03:28:13.371566 IP node3.37181 > node3.50931: UDP, length 113
03:28:13.730917 IP node3.46151 > node3.50931: UDP, length 113
03:28:13.733299 IP node3.37181 > node3.46151: UDP, length 113
03:28:13.759191 IP node3.50931 > node3.46151: UDP, length 113
03:28:13.810485 IP node3.37181 > node3.36125: UDP, length 113
03:28:13.814310 IP node3.50931 > node3.36125: UDP, length 113
03:28:13.815173 IP node3.46151 > node3.36125: UDP, length 113
03:28:13.836904 IP node3.37181 > node3.49469: UDP, length 113
03:28:13.838243 IP node3.49469 > node3.50931: UDP, length 113
03:28:13.839985 IP node3.49469 > node3.46151: UDP, length 113
03:28:13.843623 IP node3.50931 > node3.49469: UDP, length 113
03:28:13.844654 IP node3.46151 > node3.49469: UDP, length 113
03:28:13.848689 IP node3.49469 > node3.36125: UDP, length 113
03:28:13.918965 IP node3.37181 > node3.45401: UDP, length 113
03:28:13.927240 IP node3.46151 > node3.45401: UDP, length 113
03:28:13.952686 IP node3.49469 > node3.45401: UDP, length 113
03:28:13.965327 IP node3.50931 > node3.45401: UDP, length 113
03:28:14.069137 IP node3.36125 > node3.50931: UDP, length 113
03:28:14.071975 IP node3.36125 > node3.46151: UDP, length 113
03:28:14.073894 IP node3.36125 > node3.49469: UDP, length 113
03:28:14.074927 IP node3.36125 > node3.45401: UDP, length 113
03:28:14.123756 IP node3.37181 > node3.43708: UDP, length 113
03:28:14.219807 IP node3.46151 > node3.43708: UDP, length 113
03:28:14.222576 IP node3.36125 > node3.43708: UDP, length 113
03:28:14.248643 IP node3.50931 > node3.43708: UDP, length 113
03:28:14.260497 IP node3.49469 > node3.43708: UDP, length 113
03:28:14.273465 IP node3.45401 > node3.50931: UDP, length 112
03:28:14.274723 IP node3.45401 > node3.46151: UDP, length 112
03:28:14.275074 IP node3.45401 > node3.36125: UDP, length 112
03:28:14.312487 IP node3.43708 > node3.50931: UDP, length 113
03:28:14.314298 IP node3.43708 > node3.46151: UDP, length 113
03:28:14.314992 IP node3.43708 > node3.36125: UDP, length 113
03:28:14.316445 IP node3.45401 > node3.49469: UDP, length 112
03:28:14.344472 IP node3.45401 > node3.43708: UDP, length 112
03:28:14.371030 IP node3.37181 > node3.43726: UDP, length 113
03:28:14.371285 IP node3.36125 > node3.43726: UDP, length 113
03:28:14.372453 IP node3.45401 > node3.43726: UDP, length 112
03:28:14.430367 IP node3.46151 > node3.43726: UDP, length 113
03:28:14.493091 IP node3.50931 > node3.43726: UDP, length 113
03:28:14.497903 IP node3.43708 > node3.49469: UDP, length 113
03:28:14.497968 IP node3.43708 > node3.45401: UDP, length 113
03:28:14.511218 IP node3.43708 > node3.43726: UDP, length 113
03:28:14.566512 IP node3.43726 > node3.46151: UDP, length 113
03:28:14.593342 IP node3.46151 > node3.46391: UDP, length 113
03:28:14.593742 IP node3.36125 > node3.46391: UDP, length 113
03:28:14.594320 IP node3.43708 > node3.46391: UDP, length 113
03:28:14.594657 IP node3.50931 > node3.46391: UDP, length 113
03:28:14.595162 IP node3.45401 > node3.46391: UDP, length 112
03:28:14.597352 IP node3.37181 > node3.46391: UDP, length 113
03:28:14.602607 IP node3.49469 > node3.43726: UDP, length 113
03:28:14.606148 IP node3.49469 > node3.46391: UDP, length 113
03:28:14.623531 IP node3.45401 > node3.60737: UDP, length 112
03:28:14.624599 IP node3.46151 > node3.60737: UDP, length 113
03:28:14.624737 IP node3.36125 > node3.60737: UDP, length 113
03:28:14.624843 IP node3.37181 > node3.60737: UDP, length 113
03:28:14.625227 IP node3.49469 > node3.60737: UDP, length 113
03:28:14.625482 IP node3.50931 > node3.60737: UDP, length 113
03:28:14.631762 IP node3.43708 > node3.60737: UDP, length 113
03:28:14.664376 IP node3.49469 > node3.48528: UDP, length 113
03:28:14.665116 IP node3.37181 > node3.48528: UDP, length 113
03:28:14.665214 IP node3.46151 > node3.48528: UDP, length 113
03:28:14.667972 IP node3.36125 > node3.48528: UDP, length 113
03:28:14.669336 IP node3.43708 > node3.48528: UDP, length 113
03:28:14.670918 IP node3.45401 > node3.48528: UDP, length 112
03:28:14.671834 IP node3.48528 > node3.46151: UDP, length 113
03:28:14.678200 IP node3.48528 > node3.36125: UDP, length 113
03:28:14.680207 IP node3.48528 > node3.49469: UDP, length 113
03:28:14.681342 IP node3.48528 > node3.45401: UDP, length 113
03:28:14.722549 IP node3.43726 > node3.36125: UDP, length 113
03:28:14.723163 IP node3.43726 > node3.49469: UDP, length 113
03:28:14.724821 IP node3.43726 > node3.45401: UDP, length 113
03:28:14.728660 IP node3.43726 > node3.43708: UDP, length 113
03:28:14.732217 IP node3.43726 > node3.46391: UDP, length 113
03:28:14.732424 IP node3.43726 > node3.60737: UDP, length 113
03:28:14.733031 IP node3.43726 > node3.48528: UDP, length 113
03:28:14.739519 IP node3.49097 > node3.43708: UDP, length 113
03:28:14.740177 IP node3.49097 > node3.36125: UDP, length 113
03:28:14.740489 IP node3.49097 > node3.49469: UDP, length 113
03:28:14.740545 IP node3.49097 > node3.46151: UDP, length 113
03:28:14.740913 IP node3.49097 > node3.45401: UDP, length 113
03:28:14.742512 IP node3.50931 > node3.48528: UDP, length 113
03:28:14.742970 IP node3.49469 > node3.49097: UDP, length 113
03:28:14.743470 IP node3.37181 > node3.49097: UDP, length 113
03:28:14.743534 IP node3.50931 > node3.49097: UDP, length 113
03:28:14.743680 IP node3.36125 > node3.49097: UDP, length 113
03:28:14.744582 IP node3.46151 > node3.49097: UDP, length 113
03:28:14.745184 IP node3.45401 > node3.49097: UDP, length 112
03:28:14.745842 IP node3.43708 > node3.49097: UDP, length 113
03:28:14.753055 IP node3.49097 > node3.43726: UDP, length 113
03:28:14.755131 IP node3.43726 > node3.49097: UDP, length 113
03:28:14.775408 IP node3.50931 > node3.48726: UDP, length 113
03:28:14.780027 IP node3.37181 > node3.48726: UDP, length 113
03:28:14.781430 IP node3.49469 > node3.48726: UDP, length 113
03:28:14.781593 IP node3.46151 > node3.48726: UDP, length 113
03:28:14.784116 IP node3.45401 > node3.48726: UDP, length 112
03:28:14.784149 IP node3.43726 > node3.48726: UDP, length 113
03:28:14.792862 IP node3.36125 > node3.48726: UDP, length 113
03:28:14.793303 IP node3.43708 > node3.48726: UDP, length 113
03:28:14.822044 IP node3.48528 > node3.43726: UDP, length 113
03:28:14.823537 IP node3.48528 > node3.46391: UDP, length 113
03:28:14.823822 IP node3.48528 > node3.60737: UDP, length 113
03:28:14.825444 IP node3.48528 > node3.49097: UDP, length 113
03:28:14.836055 IP node3.60737 > node3.46151: UDP, length 113
03:28:14.836382 IP node3.60737 > node3.36125: UDP, length 113
03:28:14.837657 IP node3.60737 > node3.49469: UDP, length 113
03:28:14.837730 IP node3.60737 > node3.45401: UDP, length 113
03:28:14.839582 IP node3.60737 > node3.43708: UDP, length 113
03:28:14.840447 IP node3.60737 > node3.43726: UDP, length 113
03:28:14.842658 IP node3.60737 > node3.48726: UDP, length 113
03:28:14.843325 IP node3.60737 > node3.48528: UDP, length 113
03:28:14.843629 IP node3.60737 > node3.49097: UDP, length 113
03:28:14.843710 IP node3.60737 > node3.46391: UDP, length 113
03:28:14.861568 IP node3.49097 > node3.60737: UDP, length 113
03:28:14.861664 IP node3.49097 > node3.46391: UDP, length 113
03:28:14.865402 IP node3.48528 > node3.43708: UDP, length 113
03:28:14.871380 IP node3.48528 > node3.48726: UDP, length 113
03:28:14.891476 IP node3.49097 > node3.48528: UDP, length 113
03:28:14.946218 IP node3.46391 > node3.45401: UDP, length 113
03:28:14.949331 IP node3.46391 > node3.43708: UDP, length 113
03:28:14.950213 IP node3.46391 > node3.43726: UDP, length 113
03:28:14.950280 IP node3.48726 > node3.36125: UDP, length 113
03:28:14.951452 IP node3.46391 > node3.60737: UDP, length 113
03:28:14.952475 IP node3.46391 > node3.48528: UDP, length 113
03:28:14.954267 IP node3.46391 > node3.49097: UDP, length 113
03:28:14.968885 IP node3.49097 > node3.48726: UDP, length 113
03:28:14.979208 IP node3.48726 > node3.49469: UDP, length 113
03:28:14.985786 IP node3.48726 > node3.45401: UDP, length 113
03:28:15.002966 IP node3.48726 > node3.43708: UDP, length 113
03:28:15.003595 IP node3.48726 > node3.43726: UDP, length 113
03:28:15.003800 IP node3.48726 > node3.46391: UDP, length 113
03:28:15.022792 IP node3.48726 > node3.48528: UDP, length 113
03:28:15.022845 IP node3.48726 > node3.49097: UDP, length 113
03:28:15.023135 IP node3.48726 > node3.60737: UDP, length 113
03:28:15.041423 IP node3.46391 > node3.48726: UDP, length 113
03:28:15.078005 IP node3.46391 > node3.53435: UDP, length 113
03:28:15.079645 IP node3.43708 > node3.53435: UDP, length 113
03:28:15.084893 IP node3.37181 > node3.53435: UDP, length 113
03:28:15.087264 IP node3.49469 > node3.53435: UDP, length 113
03:28:15.087624 IP node3.50931 > node3.53435: UDP, length 113
03:28:15.087886 IP node3.46151 > node3.53435: UDP, length 113
03:28:15.091189 IP node3.36125 > node3.53435: UDP, length 113
03:28:15.091382 IP node3.45401 > node3.53435: UDP, length 112
03:28:15.091916 IP node3.43726 > node3.53435: UDP, length 113
03:28:15.092916 IP node3.48528 > node3.53435: UDP, length 113
03:28:15.093172 IP node3.60737 > node3.53435: UDP, length 113
03:28:15.093886 IP node3.49097 > node3.53435: UDP, length 113
03:28:15.099894 IP node3.48726 > node3.53435: UDP, length 113
03:28:15.204592 IP node3.50931 > node3.41805: UDP, length 113
03:28:15.208048 IP node3.46151 > node3.41805: UDP, length 113
03:28:15.208691 IP node3.37181 > node3.41805: UDP, length 113
03:28:15.209288 IP node3.43708 > node3.41805: UDP, length 113
03:28:15.210566 IP node3.49469 > node3.41805: UDP, length 113
03:28:15.218806 IP node3.41805 > node3.43708: UDP, length 113
03:28:15.219380 IP node3.41805 > node3.49469: UDP, length 113
03:28:15.219719 IP node3.41805 > node3.45401: UDP, length 113
03:28:15.227863 IP node3.41805 > node3.48726: UDP, length 113
03:28:15.228477 IP node3.41805 > node3.53435: UDP, length 113
03:28:15.229469 IP node3.41805 > node3.48528: UDP, length 113
03:28:15.229776 IP node3.41805 > node3.43726: UDP, length 113
03:28:15.229833 IP node3.41805 > node3.49097: UDP, length 113
03:28:15.229991 IP node3.41805 > node3.60737: UDP, length 113
03:28:15.230311 IP node3.41805 > node3.46391: UDP, length 113
03:28:15.242280 IP node3.50931 > node3.39029: UDP, length 113
03:28:15.243755 IP node3.46151 > node3.39029: UDP, length 113
03:28:15.243913 IP node3.37181 > node3.39029: UDP, length 113
03:28:15.244425 IP node3.49469 > node3.39029: UDP, length 113
03:28:15.255279 IP node3.43708 > node3.39029: UDP, length 113
03:28:15.263861 IP node3.45401 > node3.39029: UDP, length 112
03:28:15.263911 IP node3.45401 > node3.41805: UDP, length 112
03:28:15.297213 IP node3.36125 > node3.39029: UDP, length 113
03:28:15.297267 IP node3.36125 > node3.41805: UDP, length 113
03:28:15.303347 IP node3.49097 > node3.39029: UDP, length 113
03:28:15.303413 IP node3.49097 > node3.41805: UDP, length 113
03:28:15.304625 IP node3.34615 > node3.43726: UDP, length 113
03:28:15.304993 IP node3.37181 > node3.34615: UDP, length 113
03:28:15.305293 IP node3.49097 > node3.34615: UDP, length 113
03:28:15.305826 IP node3.45401 > node3.34615: UDP, length 112
03:28:15.306771 IP node3.50931 > node3.34615: UDP, length 113
03:28:15.307662 IP node3.49469 > node3.34615: UDP, length 113
03:28:15.307778 IP node3.36125 > node3.34615: UDP, length 113
03:28:15.309241 IP node3.46151 > node3.34615: UDP, length 113
03:28:15.310090 IP node3.43708 > node3.34615: UDP, length 113
03:28:15.365754 IP node3.41805 > node3.39029: UDP, length 113
03:28:15.366146 IP node3.41805 > node3.34615: UDP, length 113
03:28:15.415413 IP node3.46391 > node3.39029: UDP, length 113
03:28:15.415481 IP node3.46391 > node3.41805: UDP, length 113
03:28:15.417270 IP node3.46391 > node3.34615: UDP, length 113
03:28:15.430662 IP node3.34615 > node3.48726: UDP, length 113
03:28:15.430872 IP node3.34615 > node3.53435: UDP, length 113
03:28:15.431299 IP node3.34615 > node3.48528: UDP, length 113
03:28:15.431494 IP node3.34615 > node3.49097: UDP, length 113
03:28:15.431628 IP node3.34615 > node3.60737: UDP, length 113
03:28:15.431674 IP node3.34615 > node3.46391: UDP, length 113
03:28:15.438008 IP node3.48528 > node3.39029: UDP, length 113
03:28:15.438113 IP node3.48528 > node3.41805: UDP, length 113
03:28:15.439040 IP node3.48528 > node3.34615: UDP, length 113
03:28:15.450783 IP node3.34615 > node3.39029: UDP, length 113
03:28:15.450865 IP node3.34615 > node3.41805: UDP, length 113
03:28:15.471714 IP node3.60737 > node3.39029: UDP, length 113
03:28:15.471748 IP node3.60737 > node3.41805: UDP, length 113
03:28:15.471989 IP node3.60737 > node3.34615: UDP, length 113
03:28:15.497016 IP node3.53435 > node3.43726: UDP, length 113
03:28:15.497978 IP node3.53435 > node3.46391: UDP, length 113
03:28:15.498383 IP node3.53435 > node3.60737: UDP, length 113
03:28:15.499299 IP node3.53435 > node3.48528: UDP, length 113
03:28:15.500887 IP node3.53435 > node3.49097: UDP, length 113
03:28:15.501409 IP node3.53435 > node3.48726: UDP, length 113
03:28:15.503460 IP node3.53435 > node3.41805: UDP, length 113
03:28:15.547630 IP node3.48726 > node3.41805: UDP, length 113
03:28:15.547998 IP node3.48726 > node3.39029: UDP, length 113
03:28:15.548575 IP node3.48726 > node3.34615: UDP, length 113
03:28:15.552659 IP node3.43726 > node3.39029: UDP, length 113
03:28:15.552712 IP node3.43726 > node3.41805: UDP, length 113
03:28:15.553058 IP node3.43726 > node3.34615: UDP, length 113
03:28:15.566337 IP node3.53435 > node3.39029: UDP, length 113
03:28:15.566962 IP node3.53435 > node3.34615: UDP, length 113
03:28:15.572461 IP node3.46151 > node3.37061: UDP, length 113
03:28:15.572611 IP node3.43726 > node3.37061: UDP, length 113
03:28:15.573386 IP node3.43708 > node3.37061: UDP, length 113
03:28:15.573874 IP node3.50931 > node3.37061: UDP, length 113
03:28:15.574413 IP node3.41805 > node3.37061: UDP, length 113
03:28:15.574770 IP node3.49469 > node3.37061: UDP, length 113
03:28:15.575504 IP node3.37181 > node3.37061: UDP, length 113
03:28:15.577165 IP node3.34615 > node3.37061: UDP, length 113
03:28:15.582456 IP node3.48726 > node3.37061: UDP, length 113
03:28:15.589584 IP node3.53435 > node3.37061: UDP, length 113
03:28:15.603074 IP node3.46391 > node3.37061: UDP, length 113
03:28:15.641087 IP node3.43022 > node3.60737: UDP, length 113
03:28:15.665603 IP node3.48528 > node3.37061: UDP, length 113
03:28:15.674979 IP node3.39029 > node3.48726: UDP, length 113
03:28:15.675729 IP node3.39029 > node3.48528: UDP, length 113
03:28:15.676025 IP node3.39029 > node3.43726: UDP, length 113
03:28:15.676078 IP node3.39029 > node3.49097: UDP, length 113
03:28:15.676130 IP node3.39029 > node3.60737: UDP, length 113
03:28:15.676185 IP node3.39029 > node3.46391: UDP, length 113
03:28:15.712949 IP node3.39029 > node3.53435: UDP, length 113
03:28:15.735136 IP node3.60737 > node3.37061: UDP, length 113
03:28:15.761063 IP node3.37061 > node3.43708: UDP, length 113
03:28:15.763184 IP node3.37061 > node3.43726: UDP, length 113
03:28:15.764490 IP node3.49097 > node3.37061: UDP, length 113
03:28:15.764837 IP node3.37061 > node3.46391: UDP, length 113
03:28:15.765165 IP node3.37061 > node3.60737: UDP, length 113
03:28:15.783612 IP node3.43022 > node3.46391: UDP, length 113
03:28:15.784372 IP node3.43022 > node3.48726: UDP, length 113
03:28:15.784909 IP node3.43022 > node3.53435: UDP, length 113
03:28:15.785375 IP node3.43022 > node3.48528: UDP, length 113
03:28:15.785473 IP node3.49097 > node3.43022: UDP, length 113
03:28:15.785669 IP node3.43022 > node3.49097: UDP, length 113
03:28:15.788407 IP node3.60737 > node3.43022: UDP, length 113
03:28:15.788982 IP node3.43726 > node3.43022: UDP, length 113
03:28:15.790443 IP node3.37181 > node3.43022: UDP, length 113
03:28:15.790767 IP node3.46151 > node3.43022: UDP, length 113
03:28:15.791038 IP node3.49469 > node3.43022: UDP, length 113
03:28:15.791768 IP node3.50931 > node3.43022: UDP, length 113
03:28:15.796895 IP node3.41805 > node3.43022: UDP, length 113
03:28:15.802695 IP node3.34615 > node3.43022: UDP, length 113
03:28:15.803567 IP node3.43022 > node3.39029: UDP, length 113
03:28:15.803631 IP node3.43022 > node3.41805: UDP, length 113
03:28:15.804065 IP node3.37061 > node3.48726: UDP, length 113
03:28:15.804235 IP node3.37061 > node3.53435: UDP, length 113
03:28:15.804906 IP node3.37061 > node3.48528: UDP, length 113
03:28:15.805065 IP node3.37061 > node3.49097: UDP, length 113
03:28:15.807333 IP node3.43022 > node3.34615: UDP, length 113
03:28:15.815121 IP node3.43022 > node3.37061: UDP, length 113
03:28:15.821794 IP node3.53435 > node3.43022: UDP, length 113
03:28:15.825599 IP node3.39029 > node3.41805: UDP, length 113
03:28:15.827818 IP node3.39029 > node3.34615: UDP, length 113
03:28:15.833469 IP node3.39029 > node3.37061: UDP, length 113
03:28:15.867521 IP node3.48726 > node3.43022: UDP, length 113
03:28:15.877015 IP node3.48528 > node3.43022: UDP, length 113
03:28:15.888639 IP node3.37061 > node3.39029: UDP, length 113
03:28:15.888745 IP node3.37061 > node3.41805: UDP, length 113
03:28:15.890158 IP node3.37061 > node3.43022: UDP, length 113
03:28:15.890236 IP node3.37061 > node3.34615: UDP, length 113
03:28:15.898904 IP node3.39029 > node3.43022: UDP, length 113
03:28:15.912219 IP node3.36125 > node3.37061: UDP, length 113
03:28:15.912903 IP node3.36125 > node3.43022: UDP, length 113
03:28:15.930408 IP node3.43708 > node3.43022: UDP, length 113
03:28:16.017597 IP node3.49097 > node3.46472: UDP, length 113
03:28:16.018625 IP node3.43726 > node3.46472: UDP, length 113
03:28:16.018756 IP node3.50931 > node3.46472: UDP, length 113
03:28:16.018868 IP node3.48726 > node3.46472: UDP, length 113
03:28:16.019773 IP node3.48528 > node3.46472: UDP, length 113
03:28:16.019920 IP node3.46151 > node3.46472: UDP, length 113
03:28:16.020500 IP node3.41805 > node3.46472: UDP, length 113
03:28:16.020798 IP node3.34615 > node3.46472: UDP, length 113
03:28:16.020955 IP node3.49469 > node3.46472: UDP, length 113
03:28:16.021243 IP node3.37181 > node3.46472: UDP, length 113
03:28:16.021842 IP node3.36125 > node3.46472: UDP, length 113
03:28:16.022753 IP node3.37061 > node3.46472: UDP, length 113
03:28:16.022838 IP node3.53435 > node3.46472: UDP, length 113
03:28:16.025221 IP node3.39029 > node3.46472: UDP, length 113
03:28:16.025688 IP node3.43022 > node3.46472: UDP, length 113
03:28:16.038704 IP node3.45401 > node3.37061: UDP, length 112
03:28:16.042729 IP node3.48528 > node3.42226: UDP, length 113
03:28:16.043886 IP node3.49097 > node3.42226: UDP, length 113
03:28:16.044134 IP node3.43726 > node3.42226: UDP, length 113
03:28:16.044765 IP node3.41805 > node3.42226: UDP, length 113
03:28:16.044942 IP node3.46151 > node3.42226: UDP, length 113
03:28:16.046498 IP node3.50931 > node3.42226: UDP, length 113
03:28:16.047851 IP node3.37181 > node3.42226: UDP, length 113
03:28:16.048793 IP node3.53435 > node3.42226: UDP, length 113
03:28:16.049590 IP node3.39029 > node3.42226: UDP, length 113
03:28:16.049670 IP node3.36125 > node3.42226: UDP, length 113
03:28:16.049801 IP node3.43022 > node3.42226: UDP, length 113
03:28:16.049862 IP node3.34615 > node3.42226: UDP, length 113
03:28:16.050533 IP node3.49469 > node3.42226: UDP, length 113
03:28:16.051315 IP node3.37061 > node3.42226: UDP, length 113
03:28:16.053249 IP node3.46391 > node3.46472: UDP, length 113
03:28:16.053600 IP node3.46391 > node3.42226: UDP, length 113
03:28:16.053646 IP node3.46391 > node3.43022: UDP, length 113
03:28:16.072607 IP node3.48726 > node3.42226: UDP, length 113
03:28:16.079612 IP node3.48726 > node3.45286: UDP, length 113
03:28:16.079680 IP node3.46151 > node3.45286: UDP, length 113
03:28:16.080906 IP node3.48528 > node3.45286: UDP, length 113
03:28:16.080938 IP node3.41805 > node3.45286: UDP, length 113
03:28:16.081081 IP node3.43726 > node3.45286: UDP, length 113
03:28:16.081747 IP node3.60737 > node3.46472: UDP, length 113
03:28:16.081820 IP node3.49469 > node3.45286: UDP, length 113
03:28:16.081997 IP node3.60737 > node3.42226: UDP, length 113
03:28:16.082059 IP node3.60737 > node3.45286: UDP, length 113
03:28:16.082544 IP node3.50931 > node3.45286: UDP, length 113
03:28:16.083267 IP node3.36125 > node3.45286: UDP, length 113
03:28:16.083490 IP node3.37181 > node3.45286: UDP, length 113
03:28:16.083665 IP node3.46391 > node3.45286: UDP, length 113
03:28:16.084440 IP node3.53435 > node3.45286: UDP, length 113
03:28:16.084983 IP node3.37061 > node3.45286: UDP, length 113
03:28:16.085197 IP node3.34615 > node3.45286: UDP, length 113
03:28:16.086022 IP node3.49097 > node3.45286: UDP, length 113
03:28:16.086643 IP node3.43022 > node3.45286: UDP, length 113
03:28:16.088652 IP node3.39029 > node3.45286: UDP, length 113
03:28:16.195929 IP node3.45401 > node3.46472: UDP, length 112
03:28:16.196395 IP node3.45401 > node3.42226: UDP, length 112
03:28:16.196440 IP node3.45401 > node3.43022: UDP, length 112
03:28:16.196493 IP node3.45401 > node3.45286: UDP, length 112
03:28:16.273564 IP node3.43708 > node3.46472: UDP, length 113
03:28:16.273851 IP node3.43708 > node3.42226: UDP, length 113
03:28:16.273898 IP node3.43708 > node3.45286: UDP, length 113
03:28:16.275462 IP node3.45286 > node3.53435: UDP, length 113
03:28:16.276787 IP node3.45286 > node3.41805: UDP, length 113
03:28:16.277172 IP node3.45286 > node3.39029: UDP, length 113
03:28:16.277728 IP node3.45286 > node3.34615: UDP, length 113
03:28:16.294853 IP node3.46472 > node3.53435: UDP, length 113
03:28:16.295772 IP node3.46472 > node3.39029: UDP, length 113
03:28:16.295852 IP node3.46472 > node3.41805: UDP, length 113
03:28:16.310302 IP node3.42226 > node3.41805: UDP, length 113
03:28:16.310540 IP node3.42226 > node3.39029: UDP, length 113
03:28:16.311200 IP node3.42226 > node3.34615: UDP, length 113
03:28:16.320201 IP node3.41805 > node3.53012: UDP, length 113
03:28:16.320467 IP node3.46151 > node3.53012: UDP, length 113
03:28:16.320512 IP node3.48726 > node3.53012: UDP, length 113
03:28:16.320700 IP node3.43726 > node3.53012: UDP, length 113
03:28:16.320828 IP node3.36125 > node3.53012: UDP, length 113
03:28:16.326766 IP node3.46391 > node3.53012: UDP, length 113
03:28:16.327072 IP node3.49097 > node3.53012: UDP, length 113
03:28:16.327588 IP node3.45401 > node3.53012: UDP, length 112
03:28:16.327864 IP node3.48528 > node3.53012: UDP, length 113
03:28:16.328145 IP node3.50931 > node3.53012: UDP, length 113
03:28:16.328294 IP node3.37181 > node3.53012: UDP, length 113
03:28:16.328943 IP node3.49469 > node3.53012: UDP, length 113
03:28:16.356426 IP node3.34615 > node3.53012: UDP, length 113
03:28:16.356512 IP node3.43022 > node3.53012: UDP, length 113
03:28:16.361054 IP node3.46472 > node3.34615: UDP, length 113
03:28:16.362155 IP node3.46472 > node3.42226: UDP, length 113
03:28:16.362197 IP node3.46472 > node3.43022: UDP, length 113
03:28:16.362242 IP node3.46472 > node3.45286: UDP, length 113
03:28:16.384838 IP node3.37061 > node3.53012: UDP, length 113
03:28:16.389787 IP node3.39029 > node3.53012: UDP, length 113
03:28:16.396449 IP node3.45286 > node3.37061: UDP, length 113
03:28:16.398251 IP node3.45286 > node3.43022: UDP, length 113
03:28:16.398878 IP node3.45286 > node3.46472: UDP, length 113
03:28:16.399380 IP node3.45286 > node3.42226: UDP, length 113
03:28:16.405122 IP node3.43708 > node3.53012: UDP, length 113
03:28:16.410051 IP node3.45286 > node3.53012: UDP, length 113
03:28:16.434666 IP node3.53435 > node3.53012: UDP, length 113
03:28:16.436640 IP node3.42226 > node3.46472: UDP, length 113
03:28:16.437228 IP node3.42226 > node3.37061: UDP, length 113
03:28:16.437502 IP node3.42226 > node3.53012: UDP, length 113
03:28:16.437681 IP node3.42226 > node3.43022: UDP, length 113
03:28:16.437854 IP node3.42226 > node3.45286: UDP, length 113
03:28:16.452232 IP node3.58821 > node3.41805: UDP, length 113
03:28:16.452727 IP node3.58821 > node3.37061: UDP, length 113
03:28:16.452939 IP node3.58821 > node3.43022: UDP, length 113
03:28:16.452982 IP node3.58821 > node3.34615: UDP, length 113
03:28:16.453108 IP node3.58821 > node3.45286: UDP, length 113
03:28:16.453304 IP node3.58821 > node3.39029: UDP, length 113
03:28:16.453354 IP node3.58821 > node3.46472: UDP, length 113
03:28:16.453756 IP node3.58821 > node3.42226: UDP, length 113
03:28:16.453833 IP node3.36125 > node3.58821: UDP, length 113
03:28:16.454003 IP node3.43726 > node3.58821: UDP, length 113
03:28:16.454278 IP node3.48726 > node3.58821: UDP, length 113
03:28:16.454750 IP node3.53435 > node3.58821: UDP, length 113
03:28:16.455135 IP node3.43708 > node3.58821: UDP, length 113
03:28:16.455282 IP node3.46151 > node3.58821: UDP, length 113
03:28:16.458513 IP node3.34615 > node3.58821: UDP, length 113
03:28:16.461029 IP node3.49469 > node3.58821: UDP, length 113
03:28:16.461210 IP node3.42226 > node3.58821: UDP, length 113
03:28:16.463309 IP node3.37181 > node3.58821: UDP, length 113
03:28:16.463833 IP node3.45286 > node3.58821: UDP, length 113
03:28:16.464045 IP node3.50931 > node3.58821: UDP, length 113
03:28:16.464584 IP node3.53435 > node3.46770: UDP, length 113
03:28:16.464601 IP node3.46151 > node3.46770: UDP, length 113
03:28:16.464866 IP node3.45286 > node3.46770: UDP, length 113
03:28:16.464868 IP node3.48726 > node3.46770: UDP, length 113
03:28:16.465448 IP node3.43708 > node3.46770: UDP, length 113
03:28:16.465529 IP node3.48528 > node3.58821: UDP, length 113
03:28:16.466599 IP node3.41805 > node3.58821: UDP, length 113
03:28:16.466600 IP node3.43726 > node3.46770: UDP, length 113
03:28:16.466652 IP node3.41805 > node3.46770: UDP, length 113
03:28:16.467166 IP node3.36125 > node3.46770: UDP, length 113
03:28:16.467319 IP node3.46391 > node3.58821: UDP, length 113
03:28:16.467363 IP node3.46391 > node3.46770: UDP, length 113
03:28:16.468355 IP node3.58821 > node3.53012: UDP, length 113
03:28:16.468431 IP node3.46770 > node3.53435: UDP, length 113
03:28:16.469484 IP node3.42226 > node3.46770: UDP, length 113
03:28:16.470262 IP node3.45401 > node3.58821: UDP, length 112
03:28:16.470586 IP node3.39029 > node3.58821: UDP, length 113
03:28:16.470681 IP node3.39029 > node3.46770: UDP, length 113
03:28:16.472628 IP node3.49469 > node3.46770: UDP, length 113
03:28:16.474368 IP node3.50931 > node3.46770: UDP, length 113
03:28:16.474517 IP node3.49097 > node3.58821: UDP, length 113
03:28:16.474578 IP node3.49097 > node3.46770: UDP, length 113
03:28:16.475769 IP node3.58821 > node3.46770: UDP, length 113
03:28:16.476472 IP node3.37181 > node3.46770: UDP, length 113
03:28:16.477306 IP node3.45401 > node3.46770: UDP, length 112
03:28:16.478481 IP node3.43022 > node3.46770: UDP, length 113
03:28:16.478724 IP node3.37061 > node3.58821: UDP, length 113
03:28:16.478766 IP node3.37061 > node3.46770: UDP, length 113
03:28:16.479387 IP node3.43022 > node3.58821: UDP, length 113
03:28:16.479686 IP node3.34615 > node3.46770: UDP, length 113
03:28:16.481097 IP node3.48528 > node3.46770: UDP, length 113
03:28:16.492760 IP node3.46770 > node3.41805: UDP, length 113
03:28:16.493233 IP node3.46770 > node3.37061: UDP, length 113
03:28:16.493425 IP node3.46770 > node3.43022: UDP, length 113
03:28:16.493469 IP node3.46770 > node3.34615: UDP, length 113
03:28:16.493591 IP node3.46770 > node3.45286: UDP, length 113
03:28:16.493787 IP node3.46770 > node3.39029: UDP, length 113
03:28:16.493843 IP node3.46770 > node3.46472: UDP, length 113
03:28:16.494228 IP node3.46770 > node3.42226: UDP, length 113
03:28:16.509472 IP node3.60737 > node3.58821: UDP, length 113
03:28:16.509531 IP node3.60737 > node3.46770: UDP, length 113
03:28:16.509580 IP node3.60737 > node3.53012: UDP, length 113
03:28:16.522055 IP node3.46472 > node3.37061: UDP, length 113
03:28:16.558272 IP node3.53012 > node3.37061: UDP, length 113
03:28:16.567434 IP node3.53435 > node3.46977: UDP, length 113
03:28:16.568583 IP node3.48726 > node3.46977: UDP, length 113
03:28:16.568683 IP node3.43022 > node3.46977: UDP, length 113
03:28:16.568751 IP node3.46391 > node3.46977: UDP, length 113
03:28:16.568881 IP node3.36125 > node3.46977: UDP, length 113
03:28:16.569057 IP node3.43726 > node3.46977: UDP, length 113
03:28:16.571180 IP node3.43708 > node3.46977: UDP, length 113
03:28:16.571385 IP node3.46151 > node3.46977: UDP, length 113
03:28:16.571977 IP node3.39029 > node3.46977: UDP, length 113
03:28:16.573053 IP node3.48528 > node3.46977: UDP, length 113
03:28:16.573270 IP node3.45286 > node3.46977: UDP, length 113
03:28:16.573401 IP node3.60737 > node3.46977: UDP, length 113
03:28:16.573821 IP node3.49097 > node3.46977: UDP, length 113
03:28:16.574271 IP node3.49469 > node3.46977: UDP, length 113
03:28:16.574315 IP node3.42226 > node3.46977: UDP, length 113
03:28:16.577337 IP node3.37181 > node3.46977: UDP, length 113
03:28:16.580688 IP node3.45401 > node3.46977: UDP, length 112
03:28:16.585767 IP node3.50931 > node3.46977: UDP, length 113
03:28:16.589311 IP node3.37061 > node3.46977: UDP, length 113
03:28:16.594458 IP node3.58821 > node3.46977: UDP, length 113
03:28:16.602561 IP node3.34615 > node3.46977: UDP, length 113
03:28:16.712081 IP node3.41805 > node3.46977: UDP, length 113
03:28:16.760559 IP node3.46977 > node3.43022: UDP, length 113
03:28:16.761346 IP node3.46977 > node3.46472: UDP, length 113
03:28:16.790972 IP node3.46472 > node3.53012: UDP, length 113
03:28:16.791061 IP node3.46472 > node3.58821: UDP, length 113
03:28:16.791133 IP node3.46472 > node3.46770: UDP, length 113
03:28:16.791393 IP node3.46472 > node3.46977: UDP, length 113
03:28:16.795545 IP node3.43708 > node3.57455: UDP, length 113
03:28:16.796050 IP node3.46151 > node3.57455: UDP, length 113
03:28:16.796547 IP node3.37181 > node3.57455: UDP, length 113
03:28:16.797500 IP node3.46391 > node3.57455: UDP, length 113
03:28:16.797773 IP node3.49097 > node3.57455: UDP, length 113
03:28:16.798643 IP node3.48528 > node3.57455: UDP, length 113
03:28:16.798877 IP node3.49469 > node3.57455: UDP, length 113
03:28:16.800729 IP node3.36125 > node3.57455: UDP, length 113
03:28:16.803665 IP node3.41805 > node3.57455: UDP, length 113
03:28:16.803773 IP node3.48726 > node3.57455: UDP, length 113
03:28:16.804068 IP node3.43726 > node3.57455: UDP, length 113
03:28:16.805138 IP node3.45401 > node3.57455: UDP, length 112
03:28:16.805706 IP node3.60737 > node3.57455: UDP, length 113
03:28:16.807893 IP node3.45286 > node3.57455: UDP, length 113
03:28:16.808445 IP node3.50931 > node3.57455: UDP, length 113
03:28:16.809932 IP node3.46472 > node3.57455: UDP, length 113
03:28:16.814336 IP node3.43022 > node3.57455: UDP, length 113
03:28:16.818558 IP node3.34615 > node3.57455: UDP, length 113
03:28:16.826729 IP node3.58821 > node3.57455: UDP, length 113
03:28:16.835025 IP node3.46977 > node3.42226: UDP, length 113
03:28:16.835626 IP node3.46977 > node3.45286: UDP, length 113
03:28:16.841800 IP node3.46977 > node3.53012: UDP, length 113
03:28:16.842084 IP node3.46977 > node3.58821: UDP, length 113
03:28:16.842292 IP node3.46977 > node3.46770: UDP, length 113
03:28:16.850971 IP node3.53435 > node3.57455: UDP, length 113
03:28:16.851176 IP node3.42226 > node3.57455: UDP, length 113
03:28:16.858643 IP node3.46770 > node3.53012: UDP, length 113
03:28:16.858846 IP node3.46770 > node3.46977: UDP, length 113
03:28:16.859982 IP node3.46770 > node3.57455: UDP, length 113
03:28:16.860535 IP node3.46770 > node3.58821: UDP, length 113
03:28:16.864270 IP node3.39029 > node3.57455: UDP, length 113
03:28:16.903446 IP node3.46977 > node3.57455: UDP, length 113
03:28:16.907201 IP node3.45286 > node3.38181: UDP, length 113
03:28:16.907670 IP node3.53435 > node3.38181: UDP, length 113
03:28:16.907872 IP node3.42226 > node3.38181: UDP, length 113
03:28:16.908548 IP node3.46391 > node3.38181: UDP, length 113
03:28:16.910699 IP node3.43726 > node3.38181: UDP, length 113
03:28:16.912098 IP node3.36125 > node3.38181: UDP, length 113
03:28:16.915147 IP node3.46151 > node3.38181: UDP, length 113
03:28:16.918436 IP node3.43708 > node3.38181: UDP, length 113
03:28:16.918972 IP node3.49097 > node3.38181: UDP, length 113
03:28:16.919283 IP node3.60737 > node3.38181: UDP, length 113
03:28:16.919756 IP node3.45401 > node3.38181: UDP, length 112
03:28:16.919971 IP node3.50931 > node3.38181: UDP, length 113
03:28:16.920146 IP node3.37181 > node3.38181: UDP, length 113
03:28:16.921707 IP node3.48726 > node3.38181: UDP, length 113
03:28:16.923494 IP node3.48528 > node3.38181: UDP, length 113
03:28:16.927045 IP node3.49469 > node3.38181: UDP, length 113
03:28:16.933947 IP node3.46770 > node3.38181: UDP, length 113
03:28:16.934560 IP node3.46472 > node3.38181: UDP, length 113
03:28:16.935250 IP node3.58821 > node3.38181: UDP, length 113
03:28:16.939105 IP node3.46977 > node3.38181: UDP, length 113
03:28:16.971136 IP node3.37061 > node3.57455: UDP, length 113
03:28:16.973751 IP node3.43022 > node3.38181: UDP, length 113
03:28:16.989729 IP node3.53012 > node3.43022: UDP, length 113
03:28:16.989925 IP node3.53012 > node3.46472: UDP, length 113
03:28:16.990297 IP node3.53012 > node3.42226: UDP, length 113
03:28:16.992988 IP node3.53012 > node3.45286: UDP, length 113
03:28:16.994967 IP node3.53012 > node3.58821: UDP, length 113
03:28:16.995069 IP node3.37061 > node3.38181: UDP, length 113
03:28:16.995148 IP node3.53012 > node3.46770: UDP, length 113
03:28:16.995310 IP node3.53012 > node3.46977: UDP, length 113
03:28:16.997805 IP node3.53012 > node3.57455: UDP, length 113
03:28:16.997969 IP node3.53012 > node3.38181: UDP, length 113
03:28:17.007244 IP node3.57455 > node3.34615: UDP, length 113
03:28:17.032333 IP node3.42226 > node3.40743: UDP, length 113
03:28:17.032602 IP node3.45286 > node3.40743: UDP, length 113
03:28:17.033884 IP node3.53435 > node3.40743: UDP, length 113
03:28:17.035489 IP node3.46977 > node3.40743: UDP, length 113
03:28:17.037469 IP node3.46391 > node3.40743: UDP, length 113
03:28:17.037547 IP node3.43726 > node3.40743: UDP, length 113
03:28:17.037669 IP node3.34615 > node3.40743: UDP, length 113
03:28:17.037709 IP node3.34615 > node3.38181: UDP, length 113
03:28:17.037861 IP node3.36125 > node3.40743: UDP, length 113
03:28:17.039454 IP node3.46151 > node3.40743: UDP, length 113
03:28:17.040553 IP node3.53012 > node3.40743: UDP, length 113
03:28:17.043350 IP node3.46770 > node3.40743: UDP, length 113
03:28:17.045265 IP node3.48726 > node3.40743: UDP, length 113
03:28:17.045942 IP node3.46472 > node3.40743: UDP, length 113
03:28:17.047096 IP node3.43708 > node3.40743: UDP, length 113
03:28:17.047109 IP node3.49469 > node3.40743: UDP, length 113
03:28:17.048671 IP node3.60737 > node3.40743: UDP, length 113
03:28:17.048841 IP node3.48528 > node3.40743: UDP, length 113
03:28:17.048981 IP node3.45401 > node3.40743: UDP, length 112
03:28:17.049412 IP node3.50931 > node3.40743: UDP, length 113
03:28:17.049557 IP node3.37181 > node3.40743: UDP, length 113
03:28:17.049800 IP node3.37061 > node3.40743: UDP, length 113
03:28:17.053540 IP node3.58821 > node3.40743: UDP, length 113
03:28:17.055843 IP node3.49097 > node3.40743: UDP, length 113
03:28:17.056902 IP node3.43022 > node3.40743: UDP, length 113
03:28:17.063671 IP node3.41805 > node3.40743: UDP, length 113
03:28:17.063728 IP node3.41805 > node3.38181: UDP, length 113
03:28:17.076618 IP node3.57455 > node3.37061: UDP, length 113
03:28:17.079263 IP node3.39029 > node3.38181: UDP, length 113
03:28:17.079458 IP node3.57455 > node3.46472: UDP, length 113
03:28:17.079663 IP node3.57455 > node3.42226: UDP, length 113
03:28:17.079840 IP node3.57455 > node3.45286: UDP, length 113
03:28:17.083601 IP node3.57455 > node3.43022: UDP, length 113
03:28:17.092853 IP node3.57455 > node3.53012: UDP, length 113
03:28:17.094992 IP node3.57455 > node3.58821: UDP, length 113
03:28:17.095206 IP node3.57455 > node3.46770: UDP, length 113
03:28:17.095391 IP node3.57455 > node3.46977: UDP, length 113
03:28:17.096710 IP node3.57455 > node3.38181: UDP, length 113
03:28:17.097087 IP node3.57455 > node3.40743: UDP, length 113
03:28:17.110040 IP node3.39029 > node3.40743: UDP, length 113
03:28:17.142459 IP node3.38181 > node3.42226: UDP, length 113
03:28:17.143155 IP node3.38181 > node3.45286: UDP, length 113
03:28:17.155316 IP node3.38181 > node3.53012: UDP, length 113
03:28:17.155622 IP node3.38181 > node3.58821: UDP, length 113
03:28:17.155806 IP node3.38181 > node3.46770: UDP, length 113
03:28:17.156930 IP node3.38181 > node3.46977: UDP, length 113
03:28:17.158290 IP node3.38181 > node3.57455: UDP, length 113
03:28:17.158594 IP node3.38181 > node3.40743: UDP, length 113
03:28:17.164323 IP node3.40743 > node3.37061: UDP, length 112
03:28:17.167261 IP node3.40743 > node3.43022: UDP, length 112
03:28:17.167912 IP node3.40743 > node3.46472: UDP, length 112
03:28:17.168172 IP node3.40743 > node3.42226: UDP, length 112
03:28:17.169851 IP node3.40743 > node3.45286: UDP, length 112
03:28:17.215577 IP node3.40743 > node3.53012: UDP, length 112
03:28:17.216441 IP node3.40743 > node3.58821: UDP, length 112
03:28:17.216943 IP node3.40743 > node3.46770: UDP, length 112
03:28:17.217150 IP node3.40743 > node3.46977: UDP, length 112
03:28:17.218932 IP node3.40743 > node3.57455: UDP, length 112
03:28:17.220023 IP node3.40743 > node3.38181: UDP, length 112
03:28:17.231322 IP node3.38181 > node3.46472: UDP, length 113
03:28:17.266403 IP node3.39029 > node3.39819: UDP, length 113
03:28:17.266388 IP node3.37061 > node3.39819: UDP, length 113
03:28:17.267050 IP node3.34615 > node3.39819: UDP, length 113
03:28:17.267491 IP node3.46977 > node3.39819: UDP, length 113
03:28:17.268041 IP node3.42226 > node3.39819: UDP, length 113
03:28:17.268251 IP node3.46472 > node3.39819: UDP, length 113
03:28:17.268847 IP node3.53435 > node3.39819: UDP, length 113
03:28:17.269830 IP node3.43726 > node3.39819: UDP, length 113
03:28:17.272221 IP node3.36125 > node3.39819: UDP, length 113
03:28:17.273762 IP node3.43022 > node3.39819: UDP, length 113
03:28:17.274427 IP node3.45286 > node3.39819: UDP, length 113
03:28:17.275062 IP node3.46770 > node3.39819: UDP, length 113
03:28:17.275686 IP node3.48726 > node3.39819: UDP, length 113
03:28:17.279126 IP node3.39819 > node3.57455: UDP, length 113
03:28:17.279484 IP node3.39819 > node3.38181: UDP, length 113
03:28:17.279554 IP node3.38181 > node3.39819: UDP, length 113
03:28:17.281531 IP node3.46151 > node3.39819: UDP, length 113
03:28:17.281827 IP node3.43708 > node3.39819: UDP, length 113
03:28:17.282413 IP node3.58821 > node3.39819: UDP, length 113
03:28:17.282833 IP node3.41805 > node3.39819: UDP, length 113
03:28:17.283309 IP node3.60737 > node3.39819: UDP, length 113
03:28:17.283488 IP node3.49097 > node3.39819: UDP, length 113
03:28:17.283657 IP node3.50931 > node3.39819: UDP, length 113
03:28:17.283958 IP node3.45401 > node3.39819: UDP, length 112
03:28:17.284097 IP node3.37181 > node3.39819: UDP, length 113
03:28:17.285189 IP node3.53012 > node3.39819: UDP, length 113
03:28:17.285530 IP node3.46391 > node3.39819: UDP, length 113
03:28:17.286216 IP node3.48528 > node3.39819: UDP, length 113
03:28:17.286855 IP node3.40743 > node3.39819: UDP, length 112
03:28:17.286863 IP node3.49469 > node3.39819: UDP, length 113
03:28:17.291021 IP node3.57455 > node3.39819: UDP, length 113
03:28:17.332063 IP node3.39819 > node3.40743: UDP, length 113

