03:28:19.370353 IP node1.54469 > node4.45712: UDP, length 113
03:28:19.429690 IP node1.54469 > node2.52204: UDP, length 94
03:28:19.465512 IP node1.54469 > node2.46985: UDP, length 113
03:28:19.465969 IP node1.54469 > node2.54401: UDP, length 113
03:28:19.467093 IP node1.54469 > node2.52757: UDP, length 113
03:28:19.467329 IP node1.54469 > node4.53935: UDP, length 113
03:28:19.467542 IP node1.54469 > node2.50586: UDP, length 113
03:28:19.467760 IP node1.54469 > node4.41317: UDP, length 113
03:28:19.467988 IP node1.54469 > node2.46331: UDP, length 113
03:28:19.468286 IP node1.54469 > node3.41805: UDP, length 113
03:28:19.468585 IP node1.54469 > node3.39029: UDP, length 113
03:28:19.469248 IP node1.54469 > node4.47907: UDP, length 113
03:28:19.469621 IP node1.54469 > node3.34615: UDP, length 113
03:28:19.470756 IP node1.54469 > node4.56052: UDP, length 113
03:28:19.471346 IP node1.54469 > node4.39355: UDP, length 113
03:28:19.471875 IP node1.54469 > node2.35129: UDP, length 113
03:28:19.474583 IP node1.54469 > node3.53435: UDP, length 113
03:28:19.489542 IP node1.54469 > node2.60280: UDP, length 113
03:28:19.490217 IP node1.54469 > node4.34193: UDP, length 113
03:28:19.491555 IP node1.54469 > node2.36086: UDP, length 113
03:28:19.491804 IP node1.54469 > node4.45280: UDP, length 113
03:28:19.492028 IP node1.54469 > node3.37061: UDP, length 113
03:28:19.492391 IP node1.54469 > node2.49898: UDP, length 113
03:28:19.492722 IP node1.54469 > node2.50365: UDP, length 113
03:28:19.492959 IP node1.54469 > node2.50393: UDP, length 113
03:28:19.493917 IP node1.54469 > node4.50583: UDP, length 113
03:28:19.494394 IP node1.54469 > node3.43022: UDP, length 113
03:28:19.536794 IP node1.54469 > node3.46472: UDP, length 113
03:28:19.558727 IP node1.54469 > node3.42226: UDP, length 113
03:28:19.623227 IP node1.54469 > node4.54945: UDP, length 113
03:28:19.623596 IP node1.54469 > node3.45286: UDP, length 113
03:28:19.693792 IP node1.54469 > node4.57274: UDP, length 113
03:28:19.911435 IP node1.54469 > node3.53012: UDP, length 113
03:28:19.970974 IP node1.54469 > node3.58821: UDP, length 113
03:28:19.981023 IP node1.54469 > node3.46770: UDP, length 113
03:28:20.097984 IP node1.54469 > node3.46977: UDP, length 113
03:28:20.268810 IP node1.54469 > node2.52204: UDP, length 71
03:28:20.368896 IP node1.54469 > node3.57455: UDP, length 113
03:28:20.369135 IP node1.54469 > node4.35246: UDP, length 113
03:28:20.369243 IP node1.54469 > node4.53702: UDP, length 113
03:28:20.376585 IP node1.54469 > node2.52204: UDP, length 71
03:28:20.550369 IP node1.54469 > node3.40743: UDP, length 113
03:28:20.550637 IP node1.54469 > node3.38181: UDP, length 113
03:28:20.782727 IP node1.54469 > node3.39819: UDP, length 113
03:28:20.890399 IP node1.33327 > node3.58821: UDP, length 113
03:28:20.890850 IP node1.33327 > node3.46977: UDP, length 113
03:28:20.891986 IP node1.33327 > node4.35246: UDP, length 113
03:28:20.892392 IP node1.33327 > node4.53702: UDP, length 113
03:28:20.896596 IP node1.33327 > node3.57455: UDP, length 113
03:28:20.904862 IP node1.33327 > node3.46770: UDP, length 113
03:28:20.945520 IP node1.54469 > node2.52204: UDP, length 78
03:28:20.949469 IP node1.33327 > node3.40743: UDP, length 113
03:28:20.950296 IP node1.33327 > node3.39819: UDP, length 113
03:28:20.952543 IP node1.33327 > node3.38181: UDP, length 113
03:28:21.021862 IP node1.54469 > node2.52204: UDP, length 78
03:28:21.032580 IP node1.33327 > node2.52204: UDP, length 94
03:28:21.390395 IP node1.56110 > node3.58821: UDP, length 113
03:28:21.405470 IP node1.40805 > node4.53702: UDP, length 113
03:28:21.448940 IP node1.41777 > node3.38181: UDP, length 113
03:28:21.514948 IP node1.56110 > node3.46770: UDP, length 113
03:28:21.515449 IP node1.56110 > node3.46977: UDP, length 113
03:28:21.517733 IP node1.56110 > node4.35246: UDP, length 113
03:28:21.602817 IP node1.40805 > node2.52204: UDP, length 94
03:28:21.603588 IP node1.56110 > node4.53702: UDP, length 113
03:28:21.614146 IP node1.56110 > node3.57455: UDP, length 113
03:28:21.627796 IP node1.40805 > node3.57455: UDP, length 113
03:28:21.628773 IP node1.40805 > node3.38181: UDP, length 113
03:28:21.629315 IP node1.40805 > node3.40743: UDP, length 113
03:28:21.629692 IP node1.40805 > node3.39819: UDP, length 113
03:28:21.637878 IP node1.56110 > node3.39819: UDP, length 113
03:28:21.638154 IP node1.56110 > node3.40743: UDP, length 113
03:28:21.638409 IP node1.56110 > node3.38181: UDP, length 113
03:28:21.642548 IP node1.41777 > node2.52204: UDP, length 94
03:28:21.652097 IP node1.56110 > node2.52204: UDP, length 94
03:28:21.731717 IP node1.41777 > node3.40743: UDP, length 113
03:28:21.746480 IP node1.41777 > node3.39819: UDP, length 113
03:28:21.768363 IP node1.54469 > node2.52204: UDP, length 78
03:28:21.841018 IP node1.33327 > node3.39819: UDP, length 94
03:28:21.949095 IP node1.56110 > node2.52204: UDP, length 71
03:28:22.114020 IP node1.33327 > node2.52204: UDP, length 71
03:28:22.134059 IP node1.33327 > node2.52204: UDP, length 71
03:28:22.209627 IP node1.39134 > node3.39819: UDP, length 113
03:28:22.224935 IP node1.40805 > node2.52204: UDP, length 87
03:28:22.279678 IP node1.56110 > node2.52204: UDP, length 71
03:28:22.310069 IP node1.41084 > node2.52204: UDP, length 94
03:28:22.342379 IP node1.46696 > node2.52204: UDP, length 94
03:28:22.387425 IP node1.47989 > node2.52204: UDP, length 94
03:28:22.402256 IP node1.39134 > node2.52204: UDP, length 94
03:28:22.447982 IP node1.41777 > node2.52204: UDP, length 71
03:28:22.450359 IP node1.41777 > node2.52204: UDP, length 71
03:28:22.610512 IP node1.49148 > node2.52204: UDP, length 94
03:28:22.683263 IP node1.38402 > node2.52204: UDP, length 94
03:28:22.726251 IP node1.35613 > node2.52204: UDP, length 94
03:28:22.809556 IP node1.34917 > node2.52204: UDP, length 94
03:28:23.028539 IP node1.53797 > node2.52204: UDP, length 94
03:28:23.034916 IP node1.40805 > node2.52204: UDP, length 78
03:28:23.085149 IP node1.45765 > node2.52204: UDP, length 94
03:28:23.098357 IP node1.60770 > node2.52204: UDP, length 94
03:28:23.270892 IP node1.41777 > node2.52204: UDP, length 78
03:28:23.351175 IP node1.33327 > node2.52204: UDP, length 78
03:28:23.360600 IP node1.56110 > node2.52204: UDP, length 78
03:28:23.454638 IP node1.33327 > node2.52204: UDP, length 78
03:28:23.462033 IP node1.54469 > node2.52204: UDP, length 78
03:28:23.495715 IP node1.56110 > node2.52204: UDP, length 78
03:28:23.551649 IP node1.41777 > node2.52204: UDP, length 78
03:28:23.579208 IP node1.40805 > node2.52204: UDP, length 78
03:28:23.607150 IP node1.37459 > node2.52204: UDP, length 94
03:28:23.664531 IP node1.47989 > node2.52204: UDP, length 71
03:28:23.695383 IP node1.34917 > node2.52204: UDP, length 71
03:28:23.765630 IP node1.53797 > node2.52204: UDP, length 71
03:28:23.791953 IP node1.35613 > node2.52204: UDP, length 71
03:28:23.792612 IP node1.49148 > node2.52204: UDP, length 71
03:28:23.795833 IP node1.46696 > node2.52204: UDP, length 71
03:28:23.812452 IP node1.60770 > node2.52204: UDP, length 71
03:28:23.844878 IP node1.46696 > node2.52204: UDP, length 71
03:28:23.874483 IP node1.38402 > node2.52204: UDP, length 71
03:28:23.878473 IP node1.47989 > node2.52204: UDP, length 71
03:28:23.897817 IP node1.39134 > node2.52204: UDP, length 71
03:28:23.928994 IP node1.45765 > node2.52204: UDP, length 71
03:28:23.946390 IP node1.53797 > node2.52204: UDP, length 71
03:28:23.957296 IP node1.34917 > node2.52204: UDP, length 71
03:28:23.965875 IP node1.38402 > node2.52204: UDP, length 71
03:28:23.977582 IP node1.45765 > node2.52204: UDP, length 71
03:28:24.027111 IP node1.60770 > node2.52204: UDP, length 71
03:28:24.031756 IP node1.41084 > node2.52204: UDP, length 71
03:28:24.042291 IP node1.49148 > node2.52204: UDP, length 71
03:28:24.073233 IP node1.35613 > node2.52204: UDP, length 71
03:28:24.088647 IP node1.39134 > node2.52204: UDP, length 71
03:28:24.146524 IP node1.41084 > node2.52204: UDP, length 71
03:28:24.281200 IP node1.47575 > node2.52204: UDP, length 94
03:28:24.282471 IP node1.34182 > node2.52204: UDP, length 94
03:28:24.638046 IP node1.46696 > node2.52204: UDP, length 78
03:28:24.678905 IP node1.40306 > node2.52204: UDP, length 94
03:28:24.688825 IP node1.49148 > node2.52204: UDP, length 78
03:28:24.694215 IP node1.47989 > node2.52204: UDP, length 78
03:28:24.720470 IP node1.53797 > node2.52204: UDP, length 107
03:28:24.724023 IP node1.38402 > node2.52204: UDP, length 107
03:28:24.726842 IP node1.39134 > node2.52204: UDP, length 107
03:28:24.732828 IP node1.35613 > node2.52204: UDP, length 107
03:28:24.753869 IP node1.60770 > node2.52204: UDP, length 107
03:28:24.758712 IP node1.34917 > node2.52204: UDP, length 107
03:28:24.781257 IP node1.60770 > node2.52204: UDP, length 78
03:28:24.826737 IP node1.41084 > node2.52204: UDP, length 107
03:28:24.840626 IP node1.34917 > node2.52204: UDP, length 78
03:28:24.845784 IP node1.45765 > node2.52204: UDP, length 107
03:28:24.894328 IP node1.53797 > node2.52204: UDP, length 78
03:28:24.903257 IP node1.35613 > node2.52204: UDP, length 78
03:28:24.946184 IP node1.45765 > node2.52204: UDP, length 78
03:28:24.975533 IP node1.39134 > node2.52204: UDP, length 78
03:28:25.036287 IP node1.41084 > node2.52204: UDP, length 78
03:28:25.068262 IP node1.38402 > node2.52204: UDP, length 78
03:28:25.120096 IP node1.40423 > node2.52204: UDP, length 94
03:28:25.133774 IP node1.54469 > node2.52204: UDP, length 78
03:28:25.153650 IP node1.40805 > node2.52204: UDP, length 78
03:28:25.155207 IP node1.41777 > node2.52204: UDP, length 78
03:28:25.162476 IP node1.56110 > node2.52204: UDP, length 78
03:28:25.174473 IP node1.53797 > node2.52204: UDP, length 78
03:28:25.186275 IP node1.33327 > node2.52204: UDP, length 78
03:28:25.187010 IP node1.41084 > node2.52204: UDP, length 78
03:28:25.196528 IP node1.46696 > node2.52204: UDP, length 78
03:28:25.203970 IP node1.38402 > node2.52204: UDP, length 78
03:28:25.211558 IP node1.44696 > node2.52204: UDP, length 94
03:28:25.228865 IP node1.45765 > node2.52204: UDP, length 78
03:28:25.236361 IP node1.39134 > node2.52204: UDP, length 78
03:28:25.266032 IP node1.35613 > node2.52204: UDP, length 78
03:28:25.275030 IP node1.37451 > node2.52204: UDP, length 94
03:28:25.303153 IP node1.44248 > node2.52204: UDP, length 94
03:28:25.311165 IP node1.60770 > node2.52204: UDP, length 78
03:28:25.347017 IP node1.34917 > node2.52204: UDP, length 78
03:28:25.358315 IP node1.47989 > node2.52204: UDP, length 78
03:28:25.370218 IP node1.49148 > node2.52204: UDP, length 78
03:28:25.534346 IP node1.37459 > node2.52204: UDP, length 71
03:28:25.599637 IP node1.49146 > node2.52204: UDP, length 94
03:28:25.600491 IP node1.40306 > node2.52204: UDP, length 71
03:28:25.628973 IP node1.37459 > node2.52204: UDP, length 71
03:28:25.721504 IP node1.40306 > node2.52204: UDP, length 71
03:28:25.755961 IP node1.34182 > node2.52204: UDP, length 71
03:28:25.780420 IP node1.47575 > node2.52204: UDP, length 71
03:28:25.799194 IP node1.47575 > node2.52204: UDP, length 71
03:28:25.842084 IP node1.34182 > node2.52204: UDP, length 71
03:28:25.881284 IP node1.49895 > node2.52204: UDP, length 94
03:28:25.902436 IP node1.48423 > node2.52204: UDP, length 94
03:28:26.084548 IP node1.34182 > node2.52204: UDP, length 78
03:28:26.093648 IP node1.40306 > node2.52204: UDP, length 78
03:28:26.112187 IP node1.37459 > node2.52204: UDP, length 78
03:28:26.135980 IP node1.47575 > node2.52204: UDP, length 78
03:28:26.224892 IP node1.41084 > node2.52204: UDP, length 78
03:28:26.229726 IP node1.45765 > node2.52204: UDP, length 78
03:28:26.236596 IP node1.60770 > node2.52204: UDP, length 78
03:28:26.240736 IP node1.38402 > node2.52204: UDP, length 78
03:28:26.244683 IP node1.34917 > node2.52204: UDP, length 78
03:28:26.244913 IP node1.53797 > node2.52204: UDP, length 78
03:28:26.245975 IP node1.40805 > node2.52204: UDP, length 78
03:28:26.260373 IP node1.41777 > node2.52204: UDP, length 78
03:28:26.264579 IP node1.33327 > node2.52204: UDP, length 78
03:28:26.269655 IP node1.54469 > node2.52204: UDP, length 78
03:28:26.270323 IP node1.56110 > node2.52204: UDP, length 78
03:28:26.274689 IP node1.35613 > node2.52204: UDP, length 78
03:28:26.281439 IP node1.47575 > node2.52204: UDP, length 78
03:28:26.281990 IP node1.34182 > node2.52204: UDP, length 78
03:28:26.284084 IP node1.49148 > node2.52204: UDP, length 78
03:28:26.287578 IP node1.47989 > node2.52204: UDP, length 78
03:28:26.291789 IP node1.37459 > node2.52204: UDP, length 78
03:28:26.293592 IP node1.39134 > node2.52204: UDP, length 78
03:28:26.294979 IP node1.46696 > node2.52204: UDP, length 78
03:28:26.347913 IP node1.40306 > node2.52204: UDP, length 78
03:28:26.375862 IP node1.48423 > node2.52204: UDP, length 71
03:28:26.445324 IP node1.44248 > node2.52204: UDP, length 71
03:28:26.448482 IP node1.49146 > node2.52204: UDP, length 71
03:28:26.453985 IP node1.40423 > node2.52204: UDP, length 71
03:28:26.475275 IP node1.48423 > node2.52204: UDP, length 71
03:28:26.493748 IP node1.49895 > node2.52204: UDP, length 71
03:28:26.525916 IP node1.44248 > node2.52204: UDP, length 71
03:28:26.529964 IP node1.37451 > node2.52204: UDP, length 71
03:28:26.566504 IP node1.44696 > node2.52204: UDP, length 71
03:28:26.620816 IP node1.49895 > node2.52204: UDP, length 71
03:28:26.721142 IP node1.49146 > node2.52204: UDP, length 78
03:28:26.728737 IP node1.49146 > node2.52204: UDP, length 71
03:28:26.740086 IP node1.40423 > node2.52204: UDP, length 78
03:28:26.751238 IP node1.44696 > node2.52204: UDP, length 71
03:28:26.757868 IP node1.37451 > node2.52204: UDP, length 71
03:28:26.776387 IP node1.44696 > node2.52204: UDP, length 78
03:28:26.796534 IP node1.48423 > node2.52204: UDP, length 78
03:28:26.797815 IP node1.44248 > node2.52204: UDP, length 78
03:28:26.812955 IP node1.40423 > node2.52204: UDP, length 71
03:28:26.832486 IP node1.49895 > node2.52204: UDP, length 78
03:28:26.871396 IP node1.37451 > node2.52204: UDP, length 78
03:28:26.881876 IP node1.49148 > node2.52204: UDP, length 2200
03:28:26.881983 IP node1 > node2: udp
03:28:27.308082 IP node1.41084 > node2.52204: UDP, length 2200
03:28:27.308207 IP node1 > node2: udp
03:28:27.817168 IP node1.35785 > node2.52204: UDP, length 94
03:28:27.829277 IP node1.54469 > node2.52204: UDP, length 78
03:28:27.831426 IP node1.47989 > node2.52204: UDP, length 78
03:28:27.837512 IP node1.34917 > node2.52204: UDP, length 78
03:28:27.844686 IP node1.60770 > node2.52204: UDP, length 78
03:28:27.845409 IP node1.33327 > node2.52204: UDP, length 78
03:28:27.845464 IP node1.40805 > node2.52204: UDP, length 78
03:28:27.845620 IP node1.49895 > node2.52204: UDP, length 78
03:28:27.847290 IP node1.46696 > node2.52204: UDP, length 78
03:28:27.861746 IP node1.35613 > node2.52204: UDP, length 78
03:28:27.866118 IP node1.40306 > node2.52204: UDP, length 78
03:28:27.868778 IP node1.37459 > node2.52204: UDP, length 78
03:28:27.872411 IP node1.41084 > node2.52204: UDP, length 78
03:28:27.886863 IP node1.39134 > node2.52204: UDP, length 78
03:28:27.891520 IP node1.45765 > node2.52204: UDP, length 78
03:28:27.893377 IP node1.53797 > node2.52204: UDP, length 78
03:28:27.897255 IP node1.38402 > node2.52204: UDP, length 78
03:28:27.902859 IP node1.49148 > node2.52204: UDP, length 78
03:28:27.908494 IP node1.41777 > node2.52204: UDP, length 78
03:28:27.924577 IP node1.47575 > node2.52204: UDP, length 78
03:28:27.932020 IP node1.40805 > node2.52204: UDP, length 2218
03:28:27.932137 IP node1 > node2: udp
03:28:27.940721 IP node1.56110 > node2.52204: UDP, length 78
03:28:27.948606 IP node1.34182 > node2.52204: UDP, length 78
03:28:27.979508 IP node1.44248 > node2.52204: UDP, length 78
03:28:27.987945 IP node1.44696 > node2.52204: UDP, length 78
03:28:28.002018 IP node1.37451 > node2.52204: UDP, length 78
03:28:28.010659 IP node1.49146 > node2.52204: UDP, length 78
03:28:28.028837 IP node1.40423 > node2.52204: UDP, length 78
03:28:28.044578 IP node1.48423 > node2.52204: UDP, length 78
03:28:28.167715 IP node1.35785 > node2.52204: UDP, length 71
03:28:28.174617 IP node1.35785 > node2.52204: UDP, length 71
03:28:28.237618 IP node1.44696 > node2.52204: UDP, length 2218
03:28:28.237718 IP node1 > node2: udp
03:28:28.322857 IP node1.35785 > node2.52204: UDP, length 78
03:28:28.523737 IP node1.42645 > node2.52204: UDP, length 94
03:28:28.569182 IP node1.41777 > node2.52204: UDP, length 78
03:28:28.572060 IP node1.39134 > node2.52204: UDP, length 78
03:28:28.575614 IP node1.53797 > node2.52204: UDP, length 78
03:28:28.577066 IP node1.46696 > node2.52204: UDP, length 78
03:28:28.579501 IP node1.54469 > node2.52204: UDP, length 78
03:28:28.588072 IP node1.33327 > node2.52204: UDP, length 78
03:28:28.588510 IP node1.40423 > node2.52204: UDP, length 78
03:28:28.590253 IP node1.49148 > node2.52204: UDP, length 78
03:28:28.593283 IP node1.40805 > node2.52204: UDP, length 78
03:28:28.596459 IP node1.35613 > node2.52204: UDP, length 78
03:28:28.596983 IP node1.60770 > node2.52204: UDP, length 78
03:28:28.599121 IP node1.56110 > node2.52204: UDP, length 78
03:28:28.609115 IP node1.47989 > node2.52204: UDP, length 78
03:28:28.610279 IP node1.35785 > node2.52204: UDP, length 78
03:28:28.611538 IP node1.34182 > node2.52204: UDP, length 78
03:28:28.622879 IP node1.41084 > node2.52204: UDP, length 78
03:28:28.624629 IP node1.45765 > node2.52204: UDP, length 78
03:28:28.625545 IP node1.38402 > node2.52204: UDP, length 78
03:28:28.628142 IP node1.40306 > node2.52204: UDP, length 78
03:28:28.634518 IP node1.47575 > node2.52204: UDP, length 78
03:28:28.636768 IP node1.37459 > node2.52204: UDP, length 78
03:28:28.644895 IP node1.49146 > node2.52204: UDP, length 78
03:28:28.652425 IP node1.34917 > node2.52204: UDP, length 78
03:28:28.658157 IP node1.37451 > node2.52204: UDP, length 78
03:28:28.667169 IP node1.44696 > node2.52204: UDP, length 78
03:28:28.668801 IP node1.44248 > node2.52204: UDP, length 78
03:28:28.679772 IP node1.49895 > node2.52204: UDP, length 78
03:28:28.681946 IP node1.48423 > node2.52204: UDP, length 78
03:28:28.801709 IP node1.42645 > node2.52204: UDP, length 71
03:28:28.861891 IP node1.35325 > node2.52204: UDP, length 94
03:28:28.916026 IP node1.42645 > node2.52204: UDP, length 71
03:28:28.957242 IP node1.42645 > node2.52204: UDP, length 78
03:28:29.027093 IP node1.54469 > node2.52204: UDP, length 78
03:28:29.042613 IP node1.39134 > node2.52204: UDP, length 78
03:28:29.043827 IP node1.44248 > node2.52204: UDP, length 78
03:28:29.043996 IP node1.48423 > node2.52204: UDP, length 78
03:28:29.044922 IP node1.44696 > node2.52204: UDP, length 78
03:28:29.044977 IP node1.33327 > node2.52204: UDP, length 78
03:28:29.049224 IP node1.35613 > node2.52204: UDP, length 78
03:28:29.049917 IP node1.60770 > node2.52204: UDP, length 78
03:28:29.056953 IP node1.41084 > node2.52204: UDP, length 78
03:28:29.070801 IP node1.46696 > node2.52204: UDP, length 78
03:28:29.076732 IP node1.49148 > node2.52204: UDP, length 78
03:28:29.078151 IP node1.35785 > node2.52204: UDP, length 78
03:28:29.080287 IP node1.37459 > node2.52204: UDP, length 78
03:28:29.082356 IP node1.45765 > node2.52204: UDP, length 78
03:28:29.083283 IP node1.41777 > node2.52204: UDP, length 78
03:28:29.083400 IP node1.40306 > node2.52204: UDP, length 78
03:28:29.096748 IP node1.34917 > node2.52204: UDP, length 78
03:28:29.104128 IP node1.49146 > node2.52204: UDP, length 78
03:28:29.107170 IP node1.38402 > node2.52204: UDP, length 78
03:28:29.107848 IP node1.40805 > node2.52204: UDP, length 78
03:28:29.111024 IP node1.49895 > node2.52204: UDP, length 78
03:28:29.128642 IP node1.34182 > node2.52204: UDP, length 78
03:28:29.134878 IP node1.40423 > node2.52204: UDP, length 78
03:28:29.138285 IP node1.53797 > node2.52204: UDP, length 78
03:28:29.140029 IP node1.47989 > node2.52204: UDP, length 78
03:28:29.140756 IP node1.47575 > node2.52204: UDP, length 78
03:28:29.142167 IP node1.37451 > node2.52204: UDP, length 78
03:28:29.150268 IP node1.56110 > node2.52204: UDP, length 78
03:28:29.213496 IP node1.42645 > node2.52204: UDP, length 78
03:28:29.345862 IP node1.35325 > node2.52204: UDP, length 71
03:28:29.397585 IP node1.35325 > node2.52204: UDP, length 71
03:28:29.509838 IP node1.35325 > node2.52204: UDP, length 78
03:28:30.626711 IP node1.35325 > node2.52204: UDP, length 2254
03:28:30.626827 IP node1 > node2: udp
03:28:30.983578 IP node1.40805 > node2.52204: UDP, length 2254
03:28:30.983681 IP node1 > node2: udp
03:28:32.291774 IP node1.33327 > node2.52204: UDP, length 2254
03:28:32.291877 IP node1 > node2: udp
03:28:32.756343 IP node1.35325 > node2.52204: UDP, length 2254
03:28:32.756462 IP node1 > node2: udp
03:28:36.048346 IP node1.35325 > node2.52204: UDP, length 2254
03:28:36.048445 IP node1 > node2: udp
03:28:37.091014 IP node1.35613 > node2.52204: UDP, length 2254
03:28:37.091121 IP node1 > node2: udp
03:28:37.519639 IP node1.42645 > node2.52204: UDP, length 2254
03:28:37.519750 IP node1 > node2: udp
03:28:38.043917 IP node1.47575 > node2.52204: UDP, length 2254
03:28:38.044040 IP node1 > node2: udp
03:28:38.185604 IP node1.46696 > node2.52204: UDP, length 2254
03:28:38.185702 IP node1 > node2: udp
03:28:38.203913 IP node1.54469 > node2.52204: UDP, length 2254
03:28:38.204063 IP node1 > node2: udp
03:28:38.441478 IP node1.35613 > node2.52204: UDP, length 2254
03:28:38.441584 IP node1 > node2: udp
03:28:39.886108 IP node1.44248 > node2.52204: UDP, length 2254
03:28:39.886215 IP node1 > node2: udp
03:28:41.938473 IP node1.38402 > node2.52204: UDP, length 2254
03:28:41.938585 IP node1 > node2: udp
03:28:42.959802 IP node1.37451 > node2.52204: UDP, length 2254
03:28:42.959909 IP node1 > node2: udp
03:28:43.719931 IP node1.53797 > node2.52204: UDP, length 2254
03:28:43.720019 IP node1 > node2: udp
03:28:43.857456 IP node1.39134 > node2.52204: UDP, length 2254
03:28:43.857603 IP node1 > node2: udp
03:28:43.900204 IP node1.33327 > node2.52204: UDP, length 2254
03:28:43.900311 IP node1 > node2: udp
03:28:44.007571 IP node1.44696 > node2.52204: UDP, length 2254
03:28:44.007669 IP node1 > node2: udp
03:28:44.093130 IP node1.34917 > node2.52204: UDP, length 2254
03:28:44.093225 IP node1 > node2: udp
03:28:44.386351 IP node1.41084 > node2.52204: UDP, length 2254
03:28:44.386481 IP node1 > node2: udp
03:28:44.899198 IP node1.47989 > node2.52204: UDP, length 2254
03:28:44.899352 IP node1 > node2: udp
03:28:45.294799 IP node1.48423 > node2.52204: UDP, length 2254
03:28:45.294930 IP node1 > node2: udp
03:28:46.131788 IP node1.35785 > node2.52204: UDP, length 2254
03:28:46.131864 IP node1 > node2: udp
03:28:46.199144 IP node1.49895 > node2.52204: UDP, length 2254
03:28:46.199226 IP node1 > node2: udp
03:28:46.596668 IP node1.42645 > node2.52204: UDP, length 2254
03:28:46.596785 IP node1 > node2: udp
03:28:47.177030 IP node1.47575 > node2.52204: UDP, length 2254
03:28:47.177142 IP node1 > node2: udp
03:28:47.648390 IP node1.41777 > node2.52204: UDP, length 2254
03:28:47.648518 IP node1 > node2: udp
03:28:48.286058 IP node1.49148 > node2.52204: UDP, length 2254
03:28:48.286199 IP node1 > node2: udp
03:28:48.596687 IP node1.56110 > node2.52204: UDP, length 2254
03:28:48.596824 IP node1 > node2: udp
03:28:48.782597 IP node1.42645 > node2.52204: UDP, length 2254
03:28:48.782715 IP node1 > node2: udp
03:28:49.243788 IP node1.40805 > node2.52204: UDP, length 2254
03:28:49.243876 IP node1 > node2: udp
03:28:49.765327 IP node1.60770 > node2.52204: UDP, length 2254
03:28:49.765431 IP node1 > node2: udp
03:28:50.944630 IP node1.40306 > node2.52204: UDP, length 2254
03:28:50.944739 IP node1 > node2: udp
03:28:52.357884 IP node1.37459 > node2.52204: UDP, length 2254
03:28:52.357999 IP node1 > node2: udp
03:28:52.377404 IP node1.34182 > node2.52204: UDP, length 2254
03:28:52.377484 IP node1 > node2: udp
03:28:53.635768 IP node1.41777 > node2.52204: UDP, length 2254
03:28:53.635866 IP node1 > node2: udp
03:28:53.848904 IP node1.45765 > node2.52204: UDP, length 2254
03:28:53.849049 IP node1 > node2: udp
03:28:54.219116 IP node1.39134 > node2.52204: UDP, length 2254
03:28:54.219243 IP node1 > node2: udp
03:28:54.421636 IP node1.34917 > node2.52204: UDP, length 2254
03:28:54.421753 IP node1 > node2: udp
03:28:54.479400 IP node1.34182 > node2.52204: UDP, length 2254
03:28:54.479512 IP node1 > node2: udp
03:28:54.579412 IP node1.49146 > node2.52204: UDP, length 2254
03:28:54.579536 IP node1 > node2: udp
03:28:55.436181 IP node1.33327 > node2.52204: UDP, length 2254
03:28:55.436305 IP node1 > node2: udp
03:28:55.572010 IP node1.44696 > node2.52204: UDP, length 2254
03:28:55.572191 IP node1 > node2: udp
03:28:56.761166 IP node1.41084 > node2.52204: UDP, length 2254
03:28:56.761285 IP node1 > node2: udp
03:28:57.304391 IP node1.41084 > node2.52204: UDP, length 2254
03:28:57.304472 IP node1 > node2: udp
03:28:59.490034 IP node1.44696 > node2.52204: UDP, length 2254
03:28:59.490137 IP node1 > node2: udp
03:28:59.949981 IP node1.54469 > node2.52204: UDP, length 2254
03:28:59.950082 IP node1 > node2: udp
03:29:01.587661 IP node1.40423 > node2.52204: UDP, length 2254
03:29:01.587785 IP node1 > node2: udp
03:29:02.370127 IP node1.47575 > node2.52204: UDP, length 2254
03:29:02.370241 IP node1 > node2: udp
03:29:03.523366 IP node1.49895 > node2.52204: UDP, length 2254
03:29:03.523495 IP node1 > node2: udp
03:29:04.576137 IP node1.34182 > node2.52204: UDP, length 2254
03:29:04.576279 IP node1 > node2: udp
03:29:04.586387 IP node1.41777 > node2.52204: UDP, length 2254
03:29:04.586473 IP node1 > node2: udp
03:29:05.145432 IP node1.48423 > node2.52204: UDP, length 2254
03:29:05.145574 IP node1 > node2: udp
03:29:06.029969 IP node1.40423 > node2.52204: UDP, length 2254
03:29:06.030100 IP node1 > node2: udp
03:29:07.192364 IP node1.46696 > node2.52204: UDP, length 2254
03:29:07.192452 IP node1 > node2: udp
03:29:08.502953 IP node1.35325 > node2.52204: UDP, length 2254
03:29:08.503074 IP node1 > node2: udp
03:29:09.210640 IP node1.37459 > node2.52204: UDP, length 2254
03:29:09.210743 IP node1 > node2: udp
03:29:09.264287 IP node1.53797 > node2.52204: UDP, length 2254
03:29:09.264340 IP node1 > node2: udp
03:29:10.138786 IP node1.49146 > node2.52204: UDP, length 2254
03:29:10.138905 IP node1 > node2: udp
03:29:10.726306 IP node1.37451 > node2.52204: UDP, length 2254
03:29:10.726429 IP node1 > node2: udp
03:29:10.961225 IP node1.35785 > node2.52204: UDP, length 2254
03:29:10.961347 IP node1 > node2: udp
03:29:11.280992 IP node1.44696 > node2.52204: UDP, length 2254
03:29:11.281082 IP node1 > node2: udp
03:29:13.465567 IP node1.42645 > node2.52204: UDP, length 2254
03:29:13.465692 IP node1 > node2: udp
03:29:14.600324 IP node1.44248 > node2.52204: UDP, length 2254
03:29:14.600420 IP node1 > node2: udp
03:29:15.005633 IP node1.35613 > node2.52204: UDP, length 2254
03:29:15.005740 IP node1 > node2: udp
03:29:16.949368 IP node1.41084 > node2.52204: UDP, length 2254
03:29:16.949492 IP node1 > node2: udp
03:29:17.426134 IP node1.47989 > node2.52204: UDP, length 2254
03:29:17.426238 IP node1 > node2: udp
03:29:18.619980 IP node1.33327 > node2.52204: UDP, length 2254
03:29:18.620088 IP node1 > node2: udp
03:29:18.747558 IP node1.39134 > node2.52204: UDP, length 2254
03:29:18.747707 IP node1 > node2: udp
03:29:18.897769 IP node1.56110 > node2.52204: UDP, length 2254
03:29:18.897873 IP node1 > node2: udp
03:29:19.148920 IP node1.44696 > node2.52204: UDP, length 2254
03:29:19.149041 IP node1 > node2: udp
03:29:19.273387 IP node1.38402 > node2.52204: UDP, length 2254
03:29:19.273490 IP node1 > node2: udp
03:29:19.774011 IP node1.35613 > node2.52204: UDP, length 2254
03:29:19.774104 IP node1 > node2: udp
03:29:20.562805 IP node1.35613 > node2.52204: UDP, length 2254
03:29:20.562899 IP node1 > node2: udp
03:29:21.285887 IP node1.40306 > node2.52204: UDP, length 2254
03:29:21.286013 IP node1 > node2: udp
03:29:21.731359 IP node1.54469 > node2.52204: UDP, length 2254
03:29:21.731456 IP node1 > node2: udp
03:29:24.434234 IP node1.47989 > node2.52204: UDP, length 2254
03:29:24.434343 IP node1 > node2: udp
03:29:25.322182 IP node1.49148 > node2.52204: UDP, length 2254
03:29:25.322300 IP node1 > node2: udp
03:29:25.629879 IP node1.40805 > node2.52204: UDP, length 2254
03:29:25.629970 IP node1 > node2: udp
03:29:26.149108 IP node1.45765 > node2.52204: UDP, length 2254
03:29:26.149209 IP node1 > node2: udp
03:29:26.906286 IP node1.49148 > node2.52204: UDP, length 2254
03:29:26.906391 IP node1 > node2: udp
03:29:27.392539 IP node1.41777 > node2.52204: UDP, length 2254
03:29:27.392646 IP node1 > node2: udp
03:29:27.812567 IP node1.60770 > node2.52204: UDP, length 2254
03:29:27.812631 IP node1 > node2: udp
03:29:31.108719 IP node1.44696 > node2.52204: UDP, length 2254
03:29:31.108842 IP node1 > node2: udp
03:29:31.578485 IP node1.49895 > node2.52204: UDP, length 2254
03:29:31.578598 IP node1 > node2: udp
03:29:32.656149 IP node1.34917 > node2.52204: UDP, length 2254
03:29:32.656296 IP node1 > node2: udp
03:29:32.806215 IP node1.47575 > node2.52204: UDP, length 2254
03:29:32.806325 IP node1 > node2: udp
03:29:34.161018 IP node1.40423 > node2.52204: UDP, length 2254
03:29:34.161126 IP node1 > node2: udp
03:29:35.077635 IP node1.60770 > node2.52204: UDP, length 2254
03:29:35.077736 IP node1 > node2: udp
03:29:35.221505 IP node1.35325 > node2.52204: UDP, length 2254
03:29:35.221571 IP node1 > node2: udp
03:29:35.227665 IP node1.41777 > node2.52204: UDP, length 2254
03:29:35.227774 IP node1 > node2: udp
03:29:35.255606 IP node1.34182 > node2.52204: UDP, length 2254
03:29:35.255670 IP node1 > node2: udp
03:29:35.905936 IP node1.56110 > node2.52204: UDP, length 2254
03:29:35.906053 IP node1 > node2: udp
03:29:36.020569 IP node1.48423 > node2.52204: UDP, length 2254
03:29:36.020663 IP node1 > node2: udp
03:29:36.167591 IP node1.38402 > node2.52204: UDP, length 2254
03:29:36.167715 IP node1 > node2: udp
03:29:36.668254 IP node1.33327 > node2.52204: UDP, length 2254
03:29:36.668449 IP node1 > node2: udp
03:29:37.793993 IP node1.37459 > node2.52204: UDP, length 2254
03:29:37.794128 IP node1 > node2: udp
03:29:37.936128 IP node1.40306 > node2.52204: UDP, length 2254
03:29:37.936248 IP node1 > node2: udp
03:29:37.999593 IP node1.53797 > node2.52204: UDP, length 2254
03:29:37.999716 IP node1 > node2: udp
03:29:39.053337 IP node1.47575 > node2.52204: UDP, length 2254
03:29:39.053432 IP node1 > node2: udp
03:29:39.799138 IP node1.37459 > node2.52204: UDP, length 2254
03:29:39.799258 IP node1 > node2: udp
03:29:40.638347 IP node1.42645 > node2.52204: UDP, length 2254
03:29:40.638428 IP node1 > node2: udp
03:29:41.370294 IP node1.49146 > node2.52204: UDP, length 2254
03:29:41.370439 IP node1 > node2: udp
03:29:41.398495 IP node1.35785 > node2.52204: UDP, length 2254
03:29:41.398599 IP node1 > node2: udp
03:29:41.822588 IP node1.53797 > node2.52204: UDP, length 2254
03:29:41.822703 IP node1 > node2: udp
03:29:41.943189 IP node1.41084 > node2.52204: UDP, length 2254
03:29:41.943292 IP node1 > node2: udp
03:29:42.039516 IP node1.40423 > node2.52204: UDP, length 2254
03:29:42.039616 IP node1 > node2: udp
03:29:42.113046 IP node1.49146 > node2.52204: UDP, length 2254
03:29:42.113197 IP node1 > node2: udp
03:29:42.388214 IP node1.46696 > node2.52204: UDP, length 2254
03:29:42.388313 IP node1 > node2: udp
03:29:42.712314 IP node1.44248 > node2.52204: UDP, length 2254
03:29:42.712460 IP node1 > node2: udp
03:29:44.983059 IP node1.41084 > node2.52204: UDP, length 2254
03:29:44.983162 IP node1 > node2: udp
03:29:45.569587 IP node1.37451 > node2.52204: UDP, length 2254
03:29:45.569686 IP node1 > node2: udp
03:29:45.876682 IP node1.35613 > node2.52204: UDP, length 2254
03:29:45.876752 IP node1 > node2: udp
03:29:47.195777 IP node1.56110 > node2.52204: UDP, length 2254
03:29:47.195874 IP node1 > node2: udp
03:29:47.651075 IP node1.39134 > node2.52204: UDP, length 2254
03:29:47.651154 IP node1 > node2: udp
03:29:48.461291 IP node1.49148 > node2.52204: UDP, length 2254
03:29:48.461394 IP node1 > node2: udp
03:29:50.449386 IP node1.44696 > node2.52204: UDP, length 2254
03:29:50.449476 IP node1 > node2: udp
03:29:50.726557 IP node1.41777 > node2.52204: UDP, length 2254
03:29:50.726659 IP node1 > node2: udp
03:29:50.835144 IP node1.40306 > node2.52204: UDP, length 2254
03:29:50.835242 IP node1 > node2: udp
03:29:50.866271 IP node1.46696 > node2.52204: UDP, length 2254
03:29:50.866331 IP node1 > node2: udp
03:29:52.060340 IP node1.34182 > node2.52204: UDP, length 2254
03:29:52.060430 IP node1 > node2: udp
03:29:52.144138 IP node1.38402 > node2.52204: UDP, length 2254
03:29:52.144292 IP node1 > node2: udp
03:29:52.782391 IP node1.33327 > node2.52204: UDP, length 2254
03:29:52.782474 IP node1 > node2: udp
03:29:53.259411 IP node1.54469 > node2.52204: UDP, length 2254
03:29:53.259526 IP node1 > node2: udp
03:29:54.476365 IP node1.49895 > node2.52204: UDP, length 2254
03:29:54.476447 IP node1 > node2: udp
03:29:54.605319 IP node1.47989 > node2.52204: UDP, length 2254
03:29:54.605464 IP node1 > node2: udp
03:29:55.075383 IP node1.41777 > node2.52204: UDP, length 2254
03:29:55.075489 IP node1 > node2: udp
03:29:57.950368 IP node1.42645 > node2.52204: UDP, length 2254
03:29:57.950498 IP node1 > node2: udp
03:29:59.592109 IP node1.42645 > node2.52204: UDP, length 2254
03:29:59.592231 IP node1 > node2: udp
03:29:59.639647 IP node1.48423 > node2.52204: UDP, length 2254
03:29:59.639760 IP node1 > node2: udp
03:29:59.889799 IP node1.41084 > node2.52204: UDP, length 2254
03:29:59.889905 IP node1 > node2: udp
03:30:00.582070 IP node1.33327 > node2.52204: UDP, length 2254
03:30:00.582211 IP node1 > node2: udp
03:30:00.668187 IP node1.38402 > node2.52204: UDP, length 2254
03:30:00.668316 IP node1 > node2: udp
03:30:01.807313 IP node1.45765 > node2.52204: UDP, length 2254
03:30:01.807424 IP node1 > node2: udp
03:30:01.912921 IP node1.37459 > node2.52204: UDP, length 2254
03:30:01.912995 IP node1 > node2: udp
03:30:03.682178 IP node1.40805 > node2.52204: UDP, length 2254
03:30:03.682280 IP node1 > node2: udp
03:30:04.391592 IP node1.53797 > node2.52204: UDP, length 2254
03:30:04.391692 IP node1 > node2: udp
03:30:04.812129 IP node1.44696 > node2.52204: UDP, length 2254
03:30:04.812222 IP node1 > node2: udp
03:30:08.120575 IP node1.54469 > node2.52204: UDP, length 2254
03:30:08.120680 IP node1 > node2: udp
03:30:08.418572 IP node1.35325 > node2.52204: UDP, length 2254
03:30:08.418668 IP node1 > node2: udp
03:30:08.617944 IP node1.39134 > node2.52204: UDP, length 2254
03:30:08.618070 IP node1 > node2: udp
03:30:09.391610 IP node1.35785 > node2.52204: UDP, length 2254
03:30:09.391721 IP node1 > node2: udp
03:30:09.592221 IP node1.34917 > node2.52204: UDP, length 2254
03:30:09.592351 IP node1 > node2: udp
03:30:11.270464 IP node1.37451 > node2.52204: UDP, length 2254
03:30:11.270573 IP node1 > node2: udp
03:30:12.089911 IP node1.33327 > node2.52204: UDP, length 2254
03:30:12.090025 IP node1 > node2: udp
03:30:12.820069 IP node1.41777 > node2.52204: UDP, length 2254
03:30:12.820207 IP node1 > node2: udp
03:30:13.013593 IP node1.41084 > node2.52204: UDP, length 2254
03:30:13.013657 IP node1 > node2: udp
03:30:13.988597 IP node1.60770 > node2.52204: UDP, length 2254
03:30:13.988704 IP node1 > node2: udp
03:30:14.063618 IP node1.48423 > node2.52204: UDP, length 2254
03:30:14.063714 IP node1 > node2: udp
03:30:15.013783 IP node1.41777 > node2.52204: UDP, length 2254
03:30:15.013885 IP node1 > node2: udp
03:30:15.171592 IP node1.49148 > node2.52204: UDP, length 2254
03:30:15.171702 IP node1 > node2: udp
03:30:15.930961 IP node1.56110 > node2.52204: UDP, length 2254
03:30:15.931083 IP node1 > node2: udp
03:30:16.023407 IP node1.34182 > node2.52204: UDP, length 2254
03:30:16.023490 IP node1 > node2: udp
03:30:16.846399 IP node1.35325 > node2.52204: UDP, length 2254
03:30:16.846695 IP node1 > node2: udp
03:30:16.967262 IP node1.47575 > node2.52204: UDP, length 2254
03:30:16.967372 IP node1 > node2: udp
03:30:17.991099 IP node1.49146 > node2.52204: UDP, length 2254
03:30:17.991219 IP node1 > node2: udp
03:30:18.579414 IP node1.35325 > node2.52204: UDP, length 2254
03:30:18.579493 IP node1 > node2: udp
03:30:19.606235 IP node1.40423 > node2.52204: UDP, length 2254
03:30:19.606336 IP node1 > node2: udp
03:30:19.895855 IP node1.44696 > node2.52204: UDP, length 2254
03:30:19.895957 IP node1 > node2: udp
03:30:20.280955 IP node1.49895 > node2.52204: UDP, length 2254
03:30:20.281039 IP node1 > node2: udp
03:30:20.362410 IP node1.35613 > node2.52204: UDP, length 2254
03:30:20.362511 IP node1 > node2: udp
03:30:20.488283 IP node1.44248 > node2.52204: UDP, length 2254
03:30:20.488380 IP node1 > node2: udp
03:30:21.279927 IP node1.40306 > node2.52204: UDP, length 2254
03:30:21.280066 IP node1 > node2: udp
03:30:21.433060 IP node1.53797 > node2.52204: UDP, length 2254
03:30:21.433143 IP node1 > node2: udp
03:30:23.690449 IP node1.45765 > node2.52204: UDP, length 2254
03:30:23.690588 IP node1 > node2: udp
03:30:26.185082 IP node1.47575 > node2.52204: UDP, length 2254
03:30:26.185189 IP node1 > node2: udp
03:30:27.114681 IP node1.35785 > node2.52204: UDP, length 2254
03:30:27.114754 IP node1 > node2: udp
03:30:27.822372 IP node1.47989 > node2.52204: UDP, length 2254
03:30:27.822513 IP node1 > node2: udp
03:30:27.879462 IP node1.41777 > node2.52204: UDP, length 2254
03:30:27.879533 IP node1 > node2: udp
03:30:29.302860 IP node1.46696 > node2.52204: UDP, length 2254
03:30:29.302985 IP node1 > node2: udp
03:30:31.616973 IP node1.38402 > node2.52204: UDP, length 2254
03:30:31.617096 IP node1 > node2: udp
03:30:31.692475 IP node1.37451 > node2.52204: UDP, length 2254
03:30:31.692596 IP node1 > node2: udp
03:30:33.239184 IP node1.35613 > node2.52204: UDP, length 2254
03:30:33.239275 IP node1 > node2: udp
03:30:34.381082 IP node1.40306 > node2.52204: UDP, length 2254
03:30:34.381233 IP node1 > node2: udp
03:30:35.391708 IP node1.39134 > node2.52204: UDP, length 2254
03:30:35.391816 IP node1 > node2: udp
03:30:35.670869 IP node1.35613 > node2.52204: UDP, length 2254
03:30:35.670963 IP node1 > node2: udp
03:30:36.041186 IP node1.40805 > node2.52204: UDP, length 2254
03:30:36.041687 IP node1 > node2: udp
03:30:36.311909 IP node1.40423 > node2.52204: UDP, length 2254
03:30:36.312026 IP node1 > node2: udp
03:30:36.361838 IP node1.40805 > node2.52204: UDP, length 2254
03:30:36.361952 IP node1 > node2: udp
03:30:36.472752 IP node1.33327 > node2.52204: UDP, length 2254
03:30:36.472870 IP node1 > node2: udp
03:30:36.507114 IP node1.42645 > node2.52204: UDP, length 2254
03:30:36.507215 IP node1 > node2: udp
03:30:36.596370 IP node1.41084 > node2.52204: UDP, length 2254
03:30:36.596436 IP node1 > node2: udp
03:30:36.651854 IP node1.56110 > node2.52204: UDP, length 2254
03:30:36.651971 IP node1 > node2: udp
03:30:36.659842 IP node1.37459 > node2.52204: UDP, length 2254
03:30:36.659894 IP node1 > node2: udp
03:30:37.440547 IP node1.48423 > node2.52204: UDP, length 2254
03:30:37.440663 IP node1 > node2: udp
03:30:37.998757 IP node1.49895 > node2.52204: UDP, length 2254
03:30:37.998845 IP node1 > node2: udp
03:30:38.643145 IP node1.35613 > node2.52204: UDP, length 67
03:30:38.663620 IP node1.41084 > node2.52204: UDP, length 67
03:30:38.666815 IP node1.37459 > node2.52204: UDP, length 67
03:30:38.670860 IP node1.39134 > node2.52204: UDP, length 67
03:30:38.785319 IP node1.49146 > node2.52204: UDP, length 67
03:30:38.822531 IP node1.44696 > node2.52204: UDP, length 67
03:30:38.887228 IP node1.60770 > node2.52204: UDP, length 67
03:30:38.912629 IP node1.34182 > node2.52204: UDP, length 67
03:30:38.989704 IP node1.38402 > node2.52204: UDP, length 67
03:30:38.999825 IP node1.49148 > node2.52204: UDP, length 67
03:30:39.011638 IP node1.53797 > node2.52204: UDP, length 67
03:30:39.012282 IP node1.41777 > node2.52204: UDP, length 67
03:30:39.016130 IP node1.44248 > node2.52204: UDP, length 67
03:30:39.049776 IP node1.45765 > node2.52204: UDP, length 67
03:30:39.171491 IP node1.56110 > node2.52204: UDP, length 67
03:30:39.194367 IP node1.49895 > node2.52204: UDP, length 67
