03:28:12.114723 IP node4.34193 > node4.33410: UDP, length 113
03:28:12.268560 IP node4.34193 > node4.32788: UDP, length 113
03:28:12.331460 IP node4.33410 > node4.34193: UDP, length 113
03:28:12.341395 IP node4.33410 > node4.32788: UDP, length 113
03:28:12.419732 IP node4.32788 > node4.33410: UDP, length 113
03:28:12.438207 IP node4.43338 > node4.33410: UDP, length 113
03:28:12.438518 IP node4.43338 > node4.32788: UDP, length 113
03:28:12.440451 IP node4.34193 > node4.43338: UDP, length 113
03:28:12.440569 IP node4.33410 > node4.43338: UDP, length 113
03:28:12.442580 IP node4.32788 > node4.43338: UDP, length 113
03:28:12.568866 IP node4.41567 > node4.33410: UDP, length 113
03:28:12.569004 IP node4.41567 > node4.32788: UDP, length 113
03:28:12.569117 IP node4.41567 > node4.43338: UDP, length 113
03:28:12.570144 IP node4.34193 > node4.41567: UDP, length 113
03:28:12.570868 IP node4.33410 > node4.54038: UDP, length 113
03:28:12.570868 IP node4.34193 > node4.54038: UDP, length 113
03:28:12.572518 IP node4.54038 > node4.33410: UDP, length 113
03:28:12.572863 IP node4.54038 > node4.32788: UDP, length 113
03:28:12.573062 IP node4.54038 > node4.43338: UDP, length 113
03:28:12.574107 IP node4.32788 > node4.41567: UDP, length 113
03:28:12.574386 IP node4.32788 > node4.54038: UDP, length 113
03:28:12.575751 IP node4.43338 > node4.54038: UDP, length 113
03:28:12.575771 IP node4.43338 > node4.41567: UDP, length 113
03:28:12.579003 IP node4.54038 > node4.41567: UDP, length 113
03:28:12.589065 IP node4.33410 > node4.41567: UDP, length 113
03:28:12.605880 IP node4.41567 > node4.54038: UDP, length 113
03:28:12.662931 IP node4.33410 > node4.39188: UDP, length 113
03:28:12.662979 IP node4.32788 > node4.39188: UDP, length 113
03:28:12.663706 IP node4.34193 > node4.39188: UDP, length 113
03:28:12.667507 IP node4.54038 > node4.39188: UDP, length 113
03:28:12.667621 IP node4.43338 > node4.39188: UDP, length 113
03:28:12.667859 IP node4.41567 > node4.39188: UDP, length 113
03:28:12.816396 IP node4.39260 > node4.54038: UDP, length 113
03:28:12.816815 IP node4.39260 > node4.32788: UDP, length 113
03:28:12.816815 IP node4.39260 > node4.39188: UDP, length 113
03:28:12.816815 IP node4.39260 > node4.43338: UDP, length 113
03:28:12.816906 IP node4.39260 > node4.41567: UDP, length 113
03:28:12.818074 IP node4.32788 > node4.39260: UDP, length 113
03:28:12.818837 IP node4.41567 > node4.39260: UDP, length 113
03:28:12.819398 IP node4.34193 > node4.39260: UDP, length 113
03:28:12.819803 IP node4.43338 > node4.39260: UDP, length 113
03:28:12.820469 IP node4.33410 > node4.39260: UDP, length 113
03:28:12.827683 IP node4.54038 > node4.39260: UDP, length 113
03:28:12.828860 IP node4.39260 > node4.33410: UDP, length 113
03:28:12.879223 IP node4.33410 > node4.39614: UDP, length 113
03:28:12.879650 IP node4.43338 > node4.39614: UDP, length 113
03:28:12.879816 IP node4.41567 > node4.39614: UDP, length 113
03:28:12.879854 IP node4.54038 > node4.39614: UDP, length 113
03:28:12.880347 IP node4.34193 > node4.39614: UDP, length 113
03:28:12.909135 IP node4.39260 > node4.39614: UDP, length 113
03:28:12.927405 IP node4.39188 > node4.33410: UDP, length 113
03:28:12.946982 IP node4.39188 > node4.43338: UDP, length 113
03:28:12.948719 IP node4.39188 > node4.32788: UDP, length 113
03:28:12.950408 IP node4.39188 > node4.54038: UDP, length 113
03:28:12.950733 IP node4.39188 > node4.39260: UDP, length 113
03:28:12.950751 IP node4.39188 > node4.39614: UDP, length 113
03:28:12.950825 IP node4.39188 > node4.41567: UDP, length 113
03:28:13.041295 IP node4.32788 > node4.39614: UDP, length 113
03:28:13.086652 IP node4.39188 > node4.44436: UDP, length 113
03:28:13.089270 IP node4.34193 > node4.44436: UDP, length 113
03:28:13.089402 IP node4.41567 > node4.44436: UDP, length 113
03:28:13.093191 IP node4.32788 > node4.44436: UDP, length 113
03:28:13.096687 IP node4.54038 > node4.44436: UDP, length 113
03:28:13.106233 IP node4.43338 > node4.44436: UDP, length 113
03:28:13.107265 IP node4.39614 > node4.43338: UDP, length 112
03:28:13.108325 IP node4.39614 > node4.41567: UDP, length 112
03:28:13.109963 IP node4.39260 > node4.44436: UDP, length 113
03:28:13.112167 IP node4.39614 > node4.39188: UDP, length 112
03:28:13.112847 IP node4.39614 > node4.39260: UDP, length 112
03:28:13.113679 IP node4.39614 > node4.44436: UDP, length 112
03:28:13.118721 IP node4.39614 > node4.54038: UDP, length 112
03:28:13.137762 IP node4.33410 > node4.44436: UDP, length 113
03:28:13.145951 IP node4.41567 > node4.38447: UDP, length 113
03:28:13.146151 IP node4.39188 > node4.38447: UDP, length 113
03:28:13.146662 IP node4.43338 > node4.38447: UDP, length 113
03:28:13.148879 IP node4.32788 > node4.38447: UDP, length 113
03:28:13.149763 IP node4.33410 > node4.38447: UDP, length 113
03:28:13.150012 IP node4.34193 > node4.38447: UDP, length 113
03:28:13.150410 IP node4.54038 > node4.38447: UDP, length 113
03:28:13.153935 IP node4.39260 > node4.38447: UDP, length 113
03:28:13.160321 IP node4.39614 > node4.38447: UDP, length 112
03:28:13.183681 IP node4.43338 > node4.47792: UDP, length 113
03:28:13.184669 IP node4.54038 > node4.47792: UDP, length 113
03:28:13.184883 IP node4.32788 > node4.47792: UDP, length 113
03:28:13.185144 IP node4.41567 > node4.47792: UDP, length 113
03:28:13.185521 IP node4.34193 > node4.47792: UDP, length 113
03:28:13.185749 IP node4.33410 > node4.47792: UDP, length 113
03:28:13.187746 IP node4.47792 > node4.32788: UDP, length 113
03:28:13.189092 IP node4.47792 > node4.41567: UDP, length 113
03:28:13.190115 IP node4.47792 > node4.54038: UDP, length 113
03:28:13.190588 IP node4.47792 > node4.39188: UDP, length 113
03:28:13.193419 IP node4.47792 > node4.39260: UDP, length 113
03:28:13.194019 IP node4.47792 > node4.43338: UDP, length 113
03:28:13.195883 IP node4.39260 > node4.47792: UDP, length 113
03:28:13.196889 IP node4.39614 > node4.47792: UDP, length 112
03:28:13.197122 IP node4.39188 > node4.47792: UDP, length 113
03:28:13.212184 IP node4.47792 > node4.39614: UDP, length 113
03:28:13.216328 IP node4.47792 > node4.44436: UDP, length 113
03:28:13.226958 IP node4.47792 > node4.38447: UDP, length 113
03:28:13.343946 IP node4.32788 > node4.43338: UDP, length 87
03:28:13.344583 IP node4.43338 > node4.32788: UDP, length 94
03:28:13.437611 IP node4.39260 > node4.45119: UDP, length 113
03:28:13.438151 IP node4.34193 > node4.45119: UDP, length 113
03:28:13.438900 IP node4.32788 > node4.45119: UDP, length 113
03:28:13.439012 IP node4.33410 > node4.45119: UDP, length 113
03:28:13.439924 IP node4.41567 > node4.45119: UDP, length 113
03:28:13.441657 IP node4.54038 > node4.45119: UDP, length 113
03:28:13.447016 IP node4.47792 > node4.45119: UDP, length 113
03:28:13.447900 IP node4.39614 > node4.45119: UDP, length 112
03:28:13.449189 IP node4.39188 > node4.45119: UDP, length 113
03:28:13.521067 IP node4.44436 > node4.43338: UDP, length 113
03:28:13.558128 IP node4.43338 > node4.45119: UDP, length 113
03:28:13.559483 IP node4.39188 > node4.44728: UDP, length 113
03:28:13.560089 IP node4.32788 > node4.44728: UDP, length 113
03:28:13.560338 IP node4.33410 > node4.44728: UDP, length 113
03:28:13.560688 IP node4.34193 > node4.44728: UDP, length 113
03:28:13.561245 IP node4.39260 > node4.44728: UDP, length 113
03:28:13.561394 IP node4.54038 > node4.44728: UDP, length 113
03:28:13.563313 IP node4.44728 > node4.39188: UDP, length 113
03:28:13.565274 IP node4.47792 > node4.44728: UDP, length 113
03:28:13.566163 IP node4.43338 > node4.44728: UDP, length 113
03:28:13.566741 IP node4.44728 > node4.39260: UDP, length 113
03:28:13.567314 IP node4.44728 > node4.39614: UDP, length 113
03:28:13.568331 IP node4.44728 > node4.44436: UDP, length 113
03:28:13.568911 IP node4.44728 > node4.38447: UDP, length 113
03:28:13.569317 IP node4.44728 > node4.47792: UDP, length 113
03:28:13.582803 IP node4.44436 > node4.41567: UDP, length 113
03:28:13.583135 IP node4.44436 > node4.54038: UDP, length 113
03:28:13.583927 IP node4.44436 > node4.39188: UDP, length 113
03:28:13.584803 IP node4.44436 > node4.39260: UDP, length 113
03:28:13.585134 IP node4.44436 > node4.39614: UDP, length 113
03:28:13.586460 IP node4.44436 > node4.38447: UDP, length 113
03:28:13.586998 IP node4.44436 > node4.47792: UDP, length 113
03:28:13.603593 IP node4.44436 > node4.44728: UDP, length 113
03:28:13.603735 IP node4.44436 > node4.45119: UDP, length 113
03:28:13.616475 IP node4.38447 > node4.54038: UDP, length 113
03:28:13.616475 IP node4.38447 > node4.44436: UDP, length 113
03:28:13.617337 IP node4.38447 > node4.44728: UDP, length 113
03:28:13.617976 IP node4.38447 > node4.39188: UDP, length 113
03:28:13.618262 IP node4.38447 > node4.47792: UDP, length 113
03:28:13.618542 IP node4.38447 > node4.39260: UDP, length 113
03:28:13.618609 IP node4.38447 > node4.39614: UDP, length 113
03:28:13.618637 IP node4.38447 > node4.45119: UDP, length 113
03:28:13.618948 IP node4.38447 > node4.41567: UDP, length 113
03:28:13.621083 IP node4.41567 > node4.44728: UDP, length 113
03:28:13.630346 IP node4.41567 > node4.54038: UDP, length 87
03:28:13.644742 IP node4.54038 > node4.41567: UDP, length 94
03:28:13.687769 IP node4.38447 > node4.43338: UDP, length 113
03:28:13.746170 IP node4.44728 > node4.45119: UDP, length 113
03:28:13.814494 IP node4.39614 > node4.44728: UDP, length 112
03:28:13.877345 IP node4.41567 > node4.44358: UDP, length 113
03:28:13.878376 IP node4.44436 > node4.44358: UDP, length 113
03:28:13.878648 IP node4.39614 > node4.44358: UDP, length 112
03:28:13.879615 IP node4.32788 > node4.44358: UDP, length 113
03:28:13.880412 IP node4.39188 > node4.44358: UDP, length 113
03:28:13.880769 IP node4.33410 > node4.44358: UDP, length 113
03:28:13.881386 IP node4.34193 > node4.44358: UDP, length 113
03:28:13.881523 IP node4.43338 > node4.44358: UDP, length 113
03:28:13.884324 IP node4.44728 > node4.44358: UDP, length 113
03:28:13.885333 IP node4.38447 > node4.44358: UDP, length 113
03:28:13.909748 IP node4.39260 > node4.44358: UDP, length 113
03:28:13.922773 IP node4.45119 > node4.39260: UDP, length 113
03:28:13.924413 IP node4.45119 > node4.39614: UDP, length 113
03:28:13.924755 IP node4.45119 > node4.44436: UDP, length 113
03:28:13.925441 IP node4.45119 > node4.47792: UDP, length 113
03:28:13.925545 IP node4.45119 > node4.38447: UDP, length 113
03:28:13.932347 IP node4.54038 > node4.44358: UDP, length 113
03:28:13.964740 IP node4.45119 > node4.44728: UDP, length 113
03:28:13.965044 IP node4.45119 > node4.44358: UDP, length 113
03:28:14.010658 IP node4.47792 > node4.44358: UDP, length 113
03:28:14.014189 IP node4.39614 > node4.33600: UDP, length 112
03:28:14.016148 IP node4.33410 > node4.33600: UDP, length 113
03:28:14.017187 IP node4.47792 > node4.33600: UDP, length 113
03:28:14.017833 IP node4.32788 > node4.33600: UDP, length 113
03:28:14.018241 IP node4.44436 > node4.33600: UDP, length 113
03:28:14.019340 IP node4.34193 > node4.33600: UDP, length 113
03:28:14.020559 IP node4.43338 > node4.33600: UDP, length 113
03:28:14.021362 IP node4.38447 > node4.33600: UDP, length 113
03:28:14.023248 IP node4.34193 > node4.53588: UDP, length 113
03:28:14.023543 IP node4.39614 > node4.53588: UDP, length 112
03:28:14.024855 IP node4.32788 > node4.53588: UDP, length 113
03:28:14.025406 IP node4.38447 > node4.53588: UDP, length 113
03:28:14.025512 IP node4.43338 > node4.53588: UDP, length 113
03:28:14.025822 IP node4.44436 > node4.53588: UDP, length 113
03:28:14.026403 IP node4.45119 > node4.33600: UDP, length 113
03:28:14.026510 IP node4.33410 > node4.53588: UDP, length 113
03:28:14.027907 IP node4.45119 > node4.53588: UDP, length 113
03:28:14.028051 IP node4.47792 > node4.53588: UDP, length 113
03:28:14.029285 IP node4.44728 > node4.53588: UDP, length 113
03:28:14.034916 IP node4.44728 > node4.33600: UDP, length 113
03:28:14.082898 IP node4.54038 > node4.33600: UDP, length 113
03:28:14.083132 IP node4.54038 > node4.53588: UDP, length 113
03:28:14.089734 IP node4.41567 > node4.33600: UDP, length 113
03:28:14.091074 IP node4.41567 > node4.53588: UDP, length 113
03:28:14.147495 IP node4.39260 > node4.33600: UDP, length 113
03:28:14.147940 IP node4.39260 > node4.53588: UDP, length 113
03:28:14.150213 IP node4.44358 > node4.38447: UDP, length 113
03:28:14.150660 IP node4.44358 > node4.47792: UDP, length 113
03:28:14.192731 IP node4.55714 > node4.33600: UDP, length 113
03:28:14.193224 IP node4.55714 > node4.38447: UDP, length 113
03:28:14.193224 IP node4.41567 > node4.55714: UDP, length 113
03:28:14.193858 IP node4.55714 > node4.44436: UDP, length 113
03:28:14.194210 IP node4.55714 > node4.44728: UDP, length 113
03:28:14.194266 IP node4.55714 > node4.44358: UDP, length 113
03:28:14.194747 IP node4.55714 > node4.47792: UDP, length 113
03:28:14.194901 IP node4.55714 > node4.45119: UDP, length 113
03:28:14.194954 IP node4.55714 > node4.53588: UDP, length 113
03:28:14.198307 IP node4.44436 > node4.55714: UDP, length 113
03:28:14.199091 IP node4.34193 > node4.55714: UDP, length 113
03:28:14.199965 IP node4.43338 > node4.55714: UDP, length 113
03:28:14.200612 IP node4.33410 > node4.55714: UDP, length 113
03:28:14.200816 IP node4.47792 > node4.55714: UDP, length 113
03:28:14.201100 IP node4.32788 > node4.55714: UDP, length 113
03:28:14.205880 IP node4.44728 > node4.55714: UDP, length 113
03:28:14.209164 IP node4.45119 > node4.55714: UDP, length 113
03:28:14.212881 IP node4.38447 > node4.55714: UDP, length 113
03:28:14.226716 IP node4.32788 > node4.45712: UDP, length 113
03:28:14.227434 IP node4.34193 > node4.45712: UDP, length 113
03:28:14.227859 IP node4.47792 > node4.45712: UDP, length 113
03:28:14.228873 IP node4.44728 > node4.45712: UDP, length 113
03:28:14.230795 IP node4.44436 > node4.45712: UDP, length 113
03:28:14.230938 IP node4.41567 > node4.45712: UDP, length 113
03:28:14.232567 IP node4.55714 > node4.45712: UDP, length 113
03:28:14.233304 IP node4.43338 > node4.45712: UDP, length 113
03:28:14.236062 IP node4.38447 > node4.45712: UDP, length 113
03:28:14.236428 IP node4.33410 > node4.45712: UDP, length 113
03:28:14.238140 IP node4.39188 > node4.55714: UDP, length 113
03:28:14.238441 IP node4.39188 > node4.45712: UDP, length 113
03:28:14.238485 IP node4.39188 > node4.33600: UDP, length 113
03:28:14.238914 IP node4.39188 > node4.53588: UDP, length 113
03:28:14.240042 IP node4.45119 > node4.45712: UDP, length 113
03:28:14.264558 IP node4.33600 > node4.44436: UDP, length 113
03:28:14.266662 IP node4.33600 > node4.38447: UDP, length 113
03:28:14.267206 IP node4.33600 > node4.47792: UDP, length 113
03:28:14.271803 IP node4.54038 > node4.55714: UDP, length 113
03:28:14.271877 IP node4.54038 > node4.45712: UDP, length 113
03:28:14.334642 IP node4.44358 > node4.44436: UDP, length 113
03:28:14.342847 IP node4.33600 > node4.45119: UDP, length 113
03:28:14.343435 IP node4.53588 > node4.45712: UDP, length 113
03:28:14.343435 IP node4.33600 > node4.44728: UDP, length 113
03:28:14.343492 IP node4.53588 > node4.33600: UDP, length 113
03:28:14.343892 IP node4.53588 > node4.38447: UDP, length 113
03:28:14.344213 IP node4.33600 > node4.44358: UDP, length 113
03:28:14.344779 IP node4.53588 > node4.44436: UDP, length 113
03:28:14.344822 IP node4.53588 > node4.55714: UDP, length 113
03:28:14.344987 IP node4.33600 > node4.53588: UDP, length 113
03:28:14.345167 IP node4.53588 > node4.44728: UDP, length 113
03:28:14.345222 IP node4.53588 > node4.44358: UDP, length 113
03:28:14.345688 IP node4.53588 > node4.47792: UDP, length 113
03:28:14.345796 IP node4.53588 > node4.45119: UDP, length 113
03:28:14.361704 IP node4.33600 > node4.55714: UDP, length 113
03:28:14.366916 IP node4.33600 > node4.45712: UDP, length 113
03:28:14.382463 IP node4.44358 > node4.45119: UDP, length 113
03:28:14.384142 IP node4.44358 > node4.44728: UDP, length 113
03:28:14.387555 IP node4.44358 > node4.33600: UDP, length 113
03:28:14.388815 IP node4.44358 > node4.53588: UDP, length 113
03:28:14.397337 IP node4.39614 > node4.55714: UDP, length 112
03:28:14.397389 IP node4.39614 > node4.45712: UDP, length 112
03:28:14.406003 IP node4.39260 > node4.55714: UDP, length 113
03:28:14.406077 IP node4.39260 > node4.45712: UDP, length 113
03:28:14.420603 IP node4.45712 > node4.45119: UDP, length 113
03:28:14.421225 IP node4.44358 > node4.55714: UDP, length 113
03:28:14.421435 IP node4.44358 > node4.45712: UDP, length 113
03:28:14.421748 IP node4.45712 > node4.44728: UDP, length 113
03:28:14.423123 IP node4.45712 > node4.44358: UDP, length 113
03:28:14.424552 IP node4.45712 > node4.33600: UDP, length 113
03:28:14.426993 IP node4.45712 > node4.53588: UDP, length 113
03:28:14.515248 IP node4.39260 > node4.53935: UDP, length 113
03:28:14.515339 IP node4.41567 > node4.53935: UDP, length 113
03:28:14.515866 IP node4.54038 > node4.53935: UDP, length 113
03:28:14.515981 IP node4.39614 > node4.53935: UDP, length 112
03:28:14.516564 IP node4.32788 > node4.53935: UDP, length 113
03:28:14.516831 IP node4.44436 > node4.53935: UDP, length 113
03:28:14.517498 IP node4.38447 > node4.53935: UDP, length 113
03:28:14.519431 IP node4.34193 > node4.53935: UDP, length 113
03:28:14.520919 IP node4.47792 > node4.53935: UDP, length 113
03:28:14.521153 IP node4.43338 > node4.53935: UDP, length 113
03:28:14.522724 IP node4.39188 > node4.53935: UDP, length 113
03:28:14.530350 IP node4.33410 > node4.53935: UDP, length 113
03:28:14.532871 IP node4.41567 > node4.41317: UDP, length 113
03:28:14.533207 IP node4.54038 > node4.41317: UDP, length 113
03:28:14.533379 IP node4.33410 > node4.41317: UDP, length 113
03:28:14.534159 IP node4.32788 > node4.41317: UDP, length 113
03:28:14.535064 IP node4.39260 > node4.41317: UDP, length 113
03:28:14.535636 IP node4.44436 > node4.41317: UDP, length 113
03:28:14.535935 IP node4.38447 > node4.41317: UDP, length 113
03:28:14.536381 IP node4.34193 > node4.41317: UDP, length 113
03:28:14.541057 IP node4.43338 > node4.41317: UDP, length 113
03:28:14.541415 IP node4.47792 > node4.41317: UDP, length 113
03:28:14.544353 IP node4.39188 > node4.41317: UDP, length 113
03:28:14.558147 IP node4.39614 > node4.41317: UDP, length 112
03:28:14.590327 IP node4.33600 > node4.53935: UDP, length 113
03:28:14.592646 IP node4.45119 > node4.53935: UDP, length 113
03:28:14.592970 IP node4.53588 > node4.53935: UDP, length 113
03:28:14.603160 IP node4.33600 > node4.41317: UDP, length 113
03:28:14.613120 IP node4.55714 > node4.41317: UDP, length 113
03:28:14.629594 IP node4.45119 > node4.41317: UDP, length 113
03:28:14.631462 IP node4.55714 > node4.53935: UDP, length 113
03:28:14.632172 IP node4.44728 > node4.53935: UDP, length 113
03:28:14.633736 IP node4.41317 > node4.33600: UDP, length 113
03:28:14.634389 IP node4.41317 > node4.53588: UDP, length 113
03:28:14.639482 IP node4.41317 > node4.55714: UDP, length 113
03:28:14.639623 IP node4.41317 > node4.45712: UDP, length 113
03:28:14.661153 IP node4.44728 > node4.41317: UDP, length 113
03:28:14.663885 IP node4.44728 > node4.47907: UDP, length 113
03:28:14.664570 IP node4.39614 > node4.47907: UDP, length 112
03:28:14.664683 IP node4.39188 > node4.47907: UDP, length 113
03:28:14.664812 IP node4.54038 > node4.47907: UDP, length 113
03:28:14.665455 IP node4.41567 > node4.47907: UDP, length 113
03:28:14.665455 IP node4.38447 > node4.47907: UDP, length 113
03:28:14.665989 IP node4.44436 > node4.47907: UDP, length 113
03:28:14.666818 IP node4.39260 > node4.47907: UDP, length 113
03:28:14.667047 IP node4.32788 > node4.47907: UDP, length 113
03:28:14.667901 IP node4.34193 > node4.47907: UDP, length 113
03:28:14.667901 IP node4.45119 > node4.47907: UDP, length 113
03:28:14.669023 IP node4.47792 > node4.47907: UDP, length 113
03:28:14.669280 IP node4.55714 > node4.47907: UDP, length 113
03:28:14.669735 IP node4.33410 > node4.47907: UDP, length 113
03:28:14.670392 IP node4.43338 > node4.47907: UDP, length 113
03:28:14.683558 IP node4.53588 > node4.41317: UDP, length 113
03:28:14.683943 IP node4.33600 > node4.47907: UDP, length 113
03:28:14.702503 IP node4.53588 > node4.47907: UDP, length 113
03:28:14.721830 IP node4.45712 > node4.55714: UDP, length 113
03:28:14.763137 IP node4.39188 > node4.56052: UDP, length 113
03:28:14.763754 IP node4.54038 > node4.56052: UDP, length 113
03:28:14.764247 IP node4.47792 > node4.56052: UDP, length 113
03:28:14.764746 IP node4.39614 > node4.56052: UDP, length 112
03:28:14.764962 IP node4.34193 > node4.56052: UDP, length 113
03:28:14.765195 IP node4.41567 > node4.56052: UDP, length 113
03:28:14.765401 IP node4.39260 > node4.56052: UDP, length 113
03:28:14.765805 IP node4.33410 > node4.56052: UDP, length 113
03:28:14.766540 IP node4.32788 > node4.56052: UDP, length 113
03:28:14.766579 IP node4.43338 > node4.56052: UDP, length 113
03:28:14.767442 IP node4.44728 > node4.56052: UDP, length 113
03:28:14.768113 IP node4.53588 > node4.56052: UDP, length 113
03:28:14.768449 IP node4.38447 > node4.56052: UDP, length 113
03:28:14.773076 IP node4.53935 > node4.44358: UDP, length 113
03:28:14.773400 IP node4.53935 > node4.33600: UDP, length 113
03:28:14.773602 IP node4.53935 > node4.53588: UDP, length 113
03:28:14.781192 IP node4.44436 > node4.56052: UDP, length 113
03:28:14.784584 IP node4.41317 > node4.44358: UDP, length 113
03:28:14.794332 IP node4.33600 > node4.56052: UDP, length 113
03:28:14.804340 IP node4.41317 > node4.53935: UDP, length 113
03:28:14.805064 IP node4.44358 > node4.53935: UDP, length 113
03:28:14.808293 IP node4.55714 > node4.56052: UDP, length 113
03:28:14.809960 IP node4.41317 > node4.47907: UDP, length 113
03:28:14.810754 IP node4.41317 > node4.56052: UDP, length 113
03:28:14.815040 IP node4.45712 > node4.53935: UDP, length 113
03:28:14.815486 IP node4.45712 > node4.41317: UDP, length 113
03:28:14.816495 IP node4.45712 > node4.47907: UDP, length 113
03:28:14.817124 IP node4.45712 > node4.56052: UDP, length 113
03:28:14.823066 IP node4.34193 > node4.39355: UDP, length 113
03:28:14.823599 IP node4.39188 > node4.39355: UDP, length 113
03:28:14.824972 IP node4.32788 > node4.39355: UDP, length 113
03:28:14.825957 IP node4.47792 > node4.39355: UDP, length 113
03:28:14.826683 IP node4.54038 > node4.39355: UDP, length 113
03:28:14.828237 IP node4.38447 > node4.39355: UDP, length 113
03:28:14.828957 IP node4.39614 > node4.39355: UDP, length 112
03:28:14.829193 IP node4.41567 > node4.39355: UDP, length 113
03:28:14.830910 IP node4.43338 > node4.39355: UDP, length 113
03:28:14.832221 IP node4.33410 > node4.39355: UDP, length 113
03:28:14.832637 IP node4.39260 > node4.39355: UDP, length 113
03:28:14.833100 IP node4.33600 > node4.39355: UDP, length 113
03:28:14.834840 IP node4.53588 > node4.39355: UDP, length 113
03:28:14.835581 IP node4.45712 > node4.39355: UDP, length 113
03:28:14.864880 IP node4.55714 > node4.39355: UDP, length 113
03:28:14.871992 IP node4.47907 > node4.44358: UDP, length 113
03:28:14.872616 IP node4.47907 > node4.33600: UDP, length 113
03:28:14.873153 IP node4.47907 > node4.53588: UDP, length 113
03:28:14.873423 IP node4.47907 > node4.55714: UDP, length 113
03:28:14.873616 IP node4.47907 > node4.45712: UDP, length 113
03:28:14.895918 IP node4.45119 > node4.39355: UDP, length 113
03:28:14.896167 IP node4.45119 > node4.56052: UDP, length 113
03:28:14.901873 IP node4.44728 > node4.39355: UDP, length 113
03:28:14.907582 IP node4.44436 > node4.39355: UDP, length 113
03:28:14.909181 IP node4.45119 > node4.34193: UDP, length 113
03:28:14.911355 IP node4.44436 > node4.34193: UDP, length 113
03:28:14.912460 IP node4.39614 > node4.34193: UDP, length 112
03:28:14.912653 IP node4.39188 > node4.34193: UDP, length 113
03:28:14.914159 IP node4.41567 > node4.34193: UDP, length 113
03:28:14.914365 IP node4.47792 > node4.34193: UDP, length 113
03:28:14.914545 IP node4.54038 > node4.34193: UDP, length 113
03:28:14.915293 IP node4.33410 > node4.34193: UDP, length 113
03:28:14.915414 IP node4.43338 > node4.34193: UDP, length 113
03:28:14.916076 IP node4.39260 > node4.34193: UDP, length 113
03:28:14.918245 IP node4.33600 > node4.34193: UDP, length 113
03:28:14.918434 IP node4.53588 > node4.34193: UDP, length 113
03:28:14.919485 IP node4.32788 > node4.34193: UDP, length 113
03:28:14.927928 IP node4.39188 > node4.45280: UDP, length 113
03:28:14.928013 IP node4.47792 > node4.45280: UDP, length 113
03:28:14.928272 IP node4.53588 > node4.45280: UDP, length 113
03:28:14.930827 IP node4.33410 > node4.45280: UDP, length 113
03:28:14.931581 IP node4.54038 > node4.45280: UDP, length 113
03:28:14.931698 IP node4.43338 > node4.45280: UDP, length 113
03:28:14.938456 IP node4.39614 > node4.45280: UDP, length 112
03:28:14.941595 IP node4.32788 > node4.45280: UDP, length 113
03:28:14.942142 IP node4.41567 > node4.45280: UDP, length 113
03:28:14.943206 IP node4.39260 > node4.45280: UDP, length 113
03:28:14.945866 IP node4.33600 > node4.45280: UDP, length 113
03:28:14.947270 IP node4.55714 > node4.45280: UDP, length 113
03:28:14.947601 IP node4.55714 > node4.34193: UDP, length 113
03:28:14.969606 IP node4.34193 > node4.45280: UDP, length 113
03:28:14.993703 IP node4.44728 > node4.34193: UDP, length 113
03:28:14.994115 IP node4.44728 > node4.45280: UDP, length 113
03:28:15.027623 IP node4.41317 > node4.39355: UDP, length 113
03:28:15.029010 IP node4.45280 > node4.45712: UDP, length 113
03:28:15.029092 IP node4.45280 > node4.33600: UDP, length 113
03:28:15.029844 IP node4.45280 > node4.55714: UDP, length 113
03:28:15.030296 IP node4.45280 > node4.44728: UDP, length 113
03:28:15.030367 IP node4.45280 > node4.44358: UDP, length 113
03:28:15.030712 IP node4.45280 > node4.45119: UDP, length 113
03:28:15.030776 IP node4.45280 > node4.53588: UDP, length 113
03:28:15.032152 IP node4.53935 > node4.55714: UDP, length 113
03:28:15.032477 IP node4.53935 > node4.45712: UDP, length 113
03:28:15.033383 IP node4.47907 > node4.53935: UDP, length 113
03:28:15.033692 IP node4.47907 > node4.41317: UDP, length 113
03:28:15.035055 IP node4.47907 > node4.56052: UDP, length 113
03:28:15.035191 IP node4.47907 > node4.39355: UDP, length 113
03:28:15.035642 IP node4.47907 > node4.34193: UDP, length 113
03:28:15.046190 IP node4.53935 > node4.41317: UDP, length 113
03:28:15.047395 IP node4.53935 > node4.47907: UDP, length 113
03:28:15.048826 IP node4.53935 > node4.56052: UDP, length 113
03:28:15.049305 IP node4.53935 > node4.39355: UDP, length 113
03:28:15.049962 IP node4.53935 > node4.34193: UDP, length 113
03:28:15.050236 IP node4.53935 > node4.45280: UDP, length 113
03:28:15.056770 IP node4.41317 > node4.34193: UDP, length 113
03:28:15.057493 IP node4.41317 > node4.45280: UDP, length 113
03:28:15.067030 IP node4.38447 > node4.34193: UDP, length 113
03:28:15.068983 IP node4.38447 > node4.45280: UDP, length 113
03:28:15.070240 IP node4.45119 > node4.45280: UDP, length 113
03:28:15.077964 IP node4.44358 > node4.39355: UDP, length 113
03:28:15.078412 IP node4.44358 > node4.45280: UDP, length 113
03:28:15.078445 IP node4.44358 > node4.47907: UDP, length 113
03:28:15.078776 IP node4.44358 > node4.34193: UDP, length 113
03:28:15.078792 IP node4.44358 > node4.41317: UDP, length 113
03:28:15.079031 IP node4.44358 > node4.56052: UDP, length 113
03:28:15.118310 IP node4.45712 > node4.34193: UDP, length 113
03:28:15.129522 IP node4.50583 > node4.55714: UDP, length 113
03:28:15.129691 IP node4.43338 > node4.50583: UDP, length 113
03:28:15.130227 IP node4.50583 > node4.45712: UDP, length 113
03:28:15.130434 IP node4.50583 > node4.33600: UDP, length 113
03:28:15.132392 IP node4.45119 > node4.50583: UDP, length 113
03:28:15.133071 IP node4.38447 > node4.50583: UDP, length 113
03:28:15.133700 IP node4.39188 > node4.50583: UDP, length 113
03:28:15.134431 IP node4.41317 > node4.50583: UDP, length 113
03:28:15.134619 IP node4.32788 > node4.50583: UDP, length 113
03:28:15.135161 IP node4.47792 > node4.50583: UDP, length 113
03:28:15.136752 IP node4.55714 > node4.50583: UDP, length 113
03:28:15.137279 IP node4.39614 > node4.50583: UDP, length 112
03:28:15.137336 IP node4.41567 > node4.50583: UDP, length 113
03:28:15.137417 IP node4.54038 > node4.50583: UDP, length 113
03:28:15.138073 IP node4.33410 > node4.50583: UDP, length 113
03:28:15.140198 IP node4.34193 > node4.50583: UDP, length 113
03:28:15.140346 IP node4.39260 > node4.50583: UDP, length 113
03:28:15.144490 IP node4.50583 > node4.53588: UDP, length 113
03:28:15.147709 IP node4.45712 > node4.45280: UDP, length 113
03:28:15.149715 IP node4.45712 > node4.50583: UDP, length 113
03:28:15.159437 IP node4.53935 > node4.50583: UDP, length 113
03:28:15.175543 IP node4.56052 > node4.55714: UDP, length 113
03:28:15.175833 IP node4.53588 > node4.50583: UDP, length 113
03:28:15.175927 IP node4.56052 > node4.45712: UDP, length 113
03:28:15.177982 IP node4.56052 > node4.53935: UDP, length 113
03:28:15.178469 IP node4.56052 > node4.41317: UDP, length 113
03:28:15.179510 IP node4.45280 > node4.53935: UDP, length 113
03:28:15.179705 IP node4.45280 > node4.41317: UDP, length 113
03:28:15.180809 IP node4.45280 > node4.47907: UDP, length 113
03:28:15.181330 IP node4.45280 > node4.56052: UDP, length 113
03:28:15.181631 IP node4.45280 > node4.39355: UDP, length 113
03:28:15.182360 IP node4.45280 > node4.34193: UDP, length 113
03:28:15.182626 IP node4.39355 > node4.44358: UDP, length 113
03:28:15.214890 IP node4.47907 > node4.45280: UDP, length 113
03:28:15.216214 IP node4.47907 > node4.50583: UDP, length 113
03:28:15.219813 IP node4.44728 > node4.50583: UDP, length 113
03:28:15.223699 IP node4.39355 > node4.33600: UDP, length 113
03:28:15.223929 IP node4.39355 > node4.53588: UDP, length 113
03:28:15.233681 IP node4.44436 > node4.45280: UDP, length 113
03:28:15.242587 IP node4.39355 > node4.55714: UDP, length 113
03:28:15.246331 IP node4.39355 > node4.53935: UDP, length 113
03:28:15.246903 IP node4.39355 > node4.41317: UDP, length 113
03:28:15.247752 IP node4.39355 > node4.47907: UDP, length 113
03:28:15.249964 IP node4.39355 > node4.56052: UDP, length 113
03:28:15.250814 IP node4.39355 > node4.34193: UDP, length 113
03:28:15.251228 IP node4.39355 > node4.45280: UDP, length 113
03:28:15.261226 IP node4.39355 > node4.45712: UDP, length 113
03:28:15.261482 IP node4.39355 > node4.50583: UDP, length 113
03:28:15.268387 IP node4.33600 > node4.50583: UDP, length 113
03:28:15.283022 IP node4.45280 > node4.50583: UDP, length 113
03:28:15.284813 IP node4.56052 > node4.47907: UDP, length 113
03:28:15.287582 IP node4.56052 > node4.39355: UDP, length 113
03:28:15.290779 IP node4.56052 > node4.34193: UDP, length 113
03:28:15.291663 IP node4.56052 > node4.45280: UDP, length 113
03:28:15.293022 IP node4.56052 > node4.50583: UDP, length 113
03:28:15.306013 IP node4.50583 > node4.53935: UDP, length 113
03:28:15.306138 IP node4.50583 > node4.47907: UDP, length 113
03:28:15.306152 IP node4.50583 > node4.41317: UDP, length 113
03:28:15.325551 IP node4.50583 > node4.56052: UDP, length 113
03:28:15.326193 IP node4.50583 > node4.39355: UDP, length 113
03:28:15.336139 IP node4.50583 > node4.34193: UDP, length 113
03:28:15.336896 IP node4.50583 > node4.45280: UDP, length 113
03:28:15.346996 IP node4.44358 > node4.50583: UDP, length 113
03:28:15.459098 IP node4.54945 > node4.39355: UDP, length 113
03:28:15.459420 IP node4.45119 > node4.54945: UDP, length 113
03:28:15.459603 IP node4.54945 > node4.53935: UDP, length 113
03:28:15.459784 IP node4.54945 > node4.47907: UDP, length 113
03:28:15.459867 IP node4.54945 > node4.41317: UDP, length 113
03:28:15.460223 IP node4.54945 > node4.56052: UDP, length 113
03:28:15.460859 IP node4.39260 > node4.54945: UDP, length 113
03:28:15.461243 IP node4.33600 > node4.54945: UDP, length 113
03:28:15.462637 IP node4.55714 > node4.54945: UDP, length 113
03:28:15.462659 IP node4.39188 > node4.54945: UDP, length 113
03:28:15.463131 IP node4.53935 > node4.54945: UDP, length 113
03:28:15.463357 IP node4.43338 > node4.54945: UDP, length 113
03:28:15.465068 IP node4.41567 > node4.54945: UDP, length 113
03:28:15.466238 IP node4.53588 > node4.54945: UDP, length 113
03:28:15.467733 IP node4.54038 > node4.54945: UDP, length 113
03:28:15.468829 IP node4.33410 > node4.54945: UDP, length 113
03:28:15.468888 IP node4.34193 > node4.54945: UDP, length 113
03:28:15.469044 IP node4.32788 > node4.54945: UDP, length 113
03:28:15.469670 IP node4.45712 > node4.54945: UDP, length 113
03:28:15.469880 IP node4.47792 > node4.54945: UDP, length 113
03:28:15.469933 IP node4.39614 > node4.54945: UDP, length 112
03:28:15.470150 IP node4.47907 > node4.54945: UDP, length 113
03:28:15.470490 IP node4.41317 > node4.54945: UDP, length 113
03:28:15.470801 IP node4.44728 > node4.54945: UDP, length 113
03:28:15.471530 IP node4.45280 > node4.54945: UDP, length 113
03:28:15.472932 IP node4.56052 > node4.54945: UDP, length 113
03:28:15.476087 IP node4.39355 > node4.54945: UDP, length 113
03:28:15.480626 IP node4.44436 > node4.54945: UDP, length 113
03:28:15.480727 IP node4.54945 > node4.34193: UDP, length 113
03:28:15.481108 IP node4.54945 > node4.45280: UDP, length 113
03:28:15.483139 IP node4.44436 > node4.50583: UDP, length 113
03:28:15.487238 IP node4.50583 > node4.54945: UDP, length 113
03:28:15.510456 IP node4.54945 > node4.50583: UDP, length 113
03:28:15.541787 IP node4.45119 > node4.57274: UDP, length 113
03:28:15.542638 IP node4.44436 > node4.57274: UDP, length 113
03:28:15.542742 IP node4.43338 > node4.57274: UDP, length 113
03:28:15.548449 IP node4.53935 > node4.57274: UDP, length 113
03:28:15.548812 IP node4.45280 > node4.57274: UDP, length 113
03:28:15.549017 IP node4.55714 > node4.57274: UDP, length 113
03:28:15.549388 IP node4.39355 > node4.57274: UDP, length 113
03:28:15.550018 IP node4.53588 > node4.57274: UDP, length 113
03:28:15.550687 IP node4.56052 > node4.57274: UDP, length 113
03:28:15.551224 IP node4.41567 > node4.57274: UDP, length 113
03:28:15.555918 IP node4.33600 > node4.57274: UDP, length 113
03:28:15.558203 IP node4.39260 > node4.57274: UDP, length 113
03:28:15.558389 IP node4.39188 > node4.57274: UDP, length 113
03:28:15.558480 IP node4.32788 > node4.57274: UDP, length 113
03:28:15.559226 IP node4.33410 > node4.57274: UDP, length 113
03:28:15.559683 IP node4.41317 > node4.57274: UDP, length 113
03:28:15.560093 IP node4.47907 > node4.57274: UDP, length 113
03:28:15.560329 IP node4.45712 > node4.57274: UDP, length 113
03:28:15.560684 IP node4.44728 > node4.57274: UDP, length 113
03:28:15.561129 IP node4.47792 > node4.57274: UDP, length 113
03:28:15.561386 IP node4.54038 > node4.57274: UDP, length 113
03:28:15.561537 IP node4.50583 > node4.57274: UDP, length 113
03:28:15.561753 IP node4.34193 > node4.57274: UDP, length 113
03:28:15.573185 IP node4.39614 > node4.57274: UDP, length 112
03:28:15.579524 IP node4.54945 > node4.57274: UDP, length 113
03:28:15.581523 IP node4.44358 > node4.54945: UDP, length 113
03:28:15.581667 IP node4.44358 > node4.57274: UDP, length 113
03:28:15.624592 IP node4.38447 > node4.54945: UDP, length 113
03:28:15.624743 IP node4.38447 > node4.57274: UDP, length 113
03:28:15.654167 IP node4.57274 > node4.41317: UDP, length 113
03:28:15.656544 IP node4.57274 > node4.47907: UDP, length 113
03:28:15.703027 IP node4.57274 > node4.53935: UDP, length 113
03:28:15.703311 IP node4.57274 > node4.56052: UDP, length 113
03:28:15.705831 IP node4.57274 > node4.39355: UDP, length 113
03:28:15.706065 IP node4.57274 > node4.34193: UDP, length 113
03:28:15.708114 IP node4.57274 > node4.54945: UDP, length 113
03:28:15.708459 IP node4.57274 > node4.50583: UDP, length 113
03:28:15.709263 IP node4.57274 > node4.45280: UDP, length 113
03:28:16.123349 IP node4.45119 > node4.35246: UDP, length 113
03:28:16.123349 IP node4.35246 > node4.54945: UDP, length 113
03:28:16.123375 IP node4.35246 > node4.57274: UDP, length 113
03:28:16.123518 IP node4.39260 > node4.35246: UDP, length 113
03:28:16.124590 IP node4.39188 > node4.35246: UDP, length 113
03:28:16.125919 IP node4.32788 > node4.35246: UDP, length 113
03:28:16.126200 IP node4.33600 > node4.35246: UDP, length 113
03:28:16.126573 IP node4.54038 > node4.35246: UDP, length 113
03:28:16.126751 IP node4.47792 > node4.35246: UDP, length 113
03:28:16.127336 IP node4.43338 > node4.35246: UDP, length 113
03:28:16.128466 IP node4.44358 > node4.35246: UDP, length 113
03:28:16.128798 IP node4.34193 > node4.35246: UDP, length 113
03:28:16.129178 IP node4.33410 > node4.35246: UDP, length 113
03:28:16.131442 IP node4.53588 > node4.35246: UDP, length 113
03:28:16.131893 IP node4.39614 > node4.35246: UDP, length 112
03:28:16.132076 IP node4.41567 > node4.35246: UDP, length 113
03:28:16.132434 IP node4.38447 > node4.35246: UDP, length 113
03:28:16.133428 IP node4.55714 > node4.35246: UDP, length 113
03:28:16.134582 IP node4.44436 > node4.35246: UDP, length 113
03:28:16.135928 IP node4.45712 > node4.35246: UDP, length 113
03:28:16.137412 IP node4.44728 > node4.35246: UDP, length 113
03:28:16.137966 IP node4.47907 > node4.35246: UDP, length 113
03:28:16.140622 IP node4.45119 > node4.53702: UDP, length 113
03:28:16.141327 IP node4.45712 > node4.53702: UDP, length 113
03:28:16.141619 IP node4.39188 > node4.53702: UDP, length 113
03:28:16.141850 IP node4.32788 > node4.53702: UDP, length 113
03:28:16.141850 IP node4.53588 > node4.53702: UDP, length 113
03:28:16.142581 IP node4.44358 > node4.53702: UDP, length 113
03:28:16.142690 IP node4.33600 > node4.53702: UDP, length 113
03:28:16.142939 IP node4.47792 > node4.53702: UDP, length 113
03:28:16.143445 IP node4.54038 > node4.53702: UDP, length 113
03:28:16.143860 IP node4.38447 > node4.53702: UDP, length 113
03:28:16.144544 IP node4.43338 > node4.53702: UDP, length 113
03:28:16.144570 IP node4.34193 > node4.53702: UDP, length 113
03:28:16.144652 IP node4.44436 > node4.53702: UDP, length 113
03:28:16.145379 IP node4.41567 > node4.53702: UDP, length 113
03:28:16.146110 IP node4.33410 > node4.53702: UDP, length 113
03:28:16.146140 IP node4.39355 > node4.35246: UDP, length 113
03:28:16.146140 IP node4.39355 > node4.53702: UDP, length 113
03:28:16.146745 IP node4.39614 > node4.53702: UDP, length 112
03:28:16.147380 IP node4.44728 > node4.53702: UDP, length 113
03:28:16.147881 IP node4.47907 > node4.53702: UDP, length 113
03:28:16.149394 IP node4.55714 > node4.53702: UDP, length 113
03:28:16.150990 IP node4.39260 > node4.53702: UDP, length 113
03:28:16.152756 IP node4.57274 > node4.35246: UDP, length 113
03:28:16.152802 IP node4.57274 > node4.53702: UDP, length 113
03:28:16.159591 IP node4.50583 > node4.35246: UDP, length 113
03:28:16.159642 IP node4.50583 > node4.53702: UDP, length 113
03:28:16.188609 IP node4.56052 > node4.35246: UDP, length 113
03:28:16.190609 IP node4.41317 > node4.35246: UDP, length 113
03:28:16.190672 IP node4.41317 > node4.53702: UDP, length 113
03:28:16.221118 IP node4.56052 > node4.53702: UDP, length 113
03:28:16.248486 IP node4.35246 > node4.53702: UDP, length 113
03:28:16.261558 IP node4.54945 > node4.53702: UDP, length 113
03:28:16.264754 IP node4.54945 > node4.35246: UDP, length 113
03:28:16.282017 IP node4.53935 > node4.35246: UDP, length 113
03:28:16.282076 IP node4.53935 > node4.53702: UDP, length 113
03:28:16.295735 IP node4.45280 > node4.35246: UDP, length 113
03:28:16.295782 IP node4.45280 > node4.53702: UDP, length 113
03:28:16.525756 IP node4.53702 > node4.35246: UDP, length 111

