03:28:12.512782 IP node3.37181 > node2.35129: UDP, length 113
03:28:12.513186 IP node3.37181 > node2.36086: UDP, length 113
03:28:12.513326 IP node3.37181 > node2.50365: UDP, length 113
03:28:12.513791 IP node3.37181 > node2.50393: UDP, length 113
03:28:12.513944 IP node3.37181 > node2.60280: UDP, length 113
03:28:12.514091 IP node3.37181 > node2.49898: UDP, length 113
03:28:12.526292 IP node3.37181 > node4.34193: UDP, length 113
03:28:12.534485 IP node3.37181 > node2.53696: UDP, length 113
03:28:12.536633 IP node3.37181 > node2.52204: UDP, length 94
03:28:12.617836 IP node3.37181 > node2.52204: UDP, length 94
03:28:12.735554 IP node3.37181 > node2.39799: UDP, length 113
03:28:12.750309 IP node3.37181 > node4.33410: UDP, length 113
03:28:12.751065 IP node3.37181 > node2.52204: UDP, length 71
03:28:12.898261 IP node3.37181 > node2.52204: UDP, length 71
03:28:12.904781 IP node3.37181 > node4.32788: UDP, length 113
03:28:13.045165 IP node3.37181 > node2.52204: UDP, length 78
03:28:13.075091 IP node3.37181 > node4.43338: UDP, length 113
03:28:13.204310 IP node3.37181 > node4.41567: UDP, length 113
03:28:13.205043 IP node3.37181 > node4.54038: UDP, length 113
03:28:13.311793 IP node3.37181 > node4.39188: UDP, length 113
03:28:13.313704 IP node3.37181 > node2.52204: UDP, length 78
03:28:13.452772 IP node3.37181 > node4.39260: UDP, length 113
03:28:13.513253 IP node3.37181 > node4.39614: UDP, length 113
03:28:13.547551 IP node3.37181 > node2.44309: UDP, length 113
03:28:13.617940 IP node3.50931 > node4.33410: UDP, length 113
03:28:13.656873 IP node3.37181 > node2.59155: UDP, length 113
03:28:13.702363 IP node3.50931 > node2.52204: UDP, length 94
03:28:13.708174 IP node3.50931 > node4.32788: UDP, length 113
03:28:13.708356 IP node3.50931 > node4.43338: UDP, length 113
03:28:13.718013 IP node3.50931 > node4.54038: UDP, length 113
03:28:13.722618 IP node3.37181 > node4.44436: UDP, length 113
03:28:13.730367 IP node3.46151 > node4.54038: UDP, length 113
03:28:13.730663 IP node3.46151 > node2.44309: UDP, length 113
03:28:13.730781 IP node3.46151 > node2.59155: UDP, length 113
03:28:13.731198 IP node3.46151 > node4.32788: UDP, length 113
03:28:13.731320 IP node3.46151 > node4.39188: UDP, length 113
03:28:13.731441 IP node3.46151 > node4.39260: UDP, length 113
03:28:13.731558 IP node3.46151 > node4.43338: UDP, length 113
03:28:13.731673 IP node3.46151 > node4.41567: UDP, length 113
03:28:13.731832 IP node3.46151 > node4.39614: UDP, length 113
03:28:13.736733 IP node3.50931 > node4.41567: UDP, length 113
03:28:13.737061 IP node3.50931 > node4.39260: UDP, length 113
03:28:13.737204 IP node3.50931 > node4.39614: UDP, length 113
03:28:13.747334 IP node3.46151 > node4.44436: UDP, length 113
03:28:13.753479 IP node3.37181 > node2.56279: UDP, length 113
03:28:13.757149 IP node3.50931 > node2.59155: UDP, length 113
03:28:13.757345 IP node3.50931 > node4.39188: UDP, length 113
03:28:13.758872 IP node3.50931 > node4.44436: UDP, length 113
03:28:13.759065 IP node3.50931 > node2.56279: UDP, length 113
03:28:13.759273 IP node3.50931 > node2.44309: UDP, length 113
03:28:13.777137 IP node3.46151 > node2.56279: UDP, length 113
03:28:13.777554 IP node3.46151 > node2.52204: UDP, length 94
03:28:13.781320 IP node3.37181 > node4.38447: UDP, length 113
03:28:13.786066 IP node3.46151 > node4.38447: UDP, length 113
03:28:13.787517 IP node3.50931 > node4.38447: UDP, length 113
03:28:13.818122 IP node3.37181 > node4.47792: UDP, length 113
03:28:13.818809 IP node3.50931 > node4.47792: UDP, length 113
03:28:13.819051 IP node3.46151 > node4.47792: UDP, length 113
03:28:13.834145 IP node3.49469 > node4.43338: UDP, length 113
03:28:13.834527 IP node3.49469 > node4.54038: UDP, length 113
03:28:13.837592 IP node3.49469 > node4.41567: UDP, length 113
03:28:13.837872 IP node3.49469 > node4.39188: UDP, length 113
03:28:13.838469 IP node3.49469 > node4.39260: UDP, length 113
03:28:13.838940 IP node3.49469 > node4.39614: UDP, length 113
03:28:13.839205 IP node3.49469 > node2.44309: UDP, length 113
03:28:13.839469 IP node3.49469 > node2.59155: UDP, length 113
03:28:13.839723 IP node3.49469 > node4.44436: UDP, length 113
03:28:13.840199 IP node3.49469 > node2.56279: UDP, length 113
03:28:13.840572 IP node3.49469 > node4.38447: UDP, length 113
03:28:13.848909 IP node3.49469 > node4.47792: UDP, length 113
03:28:13.861721 IP node3.49469 > node2.52204: UDP, length 94
03:28:13.869622 IP node3.37181 > node2.39953: UDP, length 113
03:28:13.884405 IP node3.37181 > node2.60393: UDP, length 113
03:28:13.888477 IP node3.46151 > node2.39953: UDP, length 113
03:28:13.889647 IP node3.46151 > node2.60393: UDP, length 113
03:28:13.896141 IP node3.50931 > node2.60393: UDP, length 113
03:28:13.896458 IP node3.50931 > node2.39953: UDP, length 113
03:28:13.951080 IP node3.49469 > node2.60393: UDP, length 113
03:28:13.972588 IP node3.37181 > node2.52204: UDP, length 78
03:28:13.976457 IP node3.49469 > node2.39953: UDP, length 113
03:28:14.020783 IP node3.37181 > node2.45886: UDP, length 113
03:28:14.030660 IP node3.37181 > node2.34019: UDP, length 113
03:28:14.054438 IP node3.50931 > node2.59155: UDP, length 94
03:28:14.057083 IP node3.50931 > node2.34019: UDP, length 113
03:28:14.057209 IP node3.50931 > node2.45886: UDP, length 113
03:28:14.062847 IP node3.46151 > node2.34019: UDP, length 113
03:28:14.066951 IP node3.36125 > node4.41567: UDP, length 113
03:28:14.067577 IP node3.36125 > node4.54038: UDP, length 113
03:28:14.068825 IP node3.46151 > node2.56279: UDP, length 94
03:28:14.068917 IP node3.36125 > node4.39188: UDP, length 113
03:28:14.069585 IP node3.36125 > node4.39260: UDP, length 113
03:28:14.069991 IP node3.36125 > node4.39614: UDP, length 113
03:28:14.070795 IP node3.36125 > node2.44309: UDP, length 113
03:28:14.071090 IP node3.36125 > node2.59155: UDP, length 113
03:28:14.071391 IP node3.36125 > node4.44436: UDP, length 113
03:28:14.072419 IP node3.37181 > node4.45119: UDP, length 113
03:28:14.072684 IP node3.36125 > node2.56279: UDP, length 113
03:28:14.073076 IP node3.36125 > node4.38447: UDP, length 113
03:28:14.073304 IP node3.50931 > node4.45119: UDP, length 113
03:28:14.073482 IP node3.36125 > node4.47792: UDP, length 113
03:28:14.074465 IP node3.46151 > node4.45119: UDP, length 113
03:28:14.074543 IP node3.36125 > node2.39953: UDP, length 113
03:28:14.074653 IP node3.36125 > node2.60393: UDP, length 113
03:28:14.087624 IP node3.37181 > node2.50964: UDP, length 113
03:28:14.088599 IP node3.50931 > node2.50964: UDP, length 113
03:28:14.124857 IP node3.43708 > node4.43338: UDP, length 113
03:28:14.131041 IP node3.46151 > node2.45886: UDP, length 113
03:28:14.163728 IP node3.45401 > node4.41567: UDP, length 112
03:28:14.166217 IP node3.49469 > node2.34019: UDP, length 113
03:28:14.166357 IP node3.49469 > node4.45119: UDP, length 113
03:28:14.166448 IP node3.49469 > node2.50964: UDP, length 113
03:28:14.194085 IP node3.37181 > node4.44728: UDP, length 113
03:28:14.196862 IP node3.36125 > node2.52204: UDP, length 94
03:28:14.202095 IP node3.36125 > node2.34019: UDP, length 113
03:28:14.219850 IP node3.46151 > node4.44728: UDP, length 113
03:28:14.220203 IP node3.46151 > node2.50964: UDP, length 113
03:28:14.221177 IP node3.36125 > node4.45119: UDP, length 113
03:28:14.221378 IP node3.36125 > node2.45886: UDP, length 113
03:28:14.222323 IP node3.36125 > node2.50964: UDP, length 113
03:28:14.222789 IP node3.36125 > node4.44728: UDP, length 113
03:28:14.233296 IP node3.46151 > node2.52204: UDP, length 71
03:28:14.248862 IP node3.50931 > node4.44728: UDP, length 113
03:28:14.260559 IP node3.49469 > node4.44728: UDP, length 113
03:28:14.260705 IP node3.49469 > node2.45886: UDP, length 113
03:28:14.260960 IP node3.49469 > node2.52204: UDP, length 71
03:28:14.273207 IP node3.45401 > node4.54038: UDP, length 112
03:28:14.273544 IP node3.45401 > node4.39188: UDP, length 112
03:28:14.273662 IP node3.45401 > node4.39260: UDP, length 112
03:28:14.273819 IP node3.45401 > node4.39614: UDP, length 112
03:28:14.273947 IP node3.45401 > node2.44309: UDP, length 112
03:28:14.274400 IP node3.45401 > node2.59155: UDP, length 112
03:28:14.274600 IP node3.45401 > node4.44436: UDP, length 112
03:28:14.274844 IP node3.45401 > node2.56279: UDP, length 112
03:28:14.274960 IP node3.45401 > node4.38447: UDP, length 112
03:28:14.275158 IP node3.45401 > node4.47792: UDP, length 112
03:28:14.275567 IP node3.50931 > node2.52204: UDP, length 71
03:28:14.283106 IP node3.45401 > node2.52204: UDP, length 94
03:28:14.291232 IP node3.37181 > node2.37408: UDP, length 113
03:28:14.292323 IP node3.49469 > node2.37408: UDP, length 113
03:28:14.302907 IP node3.50931 > node2.52204: UDP, length 71
03:28:14.311445 IP node3.43708 > node4.41567: UDP, length 113
03:28:14.311830 IP node3.43708 > node4.54038: UDP, length 113
03:28:14.312080 IP node3.43708 > node4.39188: UDP, length 113
03:28:14.312887 IP node3.43708 > node4.39260: UDP, length 113
03:28:14.313220 IP node3.43708 > node4.39614: UDP, length 113
03:28:14.313510 IP node3.43708 > node2.44309: UDP, length 113
03:28:14.313768 IP node3.43708 > node2.59155: UDP, length 113
03:28:14.314020 IP node3.43708 > node4.44436: UDP, length 113
03:28:14.314501 IP node3.43708 > node2.56279: UDP, length 113
03:28:14.314748 IP node3.43708 > node4.38447: UDP, length 113
03:28:14.325258 IP node3.46151 > node2.37408: UDP, length 113
03:28:14.332843 IP node3.45401 > node2.39953: UDP, length 112
03:28:14.333252 IP node3.45401 > node2.60393: UDP, length 112
03:28:14.333501 IP node3.45401 > node2.45886: UDP, length 112
03:28:14.344534 IP node3.45401 > node4.44728: UDP, length 112
03:28:14.344664 IP node3.45401 > node2.34019: UDP, length 112
03:28:14.344785 IP node3.45401 > node4.45119: UDP, length 112
03:28:14.344879 IP node3.45401 > node2.37408: UDP, length 112
03:28:14.344961 IP node3.45401 > node2.50964: UDP, length 112
03:28:14.355992 IP node3.37181 > node2.46185: UDP, length 113
03:28:14.357483 IP node3.36125 > node2.37408: UDP, length 113
03:28:14.359015 IP node3.36125 > node2.46185: UDP, length 113
03:28:14.359647 IP node3.45401 > node2.46185: UDP, length 112
03:28:14.430140 IP node3.46151 > node2.46185: UDP, length 113
03:28:14.454492 IP node3.46151 > node2.52204: UDP, length 71
03:28:14.492844 IP node3.50931 > node2.46185: UDP, length 113
03:28:14.493548 IP node3.50931 > node2.37408: UDP, length 113
03:28:14.495102 IP node3.50931 > node4.39614: UDP, length 87
03:28:14.497562 IP node3.43708 > node2.60393: UDP, length 113
03:28:14.497727 IP node3.43708 > node2.39953: UDP, length 113
03:28:14.497812 IP node3.43708 > node4.47792: UDP, length 113
03:28:14.508660 IP node3.43708 > node2.52204: UDP, length 94
03:28:14.508792 IP node3.43708 > node2.45886: UDP, length 113
03:28:14.509157 IP node3.43708 > node2.34019: UDP, length 113
03:28:14.509446 IP node3.43708 > node4.45119: UDP, length 113
03:28:14.509606 IP node3.50931 > node4.44358: UDP, length 113
03:28:14.509711 IP node3.43708 > node2.50964: UDP, length 113
03:28:14.509875 IP node3.43708 > node4.44728: UDP, length 113
03:28:14.509977 IP node3.37181 > node4.44358: UDP, length 113
03:28:14.510196 IP node3.43708 > node2.37408: UDP, length 113
03:28:14.510431 IP node3.43708 > node2.46185: UDP, length 113
03:28:14.510720 IP node3.36125 > node4.44358: UDP, length 113
03:28:14.511489 IP node3.45401 > node4.44358: UDP, length 112
03:28:14.517012 IP node3.43708 > node4.44358: UDP, length 113
03:28:14.528540 IP node3.46151 > node4.44358: UDP, length 113
03:28:14.528689 IP node3.46151 > node2.52204: UDP, length 78
03:28:14.554790 IP node3.43708 > node2.59524: UDP, length 113
03:28:14.555372 IP node3.50931 > node2.59524: UDP, length 113
03:28:14.555648 IP node3.37181 > node2.59524: UDP, length 113
03:28:14.555717 IP node3.36125 > node2.59524: UDP, length 113
03:28:14.557090 IP node3.46151 > node2.59524: UDP, length 113
03:28:14.557382 IP node3.45401 > node2.59524: UDP, length 112
03:28:14.565942 IP node3.43726 > node2.59155: UDP, length 113
03:28:14.566781 IP node3.43726 > node2.56279: UDP, length 113
03:28:14.567116 IP node3.43726 > node4.38447: UDP, length 113
03:28:14.602393 IP node3.49469 > node2.46185: UDP, length 113
03:28:14.605691 IP node3.49469 > node2.59524: UDP, length 113
03:28:14.605878 IP node3.49469 > node4.44358: UDP, length 113
03:28:14.606021 IP node3.49469 > node2.52204: UDP, length 71
03:28:14.633880 IP node3.60737 > node2.59155: UDP, length 113
03:28:14.648015 IP node3.37181 > node4.33600: UDP, length 113
03:28:14.649289 IP node3.49469 > node4.33600: UDP, length 113
03:28:14.649923 IP node3.46151 > node4.33600: UDP, length 113
03:28:14.650874 IP node3.43708 > node4.33600: UDP, length 113
03:28:14.651131 IP node3.36125 > node4.33600: UDP, length 113
03:28:14.652702 IP node3.45401 > node4.33600: UDP, length 112
03:28:14.657635 IP node3.36125 > node4.53588: UDP, length 113
03:28:14.658092 IP node3.45401 > node4.53588: UDP, length 112
03:28:14.658306 IP node3.37181 > node4.53588: UDP, length 113
03:28:14.659132 IP node3.49469 > node4.53588: UDP, length 113
03:28:14.659358 IP node3.46151 > node4.53588: UDP, length 113
03:28:14.659925 IP node3.43708 > node4.53588: UDP, length 113
03:28:14.671102 IP node3.48528 > node2.59155: UDP, length 113
03:28:14.671867 IP node3.37181 > node2.56345: UDP, length 113
03:28:14.672921 IP node3.45401 > node2.56345: UDP, length 112
03:28:14.673513 IP node3.46151 > node2.56345: UDP, length 113
03:28:14.674370 IP node3.48528 > node2.56279: UDP, length 113
03:28:14.675309 IP node3.49469 > node2.56345: UDP, length 113
03:28:14.675391 IP node3.36125 > node2.56345: UDP, length 113
03:28:14.676390 IP node3.43708 > node2.56345: UDP, length 113
03:28:14.676824 IP node3.48528 > node4.38447: UDP, length 113
03:28:14.678416 IP node3.48528 > node4.47792: UDP, length 113
03:28:14.680604 IP node3.48528 > node2.39953: UDP, length 113
03:28:14.681086 IP node3.48528 > node2.60393: UDP, length 113
03:28:14.681721 IP node3.48528 > node2.45886: UDP, length 113
03:28:14.692062 IP node3.48528 > node4.44436: UDP, length 113
03:28:14.692358 IP node3.45401 > node2.57377: UDP, length 112
03:28:14.693194 IP node3.46151 > node2.57377: UDP, length 113
03:28:14.693785 IP node3.37181 > node2.57377: UDP, length 113
03:28:14.694755 IP node3.36125 > node2.57377: UDP, length 113
03:28:14.695499 IP node3.49469 > node2.57377: UDP, length 113
03:28:14.696407 IP node3.43708 > node2.57377: UDP, length 113
03:28:14.717799 IP node3.43726 > node2.52204: UDP, length 94
03:28:14.722410 IP node3.43726 > node4.44436: UDP, length 113
03:28:14.722915 IP node3.43726 > node4.47792: UDP, length 113
03:28:14.723703 IP node3.43726 > node2.39953: UDP, length 113
03:28:14.724255 IP node3.43726 > node2.60393: UDP, length 113
03:28:14.727259 IP node3.43726 > node2.45886: UDP, length 113
03:28:14.727513 IP node3.43726 > node2.34019: UDP, length 113
03:28:14.727757 IP node3.43726 > node4.45119: UDP, length 113
03:28:14.728443 IP node3.43726 > node2.50964: UDP, length 113
03:28:14.728885 IP node3.43726 > node4.44728: UDP, length 113
03:28:14.730160 IP node3.43726 > node2.37408: UDP, length 113
03:28:14.731467 IP node3.36125 > node2.54377: UDP, length 113
03:28:14.731592 IP node3.43726 > node2.46185: UDP, length 113
03:28:14.731745 IP node3.43726 > node4.44358: UDP, length 113
03:28:14.731992 IP node3.43726 > node2.59524: UDP, length 113
03:28:14.732111 IP node3.46151 > node2.54377: UDP, length 113
03:28:14.732469 IP node3.37181 > node2.54377: UDP, length 113
03:28:14.732604 IP node3.43726 > node4.33600: UDP, length 113
03:28:14.732823 IP node3.43726 > node4.53588: UDP, length 113
03:28:14.732925 IP node3.45401 > node2.54377: UDP, length 112
03:28:14.733207 IP node3.43726 > node2.56345: UDP, length 113
03:28:14.734624 IP node3.43708 > node2.54377: UDP, length 113
03:28:14.736991 IP node3.49469 > node2.54377: UDP, length 113
03:28:14.737453 IP node3.49469 > node2.52204: UDP, length 78
03:28:14.739881 IP node3.49097 > node4.44728: UDP, length 113
03:28:14.739987 IP node3.49097 > node2.60393: UDP, length 113
03:28:14.740078 IP node3.49097 > node2.56279: UDP, length 113
03:28:14.740231 IP node3.49097 > node2.39953: UDP, length 113
03:28:14.740330 IP node3.49097 > node2.34019: UDP, length 113
03:28:14.740409 IP node3.49097 > node4.47792: UDP, length 113
03:28:14.740591 IP node3.49097 > node4.38447: UDP, length 113
03:28:14.740667 IP node3.49097 > node4.45119: UDP, length 113
03:28:14.740745 IP node3.49097 > node2.45886: UDP, length 113
03:28:14.740827 IP node3.49097 > node2.50964: UDP, length 113
03:28:14.741883 IP node3.50931 > node2.57377: UDP, length 113
03:28:14.742115 IP node3.50931 > node4.33600: UDP, length 113
03:28:14.742249 IP node3.50931 > node2.56345: UDP, length 113
03:28:14.742328 IP node3.50931 > node2.54377: UDP, length 113
03:28:14.742416 IP node3.50931 > node2.52204: UDP, length 78
03:28:14.742563 IP node3.50931 > node4.53588: UDP, length 113
03:28:14.745122 IP node3.43726 > node2.57377: UDP, length 113
03:28:14.750042 IP node3.43726 > node2.54377: UDP, length 113
03:28:14.751081 IP node3.37181 > node2.42580: UDP, length 113
03:28:14.751450 IP node3.45401 > node2.42580: UDP, length 112
03:28:14.751520 IP node3.50931 > node2.42580: UDP, length 113
03:28:14.751580 IP node3.49097 > node2.37408: UDP, length 113
03:28:14.751762 IP node3.49097 > node2.46185: UDP, length 113
03:28:14.752469 IP node3.46151 > node2.42580: UDP, length 113
03:28:14.752797 IP node3.36125 > node2.42580: UDP, length 113
03:28:14.753162 IP node3.49469 > node2.42580: UDP, length 113
03:28:14.753362 IP node3.49097 > node4.44358: UDP, length 113
03:28:14.754647 IP node3.43708 > node2.42580: UDP, length 113
03:28:14.754965 IP node3.43726 > node2.42580: UDP, length 113
03:28:14.762504 IP node3.48528 > node2.46185: UDP, length 113
03:28:14.762612 IP node3.48528 > node4.44728: UDP, length 113
03:28:14.762688 IP node3.48528 > node2.34019: UDP, length 113
03:28:14.762763 IP node3.48528 > node4.45119: UDP, length 113
03:28:14.762839 IP node3.48528 > node2.37408: UDP, length 113
03:28:14.762920 IP node3.48528 > node2.50964: UDP, length 113
03:28:14.771295 IP node3.48528 > node2.52204: UDP, length 94
03:28:14.790475 IP node3.46391 > node2.39953: UDP, length 113
03:28:14.804804 IP node3.50931 > node2.45754: UDP, length 113
03:28:14.805275 IP node3.49469 > node2.45754: UDP, length 113
03:28:14.805620 IP node3.46151 > node2.45754: UDP, length 113
03:28:14.805835 IP node3.37181 > node2.45754: UDP, length 113
03:28:14.806411 IP node3.36125 > node2.45754: UDP, length 113
03:28:14.807857 IP node3.43708 > node2.45754: UDP, length 113
03:28:14.808686 IP node3.43726 > node2.45754: UDP, length 113
03:28:14.809371 IP node3.45401 > node2.45754: UDP, length 112
03:28:14.822638 IP node3.48528 > node4.44358: UDP, length 113
03:28:14.823145 IP node3.48528 > node2.59524: UDP, length 113
03:28:14.824379 IP node3.48528 > node4.33600: UDP, length 113
03:28:14.824610 IP node3.48528 > node4.53588: UDP, length 113
03:28:14.824811 IP node3.48528 > node2.56345: UDP, length 113
03:28:14.825022 IP node3.48528 > node2.57377: UDP, length 113
03:28:14.825227 IP node3.48528 > node2.54377: UDP, length 113
03:28:14.826127 IP node3.60737 > node2.52204: UDP, length 94
03:28:14.829418 IP node3.50931 > node4.55714: UDP, length 113
03:28:14.830352 IP node3.36125 > node4.55714: UDP, length 113
03:28:14.831136 IP node3.45401 > node4.55714: UDP, length 112
03:28:14.831537 IP node3.37181 > node4.55714: UDP, length 113
03:28:14.832450 IP node3.49469 > node4.55714: UDP, length 113
03:28:14.832585 IP node3.43708 > node4.55714: UDP, length 113
03:28:14.833159 IP node3.46151 > node4.55714: UDP, length 113
03:28:14.833692 IP node3.60737 > node4.44436: UDP, length 113
03:28:14.836165 IP node3.60737 > node4.38447: UDP, length 113
03:28:14.836469 IP node3.60737 > node4.47792: UDP, length 113
03:28:14.837442 IP node3.60737 > node2.60393: UDP, length 113
03:28:14.837550 IP node3.60737 > node2.39953: UDP, length 113
03:28:14.838962 IP node3.60737 > node2.34019: UDP, length 113
03:28:14.839139 IP node3.60737 > node2.45886: UDP, length 113
03:28:14.839284 IP node3.60737 > node4.45119: UDP, length 113
03:28:14.839456 IP node3.60737 > node2.50964: UDP, length 113
03:28:14.840105 IP node3.60737 > node2.46185: UDP, length 113
03:28:14.840202 IP node3.60737 > node4.44728: UDP, length 113
03:28:14.840331 IP node3.60737 > node2.37408: UDP, length 113
03:28:14.840547 IP node3.60737 > node2.59524: UDP, length 113
03:28:14.840676 IP node3.60737 > node4.44358: UDP, length 113
03:28:14.840843 IP node3.43726 > node4.55714: UDP, length 113
03:28:14.842515 IP node3.60737 > node4.55714: UDP, length 113
03:28:14.842772 IP node3.60737 > node2.57377: UDP, length 113
03:28:14.842875 IP node3.60737 > node4.33600: UDP, length 113
03:28:14.842986 IP node3.60737 > node2.56345: UDP, length 113
03:28:14.843091 IP node3.60737 > node2.54377: UDP, length 113
03:28:14.843200 IP node3.60737 > node2.42580: UDP, length 113
03:28:14.843402 IP node3.60737 > node2.45754: UDP, length 113
03:28:14.843508 IP node3.60737 > node4.53588: UDP, length 113
03:28:14.849698 IP node3.48528 > node2.42580: UDP, length 113
03:28:14.850779 IP node3.60737 > node2.56279: UDP, length 113
03:28:14.861334 IP node3.49097 > node2.59524: UDP, length 113
03:28:14.861989 IP node3.37181 > node4.45712: UDP, length 113
03:28:14.862407 IP node3.50931 > node4.45712: UDP, length 113
03:28:14.863290 IP node3.36125 > node4.45712: UDP, length 113
03:28:14.863716 IP node3.49469 > node4.45712: UDP, length 113
03:28:14.866358 IP node3.46151 > node4.45712: UDP, length 113
03:28:14.866907 IP node3.43708 > node4.45712: UDP, length 113
03:28:14.869969 IP node3.45401 > node4.45712: UDP, length 112
03:28:14.872418 IP node3.43726 > node4.45712: UDP, length 113
03:28:14.874093 IP node3.48528 > node2.45754: UDP, length 113
03:28:14.875179 IP node3.48528 > node4.55714: UDP, length 113
03:28:14.881997 IP node3.49097 > node4.53588: UDP, length 113
03:28:14.889787 IP node3.60737 > node4.45712: UDP, length 113
03:28:14.891959 IP node3.49097 > node2.56345: UDP, length 113
03:28:14.893315 IP node3.48528 > node4.45712: UDP, length 113
03:28:14.894061 IP node3.49097 > node2.57377: UDP, length 113
03:28:14.894517 IP node3.49097 > node2.54377: UDP, length 113
03:28:14.896976 IP node3.49097 > node4.33600: UDP, length 113
03:28:14.902015 IP node3.43708 > node2.46985: UDP, length 113
03:28:14.902740 IP node3.50931 > node2.46985: UDP, length 113
03:28:14.902924 IP node3.36125 > node2.46985: UDP, length 113
03:28:14.903534 IP node3.45401 > node2.46985: UDP, length 112
03:28:14.904145 IP node3.37181 > node2.46985: UDP, length 113
03:28:14.904924 IP node3.49469 > node2.46985: UDP, length 113
03:28:14.908368 IP node3.46151 > node2.46985: UDP, length 113
03:28:14.909208 IP node3.43726 > node2.46985: UDP, length 113
03:28:14.910532 IP node3.60737 > node2.46985: UDP, length 113
03:28:14.910983 IP node3.48528 > node2.46985: UDP, length 113
03:28:14.938539 IP node3.46391 > node2.52204: UDP, length 94
03:28:14.945873 IP node3.46391 > node2.60393: UDP, length 113
03:28:14.946742 IP node3.46391 > node2.45886: UDP, length 113
03:28:14.947840 IP node3.46391 > node2.34019: UDP, length 113
03:28:14.948107 IP node3.46391 > node4.45119: UDP, length 113
03:28:14.948691 IP node3.46391 > node2.50964: UDP, length 113
03:28:14.949531 IP node3.46391 > node4.44728: UDP, length 113
03:28:14.949788 IP node3.46391 > node2.37408: UDP, length 113
03:28:14.950000 IP node3.46391 > node2.46185: UDP, length 113
03:28:14.950795 IP node3.46391 > node4.44358: UDP, length 113
03:28:14.951224 IP node3.46391 > node2.59524: UDP, length 113
03:28:14.951869 IP node3.46391 > node4.33600: UDP, length 113
03:28:14.952094 IP node3.46391 > node4.53588: UDP, length 113
03:28:14.952467 IP node3.49097 > node2.52204: UDP, length 94
03:28:14.952648 IP node3.46391 > node2.56345: UDP, length 113
03:28:14.953099 IP node3.46391 > node2.57377: UDP, length 113
03:28:14.953732 IP node3.46391 > node2.54377: UDP, length 113
03:28:14.968660 IP node3.49097 > node4.55714: UDP, length 113
03:28:14.968946 IP node3.49097 > node4.45712: UDP, length 113
03:28:14.969036 IP node3.49097 > node2.42580: UDP, length 113
03:28:14.969120 IP node3.49097 > node2.45754: UDP, length 113
03:28:14.969553 IP node3.49097 > node2.46985: UDP, length 113
03:28:14.971734 IP node3.48726 > node2.52204: UDP, length 94
03:28:14.978764 IP node3.48726 > node4.47792: UDP, length 113
03:28:14.979885 IP node3.48726 > node2.39953: UDP, length 113
03:28:14.980180 IP node3.48726 > node2.60393: UDP, length 113
03:28:14.987314 IP node3.48726 > node2.34019: UDP, length 113
03:28:14.987813 IP node3.48726 > node4.45119: UDP, length 113
03:28:15.002605 IP node3.48726 > node2.59524: UDP, length 113
03:28:15.002817 IP node3.48726 > node2.46185: UDP, length 113
03:28:15.003024 IP node3.48726 > node4.44728: UDP, length 113
03:28:15.003176 IP node3.48726 > node4.44358: UDP, length 113
03:28:15.003323 IP node3.48726 > node2.37408: UDP, length 113
03:28:15.003453 IP node3.48726 > node2.45886: UDP, length 113
03:28:15.003658 IP node3.48726 > node2.50964: UDP, length 113
03:28:15.019575 IP node3.48726 > node4.33600: UDP, length 113
03:28:15.019911 IP node3.48726 > node4.53588: UDP, length 113
03:28:15.022432 IP node3.48726 > node2.57377: UDP, length 113
03:28:15.022554 IP node3.48726 > node2.56345: UDP, length 113
03:28:15.022669 IP node3.48726 > node2.54377: UDP, length 113
03:28:15.027437 IP node3.48726 > node4.55714: UDP, length 113
03:28:15.027630 IP node3.48726 > node2.42580: UDP, length 113
03:28:15.027758 IP node3.48726 > node2.45754: UDP, length 113
03:28:15.040976 IP node3.46391 > node2.42580: UDP, length 113
03:28:15.044391 IP node3.46391 > node2.45754: UDP, length 113
03:28:15.045196 IP node3.46391 > node4.55714: UDP, length 113
03:28:15.045467 IP node3.46391 > node4.45712: UDP, length 113
03:28:15.045851 IP node3.46391 > node2.46985: UDP, length 113
03:28:15.099325 IP node3.48726 > node4.45712: UDP, length 113
03:28:15.099546 IP node3.48726 > node2.46985: UDP, length 113
03:28:15.104614 IP node3.45401 > node2.54401: UDP, length 112
03:28:15.104884 IP node3.37181 > node2.54401: UDP, length 113
03:28:15.105038 IP node3.36125 > node2.54401: UDP, length 113
03:28:15.105421 IP node3.49097 > node2.54401: UDP, length 113
03:28:15.106095 IP node3.60737 > node2.54401: UDP, length 113
03:28:15.106364 IP node3.49469 > node2.54401: UDP, length 113
03:28:15.106435 IP node3.43708 > node2.54401: UDP, length 113
03:28:15.106620 IP node3.43726 > node2.54401: UDP, length 113
03:28:15.107240 IP node3.46391 > node2.54401: UDP, length 113
03:28:15.107286 IP node3.48528 > node2.54401: UDP, length 113
03:28:15.107478 IP node3.46151 > node2.54401: UDP, length 113
03:28:15.108795 IP node3.50931 > node2.54401: UDP, length 113
03:28:15.109774 IP node3.48726 > node2.54401: UDP, length 113
03:28:15.115980 IP node3.37181 > node2.52757: UDP, length 113
03:28:15.116787 IP node3.46391 > node2.52757: UDP, length 113
03:28:15.118641 IP node3.43708 > node2.52757: UDP, length 113
03:28:15.119091 IP node3.50931 > node2.52757: UDP, length 113
03:28:15.119338 IP node3.46151 > node2.52757: UDP, length 113
03:28:15.119503 IP node3.48528 > node2.52757: UDP, length 113
03:28:15.120378 IP node3.49469 > node2.52757: UDP, length 113
03:28:15.120998 IP node3.36125 > node2.52757: UDP, length 113
03:28:15.121654 IP node3.45401 > node2.52757: UDP, length 112
03:28:15.124801 IP node3.43726 > node2.52757: UDP, length 113
03:28:15.125398 IP node3.60737 > node2.52757: UDP, length 113
03:28:15.130113 IP node3.49097 > node2.52757: UDP, length 113
03:28:15.146202 IP node3.49469 > node2.52204: UDP, length 78
03:28:15.147783 IP node3.46151 > node2.52204: UDP, length 78
03:28:15.149126 IP node3.49469 > node4.53935: UDP, length 113
03:28:15.149731 IP node3.37181 > node4.53935: UDP, length 113
03:28:15.150295 IP node3.50931 > node4.53935: UDP, length 113
03:28:15.151284 IP node3.43708 > node4.53935: UDP, length 113
03:28:15.151536 IP node3.46151 > node4.53935: UDP, length 113
03:28:15.156880 IP node3.37181 > node2.52204: UDP, length 78
03:28:15.160389 IP node3.43708 > node2.50586: UDP, length 113
03:28:15.161189 IP node3.46151 > node2.50586: UDP, length 113
03:28:15.161980 IP node3.37181 > node2.50586: UDP, length 113
03:28:15.162146 IP node3.50931 > node2.50586: UDP, length 113
03:28:15.162512 IP node3.49469 > node2.50586: UDP, length 113
03:28:15.163355 IP node3.50931 > node2.52204: UDP, length 78
03:28:15.167674 IP node3.43708 > node4.41317: UDP, length 113
03:28:15.168013 IP node3.49469 > node4.41317: UDP, length 113
03:28:15.168949 IP node3.50931 > node4.41317: UDP, length 113
03:28:15.169504 IP node3.37181 > node4.41317: UDP, length 113
03:28:15.169710 IP node3.46151 > node4.41317: UDP, length 113
03:28:15.203396 IP node3.43708 > node2.46331: UDP, length 113
03:28:15.204646 IP node3.50931 > node2.46331: UDP, length 113
03:28:15.208084 IP node3.46151 > node2.46331: UDP, length 113
03:28:15.210600 IP node3.49469 > node2.46331: UDP, length 113
03:28:15.210832 IP node3.37181 > node2.46331: UDP, length 113
03:28:15.218898 IP node3.41805 > node2.60393: UDP, length 113
03:28:15.219095 IP node3.41805 > node2.39953: UDP, length 113
03:28:15.219201 IP node3.41805 > node2.34019: UDP, length 113
03:28:15.219292 IP node3.41805 > node4.47792: UDP, length 113
03:28:15.219444 IP node3.41805 > node4.45119: UDP, length 113
03:28:15.219541 IP node3.41805 > node2.45886: UDP, length 113
03:28:15.219629 IP node3.41805 > node2.50964: UDP, length 113
03:28:15.220139 IP node3.41805 > node2.52204: UDP, length 94
03:28:15.227387 IP node3.41805 > node4.55714: UDP, length 113
03:28:15.227637 IP node3.41805 > node2.54401: UDP, length 113
03:28:15.227739 IP node3.41805 > node2.59524: UDP, length 113
03:28:15.228155 IP node3.41805 > node2.46185: UDP, length 113
03:28:15.228251 IP node3.41805 > node2.57377: UDP, length 113
03:28:15.228369 IP node3.41805 > node4.45712: UDP, length 113
03:28:15.228527 IP node3.41805 > node4.44728: UDP, length 113
03:28:15.228626 IP node3.41805 > node4.44358: UDP, length 113
03:28:15.228721 IP node3.41805 > node4.33600: UDP, length 113
03:28:15.228922 IP node3.41805 > node2.56345: UDP, length 113
03:28:15.229069 IP node3.41805 > node2.54377: UDP, length 113
03:28:15.229175 IP node3.41805 > node2.42580: UDP, length 113
03:28:15.229340 IP node3.41805 > node2.37408: UDP, length 113
03:28:15.229525 IP node3.41805 > node2.45754: UDP, length 113
03:28:15.229624 IP node3.41805 > node4.53588: UDP, length 113
03:28:15.229882 IP node3.41805 > node2.52757: UDP, length 113
03:28:15.230362 IP node3.41805 > node2.46985: UDP, length 113
03:28:15.260097 IP node3.48528 > node2.50586: UDP, length 113
03:28:15.260345 IP node3.48528 > node4.53935: UDP, length 113
03:28:15.261927 IP node3.45401 > node2.50586: UDP, length 112
03:28:15.262038 IP node3.45401 > node4.53935: UDP, length 112
03:28:15.262148 IP node3.45401 > node4.41317: UDP, length 112
03:28:15.262395 IP node3.43726 > node2.50586: UDP, length 113
03:28:15.262596 IP node3.43726 > node4.53935: UDP, length 113
03:28:15.263951 IP node3.45401 > node2.46331: UDP, length 112
03:28:15.282879 IP node3.46391 > node4.53935: UDP, length 113
03:28:15.283554 IP node3.46391 > node2.50586: UDP, length 113
03:28:15.296985 IP node3.36125 > node2.50586: UDP, length 113
03:28:15.297377 IP node3.36125 > node2.46331: UDP, length 113
03:28:15.297544 IP node3.36125 > node4.53935: UDP, length 113
03:28:15.297666 IP node3.36125 > node4.41317: UDP, length 113
03:28:15.299486 IP node3.46151 > node4.47907: UDP, length 113
03:28:15.300315 IP node3.37181 > node4.47907: UDP, length 113
03:28:15.300576 IP node3.43708 > node4.47907: UDP, length 113
03:28:15.300693 IP node3.50931 > node4.47907: UDP, length 113
03:28:15.301012 IP node3.36125 > node4.47907: UDP, length 113
03:28:15.301141 IP node3.49469 > node4.47907: UDP, length 113
03:28:15.301759 IP node3.45401 > node4.47907: UDP, length 112
03:28:15.303231 IP node3.49097 > node2.50586: UDP, length 113
03:28:15.303453 IP node3.34615 > node2.59524: UDP, length 113
03:28:15.303530 IP node3.49097 > node2.46331: UDP, length 113
03:28:15.303590 IP node3.49097 > node4.53935: UDP, length 113
03:28:15.303689 IP node3.49097 > node4.47907: UDP, length 113
03:28:15.303748 IP node3.49097 > node4.41317: UDP, length 113
03:28:15.303906 IP node3.34615 > node2.46185: UDP, length 113
03:28:15.304381 IP node3.34615 > node4.44358: UDP, length 113
03:28:15.304480 IP node3.34615 > node2.37408: UDP, length 113
03:28:15.304754 IP node3.34615 > node4.44728: UDP, length 113
03:28:15.365539 IP node3.41805 > node2.50586: UDP, length 113
03:28:15.365805 IP node3.41805 > node2.46331: UDP, length 113
03:28:15.365905 IP node3.41805 > node4.47907: UDP, length 113
03:28:15.366010 IP node3.41805 > node4.41317: UDP, length 113
03:28:15.369156 IP node3.41805 > node4.53935: UDP, length 113
03:28:15.376269 IP node3.53435 > node2.52204: UDP, length 94
03:28:15.398734 IP node3.36125 > node4.56052: UDP, length 113
03:28:15.399776 IP node3.49469 > node4.56052: UDP, length 113
03:28:15.400107 IP node3.46151 > node4.56052: UDP, length 113
03:28:15.400885 IP node3.37181 > node4.56052: UDP, length 113
03:28:15.401549 IP node3.50931 > node4.56052: UDP, length 113
03:28:15.406286 IP node3.41805 > node4.56052: UDP, length 113
03:28:15.414596 IP node3.46391 > node4.41317: UDP, length 113
03:28:15.415522 IP node3.46391 > node2.46331: UDP, length 113
03:28:15.417164 IP node3.46391 > node4.47907: UDP, length 113
03:28:15.422723 IP node3.36125 > node4.44436: UDP, length 94
03:28:15.429097 IP node3.45401 > node4.56052: UDP, length 112
03:28:15.430413 IP node3.34615 > node4.55714: UDP, length 113
03:28:15.430551 IP node3.34615 > node2.54401: UDP, length 113
03:28:15.430713 IP node3.34615 > node2.57377: UDP, length 113
03:28:15.430788 IP node3.34615 > node4.45712: UDP, length 113
03:28:15.430922 IP node3.34615 > node4.33600: UDP, length 113
03:28:15.430992 IP node3.34615 > node2.56345: UDP, length 113
03:28:15.431067 IP node3.34615 > node2.54377: UDP, length 113
03:28:15.431142 IP node3.34615 > node4.53935: UDP, length 113
03:28:15.431223 IP node3.34615 > node2.42580: UDP, length 113
03:28:15.431343 IP node3.34615 > node2.45754: UDP, length 113
03:28:15.431415 IP node3.34615 > node4.53588: UDP, length 113
03:28:15.431546 IP node3.34615 > node2.52757: UDP, length 113
03:28:15.431721 IP node3.34615 > node2.46985: UDP, length 113
03:28:15.432907 IP node3.39029 > node2.46185: UDP, length 113
03:28:15.433118 IP node3.39029 > node2.37408: UDP, length 113
03:28:15.434569 IP node3.46391 > node2.52204: UDP, length 71
03:28:15.438162 IP node3.48528 > node2.46331: UDP, length 113
03:28:15.438281 IP node3.48528 > node4.41317: UDP, length 113
03:28:15.438926 IP node3.48528 > node4.47907: UDP, length 113
03:28:15.450565 IP node3.34615 > node2.50586: UDP, length 113
03:28:15.450986 IP node3.34615 > node2.52204: UDP, length 94
03:28:15.451065 IP node3.34615 > node2.46331: UDP, length 113
03:28:15.451143 IP node3.34615 > node4.41317: UDP, length 113
03:28:15.451219 IP node3.34615 > node4.56052: UDP, length 113
03:28:15.453638 IP node3.48528 > node2.52204: UDP, length 71
03:28:15.457733 IP node3.48528 > node2.42580: UDP, length 94
03:28:15.457916 IP node3.48528 > node4.56052: UDP, length 113
03:28:15.458414 IP node3.48528 > node4.39355: UDP, length 113
03:28:15.458953 IP node3.36125 > node4.39355: UDP, length 113
03:28:15.459546 IP node3.41805 > node4.39355: UDP, length 113
03:28:15.461228 IP node3.49469 > node4.39355: UDP, length 113
03:28:15.462222 IP node3.46151 > node4.39355: UDP, length 113
03:28:15.463268 IP node3.45401 > node4.39355: UDP, length 112
03:28:15.463561 IP node3.37181 > node4.39355: UDP, length 113
03:28:15.464460 IP node3.50931 > node4.39355: UDP, length 113
03:28:15.468798 IP node3.60737 > node2.50586: UDP, length 113
03:28:15.468934 IP node3.60737 > node4.53935: UDP, length 113
03:28:15.471789 IP node3.60737 > node2.46331: UDP, length 113
03:28:15.471894 IP node3.60737 > node4.47907: UDP, length 113
03:28:15.473004 IP node3.48726 > node2.52204: UDP, length 71
03:28:15.482034 IP node3.36125 > node2.35129: UDP, length 113
03:28:15.483074 IP node3.49469 > node2.35129: UDP, length 113
03:28:15.485604 IP node3.45401 > node2.35129: UDP, length 112
03:28:15.486327 IP node3.46151 > node2.35129: UDP, length 113
03:28:15.486487 IP node3.48528 > node2.35129: UDP, length 113
03:28:15.487694 IP node3.37181 > node2.35129: UDP, length 113
03:28:15.489986 IP node3.50931 > node2.35129: UDP, length 113
03:28:15.491597 IP node3.43708 > node4.39355: UDP, length 113
03:28:15.491711 IP node3.43708 > node2.35129: UDP, length 113
03:28:15.491788 IP node3.43708 > node4.56052: UDP, length 113
03:28:15.496670 IP node3.53435 > node2.46185: UDP, length 113
03:28:15.497504 IP node3.53435 > node4.44358: UDP, length 113
03:28:15.497749 IP node3.53435 > node2.59524: UDP, length 113
03:28:15.498731 IP node3.53435 > node4.33600: UDP, length 113
03:28:15.499067 IP node3.53435 > node4.53588: UDP, length 113
03:28:15.499407 IP node3.43708 > node2.60280: UDP, length 113
03:28:15.500160 IP node3.53435 > node2.56345: UDP, length 113
03:28:15.500407 IP node3.53435 > node2.57377: UDP, length 113
03:28:15.500617 IP node3.53435 > node2.54377: UDP, length 113
03:28:15.500665 IP node3.36125 > node2.60280: UDP, length 113
03:28:15.501194 IP node3.53435 > node2.42580: UDP, length 113
03:28:15.501590 IP node3.53435 > node2.45754: UDP, length 113
03:28:15.501796 IP node3.53435 > node4.55714: UDP, length 113
03:28:15.502032 IP node3.53435 > node4.45712: UDP, length 113
03:28:15.502643 IP node3.53435 > node2.50586: UDP, length 113
03:28:15.502737 IP node3.53435 > node2.54401: UDP, length 113
03:28:15.502841 IP node3.53435 > node4.53935: UDP, length 113
03:28:15.502943 IP node3.53435 > node2.52757: UDP, length 113
03:28:15.503037 IP node3.53435 > node2.46985: UDP, length 113
03:28:15.503251 IP node3.53435 > node2.46331: UDP, length 113
03:28:15.503689 IP node3.45401 > node2.60280: UDP, length 112
03:28:15.504358 IP node3.49469 > node2.60280: UDP, length 113
03:28:15.504847 IP node3.41805 > node2.35129: UDP, length 113
03:28:15.505266 IP node3.46151 > node2.60280: UDP, length 113
03:28:15.506185 IP node3.50931 > node2.60280: UDP, length 113
03:28:15.506398 IP node3.37181 > node2.60280: UDP, length 113
03:28:15.508382 IP node3.34615 > node4.47907: UDP, length 113
03:28:15.512796 IP node3.41805 > node2.60280: UDP, length 113
03:28:15.519961 IP node3.49097 > node2.52204: UDP, length 71
03:28:15.523565 IP node3.39029 > node2.52204: UDP, length 94
03:28:15.526925 IP node3.49097 > node2.52204: UDP, length 71
03:28:15.532232 IP node3.34615 > node2.35129: UDP, length 113
03:28:15.532435 IP node3.34615 > node2.60280: UDP, length 113
03:28:15.542754 IP node3.48726 > node2.52757: UDP, length 113
03:28:15.542986 IP node3.48726 > node2.50586: UDP, length 113
03:28:15.543116 IP node3.48726 > node4.53935: UDP, length 113
03:28:15.543817 IP node3.43708 > node4.34193: UDP, length 113
03:28:15.544711 IP node3.49469 > node4.34193: UDP, length 113
03:28:15.544807 IP node3.50931 > node4.34193: UDP, length 113
03:28:15.545303 IP node3.46151 > node4.34193: UDP, length 113
03:28:15.546290 IP node3.37181 > node4.34193: UDP, length 113
03:28:15.546850 IP node3.34615 > node4.34193: UDP, length 113
03:28:15.547235 IP node3.48726 > node2.46331: UDP, length 113
03:28:15.548248 IP node3.48726 > node4.47907: UDP, length 113
03:28:15.548326 IP node3.41805 > node4.34193: UDP, length 113
03:28:15.549028 IP node3.48726 > node4.56052: UDP, length 113
03:28:15.549355 IP node3.48726 > node4.39355: UDP, length 113
03:28:15.549618 IP node3.48726 > node2.35129: UDP, length 113
03:28:15.549971 IP node3.48726 > node2.60280: UDP, length 113
03:28:15.550282 IP node3.48726 > node4.34193: UDP, length 113
03:28:15.550535 IP node3.48726 > node2.52204: UDP, length 71
03:28:15.552329 IP node3.43726 > node4.39355: UDP, length 113
03:28:15.552459 IP node3.43726 > node2.35129: UDP, length 113
03:28:15.552565 IP node3.43726 > node2.57377: UDP, length 94
