03:28:11.647553 IP node4.34193 > node2.46331: UDP, length 113
03:28:11.650332 IP node4.34193 > node2.60280: UDP, length 113
03:28:11.651542 IP node4.34193 > node2.36086: UDP, length 113
03:28:11.651781 IP node4.34193 > node2.49898: UDP, length 113
03:28:11.652072 IP node4.34193 > node2.50365: UDP, length 113
03:28:11.652310 IP node4.34193 > node2.50393: UDP, length 113
03:28:11.655825 IP node4.34193 > node2.35129: UDP, length 113
03:28:11.880151 IP node4.34193 > node3.37181: UDP, length 113
03:28:11.899325 IP node4.34193 > node2.53696: UDP, length 113
03:28:12.045728 IP node4.34193 > node2.39799: UDP, length 113
03:28:12.331569 IP node4.33410 > node2.49898: UDP, length 113
03:28:12.331879 IP node4.33410 > node2.50365: UDP, length 113
03:28:12.331997 IP node4.33410 > node2.50393: UDP, length 113
03:28:12.332154 IP node4.33410 > node3.37181: UDP, length 113
03:28:12.332327 IP node4.33410 > node2.53696: UDP, length 113
03:28:12.337843 IP node4.32788 > node3.37181: UDP, length 113
03:28:12.340950 IP node4.33410 > node2.39799: UDP, length 113
03:28:12.341126 IP node4.33410 > node2.36086: UDP, length 113
03:28:12.347477 IP node4.33410 > node2.52204: UDP, length 94
03:28:12.417892 IP node4.32788 > node2.39799: UDP, length 113
03:28:12.418133 IP node4.32788 > node2.52204: UDP, length 94
03:28:12.418223 IP node4.32788 > node2.53696: UDP, length 113
03:28:12.436879 IP node4.43338 > node2.39799: UDP, length 113
03:28:12.438651 IP node4.43338 > node2.50393: UDP, length 113
03:28:12.438783 IP node4.43338 > node2.53696: UDP, length 113
03:28:12.438957 IP node4.43338 > node3.37181: UDP, length 113
03:28:12.468326 IP node4.43338 > node2.52204: UDP, length 94
03:28:12.568843 IP node4.41567 > node2.39799: UDP, length 113
03:28:12.569172 IP node4.41567 > node3.37181: UDP, length 113
03:28:12.571081 IP node4.54038 > node2.50365: UDP, length 113
03:28:12.571473 IP node4.54038 > node3.37181: UDP, length 113
03:28:12.571677 IP node4.54038 > node2.53696: UDP, length 113
03:28:12.572060 IP node4.54038 > node2.39799: UDP, length 113
03:28:12.574699 IP node4.54038 > node2.50393: UDP, length 113
03:28:12.577484 IP node4.41567 > node2.53696: UDP, length 113
03:28:12.618640 IP node4.41567 > node2.52204: UDP, length 94
03:28:12.657590 IP node4.54038 > node2.52204: UDP, length 94
03:28:12.712693 IP node4.33410 > node2.39799: UDP, length 94
03:28:12.738500 IP node4.43338 > node3.50931: UDP, length 113
03:28:12.738621 IP node4.34193 > node3.50931: UDP, length 113
03:28:12.739117 IP node4.32788 > node3.50931: UDP, length 113
03:28:12.739337 IP node4.54038 > node3.50931: UDP, length 113
03:28:12.739992 IP node4.41567 > node3.50931: UDP, length 113
03:28:12.781390 IP node4.33410 > node3.50931: UDP, length 113
03:28:12.816472 IP node4.39260 > node2.39799: UDP, length 113
03:28:12.816472 IP node4.39260 > node3.50931: UDP, length 113
03:28:12.838478 IP node4.39260 > node2.52204: UDP, length 94
03:28:12.851225 IP node4.32788 > node2.52204: UDP, length 71
03:28:12.913857 IP node4.34193 > node2.44309: UDP, length 113
03:28:12.914117 IP node4.43338 > node2.44309: UDP, length 113
03:28:12.914382 IP node4.33410 > node2.44309: UDP, length 113
03:28:12.914975 IP node4.41567 > node2.44309: UDP, length 113
03:28:12.915179 IP node4.54038 > node2.44309: UDP, length 113
03:28:12.929952 IP node4.33410 > node2.52204: UDP, length 71
03:28:12.934052 IP node4.33410 > node2.52204: UDP, length 71
03:28:12.934229 IP node4.39188 > node2.52204: UDP, length 94
03:28:12.950466 IP node4.39188 > node3.50931: UDP, length 113
03:28:12.950859 IP node4.39188 > node2.44309: UDP, length 113
03:28:13.024421 IP node4.43338 > node2.59155: UDP, length 113
03:28:13.024699 IP node4.54038 > node2.59155: UDP, length 113
03:28:13.024853 IP node4.33410 > node2.59155: UDP, length 113
03:28:13.024985 IP node4.34193 > node2.59155: UDP, length 113
03:28:13.025608 IP node4.41567 > node2.59155: UDP, length 113
03:28:13.026979 IP node4.39188 > node2.59155: UDP, length 113
03:28:13.041019 IP node4.32788 > node2.44309: UDP, length 113
03:28:13.041197 IP node4.32788 > node2.59155: UDP, length 113
03:28:13.041967 IP node4.39260 > node2.44309: UDP, length 113
03:28:13.046742 IP node4.39260 > node2.59155: UDP, length 113
03:28:13.048786 IP node4.32788 > node2.52204: UDP, length 71
03:28:13.097333 IP node4.32788 > node2.52204: UDP, length 78
03:28:13.102889 IP node4.41567 > node3.46151: UDP, length 113
03:28:13.103057 IP node4.32788 > node3.46151: UDP, length 113
03:28:13.103930 IP node4.34193 > node3.46151: UDP, length 113
03:28:13.104720 IP node4.33410 > node3.46151: UDP, length 113
03:28:13.105583 IP node4.54038 > node3.46151: UDP, length 113
03:28:13.106835 IP node4.43338 > node3.46151: UDP, length 113
03:28:13.110258 IP node4.39260 > node3.46151: UDP, length 113
03:28:13.111754 IP node4.39188 > node3.46151: UDP, length 113
03:28:13.112477 IP node4.39614 > node3.50931: UDP, length 112
03:28:13.113150 IP node4.39614 > node2.44309: UDP, length 112
03:28:13.113409 IP node4.39614 > node2.59155: UDP, length 112
03:28:13.114032 IP node4.39614 > node3.46151: UDP, length 112
03:28:13.119443 IP node4.43338 > node2.56279: UDP, length 113
03:28:13.120618 IP node4.32788 > node2.56279: UDP, length 113
03:28:13.124012 IP node4.54038 > node2.56279: UDP, length 113
03:28:13.124996 IP node4.34193 > node2.56279: UDP, length 113
03:28:13.125196 IP node4.41567 > node2.56279: UDP, length 113
03:28:13.125966 IP node4.39260 > node2.56279: UDP, length 113
03:28:13.127746 IP node4.39188 > node2.56279: UDP, length 113
03:28:13.133012 IP node4.39614 > node2.52204: UDP, length 94
03:28:13.137347 IP node4.33410 > node2.56279: UDP, length 113
03:28:13.158576 IP node4.39614 > node2.56279: UDP, length 112
03:28:13.175104 IP node4.41567 > node3.36125: UDP, length 113
03:28:13.179482 IP node4.43338 > node3.36125: UDP, length 113
03:28:13.179835 IP node4.54038 > node3.36125: UDP, length 113
03:28:13.180041 IP node4.33410 > node3.36125: UDP, length 113
03:28:13.180329 IP node4.34193 > node3.36125: UDP, length 113
03:28:13.181406 IP node4.32788 > node3.36125: UDP, length 113
03:28:13.193091 IP node4.39260 > node3.36125: UDP, length 113
03:28:13.193237 IP node4.47792 > node3.50931: UDP, length 113
03:28:13.194401 IP node4.47792 > node2.44309: UDP, length 113
03:28:13.194933 IP node4.47792 > node2.59155: UDP, length 113
03:28:13.196697 IP node4.39614 > node3.36125: UDP, length 112
03:28:13.196881 IP node4.39188 > node3.36125: UDP, length 113
03:28:13.199402 IP node4.41567 > node3.49469: UDP, length 113
03:28:13.200752 IP node4.43338 > node3.49469: UDP, length 113
03:28:13.201297 IP node4.54038 > node3.49469: UDP, length 113
03:28:13.202581 IP node4.39188 > node3.49469: UDP, length 113
03:28:13.202750 IP node4.34193 > node3.49469: UDP, length 113
03:28:13.209031 IP node4.32788 > node3.49469: UDP, length 113
03:28:13.211007 IP node4.39260 > node3.49469: UDP, length 113
03:28:13.211435 IP node4.39614 > node3.49469: UDP, length 112
03:28:13.220975 IP node4.33410 > node3.49469: UDP, length 113
03:28:13.225277 IP node4.47792 > node2.52204: UDP, length 94
03:28:13.226530 IP node4.47792 > node3.46151: UDP, length 113
03:28:13.226785 IP node4.47792 > node2.56279: UDP, length 113
03:28:13.227209 IP node4.47792 > node3.36125: UDP, length 113
03:28:13.228425 IP node4.39188 > node2.39953: UDP, length 113
03:28:13.228594 IP node4.33410 > node2.39953: UDP, length 113
03:28:13.228737 IP node4.41567 > node2.39953: UDP, length 113
03:28:13.230009 IP node4.43338 > node2.39953: UDP, length 113
03:28:13.231806 IP node4.54038 > node2.39953: UDP, length 113
03:28:13.232717 IP node4.34193 > node2.39953: UDP, length 113
03:28:13.233391 IP node4.32788 > node2.39953: UDP, length 113
03:28:13.234113 IP node4.39260 > node2.39953: UDP, length 113
03:28:13.234310 IP node4.47792 > node2.39953: UDP, length 113
03:28:13.234446 IP node4.47792 > node3.49469: UDP, length 113
03:28:13.235050 IP node4.39614 > node2.39953: UDP, length 112
03:28:13.250123 IP node4.43338 > node2.60393: UDP, length 113
03:28:13.250727 IP node4.33410 > node2.60393: UDP, length 113
03:28:13.251332 IP node4.34193 > node2.60393: UDP, length 113
03:28:13.251705 IP node4.47792 > node2.60393: UDP, length 113
03:28:13.266251 IP node4.32788 > node2.60393: UDP, length 113
03:28:13.267947 IP node4.54038 > node2.60393: UDP, length 113
03:28:13.270229 IP node4.41567 > node2.60393: UDP, length 113
03:28:13.270375 IP node4.39260 > node2.60393: UDP, length 113
03:28:13.273455 IP node4.39188 > node2.60393: UDP, length 113
03:28:13.278135 IP node4.39614 > node2.60393: UDP, length 112
03:28:13.279112 IP node4.33410 > node2.52204: UDP, length 78
03:28:13.285966 IP node4.54038 > node3.45401: UDP, length 113
03:28:13.289610 IP node4.41567 > node3.45401: UDP, length 113
03:28:13.289816 IP node4.33410 > node3.45401: UDP, length 113
03:28:13.291284 IP node4.34193 > node3.45401: UDP, length 113
03:28:13.293788 IP node4.39188 > node3.45401: UDP, length 113
03:28:13.294066 IP node4.43338 > node3.45401: UDP, length 113
03:28:13.294479 IP node4.47792 > node3.45401: UDP, length 113
03:28:13.294998 IP node4.32788 > node3.45401: UDP, length 113
03:28:13.296062 IP node4.39260 > node3.45401: UDP, length 113
03:28:13.298075 IP node4.39614 > node3.45401: UDP, length 112
03:28:13.344656 IP node4.33410 > node2.52204: UDP, length 78
03:28:13.358633 IP node4.32788 > node2.52204: UDP, length 78
03:28:13.386680 IP node4.33410 > node2.45886: UDP, length 113
03:28:13.387959 IP node4.34193 > node2.45886: UDP, length 113
03:28:13.389316 IP node4.32788 > node2.45886: UDP, length 113
03:28:13.395548 IP node4.33410 > node2.34019: UDP, length 113
03:28:13.395701 IP node4.32788 > node2.34019: UDP, length 113
03:28:13.396479 IP node4.34193 > node2.34019: UDP, length 113
03:28:13.396881 IP node4.41567 > node2.34019: UDP, length 113
03:28:13.398086 IP node4.54038 > node2.34019: UDP, length 113
03:28:13.401020 IP node4.39260 > node2.34019: UDP, length 113
03:28:13.426426 IP node4.47792 > node2.45886: UDP, length 113
03:28:13.426722 IP node4.47792 > node2.34019: UDP, length 113
03:28:13.447581 IP node4.39614 > node2.45886: UDP, length 112
03:28:13.447744 IP node4.39614 > node2.34019: UDP, length 112
03:28:13.448914 IP node4.39188 > node2.34019: UDP, length 113
03:28:13.449221 IP node4.39188 > node2.45886: UDP, length 113
03:28:13.453579 IP node4.34193 > node2.50964: UDP, length 113
03:28:13.454463 IP node4.39188 > node2.50964: UDP, length 113
03:28:13.456008 IP node4.54038 > node2.50964: UDP, length 113
03:28:13.457332 IP node4.32788 > node2.50964: UDP, length 113
03:28:13.457758 IP node4.39260 > node2.50964: UDP, length 113
03:28:13.458256 IP node4.41567 > node2.50964: UDP, length 113
03:28:13.459119 IP node4.33410 > node2.50964: UDP, length 113
03:28:13.461216 IP node4.47792 > node2.50964: UDP, length 113
03:28:13.467849 IP node4.39188 > node2.44309: UDP, length 94
03:28:13.478437 IP node4.41567 > node2.45886: UDP, length 113
03:28:13.488393 IP node4.39260 > node2.45886: UDP, length 113
03:28:13.489563 IP node4.34193 > node3.43708: UDP, length 113
03:28:13.491052 IP node4.32788 > node3.43708: UDP, length 113
03:28:13.491485 IP node4.39260 > node3.43708: UDP, length 113
03:28:13.492113 IP node4.33410 > node3.43708: UDP, length 113
03:28:13.492350 IP node4.39188 > node3.43708: UDP, length 113
03:28:13.493015 IP node4.41567 > node3.43708: UDP, length 113
03:28:13.495506 IP node4.54038 > node2.52204: UDP, length 71
03:28:13.496052 IP node4.54038 > node3.43708: UDP, length 113
03:28:13.497468 IP node4.47792 > node3.43708: UDP, length 113
03:28:13.540369 IP node4.44436 > node2.52204: UDP, length 94
03:28:13.555625 IP node4.39260 > node2.52204: UDP, length 71
03:28:13.557996 IP node4.43338 > node2.34019: UDP, length 113
03:28:13.563568 IP node4.44728 > node3.50931: UDP, length 113
03:28:13.566075 IP node4.43338 > node3.43708: UDP, length 113
03:28:13.566283 IP node4.43338 > node2.45886: UDP, length 113
03:28:13.566294 IP node4.43338 > node2.50964: UDP, length 113
03:28:13.567709 IP node4.44728 > node2.44309: UDP, length 113
03:28:13.567956 IP node4.44728 > node2.59155: UDP, length 113
03:28:13.568430 IP node4.44728 > node3.46151: UDP, length 113
03:28:13.568692 IP node4.44728 > node2.56279: UDP, length 113
03:28:13.569126 IP node4.44728 > node3.36125: UDP, length 113
03:28:13.571332 IP node4.44728 > node3.49469: UDP, length 113
03:28:13.571538 IP node4.44728 > node2.39953: UDP, length 113
03:28:13.571758 IP node4.44728 > node2.60393: UDP, length 113
03:28:13.571961 IP node4.43338 > node2.52204: UDP, length 71
03:28:13.571989 IP node4.44728 > node3.45401: UDP, length 113
03:28:13.584374 IP node4.44436 > node3.50931: UDP, length 113
03:28:13.585383 IP node4.44436 > node2.44309: UDP, length 113
03:28:13.585711 IP node4.44436 > node2.59155: UDP, length 113
03:28:13.585967 IP node4.44436 > node3.46151: UDP, length 113
03:28:13.586206 IP node4.44436 > node2.56279: UDP, length 113
03:28:13.586677 IP node4.44436 > node3.36125: UDP, length 113
03:28:13.587199 IP node4.44436 > node3.49469: UDP, length 113
03:28:13.587445 IP node4.44436 > node2.39953: UDP, length 113
03:28:13.587688 IP node4.44436 > node2.60393: UDP, length 113
03:28:13.603488 IP node4.44436 > node3.43708: UDP, length 113
03:28:13.603654 IP node4.44436 > node2.34019: UDP, length 113
03:28:13.603770 IP node4.44436 > node2.45886: UDP, length 113
03:28:13.603932 IP node4.44436 > node2.50964: UDP, length 113
03:28:13.603932 IP node4.44436 > node3.45401: UDP, length 113
03:28:13.608949 IP node4.41567 > node2.52204: UDP, length 71
03:28:13.616676 IP node4.38447 > node2.44309: UDP, length 113
03:28:13.616908 IP node4.38447 > node2.59155: UDP, length 113
03:28:13.616992 IP node4.38447 > node3.50931: UDP, length 113
03:28:13.617122 IP node4.38447 > node3.43708: UDP, length 113
03:28:13.617371 IP node4.38447 > node2.60393: UDP, length 113
03:28:13.617531 IP node4.38447 > node2.56279: UDP, length 113
03:28:13.617707 IP node4.38447 > node2.52204: UDP, length 94
03:28:13.617824 IP node4.38447 > node3.36125: UDP, length 113
03:28:13.618028 IP node4.38447 > node2.39953: UDP, length 113
03:28:13.618109 IP node4.38447 > node2.34019: UDP, length 113
03:28:13.618303 IP node4.38447 > node3.49469: UDP, length 113
03:28:13.618415 IP node4.38447 > node3.46151: UDP, length 113
03:28:13.618688 IP node4.38447 > node2.45886: UDP, length 113
03:28:13.618820 IP node4.38447 > node2.50964: UDP, length 113
03:28:13.618957 IP node4.38447 > node3.45401: UDP, length 113
03:28:13.642951 IP node4.54038 > node2.45886: UDP, length 113
03:28:13.653977 IP node4.39188 > node2.52204: UDP, length 71
03:28:13.656919 IP node4.32788 > node2.37408: UDP, length 113
03:28:13.657487 IP node4.39260 > node2.37408: UDP, length 113
03:28:13.658125 IP node4.34193 > node2.37408: UDP, length 113
03:28:13.658757 IP node4.33410 > node2.37408: UDP, length 113
03:28:13.659864 IP node4.54038 > node2.37408: UDP, length 113
03:28:13.660362 IP node4.41567 > node2.37408: UDP, length 113
03:28:13.661530 IP node4.47792 > node2.37408: UDP, length 113
03:28:13.664464 IP node4.39260 > node2.52204: UDP, length 71
03:28:13.664948 IP node4.44436 > node2.37408: UDP, length 113
03:28:13.700909 IP node4.38447 > node2.37408: UDP, length 113
03:28:13.715984 IP node4.43338 > node2.37408: UDP, length 113
03:28:13.719163 IP node4.43338 > node2.52204: UDP, length 71
03:28:13.719777 IP node4.44728 > node2.52204: UDP, length 94
03:28:13.721794 IP node4.54038 > node2.46185: UDP, length 113
03:28:13.722666 IP node4.43338 > node2.46185: UDP, length 113
03:28:13.723218 IP node4.34193 > node2.46185: UDP, length 113
03:28:13.724032 IP node4.33410 > node2.46185: UDP, length 113
03:28:13.726226 IP node4.32788 > node2.46185: UDP, length 113
03:28:13.728684 IP node4.38447 > node2.46185: UDP, length 113
03:28:13.733316 IP node4.44436 > node2.46185: UDP, length 113
03:28:13.737197 IP node4.33410 > node3.43726: UDP, length 113
03:28:13.738204 IP node4.34193 > node3.43726: UDP, length 113
03:28:13.738733 IP node4.47792 > node2.52204: UDP, length 71
03:28:13.738883 IP node4.32788 > node3.43726: UDP, length 113
03:28:13.740462 IP node4.43338 > node3.43726: UDP, length 113
03:28:13.741080 IP node4.47792 > node2.46185: UDP, length 113
03:28:13.741260 IP node4.47792 > node2.52204: UDP, length 71
03:28:13.741280 IP node4.47792 > node3.43726: UDP, length 113
03:28:13.741771 IP node4.54038 > node3.43726: UDP, length 113
03:28:13.742214 IP node4.44436 > node3.43726: UDP, length 113
03:28:13.744359 IP node4.44728 > node2.34019: UDP, length 113
03:28:13.744451 IP node4.44728 > node2.45886: UDP, length 113
03:28:13.746016 IP node4.44728 > node3.43708: UDP, length 113
03:28:13.746181 IP node4.44728 > node2.37408: UDP, length 113
03:28:13.746269 IP node4.44728 > node2.50964: UDP, length 113
03:28:13.746458 IP node4.44728 > node2.46185: UDP, length 113
03:28:13.746539 IP node4.44728 > node3.43726: UDP, length 113
03:28:13.756752 IP node4.54038 > node2.52204: UDP, length 71
03:28:13.757981 IP node4.38447 > node3.43726: UDP, length 113
03:28:13.766208 IP node4.39188 > node2.46185: UDP, length 113
03:28:13.766421 IP node4.39188 > node2.37408: UDP, length 113
03:28:13.766497 IP node4.39188 > node3.43726: UDP, length 113
03:28:13.778087 IP node4.33410 > node2.52204: UDP, length 472
03:28:13.793222 IP node4.41567 > node2.46185: UDP, length 113
03:28:13.793420 IP node4.41567 > node3.43726: UDP, length 113
03:28:13.796841 IP node4.41567 > node2.52204: UDP, length 71
03:28:13.809313 IP node4.39614 > node3.43708: UDP, length 112
03:28:13.813225 IP node4.39614 > node2.52204: UDP, length 71
03:28:13.813444 IP node4.39614 > node2.50964: UDP, length 112
03:28:13.814365 IP node4.39614 > node2.46185: UDP, length 112
03:28:13.814542 IP node4.39614 > node2.37408: UDP, length 112
03:28:13.814659 IP node4.39614 > node3.43726: UDP, length 112
03:28:13.827715 IP node4.39188 > node2.52204: UDP, length 71
03:28:13.857779 IP node4.39260 > node2.46185: UDP, length 113
03:28:13.858670 IP node4.39260 > node3.43726: UDP, length 113
03:28:13.861289 IP node4.39614 > node3.50931: UDP, length 94
03:28:13.877525 IP node4.39614 > node2.52204: UDP, length 71
03:28:13.920393 IP node4.33410 > node2.59524: UDP, length 113
03:28:13.921557 IP node4.32788 > node2.59524: UDP, length 113
03:28:13.924522 IP node4.45119 > node2.44309: UDP, length 113
03:28:13.924945 IP node4.45119 > node2.59155: UDP, length 113
03:28:13.925076 IP node4.45119 > node2.56279: UDP, length 113
03:28:13.925114 IP node4.41567 > node2.59524: UDP, length 113
03:28:13.925215 IP node4.45119 > node3.46151: UDP, length 113
03:28:13.925420 IP node4.45119 > node3.36125: UDP, length 113
03:28:13.925652 IP node4.45119 > node2.60393: UDP, length 113
03:28:13.925652 IP node4.45119 > node2.39953: UDP, length 113
03:28:13.925740 IP node4.45119 > node3.49469: UDP, length 113
03:28:13.926018 IP node4.45119 > node3.45401: UDP, length 113
03:28:13.926280 IP node4.34193 > node2.59524: UDP, length 113
03:28:13.928132 IP node4.39188 > node2.59524: UDP, length 113
03:28:13.928638 IP node4.43338 > node2.59524: UDP, length 113
03:28:13.929497 IP node4.44436 > node2.59524: UDP, length 113
03:28:13.931112 IP node4.44728 > node2.59524: UDP, length 113
03:28:13.932136 IP node4.54038 > node2.59524: UDP, length 113
03:28:13.933489 IP node4.38447 > node2.59524: UDP, length 113
03:28:13.959862 IP node4.41567 > node3.46391: UDP, length 113
03:28:13.961163 IP node4.33410 > node3.46391: UDP, length 113
03:28:13.961465 IP node4.32788 > node3.46391: UDP, length 113
03:28:13.961730 IP node4.34193 > node3.46391: UDP, length 113
03:28:13.962964 IP node4.43338 > node3.46391: UDP, length 113
03:28:13.963178 IP node4.39614 > node3.46391: UDP, length 112
03:28:13.963637 IP node4.44436 > node3.46391: UDP, length 113
03:28:13.963853 IP node4.45119 > node2.52204: UDP, length 94
03:28:13.964166 IP node4.45119 > node3.43708: UDP, length 113
03:28:13.964166 IP node4.38447 > node3.46391: UDP, length 113
03:28:13.964343 IP node4.45119 > node2.34019: UDP, length 113
03:28:13.964435 IP node4.45119 > node2.45886: UDP, length 113
03:28:13.964523 IP node4.45119 > node2.50964: UDP, length 113
03:28:13.964647 IP node4.45119 > node2.46185: UDP, length 113
03:28:13.964740 IP node4.45119 > node2.37408: UDP, length 113
03:28:13.964899 IP node4.45119 > node3.43726: UDP, length 113
03:28:13.964948 IP node4.45119 > node2.59524: UDP, length 113
03:28:13.965074 IP node4.45119 > node3.46391: UDP, length 113
03:28:13.965761 IP node4.44728 > node3.46391: UDP, length 113
03:28:13.977033 IP node4.39188 > node3.46391: UDP, length 113
03:28:13.989271 IP node4.41567 > node3.60737: UDP, length 113
03:28:13.989373 IP node4.34193 > node3.60737: UDP, length 113
03:28:13.992577 IP node4.32788 > node3.60737: UDP, length 113
03:28:13.993194 IP node4.33410 > node3.60737: UDP, length 113
03:28:13.993391 IP node4.39614 > node3.60737: UDP, length 112
03:28:13.993817 IP node4.43338 > node3.60737: UDP, length 113
03:28:13.994502 IP node4.44436 > node3.60737: UDP, length 113
03:28:13.995669 IP node4.38447 > node3.60737: UDP, length 113
03:28:13.995943 IP node4.44728 > node3.60737: UDP, length 113
03:28:14.000067 IP node4.43338 > node2.52204: UDP, length 78
03:28:14.001623 IP node4.45119 > node3.60737: UDP, length 113
03:28:14.010394 IP node4.47792 > node2.59524: UDP, length 113
03:28:14.010707 IP node4.47792 > node3.60737: UDP, length 113
03:28:14.010816 IP node4.47792 > node3.46391: UDP, length 113
03:28:14.029942 IP node4.44436 > node3.48528: UDP, length 113
03:28:14.030072 IP node4.33410 > node3.48528: UDP, length 113
03:28:14.030192 IP node4.47792 > node3.48528: UDP, length 113
03:28:14.030731 IP node4.45119 > node3.48528: UDP, length 113
03:28:14.031196 IP node4.39614 > node3.48528: UDP, length 112
03:28:14.032016 IP node4.34193 > node3.48528: UDP, length 113
03:28:14.033086 IP node4.43338 > node3.48528: UDP, length 113
03:28:14.033768 IP node4.32788 > node3.48528: UDP, length 113
03:28:14.034337 IP node4.44728 > node3.48528: UDP, length 113
03:28:14.035339 IP node4.38447 > node3.48528: UDP, length 113
03:28:14.037598 IP node4.45119 > node2.56345: UDP, length 113
03:28:14.037675 IP node4.39614 > node2.56345: UDP, length 112
03:28:14.038617 IP node4.33410 > node2.56345: UDP, length 113
03:28:14.039147 IP node4.32788 > node2.56345: UDP, length 113
03:28:14.039353 IP node4.43338 > node2.56345: UDP, length 113
03:28:14.039940 IP node4.34193 > node2.56345: UDP, length 113
03:28:14.040189 IP node4.44436 > node2.56345: UDP, length 113
03:28:14.041669 IP node4.38447 > node2.56345: UDP, length 113
03:28:14.042233 IP node4.44728 > node2.56345: UDP, length 113
03:28:14.058296 IP node4.33410 > node2.57377: UDP, length 113
03:28:14.059771 IP node4.32788 > node2.57377: UDP, length 113
03:28:14.060269 IP node4.34193 > node2.57377: UDP, length 113
03:28:14.061473 IP node4.43338 > node2.57377: UDP, length 113
03:28:14.061968 IP node4.44436 > node2.57377: UDP, length 113
03:28:14.062897 IP node4.38447 > node2.57377: UDP, length 113
03:28:14.063344 IP node4.45119 > node2.57377: UDP, length 113
03:28:14.063913 IP node4.44728 > node2.57377: UDP, length 113
03:28:14.082702 IP node4.54038 > node2.57377: UDP, length 113
03:28:14.082964 IP node4.54038 > node2.56345: UDP, length 113
03:28:14.083041 IP node4.54038 > node3.48528: UDP, length 113
03:28:14.083167 IP node4.54038 > node3.60737: UDP, length 113
03:28:14.083248 IP node4.54038 > node3.46391: UDP, length 113
03:28:14.090791 IP node4.41567 > node2.57377: UDP, length 113
03:28:14.090909 IP node4.41567 > node2.56345: UDP, length 113
03:28:14.090988 IP node4.41567 > node3.48528: UDP, length 113
03:28:14.096074 IP node4.41567 > node2.54377: UDP, length 113
03:28:14.098422 IP node4.32788 > node2.54377: UDP, length 113
03:28:14.098731 IP node4.43338 > node2.54377: UDP, length 113
03:28:14.098900 IP node4.33410 > node2.54377: UDP, length 113
03:28:14.099225 IP node4.34193 > node2.54377: UDP, length 113
03:28:14.100701 IP node4.39614 > node2.57377: UDP, length 112
03:28:14.100742 IP node4.39614 > node2.54377: UDP, length 112
03:28:14.101219 IP node4.44436 > node2.54377: UDP, length 113
03:28:14.101398 IP node4.45119 > node2.54377: UDP, length 113
03:28:14.101769 IP node4.39614 > node2.59524: UDP, length 112
03:28:14.102651 IP node4.44728 > node2.54377: UDP, length 113
03:28:14.104337 IP node4.38447 > node2.54377: UDP, length 113
03:28:14.106770 IP node4.41567 > node3.49097: UDP, length 113
03:28:14.107287 IP node4.43338 > node3.49097: UDP, length 113
03:28:14.109364 IP node4.38447 > node3.49097: UDP, length 113
03:28:14.109609 IP node4.44436 > node3.49097: UDP, length 113
03:28:14.110255 IP node4.34193 > node3.49097: UDP, length 113
03:28:14.110781 IP node4.32788 > node3.49097: UDP, length 113
03:28:14.111554 IP node4.33410 > node3.49097: UDP, length 113
03:28:14.111921 IP node4.39614 > node3.49097: UDP, length 112
03:28:14.112649 IP node4.44728 > node3.49097: UDP, length 113
03:28:14.113167 IP node4.47792 > node2.56345: UDP, length 113
03:28:14.113429 IP node4.47792 > node2.54377: UDP, length 113
03:28:14.113518 IP node4.47792 > node3.49097: UDP, length 113
03:28:14.113759 IP node4.47792 > node2.57377: UDP, length 113
03:28:14.115485 IP node4.41567 > node2.42580: UDP, length 113
03:28:14.116332 IP node4.43338 > node2.42580: UDP, length 113
03:28:14.117125 IP node4.33410 > node2.42580: UDP, length 113
03:28:14.117524 IP node4.47792 > node2.42580: UDP, length 113
03:28:14.117810 IP node4.34193 > node2.42580: UDP, length 113
03:28:14.118381 IP node4.32788 > node2.42580: UDP, length 113
03:28:14.118882 IP node4.44436 > node2.42580: UDP, length 113
03:28:14.120072 IP node4.45119 > node3.49097: UDP, length 113
03:28:14.121039 IP node4.44728 > node2.42580: UDP, length 113
03:28:14.121783 IP node4.38447 > node2.42580: UDP, length 113
03:28:14.122128 IP node4.45119 > node2.42580: UDP, length 113
03:28:14.140327 IP node4.41567 > node3.48726: UDP, length 113
03:28:14.141821 IP node4.47792 > node3.48726: UDP, length 113
03:28:14.142226 IP node4.44436 > node3.48726: UDP, length 113
03:28:14.143125 IP node4.33410 > node3.48726: UDP, length 113
03:28:14.143482 IP node4.38447 > node3.48726: UDP, length 113
03:28:14.143764 IP node4.43338 > node3.48726: UDP, length 113
03:28:14.143995 IP node4.34193 > node3.48726: UDP, length 113
03:28:14.144388 IP node4.32788 > node3.48726: UDP, length 113
03:28:14.145028 IP node4.44728 > node3.48726: UDP, length 113
03:28:14.147087 IP node4.39260 > node2.59524: UDP, length 113
03:28:14.147135 IP node4.39260 > node3.48726: UDP, length 113
03:28:14.147365 IP node4.39260 > node2.57377: UDP, length 113
03:28:14.147542 IP node4.39260 > node2.56345: UDP, length 113
03:28:14.147644 IP node4.39260 > node2.54377: UDP, length 113
03:28:14.147710 IP node4.39260 > node2.42580: UDP, length 113
03:28:14.147850 IP node4.39260 > node3.48528: UDP, length 113
03:28:14.147940 IP node4.39260 > node3.49097: UDP, length 113
03:28:14.148099 IP node4.39260 > node3.60737: UDP, length 113
03:28:14.148198 IP node4.39260 > node3.46391: UDP, length 113
03:28:14.148899 IP node4.44358 > node2.59155: UDP, length 113
03:28:14.149568 IP node4.44358 > node3.46151: UDP, length 113
03:28:14.149831 IP node4.44358 > node2.56279: UDP, length 113
03:28:14.150472 IP node4.44358 > node3.36125: UDP, length 113
03:28:14.151323 IP node4.44358 > node3.49469: UDP, length 113
03:28:14.151570 IP node4.44358 > node2.39953: UDP, length 113
03:28:14.151714 IP node4.44358 > node2.60393: UDP, length 113
03:28:14.152034 IP node4.44358 > node3.45401: UDP, length 113
03:28:14.152345 IP node4.44358 > node2.45886: UDP, length 113
03:28:14.160954 IP node4.45119 > node3.48726: UDP, length 113
03:28:14.169009 IP node4.41567 > node2.45754: UDP, length 113
03:28:14.170317 IP node4.34193 > node2.45754: UDP, length 113
03:28:14.172110 IP node4.43338 > node2.45754: UDP, length 113
03:28:14.172720 IP node4.47792 > node2.45754: UDP, length 113
03:28:14.173203 IP node4.33410 > node2.45754: UDP, length 113
03:28:14.173491 IP node4.32788 > node2.45754: UDP, length 113
03:28:14.174637 IP node4.44436 > node2.45754: UDP, length 113
03:28:14.174771 IP node4.39260 > node2.45754: UDP, length 113
03:28:14.175508 IP node4.38447 > node2.45754: UDP, length 113
03:28:14.176551 IP node4.45119 > node2.45754: UDP, length 113
03:28:14.178848 IP node4.44728 > node2.45754: UDP, length 113
03:28:14.183186 IP node4.53588 > node2.59155: UDP, length 113
03:28:14.192201 IP node4.55714 > node2.59524: UDP, length 113
03:28:14.192383 IP node4.55714 > node3.43708: UDP, length 113
03:28:14.192782 IP node4.55714 > node2.56279: UDP, length 113
03:28:14.192870 IP node4.55714 > node2.56345: UDP, length 113
03:28:14.192950 IP node4.55714 > node2.39953: UDP, length 113
03:28:14.193033 IP node4.55714 > node3.49469: UDP, length 113
03:28:14.193111 IP node4.55714 > node3.46151: UDP, length 113
03:28:14.193272 IP node4.55714 > node2.37408: UDP, length 113
03:28:14.193365 IP node4.55714 > node3.48528: UDP, length 113
03:28:14.193444 IP node4.55714 > node2.45754: UDP, length 113
03:28:14.193523 IP node4.55714 > node2.45886: UDP, length 113
03:28:14.193604 IP node4.55714 > node3.49097: UDP, length 113
03:28:14.193689 IP node4.55714 > node2.50964: UDP, length 113
03:28:14.193769 IP node4.55714 > node3.60737: UDP, length 113
03:28:14.193904 IP node4.55714 > node3.48726: UDP, length 113
03:28:14.193991 IP node4.55714 > node2.46185: UDP, length 113
03:28:14.194118 IP node4.55714 > node2.57377: UDP, length 113
03:28:14.194321 IP node4.55714 > node2.60393: UDP, length 113
03:28:14.194400 IP node4.55714 > node3.36125: UDP, length 113
03:28:14.194545 IP node4.55714 > node2.54377: UDP, length 113
03:28:14.194645 IP node4.55714 > node2.34019: UDP, length 113
03:28:14.194793 IP node4.55714 > node2.42580: UDP, length 113
03:28:14.194993 IP node4.55714 > node3.43726: UDP, length 113
03:28:14.195074 IP node4.55714 > node3.46391: UDP, length 113
03:28:14.195155 IP node4.55714 > node3.45401: UDP, length 113
03:28:14.202922 IP node4.47792 > node2.52204: UDP, length 78
03:28:14.224091 IP node4.41567 > node2.52204: UDP, length 78
03:28:14.225007 IP node4.55714 > node2.52204: UDP, length 94
03:28:14.238293 IP node4.39188 > node3.48726: UDP, length 113
03:28:14.238344 IP node4.39188 > node2.57377: UDP, length 113
03:28:14.238531 IP node4.39188 > node2.56345: UDP, length 113
03:28:14.238601 IP node4.39188 > node2.54377: UDP, length 113
03:28:14.238696 IP node4.39188 > node2.42580: UDP, length 113
03:28:14.238765 IP node4.39188 > node3.48528: UDP, length 113
03:28:14.238843 IP node4.39188 > node2.45754: UDP, length 113
03:28:14.239040 IP node4.39188 > node3.49097: UDP, length 113
03:28:14.240034 IP node4.39188 > node3.60737: UDP, length 113
03:28:14.266331 IP node4.33600 > node3.46151: UDP, length 113
03:28:14.266638 IP node4.41567 > node2.46985: UDP, length 113
03:28:14.266927 IP node4.33600 > node3.36125: UDP, length 113
03:28:14.268830 IP node4.47792 > node2.46985: UDP, length 113
03:28:14.271861 IP node4.54038 > node3.48726: UDP, length 113
03:28:14.271929 IP node4.54038 > node2.54377: UDP, length 113
03:28:14.272008 IP node4.54038 > node2.42580: UDP, length 113
03:28:14.272086 IP node4.54038 > node2.45754: UDP, length 113
03:28:14.272183 IP node4.54038 > node3.49097: UDP, length 113
03:28:14.272363 IP node4.54038 > node2.46985: UDP, length 113
03:28:14.272502 IP node4.34193 > node2.46985: UDP, length 113
03:28:14.273547 IP node4.32788 > node2.46985: UDP, length 113
03:28:14.273699 IP node4.43338 > node2.46985: UDP, length 113
03:28:14.273977 IP node4.33410 > node2.46985: UDP, length 113
03:28:14.277059 IP node4.44436 > node2.46985: UDP, length 113
03:28:14.277503 IP node4.45119 > node2.46985: UDP, length 113
03:28:14.278580 IP node4.44728 > node2.46985: UDP, length 113
03:28:14.278699 IP node4.39188 > node2.46985: UDP, length 113
03:28:14.280794 IP node4.38447 > node2.46985: UDP, length 113
03:28:14.292315 IP node4.39260 > node2.52204: UDP, length 78
03:28:14.297384 IP node4.55714 > node2.46985: UDP, length 113
03:28:14.305632 IP node4.53588 > node3.46151: UDP, length 113
03:28:14.307298 IP node4.54038 > node2.52204: UDP, length 78
03:28:14.332137 IP node4.44358 > node2.52204: UDP, length 94
03:28:14.341053 IP node4.33600 > node3.49469: UDP, length 113
03:28:14.341339 IP node4.33600 > node2.39953: UDP, length 113
03:28:14.341596 IP node4.33600 > node2.60393: UDP, length 113
03:28:14.341713 IP node4.33600 > node3.45401: UDP, length 113
03:28:14.342349 IP node4.33600 > node2.45886: UDP, length 113
03:28:14.342488 IP node4.33600 > node2.34019: UDP, length 113
03:28:14.342985 IP node4.53588 > node2.59524: UDP, length 113
03:28:14.343138 IP node4.33600 > node2.50964: UDP, length 113
03:28:14.343252 IP node4.53588 > node3.43708: UDP, length 113
03:28:14.343291 IP node4.33600 > node3.43708: UDP, length 113
03:28:14.343532 IP node4.53588 > node2.56279: UDP, length 113
03:28:14.343609 IP node4.53588 > node2.56345: UDP, length 113
03:28:14.343688 IP node4.53588 > node2.39953: UDP, length 113
03:28:14.343724 IP node4.33600 > node2.37408: UDP, length 113
03:28:14.343816 IP node4.53588 > node3.49469: UDP, length 113
03:28:14.343816 IP node4.33600 > node2.46185: UDP, length 113
03:28:14.343940 IP node4.53588 > node2.37408: UDP, length 113
03:28:14.344017 IP node4.53588 > node3.48528: UDP, length 113
03:28:14.344088 IP node4.53588 > node2.45754: UDP, length 113
03:28:14.344124 IP node4.33600 > node3.43726: UDP, length 113
03:28:14.344213 IP node4.53588 > node2.45886: UDP, length 113
03:28:14.344285 IP node4.53588 > node3.49097: UDP, length 113
03:28:14.344458 IP node4.53588 > node2.50964: UDP, length 113
03:28:14.344499 IP node4.33600 > node2.59524: UDP, length 113
03:28:14.344601 IP node4.53588 > node3.60737: UDP, length 113
03:28:14.344651 IP node4.33600 > node3.46391: UDP, length 113
03:28:14.344651 IP node4.33600 > node3.60737: UDP, length 113
03:28:14.344879 IP node4.53588 > node3.48726: UDP, length 113
03:28:14.344987 IP node4.53588 > node2.46185: UDP, length 113
03:28:14.345084 IP node4.53588 > node2.57377: UDP, length 113
03:28:14.345084 IP node4.33600 > node3.48528: UDP, length 113
03:28:14.345270 IP node4.53588 > node2.60393: UDP, length 113
03:28:14.345353 IP node4.53588 > node3.36125: UDP, length 113
03:28:14.345476 IP node4.53588 > node2.52204: UDP, length 94
03:28:14.345548 IP node4.53588 > node2.54377: UDP, length 113
03:28:14.345621 IP node4.53588 > node2.34019: UDP, length 113
03:28:14.345723 IP node4.53588 > node2.42580: UDP, length 113
03:28:14.345841 IP node4.53588 > node3.43726: UDP, length 113
03:28:14.345914 IP node4.53588 > node3.46391: UDP, length 113
03:28:14.345986 IP node4.53588 > node2.46985: UDP, length 113
03:28:14.346067 IP node4.53588 > node3.45401: UDP, length 113
03:28:14.346235 IP node4.33600 > node2.56345: UDP, length 113
03:28:14.346480 IP node4.33600 > node2.57377: UDP, length 113
03:28:14.346606 IP node4.33600 > node2.54377: UDP, length 113
03:28:14.348469 IP node4.39188 > node2.52204: UDP, length 78
03:28:14.356323 IP node4.33600 > node2.52204: UDP, length 94
03:28:14.357276 IP node4.33600 > node2.56279: UDP, length 113
03:28:14.359504 IP node4.33600 > node3.48726: UDP, length 113
03:28:14.359504 IP node4.33600 > node2.42580: UDP, length 113
03:28:14.361725 IP node4.33600 > node2.45754: UDP, length 113
03:28:14.368186 IP node4.33600 > node2.46985: UDP, length 113
03:28:14.381725 IP node4.44358 > node2.34019: UDP, length 113
03:28:14.383069 IP node4.44358 > node2.50964: UDP, length 113
03:28:14.383866 IP node4.44358 > node3.43708: UDP, length 113
03:28:14.384427 IP node4.44358 > node2.37408: UDP, length 113
03:28:14.385197 IP node4.44358 > node2.46185: UDP, length 113
03:28:14.386152 IP node4.44358 > node3.43726: UDP, length 113
03:28:14.386452 IP node4.44358 > node2.59524: UDP, length 113
03:28:14.386814 IP node4.44358 > node3.46391: UDP, length 113
03:28:14.387044 IP node4.44358 > node3.60737: UDP, length 113
03:28:14.389285 IP node4.44358 > node3.48528: UDP, length 113
03:28:14.396710 IP node4.39614 > node3.48726: UDP, length 112
03:28:14.396863 IP node4.39614 > node2.45754: UDP, length 112
03:28:14.397427 IP node4.39614 > node2.46985: UDP, length 112
03:28:14.406121 IP node4.39260 > node2.46985: UDP, length 113
03:28:14.409343 IP node4.39614 > node2.42580: UDP, length 112
03:28:14.415844 IP node4.45712 > node2.45886: UDP, length 113
03:28:14.416195 IP node4.45712 > node2.34019: UDP, length 113
03:28:14.418008 IP node4.39614 > node2.52204: UDP, length 78
03:28:14.419171 IP node4.44358 > node2.57377: UDP, length 113
03:28:14.419427 IP node4.44358 > node2.54377: UDP, length 113
03:28:14.420269 IP node4.44358 > node3.49097: UDP, length 113
03:28:14.420513 IP node4.44358 > node2.42580: UDP, length 113
03:28:14.420659 IP node4.44358 > node3.48726: UDP, length 113
03:28:14.420956 IP node4.44358 > node2.45754: UDP, length 113
03:28:14.421080 IP node4.45712 > node2.50964: UDP, length 113
03:28:14.421372 IP node4.45712 > node3.43708: UDP, length 113
03:28:14.422077 IP node4.45712 > node2.37408: UDP, length 113
03:28:14.422346 IP node4.45712 > node2.46185: UDP, length 113
03:28:14.422625 IP node4.45712 > node3.43726: UDP, length 113
03:28:14.423613 IP node4.45712 > node2.59524: UDP, length 113
03:28:14.423913 IP node4.45712 > node3.46391: UDP, length 113
03:28:14.424241 IP node4.45712 > node3.60737: UDP, length 113
03:28:14.427255 IP node4.45712 > node3.48528: UDP, length 113
03:28:14.438175 IP node4.44358 > node2.56345: UDP, length 113
03:28:14.438449 IP node4.44358 > node2.46985: UDP, length 113
03:28:14.443464 IP node4.32788 > node3.53435: UDP, length 113
03:28:14.444172 IP node4.39260 > node3.53435: UDP, length 113
03:28:14.444221 IP node4.41567 > node3.53435: UDP, length 113
03:28:14.444374 IP node4.39614 > node3.53435: UDP, length 112
03:28:14.447742 IP node4.33600 > node3.49097: UDP, length 113
03:28:14.447998 IP node4.45119 > node3.53435: UDP, length 113
03:28:14.448022 IP node4.44728 > node3.53435: UDP, length 113
03:28:14.448375 IP node4.44436 > node3.53435: UDP, length 113
03:28:14.448559 IP node4.38447 > node3.53435: UDP, length 113
03:28:14.448888 IP node4.47792 > node3.53435: UDP, length 113
03:28:14.449262 IP node4.39188 > node3.53435: UDP, length 113
03:28:14.449421 IP node4.43338 > node3.53435: UDP, length 113
03:28:14.449421 IP node4.33410 > node3.53435: UDP, length 113
03:28:14.449884 IP node4.34193 > node3.53435: UDP, length 113
03:28:14.451726 IP node4.55714 > node3.53435: UDP, length 113
03:28:14.452203 IP node4.44358 > node3.53435: UDP, length 113
03:28:14.462775 IP node4.33600 > node3.53435: UDP, length 113
03:28:14.468832 IP node4.54038 > node3.53435: UDP, length 113
03:28:14.470112 IP node4.39260 > node2.54401: UDP, length 113
03:28:14.472040 IP node4.41567 > node2.54401: UDP, length 113
03:28:14.472364 IP node4.39614 > node2.54401: UDP, length 112
03:28:14.472459 IP node4.54038 > node2.54401: UDP, length 113
03:28:14.473082 IP node4.44358 > node2.54401: UDP, length 113
03:28:14.473249 IP node4.32788 > node2.54401: UDP, length 113
03:28:14.474563 IP node4.53588 > node3.53435: UDP, length 113
03:28:14.474781 IP node4.53588 > node2.54401: UDP, length 113
03:28:14.475440 IP node4.45119 > node2.54401: UDP, length 113
03:28:14.475974 IP node4.44728 > node2.54401: UDP, length 113
03:28:14.475974 IP node4.44436 > node2.54401: UDP, length 113
03:28:14.476332 IP node4.38447 > node2.54401: UDP, length 113
03:28:14.476556 IP node4.47792 > node2.54401: UDP, length 113
03:28:14.476822 IP node4.39188 > node2.54401: UDP, length 113
03:28:14.477059 IP node4.43338 > node2.54401: UDP, length 113
03:28:14.477518 IP node4.34193 > node2.54401: UDP, length 113
03:28:14.481917 IP node4.32788 > node2.52757: UDP, length 113
03:28:14.483073 IP node4.39260 > node2.52757: UDP, length 113
03:28:14.483426 IP node4.39614 > node2.52757: UDP, length 112
03:28:14.483664 IP node4.41567 > node2.52757: UDP, length 113
03:28:14.484078 IP node4.54038 > node2.52757: UDP, length 113
03:28:14.484583 IP node4.38447 > node2.52757: UDP, length 113
03:28:14.485134 IP node4.43338 > node2.52757: UDP, length 113
