03:28:20.873143 IP node1.54469 > node1.33327: UDP, length 113
03:28:20.889953 IP node1.54469 > node1.56110: UDP, length 113
03:28:21.111541 IP node1.33327 > node1.56110: UDP, length 113
03:28:21.334821 IP node1.54469 > node1.40805: UDP, length 113
03:28:21.340707 IP node1.33327 > node1.40805: UDP, length 113
03:28:21.388379 IP node1.54469 > node1.41777: UDP, length 113
03:28:21.390279 IP node1.33327 > node1.41777: UDP, length 113
03:28:21.630252 IP node1.40805 > node1.33327: UDP, length 113
03:28:21.630338 IP node1.40805 > node1.56110: UDP, length 113
03:28:21.630892 IP node1.40805 > node1.41777: UDP, length 113
03:28:21.636678 IP node1.56110 > node1.33327: UDP, length 113
03:28:21.638260 IP node1.56110 > node1.41777: UDP, length 113
03:28:21.638351 IP node1.56110 > node1.40805: UDP, length 113
03:28:21.731488 IP node1.41777 > node1.33327: UDP, length 113
03:28:21.738676 IP node1.41777 > node1.56110: UDP, length 113
03:28:21.738752 IP node1.41777 > node1.40805: UDP, length 113
03:28:21.793895 IP node1.54469 > node1.44248: UDP, length 113
03:28:21.803574 IP node1.33327 > node1.44248: UDP, length 113
03:28:21.816531 IP node1.56110 > node1.44248: UDP, length 113
03:28:21.862600 IP node1.41777 > node1.44248: UDP, length 113
03:28:21.893045 IP node1.40805 > node1.44248: UDP, length 113
03:28:21.979052 IP node1.33327 > node1.41084: UDP, length 113
03:28:21.979247 IP node1.54469 > node1.41084: UDP, length 113
03:28:21.979734 IP node1.56110 > node1.41084: UDP, length 113
03:28:21.982825 IP node1.41777 > node1.41084: UDP, length 113
03:28:22.010892 IP node1.44248 > node1.33327: UDP, length 113
03:28:22.014546 IP node1.44248 > node1.56110: UDP, length 113
03:28:22.016175 IP node1.44248 > node1.40805: UDP, length 113
03:28:22.017247 IP node1.44248 > node1.41777: UDP, length 113
03:28:22.017783 IP node1.40805 > node1.41084: UDP, length 113
03:28:22.097380 IP node1.54469 > node1.46696: UDP, length 113
03:28:22.098067 IP node1.40805 > node1.46696: UDP, length 113
03:28:22.098972 IP node1.33327 > node1.46696: UDP, length 113
03:28:22.102116 IP node1.56110 > node1.46696: UDP, length 113
03:28:22.109236 IP node1.40805 > node1.47989: UDP, length 113
03:28:22.110359 IP node1.33327 > node1.47989: UDP, length 113
03:28:22.114938 IP node1.54469 > node1.47989: UDP, length 113
03:28:22.129296 IP node1.56110 > node1.47989: UDP, length 113
03:28:22.153046 IP node1.41084 > node1.40805: UDP, length 112
03:28:22.153663 IP node1.41084 > node1.41777: UDP, length 112
03:28:22.168663 IP node1.46696 > node1.40805: UDP, length 113
03:28:22.173071 IP node1.54469 > node1.49148: UDP, length 113
03:28:22.174141 IP node1.56110 > node1.49148: UDP, length 113
03:28:22.190256 IP node1.46696 > node1.41777: UDP, length 113
03:28:22.202180 IP node1.54469 > node1.39134: UDP, length 113
03:28:22.205356 IP node1.39134 > node1.33327: UDP, length 113
03:28:22.206446 IP node1.39134 > node1.56110: UDP, length 113
03:28:22.207176 IP node1.39134 > node1.40805: UDP, length 113
03:28:22.207672 IP node1.39134 > node1.41777: UDP, length 113
03:28:22.208727 IP node1.56110 > node1.39134: UDP, length 113
03:28:22.222880 IP node1.40805 > node1.49148: UDP, length 113
03:28:22.223409 IP node1.40805 > node1.39134: UDP, length 113
03:28:22.242659 IP node1.41084 > node1.44248: UDP, length 112
03:28:22.242985 IP node1.41084 > node1.46696: UDP, length 112
03:28:22.264337 IP node1.33327 > node1.49148: UDP, length 113
03:28:22.300750 IP node1.44248 > node1.46696: UDP, length 113
03:28:22.301324 IP node1.44248 > node1.41084: UDP, length 113
03:28:22.301386 IP node1.44248 > node1.47989: UDP, length 113
03:28:22.305210 IP node1.44248 > node1.49148: UDP, length 113
03:28:22.305354 IP node1.44248 > node1.39134: UDP, length 113
03:28:22.309939 IP node1.41084 > node1.47989: UDP, length 112
03:28:22.310269 IP node1.41084 > node1.49148: UDP, length 112
03:28:22.310321 IP node1.41084 > node1.39134: UDP, length 112
03:28:22.355048 IP node1.33327 > node1.39134: UDP, length 113
03:28:22.359931 IP node1.41084 > node1.48423: UDP, length 112
03:28:22.360363 IP node1.54469 > node1.48423: UDP, length 113
03:28:22.361277 IP node1.40805 > node1.48423: UDP, length 113
03:28:22.363693 IP node1.44248 > node1.48423: UDP, length 113
03:28:22.364291 IP node1.38402 > node1.33327: UDP, length 113
03:28:22.366254 IP node1.40805 > node1.38402: UDP, length 113
03:28:22.368157 IP node1.38402 > node1.56110: UDP, length 113
03:28:22.368246 IP node1.38402 > node1.41777: UDP, length 113
03:28:22.368304 IP node1.38402 > node1.40805: UDP, length 113
03:28:22.368348 IP node1.44248 > node1.38402: UDP, length 113
03:28:22.369135 IP node1.41084 > node1.38402: UDP, length 112
03:28:22.372763 IP node1.46696 > node1.44248: UDP, length 113
03:28:22.376123 IP node1.54469 > node1.38402: UDP, length 113
03:28:22.377311 IP node1.33327 > node1.48423: UDP, length 113
03:28:22.377666 IP node1.33327 > node1.38402: UDP, length 113
03:28:22.384944 IP node1.47989 > node1.41777: UDP, length 113
03:28:22.385094 IP node1.47989 > node1.40805: UDP, length 113
03:28:22.423258 IP node1.33327 > node1.34917: UDP, length 113
03:28:22.424435 IP node1.44248 > node1.34917: UDP, length 113
03:28:22.426207 IP node1.40805 > node1.34917: UDP, length 113
03:28:22.427170 IP node1.54469 > node1.34917: UDP, length 113
03:28:22.427806 IP node1.34917 > node1.40805: UDP, length 112
03:28:22.441419 IP node1.41084 > node1.34917: UDP, length 112
03:28:22.446625 IP node1.46696 > node1.41084: UDP, length 113
03:28:22.447349 IP node1.46696 > node1.47989: UDP, length 113
03:28:22.447659 IP node1.46696 > node1.49148: UDP, length 113
03:28:22.447991 IP node1.46696 > node1.39134: UDP, length 113
03:28:22.448446 IP node1.46696 > node1.48423: UDP, length 113
03:28:22.448900 IP node1.46696 > node1.38402: UDP, length 113
03:28:22.449173 IP node1.46696 > node1.34917: UDP, length 113
03:28:22.451985 IP node1.34917 > node1.41777: UDP, length 112
03:28:22.460517 IP node1.34917 > node1.44248: UDP, length 112
03:28:22.469535 IP node1.39134 > node1.46696: UDP, length 113
03:28:22.469770 IP node1.39134 > node1.48423: UDP, length 113
03:28:22.469816 IP node1.39134 > node1.44248: UDP, length 113
03:28:22.469872 IP node1.39134 > node1.41084: UDP, length 113
03:28:22.469924 IP node1.39134 > node1.47989: UDP, length 113
03:28:22.469986 IP node1.39134 > node1.49148: UDP, length 113
03:28:22.476195 IP node1.39134 > node1.38402: UDP, length 113
03:28:22.476417 IP node1.39134 > node1.34917: UDP, length 113
03:28:22.488931 IP node1.56110 > node1.48423: UDP, length 113
03:28:22.495247 IP node1.41777 > node1.46696: UDP, length 113
03:28:22.495350 IP node1.41777 > node1.48423: UDP, length 113
03:28:22.495391 IP node1.41777 > node1.34917: UDP, length 113
03:28:22.495440 IP node1.41777 > node1.49148: UDP, length 113
03:28:22.495488 IP node1.41777 > node1.38402: UDP, length 113
03:28:22.495526 IP node1.41777 > node1.39134: UDP, length 113
03:28:22.496088 IP node1.41777 > node1.47989: UDP, length 113
03:28:22.517343 IP node1.49148 > node1.33327: UDP, length 113
03:28:22.517431 IP node1.49148 > node1.56110: UDP, length 113
03:28:22.541698 IP node1.34917 > node1.41084: UDP, length 112
03:28:22.546657 IP node1.44248 > node1.35613: UDP, length 113
03:28:22.549242 IP node1.34917 > node1.46696: UDP, length 112
03:28:22.549263 IP node1.54469 > node1.35613: UDP, length 113
03:28:22.549713 IP node1.34917 > node1.47989: UDP, length 112
03:28:22.549815 IP node1.33327 > node1.35613: UDP, length 113
03:28:22.550056 IP node1.34917 > node1.49148: UDP, length 112
03:28:22.551769 IP node1.39134 > node1.35613: UDP, length 113
03:28:22.554366 IP node1.46696 > node1.35613: UDP, length 113
03:28:22.554758 IP node1.41084 > node1.35613: UDP, length 112
03:28:22.562726 IP node1.35613 > node1.41777: UDP, length 113
03:28:22.562862 IP node1.35613 > node1.44248: UDP, length 113
03:28:22.562981 IP node1.35613 > node1.41084: UDP, length 113
03:28:22.563815 IP node1.35613 > node1.46696: UDP, length 113
03:28:22.564294 IP node1.35613 > node1.47989: UDP, length 113
03:28:22.566897 IP node1.35613 > node1.39134: UDP, length 113
03:28:22.567268 IP node1.35613 > node1.48423: UDP, length 113
03:28:22.567491 IP node1.35613 > node1.38402: UDP, length 113
03:28:22.568221 IP node1.35613 > node1.34917: UDP, length 113
03:28:22.568443 IP node1.35613 > node1.49148: UDP, length 113
03:28:22.573045 IP node1.41777 > node1.35613: UDP, length 113
03:28:22.582368 IP node1.56110 > node1.34917: UDP, length 113
03:28:22.582452 IP node1.56110 > node1.35613: UDP, length 113
03:28:22.597450 IP node1.47989 > node1.44248: UDP, length 113
03:28:22.602847 IP node1.47989 > node1.41084: UDP, length 113
03:28:22.602951 IP node1.47989 > node1.46696: UDP, length 113
03:28:22.603057 IP node1.47989 > node1.49148: UDP, length 113
03:28:22.604553 IP node1.47989 > node1.39134: UDP, length 113
03:28:22.613461 IP node1.47989 > node1.48423: UDP, length 113
03:28:22.613593 IP node1.47989 > node1.38402: UDP, length 113
03:28:22.615498 IP node1.47989 > node1.35613: UDP, length 113
03:28:22.621166 IP node1.47989 > node1.34917: UDP, length 113
03:28:22.638808 IP node1.38402 > node1.44248: UDP, length 113
03:28:22.638933 IP node1.38402 > node1.46696: UDP, length 113
03:28:22.639566 IP node1.38402 > node1.41084: UDP, length 113
03:28:22.639747 IP node1.38402 > node1.47989: UDP, length 113
03:28:22.639908 IP node1.38402 > node1.49148: UDP, length 113
03:28:22.640863 IP node1.38402 > node1.39134: UDP, length 113
03:28:22.641107 IP node1.38402 > node1.48423: UDP, length 113
03:28:22.641343 IP node1.38402 > node1.34917: UDP, length 113
03:28:22.641540 IP node1.38402 > node1.35613: UDP, length 113
03:28:22.657646 IP node1.56110 > node1.38402: UDP, length 113
03:28:22.669885 IP node1.40805 > node1.35613: UDP, length 113
03:28:22.693413 IP node1.48423 > node1.41777: UDP, length 112
03:28:22.693492 IP node1.48423 > node1.40805: UDP, length 112
03:28:22.693573 IP node1.48423 > node1.44248: UDP, length 112
03:28:22.718798 IP node1.54469 > node1.45765: UDP, length 113
03:28:22.721166 IP node1.44248 > node1.45765: UDP, length 113
03:28:22.722190 IP node1.46696 > node1.45765: UDP, length 113
03:28:22.722796 IP node1.41777 > node1.45765: UDP, length 113
03:28:22.725104 IP node1.47989 > node1.45765: UDP, length 113
03:28:22.726886 IP node1.41084 > node1.45765: UDP, length 112
03:28:22.727466 IP node1.39134 > node1.45765: UDP, length 113
03:28:22.727607 IP node1.38402 > node1.45765: UDP, length 113
03:28:22.737512 IP node1.35613 > node1.45765: UDP, length 113
03:28:22.741945 IP node1.48423 > node1.41084: UDP, length 112
03:28:22.742221 IP node1.48423 > node1.46696: UDP, length 112
03:28:22.742366 IP node1.48423 > node1.47989: UDP, length 112
03:28:22.742477 IP node1.48423 > node1.49148: UDP, length 112
03:28:22.742584 IP node1.48423 > node1.39134: UDP, length 112
03:28:22.742690 IP node1.48423 > node1.38402: UDP, length 112
03:28:22.747349 IP node1.48423 > node1.35613: UDP, length 112
03:28:22.766643 IP node1.33327 > node1.45765: UDP, length 113
03:28:22.781657 IP node1.49148 > node1.40805: UDP, length 113
03:28:22.787978 IP node1.49148 > node1.41777: UDP, length 113
03:28:22.793188 IP node1.40805 > node1.45765: UDP, length 113
03:28:22.795511 IP node1.49148 > node1.44248: UDP, length 113
03:28:22.799877 IP node1.49148 > node1.41084: UDP, length 113
03:28:22.801936 IP node1.49148 > node1.47989: UDP, length 113
03:28:22.802474 IP node1.49148 > node1.39134: UDP, length 113
03:28:22.802878 IP node1.49148 > node1.48423: UDP, length 113
03:28:22.803138 IP node1.49148 > node1.38402: UDP, length 113
03:28:22.810739 IP node1.56110 > node1.45765: UDP, length 113
03:28:22.811287 IP node1.49148 > node1.46696: UDP, length 113
03:28:22.811645 IP node1.49148 > node1.35613: UDP, length 113
03:28:22.813437 IP node1.49148 > node1.45765: UDP, length 113
03:28:22.817282 IP node1.49148 > node1.34917: UDP, length 113
03:28:22.835760 IP node1.53797 > node1.46696: UDP, length 113
03:28:22.836934 IP node1.53797 > node1.48423: UDP, length 113
03:28:22.837365 IP node1.53797 > node1.44248: UDP, length 113
03:28:22.841378 IP node1.54469 > node1.53797: UDP, length 113
03:28:22.841399 IP node1.40805 > node1.53797: UDP, length 113
03:28:22.841668 IP node1.33327 > node1.53797: UDP, length 113
03:28:22.841863 IP node1.47989 > node1.53797: UDP, length 113
03:28:22.842835 IP node1.41777 > node1.53797: UDP, length 113
03:28:22.844453 IP node1.39134 > node1.53797: UDP, length 113
03:28:22.845368 IP node1.46696 > node1.53797: UDP, length 113
03:28:22.845579 IP node1.44248 > node1.53797: UDP, length 113
03:28:22.845841 IP node1.53797 > node1.34917: UDP, length 113
03:28:22.845903 IP node1.53797 > node1.47989: UDP, length 113
03:28:22.846335 IP node1.41084 > node1.53797: UDP, length 112
03:28:22.847042 IP node1.53797 > node1.35613: UDP, length 113
03:28:22.847755 IP node1.56110 > node1.53797: UDP, length 113
03:28:22.847833 IP node1.53797 > node1.49148: UDP, length 113
03:28:22.847893 IP node1.53797 > node1.38402: UDP, length 113
03:28:22.848018 IP node1.53797 > node1.45765: UDP, length 113
03:28:22.848188 IP node1.53797 > node1.39134: UDP, length 113
03:28:22.849391 IP node1.48423 > node1.34917: UDP, length 112
03:28:22.849992 IP node1.38402 > node1.53797: UDP, length 113
03:28:22.850797 IP node1.35613 > node1.53797: UDP, length 113
03:28:22.855748 IP node1.48423 > node1.45765: UDP, length 112
03:28:22.856713 IP node1.48423 > node1.53797: UDP, length 112
03:28:22.871830 IP node1.53797 > node1.41084: UDP, length 113
03:28:22.880838 IP node1.34917 > node1.53797: UDP, length 112
03:28:22.880899 IP node1.34917 > node1.35613: UDP, length 112
03:28:22.880938 IP node1.34917 > node1.38402: UDP, length 112
03:28:22.881023 IP node1.34917 > node1.45765: UDP, length 112
03:28:22.881080 IP node1.34917 > node1.39134: UDP, length 112
03:28:22.881984 IP node1.34917 > node1.48423: UDP, length 112
03:28:22.896448 IP node1.49148 > node1.53797: UDP, length 113
03:28:23.009287 IP node1.33327 > node1.60770: UDP, length 113
03:28:23.010633 IP node1.48423 > node1.60770: UDP, length 112
03:28:23.011454 IP node1.54469 > node1.60770: UDP, length 113
03:28:23.011454 IP node1.47989 > node1.60770: UDP, length 113
03:28:23.011671 IP node1.34917 > node1.60770: UDP, length 112
03:28:23.012482 IP node1.41777 > node1.60770: UDP, length 113
03:28:23.012881 IP node1.44248 > node1.60770: UDP, length 113
03:28:23.013042 IP node1.40805 > node1.60770: UDP, length 113
03:28:23.013181 IP node1.46696 > node1.60770: UDP, length 113
03:28:23.013339 IP node1.41084 > node1.60770: UDP, length 112
03:28:23.013490 IP node1.35613 > node1.60770: UDP, length 113
03:28:23.015793 IP node1.39134 > node1.60770: UDP, length 113
03:28:23.017078 IP node1.56110 > node1.60770: UDP, length 113
03:28:23.017738 IP node1.49148 > node1.60770: UDP, length 113
03:28:23.017873 IP node1.60770 > node1.46696: UDP, length 113
03:28:23.017954 IP node1.60770 > node1.41084: UDP, length 113
03:28:23.018121 IP node1.60770 > node1.47989: UDP, length 113
03:28:23.018221 IP node1.60770 > node1.49148: UDP, length 113
03:28:23.018440 IP node1.38402 > node1.60770: UDP, length 113
03:28:23.018458 IP node1.60770 > node1.39134: UDP, length 113
03:28:23.020367 IP node1.60770 > node1.48423: UDP, length 113
03:28:23.020678 IP node1.60770 > node1.38402: UDP, length 113
03:28:23.020931 IP node1.60770 > node1.34917: UDP, length 113
03:28:23.021260 IP node1.60770 > node1.35613: UDP, length 113
03:28:23.021746 IP node1.60770 > node1.45765: UDP, length 113
03:28:23.024123 IP node1.60770 > node1.53797: UDP, length 113
03:28:23.074932 IP node1.45765 > node1.46696: UDP, length 113
03:28:23.075102 IP node1.45765 > node1.44248: UDP, length 113
03:28:23.075222 IP node1.45765 > node1.41084: UDP, length 113
03:28:23.075404 IP node1.45765 > node1.41777: UDP, length 113
03:28:23.075501 IP node1.45765 > node1.40805: UDP, length 113
03:28:23.075656 IP node1.45765 > node1.48423: UDP, length 113
03:28:23.075738 IP node1.45765 > node1.34917: UDP, length 113
03:28:23.075807 IP node1.45765 > node1.47989: UDP, length 113
03:28:23.084295 IP node1.45765 > node1.35613: UDP, length 113
03:28:23.084435 IP node1.45765 > node1.49148: UDP, length 113
03:28:23.084557 IP node1.45765 > node1.38402: UDP, length 113
03:28:23.084637 IP node1.45765 > node1.39134: UDP, length 113
03:28:23.084890 IP node1.45765 > node1.60770: UDP, length 113
03:28:23.084967 IP node1.45765 > node1.53797: UDP, length 113
03:28:23.099075 IP node1.53797 > node1.60770: UDP, length 113
03:28:23.102343 IP node1.60770 > node1.44248: UDP, length 113
03:28:23.287317 IP node1.48423 > node1.37459: UDP, length 112
03:28:23.287737 IP node1.54469 > node1.37459: UDP, length 113
03:28:23.289910 IP node1.40805 > node1.37459: UDP, length 113
03:28:23.289950 IP node1.53797 > node1.37459: UDP, length 113
03:28:23.290483 IP node1.46696 > node1.37459: UDP, length 113
03:28:23.290681 IP node1.49148 > node1.37459: UDP, length 113
03:28:23.290863 IP node1.44248 > node1.37459: UDP, length 113
03:28:23.291373 IP node1.56110 > node1.37459: UDP, length 113
03:28:23.291652 IP node1.35613 > node1.37459: UDP, length 113
03:28:23.294122 IP node1.34917 > node1.37459: UDP, length 112
03:28:23.294305 IP node1.45765 > node1.37459: UDP, length 113
03:28:23.294568 IP node1.47989 > node1.37459: UDP, length 113
03:28:23.294971 IP node1.38402 > node1.37459: UDP, length 113
03:28:23.295250 IP node1.41777 > node1.37459: UDP, length 113
03:28:23.295327 IP node1.39134 > node1.37459: UDP, length 113
03:28:23.295501 IP node1.33327 > node1.37459: UDP, length 113
03:28:23.297572 IP node1.41084 > node1.37459: UDP, length 112
03:28:23.303204 IP node1.60770 > node1.37459: UDP, length 113
03:28:23.441622 IP node1.56110 > node1.41084: UDP, length 87
03:28:23.442834 IP node1.41084 > node1.56110: UDP, length 94
03:28:23.524637 IP node1.37459 > node1.60770: UDP, length 113
03:28:23.524768 IP node1.37459 > node1.53797: UDP, length 113
03:28:23.524844 IP node1.37459 > node1.35613: UDP, length 113
03:28:23.524927 IP node1.37459 > node1.45765: UDP, length 113
03:28:23.797763 IP node1.53797 > node1.45765: UDP, length 87
03:28:23.851479 IP node1.45765 > node1.53797: UDP, length 94
03:28:23.913141 IP node1.45765 > node1.34182: UDP, length 113
03:28:23.914494 IP node1.40805 > node1.34182: UDP, length 113
03:28:23.915226 IP node1.48423 > node1.34182: UDP, length 112
03:28:23.916721 IP node1.41084 > node1.34182: UDP, length 112
03:28:23.916959 IP node1.41777 > node1.34182: UDP, length 113
03:28:23.917324 IP node1.33327 > node1.34182: UDP, length 113
03:28:23.917593 IP node1.34917 > node1.34182: UDP, length 112
03:28:23.918325 IP node1.47989 > node1.34182: UDP, length 113
03:28:23.918499 IP node1.54469 > node1.34182: UDP, length 113
03:28:23.920051 IP node1.38402 > node1.34182: UDP, length 113
03:28:23.920333 IP node1.60770 > node1.34182: UDP, length 113
03:28:23.921267 IP node1.49148 > node1.34182: UDP, length 113
03:28:23.921356 IP node1.56110 > node1.34182: UDP, length 113
03:28:23.923541 IP node1.44248 > node1.34182: UDP, length 113
03:28:23.934655 IP node1.53797 > node1.34182: UDP, length 113
03:28:23.956462 IP node1.46696 > node1.34182: UDP, length 113
03:28:23.959242 IP node1.37459 > node1.34182: UDP, length 113
03:28:24.050858 IP node1.35613 > node1.34917: UDP, length 87
03:28:24.051815 IP node1.34917 > node1.35613: UDP, length 94
03:28:24.052406 IP node1.35613 > node1.34182: UDP, length 113
03:28:24.105010 IP node1.46696 > node1.47575: UDP, length 113
03:28:24.105060 IP node1.47575 > node1.34182: UDP, length 113
03:28:24.105117 IP node1.56110 > node1.47575: UDP, length 113
03:28:24.105131 IP node1.47575 > node1.37459: UDP, length 113
03:28:24.105274 IP node1.38402 > node1.47575: UDP, length 113
03:28:24.106721 IP node1.35613 > node1.47575: UDP, length 113
03:28:24.106882 IP node1.44248 > node1.47575: UDP, length 113
03:28:24.110351 IP node1.33327 > node1.47575: UDP, length 113
03:28:24.110940 IP node1.41777 > node1.47575: UDP, length 113
03:28:24.111154 IP node1.40805 > node1.47575: UDP, length 113
03:28:24.111543 IP node1.37459 > node1.47575: UDP, length 113
03:28:24.111921 IP node1.48423 > node1.47575: UDP, length 112
03:28:24.112343 IP node1.53797 > node1.47575: UDP, length 113
03:28:24.112577 IP node1.47989 > node1.47575: UDP, length 113
03:28:24.115158 IP node1.41084 > node1.47575: UDP, length 112
03:28:24.116484 IP node1.39134 > node1.34182: UDP, length 113
03:28:24.116609 IP node1.39134 > node1.47575: UDP, length 113
03:28:24.116997 IP node1.54469 > node1.47575: UDP, length 113
03:28:24.139245 IP node1.60770 > node1.47575: UDP, length 113
03:28:24.151388 IP node1.49148 > node1.47575: UDP, length 113
03:28:24.158500 IP node1.34182 > node1.45765: UDP, length 112
03:28:24.158613 IP node1.34182 > node1.53797: UDP, length 112
03:28:24.158709 IP node1.34182 > node1.60770: UDP, length 112
03:28:24.163550 IP node1.34182 > node1.37459: UDP, length 112
03:28:24.175793 IP node1.34917 > node1.47575: UDP, length 112
03:28:24.271138 IP node1.34182 > node1.47575: UDP, length 112
03:28:24.283487 IP node1.56110 > node1.35785: UDP, length 113
03:28:24.283908 IP node1.39134 > node1.35785: UDP, length 113
03:28:24.286149 IP node1.35613 > node1.35785: UDP, length 113
03:28:24.286687 IP node1.46696 > node1.35785: UDP, length 113
03:28:24.286815 IP node1.47989 > node1.35785: UDP, length 113
03:28:24.287280 IP node1.48423 > node1.35785: UDP, length 112
03:28:24.287927 IP node1.49148 > node1.35785: UDP, length 113
03:28:24.289843 IP node1.41777 > node1.35785: UDP, length 113
03:28:24.290076 IP node1.44248 > node1.35785: UDP, length 113
03:28:24.291057 IP node1.41084 > node1.35785: UDP, length 112
03:28:24.291750 IP node1.33327 > node1.35785: UDP, length 113
03:28:24.292381 IP node1.54469 > node1.35785: UDP, length 113
03:28:24.292916 IP node1.40805 > node1.35785: UDP, length 113
03:28:24.293141 IP node1.37459 > node1.35785: UDP, length 113
03:28:24.300962 IP node1.35785 > node1.34182: UDP, length 113
03:28:24.310616 IP node1.45765 > node1.47575: UDP, length 113
03:28:24.318045 IP node1.34917 > node1.35785: UDP, length 112
03:28:24.324618 IP node1.60770 > node1.35785: UDP, length 113
03:28:24.325692 IP node1.53797 > node1.35785: UDP, length 113
03:28:24.331563 IP node1.34182 > node1.35785: UDP, length 112
03:28:24.356862 IP node1.47575 > node1.35785: UDP, length 113
03:28:24.363681 IP node1.45765 > node1.35785: UDP, length 113
03:28:24.371695 IP node1.35785 > node1.37459: UDP, length 113
03:28:24.371788 IP node1.35785 > node1.47575: UDP, length 113
03:28:24.411745 IP node1.38402 > node1.35785: UDP, length 113
03:28:24.490057 IP node1.53797 > node1.40306: UDP, length 113
03:28:24.490239 IP node1.54469 > node1.40306: UDP, length 113
03:28:24.490562 IP node1.49148 > node1.40306: UDP, length 113
03:28:24.490668 IP node1.45765 > node1.40306: UDP, length 113
03:28:24.491427 IP node1.41777 > node1.40306: UDP, length 113
03:28:24.491616 IP node1.37459 > node1.40306: UDP, length 113
03:28:24.491866 IP node1.33327 > node1.40306: UDP, length 113
03:28:24.495067 IP node1.46696 > node1.40306: UDP, length 113
03:28:24.496705 IP node1.48423 > node1.40306: UDP, length 112
03:28:24.498071 IP node1.47989 > node1.40306: UDP, length 113
03:28:24.498276 IP node1.35613 > node1.40306: UDP, length 113
03:28:24.499109 IP node1.40805 > node1.40306: UDP, length 113
03:28:24.505321 IP node1.34917 > node1.40306: UDP, length 112
03:28:24.507938 IP node1.41084 > node1.40306: UDP, length 112
03:28:24.508228 IP node1.39134 > node1.40306: UDP, length 113
03:28:24.508424 IP node1.56110 > node1.40306: UDP, length 113
03:28:24.511431 IP node1.34182 > node1.40306: UDP, length 112
03:28:24.512765 IP node1.60770 > node1.40306: UDP, length 113
03:28:24.512819 IP node1.47575 > node1.40306: UDP, length 113
03:28:24.513480 IP node1.44248 > node1.40306: UDP, length 113
03:28:24.522570 IP node1.38402 > node1.40306: UDP, length 113
03:28:24.526651 IP node1.35785 > node1.40306: UDP, length 113
03:28:24.542020 IP node1.40306 > node1.34182: UDP, length 113
03:28:24.542547 IP node1.40306 > node1.47575: UDP, length 113
03:28:24.830692 IP node1.40306 > node1.35785: UDP, length 113
03:28:24.946816 IP node1.38402 > node1.44696: UDP, length 113
03:28:24.947182 IP node1.47575 > node1.44696: UDP, length 113
03:28:24.948281 IP node1.45765 > node1.44696: UDP, length 113
03:28:24.948857 IP node1.49148 > node1.44696: UDP, length 113
03:28:24.949107 IP node1.44248 > node1.44696: UDP, length 113
03:28:24.950695 IP node1.46696 > node1.44696: UDP, length 113
03:28:24.950701 IP node1.56110 > node1.44696: UDP, length 113
03:28:24.950786 IP node1.48423 > node1.44696: UDP, length 112
03:28:24.951920 IP node1.35613 > node1.44696: UDP, length 113
03:28:24.953090 IP node1.33327 > node1.44696: UDP, length 113
03:28:24.954792 IP node1.41777 > node1.44696: UDP, length 113
03:28:24.956551 IP node1.40805 > node1.44696: UDP, length 113
03:28:24.959674 IP node1.34182 > node1.44696: UDP, length 112
03:28:24.961523 IP node1.34917 > node1.44696: UDP, length 112
03:28:24.961610 IP node1.41084 > node1.44696: UDP, length 112
03:28:24.964701 IP node1.47989 > node1.44696: UDP, length 113
03:28:24.965135 IP node1.60770 > node1.44696: UDP, length 113
03:28:24.967880 IP node1.54469 > node1.44696: UDP, length 113
03:28:24.969753 IP node1.35785 > node1.44696: UDP, length 113
03:28:24.970649 IP node1.53797 > node1.44696: UDP, length 113
03:28:24.972566 IP node1.39134 > node1.44696: UDP, length 113
03:28:24.981461 IP node1.54469 > node1.40423: UDP, length 113
03:28:24.981792 IP node1.38402 > node1.40423: UDP, length 113
03:28:24.981917 IP node1.47575 > node1.40423: UDP, length 113
03:28:24.982107 IP node1.47989 > node1.40423: UDP, length 113
03:28:24.982851 IP node1.45765 > node1.40423: UDP, length 113
03:28:24.983511 IP node1.40805 > node1.40423: UDP, length 113
03:28:24.983749 IP node1.60770 > node1.40423: UDP, length 113
03:28:24.985365 IP node1.48423 > node1.40423: UDP, length 112
03:28:24.985402 IP node1.35613 > node1.40423: UDP, length 113
03:28:24.986156 IP node1.35785 > node1.40423: UDP, length 113
03:28:24.986200 IP node1.39134 > node1.40423: UDP, length 113
03:28:24.986570 IP node1.41777 > node1.40423: UDP, length 113
03:28:24.987399 IP node1.46696 > node1.40423: UDP, length 113
03:28:24.987793 IP node1.33327 > node1.40423: UDP, length 113
03:28:24.988268 IP node1.34917 > node1.40423: UDP, length 112
03:28:24.988736 IP node1.53797 > node1.40423: UDP, length 113
03:28:24.989341 IP node1.40423 > node1.47575: UDP, length 113
03:28:24.989989 IP node1.34182 > node1.40423: UDP, length 112
03:28:24.993989 IP node1.44248 > node1.40423: UDP, length 113
03:28:24.996244 IP node1.56110 > node1.40423: UDP, length 113
03:28:24.998100 IP node1.49148 > node1.40423: UDP, length 113
03:28:25.000713 IP node1.37459 > node1.40423: UDP, length 113
03:28:25.000786 IP node1.37459 > node1.44696: UDP, length 113
03:28:25.001929 IP node1.40423 > node1.34182: UDP, length 113
03:28:25.008873 IP node1.40423 > node1.35785: UDP, length 113
03:28:25.009238 IP node1.40423 > node1.40306: UDP, length 113
03:28:25.019838 IP node1.45765 > node1.42645: UDP, length 113
03:28:25.020395 IP node1.54469 > node1.42645: UDP, length 113
03:28:25.022001 IP node1.37459 > node1.42645: UDP, length 113
03:28:25.023161 IP node1.60770 > node1.42645: UDP, length 113
03:28:25.024913 IP node1.38402 > node1.42645: UDP, length 113
03:28:25.025440 IP node1.34917 > node1.42645: UDP, length 112
03:28:25.026201 IP node1.47989 > node1.42645: UDP, length 113
03:28:25.028033 IP node1.49148 > node1.42645: UDP, length 113
03:28:25.028353 IP node1.46696 > node1.42645: UDP, length 113
03:28:25.028917 IP node1.35785 > node1.42645: UDP, length 113
03:28:25.029116 IP node1.33327 > node1.42645: UDP, length 113
03:28:25.029139 IP node1.47575 > node1.42645: UDP, length 113
03:28:25.029170 IP node1.40306 > node1.40423: UDP, length 113
03:28:25.029251 IP node1.40306 > node1.42645: UDP, length 113
03:28:25.029348 IP node1.53797 > node1.42645: UDP, length 113
03:28:25.029719 IP node1.35613 > node1.42645: UDP, length 113
03:28:25.030441 IP node1.40306 > node1.44696: UDP, length 113
03:28:25.030492 IP node1.41777 > node1.42645: UDP, length 113
03:28:25.031782 IP node1.34182 > node1.42645: UDP, length 112
03:28:25.031993 IP node1.39134 > node1.42645: UDP, length 113
03:28:25.033394 IP node1.56110 > node1.42645: UDP, length 113
03:28:25.033563 IP node1.48423 > node1.42645: UDP, length 112
03:28:25.034747 IP node1.44248 > node1.42645: UDP, length 113
03:28:25.036305 IP node1.40805 > node1.42645: UDP, length 113
03:28:25.038540 IP node1.41084 > node1.40423: UDP, length 112
03:28:25.040106 IP node1.41084 > node1.42645: UDP, length 112
03:28:25.065984 IP node1.40423 > node1.44696: UDP, length 113
03:28:25.078727 IP node1.40423 > node1.42645: UDP, length 113
03:28:25.091167 IP node1.37451 > node1.40306: UDP, length 113
03:28:25.094977 IP node1.41777 > node1.37451: UDP, length 113
03:28:25.095146 IP node1.37459 > node1.37451: UDP, length 113
03:28:25.095407 IP node1.48423 > node1.37451: UDP, length 112
03:28:25.095490 IP node1.46696 > node1.37451: UDP, length 113
03:28:25.096149 IP node1.60770 > node1.37451: UDP, length 113
03:28:25.096527 IP node1.38402 > node1.37451: UDP, length 113
03:28:25.097297 IP node1.33327 > node1.37451: UDP, length 113
03:28:25.097402 IP node1.53797 > node1.37451: UDP, length 113
03:28:25.097965 IP node1.39134 > node1.37451: UDP, length 113
03:28:25.098144 IP node1.40805 > node1.37451: UDP, length 113
03:28:25.098167 IP node1.45765 > node1.37451: UDP, length 113
03:28:25.098176 IP node1.35785 > node1.37451: UDP, length 113
03:28:25.099683 IP node1.35613 > node1.37451: UDP, length 113
03:28:25.099755 IP node1.54469 > node1.37451: UDP, length 113
03:28:25.100458 IP node1.40306 > node1.37451: UDP, length 113
03:28:25.102073 IP node1.41084 > node1.37451: UDP, length 112
03:28:25.102553 IP node1.47989 > node1.37451: UDP, length 113
03:28:25.111539 IP node1.47575 > node1.37451: UDP, length 113
03:28:25.113014 IP node1.49148 > node1.37451: UDP, length 113
03:28:25.113267 IP node1.44248 > node1.37451: UDP, length 113
03:28:25.113457 IP node1.56110 > node1.37451: UDP, length 113
03:28:25.116266 IP node1.34182 > node1.37451: UDP, length 112
03:28:25.116729 IP node1.34917 > node1.37451: UDP, length 112
03:28:25.197664 IP node1.60770 > node1.37459: UDP, length 87
03:28:25.201518 IP node1.37459 > node1.60770: UDP, length 94
03:28:25.216442 IP node1.44696 > node1.47575: UDP, length 113
03:28:25.218993 IP node1.44696 > node1.35785: UDP, length 113
03:28:25.229855 IP node1.44696 > node1.40306: UDP, length 113
03:28:25.260580 IP node1.35785 > node1.44248: UDP, length 113
03:28:25.261121 IP node1.41084 > node1.44248: UDP, length 112
03:28:25.261129 IP node1.33327 > node1.44248: UDP, length 113
03:28:25.261327 IP node1.41777 > node1.44248: UDP, length 113
03:28:25.262474 IP node1.38402 > node1.44248: UDP, length 113
03:28:25.262683 IP node1.45765 > node1.44248: UDP, length 113
03:28:25.263089 IP node1.47989 > node1.44248: UDP, length 113
03:28:25.264955 IP node1.46696 > node1.44248: UDP, length 113
03:28:25.265692 IP node1.53797 > node1.44248: UDP, length 113
03:28:25.265967 IP node1.35613 > node1.44248: UDP, length 113
03:28:25.266512 IP node1.54469 > node1.44248: UDP, length 113
03:28:25.268455 IP node1.56110 > node1.44248: UDP, length 113
03:28:25.273650 IP node1.49148 > node1.44248: UDP, length 113
03:28:25.278159 IP node1.34917 > node1.44248: UDP, length 112
03:28:25.279453 IP node1.34182 > node1.44248: UDP, length 112
03:28:25.280181 IP node1.39134 > node1.44248: UDP, length 113
03:28:25.280558 IP node1.40306 > node1.44248: UDP, length 113
03:28:25.283591 IP node1.47575 > node1.44248: UDP, length 113
03:28:25.284630 IP node1.48423 > node1.44248: UDP, length 112
03:28:25.284870 IP node1.40805 > node1.44248: UDP, length 113
03:28:25.287190 IP node1.42645 > node1.35785: UDP, length 112
03:28:25.287288 IP node1.42645 > node1.40306: UDP, length 112
03:28:25.301290 IP node1.60770 > node1.44248: UDP, length 113
03:28:25.307720 IP node1.40423 > node1.37451: UDP, length 113
03:28:25.309996 IP node1.40423 > node1.44248: UDP, length 113
03:28:25.317358 IP node1.37451 > node1.44696: UDP, length 113
03:28:25.317721 IP node1.37451 > node1.40423: UDP, length 113
03:28:25.318361 IP node1.37451 > node1.42645: UDP, length 113
03:28:25.340970 IP node1.44696 > node1.40423: UDP, length 113
03:28:25.341245 IP node1.44696 > node1.42645: UDP, length 113
03:28:25.346424 IP node1.42645 > node1.44696: UDP, length 112
03:28:25.346921 IP node1.42645 > node1.40423: UDP, length 112
03:28:25.347419 IP node1.42645 > node1.37451: UDP, length 112
03:28:25.347861 IP node1.42645 > node1.44248: UDP, length 112
03:28:25.349566 IP node1.37459 > node1.44248: UDP, length 113
03:28:25.362493 IP node1.37451 > node1.44248: UDP, length 113
03:28:25.398618 IP node1.44696 > node1.44248: UDP, length 113
03:28:25.399464 IP node1.44696 > node1.37451: UDP, length 113
03:28:25.513339 IP node1.49146 > node1.35785: UDP, length 113
03:28:25.514613 IP node1.44696 > node1.49146: UDP, length 113
03:28:25.515653 IP node1.44248 > node1.49146: UDP, length 113
03:28:25.516078 IP node1.53797 > node1.49146: UDP, length 113
03:28:25.516091 IP node1.33327 > node1.49146: UDP, length 113
03:28:25.516345 IP node1.40306 > node1.49146: UDP, length 113
03:28:25.516431 IP node1.35613 > node1.49146: UDP, length 113
03:28:25.518475 IP node1.47989 > node1.49146: UDP, length 113
03:28:25.518479 IP node1.40423 > node1.49146: UDP, length 113
03:28:25.518897 IP node1.49146 > node1.40306: UDP, length 113
03:28:25.519005 IP node1.38402 > node1.49146: UDP, length 113
03:28:25.519057 IP node1.49146 > node1.44696: UDP, length 113
03:28:25.519276 IP node1.37459 > node1.49146: UDP, length 113
03:28:25.519303 IP node1.45765 > node1.49146: UDP, length 113
03:28:25.519504 IP node1.41777 > node1.49146: UDP, length 113
03:28:25.519892 IP node1.46696 > node1.49146: UDP, length 113
03:28:25.519964 IP node1.54469 > node1.49146: UDP, length 113
03:28:25.520016 IP node1.40805 > node1.49146: UDP, length 113
03:28:25.520699 IP node1.49146 > node1.44248: UDP, length 113
03:28:25.520907 IP node1.49146 > node1.37451: UDP, length 113
03:28:25.521650 IP node1.42645 > node1.49146: UDP, length 112
03:28:25.522176 IP node1.37451 > node1.49146: UDP, length 113
03:28:25.524499 IP node1.56110 > node1.49146: UDP, length 113
03:28:25.524597 IP node1.41084 > node1.49146: UDP, length 112
03:28:25.525060 IP node1.49148 > node1.49146: UDP, length 113
03:28:25.525601 IP node1.34917 > node1.49146: UDP, length 112
03:28:25.526023 IP node1.60770 > node1.49146: UDP, length 113
03:28:25.528550 IP node1.39134 > node1.49146: UDP, length 113
03:28:25.528841 IP node1.35785 > node1.49146: UDP, length 113
03:28:25.529060 IP node1.48423 > node1.49146: UDP, length 112
03:28:25.556480 IP node1.49146 > node1.42645: UDP, length 113
03:28:25.558916 IP node1.49146 > node1.40423: UDP, length 113
03:28:25.566506 IP node1.38402 > node1.35325: UDP, length 113
03:28:25.567349 IP node1.44696 > node1.35325: UDP, length 113
03:28:25.567592 IP node1.44248 > node1.35325: UDP, length 113
03:28:25.567706 IP node1.46696 > node1.35325: UDP, length 113
03:28:25.567705 IP node1.48423 > node1.35325: UDP, length 112
03:28:25.568003 IP node1.39134 > node1.35325: UDP, length 113
03:28:25.570686 IP node1.41084 > node1.35325: UDP, length 112
03:28:25.571176 IP node1.40306 > node1.35325: UDP, length 113
03:28:25.571245 IP node1.33327 > node1.35325: UDP, length 113
03:28:25.571322 IP node1.35613 > node1.35325: UDP, length 113
03:28:25.571553 IP node1.41777 > node1.35325: UDP, length 113
03:28:25.573256 IP node1.35785 > node1.35325: UDP, length 113
03:28:25.573290 IP node1.40805 > node1.35325: UDP, length 113
03:28:25.573571 IP node1.54469 > node1.35325: UDP, length 113
03:28:25.573726 IP node1.49148 > node1.35325: UDP, length 113
03:28:25.574765 IP node1.34917 > node1.35325: UDP, length 112
03:28:25.574970 IP node1.47575 > node1.35325: UDP, length 113
03:28:25.575324 IP node1.45765 > node1.35325: UDP, length 113
03:28:25.576034 IP node1.37459 > node1.35325: UDP, length 113
03:28:25.576863 IP node1.60770 > node1.35325: UDP, length 113
03:28:25.579466 IP node1.56110 > node1.35325: UDP, length 113
03:28:25.580484 IP node1.47989 > node1.35325: UDP, length 113
03:28:25.582281 IP node1.53797 > node1.35325: UDP, length 113
03:28:25.582561 IP node1.42645 > node1.35325: UDP, length 112
03:28:25.583157 IP node1.37451 > node1.35325: UDP, length 113
03:28:25.586527 IP node1.40423 > node1.35325: UDP, length 113
03:28:25.607491 IP node1.47575 > node1.49146: UDP, length 113
03:28:25.621332 IP node1.35325 > node1.44696: UDP, length 111
03:28:25.621726 IP node1.35325 > node1.40423: UDP, length 111
03:28:25.622004 IP node1.35325 > node1.42645: UDP, length 111
03:28:25.634664 IP node1.34182 > node1.49146: UDP, length 112
03:28:25.640131 IP node1.34182 > node1.35325: UDP, length 112
03:28:25.675784 IP node1.37459 > node1.47575: UDP, length 87
03:28:25.677817 IP node1.47575 > node1.37459: UDP, length 94
03:28:25.775902 IP node1.35325 > node1.37451: UDP, length 111
03:28:25.776719 IP node1.35325 > node1.49146: UDP, length 111
03:28:25.781658 IP node1.49146 > node1.35325: UDP, length 113
03:28:25.798858 IP node1.49895 > node1.49146: UDP, length 113
03:28:25.799050 IP node1.49895 > node1.44248: UDP, length 113
03:28:25.799333 IP node1.49895 > node1.40423: UDP, length 113
03:28:25.799461 IP node1.49895 > node1.35325: UDP, length 113
03:28:25.799626 IP node1.49895 > node1.37451: UDP, length 113
03:28:25.799816 IP node1.49895 > node1.44696: UDP, length 113
03:28:25.799885 IP node1.49895 > node1.42645: UDP, length 113
03:28:25.800468 IP node1.39134 > node1.49895: UDP, length 113
03:28:25.801354 IP node1.35613 > node1.49895: UDP, length 113
03:28:25.802153 IP node1.35325 > node1.44248: UDP, length 111
03:28:25.803235 IP node1.44696 > node1.49895: UDP, length 113
03:28:25.804266 IP node1.37451 > node1.49895: UDP, length 113
03:28:25.806863 IP node1.49148 > node1.49895: UDP, length 113
03:28:25.807438 IP node1.38402 > node1.49895: UDP, length 113
03:28:25.807845 IP node1.34182 > node1.49895: UDP, length 112
03:28:25.808043 IP node1.44248 > node1.49895: UDP, length 113
03:28:25.808902 IP node1.41777 > node1.49895: UDP, length 113
03:28:25.812467 IP node1.53797 > node1.49895: UDP, length 113
03:28:25.813721 IP node1.45765 > node1.49895: UDP, length 113
03:28:25.814983 IP node1.47989 > node1.49895: UDP, length 113
03:28:25.815626 IP node1.46696 > node1.49895: UDP, length 113
03:28:25.817791 IP node1.33327 > node1.49895: UDP, length 113
03:28:25.818401 IP node1.54469 > node1.49895: UDP, length 113
03:28:25.818407 IP node1.34917 > node1.49895: UDP, length 112
03:28:25.818811 IP node1.41084 > node1.49895: UDP, length 112
03:28:25.819299 IP node1.48423 > node1.49895: UDP, length 112
03:28:25.819615 IP node1.56110 > node1.49895: UDP, length 113
03:28:25.822186 IP node1.47575 > node1.49895: UDP, length 113
03:28:25.822694 IP node1.40805 > node1.49895: UDP, length 113
03:28:25.822761 IP node1.40423 > node1.49895: UDP, length 113
03:28:25.824253 IP node1.49146 > node1.49895: UDP, length 113
03:28:25.824253 IP node1.35785 > node1.49895: UDP, length 113
03:28:25.824375 IP node1.40306 > node1.49895: UDP, length 113
03:28:25.824952 IP node1.60770 > node1.49895: UDP, length 113
03:28:25.825732 IP node1.42645 > node1.49895: UDP, length 112
03:28:25.827519 IP node1.35325 > node1.49895: UDP, length 111
03:28:25.870917 IP node1.47575 > node1.48423: UDP, length 113
03:28:25.871915 IP node1.34182 > node1.48423: UDP, length 112
03:28:25.872510 IP node1.53797 > node1.48423: UDP, length 113
03:28:25.872729 IP node1.37451 > node1.48423: UDP, length 113
03:28:25.872975 IP node1.44696 > node1.48423: UDP, length 113
03:28:25.873029 IP node1.39134 > node1.48423: UDP, length 113
03:28:25.873209 IP node1.42645 > node1.48423: UDP, length 112
03:28:25.873589 IP node1.35325 > node1.48423: UDP, length 111
03:28:25.873699 IP node1.40423 > node1.48423: UDP, length 113
03:28:25.875298 IP node1.40306 > node1.48423: UDP, length 113
03:28:25.875382 IP node1.35785 > node1.48423: UDP, length 113
03:28:25.876342 IP node1.60770 > node1.48423: UDP, length 113
03:28:25.879488 IP node1.35613 > node1.48423: UDP, length 113
03:28:25.881185 IP node1.41084 > node1.48423: UDP, length 112
03:28:25.882518 IP node1.46696 > node1.48423: UDP, length 113
03:28:25.882534 IP node1.38402 > node1.48423: UDP, length 113
03:28:25.882704 IP node1.49148 > node1.48423: UDP, length 113
03:28:25.883504 IP node1.44248 > node1.48423: UDP, length 113
03:28:25.883681 IP node1.41777 > node1.48423: UDP, length 113
03:28:25.884312 IP node1.40805 > node1.48423: UDP, length 113
03:28:25.884667 IP node1.49146 > node1.48423: UDP, length 113
03:28:25.886985 IP node1.45765 > node1.48423: UDP, length 113
03:28:25.888068 IP node1.33327 > node1.48423: UDP, length 113
03:28:25.888191 IP node1.47989 > node1.48423: UDP, length 113
03:28:25.888680 IP node1.54469 > node1.48423: UDP, length 113
03:28:25.888865 IP node1.34917 > node1.48423: UDP, length 112
03:28:25.889368 IP node1.56110 > node1.48423: UDP, length 113
03:28:25.894485 IP node1.49895 > node1.48423: UDP, length 113
03:28:25.978963 IP node1.37459 > node1.48423: UDP, length 113
03:28:25.979038 IP node1.37459 > node1.49895: UDP, length 113
03:28:26.320935 IP node1.40306 > node1.40423: UDP, length 87
03:28:26.323643 IP node1.40423 > node1.40306: UDP, length 94
03:28:26.465464 IP node1.49146 > node1.49895: UDP, length 87
03:28:26.466939 IP node1.49895 > node1.49146: UDP, length 94
03:28:27.798102 IP node1.47989 > node1.35785: UDP, length 113
03:28:27.798270 IP node1.34917 > node1.35785: UDP, length 112
03:28:27.798384 IP node1.54469 > node1.35785: UDP, length 113
03:28:27.798685 IP node1.60770 > node1.35785: UDP, length 113
03:28:27.798891 IP node1.35613 > node1.35785: UDP, length 113
03:28:27.799028 IP node1.44248 > node1.35785: UDP, length 113
03:28:27.799847 IP node1.48423 > node1.35785: UDP, length 112
03:28:27.800263 IP node1.46696 > node1.35785: UDP, length 113
03:28:27.800263 IP node1.56110 > node1.35785: UDP, length 113
03:28:27.800407 IP node1.33327 > node1.35785: UDP, length 113
03:28:27.800711 IP node1.41084 > node1.35785: UDP, length 112
03:28:27.800840 IP node1.38402 > node1.35785: UDP, length 113
03:28:27.800879 IP node1.49148 > node1.35785: UDP, length 113
03:28:27.801569 IP node1.34182 > node1.35785: UDP, length 112
03:28:27.801791 IP node1.35325 > node1.35785: UDP, length 111
03:28:27.802792 IP node1.41777 > node1.35785: UDP, length 113
03:28:27.803560 IP node1.45765 > node1.35785: UDP, length 113
03:28:27.803560 IP node1.39134 > node1.35785: UDP, length 113
03:28:27.803573 IP node1.53797 > node1.35785: UDP, length 113
03:28:27.804339 IP node1.40306 > node1.35785: UDP, length 113
03:28:27.805861 IP node1.42645 > node1.35785: UDP, length 112
03:28:27.805947 IP node1.40423 > node1.35785: UDP, length 113
03:28:27.806491 IP node1.47575 > node1.35785: UDP, length 113
03:28:27.806921 IP node1.40805 > node1.35785: UDP, length 113
03:28:27.807279 IP node1.37459 > node1.35785: UDP, length 113
03:28:27.807591 IP node1.37451 > node1.35785: UDP, length 113
03:28:27.807593 IP node1.49895 > node1.35785: UDP, length 113
03:28:27.808746 IP node1.49146 > node1.35785: UDP, length 113
03:28:27.808758 IP node1.44696 > node1.35785: UDP, length 113
03:28:28.003716 IP node1.48423 > node1.35785: UDP, length 87
03:28:28.004864 IP node1.35785 > node1.48423: UDP, length 94
03:28:28.503107 IP node1.40805 > node1.42645: UDP, length 113
03:28:28.503159 IP node1.40423 > node1.42645: UDP, length 113
03:28:28.503170 IP node1.38402 > node1.42645: UDP, length 113
03:28:28.503856 IP node1.48423 > node1.42645: UDP, length 112
03:28:28.503927 IP node1.53797 > node1.42645: UDP, length 113
03:28:28.504689 IP node1.47575 > node1.42645: UDP, length 113
03:28:28.504693 IP node1.41777 > node1.42645: UDP, length 113
03:28:28.504817 IP node1.34182 > node1.42645: UDP, length 112
03:28:28.504904 IP node1.39134 > node1.42645: UDP, length 113
03:28:28.505099 IP node1.44696 > node1.42645: UDP, length 113
03:28:28.505156 IP node1.49895 > node1.42645: UDP, length 113
03:28:28.506080 IP node1.35325 > node1.42645: UDP, length 111
03:28:28.506239 IP node1.54469 > node1.42645: UDP, length 113
03:28:28.506306 IP node1.33327 > node1.42645: UDP, length 113
03:28:28.506563 IP node1.60770 > node1.42645: UDP, length 113
03:28:28.506796 IP node1.37459 > node1.42645: UDP, length 113
03:28:28.506805 IP node1.56110 > node1.42645: UDP, length 113
03:28:28.508280 IP node1.41084 > node1.42645: UDP, length 112
03:28:28.508311 IP node1.35785 > node1.42645: UDP, length 113
03:28:28.508360 IP node1.37451 > node1.42645: UDP, length 113
03:28:28.508588 IP node1.40306 > node1.42645: UDP, length 113
03:28:28.508862 IP node1.44248 > node1.42645: UDP, length 113
03:28:28.509684 IP node1.35613 > node1.42645: UDP, length 113
03:28:28.509923 IP node1.47989 > node1.42645: UDP, length 113
03:28:28.510020 IP node1.49146 > node1.42645: UDP, length 113
03:28:28.510202 IP node1.45765 > node1.42645: UDP, length 113
03:28:28.510477 IP node1.34917 > node1.42645: UDP, length 112
03:28:28.511977 IP node1.49148 > node1.42645: UDP, length 113
03:28:28.512136 IP node1.46696 > node1.42645: UDP, length 113
03:28:28.593079 IP node1.35785 > node1.42645: UDP, length 87
03:28:28.667219 IP node1.42645 > node1.35785: UDP, length 94
03:28:28.845841 IP node1.35785 > node1.35325: UDP, length 113
03:28:28.846969 IP node1.54469 > node1.35325: UDP, length 113
03:28:28.847169 IP node1.49895 > node1.35325: UDP, length 113
03:28:28.847272 IP node1.40306 > node1.35325: UDP, length 113
03:28:28.847437 IP node1.49148 > node1.35325: UDP, length 113
03:28:28.847718 IP node1.40423 > node1.35325: UDP, length 113
03:28:28.847953 IP node1.34917 > node1.35325: UDP, length 112
03:28:28.848519 IP node1.37451 > node1.35325: UDP, length 113
03:28:28.848707 IP node1.44696 > node1.35325: UDP, length 113
03:28:28.850236 IP node1.45765 > node1.35325: UDP, length 113
03:28:28.850241 IP node1.47989 > node1.35325: UDP, length 113
03:28:28.851505 IP node1.35613 > node1.35325: UDP, length 113
03:28:28.851504 IP node1.41084 > node1.35325: UDP, length 112
03:28:28.851688 IP node1.39134 > node1.35325: UDP, length 113
03:28:28.851743 IP node1.48423 > node1.35325: UDP, length 112
03:28:28.851987 IP node1.38402 > node1.35325: UDP, length 113
03:28:28.852549 IP node1.42645 > node1.35325: UDP, length 112
03:28:28.852646 IP node1.46696 > node1.35325: UDP, length 113
03:28:28.853446 IP node1.49146 > node1.35325: UDP, length 113
03:28:28.853897 IP node1.47575 > node1.35325: UDP, length 113
03:28:28.854647 IP node1.41777 > node1.35325: UDP, length 113
03:28:28.855367 IP node1.44248 > node1.35325: UDP, length 113
03:28:28.855439 IP node1.60770 > node1.35325: UDP, length 113
03:28:28.855599 IP node1.40805 > node1.35325: UDP, length 113
03:28:28.855783 IP node1.34182 > node1.35325: UDP, length 112
03:28:28.856071 IP node1.33327 > node1.35325: UDP, length 113
03:28:28.856074 IP node1.53797 > node1.35325: UDP, length 113
03:28:28.856379 IP node1.56110 > node1.35325: UDP, length 113
03:28:28.859801 IP node1.37459 > node1.35325: UDP, length 113
03:28:29.166157 IP node1.42645 > node1.35325: UDP, length 87
03:28:29.167417 IP node1.35325 > node1.42645: UDP, length 94

