03:28:09.225699 IP node2.53696 > node2.39799: UDP, length 110
03:28:09.277993 IP node2.39799 > node2.53696: UDP, length 113
03:28:09.381738 IP node2.53696 > node2.52204: UDP, length 110
03:28:09.382170 IP node2.39799 > node2.52204: UDP, length 113
03:28:09.437823 IP node2.52204 > node2.39799: UDP, length 113
03:28:09.991525 IP node2.52204 > node2.44309: UDP, length 113
03:28:09.991703 IP node2.39799 > node2.44309: UDP, length 113
03:28:09.991889 IP node2.53696 > node2.44309: UDP, length 110
03:28:10.206396 IP node2.39799 > node2.59155: UDP, length 113
03:28:10.206587 IP node2.53696 > node2.59155: UDP, length 110
03:28:10.206766 IP node2.52204 > node2.59155: UDP, length 113
03:28:10.206990 IP node2.44309 > node2.59155: UDP, length 113
03:28:10.207311 IP node2.59155 > node2.44309: UDP, length 113
03:28:10.302154 IP node2.39799 > node2.56279: UDP, length 113
03:28:10.302436 IP node2.44309 > node2.56279: UDP, length 113
03:28:10.302902 IP node2.52204 > node2.56279: UDP, length 113
03:28:10.303011 IP node2.53696 > node2.56279: UDP, length 110
03:28:10.307151 IP node2.59155 > node2.56279: UDP, length 113
03:28:10.391499 IP node2.56279 > node2.59155: UDP, length 113
03:28:10.425047 IP node2.39799 > node2.39953: UDP, length 113
03:28:10.426799 IP node2.56279 > node2.39953: UDP, length 113
03:28:10.428459 IP node2.44309 > node2.39953: UDP, length 113
03:28:10.428613 IP node2.59155 > node2.39953: UDP, length 113
03:28:10.428769 IP node2.52204 > node2.39953: UDP, length 113
03:28:10.429106 IP node2.53696 > node2.39953: UDP, length 110
03:28:10.431525 IP node2.53696 > node2.60393: UDP, length 110
03:28:10.431675 IP node2.44309 > node2.60393: UDP, length 113
03:28:10.432102 IP node2.52204 > node2.60393: UDP, length 113
03:28:10.432469 IP node2.56279 > node2.60393: UDP, length 113
03:28:10.436450 IP node2.39799 > node2.60393: UDP, length 113
03:28:10.437196 IP node2.59155 > node2.60393: UDP, length 113
03:28:10.483989 IP node2.39799 > node2.45886: UDP, length 113
03:28:10.485560 IP node2.44309 > node2.45886: UDP, length 113
03:28:10.485764 IP node2.59155 > node2.45886: UDP, length 113
03:28:10.485997 IP node2.56279 > node2.45886: UDP, length 113
03:28:10.486151 IP node2.53696 > node2.45886: UDP, length 110
03:28:10.486376 IP node2.52204 > node2.45886: UDP, length 113
03:28:10.563533 IP node2.45886 > node2.59155: UDP, length 112
03:28:10.567311 IP node2.39953 > node2.59155: UDP, length 113
03:28:10.567421 IP node2.39953 > node2.60393: UDP, length 113
03:28:10.567421 IP node2.45886 > node2.56279: UDP, length 112
03:28:10.567456 IP node2.39953 > node2.56279: UDP, length 113
03:28:10.567595 IP node2.39953 > node2.45886: UDP, length 113
03:28:10.568009 IP node2.45886 > node2.39953: UDP, length 112
03:28:10.568244 IP node2.45886 > node2.60393: UDP, length 112
03:28:10.571535 IP node2.60393 > node2.44309: UDP, length 113
03:28:10.572171 IP node2.60393 > node2.59155: UDP, length 113
03:28:10.572552 IP node2.60393 > node2.56279: UDP, length 113
03:28:10.573143 IP node2.60393 > node2.39953: UDP, length 113
03:28:10.574532 IP node2.53696 > node2.34019: UDP, length 110
03:28:10.574532 IP node2.44309 > node2.34019: UDP, length 113
03:28:10.574988 IP node2.39799 > node2.34019: UDP, length 113
03:28:10.575019 IP node2.52204 > node2.34019: UDP, length 113
03:28:10.575141 IP node2.56279 > node2.34019: UDP, length 113
03:28:10.575675 IP node2.59155 > node2.34019: UDP, length 113
03:28:10.576182 IP node2.45886 > node2.34019: UDP, length 112
03:28:10.579167 IP node2.60393 > node2.45886: UDP, length 113
03:28:10.579869 IP node2.60393 > node2.34019: UDP, length 113
03:28:10.583047 IP node2.39953 > node2.34019: UDP, length 113
03:28:10.701926 IP node2.34019 > node2.56279: UDP, length 113
03:28:10.702667 IP node2.34019 > node2.39953: UDP, length 113
03:28:10.702899 IP node2.34019 > node2.60393: UDP, length 113
03:28:10.703109 IP node2.34019 > node2.45886: UDP, length 113
03:28:10.704615 IP node2.34019 > node2.59155: UDP, length 113
03:28:10.726836 IP node2.56279 > node2.50964: UDP, length 113
03:28:10.727071 IP node2.44309 > node2.50964: UDP, length 113
03:28:10.727239 IP node2.53696 > node2.50964: UDP, length 110
03:28:10.728754 IP node2.50964 > node2.56279: UDP, length 113
03:28:10.731024 IP node2.34019 > node2.50964: UDP, length 113
03:28:10.732028 IP node2.50964 > node2.60393: UDP, length 113
03:28:10.733180 IP node2.45886 > node2.50964: UDP, length 112
03:28:10.733227 IP node2.59155 > node2.50964: UDP, length 113
03:28:10.733394 IP node2.39953 > node2.50964: UDP, length 113
03:28:10.733749 IP node2.39799 > node2.50964: UDP, length 113
03:28:10.733911 IP node2.52204 > node2.50964: UDP, length 113
03:28:10.734191 IP node2.50964 > node2.45886: UDP, length 113
03:28:10.734351 IP node2.50964 > node2.34019: UDP, length 113
03:28:10.738452 IP node2.50964 > node2.39953: UDP, length 113
03:28:10.739103 IP node2.60393 > node2.50964: UDP, length 113
03:28:10.867791 IP node2.34019 > node2.37408: UDP, length 113
03:28:10.869908 IP node2.60393 > node2.37408: UDP, length 113
03:28:10.870069 IP node2.39799 > node2.37408: UDP, length 113
03:28:10.870241 IP node2.52204 > node2.37408: UDP, length 113
03:28:10.870769 IP node2.59155 > node2.37408: UDP, length 113
03:28:10.870925 IP node2.39953 > node2.37408: UDP, length 113
03:28:10.871757 IP node2.45886 > node2.37408: UDP, length 112
03:28:10.871757 IP node2.50964 > node2.37408: UDP, length 113
03:28:10.872144 IP node2.56279 > node2.37408: UDP, length 113
03:28:10.872365 IP node2.44309 > node2.37408: UDP, length 113
03:28:10.872582 IP node2.53696 > node2.37408: UDP, length 110
03:28:10.909671 IP node2.60393 > node2.46185: UDP, length 113
03:28:10.909785 IP node2.37408 > node2.60393: UDP, length 112
03:28:10.909887 IP node2.39799 > node2.46185: UDP, length 113
03:28:10.910053 IP node2.50964 > node2.46185: UDP, length 113
03:28:10.910285 IP node2.37408 > node2.45886: UDP, length 112
03:28:10.910285 IP node2.56279 > node2.46185: UDP, length 113
03:28:10.910344 IP node2.39953 > node2.46185: UDP, length 113
03:28:10.910344 IP node2.34019 > node2.46185: UDP, length 113
03:28:10.910459 IP node2.44309 > node2.46185: UDP, length 113
03:28:10.910498 IP node2.52204 > node2.46185: UDP, length 113
03:28:10.910607 IP node2.53696 > node2.46185: UDP, length 110
03:28:10.910652 IP node2.59155 > node2.46185: UDP, length 113
03:28:10.910823 IP node2.37408 > node2.34019: UDP, length 112
03:28:10.910893 IP node2.45886 > node2.46185: UDP, length 112
03:28:10.911741 IP node2.37408 > node2.50964: UDP, length 112
03:28:10.961534 IP node2.46185 > node2.39953: UDP, length 113
03:28:10.967955 IP node2.37408 > node2.46185: UDP, length 112
03:28:10.968030 IP node2.37408 > node2.39953: UDP, length 112
03:28:10.988565 IP node2.46185 > node2.60393: UDP, length 113
03:28:10.988756 IP node2.46185 > node2.45886: UDP, length 113
03:28:10.988904 IP node2.46185 > node2.34019: UDP, length 113
03:28:10.988986 IP node2.46185 > node2.50964: UDP, length 113
03:28:10.989150 IP node2.46185 > node2.37408: UDP, length 113
03:28:11.070597 IP node2.34019 > node2.59524: UDP, length 113
03:28:11.070931 IP node2.37408 > node2.59524: UDP, length 112
03:28:11.073571 IP node2.44309 > node2.59524: UDP, length 113
03:28:11.073710 IP node2.50964 > node2.59524: UDP, length 113
03:28:11.073736 IP node2.53696 > node2.59524: UDP, length 110
03:28:11.073886 IP node2.39953 > node2.59524: UDP, length 113
03:28:11.074076 IP node2.60393 > node2.59524: UDP, length 113
03:28:11.074243 IP node2.45886 > node2.59524: UDP, length 112
03:28:11.074502 IP node2.59155 > node2.59524: UDP, length 113
03:28:11.074664 IP node2.52204 > node2.59524: UDP, length 113
03:28:11.074809 IP node2.39799 > node2.59524: UDP, length 113
03:28:11.075204 IP node2.56279 > node2.59524: UDP, length 113
03:28:11.083232 IP node2.46185 > node2.59524: UDP, length 113
03:28:11.166546 IP node2.59524 > node2.37408: UDP, length 113
03:28:11.170172 IP node2.59524 > node2.46185: UDP, length 113
03:28:11.181410 IP node2.59524 > node2.50964: UDP, length 113
03:28:11.238020 IP node2.34019 > node2.57377: UDP, length 113
03:28:11.238136 IP node2.37408 > node2.57377: UDP, length 112
03:28:11.242534 IP node2.39953 > node2.57377: UDP, length 113
03:28:11.242785 IP node2.50964 > node2.57377: UDP, length 113
03:28:11.243175 IP node2.56279 > node2.57377: UDP, length 113
03:28:11.243318 IP node2.46185 > node2.57377: UDP, length 113
03:28:11.243792 IP node2.44309 > node2.57377: UDP, length 113
03:28:11.243991 IP node2.45886 > node2.57377: UDP, length 112
03:28:11.243991 IP node2.53696 > node2.57377: UDP, length 110
03:28:11.244187 IP node2.59524 > node2.57377: UDP, length 113
03:28:11.244355 IP node2.60393 > node2.57377: UDP, length 113
03:28:11.244532 IP node2.52204 > node2.57377: UDP, length 113
03:28:11.244722 IP node2.59155 > node2.57377: UDP, length 113
03:28:11.245744 IP node2.39799 > node2.57377: UDP, length 113
03:28:11.305690 IP node2.42580 > node2.59524: UDP, length 112
03:28:11.306542 IP node2.34019 > node2.42580: UDP, length 113
03:28:11.307772 IP node2.37408 > node2.42580: UDP, length 112
03:28:11.310754 IP node2.53696 > node2.42580: UDP, length 110
03:28:11.313425 IP node2.44309 > node2.42580: UDP, length 113
03:28:11.313608 IP node2.59524 > node2.42580: UDP, length 113
03:28:11.313860 IP node2.46185 > node2.42580: UDP, length 113
03:28:11.314055 IP node2.45886 > node2.42580: UDP, length 112
03:28:11.314255 IP node2.60393 > node2.42580: UDP, length 113
03:28:11.314528 IP node2.59155 > node2.42580: UDP, length 113
03:28:11.314799 IP node2.52204 > node2.42580: UDP, length 113
03:28:11.315012 IP node2.39799 > node2.42580: UDP, length 113
03:28:11.316051 IP node2.56279 > node2.42580: UDP, length 113
03:28:11.316642 IP node2.39953 > node2.42580: UDP, length 113
03:28:11.317502 IP node2.50964 > node2.42580: UDP, length 113
03:28:11.319312 IP node2.57377 > node2.46185: UDP, length 113
03:28:11.321756 IP node2.42580 > node2.57377: UDP, length 112
03:28:11.321817 IP node2.57377 > node2.42580: UDP, length 113
03:28:11.323768 IP node2.57377 > node2.59524: UDP, length 113
03:28:11.354431 IP node2.45754 > node2.59524: UDP, length 113
03:28:11.355812 IP node2.34019 > node2.45754: UDP, length 113
03:28:11.357042 IP node2.57377 > node2.45754: UDP, length 113
03:28:11.357266 IP node2.45754 > node2.57377: UDP, length 113
03:28:11.357762 IP node2.45754 > node2.42580: UDP, length 113
03:28:11.358057 IP node2.54377 > node2.46185: UDP, length 113
03:28:11.358224 IP node2.45754 > node2.54377: UDP, length 113
03:28:11.359983 IP node2.54377 > node2.57377: UDP, length 113
03:28:11.360200 IP node2.57377 > node2.54377: UDP, length 113
03:28:11.361699 IP node2.37408 > node2.45754: UDP, length 112
03:28:11.362069 IP node2.56279 > node2.45754: UDP, length 113
03:28:11.362268 IP node2.54377 > node2.42580: UDP, length 113
03:28:11.362340 IP node2.37408 > node2.54377: UDP, length 112
03:28:11.362401 IP node2.45886 > node2.54377: UDP, length 112
03:28:11.362413 IP node2.45886 > node2.45754: UDP, length 112
03:28:11.362701 IP node2.39953 > node2.54377: UDP, length 113
03:28:11.362725 IP node2.39953 > node2.45754: UDP, length 113
03:28:11.363034 IP node2.44309 > node2.45754: UDP, length 113
03:28:11.366008 IP node2.53696 > node2.54377: UDP, length 110
03:28:11.366060 IP node2.53696 > node2.45754: UDP, length 110
03:28:11.367858 IP node2.50964 > node2.54377: UDP, length 113
03:28:11.367928 IP node2.50964 > node2.45754: UDP, length 113
03:28:11.368001 IP node2.54377 > node2.59524: UDP, length 113
03:28:11.368235 IP node2.54377 > node2.45754: UDP, length 113
03:28:11.370113 IP node2.44309 > node2.54377: UDP, length 113
03:28:11.371398 IP node2.34019 > node2.54377: UDP, length 113
03:28:11.373470 IP node2.59524 > node2.54377: UDP, length 113
03:28:11.373516 IP node2.59524 > node2.45754: UDP, length 113
03:28:11.374233 IP node2.56279 > node2.54377: UDP, length 113
03:28:11.375085 IP node2.46185 > node2.54377: UDP, length 113
03:28:11.375150 IP node2.46185 > node2.45754: UDP, length 113
03:28:11.376454 IP node2.42580 > node2.54377: UDP, length 112
03:28:11.376524 IP node2.42580 > node2.45754: UDP, length 112
03:28:11.378225 IP node2.60393 > node2.54377: UDP, length 113
03:28:11.378280 IP node2.60393 > node2.45754: UDP, length 113
03:28:11.378521 IP node2.52204 > node2.54377: UDP, length 113
03:28:11.378567 IP node2.52204 > node2.45754: UDP, length 113
03:28:11.378845 IP node2.59155 > node2.54377: UDP, length 113
03:28:11.378889 IP node2.59155 > node2.45754: UDP, length 113
03:28:11.379578 IP node2.39799 > node2.54377: UDP, length 113
03:28:11.379629 IP node2.39799 > node2.45754: UDP, length 113
03:28:11.419271 IP node2.56345 > node2.50964: UDP, length 113
03:28:11.421562 IP node2.39953 > node2.56345: UDP, length 113
03:28:11.422614 IP node2.50964 > node2.56345: UDP, length 113
03:28:11.423455 IP node2.57377 > node2.56345: UDP, length 113
03:28:11.424977 IP node2.45886 > node2.56345: UDP, length 112
03:28:11.425097 IP node2.56345 > node2.59524: UDP, length 113
03:28:11.425197 IP node2.56345 > node2.46185: UDP, length 113
03:28:11.425208 IP node2.56279 > node2.56345: UDP, length 113
03:28:11.425397 IP node2.56345 > node2.57377: UDP, length 113
03:28:11.425397 IP node2.44309 > node2.56345: UDP, length 113
03:28:11.425496 IP node2.56345 > node2.54377: UDP, length 113
03:28:11.425572 IP node2.53696 > node2.56345: UDP, length 110
03:28:11.425575 IP node2.56345 > node2.42580: UDP, length 113
03:28:11.425642 IP node2.56345 > node2.45754: UDP, length 113
03:28:11.426723 IP node2.34019 > node2.56345: UDP, length 113
03:28:11.429057 IP node2.42580 > node2.56345: UDP, length 112
03:28:11.429388 IP node2.59524 > node2.56345: UDP, length 113
03:28:11.429882 IP node2.56345 > node2.37408: UDP, length 113
03:28:11.430461 IP node2.60393 > node2.56345: UDP, length 113
03:28:11.430623 IP node2.39799 > node2.56345: UDP, length 113
03:28:11.430780 IP node2.52204 > node2.56345: UDP, length 113
03:28:11.430847 IP node2.45754 > node2.56345: UDP, length 113
03:28:11.431785 IP node2.54377 > node2.56345: UDP, length 113
03:28:11.431841 IP node2.37408 > node2.56345: UDP, length 112
03:28:11.432779 IP node2.59155 > node2.56345: UDP, length 113
03:28:11.433490 IP node2.46185 > node2.56345: UDP, length 113
03:28:11.460838 IP node2.46985 > node2.59524: UDP, length 113
03:28:11.461575 IP node2.46985 > node2.57377: UDP, length 113
03:28:11.461651 IP node2.46985 > node2.56345: UDP, length 113
03:28:11.461719 IP node2.46985 > node2.54377: UDP, length 113
03:28:11.461810 IP node2.46985 > node2.42580: UDP, length 113
03:28:11.461890 IP node2.46985 > node2.45754: UDP, length 113
03:28:11.463026 IP node2.37408 > node2.46985: UDP, length 112
03:28:11.463461 IP node2.39953 > node2.46985: UDP, length 113
03:28:11.464921 IP node2.45886 > node2.46985: UDP, length 112
03:28:11.465137 IP node2.34019 > node2.46985: UDP, length 113
03:28:11.465300 IP node2.56279 > node2.46985: UDP, length 113
03:28:11.465373 IP node2.44309 > node2.46985: UDP, length 113
03:28:11.465462 IP node2.56345 > node2.46985: UDP, length 113
03:28:11.465700 IP node2.53696 > node2.46985: UDP, length 110
03:28:11.465756 IP node2.50964 > node2.46985: UDP, length 113
03:28:11.466204 IP node2.57377 > node2.46985: UDP, length 113
03:28:11.466457 IP node2.42580 > node2.46985: UDP, length 112
03:28:11.466706 IP node2.59524 > node2.46985: UDP, length 113
03:28:11.467025 IP node2.60393 > node2.46985: UDP, length 113
03:28:11.467238 IP node2.54377 > node2.46985: UDP, length 113
03:28:11.467486 IP node2.59155 > node2.46985: UDP, length 113
03:28:11.467636 IP node2.45754 > node2.46985: UDP, length 113
03:28:11.468534 IP node2.52204 > node2.46985: UDP, length 113
03:28:11.468754 IP node2.46185 > node2.46985: UDP, length 113
03:28:11.471155 IP node2.39799 > node2.46985: UDP, length 113
03:28:11.642316 IP node2.45754 > node2.54401: UDP, length 113
03:28:11.643173 IP node2.37408 > node2.54401: UDP, length 112
03:28:11.645172 IP node2.42580 > node2.54401: UDP, length 112
03:28:11.645388 IP node2.46185 > node2.54401: UDP, length 113
03:28:11.645558 IP node2.60393 > node2.54401: UDP, length 113
03:28:11.645700 IP node2.54377 > node2.54401: UDP, length 113
03:28:11.646187 IP node2.52204 > node2.54401: UDP, length 113
03:28:11.646469 IP node2.39799 > node2.54401: UDP, length 113
03:28:11.646886 IP node2.46985 > node2.54401: UDP, length 113
03:28:11.647345 IP node2.57377 > node2.54401: UDP, length 113
03:28:11.648745 IP node2.56345 > node2.54401: UDP, length 113
03:28:11.649161 IP node2.59524 > node2.54401: UDP, length 113
03:28:11.649327 IP node2.50964 > node2.54401: UDP, length 113
03:28:11.649577 IP node2.34019 > node2.54401: UDP, length 113
03:28:11.649901 IP node2.45886 > node2.54401: UDP, length 112
03:28:11.650148 IP node2.56279 > node2.54401: UDP, length 113
03:28:11.650332 IP node2.39953 > node2.54401: UDP, length 113
03:28:11.653759 IP node2.53696 > node2.54401: UDP, length 110
03:28:11.654292 IP node2.44309 > node2.54401: UDP, length 113
03:28:11.655031 IP node2.59155 > node2.54401: UDP, length 113
03:28:11.721433 IP node2.56345 > node2.50586: UDP, length 113
03:28:11.722209 IP node2.39799 > node2.50586: UDP, length 113
03:28:11.722402 IP node2.52204 > node2.50586: UDP, length 113
03:28:11.722584 IP node2.60393 > node2.50586: UDP, length 113
03:28:11.723197 IP node2.46185 > node2.50586: UDP, length 113
03:28:11.723406 IP node2.45754 > node2.50586: UDP, length 113
03:28:11.723764 IP node2.59155 > node2.50586: UDP, length 113
03:28:11.723969 IP node2.37408 > node2.50586: UDP, length 112
03:28:11.724542 IP node2.46985 > node2.50586: UDP, length 113
03:28:11.724611 IP node2.42580 > node2.50586: UDP, length 112
03:28:11.724607 IP node2.50964 > node2.50586: UDP, length 113
03:28:11.724977 IP node2.59524 > node2.50586: UDP, length 113
03:28:11.725419 IP node2.57377 > node2.50586: UDP, length 113
03:28:11.725605 IP node2.54377 > node2.50586: UDP, length 113
03:28:11.726180 IP node2.53696 > node2.50586: UDP, length 110
03:28:11.726478 IP node2.44309 > node2.50586: UDP, length 113
03:28:11.726770 IP node2.45754 > node2.52757: UDP, length 113
03:28:11.726904 IP node2.52757 > node2.45754: UDP, length 113
03:28:11.727275 IP node2.60393 > node2.52757: UDP, length 113
03:28:11.727467 IP node2.46185 > node2.52757: UDP, length 113
03:28:11.727467 IP node2.39953 > node2.50586: UDP, length 113
03:28:11.727687 IP node2.56279 > node2.50586: UDP, length 113
03:28:11.728084 IP node2.46985 > node2.52757: UDP, length 113
03:28:11.728249 IP node2.52757 > node2.54377: UDP, length 113
03:28:11.728266 IP node2.45886 > node2.50586: UDP, length 112
03:28:11.728511 IP node2.34019 > node2.50586: UDP, length 113
03:28:11.728529 IP node2.52204 > node2.52757: UDP, length 113
03:28:11.728975 IP node2.52757 > node2.56345: UDP, length 113
03:28:11.729073 IP node2.42580 > node2.52757: UDP, length 112
03:28:11.729248 IP node2.52757 > node2.46985: UDP, length 113
03:28:11.729610 IP node2.52757 > node2.54401: UDP, length 113
03:28:11.729863 IP node2.52757 > node2.50586: UDP, length 113
03:28:11.729931 IP node2.39799 > node2.52757: UDP, length 113
03:28:11.730802 IP node2.37408 > node2.52757: UDP, length 112
03:28:11.731902 IP node2.59155 > node2.52757: UDP, length 113
03:28:11.732328 IP node2.34019 > node2.52757: UDP, length 113
03:28:11.732387 IP node2.56279 > node2.52757: UDP, length 113
03:28:11.733987 IP node2.59524 > node2.52757: UDP, length 113
03:28:11.734332 IP node2.56345 > node2.52757: UDP, length 113
03:28:11.734571 IP node2.57377 > node2.52757: UDP, length 113
03:28:11.735179 IP node2.39953 > node2.52757: UDP, length 113
03:28:11.735937 IP node2.45886 > node2.52757: UDP, length 112
03:28:11.736206 IP node2.44309 > node2.52757: UDP, length 113
03:28:11.736743 IP node2.54377 > node2.52757: UDP, length 113
03:28:11.737277 IP node2.50964 > node2.52757: UDP, length 113
03:28:11.738132 IP node2.53696 > node2.52757: UDP, length 110
03:28:11.750984 IP node2.54401 > node2.50586: UDP, length 112
03:28:11.751069 IP node2.54401 > node2.52757: UDP, length 112
03:28:11.771705 IP node2.50586 > node2.54401: UDP, length 113
03:28:11.771806 IP node2.50586 > node2.52757: UDP, length 113
03:28:11.802921 IP node2.37408 > node2.46331: UDP, length 112
03:28:11.803314 IP node2.57377 > node2.46331: UDP, length 113
03:28:11.805174 IP node2.34019 > node2.46331: UDP, length 113
03:28:11.805457 IP node2.53696 > node2.46331: UDP, length 110
03:28:11.805670 IP node2.54377 > node2.46331: UDP, length 113
03:28:11.806614 IP node2.56279 > node2.46331: UDP, length 113
03:28:11.806666 IP node2.50586 > node2.46331: UDP, length 113
03:28:11.807785 IP node2.50964 > node2.46331: UDP, length 113
03:28:11.807921 IP node2.46331 > node2.54401: UDP, length 113
03:28:11.808374 IP node2.46331 > node2.52757: UDP, length 113
03:28:11.808406 IP node2.46985 > node2.46331: UDP, length 113
03:28:11.812056 IP node2.44309 > node2.46331: UDP, length 113
03:28:11.812539 IP node2.59155 > node2.46331: UDP, length 113
03:28:11.814521 IP node2.46185 > node2.46331: UDP, length 113
03:28:11.815314 IP node2.54401 > node2.46331: UDP, length 112
03:28:11.815872 IP node2.56345 > node2.46331: UDP, length 113
03:28:11.816613 IP node2.42580 > node2.46331: UDP, length 112
03:28:11.817029 IP node2.45886 > node2.46331: UDP, length 112
03:28:11.818326 IP node2.46331 > node2.50586: UDP, length 113
03:28:11.818675 IP node2.39953 > node2.46331: UDP, length 113
03:28:11.819951 IP node2.45754 > node2.46331: UDP, length 113
03:28:11.820553 IP node2.39799 > node2.46331: UDP, length 113
03:28:11.821217 IP node2.52204 > node2.46331: UDP, length 113
03:28:11.822907 IP node2.60393 > node2.46331: UDP, length 113
03:28:11.823725 IP node2.59524 > node2.46331: UDP, length 113
03:28:11.835250 IP node2.52757 > node2.46331: UDP, length 113
03:28:12.038686 IP node2.52757 > node2.35129: UDP, length 113
03:28:12.039439 IP node2.42580 > node2.35129: UDP, length 112
03:28:12.039717 IP node2.60393 > node2.35129: UDP, length 113
03:28:12.039899 IP node2.39799 > node2.35129: UDP, length 113
03:28:12.040093 IP node2.46331 > node2.35129: UDP, length 113
03:28:12.040614 IP node2.54377 > node2.35129: UDP, length 113
03:28:12.040724 IP node2.45754 > node2.35129: UDP, length 113
03:28:12.041053 IP node2.50586 > node2.35129: UDP, length 113
03:28:12.041200 IP node2.52204 > node2.35129: UDP, length 113
03:28:12.041797 IP node2.46185 > node2.35129: UDP, length 113
03:28:12.042060 IP node2.37408 > node2.35129: UDP, length 112
03:28:12.042179 IP node2.59524 > node2.35129: UDP, length 113
03:28:12.042434 IP node2.57377 > node2.35129: UDP, length 113
03:28:12.043157 IP node2.56345 > node2.35129: UDP, length 113
03:28:12.043202 IP node2.54401 > node2.35129: UDP, length 112
03:28:12.043363 IP node2.46985 > node2.35129: UDP, length 113
03:28:12.043604 IP node2.39953 > node2.35129: UDP, length 113
03:28:12.043680 IP node2.59155 > node2.35129: UDP, length 113
03:28:12.043769 IP node2.56279 > node2.35129: UDP, length 113
03:28:12.043975 IP node2.45886 > node2.35129: UDP, length 112
03:28:12.044171 IP node2.34019 > node2.35129: UDP, length 113
03:28:12.045964 IP node2.50964 > node2.35129: UDP, length 113
03:28:12.046861 IP node2.44309 > node2.35129: UDP, length 113
03:28:12.047063 IP node2.53696 > node2.35129: UDP, length 110
03:28:12.048082 IP node2.39799 > node2.60280: UDP, length 113
03:28:12.048736 IP node2.54401 > node2.60280: UDP, length 112
03:28:12.048809 IP node2.60393 > node2.60280: UDP, length 113
03:28:12.049042 IP node2.50586 > node2.60280: UDP, length 113
03:28:12.049255 IP node2.46185 > node2.60280: UDP, length 113
03:28:12.049272 IP node2.46331 > node2.60280: UDP, length 113
03:28:12.049420 IP node2.45754 > node2.60280: UDP, length 113
03:28:12.049707 IP node2.46985 > node2.60280: UDP, length 113
03:28:12.049972 IP node2.52757 > node2.60280: UDP, length 113
03:28:12.049972 IP node2.52204 > node2.60280: UDP, length 113
03:28:12.050238 IP node2.59524 > node2.60280: UDP, length 113
03:28:12.050387 IP node2.34019 > node2.60280: UDP, length 113
03:28:12.050528 IP node2.59155 > node2.60280: UDP, length 113
03:28:12.050805 IP node2.44309 > node2.60280: UDP, length 113
03:28:12.052058 IP node2.53696 > node2.60280: UDP, length 110
03:28:12.052277 IP node2.56279 > node2.60280: UDP, length 113
03:28:12.052382 IP node2.39953 > node2.60280: UDP, length 113
03:28:12.052516 IP node2.42580 > node2.60280: UDP, length 112
03:28:12.053170 IP node2.45886 > node2.60280: UDP, length 112
03:28:12.054700 IP node2.37408 > node2.60280: UDP, length 112
03:28:12.054979 IP node2.56345 > node2.60280: UDP, length 113
03:28:12.055099 IP node2.50964 > node2.60280: UDP, length 113
03:28:12.056095 IP node2.57377 > node2.60280: UDP, length 113
03:28:12.056262 IP node2.54377 > node2.60280: UDP, length 113
03:28:12.111969 IP node2.46331 > node2.36086: UDP, length 113
03:28:12.111975 IP node2.52757 > node2.36086: UDP, length 113
03:28:12.111998 IP node2.54401 > node2.36086: UDP, length 112
03:28:12.112774 IP node2.46985 > node2.36086: UDP, length 113
03:28:12.113056 IP node2.45754 > node2.36086: UDP, length 113
03:28:12.113243 IP node2.56345 > node2.36086: UDP, length 113
03:28:12.113523 IP node2.46185 > node2.36086: UDP, length 113
03:28:12.114006 IP node2.54377 > node2.36086: UDP, length 113
03:28:12.114112 IP node2.37408 > node2.36086: UDP, length 112
03:28:12.114590 IP node2.42580 > node2.36086: UDP, length 112
03:28:12.114632 IP node2.50586 > node2.36086: UDP, length 113
03:28:12.114786 IP node2.60393 > node2.36086: UDP, length 113
03:28:12.114992 IP node2.34019 > node2.36086: UDP, length 113
03:28:12.115023 IP node2.39799 > node2.36086: UDP, length 113
03:28:12.115308 IP node2.59524 > node2.36086: UDP, length 113
03:28:12.115618 IP node2.52204 > node2.36086: UDP, length 113
03:28:12.116665 IP node2.59155 > node2.36086: UDP, length 113
03:28:12.117308 IP node2.57377 > node2.36086: UDP, length 113
03:28:12.117547 IP node2.35129 > node2.36086: UDP, length 113
03:28:12.117900 IP node2.35129 > node2.60280: UDP, length 113
03:28:12.118071 IP node2.60280 > node2.35129: UDP, length 113
03:28:12.118292 IP node2.45886 > node2.36086: UDP, length 112
03:28:12.118456 IP node2.53696 > node2.36086: UDP, length 110
03:28:12.118456 IP node2.56279 > node2.36086: UDP, length 113
03:28:12.118570 IP node2.39953 > node2.36086: UDP, length 113
03:28:12.119388 IP node2.44309 > node2.36086: UDP, length 113
03:28:12.119675 IP node2.50964 > node2.36086: UDP, length 113
03:28:12.122417 IP node2.60280 > node2.36086: UDP, length 113
03:28:12.134382 IP node2.46185 > node2.49898: UDP, length 113
03:28:12.134382 IP node2.50964 > node2.49898: UDP, length 113
03:28:12.134426 IP node2.52757 > node2.49898: UDP, length 113
03:28:12.134563 IP node2.45754 > node2.49898: UDP, length 113
03:28:12.135168 IP node2.54401 > node2.49898: UDP, length 112
03:28:12.135316 IP node2.37408 > node2.49898: UDP, length 112
03:28:12.135674 IP node2.46985 > node2.49898: UDP, length 113
03:28:12.135853 IP node2.42580 > node2.49898: UDP, length 112
03:28:12.136081 IP node2.60393 > node2.49898: UDP, length 113
03:28:12.136197 IP node2.57377 > node2.49898: UDP, length 113
03:28:12.136369 IP node2.53696 > node2.49898: UDP, length 110
03:28:12.136369 IP node2.59524 > node2.49898: UDP, length 113
03:28:12.136390 IP node2.46331 > node2.49898: UDP, length 113
03:28:12.136474 IP node2.56345 > node2.49898: UDP, length 113
03:28:12.136625 IP node2.52204 > node2.49898: UDP, length 113
03:28:12.136674 IP node2.54377 > node2.49898: UDP, length 113
03:28:12.136716 IP node2.39799 > node2.49898: UDP, length 113
03:28:12.136990 IP node2.34019 > node2.49898: UDP, length 113
03:28:12.137024 IP node2.56279 > node2.49898: UDP, length 113
03:28:12.137174 IP node2.44309 > node2.49898: UDP, length 113
03:28:12.137308 IP node2.35129 > node2.49898: UDP, length 113
03:28:12.137621 IP node2.45886 > node2.49898: UDP, length 112
03:28:12.137816 IP node2.59155 > node2.49898: UDP, length 113
03:28:12.138493 IP node2.39953 > node2.49898: UDP, length 113
03:28:12.139419 IP node2.60280 > node2.49898: UDP, length 113
03:28:12.139549 IP node2.50586 > node2.49898: UDP, length 113
03:28:12.144594 IP node2.36086 > node2.35129: UDP, length 113
03:28:12.144676 IP node2.36086 > node2.60280: UDP, length 113
03:28:12.144794 IP node2.36086 > node2.49898: UDP, length 113
03:28:12.157945 IP node2.49898 > node2.35129: UDP, length 113
03:28:12.159302 IP node2.49898 > node2.36086: UDP, length 113
03:28:12.159420 IP node2.49898 > node2.60280: UDP, length 113
03:28:12.219658 IP node2.37408 > node2.50365: UDP, length 112
03:28:12.219794 IP node2.49898 > node2.50365: UDP, length 113
03:28:12.219924 IP node2.52204 > node2.50365: UDP, length 113
03:28:12.220126 IP node2.42580 > node2.50365: UDP, length 112
03:28:12.220505 IP node2.46185 > node2.50365: UDP, length 113
03:28:12.220544 IP node2.45754 > node2.50365: UDP, length 113
03:28:12.220832 IP node2.60393 > node2.50365: UDP, length 113
03:28:12.221323 IP node2.52757 > node2.50365: UDP, length 113
03:28:12.221812 IP node2.50586 > node2.50365: UDP, length 113
03:28:12.221812 IP node2.39799 > node2.50365: UDP, length 113
03:28:12.222164 IP node2.59524 > node2.50365: UDP, length 113
03:28:12.222168 IP node2.60280 > node2.50365: UDP, length 113
03:28:12.222425 IP node2.50964 > node2.50365: UDP, length 113
03:28:12.222447 IP node2.36086 > node2.50365: UDP, length 113
03:28:12.222510 IP node2.54401 > node2.50365: UDP, length 112
03:28:12.222664 IP node2.34019 > node2.50365: UDP, length 113
03:28:12.222927 IP node2.46331 > node2.50365: UDP, length 113
03:28:12.223132 IP node2.46985 > node2.50365: UDP, length 113
03:28:12.223159 IP node2.56279 > node2.50365: UDP, length 113
03:28:12.223190 IP node2.54377 > node2.50365: UDP, length 113
03:28:12.223365 IP node2.56345 > node2.50365: UDP, length 113
03:28:12.223605 IP node2.59155 > node2.50365: UDP, length 113
03:28:12.224163 IP node2.45886 > node2.50365: UDP, length 112
03:28:12.224506 IP node2.57377 > node2.50365: UDP, length 113
03:28:12.224841 IP node2.44309 > node2.50365: UDP, length 113
03:28:12.225257 IP node2.35129 > node2.50365: UDP, length 113
03:28:12.225423 IP node2.39953 > node2.50365: UDP, length 113
03:28:12.225661 IP node2.50365 > node2.36086: UDP, length 113
03:28:12.225812 IP node2.50365 > node2.49898: UDP, length 113
03:28:12.226201 IP node2.53696 > node2.50365: UDP, length 110
03:28:12.227716 IP node2.50365 > node2.60280: UDP, length 113
03:28:12.257673 IP node2.46331 > node2.50393: UDP, length 113
03:28:12.258410 IP node2.35129 > node2.50393: UDP, length 113
03:28:12.258652 IP node2.36086 > node2.50393: UDP, length 113
03:28:12.258666 IP node2.39799 > node2.50393: UDP, length 113
03:28:12.259290 IP node2.52757 > node2.50393: UDP, length 113
03:28:12.259313 IP node2.42580 > node2.50393: UDP, length 112
03:28:12.259433 IP node2.52204 > node2.50393: UDP, length 113
03:28:12.259498 IP node2.45754 > node2.50393: UDP, length 113
03:28:12.259629 IP node2.60393 > node2.50393: UDP, length 113
03:28:12.259935 IP node2.60280 > node2.50393: UDP, length 113
03:28:12.259996 IP node2.50586 > node2.50393: UDP, length 113
03:28:12.260129 IP node2.59524 > node2.50393: UDP, length 113
03:28:12.260490 IP node2.57377 > node2.50393: UDP, length 113
03:28:12.260720 IP node2.37408 > node2.50393: UDP, length 112
03:28:12.260781 IP node2.54377 > node2.50393: UDP, length 113
03:28:12.261494 IP node2.45886 > node2.50393: UDP, length 112
03:28:12.261877 IP node2.34019 > node2.50393: UDP, length 113
03:28:12.262229 IP node2.50964 > node2.50393: UDP, length 113
03:28:12.263384 IP node2.53696 > node2.50393: UDP, length 110
03:28:12.263681 IP node2.56279 > node2.50393: UDP, length 113
03:28:12.263840 IP node2.54401 > node2.50393: UDP, length 112
03:28:12.264312 IP node2.44309 > node2.50393: UDP, length 113
03:28:12.264455 IP node2.50365 > node2.50393: UDP, length 113
03:28:12.264696 IP node2.46185 > node2.50393: UDP, length 113
03:28:12.264989 IP node2.56345 > node2.50393: UDP, length 113
03:28:12.265012 IP node2.39953 > node2.50393: UDP, length 113
03:28:12.265265 IP node2.49898 > node2.50393: UDP, length 113
03:28:12.265537 IP node2.46985 > node2.50393: UDP, length 113
03:28:12.266194 IP node2.59155 > node2.50393: UDP, length 113
03:28:12.290201 IP node2.50393 > node2.50365: UDP, length 113
03:28:12.582174 IP node2.50964 > node2.53696: UDP, length 113
03:28:12.583418 IP node2.39799 > node2.53696: UDP, length 113
03:28:12.584013 IP node2.45886 > node2.53696: UDP, length 112
03:28:12.584013 IP node2.44309 > node2.53696: UDP, length 113
03:28:12.584816 IP node2.57377 > node2.53696: UDP, length 113
03:28:12.585142 IP node2.60393 > node2.53696: UDP, length 113
03:28:12.585200 IP node2.56279 > node2.53696: UDP, length 113
03:28:12.585322 IP node2.34019 > node2.53696: UDP, length 113
03:28:12.585610 IP node2.60280 > node2.53696: UDP, length 113
03:28:12.586269 IP node2.39953 > node2.53696: UDP, length 113
03:28:12.586679 IP node2.46985 > node2.53696: UDP, length 113
03:28:12.587270 IP node2.50393 > node2.53696: UDP, length 113
03:28:12.587685 IP node2.49898 > node2.53696: UDP, length 113
03:28:12.587809 IP node2.59524 > node2.53696: UDP, length 113
03:28:12.587816 IP node2.46185 > node2.53696: UDP, length 113
03:28:12.588365 IP node2.46331 > node2.53696: UDP, length 113
03:28:12.588613 IP node2.35129 > node2.53696: UDP, length 113
03:28:12.588805 IP node2.50365 > node2.53696: UDP, length 113
03:28:12.589780 IP node2.52757 > node2.53696: UDP, length 113
03:28:12.590090 IP node2.56345 > node2.53696: UDP, length 113
03:28:12.590123 IP node2.52204 > node2.53696: UDP, length 113
03:28:12.590660 IP node2.37408 > node2.53696: UDP, length 112
03:28:12.591101 IP node2.50586 > node2.53696: UDP, length 113
03:28:12.592074 IP node2.45754 > node2.53696: UDP, length 113
03:28:12.592074 IP node2.59155 > node2.53696: UDP, length 113
03:28:12.592197 IP node2.54377 > node2.53696: UDP, length 113
03:28:12.592282 IP node2.42580 > node2.53696: UDP, length 112
03:28:12.592355 IP node2.36086 > node2.53696: UDP, length 113
03:28:12.593464 IP node2.54401 > node2.53696: UDP, length 112
03:28:12.606644 IP node2.53696 > node2.52204: UDP, length 94
03:28:12.666502 IP node2.52204 > node2.53696: UDP, length 177
03:28:12.697606 IP node2.53696 > node2.52204: UDP, length 71
03:28:12.700168 IP node2.52204 > node2.53696: UDP, length 154
03:28:12.701210 IP node2.50964 > node2.39799: UDP, length 113
03:28:12.701550 IP node2.34019 > node2.39799: UDP, length 113
03:28:12.701560 IP node2.46985 > node2.39799: UDP, length 113
03:28:12.702448 IP node2.59155 > node2.39799: UDP, length 113
03:28:12.702629 IP node2.45886 > node2.39799: UDP, length 112
03:28:12.703087 IP node2.56279 > node2.39799: UDP, length 113
03:28:12.703155 IP node2.46185 > node2.39799: UDP, length 113
03:28:12.703368 IP node2.39953 > node2.39799: UDP, length 113
03:28:12.704134 IP node2.44309 > node2.39799: UDP, length 113
03:28:12.704235 IP node2.42580 > node2.39799: UDP, length 112
03:28:12.704715 IP node2.57377 > node2.39799: UDP, length 113
03:28:12.704914 IP node2.60393 > node2.39799: UDP, length 113
03:28:12.705399 IP node2.54377 > node2.39799: UDP, length 113
03:28:12.705788 IP node2.52757 > node2.39799: UDP, length 113
03:28:12.705789 IP node2.50586 > node2.39799: UDP, length 113
03:28:12.706433 IP node2.56345 > node2.39799: UDP, length 113
03:28:12.706495 IP node2.35129 > node2.39799: UDP, length 113
03:28:12.707440 IP node2.50365 > node2.39799: UDP, length 113
03:28:12.707585 IP node2.49898 > node2.39799: UDP, length 113
03:28:12.707770 IP node2.54401 > node2.39799: UDP, length 112
03:28:12.707843 IP node2.50393 > node2.39799: UDP, length 113
03:28:12.708413 IP node2.36086 > node2.39799: UDP, length 113
03:28:12.708474 IP node2.45754 > node2.39799: UDP, length 113
03:28:12.708944 IP node2.37408 > node2.39799: UDP, length 112
03:28:12.709199 IP node2.59524 > node2.39799: UDP, length 113
03:28:12.709419 IP node2.52204 > node2.39799: UDP, length 113
03:28:12.709824 IP node2.53696 > node2.39799: UDP, length 110
03:28:12.711403 IP node2.46331 > node2.39799: UDP, length 113
03:28:12.711658 IP node2.60280 > node2.39799: UDP, length 113
03:28:12.725257 IP node2.39799 > node2.52204: UDP, length 94
03:28:12.729092 IP node2.53696 > node2.52204: UDP, length 78
03:28:13.158536 IP node2.53696 > node2.52204: UDP, length 71
03:28:13.159330 IP node2.53696 > node2.39799: UDP, length 87
03:28:13.160010 IP node2.52204 > node2.39799: UDP, length 71
03:28:13.160239 IP node2.39799 > node2.53696: UDP, length 94
03:28:13.160655 IP node2.52204 > node2.53696: UDP, length 71
03:28:13.163616 IP node2.53696 > node2.52204: UDP, length 78
03:28:13.367846 IP node2.52204 > node2.39799: UDP, length 217
03:28:13.370382 IP node2.39799 > node2.52204: UDP, length 71
03:28:13.379780 IP node2.39799 > node2.52204: UDP, length 71
03:28:13.381352 IP node2.52204 > node2.39799: UDP, length 154
03:28:13.418659 IP node2.39799 > node2.52204: UDP, length 78
03:28:13.595251 IP node2.57377 > node2.44309: UDP, length 113
03:28:13.595582 IP node2.37408 > node2.44309: UDP, length 112
03:28:13.595697 IP node2.46185 > node2.44309: UDP, length 113
03:28:13.595886 IP node2.52757 > node2.44309: UDP, length 113
03:28:13.597004 IP node2.46985 > node2.44309: UDP, length 113
03:28:13.597498 IP node2.60393 > node2.44309: UDP, length 113
03:28:13.597541 IP node2.49898 > node2.44309: UDP, length 113
03:28:13.597777 IP node2.42580 > node2.44309: UDP, length 112
03:28:13.597798 IP node2.35129 > node2.44309: UDP, length 113
03:28:13.598156 IP node2.50586 > node2.44309: UDP, length 113
03:28:13.598424 IP node2.54401 > node2.44309: UDP, length 112
03:28:13.598553 IP node2.50393 > node2.44309: UDP, length 113
03:28:13.598801 IP node2.59155 > node2.44309: UDP, length 113
03:28:13.598977 IP node2.34019 > node2.44309: UDP, length 113
03:28:13.599840 IP node2.56345 > node2.44309: UDP, length 113
03:28:13.599968 IP node2.60280 > node2.44309: UDP, length 113
03:28:13.600241 IP node2.59524 > node2.44309: UDP, length 113
03:28:13.600392 IP node2.39799 > node2.44309: UDP, length 113
03:28:13.600484 IP node2.56279 > node2.44309: UDP, length 113
03:28:13.600678 IP node2.45886 > node2.44309: UDP, length 112
03:28:13.601498 IP node2.53696 > node2.44309: UDP, length 110
03:28:13.601737 IP node2.54377 > node2.44309: UDP, length 113
03:28:13.601849 IP node2.50365 > node2.44309: UDP, length 113
03:28:13.601940 IP node2.36086 > node2.44309: UDP, length 113
03:28:13.602011 IP node2.45754 > node2.44309: UDP, length 113
03:28:13.602064 IP node2.39953 > node2.44309: UDP, length 113
03:28:13.602309 IP node2.52204 > node2.44309: UDP, length 113
03:28:13.602339 IP node2.46331 > node2.44309: UDP, length 113
03:28:13.603730 IP node2.50964 > node2.44309: UDP, length 113
03:28:13.607974 IP node2.44309 > node2.52204: UDP, length 94
03:28:13.658470 IP node2.52204 > node2.39799: UDP, length 71
03:28:13.658531 IP node2.52204 > node2.44309: UDP, length 71
03:28:13.658818 IP node2.52204 > node2.53696: UDP, length 71
03:28:13.704826 IP node2.56345 > node2.59155: UDP, length 113
03:28:13.704936 IP node2.39953 > node2.59155: UDP, length 113
03:28:13.705296 IP node2.39799 > node2.59155: UDP, length 113
03:28:13.705675 IP node2.60280 > node2.59155: UDP, length 113
03:28:13.705960 IP node2.59524 > node2.59155: UDP, length 113
03:28:13.706061 IP node2.54377 > node2.59155: UDP, length 113
03:28:13.706433 IP node2.49898 > node2.59155: UDP, length 113
03:28:13.706691 IP node2.60393 > node2.59155: UDP, length 113
03:28:13.706692 IP node2.50365 > node2.59155: UDP, length 113
03:28:13.707260 IP node2.50393 > node2.59155: UDP, length 113
03:28:13.707431 IP node2.53696 > node2.59155: UDP, length 110
03:28:13.707928 IP node2.56279 > node2.59155: UDP, length 113
03:28:13.708251 IP node2.50586 > node2.59155: UDP, length 113
03:28:13.708454 IP node2.52757 > node2.59155: UDP, length 113
03:28:13.709037 IP node2.50964 > node2.59155: UDP, length 113
03:28:13.709098 IP node2.52204 > node2.59155: UDP, length 113
03:28:13.709127 IP node2.57377 > node2.59155: UDP, length 113
03:28:13.709244 IP node2.46185 > node2.59155: UDP, length 113
