03:28:12.187163 IP node2.54401 > node4.34193: UDP, length 112
03:28:12.187735 IP node2.56345 > node4.34193: UDP, length 113
03:28:12.187944 IP node2.52757 > node4.34193: UDP, length 113
03:28:12.188020 IP node2.50586 > node4.34193: UDP, length 113
03:28:12.188089 IP node2.45754 > node4.34193: UDP, length 113
03:28:12.188198 IP node2.36086 > node4.34193: UDP, length 113
03:28:12.188417 IP node2.37408 > node4.34193: UDP, length 112
03:28:12.188524 IP node2.35129 > node4.34193: UDP, length 113
03:28:12.188821 IP node2.46185 > node4.34193: UDP, length 113
03:28:12.188938 IP node2.42580 > node4.34193: UDP, length 112
03:28:12.189130 IP node2.46331 > node4.34193: UDP, length 113
03:28:12.189214 IP node2.46985 > node4.34193: UDP, length 113
03:28:12.189343 IP node2.60280 > node4.34193: UDP, length 113
03:28:12.189425 IP node2.54377 > node4.34193: UDP, length 113
03:28:12.189542 IP node2.60393 > node4.34193: UDP, length 113
03:28:12.189877 IP node2.59524 > node4.34193: UDP, length 113
03:28:12.190012 IP node2.52204 > node4.34193: UDP, length 113
03:28:12.190193 IP node2.34019 > node4.34193: UDP, length 113
03:28:12.190364 IP node2.39799 > node4.34193: UDP, length 113
03:28:12.191584 IP node2.50964 > node4.34193: UDP, length 113
03:28:12.191933 IP node2.59155 > node4.34193: UDP, length 113
03:28:12.192020 IP node2.56279 > node4.34193: UDP, length 113
03:28:12.192221 IP node2.39953 > node4.34193: UDP, length 113
03:28:12.192395 IP node2.45886 > node4.34193: UDP, length 112
03:28:12.192462 IP node2.49898 > node4.34193: UDP, length 113
03:28:12.192843 IP node2.44309 > node4.34193: UDP, length 113
03:28:12.195766 IP node2.57377 > node4.34193: UDP, length 113
03:28:12.196942 IP node2.53696 > node4.34193: UDP, length 110
03:28:12.226381 IP node2.50365 > node4.34193: UDP, length 113
03:28:12.290331 IP node2.50393 > node4.34193: UDP, length 113
03:28:12.563711 IP node2.36086 > node3.37181: UDP, length 113
03:28:12.564119 IP node2.59524 > node3.37181: UDP, length 113
03:28:12.564376 IP node2.60280 > node3.37181: UDP, length 113
03:28:12.564453 IP node2.60393 > node3.37181: UDP, length 113
03:28:12.564600 IP node2.39799 > node3.37181: UDP, length 113
03:28:12.565557 IP node2.45754 > node3.37181: UDP, length 113
03:28:12.565704 IP node2.52757 > node3.37181: UDP, length 113
03:28:12.565898 IP node2.46331 > node3.37181: UDP, length 113
03:28:12.565985 IP node2.50964 > node3.37181: UDP, length 113
03:28:12.566850 IP node2.54377 > node3.37181: UDP, length 113
03:28:12.567086 IP node2.54401 > node3.37181: UDP, length 112
03:28:12.567235 IP node2.57377 > node3.37181: UDP, length 113
03:28:12.567627 IP node2.50393 > node3.37181: UDP, length 113
03:28:12.568076 IP node2.37408 > node3.37181: UDP, length 112
03:28:12.568159 IP node2.56279 > node3.37181: UDP, length 113
03:28:12.568331 IP node2.49898 > node3.37181: UDP, length 113
03:28:12.568419 IP node2.34019 > node3.37181: UDP, length 113
03:28:12.568494 IP node2.46185 > node3.37181: UDP, length 113
03:28:12.568793 IP node2.42580 > node3.37181: UDP, length 112
03:28:12.568864 IP node2.52204 > node3.37181: UDP, length 113
03:28:12.568931 IP node2.59155 > node3.37181: UDP, length 113
03:28:12.569015 IP node2.45886 > node3.37181: UDP, length 112
03:28:12.569644 IP node2.53696 > node3.37181: UDP, length 110
03:28:12.569718 IP node2.44309 > node3.37181: UDP, length 113
03:28:12.569800 IP node2.46985 > node3.37181: UDP, length 113
03:28:12.569933 IP node2.39953 > node3.37181: UDP, length 113
03:28:12.570008 IP node2.50586 > node3.37181: UDP, length 113
03:28:12.570514 IP node2.56345 > node3.37181: UDP, length 113
03:28:12.571009 IP node2.35129 > node3.37181: UDP, length 113
03:28:12.571625 IP node2.50365 > node3.37181: UDP, length 113
03:28:12.658914 IP node2.52204 > node3.37181: UDP, length 87
03:28:12.665934 IP node2.52204 > node3.37181: UDP, length 177
03:28:12.799189 IP node2.56279 > node4.33410: UDP, length 113
03:28:12.799441 IP node2.60280 > node4.33410: UDP, length 113
03:28:12.799594 IP node2.50964 > node4.33410: UDP, length 113
03:28:12.799871 IP node2.39953 > node4.33410: UDP, length 113
03:28:12.800077 IP node2.57377 > node4.33410: UDP, length 113
03:28:12.800394 IP node2.45886 > node4.33410: UDP, length 112
03:28:12.800504 IP node2.44309 > node4.33410: UDP, length 113
03:28:12.800775 IP node2.50393 > node4.33410: UDP, length 113
03:28:12.801146 IP node2.54401 > node4.33410: UDP, length 112
03:28:12.801265 IP node2.39799 > node4.33410: UDP, length 113
03:28:12.801476 IP node2.34019 > node4.33410: UDP, length 113
03:28:12.801872 IP node2.50365 > node4.33410: UDP, length 113
03:28:12.802454 IP node2.36086 > node4.33410: UDP, length 113
03:28:12.802576 IP node2.59155 > node4.33410: UDP, length 113
03:28:12.802800 IP node2.35129 > node4.33410: UDP, length 113
03:28:12.802881 IP node2.50586 > node4.33410: UDP, length 113
03:28:12.802966 IP node2.45754 > node4.33410: UDP, length 113
03:28:12.803142 IP node2.46985 > node4.33410: UDP, length 113
03:28:12.803240 IP node2.52757 > node4.33410: UDP, length 113
03:28:12.803362 IP node2.54377 > node4.33410: UDP, length 113
03:28:12.803480 IP node2.37408 > node4.33410: UDP, length 112
03:28:12.804008 IP node2.42580 > node4.33410: UDP, length 112
03:28:12.804107 IP node2.49898 > node4.33410: UDP, length 113
03:28:12.804195 IP node2.60393 > node4.33410: UDP, length 113
03:28:12.804292 IP node2.59524 > node4.33410: UDP, length 113
03:28:12.804375 IP node2.46185 > node4.33410: UDP, length 113
03:28:12.804700 IP node2.53696 > node4.33410: UDP, length 110
03:28:12.804848 IP node2.46331 > node4.33410: UDP, length 113
03:28:12.804943 IP node2.56345 > node4.33410: UDP, length 113
03:28:12.805233 IP node2.52204 > node4.33410: UDP, length 113
03:28:12.947182 IP node2.52204 > node3.37181: UDP, length 154
03:28:12.951870 IP node2.46331 > node4.32788: UDP, length 113
03:28:12.951989 IP node2.44309 > node4.32788: UDP, length 113
03:28:12.952321 IP node2.39953 > node4.32788: UDP, length 113
03:28:12.952551 IP node2.46185 > node4.32788: UDP, length 113
03:28:12.952720 IP node2.57377 > node4.32788: UDP, length 113
03:28:12.952963 IP node2.45754 > node4.32788: UDP, length 113
03:28:12.953045 IP node2.50586 > node4.32788: UDP, length 113
03:28:12.953307 IP node2.50393 > node4.32788: UDP, length 113
03:28:12.953862 IP node2.50365 > node4.32788: UDP, length 113
03:28:12.953996 IP node2.49898 > node4.32788: UDP, length 113
03:28:12.954076 IP node2.34019 > node4.32788: UDP, length 113
03:28:12.954166 IP node2.60280 > node4.32788: UDP, length 113
03:28:12.954524 IP node2.59524 > node4.32788: UDP, length 113
03:28:12.954645 IP node2.42580 > node4.32788: UDP, length 112
03:28:12.954771 IP node2.54377 > node4.32788: UDP, length 113
03:28:12.954862 IP node2.53696 > node4.32788: UDP, length 110
03:28:12.954950 IP node2.35129 > node4.32788: UDP, length 113
03:28:12.955395 IP node2.54401 > node4.32788: UDP, length 112
03:28:12.955594 IP node2.36086 > node4.32788: UDP, length 113
03:28:12.955940 IP node2.46985 > node4.32788: UDP, length 113
03:28:12.956031 IP node2.50964 > node4.32788: UDP, length 113
03:28:12.956270 IP node2.52757 > node4.32788: UDP, length 113
03:28:12.956465 IP node2.56279 > node4.32788: UDP, length 113
03:28:12.956605 IP node2.59155 > node4.32788: UDP, length 113
03:28:12.957270 IP node2.52204 > node4.32788: UDP, length 113
03:28:12.957444 IP node2.37408 > node4.32788: UDP, length 112
03:28:12.957769 IP node2.60393 > node4.32788: UDP, length 113
03:28:12.958211 IP node2.45886 > node4.32788: UDP, length 112
03:28:12.958571 IP node2.39799 > node4.32788: UDP, length 113
03:28:12.958845 IP node2.56345 > node4.32788: UDP, length 113
03:28:13.126786 IP node2.49898 > node4.43338: UDP, length 113
03:28:13.129150 IP node2.60280 > node4.43338: UDP, length 113
03:28:13.129546 IP node2.46331 > node4.43338: UDP, length 113
03:28:13.129789 IP node2.50586 > node4.43338: UDP, length 113
03:28:13.130055 IP node2.34019 > node4.43338: UDP, length 113
03:28:13.130339 IP node2.50393 > node4.43338: UDP, length 113
03:28:13.131209 IP node2.46185 > node4.43338: UDP, length 113
03:28:13.131625 IP node2.52757 > node4.43338: UDP, length 113
03:28:13.131956 IP node2.54377 > node4.43338: UDP, length 113
03:28:13.132150 IP node2.56345 > node4.43338: UDP, length 113
03:28:13.133666 IP node2.56279 > node4.43338: UDP, length 113
03:28:13.133730 IP node2.39799 > node4.43338: UDP, length 113
03:28:13.133862 IP node2.50964 > node4.43338: UDP, length 113
03:28:13.134051 IP node2.42580 > node4.43338: UDP, length 112
03:28:13.134587 IP node2.35129 > node4.43338: UDP, length 113
03:28:13.134905 IP node2.36086 > node4.43338: UDP, length 113
03:28:13.135062 IP node2.52204 > node4.43338: UDP, length 113
03:28:13.135769 IP node2.37408 > node4.43338: UDP, length 112
03:28:13.137269 IP node2.45754 > node4.43338: UDP, length 113
03:28:13.137536 IP node2.50365 > node4.43338: UDP, length 113
03:28:13.138135 IP node2.53696 > node4.43338: UDP, length 110
03:28:13.138827 IP node2.60393 > node4.43338: UDP, length 113
03:28:13.139269 IP node2.54401 > node4.43338: UDP, length 112
03:28:13.139651 IP node2.46985 > node4.43338: UDP, length 113
03:28:13.140927 IP node2.45886 > node4.43338: UDP, length 112
03:28:13.141049 IP node2.59524 > node4.43338: UDP, length 113
03:28:13.141151 IP node2.59155 > node4.43338: UDP, length 113
03:28:13.141366 IP node2.57377 > node4.43338: UDP, length 113
03:28:13.141523 IP node2.39953 > node4.43338: UDP, length 113
03:28:13.141802 IP node2.44309 > node4.43338: UDP, length 113
03:28:13.160103 IP node2.52204 > node4.33410: UDP, length 71
03:28:13.160337 IP node2.52204 > node4.32788: UDP, length 71
03:28:13.160469 IP node2.52204 > node4.43338: UDP, length 71
03:28:13.160555 IP node2.52204 > node3.37181: UDP, length 71
03:28:13.253969 IP node2.39799 > node4.41567: UDP, length 113
03:28:13.255005 IP node2.39953 > node4.41567: UDP, length 113
03:28:13.255270 IP node2.49898 > node4.41567: UDP, length 113
03:28:13.255606 IP node2.50365 > node4.41567: UDP, length 113
03:28:13.256689 IP node2.59155 > node4.41567: UDP, length 113
03:28:13.257132 IP node2.50586 > node4.41567: UDP, length 113
03:28:13.257287 IP node2.52204 > node4.41567: UDP, length 113
03:28:13.258275 IP node2.54377 > node4.41567: UDP, length 113
03:28:13.258822 IP node2.56345 > node4.41567: UDP, length 113
03:28:13.259823 IP node2.34019 > node4.41567: UDP, length 113
03:28:13.260034 IP node2.45886 > node4.41567: UDP, length 112
03:28:13.270771 IP node2.53696 > node4.41567: UDP, length 110
03:28:13.270941 IP node2.39953 > node4.54038: UDP, length 113
03:28:13.271064 IP node2.37408 > node4.54038: UDP, length 112
03:28:13.271108 IP node2.37408 > node4.41567: UDP, length 112
03:28:13.271165 IP node2.49898 > node4.54038: UDP, length 113
03:28:13.271222 IP node2.56279 > node4.54038: UDP, length 113
03:28:13.271278 IP node2.54401 > node4.54038: UDP, length 112
03:28:13.271333 IP node2.44309 > node4.41567: UDP, length 113
03:28:13.271361 IP node2.44309 > node4.54038: UDP, length 113
03:28:13.271395 IP node2.54377 > node4.54038: UDP, length 113
03:28:13.271446 IP node2.53696 > node4.54038: UDP, length 110
03:28:13.271542 IP node2.50365 > node4.54038: UDP, length 113
03:28:13.271585 IP node2.57377 > node4.54038: UDP, length 113
03:28:13.271619 IP node2.57377 > node4.41567: UDP, length 113
03:28:13.271668 IP node2.34019 > node4.54038: UDP, length 113
03:28:13.271722 IP node2.56345 > node4.54038: UDP, length 113
03:28:13.271777 IP node2.52204 > node4.54038: UDP, length 113
03:28:13.271831 IP node2.56279 > node4.41567: UDP, length 113
03:28:13.271886 IP node2.60393 > node4.54038: UDP, length 113
03:28:13.271941 IP node2.60393 > node4.41567: UDP, length 113
03:28:13.271995 IP node2.50964 > node4.54038: UDP, length 113
03:28:13.272050 IP node2.50964 > node4.41567: UDP, length 113
03:28:13.272104 IP node2.59524 > node4.54038: UDP, length 113
03:28:13.272160 IP node2.46985 > node4.41567: UDP, length 113
03:28:13.272215 IP node2.59524 > node4.41567: UDP, length 113
03:28:13.272270 IP node2.46985 > node4.54038: UDP, length 113
03:28:13.272325 IP node2.46185 > node4.54038: UDP, length 113
03:28:13.272392 IP node2.60280 > node4.54038: UDP, length 113
03:28:13.272447 IP node2.60280 > node4.41567: UDP, length 113
03:28:13.272502 IP node2.35129 > node4.41567: UDP, length 113
03:28:13.272564 IP node2.50393 > node4.54038: UDP, length 113
03:28:13.272626 IP node2.35129 > node4.54038: UDP, length 113
03:28:13.272682 IP node2.50393 > node4.41567: UDP, length 113
03:28:13.272737 IP node2.46331 > node4.54038: UDP, length 113
03:28:13.272792 IP node2.46331 > node4.41567: UDP, length 113
03:28:13.272847 IP node2.36086 > node4.54038: UDP, length 113
03:28:13.272902 IP node2.36086 > node4.41567: UDP, length 113
03:28:13.272957 IP node2.45754 > node4.54038: UDP, length 113
03:28:13.273012 IP node2.46185 > node4.41567: UDP, length 113
03:28:13.273066 IP node2.54401 > node4.41567: UDP, length 112
03:28:13.273122 IP node2.50586 > node4.54038: UDP, length 113
03:28:13.273178 IP node2.52757 > node4.54038: UDP, length 113
03:28:13.273233 IP node2.52757 > node4.41567: UDP, length 113
03:28:13.273499 IP node2.45754 > node4.41567: UDP, length 113
03:28:13.273616 IP node2.59155 > node4.54038: UDP, length 113
03:28:13.273702 IP node2.45886 > node4.54038: UDP, length 112
03:28:13.273927 IP node2.42580 > node4.54038: UDP, length 112
03:28:13.274004 IP node2.39799 > node4.54038: UDP, length 113
03:28:13.276143 IP node2.42580 > node4.41567: UDP, length 112
03:28:13.346937 IP node2.39953 > node4.39188: UDP, length 113
03:28:13.347203 IP node2.60280 > node4.39188: UDP, length 113
03:28:13.347634 IP node2.49898 > node4.39188: UDP, length 113
03:28:13.348004 IP node2.52757 > node4.39188: UDP, length 113
03:28:13.348075 IP node2.45886 > node4.39188: UDP, length 112
03:28:13.349189 IP node2.52204 > node4.39188: UDP, length 113
03:28:13.349261 IP node2.44309 > node4.39188: UDP, length 113
03:28:13.349430 IP node2.56345 > node4.39188: UDP, length 113
03:28:13.349528 IP node2.35129 > node4.39188: UDP, length 113
03:28:13.350075 IP node2.39799 > node4.39188: UDP, length 113
03:28:13.350144 IP node2.50365 > node4.39188: UDP, length 113
03:28:13.350317 IP node2.54401 > node4.39188: UDP, length 112
03:28:13.350434 IP node2.42580 > node4.39188: UDP, length 112
03:28:13.350537 IP node2.56279 > node4.39188: UDP, length 113
03:28:13.350620 IP node2.37408 > node4.39188: UDP, length 112
03:28:13.350922 IP node2.59155 > node4.39188: UDP, length 113
03:28:13.350983 IP node2.53696 > node4.39188: UDP, length 110
03:28:13.351684 IP node2.46185 > node4.39188: UDP, length 113
03:28:13.351862 IP node2.50586 > node4.39188: UDP, length 113
03:28:13.352142 IP node2.59524 > node4.39188: UDP, length 113
03:28:13.352346 IP node2.60393 > node4.39188: UDP, length 113
03:28:13.352464 IP node2.34019 > node4.39188: UDP, length 113
03:28:13.352596 IP node2.50964 > node4.39188: UDP, length 113
03:28:13.352977 IP node2.45754 > node4.39188: UDP, length 113
03:28:13.353671 IP node2.46331 > node4.39188: UDP, length 113
03:28:13.353911 IP node2.36086 > node4.39188: UDP, length 113
03:28:13.354336 IP node2.50393 > node4.39188: UDP, length 113
03:28:13.354400 IP node2.57377 > node4.39188: UDP, length 113
03:28:13.356152 IP node2.54377 > node4.39188: UDP, length 113
03:28:13.356317 IP node2.46985 > node4.39188: UDP, length 113
03:28:13.367900 IP node2.52204 > node4.33410: UDP, length 217
03:28:13.368056 IP node2.52204 > node4.32788: UDP, length 217
03:28:13.386333 IP node2.39799 > node4.33410: UDP, length 87
03:28:13.421907 IP node2.53696 > node3.50931: UDP, length 110
03:28:13.422126 IP node2.42580 > node3.50931: UDP, length 112
03:28:13.422263 IP node2.59155 > node3.50931: UDP, length 113
03:28:13.422336 IP node2.35129 > node3.50931: UDP, length 113
03:28:13.422378 IP node2.50365 > node3.50931: UDP, length 113
03:28:13.422446 IP node2.52204 > node3.50931: UDP, length 113
03:28:13.422539 IP node2.50393 > node3.50931: UDP, length 113
03:28:13.422718 IP node2.36086 > node3.50931: UDP, length 113
03:28:13.422909 IP node2.56279 > node3.50931: UDP, length 113
03:28:13.422981 IP node2.49898 > node3.50931: UDP, length 113
03:28:13.423051 IP node2.44309 > node3.50931: UDP, length 113
03:28:13.423125 IP node2.57377 > node3.50931: UDP, length 113
03:28:13.423196 IP node2.56345 > node3.50931: UDP, length 113
03:28:13.423943 IP node2.45754 > node3.50931: UDP, length 113
03:28:13.424224 IP node2.50586 > node3.50931: UDP, length 113
03:28:13.424551 IP node2.54377 > node3.50931: UDP, length 113
03:28:13.424611 IP node2.39799 > node3.50931: UDP, length 113
03:28:13.424808 IP node2.46985 > node3.50931: UDP, length 113
03:28:13.425006 IP node2.54401 > node3.50931: UDP, length 112
03:28:13.425377 IP node2.39953 > node3.50931: UDP, length 113
03:28:13.425549 IP node2.46185 > node3.50931: UDP, length 113
03:28:13.425612 IP node2.46331 > node3.50931: UDP, length 113
03:28:13.425842 IP node2.37408 > node3.50931: UDP, length 112
03:28:13.425909 IP node2.59524 > node3.50931: UDP, length 113
03:28:13.425986 IP node2.60393 > node3.50931: UDP, length 113
03:28:13.426057 IP node2.45886 > node3.50931: UDP, length 112
03:28:13.426127 IP node2.52757 > node3.50931: UDP, length 113
03:28:13.426197 IP node2.60280 > node3.50931: UDP, length 113
03:28:13.426438 IP node2.34019 > node3.50931: UDP, length 113
03:28:13.426629 IP node2.50964 > node3.50931: UDP, length 113
03:28:13.500455 IP node2.50586 > node4.39260: UDP, length 113
03:28:13.501641 IP node2.60280 > node4.39260: UDP, length 113
03:28:13.502480 IP node2.46185 > node4.39260: UDP, length 113
03:28:13.503394 IP node2.54377 > node4.39260: UDP, length 113
03:28:13.503615 IP node2.35129 > node4.39260: UDP, length 113
03:28:13.503722 IP node2.50964 > node4.39260: UDP, length 113
03:28:13.503808 IP node2.37408 > node4.39260: UDP, length 112
03:28:13.504122 IP node2.45886 > node4.39260: UDP, length 112
03:28:13.504208 IP node2.54401 > node4.39260: UDP, length 112
03:28:13.504360 IP node2.53696 > node4.39260: UDP, length 110
03:28:13.504472 IP node2.59524 > node4.39260: UDP, length 113
03:28:13.504547 IP node2.50365 > node4.39260: UDP, length 113
03:28:13.504807 IP node2.59155 > node4.39260: UDP, length 113
03:28:13.505033 IP node2.46985 > node4.39260: UDP, length 113
03:28:13.505105 IP node2.44309 > node4.39260: UDP, length 113
03:28:13.505237 IP node2.50393 > node4.39260: UDP, length 113
03:28:13.505600 IP node2.57377 > node4.39260: UDP, length 113
03:28:13.505796 IP node2.36086 > node4.39260: UDP, length 113
03:28:13.505934 IP node2.46331 > node4.39260: UDP, length 113
03:28:13.506201 IP node2.34019 > node4.39260: UDP, length 113
03:28:13.506326 IP node2.56345 > node4.39260: UDP, length 113
03:28:13.506381 IP node2.49898 > node4.39260: UDP, length 113
03:28:13.506653 IP node2.39799 > node4.39260: UDP, length 113
03:28:13.506938 IP node2.60393 > node4.39260: UDP, length 113
03:28:13.507006 IP node2.52757 > node4.39260: UDP, length 113
03:28:13.507124 IP node2.52204 > node4.39260: UDP, length 113
03:28:13.507479 IP node2.42580 > node4.39260: UDP, length 112
03:28:13.507942 IP node2.56279 > node4.39260: UDP, length 113
03:28:13.508014 IP node2.39953 > node4.39260: UDP, length 113
03:28:13.508280 IP node2.45754 > node4.39260: UDP, length 113
03:28:13.535503 IP node2.52204 > node4.32788: UDP, length 204
03:28:13.562015 IP node2.42580 > node4.39614: UDP, length 112
03:28:13.562181 IP node2.44309 > node4.39614: UDP, length 113
03:28:13.562520 IP node2.37408 > node4.39614: UDP, length 112
03:28:13.562659 IP node2.39953 > node4.39614: UDP, length 113
03:28:13.563374 IP node2.56279 > node4.39614: UDP, length 113
03:28:13.563702 IP node2.50586 > node4.39614: UDP, length 113
03:28:13.564083 IP node2.46985 > node4.39614: UDP, length 113
03:28:13.564591 IP node2.45886 > node4.39614: UDP, length 112
03:28:13.565028 IP node2.52757 > node4.39614: UDP, length 113
03:28:13.565124 IP node2.34019 > node4.39614: UDP, length 113
03:28:13.565904 IP node2.60393 > node4.39614: UDP, length 113
03:28:13.566378 IP node2.57377 > node4.39614: UDP, length 113
03:28:13.566477 IP node2.59524 > node4.39614: UDP, length 113
03:28:13.566560 IP node2.50393 > node4.39614: UDP, length 113
03:28:13.566867 IP node2.59155 > node4.39614: UDP, length 113
03:28:13.567361 IP node2.49898 > node4.39614: UDP, length 113
03:28:13.567632 IP node2.39799 > node4.39614: UDP, length 113
03:28:13.567815 IP node2.54401 > node4.39614: UDP, length 112
03:28:13.567910 IP node2.36086 > node4.39614: UDP, length 113
03:28:13.567977 IP node2.46331 > node4.39614: UDP, length 113
03:28:13.568343 IP node2.46185 > node4.39614: UDP, length 113
03:28:13.568758 IP node2.35129 > node4.39614: UDP, length 113
03:28:13.568881 IP node2.53696 > node4.39614: UDP, length 110
03:28:13.569013 IP node2.56345 > node4.39614: UDP, length 113
03:28:13.569126 IP node2.45754 > node4.39614: UDP, length 113
03:28:13.569254 IP node2.60280 > node4.39614: UDP, length 113
03:28:13.569396 IP node2.50964 > node4.39614: UDP, length 113
03:28:13.569679 IP node2.54377 > node4.39614: UDP, length 113
03:28:13.570190 IP node2.50365 > node4.39614: UDP, length 113
03:28:13.570569 IP node2.52204 > node4.39614: UDP, length 113
03:28:13.617405 IP node2.52204 > node4.33410: UDP, length 229
03:28:13.658317 IP node2.52204 > node4.54038: UDP, length 71
03:28:13.658570 IP node2.52204 > node4.39188: UDP, length 71
03:28:13.658654 IP node2.52204 > node4.39260: UDP, length 71
03:28:13.658734 IP node2.52204 > node4.41567: UDP, length 71
03:28:13.658920 IP node2.52204 > node3.37181: UDP, length 71
03:28:13.768992 IP node2.60280 > node4.44436: UDP, length 113
03:28:13.769721 IP node2.42580 > node4.44436: UDP, length 112
03:28:13.770525 IP node2.39953 > node4.44436: UDP, length 113
03:28:13.770760 IP node2.50393 > node4.44436: UDP, length 113
03:28:13.770885 IP node2.46985 > node4.44436: UDP, length 113
03:28:13.771052 IP node2.52757 > node4.44436: UDP, length 113
03:28:13.771448 IP node2.54401 > node4.44436: UDP, length 112
03:28:13.771628 IP node2.46185 > node4.44436: UDP, length 113
03:28:13.772030 IP node2.39799 > node4.44436: UDP, length 113
03:28:13.772131 IP node2.45754 > node4.44436: UDP, length 113
03:28:13.772733 IP node2.59524 > node4.44436: UDP, length 113
03:28:13.773079 IP node2.57377 > node4.44436: UDP, length 113
03:28:13.773138 IP node2.60393 > node4.44436: UDP, length 113
03:28:13.773284 IP node2.54377 > node4.44436: UDP, length 113
03:28:13.773507 IP node2.37408 > node4.44436: UDP, length 112
03:28:13.773612 IP node2.49898 > node4.44436: UDP, length 113
03:28:13.774277 IP node2.50365 > node4.44436: UDP, length 113
03:28:13.774423 IP node2.59155 > node4.44436: UDP, length 113
03:28:13.774760 IP node2.35129 > node4.44436: UDP, length 113
03:28:13.774940 IP node2.45886 > node4.44436: UDP, length 112
03:28:13.775044 IP node2.53696 > node4.44436: UDP, length 110
03:28:13.775213 IP node2.36086 > node4.44436: UDP, length 113
03:28:13.775331 IP node2.44309 > node4.44436: UDP, length 113
03:28:13.775444 IP node2.50964 > node4.44436: UDP, length 113
03:28:13.775751 IP node2.56279 > node4.44436: UDP, length 113
03:28:13.775816 IP node2.50586 > node4.44436: UDP, length 113
03:28:13.775894 IP node2.34019 > node4.44436: UDP, length 113
03:28:13.775969 IP node2.52204 > node4.44436: UDP, length 113
03:28:13.776466 IP node2.56345 > node4.44436: UDP, length 113
03:28:13.776654 IP node2.46331 > node4.44436: UDP, length 113
03:28:13.782636 IP node2.45754 > node3.46151: UDP, length 113
03:28:13.784013 IP node2.37408 > node3.46151: UDP, length 112
03:28:13.784579 IP node2.53696 > node3.46151: UDP, length 110
03:28:13.784744 IP node2.39953 > node3.46151: UDP, length 113
03:28:13.784823 IP node2.50964 > node3.46151: UDP, length 113
03:28:13.785159 IP node2.60393 > node3.46151: UDP, length 113
03:28:13.785456 IP node2.34019 > node3.46151: UDP, length 113
03:28:13.785591 IP node2.50393 > node3.46151: UDP, length 113
03:28:13.785672 IP node2.56345 > node3.46151: UDP, length 113
03:28:13.785746 IP node2.50586 > node3.46151: UDP, length 113
03:28:13.786579 IP node2.46185 > node3.46151: UDP, length 113
03:28:13.786750 IP node2.52757 > node3.46151: UDP, length 113
03:28:13.786837 IP node2.56279 > node3.46151: UDP, length 113
03:28:13.787075 IP node2.57377 > node3.46151: UDP, length 113
03:28:13.788544 IP node2.54377 > node3.46151: UDP, length 113
03:28:13.789273 IP node2.39799 > node3.46151: UDP, length 113
03:28:13.789672 IP node2.46985 > node3.46151: UDP, length 113
03:28:13.790194 IP node2.36086 > node3.46151: UDP, length 113
03:28:13.790299 IP node2.45886 > node3.46151: UDP, length 112
03:28:13.790412 IP node2.59524 > node3.46151: UDP, length 113
03:28:13.790821 IP node2.60280 > node3.46151: UDP, length 113
03:28:13.791292 IP node2.50365 > node3.46151: UDP, length 113
03:28:13.792056 IP node2.49898 > node3.46151: UDP, length 113
03:28:13.792143 IP node2.42580 > node3.46151: UDP, length 112
03:28:13.792211 IP node2.44309 > node3.46151: UDP, length 113
03:28:13.792284 IP node2.35129 > node3.46151: UDP, length 113
03:28:13.793274 IP node2.52204 > node3.46151: UDP, length 113
03:28:13.793415 IP node2.46331 > node3.46151: UDP, length 113
03:28:13.793497 IP node2.54401 > node3.46151: UDP, length 112
03:28:13.793905 IP node2.59155 > node3.46151: UDP, length 113
03:28:13.829145 IP node2.42580 > node4.38447: UDP, length 112
03:28:13.829452 IP node2.50365 > node4.38447: UDP, length 113
03:28:13.829888 IP node2.45754 > node4.38447: UDP, length 113
03:28:13.830199 IP node2.60393 > node4.38447: UDP, length 113
03:28:13.830815 IP node2.35129 > node4.38447: UDP, length 113
03:28:13.830906 IP node2.53696 > node4.38447: UDP, length 110
03:28:13.831718 IP node2.39953 > node4.38447: UDP, length 113
03:28:13.831824 IP node2.59524 > node4.38447: UDP, length 113
03:28:13.832511 IP node2.60280 > node4.38447: UDP, length 113
03:28:13.832701 IP node2.45886 > node4.38447: UDP, length 112
03:28:13.832844 IP node2.50586 > node4.38447: UDP, length 113
03:28:13.832923 IP node2.39799 > node4.38447: UDP, length 113
03:28:13.833013 IP node2.37408 > node4.38447: UDP, length 112
03:28:13.833078 IP node2.57377 > node4.38447: UDP, length 113
03:28:13.833287 IP node2.46985 > node4.38447: UDP, length 113
03:28:13.833454 IP node2.52757 > node4.38447: UDP, length 113
03:28:13.833721 IP node2.54401 > node4.38447: UDP, length 112
03:28:13.833816 IP node2.50964 > node4.38447: UDP, length 113
03:28:13.834084 IP node2.49898 > node4.38447: UDP, length 113
03:28:13.834278 IP node2.50393 > node4.38447: UDP, length 113
03:28:13.834577 IP node2.36086 > node4.38447: UDP, length 113
03:28:13.834783 IP node2.59155 > node4.38447: UDP, length 113
03:28:13.835428 IP node2.34019 > node4.38447: UDP, length 113
03:28:13.835613 IP node2.52204 > node4.38447: UDP, length 113
03:28:13.836033 IP node2.44309 > node4.38447: UDP, length 113
03:28:13.836390 IP node2.46185 > node4.38447: UDP, length 113
03:28:13.836492 IP node2.46331 > node4.38447: UDP, length 113
03:28:13.836858 IP node2.54377 > node4.38447: UDP, length 113
03:28:13.837116 IP node2.56345 > node4.38447: UDP, length 113
03:28:13.837492 IP node2.56279 > node4.38447: UDP, length 113
03:28:13.857261 IP node2.56345 > node3.36125: UDP, length 113
03:28:13.857674 IP node2.45886 > node3.36125: UDP, length 112
03:28:13.858104 IP node2.52757 > node3.36125: UDP, length 113
03:28:13.858574 IP node2.53696 > node3.36125: UDP, length 110
03:28:13.858638 IP node2.50365 > node3.36125: UDP, length 113
03:28:13.858883 IP node2.37408 > node3.36125: UDP, length 112
03:28:13.859121 IP node2.39799 > node3.36125: UDP, length 113
03:28:13.859613 IP node2.42580 > node3.36125: UDP, length 112
03:28:13.859898 IP node2.57377 > node3.36125: UDP, length 113
03:28:13.860088 IP node2.36086 > node3.36125: UDP, length 113
03:28:13.860394 IP node2.60393 > node3.36125: UDP, length 113
03:28:13.860462 IP node2.59524 > node3.36125: UDP, length 113
03:28:13.860543 IP node2.50393 > node3.36125: UDP, length 113
03:28:13.860906 IP node2.54377 > node3.36125: UDP, length 113
03:28:13.861153 IP node2.50586 > node3.36125: UDP, length 113
03:28:13.861526 IP node2.60280 > node3.36125: UDP, length 113
03:28:13.861758 IP node2.50964 > node3.36125: UDP, length 113
03:28:13.861868 IP node2.46331 > node3.36125: UDP, length 113
03:28:13.861954 IP node2.56279 > node3.36125: UDP, length 113
03:28:13.862279 IP node2.46185 > node3.36125: UDP, length 113
03:28:13.862528 IP node2.39953 > node3.36125: UDP, length 113
03:28:13.862756 IP node2.49898 > node3.36125: UDP, length 113
03:28:13.863017 IP node2.44309 > node3.36125: UDP, length 113
03:28:13.863171 IP node2.54401 > node3.36125: UDP, length 112
03:28:13.863448 IP node2.46985 > node3.36125: UDP, length 113
03:28:13.864033 IP node2.35129 > node3.36125: UDP, length 113
03:28:13.864317 IP node2.45754 > node3.36125: UDP, length 113
03:28:13.865307 IP node2.59155 > node3.36125: UDP, length 113
03:28:13.866608 IP node2.60393 > node4.47792: UDP, length 113
03:28:13.866713 IP node2.46185 > node4.47792: UDP, length 113
03:28:13.866937 IP node2.42580 > node4.47792: UDP, length 112
03:28:13.867451 IP node2.39799 > node4.47792: UDP, length 113
03:28:13.867610 IP node2.56345 > node4.47792: UDP, length 113
03:28:13.867812 IP node2.45754 > node4.47792: UDP, length 113
03:28:13.868418 IP node2.59524 > node4.47792: UDP, length 113
03:28:13.868505 IP node2.37408 > node4.47792: UDP, length 112
03:28:13.868815 IP node2.52204 > node3.36125: UDP, length 113
03:28:13.869089 IP node2.50964 > node4.47792: UDP, length 113
03:28:13.869298 IP node2.36086 > node4.47792: UDP, length 113
03:28:13.869371 IP node2.60280 > node4.47792: UDP, length 113
03:28:13.869728 IP node2.46331 > node4.47792: UDP, length 113
03:28:13.869892 IP node2.50393 > node4.47792: UDP, length 113
03:28:13.870091 IP node2.35129 > node4.47792: UDP, length 113
03:28:13.870189 IP node2.57377 > node4.47792: UDP, length 113
03:28:13.870238 IP node2.39953 > node4.47792: UDP, length 113
03:28:13.870375 IP node2.54401 > node4.47792: UDP, length 112
03:28:13.870438 IP node2.50365 > node4.47792: UDP, length 113
03:28:13.871572 IP node2.44309 > node4.47792: UDP, length 113
03:28:13.871680 IP node2.53696 > node4.47792: UDP, length 110
03:28:13.871768 IP node2.52757 > node4.47792: UDP, length 113
03:28:13.871939 IP node2.34019 > node3.36125: UDP, length 113
03:28:13.872056 IP node2.34019 > node4.47792: UDP, length 113
03:28:13.872140 IP node2.56279 > node4.47792: UDP, length 113
03:28:13.872284 IP node2.52204 > node4.47792: UDP, length 113
03:28:13.872390 IP node2.45886 > node4.47792: UDP, length 112
03:28:13.872646 IP node2.46985 > node4.47792: UDP, length 113
03:28:13.872753 IP node2.50586 > node4.47792: UDP, length 113
03:28:13.872965 IP node2.49898 > node4.47792: UDP, length 113
03:28:13.873336 IP node2.54377 > node4.47792: UDP, length 113
03:28:13.873878 IP node2.59155 > node4.47792: UDP, length 113
03:28:13.882681 IP node2.46185 > node3.49469: UDP, length 113
03:28:13.882980 IP node2.36086 > node3.49469: UDP, length 113
03:28:13.884335 IP node2.60393 > node3.49469: UDP, length 113
03:28:13.884851 IP node2.42580 > node3.49469: UDP, length 112
03:28:13.885234 IP node2.34019 > node3.49469: UDP, length 113
03:28:13.885555 IP node2.50964 > node3.49469: UDP, length 113
03:28:13.885943 IP node2.57377 > node3.49469: UDP, length 113
03:28:13.886111 IP node2.50586 > node3.49469: UDP, length 113
03:28:13.886287 IP node2.53696 > node3.49469: UDP, length 110
03:28:13.886347 IP node2.50365 > node3.49469: UDP, length 113
03:28:13.886463 IP node2.35129 > node3.49469: UDP, length 113
03:28:13.886883 IP node2.37408 > node3.49469: UDP, length 112
03:28:13.887070 IP node2.46331 > node3.49469: UDP, length 113
03:28:13.887169 IP node2.60280 > node3.49469: UDP, length 113
03:28:13.887233 IP node2.59524 > node3.49469: UDP, length 113
03:28:13.887392 IP node2.44309 > node3.49469: UDP, length 113
03:28:13.887743 IP node2.45754 > node3.49469: UDP, length 113
03:28:13.888068 IP node2.56345 > node3.49469: UDP, length 113
03:28:13.888605 IP node2.54401 > node3.49469: UDP, length 112
03:28:13.889201 IP node2.39799 > node3.49469: UDP, length 113
03:28:13.889428 IP node2.50393 > node3.49469: UDP, length 113
03:28:13.889497 IP node2.39953 > node3.49469: UDP, length 113
03:28:13.889857 IP node2.52757 > node3.49469: UDP, length 113
03:28:13.890197 IP node2.46985 > node3.49469: UDP, length 113
03:28:13.890440 IP node2.45886 > node3.49469: UDP, length 112
03:28:13.890500 IP node2.49898 > node3.49469: UDP, length 113
03:28:13.890804 IP node2.54377 > node3.49469: UDP, length 113
03:28:13.891834 IP node2.56279 > node3.49469: UDP, length 113
03:28:13.891989 IP node2.52204 > node3.49469: UDP, length 113
03:28:13.892285 IP node2.59155 > node3.49469: UDP, length 113
03:28:13.970227 IP node2.34019 > node3.45401: UDP, length 113
03:28:13.971414 IP node2.46185 > node3.45401: UDP, length 113
03:28:13.971691 IP node2.50365 > node3.45401: UDP, length 113
03:28:13.973978 IP node2.45886 > node3.45401: UDP, length 112
03:28:13.976096 IP node2.42580 > node3.45401: UDP, length 112
03:28:13.976633 IP node2.36086 > node3.45401: UDP, length 113
03:28:13.977608 IP node2.50586 > node3.45401: UDP, length 113
03:28:13.977763 IP node2.45754 > node3.45401: UDP, length 113
03:28:13.979415 IP node2.46331 > node3.45401: UDP, length 113
03:28:13.979609 IP node2.50964 > node3.45401: UDP, length 113
03:28:13.979742 IP node2.52757 > node3.45401: UDP, length 113
03:28:13.980974 IP node2.49898 > node3.45401: UDP, length 113
03:28:13.981156 IP node2.50393 > node3.45401: UDP, length 113
03:28:13.981229 IP node2.35129 > node3.45401: UDP, length 113
03:28:13.981488 IP node2.57377 > node3.45401: UDP, length 113
03:28:13.981637 IP node2.54401 > node3.45401: UDP, length 112
03:28:13.982028 IP node2.53696 > node3.45401: UDP, length 110
03:28:13.982584 IP node2.56345 > node3.45401: UDP, length 113
03:28:13.983084 IP node2.59524 > node3.45401: UDP, length 113
03:28:13.983268 IP node2.60393 > node3.45401: UDP, length 113
03:28:13.983911 IP node2.60280 > node3.45401: UDP, length 113
03:28:13.984567 IP node2.37408 > node3.45401: UDP, length 112
03:28:13.984893 IP node2.54377 > node3.45401: UDP, length 113
03:28:13.985107 IP node2.56279 > node3.45401: UDP, length 113
03:28:13.986073 IP node2.59155 > node3.45401: UDP, length 113
03:28:13.986290 IP node2.46985 > node3.45401: UDP, length 113
03:28:13.986842 IP node2.39799 > node3.45401: UDP, length 113
03:28:13.987143 IP node2.52204 > node3.45401: UDP, length 113
03:28:13.988229 IP node2.44309 > node3.45401: UDP, length 113
03:28:13.988886 IP node2.39953 > node3.45401: UDP, length 113
03:28:14.042816 IP node2.52204 > node4.54038: UDP, length 487
03:28:14.043149 IP node2.52204 > node4.39188: UDP, length 487
03:28:14.043232 IP node2.52204 > node4.43338: UDP, length 487
03:28:14.043308 IP node2.52204 > node4.39260: UDP, length 487
03:28:14.043389 IP node2.52204 > node4.41567: UDP, length 487
03:28:14.043653 IP node2.52204 > node3.50931: UDP, length 487
03:28:14.043874 IP node2.52204 > node4.47792: UDP, length 487
03:28:14.043970 IP node2.52204 > node3.49469: UDP, length 487
03:28:14.044063 IP node2.52204 > node3.46151: UDP, length 487
03:28:14.044141 IP node2.52204 > node4.39614: UDP, length 487
03:28:14.101119 IP node2.59155 > node3.50931: UDP, length 87
03:28:14.115117 IP node2.56279 > node3.46151: UDP, length 87
03:28:14.121198 IP node2.60393 > node4.45119: UDP, length 113
03:28:14.121376 IP node2.39799 > node4.45119: UDP, length 113
03:28:14.121583 IP node2.59524 > node4.45119: UDP, length 113
03:28:14.121691 IP node2.45886 > node4.45119: UDP, length 112
03:28:14.121900 IP node2.44309 > node4.45119: UDP, length 113
03:28:14.122643 IP node2.52204 > node4.45119: UDP, length 113
03:28:14.122757 IP node2.57377 > node4.45119: UDP, length 113
03:28:14.123681 IP node2.54377 > node4.45119: UDP, length 113
03:28:14.124077 IP node2.34019 > node4.45119: UDP, length 113
03:28:14.124140 IP node2.46985 > node4.45119: UDP, length 113
03:28:14.125299 IP node2.52757 > node4.45119: UDP, length 113
03:28:14.126611 IP node2.59155 > node4.45119: UDP, length 113
03:28:14.127805 IP node2.37408 > node4.45119: UDP, length 112
03:28:14.128139 IP node2.53696 > node4.45119: UDP, length 110
03:28:14.132775 IP node2.35129 > node4.45119: UDP, length 113
03:28:14.133009 IP node2.54401 > node4.45119: UDP, length 112
03:28:14.133978 IP node2.46185 > node4.45119: UDP, length 113
03:28:14.135333 IP node2.56345 > node4.45119: UDP, length 113
03:28:14.136064 IP node2.46331 > node4.45119: UDP, length 113
03:28:14.136172 IP node2.50586 > node4.45119: UDP, length 113
03:28:14.136446 IP node2.42580 > node4.45119: UDP, length 112
03:28:14.137558 IP node2.49898 > node4.45119: UDP, length 113
03:28:14.137668 IP node2.50393 > node4.45119: UDP, length 113
03:28:14.138782 IP node2.45754 > node4.45119: UDP, length 113
03:28:14.139137 IP node2.60280 > node4.45119: UDP, length 113
03:28:14.139207 IP node2.36086 > node4.45119: UDP, length 113
03:28:14.140473 IP node2.50365 > node4.45119: UDP, length 113
03:28:14.147354 IP node2.56279 > node4.45119: UDP, length 113
03:28:14.148416 IP node2.39953 > node4.45119: UDP, length 113
03:28:14.149621 IP node2.44309 > node4.39188: UDP, length 87
03:28:14.159064 IP node2.52204 > node4.33410: UDP, length 71
03:28:14.159293 IP node2.52204 > node3.50931: UDP, length 71
03:28:14.159454 IP node2.52204 > node4.32788: UDP, length 71
03:28:14.159575 IP node2.52204 > node4.47792: UDP, length 71
03:28:14.159658 IP node2.52204 > node3.49469: UDP, length 71
03:28:14.159735 IP node2.52204 > node3.46151: UDP, length 71
03:28:14.159817 IP node2.52204 > node4.39614: UDP, length 71
03:28:14.160317 IP node2.52204 > node3.37181: UDP, length 71
03:28:14.169805 IP node2.50964 > node4.45119: UDP, length 113
03:28:14.172725 IP node2.46985 > node3.43708: UDP, length 113
03:28:14.174606 IP node2.54377 > node3.43708: UDP, length 113
03:28:14.174823 IP node2.60280 > node3.43708: UDP, length 113
03:28:14.175032 IP node2.35129 > node3.43708: UDP, length 113
03:28:14.175161 IP node2.49898 > node3.43708: UDP, length 113
03:28:14.175248 IP node2.56279 > node3.43708: UDP, length 113
03:28:14.175327 IP node2.39799 > node3.43708: UDP, length 113
03:28:14.175772 IP node2.54401 > node3.43708: UDP, length 112
03:28:14.175859 IP node2.37408 > node3.43708: UDP, length 112
03:28:14.175932 IP node2.50365 > node3.43708: UDP, length 113
03:28:14.176014 IP node2.45886 > node3.43708: UDP, length 112
03:28:14.176605 IP node2.50393 > node3.43708: UDP, length 113
03:28:14.176794 IP node2.34019 > node3.43708: UDP, length 113
03:28:14.177024 IP node2.46185 > node3.43708: UDP, length 113
03:28:14.177229 IP node2.50586 > node3.43708: UDP, length 113
03:28:14.177309 IP node2.52204 > node3.43708: UDP, length 113
03:28:14.177484 IP node2.60393 > node3.43708: UDP, length 113
03:28:14.177559 IP node2.59524 > node3.43708: UDP, length 113
03:28:14.177863 IP node2.52757 > node3.43708: UDP, length 113
03:28:14.178153 IP node2.45754 > node3.43708: UDP, length 113
03:28:14.178265 IP node2.42580 > node3.43708: UDP, length 112
03:28:14.178519 IP node2.46331 > node3.43708: UDP, length 113
03:28:14.179483 IP node2.57377 > node3.43708: UDP, length 113
03:28:14.179739 IP node2.53696 > node3.43708: UDP, length 110
03:28:14.181319 IP node2.36086 > node3.43708: UDP, length 113
03:28:14.184079 IP node2.50964 > node3.43708: UDP, length 113
03:28:14.184586 IP node2.56345 > node3.43708: UDP, length 113
03:28:14.185555 IP node2.59155 > node3.43708: UDP, length 113
03:28:14.195414 IP node2.44309 > node3.43708: UDP, length 113
03:28:14.196017 IP node2.39953 > node3.43708: UDP, length 113
03:28:14.241853 IP node2.39953 > node4.44728: UDP, length 113
03:28:14.242592 IP node2.60280 > node4.44728: UDP, length 113
03:28:14.242824 IP node2.35129 > node4.44728: UDP, length 113
03:28:14.242994 IP node2.44309 > node4.44728: UDP, length 113
03:28:14.243288 IP node2.53696 > node4.44728: UDP, length 110
03:28:14.243670 IP node2.50586 > node4.44728: UDP, length 113
03:28:14.243726 IP node2.39799 > node4.44728: UDP, length 113
