03:45:14.414460 IP node2.44278 > node4.43535: UDP, length 113
03:45:14.415632 IP node2.34901 > node4.43535: UDP, length 113
03:45:14.416305 IP node2.43732 > node4.43535: UDP, length 113
03:45:14.416455 IP node2.49754 > node4.43535: UDP, length 113
03:45:14.416879 IP node2.39954 > node4.43535: UDP, length 113
03:45:14.417236 IP node2.58597 > node4.43535: UDP, length 113
03:45:14.417287 IP node2.44881 > node4.43535: UDP, length 113
03:45:14.417390 IP node2.46240 > node4.43535: UDP, length 111
03:45:14.417494 IP node2.60168 > node4.43535: UDP, length 113
03:45:14.417696 IP node2.42544 > node4.43535: UDP, length 113
03:45:14.418029 IP node2.54620 > node4.43535: UDP, length 113
03:45:14.418087 IP node2.38644 > node4.43535: UDP, length 113
03:45:14.418693 IP node2.50082 > node4.43535: UDP, length 112
03:45:14.418753 IP node2.39590 > node4.43535: UDP, length 113
03:45:14.418753 IP node2.33434 > node4.43535: UDP, length 113
03:45:14.419003 IP node2.46051 > node4.43535: UDP, length 113
03:45:14.419312 IP node2.33629 > node4.43535: UDP, length 113
03:45:14.419380 IP node2.40292 > node4.43535: UDP, length 113
03:45:14.419546 IP node2.59900 > node4.43535: UDP, length 113
03:45:14.419609 IP node2.33901 > node4.43535: UDP, length 113
03:45:14.419895 IP node2.33273 > node4.43535: UDP, length 113
03:45:14.420170 IP node2.33869 > node4.43535: UDP, length 113
03:45:14.420440 IP node2.45176 > node4.43535: UDP, length 113
03:45:14.420440 IP node2.44832 > node4.43535: UDP, length 111
03:45:14.420576 IP node2.35425 > node4.43535: UDP, length 113
03:45:14.420627 IP node2.45941 > node4.43535: UDP, length 113
03:45:14.421031 IP node2.37998 > node4.43535: UDP, length 113
03:45:14.421183 IP node2.53863 > node4.43535: UDP, length 112
03:45:14.421183 IP node2.37029 > node4.43535: UDP, length 113
03:45:14.421516 IP node2.47183 > node4.43535: UDP, length 113
03:45:14.421594 IP node2.45020 > node4.43535: UDP, length 113
03:45:14.421596 IP node2.37614 > node4.43535: UDP, length 113
03:45:14.421695 IP node2.50420 > node4.43535: UDP, length 113
03:45:14.422081 IP node2.53302 > node4.43535: UDP, length 113
03:45:14.422267 IP node2.36822 > node4.43535: UDP, length 113
03:45:14.423393 IP node2.42304 > node4.43535: UDP, length 113
03:45:14.423715 IP node2.34103 > node4.43535: UDP, length 113
03:45:14.423715 IP node2.50822 > node4.43535: UDP, length 113
03:45:14.423924 IP node2.35476 > node4.43535: UDP, length 113
03:45:14.470524 IP node2.53706 > node4.43535: UDP, length 113
03:45:14.538921 IP node2.33629 > node4.36649: UDP, length 113
03:45:14.541336 IP node2.59900 > node4.36649: UDP, length 113
03:45:14.541530 IP node2.58597 > node4.36649: UDP, length 113
03:45:14.542262 IP node2.44278 > node4.36649: UDP, length 113
03:45:14.542424 IP node2.35476 > node4.36649: UDP, length 113
03:45:14.542582 IP node2.45176 > node4.36649: UDP, length 113
03:45:14.542717 IP node2.33869 > node4.36649: UDP, length 113
03:45:14.543249 IP node2.35425 > node4.36649: UDP, length 113
03:45:14.543381 IP node2.33434 > node4.36649: UDP, length 113
03:45:14.543814 IP node2.37614 > node4.36649: UDP, length 113
03:45:14.543878 IP node2.44832 > node4.36649: UDP, length 111
03:45:14.544026 IP node2.40292 > node4.36649: UDP, length 113
03:45:14.544104 IP node2.33273 > node4.36649: UDP, length 113
03:45:14.544189 IP node2.50420 > node4.36649: UDP, length 113
03:45:14.544266 IP node2.49754 > node4.36649: UDP, length 113
03:45:14.544341 IP node2.33901 > node4.36649: UDP, length 113
03:45:14.544441 IP node2.46051 > node4.36649: UDP, length 113
03:45:14.544644 IP node2.43732 > node4.36649: UDP, length 113
03:45:14.544742 IP node2.47183 > node4.36649: UDP, length 113
03:45:14.544915 IP node2.53863 > node4.36649: UDP, length 112
03:45:14.546006 IP node2.50082 > node4.36649: UDP, length 112
03:45:14.546888 IP node2.39590 > node4.36649: UDP, length 113
03:45:14.546977 IP node2.39954 > node4.36649: UDP, length 113
03:45:14.547046 IP node2.45941 > node4.36649: UDP, length 113
03:45:14.548038 IP node2.36822 > node4.36649: UDP, length 113
03:45:14.548113 IP node2.38644 > node4.36649: UDP, length 113
03:45:14.548597 IP node2.60168 > node4.36649: UDP, length 113
03:45:14.548972 IP node2.34103 > node4.36649: UDP, length 113
03:45:14.549050 IP node2.34901 > node4.36649: UDP, length 113
03:45:14.549114 IP node2.44881 > node4.36649: UDP, length 113
03:45:14.549572 IP node2.42544 > node4.36649: UDP, length 113
03:45:14.549935 IP node2.50822 > node4.36649: UDP, length 113
03:45:14.550245 IP node2.53706 > node4.36649: UDP, length 113
03:45:14.550301 IP node2.54620 > node4.36649: UDP, length 113
03:45:14.550366 IP node2.46240 > node4.36649: UDP, length 111
03:45:14.551445 IP node2.42304 > node4.36649: UDP, length 113
03:45:14.552111 IP node2.37029 > node4.36649: UDP, length 113
03:45:14.552257 IP node2.45020 > node4.36649: UDP, length 113
03:45:14.552594 IP node2.37998 > node4.36649: UDP, length 113
03:45:14.552875 IP node2.53302 > node4.36649: UDP, length 113
03:45:14.583143 IP node2.38644 > node4.44488: UDP, length 113
03:45:14.583298 IP node2.59900 > node4.44488: UDP, length 113
03:45:14.583765 IP node2.37998 > node4.44488: UDP, length 113
03:45:14.584548 IP node2.33629 > node4.44488: UDP, length 113
03:45:14.585153 IP node2.33869 > node4.44488: UDP, length 113
03:45:14.585365 IP node2.53863 > node4.44488: UDP, length 112
03:45:14.585744 IP node2.42304 > node4.44488: UDP, length 113
03:45:14.586280 IP node2.46240 > node4.44488: UDP, length 111
03:45:14.586682 IP node2.33901 > node4.44488: UDP, length 113
03:45:14.587028 IP node2.54620 > node4.44488: UDP, length 113
03:45:14.587121 IP node2.50082 > node4.44488: UDP, length 112
03:45:14.587204 IP node2.46051 > node4.44488: UDP, length 113
03:45:14.587453 IP node2.42544 > node4.44488: UDP, length 113
03:45:14.587906 IP node2.36822 > node4.44488: UDP, length 113
03:45:14.588000 IP node2.58597 > node4.44488: UDP, length 113
03:45:14.588160 IP node2.45176 > node4.44488: UDP, length 113
03:45:14.588240 IP node2.50822 > node4.44488: UDP, length 113
03:45:14.588318 IP node2.39590 > node4.44488: UDP, length 113
03:45:14.588689 IP node2.50420 > node4.44488: UDP, length 113
03:45:14.588764 IP node2.47183 > node4.44488: UDP, length 113
03:45:14.588950 IP node2.35425 > node4.44488: UDP, length 113
03:45:14.589196 IP node2.33273 > node4.44488: UDP, length 113
03:45:14.589257 IP node2.45020 > node4.44488: UDP, length 113
03:45:14.589339 IP node2.37029 > node4.44488: UDP, length 113
03:45:14.589941 IP node2.43732 > node4.44488: UDP, length 113
03:45:14.590221 IP node2.45941 > node4.44488: UDP, length 113
03:45:14.590314 IP node2.40292 > node4.44488: UDP, length 113
03:45:14.591350 IP node2.53706 > node4.44488: UDP, length 113
03:45:14.591447 IP node2.33434 > node4.44488: UDP, length 113
03:45:14.592210 IP node2.44278 > node4.44488: UDP, length 113
03:45:14.592530 IP node2.60168 > node4.44488: UDP, length 113
03:45:14.592632 IP node2.44881 > node4.44488: UDP, length 113
03:45:14.592793 IP node2.49754 > node4.44488: UDP, length 113
03:45:14.593070 IP node2.39954 > node4.44488: UDP, length 113
03:45:14.593179 IP node2.37614 > node4.44488: UDP, length 113
03:45:14.594162 IP node2.34901 > node4.44488: UDP, length 113
03:45:14.594229 IP node2.34103 > node4.44488: UDP, length 113
03:45:14.594512 IP node2.35476 > node4.44488: UDP, length 113
03:45:14.595372 IP node2.44832 > node4.44488: UDP, length 111
03:45:14.595558 IP node2.53302 > node4.44488: UDP, length 113
03:45:14.790022 IP node2.44278 > node4.42817: UDP, length 113
03:45:14.790914 IP node2.46051 > node4.42817: UDP, length 113
03:45:14.791095 IP node2.50420 > node4.42817: UDP, length 113
03:45:14.791159 IP node2.34103 > node3.45596: UDP, length 113
03:45:14.791219 IP node2.34103 > node4.42817: UDP, length 113
03:45:14.791388 IP node2.33434 > node3.45596: UDP, length 113
03:45:14.791615 IP node2.33434 > node4.42817: UDP, length 113
03:45:14.791696 IP node2.34901 > node4.42817: UDP, length 113
03:45:14.791871 IP node2.45941 > node4.42817: UDP, length 113
03:45:14.792172 IP node2.39954 > node4.42817: UDP, length 113
03:45:14.792312 IP node2.50420 > node3.45596: UDP, length 113
03:45:14.792771 IP node2.46051 > node3.45596: UDP, length 113
03:45:14.792861 IP node2.44278 > node3.45596: UDP, length 113
03:45:14.793009 IP node2.45941 > node3.45596: UDP, length 113
03:45:14.793921 IP node2.39590 > node3.45596: UDP, length 113
03:45:14.793991 IP node2.45020 > node3.45596: UDP, length 113
03:45:14.794083 IP node2.45020 > node4.42817: UDP, length 113
03:45:14.795081 IP node2.34901 > node3.45596: UDP, length 113
03:45:14.795218 IP node2.37998 > node4.42817: UDP, length 113
03:45:14.795687 IP node2.39954 > node3.45596: UDP, length 113
03:45:14.797003 IP node2.37029 > node3.45596: UDP, length 113
03:45:14.799185 IP node2.53706 > node4.42817: UDP, length 113
03:45:14.799755 IP node2.36822 > node3.45596: UDP, length 113
03:45:14.799900 IP node2.53706 > node3.45596: UDP, length 113
03:45:14.800011 IP node2.36822 > node4.42817: UDP, length 113
03:45:14.800309 IP node2.59900 > node3.45596: UDP, length 113
03:45:14.800377 IP node2.37029 > node4.42817: UDP, length 113
03:45:14.800471 IP node2.59900 > node4.42817: UDP, length 113
03:45:14.801031 IP node2.60168 > node3.45596: UDP, length 113
03:45:14.801147 IP node2.60168 > node4.42817: UDP, length 113
03:45:14.801908 IP node2.46240 > node3.45596: UDP, length 111
03:45:14.802094 IP node2.46240 > node4.42817: UDP, length 111
03:45:14.802446 IP node2.44881 > node3.45596: UDP, length 113
03:45:14.802554 IP node2.44881 > node4.42817: UDP, length 113
03:45:14.802863 IP node2.45176 > node4.42817: UDP, length 113
03:45:14.803006 IP node2.50082 > node3.45596: UDP, length 112
03:45:14.803137 IP node2.50082 > node4.42817: UDP, length 112
03:45:14.803341 IP node2.39590 > node4.42817: UDP, length 113
03:45:14.805188 IP node2.35425 > node3.45596: UDP, length 113
03:45:14.805317 IP node2.35425 > node4.42817: UDP, length 113
03:45:14.805362 IP node2.43732 > node3.45596: UDP, length 113
03:45:14.805435 IP node2.43732 > node4.42817: UDP, length 113
03:45:14.806097 IP node2.40292 > node3.45596: UDP, length 113
03:45:14.806236 IP node2.40292 > node4.42817: UDP, length 113
03:45:14.807418 IP node2.53863 > node3.45596: UDP, length 112
03:45:14.807628 IP node2.53863 > node4.42817: UDP, length 112
03:45:14.808619 IP node2.33901 > node3.45596: UDP, length 113
03:45:14.808721 IP node2.33901 > node4.42817: UDP, length 113
03:45:14.809558 IP node2.42544 > node3.45596: UDP, length 113
03:45:14.810361 IP node2.49754 > node3.45596: UDP, length 113
03:45:14.810540 IP node2.47183 > node3.45596: UDP, length 113
03:45:14.810624 IP node2.47183 > node4.42817: UDP, length 113
03:45:14.810768 IP node2.49754 > node4.42817: UDP, length 113
03:45:14.811190 IP node2.33869 > node3.45596: UDP, length 113
03:45:14.811244 IP node2.38644 > node3.45596: UDP, length 113
03:45:14.811356 IP node2.33869 > node4.42817: UDP, length 113
03:45:14.811391 IP node2.37614 > node3.45596: UDP, length 113
03:45:14.811449 IP node2.37614 > node4.42817: UDP, length 113
03:45:14.811737 IP node2.45176 > node3.45596: UDP, length 113
03:45:14.811846 IP node2.42304 > node3.45596: UDP, length 113
03:45:14.811895 IP node2.33273 > node3.45596: UDP, length 113
03:45:14.811956 IP node2.33273 > node4.42817: UDP, length 113
03:45:14.812015 IP node2.54620 > node3.45596: UDP, length 113
03:45:14.812074 IP node2.54620 > node4.42817: UDP, length 113
03:45:14.812180 IP node2.42304 > node4.42817: UDP, length 113
03:45:14.813743 IP node2.42544 > node4.42817: UDP, length 113
03:45:14.814213 IP node2.53302 > node3.45596: UDP, length 113
03:45:14.814368 IP node2.58597 > node3.45596: UDP, length 113
03:45:14.814464 IP node2.58597 > node4.42817: UDP, length 113
03:45:14.815013 IP node2.33629 > node3.45596: UDP, length 113
03:45:14.815188 IP node2.53302 > node4.42817: UDP, length 113
03:45:14.815235 IP node2.33629 > node4.42817: UDP, length 113
03:45:14.815811 IP node2.35476 > node3.45596: UDP, length 113
03:45:14.815902 IP node2.35476 > node4.42817: UDP, length 113
03:45:14.817268 IP node2.38644 > node4.42817: UDP, length 113
03:45:14.817603 IP node2.50822 > node3.45596: UDP, length 113
03:45:14.817713 IP node2.50822 > node4.42817: UDP, length 113
03:45:14.818100 IP node2.44832 > node3.45596: UDP, length 111
03:45:14.818188 IP node2.44832 > node4.42817: UDP, length 111
03:45:14.818532 IP node2.37998 > node3.45596: UDP, length 113
03:45:15.026862 IP node2.43732 > node3.33275: UDP, length 113
03:45:15.027636 IP node2.46240 > node3.33275: UDP, length 111
03:45:15.028559 IP node2.33273 > node3.33275: UDP, length 113
03:45:15.028789 IP node2.35476 > node3.33275: UDP, length 113
03:45:15.028930 IP node2.50082 > node3.33275: UDP, length 112
03:45:15.029035 IP node2.37614 > node3.33275: UDP, length 113
03:45:15.029188 IP node2.46051 > node3.33275: UDP, length 113
03:45:15.029524 IP node2.35425 > node3.33275: UDP, length 113
03:45:15.029736 IP node2.60168 > node3.33275: UDP, length 113
03:45:15.029889 IP node2.34103 > node3.33275: UDP, length 113
03:45:15.030111 IP node2.50420 > node3.33275: UDP, length 113
03:45:15.030301 IP node2.40292 > node3.33275: UDP, length 113
03:45:15.030433 IP node2.59900 > node3.33275: UDP, length 113
03:45:15.030532 IP node2.34901 > node3.33275: UDP, length 113
03:45:15.030679 IP node2.44278 > node3.33275: UDP, length 113
03:45:15.030960 IP node2.53863 > node3.33275: UDP, length 112
03:45:15.031160 IP node2.53706 > node3.33275: UDP, length 113
03:45:15.031284 IP node2.33434 > node3.33275: UDP, length 113
03:45:15.031890 IP node2.33901 > node3.33275: UDP, length 113
03:45:15.032040 IP node2.38644 > node3.33275: UDP, length 113
03:45:15.032101 IP node2.45941 > node3.33275: UDP, length 113
03:45:15.032218 IP node2.39954 > node3.33275: UDP, length 113
03:45:15.032529 IP node2.53302 > node3.33275: UDP, length 113
03:45:15.032915 IP node2.47183 > node3.33275: UDP, length 113
03:45:15.033116 IP node2.44881 > node3.33275: UDP, length 113
03:45:15.033213 IP node2.36822 > node3.33275: UDP, length 113
03:45:15.033726 IP node2.33629 > node3.33275: UDP, length 113
03:45:15.035053 IP node2.58597 > node3.33275: UDP, length 113
03:45:15.035809 IP node2.42304 > node3.33275: UDP, length 113
03:45:15.036078 IP node2.39590 > node3.33275: UDP, length 113
03:45:15.036148 IP node2.54620 > node3.33275: UDP, length 113
03:45:15.036437 IP node2.50822 > node3.33275: UDP, length 113
03:45:15.036593 IP node2.33869 > node3.33275: UDP, length 113
03:45:15.036773 IP node2.42544 > node3.33275: UDP, length 113
03:45:15.036895 IP node2.45020 > node3.33275: UDP, length 113
03:45:15.036959 IP node2.44832 > node3.33275: UDP, length 111
03:45:15.037060 IP node2.37998 > node3.33275: UDP, length 113
03:45:15.037546 IP node2.49754 > node3.33275: UDP, length 113
03:45:15.037662 IP node2.37029 > node3.33275: UDP, length 113
03:45:15.038678 IP node2.45176 > node3.33275: UDP, length 113
03:45:15.143618 IP node2.37614 > node4.55298: UDP, length 113
03:45:15.144185 IP node2.36822 > node4.55298: UDP, length 113
03:45:15.144426 IP node2.43732 > node4.55298: UDP, length 113
03:45:15.145516 IP node2.46240 > node4.55298: UDP, length 111
03:45:15.146013 IP node2.37998 > node4.55298: UDP, length 113
03:45:15.146254 IP node2.47183 > node4.55298: UDP, length 113
03:45:15.146497 IP node2.33273 > node4.55298: UDP, length 113
03:45:15.146623 IP node2.50082 > node4.55298: UDP, length 112
03:45:15.146808 IP node2.58597 > node4.55298: UDP, length 113
03:45:15.146893 IP node2.35476 > node4.55298: UDP, length 113
03:45:15.147020 IP node2.40292 > node4.55298: UDP, length 113
03:45:15.147259 IP node2.53706 > node4.55298: UDP, length 113
03:45:15.147406 IP node2.44278 > node4.55298: UDP, length 113
03:45:15.147568 IP node2.34901 > node4.55298: UDP, length 113
03:45:15.147665 IP node2.46051 > node4.55298: UDP, length 113
03:45:15.147895 IP node2.45941 > node4.55298: UDP, length 113
03:45:15.148724 IP node2.49754 > node4.55298: UDP, length 113
03:45:15.149092 IP node2.45176 > node4.55298: UDP, length 113
03:45:15.149748 IP node2.50822 > node4.55298: UDP, length 113
03:45:15.149852 IP node2.37029 > node4.55298: UDP, length 113
03:45:15.149919 IP node2.54620 > node4.55298: UDP, length 113
03:45:15.150157 IP node2.35425 > node4.55298: UDP, length 113
03:45:15.150349 IP node2.38644 > node4.55298: UDP, length 113
03:45:15.151034 IP node2.39954 > node4.55298: UDP, length 113
03:45:15.151131 IP node2.42304 > node4.55298: UDP, length 113
03:45:15.151443 IP node2.33629 > node4.55298: UDP, length 113
03:45:15.151969 IP node2.33901 > node4.55298: UDP, length 113
03:45:15.152075 IP node2.60168 > node4.55298: UDP, length 113
03:45:15.152224 IP node2.53302 > node4.55298: UDP, length 113
03:45:15.152863 IP node2.59900 > node4.55298: UDP, length 113
03:45:15.152961 IP node2.44832 > node4.55298: UDP, length 111
03:45:15.153092 IP node2.45020 > node4.55298: UDP, length 113
03:45:15.153186 IP node2.33869 > node4.55298: UDP, length 113
03:45:15.153551 IP node2.39590 > node4.55298: UDP, length 113
03:45:15.153801 IP node2.33434 > node4.55298: UDP, length 113
03:45:15.154124 IP node2.44881 > node4.55298: UDP, length 113
03:45:15.155343 IP node2.42544 > node4.55298: UDP, length 113
03:45:15.155805 IP node2.53863 > node4.55298: UDP, length 112
03:45:15.156451 IP node2.34103 > node4.55298: UDP, length 113
03:45:15.157614 IP node2.50420 > node4.55298: UDP, length 113
03:45:15.434704 IP node2.39954 > node4.45910: UDP, length 113
03:45:15.436188 IP node2.53706 > node4.45910: UDP, length 113
03:45:15.436450 IP node2.50082 > node4.45910: UDP, length 112
03:45:15.438103 IP node2.34901 > node4.45910: UDP, length 113
03:45:15.440837 IP node2.45941 > node4.45910: UDP, length 113
03:45:15.443039 IP node2.58597 > node4.45910: UDP, length 113
03:45:15.443448 IP node2.53863 > node4.45910: UDP, length 112
03:45:15.444758 IP node2.36822 > node4.45910: UDP, length 113
03:45:15.445145 IP node2.45020 > node4.45910: UDP, length 113
03:45:15.446232 IP node2.38644 > node4.45910: UDP, length 113
03:45:15.446388 IP node2.46240 > node4.45910: UDP, length 111
03:45:15.446476 IP node2.39590 > node4.45910: UDP, length 113
03:45:15.446745 IP node2.46051 > node4.45910: UDP, length 113
03:45:15.447340 IP node2.53302 > node4.45910: UDP, length 113
03:45:15.449629 IP node2.50822 > node4.45910: UDP, length 113
03:45:15.450030 IP node2.37998 > node4.45910: UDP, length 113
03:45:15.451097 IP node2.44278 > node4.45910: UDP, length 113
03:45:15.452462 IP node2.43732 > node4.45910: UDP, length 113
03:45:15.452998 IP node2.45176 > node4.45910: UDP, length 113
03:45:15.454163 IP node2.47183 > node4.45910: UDP, length 113
03:45:15.454742 IP node2.33901 > node4.45910: UDP, length 113
03:45:15.455980 IP node2.35476 > node4.45910: UDP, length 113
03:45:15.456446 IP node2.37614 > node4.45910: UDP, length 113
03:45:15.456997 IP node2.44832 > node4.45910: UDP, length 111
03:45:15.457304 IP node2.42304 > node4.45910: UDP, length 113
03:45:15.457635 IP node2.44881 > node4.45910: UDP, length 113
03:45:15.457739 IP node2.42544 > node4.45910: UDP, length 113
03:45:15.459723 IP node2.35425 > node4.45910: UDP, length 113
03:45:15.460055 IP node2.59900 > node4.45910: UDP, length 113
03:45:15.460171 IP node2.50420 > node4.45910: UDP, length 113
03:45:15.460581 IP node2.33434 > node4.45910: UDP, length 113
03:45:15.460636 IP node2.54620 > node4.45910: UDP, length 113
03:45:15.462263 IP node2.33273 > node4.45910: UDP, length 113
03:45:15.462389 IP node2.33869 > node4.45910: UDP, length 113
03:45:15.462941 IP node2.49754 > node4.45910: UDP, length 113
03:45:15.463143 IP node2.60168 > node4.45910: UDP, length 113
03:45:15.463906 IP node2.34103 > node4.45910: UDP, length 113
03:45:15.464146 IP node2.37029 > node4.45910: UDP, length 113
03:45:15.465143 IP node2.33629 > node4.45910: UDP, length 113
03:45:15.466011 IP node2.40292 > node4.45910: UDP, length 113
03:45:15.516362 IP node2.44278 > node4.35032: UDP, length 113
03:45:15.516695 IP node2.35476 > node4.35032: UDP, length 113
03:45:15.516924 IP node2.34103 > node4.35032: UDP, length 113
03:45:15.517403 IP node2.33629 > node4.35032: UDP, length 113
03:45:15.517933 IP node2.36822 > node4.35032: UDP, length 113
03:45:15.519296 IP node2.40292 > node4.35032: UDP, length 113
03:45:15.519595 IP node2.50082 > node4.35032: UDP, length 112
03:45:15.519736 IP node2.37998 > node4.35032: UDP, length 113
03:45:15.519814 IP node2.50420 > node4.35032: UDP, length 113
03:45:15.520277 IP node2.39590 > node4.35032: UDP, length 113
03:45:15.520418 IP node2.37029 > node4.35032: UDP, length 113
03:45:15.520762 IP node2.45176 > node4.35032: UDP, length 113
03:45:15.521273 IP node2.37614 > node4.35032: UDP, length 113
03:45:15.521371 IP node2.46240 > node4.35032: UDP, length 111
03:45:15.521640 IP node2.50822 > node4.35032: UDP, length 113
03:45:15.522233 IP node2.39954 > node4.35032: UDP, length 113
03:45:15.522546 IP node2.42544 > node4.35032: UDP, length 113
03:45:15.522619 IP node2.58597 > node4.35032: UDP, length 113
03:45:15.522834 IP node2.38644 > node4.35032: UDP, length 113
03:45:15.523065 IP node2.34901 > node4.35032: UDP, length 113
03:45:15.523429 IP node2.44881 > node4.35032: UDP, length 113
03:45:15.524285 IP node2.45020 > node4.35032: UDP, length 113
03:45:15.524366 IP node2.53706 > node4.35032: UDP, length 113
03:45:15.524412 IP node2.44832 > node4.35032: UDP, length 111
03:45:15.524486 IP node2.49754 > node4.35032: UDP, length 113
03:45:15.524552 IP node2.45941 > node4.35032: UDP, length 113
03:45:15.525306 IP node2.53302 > node4.35032: UDP, length 113
03:45:15.526142 IP node2.33434 > node4.35032: UDP, length 113
03:45:15.526215 IP node2.60168 > node4.35032: UDP, length 113
03:45:15.526292 IP node2.47183 > node4.35032: UDP, length 113
03:45:15.526456 IP node2.33273 > node4.35032: UDP, length 113
03:45:15.526604 IP node2.53863 > node4.35032: UDP, length 112
03:45:15.527066 IP node2.43732 > node4.35032: UDP, length 113
03:45:15.527505 IP node2.35425 > node4.35032: UDP, length 113
03:45:15.527894 IP node2.42304 > node4.35032: UDP, length 113
03:45:15.528218 IP node2.33901 > node4.35032: UDP, length 113
03:45:15.528323 IP node2.33869 > node4.35032: UDP, length 113
03:45:15.528540 IP node2.59900 > node4.35032: UDP, length 113
03:45:15.528700 IP node2.54620 > node4.35032: UDP, length 113
03:45:15.528915 IP node2.46051 > node4.35032: UDP, length 113
03:45:15.567874 IP node2.46051 > node4.55446: UDP, length 113
03:45:15.568296 IP node2.44278 > node4.55446: UDP, length 113
03:45:15.568493 IP node2.40292 > node4.55446: UDP, length 113
03:45:15.568576 IP node2.43732 > node4.55446: UDP, length 113
03:45:15.568650 IP node2.54620 > node4.55446: UDP, length 113
03:45:15.569107 IP node2.47183 > node4.55446: UDP, length 113
03:45:15.569193 IP node2.46240 > node4.55446: UDP, length 111
03:45:15.569335 IP node2.53706 > node4.55446: UDP, length 113
03:45:15.569740 IP node2.37614 > node4.55446: UDP, length 113
03:45:15.569808 IP node2.42544 > node4.55446: UDP, length 113
03:45:15.569891 IP node2.36822 > node4.55446: UDP, length 113
03:45:15.569966 IP node2.39590 > node4.55446: UDP, length 113
03:45:15.570044 IP node2.37029 > node4.55446: UDP, length 113
03:45:15.570114 IP node2.49754 > node4.55446: UDP, length 113
03:45:15.570254 IP node2.50082 > node4.55446: UDP, length 112
03:45:15.570348 IP node2.34103 > node4.55446: UDP, length 113
03:45:15.570835 IP node2.37998 > node4.55446: UDP, length 113
03:45:15.570949 IP node2.53863 > node4.55446: UDP, length 112
03:45:15.571596 IP node2.35425 > node4.55446: UDP, length 113
03:45:15.571769 IP node2.42304 > node4.55446: UDP, length 113
03:45:15.571850 IP node2.33273 > node4.55446: UDP, length 113
03:45:15.571928 IP node2.45176 > node4.55446: UDP, length 113
03:45:15.572633 IP node2.59900 > node4.55446: UDP, length 113
03:45:15.572806 IP node2.35476 > node4.55446: UDP, length 113
03:45:15.573078 IP node2.50420 > node4.55446: UDP, length 113
03:45:15.573232 IP node2.39954 > node4.55446: UDP, length 113
03:45:15.574110 IP node2.44832 > node4.55446: UDP, length 111
03:45:15.574233 IP node2.44881 > node4.55446: UDP, length 113
03:45:15.574883 IP node2.50822 > node4.55446: UDP, length 113
03:45:15.575792 IP node2.60168 > node4.55446: UDP, length 113
03:45:15.575854 IP node2.33869 > node4.55446: UDP, length 113
03:45:15.576639 IP node2.33629 > node4.55446: UDP, length 113
03:45:15.577392 IP node2.53302 > node4.55446: UDP, length 113
03:45:15.577797 IP node2.33434 > node4.55446: UDP, length 113
03:45:15.577908 IP node2.45941 > node4.55446: UDP, length 113
03:45:15.578391 IP node2.33901 > node4.55446: UDP, length 113
03:45:15.578546 IP node2.45020 > node4.55446: UDP, length 113
03:45:15.578762 IP node2.38644 > node4.55446: UDP, length 113
03:45:15.578908 IP node2.58597 > node4.55446: UDP, length 113
03:45:15.580726 IP node2.34901 > node4.55446: UDP, length 113
03:45:15.581640 IP node2.50822 > node3.42797: UDP, length 113
03:45:15.583240 IP node2.34901 > node3.42797: UDP, length 113
03:45:15.583337 IP node2.35425 > node3.42797: UDP, length 113
03:45:15.583644 IP node2.46240 > node3.42797: UDP, length 111
03:45:15.583808 IP node2.33901 > node3.42797: UDP, length 113
03:45:15.583945 IP node2.44881 > node3.42797: UDP, length 113
03:45:15.584164 IP node2.34103 > node3.42797: UDP, length 113
03:45:15.584366 IP node2.42544 > node3.42797: UDP, length 113
03:45:15.584722 IP node2.39590 > node3.42797: UDP, length 113
03:45:15.584788 IP node2.46051 > node3.42797: UDP, length 113
03:45:15.584864 IP node2.50420 > node3.42797: UDP, length 113
03:45:15.584960 IP node2.59900 > node3.42797: UDP, length 113
03:45:15.585199 IP node2.40292 > node3.42797: UDP, length 113
03:45:15.585280 IP node2.45176 > node3.42797: UDP, length 113
03:45:15.585484 IP node2.53863 > node3.42797: UDP, length 112
03:45:15.585549 IP node2.53706 > node3.42797: UDP, length 113
03:45:15.585830 IP node2.36822 > node3.42797: UDP, length 113
03:45:15.585892 IP node2.33273 > node3.42797: UDP, length 113
03:45:15.586064 IP node2.35476 > node3.42797: UDP, length 113
03:45:15.586240 IP node2.47183 > node3.42797: UDP, length 113
03:45:15.586448 IP node2.39954 > node3.42797: UDP, length 113
03:45:15.586546 IP node2.49754 > node3.42797: UDP, length 113
03:45:15.586698 IP node2.44278 > node3.42797: UDP, length 113
03:45:15.587035 IP node2.43732 > node3.42797: UDP, length 113
03:45:15.587366 IP node2.45020 > node3.42797: UDP, length 113
03:45:15.587419 IP node2.50082 > node3.42797: UDP, length 112
03:45:15.587746 IP node2.44832 > node3.42797: UDP, length 111
03:45:15.587829 IP node2.33869 > node3.42797: UDP, length 113
03:45:15.587991 IP node2.33434 > node3.42797: UDP, length 113
03:45:15.588050 IP node2.53302 > node3.42797: UDP, length 113
03:45:15.588212 IP node2.58597 > node3.42797: UDP, length 113
03:45:15.588353 IP node2.33629 > node3.42797: UDP, length 113
03:45:15.589312 IP node2.37998 > node3.42797: UDP, length 113
03:45:15.589851 IP node2.37614 > node3.42797: UDP, length 113
03:45:15.589920 IP node2.42304 > node3.42797: UDP, length 113
03:45:15.590758 IP node2.45941 > node3.42797: UDP, length 113
03:45:15.590809 IP node2.37029 > node3.42797: UDP, length 113
03:45:15.591366 IP node2.54620 > node3.42797: UDP, length 113
03:45:15.591409 IP node2.38644 > node3.42797: UDP, length 113
03:45:15.591885 IP node2.60168 > node3.42797: UDP, length 113
03:45:15.692295 IP node2.42544 > node3.58663: UDP, length 113
03:45:15.692798 IP node2.50822 > node3.58663: UDP, length 113
03:45:15.693026 IP node2.37614 > node3.58663: UDP, length 113
03:45:15.693341 IP node2.46240 > node3.58663: UDP, length 111
03:45:15.693619 IP node2.34901 > node3.58663: UDP, length 113
03:45:15.694331 IP node2.38644 > node3.58663: UDP, length 113
03:45:15.695700 IP node2.42304 > node3.58663: UDP, length 113
03:45:15.696715 IP node2.58597 > node3.58663: UDP, length 113
03:45:15.696796 IP node2.33629 > node3.58663: UDP, length 113
03:45:15.696898 IP node2.53863 > node3.58663: UDP, length 112
03:45:15.697004 IP node2.35476 > node3.58663: UDP, length 113
03:45:15.697052 IP node2.45020 > node3.58663: UDP, length 113
03:45:15.697712 IP node2.35425 > node3.58663: UDP, length 113
03:45:15.698068 IP node2.47183 > node3.58663: UDP, length 113
03:45:15.698296 IP node2.33869 > node3.58663: UDP, length 113
03:45:15.698918 IP node2.40292 > node3.58663: UDP, length 113
03:45:15.699136 IP node2.44832 > node3.58663: UDP, length 111
03:45:15.699377 IP node2.33901 > node3.58663: UDP, length 113
03:45:15.699689 IP node2.36822 > node3.58663: UDP, length 113
03:45:15.699867 IP node2.39590 > node3.58663: UDP, length 113
03:45:15.699938 IP node2.37029 > node3.58663: UDP, length 113
03:45:15.700177 IP node2.49754 > node3.58663: UDP, length 113
03:45:15.700983 IP node2.37998 > node3.58663: UDP, length 113
03:45:15.701281 IP node2.50420 > node3.58663: UDP, length 113
03:45:15.702068 IP node2.44881 > node3.58663: UDP, length 113
03:45:15.702749 IP node2.45941 > node3.58663: UDP, length 113
03:45:15.704426 IP node2.34103 > node3.58663: UDP, length 113
03:45:15.705079 IP node2.39954 > node3.58663: UDP, length 113
03:45:15.707069 IP node2.59900 > node3.58663: UDP, length 113
03:45:15.707379 IP node2.45176 > node3.58663: UDP, length 113
03:45:15.707944 IP node2.60168 > node3.58663: UDP, length 113
03:45:15.709286 IP node2.53302 > node3.58663: UDP, length 113
03:45:15.711810 IP node2.33434 > node3.58663: UDP, length 113
03:45:15.713400 IP node2.50082 > node3.58663: UDP, length 112
03:45:15.714969 IP node2.46051 > node3.58663: UDP, length 113
03:45:15.722635 IP node2.54620 > node3.58663: UDP, length 113
03:45:15.727093 IP node2.53706 > node3.58663: UDP, length 113
03:45:15.727973 IP node2.44278 > node3.58663: UDP, length 113
03:45:15.730259 IP node2.33273 > node3.58663: UDP, length 113
03:45:15.730881 IP node2.43732 > node3.58663: UDP, length 113
03:45:15.745102 IP node2.42304 > node3.39663: UDP, length 113
03:45:15.745878 IP node2.34901 > node3.39663: UDP, length 113
03:45:15.746390 IP node2.37029 > node3.39663: UDP, length 113
03:45:15.746901 IP node2.35425 > node3.39663: UDP, length 113
03:45:15.747117 IP node2.37998 > node3.39663: UDP, length 113
03:45:15.747667 IP node2.33434 > node3.39663: UDP, length 113
03:45:15.748086 IP node2.45176 > node3.39663: UDP, length 113
03:45:15.748817 IP node2.47183 > node3.39663: UDP, length 113
03:45:15.749121 IP node2.44832 > node3.39663: UDP, length 111
03:45:15.749454 IP node2.53863 > node3.39663: UDP, length 112
03:45:15.749780 IP node2.33901 > node3.39663: UDP, length 113
03:45:15.750935 IP node2.33629 > node3.39663: UDP, length 113
03:45:15.751612 IP node2.46240 > node3.39663: UDP, length 111
03:45:15.752639 IP node2.37614 > node3.39663: UDP, length 113
03:45:15.752723 IP node2.54620 > node3.39663: UDP, length 113
03:45:15.753125 IP node2.39590 > node3.39663: UDP, length 113
03:45:15.753251 IP node2.50822 > node3.39663: UDP, length 113
03:45:15.753639 IP node2.34103 > node3.39663: UDP, length 113
03:45:15.753927 IP node2.50082 > node3.39663: UDP, length 112
03:45:15.754022 IP node2.39954 > node3.39663: UDP, length 113
03:45:15.755058 IP node2.40292 > node3.39663: UDP, length 113
03:45:15.755358 IP node2.58597 > node3.39663: UDP, length 113
03:45:15.755932 IP node2.44881 > node3.39663: UDP, length 113
03:45:15.756295 IP node2.50420 > node3.39663: UDP, length 113
03:45:15.756396 IP node2.45941 > node3.39663: UDP, length 113
03:45:15.757516 IP node2.49754 > node3.39663: UDP, length 113
03:45:15.758362 IP node2.35476 > node3.39663: UDP, length 113
03:45:15.758652 IP node2.43732 > node3.39663: UDP, length 113
03:45:15.758817 IP node2.33869 > node3.39663: UDP, length 113
03:45:15.759730 IP node2.36822 > node3.39663: UDP, length 113
03:45:15.760496 IP node2.60168 > node3.39663: UDP, length 113
03:45:15.761939 IP node2.59900 > node3.39663: UDP, length 113
03:45:15.763407 IP node2.45020 > node3.39663: UDP, length 113
03:45:15.766308 IP node2.53706 > node3.39663: UDP, length 113
03:45:15.766601 IP node2.53302 > node3.39663: UDP, length 113
03:45:15.766789 IP node2.44278 > node3.39663: UDP, length 113
03:45:15.767116 IP node2.38644 > node3.39663: UDP, length 113
03:45:15.770046 IP node2.33273 > node3.39663: UDP, length 113
03:45:15.774524 IP node2.42544 > node3.39663: UDP, length 113
03:45:15.776486 IP node2.46051 > node3.39663: UDP, length 113
03:45:15.793858 IP node2.37614 > node4.59050: UDP, length 113
03:45:15.794662 IP node2.36822 > node4.59050: UDP, length 113
03:45:15.794978 IP node2.35476 > node4.59050: UDP, length 113
03:45:15.795094 IP node2.33434 > node4.59050: UDP, length 113
03:45:15.795584 IP node2.58597 > node4.59050: UDP, length 113
03:45:15.795708 IP node2.34901 > node4.59050: UDP, length 113
03:45:15.795945 IP node2.37029 > node4.59050: UDP, length 113
03:45:15.795997 IP node2.42544 > node4.59050: UDP, length 113
03:45:15.796238 IP node2.50822 > node4.59050: UDP, length 113
03:45:15.796468 IP node2.45176 > node4.59050: UDP, length 113
03:45:15.796516 IP node2.39954 > node4.59050: UDP, length 113
03:45:15.796678 IP node2.59900 > node4.59050: UDP, length 113
03:45:15.796727 IP node2.53706 > node4.59050: UDP, length 113
03:45:15.796807 IP node2.50420 > node4.59050: UDP, length 113
03:45:15.797105 IP node2.44278 > node4.59050: UDP, length 113
03:45:15.797294 IP node2.43732 > node4.59050: UDP, length 113
03:45:15.797956 IP node2.54620 > node4.59050: UDP, length 113
03:45:15.798152 IP node2.44881 > node4.59050: UDP, length 113
03:45:15.799074 IP node2.45941 > node4.59050: UDP, length 113
03:45:15.799305 IP node2.39590 > node4.59050: UDP, length 113
03:45:15.799851 IP node2.35425 > node4.59050: UDP, length 113
03:45:15.800646 IP node2.33901 > node4.59050: UDP, length 113
03:45:15.800967 IP node2.34103 > node4.59050: UDP, length 113
03:45:15.802003 IP node2.38644 > node4.59050: UDP, length 113
03:45:15.802608 IP node2.44832 > node4.59050: UDP, length 111
03:45:15.803495 IP node2.37998 > node4.59050: UDP, length 113
03:45:15.805004 IP node2.33629 > node4.59050: UDP, length 113
03:45:15.805132 IP node2.45020 > node4.59050: UDP, length 113
03:45:15.805747 IP node2.53863 > node4.59050: UDP, length 112
03:45:15.806534 IP node2.40292 > node4.59050: UDP, length 113
03:45:15.806766 IP node2.53302 > node4.59050: UDP, length 113
03:45:15.812972 IP node2.42304 > node4.59050: UDP, length 113
03:45:15.813806 IP node2.46051 > node4.59050: UDP, length 113
03:45:15.815368 IP node2.47183 > node4.59050: UDP, length 113
03:45:15.821345 IP node2.49754 > node4.59050: UDP, length 113
03:45:15.821527 IP node2.46240 > node4.59050: UDP, length 111
03:45:15.822190 IP node2.50082 > node4.59050: UDP, length 112
03:45:15.824552 IP node2.33869 > node4.59050: UDP, length 113
03:45:15.825514 IP node2.60168 > node4.59050: UDP, length 113
03:45:15.847166 IP node2.33273 > node4.59050: UDP, length 113
03:45:15.899859 IP node2.37614 > node3.48649: UDP, length 113
03:45:15.902775 IP node2.46051 > node3.48649: UDP, length 113
03:45:15.903155 IP node2.33273 > node3.48649: UDP, length 113
03:45:15.903602 IP node2.44881 > node3.48649: UDP, length 113
03:45:15.903852 IP node2.58597 > node3.48649: UDP, length 113
03:45:15.903943 IP node2.42544 > node3.48649: UDP, length 113
03:45:15.904067 IP node2.50822 > node3.48649: UDP, length 113
03:45:15.904276 IP node2.35476 > node3.48649: UDP, length 113
03:45:15.904375 IP node2.33434 > node3.48649: UDP, length 113
03:45:15.904599 IP node2.45176 > node3.48649: UDP, length 113
03:45:15.904673 IP node2.49754 > node3.48649: UDP, length 113
03:45:15.904931 IP node2.45941 > node3.48649: UDP, length 113
03:45:15.905051 IP node2.40292 > node3.48649: UDP, length 113
03:45:15.905317 IP node2.33869 > node3.48649: UDP, length 113
03:45:15.905367 IP node2.59900 > node3.48649: UDP, length 113
03:45:15.905525 IP node2.33901 > node3.48649: UDP, length 113
03:45:15.905678 IP node2.50420 > node3.48649: UDP, length 113
03:45:15.905801 IP node2.47183 > node3.48649: UDP, length 113
03:45:15.906085 IP node2.46240 > node3.48649: UDP, length 111
03:45:15.906164 IP node2.54620 > node3.48649: UDP, length 113
03:45:15.906247 IP node2.42304 > node3.48649: UDP, length 113
03:45:15.906607 IP node2.53302 > node3.48649: UDP, length 113
03:45:15.906926 IP node2.37029 > node3.48649: UDP, length 113
03:45:15.906990 IP node2.39590 > node3.48649: UDP, length 113
03:45:15.907209 IP node2.53706 > node3.48649: UDP, length 113
03:45:15.907396 IP node2.37998 > node3.48649: UDP, length 113
03:45:15.907711 IP node2.33629 > node3.48649: UDP, length 113
03:45:15.907928 IP node2.38644 > node3.48649: UDP, length 113
03:45:15.908099 IP node2.34901 > node3.48649: UDP, length 113
03:45:15.908200 IP node2.53863 > node3.48649: UDP, length 112
03:45:15.908479 IP node2.43732 > node3.48649: UDP, length 113
03:45:15.909056 IP node2.45020 > node3.48649: UDP, length 113
03:45:15.909125 IP node2.44278 > node3.48649: UDP, length 113
03:45:15.909312 IP node2.34103 > node3.48649: UDP, length 113
03:45:15.909561 IP node2.39954 > node3.48649: UDP, length 113
03:45:15.909921 IP node2.44832 > node3.48649: UDP, length 111
03:45:15.910173 IP node2.36822 > node3.48649: UDP, length 113
03:45:15.911694 IP node2.35425 > node3.48649: UDP, length 113
03:45:15.912225 IP node2.50082 > node3.48649: UDP, length 112
03:45:15.915444 IP node2.60168 > node3.48649: UDP, length 113
03:45:15.984342 IP node2.58597 > node3.55023: UDP, length 113
03:45:15.984554 IP node2.46240 > node3.55023: UDP, length 111
03:45:15.984646 IP node2.39954 > node3.55023: UDP, length 113
03:45:15.985298 IP node2.44881 > node3.55023: UDP, length 113
03:45:15.986454 IP node2.37029 > node3.55023: UDP, length 113
03:45:15.986791 IP node2.50822 > node3.55023: UDP, length 113
03:45:15.986856 IP node2.35476 > node3.55023: UDP, length 113
03:45:15.987019 IP node2.47183 > node3.55023: UDP, length 113
03:45:15.987251 IP node2.36822 > node3.55023: UDP, length 113
03:45:15.987442 IP node2.53863 > node3.55023: UDP, length 112
03:45:15.987741 IP node2.45176 > node3.55023: UDP, length 113
03:45:15.988119 IP node2.49754 > node3.55023: UDP, length 113
03:45:15.988392 IP node2.35425 > node3.55023: UDP, length 113
03:45:15.988679 IP node2.45941 > node3.55023: UDP, length 113
03:45:15.988744 IP node2.39590 > node3.55023: UDP, length 113
03:45:15.988998 IP node2.33901 > node3.55023: UDP, length 113
03:45:15.989672 IP node2.42304 > node3.55023: UDP, length 113
03:45:15.989934 IP node2.33629 > node3.55023: UDP, length 113
03:45:15.990175 IP node2.34901 > node3.55023: UDP, length 113
03:45:15.990332 IP node2.33434 > node3.55023: UDP, length 113
03:45:15.990588 IP node2.53302 > node3.55023: UDP, length 113
03:45:15.990668 IP node2.50420 > node3.55023: UDP, length 113
03:45:15.990792 IP node2.38644 > node3.55023: UDP, length 113
03:45:15.990945 IP node2.33869 > node3.55023: UDP, length 113
03:45:15.991010 IP node2.45020 > node3.55023: UDP, length 113
03:45:15.991194 IP node2.34103 > node3.55023: UDP, length 113
03:45:15.991287 IP node2.59900 > node3.55023: UDP, length 113
03:45:15.991562 IP node2.46051 > node3.55023: UDP, length 113
03:45:15.991726 IP node2.53706 > node3.55023: UDP, length 113
03:45:15.991912 IP node2.43732 > node3.55023: UDP, length 113
03:45:15.991985 IP node2.60168 > node3.55023: UDP, length 113
03:45:15.992297 IP node2.33273 > node3.55023: UDP, length 113
03:45:15.992805 IP node2.50082 > node3.55023: UDP, length 112
03:45:15.992982 IP node2.40292 > node3.55023: UDP, length 113
03:45:15.993245 IP node2.44832 > node3.55023: UDP, length 111
03:45:15.994683 IP node2.37998 > node3.55023: UDP, length 113
03:45:15.995169 IP node2.42544 > node3.55023: UDP, length 113
03:45:15.995691 IP node2.42304 > node4.39087: UDP, length 113
03:45:15.996046 IP node2.33629 > node4.39087: UDP, length 113
03:45:15.996662 IP node2.33434 > node4.39087: UDP, length 113
03:45:15.996940 IP node2.50082 > node4.39087: UDP, length 112
03:45:15.997089 IP node2.45020 > node4.39087: UDP, length 113
03:45:15.997387 IP node2.53302 > node4.39087: UDP, length 113
03:45:15.997829 IP node2.39954 > node4.39087: UDP, length 113
03:45:15.998035 IP node2.54620 > node4.39087: UDP, length 113
