03:45:15.180552 IP node3.45596 > node3.33275: UDP, length 113
03:45:15.303346 IP node3.33275 > node3.45596: UDP, length 113
03:45:15.532533 IP node3.45596 > node3.42797: UDP, length 113
03:45:15.536482 IP node3.33275 > node3.42797: UDP, length 113
03:45:15.644432 IP node3.45596 > node3.58663: UDP, length 113
03:45:15.645108 IP node3.33275 > node3.58663: UDP, length 113
03:45:15.656319 IP node3.58663 > node3.45596: UDP, length 113
03:45:15.658686 IP node3.58663 > node3.33275: UDP, length 113
03:45:15.673039 IP node3.58663 > node3.42797: UDP, length 113
03:45:15.696593 IP node3.33275 > node3.39663: UDP, length 113
03:45:15.697076 IP node3.45596 > node3.39663: UDP, length 113
03:45:15.852072 IP node3.45596 > node3.48649: UDP, length 113
03:45:15.852632 IP node3.33275 > node3.48649: UDP, length 113
03:45:15.917011 IP node3.39663 > node3.33275: UDP, length 113
03:45:15.918626 IP node3.39663 > node3.42797: UDP, length 113
03:45:15.919244 IP node3.39663 > node3.58663: UDP, length 113
03:45:15.935166 IP node3.45596 > node3.55023: UDP, length 113
03:45:15.936205 IP node3.33275 > node3.55023: UDP, length 113
03:45:15.937906 IP node3.42797 > node3.33275: UDP, length 113
03:45:15.943156 IP node3.42797 > node3.58663: UDP, length 113
03:45:15.957127 IP node3.42797 > node3.39663: UDP, length 113
03:45:15.957248 IP node3.42797 > node3.48649: UDP, length 113
03:45:16.033206 IP node3.45596 > node3.33216: UDP, length 113
03:45:16.036261 IP node3.33275 > node3.33216: UDP, length 113
03:45:16.046782 IP node3.42797 > node3.55023: UDP, length 113
03:45:16.046900 IP node3.55023 > node3.33275: UDP, length 112
03:45:16.048144 IP node3.42797 > node3.33216: UDP, length 113
03:45:16.050580 IP node3.39663 > node3.48649: UDP, length 113
03:45:16.050868 IP node3.39663 > node3.55023: UDP, length 113
03:45:16.145098 IP node3.39663 > node3.33216: UDP, length 113
03:45:16.158099 IP node3.48649 > node3.45596: UDP, length 113
03:45:16.159639 IP node3.48649 > node3.33275: UDP, length 113
03:45:16.211370 IP node3.45596 > node3.47674: UDP, length 113
03:45:16.211576 IP node3.42797 > node3.47674: UDP, length 113
03:45:16.212502 IP node3.33275 > node3.47674: UDP, length 113
03:45:16.215381 IP node3.39663 > node3.47674: UDP, length 113
03:45:16.254742 IP node3.58663 > node3.39663: UDP, length 113
03:45:16.254795 IP node3.58663 > node3.48649: UDP, length 113
03:45:16.268318 IP node3.58663 > node3.33216: UDP, length 113
03:45:16.268693 IP node3.58663 > node3.47674: UDP, length 113
03:45:16.270477 IP node3.58663 > node3.55023: UDP, length 113
03:45:16.312993 IP node3.33275 > node3.33707: UDP, length 113
03:45:16.313121 IP node3.45596 > node3.33707: UDP, length 113
03:45:16.314991 IP node3.42797 > node3.33707: UDP, length 113
03:45:16.315373 IP node3.39663 > node3.33707: UDP, length 113
03:45:16.317063 IP node3.33707 > node3.42797: UDP, length 113
03:45:16.318095 IP node3.33707 > node3.58663: UDP, length 113
03:45:16.318944 IP node3.33707 > node3.39663: UDP, length 113
03:45:16.323814 IP node3.58663 > node3.33707: UDP, length 113
03:45:16.324914 IP node3.33707 > node3.48649: UDP, length 113
03:45:16.325483 IP node3.33707 > node3.55023: UDP, length 113
03:45:16.331233 IP node3.48649 > node3.42797: UDP, length 113
03:45:16.333248 IP node3.48649 > node3.58663: UDP, length 113
03:45:16.334231 IP node3.48649 > node3.39663: UDP, length 113
03:45:16.336772 IP node3.48649 > node3.55023: UDP, length 113
03:45:16.337504 IP node3.48649 > node3.33216: UDP, length 113
03:45:16.349383 IP node3.48649 > node3.47674: UDP, length 113
03:45:16.359640 IP node3.48649 > node3.33707: UDP, length 113
03:45:16.365594 IP node3.55023 > node3.42797: UDP, length 112
03:45:16.366110 IP node3.55023 > node3.58663: UDP, length 112
03:45:16.367314 IP node3.55023 > node3.39663: UDP, length 112
03:45:16.368149 IP node3.55023 > node3.48649: UDP, length 112
03:45:16.372407 IP node3.55023 > node3.33216: UDP, length 112
03:45:16.375936 IP node3.55023 > node3.33707: UDP, length 112
03:45:16.380067 IP node3.55023 > node3.47674: UDP, length 112
03:45:16.416715 IP node3.45596 > node3.55313: UDP, length 113
03:45:16.416776 IP node3.39663 > node3.55313: UDP, length 113
03:45:16.418852 IP node3.33275 > node3.55313: UDP, length 113
03:45:16.419464 IP node3.58663 > node3.55313: UDP, length 113
03:45:16.419947 IP node3.42797 > node3.55313: UDP, length 113
03:45:16.422748 IP node3.48649 > node3.55313: UDP, length 113
03:45:16.428600 IP node3.55023 > node3.55313: UDP, length 112
03:45:16.486607 IP node3.42797 > node3.53645: UDP, length 113
03:45:16.486651 IP node3.33275 > node3.53645: UDP, length 113
03:45:16.487540 IP node3.45596 > node3.53645: UDP, length 113
03:45:16.488278 IP node3.48649 > node3.53645: UDP, length 113
03:45:16.488580 IP node3.58663 > node3.53645: UDP, length 113
03:45:16.489326 IP node3.39663 > node3.53645: UDP, length 113
03:45:16.492199 IP node3.55023 > node3.53645: UDP, length 112
03:45:16.510199 IP node3.33707 > node3.33216: UDP, length 113
03:45:16.516643 IP node3.33707 > node3.47674: UDP, length 113
03:45:16.526186 IP node3.33707 > node3.55313: UDP, length 113
03:45:16.529845 IP node3.33707 > node3.53645: UDP, length 113
03:45:16.531718 IP node3.33216 > node3.42797: UDP, length 113
03:45:16.557138 IP node3.33216 > node3.58663: UDP, length 113
03:45:16.562344 IP node3.33216 > node3.48649: UDP, length 113
03:45:16.562778 IP node3.33216 > node3.55023: UDP, length 113
03:45:16.564928 IP node3.33216 > node3.47674: UDP, length 113
03:45:16.569315 IP node3.33216 > node3.33707: UDP, length 113
03:45:16.571374 IP node3.33216 > node3.55313: UDP, length 113
03:45:16.572447 IP node3.33216 > node3.53645: UDP, length 113
03:45:16.574115 IP node3.33216 > node3.39663: UDP, length 113
03:45:16.729043 IP node3.39663 > node3.39256: UDP, length 113
03:45:16.729788 IP node3.45596 > node3.39256: UDP, length 113
03:45:16.729788 IP node3.42797 > node3.39256: UDP, length 113
03:45:16.730278 IP node3.58663 > node3.39256: UDP, length 113
03:45:16.731722 IP node3.33275 > node3.39256: UDP, length 113
03:45:16.742971 IP node3.55023 > node3.39256: UDP, length 112
03:45:16.746834 IP node3.48649 > node3.39256: UDP, length 113
03:45:16.751757 IP node3.33707 > node3.39256: UDP, length 113
03:45:16.755542 IP node3.33216 > node3.39256: UDP, length 113
03:45:16.881844 IP node3.47674 > node3.39663: UDP, length 112
03:45:16.881908 IP node3.47674 > node3.42797: UDP, length 112
03:45:16.882548 IP node3.47674 > node3.58663: UDP, length 112
03:45:16.901511 IP node3.53645 > node3.42797: UDP, length 113
03:45:16.907236 IP node3.47674 > node3.48649: UDP, length 112
03:45:16.908206 IP node3.47674 > node3.55023: UDP, length 112
03:45:16.908748 IP node3.47674 > node3.33216: UDP, length 112
03:45:16.911055 IP node3.47674 > node3.33707: UDP, length 112
03:45:16.913904 IP node3.47674 > node3.55313: UDP, length 112
03:45:16.914354 IP node3.47674 > node3.53645: UDP, length 112
03:45:16.916645 IP node3.47674 > node3.39256: UDP, length 112
03:45:16.943814 IP node3.55313 > node3.58663: UDP, length 113
03:45:16.946067 IP node3.55313 > node3.39663: UDP, length 113
03:45:16.946250 IP node3.53645 > node3.58663: UDP, length 113
03:45:16.946533 IP node3.55313 > node3.48649: UDP, length 113
03:45:16.946953 IP node3.55313 > node3.55023: UDP, length 113
03:45:16.950141 IP node3.53645 > node3.39663: UDP, length 113
03:45:17.000383 IP node3.55313 > node3.33216: UDP, length 113
03:45:17.000767 IP node3.55313 > node3.47674: UDP, length 113
03:45:17.000927 IP node3.55313 > node3.33707: UDP, length 113
03:45:17.001152 IP node3.55313 > node3.53645: UDP, length 113
03:45:17.004196 IP node3.55313 > node3.39256: UDP, length 113
03:45:17.065913 IP node3.53645 > node3.55023: UDP, length 113
03:45:17.066539 IP node3.53645 > node3.33216: UDP, length 113
03:45:17.073981 IP node3.53645 > node3.48649: UDP, length 113
03:45:17.074613 IP node3.53645 > node3.47674: UDP, length 113
03:45:17.075008 IP node3.53645 > node3.33707: UDP, length 113
03:45:17.075825 IP node3.53645 > node3.55313: UDP, length 113
03:45:17.081106 IP node3.53645 > node3.39256: UDP, length 113
03:45:17.241798 IP node3.48649 > node3.55023: UDP, length 87
03:45:17.257330 IP node3.39256 > node3.48649: UDP, length 113
03:45:17.280365 IP node3.39256 > node3.55023: UDP, length 113
03:45:17.281452 IP node3.39256 > node3.33216: UDP, length 113
03:45:17.283799 IP node3.39256 > node3.47674: UDP, length 113
03:45:17.288484 IP node3.39256 > node3.33707: UDP, length 113
03:45:17.291133 IP node3.39256 > node3.55313: UDP, length 113
03:45:17.293469 IP node3.39256 > node3.53645: UDP, length 113
03:45:17.363861 IP node3.55023 > node3.48649: UDP, length 94
03:45:17.423114 IP node3.39663 > node3.58437: UDP, length 113
03:45:17.423838 IP node3.33275 > node3.58437: UDP, length 113
03:45:17.423967 IP node3.55023 > node3.58437: UDP, length 112
03:45:17.425196 IP node3.45596 > node3.58437: UDP, length 113
03:45:17.425868 IP node3.55313 > node3.58437: UDP, length 113
03:45:17.426845 IP node3.47674 > node3.58437: UDP, length 112
03:45:17.439722 IP node3.53645 > node3.58437: UDP, length 113
03:45:17.446998 IP node3.53645 > node3.50677: UDP, length 113
03:45:17.447668 IP node3.47674 > node3.50677: UDP, length 112
03:45:17.447848 IP node3.39663 > node3.50677: UDP, length 113
03:45:17.447926 IP node3.33275 > node3.50677: UDP, length 113
03:45:17.448169 IP node3.55023 > node3.50677: UDP, length 112
03:45:17.448425 IP node3.45596 > node3.50677: UDP, length 113
03:45:17.449505 IP node3.55313 > node3.50677: UDP, length 113
03:45:17.466380 IP node3.50677 > node3.33216: UDP, length 113
03:45:17.466710 IP node3.50677 > node3.47674: UDP, length 113
03:45:17.466768 IP node3.50677 > node3.33707: UDP, length 113
03:45:17.466816 IP node3.50677 > node3.55313: UDP, length 113
03:45:17.466956 IP node3.50677 > node3.53645: UDP, length 113
03:45:17.483726 IP node3.39256 > node3.58437: UDP, length 113
03:45:17.487867 IP node3.39256 > node3.50677: UDP, length 113
03:45:17.501466 IP node3.48649 > node3.58437: UDP, length 113
03:45:17.501672 IP node3.48649 > node3.50677: UDP, length 113
03:45:17.519957 IP node3.33707 > node3.58437: UDP, length 113
03:45:17.520142 IP node3.33707 > node3.50677: UDP, length 113
03:45:17.541937 IP node3.33216 > node3.58437: UDP, length 113
03:45:17.542120 IP node3.33216 > node3.50677: UDP, length 113
03:45:17.594369 IP node3.58663 > node3.58437: UDP, length 113
03:45:17.594689 IP node3.58663 > node3.50677: UDP, length 113
03:45:17.604023 IP node3.48649 > node3.46745: UDP, length 113
03:45:17.604204 IP node3.39663 > node3.46745: UDP, length 113
03:45:17.605058 IP node3.47674 > node3.46745: UDP, length 112
03:45:17.605248 IP node3.33275 > node3.46745: UDP, length 113
03:45:17.605295 IP node3.45596 > node3.46745: UDP, length 113
03:45:17.605443 IP node3.33216 > node3.46745: UDP, length 113
03:45:17.605870 IP node3.55313 > node3.46745: UDP, length 113
03:45:17.605987 IP node3.55023 > node3.46745: UDP, length 112
03:45:17.606765 IP node3.39256 > node3.46745: UDP, length 113
03:45:17.614167 IP node3.53645 > node3.46745: UDP, length 113
03:45:17.637813 IP node3.58663 > node3.46745: UDP, length 113
03:45:17.680448 IP node3.42797 > node3.46745: UDP, length 113
03:45:17.680593 IP node3.47648 > node3.33216: UDP, length 113
03:45:17.680727 IP node3.42797 > node3.58437: UDP, length 113
03:45:17.680885 IP node3.42797 > node3.50677: UDP, length 113
03:45:17.681582 IP node3.47648 > node3.47674: UDP, length 113
03:45:17.681860 IP node3.33275 > node3.47648: UDP, length 113
03:45:17.682430 IP node3.42797 > node3.47648: UDP, length 113
03:45:17.687161 IP node3.33216 > node3.47648: UDP, length 113
03:45:17.687321 IP node3.47674 > node3.47648: UDP, length 112
03:45:17.687962 IP node3.39663 > node3.47648: UDP, length 113
03:45:17.688173 IP node3.55313 > node3.47648: UDP, length 113
03:45:17.688393 IP node3.45596 > node3.47648: UDP, length 113
03:45:17.688555 IP node3.48649 > node3.47648: UDP, length 113
03:45:17.689769 IP node3.33707 > node3.47648: UDP, length 113
03:45:17.689795 IP node3.33707 > node3.46745: UDP, length 113
03:45:17.695960 IP node3.53645 > node3.47648: UDP, length 113
03:45:17.697879 IP node3.39256 > node3.47648: UDP, length 113
03:45:17.742911 IP node3.42797 > node3.47172: UDP, length 113
03:45:17.744573 IP node3.33275 > node3.47172: UDP, length 113
03:45:17.744617 IP node3.45596 > node3.47172: UDP, length 113
03:45:17.745255 IP node3.55313 > node3.47172: UDP, length 113
03:45:17.746260 IP node3.47674 > node3.47172: UDP, length 112
03:45:17.746469 IP node3.39663 > node3.47172: UDP, length 113
03:45:17.748728 IP node3.33216 > node3.47172: UDP, length 113
03:45:17.749917 IP node3.48649 > node3.47172: UDP, length 113
03:45:17.750758 IP node3.53645 > node3.47172: UDP, length 113
03:45:17.751219 IP node3.39256 > node3.47172: UDP, length 113
03:45:17.779030 IP node3.55023 > node3.47648: UDP, length 112
03:45:17.779315 IP node3.55023 > node3.47172: UDP, length 112
03:45:17.781564 IP node3.58663 > node3.47648: UDP, length 113
03:45:17.781938 IP node3.58663 > node3.47172: UDP, length 113
03:45:17.807037 IP node3.47648 > node3.33707: UDP, length 113
03:45:17.809957 IP node3.47648 > node3.55313: UDP, length 113
03:45:17.813634 IP node3.47648 > node3.53645: UDP, length 113
03:45:17.825478 IP node3.47648 > node3.39256: UDP, length 113
03:45:17.828472 IP node3.55023 > node3.51293: UDP, length 112
03:45:17.828618 IP node3.39663 > node3.51293: UDP, length 113
03:45:17.829069 IP node3.47674 > node3.51293: UDP, length 112
03:45:17.829955 IP node3.45596 > node3.51293: UDP, length 113
03:45:17.830276 IP node3.58663 > node3.51293: UDP, length 113
03:45:17.831436 IP node3.33275 > node3.51293: UDP, length 113
03:45:17.831715 IP node3.33216 > node3.51293: UDP, length 113
03:45:17.831917 IP node3.39256 > node3.51293: UDP, length 113
03:45:17.832061 IP node3.48649 > node3.51293: UDP, length 113
03:45:17.832333 IP node3.55313 > node3.51293: UDP, length 113
03:45:17.833923 IP node3.53645 > node3.51293: UDP, length 113
03:45:17.836172 IP node3.51293 > node3.47674: UDP, length 113
03:45:17.837502 IP node3.51293 > node3.33707: UDP, length 113
03:45:17.838610 IP node3.51293 > node3.55313: UDP, length 113
03:45:17.839039 IP node3.51293 > node3.53645: UDP, length 113
03:45:17.842953 IP node3.55023 > node3.39207: UDP, length 112
03:45:17.843391 IP node3.39256 > node3.39207: UDP, length 113
03:45:17.844825 IP node3.39663 > node3.39207: UDP, length 113
03:45:17.848145 IP node3.48649 > node3.39207: UDP, length 113
03:45:17.848498 IP node3.33216 > node3.39207: UDP, length 113
03:45:17.849589 IP node3.58663 > node3.39207: UDP, length 113
03:45:17.850342 IP node3.45596 > node3.39207: UDP, length 113
03:45:17.850849 IP node3.47674 > node3.39207: UDP, length 112
03:45:17.851605 IP node3.33275 > node3.39207: UDP, length 113
03:45:17.852132 IP node3.55313 > node3.39207: UDP, length 113
03:45:17.853563 IP node3.53645 > node3.39207: UDP, length 113
03:45:17.876591 IP node3.50677 > node3.39256: UDP, length 113
03:45:17.908309 IP node3.50677 > node3.58437: UDP, length 113
03:45:17.945369 IP node3.50677 > node3.46745: UDP, length 113
03:45:17.947079 IP node3.50677 > node3.47648: UDP, length 113
03:45:17.949123 IP node3.50677 > node3.47172: UDP, length 113
03:45:17.949590 IP node3.50677 > node3.51293: UDP, length 113
03:45:17.949758 IP node3.50677 > node3.39207: UDP, length 113
03:45:17.980877 IP node3.42797 > node3.39207: UDP, length 113
03:45:17.981129 IP node3.42797 > node3.51293: UDP, length 113
03:45:18.017336 IP node3.55313 > node3.34748: UDP, length 113
03:45:18.017581 IP node3.33275 > node3.34748: UDP, length 113
03:45:18.017675 IP node3.42797 > node3.34748: UDP, length 113
03:45:18.018727 IP node3.47674 > node3.34748: UDP, length 112
03:45:18.019965 IP node3.58663 > node3.34748: UDP, length 113
03:45:18.020321 IP node3.39256 > node3.34748: UDP, length 113
03:45:18.020368 IP node3.45596 > node3.34748: UDP, length 113
03:45:18.022002 IP node3.39663 > node3.34748: UDP, length 113
03:45:18.022454 IP node3.33216 > node3.34748: UDP, length 113
03:45:18.023816 IP node3.53645 > node3.34748: UDP, length 113
03:45:18.023908 IP node3.50677 > node3.34748: UDP, length 113
03:45:18.028536 IP node3.33707 > node3.47172: UDP, length 113
03:45:18.036380 IP node3.46745 > node3.47674: UDP, length 113
03:45:18.037084 IP node3.33707 > node3.39207: UDP, length 113
03:45:18.037182 IP node3.33707 > node3.34748: UDP, length 113
03:45:18.038037 IP node3.46745 > node3.33707: UDP, length 113
03:45:18.038405 IP node3.33707 > node3.51293: UDP, length 113
03:45:18.077994 IP node3.58663 > node3.50722: UDP, length 113
03:45:18.079364 IP node3.42797 > node3.50722: UDP, length 113
03:45:18.079544 IP node3.33707 > node3.50722: UDP, length 113
03:45:18.081198 IP node3.39256 > node3.50722: UDP, length 113
03:45:18.081405 IP node3.33275 > node3.50722: UDP, length 113
03:45:18.081505 IP node3.45596 > node3.50722: UDP, length 113
03:45:18.083022 IP node3.47674 > node3.50722: UDP, length 112
03:45:18.083640 IP node3.33216 > node3.50722: UDP, length 113
03:45:18.085272 IP node3.50677 > node3.50722: UDP, length 113
03:45:18.086991 IP node3.51293 > node3.39256: UDP, length 113
03:45:18.087299 IP node3.39663 > node3.50722: UDP, length 113
03:45:18.087450 IP node3.50722 > node3.39256: UDP, length 113
03:45:18.087593 IP node3.55313 > node3.50722: UDP, length 113
03:45:18.092453 IP node3.53645 > node3.50722: UDP, length 113
03:45:18.105600 IP node3.55023 > node3.50722: UDP, length 112
03:45:18.106065 IP node3.55023 > node3.34748: UDP, length 112
03:45:18.145912 IP node3.47648 > node3.58437: UDP, length 113
03:45:18.146404 IP node3.47648 > node3.50677: UDP, length 113
03:45:18.147875 IP node3.48649 > node3.50722: UDP, length 113
03:45:18.148017 IP node3.48649 > node3.34748: UDP, length 113
03:45:18.154727 IP node3.51293 > node3.58437: UDP, length 113
03:45:18.154904 IP node3.51293 > node3.50677: UDP, length 113
03:45:18.156057 IP node3.51293 > node3.46745: UDP, length 113
03:45:18.160020 IP node3.51293 > node3.47648: UDP, length 113
03:45:18.167572 IP node3.51293 > node3.47172: UDP, length 113
03:45:18.169870 IP node3.47172 > node3.33707: UDP, length 113
03:45:18.172742 IP node3.47172 > node3.55313: UDP, length 113
03:45:18.174249 IP node3.47172 > node3.53645: UDP, length 113
03:45:18.183370 IP node3.51293 > node3.39207: UDP, length 113
03:45:18.191635 IP node3.46745 > node3.55313: UDP, length 113
03:45:18.192598 IP node3.46745 > node3.53645: UDP, length 113
03:45:18.202560 IP node3.42797 > node3.45596: UDP, length 113
03:45:18.202964 IP node3.33275 > node3.45596: UDP, length 113
03:45:18.203429 IP node3.39256 > node3.45596: UDP, length 113
03:45:18.204743 IP node3.33707 > node3.45596: UDP, length 113
03:45:18.205962 IP node3.47674 > node3.45596: UDP, length 112
03:45:18.206626 IP node3.58663 > node3.45596: UDP, length 113
03:45:18.208983 IP node3.33216 > node3.45596: UDP, length 113
03:45:18.210011 IP node3.50677 > node3.45596: UDP, length 113
03:45:18.213215 IP node3.55313 > node3.45596: UDP, length 113
03:45:18.213538 IP node3.48649 > node3.45596: UDP, length 113
03:45:18.214604 IP node3.39663 > node3.45596: UDP, length 113
03:45:18.220614 IP node3.53645 > node3.45596: UDP, length 113
03:45:18.240143 IP node3.51293 > node3.34748: UDP, length 113
03:45:18.266955 IP node3.58663 > node3.46165: UDP, length 113
03:45:18.267444 IP node3.33707 > node3.46165: UDP, length 113
03:45:18.268002 IP node3.48649 > node3.46165: UDP, length 113
03:45:18.269030 IP node3.33275 > node3.46165: UDP, length 113
03:45:18.269178 IP node3.42797 > node3.46165: UDP, length 113
03:45:18.269506 IP node3.39256 > node3.46165: UDP, length 113
03:45:18.269945 IP node3.53645 > node3.46165: UDP, length 113
03:45:18.270156 IP node3.33216 > node3.46165: UDP, length 113
03:45:18.270317 IP node3.39663 > node3.46165: UDP, length 113
03:45:18.270632 IP node3.45596 > node3.46165: UDP, length 113
03:45:18.270819 IP node3.55313 > node3.46165: UDP, length 113
03:45:18.271399 IP node3.47674 > node3.46165: UDP, length 112
03:45:18.281248 IP node3.50677 > node3.46165: UDP, length 113
03:45:18.286881 IP node3.33707 > node3.35675: UDP, length 113
03:45:18.287584 IP node3.33275 > node3.35675: UDP, length 113
03:45:18.291103 IP node3.47674 > node3.35675: UDP, length 112
03:45:18.291487 IP node3.55313 > node3.35675: UDP, length 113
03:45:18.292048 IP node3.51293 > node3.45596: UDP, length 113
03:45:18.292177 IP node3.58663 > node3.35675: UDP, length 113
03:45:18.292443 IP node3.39663 > node3.35675: UDP, length 113
03:45:18.293183 IP node3.48649 > node3.35675: UDP, length 113
03:45:18.293710 IP node3.39256 > node3.35675: UDP, length 113
03:45:18.294288 IP node3.53645 > node3.35675: UDP, length 113
03:45:18.294797 IP node3.33216 > node3.35675: UDP, length 113
03:45:18.295008 IP node3.42797 > node3.35675: UDP, length 113
03:45:18.295813 IP node3.45596 > node3.35675: UDP, length 113
03:45:18.296571 IP node3.50677 > node3.35675: UDP, length 113
03:45:18.308869 IP node3.46745 > node3.39256: UDP, length 113
03:45:18.314021 IP node3.51293 > node3.50722: UDP, length 113
03:45:18.343406 IP node3.58663 > node3.60040: UDP, length 113
03:45:18.344156 IP node3.33707 > node3.60040: UDP, length 113
03:45:18.344407 IP node3.48649 > node3.60040: UDP, length 113
03:45:18.344595 IP node3.33275 > node3.60040: UDP, length 113
03:45:18.344767 IP node3.42797 > node3.60040: UDP, length 113
03:45:18.344898 IP node3.53645 > node3.60040: UDP, length 113
03:45:18.345125 IP node3.39256 > node3.60040: UDP, length 113
03:45:18.345153 IP node3.39663 > node3.60040: UDP, length 113
03:45:18.347637 IP node3.55313 > node3.60040: UDP, length 113
03:45:18.347941 IP node3.47674 > node3.60040: UDP, length 112
03:45:18.348364 IP node3.33216 > node3.60040: UDP, length 113
03:45:18.349004 IP node3.45596 > node3.60040: UDP, length 113
03:45:18.349754 IP node3.50677 > node3.60040: UDP, length 113
03:45:18.372940 IP node3.51293 > node3.46165: UDP, length 113
03:45:18.382238 IP node3.51293 > node3.35675: UDP, length 113
03:45:18.382433 IP node3.51293 > node3.60040: UDP, length 113
03:45:18.382834 IP node3.47172 > node3.39256: UDP, length 113
03:45:18.417286 IP node3.55023 > node3.60040: UDP, length 112
03:45:18.417395 IP node3.55023 > node3.45596: UDP, length 112
03:45:18.417510 IP node3.55023 > node3.35675: UDP, length 112
03:45:18.417599 IP node3.55023 > node3.46165: UDP, length 112
03:45:18.420310 IP node3.47648 > node3.46745: UDP, length 113
03:45:18.422469 IP node3.47648 > node3.47172: UDP, length 113
03:45:18.425950 IP node3.47648 > node3.51293: UDP, length 113
03:45:18.426376 IP node3.47648 > node3.39207: UDP, length 113
03:45:18.446842 IP node3.47648 > node3.45596: UDP, length 113
03:45:18.447016 IP node3.47648 > node3.50722: UDP, length 113
03:45:18.447287 IP node3.47648 > node3.34748: UDP, length 113
03:45:18.448486 IP node3.47648 > node3.46165: UDP, length 113
03:45:18.448657 IP node3.47648 > node3.35675: UDP, length 113
03:45:18.448838 IP node3.47648 > node3.60040: UDP, length 113
03:45:18.452678 IP node3.39207 > node3.39256: UDP, length 113
03:45:18.477436 IP node3.39207 > node3.58437: UDP, length 113
03:45:18.477755 IP node3.39207 > node3.50677: UDP, length 113
03:45:18.481183 IP node3.39207 > node3.46745: UDP, length 113
03:45:18.481581 IP node3.39207 > node3.47648: UDP, length 113
03:45:18.481978 IP node3.39207 > node3.47172: UDP, length 113
03:45:18.482366 IP node3.39207 > node3.51293: UDP, length 113
03:45:18.485209 IP node3.39207 > node3.34748: UDP, length 113
03:45:18.485423 IP node3.39207 > node3.50722: UDP, length 113
03:45:18.485806 IP node3.39207 > node3.45596: UDP, length 113
03:45:18.486842 IP node3.39207 > node3.46165: UDP, length 113
03:45:18.488602 IP node3.39207 > node3.35675: UDP, length 113
03:45:18.488901 IP node3.39207 > node3.60040: UDP, length 113
03:45:18.508148 IP node3.50722 > node3.47648: UDP, length 113
03:45:18.508403 IP node3.50722 > node3.45596: UDP, length 113
03:45:18.508469 IP node3.50722 > node3.46745: UDP, length 113
03:45:18.509505 IP node3.50722 > node3.46165: UDP, length 113
03:45:18.509551 IP node3.50722 > node3.58437: UDP, length 113
03:45:18.509667 IP node3.50722 > node3.47172: UDP, length 113
03:45:18.510045 IP node3.50722 > node3.60040: UDP, length 113
03:45:18.510314 IP node3.50722 > node3.39207: UDP, length 113
03:45:18.510524 IP node3.50722 > node3.35675: UDP, length 113
03:45:18.510914 IP node3.50722 > node3.34748: UDP, length 113
03:45:18.511042 IP node3.50722 > node3.51293: UDP, length 113
03:45:18.511094 IP node3.50722 > node3.50677: UDP, length 113
03:45:18.525152 IP node3.58437 > node3.55313: UDP, length 113
03:45:18.525501 IP node3.58437 > node3.53645: UDP, length 113
03:45:18.526281 IP node3.58437 > node3.47674: UDP, length 113
03:45:18.526357 IP node3.58437 > node3.33707: UDP, length 113
03:45:18.527341 IP node3.58437 > node3.39256: UDP, length 113
03:45:18.533038 IP node3.58437 > node3.47648: UDP, length 113
03:45:18.533477 IP node3.58437 > node3.45596: UDP, length 113
03:45:18.535252 IP node3.58437 > node3.46745: UDP, length 113
03:45:18.535689 IP node3.58437 > node3.47172: UDP, length 113
03:45:18.536336 IP node3.58437 > node3.39207: UDP, length 113
03:45:18.536690 IP node3.58437 > node3.50722: UDP, length 113
03:45:18.537690 IP node3.58437 > node3.34748: UDP, length 113
03:45:18.537803 IP node3.58437 > node3.51293: UDP, length 113
03:45:18.537877 IP node3.58437 > node3.50677: UDP, length 113
03:45:18.544361 IP node3.58437 > node3.46165: UDP, length 113
03:45:18.544452 IP node3.58437 > node3.60040: UDP, length 113
03:45:18.544618 IP node3.58437 > node3.35675: UDP, length 113
03:45:18.556797 IP node3.34748 > node3.58437: UDP, length 113
03:45:18.557342 IP node3.34748 > node3.50677: UDP, length 113
03:45:18.559013 IP node3.34748 > node3.46745: UDP, length 113
03:45:18.561896 IP node3.34748 > node3.47648: UDP, length 113
03:45:18.562876 IP node3.34748 > node3.47172: UDP, length 113
03:45:18.563303 IP node3.34748 > node3.51293: UDP, length 113
03:45:18.575276 IP node3.53645 > node3.52490: UDP, length 113
03:45:18.576543 IP node3.50677 > node3.52490: UDP, length 113
03:45:18.576723 IP node3.33275 > node3.52490: UDP, length 113
03:45:18.576790 IP node3.42797 > node3.52490: UDP, length 113
03:45:18.577369 IP node3.55023 > node3.52490: UDP, length 112
03:45:18.577745 IP node3.45596 > node3.52490: UDP, length 113
03:45:18.577983 IP node3.58663 > node3.52490: UDP, length 113
03:45:18.579205 IP node3.33707 > node3.52490: UDP, length 113
03:45:18.580016 IP node3.52490 > node3.58437: UDP, length 113
03:45:18.580313 IP node3.52490 > node3.50677: UDP, length 113
03:45:18.581655 IP node3.39663 > node3.52490: UDP, length 113
03:45:18.582608 IP node3.33216 > node3.52490: UDP, length 113
03:45:18.582712 IP node3.47674 > node3.52490: UDP, length 112
03:45:18.583080 IP node3.55313 > node3.52490: UDP, length 113
03:45:18.584314 IP node3.39256 > node3.52490: UDP, length 113
03:45:18.594974 IP node3.34748 > node3.39207: UDP, length 113
03:45:18.596398 IP node3.34748 > node3.50722: UDP, length 113
03:45:18.609950 IP node3.35675 > node3.58437: UDP, length 113
03:45:18.635940 IP node3.55023 > node3.56179: UDP, length 112
03:45:18.636570 IP node3.56179 > node3.39256: UDP, length 113
03:45:18.636834 IP node3.56179 > node3.53645: UDP, length 113
03:45:18.638259 IP node3.42797 > node3.56179: UDP, length 113
03:45:18.638932 IP node3.33707 > node3.56179: UDP, length 113
03:45:18.639617 IP node3.50677 > node3.56179: UDP, length 113
03:45:18.644974 IP node3.47674 > node3.56179: UDP, length 112
03:45:18.646525 IP node3.33275 > node3.56179: UDP, length 113
03:45:18.647597 IP node3.58663 > node3.56179: UDP, length 113
03:45:18.647776 IP node3.53645 > node3.56179: UDP, length 113
03:45:18.648555 IP node3.34748 > node3.45596: UDP, length 113
03:45:18.649589 IP node3.34748 > node3.46165: UDP, length 113
03:45:18.649848 IP node3.33216 > node3.56179: UDP, length 113
03:45:18.653474 IP node3.45596 > node3.56179: UDP, length 113
03:45:18.654340 IP node3.55313 > node3.56179: UDP, length 113
03:45:18.655138 IP node3.39663 > node3.56179: UDP, length 113
03:45:18.655965 IP node3.39256 > node3.56179: UDP, length 113
03:45:18.656027 IP node3.48649 > node3.52490: UDP, length 113
03:45:18.656367 IP node3.48649 > node3.56179: UDP, length 113
03:45:18.670475 IP node3.46745 > node3.58437: UDP, length 113
03:45:18.670939 IP node3.39207 > node3.52490: UDP, length 113
03:45:18.671342 IP node3.39207 > node3.56179: UDP, length 113
03:45:18.673151 IP node3.45596 > node3.33275: UDP, length 113
03:45:18.673151 IP node3.55023 > node3.33275: UDP, length 112
03:45:18.673745 IP node3.48649 > node3.33275: UDP, length 113
03:45:18.674179 IP node3.53645 > node3.33275: UDP, length 113
03:45:18.675503 IP node3.47674 > node3.33275: UDP, length 112
03:45:18.675645 IP node3.39256 > node3.33275: UDP, length 113
03:45:18.676478 IP node3.33707 > node3.33275: UDP, length 113
03:45:18.677050 IP node3.50677 > node3.33275: UDP, length 113
03:45:18.677132 IP node3.42797 > node3.33275: UDP, length 113
03:45:18.682791 IP node3.39207 > node3.33275: UDP, length 113
03:45:18.684910 IP node3.58663 > node3.33275: UDP, length 113
03:45:18.685432 IP node3.58437 > node3.52490: UDP, length 113
03:45:18.685538 IP node3.58437 > node3.56179: UDP, length 113
03:45:18.685798 IP node3.33216 > node3.33275: UDP, length 113
03:45:18.686031 IP node3.55313 > node3.33275: UDP, length 113
03:45:18.686321 IP node3.58437 > node3.33275: UDP, length 113
03:45:18.686511 IP node3.46745 > node3.47648: UDP, length 113
03:45:18.686953 IP node3.46745 > node3.47172: UDP, length 113
03:45:18.687441 IP node3.46745 > node3.51293: UDP, length 113
03:45:18.688677 IP node3.50722 > node3.52490: UDP, length 113
03:45:18.688966 IP node3.39663 > node3.33275: UDP, length 113
03:45:18.689001 IP node3.50722 > node3.56179: UDP, length 113
03:45:18.689087 IP node3.50722 > node3.33275: UDP, length 113
03:45:18.698484 IP node3.51293 > node3.52490: UDP, length 113
03:45:18.698691 IP node3.51293 > node3.56179: UDP, length 113
03:45:18.698863 IP node3.51293 > node3.33275: UDP, length 113
03:45:18.713264 IP node3.34748 > node3.60040: UDP, length 113
03:45:18.715316 IP node3.34748 > node3.52490: UDP, length 113
03:45:18.724560 IP node3.47648 > node3.52490: UDP, length 113
03:45:18.724769 IP node3.47648 > node3.56179: UDP, length 113
03:45:18.724925 IP node3.47648 > node3.33275: UDP, length 113
03:45:18.746650 IP node3.46745 > node3.50677: UDP, length 113
03:45:18.747322 IP node3.46745 > node3.39207: UDP, length 113
03:45:18.750988 IP node3.46745 > node3.34748: UDP, length 113
03:45:18.804436 IP node3.46745 > node3.50722: UDP, length 113
03:45:18.810567 IP node3.46745 > node3.52490: UDP, length 113
03:45:18.810604 IP node3.46745 > node3.33275: UDP, length 113
03:45:18.810772 IP node3.46745 > node3.60040: UDP, length 113
03:45:18.810984 IP node3.46745 > node3.45596: UDP, length 113
03:45:18.811188 IP node3.46745 > node3.56179: UDP, length 113
03:45:18.811435 IP node3.46745 > node3.35675: UDP, length 113
03:45:18.811492 IP node3.46745 > node3.46165: UDP, length 113
03:45:18.869201 IP node3.47172 > node3.58437: UDP, length 113
03:45:18.869850 IP node3.47172 > node3.50677: UDP, length 113
03:45:18.870921 IP node3.56179 > node3.58437: UDP, length 113
03:45:18.871171 IP node3.56179 > node3.50677: UDP, length 113
03:45:18.872649 IP node3.47172 > node3.46745: UDP, length 113
03:45:18.873782 IP node3.47172 > node3.47648: UDP, length 113
03:45:18.874422 IP node3.56179 > node3.47648: UDP, length 113
03:45:18.874671 IP node3.47172 > node3.51293: UDP, length 113
03:45:18.876765 IP node3.47172 > node3.60040: UDP, length 113
03:45:18.877126 IP node3.47172 > node3.45596: UDP, length 113
03:45:18.877525 IP node3.47172 > node3.39207: UDP, length 113
03:45:18.877730 IP node3.47172 > node3.50722: UDP, length 113
03:45:18.878028 IP node3.47172 > node3.35675: UDP, length 113
03:45:18.878177 IP node3.47172 > node3.46165: UDP, length 113
03:45:18.878411 IP node3.47172 > node3.34748: UDP, length 113
03:45:18.879476 IP node3.46165 > node3.58437: UDP, length 113
03:45:18.879988 IP node3.46165 > node3.50677: UDP, length 113
03:45:18.881429 IP node3.46165 > node3.46745: UDP, length 113
03:45:18.881894 IP node3.46165 > node3.47648: UDP, length 113
03:45:18.882403 IP node3.46165 > node3.47172: UDP, length 113
03:45:18.882769 IP node3.46165 > node3.51293: UDP, length 113
03:45:18.882962 IP node3.46165 > node3.39207: UDP, length 113
03:45:18.884231 IP node3.46165 > node3.34748: UDP, length 113
03:45:18.884967 IP node3.46165 > node3.50722: UDP, length 113
03:45:18.997368 IP node3.56179 > node3.46745: UDP, length 113
03:45:18.998091 IP node3.47172 > node3.52490: UDP, length 113
03:45:18.998171 IP node3.56179 > node3.51293: UDP, length 113
03:45:18.998171 IP node3.47172 > node3.33275: UDP, length 113
03:45:18.998258 IP node3.47172 > node3.56179: UDP, length 113
03:45:18.998469 IP node3.56179 > node3.39207: UDP, length 113
03:45:19.018318 IP node3.34748 > node3.56179: UDP, length 113
03:45:19.018472 IP node3.34748 > node3.35675: UDP, length 113
03:45:19.018564 IP node3.34748 > node3.33275: UDP, length 113
03:45:19.030598 IP node3.35675 > node3.50677: UDP, length 113
03:45:19.034213 IP node3.35675 > node3.46745: UDP, length 113
03:45:19.035128 IP node3.35675 > node3.47648: UDP, length 113
03:45:19.036537 IP node3.35675 > node3.47172: UDP, length 113
03:45:19.037131 IP node3.35675 > node3.51293: UDP, length 113
03:45:19.037441 IP node3.35675 > node3.39207: UDP, length 113
03:45:19.039369 IP node3.35675 > node3.34748: UDP, length 113
03:45:19.039586 IP node3.35675 > node3.50722: UDP, length 113
03:45:19.040076 IP node3.35675 > node3.45596: UDP, length 113
03:45:19.046427 IP node3.35675 > node3.46165: UDP, length 113
03:45:19.047142 IP node3.35675 > node3.60040: UDP, length 113
03:45:19.051219 IP node3.35675 > node3.52490: UDP, length 113
03:45:19.051399 IP node3.35675 > node3.56179: UDP, length 113
03:45:19.053225 IP node3.35675 > node3.33275: UDP, length 113
03:45:19.089981 IP node3.52490 > node3.46745: UDP, length 113
03:45:19.090409 IP node3.52490 > node3.47648: UDP, length 113
03:45:19.090800 IP node3.52490 > node3.47172: UDP, length 113
03:45:19.091956 IP node3.52490 > node3.51293: UDP, length 113
03:45:19.092765 IP node3.52490 > node3.39207: UDP, length 113
03:45:19.094069 IP node3.52490 > node3.34748: UDP, length 113
03:45:19.094529 IP node3.52490 > node3.50722: UDP, length 113
03:45:19.094967 IP node3.52490 > node3.45596: UDP, length 113
03:45:19.095842 IP node3.52490 > node3.46165: UDP, length 113
03:45:19.096059 IP node3.52490 > node3.35675: UDP, length 113
03:45:19.096390 IP node3.52490 > node3.60040: UDP, length 113
03:45:19.103350 IP node3.60040 > node3.39256: UDP, length 112
03:45:19.111413 IP node3.56179 > node3.47172: UDP, length 113
03:45:19.113449 IP node3.56179 > node3.34748: UDP, length 113
03:45:19.113675 IP node3.56179 > node3.50722: UDP, length 113
03:45:19.114229 IP node3.56179 > node3.45596: UDP, length 113
03:45:19.115545 IP node3.56179 > node3.46165: UDP, length 113
03:45:19.115747 IP node3.56179 > node3.35675: UDP, length 113
03:45:19.126061 IP node3.56179 > node3.60040: UDP, length 113
03:45:19.127567 IP node3.56179 > node3.52490: UDP, length 113
03:45:19.133271 IP node3.60040 > node3.58437: UDP, length 112
03:45:19.133856 IP node3.60040 > node3.50677: UDP, length 112
03:45:19.139653 IP node3.46165 > node3.45596: UDP, length 113
03:45:19.141322 IP node3.46165 > node3.35675: UDP, length 113
03:45:19.142153 IP node3.46165 > node3.60040: UDP, length 113
03:45:19.147399 IP node3.46165 > node3.52490: UDP, length 113
03:45:19.147444 IP node3.46165 > node3.33275: UDP, length 113
03:45:19.147757 IP node3.46165 > node3.56179: UDP, length 113
03:45:19.177142 IP node3.52490 > node3.56179: UDP, length 113
03:45:19.179251 IP node3.52490 > node3.33275: UDP, length 113
03:45:19.193926 IP node3.56179 > node3.33275: UDP, length 113
03:45:19.218746 IP node3.60040 > node3.46745: UDP, length 112
03:45:19.219175 IP node3.60040 > node3.47648: UDP, length 112
03:45:19.228611 IP node3.46745 > node3.50722: UDP, length 87
03:45:19.258751 IP node3.60040 > node3.47172: UDP, length 112
03:45:19.259301 IP node3.60040 > node3.51293: UDP, length 112
03:45:19.259461 IP node3.60040 > node3.39207: UDP, length 112
03:45:19.326277 IP node3.46165 > node3.42537: UDP, length 113
03:45:19.326514 IP node3.55023 > node3.42537: UDP, length 112
03:45:19.327196 IP node3.46745 > node3.42537: UDP, length 113
03:45:19.328235 IP node3.47674 > node3.42537: UDP, length 112
03:45:19.328410 IP node3.55313 > node3.42537: UDP, length 113
03:45:19.328706 IP node3.58663 > node3.42537: UDP, length 113
03:45:19.330362 IP node3.42797 > node3.42537: UDP, length 113
03:45:19.331798 IP node3.39256 > node3.42537: UDP, length 113
03:45:19.332578 IP node3.33216 > node3.42537: UDP, length 113
03:45:19.333656 IP node3.33275 > node3.42537: UDP, length 113
03:45:19.335626 IP node3.33707 > node3.42537: UDP, length 113
03:45:19.335787 IP node3.48649 > node3.42537: UDP, length 113
03:45:19.338082 IP node3.58437 > node3.42537: UDP, length 113
03:45:19.338716 IP node3.53645 > node3.42537: UDP, length 113
03:45:19.346197 IP node3.39207 > node3.42537: UDP, length 113
03:45:19.347165 IP node3.39663 > node3.42537: UDP, length 113
03:45:19.357686 IP node3.47648 > node3.42537: UDP, length 113
03:45:19.364441 IP node3.34748 > node3.42537: UDP, length 113
03:45:19.365939 IP node3.47172 > node3.42537: UDP, length 113
03:45:19.368045 IP node3.35675 > node3.42537: UDP, length 113
03:45:19.368799 IP node3.52490 > node3.42537: UDP, length 113
03:45:19.371639 IP node3.60040 > node3.34748: UDP, length 112
03:45:19.372390 IP node3.60040 > node3.50722: UDP, length 112
03:45:19.372747 IP node3.60040 > node3.45596: UDP, length 112
03:45:19.374384 IP node3.60040 > node3.46165: UDP, length 112
03:45:19.374790 IP node3.60040 > node3.35675: UDP, length 112
03:45:19.378073 IP node3.53645 > node3.51005: UDP, length 113
03:45:19.378372 IP node3.33707 > node3.51005: UDP, length 113
03:45:19.378500 IP node3.46745 > node3.51005: UDP, length 113
03:45:19.378519 IP node3.55313 > node3.51005: UDP, length 113
03:45:19.379984 IP node3.47674 > node3.51005: UDP, length 112
03:45:19.379984 IP node3.47648 > node3.51005: UDP, length 113
03:45:19.381288 IP node3.55023 > node3.51005: UDP, length 112
03:45:19.382158 IP node3.39256 > node3.51005: UDP, length 113
03:45:19.382792 IP node3.48649 > node3.51005: UDP, length 113
03:45:19.383040 IP node3.33216 > node3.51005: UDP, length 113
03:45:19.383650 IP node3.39207 > node3.51005: UDP, length 113
03:45:19.383718 IP node3.34748 > node3.51005: UDP, length 113
03:45:19.384146 IP node3.58663 > node3.51005: UDP, length 113
03:45:19.384263 IP node3.39663 > node3.51005: UDP, length 113
03:45:19.385584 IP node3.42797 > node3.51005: UDP, length 113
03:45:19.385874 IP node3.33275 > node3.51005: UDP, length 113
03:45:19.386582 IP node3.35675 > node3.51005: UDP, length 113
03:45:19.386894 IP node3.58437 > node3.51005: UDP, length 113
03:45:19.387621 IP node3.46165 > node3.51005: UDP, length 113
03:45:19.395363 IP node3.60040 > node3.52490: UDP, length 112
03:45:19.399250 IP node3.51293 > node3.51005: UDP, length 113
03:45:19.399821 IP node3.51293 > node3.42537: UDP, length 113
03:45:19.400756 IP node3.47172 > node3.51005: UDP, length 113
03:45:19.411661 IP node3.60040 > node3.56179: UDP, length 112
03:45:19.418205 IP node3.52490 > node3.51005: UDP, length 113
03:45:19.427215 IP node3.50677 > node3.51005: UDP, length 113
03:45:19.427610 IP node3.50677 > node3.42537: UDP, length 113
03:45:19.437477 IP node3.60040 > node3.33275: UDP, length 112
03:45:19.462466 IP node3.51005 > node3.46745: UDP, length 113
03:45:19.463008 IP node3.51005 > node3.47648: UDP, length 113
03:45:19.463821 IP node3.51005 > node3.47172: UDP, length 113
03:45:19.501324 IP node3.51293 > node3.51507: UDP, length 113
03:45:19.501803 IP node3.53645 > node3.51507: UDP, length 113
03:45:19.501930 IP node3.33707 > node3.51507: UDP, length 113
03:45:19.502104 IP node3.50677 > node3.51507: UDP, length 113
03:45:19.502833 IP node3.47648 > node3.51507: UDP, length 113
03:45:19.503744 IP node3.55023 > node3.51507: UDP, length 112
03:45:19.503925 IP node3.58663 > node3.51507: UDP, length 113
03:45:19.505596 IP node3.39256 > node3.51507: UDP, length 113
03:45:19.506358 IP node3.58437 > node3.51507: UDP, length 113
03:45:19.506491 IP node3.46745 > node3.51507: UDP, length 113
03:45:19.506491 IP node3.48649 > node3.51507: UDP, length 113
03:45:19.507296 IP node3.33275 > node3.51507: UDP, length 113
03:45:19.507519 IP node3.34748 > node3.51507: UDP, length 113
03:45:19.507677 IP node3.33216 > node3.51507: UDP, length 113
03:45:19.507835 IP node3.42797 > node3.51507: UDP, length 113
03:45:19.508041 IP node3.39663 > node3.51507: UDP, length 113
03:45:19.508980 IP node3.52490 > node3.51507: UDP, length 113
03:45:19.509564 IP node3.35675 > node3.51507: UDP, length 113
03:45:19.510588 IP node3.46165 > node3.51507: UDP, length 113
03:45:19.515746 IP node3.60040 > node3.42537: UDP, length 112
03:45:19.517566 IP node3.60040 > node3.51005: UDP, length 112
03:45:19.532849 IP node3.42537 > node3.58437: UDP, length 113
03:45:19.535927 IP node3.45596 > node3.51005: UDP, length 113
03:45:19.535983 IP node3.45596 > node3.51507: UDP, length 113
03:45:19.536340 IP node3.45596 > node3.42537: UDP, length 113
03:45:19.541839 IP node3.42537 > node3.50677: UDP, length 113
03:45:19.551295 IP node3.42537 > node3.46745: UDP, length 113
03:45:19.551431 IP node3.42537 > node3.47648: UDP, length 113
03:45:19.552354 IP node3.39207 > node3.51507: UDP, length 113
03:45:19.552367 IP node3.42537 > node3.47172: UDP, length 113
03:45:19.552863 IP node3.56179 > node3.51005: UDP, length 113
03:45:19.552904 IP node3.56179 > node3.51507: UDP, length 113
03:45:19.552904 IP node3.42537 > node3.51293: UDP, length 113
03:45:19.553044 IP node3.42537 > node3.39207: UDP, length 113
03:45:19.553196 IP node3.56179 > node3.42537: UDP, length 113
03:45:19.572658 IP node3.51507 > node3.34748: UDP, length 113
03:45:19.572982 IP node3.51507 > node3.50722: UDP, length 113
03:45:19.573525 IP node3.42537 > node3.34748: UDP, length 113
03:45:19.573863 IP node3.51507 > node3.45596: UDP, length 113
03:45:19.574258 IP node3.42537 > node3.50722: UDP, length 113
03:45:19.575103 IP node3.51507 > node3.46165: UDP, length 113
03:45:19.575487 IP node3.51507 > node3.35675: UDP, length 113
03:45:19.575738 IP node3.51507 > node3.60040: UDP, length 113
03:45:19.579045 IP node3.42537 > node3.45596: UDP, length 113
03:45:19.582589 IP node3.53645 > node3.34187: UDP, length 113
03:45:19.582672 IP node3.39256 > node3.34187: UDP, length 113
03:45:19.583061 IP node3.55023 > node3.34187: UDP, length 112
03:45:19.583438 IP node3.50677 > node3.34187: UDP, length 113
03:45:19.583553 IP node3.45596 > node3.34187: UDP, length 113
03:45:19.584045 IP node3.35675 > node3.34187: UDP, length 113
03:45:19.584049 IP node3.58663 > node3.34187: UDP, length 113
03:45:19.584264 IP node3.33216 > node3.34187: UDP, length 113
03:45:19.585081 IP node3.58437 > node3.34187: UDP, length 113
03:45:19.585638 IP node3.51293 > node3.34187: UDP, length 113
03:45:19.585638 IP node3.42797 > node3.34187: UDP, length 113
03:45:19.586259 IP node3.34748 > node3.34187: UDP, length 113
03:45:19.586300 IP node3.48649 > node3.34187: UDP, length 113
03:45:19.587047 IP node3.52490 > node3.34187: UDP, length 113
03:45:19.587422 IP node3.33707 > node3.34187: UDP, length 113
03:45:19.588001 IP node3.46165 > node3.34187: UDP, length 113
03:45:19.588642 IP node3.56179 > node3.34187: UDP, length 113
03:45:19.589168 IP node3.33275 > node3.34187: UDP, length 113
03:45:19.591812 IP node3.46745 > node3.34187: UDP, length 113
03:45:19.592392 IP node3.47648 > node3.34187: UDP, length 113
03:45:19.593107 IP node3.39663 > node3.34187: UDP, length 113
03:45:19.597767 IP node3.42537 > node3.46165: UDP, length 113
03:45:19.604914 IP node3.60040 > node3.51507: UDP, length 112
03:45:19.607848 IP node3.60040 > node3.34187: UDP, length 112
03:45:19.618877 IP node3.50722 > node3.34187: UDP, length 113
03:45:19.619103 IP node3.50722 > node3.51507: UDP, length 113
03:45:19.619388 IP node3.50722 > node3.46745: UDP, length 94
03:45:19.619874 IP node3.50722 > node3.42537: UDP, length 113
03:45:19.620012 IP node3.50722 > node3.51005: UDP, length 113
03:45:19.624088 IP node3.55313 > node3.34187: UDP, length 113
03:45:19.624140 IP node3.55313 > node3.51507: UDP, length 113
03:45:19.638353 IP node3.42537 > node3.35675: UDP, length 113
03:45:19.638619 IP node3.42537 > node3.60040: UDP, length 113
03:45:19.690734 IP node3.51005 > node3.51293: UDP, length 113
03:45:19.691053 IP node3.51005 > node3.39207: UDP, length 113
03:45:19.692450 IP node3.51005 > node3.34748: UDP, length 113
03:45:19.693256 IP node3.51005 > node3.50722: UDP, length 113
03:45:19.693699 IP node3.51005 > node3.45596: UDP, length 113
03:45:19.694671 IP node3.51005 > node3.46165: UDP, length 113
03:45:19.695216 IP node3.51005 > node3.35675: UDP, length 113
03:45:19.696099 IP node3.51005 > node3.60040: UDP, length 113
03:45:19.697778 IP node3.51005 > node3.52490: UDP, length 113
03:45:19.698466 IP node3.51005 > node3.56179: UDP, length 113
03:45:19.699599 IP node3.51005 > node3.33275: UDP, length 113
03:45:19.723891 IP node3.47172 > node3.51507: UDP, length 113
03:45:19.724084 IP node3.47172 > node3.34187: UDP, length 113
03:45:19.777251 IP node3.42537 > node3.52490: UDP, length 113
03:45:19.777450 IP node3.42537 > node3.56179: UDP, length 113
03:45:19.777656 IP node3.42537 > node3.33275: UDP, length 113
03:45:19.817644 IP node3.47674 > node3.34187: UDP, length 112
03:45:19.817694 IP node3.47674 > node3.51507: UDP, length 112
03:45:19.854957 IP node3.51507 > node3.52490: UDP, length 113
03:45:19.855153 IP node3.51507 > node3.56179: UDP, length 113
03:45:19.855351 IP node3.51507 > node3.33275: UDP, length 113
03:45:19.861054 IP node3.51507 > node3.42537: UDP, length 113
03:45:19.861755 IP node3.51507 > node3.51005: UDP, length 113
03:45:19.875380 IP node3.51005 > node3.42537: UDP, length 113
03:45:19.948706 IP node3.39207 > node3.34187: UDP, length 113
03:45:19.996638 IP node3.51005 > node3.34187: UDP, length 113
03:45:19.996717 IP node3.51005 > node3.51507: UDP, length 113
03:45:20.004659 IP node3.51507 > node3.34187: UDP, length 113
03:45:20.050286 IP node3.42537 > node3.51005: UDP, length 113
03:45:20.052354 IP node3.42537 > node3.34187: UDP, length 113
03:45:20.052363 IP node3.42537 > node3.51507: UDP, length 113
03:45:20.085916 IP node3.34187 > node3.45596: UDP, length 113
03:45:20.086279 IP node3.34187 > node3.50722: UDP, length 113
03:45:20.120121 IP node3.34187 > node3.34748: UDP, length 113
03:45:20.120655 IP node3.34187 > node3.52490: UDP, length 113
03:45:20.121140 IP node3.34187 > node3.51507: UDP, length 113
03:45:20.121565 IP node3.34187 > node3.56179: UDP, length 113
03:45:20.121866 IP node3.34187 > node3.46165: UDP, length 113
03:45:20.122157 IP node3.34187 > node3.42537: UDP, length 113
03:45:20.122478 IP node3.34187 > node3.33275: UDP, length 113
03:45:20.122546 IP node3.34187 > node3.51005: UDP, length 113
03:45:20.122675 IP node3.34187 > node3.60040: UDP, length 113
03:45:20.123019 IP node3.34187 > node3.35675: UDP, length 113
03:45:20.148586 IP node3.39207 > node3.33834: UDP, length 113
03:45:20.148767 IP node3.45596 > node3.33834: UDP, length 113
03:45:20.148915 IP node3.51293 > node3.33834: UDP, length 113
03:45:20.149051 IP node3.47674 > node3.33834: UDP, length 112
03:45:20.150760 IP node3.39256 > node3.33834: UDP, length 113
03:45:20.151045 IP node3.50677 > node3.33834: UDP, length 113
03:45:20.151469 IP node3.47648 > node3.33834: UDP, length 113
03:45:20.151769 IP node3.53645 > node3.33834: UDP, length 113
03:45:20.151904 IP node3.33707 > node3.33834: UDP, length 113
03:45:20.152045 IP node3.58663 > node3.33834: UDP, length 113
03:45:20.152335 IP node3.48649 > node3.33834: UDP, length 113
03:45:20.153883 IP node3.46165 > node3.33834: UDP, length 113
03:45:20.155439 IP node3.46745 > node3.33834: UDP, length 113
03:45:20.156675 IP node3.60040 > node3.33834: UDP, length 112
03:45:20.157507 IP node3.34748 > node3.33834: UDP, length 113
03:45:20.157737 IP node3.50722 > node3.33834: UDP, length 113
03:45:20.157985 IP node3.35675 > node3.33834: UDP, length 113
03:45:20.158213 IP node3.58437 > node3.33834: UDP, length 113
03:45:20.158562 IP node3.55313 > node3.33834: UDP, length 113
03:45:20.158900 IP node3.33216 > node3.33834: UDP, length 113
03:45:20.158989 IP node3.51005 > node3.33834: UDP, length 113
03:45:20.159345 IP node3.55023 > node3.33834: UDP, length 112
03:45:20.159722 IP node3.33834 > node3.52490: UDP, length 113
03:45:20.160401 IP node3.42797 > node3.33834: UDP, length 113
03:45:20.160491 IP node3.52490 > node3.33834: UDP, length 113
03:45:20.161127 IP node3.33275 > node3.33834: UDP, length 113
03:45:20.163505 IP node3.39663 > node3.33834: UDP, length 113
03:45:20.163974 IP node3.47172 > node3.33834: UDP, length 113
03:45:20.165375 IP node3.51507 > node3.33834: UDP, length 113
03:45:20.167361 IP node3.56179 > node3.33834: UDP, length 113
03:45:20.167824 IP node3.42537 > node3.33834: UDP, length 113
03:45:20.171348 IP node3.33834 > node3.33275: UDP, length 113
03:45:20.190963 IP node3.39207 > node3.57602: UDP, length 113
03:45:20.194057 IP node3.45596 > node3.57602: UDP, length 113
03:45:20.194263 IP node3.51293 > node3.57602: UDP, length 113
03:45:20.194348 IP node3.53645 > node3.57602: UDP, length 113
03:45:20.194479 IP node3.47674 > node3.57602: UDP, length 112
03:45:20.194516 IP node3.33707 > node3.57602: UDP, length 113
03:45:20.194752 IP node3.58663 > node3.57602: UDP, length 113
03:45:20.194780 IP node3.50722 > node3.57602: UDP, length 113
03:45:20.194833 IP node3.50677 > node3.57602: UDP, length 113
03:45:20.195042 IP node3.47648 > node3.57602: UDP, length 113
03:45:20.195050 IP node3.58437 > node3.57602: UDP, length 113
03:45:20.195246 IP node3.55313 > node3.57602: UDP, length 113
03:45:20.195263 IP node3.48649 > node3.57602: UDP, length 113
03:45:20.195379 IP node3.33216 > node3.57602: UDP, length 113
03:45:20.195524 IP node3.46745 > node3.57602: UDP, length 113
03:45:20.195649 IP node3.46165 > node3.57602: UDP, length 113
03:45:20.195852 IP node3.33275 > node3.57602: UDP, length 113
03:45:20.196624 IP node3.56179 > node3.57602: UDP, length 113
03:45:20.197147 IP node3.60040 > node3.57602: UDP, length 112
03:45:20.198165 IP node3.57602 > node3.60040: UDP, length 113
03:45:20.198604 IP node3.51005 > node3.57602: UDP, length 113
03:45:20.198774 IP node3.39663 > node3.57602: UDP, length 113
03:45:20.199106 IP node3.52490 > node3.57602: UDP, length 113
03:45:20.200165 IP node3.39256 > node3.57602: UDP, length 113
03:45:20.200960 IP node3.55023 > node3.57602: UDP, length 112
03:45:20.201322 IP node3.42797 > node3.57602: UDP, length 113
03:45:20.201894 IP node3.35675 > node3.57602: UDP, length 113
03:45:20.202449 IP node3.34748 > node3.57602: UDP, length 113
03:45:20.203371 IP node3.47172 > node3.57602: UDP, length 113
03:45:20.206082 IP node3.51507 > node3.57602: UDP, length 113
03:45:20.206821 IP node3.42537 > node3.57602: UDP, length 113
03:45:20.227694 IP node3.34187 > node3.33834: UDP, length 113
03:45:20.227987 IP node3.34187 > node3.57602: UDP, length 113
03:45:20.353255 IP node3.50677 > node3.33317: UDP, length 113
03:45:20.353680 IP node3.33707 > node3.33317: UDP, length 113
03:45:20.353893 IP node3.46745 > node3.33317: UDP, length 113
03:45:20.354037 IP node3.47648 > node3.33317: UDP, length 113
03:45:20.354624 IP node3.39207 > node3.33317: UDP, length 113
03:45:20.355898 IP node3.58663 > node3.33317: UDP, length 113
03:45:20.356079 IP node3.47674 > node3.33317: UDP, length 112
03:45:20.356649 IP node3.45596 > node3.33317: UDP, length 113
03:45:20.356689 IP node3.39256 > node3.33317: UDP, length 113
03:45:20.356747 IP node3.53645 > node3.33317: UDP, length 113
03:45:20.356798 IP node3.51293 > node3.33317: UDP, length 113
03:45:20.356857 IP node3.39663 > node3.33317: UDP, length 113
03:45:20.361868 IP node3.35675 > node3.33317: UDP, length 113
03:45:20.361987 IP node3.56179 > node3.33317: UDP, length 113
03:45:20.362745 IP node3.33216 > node3.33317: UDP, length 113
03:45:20.363943 IP node3.60040 > node3.33317: UDP, length 112
03:45:20.364696 IP node3.48649 > node3.33317: UDP, length 113
03:45:20.365307 IP node3.34748 > node3.33317: UDP, length 113
03:45:20.365688 IP node3.58437 > node3.33317: UDP, length 113
03:45:20.365992 IP node3.50722 > node3.33317: UDP, length 113
03:45:20.366176 IP node3.33275 > node3.33317: UDP, length 113
03:45:20.366758 IP node3.42797 > node3.33317: UDP, length 113
03:45:20.367068 IP node3.55023 > node3.33317: UDP, length 112
03:45:20.367370 IP node3.46165 > node3.33317: UDP, length 113
03:45:20.367714 IP node3.52490 > node3.33317: UDP, length 113
03:45:20.368052 IP node3.47172 > node3.33317: UDP, length 113
03:45:20.368256 IP node3.55313 > node3.33317: UDP, length 113
03:45:20.369440 IP node3.42537 > node3.33317: UDP, length 113
03:45:20.370058 IP node3.51507 > node3.33317: UDP, length 113
03:45:20.372620 IP node3.51005 > node3.33317: UDP, length 113
03:45:20.391696 IP node3.47648 > node3.53349: UDP, length 113
03:45:20.392231 IP node3.51005 > node3.53349: UDP, length 113
03:45:20.393072 IP node3.39207 > node3.53349: UDP, length 113
03:45:20.393136 IP node3.39256 > node3.53349: UDP, length 113
03:45:20.394835 IP node3.46745 > node3.53349: UDP, length 113
03:45:20.394992 IP node3.45596 > node3.53349: UDP, length 113
03:45:20.395138 IP node3.53645 > node3.53349: UDP, length 113
03:45:20.395178 IP node3.47674 > node3.53349: UDP, length 112
03:45:20.395330 IP node3.33707 > node3.53349: UDP, length 113
03:45:20.395453 IP node3.58663 > node3.53349: UDP, length 113
03:45:20.395851 IP node3.50677 > node3.53349: UDP, length 113
03:45:20.396037 IP node3.51507 > node3.53349: UDP, length 113
03:45:20.396178 IP node3.51293 > node3.53349: UDP, length 113
03:45:20.396414 IP node3.60040 > node3.53349: UDP, length 112
03:45:20.401304 IP node3.39663 > node3.53349: UDP, length 113
03:45:20.404471 IP node3.55023 > node3.53349: UDP, length 112
03:45:20.405227 IP node3.35675 > node3.53349: UDP, length 113
03:45:20.405499 IP node3.34748 > node3.53349: UDP, length 113
03:45:20.405518 IP node3.56179 > node3.53349: UDP, length 113
03:45:20.405692 IP node3.50722 > node3.53349: UDP, length 113
03:45:20.406754 IP node3.33275 > node3.53349: UDP, length 113
03:45:20.407201 IP node3.58437 > node3.53349: UDP, length 113
03:45:20.408173 IP node3.33216 > node3.53349: UDP, length 113
03:45:20.408547 IP node3.46165 > node3.53349: UDP, length 113
03:45:20.408810 IP node3.47172 > node3.53349: UDP, length 113
03:45:20.409128 IP node3.52490 > node3.53349: UDP, length 113
03:45:20.409303 IP node3.42797 > node3.53349: UDP, length 113
03:45:20.409597 IP node3.48649 > node3.53349: UDP, length 113
03:45:20.409831 IP node3.55313 > node3.53349: UDP, length 113
03:45:20.410565 IP node3.42537 > node3.53349: UDP, length 113
03:45:20.419508 IP node3.34187 > node3.33317: UDP, length 113
03:45:20.419733 IP node3.34187 > node3.53349: UDP, length 113
03:45:20.440911 IP node3.33834 > node3.56179: UDP, length 113
03:45:20.516651 IP node3.33317 > node3.42537: UDP, length 113
03:45:20.546680 IP node3.57602 > node3.52490: UDP, length 113
03:45:20.546783 IP node3.57602 > node3.56179: UDP, length 113
03:45:20.546792 IP node3.57602 > node3.33275: UDP, length 113
03:45:20.708835 IP node3.33834 > node3.34187: UDP, length 113
03:45:20.708864 IP node3.33834 > node3.51005: UDP, length 113
03:45:20.708944 IP node3.33834 > node3.51507: UDP, length 113
03:45:20.709718 IP node3.33834 > node3.42537: UDP, length 113
03:45:20.715146 IP node3.33834 > node3.57602: UDP, length 113
03:45:20.715863 IP node3.33834 > node3.33317: UDP, length 113
03:45:20.715977 IP node3.33834 > node3.53349: UDP, length 113
03:45:20.731473 IP node3.57602 > node3.34187: UDP, length 113
03:45:20.731542 IP node3.57602 > node3.51005: UDP, length 113
03:45:20.731596 IP node3.57602 > node3.51507: UDP, length 113
03:45:20.732182 IP node3.57602 > node3.42537: UDP, length 113
03:45:20.734720 IP node3.57602 > node3.33834: UDP, length 113
03:45:20.734787 IP node3.57602 > node3.53349: UDP, length 113
03:45:20.735203 IP node3.57602 > node3.33317: UDP, length 113
03:45:20.813893 IP node3.45596 > node3.35908: UDP, length 113
03:45:20.814017 IP node3.47648 > node3.35908: UDP, length 113
03:45:20.814518 IP node3.60040 > node3.35908: UDP, length 112
03:45:20.814661 IP node3.46745 > node3.35908: UDP, length 113
03:45:20.815076 IP node3.47674 > node3.35908: UDP, length 112
03:45:20.816690 IP node3.51293 > node3.35908: UDP, length 113
03:45:20.816813 IP node3.50677 > node3.35908: UDP, length 113
03:45:20.818019 IP node3.56179 > node3.35908: UDP, length 113
03:45:20.818302 IP node3.47172 > node3.35908: UDP, length 113
03:45:20.818911 IP node3.53645 > node3.35908: UDP, length 113
03:45:20.822032 IP node3.58437 > node3.35908: UDP, length 113
03:45:20.829629 IP node3.33216 > node3.35908: UDP, length 113
03:45:20.829727 IP node3.33707 > node3.35908: UDP, length 113
03:45:20.829955 IP node3.51507 > node3.35908: UDP, length 113
03:45:20.831028 IP node3.48649 > node3.35908: UDP, length 113
03:45:20.844573 IP node3.58663 > node3.35908: UDP, length 113
03:45:20.862406 IP node3.39256 > node3.35908: UDP, length 113
03:45:20.863956 IP node3.51005 > node3.35908: UDP, length 113
03:45:20.864271 IP node3.55023 > node3.35908: UDP, length 112
03:45:20.869088 IP node3.35675 > node3.35908: UDP, length 113
03:45:20.869282 IP node3.55313 > node3.35908: UDP, length 113
03:45:20.870723 IP node3.39663 > node3.35908: UDP, length 113
03:45:20.871287 IP node3.33275 > node3.35908: UDP, length 113
03:45:20.871662 IP node3.52490 > node3.35908: UDP, length 113
03:45:20.873299 IP node3.42797 > node3.35908: UDP, length 113
03:45:20.874221 IP node3.50722 > node3.35908: UDP, length 113
03:45:20.874297 IP node3.33834 > node3.35908: UDP, length 113
03:45:20.874735 IP node3.34187 > node3.35908: UDP, length 113
03:45:20.877011 IP node3.39207 > node3.35908: UDP, length 113
03:45:20.877184 IP node3.46165 > node3.35908: UDP, length 113
03:45:20.877389 IP node3.34748 > node3.35908: UDP, length 113
03:45:20.880395 IP node3.45596 > node3.42269: UDP, length 113
03:45:20.881239 IP node3.47648 > node3.42269: UDP, length 113
03:45:20.881722 IP node3.47674 > node3.42269: UDP, length 112
03:45:20.882073 IP node3.48649 > node3.42269: UDP, length 113
03:45:20.882530 IP node3.34187 > node3.42269: UDP, length 113
03:45:20.882840 IP node3.51293 > node3.42269: UDP, length 113
03:45:20.883453 IP node3.33216 > node3.42269: UDP, length 113
03:45:20.883502 IP node3.33834 > node3.42269: UDP, length 113
03:45:20.884273 IP node3.46745 > node3.42269: UDP, length 113
03:45:20.884470 IP node3.58663 > node3.42269: UDP, length 113
03:45:20.884652 IP node3.51507 > node3.42269: UDP, length 113
03:45:20.884863 IP node3.33707 > node3.42269: UDP, length 113
03:45:20.885752 IP node3.56179 > node3.42269: UDP, length 113
03:45:20.887141 IP node3.47172 > node3.42269: UDP, length 113
03:45:20.887387 IP node3.60040 > node3.42269: UDP, length 112
03:45:20.887550 IP node3.58437 > node3.42269: UDP, length 113
03:45:20.890856 IP node3.51005 > node3.42269: UDP, length 113
03:45:20.891267 IP node3.42797 > node3.42269: UDP, length 113
03:45:20.892133 IP node3.42269 > node3.34187: UDP, length 113
03:45:20.894872 IP node3.55023 > node3.42269: UDP, length 112
03:45:20.895462 IP node3.53645 > node3.42269: UDP, length 113
03:45:20.896128 IP node3.55313 > node3.42269: UDP, length 113
03:45:20.896945 IP node3.39663 > node3.42269: UDP, length 113
03:45:20.900981 IP node3.50677 > node3.42269: UDP, length 113
03:45:20.902675 IP node3.50722 > node3.42269: UDP, length 113
03:45:20.902922 IP node3.39207 > node3.42269: UDP, length 113
03:45:20.903099 IP node3.34748 > node3.42269: UDP, length 113
03:45:20.903804 IP node3.39256 > node3.42269: UDP, length 113
03:45:20.907656 IP node3.33275 > node3.42269: UDP, length 113
03:45:20.910778 IP node3.42537 > node3.42269: UDP, length 113
03:45:20.910832 IP node3.42537 > node3.35908: UDP, length 113
03:45:20.912140 IP node3.52490 > node3.42269: UDP, length 113
03:45:20.913074 IP node3.46165 > node3.42269: UDP, length 113
03:45:20.913580 IP node3.35675 > node3.42269: UDP, length 113
03:45:20.917383 IP node3.57602 > node3.35908: UDP, length 113
03:45:20.925456 IP node3.57602 > node3.42269: UDP, length 113
03:45:20.933225 IP node3.42269 > node3.33834: UDP, length 113
03:45:20.933314 IP node3.42269 > node3.53349: UDP, length 113
03:45:20.933373 IP node3.42269 > node3.51507: UDP, length 113
03:45:20.933431 IP node3.42269 > node3.57602: UDP, length 113
03:45:20.933910 IP node3.42269 > node3.33317: UDP, length 113
03:45:20.938151 IP node3.42269 > node3.35908: UDP, length 113
03:45:20.979998 IP node3.53349 > node3.51005: UDP, length 113
03:45:21.060439 IP node3.33317 > node3.51005: UDP, length 113
03:45:21.062589 IP node3.33317 > node3.51507: UDP, length 113
03:45:21.062827 IP node3.33317 > node3.34187: UDP, length 113
03:45:21.083907 IP node3.33317 > node3.57602: UDP, length 113
03:45:21.084734 IP node3.33317 > node3.53349: UDP, length 113
03:45:21.186427 IP node3.33275 > node3.46165: UDP, length 87
03:45:21.214953 IP node3.53349 > node3.34187: UDP, length 113
03:45:21.215027 IP node3.53349 > node3.51507: UDP, length 113
03:45:21.221693 IP node3.53349 > node3.33834: UDP, length 113
03:45:21.221747 IP node3.53349 > node3.57602: UDP, length 113
03:45:21.222124 IP node3.53349 > node3.42269: UDP, length 113
03:45:21.222238 IP node3.53349 > node3.33317: UDP, length 113
03:45:21.222283 IP node3.53349 > node3.35908: UDP, length 113
03:45:21.235751 IP node3.39256 > node3.45542: UDP, length 113
03:45:21.236206 IP node3.47674 > node3.45542: UDP, length 112
03:45:21.236482 IP node3.33707 > node3.45542: UDP, length 113
03:45:21.237619 IP node3.34748 > node3.45542: UDP, length 113
03:45:21.238323 IP node3.51005 > node3.45542: UDP, length 113
03:45:21.238435 IP node3.45596 > node3.45542: UDP, length 113
03:45:21.239166 IP node3.33275 > node3.45542: UDP, length 113
03:45:21.239175 IP node3.47648 > node3.45542: UDP, length 113
03:45:21.239556 IP node3.48649 > node3.45542: UDP, length 113
03:45:21.239657 IP node3.52490 > node3.45542: UDP, length 113
03:45:21.240088 IP node3.42797 > node3.45542: UDP, length 113
03:45:21.241234 IP node3.42537 > node3.45542: UDP, length 113
03:45:21.241275 IP node3.60040 > node3.45542: UDP, length 112
03:45:21.241383 IP node3.33216 > node3.45542: UDP, length 113
03:45:21.241398 IP node3.39663 > node3.45542: UDP, length 113
03:45:21.241700 IP node3.46165 > node3.45542: UDP, length 113
03:45:21.241773 IP node3.46165 > node3.33275: UDP, length 94
03:45:21.244704 IP node3.56179 > node3.45542: UDP, length 113
03:45:21.245614 IP node3.45542 > node3.34187: UDP, length 113
03:45:21.245933 IP node3.45542 > node3.33834: UDP, length 113
03:45:21.246228 IP node3.45542 > node3.57602: UDP, length 113
03:45:21.247098 IP node3.45542 > node3.33317: UDP, length 113
03:45:21.247347 IP node3.45542 > node3.53349: UDP, length 113
03:45:21.250130 IP node3.45542 > node3.35908: UDP, length 113
03:45:21.250325 IP node3.45542 > node3.42269: UDP, length 113
03:45:21.254420 IP node3.58663 > node3.45542: UDP, length 113
03:45:21.255415 IP node3.50677 > node3.45542: UDP, length 113
03:45:21.255457 IP node3.51507 > node3.45542: UDP, length 113
03:45:21.255772 IP node3.33317 > node3.33834: UDP, length 113
03:45:21.255822 IP node3.33317 > node3.42269: UDP, length 113
03:45:21.255862 IP node3.33317 > node3.35908: UDP, length 113
03:45:21.256702 IP node3.39207 > node3.45542: UDP, length 113
03:45:21.259092 IP node3.46745 > node3.45542: UDP, length 113
03:45:21.260138 IP node3.53645 > node3.45542: UDP, length 113
03:45:21.260269 IP node3.33834 > node3.45542: UDP, length 113
03:45:21.260814 IP node3.33317 > node3.45542: UDP, length 113
03:45:21.261042 IP node3.47172 > node3.45542: UDP, length 113
03:45:21.261673 IP node3.50722 > node3.45542: UDP, length 113
03:45:21.264851 IP node3.55023 > node3.45542: UDP, length 112
03:45:21.265486 IP node3.55313 > node3.45542: UDP, length 113
03:45:21.266017 IP node3.35908 > node3.51507: UDP, length 113
03:45:21.266830 IP node3.35908 > node3.34187: UDP, length 113
03:45:21.268345 IP node3.51293 > node3.45542: UDP, length 113
03:45:21.270577 IP node3.42269 > node3.45542: UDP, length 113
03:45:21.283913 IP node3.46165 > node3.53047: UDP, length 113
03:45:21.284686 IP node3.33707 > node3.53047: UDP, length 113
03:45:21.285441 IP node3.47648 > node3.53047: UDP, length 113
03:45:21.285617 IP node3.33275 > node3.53047: UDP, length 113
03:45:21.286308 IP node3.58663 > node3.53047: UDP, length 113
03:45:21.286621 IP node3.51005 > node3.53047: UDP, length 113
03:45:21.286933 IP node3.52490 > node3.53047: UDP, length 113
03:45:21.287253 IP node3.45596 > node3.53047: UDP, length 113
03:45:21.287937 IP node3.48649 > node3.53047: UDP, length 113
03:45:21.288659 IP node3.39663 > node3.53047: UDP, length 113
03:45:21.291582 IP node3.42797 > node3.53047: UDP, length 113
03:45:21.291948 IP node3.33317 > node3.53047: UDP, length 113
03:45:21.292001 IP node3.42537 > node3.53047: UDP, length 113
03:45:21.292469 IP node3.47674 > node3.53047: UDP, length 112
03:45:21.292799 IP node3.50677 > node3.53047: UDP, length 113
03:45:21.293113 IP node3.55313 > node3.53047: UDP, length 113
03:45:21.293266 IP node3.34748 > node3.53047: UDP, length 113
03:45:21.293931 IP node3.51507 > node3.53047: UDP, length 113
03:45:21.294490 IP node3.33216 > node3.53047: UDP, length 113
03:45:21.294844 IP node3.56179 > node3.53047: UDP, length 113
03:45:21.294941 IP node3.33834 > node3.53047: UDP, length 113
03:45:21.295270 IP node3.53645 > node3.53047: UDP, length 113
03:45:21.295703 IP node3.51293 > node3.53047: UDP, length 113
03:45:21.297977 IP node3.55023 > node3.53047: UDP, length 112
03:45:21.299931 IP node3.47172 > node3.53047: UDP, length 113
03:45:21.300483 IP node3.50722 > node3.53047: UDP, length 113
03:45:21.301130 IP node3.46745 > node3.53047: UDP, length 113
03:45:21.301437 IP node3.35675 > node3.45542: UDP, length 113
03:45:21.301470 IP node3.35675 > node3.53047: UDP, length 113
03:45:21.302061 IP node3.39207 > node3.53047: UDP, length 113
03:45:21.308658 IP node3.39256 > node3.53047: UDP, length 113
03:45:21.309710 IP node3.42269 > node3.53047: UDP, length 113
03:45:21.331387 IP node3.53349 > node3.45542: UDP, length 113
03:45:21.338965 IP node3.53349 > node3.53047: UDP, length 113
03:45:21.357869 IP node3.58437 > node3.45542: UDP, length 113
03:45:21.357913 IP node3.58437 > node3.53047: UDP, length 113
03:45:21.361382 IP node3.35908 > node3.33834: UDP, length 113
03:45:21.361446 IP node3.35908 > node3.57602: UDP, length 113
03:45:21.362685 IP node3.35908 > node3.33317: UDP, length 113
03:45:21.363409 IP node3.35908 > node3.53349: UDP, length 113
03:45:21.364601 IP node3.35908 > node3.42269: UDP, length 113
03:45:21.365603 IP node3.35908 > node3.45542: UDP, length 113
03:45:21.392363 IP node3.53047 > node3.57602: UDP, length 113
03:45:21.396463 IP node3.53047 > node3.33834: UDP, length 113
03:45:21.396538 IP node3.53047 > node3.53349: UDP, length 113
03:45:21.396926 IP node3.53047 > node3.33317: UDP, length 113
03:45:21.398976 IP node3.53047 > node3.35908: UDP, length 113
03:45:21.409897 IP node3.60040 > node3.53047: UDP, length 112
03:45:21.410623 IP node3.46165 > node3.45731: UDP, length 113
03:45:21.412632 IP node3.47674 > node3.45731: UDP, length 112
03:45:21.413446 IP node3.39663 > node3.45731: UDP, length 113
03:45:21.415808 IP node3.42797 > node3.45731: UDP, length 113
03:45:21.421658 IP node3.39256 > node3.45731: UDP, length 113
03:45:21.423538 IP node3.45596 > node3.45731: UDP, length 113
03:45:21.423637 IP node3.33275 > node3.45731: UDP, length 113
03:45:21.424035 IP node3.51005 > node3.45731: UDP, length 113
03:45:21.424549 IP node3.42537 > node3.45731: UDP, length 113
03:45:21.424783 IP node3.35675 > node3.45731: UDP, length 113
03:45:21.426440 IP node3.34748 > node3.45731: UDP, length 113
03:45:21.426484 IP node3.52490 > node3.45731: UDP, length 113
03:45:21.427209 IP node3.58437 > node3.45731: UDP, length 113
03:45:21.427513 IP node3.50677 > node3.45731: UDP, length 113
03:45:21.428378 IP node3.47648 > node3.45731: UDP, length 113
03:45:21.429206 IP node3.51507 > node3.45731: UDP, length 113
03:45:21.429984 IP node3.39207 > node3.45731: UDP, length 113
03:45:21.431047 IP node3.58663 > node3.45731: UDP, length 113
03:45:21.431441 IP node3.46745 > node3.45731: UDP, length 113
03:45:21.432504 IP node3.33216 > node3.45731: UDP, length 113
03:45:21.432505 IP node3.53645 > node3.45731: UDP, length 113
03:45:21.432875 IP node3.33834 > node3.45731: UDP, length 113
03:45:21.433059 IP node3.56179 > node3.45731: UDP, length 113
03:45:21.433573 IP node3.33707 > node3.45731: UDP, length 113
03:45:21.433646 IP node3.50722 > node3.45731: UDP, length 113
03:45:21.434103 IP node3.47172 > node3.45731: UDP, length 113
03:45:21.434659 IP node3.48649 > node3.45731: UDP, length 113
03:45:21.435098 IP node3.55023 > node3.45731: UDP, length 112
03:45:21.435144 IP node3.51293 > node3.45731: UDP, length 113
03:45:21.435683 IP node3.33317 > node3.45731: UDP, length 113
03:45:21.436328 IP node3.55313 > node3.45731: UDP, length 113
03:45:21.436339 IP node3.60040 > node3.45731: UDP, length 112
03:45:21.436954 IP node3.42269 > node3.45731: UDP, length 113
03:45:21.439030 IP node3.35908 > node3.53047: UDP, length 113
03:45:21.439559 IP node3.53349 > node3.45731: UDP, length 113
03:45:21.439795 IP node3.35908 > node3.45731: UDP, length 113
03:45:21.445084 IP node3.45731 > node3.33834: UDP, length 113
03:45:21.449085 IP node3.45731 > node3.33317: UDP, length 113
03:45:21.449364 IP node3.45731 > node3.53349: UDP, length 113
03:45:21.450942 IP node3.45731 > node3.35908: UDP, length 113
03:45:21.451156 IP node3.45731 > node3.42269: UDP, length 113
03:45:21.452514 IP node3.45731 > node3.57602: UDP, length 113
03:45:21.459905 IP node3.45731 > node3.45542: UDP, length 113
03:45:21.465739 IP node3.45731 > node3.53047: UDP, length 113
03:45:21.481577 IP node3.45542 > node3.53047: UDP, length 113
03:45:21.481810 IP node3.45542 > node3.45731: UDP, length 113
03:45:21.517363 IP node3.57602 > node3.45542: UDP, length 113
03:45:21.517567 IP node3.57602 > node3.45731: UDP, length 113
03:45:21.517616 IP node3.57602 > node3.53047: UDP, length 113
03:45:21.678441 IP node3.53047 > node3.45542: UDP, length 113
03:45:21.678710 IP node3.53047 > node3.42269: UDP, length 113
03:45:21.759700 IP node3.53047 > node3.45731: UDP, length 113
03:45:21.770969 IP node3.34187 > node3.45542: UDP, length 113
03:45:21.771034 IP node3.34187 > node3.45731: UDP, length 113
03:45:21.771085 IP node3.34187 > node3.53047: UDP, length 113
03:45:21.901231 IP node3.45596 > node3.34748: UDP, length 113
03:45:21.902290 IP node3.39663 > node3.34748: UDP, length 113
03:45:21.903079 IP node3.46165 > node3.34748: UDP, length 113
03:45:21.904238 IP node3.58663 > node3.34748: UDP, length 113
03:45:21.904772 IP node3.33275 > node3.34748: UDP, length 113
03:45:21.904970 IP node3.39256 > node3.34748: UDP, length 113
03:45:21.905695 IP node3.51507 > node3.34748: UDP, length 113
03:45:21.907385 IP node3.42797 > node3.34748: UDP, length 113
03:45:21.908192 IP node3.51293 > node3.34748: UDP, length 113
03:45:21.916489 IP node3.33707 > node3.34748: UDP, length 113
03:45:21.916566 IP node3.35908 > node3.34748: UDP, length 113
03:45:21.916694 IP node3.60040 > node3.34748: UDP, length 112
03:45:21.919335 IP node3.47648 > node3.34748: UDP, length 113
03:45:21.920440 IP node3.50677 > node3.34748: UDP, length 113
03:45:21.921312 IP node3.45542 > node3.34748: UDP, length 113
03:45:21.921441 IP node3.53645 > node3.34748: UDP, length 113
03:45:21.921462 IP node3.33216 > node3.34748: UDP, length 113
03:45:21.921493 IP node3.47172 > node3.34748: UDP, length 113
03:45:21.922552 IP node3.55313 > node3.34748: UDP, length 113
03:45:21.922575 IP node3.47674 > node3.34748: UDP, length 112
03:45:21.923413 IP node3.50722 > node3.34748: UDP, length 113
03:45:21.923892 IP node3.46745 > node3.34748: UDP, length 113
03:45:21.924676 IP node3.56179 > node3.34748: UDP, length 113
03:45:21.924943 IP node3.33834 > node3.34748: UDP, length 113
03:45:21.925111 IP node3.35675 > node3.34748: UDP, length 113
03:45:21.925280 IP node3.42269 > node3.34748: UDP, length 113
03:45:21.925976 IP node3.51005 > node3.34748: UDP, length 113
03:45:21.925985 IP node3.33317 > node3.34748: UDP, length 113
03:45:21.926452 IP node3.42537 > node3.34748: UDP, length 113
03:45:21.926687 IP node3.52490 > node3.34748: UDP, length 113
03:45:21.926813 IP node3.53349 > node3.34748: UDP, length 113
03:45:21.927256 IP node3.55023 > node3.34748: UDP, length 112
03:45:21.927419 IP node3.39207 > node3.34748: UDP, length 113
03:45:21.927512 IP node3.57602 > node3.34748: UDP, length 113
03:45:21.929427 IP node3.53047 > node3.34748: UDP, length 113
03:45:21.929428 IP node3.58437 > node3.34748: UDP, length 113
03:45:21.930248 IP node3.45731 > node3.34748: UDP, length 113
03:45:21.930271 IP node3.48649 > node3.34748: UDP, length 113
03:45:21.954427 IP node3.34187 > node3.34748: UDP, length 113
03:45:23.261746 IP node3.45542 > node3.45731: UDP, length 87
03:45:23.264974 IP node3.45731 > node3.45542: UDP, length 94
03:45:23.268735 IP node3.53047 > node3.34748: UDP, length 87
03:45:23.272169 IP node3.34748 > node3.53047: UDP, length 94
03:45:24.223363 IP node3.51507 > node3.42269: UDP, length 113
03:45:24.224016 IP node3.34187 > node3.42269: UDP, length 113
03:45:24.224930 IP node3.60040 > node3.42269: UDP, length 112
03:45:24.225163 IP node3.50677 > node3.42269: UDP, length 113
03:45:24.225382 IP node3.47648 > node3.42269: UDP, length 113
03:45:24.225888 IP node3.51005 > node3.42269: UDP, length 113
03:45:24.226415 IP node3.35675 > node3.42269: UDP, length 113
03:45:24.227060 IP node3.34748 > node3.42269: UDP, length 113
03:45:24.227280 IP node3.47674 > node3.42269: UDP, length 112
03:45:24.227302 IP node3.47172 > node3.42269: UDP, length 113
03:45:24.227488 IP node3.51293 > node3.42269: UDP, length 113
03:45:24.227982 IP node3.48649 > node3.42269: UDP, length 113
03:45:24.228131 IP node3.55313 > node3.42269: UDP, length 113
03:45:24.228940 IP node3.45731 > node3.42269: UDP, length 113
03:45:24.229654 IP node3.33317 > node3.42269: UDP, length 113
03:45:24.230858 IP node3.58437 > node3.42269: UDP, length 113
03:45:24.231088 IP node3.33216 > node3.42269: UDP, length 113
03:45:24.231439 IP node3.33834 > node3.42269: UDP, length 113
03:45:24.231696 IP node3.55023 > node3.42269: UDP, length 112
03:45:24.231898 IP node3.58663 > node3.42269: UDP, length 113
03:45:24.232121 IP node3.39663 > node3.42269: UDP, length 113
03:45:24.232279 IP node3.53645 > node3.42269: UDP, length 113
03:45:24.232447 IP node3.46745 > node3.42269: UDP, length 113
03:45:24.232896 IP node3.52490 > node3.42269: UDP, length 113
03:45:24.232967 IP node3.33275 > node3.42269: UDP, length 113
03:45:24.233136 IP node3.46165 > node3.42269: UDP, length 113
03:45:24.233146 IP node3.57602 > node3.42269: UDP, length 113
03:45:24.234155 IP node3.33707 > node3.42269: UDP, length 113
03:45:24.237301 IP node3.45596 > node3.42269: UDP, length 113
03:45:24.238115 IP node3.56179 > node3.42269: UDP, length 113
03:45:24.239276 IP node3.42537 > node3.42269: UDP, length 113
03:45:24.240191 IP node3.35908 > node3.42269: UDP, length 113
03:45:24.240498 IP node3.42797 > node3.42269: UDP, length 113
03:45:24.240530 IP node3.39207 > node3.42269: UDP, length 113
03:45:24.241297 IP node3.50722 > node3.42269: UDP, length 113
03:45:24.242516 IP node3.39256 > node3.42269: UDP, length 113
03:45:24.242745 IP node3.45542 > node3.42269: UDP, length 113
03:45:24.242818 IP node3.53047 > node3.42269: UDP, length 113
03:45:24.248358 IP node3.53349 > node3.42269: UDP, length 113
03:45:24.317168 IP node3.51005 > node3.35908: UDP, length 113
03:45:24.319048 IP node3.53645 > node3.35908: UDP, length 113
03:45:24.319474 IP node3.45596 > node3.35908: UDP, length 113
03:45:24.319492 IP node3.39663 > node3.35908: UDP, length 113
03:45:24.320412 IP node3.56179 > node3.35908: UDP, length 113
03:45:24.320621 IP node3.52490 > node3.35908: UDP, length 113
03:45:24.320648 IP node3.33707 > node3.35908: UDP, length 113
03:45:24.320737 IP node3.50677 > node3.35908: UDP, length 113
03:45:24.320860 IP node3.47648 > node3.35908: UDP, length 113
03:45:24.320895 IP node3.58663 > node3.35908: UDP, length 113
03:45:24.320921 IP node3.60040 > node3.35908: UDP, length 112
03:45:24.321066 IP node3.50722 > node3.35908: UDP, length 113
03:45:24.321078 IP node3.39207 > node3.35908: UDP, length 113
03:45:24.321280 IP node3.33216 > node3.35908: UDP, length 113
03:45:24.321378 IP node3.57602 > node3.35908: UDP, length 113
03:45:24.321611 IP node3.46745 > node3.35908: UDP, length 113
03:45:24.322222 IP node3.33275 > node3.35908: UDP, length 113
03:45:24.322310 IP node3.42797 > node3.35908: UDP, length 113
03:45:24.322481 IP node3.47674 > node3.35908: UDP, length 112
03:45:24.322998 IP node3.46165 > node3.35908: UDP, length 113
03:45:24.323286 IP node3.42537 > node3.35908: UDP, length 113
03:45:24.323670 IP node3.34748 > node3.35908: UDP, length 113
03:45:24.325333 IP node3.39256 > node3.35908: UDP, length 113
03:45:24.325551 IP node3.51293 > node3.35908: UDP, length 113
03:45:24.326906 IP node3.53047 > node3.35908: UDP, length 113
03:45:24.327024 IP node3.35675 > node3.35908: UDP, length 113
03:45:24.327107 IP node3.42269 > node3.35908: UDP, length 113
03:45:24.327520 IP node3.33317 > node3.35908: UDP, length 113
03:45:24.328693 IP node3.45542 > node3.35908: UDP, length 113
03:45:24.328833 IP node3.55313 > node3.35908: UDP, length 113
03:45:24.329172 IP node3.51507 > node3.35908: UDP, length 113
03:45:24.330932 IP node3.34187 > node3.35908: UDP, length 113
03:45:24.331366 IP node3.33834 > node3.35908: UDP, length 113
03:45:24.331910 IP node3.55023 > node3.35908: UDP, length 112
03:45:24.332205 IP node3.45731 > node3.35908: UDP, length 113
03:45:24.332850 IP node3.58437 > node3.35908: UDP, length 113
03:45:24.333355 IP node3.47172 > node3.35908: UDP, length 113
03:45:24.333590 IP node3.48649 > node3.35908: UDP, length 113
03:45:24.340004 IP node3.53349 > node3.35908: UDP, length 113
03:54:56.922305 IP node3.56179 > node3.45542: UDP, length 83
03:54:56.922430 IP node3.56179 > node3.48649: UDP, length 83
03:54:56.922461 IP node3.56179 > node3.39663: UDP, length 83
03:54:56.922751 IP node3.56179 > node3.57602: UDP, length 83
03:54:56.922815 IP node3.45542 > node3.56179: UDP, length 83
03:54:56.922915 IP node3.56179 > node3.35908: UDP, length 83
03:54:56.923387 IP node3.56179 > node3.53645: UDP, length 83
03:54:56.923575 IP node3.56179 > node3.33275: UDP, length 83
03:54:56.923733 IP node3.53645 > node3.56179: UDP, length 83
03:54:56.923760 IP node3.56179 > node3.51005: UDP, length 83
03:54:56.923790 IP node3.56179 > node3.53349: UDP, length 83
03:54:56.924087 IP node3.56179 > node3.50722: UDP, length 83
03:54:56.924116 IP node3.56179 > node3.35675: UDP, length 83
03:54:56.937754 IP node3.35675 > node3.56179: UDP, length 83
03:54:56.939562 IP node3.39663 > node3.56179: UDP, length 83
03:54:56.944033 IP node3.48649 > node3.56179: UDP, length 83
03:54:56.945110 IP node3.33275 > node3.56179: UDP, length 83
03:54:56.947487 IP node3.51005 > node3.56179: UDP, length 83
03:54:56.950690 IP node3.56179 > node3.34748: UDP, length 83
03:54:56.955334 IP node3.50722 > node3.56179: UDP, length 83
03:54:56.959214 IP node3.56179 > node3.46745: UDP, length 83
03:54:56.959868 IP node3.57602 > node3.56179: UDP, length 83
03:54:56.961013 IP node3.46745 > node3.56179: UDP, length 83
03:54:56.961805 IP node3.56179 > node3.42537: UDP, length 83
03:54:56.962301 IP node3.56179 > node3.33707: UDP, length 83
03:54:56.969282 IP node3.42537 > node3.56179: UDP, length 83
03:54:56.972359 IP node3.56179 > node3.46165: UDP, length 83
03:54:56.978078 IP node3.56179 > node3.45731: UDP, length 83
03:54:56.978203 IP node3.56179 > node3.53047: UDP, length 83
03:54:56.978540 IP node3.56179 > node3.60040: UDP, length 83
03:54:56.978585 IP node3.56179 > node3.39207: UDP, length 83
03:54:56.978921 IP node3.60040 > node3.56179: UDP, length 83
03:54:56.979067 IP node3.39207 > node3.56179: UDP, length 83
03:54:56.979719 IP node3.53047 > node3.56179: UDP, length 83
03:54:56.984162 IP node3.56179 > node3.33216: UDP, length 83
03:54:56.984937 IP node3.56179 > node3.47674: UDP, length 83
03:54:56.985143 IP node3.56179 > node3.39256: UDP, length 83
03:54:56.987482 IP node3.39256 > node3.56179: UDP, length 83
03:54:56.993739 IP node3.47674 > node3.56179: UDP, length 83
03:54:56.995137 IP node3.35908 > node3.56179: UDP, length 83
03:54:57.052085 IP node3.56179 > node3.51293: UDP, length 83
03:54:57.054376 IP node3.51293 > node3.56179: UDP, length 83
03:54:57.056796 IP node3.56179 > node3.50677: UDP, length 83
03:54:57.057202 IP node3.50677 > node3.56179: UDP, length 83
03:54:57.058486 IP node3.56179 > node3.34187: UDP, length 83
03:54:57.058522 IP node3.56179 > node3.52490: UDP, length 83
03:54:57.058991 IP node3.56179 > node3.33834: UDP, length 83
03:54:57.060170 IP node3.56179 > node3.33317: UDP, length 83
03:54:57.060697 IP node3.34187 > node3.56179: UDP, length 83
03:54:57.060860 IP node3.52490 > node3.56179: UDP, length 83
03:54:57.062066 IP node3.33317 > node3.56179: UDP, length 83
03:54:57.062979 IP node3.56179 > node3.55313: UDP, length 83
03:54:57.063035 IP node3.56179 > node3.58437: UDP, length 83
03:54:57.063141 IP node3.56179 > node3.47172: UDP, length 83
03:54:57.063967 IP node3.56179 > node3.42797: UDP, length 83
03:54:57.068699 IP node3.47648 > node3.45542: UDP, length 83
03:54:57.068808 IP node3.47648 > node3.48649: UDP, length 83
03:54:57.068836 IP node3.47648 > node3.39663: UDP, length 83
03:54:57.069031 IP node3.47648 > node3.57602: UDP, length 83
03:54:57.069226 IP node3.47648 > node3.35908: UDP, length 83
03:54:57.069636 IP node3.47648 > node3.53645: UDP, length 83
03:54:57.069770 IP node3.47648 > node3.33275: UDP, length 83
03:54:57.069908 IP node3.47648 > node3.51005: UDP, length 83
03:54:57.069934 IP node3.47648 > node3.53349: UDP, length 83
03:54:57.070165 IP node3.47648 > node3.50722: UDP, length 83
03:54:57.070190 IP node3.47648 > node3.35675: UDP, length 83
03:54:57.070436 IP node3.47648 > node3.34748: UDP, length 83
03:54:57.071827 IP node3.53645 > node3.47648: UDP, length 83
03:54:57.072097 IP node3.35675 > node3.47648: UDP, length 83
03:54:57.072193 IP node3.57602 > node3.47648: UDP, length 83
03:54:57.072516 IP node3.33275 > node3.47648: UDP, length 83
03:54:57.072619 IP node3.47172 > node3.56179: UDP, length 83
03:54:57.072919 IP node3.51005 > node3.47648: UDP, length 83
03:54:57.075123 IP node3.39663 > node3.47648: UDP, length 83
03:54:57.075426 IP node3.50722 > node3.47648: UDP, length 83
03:54:57.075694 IP node3.48649 > node3.47648: UDP, length 83
03:54:57.077080 IP node3.35908 > node3.47648: UDP, length 83
03:54:57.077499 IP node3.56179 > node3.51507: UDP, length 83
03:54:57.077612 IP node3.56179 > node3.45596: UDP, length 83
03:54:57.078119 IP node3.51507 > node3.56179: UDP, length 83
03:54:57.078880 IP node3.56179 > node3.47648: UDP, length 83
03:54:57.078970 IP node3.56179 > node3.42269: UDP, length 83
03:54:57.080480 IP node3.42269 > node3.56179: UDP, length 83
03:54:57.081211 IP node3.56179 > node3.58663: UDP, length 83
03:54:57.081551 IP node3.56179 > node3.55023: UDP, length 83
03:54:57.081608 IP node3.42797 > node3.56179: UDP, length 83
03:54:57.088922 IP node3.45596 > node3.56179: UDP, length 83
03:54:57.109513 IP node3.45542 > node3.47648: UDP, length 83
03:54:57.137077 IP node3.47648 > node3.56179: UDP, length 83
03:54:57.154183 IP node3.47648 > node3.46745: UDP, length 83
03:54:57.154584 IP node3.47648 > node3.56179: UDP, length 83
03:54:57.157473 IP node3.46745 > node3.47648: UDP, length 83
03:54:57.157543 IP node3.47648 > node3.46165: UDP, length 83
03:54:57.158143 IP node3.47648 > node3.45731: UDP, length 83
03:54:57.158238 IP node3.47648 > node3.42537: UDP, length 83
03:54:57.158465 IP node3.47648 > node3.39207: UDP, length 83
03:54:57.158741 IP node3.39207 > node3.47648: UDP, length 83
03:54:57.158825 IP node3.47648 > node3.33216: UDP, length 83
03:54:57.162782 IP node3.47648 > node3.47674: UDP, length 83
03:54:57.163030 IP node3.47674 > node3.47648: UDP, length 83
03:54:57.163222 IP node3.47648 > node3.39256: UDP, length 83
03:54:57.163392 IP node3.47648 > node3.51293: UDP, length 83
03:54:57.163497 IP node3.47648 > node3.50677: UDP, length 83
03:54:57.163768 IP node3.47648 > node3.34187: UDP, length 83
03:54:57.164158 IP node3.34187 > node3.47648: UDP, length 83
03:54:57.164224 IP node3.39256 > node3.47648: UDP, length 83
03:54:57.164286 IP node3.47648 > node3.52490: UDP, length 83
03:54:57.164559 IP node3.52490 > node3.47648: UDP, length 83
03:54:57.164659 IP node3.51293 > node3.47648: UDP, length 83
03:54:57.164738 IP node3.47648 > node3.33834: UDP, length 83
03:54:57.166118 IP node3.47648 > node3.33317: UDP, length 83
03:54:57.167671 IP node3.50677 > node3.47648: UDP, length 83
03:54:57.167822 IP node3.33317 > node3.47648: UDP, length 83
03:54:57.168760 IP node3.47648 > node3.55313: UDP, length 83
03:54:57.168847 IP node3.47648 > node3.58437: UDP, length 83
03:54:57.169053 IP node3.47648 > node3.47172: UDP, length 83
03:54:57.170555 IP node3.47648 > node3.42797: UDP, length 83
03:54:57.170568 IP node3.42537 > node3.47648: UDP, length 83
03:54:57.171610 IP node3.42797 > node3.47648: UDP, length 83
03:54:57.172470 IP node3.47172 > node3.47648: UDP, length 83
03:54:57.179650 IP node3.56179 > node3.47648: UDP, length 83
03:54:57.201354 IP node3.47648 > node3.33707: UDP, length 83
03:54:57.203484 IP node3.47648 > node3.51507: UDP, length 83
03:54:57.203904 IP node3.47648 > node3.45596: UDP, length 83
03:54:57.204015 IP node3.51507 > node3.47648: UDP, length 83
03:54:57.204979 IP node3.47648 > node3.53047: UDP, length 83
03:54:57.205230 IP node3.53047 > node3.47648: UDP, length 83
03:54:57.205285 IP node3.47648 > node3.60040: UDP, length 83
03:54:57.205686 IP node3.60040 > node3.47648: UDP, length 83
03:54:57.206221 IP node3.45596 > node3.47648: UDP, length 83
03:54:57.220644 IP node3.47648 > node3.42269: UDP, length 83
03:54:57.220904 IP node3.47648 > node3.58663: UDP, length 83
03:54:57.221008 IP node3.47648 > node3.55023: UDP, length 83
03:54:57.230356 IP node3.42269 > node3.47648: UDP, length 83

