03:45:13.804363 IP node4.43535 > node2.45941: UDP, length 113
03:45:13.816167 IP node4.43535 > node2.39590: UDP, length 113
03:45:13.816369 IP node4.43535 > node2.46240: UDP, length 113
03:45:13.816483 IP node4.43535 > node2.34901: UDP, length 113
03:45:13.816572 IP node4.43535 > node2.45020: UDP, length 113
03:45:13.816677 IP node4.43535 > node2.38644: UDP, length 113
03:45:13.852654 IP node4.36649 > node2.39590: UDP, length 113
03:45:13.852787 IP node4.36649 > node2.46240: UDP, length 113
03:45:13.852925 IP node4.36649 > node2.37029: UDP, length 113
03:45:13.853024 IP node4.36649 > node2.53706: UDP, length 113
03:45:13.853127 IP node4.36649 > node2.45020: UDP, length 113
03:45:13.853255 IP node4.36649 > node2.36822: UDP, length 113
03:45:13.853349 IP node4.36649 > node2.40292: UDP, length 113
03:45:13.853440 IP node4.36649 > node2.37998: UDP, length 113
03:45:13.853618 IP node4.36649 > node2.53302: UDP, length 113
03:45:13.853719 IP node4.36649 > node2.42544: UDP, length 113
03:45:13.857136 IP node4.36649 > node2.38644: UDP, length 113
03:45:13.893294 IP node4.43535 > node2.40292: UDP, length 113
03:45:13.893498 IP node4.43535 > node2.37998: UDP, length 113
03:45:13.893653 IP node4.43535 > node2.53302: UDP, length 113
03:45:13.893736 IP node4.43535 > node2.42544: UDP, length 113
03:45:13.893886 IP node4.43535 > node2.37029: UDP, length 113
03:45:13.893970 IP node4.43535 > node2.53706: UDP, length 113
03:45:13.894091 IP node4.43535 > node2.36822: UDP, length 113
03:45:13.894255 IP node4.43535 > node2.33629: UDP, length 113
03:45:13.903845 IP node4.44488 > node2.46240: UDP, length 113
03:45:13.904455 IP node4.44488 > node2.39590: UDP, length 113
03:45:13.907344 IP node4.44488 > node2.53302: UDP, length 113
03:45:13.907627 IP node4.44488 > node2.37998: UDP, length 113
03:45:13.977608 IP node4.44488 > node2.42544: UDP, length 113
03:45:13.978126 IP node4.44488 > node2.38644: UDP, length 113
03:45:13.981949 IP node4.44488 > node2.40292: UDP, length 113
03:45:13.982347 IP node4.44488 > node2.36822: UDP, length 113
03:45:13.983026 IP node4.44488 > node2.37029: UDP, length 113
03:45:13.983380 IP node4.44488 > node2.53706: UDP, length 113
03:45:14.063606 IP node4.43535 > node2.45176: UDP, length 113
03:45:14.065644 IP node4.36649 > node2.45176: UDP, length 113
03:45:14.109362 IP node4.43535 > node3.45596: UDP, length 113
03:45:14.111729 IP node4.42817 > node2.45020: UDP, length 113
03:45:14.112280 IP node4.42817 > node2.46240: UDP, length 113
03:45:14.113658 IP node4.42817 > node2.39590: UDP, length 113
03:45:14.115480 IP node4.42817 > node2.53302: UDP, length 113
03:45:14.116034 IP node4.42817 > node2.37998: UDP, length 113
03:45:14.116628 IP node4.42817 > node2.42544: UDP, length 113
03:45:14.116949 IP node4.42817 > node2.40292: UDP, length 113
03:45:14.117225 IP node4.42817 > node2.36822: UDP, length 113
03:45:14.117887 IP node4.42817 > node2.37029: UDP, length 113
03:45:14.118182 IP node4.42817 > node2.53706: UDP, length 113
03:45:14.118903 IP node4.44488 > node2.45176: UDP, length 113
03:45:14.119060 IP node4.43535 > node2.50420: UDP, length 113
03:45:14.119516 IP node4.44488 > node3.45596: UDP, length 113
03:45:14.119691 IP node4.36649 > node3.45596: UDP, length 113
03:45:14.119869 IP node4.44488 > node2.50420: UDP, length 113
03:45:14.122997 IP node4.36649 > node2.50420: UDP, length 113
03:45:14.126115 IP node4.42817 > node2.38644: UDP, length 113
03:45:14.128184 IP node4.42817 > node2.45176: UDP, length 113
03:45:14.158682 IP node4.42817 > node3.45596: UDP, length 113
03:45:14.159041 IP node4.42817 > node2.50420: UDP, length 113
03:45:14.332993 IP node4.42817 > node2.50822: UDP, length 113
03:45:14.334404 IP node4.43535 > node2.50822: UDP, length 113
03:45:14.335101 IP node4.36649 > node2.50822: UDP, length 113
03:45:14.336172 IP node4.44488 > node2.50822: UDP, length 113
03:45:14.343634 IP node4.42817 > node3.33275: UDP, length 113
03:45:14.344460 IP node4.44488 > node3.33275: UDP, length 113
03:45:14.344591 IP node4.43535 > node3.33275: UDP, length 113
03:45:14.345074 IP node4.36649 > node3.33275: UDP, length 113
03:45:14.386408 IP node4.42817 > node2.34103: UDP, length 113
03:45:14.386962 IP node4.43535 > node2.34103: UDP, length 113
03:45:14.387427 IP node4.36649 > node2.34103: UDP, length 113
03:45:14.392122 IP node4.44488 > node2.34103: UDP, length 113
03:45:14.397020 IP node4.44488 > node2.35476: UDP, length 113
03:45:14.397135 IP node4.43535 > node2.35476: UDP, length 113
03:45:14.397769 IP node4.42817 > node2.35476: UDP, length 113
03:45:14.398275 IP node4.36649 > node2.35476: UDP, length 113
03:45:14.427425 IP node4.36649 > node2.39954: UDP, length 113
03:45:14.428760 IP node4.43535 > node2.39954: UDP, length 113
03:45:14.429206 IP node4.42817 > node2.39954: UDP, length 113
03:45:14.429413 IP node4.44488 > node2.39954: UDP, length 113
03:45:14.525734 IP node4.55298 > node2.42544: UDP, length 113
03:45:14.533008 IP node4.55298 > node2.40292: UDP, length 113
03:45:14.533183 IP node4.55298 > node2.36822: UDP, length 113
03:45:14.533952 IP node4.55298 > node2.37029: UDP, length 113
03:45:14.534073 IP node4.55298 > node2.53706: UDP, length 113
03:45:14.534316 IP node4.55298 > node2.45176: UDP, length 113
03:45:14.534623 IP node4.55298 > node3.33275: UDP, length 113
03:45:14.534746 IP node4.55298 > node2.50420: UDP, length 113
03:45:14.534847 IP node4.55298 > node3.45596: UDP, length 113
03:45:14.534941 IP node4.55298 > node2.50822: UDP, length 113
03:45:14.535052 IP node4.55298 > node2.34103: UDP, length 113
03:45:14.542641 IP node4.55298 > node2.39954: UDP, length 113
03:45:14.740176 IP node4.55298 > node2.35476: UDP, length 113
03:45:14.859328 IP node4.44488 > node2.42304: UDP, length 113
03:45:14.859674 IP node4.36649 > node2.42304: UDP, length 113
03:45:14.859779 IP node4.42817 > node2.42304: UDP, length 113
03:45:14.860267 IP node4.43535 > node2.42304: UDP, length 113
03:45:14.860718 IP node4.55298 > node2.42304: UDP, length 113
03:45:14.898670 IP node4.36649 > node3.42797: UDP, length 113
03:45:14.898832 IP node4.42817 > node3.42797: UDP, length 113
03:45:14.899539 IP node4.43535 > node3.42797: UDP, length 113
03:45:14.900664 IP node4.44488 > node3.42797: UDP, length 113
03:45:14.900854 IP node4.55298 > node3.42797: UDP, length 113
03:45:14.924921 IP node4.45910 > node2.45176: UDP, length 113
03:45:14.940710 IP node4.36649 > node2.60168: UDP, length 113
03:45:14.941221 IP node4.43535 > node2.60168: UDP, length 113
03:45:14.942663 IP node4.42817 > node2.60168: UDP, length 113
03:45:14.943044 IP node4.55298 > node2.60168: UDP, length 113
03:45:14.943825 IP node4.44488 > node2.60168: UDP, length 113
03:45:14.943954 IP node4.45910 > node3.45596: UDP, length 113
03:45:14.952630 IP node4.45910 > node2.50822: UDP, length 113
03:45:14.954613 IP node4.45910 > node3.33275: UDP, length 113
03:45:14.954729 IP node4.45910 > node3.42797: UDP, length 113
03:45:14.954843 IP node4.45910 > node2.50420: UDP, length 113
03:45:14.954978 IP node4.45910 > node2.42304: UDP, length 113
03:45:14.955159 IP node4.45910 > node2.39954: UDP, length 113
03:45:14.955272 IP node4.45910 > node2.35476: UDP, length 113
03:45:14.955553 IP node4.45910 > node2.34103: UDP, length 113
03:45:14.955641 IP node4.45910 > node2.60168: UDP, length 113
03:45:14.956703 IP node4.44488 > node2.33273: UDP, length 113
03:45:14.957833 IP node4.43535 > node2.33273: UDP, length 113
03:45:14.958860 IP node4.36649 > node2.33273: UDP, length 113
03:45:14.960072 IP node4.42817 > node2.33273: UDP, length 113
03:45:14.960798 IP node4.55298 > node2.33273: UDP, length 113
03:45:14.964560 IP node4.45910 > node2.33273: UDP, length 113
03:45:14.968872 IP node4.43535 > node2.35425: UDP, length 113
03:45:14.969574 IP node4.36649 > node2.35425: UDP, length 113
03:45:14.978771 IP node4.44488 > node2.35425: UDP, length 113
03:45:14.979815 IP node4.42817 > node2.35425: UDP, length 113
03:45:14.996140 IP node4.55298 > node2.35425: UDP, length 113
03:45:15.010147 IP node4.44488 > node3.58663: UDP, length 113
03:45:15.012148 IP node4.36649 > node3.58663: UDP, length 113
03:45:15.012463 IP node4.43535 > node3.58663: UDP, length 113
03:45:15.013381 IP node4.42817 > node3.58663: UDP, length 113
03:45:15.013619 IP node4.42817 > node2.50082: UDP, length 113
03:45:15.014394 IP node4.43535 > node2.50082: UDP, length 113
03:45:15.014903 IP node4.36649 > node2.50082: UDP, length 113
03:45:15.015848 IP node4.44488 > node2.50082: UDP, length 113
03:45:15.017259 IP node4.55298 > node2.50082: UDP, length 113
03:45:15.017400 IP node4.55298 > node3.58663: UDP, length 113
03:45:15.035132 IP node4.42817 > node2.46051: UDP, length 113
03:45:15.035322 IP node4.36649 > node2.46051: UDP, length 113
03:45:15.035644 IP node4.43535 > node2.46051: UDP, length 113
03:45:15.037204 IP node4.55298 > node2.46051: UDP, length 113
03:45:15.038106 IP node4.44488 > node2.46051: UDP, length 113
03:45:15.049548 IP node4.45910 > node2.35425: UDP, length 113
03:45:15.065290 IP node4.36649 > node3.39663: UDP, length 113
03:45:15.065596 IP node4.43535 > node3.39663: UDP, length 113
03:45:15.068923 IP node4.43535 > node2.47183: UDP, length 113
03:45:15.069149 IP node4.44488 > node3.39663: UDP, length 113
03:45:15.069262 IP node4.44488 > node2.47183: UDP, length 113
03:45:15.069746 IP node4.36649 > node2.47183: UDP, length 113
03:45:15.072383 IP node4.55298 > node2.47183: UDP, length 113
03:45:15.072665 IP node4.55298 > node3.39663: UDP, length 113
03:45:15.074178 IP node4.42817 > node3.39663: UDP, length 113
03:45:15.074515 IP node4.42817 > node2.47183: UDP, length 113
03:45:15.090344 IP node4.55446 > node2.45176: UDP, length 113
03:45:15.094796 IP node4.55446 > node2.44278: UDP, length 94
03:45:15.095252 IP node4.45910 > node2.50082: UDP, length 113
03:45:15.097031 IP node4.55446 > node3.45596: UDP, length 113
03:45:15.097250 IP node4.55446 > node2.50420: UDP, length 113
03:45:15.097444 IP node4.45910 > node2.46051: UDP, length 113
03:45:15.097467 IP node4.55446 > node2.50822: UDP, length 113
03:45:15.097738 IP node4.55446 > node3.33275: UDP, length 113
03:45:15.098115 IP node4.55446 > node2.34103: UDP, length 113
03:45:15.098322 IP node4.55446 > node2.35476: UDP, length 113
03:45:15.099109 IP node4.55446 > node2.39954: UDP, length 113
03:45:15.100021 IP node4.55446 > node2.42304: UDP, length 113
03:45:15.100403 IP node4.55446 > node3.42797: UDP, length 113
03:45:15.101060 IP node4.55446 > node2.60168: UDP, length 113
03:45:15.101260 IP node4.45910 > node3.39663: UDP, length 113
03:45:15.101359 IP node4.55446 > node2.33273: UDP, length 113
03:45:15.101559 IP node4.55446 > node2.35425: UDP, length 113
03:45:15.101753 IP node4.55446 > node3.58663: UDP, length 113
03:45:15.101957 IP node4.55446 > node2.50082: UDP, length 113
03:45:15.102178 IP node4.55446 > node2.46051: UDP, length 113
03:45:15.144694 IP node4.45910 > node2.47183: UDP, length 113
03:45:15.180523 IP node4.55446 > node3.39663: UDP, length 113
03:45:15.180821 IP node4.55446 > node2.47183: UDP, length 113
03:45:15.217629 IP node4.44488 > node3.48649: UDP, length 113
03:45:15.218484 IP node4.42817 > node3.48649: UDP, length 113
03:45:15.219121 IP node4.55298 > node3.48649: UDP, length 113
03:45:15.219904 IP node4.36649 > node3.48649: UDP, length 113
03:45:15.221179 IP node4.43535 > node3.48649: UDP, length 113
03:45:15.226828 IP node4.45910 > node3.48649: UDP, length 113
03:45:15.256563 IP node4.35032 > node3.33275: UDP, length 112
03:45:15.257098 IP node4.35032 > node2.34103: UDP, length 112
03:45:15.257371 IP node4.35032 > node2.35476: UDP, length 112
03:45:15.258104 IP node4.35032 > node2.39954: UDP, length 112
03:45:15.260095 IP node4.35032 > node2.42304: UDP, length 112
03:45:15.260618 IP node4.35032 > node3.42797: UDP, length 112
03:45:15.260873 IP node4.35032 > node2.60168: UDP, length 112
03:45:15.261137 IP node4.35032 > node2.33273: UDP, length 112
03:45:15.261388 IP node4.35032 > node2.35425: UDP, length 112
03:45:15.262694 IP node4.35032 > node3.58663: UDP, length 112
03:45:15.263504 IP node4.35032 > node2.50082: UDP, length 112
03:45:15.263749 IP node4.35032 > node2.46051: UDP, length 112
03:45:15.264147 IP node4.35032 > node3.39663: UDP, length 112
03:45:15.264425 IP node4.35032 > node2.47183: UDP, length 112
03:45:15.276349 IP node4.35032 > node3.48649: UDP, length 112
03:45:15.276713 IP node4.35032 > node2.50822: UDP, length 112
03:45:15.280184 IP node4.55446 > node3.48649: UDP, length 113
03:45:15.287901 IP node4.45910 > node3.58663: UDP, length 113
03:45:15.296060 IP node4.35032 > node2.37614: UDP, length 112
03:45:15.296817 IP node4.44488 > node2.37614: UDP, length 113
03:45:15.297043 IP node4.36649 > node2.37614: UDP, length 113
03:45:15.297243 IP node4.42817 > node2.37614: UDP, length 113
03:45:15.297946 IP node4.43535 > node2.37614: UDP, length 113
03:45:15.301088 IP node4.42817 > node3.55023: UDP, length 113
03:45:15.301675 IP node4.36649 > node3.55023: UDP, length 113
03:45:15.302555 IP node4.43535 > node3.55023: UDP, length 113
03:45:15.302764 IP node4.44488 > node3.55023: UDP, length 113
03:45:15.303707 IP node4.55446 > node2.37614: UDP, length 113
03:45:15.303939 IP node4.55446 > node3.55023: UDP, length 113
03:45:15.304851 IP node4.45910 > node2.37614: UDP, length 113
03:45:15.304999 IP node4.45910 > node3.55023: UDP, length 113
03:45:15.305198 IP node4.35032 > node3.55023: UDP, length 112
03:45:15.322804 IP node4.55298 > node2.37614: UDP, length 113
03:45:15.322940 IP node4.55298 > node3.55023: UDP, length 113
03:45:15.391526 IP node4.39087 > node2.50822: UDP, length 113
03:45:15.396974 IP node4.39087 > node3.33275: UDP, length 113
03:45:15.404547 IP node4.44488 > node3.33216: UDP, length 113
03:45:15.404771 IP node4.35032 > node3.33216: UDP, length 112
03:45:15.405849 IP node4.36649 > node3.33216: UDP, length 113
03:45:15.409471 IP node4.55446 > node2.50082: UDP, length 94
03:45:15.409694 IP node4.55446 > node3.33216: UDP, length 113
03:45:15.412593 IP node4.55298 > node3.33216: UDP, length 113
03:45:15.413298 IP node4.43535 > node3.33216: UDP, length 113
03:45:15.413633 IP node4.42817 > node3.33216: UDP, length 113
03:45:15.459201 IP node4.45910 > node3.33216: UDP, length 113
03:45:15.463736 IP node4.59050 > node2.45176: UDP, length 113
03:45:15.463947 IP node4.59050 > node2.53706: UDP, length 113
03:45:15.464137 IP node4.59050 > node2.50420: UDP, length 113
03:45:15.464250 IP node4.59050 > node3.45596: UDP, length 113
03:45:15.464567 IP node4.59050 > node3.33275: UDP, length 113
03:45:15.464665 IP node4.59050 > node2.50822: UDP, length 113
03:45:15.464769 IP node4.59050 > node2.34103: UDP, length 113
03:45:15.464910 IP node4.59050 > node2.39954: UDP, length 113
03:45:15.465004 IP node4.59050 > node2.35476: UDP, length 113
03:45:15.466413 IP node4.59050 > node2.42304: UDP, length 113
03:45:15.467059 IP node4.59050 > node3.42797: UDP, length 113
03:45:15.467369 IP node4.59050 > node2.60168: UDP, length 113
03:45:15.467695 IP node4.59050 > node2.33273: UDP, length 113
03:45:15.468008 IP node4.59050 > node2.35425: UDP, length 113
03:45:15.468669 IP node4.59050 > node3.58663: UDP, length 113
03:45:15.469042 IP node4.59050 > node2.50082: UDP, length 113
03:45:15.469359 IP node4.59050 > node2.46051: UDP, length 113
03:45:15.470221 IP node4.59050 > node3.39663: UDP, length 113
03:45:15.470545 IP node4.59050 > node2.47183: UDP, length 113
03:45:15.476781 IP node4.59050 > node2.44278: UDP, length 94
03:45:15.476912 IP node4.59050 > node3.48649: UDP, length 113
03:45:15.477021 IP node4.59050 > node2.37614: UDP, length 113
03:45:15.477255 IP node4.59050 > node3.33216: UDP, length 113
03:45:15.477482 IP node4.59050 > node3.55023: UDP, length 113
03:45:15.525822 IP node4.55298 > node2.53863: UDP, length 113
03:45:15.527231 IP node4.35032 > node2.53863: UDP, length 112
03:45:15.529143 IP node4.42817 > node2.53863: UDP, length 113
03:45:15.532411 IP node4.36649 > node2.53863: UDP, length 113
03:45:15.533437 IP node4.55298 > node2.58597: UDP, length 113
03:45:15.534194 IP node4.44488 > node2.58597: UDP, length 113
03:45:15.534588 IP node4.42817 > node2.58597: UDP, length 113
03:45:15.535920 IP node4.43535 > node2.53863: UDP, length 113
03:45:15.536522 IP node4.44488 > node2.53863: UDP, length 113
03:45:15.536769 IP node4.43535 > node2.58597: UDP, length 113
03:45:15.537452 IP node4.36649 > node2.58597: UDP, length 113
03:45:15.541713 IP node4.55446 > node2.58597: UDP, length 113
03:45:15.542358 IP node4.45910 > node2.53863: UDP, length 113
03:45:15.542672 IP node4.45910 > node2.58597: UDP, length 113
03:45:15.544021 IP node4.35032 > node2.58597: UDP, length 112
03:45:15.546938 IP node4.59050 > node2.53863: UDP, length 113
03:45:15.547351 IP node4.59050 > node2.58597: UDP, length 113
03:45:15.562304 IP node4.55298 > node2.49754: UDP, length 113
03:45:15.562483 IP node4.35032 > node2.49754: UDP, length 112
03:45:15.563664 IP node4.43535 > node2.49754: UDP, length 113
03:45:15.563957 IP node4.42817 > node2.49754: UDP, length 113
03:45:15.564495 IP node4.44488 > node2.49754: UDP, length 113
03:45:15.564947 IP node4.36649 > node2.49754: UDP, length 113
03:45:15.565517 IP node4.55446 > node2.49754: UDP, length 113
03:45:15.567185 IP node4.45910 > node2.49754: UDP, length 113
03:45:15.569554 IP node4.59050 > node2.49754: UDP, length 113
03:45:15.577713 IP node4.55298 > node3.47674: UDP, length 113
03:45:15.579277 IP node4.42817 > node3.47674: UDP, length 113
03:45:15.579909 IP node4.36649 > node3.47674: UDP, length 113
03:45:15.580097 IP node4.44488 > node3.47674: UDP, length 113
03:45:15.580341 IP node4.43535 > node3.47674: UDP, length 113
03:45:15.581281 IP node4.55446 > node3.47674: UDP, length 113
03:45:15.583776 IP node4.35032 > node3.47674: UDP, length 112
03:45:15.584555 IP node4.45910 > node3.47674: UDP, length 113
03:45:15.585970 IP node4.59050 > node3.47674: UDP, length 113
03:45:15.603694 IP node4.55298 > node2.33869: UDP, length 113
03:45:15.603861 IP node4.35032 > node2.33869: UDP, length 112
03:45:15.605721 IP node4.36649 > node2.33869: UDP, length 113
03:45:15.605971 IP node4.44488 > node2.33869: UDP, length 113
03:45:15.606180 IP node4.42817 > node2.33869: UDP, length 113
03:45:15.606378 IP node4.43535 > node2.33869: UDP, length 113
03:45:15.607217 IP node4.55446 > node2.44278: UDP, length 71
03:45:15.607344 IP node4.55446 > node2.53863: UDP, length 113
03:45:15.607460 IP node4.55446 > node2.33869: UDP, length 113
03:45:15.608282 IP node4.45910 > node2.33869: UDP, length 113
03:45:15.609622 IP node4.59050 > node2.33869: UDP, length 113
03:45:15.614495 IP node4.42409 > node2.42304: UDP, length 113
03:45:15.615175 IP node4.42409 > node3.42797: UDP, length 113
03:45:15.615438 IP node4.42409 > node2.60168: UDP, length 113
03:45:15.615707 IP node4.42409 > node2.33273: UDP, length 113
03:45:15.615954 IP node4.42409 > node2.35425: UDP, length 113
03:45:15.616209 IP node4.42409 > node3.58663: UDP, length 113
03:45:15.616509 IP node4.42409 > node2.50082: UDP, length 113
03:45:15.616807 IP node4.42409 > node2.46051: UDP, length 113
03:45:15.617142 IP node4.42409 > node3.39663: UDP, length 113
03:45:15.617401 IP node4.42409 > node2.47183: UDP, length 113
03:45:15.618549 IP node4.47308 > node2.42304: UDP, length 113
03:45:15.623815 IP node4.36649 > node2.33901: UDP, length 113
03:45:15.625483 IP node4.43535 > node2.33901: UDP, length 113
03:45:15.626182 IP node4.44488 > node2.33901: UDP, length 113
03:45:15.627138 IP node4.55298 > node2.33901: UDP, length 113
03:45:15.627470 IP node4.42817 > node2.33901: UDP, length 113
03:45:15.628574 IP node4.55446 > node2.33901: UDP, length 113
03:45:15.632156 IP node4.35032 > node2.33901: UDP, length 112
03:45:15.632984 IP node4.59050 > node2.33901: UDP, length 113
03:45:15.640687 IP node4.45910 > node2.33901: UDP, length 113
03:45:15.660766 IP node4.39087 > node2.44278: UDP, length 94
03:45:15.661024 IP node4.39087 > node3.39663: UDP, length 113
03:45:15.661188 IP node4.39087 > node3.48649: UDP, length 113
03:45:15.661259 IP node4.39087 > node2.37614: UDP, length 113
03:45:15.661390 IP node4.39087 > node2.33901: UDP, length 113
03:45:15.661460 IP node4.39087 > node2.53863: UDP, length 113
03:45:15.661532 IP node4.39087 > node2.42304: UDP, length 113
03:45:15.661671 IP node4.39087 > node2.39954: UDP, length 113
03:45:15.661756 IP node4.39087 > node2.33273: UDP, length 113
03:45:15.661832 IP node4.39087 > node2.35476: UDP, length 113
03:45:15.661942 IP node4.39087 > node2.33869: UDP, length 113
03:45:15.662094 IP node4.39087 > node2.49754: UDP, length 113
03:45:15.662255 IP node4.39087 > node2.46051: UDP, length 113
03:45:15.662434 IP node4.39087 > node2.34103: UDP, length 113
03:45:15.662670 IP node4.39087 > node3.42797: UDP, length 113
03:45:15.662836 IP node4.39087 > node2.47183: UDP, length 113
03:45:15.662923 IP node4.39087 > node3.33216: UDP, length 113
03:45:15.663134 IP node4.39087 > node2.50082: UDP, length 113
03:45:15.663226 IP node4.39087 > node2.35425: UDP, length 113
03:45:15.663360 IP node4.39087 > node3.58663: UDP, length 113
03:45:15.663432 IP node4.39087 > node3.47674: UDP, length 113
03:45:15.663520 IP node4.39087 > node2.58597: UDP, length 113
03:45:15.663644 IP node4.39087 > node2.60168: UDP, length 113
03:45:15.663692 IP node4.39087 > node3.55023: UDP, length 113
03:45:15.680196 IP node4.55298 > node3.33707: UDP, length 113
03:45:15.681035 IP node4.36649 > node3.33707: UDP, length 113
03:45:15.681294 IP node4.42817 > node3.33707: UDP, length 113
03:45:15.681570 IP node4.43535 > node3.33707: UDP, length 113
03:45:15.681814 IP node4.44488 > node3.33707: UDP, length 113
03:45:15.683554 IP node4.35032 > node3.33707: UDP, length 112
03:45:15.684732 IP node4.55446 > node3.33707: UDP, length 113
03:45:15.684864 IP node4.59050 > node3.33707: UDP, length 113
03:45:15.685314 IP node4.39087 > node3.33707: UDP, length 113
03:45:15.687945 IP node4.45910 > node3.33707: UDP, length 113
03:45:15.738287 IP node4.51545 > node2.50822: UDP, length 113
03:45:15.738992 IP node4.51545 > node2.34103: UDP, length 113
03:45:15.740508 IP node4.51545 > node2.35476: UDP, length 113
03:45:15.740785 IP node4.51545 > node2.39954: UDP, length 113
03:45:15.741844 IP node4.51545 > node2.42304: UDP, length 113
03:45:15.742266 IP node4.51545 > node3.42797: UDP, length 113
03:45:15.742380 IP node4.51545 > node2.33273: UDP, length 113
03:45:15.742638 IP node4.51545 > node2.60168: UDP, length 113
03:45:15.742773 IP node4.51545 > node2.35425: UDP, length 113
03:45:15.742893 IP node4.51545 > node3.58663: UDP, length 113
03:45:15.749308 IP node4.51545 > node3.39663: UDP, length 113
03:45:15.749578 IP node4.51545 > node2.47183: UDP, length 113
03:45:15.749707 IP node4.51545 > node2.50082: UDP, length 113
03:45:15.749857 IP node4.51545 > node2.46051: UDP, length 113
03:45:15.753198 IP node4.42409 > node2.44278: UDP, length 94
03:45:15.766748 IP node4.42409 > node3.48649: UDP, length 113
03:45:15.767046 IP node4.42409 > node2.37614: UDP, length 113
03:45:15.767298 IP node4.42409 > node3.55023: UDP, length 113
03:45:15.768890 IP node4.42409 > node3.33216: UDP, length 113
03:45:15.769559 IP node4.47308 > node3.42797: UDP, length 113
03:45:15.769857 IP node4.42409 > node2.53863: UDP, length 113
03:45:15.770113 IP node4.47308 > node2.60168: UDP, length 113
03:45:15.770251 IP node4.42409 > node2.58597: UDP, length 113
03:45:15.770446 IP node4.42409 > node2.49754: UDP, length 113
03:45:15.770544 IP node4.47308 > node2.33273: UDP, length 113
03:45:15.770637 IP node4.42409 > node3.47674: UDP, length 113
03:45:15.770829 IP node4.42409 > node2.33869: UDP, length 113
03:45:15.770890 IP node4.47308 > node2.35425: UDP, length 113
03:45:15.771194 IP node4.42409 > node2.33901: UDP, length 113
03:45:15.771243 IP node4.47308 > node3.58663: UDP, length 113
03:45:15.771449 IP node4.42409 > node3.33707: UDP, length 113
03:45:15.771612 IP node4.47308 > node2.50082: UDP, length 113
03:45:15.772196 IP node4.47308 > node2.46051: UDP, length 113
03:45:15.772756 IP node4.47308 > node3.39663: UDP, length 113
03:45:15.773070 IP node4.47308 > node2.47183: UDP, length 113
03:45:15.782876 IP node4.55298 > node3.55313: UDP, length 113
03:45:15.783337 IP node4.44488 > node3.55313: UDP, length 113
03:45:15.783636 IP node4.36649 > node3.55313: UDP, length 113
03:45:15.784602 IP node4.43535 > node3.55313: UDP, length 113
03:45:15.784699 IP node4.35032 > node3.55313: UDP, length 112
03:45:15.785046 IP node4.45910 > node3.55313: UDP, length 113
03:45:15.785219 IP node4.39087 > node3.55313: UDP, length 113
03:45:15.785288 IP node4.42817 > node3.55313: UDP, length 113
03:45:15.787446 IP node4.59050 > node3.55313: UDP, length 113
03:45:15.795279 IP node4.42409 > node3.55313: UDP, length 113
03:45:15.799643 IP node4.51453 > node3.42797: UDP, length 113
03:45:15.800730 IP node4.51453 > node2.60168: UDP, length 113
03:45:15.801507 IP node4.51453 > node2.33273: UDP, length 113
03:45:15.801785 IP node4.51453 > node2.35425: UDP, length 113
03:45:15.802151 IP node4.51453 > node3.58663: UDP, length 113
03:45:15.802470 IP node4.51453 > node2.50082: UDP, length 113
03:45:15.802764 IP node4.51453 > node2.46051: UDP, length 113
03:45:15.803103 IP node4.51453 > node3.39663: UDP, length 113
03:45:15.803348 IP node4.51453 > node2.47183: UDP, length 113
03:45:15.808071 IP node4.51453 > node2.42304: UDP, length 113
03:45:15.840811 IP node4.55298 > node2.43732: UDP, length 113
03:45:15.842087 IP node4.44488 > node2.43732: UDP, length 113
03:45:15.842552 IP node4.39087 > node2.43732: UDP, length 113
03:45:15.843510 IP node4.42817 > node2.43732: UDP, length 113
03:45:15.844047 IP node4.43535 > node2.43732: UDP, length 113
03:45:15.844623 IP node4.36649 > node2.43732: UDP, length 113
03:45:15.845150 IP node4.45910 > node2.43732: UDP, length 113
03:45:15.847261 IP node4.35032 > node2.43732: UDP, length 112
03:45:15.848178 IP node4.59050 > node2.43732: UDP, length 113
03:45:15.852810 IP node4.42817 > node3.53645: UDP, length 113
03:45:15.853225 IP node4.55298 > node3.53645: UDP, length 113
03:45:15.853678 IP node4.39087 > node3.53645: UDP, length 113
03:45:15.854445 IP node4.43535 > node3.53645: UDP, length 113
03:45:15.855351 IP node4.36649 > node3.53645: UDP, length 113
03:45:15.856623 IP node4.44488 > node3.53645: UDP, length 113
03:45:15.857082 IP node4.35032 > node3.53645: UDP, length 112
03:45:15.858961 IP node4.59050 > node3.53645: UDP, length 113
03:45:15.859392 IP node4.55446 > node2.44278: UDP, length 71
03:45:15.859484 IP node4.45910 > node3.53645: UDP, length 113
03:45:15.860476 IP node4.42409 > node2.43732: UDP, length 113
03:45:15.861139 IP node4.55446 > node2.43732: UDP, length 113
03:45:15.861223 IP node4.42409 > node3.53645: UDP, length 113
03:45:15.861299 IP node4.55446 > node3.55313: UDP, length 113
03:45:15.861383 IP node4.55446 > node3.53645: UDP, length 113
03:45:15.892923 IP node4.58434 > node2.44278: UDP, length 94
03:45:15.902703 IP node4.51545 > node2.44278: UDP, length 94
03:45:15.904784 IP node4.51545 > node3.48649: UDP, length 113
03:45:15.904999 IP node4.51545 > node2.37614: UDP, length 113
03:45:15.906456 IP node4.51545 > node3.55023: UDP, length 113
03:45:15.906976 IP node4.51545 > node3.33216: UDP, length 113
03:45:15.907685 IP node4.51545 > node2.53863: UDP, length 113
03:45:15.908077 IP node4.51545 > node2.58597: UDP, length 113
03:45:15.908327 IP node4.51545 > node2.49754: UDP, length 113
03:45:15.908532 IP node4.51545 > node3.47674: UDP, length 113
03:45:15.908739 IP node4.51545 > node2.33869: UDP, length 113
03:45:15.921163 IP node4.51545 > node2.33901: UDP, length 113
03:45:15.921460 IP node4.51545 > node3.33707: UDP, length 113
03:45:15.921691 IP node4.51545 > node3.55313: UDP, length 113
03:45:15.934971 IP node4.51545 > node3.33275: UDP, length 113
03:45:15.935142 IP node4.51545 > node2.43732: UDP, length 113
03:45:15.935297 IP node4.51545 > node3.53645: UDP, length 113
03:45:15.961020 IP node4.58434 > node3.39663: UDP, length 113
03:45:15.961175 IP node4.58434 > node3.42797: UDP, length 113
03:45:15.961315 IP node4.58434 > node2.42304: UDP, length 113
03:45:15.961391 IP node4.58434 > node2.47183: UDP, length 113
03:45:15.961453 IP node4.58434 > node2.33273: UDP, length 113
03:45:15.961629 IP node4.58434 > node2.50082: UDP, length 113
03:45:15.961716 IP node4.58434 > node2.35425: UDP, length 113
03:45:15.961779 IP node4.58434 > node3.58663: UDP, length 113
03:45:15.961940 IP node4.58434 > node2.46051: UDP, length 113
03:45:15.962036 IP node4.58434 > node2.60168: UDP, length 113
03:45:15.963837 IP node4.58434 > node3.48649: UDP, length 113
03:45:15.964114 IP node4.58434 > node3.55023: UDP, length 113
03:45:15.964546 IP node4.58434 > node2.37614: UDP, length 113
03:45:15.964740 IP node4.58434 > node3.33216: UDP, length 113
03:45:15.980078 IP node4.58434 > node2.53863: UDP, length 113
03:45:15.983771 IP node4.58434 > node2.49754: UDP, length 113
03:45:15.984519 IP node4.58434 > node2.58597: UDP, length 113
03:45:15.984731 IP node4.58434 > node3.47674: UDP, length 113
03:45:15.984946 IP node4.58434 > node2.33869: UDP, length 113
03:45:15.985165 IP node4.58434 > node2.33901: UDP, length 113
03:45:15.993816 IP node4.51453 > node2.44278: UDP, length 94
03:45:15.996195 IP node4.51453 > node3.48649: UDP, length 113
03:45:15.996602 IP node4.51453 > node2.37614: UDP, length 113
03:45:15.996648 IP node4.51453 > node3.55023: UDP, length 113
03:45:16.001081 IP node4.51453 > node2.33901: UDP, length 113
03:45:16.001169 IP node4.51453 > node2.43732: UDP, length 113
03:45:16.001287 IP node4.51453 > node2.53863: UDP, length 113
03:45:16.001422 IP node4.51453 > node3.33216: UDP, length 113
03:45:16.001499 IP node4.51453 > node2.33869: UDP, length 113
03:45:16.001619 IP node4.51453 > node2.49754: UDP, length 113
03:45:16.001729 IP node4.51453 > node3.47674: UDP, length 113
03:45:16.001776 IP node4.51453 > node3.33707: UDP, length 113
03:45:16.001860 IP node4.51453 > node3.55313: UDP, length 113
03:45:16.001925 IP node4.51453 > node2.58597: UDP, length 113
03:45:16.002003 IP node4.51453 > node3.53645: UDP, length 113
03:45:16.004470 IP node4.47308 > node2.44278: UDP, length 94
03:45:16.008475 IP node4.58434 > node3.55313: UDP, length 113
03:45:16.016748 IP node4.58434 > node3.33707: UDP, length 113
03:45:16.018942 IP node4.58434 > node2.43732: UDP, length 113
03:45:16.020754 IP node4.36744 > node3.42797: UDP, length 112
03:45:16.020920 IP node4.36744 > node2.42304: UDP, length 112
03:45:16.021317 IP node4.36744 > node2.33273: UDP, length 112
03:45:16.021438 IP node4.36744 > node2.50082: UDP, length 112
03:45:16.021561 IP node4.36744 > node2.35425: UDP, length 112
03:45:16.021698 IP node4.36744 > node3.58663: UDP, length 112
03:45:16.021818 IP node4.36744 > node2.46051: UDP, length 112
03:45:16.021935 IP node4.36744 > node2.60168: UDP, length 112
03:45:16.022113 IP node4.36744 > node3.39663: UDP, length 112
03:45:16.037824 IP node4.36744 > node2.47183: UDP, length 112
03:45:16.045856 IP node4.58434 > node3.53645: UDP, length 113
03:45:16.047182 IP node4.47204 > node3.39663: UDP, length 113
03:45:16.047239 IP node4.47204 > node3.42797: UDP, length 113
03:45:16.047333 IP node4.47204 > node2.47183: UDP, length 113
03:45:16.047428 IP node4.47204 > node2.33273: UDP, length 113
03:45:16.047570 IP node4.47204 > node2.50082: UDP, length 113
03:45:16.047655 IP node4.47204 > node2.35425: UDP, length 113
03:45:16.047732 IP node4.47204 > node3.58663: UDP, length 113
03:45:16.047863 IP node4.47204 > node2.46051: UDP, length 113
03:45:16.047993 IP node4.47204 > node2.60168: UDP, length 113
03:45:16.059873 IP node4.55298 > node2.59900: UDP, length 113
03:45:16.060134 IP node4.36649 > node2.59900: UDP, length 113
03:45:16.060517 IP node4.35032 > node2.59900: UDP, length 112
03:45:16.060964 IP node4.45910 > node2.59900: UDP, length 113
03:45:16.061152 IP node4.42817 > node2.59900: UDP, length 113
03:45:16.062030 IP node4.55446 > node2.59900: UDP, length 113
03:45:16.062929 IP node4.43535 > node2.59900: UDP, length 113
03:45:16.063892 IP node4.44488 > node2.59900: UDP, length 113
03:45:16.064854 IP node4.39087 > node2.59900: UDP, length 113
03:45:16.067476 IP node4.42409 > node2.59900: UDP, length 113
03:45:16.068199 IP node4.51545 > node2.59900: UDP, length 113
03:45:16.069417 IP node4.59050 > node2.59900: UDP, length 113
03:45:16.073056 IP node4.51453 > node2.59900: UDP, length 113
03:45:16.082439 IP node4.45660 > node3.42797: UDP, length 113
03:45:16.090515 IP node4.45910 > node2.44881: UDP, length 113
03:45:16.091851 IP node4.45910 > node3.39256: UDP, length 113
03:45:16.092329 IP node4.59050 > node2.44881: UDP, length 113
03:45:16.092385 IP node4.59050 > node3.39256: UDP, length 113
03:45:16.092619 IP node4.42817 > node2.44881: UDP, length 113
03:45:16.092742 IP node4.42817 > node3.39256: UDP, length 113
03:45:16.094703 IP node4.51453 > node2.44881: UDP, length 113
03:45:16.096036 IP node4.36649 > node2.44881: UDP, length 113
03:45:16.103027 IP node4.35032 > node2.44881: UDP, length 112
03:45:16.103138 IP node4.35032 > node3.39256: UDP, length 112
03:45:16.103709 IP node4.55298 > node2.44881: UDP, length 113
03:45:16.103857 IP node4.55298 > node3.39256: UDP, length 113
03:45:16.104142 IP node4.36649 > node3.39256: UDP, length 113
03:45:16.105731 IP node4.44488 > node2.44881: UDP, length 113
03:45:16.105889 IP node4.44488 > node3.39256: UDP, length 113
03:45:16.107656 IP node4.43535 > node2.44881: UDP, length 113
03:45:16.107883 IP node4.43535 > node3.39256: UDP, length 113
03:45:16.108136 IP node4.58434 > node2.59900: UDP, length 113
03:45:16.109524 IP node4.39087 > node3.39256: UDP, length 113
03:45:16.110836 IP node4.39087 > node2.44881: UDP, length 113
03:45:16.115506 IP node4.51453 > node3.39256: UDP, length 113
03:45:16.116639 IP node4.42409 > node2.44881: UDP, length 113
03:45:16.117216 IP node4.42409 > node3.39256: UDP, length 113
03:45:16.124604 IP node4.45660 > node3.39663: UDP, length 113
03:45:16.124796 IP node4.45660 > node3.48649: UDP, length 113
03:45:16.124891 IP node4.45660 > node2.37614: UDP, length 113
03:45:16.124932 IP node4.51545 > node3.39256: UDP, length 113
03:45:16.125057 IP node4.45660 > node2.47183: UDP, length 113
03:45:16.125153 IP node4.45660 > node2.33273: UDP, length 113
03:45:16.125237 IP node4.45660 > node2.50082: UDP, length 113
03:45:16.125330 IP node4.45660 > node2.35425: UDP, length 113
03:45:16.125421 IP node4.45660 > node3.58663: UDP, length 113
03:45:16.125578 IP node4.45660 > node2.46051: UDP, length 113
03:45:16.125669 IP node4.45660 > node3.55023: UDP, length 113
03:45:16.126134 IP node4.51545 > node2.44881: UDP, length 113
03:45:16.127793 IP node4.58434 > node2.44881: UDP, length 113
03:45:16.127992 IP node4.58434 > node3.39256: UDP, length 113
03:45:16.129984 IP node4.59050 > node2.44832: UDP, length 113
03:45:16.130298 IP node4.45660 > node2.44278: UDP, length 94
03:45:16.130438 IP node4.45910 > node2.44832: UDP, length 113
03:45:16.130910 IP node4.51453 > node2.44832: UDP, length 113
03:45:16.131498 IP node4.55298 > node2.44832: UDP, length 113
03:45:16.131755 IP node4.35032 > node2.44832: UDP, length 112
03:45:16.131933 IP node4.36649 > node2.44832: UDP, length 113
03:45:16.133072 IP node4.43535 > node2.44832: UDP, length 113
03:45:16.133175 IP node4.45660 > node2.60168: UDP, length 113
03:45:16.133844 IP node4.44488 > node2.44832: UDP, length 113
03:45:16.135876 IP node4.42817 > node2.44832: UDP, length 113
03:45:16.135962 IP node4.39087 > node2.44832: UDP, length 113
03:45:16.137206 IP node4.42409 > node2.44832: UDP, length 113
03:45:16.138091 IP node4.51545 > node2.44832: UDP, length 113
03:45:16.140125 IP node4.58434 > node2.44832: UDP, length 113
03:45:16.141621 IP node4.55446 > node2.44881: UDP, length 113
03:45:16.141710 IP node4.55446 > node3.39256: UDP, length 113
03:45:16.141830 IP node4.55446 > node2.44832: UDP, length 113
03:45:16.148595 IP node4.45910 > node2.54620: UDP, length 113
03:45:16.149079 IP node4.42817 > node2.54620: UDP, length 113
03:45:16.149452 IP node4.55446 > node2.54620: UDP, length 113
03:45:16.150426 IP node4.36649 > node2.54620: UDP, length 113
03:45:16.152459 IP node4.55298 > node2.54620: UDP, length 113
03:45:16.154084 IP node4.35032 > node2.54620: UDP, length 112
03:45:16.154301 IP node4.43535 > node2.54620: UDP, length 113
03:45:16.155419 IP node4.44488 > node2.54620: UDP, length 113
03:45:16.156051 IP node4.59050 > node2.54620: UDP, length 113
03:45:16.157050 IP node4.39087 > node2.54620: UDP, length 113
03:45:16.162251 IP node4.55446 > node2.44278: UDP, length 78
03:45:16.164577 IP node4.42409 > node2.54620: UDP, length 113
03:45:16.168228 IP node4.51453 > node2.54620: UDP, length 113
03:45:16.169134 IP node4.51545 > node2.54620: UDP, length 113
03:45:16.176349 IP node4.58434 > node2.54620: UDP, length 113
03:45:16.194471 IP node4.47308 > node3.48649: UDP, length 113
03:45:16.194701 IP node4.47308 > node2.37614: UDP, length 113
03:45:16.194886 IP node4.47308 > node3.55023: UDP, length 113
03:45:16.196854 IP node4.47204 > node2.44278: UDP, length 94
03:45:16.197001 IP node4.47204 > node3.48649: UDP, length 113
03:45:16.197118 IP node4.47204 > node2.37614: UDP, length 113
03:45:16.197154 IP node4.47204 > node2.33901: UDP, length 113
03:45:16.197240 IP node4.47204 > node2.53863: UDP, length 113
03:45:16.197329 IP node4.47204 > node2.42304: UDP, length 113
03:45:16.197367 IP node4.47308 > node3.33216: UDP, length 113
03:45:16.197463 IP node4.47204 > node2.33869: UDP, length 113
03:45:16.197508 IP node4.47204 > node2.44881: UDP, length 113
03:45:16.197583 IP node4.47204 > node2.49754: UDP, length 113
03:45:16.197655 IP node4.47204 > node3.55313: UDP, length 113
03:45:16.197768 IP node4.47204 > node2.59900: UDP, length 113
03:45:16.197823 IP node4.47204 > node3.53645: UDP, length 113
03:45:16.198191 IP node4.47204 > node2.43732: UDP, length 113
03:45:16.198344 IP node4.47204 > node3.33216: UDP, length 113
03:45:16.198502 IP node4.47204 > node3.47674: UDP, length 113
03:45:16.198577 IP node4.47204 > node3.33707: UDP, length 113
03:45:16.198649 IP node4.47204 > node3.39256: UDP, length 113
03:45:16.198722 IP node4.47204 > node2.58597: UDP, length 113
03:45:16.198790 IP node4.47204 > node3.55023: UDP, length 113
03:45:16.199519 IP node4.47308 > node2.53863: UDP, length 113
03:45:16.199640 IP node4.47308 > node2.49754: UDP, length 113
03:45:16.199744 IP node4.47308 > node2.58597: UDP, length 113
03:45:16.201351 IP node4.47308 > node2.33869: UDP, length 113
03:45:16.201486 IP node4.47308 > node3.47674: UDP, length 113
03:45:16.202899 IP node4.47308 > node2.33901: UDP, length 113
03:45:16.204540 IP node4.47308 > node2.43732: UDP, length 113
03:45:16.204760 IP node4.47308 > node3.33707: UDP, length 113
03:45:16.204870 IP node4.47308 > node3.55313: UDP, length 113
03:45:16.204982 IP node4.47308 > node2.59900: UDP, length 113
03:45:16.205087 IP node4.47308 > node3.53645: UDP, length 113
03:45:16.209451 IP node4.47308 > node2.44881: UDP, length 113
03:45:16.209707 IP node4.47308 > node3.39256: UDP, length 113
03:45:16.210093 IP node4.47308 > node2.44832: UDP, length 113
03:45:16.210335 IP node4.47308 > node2.54620: UDP, length 113
03:45:16.239604 IP node4.59050 > node2.33434: UDP, length 113
03:45:16.239805 IP node4.42817 > node2.33434: UDP, length 113
03:45:16.240549 IP node4.45910 > node2.33434: UDP, length 113
03:45:16.240788 IP node4.36649 > node2.33434: UDP, length 113
03:45:16.241199 IP node4.55298 > node2.33434: UDP, length 113
03:45:16.241451 IP node4.43535 > node2.33434: UDP, length 113
03:45:16.242523 IP node4.39087 > node2.33434: UDP, length 113
03:45:16.242889 IP node4.44488 > node2.33434: UDP, length 113
03:45:16.243199 IP node4.51545 > node2.33434: UDP, length 113
03:45:16.243647 IP node4.51453 > node2.33434: UDP, length 113
03:45:16.245041 IP node4.35032 > node2.33434: UDP, length 112
03:45:16.247220 IP node4.42409 > node2.33434: UDP, length 113
03:45:16.262971 IP node4.47308 > node2.33434: UDP, length 113
03:45:16.283975 IP node4.58434 > node2.33434: UDP, length 113
03:45:16.301253 IP node4.55446 > node2.44278: UDP, length 78
03:45:16.303843 IP node4.47204 > node2.44832: UDP, length 113
