03:45:10.982648 IP node2.37029 > node2.36822: UDP, length 113
03:45:11.023858 IP node2.36822 > node2.37029: UDP, length 113
03:45:11.287747 IP node2.37029 > node2.50420: UDP, length 113
03:45:11.288217 IP node2.36822 > node2.50420: UDP, length 113
03:45:11.390708 IP node2.37029 > node2.45176: UDP, length 113
03:45:11.391011 IP node2.45176 > node2.36822: UDP, length 113
03:45:11.391587 IP node2.45176 > node2.50420: UDP, length 113
03:45:11.392515 IP node2.45176 > node2.37029: UDP, length 113
03:45:11.451442 IP node2.37029 > node2.35476: UDP, length 113
03:45:11.455952 IP node2.45176 > node2.35476: UDP, length 113
03:45:11.514112 IP node2.37029 > node2.50822: UDP, length 113
03:45:11.532636 IP node2.45176 > node2.50822: UDP, length 113
03:45:11.574467 IP node2.50420 > node2.36822: UDP, length 113
03:45:11.593593 IP node2.50420 > node2.37029: UDP, length 113
03:45:11.593832 IP node2.50420 > node2.45176: UDP, length 113
03:45:11.593832 IP node2.50420 > node2.35476: UDP, length 113
03:45:11.593950 IP node2.50420 > node2.50822: UDP, length 113
03:45:11.604154 IP node2.50822 > node2.50420: UDP, length 113
03:45:11.604679 IP node2.50822 > node2.45176: UDP, length 113
03:45:11.604965 IP node2.50822 > node2.35476: UDP, length 113
03:45:11.634066 IP node2.35476 > node2.37029: UDP, length 113
03:45:11.634160 IP node2.35476 > node2.45176: UDP, length 113
03:45:11.634219 IP node2.35476 > node2.50420: UDP, length 113
03:45:11.634295 IP node2.35476 > node2.36822: UDP, length 113
03:45:11.634353 IP node2.35476 > node2.50822: UDP, length 113
03:45:11.714573 IP node2.35476 > node2.34103: UDP, length 113
03:45:11.714573 IP node2.45176 > node2.34103: UDP, length 113
03:45:11.714830 IP node2.37029 > node2.34103: UDP, length 113
03:45:11.715264 IP node2.50420 > node2.34103: UDP, length 113
03:45:11.716377 IP node2.34103 > node2.50420: UDP, length 113
03:45:11.716479 IP node2.50822 > node2.34103: UDP, length 113
03:45:11.716881 IP node2.34103 > node2.35476: UDP, length 113
03:45:11.717214 IP node2.34103 > node2.50822: UDP, length 113
03:45:11.736810 IP node2.34103 > node2.45176: UDP, length 113
03:45:11.749425 IP node2.50822 > node2.39954: UDP, length 113
03:45:11.750333 IP node2.37029 > node2.39954: UDP, length 113
03:45:11.750514 IP node2.39954 > node2.36822: UDP, length 113
03:45:11.750559 IP node2.45176 > node2.39954: UDP, length 113
03:45:11.751719 IP node2.35476 > node2.39954: UDP, length 113
03:45:11.752049 IP node2.50420 > node2.39954: UDP, length 113
03:45:11.752496 IP node2.36822 > node2.39954: UDP, length 113
03:45:11.752565 IP node2.36822 > node2.35476: UDP, length 113
03:45:11.752632 IP node2.36822 > node2.50822: UDP, length 113
03:45:11.752684 IP node2.36822 > node2.34103: UDP, length 113
03:45:11.753295 IP node2.34103 > node2.39954: UDP, length 113
03:45:11.761116 IP node2.39954 > node2.50420: UDP, length 113
03:45:11.761535 IP node2.39954 > node2.45176: UDP, length 113
03:45:11.761737 IP node2.39954 > node2.35476: UDP, length 113
03:45:11.762172 IP node2.39954 > node2.50822: UDP, length 113
03:45:11.762353 IP node2.39954 > node2.34103: UDP, length 113
03:45:11.788237 IP node2.39954 > node2.37029: UDP, length 113
03:45:12.034023 IP node2.39954 > node2.42304: UDP, length 113
03:45:12.034032 IP node2.35476 > node2.42304: UDP, length 113
03:45:12.034153 IP node2.34103 > node2.42304: UDP, length 113
03:45:12.034637 IP node2.36822 > node2.42304: UDP, length 113
03:45:12.035595 IP node2.37029 > node2.42304: UDP, length 113
03:45:12.035736 IP node2.45176 > node2.42304: UDP, length 113
03:45:12.036010 IP node2.50420 > node2.42304: UDP, length 113
03:45:12.036223 IP node2.50822 > node2.42304: UDP, length 113
03:45:12.121907 IP node2.34103 > node2.60168: UDP, length 113
03:45:12.123684 IP node2.36822 > node2.60168: UDP, length 113
03:45:12.123768 IP node2.39954 > node2.60168: UDP, length 113
03:45:12.123928 IP node2.50822 > node2.60168: UDP, length 113
03:45:12.123931 IP node2.35476 > node2.60168: UDP, length 113
03:45:12.124000 IP node2.37029 > node2.60168: UDP, length 113
03:45:12.124253 IP node2.45176 > node2.60168: UDP, length 113
03:45:12.127233 IP node2.50420 > node2.60168: UDP, length 113
03:45:12.147729 IP node2.35476 > node2.33273: UDP, length 113
03:45:12.147729 IP node2.39954 > node2.33273: UDP, length 113
03:45:12.147998 IP node2.34103 > node2.33273: UDP, length 113
03:45:12.149680 IP node2.36822 > node2.33273: UDP, length 113
03:45:12.150598 IP node2.50822 > node2.33273: UDP, length 113
03:45:12.151002 IP node2.45176 > node2.33273: UDP, length 113
03:45:12.151619 IP node2.37029 > node2.33273: UDP, length 113
03:45:12.153114 IP node2.50420 > node2.33273: UDP, length 113
03:45:12.197021 IP node2.42304 > node2.35476: UDP, length 113
03:45:12.197324 IP node2.42304 > node2.50822: UDP, length 113
03:45:12.197611 IP node2.42304 > node2.34103: UDP, length 113
03:45:12.199430 IP node2.35476 > node2.50082: UDP, length 113
03:45:12.200512 IP node2.50420 > node2.50082: UDP, length 113
03:45:12.200761 IP node2.34103 > node2.50082: UDP, length 113
03:45:12.201523 IP node2.42304 > node2.39954: UDP, length 113
03:45:12.201822 IP node2.42304 > node2.60168: UDP, length 113
03:45:12.202117 IP node2.42304 > node2.33273: UDP, length 113
03:45:12.202189 IP node2.42304 > node2.50082: UDP, length 113
03:45:12.204427 IP node2.45176 > node2.50082: UDP, length 113
03:45:12.204593 IP node2.50822 > node2.50082: UDP, length 113
03:45:12.204912 IP node2.37029 > node2.50082: UDP, length 113
03:45:12.207955 IP node2.36822 > node2.50082: UDP, length 113
03:45:12.214129 IP node2.39954 > node2.50082: UDP, length 113
03:45:12.245579 IP node2.35476 > node2.47183: UDP, length 113
03:45:12.245688 IP node2.34103 > node2.47183: UDP, length 113
03:45:12.247780 IP node2.39954 > node2.47183: UDP, length 113
03:45:12.248041 IP node2.36822 > node2.47183: UDP, length 113
03:45:12.248301 IP node2.50420 > node2.47183: UDP, length 113
03:45:12.249011 IP node2.37029 > node2.47183: UDP, length 113
03:45:12.250300 IP node2.45176 > node2.47183: UDP, length 113
03:45:12.250767 IP node2.50822 > node2.47183: UDP, length 113
03:45:12.252192 IP node2.42304 > node2.47183: UDP, length 113
03:45:12.264228 IP node2.60168 > node2.50822: UDP, length 113
03:45:12.266442 IP node2.60168 > node2.34103: UDP, length 113
03:45:12.268804 IP node2.60168 > node2.39954: UDP, length 113
03:45:12.269052 IP node2.60168 > node2.42304: UDP, length 113
03:45:12.274064 IP node2.60168 > node2.33273: UDP, length 113
03:45:12.274299 IP node2.60168 > node2.50082: UDP, length 113
03:45:12.285228 IP node2.50822 > node2.35425: UDP, length 113
03:45:12.286257 IP node2.34103 > node2.35425: UDP, length 113
03:45:12.286839 IP node2.36822 > node2.35425: UDP, length 113
03:45:12.286881 IP node2.37029 > node2.35425: UDP, length 113
03:45:12.287765 IP node2.50420 > node2.35425: UDP, length 113
03:45:12.288554 IP node2.39954 > node2.35425: UDP, length 113
03:45:12.288617 IP node2.45176 > node2.35425: UDP, length 113
03:45:12.289635 IP node2.35476 > node2.35425: UDP, length 113
03:45:12.291543 IP node2.35425 > node2.35476: UDP, length 113
03:45:12.292050 IP node2.35425 > node2.34103: UDP, length 113
03:45:12.296270 IP node2.42304 > node2.35425: UDP, length 113
03:45:12.299186 IP node2.33273 > node2.50822: UDP, length 113
03:45:12.300378 IP node2.33273 > node2.34103: UDP, length 113
03:45:12.300601 IP node2.33273 > node2.39954: UDP, length 113
03:45:12.300840 IP node2.33273 > node2.42304: UDP, length 113
03:45:12.302516 IP node2.33273 > node2.35476: UDP, length 113
03:45:12.303572 IP node2.33273 > node2.60168: UDP, length 113
03:45:12.304133 IP node2.33273 > node2.50082: UDP, length 113
03:45:12.304429 IP node2.35425 > node2.42304: UDP, length 113
03:45:12.304649 IP node2.35425 > node2.39954: UDP, length 113
03:45:12.304760 IP node2.35425 > node2.50822: UDP, length 113
03:45:12.304870 IP node2.35425 > node2.33273: UDP, length 113
03:45:12.304935 IP node2.35425 > node2.60168: UDP, length 113
03:45:12.305621 IP node2.35425 > node2.50082: UDP, length 113
03:45:12.308779 IP node2.36822 > node2.46051: UDP, length 113
03:45:12.310034 IP node2.50822 > node2.46051: UDP, length 113
03:45:12.310071 IP node2.39954 > node2.46051: UDP, length 113
03:45:12.310217 IP node2.45176 > node2.46051: UDP, length 113
03:45:12.310232 IP node2.35476 > node2.46051: UDP, length 113
03:45:12.310311 IP node2.37029 > node2.46051: UDP, length 113
03:45:12.311683 IP node2.34103 > node2.46051: UDP, length 113
03:45:12.312718 IP node2.50420 > node2.46051: UDP, length 113
03:45:12.313448 IP node2.42304 > node2.46051: UDP, length 113
03:45:12.318285 IP node2.60168 > node2.47183: UDP, length 113
03:45:12.318677 IP node2.35425 > node2.46051: UDP, length 113
03:45:12.319760 IP node2.60168 > node2.35425: UDP, length 113
03:45:12.320347 IP node2.60168 > node2.46051: UDP, length 113
03:45:12.327311 IP node2.47183 > node2.34103: UDP, length 113
03:45:12.329673 IP node2.47183 > node2.39954: UDP, length 113
03:45:12.331527 IP node2.33273 > node2.35425: UDP, length 113
03:45:12.332090 IP node2.47183 > node2.42304: UDP, length 113
03:45:12.332340 IP node2.47183 > node2.60168: UDP, length 113
03:45:12.333120 IP node2.47183 > node2.33273: UDP, length 113
03:45:12.333715 IP node2.47183 > node2.50082: UDP, length 113
03:45:12.333923 IP node2.47183 > node2.35425: UDP, length 113
03:45:12.335101 IP node2.47183 > node2.46051: UDP, length 113
03:45:12.337120 IP node2.35425 > node2.47183: UDP, length 113
03:45:12.371797 IP node2.33273 > node2.47183: UDP, length 113
03:45:12.372135 IP node2.33273 > node2.46051: UDP, length 113
03:45:12.386872 IP node2.50082 > node2.34103: UDP, length 112
03:45:12.386992 IP node2.50082 > node2.42304: UDP, length 112
03:45:12.387072 IP node2.50082 > node2.39954: UDP, length 112
03:45:12.389798 IP node2.50082 > node2.47183: UDP, length 112
03:45:12.389918 IP node2.50082 > node2.33273: UDP, length 112
03:45:12.389985 IP node2.50082 > node2.35425: UDP, length 112
03:45:12.390069 IP node2.50082 > node2.46051: UDP, length 112
03:45:12.390131 IP node2.50082 > node2.60168: UDP, length 112
03:45:12.448597 IP node2.46051 > node2.50822: UDP, length 113
03:45:12.448879 IP node2.46051 > node2.34103: UDP, length 113
03:45:12.449211 IP node2.46051 > node2.39954: UDP, length 113
03:45:12.449481 IP node2.46051 > node2.42304: UDP, length 113
03:45:12.449836 IP node2.46051 > node2.60168: UDP, length 113
03:45:12.450136 IP node2.46051 > node2.33273: UDP, length 113
03:45:12.450441 IP node2.46051 > node2.50082: UDP, length 113
03:45:12.450739 IP node2.46051 > node2.47183: UDP, length 113
03:45:12.451047 IP node2.46051 > node2.35425: UDP, length 113
03:45:12.478835 IP node2.42304 > node2.37614: UDP, length 113
03:45:12.478881 IP node2.50822 > node2.37614: UDP, length 113
03:45:12.479111 IP node2.34103 > node2.37614: UDP, length 113
03:45:12.479579 IP node2.45176 > node2.37614: UDP, length 113
03:45:12.479755 IP node2.50420 > node2.37614: UDP, length 113
03:45:12.480089 IP node2.36822 > node2.37614: UDP, length 113
03:45:12.480089 IP node2.39954 > node2.37614: UDP, length 113
03:45:12.480157 IP node2.37029 > node2.37614: UDP, length 113
03:45:12.480224 IP node2.35476 > node2.37614: UDP, length 113
03:45:12.481289 IP node2.60168 > node2.37614: UDP, length 113
03:45:12.481755 IP node2.47183 > node2.37614: UDP, length 113
03:45:12.483790 IP node2.33273 > node2.37614: UDP, length 113
03:45:12.483870 IP node2.35425 > node2.37614: UDP, length 113
03:45:12.495735 IP node2.46051 > node2.37614: UDP, length 113
03:45:12.498128 IP node2.50082 > node2.37614: UDP, length 112
03:45:12.516185 IP node2.37614 > node2.34103: UDP, length 113
03:45:12.517117 IP node2.37614 > node2.42304: UDP, length 113
03:45:12.517688 IP node2.37614 > node2.60168: UDP, length 113
03:45:12.517943 IP node2.37614 > node2.33273: UDP, length 113
03:45:12.518693 IP node2.37614 > node2.50082: UDP, length 113
03:45:12.518945 IP node2.37614 > node2.47183: UDP, length 113
03:45:12.519247 IP node2.37614 > node2.35425: UDP, length 113
03:45:12.519532 IP node2.37614 > node2.46051: UDP, length 113
03:45:12.523084 IP node2.37614 > node2.39954: UDP, length 113
03:45:12.568891 IP node2.36822 > node2.44278: UDP, length 113
03:45:12.569224 IP node2.45176 > node2.44278: UDP, length 113
03:45:12.569894 IP node2.50420 > node2.44278: UDP, length 113
03:45:12.570306 IP node2.37029 > node2.44278: UDP, length 113
03:45:12.570590 IP node2.33273 > node2.44278: UDP, length 113
03:45:12.570889 IP node2.60168 > node2.44278: UDP, length 113
03:45:12.571246 IP node2.50822 > node2.44278: UDP, length 113
03:45:12.571321 IP node2.42304 > node2.44278: UDP, length 113
03:45:12.571531 IP node2.35425 > node2.44278: UDP, length 113
03:45:12.571578 IP node2.39954 > node2.44278: UDP, length 113
03:45:12.571757 IP node2.35476 > node2.44278: UDP, length 113
03:45:12.571887 IP node2.47183 > node2.44278: UDP, length 113
03:45:12.572037 IP node2.46051 > node2.44278: UDP, length 113
03:45:12.572117 IP node2.34103 > node2.44278: UDP, length 113
03:45:12.573323 IP node2.44278 > node2.42304: UDP, length 113
03:45:12.573611 IP node2.44278 > node2.33273: UDP, length 113
03:45:12.573840 IP node2.44278 > node2.50082: UDP, length 113
03:45:12.574160 IP node2.44278 > node2.47183: UDP, length 113
03:45:12.574376 IP node2.44278 > node2.35425: UDP, length 113
03:45:12.574601 IP node2.44278 > node2.46051: UDP, length 113
03:45:12.575187 IP node2.44278 > node2.37614: UDP, length 113
03:45:12.575750 IP node2.50082 > node2.44278: UDP, length 112
03:45:12.576917 IP node2.37614 > node2.44278: UDP, length 113
03:45:12.599884 IP node2.44278 > node2.60168: UDP, length 113
03:45:12.740367 IP node2.49754 > node2.47183: UDP, length 113
03:45:12.743282 IP node2.50420 > node2.49754: UDP, length 113
03:45:12.743556 IP node2.42304 > node2.49754: UDP, length 113
03:45:12.743873 IP node2.34103 > node2.49754: UDP, length 113
03:45:12.744033 IP node2.47183 > node2.49754: UDP, length 113
03:45:12.744291 IP node2.39954 > node2.49754: UDP, length 113
03:45:12.744407 IP node2.35476 > node2.49754: UDP, length 113
03:45:12.745276 IP node2.44278 > node2.49754: UDP, length 113
03:45:12.746101 IP node2.37029 > node2.49754: UDP, length 113
03:45:12.746339 IP node2.46051 > node2.49754: UDP, length 113
03:45:12.746565 IP node2.35425 > node2.49754: UDP, length 113
03:45:12.746600 IP node2.45176 > node2.49754: UDP, length 113
03:45:12.746756 IP node2.36822 > node2.49754: UDP, length 113
03:45:12.748022 IP node2.49754 > node2.50082: UDP, length 113
03:45:12.748022 IP node2.33273 > node2.49754: UDP, length 113
03:45:12.748461 IP node2.50082 > node2.49754: UDP, length 112
03:45:12.748721 IP node2.37614 > node2.49754: UDP, length 113
03:45:12.748806 IP node2.49754 > node2.35425: UDP, length 113
03:45:12.748974 IP node2.60168 > node2.49754: UDP, length 113
03:45:12.749066 IP node2.50822 > node2.49754: UDP, length 113
03:45:12.749611 IP node2.49754 > node2.46051: UDP, length 113
03:45:12.751789 IP node2.49754 > node2.60168: UDP, length 113
03:45:12.751904 IP node2.49754 > node2.37614: UDP, length 113
03:45:12.770444 IP node2.49754 > node2.33273: UDP, length 113
03:45:12.773610 IP node2.50822 > node2.58597: UDP, length 113
03:45:12.773613 IP node2.45176 > node2.58597: UDP, length 113
03:45:12.774216 IP node2.35425 > node2.58597: UDP, length 113
03:45:12.775274 IP node2.36822 > node2.58597: UDP, length 113
03:45:12.775521 IP node2.60168 > node2.58597: UDP, length 113
03:45:12.776181 IP node2.33273 > node2.58597: UDP, length 113
03:45:12.776467 IP node2.58597 > node2.60168: UDP, length 113
03:45:12.776516 IP node2.50420 > node2.58597: UDP, length 113
03:45:12.776735 IP node2.37029 > node2.58597: UDP, length 113
03:45:12.777025 IP node2.37614 > node2.58597: UDP, length 113
03:45:12.777355 IP node2.49754 > node2.44278: UDP, length 113
03:45:12.778167 IP node2.47183 > node2.58597: UDP, length 113
03:45:12.778677 IP node2.42304 > node2.58597: UDP, length 113
03:45:12.779004 IP node2.34103 > node2.58597: UDP, length 113
03:45:12.779163 IP node2.50082 > node2.58597: UDP, length 112
03:45:12.779163 IP node2.35476 > node2.58597: UDP, length 113
03:45:12.779379 IP node2.39954 > node2.58597: UDP, length 113
03:45:12.781339 IP node2.46051 > node2.58597: UDP, length 113
03:45:12.781597 IP node2.44278 > node2.58597: UDP, length 113
03:45:12.795213 IP node2.49754 > node2.58597: UDP, length 113
03:45:12.799898 IP node2.58597 > node2.33273: UDP, length 113
03:45:12.799988 IP node2.58597 > node2.50082: UDP, length 113
03:45:12.801656 IP node2.58597 > node2.35425: UDP, length 113
03:45:12.802913 IP node2.58597 > node2.46051: UDP, length 113
03:45:12.803132 IP node2.58597 > node2.37614: UDP, length 113
03:45:12.803351 IP node2.58597 > node2.44278: UDP, length 113
03:45:12.803763 IP node2.58597 > node2.49754: UDP, length 113
03:45:12.804741 IP node2.50822 > node2.53863: UDP, length 113
03:45:12.805525 IP node2.33273 > node2.53863: UDP, length 113
03:45:12.807182 IP node2.35425 > node2.53863: UDP, length 113
03:45:12.807336 IP node2.58597 > node2.53863: UDP, length 113
03:45:12.807397 IP node2.58597 > node2.47183: UDP, length 113
03:45:12.807583 IP node2.45176 > node2.53863: UDP, length 113
03:45:12.807685 IP node2.60168 > node2.53863: UDP, length 113
03:45:12.807758 IP node2.36822 > node2.53863: UDP, length 113
03:45:12.807970 IP node2.37029 > node2.53863: UDP, length 113
03:45:12.808206 IP node2.37614 > node2.53863: UDP, length 113
03:45:12.808499 IP node2.50082 > node2.53863: UDP, length 112
03:45:12.809474 IP node2.35476 > node2.53863: UDP, length 113
03:45:12.809613 IP node2.46051 > node2.53863: UDP, length 113
03:45:12.809826 IP node2.50420 > node2.53863: UDP, length 113
03:45:12.810304 IP node2.34103 > node2.53863: UDP, length 113
03:45:12.810781 IP node2.42304 > node2.53863: UDP, length 113
03:45:12.811072 IP node2.39954 > node2.53863: UDP, length 113
03:45:12.811289 IP node2.47183 > node2.53863: UDP, length 113
03:45:12.811463 IP node2.53863 > node2.60168: UDP, length 112
03:45:12.812639 IP node2.44278 > node2.53863: UDP, length 113
03:45:12.815744 IP node2.49754 > node2.53863: UDP, length 113
03:45:12.817502 IP node2.53863 > node2.33273: UDP, length 112
03:45:12.818823 IP node2.53863 > node2.50082: UDP, length 112
03:45:12.819389 IP node2.53863 > node2.47183: UDP, length 112
03:45:12.821481 IP node2.53863 > node2.35425: UDP, length 112
03:45:12.822640 IP node2.53863 > node2.46051: UDP, length 112
03:45:12.822857 IP node2.53863 > node2.37614: UDP, length 112
03:45:12.842061 IP node2.53863 > node2.49754: UDP, length 112
03:45:12.842298 IP node2.53863 > node2.58597: UDP, length 112
03:45:12.851765 IP node2.35425 > node2.33901: UDP, length 113
03:45:12.852381 IP node2.45176 > node2.33901: UDP, length 113
03:45:12.852427 IP node2.36822 > node2.33901: UDP, length 113
03:45:12.852741 IP node2.50822 > node2.33901: UDP, length 113
03:45:12.853421 IP node2.37029 > node2.33901: UDP, length 113
03:45:12.853498 IP node2.33273 > node2.33901: UDP, length 113
03:45:12.853692 IP node2.60168 > node2.33901: UDP, length 113
03:45:12.853702 IP node2.50420 > node2.33901: UDP, length 113
03:45:12.853757 IP node2.50082 > node2.33901: UDP, length 112
03:45:12.853757 IP node2.39954 > node2.33901: UDP, length 113
03:45:12.853859 IP node2.37614 > node2.33901: UDP, length 113
03:45:12.853939 IP node2.35476 > node2.33901: UDP, length 113
03:45:12.854116 IP node2.34103 > node2.33901: UDP, length 113
03:45:12.854275 IP node2.46051 > node2.33901: UDP, length 113
03:45:12.854304 IP node2.42304 > node2.33901: UDP, length 113
03:45:12.854515 IP node2.44278 > node2.33901: UDP, length 113
03:45:12.854683 IP node2.47183 > node2.33901: UDP, length 113
03:45:12.856122 IP node2.49754 > node2.33901: UDP, length 113
03:45:12.857418 IP node2.53863 > node2.44278: UDP, length 112
03:45:12.864907 IP node2.33901 > node2.60168: UDP, length 113
03:45:12.865175 IP node2.33901 > node2.33273: UDP, length 113
03:45:12.865662 IP node2.33901 > node2.50082: UDP, length 113
03:45:12.866446 IP node2.33901 > node2.47183: UDP, length 113
03:45:12.872155 IP node2.58597 > node2.33901: UDP, length 113
03:45:12.878126 IP node2.53863 > node2.33901: UDP, length 112
03:45:12.885222 IP node2.33901 > node2.42304: UDP, length 113
03:45:12.934122 IP node2.33869 > node2.33273: UDP, length 113
03:45:12.934670 IP node2.33869 > node2.47183: UDP, length 113
03:45:12.934822 IP node2.50082 > node2.33869: UDP, length 112
03:45:12.935039 IP node2.45176 > node2.33869: UDP, length 113
03:45:12.935039 IP node2.33273 > node2.33869: UDP, length 113
03:45:12.935039 IP node2.60168 > node2.33869: UDP, length 113
03:45:12.935544 IP node2.37614 > node2.33869: UDP, length 113
03:45:12.936360 IP node2.33869 > node2.35425: UDP, length 113
03:45:12.936476 IP node2.50420 > node2.33869: UDP, length 113
03:45:12.936983 IP node2.50822 > node2.33869: UDP, length 113
03:45:12.937265 IP node2.33869 > node2.46051: UDP, length 113
03:45:12.938043 IP node2.33869 > node2.37614: UDP, length 113
03:45:12.938507 IP node2.33869 > node2.44278: UDP, length 113
03:45:12.938799 IP node2.33869 > node2.49754: UDP, length 113
03:45:12.939458 IP node2.33869 > node2.58597: UDP, length 113
03:45:12.939720 IP node2.33869 > node2.53863: UDP, length 113
03:45:12.939818 IP node2.46051 > node2.33869: UDP, length 113
03:45:12.941382 IP node2.47183 > node2.33869: UDP, length 113
03:45:12.941518 IP node2.37029 > node2.33869: UDP, length 113
03:45:12.941671 IP node2.49754 > node2.33869: UDP, length 113
03:45:12.941885 IP node2.44278 > node2.33869: UDP, length 113
03:45:12.942035 IP node2.35425 > node2.33869: UDP, length 113
03:45:12.942370 IP node2.42304 > node2.33869: UDP, length 113
03:45:12.942870 IP node2.34103 > node2.33869: UDP, length 113
03:45:12.942992 IP node2.36822 > node2.33869: UDP, length 113
03:45:12.943997 IP node2.35476 > node2.33869: UDP, length 113
03:45:12.944644 IP node2.33869 > node2.33901: UDP, length 113
03:45:12.944807 IP node2.33869 > node2.50082: UDP, length 113
03:45:12.945758 IP node2.39954 > node2.33869: UDP, length 113
03:45:12.946467 IP node2.58597 > node2.33869: UDP, length 113
03:45:12.948031 IP node2.53863 > node2.33869: UDP, length 112
03:45:12.948669 IP node2.33901 > node2.35425: UDP, length 113
03:45:12.949409 IP node2.33901 > node2.46051: UDP, length 113
03:45:12.950280 IP node2.33901 > node2.37614: UDP, length 113
03:45:12.950485 IP node2.33901 > node2.44278: UDP, length 113
03:45:12.951331 IP node2.33901 > node2.49754: UDP, length 113
03:45:12.951523 IP node2.33901 > node2.58597: UDP, length 113
03:45:12.951758 IP node2.33901 > node2.53863: UDP, length 113
03:45:12.954238 IP node2.33901 > node2.33869: UDP, length 113
03:45:13.022487 IP node2.37614 > node2.43732: UDP, length 113
03:45:13.023037 IP node2.49754 > node2.43732: UDP, length 113
03:45:13.023216 IP node2.50420 > node2.43732: UDP, length 113
03:45:13.023311 IP node2.45176 > node2.43732: UDP, length 113
03:45:13.023519 IP node2.50822 > node2.43732: UDP, length 113
03:45:13.023836 IP node2.37029 > node2.43732: UDP, length 113
03:45:13.023957 IP node2.53863 > node2.43732: UDP, length 112
03:45:13.024406 IP node2.36822 > node2.43732: UDP, length 113
03:45:13.024406 IP node2.42304 > node2.43732: UDP, length 113
03:45:13.024684 IP node2.46051 > node2.43732: UDP, length 113
03:45:13.024778 IP node2.44278 > node2.43732: UDP, length 113
03:45:13.024797 IP node2.39954 > node2.43732: UDP, length 113
03:45:13.025071 IP node2.33273 > node2.43732: UDP, length 113
03:45:13.025071 IP node2.35476 > node2.43732: UDP, length 113
03:45:13.025337 IP node2.33901 > node2.43732: UDP, length 113
03:45:13.025622 IP node2.60168 > node2.43732: UDP, length 113
03:45:13.025622 IP node2.34103 > node2.43732: UDP, length 113
03:45:13.026483 IP node2.35425 > node2.43732: UDP, length 113
03:45:13.026638 IP node2.50082 > node2.43732: UDP, length 112
03:45:13.026769 IP node2.33869 > node2.43732: UDP, length 113
03:45:13.026877 IP node2.47183 > node2.43732: UDP, length 113
03:45:13.027714 IP node2.58597 > node2.43732: UDP, length 113
03:45:13.167249 IP node2.43732 > node2.37614: UDP, length 113
03:45:13.211230 IP node2.43732 > node2.44278: UDP, length 113
03:45:13.228480 IP node2.43732 > node2.49754: UDP, length 113
03:45:13.228782 IP node2.43732 > node2.58597: UDP, length 113
03:45:13.229016 IP node2.43732 > node2.53863: UDP, length 113
03:45:13.229255 IP node2.43732 > node2.33901: UDP, length 113
03:45:13.229567 IP node2.43732 > node2.33869: UDP, length 113
03:45:13.235890 IP node2.47183 > node2.59900: UDP, length 113
03:45:13.236050 IP node2.35425 > node2.59900: UDP, length 113
03:45:13.236315 IP node2.33273 > node2.59900: UDP, length 113
03:45:13.239916 IP node2.34103 > node2.59900: UDP, length 113
03:45:13.239916 IP node2.50420 > node2.59900: UDP, length 113
03:45:13.240499 IP node2.44278 > node2.59900: UDP, length 113
03:45:13.241776 IP node2.50082 > node2.59900: UDP, length 112
03:45:13.242632 IP node2.58597 > node2.59900: UDP, length 113
03:45:13.246224 IP node2.37614 > node2.59900: UDP, length 113
03:45:13.249348 IP node2.60168 > node2.59900: UDP, length 113
03:45:13.249551 IP node2.45176 > node2.59900: UDP, length 113
03:45:13.249942 IP node2.42304 > node2.59900: UDP, length 113
03:45:13.249942 IP node2.37029 > node2.59900: UDP, length 113
03:45:13.251144 IP node2.50822 > node2.59900: UDP, length 113
03:45:13.252955 IP node2.33901 > node2.59900: UDP, length 113
03:45:13.253216 IP node2.35476 > node2.59900: UDP, length 113
03:45:13.253603 IP node2.36822 > node2.59900: UDP, length 113
03:45:13.254058 IP node2.49754 > node2.59900: UDP, length 113
03:45:13.255697 IP node2.46051 > node2.59900: UDP, length 113
03:45:13.259892 IP node2.53863 > node2.59900: UDP, length 112
03:45:13.262173 IP node2.33869 > node2.59900: UDP, length 113
03:45:13.267175 IP node2.43732 > node2.59900: UDP, length 113
03:45:13.287850 IP node2.39954 > node2.59900: UDP, length 113
03:45:13.306426 IP node2.35425 > node2.44832: UDP, length 113
03:45:13.306665 IP node2.45176 > node2.44832: UDP, length 113
03:45:13.306844 IP node2.33273 > node2.44832: UDP, length 113
03:45:13.307075 IP node2.60168 > node2.44832: UDP, length 113
03:45:13.307223 IP node2.37614 > node2.44832: UDP, length 113
03:45:13.307470 IP node2.50822 > node2.44832: UDP, length 113
03:45:13.307706 IP node2.36822 > node2.44832: UDP, length 113
03:45:13.307889 IP node2.50082 > node2.44832: UDP, length 112
03:45:13.308712 IP node2.50420 > node2.44832: UDP, length 113
03:45:13.308852 IP node2.53863 > node2.44832: UDP, length 112
03:45:13.308921 IP node2.46051 > node2.44832: UDP, length 113
03:45:13.308921 IP node2.37029 > node2.44832: UDP, length 113
03:45:13.309025 IP node2.49754 > node2.44832: UDP, length 113
03:45:13.309042 IP node2.47183 > node2.44832: UDP, length 113
03:45:13.309062 IP node2.44278 > node2.44832: UDP, length 113
03:45:13.309182 IP node2.33901 > node2.44832: UDP, length 113
03:45:13.309375 IP node2.58597 > node2.44832: UDP, length 113
03:45:13.309490 IP node2.33869 > node2.44832: UDP, length 113
03:45:13.310108 IP node2.43732 > node2.44832: UDP, length 113
03:45:13.310452 IP node2.42304 > node2.44832: UDP, length 113
03:45:13.310640 IP node2.34103 > node2.44832: UDP, length 113
03:45:13.310837 IP node2.39954 > node2.44832: UDP, length 113
03:45:13.310998 IP node2.35476 > node2.44832: UDP, length 113
03:45:13.311276 IP node2.44832 > node2.49754: UDP, length 111
03:45:13.315805 IP node2.44832 > node2.53863: UDP, length 111
03:45:13.316179 IP node2.44832 > node2.33901: UDP, length 111
03:45:13.316456 IP node2.44832 > node2.33869: UDP, length 111
03:45:13.316726 IP node2.44832 > node2.43732: UDP, length 111
03:45:13.317041 IP node2.44832 > node2.59900: UDP, length 111
03:45:13.319551 IP node2.44832 > node2.58597: UDP, length 111
03:45:13.333723 IP node2.50420 > node2.54620: UDP, length 113
03:45:13.333901 IP node2.33273 > node2.54620: UDP, length 113
03:45:13.333901 IP node2.50082 > node2.54620: UDP, length 112
03:45:13.334139 IP node2.37614 > node2.54620: UDP, length 113
03:45:13.334332 IP node2.35425 > node2.54620: UDP, length 113
03:45:13.334773 IP node2.50822 > node2.54620: UDP, length 113
03:45:13.335331 IP node2.47183 > node2.54620: UDP, length 113
03:45:13.335520 IP node2.58597 > node2.54620: UDP, length 113
03:45:13.335540 IP node2.60168 > node2.54620: UDP, length 113
03:45:13.335769 IP node2.42304 > node2.54620: UDP, length 113
03:45:13.335937 IP node2.34103 > node2.54620: UDP, length 113
03:45:13.335969 IP node2.46051 > node2.54620: UDP, length 113
03:45:13.336225 IP node2.53863 > node2.54620: UDP, length 112
03:45:13.336245 IP node2.39954 > node2.54620: UDP, length 113
03:45:13.336245 IP node2.45176 > node2.54620: UDP, length 113
03:45:13.336409 IP node2.33869 > node2.54620: UDP, length 113
03:45:13.336409 IP node2.35476 > node2.54620: UDP, length 113
03:45:13.336427 IP node2.36822 > node2.54620: UDP, length 113
03:45:13.336577 IP node2.49754 > node2.54620: UDP, length 113
03:45:13.336731 IP node2.44278 > node2.54620: UDP, length 113
03:45:13.336764 IP node2.37029 > node2.54620: UDP, length 113
03:45:13.337813 IP node2.33901 > node2.54620: UDP, length 113
03:45:13.338757 IP node2.43732 > node2.54620: UDP, length 113
03:45:13.340745 IP node2.54620 > node2.49754: UDP, length 113
03:45:13.341201 IP node2.54620 > node2.53863: UDP, length 113
03:45:13.343388 IP node2.54620 > node2.33901: UDP, length 113
03:45:13.343664 IP node2.54620 > node2.33869: UDP, length 113
03:45:13.344559 IP node2.54620 > node2.43732: UDP, length 113
03:45:13.344790 IP node2.54620 > node2.59900: UDP, length 113
03:45:13.345559 IP node2.54620 > node2.44832: UDP, length 113
03:45:13.357722 IP node2.54620 > node2.58597: UDP, length 113
03:45:13.362509 IP node2.44832 > node2.54620: UDP, length 111
03:45:13.362849 IP node2.59900 > node2.58597: UDP, length 113
03:45:13.363133 IP node2.59900 > node2.53863: UDP, length 113
03:45:13.363888 IP node2.59900 > node2.33901: UDP, length 113
03:45:13.364575 IP node2.59900 > node2.33869: UDP, length 113
03:45:13.364983 IP node2.59900 > node2.43732: UDP, length 113
03:45:13.365193 IP node2.59900 > node2.44832: UDP, length 113
03:45:13.365399 IP node2.59900 > node2.54620: UDP, length 113
03:45:13.375537 IP node2.50082 > node2.44881: UDP, length 112
03:45:13.375878 IP node2.60168 > node2.44881: UDP, length 113
03:45:13.376147 IP node2.33273 > node2.44881: UDP, length 113
03:45:13.376571 IP node2.35425 > node2.44881: UDP, length 113
03:45:13.376826 IP node2.44881 > node2.49754: UDP, length 113
03:45:13.377390 IP node2.50822 > node2.44881: UDP, length 113
03:45:13.378083 IP node2.50420 > node2.44881: UDP, length 113
03:45:13.378205 IP node2.37614 > node2.44881: UDP, length 113
03:45:13.378522 IP node2.46051 > node2.44881: UDP, length 113
03:45:13.378763 IP node2.34103 > node2.44881: UDP, length 113
03:45:13.378933 IP node2.33869 > node2.44881: UDP, length 113
03:45:13.378988 IP node2.42304 > node2.44881: UDP, length 113
03:45:13.379164 IP node2.43732 > node2.44881: UDP, length 113
03:45:13.379204 IP node2.39954 > node2.44881: UDP, length 113
03:45:13.379366 IP node2.33901 > node2.44881: UDP, length 113
03:45:13.380700 IP node2.44278 > node2.44881: UDP, length 113
03:45:13.380723 IP node2.37029 > node2.44881: UDP, length 113
03:45:13.381216 IP node2.45176 > node2.44881: UDP, length 113
03:45:13.381351 IP node2.53863 > node2.44881: UDP, length 112
03:45:13.381493 IP node2.47183 > node2.44881: UDP, length 113
03:45:13.381751 IP node2.36822 > node2.44881: UDP, length 113
03:45:13.381869 IP node2.44881 > node2.58597: UDP, length 113
03:45:13.382446 IP node2.58597 > node2.44881: UDP, length 113
03:45:13.382680 IP node2.44881 > node2.53863: UDP, length 113
03:45:13.382899 IP node2.44881 > node2.33901: UDP, length 113
03:45:13.383154 IP node2.44881 > node2.33869: UDP, length 113
03:45:13.383882 IP node2.59900 > node2.49754: UDP, length 113
03:45:13.383967 IP node2.44881 > node2.43732: UDP, length 113
03:45:13.384265 IP node2.44881 > node2.59900: UDP, length 113
03:45:13.384500 IP node2.44881 > node2.44832: UDP, length 113
03:45:13.384752 IP node2.44881 > node2.54620: UDP, length 113
03:45:13.384799 IP node2.35476 > node2.44881: UDP, length 113
03:45:13.385719 IP node2.49754 > node2.44881: UDP, length 113
03:45:13.390249 IP node2.44832 > node2.44881: UDP, length 111
03:45:13.396161 IP node2.54620 > node2.44881: UDP, length 113
03:45:13.402538 IP node2.59900 > node2.44881: UDP, length 113
03:45:13.410666 IP node2.35425 > node2.33434: UDP, length 113
03:45:13.410849 IP node2.60168 > node2.33434: UDP, length 113
03:45:13.410956 IP node2.36822 > node2.33434: UDP, length 113
03:45:13.410956 IP node2.50822 > node2.33434: UDP, length 113
03:45:13.411150 IP node2.33273 > node2.33434: UDP, length 113
03:45:13.411653 IP node2.45176 > node2.33434: UDP, length 113
03:45:13.412274 IP node2.46051 > node2.33434: UDP, length 113
03:45:13.412484 IP node2.44278 > node2.33434: UDP, length 113
03:45:13.412695 IP node2.33901 > node2.33434: UDP, length 113
03:45:13.412736 IP node2.37614 > node2.33434: UDP, length 113
03:45:13.412747 IP node2.39954 > node2.33434: UDP, length 113
03:45:13.412780 IP node2.50420 > node2.33434: UDP, length 113
03:45:13.412899 IP node2.33869 > node2.33434: UDP, length 113
03:45:13.412953 IP node2.35476 > node2.33434: UDP, length 113
03:45:13.413094 IP node2.53863 > node2.33434: UDP, length 112
03:45:13.413126 IP node2.50082 > node2.33434: UDP, length 112
03:45:13.413223 IP node2.34103 > node2.33434: UDP, length 113
03:45:13.413358 IP node2.37029 > node2.33434: UDP, length 113
03:45:13.413397 IP node2.43732 > node2.33434: UDP, length 113
03:45:13.413461 IP node2.42304 > node2.33434: UDP, length 113
03:45:13.413533 IP node2.58597 > node2.33434: UDP, length 113
03:45:13.413658 IP node2.47183 > node2.33434: UDP, length 113
03:45:13.414648 IP node2.49754 > node2.33434: UDP, length 113
03:45:13.415221 IP node2.44832 > node2.33434: UDP, length 111
03:45:13.415471 IP node2.54620 > node2.33434: UDP, length 113
03:45:13.415551 IP node2.33434 > node2.33901: UDP, length 113
03:45:13.416151 IP node2.44881 > node2.33434: UDP, length 113
03:45:13.417543 IP node2.59900 > node2.33434: UDP, length 113
03:45:13.418178 IP node2.33434 > node2.43732: UDP, length 113
03:45:13.418493 IP node2.33434 > node2.59900: UDP, length 113
03:45:13.418827 IP node2.33434 > node2.44832: UDP, length 113
03:45:13.419336 IP node2.33434 > node2.54620: UDP, length 113
03:45:13.419801 IP node2.33434 > node2.44881: UDP, length 113
03:45:13.427254 IP node2.33434 > node2.33869: UDP, length 113
03:45:13.599537 IP node2.50822 > node2.45941: UDP, length 113
03:45:13.599712 IP node2.60168 > node2.45941: UDP, length 113
03:45:13.600492 IP node2.33869 > node2.45941: UDP, length 113
03:45:13.600719 IP node2.33901 > node2.45941: UDP, length 113
03:45:13.601138 IP node2.33273 > node2.45941: UDP, length 113
03:45:13.601356 IP node2.35425 > node2.45941: UDP, length 113
03:45:13.601476 IP node2.44278 > node2.45941: UDP, length 113
03:45:13.602271 IP node2.53863 > node2.45941: UDP, length 112
03:45:13.603150 IP node2.39954 > node2.45941: UDP, length 113
03:45:13.603540 IP node2.49754 > node2.45941: UDP, length 113
03:45:13.604201 IP node2.36822 > node2.45941: UDP, length 113
03:45:13.604304 IP node2.43732 > node2.45941: UDP, length 113
03:45:13.604578 IP node2.35476 > node2.45941: UDP, length 113
03:45:13.604807 IP node2.46051 > node2.45941: UDP, length 113
03:45:13.605213 IP node2.44832 > node2.45941: UDP, length 111
03:45:13.605500 IP node2.45176 > node2.45941: UDP, length 113
03:45:13.605903 IP node2.50082 > node2.45941: UDP, length 112
03:45:13.607065 IP node2.42304 > node2.45941: UDP, length 113
03:45:13.607968 IP node2.58597 > node2.45941: UDP, length 113
03:45:13.608321 IP node2.45941 > node2.33901: UDP, length 113
03:45:13.608449 IP node2.45941 > node2.33869: UDP, length 113
03:45:13.609340 IP node2.33434 > node2.45941: UDP, length 113
03:45:13.609772 IP node2.54620 > node2.45941: UDP, length 113
03:45:13.610328 IP node2.34103 > node2.45941: UDP, length 113
03:45:13.610820 IP node2.45941 > node2.43732: UDP, length 113
03:45:13.610830 IP node2.50420 > node2.45941: UDP, length 113
03:45:13.610938 IP node2.45941 > node2.59900: UDP, length 113
03:45:13.611061 IP node2.37614 > node2.45941: UDP, length 113
03:45:13.611116 IP node2.45941 > node2.54620: UDP, length 113
03:45:13.611123 IP node2.37029 > node2.45941: UDP, length 113
03:45:13.611201 IP node2.45941 > node2.44832: UDP, length 113
03:45:13.611332 IP node2.45941 > node2.44881: UDP, length 113
03:45:13.611411 IP node2.45941 > node2.33434: UDP, length 113
03:45:13.611575 IP node2.47183 > node2.45941: UDP, length 113
03:45:13.612530 IP node2.59900 > node2.45941: UDP, length 113
03:45:13.613360 IP node2.44881 > node2.45941: UDP, length 113
03:45:13.727658 IP node2.44278 > node2.33629: UDP, length 113
03:45:13.727735 IP node2.60168 > node2.33629: UDP, length 113
03:45:13.727735 IP node2.44832 > node2.33629: UDP, length 111
03:45:13.729991 IP node2.58597 > node2.33629: UDP, length 113
03:45:13.730152 IP node2.34103 > node2.33629: UDP, length 113
03:45:13.730312 IP node2.42304 > node2.33629: UDP, length 113
03:45:13.730472 IP node2.39954 > node2.33629: UDP, length 113
03:45:13.730551 IP node2.35476 > node2.33629: UDP, length 113
03:45:13.740443 IP node2.33434 > node2.33629: UDP, length 113
03:45:13.740748 IP node2.44881 > node2.33629: UDP, length 113
03:45:13.740874 IP node2.59900 > node2.33629: UDP, length 113
03:45:13.741244 IP node2.43732 > node2.33629: UDP, length 113
03:45:13.741422 IP node2.53863 > node2.33629: UDP, length 112
03:45:13.741715 IP node2.33869 > node2.33629: UDP, length 113
03:45:13.742344 IP node2.49754 > node2.33629: UDP, length 113
03:45:13.742766 IP node2.33901 > node2.33629: UDP, length 113
03:45:13.743153 IP node2.37614 > node2.33629: UDP, length 113
03:45:13.743570 IP node2.50082 > node2.33629: UDP, length 112
03:45:13.743812 IP node2.47183 > node2.33629: UDP, length 113
03:45:13.744378 IP node2.46051 > node2.33629: UDP, length 113
03:45:13.744601 IP node2.33273 > node2.33629: UDP, length 113
03:45:13.744851 IP node2.35425 > node2.33629: UDP, length 113
03:45:13.745249 IP node2.50822 > node2.33629: UDP, length 113
03:45:13.745514 IP node2.45176 > node2.33629: UDP, length 113
03:45:13.745827 IP node2.37029 > node2.33629: UDP, length 113
03:45:13.746162 IP node2.36822 > node2.33629: UDP, length 113
03:45:13.748802 IP node2.34901 > node2.59900: UDP, length 113
03:45:13.749918 IP node2.44832 > node2.34901: UDP, length 111
03:45:13.751140 IP node2.50082 > node2.34901: UDP, length 112
03:45:13.751585 IP node2.60168 > node2.34901: UDP, length 113
03:45:13.752770 IP node2.42304 > node2.34901: UDP, length 113
03:45:13.753353 IP node2.50420 > node2.34901: UDP, length 113
03:45:13.753396 IP node2.50420 > node2.33629: UDP, length 113
03:45:13.753479 IP node2.35476 > node2.34901: UDP, length 113
03:45:13.753716 IP node2.39954 > node2.34901: UDP, length 113
03:45:13.754040 IP node2.47183 > node2.34901: UDP, length 113
03:45:13.754285 IP node2.35425 > node2.34901: UDP, length 113
03:45:13.754907 IP node2.34103 > node2.34901: UDP, length 113
03:45:13.755129 IP node2.33273 > node2.34901: UDP, length 113
03:45:13.755523 IP node2.37614 > node2.34901: UDP, length 113
03:45:13.755565 IP node2.45176 > node2.34901: UDP, length 113
03:45:13.756355 IP node2.54620 > node2.33629: UDP, length 113
03:45:13.756439 IP node2.54620 > node2.34901: UDP, length 113
03:45:13.756706 IP node2.50822 > node2.34901: UDP, length 113
03:45:13.757013 IP node2.44278 > node2.34901: UDP, length 113
03:45:13.757328 IP node2.36822 > node2.34901: UDP, length 113
03:45:13.757505 IP node2.43732 > node2.34901: UDP, length 113
03:45:13.758046 IP node2.53863 > node2.34901: UDP, length 112
03:45:13.758711 IP node2.37029 > node2.34901: UDP, length 113
03:45:13.759154 IP node2.33869 > node2.34901: UDP, length 113
03:45:13.759528 IP node2.46051 > node2.34901: UDP, length 113
03:45:13.759645 IP node2.59900 > node2.34901: UDP, length 113
03:45:13.760283 IP node2.44881 > node2.34901: UDP, length 113
03:45:13.760393 IP node2.58597 > node2.34901: UDP, length 113
