03:45:13.853554 IP node4.36649 > node4.43535: UDP, length 113
03:45:13.894199 IP node4.43535 > node4.36649: UDP, length 113
03:45:13.960992 IP node4.43535 > node4.44488: UDP, length 113
03:45:13.962593 IP node4.36649 > node4.44488: UDP, length 113
03:45:13.982696 IP node4.44488 > node4.43535: UDP, length 113
03:45:13.983698 IP node4.44488 > node4.36649: UDP, length 113
03:45:14.109492 IP node4.43535 > node4.42817: UDP, length 113
03:45:14.117549 IP node4.42817 > node4.43535: UDP, length 113
03:45:14.118481 IP node4.42817 > node4.36649: UDP, length 113
03:45:14.119356 IP node4.44488 > node4.42817: UDP, length 113
03:45:14.119471 IP node4.36649 > node4.42817: UDP, length 113
03:45:14.126583 IP node4.42817 > node4.44488: UDP, length 113
03:45:14.460817 IP node4.44488 > node4.55298: UDP, length 113
03:45:14.462435 IP node4.36649 > node4.55298: UDP, length 113
03:45:14.462817 IP node4.42817 > node4.55298: UDP, length 113
03:45:14.462970 IP node4.43535 > node4.55298: UDP, length 113
03:45:14.534215 IP node4.55298 > node4.43535: UDP, length 113
03:45:14.534439 IP node4.55298 > node4.42817: UDP, length 113
03:45:14.534476 IP node4.55298 > node4.44488: UDP, length 113
03:45:14.534509 IP node4.55298 > node4.36649: UDP, length 113
03:45:14.752933 IP node4.44488 > node4.45910: UDP, length 113
03:45:14.758650 IP node4.42817 > node4.45910: UDP, length 113
03:45:14.759380 IP node4.36649 > node4.45910: UDP, length 113
03:45:14.765146 IP node4.43535 > node4.45910: UDP, length 113
03:45:14.767699 IP node4.55298 > node4.45910: UDP, length 113
03:45:14.833266 IP node4.36649 > node4.35032: UDP, length 113
03:45:14.834024 IP node4.44488 > node4.35032: UDP, length 113
03:45:14.834285 IP node4.43535 > node4.35032: UDP, length 113
03:45:14.835533 IP node4.42817 > node4.35032: UDP, length 113
03:45:14.838815 IP node4.55298 > node4.35032: UDP, length 113
03:45:14.883392 IP node4.36649 > node4.55446: UDP, length 113
03:45:14.885531 IP node4.42817 > node4.55446: UDP, length 113
03:45:14.886300 IP node4.43535 > node4.55446: UDP, length 113
03:45:14.886467 IP node4.44488 > node4.55446: UDP, length 113
03:45:14.901443 IP node4.55298 > node4.55446: UDP, length 113
03:45:14.944549 IP node4.45910 > node4.42817: UDP, length 113
03:45:14.955386 IP node4.45910 > node4.55298: UDP, length 113
03:45:14.955453 IP node4.45910 > node4.55446: UDP, length 113
03:45:14.955508 IP node4.45910 > node4.35032: UDP, length 113
03:45:15.096821 IP node4.55446 > node4.42817: UDP, length 113
03:45:15.099335 IP node4.55446 > node4.55298: UDP, length 113
03:45:15.099538 IP node4.55446 > node4.45910: UDP, length 113
03:45:15.099848 IP node4.55446 > node4.35032: UDP, length 113
03:45:15.195497 IP node4.36649 > node4.59050: UDP, length 113
03:45:15.199916 IP node4.43535 > node4.59050: UDP, length 113
03:45:15.203628 IP node4.42817 > node4.59050: UDP, length 113
03:45:15.207589 IP node4.44488 > node4.59050: UDP, length 113
03:45:15.209551 IP node4.55298 > node4.59050: UDP, length 113
03:45:15.212590 IP node4.45910 > node4.59050: UDP, length 113
03:45:15.258463 IP node4.35032 > node4.55298: UDP, length 112
03:45:15.258922 IP node4.35032 > node4.45910: UDP, length 112
03:45:15.260385 IP node4.35032 > node4.55446: UDP, length 112
03:45:15.265198 IP node4.35032 > node4.59050: UDP, length 112
03:45:15.279120 IP node4.55446 > node4.59050: UDP, length 113
03:45:15.313117 IP node4.36649 > node4.39087: UDP, length 113
03:45:15.313298 IP node4.42817 > node4.39087: UDP, length 113
03:45:15.313426 IP node4.43535 > node4.39087: UDP, length 113
03:45:15.313767 IP node4.44488 > node4.39087: UDP, length 113
03:45:15.316114 IP node4.35032 > node4.39087: UDP, length 112
03:45:15.320382 IP node4.55446 > node4.39087: UDP, length 113
03:45:15.323451 IP node4.55298 > node4.39087: UDP, length 113
03:45:15.404826 IP node4.44488 > node4.47308: UDP, length 113
03:45:15.405969 IP node4.36649 > node4.47308: UDP, length 113
03:45:15.409798 IP node4.55446 > node4.47308: UDP, length 113
03:45:15.412807 IP node4.55298 > node4.47308: UDP, length 113
03:45:15.413424 IP node4.43535 > node4.47308: UDP, length 113
03:45:15.413755 IP node4.42817 > node4.47308: UDP, length 113
03:45:15.421285 IP node4.35032 > node4.47308: UDP, length 112
03:45:15.436946 IP node4.55298 > node4.42409: UDP, length 113
03:45:15.439183 IP node4.44488 > node4.42409: UDP, length 113
03:45:15.439310 IP node4.42817 > node4.42409: UDP, length 113
03:45:15.439535 IP node4.43535 > node4.42409: UDP, length 113
03:45:15.439908 IP node4.55446 > node4.42409: UDP, length 113
03:45:15.440939 IP node4.36649 > node4.42409: UDP, length 113
03:45:15.442239 IP node4.35032 > node4.42409: UDP, length 112
03:45:15.459464 IP node4.45910 > node4.47308: UDP, length 113
03:45:15.459585 IP node4.45910 > node4.42409: UDP, length 113
03:45:15.461331 IP node4.45910 > node4.39087: UDP, length 113
03:45:15.463612 IP node4.59050 > node4.36649: UDP, length 113
03:45:15.464434 IP node4.59050 > node4.42817: UDP, length 113
03:45:15.465101 IP node4.59050 > node4.55298: UDP, length 113
03:45:15.465182 IP node4.59050 > node4.45910: UDP, length 113
03:45:15.465987 IP node4.59050 > node4.35032: UDP, length 113
03:45:15.466796 IP node4.59050 > node4.55446: UDP, length 113
03:45:15.477141 IP node4.59050 > node4.39087: UDP, length 113
03:45:15.477204 IP node4.59050 > node4.42409: UDP, length 113
03:45:15.477370 IP node4.59050 > node4.47308: UDP, length 113
03:45:15.477421 IP node4.59050 > node4.44488: UDP, length 113
03:45:15.526082 IP node4.55298 > node4.51453: UDP, length 113
03:45:15.526765 IP node4.55446 > node4.51453: UDP, length 113
03:45:15.527513 IP node4.35032 > node4.51453: UDP, length 112
03:45:15.528651 IP node4.44488 > node4.51453: UDP, length 113
03:45:15.530768 IP node4.36649 > node4.51453: UDP, length 113
03:45:15.533183 IP node4.43535 > node4.51453: UDP, length 113
03:45:15.534539 IP node4.42817 > node4.51453: UDP, length 113
03:45:15.542624 IP node4.45910 > node4.51453: UDP, length 113
03:45:15.547171 IP node4.59050 > node4.51453: UDP, length 113
03:45:15.558462 IP node4.47308 > node4.45910: UDP, length 113
03:45:15.610524 IP node4.44488 > node4.58434: UDP, length 113
03:45:15.610666 IP node4.36649 > node4.58434: UDP, length 113
03:45:15.610751 IP node4.55298 > node4.58434: UDP, length 113
03:45:15.610780 IP node4.42817 > node4.58434: UDP, length 113
03:45:15.610895 IP node4.43535 > node4.58434: UDP, length 113
03:45:15.611745 IP node4.55446 > node4.58434: UDP, length 113
03:45:15.611942 IP node4.45910 > node4.58434: UDP, length 113
03:45:15.612531 IP node4.59050 > node4.58434: UDP, length 113
03:45:15.613786 IP node4.42409 > node4.45910: UDP, length 113
03:45:15.613981 IP node4.35032 > node4.58434: UDP, length 112
03:45:15.614275 IP node4.42409 > node4.35032: UDP, length 113
03:45:15.614961 IP node4.42409 > node4.55446: UDP, length 113
03:45:15.617767 IP node4.47308 > node4.35032: UDP, length 113
03:45:15.619283 IP node4.47308 > node4.55446: UDP, length 113
03:45:15.662043 IP node4.39087 > node4.55298: UDP, length 113
03:45:15.662194 IP node4.39087 > node4.59050: UDP, length 113
03:45:15.662377 IP node4.39087 > node4.35032: UDP, length 113
03:45:15.662529 IP node4.39087 > node4.45910: UDP, length 113
03:45:15.662584 IP node4.39087 > node4.51453: UDP, length 113
03:45:15.662627 IP node4.39087 > node4.58434: UDP, length 113
03:45:15.662776 IP node4.39087 > node4.42409: UDP, length 113
03:45:15.663031 IP node4.39087 > node4.55446: UDP, length 113
03:45:15.663321 IP node4.39087 > node4.47308: UDP, length 113
03:45:15.731014 IP node4.36649 > node4.51545: UDP, length 113
03:45:15.732039 IP node4.55446 > node4.51545: UDP, length 113
03:45:15.732775 IP node4.55298 > node4.51545: UDP, length 113
03:45:15.733308 IP node4.39087 > node4.51545: UDP, length 113
03:45:15.733916 IP node4.44488 > node4.51545: UDP, length 113
03:45:15.734456 IP node4.42817 > node4.51545: UDP, length 113
03:45:15.734608 IP node4.43535 > node4.51545: UDP, length 113
03:45:15.741685 IP node4.51545 > node4.55298: UDP, length 113
03:45:15.742045 IP node4.51545 > node4.35032: UDP, length 113
03:45:15.742137 IP node4.51545 > node4.45910: UDP, length 113
03:45:15.742594 IP node4.51545 > node4.55446: UDP, length 113
03:45:15.745463 IP node4.45910 > node4.51545: UDP, length 113
03:45:15.750392 IP node4.35032 > node4.51545: UDP, length 112
03:45:15.753747 IP node4.59050 > node4.51545: UDP, length 113
03:45:15.765256 IP node4.42409 > node4.59050: UDP, length 113
03:45:15.768283 IP node4.42409 > node4.39087: UDP, length 113
03:45:15.769124 IP node4.42409 > node4.47308: UDP, length 113
03:45:15.770084 IP node4.42409 > node4.51453: UDP, length 113
03:45:15.771034 IP node4.42409 > node4.58434: UDP, length 113
03:45:15.771737 IP node4.42409 > node4.51545: UDP, length 113
03:45:15.793102 IP node4.51453 > node4.35032: UDP, length 113
03:45:15.799165 IP node4.51453 > node4.45910: UDP, length 113
03:45:15.799434 IP node4.51453 > node4.55446: UDP, length 113
03:45:15.868325 IP node4.58434 > node4.45910: UDP, length 113
03:45:15.885317 IP node4.55298 > node4.36744: UDP, length 113
03:45:15.885818 IP node4.55446 > node4.36744: UDP, length 113
03:45:15.886621 IP node4.44488 > node4.36744: UDP, length 113
03:45:15.887008 IP node4.39087 > node4.36744: UDP, length 113
03:45:15.888748 IP node4.43535 > node4.36744: UDP, length 113
03:45:15.890775 IP node4.36649 > node4.36744: UDP, length 113
03:45:15.894115 IP node4.42817 > node4.36744: UDP, length 113
03:45:15.894709 IP node4.45910 > node4.36744: UDP, length 113
03:45:15.898876 IP node4.35032 > node4.36744: UDP, length 112
03:45:15.899457 IP node4.59050 > node4.36744: UDP, length 113
03:45:15.901575 IP node4.42409 > node4.36744: UDP, length 113
03:45:15.904527 IP node4.51545 > node4.59050: UDP, length 113
03:45:15.906774 IP node4.51545 > node4.39087: UDP, length 113
03:45:15.907211 IP node4.51545 > node4.47308: UDP, length 113
03:45:15.907436 IP node4.51545 > node4.42409: UDP, length 113
03:45:15.907921 IP node4.51545 > node4.51453: UDP, length 113
03:45:15.920802 IP node4.51545 > node4.58434: UDP, length 113
03:45:15.935251 IP node4.51545 > node4.36744: UDP, length 113
03:45:15.961566 IP node4.58434 > node4.55446: UDP, length 113
03:45:15.961844 IP node4.58434 > node4.59050: UDP, length 113
03:45:15.961989 IP node4.58434 > node4.35032: UDP, length 113
03:45:15.964953 IP node4.58434 > node4.47308: UDP, length 113
03:45:15.974338 IP node4.58434 > node4.42409: UDP, length 113
03:45:15.974716 IP node4.58434 > node4.39087: UDP, length 113
03:45:15.979436 IP node4.58434 > node4.51453: UDP, length 113
03:45:15.985919 IP node4.58434 > node4.51545: UDP, length 113
03:45:15.989337 IP node4.55298 > node4.35588: UDP, length 113
03:45:15.989460 IP node4.36649 > node4.35588: UDP, length 113
03:45:15.990772 IP node4.44488 > node4.35588: UDP, length 113
03:45:15.991542 IP node4.42817 > node4.35588: UDP, length 113
03:45:15.991662 IP node4.43535 > node4.35588: UDP, length 113
03:45:15.992388 IP node4.59050 > node4.35588: UDP, length 113
03:45:15.992526 IP node4.55446 > node4.35588: UDP, length 113
03:45:15.993293 IP node4.39087 > node4.35588: UDP, length 113
03:45:15.993758 IP node4.45910 > node4.35588: UDP, length 113
03:45:15.993801 IP node4.35032 > node4.35588: UDP, length 112
03:45:15.995741 IP node4.51453 > node4.59050: UDP, length 113
03:45:15.995948 IP node4.51545 > node4.35588: UDP, length 113
03:45:15.996342 IP node4.42409 > node4.35588: UDP, length 113
03:45:16.000944 IP node4.51453 > node4.39087: UDP, length 113
03:45:16.000993 IP node4.51453 > node4.51545: UDP, length 113
03:45:16.001034 IP node4.51453 > node4.58434: UDP, length 113
03:45:16.001241 IP node4.51453 > node4.42409: UDP, length 113
03:45:16.001372 IP node4.51453 > node4.36744: UDP, length 113
03:45:16.001580 IP node4.51453 > node4.47308: UDP, length 113
03:45:16.001693 IP node4.51453 > node4.35588: UDP, length 113
03:45:16.021094 IP node4.36744 > node4.55446: UDP, length 112
03:45:16.021150 IP node4.36744 > node4.35032: UDP, length 112
03:45:16.021190 IP node4.36744 > node4.45910: UDP, length 112
03:45:16.044099 IP node4.58434 > node4.36744: UDP, length 113
03:45:16.044537 IP node4.58434 > node4.35588: UDP, length 113
03:45:16.047523 IP node4.47204 > node4.55446: UDP, length 113
03:45:16.047815 IP node4.47204 > node4.59050: UDP, length 113
03:45:16.047943 IP node4.47204 > node4.35032: UDP, length 113
03:45:16.049200 IP node4.55446 > node4.47204: UDP, length 113
03:45:16.049663 IP node4.36649 > node4.47204: UDP, length 113
03:45:16.051779 IP node4.55298 > node4.47204: UDP, length 113
03:45:16.053615 IP node4.42817 > node4.47204: UDP, length 113
03:45:16.053878 IP node4.44488 > node4.47204: UDP, length 113
03:45:16.053878 IP node4.43535 > node4.47204: UDP, length 113
03:45:16.054850 IP node4.39087 > node4.47204: UDP, length 113
03:45:16.055543 IP node4.42409 > node4.47204: UDP, length 113
03:45:16.056559 IP node4.45910 > node4.47204: UDP, length 113
03:45:16.057352 IP node4.35032 > node4.47204: UDP, length 112
03:45:16.058160 IP node4.59050 > node4.47204: UDP, length 113
03:45:16.059099 IP node4.51453 > node4.47204: UDP, length 113
03:45:16.068338 IP node4.51545 > node4.47204: UDP, length 113
03:45:16.078346 IP node4.45910 > node4.45660: UDP, length 113
03:45:16.078999 IP node4.36649 > node4.45660: UDP, length 113
03:45:16.079344 IP node4.55298 > node4.45660: UDP, length 113
03:45:16.079542 IP node4.42817 > node4.45660: UDP, length 113
03:45:16.080073 IP node4.45660 > node4.55446: UDP, length 113
03:45:16.080139 IP node4.59050 > node4.45660: UDP, length 113
03:45:16.081301 IP node4.43535 > node4.45660: UDP, length 113
03:45:16.081654 IP node4.35032 > node4.45660: UDP, length 112
03:45:16.082016 IP node4.44488 > node4.45660: UDP, length 113
03:45:16.084176 IP node4.51545 > node4.45660: UDP, length 113
03:45:16.084343 IP node4.39087 > node4.45660: UDP, length 113
03:45:16.084722 IP node4.51453 > node4.45660: UDP, length 113
03:45:16.085929 IP node4.42409 > node4.45660: UDP, length 113
03:45:16.100803 IP node4.59050 > node4.42261: UDP, length 113
03:45:16.101503 IP node4.45910 > node4.42261: UDP, length 113
03:45:16.101996 IP node4.42817 > node4.42261: UDP, length 113
03:45:16.102982 IP node4.35032 > node4.42261: UDP, length 112
03:45:16.103660 IP node4.55298 > node4.42261: UDP, length 113
03:45:16.104121 IP node4.36649 > node4.42261: UDP, length 113
03:45:16.107595 IP node4.43535 > node4.42261: UDP, length 113
03:45:16.108658 IP node4.44488 > node4.42261: UDP, length 113
03:45:16.109511 IP node4.39087 > node4.42261: UDP, length 113
03:45:16.115840 IP node4.51453 > node4.42261: UDP, length 113
03:45:16.117454 IP node4.42409 > node4.42261: UDP, length 113
03:45:16.125242 IP node4.51545 > node4.42261: UDP, length 113
03:45:16.125421 IP node4.58434 > node4.45660: UDP, length 113
03:45:16.125514 IP node4.45660 > node4.59050: UDP, length 113
03:45:16.127761 IP node4.58434 > node4.42261: UDP, length 113
03:45:16.128097 IP node4.58434 > node4.47204: UDP, length 113
03:45:16.141575 IP node4.55446 > node4.42261: UDP, length 113
03:45:16.141923 IP node4.55446 > node4.45660: UDP, length 113
03:45:16.149984 IP node4.45910 > node4.42345: UDP, length 113
03:45:16.150290 IP node4.42817 > node4.42345: UDP, length 113
03:45:16.150544 IP node4.36649 > node4.42345: UDP, length 113
03:45:16.151761 IP node4.55446 > node4.42345: UDP, length 113
03:45:16.152546 IP node4.55298 > node4.42345: UDP, length 113
03:45:16.152967 IP node4.35032 > node4.42345: UDP, length 112
03:45:16.154415 IP node4.43535 > node4.42345: UDP, length 113
03:45:16.155531 IP node4.44488 > node4.42345: UDP, length 113
03:45:16.156333 IP node4.59050 > node4.42345: UDP, length 113
03:45:16.157034 IP node4.39087 > node4.42345: UDP, length 113
03:45:16.165039 IP node4.42409 > node4.42345: UDP, length 113
03:45:16.167715 IP node4.51545 > node4.42345: UDP, length 113
03:45:16.168504 IP node4.51453 > node4.42345: UDP, length 113
03:45:16.176526 IP node4.58434 > node4.42345: UDP, length 113
03:45:16.194827 IP node4.47308 > node4.59050: UDP, length 113
03:45:16.197118 IP node4.47308 > node4.39087: UDP, length 113
03:45:16.197240 IP node4.47308 > node4.42409: UDP, length 113
03:45:16.197926 IP node4.47204 > node4.45660: UDP, length 113
03:45:16.197954 IP node4.47204 > node4.51453: UDP, length 113
03:45:16.197993 IP node4.47204 > node4.39087: UDP, length 113
03:45:16.198065 IP node4.47204 > node4.51545: UDP, length 113
03:45:16.198153 IP node4.47204 > node4.58434: UDP, length 113
03:45:16.198264 IP node4.47204 > node4.42409: UDP, length 113
03:45:16.198306 IP node4.47204 > node4.36744: UDP, length 113
03:45:16.198416 IP node4.47204 > node4.47308: UDP, length 113
03:45:16.198456 IP node4.47204 > node4.35588: UDP, length 113
03:45:16.199460 IP node4.47308 > node4.51453: UDP, length 113
03:45:16.201317 IP node4.47308 > node4.58434: UDP, length 113
03:45:16.204497 IP node4.47308 > node4.51545: UDP, length 113
03:45:16.204664 IP node4.47308 > node4.36744: UDP, length 113
03:45:16.204715 IP node4.47308 > node4.35588: UDP, length 113
03:45:16.205211 IP node4.47308 > node4.47204: UDP, length 113
03:45:16.205251 IP node4.47308 > node4.45660: UDP, length 113
03:45:16.209950 IP node4.47308 > node4.42261: UDP, length 113
03:45:16.210343 IP node4.45660 > node4.39087: UDP, length 113
03:45:16.210545 IP node4.47308 > node4.42345: UDP, length 113
03:45:16.269613 IP node4.59050 > node4.42011: UDP, length 113
03:45:16.269860 IP node4.55298 > node4.42011: UDP, length 113
03:45:16.269980 IP node4.35032 > node4.42011: UDP, length 112
03:45:16.270585 IP node4.42817 > node4.42011: UDP, length 113
03:45:16.270906 IP node4.42409 > node4.42011: UDP, length 113
03:45:16.271414 IP node4.36649 > node4.42011: UDP, length 113
03:45:16.271672 IP node4.45910 > node4.42011: UDP, length 113
03:45:16.272264 IP node4.51453 > node4.42011: UDP, length 113
03:45:16.272536 IP node4.43535 > node4.42011: UDP, length 113
03:45:16.274184 IP node4.44488 > node4.42011: UDP, length 113
03:45:16.274476 IP node4.39087 > node4.42011: UDP, length 113
03:45:16.276687 IP node4.47308 > node4.42011: UDP, length 113
03:45:16.277283 IP node4.51545 > node4.42011: UDP, length 113
03:45:16.283468 IP node4.47204 > node4.42261: UDP, length 113
03:45:16.302300 IP node4.58434 > node4.42011: UDP, length 113
03:45:16.307669 IP node4.47204 > node4.42011: UDP, length 113
03:45:16.307806 IP node4.47204 > node4.42345: UDP, length 113
03:45:16.309861 IP node4.55446 > node4.42011: UDP, length 113
03:45:16.365878 IP node4.36744 > node4.59050: UDP, length 112
03:45:16.367127 IP node4.36744 > node4.39087: UDP, length 112
03:45:16.376680 IP node4.55298 > node4.45176: UDP, length 113
03:45:16.377295 IP node4.35032 > node4.45176: UDP, length 112
03:45:16.377855 IP node4.55446 > node4.45176: UDP, length 113
03:45:16.378800 IP node4.45910 > node4.45176: UDP, length 113
03:45:16.379947 IP node4.51545 > node4.45176: UDP, length 113
03:45:16.380759 IP node4.44488 > node4.45176: UDP, length 113
03:45:16.382497 IP node4.42817 > node4.45176: UDP, length 113
03:45:16.383199 IP node4.36649 > node4.45176: UDP, length 113
03:45:16.384131 IP node4.43535 > node4.45176: UDP, length 113
03:45:16.385081 IP node4.39087 > node4.45176: UDP, length 113
03:45:16.385639 IP node4.47308 > node4.45176: UDP, length 113
03:45:16.387474 IP node4.42409 > node4.45176: UDP, length 113
03:45:16.391872 IP node4.51453 > node4.45176: UDP, length 113
03:45:16.409226 IP node4.44488 > node4.35245: UDP, length 113
03:45:16.409606 IP node4.35032 > node4.35245: UDP, length 112
03:45:16.409845 IP node4.45660 > node4.47308: UDP, length 113
03:45:16.410140 IP node4.45910 > node4.35245: UDP, length 113
03:45:16.410306 IP node4.43535 > node4.35245: UDP, length 113
03:45:16.410683 IP node4.55298 > node4.35245: UDP, length 113
03:45:16.411837 IP node4.42817 > node4.35245: UDP, length 113
03:45:16.411902 IP node4.59050 > node4.35245: UDP, length 113
03:45:16.412260 IP node4.55446 > node4.35245: UDP, length 113
03:45:16.412808 IP node4.36649 > node4.35245: UDP, length 113
03:45:16.413277 IP node4.47308 > node4.35245: UDP, length 113
03:45:16.413472 IP node4.39087 > node4.35245: UDP, length 113
03:45:16.414645 IP node4.51453 > node4.35245: UDP, length 113
03:45:16.420670 IP node4.58434 > node4.45176: UDP, length 113
03:45:16.421380 IP node4.47204 > node4.45176: UDP, length 113
03:45:16.421861 IP node4.47204 > node4.35245: UDP, length 113
03:45:16.422864 IP node4.45660 > node4.42409: UDP, length 113
03:45:16.425343 IP node4.45660 > node4.51453: UDP, length 113
03:45:16.434614 IP node4.45660 > node4.58434: UDP, length 113
03:45:16.435428 IP node4.45660 > node4.51545: UDP, length 113
03:45:16.436595 IP node4.45660 > node4.36744: UDP, length 113
03:45:16.436770 IP node4.45660 > node4.35588: UDP, length 113
03:45:16.436938 IP node4.45660 > node4.47204: UDP, length 113
03:45:16.441284 IP node4.36744 > node4.47308: UDP, length 112
03:45:16.441864 IP node4.36744 > node4.42409: UDP, length 112
03:45:16.442441 IP node4.36744 > node4.51453: UDP, length 112
03:45:16.452197 IP node4.36744 > node4.58434: UDP, length 112
03:45:16.500786 IP node4.36744 > node4.51545: UDP, length 112
03:45:16.501570 IP node4.36744 > node4.35588: UDP, length 112
03:45:16.502577 IP node4.36744 > node4.47204: UDP, length 112
03:45:16.502999 IP node4.36744 > node4.45660: UDP, length 112
03:45:16.503569 IP node4.36744 > node4.42261: UDP, length 112
03:45:16.572473 IP node4.35588 > node4.59050: UDP, length 113
03:45:16.573422 IP node4.35588 > node4.39087: UDP, length 113
03:45:16.573985 IP node4.35588 > node4.47308: UDP, length 113
03:45:16.575605 IP node4.51545 > node4.35245: UDP, length 113
03:45:16.576592 IP node4.35588 > node4.42409: UDP, length 113
03:45:16.577207 IP node4.35588 > node4.51453: UDP, length 113
03:45:16.578273 IP node4.35588 > node4.58434: UDP, length 113
03:45:16.589572 IP node4.36744 > node4.42011: UDP, length 112
03:45:16.589702 IP node4.36744 > node4.42345: UDP, length 112
03:45:16.589823 IP node4.36744 > node4.45176: UDP, length 112
03:45:16.589934 IP node4.36744 > node4.35245: UDP, length 112
03:45:16.601147 IP node4.45660 > node4.42261: UDP, length 113
03:45:16.602107 IP node4.45660 > node4.42345: UDP, length 113
03:45:16.603233 IP node4.45660 > node4.42011: UDP, length 113
03:45:16.603786 IP node4.45660 > node4.45176: UDP, length 113
03:45:16.609154 IP node4.35245 > node4.59050: UDP, length 113
03:45:16.612446 IP node4.35245 > node4.39087: UDP, length 113
03:45:16.616861 IP node4.42261 > node4.51453: UDP, length 113
03:45:16.616951 IP node4.42261 > node4.39087: UDP, length 113
03:45:16.617006 IP node4.42261 > node4.51545: UDP, length 113
03:45:16.617055 IP node4.42261 > node4.58434: UDP, length 113
03:45:16.617369 IP node4.42261 > node4.42409: UDP, length 113
03:45:16.617531 IP node4.42261 > node4.36744: UDP, length 113
03:45:16.617817 IP node4.42261 > node4.47308: UDP, length 113
03:45:16.618018 IP node4.42261 > node4.35588: UDP, length 113
03:45:16.624976 IP node4.42261 > node4.47204: UDP, length 113
03:45:16.627617 IP node4.42261 > node4.42345: UDP, length 113
03:45:16.630732 IP node4.35588 > node4.51545: UDP, length 113
03:45:16.631429 IP node4.35588 > node4.36744: UDP, length 113
03:45:16.631642 IP node4.35588 > node4.47204: UDP, length 113
03:45:16.634313 IP node4.35588 > node4.42261: UDP, length 113
03:45:16.637211 IP node4.58434 > node4.35245: UDP, length 113
03:45:16.659685 IP node4.42345 > node4.39087: UDP, length 113
03:45:16.662679 IP node4.35588 > node4.45660: UDP, length 113
03:45:16.663619 IP node4.35588 > node4.42345: UDP, length 113
03:45:16.664122 IP node4.35588 > node4.42011: UDP, length 113
03:45:16.664459 IP node4.35588 > node4.45176: UDP, length 113
03:45:16.664674 IP node4.35588 > node4.35245: UDP, length 113
03:45:16.677165 IP node4.42345 > node4.47308: UDP, length 113
03:45:16.677480 IP node4.42345 > node4.42409: UDP, length 113
03:45:16.678040 IP node4.42345 > node4.51453: UDP, length 113
03:45:16.679246 IP node4.42345 > node4.58434: UDP, length 113
03:45:16.679813 IP node4.42345 > node4.51545: UDP, length 113
03:45:16.693716 IP node4.42011 > node4.39087: UDP, length 113
03:45:16.696405 IP node4.42011 > node4.47308: UDP, length 113
03:45:16.699771 IP node4.42011 > node4.42409: UDP, length 113
03:45:16.700700 IP node4.42011 > node4.51453: UDP, length 113
03:45:16.702841 IP node4.42011 > node4.58434: UDP, length 113
03:45:16.721520 IP node4.45176 > node4.39087: UDP, length 113
03:45:16.724620 IP node4.42345 > node4.42011: UDP, length 113
03:45:16.724713 IP node4.42345 > node4.36744: UDP, length 113
03:45:16.724764 IP node4.42345 > node4.42261: UDP, length 113
03:45:16.725033 IP node4.42345 > node4.35588: UDP, length 113
03:45:16.725228 IP node4.42345 > node4.45176: UDP, length 113
03:45:16.725465 IP node4.42345 > node4.47204: UDP, length 113
03:45:16.725519 IP node4.42345 > node4.35245: UDP, length 113
03:45:16.725574 IP node4.42345 > node4.45660: UDP, length 113
03:45:16.748038 IP node4.42409 > node4.35245: UDP, length 113
03:45:16.756156 IP node4.59050 > node4.45176: UDP, length 113
03:45:16.763107 IP node4.42011 > node4.51545: UDP, length 113
03:45:16.765051 IP node4.42011 > node4.36744: UDP, length 113
03:45:16.765274 IP node4.42011 > node4.35588: UDP, length 113
03:45:16.765456 IP node4.42011 > node4.47204: UDP, length 113
03:45:16.837890 IP node4.35245 > node4.47308: UDP, length 113
03:45:16.840282 IP node4.35245 > node4.42409: UDP, length 113
03:45:16.909567 IP node4.42261 > node4.42011: UDP, length 113
03:45:16.910125 IP node4.42261 > node4.45176: UDP, length 113
03:45:16.910340 IP node4.42261 > node4.35245: UDP, length 113
03:45:16.988078 IP node4.35245 > node4.42011: UDP, length 113
03:45:16.988136 IP node4.35245 > node4.42345: UDP, length 113
03:45:16.988731 IP node4.35245 > node4.45176: UDP, length 113
03:45:16.989017 IP node4.35245 > node4.47204: UDP, length 113
03:45:16.989145 IP node4.35245 > node4.45660: UDP, length 113
03:45:16.989234 IP node4.35245 > node4.51453: UDP, length 113
03:45:16.989274 IP node4.35245 > node4.51545: UDP, length 113
03:45:16.989294 IP node4.35245 > node4.58434: UDP, length 113
03:45:16.989499 IP node4.35245 > node4.36744: UDP, length 113
03:45:16.989546 IP node4.35245 > node4.42261: UDP, length 113
03:45:16.989897 IP node4.35245 > node4.35588: UDP, length 113
03:45:16.995473 IP node4.36649 > node4.44659: UDP, length 113
03:45:16.996108 IP node4.35032 > node4.44659: UDP, length 112
03:45:16.996406 IP node4.44488 > node4.44659: UDP, length 113
03:45:16.996880 IP node4.36744 > node4.44659: UDP, length 112
03:45:16.998015 IP node4.55446 > node4.44659: UDP, length 113
03:45:16.998598 IP node4.45910 > node4.44659: UDP, length 113
03:45:16.999746 IP node4.44659 > node4.39087: UDP, length 113
03:45:17.000739 IP node4.42817 > node4.44659: UDP, length 113
03:45:17.000997 IP node4.43535 > node4.44659: UDP, length 113
03:45:17.001303 IP node4.55298 > node4.44659: UDP, length 113
03:45:17.001626 IP node4.35588 > node4.44659: UDP, length 113
03:45:17.002363 IP node4.42345 > node4.44659: UDP, length 113
03:45:17.003096 IP node4.44659 > node4.47308: UDP, length 113
03:45:17.003483 IP node4.44659 > node4.42409: UDP, length 113
03:45:17.004060 IP node4.44659 > node4.51453: UDP, length 113
03:45:17.004697 IP node4.51545 > node4.44659: UDP, length 113
03:45:17.012280 IP node4.45176 > node4.47308: UDP, length 113
03:45:17.012658 IP node4.45176 > node4.42409: UDP, length 113
03:45:17.020665 IP node4.35245 > node4.44659: UDP, length 113
03:45:17.020771 IP node4.45660 > node4.35245: UDP, length 113
03:45:17.026869 IP node4.42261 > node4.45660: UDP, length 113
03:45:17.028581 IP node4.47204 > node4.44659: UDP, length 113
03:45:17.039873 IP node4.42261 > node4.44659: UDP, length 113
03:45:17.047189 IP node4.45660 > node4.44659: UDP, length 113
03:45:17.049260 IP node4.59050 > node4.44659: UDP, length 113
03:45:17.056048 IP node4.35032 > node4.43535: UDP, length 112
03:45:17.058025 IP node4.44488 > node4.43535: UDP, length 113
03:45:17.058213 IP node4.55446 > node4.43535: UDP, length 113
03:45:17.058823 IP node4.36649 > node4.43535: UDP, length 113
03:45:17.058987 IP node4.55298 > node4.43535: UDP, length 113
03:45:17.064245 IP node4.45910 > node4.43535: UDP, length 113
03:45:17.064747 IP node4.42817 > node4.43535: UDP, length 113
03:45:17.065121 IP node4.59050 > node4.43535: UDP, length 113
03:45:17.069100 IP node4.51545 > node4.43535: UDP, length 113
03:45:17.070082 IP node4.42345 > node4.43535: UDP, length 113
03:45:17.072427 IP node4.45660 > node4.43535: UDP, length 113
03:45:17.072776 IP node4.35588 > node4.43535: UDP, length 113
03:45:17.073062 IP node4.42261 > node4.43535: UDP, length 113
03:45:17.077221 IP node4.42011 > node4.45660: UDP, length 113
03:45:17.078470 IP node4.42011 > node4.42261: UDP, length 113
03:45:17.078516 IP node4.36744 > node4.43535: UDP, length 112
03:45:17.079483 IP node4.42011 > node4.42345: UDP, length 113
03:45:17.081087 IP node4.45176 > node4.51453: UDP, length 113
03:45:17.082222 IP node4.42409 > node4.43535: UDP, length 113
03:45:17.082278 IP node4.42409 > node4.44659: UDP, length 113
03:45:17.088242 IP node4.35245 > node4.43535: UDP, length 113
03:45:17.132357 IP node4.39087 > node4.43535: UDP, length 113
03:45:17.133094 IP node4.39087 > node4.44659: UDP, length 113
03:45:17.151269 IP node4.42011 > node4.45176: UDP, length 113
03:45:17.152484 IP node4.42011 > node4.35245: UDP, length 113
03:45:17.157579 IP node4.42011 > node4.44659: UDP, length 113
03:45:17.167199 IP node4.45176 > node4.42011: UDP, length 113
03:45:17.167445 IP node4.45176 > node4.42345: UDP, length 113
03:45:17.167831 IP node4.45176 > node4.43535: UDP, length 113
03:45:17.169041 IP node4.45176 > node4.47204: UDP, length 113
03:45:17.169301 IP node4.45176 > node4.35245: UDP, length 113
03:45:17.169349 IP node4.45176 > node4.45660: UDP, length 113
03:45:17.169395 IP node4.45176 > node4.51545: UDP, length 113
03:45:17.169440 IP node4.45176 > node4.58434: UDP, length 113
03:45:17.169702 IP node4.45176 > node4.36744: UDP, length 113
03:45:17.170632 IP node4.45176 > node4.42261: UDP, length 113
03:45:17.170970 IP node4.45176 > node4.35588: UDP, length 113
03:45:17.171760 IP node4.45176 > node4.44659: UDP, length 113
03:45:17.175403 IP node4.44659 > node4.58434: UDP, length 113
03:45:17.176048 IP node4.44659 > node4.51545: UDP, length 113
03:45:17.176887 IP node4.44659 > node4.36744: UDP, length 113
03:45:17.177112 IP node4.44659 > node4.35588: UDP, length 113
03:45:17.177276 IP node4.44659 > node4.47204: UDP, length 113
03:45:17.177670 IP node4.44659 > node4.45660: UDP, length 113
03:45:17.179064 IP node4.44659 > node4.42261: UDP, length 113
03:45:17.222112 IP node4.42011 > node4.43535: UDP, length 113
03:45:17.231762 IP node4.47204 > node4.43535: UDP, length 113
03:45:17.269917 IP node4.47308 > node4.43535: UDP, length 113
03:45:17.269984 IP node4.47308 > node4.44659: UDP, length 113
03:45:17.311789 IP node4.42409 > node4.44488: UDP, length 113
03:45:17.311999 IP node4.47308 > node4.44488: UDP, length 113
03:45:17.311999 IP node4.59050 > node4.44488: UDP, length 113
03:45:17.312692 IP node4.55446 > node4.44488: UDP, length 113
03:45:17.315008 IP node4.42817 > node4.44488: UDP, length 113
03:45:17.316485 IP node4.55298 > node4.44488: UDP, length 113
03:45:17.316946 IP node4.45176 > node4.44488: UDP, length 113
03:45:17.325461 IP node4.45910 > node4.44488: UDP, length 113
03:45:17.325800 IP node4.36649 > node4.44488: UDP, length 113
03:45:17.328931 IP node4.35032 > node4.44488: UDP, length 112
03:45:17.329031 IP node4.47204 > node4.44488: UDP, length 113
03:45:17.329817 IP node4.45660 > node4.44488: UDP, length 113
03:45:17.334292 IP node4.43535 > node4.44488: UDP, length 113
03:45:17.335064 IP node4.39087 > node4.44488: UDP, length 113
03:45:17.335756 IP node4.36744 > node4.44488: UDP, length 112
03:45:17.339125 IP node4.42345 > node4.44488: UDP, length 113
03:45:17.339759 IP node4.35588 > node4.44488: UDP, length 113
03:45:17.341290 IP node4.35245 > node4.44488: UDP, length 113
03:45:17.342250 IP node4.42261 > node4.44488: UDP, length 113
03:45:17.343480 IP node4.51453 > node4.44659: UDP, length 113
03:45:17.345807 IP node4.51453 > node4.44488: UDP, length 113
03:45:17.345870 IP node4.51453 > node4.43535: UDP, length 113
03:45:17.350066 IP node4.42011 > node4.44488: UDP, length 113
03:45:17.356577 IP node4.51453 > node4.36649: UDP, length 113
03:45:17.357008 IP node4.59050 > node4.36649: UDP, length 113
03:45:17.357129 IP node4.55446 > node4.36649: UDP, length 113
03:45:17.357900 IP node4.43535 > node4.36649: UDP, length 113
03:45:17.357979 IP node4.47308 > node4.36649: UDP, length 113
03:45:17.358217 IP node4.42409 > node4.36649: UDP, length 113
03:45:17.358811 IP node4.42817 > node4.36649: UDP, length 113
03:45:17.359650 IP node4.55298 > node4.36649: UDP, length 113
03:45:17.359922 IP node4.36744 > node4.36649: UDP, length 112
03:45:17.360593 IP node4.45176 > node4.36649: UDP, length 113
03:45:17.361568 IP node4.42345 > node4.36649: UDP, length 113
03:45:17.361977 IP node4.47204 > node4.36649: UDP, length 113
03:45:17.362676 IP node4.45910 > node4.36649: UDP, length 113
03:45:17.366958 IP node4.35032 > node4.36649: UDP, length 112
03:45:17.367700 IP node4.39087 > node4.36649: UDP, length 113
03:45:17.368682 IP node4.51545 > node4.36649: UDP, length 113
03:45:17.372375 IP node4.45660 > node4.36649: UDP, length 113
03:45:17.374405 IP node4.44488 > node4.36649: UDP, length 113
03:45:17.374832 IP node4.35245 > node4.36649: UDP, length 113
03:45:17.375675 IP node4.42261 > node4.36649: UDP, length 113
03:45:17.376128 IP node4.35588 > node4.36649: UDP, length 113
03:45:17.381277 IP node4.42011 > node4.36649: UDP, length 113
03:45:17.389724 IP node4.51545 > node4.44488: UDP, length 113
03:45:17.402037 IP node4.44659 > node4.42345: UDP, length 113
03:45:17.402857 IP node4.44659 > node4.42011: UDP, length 113
03:45:17.403242 IP node4.44659 > node4.45176: UDP, length 113
03:45:17.403696 IP node4.44659 > node4.35245: UDP, length 113
03:45:17.407775 IP node4.44659 > node4.43535: UDP, length 113
03:45:17.409982 IP node4.44659 > node4.44488: UDP, length 113
03:45:17.411333 IP node4.44659 > node4.36649: UDP, length 113
03:45:17.429290 IP node4.58434 > node4.44659: UDP, length 113
03:45:17.431784 IP node4.58434 > node4.43535: UDP, length 113
03:45:17.441495 IP node4.58434 > node4.44488: UDP, length 113
03:45:17.441537 IP node4.58434 > node4.36649: UDP, length 113
03:45:17.473744 IP node4.59050 > node4.55815: UDP, length 113
03:45:17.474108 IP node4.42817 > node4.55815: UDP, length 113
03:45:17.474118 IP node4.42409 > node4.55815: UDP, length 113
03:45:17.474294 IP node4.47308 > node4.55815: UDP, length 113
03:45:17.474857 IP node4.36744 > node4.55815: UDP, length 112
03:45:17.474916 IP node4.55298 > node4.55815: UDP, length 113
03:45:17.476179 IP node4.55446 > node4.55815: UDP, length 113
03:45:17.476808 IP node4.36649 > node4.55815: UDP, length 113
03:45:17.477593 IP node4.45910 > node4.55815: UDP, length 113
03:45:17.480994 IP node4.51545 > node4.55815: UDP, length 113
03:45:17.481825 IP node4.45660 > node4.55815: UDP, length 113
03:45:17.482394 IP node4.35032 > node4.55815: UDP, length 112
03:45:17.482947 IP node4.51453 > node4.55815: UDP, length 113
03:45:17.483423 IP node4.44488 > node4.55815: UDP, length 113
03:45:17.484404 IP node4.47204 > node4.55815: UDP, length 113
03:45:17.484667 IP node4.39087 > node4.55815: UDP, length 113
03:45:17.485235 IP node4.43535 > node4.55815: UDP, length 113
03:45:17.485965 IP node4.45176 > node4.55815: UDP, length 113
03:45:17.486725 IP node4.42345 > node4.55815: UDP, length 113
03:45:17.487248 IP node4.35245 > node4.55815: UDP, length 113
03:45:17.491276 IP node4.35588 > node4.55815: UDP, length 113
03:45:17.492253 IP node4.44659 > node4.55815: UDP, length 113
03:45:17.492819 IP node4.42261 > node4.55815: UDP, length 113
03:45:17.493729 IP node4.42011 > node4.55815: UDP, length 113
03:45:17.495321 IP node4.55815 > node4.42409: UDP, length 113
03:45:17.507266 IP node4.58434 > node4.55815: UDP, length 113
03:45:17.611861 IP node4.36744 > node4.42817: UDP, length 112
03:45:17.615061 IP node4.51545 > node4.42817: UDP, length 113
03:45:17.618935 IP node4.45176 > node4.42817: UDP, length 113
03:45:17.620747 IP node4.44488 > node4.42817: UDP, length 113
03:45:17.621351 IP node4.55446 > node4.42817: UDP, length 113
03:45:17.624573 IP node4.51453 > node4.42817: UDP, length 113
03:45:17.624910 IP node4.35032 > node4.42817: UDP, length 112
03:45:17.625183 IP node4.55298 > node4.42817: UDP, length 113
03:45:17.625353 IP node4.43535 > node4.42817: UDP, length 113
03:45:17.626504 IP node4.45910 > node4.42817: UDP, length 113
03:45:17.626922 IP node4.39087 > node4.42817: UDP, length 113
03:45:17.627376 IP node4.42345 > node4.42817: UDP, length 113
03:45:17.628240 IP node4.42409 > node4.42817: UDP, length 113
03:45:17.628664 IP node4.47308 > node4.42817: UDP, length 113
03:45:17.628877 IP node4.59050 > node4.42817: UDP, length 113
03:45:17.629225 IP node4.45660 > node4.42817: UDP, length 113
03:45:17.634554 IP node4.47204 > node4.42817: UDP, length 113
03:45:17.635156 IP node4.58434 > node4.42817: UDP, length 113
03:45:17.645004 IP node4.35588 > node4.42817: UDP, length 113
03:45:17.647055 IP node4.36649 > node4.42817: UDP, length 113
03:45:17.665510 IP node4.42261 > node4.42817: UDP, length 113
03:45:17.668207 IP node4.42011 > node4.42817: UDP, length 113
03:45:17.669454 IP node4.44659 > node4.42817: UDP, length 113
03:45:17.676363 IP node4.35245 > node4.42817: UDP, length 113
03:45:17.716295 IP node4.36744 > node4.48630: UDP, length 112
03:45:17.716662 IP node4.45176 > node4.48630: UDP, length 113
03:45:17.725371 IP node4.36649 > node4.48630: UDP, length 113
03:45:17.725728 IP node4.43535 > node4.48630: UDP, length 113
03:45:17.729657 IP node4.59050 > node4.48630: UDP, length 113
03:45:17.730992 IP node4.55446 > node4.48630: UDP, length 113
03:45:17.732796 IP node4.35245 > node4.48630: UDP, length 113
03:45:17.733777 IP node4.45660 > node4.48630: UDP, length 113
03:45:17.733954 IP node4.39087 > node4.48630: UDP, length 113
03:45:17.734138 IP node4.51545 > node4.48630: UDP, length 113
03:45:17.734363 IP node4.47308 > node4.48630: UDP, length 113
03:45:17.734788 IP node4.42261 > node4.48630: UDP, length 113
03:45:17.735280 IP node4.51453 > node4.48630: UDP, length 113
03:45:17.735439 IP node4.44488 > node4.48630: UDP, length 113
03:45:17.735676 IP node4.55298 > node4.48630: UDP, length 113
03:45:17.735896 IP node4.58434 > node4.48630: UDP, length 113
03:45:17.736104 IP node4.45910 > node4.48630: UDP, length 113
03:45:17.736858 IP node4.35588 > node4.48630: UDP, length 113
03:45:17.737098 IP node4.35032 > node4.48630: UDP, length 112
03:45:17.737494 IP node4.42409 > node4.48630: UDP, length 113
03:45:17.739507 IP node4.42817 > node4.48630: UDP, length 113
03:45:17.739544 IP node4.47204 > node4.48630: UDP, length 113
03:45:17.740665 IP node4.44659 > node4.48630: UDP, length 113
03:45:17.741172 IP node4.42345 > node4.48630: UDP, length 113
03:45:17.741328 IP node4.42011 > node4.48630: UDP, length 113
03:45:17.809686 IP node4.55815 > node4.51453: UDP, length 113
03:45:17.809740 IP node4.55815 > node4.51545: UDP, length 113
03:45:17.809810 IP node4.55815 > node4.58434: UDP, length 113
03:45:17.810180 IP node4.55815 > node4.36744: UDP, length 113
03:45:17.810436 IP node4.55815 > node4.35588: UDP, length 113
03:45:17.811120 IP node4.55815 > node4.47204: UDP, length 113
03:45:17.811151 IP node4.55815 > node4.45660: UDP, length 113
03:45:17.821826 IP node4.55815 > node4.42011: UDP, length 113
03:45:17.822222 IP node4.55815 > node4.42345: UDP, length 113
03:45:17.823141 IP node4.55815 > node4.42817: UDP, length 113
03:45:17.823314 IP node4.55815 > node4.43535: UDP, length 113
03:45:17.823942 IP node4.55815 > node4.45176: UDP, length 113
03:45:17.824293 IP node4.55815 > node4.36649: UDP, length 113
03:45:17.825080 IP node4.55815 > node4.35245: UDP, length 113
03:45:17.825931 IP node4.55815 > node4.48630: UDP, length 113
03:45:17.825979 IP node4.55815 > node4.42261: UDP, length 113
03:45:17.827515 IP node4.55815 > node4.44488: UDP, length 113
03:45:17.875454 IP node4.44659 > node4.55298: UDP, length 113
03:45:17.878071 IP node4.45176 > node4.55298: UDP, length 113
03:45:17.878946 IP node4.42409 > node4.55298: UDP, length 113
03:45:17.880862 IP node4.51545 > node4.55298: UDP, length 113
03:45:17.882486 IP node4.36744 > node4.55298: UDP, length 112
03:45:17.886092 IP node4.42011 > node4.55298: UDP, length 113
03:45:17.890257 IP node4.45910 > node4.55298: UDP, length 113
03:45:17.891680 IP node4.42817 > node4.55298: UDP, length 113
03:45:17.893845 IP node4.42345 > node4.55298: UDP, length 113
03:45:17.894098 IP node4.35245 > node4.55298: UDP, length 113
03:45:17.894349 IP node4.35588 > node4.55298: UDP, length 113
03:45:17.894881 IP node4.45660 > node4.55298: UDP, length 113
03:45:17.895145 IP node4.51453 > node4.55298: UDP, length 113
03:45:17.895165 IP node4.47204 > node4.55298: UDP, length 113
03:45:17.895390 IP node4.58434 > node4.55298: UDP, length 113
03:45:17.895741 IP node4.35032 > node4.55298: UDP, length 112
03:45:17.896112 IP node4.44488 > node4.55298: UDP, length 113
03:45:17.896814 IP node4.36649 > node4.55298: UDP, length 113
03:45:17.897770 IP node4.43535 > node4.55298: UDP, length 113
03:45:17.916635 IP node4.55815 > node4.44659: UDP, length 113
03:45:17.918285 IP node4.42261 > node4.55298: UDP, length 113
03:45:17.945029 IP node4.47308 > node4.55298: UDP, length 113
03:45:17.956797 IP node4.55446 > node4.55298: UDP, length 113
03:45:17.992538 IP node4.59050 > node4.55298: UDP, length 113
03:45:18.013496 IP node4.39087 > node4.55298: UDP, length 113
03:45:18.181704 IP node4.47204 > node4.45910: UDP, length 113
03:45:18.182303 IP node4.58434 > node4.45910: UDP, length 113
03:45:18.182438 IP node4.35032 > node4.45910: UDP, length 112
03:45:18.182574 IP node4.43535 > node4.45910: UDP, length 113
03:45:18.183067 IP node4.51545 > node4.45910: UDP, length 113
03:45:18.183244 IP node4.55446 > node4.45910: UDP, length 113
03:45:18.184895 IP node4.44659 > node4.45910: UDP, length 113
03:45:18.185398 IP node4.51453 > node4.45910: UDP, length 113
03:45:18.186174 IP node4.47308 > node4.45910: UDP, length 113
03:45:18.186313 IP node4.36744 > node4.45910: UDP, length 112
03:45:18.187375 IP node4.44488 > node4.45910: UDP, length 113
03:45:18.188275 IP node4.42011 > node4.45910: UDP, length 113
03:45:18.188419 IP node4.35588 > node4.45910: UDP, length 113
03:45:18.188648 IP node4.55298 > node4.45910: UDP, length 113
03:45:18.189134 IP node4.36649 > node4.45910: UDP, length 113
03:45:18.193141 IP node4.45660 > node4.45910: UDP, length 113
03:45:18.193757 IP node4.59050 > node4.45910: UDP, length 113
03:45:18.196117 IP node4.42345 > node4.45910: UDP, length 113
03:45:18.206495 IP node4.42817 > node4.45910: UDP, length 113
03:45:18.217127 IP node4.48630 > node4.35245: UDP, length 113
03:45:18.220025 IP node4.42261 > node4.45910: UDP, length 113
03:45:18.237621 IP node4.45176 > node4.45910: UDP, length 113
03:45:18.239076 IP node4.55815 > node4.55298: UDP, length 113
03:45:18.245071 IP node4.55815 > node4.45910: UDP, length 113
03:45:18.259675 IP node4.48630 > node4.55815: UDP, length 113
03:45:18.259905 IP node4.48630 > node4.42817: UDP, length 113
03:45:18.260008 IP node4.48630 > node4.43535: UDP, length 113
03:45:18.261056 IP node4.48630 > node4.36649: UDP, length 113
03:45:18.261852 IP node4.48630 > node4.44488: UDP, length 113
03:45:18.261869 IP node4.35245 > node4.45910: UDP, length 113
03:45:18.261906 IP node4.48630 > node4.44659: UDP, length 113
03:45:18.262680 IP node4.48630 > node4.55298: UDP, length 113
03:45:18.276160 IP node4.48630 > node4.45910: UDP, length 113
03:45:18.280997 IP node4.47204 > node4.36908: UDP, length 113
03:45:18.281473 IP node4.45660 > node4.36908: UDP, length 113
03:45:18.281668 IP node4.58434 > node4.36908: UDP, length 113
03:45:18.283007 IP node4.51453 > node4.36908: UDP, length 113
03:45:18.283881 IP node4.55446 > node4.34557: UDP, length 113
03:45:18.284070 IP node4.58434 > node4.34557: UDP, length 113
03:45:18.284857 IP node4.51545 > node4.34557: UDP, length 113
03:45:18.284904 IP node4.51545 > node4.36908: UDP, length 113
03:45:18.287730 IP node4.42409 > node4.34557: UDP, length 113
03:45:18.287776 IP node4.42409 > node4.36908: UDP, length 113
03:45:18.287810 IP node4.42409 > node4.45910: UDP, length 113
03:45:18.289301 IP node4.55446 > node4.36908: UDP, length 113
03:45:18.290088 IP node4.45660 > node4.34557: UDP, length 113
03:45:18.290496 IP node4.45910 > node4.34557: UDP, length 113
03:45:18.290504 IP node4.45910 > node4.36908: UDP, length 113
03:45:18.291204 IP node4.47204 > node4.34557: UDP, length 113
03:45:18.291667 IP node4.51453 > node4.34557: UDP, length 113
03:45:18.291686 IP node4.59050 > node4.34557: UDP, length 113
03:45:18.291717 IP node4.59050 > node4.36908: UDP, length 113
03:45:18.292808 IP node4.55298 > node4.34557: UDP, length 113
03:45:18.292847 IP node4.55298 > node4.36908: UDP, length 113
03:45:18.293948 IP node4.44488 > node4.34557: UDP, length 113
03:45:18.294044 IP node4.44488 > node4.36908: UDP, length 113
03:45:18.295060 IP node4.35032 > node4.36908: UDP, length 112
03:45:18.295226 IP node4.35032 > node4.34557: UDP, length 112
03:45:18.296397 IP node4.35588 > node4.34557: UDP, length 113
03:45:18.296465 IP node4.35588 > node4.36908: UDP, length 113
03:45:18.296572 IP node4.45176 > node4.36908: UDP, length 113
03:45:18.297113 IP node4.42817 > node4.36908: UDP, length 113
03:45:18.297504 IP node4.42817 > node4.34557: UDP, length 113
03:45:18.298361 IP node4.36744 > node4.34557: UDP, length 112
03:45:18.298412 IP node4.36744 > node4.36908: UDP, length 112
03:45:18.298777 IP node4.45176 > node4.34557: UDP, length 113
03:45:18.300479 IP node4.36649 > node4.34557: UDP, length 113
03:45:18.300518 IP node4.36649 > node4.36908: UDP, length 113
03:45:18.302225 IP node4.35245 > node4.34557: UDP, length 113
03:45:18.302316 IP node4.35245 > node4.36908: UDP, length 113
03:45:18.313106 IP node4.48630 > node4.36908: UDP, length 113
03:45:18.313372 IP node4.48630 > node4.34557: UDP, length 113
03:45:18.331136 IP node4.44659 > node4.34557: UDP, length 113
03:45:18.331469 IP node4.44659 > node4.36908: UDP, length 113
03:45:18.354126 IP node4.42011 > node4.36908: UDP, length 113
03:45:18.354607 IP node4.42011 > node4.34557: UDP, length 113
03:45:18.358434 IP node4.43535 > node4.34557: UDP, length 113
03:45:18.358481 IP node4.43535 > node4.36908: UDP, length 113
03:45:18.359388 IP node4.43535 > node4.45176: UDP, length 87
03:45:18.359969 IP node4.45176 > node4.43535: UDP, length 94
03:45:18.397751 IP node4.54451 > node4.45176: UDP, length 113
03:45:18.397818 IP node4.54451 > node4.35245: UDP, length 113
03:45:18.397987 IP node4.55298 > node4.54451: UDP, length 113
03:45:18.398200 IP node4.51545 > node4.54451: UDP, length 113
03:45:18.398871 IP node4.43535 > node4.54451: UDP, length 113
03:45:18.399823 IP node4.47204 > node4.54451: UDP, length 113
03:45:18.400589 IP node4.42011 > node4.54451: UDP, length 113
03:45:18.405985 IP node4.35032 > node4.54451: UDP, length 112
03:45:18.406202 IP node4.54451 > node4.43535: UDP, length 113
03:45:18.406398 IP node4.54451 > node4.44659: UDP, length 113
03:45:18.410533 IP node4.54451 > node4.44488: UDP, length 113
03:45:18.411275 IP node4.54451 > node4.36649: UDP, length 113
03:45:18.412266 IP node4.54451 > node4.55815: UDP, length 113
03:45:18.412546 IP node4.45910 > node4.54451: UDP, length 113
03:45:18.413110 IP node4.54451 > node4.42817: UDP, length 113
03:45:18.413251 IP node4.58434 > node4.54451: UDP, length 113
03:45:18.413550 IP node4.51453 > node4.54451: UDP, length 113
03:45:18.414933 IP node4.45660 > node4.54451: UDP, length 113
03:45:18.415431 IP node4.54451 > node4.48630: UDP, length 113
03:45:18.415647 IP node4.54451 > node4.55298: UDP, length 113
03:45:18.416954 IP node4.45176 > node4.54451: UDP, length 113
03:45:18.418620 IP node4.59050 > node4.54451: UDP, length 113
03:45:18.419143 IP node4.55446 > node4.54451: UDP, length 113
03:45:18.420238 IP node4.35245 > node4.54451: UDP, length 113
03:45:18.421306 IP node4.36649 > node4.54451: UDP, length 113
03:45:18.421707 IP node4.42409 > node4.54451: UDP, length 113
03:45:18.421827 IP node4.42817 > node4.54451: UDP, length 113
03:45:18.422492 IP node4.54451 > node4.34557: UDP, length 113
03:45:18.422533 IP node4.54451 > node4.36908: UDP, length 113
03:45:18.427690 IP node4.43535 > node4.35032: UDP, length 113
03:45:18.427890 IP node4.55446 > node4.35032: UDP, length 113
03:45:18.428432 IP node4.36908 > node4.44488: UDP, length 113
03:45:18.428671 IP node4.59050 > node4.35032: UDP, length 113
03:45:18.428799 IP node4.36908 > node4.36649: UDP, length 113
03:45:18.429159 IP node4.58434 > node4.35032: UDP, length 113
03:45:18.429794 IP node4.36908 > node4.55815: UDP, length 113
03:45:18.430412 IP node4.55298 > node4.35032: UDP, length 113
03:45:18.430430 IP node4.51545 > node4.35032: UDP, length 113
03:45:18.430564 IP node4.36908 > node4.42817: UDP, length 113
03:45:18.431633 IP node4.47204 > node4.35032: UDP, length 113
03:45:18.432011 IP node4.45176 > node4.35032: UDP, length 113
03:45:18.432298 IP node4.42409 > node4.35032: UDP, length 113
03:45:18.432937 IP node4.45660 > node4.35032: UDP, length 113
03:45:18.434298 IP node4.51453 > node4.35032: UDP, length 113
03:45:18.437351 IP node4.54451 > node4.35032: UDP, length 113
03:45:18.440565 IP node4.42011 > node4.35032: UDP, length 113
03:45:18.446622 IP node4.35245 > node4.35032: UDP, length 113
03:45:18.448107 IP node4.45910 > node4.35032: UDP, length 113
03:45:18.449256 IP node4.42817 > node4.35032: UDP, length 113
03:45:18.451657 IP node4.58434 > node4.35524: UDP, length 113
03:45:18.451831 IP node4.42011 > node4.35524: UDP, length 113
03:45:18.451831 IP node4.43535 > node4.35524: UDP, length 113
03:45:18.452019 IP node4.55446 > node4.35524: UDP, length 113
03:45:18.452764 IP node4.45660 > node4.35524: UDP, length 113
03:45:18.453589 IP node4.35245 > node4.35524: UDP, length 113
03:45:18.454441 IP node4.51545 > node4.35524: UDP, length 113
03:45:18.454852 IP node4.45910 > node4.35524: UDP, length 113
03:45:18.456507 IP node4.35588 > node4.54451: UDP, length 113
03:45:18.456959 IP node4.35588 > node4.35032: UDP, length 113
03:45:18.456966 IP node4.51453 > node4.35524: UDP, length 113
03:45:18.457096 IP node4.35588 > node4.35524: UDP, length 113
03:45:18.458530 IP node4.47204 > node4.35524: UDP, length 113
03:45:18.458650 IP node4.55298 > node4.35524: UDP, length 113
03:45:18.459175 IP node4.42409 > node4.35524: UDP, length 113
03:45:18.459197 IP node4.36649 > node4.35524: UDP, length 113
03:45:18.459359 IP node4.36649 > node4.35032: UDP, length 113
03:45:18.459489 IP node4.54451 > node4.45910: UDP, length 113
03:45:18.461220 IP node4.45176 > node4.35524: UDP, length 113
03:45:18.461950 IP node4.59050 > node4.35524: UDP, length 113
03:45:18.463933 IP node4.42345 > node4.35524: UDP, length 113
03:45:18.464239 IP node4.42345 > node4.34557: UDP, length 113
03:45:18.464339 IP node4.42345 > node4.36908: UDP, length 113
03:45:18.464351 IP node4.42345 > node4.54451: UDP, length 113
03:45:18.464416 IP node4.42345 > node4.35032: UDP, length 113
03:45:18.465100 IP node4.35032 > node4.35524: UDP, length 112
03:45:18.465515 IP node4.42817 > node4.35524: UDP, length 113
03:45:18.476638 IP node4.48630 > node4.54451: UDP, length 113
03:45:18.488694 IP node4.55815 > node4.36908: UDP, length 113
03:45:18.489525 IP node4.55815 > node4.34557: UDP, length 113
03:45:18.489922 IP node4.48630 > node4.35032: UDP, length 113
03:45:18.490538 IP node4.48630 > node4.35524: UDP, length 113
03:45:18.507249 IP node4.47308 > node4.35524: UDP, length 113
03:45:18.507519 IP node4.47308 > node4.34557: UDP, length 113
03:45:18.507554 IP node4.47308 > node4.36908: UDP, length 113
03:45:18.507588 IP node4.47308 > node4.54451: UDP, length 113
03:45:18.507628 IP node4.47308 > node4.35032: UDP, length 113
03:45:18.513016 IP node4.55815 > node4.35032: UDP, length 113
03:45:18.513266 IP node4.55815 > node4.35524: UDP, length 113
03:45:18.526964 IP node4.36908 > node4.48630: UDP, length 113
03:45:18.529667 IP node4.44488 > node4.35524: UDP, length 113
03:45:18.529789 IP node4.44488 > node4.54451: UDP, length 113
03:45:18.529824 IP node4.44488 > node4.35032: UDP, length 113
03:45:18.536067 IP node4.44659 > node4.35524: UDP, length 113
03:45:18.536207 IP node4.44659 > node4.54451: UDP, length 113
03:45:18.536246 IP node4.44659 > node4.35032: UDP, length 113
03:45:18.546111 IP node4.39087 > node4.35524: UDP, length 113
03:45:18.546418 IP node4.39087 > node4.54451: UDP, length 113
03:45:18.546447 IP node4.39087 > node4.35032: UDP, length 113
03:45:18.546463 IP node4.39087 > node4.45910: UDP, length 113
03:45:18.546502 IP node4.39087 > node4.34557: UDP, length 113
03:45:18.546566 IP node4.39087 > node4.36908: UDP, length 113
03:45:18.568639 IP node4.54451 > node4.35524: UDP, length 113
03:45:18.585036 IP node4.36744 > node4.35524: UDP, length 112
03:45:18.585487 IP node4.36744 > node4.54451: UDP, length 112
03:45:18.585553 IP node4.36744 > node4.35032: UDP, length 112
03:45:18.625884 IP node4.34557 > node4.44488: UDP, length 113
03:45:18.626263 IP node4.34557 > node4.36649: UDP, length 113
03:45:18.626929 IP node4.34557 > node4.55815: UDP, length 113
03:45:18.628164 IP node4.34557 > node4.42817: UDP, length 113
03:45:18.630546 IP node4.34557 > node4.48630: UDP, length 113
03:45:18.707004 IP node4.58434 > node4.57522: UDP, length 113
03:45:18.707347 IP node4.47308 > node4.57522: UDP, length 113
03:45:18.707501 IP node4.44659 > node4.57522: UDP, length 113
03:45:18.707581 IP node4.44488 > node4.57522: UDP, length 113
03:45:18.707721 IP node4.55298 > node4.57522: UDP, length 113
03:45:18.708325 IP node4.42409 > node4.57522: UDP, length 113
03:45:18.709953 IP node4.45910 > node4.57522: UDP, length 113
03:45:18.710133 IP node4.51545 > node4.57522: UDP, length 113
03:45:18.710208 IP node4.45660 > node4.57522: UDP, length 113
03:45:18.710261 IP node4.42011 > node4.57522: UDP, length 113
03:45:18.710730 IP node4.36649 > node4.57522: UDP, length 113
03:45:18.710967 IP node4.59050 > node4.57522: UDP, length 113
03:45:18.711205 IP node4.35032 > node4.57522: UDP, length 112
03:45:18.712469 IP node4.55446 > node4.57522: UDP, length 113
03:45:18.713335 IP node4.47204 > node4.57522: UDP, length 113
03:45:18.713830 IP node4.45176 > node4.57522: UDP, length 113
03:45:18.714321 IP node4.51453 > node4.57522: UDP, length 113
03:45:18.714352 IP node4.51453 > node4.38741: UDP, length 113
03:45:18.714352 IP node4.44488 > node4.38741: UDP, length 113
03:45:18.715158 IP node4.35032 > node4.38741: UDP, length 112
03:45:18.715167 IP node4.55298 > node4.38741: UDP, length 113
03:45:18.715878 IP node4.42011 > node4.38741: UDP, length 113
03:45:18.716092 IP node4.44659 > node4.38741: UDP, length 113
03:45:18.716537 IP node4.47308 > node4.38741: UDP, length 113
03:45:18.716912 IP node4.42409 > node4.38741: UDP, length 113
03:45:18.717704 IP node4.51545 > node4.38741: UDP, length 113
03:45:18.718246 IP node4.45660 > node4.38741: UDP, length 113
03:45:18.718264 IP node4.47204 > node4.38741: UDP, length 113
03:45:18.718682 IP node4.45176 > node4.38741: UDP, length 113
03:45:18.718814 IP node4.36649 > node4.38741: UDP, length 113
03:45:18.719639 IP node4.58434 > node4.38741: UDP, length 113
03:45:18.720441 IP node4.55446 > node4.38741: UDP, length 113
03:45:18.720810 IP node4.59050 > node4.38741: UDP, length 113
03:45:18.721091 IP node4.45910 > node4.38741: UDP, length 113
03:45:18.753297 IP node4.35245 > node4.57522: UDP, length 113
03:45:18.753589 IP node4.35245 > node4.38741: UDP, length 113
03:45:18.755632 IP node4.48630 > node4.57522: UDP, length 113
03:45:18.755672 IP node4.48630 > node4.38741: UDP, length 113
03:45:18.756770 IP node4.35524 > node4.44659: UDP, length 113
03:45:18.757184 IP node4.35524 > node4.43535: UDP, length 113
03:45:18.758769 IP node4.35524 > node4.44488: UDP, length 113
03:45:18.758928 IP node4.35524 > node4.36649: UDP, length 113
03:45:18.759493 IP node4.35524 > node4.55815: UDP, length 113
03:45:18.760028 IP node4.35524 > node4.42817: UDP, length 113
03:45:18.785045 IP node4.54451 > node4.57522: UDP, length 113
03:45:18.785357 IP node4.54451 > node4.38741: UDP, length 113
03:45:18.787549 IP node4.39087 > node4.57522: UDP, length 113
03:45:18.787923 IP node4.39087 > node4.38741: UDP, length 113
03:45:18.805206 IP node4.42409 > node4.44108: UDP, length 113
03:45:18.805347 IP node4.45910 > node4.44108: UDP, length 113
03:45:18.805610 IP node4.44108 > node4.48630: UDP, length 113
03:45:18.806141 IP node4.44108 > node4.55298: UDP, length 113
03:45:18.806323 IP node4.44108 > node4.42817: UDP, length 113
03:45:18.807516 IP node4.44488 > node4.44108: UDP, length 113
03:45:18.807618 IP node4.42011 > node4.44108: UDP, length 113
03:45:18.808066 IP node4.35032 > node4.44108: UDP, length 112
03:45:18.808817 IP node4.44659 > node4.44108: UDP, length 113
03:45:18.809148 IP node4.39087 > node4.44108: UDP, length 113
03:45:18.809551 IP node4.44108 > node4.45910: UDP, length 113
03:45:18.810064 IP node4.59050 > node4.44108: UDP, length 113
03:45:18.817368 IP node4.47308 > node4.44108: UDP, length 113
03:45:18.818677 IP node4.45660 > node4.44108: UDP, length 113
03:45:18.819774 IP node4.47204 > node4.44108: UDP, length 113
03:45:18.822873 IP node4.51545 > node4.44108: UDP, length 113
03:45:18.823453 IP node4.51453 > node4.44108: UDP, length 113
03:45:18.824698 IP node4.55446 > node4.44108: UDP, length 113
03:45:18.825847 IP node4.58434 > node4.44108: UDP, length 113
03:45:18.826624 IP node4.36649 > node4.44108: UDP, length 113
03:45:18.826933 IP node4.54451 > node4.44108: UDP, length 113
03:45:18.827590 IP node4.48630 > node4.44108: UDP, length 113
03:45:18.833003 IP node4.34557 > node4.55298: UDP, length 113
03:45:18.834689 IP node4.44108 > node4.36908: UDP, length 113
03:45:18.855732 IP node4.55815 > node4.54451: UDP, length 113
03:45:18.857432 IP node4.55815 > node4.57522: UDP, length 113
03:45:18.858336 IP node4.55815 > node4.44108: UDP, length 113
03:45:18.858538 IP node4.55815 > node4.38741: UDP, length 113
03:45:18.860653 IP node4.35588 > node4.57522: UDP, length 113
03:45:18.868271 IP node4.45176 > node4.44108: UDP, length 113
03:45:18.888997 IP node4.42345 > node4.57522: UDP, length 113
03:45:18.889166 IP node4.42345 > node4.38741: UDP, length 113
03:45:18.889323 IP node4.42345 > node4.44108: UDP, length 113
03:45:18.905988 IP node4.36744 > node4.57522: UDP, length 112
03:45:18.906132 IP node4.36744 > node4.38741: UDP, length 112
03:45:18.906367 IP node4.36744 > node4.44108: UDP, length 112
03:45:18.908693 IP node4.35524 > node4.48630: UDP, length 113
03:45:18.913180 IP node4.34557 > node4.45910: UDP, length 113
03:45:18.913865 IP node4.34557 > node4.36908: UDP, length 113
03:45:18.914508 IP node4.34557 > node4.54451: UDP, length 113
03:45:18.914769 IP node4.34557 > node4.35032: UDP, length 113
03:45:18.915770 IP node4.35524 > node4.55298: UDP, length 113
03:45:18.916067 IP node4.35524 > node4.36908: UDP, length 113
03:45:18.916280 IP node4.35524 > node4.45910: UDP, length 113
03:45:18.917210 IP node4.35245 > node4.44108: UDP, length 113
03:45:18.936674 IP node4.35588 > node4.38741: UDP, length 113
03:45:18.936966 IP node4.35588 > node4.44108: UDP, length 113
03:45:18.959806 IP node4.38347 > node4.48630: UDP, length 113
03:45:18.960045 IP node4.38347 > node4.55298: UDP, length 113
03:45:18.963184 IP node4.42345 > node4.38347: UDP, length 113
03:45:18.963411 IP node4.42409 > node4.38347: UDP, length 113
03:45:18.964389 IP node4.51545 > node4.38347: UDP, length 113
03:45:18.964661 IP node4.45176 > node4.38347: UDP, length 113
03:45:18.965391 IP node4.35032 > node4.38347: UDP, length 112
03:45:18.965736 IP node4.58434 > node4.38347: UDP, length 113
03:45:18.965810 IP node4.47204 > node4.38347: UDP, length 113
03:45:18.968827 IP node4.38347 > node4.45910: UDP, length 113
03:45:18.969552 IP node4.44488 > node4.38347: UDP, length 113
03:45:18.969796 IP node4.35245 > node4.38347: UDP, length 113
03:45:18.969796 IP node4.51453 > node4.38347: UDP, length 113
03:45:18.970090 IP node4.45660 > node4.38347: UDP, length 113
03:45:18.970406 IP node4.59050 > node4.38347: UDP, length 113
03:45:18.970638 IP node4.55446 > node4.38347: UDP, length 113
03:45:18.970814 IP node4.47308 > node4.38347: UDP, length 113
03:45:18.972104 IP node4.39087 > node4.38347: UDP, length 113
03:45:18.972259 IP node4.36744 > node4.38347: UDP, length 112
03:45:18.972737 IP node4.45910 > node4.38347: UDP, length 113
03:45:18.973482 IP node4.48630 > node4.38347: UDP, length 113
03:45:18.975809 IP node4.42817 > node4.38347: UDP, length 113
03:45:18.975922 IP node4.42817 > node4.57522: UDP, length 113
03:45:18.976102 IP node4.42817 > node4.38741: UDP, length 113
03:45:18.976239 IP node4.42817 > node4.44108: UDP, length 113
03:45:18.979380 IP node4.54451 > node4.38347: UDP, length 113
03:45:18.994485 IP node4.35524 > node4.34557: UDP, length 113
03:45:18.994895 IP node4.35524 > node4.54451: UDP, length 113
03:45:18.995108 IP node4.35524 > node4.35032: UDP, length 113
03:45:18.996182 IP node4.35524 > node4.57522: UDP, length 113
03:45:18.996396 IP node4.35524 > node4.38741: UDP, length 113
03:45:18.997965 IP node4.35524 > node4.38347: UDP, length 113
03:45:18.998101 IP node4.35524 > node4.44108: UDP, length 113
03:45:18.998987 IP node4.35588 > node4.38347: UDP, length 113
03:45:19.003275 IP node4.36908 > node4.34557: UDP, length 113
03:45:19.003370 IP node4.36908 > node4.55298: UDP, length 113
03:45:19.003509 IP node4.36908 > node4.54451: UDP, length 113
03:45:19.003567 IP node4.36908 > node4.35032: UDP, length 113
03:45:19.003716 IP node4.36908 > node4.45910: UDP, length 113
03:45:19.003989 IP node4.36908 > node4.35524: UDP, length 113
03:45:19.004064 IP node4.36908 > node4.57522: UDP, length 113
03:45:19.004946 IP node4.34557 > node4.57522: UDP, length 113
03:45:19.005215 IP node4.36649 > node4.38347: UDP, length 113
03:45:19.005256 IP node4.34557 > node4.38741: UDP, length 113
03:45:19.005711 IP node4.34557 > node4.44108: UDP, length 113
03:45:19.006698 IP node4.34557 > node4.38347: UDP, length 113
03:45:19.006994 IP node4.34557 > node4.35524: UDP, length 113
03:45:19.007620 IP node4.51320 > node4.55815: UDP, length 113
03:45:19.009134 IP node4.35524 > node4.51320: UDP, length 113
03:45:19.011878 IP node4.35588 > node4.51320: UDP, length 113
03:45:19.013078 IP node4.42409 > node4.51320: UDP, length 113
03:45:19.013703 IP node4.45910 > node4.51320: UDP, length 113
03:45:19.014961 IP node4.47308 > node4.51320: UDP, length 113
03:45:19.015785 IP node4.42345 > node4.51320: UDP, length 113
03:45:19.016834 IP node4.44488 > node4.51320: UDP, length 113
03:45:19.018074 IP node4.51453 > node4.51320: UDP, length 113
03:45:19.019455 IP node4.45660 > node4.51320: UDP, length 113
03:45:19.020201 IP node4.59050 > node4.51320: UDP, length 113
03:45:19.021137 IP node4.51545 > node4.51320: UDP, length 113
03:45:19.021717 IP node4.39087 > node4.51320: UDP, length 113
03:45:19.021993 IP node4.45176 > node4.51320: UDP, length 113
03:45:19.022114 IP node4.35032 > node4.51320: UDP, length 112
03:45:19.022240 IP node4.47204 > node4.51320: UDP, length 113
03:45:19.022360 IP node4.55446 > node4.51320: UDP, length 113
03:45:19.022643 IP node4.36649 > node4.51320: UDP, length 113
03:45:19.023037 IP node4.42817 > node4.51320: UDP, length 113
03:45:19.026369 IP node4.58434 > node4.51320: UDP, length 113
03:45:19.026380 IP node4.36744 > node4.51320: UDP, length 112
03:45:19.026994 IP node4.35245 > node4.51320: UDP, length 113
03:45:19.027512 IP node4.51320 > node4.44488: UDP, length 113
03:45:19.027576 IP node4.51320 > node4.43535: UDP, length 113
03:45:19.028087 IP node4.51320 > node4.44659: UDP, length 113
03:45:19.028271 IP node4.51320 > node4.36649: UDP, length 113
03:45:19.030556 IP node4.36908 > node4.38741: UDP, length 113
03:45:19.030619 IP node4.36908 > node4.44108: UDP, length 113
03:45:19.031357 IP node4.36908 > node4.51320: UDP, length 113
03:45:19.033820 IP node4.34557 > node4.51320: UDP, length 113
03:45:19.035868 IP node4.54451 > node4.51320: UDP, length 113
03:45:19.037965 IP node4.48630 > node4.51320: UDP, length 113
03:45:19.048066 IP node4.51320 > node4.42817: UDP, length 113
03:45:19.065036 IP node4.42011 > node4.51320: UDP, length 113
03:45:19.065089 IP node4.42011 > node4.38347: UDP, length 113
03:45:19.067401 IP node4.51320 > node4.48630: UDP, length 113
03:45:19.067550 IP node4.51320 > node4.55298: UDP, length 113
03:45:19.114387 IP node4.36908 > node4.38347: UDP, length 113
03:45:19.199069 IP node4.44659 > node4.51320: UDP, length 113
03:45:19.199125 IP node4.44659 > node4.38347: UDP, length 113
03:45:19.223231 IP node4.51320 > node4.36908: UDP, length 113
03:45:19.225508 IP node4.44108 > node4.34557: UDP, length 113
03:45:19.230586 IP node4.55298 > node4.51320: UDP, length 113
03:45:19.230661 IP node4.55298 > node4.38347: UDP, length 113
03:45:19.230797 IP node4.55298 > node4.44108: UDP, length 113
03:45:19.247489 IP node4.43535 > node4.51320: UDP, length 113
03:45:19.247533 IP node4.43535 > node4.38347: UDP, length 113
03:45:19.247563 IP node4.43535 > node4.57522: UDP, length 113
03:45:19.247856 IP node4.43535 > node4.38741: UDP, length 113
03:45:19.247978 IP node4.43535 > node4.44108: UDP, length 113
03:45:19.275045 IP node4.55815 > node4.38347: UDP, length 113
03:45:19.275091 IP node4.55815 > node4.51320: UDP, length 113
03:45:19.302869 IP node4.38347 > node4.36908: UDP, length 113
03:45:19.303097 IP node4.38347 > node4.34557: UDP, length 113
03:45:19.316073 IP node4.38347 > node4.54451: UDP, length 113
03:45:19.316393 IP node4.38347 > node4.35032: UDP, length 113
03:45:19.318161 IP node4.38347 > node4.35524: UDP, length 113
03:45:19.320059 IP node4.38347 > node4.57522: UDP, length 113
03:45:19.320422 IP node4.51320 > node4.45910: UDP, length 113
03:45:19.320639 IP node4.38347 > node4.38741: UDP, length 113
03:45:19.321518 IP node4.51320 > node4.34557: UDP, length 113
03:45:19.321600 IP node4.42261 > node4.35524: UDP, length 113
03:45:19.321801 IP node4.42261 > node4.51320: UDP, length 113
03:45:19.321842 IP node4.42261 > node4.38347: UDP, length 113
03:45:19.321883 IP node4.42261 > node4.36908: UDP, length 113
03:45:19.321928 IP node4.42261 > node4.57522: UDP, length 113
03:45:19.322052 IP node4.42261 > node4.38741: UDP, length 113
03:45:19.322163 IP node4.42261 > node4.54451: UDP, length 113
03:45:19.322203 IP node4.42261 > node4.35032: UDP, length 113
03:45:19.322327 IP node4.42261 > node4.44108: UDP, length 113
03:45:19.325005 IP node4.51320 > node4.54451: UDP, length 113
03:45:19.326385 IP node4.42261 > node4.34557: UDP, length 113
03:45:19.342604 IP node4.51320 > node4.35032: UDP, length 113
03:45:19.342881 IP node4.51320 > node4.35524: UDP, length 113
03:45:19.350333 IP node4.51320 > node4.57522: UDP, length 113
03:45:19.350527 IP node4.51320 > node4.38741: UDP, length 113
03:45:19.354796 IP node4.51320 > node4.44108: UDP, length 113
03:45:19.381896 IP node4.38347 > node4.44108: UDP, length 113
03:45:19.392045 IP node4.38347 > node4.51320: UDP, length 113
03:45:19.396136 IP node4.51320 > node4.38347: UDP, length 113
03:45:19.399794 IP node4.38741 > node4.44659: UDP, length 113
03:45:19.400339 IP node4.38741 > node4.43535: UDP, length 113
03:45:19.403191 IP node4.44108 > node4.54451: UDP, length 113
03:45:19.403584 IP node4.44108 > node4.35032: UDP, length 113
03:45:19.405157 IP node4.44108 > node4.35524: UDP, length 113
03:45:19.405949 IP node4.44108 > node4.57522: UDP, length 113
03:45:19.406151 IP node4.44108 > node4.38741: UDP, length 113
03:45:19.410699 IP node4.44108 > node4.38347: UDP, length 113
03:45:19.410858 IP node4.44108 > node4.51320: UDP, length 113
03:45:19.422186 IP node4.38741 > node4.44488: UDP, length 113
03:45:19.422383 IP node4.38741 > node4.36649: UDP, length 113
03:45:19.423318 IP node4.38741 > node4.55815: UDP, length 113
03:45:19.423929 IP node4.38741 > node4.42817: UDP, length 113
03:45:19.425423 IP node4.38741 > node4.48630: UDP, length 113
03:45:19.430596 IP node4.38741 > node4.55298: UDP, length 113
03:45:19.431737 IP node4.38741 > node4.45910: UDP, length 113
03:45:19.460928 IP node4.38741 > node4.36908: UDP, length 113
03:45:19.479318 IP node4.57522 > node4.55815: UDP, length 113
03:45:19.495280 IP node4.38741 > node4.35524: UDP, length 113
03:45:19.495579 IP node4.38741 > node4.51320: UDP, length 113
03:45:19.495641 IP node4.38741 > node4.38347: UDP, length 113
03:45:19.495700 IP node4.38741 > node4.34557: UDP, length 113
03:45:19.495775 IP node4.38741 > node4.57522: UDP, length 113
03:45:19.495992 IP node4.38741 > node4.54451: UDP, length 113
03:45:19.496072 IP node4.38741 > node4.35032: UDP, length 113
03:45:19.496228 IP node4.38741 > node4.44108: UDP, length 113
03:45:19.520359 IP node4.57522 > node4.48630: UDP, length 113
03:45:19.520535 IP node4.57522 > node4.42817: UDP, length 113
03:45:19.520797 IP node4.57522 > node4.55298: UDP, length 113
03:45:19.522743 IP node4.57522 > node4.45910: UDP, length 113
03:45:19.534422 IP node4.57522 > node4.34557: UDP, length 113
03:45:19.535317 IP node4.57522 > node4.36908: UDP, length 113
03:45:19.537511 IP node4.57522 > node4.54451: UDP, length 113
03:45:19.539942 IP node4.57522 > node4.35032: UDP, length 113
03:45:19.540732 IP node4.57522 > node4.35524: UDP, length 113
03:45:19.542181 IP node4.57522 > node4.38741: UDP, length 113
03:45:19.542610 IP node4.57522 > node4.44108: UDP, length 113
03:45:19.543804 IP node4.57522 > node4.38347: UDP, length 113
03:45:19.543976 IP node4.57522 > node4.51320: UDP, length 113
03:45:19.630304 IP node4.42261 > node4.35193: UDP, length 113
03:45:19.630914 IP node4.55815 > node4.35193: UDP, length 113
03:45:19.631617 IP node4.47204 > node4.35193: UDP, length 113
03:45:19.632103 IP node4.35588 > node4.35193: UDP, length 113
03:45:19.632712 IP node4.35245 > node4.35193: UDP, length 113
03:45:19.636285 IP node4.35032 > node4.35193: UDP, length 112
03:45:19.636556 IP node4.51545 > node4.35193: UDP, length 113
03:45:19.636702 IP node4.34557 > node4.35193: UDP, length 113
03:45:19.636857 IP node4.35524 > node4.35193: UDP, length 113
03:45:19.637003 IP node4.48630 > node4.35193: UDP, length 113
03:45:19.637135 IP node4.54451 > node4.35193: UDP, length 113
03:45:19.637275 IP node4.44659 > node4.35193: UDP, length 113
03:45:19.637403 IP node4.42011 > node4.35193: UDP, length 113
03:45:19.637657 IP node4.39087 > node4.35193: UDP, length 113
03:45:19.638342 IP node4.43535 > node4.35193: UDP, length 113
03:45:19.638533 IP node4.44108 > node4.35193: UDP, length 113
03:45:19.639678 IP node4.36908 > node4.35193: UDP, length 113
03:45:19.639960 IP node4.38347 > node4.35193: UDP, length 113
03:45:19.640238 IP node4.42345 > node4.35193: UDP, length 113
03:45:19.640797 IP node4.45176 > node4.35193: UDP, length 113
03:45:19.641658 IP node4.42409 > node4.35193: UDP, length 113
03:45:19.642642 IP node4.58434 > node4.35193: UDP, length 113
03:45:19.644635 IP node4.59050 > node4.35193: UDP, length 113
03:45:19.644994 IP node4.55298 > node4.35193: UDP, length 113
03:45:19.645531 IP node4.45660 > node4.35193: UDP, length 113
03:45:19.645771 IP node4.47308 > node4.35193: UDP, length 113
03:45:19.646077 IP node4.51453 > node4.35193: UDP, length 113
03:45:19.646279 IP node4.36744 > node4.35193: UDP, length 112
03:45:19.646372 IP node4.35193 > node4.35032: UDP, length 113
03:45:19.646463 IP node4.55446 > node4.35193: UDP, length 113
03:45:19.646768 IP node4.35193 > node4.35524: UDP, length 113
03:45:19.646768 IP node4.42817 > node4.35193: UDP, length 113
03:45:19.648551 IP node4.36649 > node4.35193: UDP, length 113
03:45:19.649284 IP node4.44488 > node4.35193: UDP, length 113
03:45:19.649581 IP node4.45910 > node4.35193: UDP, length 113
03:45:19.650416 IP node4.57522 > node4.35193: UDP, length 113
03:45:19.651514 IP node4.51320 > node4.35193: UDP, length 113
03:45:19.652378 IP node4.35193 > node4.57522: UDP, length 113
03:45:19.652601 IP node4.35193 > node4.38741: UDP, length 113
03:45:19.653086 IP node4.35193 > node4.44108: UDP, length 113
03:45:19.653992 IP node4.35193 > node4.38347: UDP, length 113
03:45:19.654168 IP node4.35193 > node4.51320: UDP, length 113
03:45:19.656846 IP node4.38741 > node4.35193: UDP, length 113
03:45:19.700399 IP node4.42261 > node4.56385: UDP, length 113
03:45:19.701467 IP node4.48630 > node4.56385: UDP, length 113
03:45:19.701641 IP node4.36908 > node4.56385: UDP, length 113
03:45:19.701918 IP node4.34557 > node4.56385: UDP, length 113
03:45:19.702110 IP node4.44108 > node4.56385: UDP, length 113
03:45:19.702151 IP node4.58434 > node4.56385: UDP, length 113
03:45:19.702324 IP node4.35524 > node4.56385: UDP, length 113
03:45:19.702633 IP node4.44659 > node4.56385: UDP, length 113
03:45:19.702914 IP node4.38347 > node4.56385: UDP, length 113
03:45:19.703049 IP node4.55298 > node4.56385: UDP, length 113
03:45:19.706069 IP node4.51320 > node4.56385: UDP, length 113
03:45:19.706248 IP node4.35588 > node4.56385: UDP, length 113
03:45:19.707167 IP node4.45176 > node4.56385: UDP, length 113
03:45:19.707331 IP node4.43535 > node4.56385: UDP, length 113
03:45:19.707555 IP node4.42011 > node4.56385: UDP, length 113
03:45:19.708204 IP node4.59050 > node4.56385: UDP, length 113
03:45:19.708872 IP node4.57522 > node4.56385: UDP, length 113
03:45:19.709330 IP node4.39087 > node4.56385: UDP, length 113
03:45:19.709969 IP node4.38741 > node4.56385: UDP, length 113
03:45:19.710747 IP node4.35032 > node4.56385: UDP, length 112
03:45:19.710870 IP node4.36744 > node4.56385: UDP, length 112
03:45:19.711260 IP node4.51545 > node4.56385: UDP, length 113
03:45:19.712417 IP node4.42409 > node4.56385: UDP, length 113
03:45:19.712676 IP node4.47204 > node4.56385: UDP, length 113
03:45:19.712974 IP node4.35245 > node4.56385: UDP, length 113
03:45:19.713981 IP node4.42345 > node4.56385: UDP, length 113
03:45:19.714502 IP node4.36649 > node4.56385: UDP, length 113
03:45:19.715803 IP node4.54451 > node4.56385: UDP, length 113
03:45:19.716562 IP node4.44488 > node4.56385: UDP, length 113
03:45:19.717922 IP node4.55446 > node4.56385: UDP, length 113
03:45:19.718182 IP node4.47308 > node4.56385: UDP, length 113
03:45:19.718424 IP node4.51453 > node4.56385: UDP, length 113
03:45:19.718923 IP node4.42817 > node4.56385: UDP, length 113
03:45:19.719179 IP node4.45910 > node4.56385: UDP, length 113
03:45:19.730411 IP node4.45660 > node4.56385: UDP, length 113
03:45:19.734735 IP node4.55815 > node4.56385: UDP, length 113
03:45:19.754892 IP node4.35193 > node4.54451: UDP, length 113
03:45:19.822184 IP node4.35193 > node4.56385: UDP, length 113
03:45:19.833868 IP node4.56385 > node4.45910: UDP, length 113
03:45:19.834552 IP node4.56385 > node4.36908: UDP, length 113
03:45:19.835252 IP node4.56385 > node4.34557: UDP, length 113
03:45:19.836194 IP node4.56385 > node4.54451: UDP, length 113
03:45:19.836856 IP node4.56385 > node4.35032: UDP, length 113
03:45:19.837122 IP node4.56385 > node4.35524: UDP, length 113
03:45:19.838116 IP node4.56385 > node4.57522: UDP, length 113
03:45:19.838688 IP node4.56385 > node4.38741: UDP, length 113
03:45:19.839199 IP node4.56385 > node4.44108: UDP, length 113
03:45:19.841027 IP node4.56385 > node4.38347: UDP, length 113
03:45:19.841218 IP node4.56385 > node4.51320: UDP, length 113
03:45:19.885999 IP node4.42261 > node4.49419: UDP, length 113
03:45:19.886881 IP node4.34557 > node4.49419: UDP, length 113
03:45:19.887055 IP node4.54451 > node4.49419: UDP, length 113
03:45:19.887537 IP node4.55815 > node4.49419: UDP, length 113
03:45:19.888025 IP node4.45176 > node4.49419: UDP, length 113
03:45:19.888557 IP node4.38741 > node4.49419: UDP, length 113
03:45:19.888577 IP node4.35524 > node4.49419: UDP, length 113
03:45:19.889005 IP node4.48630 > node4.49419: UDP, length 113
03:45:19.889517 IP node4.57522 > node4.49419: UDP, length 113
03:45:19.889741 IP node4.51320 > node4.49419: UDP, length 113
03:45:19.889809 IP node4.36908 > node4.49419: UDP, length 113
03:45:19.889866 IP node4.35193 > node4.49419: UDP, length 113
03:45:19.889974 IP node4.35588 > node4.49419: UDP, length 113
03:45:19.889983 IP node4.44108 > node4.49419: UDP, length 113
03:45:19.890112 IP node4.38347 > node4.49419: UDP, length 113
03:45:19.890360 IP node4.44659 > node4.49419: UDP, length 113
03:45:19.890493 IP node4.58434 > node4.49419: UDP, length 113
03:45:19.890531 IP node4.42011 > node4.49419: UDP, length 113
03:45:19.891001 IP node4.55298 > node4.49419: UDP, length 113
03:45:19.891121 IP node4.59050 > node4.49419: UDP, length 113
03:45:19.891301 IP node4.35245 > node4.49419: UDP, length 113
03:45:19.891442 IP node4.43535 > node4.49419: UDP, length 113
03:45:19.894908 IP node4.42345 > node4.49419: UDP, length 113
03:45:19.895192 IP node4.47204 > node4.49419: UDP, length 113
03:45:19.895428 IP node4.42409 > node4.49419: UDP, length 113
03:45:19.895750 IP node4.35032 > node4.49419: UDP, length 112
03:45:19.896630 IP node4.51545 > node4.49419: UDP, length 113
03:45:19.897751 IP node4.36744 > node4.49419: UDP, length 112
03:45:19.898714 IP node4.45660 > node4.49419: UDP, length 113
03:45:19.899041 IP node4.47308 > node4.49419: UDP, length 113
03:45:19.899208 IP node4.51453 > node4.49419: UDP, length 113
03:45:19.899482 IP node4.44488 > node4.49419: UDP, length 113
03:45:19.899605 IP node4.45910 > node4.49419: UDP, length 113
03:45:19.899743 IP node4.36649 > node4.49419: UDP, length 113
03:45:19.900114 IP node4.55446 > node4.49419: UDP, length 113
03:45:19.900624 IP node4.42817 > node4.49419: UDP, length 113
03:45:19.905972 IP node4.39087 > node4.49419: UDP, length 113
03:45:20.158593 IP node4.56385 > node4.35193: UDP, length 113
03:45:20.159533 IP node4.56385 > node4.49419: UDP, length 113
03:45:20.167427 IP node4.42261 > node4.33805: UDP, length 113
03:45:20.167609 IP node4.43535 > node4.33805: UDP, length 113
03:45:20.168866 IP node4.36908 > node4.33805: UDP, length 113
03:45:20.169894 IP node4.57522 > node4.33805: UDP, length 113
03:45:20.170034 IP node4.34557 > node4.33805: UDP, length 113
03:45:20.170189 IP node4.35524 > node4.33805: UDP, length 113
03:45:20.170600 IP node4.35193 > node4.33805: UDP, length 113
03:45:20.171063 IP node4.55298 > node4.33805: UDP, length 113
03:45:20.171186 IP node4.48630 > node4.33805: UDP, length 113
03:45:20.171244 IP node4.42011 > node4.33805: UDP, length 113
03:45:20.171371 IP node4.44659 > node4.33805: UDP, length 113
03:45:20.171626 IP node4.51320 > node4.33805: UDP, length 113
03:45:20.171791 IP node4.38741 > node4.33805: UDP, length 113
03:45:20.171950 IP node4.44108 > node4.33805: UDP, length 113
03:45:20.172105 IP node4.38347 > node4.33805: UDP, length 113
03:45:20.172335 IP node4.35245 > node4.33805: UDP, length 113
03:45:20.172563 IP node4.45176 > node4.33805: UDP, length 113
03:45:20.173499 IP node4.36649 > node4.33805: UDP, length 113
03:45:20.173957 IP node4.44488 > node4.33805: UDP, length 113
03:45:20.174671 IP node4.59050 > node4.33805: UDP, length 113
03:45:20.174938 IP node4.56385 > node4.33805: UDP, length 113
03:45:20.177978 IP node4.39087 > node4.33805: UDP, length 113
03:45:20.178630 IP node4.36744 > node4.33805: UDP, length 112
03:45:20.179058 IP node4.35032 > node4.33805: UDP, length 112
03:45:20.181620 IP node4.58434 > node4.33805: UDP, length 113
03:45:20.181630 IP node4.45660 > node4.33805: UDP, length 113
03:45:20.181913 IP node4.35588 > node4.33805: UDP, length 113
03:45:20.183288 IP node4.45910 > node4.33805: UDP, length 113
03:45:20.184097 IP node4.55446 > node4.33805: UDP, length 113
03:45:20.184539 IP node4.47204 > node4.33805: UDP, length 113
03:45:20.185314 IP node4.42345 > node4.33805: UDP, length 113
03:45:20.186043 IP node4.42409 > node4.33805: UDP, length 113
03:45:20.186894 IP node4.47308 > node4.33805: UDP, length 113
03:45:20.187294 IP node4.51453 > node4.33805: UDP, length 113
03:45:20.187849 IP node4.55815 > node4.33805: UDP, length 113
03:45:20.205873 IP node4.51545 > node4.33805: UDP, length 113
03:45:20.216262 IP node4.42817 > node4.33805: UDP, length 113
03:45:20.268546 IP node4.54451 > node4.33805: UDP, length 113
03:45:20.412539 IP node4.49419 > node4.35193: UDP, length 113
03:45:20.425115 IP node4.49419 > node4.33805: UDP, length 113
03:45:20.433411 IP node4.49419 > node4.56385: UDP, length 113
03:45:20.560806 IP node4.33805 > node4.35193: UDP, length 113
03:45:20.561243 IP node4.33805 > node4.56385: UDP, length 113
03:45:20.576348 IP node4.33805 > node4.49419: UDP, length 113
03:45:23.622216 IP node4.38347 > node4.33805: UDP, length 113
03:45:23.623482 IP node4.55446 > node4.33805: UDP, length 113
03:45:23.623489 IP node4.38741 > node4.33805: UDP, length 113
03:45:23.623656 IP node4.42409 > node4.33805: UDP, length 113
03:45:23.624264 IP node4.39087 > node4.33805: UDP, length 113
03:45:23.624547 IP node4.44659 > node4.33805: UDP, length 113
03:45:23.624792 IP node4.51320 > node4.33805: UDP, length 113
03:45:23.625147 IP node4.34557 > node4.33805: UDP, length 113
03:45:23.625360 IP node4.51453 > node4.33805: UDP, length 113
03:45:23.625516 IP node4.42345 > node4.33805: UDP, length 113
03:45:23.625598 IP node4.47308 > node4.33805: UDP, length 113
03:45:23.626019 IP node4.55298 > node4.33805: UDP, length 113
03:45:23.626450 IP node4.59050 > node4.33805: UDP, length 113
03:45:23.626744 IP node4.35245 > node4.33805: UDP, length 113
03:45:23.627527 IP node4.58434 > node4.33805: UDP, length 113
03:45:23.627684 IP node4.36649 > node4.33805: UDP, length 113
03:45:23.627819 IP node4.57522 > node4.33805: UDP, length 113
03:45:23.628457 IP node4.35032 > node4.33805: UDP, length 112
03:45:23.628523 IP node4.36744 > node4.33805: UDP, length 112
03:45:23.629274 IP node4.35524 > node4.33805: UDP, length 113
03:45:23.630152 IP node4.44108 > node4.33805: UDP, length 113
03:45:23.630955 IP node4.55815 > node4.33805: UDP, length 113
03:45:23.631124 IP node4.42011 > node4.33805: UDP, length 113
03:45:23.638066 IP node4.36908 > node4.33805: UDP, length 113
03:45:23.638557 IP node4.43535 > node4.33805: UDP, length 113
03:45:23.639216 IP node4.47204 > node4.33805: UDP, length 113
03:45:23.639387 IP node4.54451 > node4.33805: UDP, length 113
03:45:23.640044 IP node4.42817 > node4.33805: UDP, length 113
03:45:23.640328 IP node4.48630 > node4.33805: UDP, length 113
03:45:23.640527 IP node4.44488 > node4.33805: UDP, length 113
03:45:23.640974 IP node4.45176 > node4.33805: UDP, length 113
03:45:23.641340 IP node4.45910 > node4.33805: UDP, length 113
03:45:23.641537 IP node4.35193 > node4.33805: UDP, length 113
03:45:23.641798 IP node4.56385 > node4.33805: UDP, length 113
03:45:23.642121 IP node4.49419 > node4.33805: UDP, length 113
03:45:23.642286 IP node4.35588 > node4.33805: UDP, length 113
03:45:23.642466 IP node4.45660 > node4.33805: UDP, length 113
03:45:23.643150 IP node4.42261 > node4.33805: UDP, length 113
03:45:23.646271 IP node4.51545 > node4.33805: UDP, length 113

