03:45:22.724505 IP node1.59003 > node1.33607: UDP, length 113
03:45:23.065024 IP node1.59003 > node1.42579: UDP, length 113
03:45:23.096834 IP node1.42579 > node1.33607: UDP, length 113
03:45:23.318957 IP node1.33607 > node1.42579: UDP, length 113
03:45:24.013559 IP node1.42579 > node1.58838: UDP, length 113
03:45:24.020122 IP node1.33607 > node1.58838: UDP, length 113
03:45:24.020810 IP node1.59003 > node1.58838: UDP, length 113
03:45:24.383431 IP node1.58838 > node1.42579: UDP, length 113
03:45:24.605012 IP node1.59003 > node1.38553: UDP, length 113
03:45:24.610371 IP node1.42579 > node1.38553: UDP, length 113
03:45:24.630383 IP node1.33607 > node1.38553: UDP, length 113
03:45:24.738380 IP node1.33607 > node1.42579: UDP, length 87
03:45:24.759464 IP node1.58838 > node1.38553: UDP, length 113
03:45:24.801934 IP node1.42579 > node1.33607: UDP, length 94
03:45:24.950146 IP node1.38553 > node1.58838: UDP, length 112
03:45:25.178018 IP node1.58838 > node1.34433: UDP, length 113
03:45:25.178794 IP node1.38553 > node1.34433: UDP, length 112
03:45:25.182181 IP node1.59003 > node1.34433: UDP, length 113
03:45:25.206594 IP node1.33607 > node1.34433: UDP, length 113
03:45:25.237284 IP node1.42579 > node1.34433: UDP, length 113
03:45:25.251037 IP node1.34433 > node1.58838: UDP, length 113
03:45:25.448471 IP node1.59003 > node1.38655: UDP, length 113
03:45:25.450247 IP node1.33607 > node1.38655: UDP, length 113
03:45:25.450638 IP node1.38553 > node1.38655: UDP, length 112
03:45:25.455131 IP node1.58838 > node1.38655: UDP, length 113
03:45:25.459197 IP node1.42579 > node1.38655: UDP, length 113
03:45:25.684939 IP node1.33607 > node1.32848: UDP, length 113
03:45:25.685617 IP node1.59003 > node1.32848: UDP, length 113
03:45:25.685771 IP node1.38553 > node1.32848: UDP, length 112
03:45:25.685829 IP node1.42579 > node1.32848: UDP, length 113
03:45:25.686985 IP node1.58838 > node1.32848: UDP, length 113
03:45:25.766150 IP node1.34433 > node1.38553: UDP, length 113
03:45:25.845787 IP node1.38655 > node1.38553: UDP, length 111
03:45:25.982017 IP node1.34433 > node1.38655: UDP, length 113
03:45:25.984581 IP node1.34433 > node1.32848: UDP, length 113
03:45:25.998540 IP node1.38655 > node1.34433: UDP, length 111
03:45:26.050346 IP node1.33607 > node1.38430: UDP, length 113
03:45:26.052399 IP node1.38553 > node1.38430: UDP, length 112
03:45:26.053151 IP node1.58838 > node1.38430: UDP, length 113
03:45:26.054238 IP node1.42579 > node1.38430: UDP, length 113
03:45:26.054584 IP node1.59003 > node1.38430: UDP, length 113
03:45:26.060639 IP node1.34433 > node1.38430: UDP, length 113
03:45:26.095365 IP node1.38430 > node1.38553: UDP, length 112
03:45:26.106581 IP node1.38430 > node1.34433: UDP, length 112
03:45:26.112738 IP node1.58838 > node1.49865: UDP, length 113
03:45:26.113368 IP node1.59003 > node1.49865: UDP, length 113
03:45:26.113656 IP node1.42579 > node1.49865: UDP, length 113
03:45:26.113831 IP node1.38553 > node1.49865: UDP, length 112
03:45:26.115047 IP node1.34433 > node1.49865: UDP, length 113
03:45:26.119868 IP node1.33607 > node1.49865: UDP, length 113
03:45:26.202852 IP node1.33607 > node1.45429: UDP, length 113
03:45:26.203583 IP node1.34433 > node1.45429: UDP, length 113
03:45:26.203748 IP node1.58838 > node1.45429: UDP, length 113
03:45:26.203880 IP node1.38553 > node1.45429: UDP, length 112
03:45:26.204005 IP node1.59003 > node1.45429: UDP, length 113
03:45:26.204129 IP node1.42579 > node1.45429: UDP, length 113
03:45:26.216981 IP node1.38655 > node1.32848: UDP, length 111
03:45:26.218536 IP node1.38655 > node1.38430: UDP, length 111
03:45:26.219490 IP node1.38655 > node1.49865: UDP, length 111
03:45:26.219810 IP node1.38655 > node1.45429: UDP, length 111
03:45:26.243249 IP node1.32848 > node1.38553: UDP, length 113
03:45:26.255403 IP node1.32848 > node1.34433: UDP, length 113
03:45:26.262863 IP node1.32848 > node1.38655: UDP, length 113
03:45:26.293663 IP node1.32848 > node1.49865: UDP, length 113
03:45:26.296014 IP node1.32848 > node1.45429: UDP, length 113
03:45:26.314526 IP node1.57400 > node1.34433: UDP, length 113
03:45:26.315744 IP node1.58838 > node1.57400: UDP, length 113
03:45:26.318065 IP node1.38553 > node1.57400: UDP, length 112
03:45:26.318659 IP node1.33607 > node1.57400: UDP, length 113
03:45:26.319056 IP node1.42579 > node1.57400: UDP, length 113
03:45:26.320864 IP node1.34433 > node1.57400: UDP, length 113
03:45:26.333963 IP node1.58838 > node1.45761: UDP, length 113
03:45:26.334439 IP node1.33607 > node1.45761: UDP, length 113
03:45:26.334518 IP node1.34433 > node1.45761: UDP, length 113
03:45:26.335378 IP node1.59003 > node1.57400: UDP, length 113
03:45:26.336000 IP node1.59003 > node1.45761: UDP, length 113
03:45:26.337357 IP node1.38553 > node1.45761: UDP, length 112
03:45:26.340789 IP node1.42579 > node1.45761: UDP, length 113
03:45:26.341882 IP node1.32848 > node1.38430: UDP, length 113
03:45:26.347890 IP node1.38655 > node1.57400: UDP, length 111
03:45:26.348291 IP node1.38655 > node1.45761: UDP, length 111
03:45:26.389604 IP node1.32848 > node1.57400: UDP, length 113
03:45:26.389668 IP node1.32848 > node1.45761: UDP, length 113
03:45:26.461647 IP node1.49009 > node1.34433: UDP, length 112
03:45:26.464481 IP node1.58838 > node1.49009: UDP, length 113
03:45:26.464550 IP node1.38553 > node1.49009: UDP, length 112
03:45:26.464699 IP node1.34433 > node1.49009: UDP, length 113
03:45:26.467733 IP node1.42579 > node1.49009: UDP, length 113
03:45:26.469457 IP node1.59003 > node1.49009: UDP, length 113
03:45:26.470017 IP node1.33607 > node1.49009: UDP, length 113
03:45:26.472507 IP node1.38655 > node1.49009: UDP, length 111
03:45:26.474384 IP node1.32848 > node1.49009: UDP, length 113
03:45:26.549589 IP node1.45761 > node1.34433: UDP, length 113
03:45:26.610136 IP node1.57400 > node1.38655: UDP, length 113
03:45:26.610559 IP node1.57400 > node1.32848: UDP, length 113
03:45:26.612052 IP node1.57400 > node1.38430: UDP, length 113
03:45:26.612552 IP node1.57400 > node1.49865: UDP, length 113
03:45:26.612987 IP node1.57400 > node1.45429: UDP, length 113
03:45:26.613184 IP node1.57400 > node1.45761: UDP, length 113
03:45:26.613457 IP node1.57400 > node1.49009: UDP, length 113
03:45:26.622684 IP node1.49865 > node1.34433: UDP, length 113
03:45:26.674243 IP node1.38430 > node1.38655: UDP, length 112
03:45:26.675790 IP node1.38430 > node1.32848: UDP, length 112
03:45:26.676088 IP node1.38430 > node1.49865: UDP, length 112
03:45:26.680019 IP node1.38430 > node1.45429: UDP, length 112
03:45:26.680102 IP node1.38430 > node1.57400: UDP, length 112
03:45:26.680424 IP node1.38430 > node1.45761: UDP, length 112
03:45:26.680489 IP node1.38430 > node1.49009: UDP, length 112
03:45:26.715950 IP node1.45761 > node1.45429: UDP, length 113
03:45:26.716149 IP node1.45761 > node1.49009: UDP, length 113
03:45:26.716259 IP node1.45761 > node1.49865: UDP, length 113
03:45:26.717358 IP node1.45761 > node1.38430: UDP, length 113
03:45:26.717432 IP node1.45761 > node1.32848: UDP, length 113
03:45:26.717504 IP node1.45761 > node1.57400: UDP, length 113
03:45:26.717767 IP node1.45761 > node1.38655: UDP, length 113
03:45:26.811571 IP node1.47025 > node1.49865: UDP, length 113
03:45:26.811676 IP node1.47025 > node1.32848: UDP, length 113
03:45:26.811809 IP node1.47025 > node1.38430: UDP, length 113
03:45:26.812106 IP node1.32848 > node1.47025: UDP, length 113
03:45:26.812157 IP node1.58838 > node1.47025: UDP, length 113
03:45:26.812388 IP node1.38553 > node1.47025: UDP, length 112
03:45:26.812919 IP node1.33607 > node1.47025: UDP, length 113
03:45:26.814023 IP node1.42579 > node1.47025: UDP, length 113
03:45:26.814276 IP node1.38655 > node1.47025: UDP, length 111
03:45:26.818116 IP node1.59003 > node1.47025: UDP, length 113
03:45:26.824534 IP node1.45761 > node1.47025: UDP, length 113
03:45:26.824850 IP node1.47025 > node1.45429: UDP, length 113
03:45:26.824902 IP node1.47025 > node1.57400: UDP, length 113
03:45:26.824956 IP node1.47025 > node1.45761: UDP, length 113
03:45:26.826144 IP node1.49009 > node1.38655: UDP, length 112
03:45:26.827011 IP node1.49009 > node1.32848: UDP, length 112
03:45:26.827188 IP node1.57400 > node1.47025: UDP, length 113
03:45:26.827282 IP node1.49009 > node1.38430: UDP, length 112
03:45:26.827563 IP node1.49009 > node1.49865: UDP, length 112
03:45:26.828107 IP node1.49009 > node1.45429: UDP, length 112
03:45:26.828259 IP node1.49865 > node1.38655: UDP, length 113
03:45:26.828750 IP node1.49009 > node1.57400: UDP, length 112
03:45:26.828878 IP node1.34433 > node1.47025: UDP, length 113
03:45:26.830460 IP node1.49009 > node1.45761: UDP, length 112
03:45:26.830565 IP node1.49865 > node1.32848: UDP, length 113
03:45:26.831012 IP node1.49865 > node1.38430: UDP, length 113
03:45:26.831100 IP node1.49009 > node1.47025: UDP, length 112
03:45:26.831498 IP node1.49865 > node1.45429: UDP, length 113
03:45:26.831773 IP node1.49865 > node1.57400: UDP, length 113
03:45:26.832020 IP node1.49865 > node1.45761: UDP, length 113
03:45:26.837173 IP node1.49865 > node1.49009: UDP, length 113
03:45:26.846165 IP node1.42579 > node1.60161: UDP, length 113
03:45:26.846710 IP node1.60161 > node1.32848: UDP, length 113
03:45:26.847536 IP node1.34433 > node1.60161: UDP, length 113
03:45:26.847588 IP node1.60161 > node1.49865: UDP, length 113
03:45:26.847607 IP node1.59003 > node1.60161: UDP, length 113
03:45:26.848266 IP node1.58838 > node1.60161: UDP, length 113
03:45:26.848313 IP node1.33607 > node1.60161: UDP, length 113
03:45:26.849450 IP node1.38553 > node1.60161: UDP, length 112
03:45:26.849490 IP node1.60161 > node1.45429: UDP, length 113
03:45:26.849781 IP node1.57400 > node1.60161: UDP, length 113
03:45:26.849918 IP node1.45761 > node1.60161: UDP, length 113
03:45:26.850422 IP node1.38655 > node1.60161: UDP, length 111
03:45:26.850529 IP node1.49009 > node1.60161: UDP, length 112
03:45:26.851183 IP node1.38430 > node1.47025: UDP, length 112
03:45:26.868597 IP node1.49865 > node1.47025: UDP, length 113
03:45:26.873878 IP node1.47025 > node1.49009: UDP, length 113
03:45:26.873988 IP node1.49865 > node1.60161: UDP, length 113
03:45:26.877657 IP node1.47025 > node1.60161: UDP, length 113
03:45:26.921800 IP node1.49865 > node1.58604: UDP, length 113
03:45:26.922656 IP node1.34433 > node1.58604: UDP, length 113
03:45:26.923329 IP node1.49009 > node1.58604: UDP, length 112
03:45:26.924111 IP node1.45761 > node1.58604: UDP, length 113
03:45:26.924464 IP node1.38553 > node1.58604: UDP, length 112
03:45:26.925383 IP node1.60161 > node1.38430: UDP, length 113
03:45:26.926374 IP node1.60161 > node1.57400: UDP, length 113
03:45:26.926867 IP node1.60161 > node1.45761: UDP, length 113
03:45:26.928004 IP node1.60161 > node1.49009: UDP, length 113
03:45:26.932478 IP node1.59003 > node1.58604: UDP, length 113
03:45:26.932733 IP node1.42579 > node1.58604: UDP, length 113
03:45:26.936802 IP node1.58838 > node1.58604: UDP, length 113
03:45:26.936832 IP node1.38655 > node1.58604: UDP, length 111
03:45:26.937523 IP node1.33607 > node1.58604: UDP, length 113
03:45:26.937629 IP node1.57400 > node1.58604: UDP, length 113
03:45:26.941132 IP node1.38430 > node1.60161: UDP, length 112
03:45:26.941177 IP node1.38430 > node1.58604: UDP, length 112
03:45:26.955394 IP node1.45429 > node1.34433: UDP, length 113
03:45:26.957964 IP node1.60161 > node1.47025: UDP, length 113
03:45:26.958084 IP node1.60161 > node1.58604: UDP, length 113
03:45:27.013802 IP node1.32848 > node1.60161: UDP, length 113
03:45:27.013894 IP node1.32848 > node1.58604: UDP, length 113
03:45:27.033729 IP node1.47025 > node1.58604: UDP, length 113
03:45:27.042636 IP node1.38655 > node1.47760: UDP, length 111
03:45:27.043323 IP node1.34433 > node1.47760: UDP, length 113
03:45:27.043337 IP node1.38553 > node1.47760: UDP, length 112
03:45:27.043751 IP node1.33607 > node1.47760: UDP, length 113
03:45:27.045007 IP node1.59003 > node1.47760: UDP, length 113
03:45:27.045708 IP node1.58838 > node1.47760: UDP, length 113
03:45:27.049454 IP node1.42579 > node1.47760: UDP, length 113
03:45:27.049478 IP node1.49865 > node1.47760: UDP, length 113
03:45:27.049521 IP node1.49009 > node1.47760: UDP, length 112
03:45:27.051063 IP node1.47760 > node1.38655: UDP, length 113
03:45:27.051716 IP node1.47760 > node1.32848: UDP, length 113
03:45:27.052619 IP node1.57400 > node1.47760: UDP, length 113
03:45:27.053635 IP node1.47760 > node1.38430: UDP, length 113
03:45:27.054054 IP node1.47760 > node1.49865: UDP, length 113
03:45:27.054403 IP node1.47760 > node1.45429: UDP, length 113
03:45:27.064843 IP node1.47025 > node1.47760: UDP, length 113
03:45:27.067731 IP node1.38430 > node1.47760: UDP, length 112
03:45:27.076896 IP node1.47760 > node1.57400: UDP, length 113
03:45:27.077185 IP node1.47760 > node1.45761: UDP, length 113
03:45:27.078303 IP node1.47760 > node1.49009: UDP, length 113
03:45:27.078771 IP node1.47760 > node1.47025: UDP, length 113
03:45:27.079681 IP node1.47760 > node1.60161: UDP, length 113
03:45:27.080026 IP node1.47760 > node1.58604: UDP, length 113
03:45:27.092746 IP node1.45429 > node1.38430: UDP, length 113
03:45:27.093011 IP node1.45429 > node1.38655: UDP, length 113
03:45:27.093147 IP node1.45429 > node1.32848: UDP, length 113
03:45:27.096224 IP node1.45429 > node1.57400: UDP, length 113
03:45:27.096469 IP node1.45429 > node1.45761: UDP, length 113
03:45:27.097698 IP node1.45429 > node1.49009: UDP, length 113
03:45:27.099436 IP node1.45429 > node1.47025: UDP, length 113
03:45:27.100896 IP node1.45429 > node1.60161: UDP, length 113
03:45:27.101489 IP node1.45429 > node1.58604: UDP, length 113
03:45:27.102042 IP node1.45429 > node1.47760: UDP, length 113
03:45:27.104571 IP node1.45429 > node1.49865: UDP, length 113
03:45:27.186572 IP node1.45761 > node1.47760: UDP, length 113
03:45:27.190998 IP node1.58604 > node1.38655: UDP, length 113
03:45:27.196424 IP node1.32848 > node1.47760: UDP, length 113
03:45:27.200441 IP node1.58604 > node1.32848: UDP, length 113
03:45:27.215109 IP node1.58604 > node1.49865: UDP, length 113
03:45:27.221661 IP node1.58604 > node1.45429: UDP, length 113
03:45:27.221932 IP node1.58604 > node1.57400: UDP, length 113
03:45:27.222165 IP node1.58604 > node1.45761: UDP, length 113
03:45:27.222887 IP node1.58604 > node1.49009: UDP, length 113
03:45:27.223528 IP node1.58604 > node1.47025: UDP, length 113
03:45:27.224364 IP node1.58604 > node1.60161: UDP, length 113
03:45:27.238406 IP node1.58604 > node1.38430: UDP, length 113
03:45:27.297499 IP node1.47025 > node1.60033: UDP, length 113
03:45:27.298514 IP node1.59003 > node1.60033: UDP, length 113
03:45:27.299101 IP node1.58604 > node1.47760: UDP, length 113
03:45:27.299550 IP node1.49009 > node1.60033: UDP, length 112
03:45:27.302920 IP node1.57400 > node1.60033: UDP, length 113
03:45:27.304594 IP node1.45761 > node1.60033: UDP, length 113
03:45:27.309417 IP node1.49865 > node1.60033: UDP, length 113
03:45:27.314525 IP node1.38430 > node1.60033: UDP, length 112
03:45:27.316400 IP node1.33607 > node1.60033: UDP, length 113
03:45:27.317104 IP node1.38553 > node1.60033: UDP, length 112
03:45:27.320501 IP node1.45429 > node1.60033: UDP, length 113
03:45:27.325717 IP node1.38655 > node1.60033: UDP, length 111
03:45:27.346466 IP node1.47760 > node1.60033: UDP, length 113
03:45:27.346538 IP node1.58604 > node1.60033: UDP, length 113
03:45:27.349181 IP node1.42579 > node1.60033: UDP, length 113
03:45:27.380240 IP node1.45761 > node1.50532: UDP, length 113
03:45:27.380508 IP node1.38655 > node1.50532: UDP, length 111
03:45:27.381259 IP node1.59003 > node1.50532: UDP, length 113
03:45:27.381291 IP node1.47025 > node1.50532: UDP, length 113
03:45:27.381446 IP node1.49009 > node1.50532: UDP, length 112
03:45:27.383962 IP node1.42579 > node1.50532: UDP, length 113
03:45:27.384507 IP node1.38430 > node1.50532: UDP, length 112
03:45:27.386701 IP node1.57400 > node1.50532: UDP, length 113
03:45:27.390489 IP node1.49865 > node1.50532: UDP, length 113
03:45:27.390871 IP node1.47760 > node1.50532: UDP, length 113
03:45:27.396568 IP node1.50532 > node1.38430: UDP, length 113
03:45:27.396946 IP node1.50532 > node1.45429: UDP, length 113
03:45:27.397257 IP node1.50532 > node1.57400: UDP, length 113
03:45:27.397500 IP node1.50532 > node1.45761: UDP, length 113
03:45:27.397964 IP node1.50532 > node1.49009: UDP, length 113
03:45:27.398391 IP node1.50532 > node1.47025: UDP, length 113
03:45:27.398693 IP node1.50532 > node1.60161: UDP, length 113
03:45:27.398797 IP node1.45429 > node1.50532: UDP, length 113
03:45:27.403689 IP node1.58604 > node1.50532: UDP, length 113
03:45:27.409602 IP node1.60161 > node1.47760: UDP, length 113
03:45:27.412122 IP node1.60161 > node1.60033: UDP, length 113
03:45:27.412403 IP node1.60161 > node1.50532: UDP, length 113
03:45:27.412446 IP node1.50532 > node1.49865: UDP, length 113
03:45:27.464299 IP node1.58838 > node1.60033: UDP, length 113
03:45:27.482015 IP node1.58838 > node1.50532: UDP, length 113
03:45:27.517166 IP node1.32848 > node1.60033: UDP, length 113
03:45:27.579411 IP node1.33607 > node1.50532: UDP, length 113
03:45:27.596943 IP node1.34433 > node1.60033: UDP, length 113
03:45:27.597009 IP node1.34433 > node1.50532: UDP, length 113
03:45:27.664412 IP node1.60161 > node1.34176: UDP, length 113
03:45:27.664825 IP node1.33607 > node1.34176: UDP, length 113
03:45:27.665507 IP node1.42579 > node1.34176: UDP, length 113
03:45:27.666070 IP node1.57400 > node1.34176: UDP, length 113
03:45:27.666470 IP node1.47025 > node1.34176: UDP, length 113
03:45:27.666838 IP node1.38430 > node1.34176: UDP, length 112
03:45:27.667704 IP node1.59003 > node1.34176: UDP, length 113
03:45:27.667920 IP node1.47760 > node1.34176: UDP, length 113
03:45:27.669882 IP node1.58604 > node1.34176: UDP, length 113
03:45:27.670554 IP node1.49865 > node1.34176: UDP, length 113
03:45:27.673750 IP node1.45429 > node1.34176: UDP, length 113
03:45:27.678840 IP node1.38655 > node1.34176: UDP, length 111
03:45:27.679820 IP node1.34433 > node1.34176: UDP, length 113
03:45:27.700301 IP node1.49009 > node1.34176: UDP, length 112
03:45:27.702939 IP node1.45761 > node1.34176: UDP, length 113
03:45:27.741246 IP node1.58838 > node1.34176: UDP, length 113
03:45:27.746376 IP node1.47760 > node1.58616: UDP, length 113
03:45:27.747221 IP node1.33607 > node1.58616: UDP, length 113
03:45:27.748877 IP node1.47025 > node1.58616: UDP, length 113
03:45:27.749817 IP node1.38430 > node1.58616: UDP, length 112
03:45:27.750955 IP node1.34433 > node1.58616: UDP, length 113
03:45:27.751025 IP node1.49865 > node1.58616: UDP, length 113
03:45:27.752310 IP node1.59003 > node1.58616: UDP, length 113
03:45:27.752497 IP node1.42579 > node1.58616: UDP, length 113
03:45:27.752672 IP node1.45761 > node1.58616: UDP, length 113
03:45:27.752701 IP node1.58604 > node1.58616: UDP, length 113
03:45:27.754310 IP node1.60161 > node1.58616: UDP, length 113
03:45:27.754499 IP node1.49009 > node1.58616: UDP, length 112
03:45:27.754538 IP node1.45429 > node1.58616: UDP, length 113
03:45:27.754961 IP node1.58616 > node1.45429: UDP, length 113
03:45:27.757689 IP node1.38655 > node1.58616: UDP, length 111
03:45:27.757837 IP node1.58838 > node1.58616: UDP, length 113
03:45:27.764358 IP node1.57400 > node1.58616: UDP, length 113
03:45:27.801543 IP node1.50532 > node1.58604: UDP, length 113
03:45:27.802178 IP node1.50532 > node1.47760: UDP, length 113
03:45:27.802836 IP node1.50532 > node1.60033: UDP, length 113
03:45:27.803331 IP node1.50532 > node1.34176: UDP, length 113
03:45:27.803504 IP node1.50532 > node1.58616: UDP, length 113
03:45:27.831893 IP node1.38553 > node1.50532: UDP, length 112
03:45:27.845154 IP node1.32848 > node1.50532: UDP, length 113
03:45:27.850379 IP node1.38553 > node1.34176: UDP, length 112
03:45:27.850454 IP node1.38553 > node1.58616: UDP, length 112
03:45:27.852143 IP node1.32848 > node1.34176: UDP, length 113
03:45:27.852350 IP node1.32848 > node1.58616: UDP, length 113
03:45:27.879447 IP node1.38430 > node1.57925: UDP, length 112
03:45:27.884788 IP node1.60161 > node1.57925: UDP, length 113
03:45:27.885769 IP node1.42579 > node1.57925: UDP, length 113
03:45:27.887243 IP node1.59003 > node1.57925: UDP, length 113
03:45:27.887753 IP node1.47025 > node1.57925: UDP, length 113
03:45:27.889063 IP node1.45429 > node1.57925: UDP, length 113
03:45:27.889655 IP node1.38655 > node1.57925: UDP, length 111
03:45:27.889667 IP node1.34433 > node1.57925: UDP, length 113
03:45:27.889681 IP node1.45761 > node1.57925: UDP, length 113
03:45:27.890038 IP node1.49009 > node1.57925: UDP, length 112
03:45:27.890937 IP node1.57400 > node1.57925: UDP, length 113
03:45:27.890998 IP node1.47760 > node1.57925: UDP, length 113
03:45:27.891400 IP node1.32848 > node1.57925: UDP, length 113
03:45:27.892688 IP node1.58604 > node1.57925: UDP, length 113
03:45:27.894650 IP node1.33607 > node1.57925: UDP, length 113
03:45:27.898595 IP node1.60033 > node1.32848: UDP, length 113
03:45:27.899487 IP node1.49865 > node1.57925: UDP, length 113
03:45:27.904138 IP node1.50532 > node1.57925: UDP, length 113
03:45:27.937138 IP node1.41557 > node1.60033: UDP, length 113
03:45:27.937196 IP node1.41557 > node1.47025: UDP, length 113
03:45:27.937292 IP node1.41557 > node1.50532: UDP, length 113
03:45:27.937352 IP node1.41557 > node1.47760: UDP, length 113
03:45:27.937479 IP node1.41557 > node1.58604: UDP, length 113
03:45:27.937702 IP node1.41557 > node1.60161: UDP, length 113
03:45:27.937972 IP node1.59003 > node1.41557: UDP, length 113
03:45:27.942907 IP node1.42579 > node1.41557: UDP, length 113
03:45:27.945074 IP node1.60161 > node1.41557: UDP, length 113
03:45:27.946227 IP node1.38655 > node1.41557: UDP, length 111
03:45:27.947779 IP node1.49865 > node1.41557: UDP, length 113
03:45:27.947849 IP node1.33607 > node1.41557: UDP, length 113
03:45:27.949553 IP node1.32848 > node1.41557: UDP, length 113
03:45:27.951257 IP node1.58604 > node1.41557: UDP, length 113
03:45:27.951339 IP node1.49009 > node1.41557: UDP, length 112
03:45:27.953028 IP node1.45429 > node1.41557: UDP, length 113
03:45:27.953901 IP node1.47760 > node1.41557: UDP, length 113
03:45:27.954130 IP node1.45761 > node1.41557: UDP, length 113
03:45:27.956818 IP node1.57400 > node1.41557: UDP, length 113
03:45:27.958518 IP node1.34433 > node1.41557: UDP, length 113
03:45:27.959048 IP node1.47025 > node1.41557: UDP, length 113
03:45:27.964474 IP node1.38430 > node1.41557: UDP, length 112
03:45:27.977773 IP node1.32848 > node1.57062: UDP, length 113
03:45:27.977836 IP node1.58604 > node1.57062: UDP, length 113
03:45:27.979817 IP node1.45761 > node1.57062: UDP, length 113
03:45:27.980711 IP node1.47025 > node1.57062: UDP, length 113
03:45:27.980991 IP node1.47760 > node1.57062: UDP, length 113
03:45:27.983376 IP node1.60161 > node1.57062: UDP, length 113
03:45:27.983771 IP node1.38655 > node1.57062: UDP, length 111
03:45:27.984236 IP node1.59003 > node1.57062: UDP, length 113
03:45:27.984465 IP node1.42579 > node1.57062: UDP, length 113
03:45:27.985764 IP node1.33607 > node1.57062: UDP, length 113
03:45:27.985800 IP node1.49865 > node1.57062: UDP, length 113
03:45:27.986039 IP node1.57400 > node1.57062: UDP, length 113
03:45:27.988875 IP node1.45429 > node1.57062: UDP, length 113
03:45:27.989155 IP node1.49009 > node1.57062: UDP, length 112
03:45:27.990481 IP node1.34433 > node1.57062: UDP, length 113
03:45:27.991893 IP node1.60033 > node1.49865: UDP, length 113
03:45:27.992858 IP node1.60033 > node1.45429: UDP, length 113
03:45:27.997952 IP node1.60033 > node1.57400: UDP, length 113
03:45:27.998116 IP node1.38430 > node1.57062: UDP, length 112
03:45:27.998226 IP node1.60033 > node1.45761: UDP, length 113
03:45:27.999444 IP node1.60033 > node1.49009: UDP, length 113
03:45:28.000228 IP node1.60033 > node1.47025: UDP, length 113
03:45:28.000683 IP node1.60033 > node1.38430: UDP, length 113
03:45:28.001013 IP node1.60033 > node1.60161: UDP, length 113
03:45:28.001332 IP node1.60033 > node1.58604: UDP, length 113
03:45:28.019885 IP node1.57925 > node1.57400: UDP, length 113
03:45:28.021122 IP node1.57925 > node1.45761: UDP, length 113
03:45:28.035339 IP node1.38553 > node1.41557: UDP, length 112
03:45:28.035733 IP node1.38553 > node1.57062: UDP, length 112
03:45:28.035799 IP node1.38553 > node1.57925: UDP, length 112
03:45:28.043783 IP node1.58838 > node1.41557: UDP, length 113
03:45:28.044241 IP node1.58838 > node1.57062: UDP, length 113
03:45:28.044281 IP node1.58838 > node1.57925: UDP, length 113
03:45:28.045534 IP node1.60033 > node1.47760: UDP, length 113
03:45:28.046742 IP node1.60033 > node1.50532: UDP, length 113
03:45:28.047632 IP node1.60033 > node1.34176: UDP, length 113
03:45:28.048221 IP node1.57925 > node1.49009: UDP, length 113
03:45:28.048327 IP node1.57925 > node1.45429: UDP, length 113
03:45:28.055248 IP node1.60033 > node1.58616: UDP, length 113
03:45:28.058796 IP node1.57925 > node1.47025: UDP, length 113
03:45:28.060197 IP node1.60033 > node1.57925: UDP, length 113
03:45:28.061301 IP node1.57925 > node1.60161: UDP, length 113
03:45:28.064479 IP node1.50532 > node1.57062: UDP, length 113
03:45:28.065091 IP node1.50532 > node1.41557: UDP, length 113
03:45:28.076002 IP node1.58616 > node1.57400: UDP, length 113
03:45:28.076339 IP node1.58616 > node1.45761: UDP, length 113
03:45:28.087929 IP node1.57925 > node1.58604: UDP, length 113
03:45:28.089088 IP node1.58616 > node1.49009: UDP, length 113
03:45:28.091770 IP node1.57925 > node1.60033: UDP, length 113
03:45:28.092333 IP node1.57925 > node1.50532: UDP, length 113
03:45:28.092962 IP node1.57925 > node1.34176: UDP, length 113
03:45:28.095952 IP node1.58616 > node1.47025: UDP, length 113
03:45:28.098352 IP node1.58616 > node1.58604: UDP, length 113
03:45:28.100625 IP node1.58616 > node1.60161: UDP, length 113
03:45:28.101743 IP node1.58616 > node1.60033: UDP, length 113
03:45:28.102708 IP node1.58616 > node1.50532: UDP, length 113
03:45:28.104157 IP node1.58616 > node1.34176: UDP, length 113
03:45:28.107603 IP node1.58616 > node1.57925: UDP, length 113
03:45:28.110221 IP node1.58616 > node1.41557: UDP, length 113
03:45:28.112020 IP node1.60033 > node1.57062: UDP, length 113
03:45:28.115130 IP node1.57925 > node1.47760: UDP, length 113
03:45:28.116452 IP node1.57925 > node1.58616: UDP, length 113
03:45:28.117950 IP node1.57925 > node1.41557: UDP, length 113
03:45:28.118186 IP node1.57925 > node1.57062: UDP, length 113
03:45:28.142483 IP node1.34176 > node1.60033: UDP, length 113
03:45:28.142674 IP node1.34176 > node1.47025: UDP, length 113
03:45:28.142787 IP node1.34176 > node1.50532: UDP, length 113
03:45:28.143100 IP node1.34176 > node1.60161: UDP, length 113
03:45:28.143172 IP node1.34176 > node1.58616: UDP, length 113
03:45:28.143238 IP node1.34176 > node1.47760: UDP, length 113
03:45:28.143464 IP node1.34176 > node1.58604: UDP, length 113
03:45:28.145085 IP node1.34176 > node1.57925: UDP, length 113
03:45:28.145889 IP node1.34176 > node1.41557: UDP, length 113
03:45:28.146170 IP node1.34176 > node1.57062: UDP, length 113
03:45:28.159030 IP node1.54852 > node1.45429: UDP, length 113
03:45:28.159153 IP node1.54852 > node1.49865: UDP, length 113
03:45:28.159215 IP node1.54852 > node1.38430: UDP, length 113
03:45:28.159283 IP node1.54852 > node1.32848: UDP, length 113
03:45:28.159527 IP node1.58838 > node1.54852: UDP, length 113
03:45:28.160981 IP node1.32848 > node1.54852: UDP, length 113
03:45:28.161986 IP node1.47760 > node1.54852: UDP, length 113
03:45:28.164100 IP node1.59003 > node1.54852: UDP, length 113
03:45:28.164393 IP node1.42579 > node1.54852: UDP, length 113
03:45:28.164956 IP node1.38655 > node1.54852: UDP, length 111
03:45:28.166888 IP node1.58604 > node1.54852: UDP, length 113
03:45:28.167588 IP node1.49865 > node1.54852: UDP, length 113
03:45:28.167900 IP node1.45761 > node1.54852: UDP, length 113
03:45:28.172919 IP node1.45429 > node1.54852: UDP, length 113
03:45:28.175274 IP node1.47025 > node1.54852: UDP, length 113
03:45:28.177703 IP node1.57400 > node1.54852: UDP, length 113
03:45:28.178329 IP node1.49009 > node1.54852: UDP, length 112
03:45:28.178426 IP node1.60161 > node1.54852: UDP, length 113
03:45:28.178971 IP node1.33607 > node1.54852: UDP, length 113
03:45:28.181126 IP node1.38553 > node1.54852: UDP, length 112
03:45:28.182608 IP node1.50532 > node1.54852: UDP, length 113
03:45:28.184421 IP node1.38430 > node1.54852: UDP, length 112
03:45:28.185696 IP node1.57062 > node1.47025: UDP, length 112
03:45:28.198563 IP node1.34176 > node1.54852: UDP, length 113
03:45:28.213423 IP node1.60033 > node1.41557: UDP, length 113
03:45:28.213992 IP node1.57062 > node1.58604: UDP, length 112
03:45:28.215896 IP node1.57062 > node1.60161: UDP, length 112
03:45:28.217482 IP node1.34433 > node1.54852: UDP, length 113
03:45:28.220055 IP node1.60033 > node1.54852: UDP, length 113
03:45:28.220574 IP node1.57925 > node1.54852: UDP, length 113
03:45:28.233993 IP node1.58616 > node1.54852: UDP, length 113
03:45:28.234045 IP node1.57062 > node1.60033: UDP, length 112
03:45:28.234058 IP node1.58616 > node1.57062: UDP, length 113
03:45:28.234114 IP node1.58616 > node1.47760: UDP, length 113
03:45:28.235547 IP node1.57062 > node1.50532: UDP, length 112
03:45:28.277286 IP node1.54852 > node1.57400: UDP, length 113
03:45:28.278570 IP node1.54852 > node1.45761: UDP, length 113
03:45:28.320019 IP node1.41557 > node1.34176: UDP, length 113
03:45:28.324206 IP node1.41557 > node1.58616: UDP, length 113
03:45:28.339154 IP node1.41557 > node1.57925: UDP, length 113
03:45:28.441597 IP node1.54852 > node1.47025: UDP, length 113
03:45:28.465112 IP node1.57062 > node1.47760: UDP, length 112
03:45:28.473525 IP node1.41557 > node1.57062: UDP, length 113
03:45:28.480017 IP node1.41557 > node1.54852: UDP, length 113
03:45:28.486462 IP node1.38655 > node1.38638: UDP, length 111
03:45:28.486621 IP node1.41557 > node1.38638: UDP, length 113
03:45:28.488903 IP node1.60033 > node1.38638: UDP, length 113
03:45:28.492036 IP node1.50532 > node1.38638: UDP, length 113
03:45:28.493544 IP node1.45429 > node1.38638: UDP, length 113
03:45:28.494444 IP node1.60161 > node1.38638: UDP, length 113
03:45:28.494537 IP node1.49009 > node1.38638: UDP, length 112
03:45:28.494749 IP node1.58616 > node1.38638: UDP, length 113
03:45:28.495298 IP node1.34433 > node1.38638: UDP, length 113
03:45:28.495738 IP node1.45761 > node1.38638: UDP, length 113
03:45:28.496067 IP node1.57925 > node1.38638: UDP, length 113
03:45:28.496141 IP node1.32848 > node1.38638: UDP, length 113
03:45:28.497324 IP node1.38430 > node1.38638: UDP, length 112
03:45:28.498554 IP node1.47760 > node1.38638: UDP, length 113
03:45:28.498731 IP node1.58604 > node1.38638: UDP, length 113
03:45:28.500816 IP node1.34176 > node1.38638: UDP, length 113
03:45:28.501047 IP node1.47025 > node1.38638: UDP, length 113
03:45:28.501831 IP node1.57400 > node1.38638: UDP, length 113
03:45:28.502282 IP node1.59003 > node1.38638: UDP, length 113
03:45:28.502663 IP node1.42579 > node1.38638: UDP, length 113
03:45:28.503013 IP node1.33607 > node1.38638: UDP, length 113
03:45:28.506695 IP node1.49865 > node1.38638: UDP, length 113
03:45:28.508506 IP node1.58838 > node1.38638: UDP, length 113
03:45:28.511231 IP node1.38553 > node1.38638: UDP, length 112
03:45:28.520912 IP node1.54852 > node1.49009: UDP, length 113
03:45:28.521005 IP node1.54852 > node1.60033: UDP, length 113
03:45:28.521094 IP node1.54852 > node1.50532: UDP, length 113
03:45:28.521183 IP node1.54852 > node1.34176: UDP, length 113
03:45:28.521564 IP node1.54852 > node1.41557: UDP, length 113
03:45:28.521695 IP node1.54852 > node1.60161: UDP, length 113
03:45:28.521750 IP node1.54852 > node1.58616: UDP, length 113
03:45:28.521820 IP node1.54852 > node1.57062: UDP, length 113
03:45:28.521872 IP node1.54852 > node1.47760: UDP, length 113
03:45:28.521993 IP node1.54852 > node1.58604: UDP, length 113
03:45:28.522041 IP node1.54852 > node1.57925: UDP, length 113
03:45:28.526005 IP node1.54852 > node1.38638: UDP, length 113
03:45:28.536754 IP node1.38638 > node1.47760: UDP, length 113
03:45:28.538500 IP node1.38638 > node1.60033: UDP, length 113
03:45:28.539940 IP node1.38638 > node1.50532: UDP, length 113
03:45:28.563997 IP node1.57062 > node1.34176: UDP, length 112
03:45:28.564731 IP node1.57062 > node1.58616: UDP, length 112
03:45:28.565894 IP node1.57062 > node1.57925: UDP, length 112
03:45:28.566388 IP node1.57062 > node1.41557: UDP, length 112
03:45:28.566607 IP node1.57062 > node1.54852: UDP, length 112
03:45:28.606736 IP node1.57062 > node1.38638: UDP, length 112
03:45:28.636758 IP node1.38638 > node1.58616: UDP, length 113
03:45:28.638528 IP node1.38638 > node1.34176: UDP, length 113
03:45:28.640108 IP node1.38638 > node1.41557: UDP, length 113
03:45:28.645697 IP node1.38638 > node1.57925: UDP, length 113
03:45:28.647968 IP node1.38638 > node1.54852: UDP, length 113
03:45:28.742768 IP node1.38638 > node1.57062: UDP, length 113
03:45:28.814223 IP node1.57062 > node1.56249: UDP, length 112
03:45:28.814554 IP node1.33607 > node1.56249: UDP, length 113
03:45:28.815668 IP node1.42579 > node1.56249: UDP, length 113
03:45:28.817448 IP node1.38655 > node1.56249: UDP, length 111
03:45:28.817644 IP node1.57925 > node1.56249: UDP, length 113
03:45:28.817951 IP node1.57400 > node1.56249: UDP, length 113
03:45:28.818206 IP node1.38638 > node1.56249: UDP, length 113
03:45:28.818384 IP node1.49009 > node1.56249: UDP, length 112
03:45:28.819812 IP node1.34176 > node1.56249: UDP, length 113
03:45:28.820818 IP node1.60161 > node1.56249: UDP, length 113
03:45:28.821169 IP node1.45429 > node1.56249: UDP, length 113
03:45:28.822626 IP node1.38553 > node1.56249: UDP, length 112
03:45:28.832488 IP node1.47025 > node1.56249: UDP, length 113
03:45:28.834857 IP node1.58604 > node1.56249: UDP, length 113
03:45:28.835116 IP node1.60033 > node1.56249: UDP, length 113
03:45:28.835495 IP node1.58616 > node1.56249: UDP, length 113
03:45:28.835925 IP node1.50532 > node1.56249: UDP, length 113
03:45:28.836196 IP node1.41557 > node1.56249: UDP, length 113
03:45:28.841962 IP node1.32848 > node1.56249: UDP, length 113
03:45:28.845088 IP node1.34433 > node1.56249: UDP, length 113
03:45:28.845548 IP node1.59003 > node1.56249: UDP, length 113
03:45:28.849546 IP node1.47760 > node1.56249: UDP, length 113
03:45:28.866286 IP node1.38430 > node1.56249: UDP, length 112
03:45:28.867895 IP node1.45761 > node1.56249: UDP, length 113
03:45:28.868961 IP node1.58838 > node1.56249: UDP, length 113
03:45:28.869835 IP node1.49865 > node1.56249: UDP, length 113
03:45:28.897159 IP node1.32848 > node1.57400: UDP, length 87
03:45:28.898464 IP node1.57400 > node1.32848: UDP, length 94
03:45:28.898860 IP node1.54852 > node1.56249: UDP, length 113
03:45:28.949052 IP node1.56249 > node1.58616: UDP, length 113
03:45:28.950247 IP node1.56249 > node1.57925: UDP, length 113
03:45:28.950930 IP node1.56249 > node1.41557: UDP, length 113
03:45:28.988832 IP node1.56249 > node1.34176: UDP, length 113
03:45:28.990474 IP node1.56249 > node1.57062: UDP, length 113
03:45:29.009687 IP node1.56879 > node1.54852: UDP, length 112
03:45:29.009899 IP node1.56879 > node1.34176: UDP, length 112
03:45:29.010121 IP node1.56879 > node1.41557: UDP, length 112
03:45:29.010336 IP node1.56879 > node1.57062: UDP, length 112
03:45:29.010386 IP node1.56879 > node1.58616: UDP, length 112
03:45:29.012493 IP node1.47760 > node1.56879: UDP, length 113
03:45:29.012909 IP node1.49865 > node1.56879: UDP, length 113
03:45:29.013703 IP node1.41557 > node1.56879: UDP, length 113
03:45:29.013963 IP node1.34176 > node1.56879: UDP, length 113
03:45:29.014146 IP node1.57925 > node1.56879: UDP, length 113
03:45:29.014253 IP node1.50532 > node1.56879: UDP, length 113
03:45:29.014900 IP node1.60161 > node1.56879: UDP, length 113
03:45:29.015653 IP node1.49009 > node1.56879: UDP, length 112
03:45:29.016093 IP node1.45429 > node1.56879: UDP, length 113
03:45:29.017481 IP node1.45761 > node1.56879: UDP, length 113
03:45:29.017735 IP node1.58604 > node1.56879: UDP, length 113
03:45:29.018541 IP node1.34433 > node1.56879: UDP, length 113
03:45:29.019006 IP node1.38638 > node1.56879: UDP, length 113
03:45:29.019367 IP node1.57062 > node1.56879: UDP, length 112
03:45:29.019592 IP node1.42579 > node1.56879: UDP, length 113
03:45:29.022329 IP node1.56879 > node1.57925: UDP, length 112
03:45:29.025168 IP node1.60033 > node1.56879: UDP, length 113
03:45:29.026793 IP node1.32848 > node1.56879: UDP, length 113
03:45:29.029675 IP node1.60033 > node1.34959: UDP, length 113
03:45:29.030156 IP node1.57400 > node1.56879: UDP, length 113
03:45:29.031016 IP node1.38430 > node1.56879: UDP, length 112
03:45:29.033943 IP node1.38655 > node1.56879: UDP, length 111
03:45:29.034388 IP node1.60161 > node1.34959: UDP, length 113
03:45:29.034692 IP node1.58616 > node1.56879: UDP, length 113
03:45:29.034752 IP node1.58616 > node1.34959: UDP, length 113
03:45:29.035573 IP node1.49009 > node1.34959: UDP, length 112
03:45:29.039251 IP node1.57925 > node1.34959: UDP, length 113
03:45:29.039403 IP node1.34176 > node1.34959: UDP, length 113
03:45:29.039408 IP node1.57062 > node1.34959: UDP, length 112
03:45:29.040273 IP node1.47760 > node1.34959: UDP, length 113
03:45:29.040421 IP node1.45429 > node1.34959: UDP, length 113
03:45:29.041053 IP node1.38553 > node1.56879: UDP, length 112
03:45:29.041385 IP node1.45761 > node1.34959: UDP, length 113
03:45:29.043272 IP node1.41557 > node1.34959: UDP, length 113
03:45:29.044248 IP node1.38638 > node1.34959: UDP, length 113
03:45:29.044776 IP node1.50532 > node1.34959: UDP, length 113
03:45:29.046126 IP node1.54852 > node1.56879: UDP, length 113
03:45:29.046184 IP node1.54852 > node1.34959: UDP, length 113
03:45:29.046592 IP node1.34433 > node1.34959: UDP, length 113
03:45:29.046594 IP node1.38430 > node1.34959: UDP, length 112
03:45:29.046832 IP node1.38655 > node1.34959: UDP, length 111
03:45:29.046857 IP node1.58604 > node1.34959: UDP, length 113
03:45:29.047180 IP node1.34959 > node1.54852: UDP, length 113
03:45:29.047261 IP node1.34959 > node1.41557: UDP, length 113
03:45:29.047261 IP node1.42579 > node1.34959: UDP, length 113
03:45:29.047477 IP node1.34959 > node1.57062: UDP, length 113
03:45:29.048134 IP node1.32848 > node1.34959: UDP, length 113
03:45:29.048493 IP node1.34959 > node1.57925: UDP, length 113
03:45:29.049679 IP node1.47025 > node1.56879: UDP, length 113
03:45:29.051207 IP node1.49865 > node1.34959: UDP, length 113
03:45:29.051270 IP node1.47025 > node1.34959: UDP, length 113
03:45:29.051941 IP node1.58838 > node1.56879: UDP, length 113
03:45:29.051990 IP node1.58838 > node1.34959: UDP, length 113
03:45:29.052358 IP node1.59003 > node1.56879: UDP, length 113
03:45:29.052399 IP node1.38553 > node1.34959: UDP, length 112
03:45:29.052502 IP node1.59003 > node1.34959: UDP, length 113
03:45:29.053961 IP node1.33607 > node1.56879: UDP, length 113
03:45:29.054045 IP node1.33607 > node1.34959: UDP, length 113
03:45:29.061109 IP node1.56879 > node1.38638: UDP, length 112
03:45:29.096483 IP node1.36914 > node1.57925: UDP, length 113
03:45:29.096583 IP node1.36914 > node1.41557: UDP, length 113
03:45:29.096818 IP node1.36914 > node1.57062: UDP, length 113
03:45:29.096966 IP node1.36914 > node1.54852: UDP, length 113
03:45:29.098367 IP node1.49865 > node1.36914: UDP, length 113
03:45:29.099206 IP node1.54852 > node1.36914: UDP, length 113
03:45:29.100720 IP node1.58838 > node1.36914: UDP, length 113
03:45:29.100952 IP node1.60033 > node1.36914: UDP, length 113
03:45:29.102942 IP node1.38553 > node1.36914: UDP, length 112
03:45:29.104082 IP node1.60161 > node1.36914: UDP, length 113
03:45:29.106137 IP node1.38638 > node1.36914: UDP, length 113
03:45:29.106352 IP node1.47760 > node1.36914: UDP, length 113
03:45:29.107333 IP node1.33607 > node1.36914: UDP, length 113
03:45:29.107540 IP node1.47025 > node1.36914: UDP, length 113
03:45:29.107558 IP node1.42579 > node1.36914: UDP, length 113
03:45:29.107562 IP node1.49009 > node1.36914: UDP, length 112
03:45:29.107856 IP node1.45761 > node1.36914: UDP, length 113
03:45:29.108066 IP node1.57400 > node1.34959: UDP, length 113
03:45:29.108334 IP node1.57062 > node1.36914: UDP, length 112
03:45:29.109276 IP node1.60033 > node1.59984: UDP, length 113
03:45:29.109559 IP node1.34176 > node1.36914: UDP, length 113
03:45:29.109742 IP node1.38638 > node1.59984: UDP, length 113
03:45:29.109805 IP node1.60161 > node1.59984: UDP, length 113
03:45:29.110256 IP node1.45429 > node1.36914: UDP, length 113
03:45:29.110633 IP node1.58604 > node1.36914: UDP, length 113
03:45:29.111319 IP node1.49009 > node1.59984: UDP, length 112
03:45:29.111467 IP node1.34176 > node1.59984: UDP, length 113
03:45:29.111501 IP node1.34433 > node1.36914: UDP, length 113
03:45:29.112014 IP node1.58838 > node1.59984: UDP, length 113
03:45:29.112275 IP node1.57925 > node1.59984: UDP, length 113
03:45:29.112362 IP node1.57925 > node1.36914: UDP, length 113
03:45:29.113567 IP node1.57062 > node1.59984: UDP, length 112
03:45:29.114022 IP node1.42579 > node1.59984: UDP, length 113
03:45:29.114788 IP node1.54852 > node1.59984: UDP, length 113
03:45:29.115113 IP node1.58616 > node1.59984: UDP, length 113
03:45:29.115267 IP node1.58616 > node1.36914: UDP, length 113
03:45:29.116456 IP node1.50532 > node1.59984: UDP, length 113
03:45:29.116568 IP node1.50532 > node1.36914: UDP, length 113
03:45:29.116775 IP node1.45761 > node1.59984: UDP, length 113
03:45:29.117000 IP node1.47760 > node1.59984: UDP, length 113
03:45:29.117977 IP node1.38430 > node1.59984: UDP, length 112
03:45:29.118221 IP node1.38430 > node1.36914: UDP, length 112
03:45:29.118463 IP node1.58604 > node1.59984: UDP, length 113
03:45:29.119223 IP node1.45429 > node1.59984: UDP, length 113
03:45:29.120726 IP node1.41557 > node1.59984: UDP, length 113
03:45:29.120774 IP node1.41557 > node1.36914: UDP, length 113
03:45:29.121082 IP node1.38655 > node1.59984: UDP, length 111
03:45:29.121124 IP node1.38655 > node1.36914: UDP, length 111
03:45:29.123598 IP node1.59003 > node1.59984: UDP, length 113
03:45:29.123672 IP node1.59003 > node1.36914: UDP, length 113
03:45:29.123680 IP node1.56879 > node1.56249: UDP, length 112
03:45:29.124296 IP node1.34433 > node1.59984: UDP, length 113
03:45:29.124502 IP node1.33607 > node1.59984: UDP, length 113
03:45:29.125043 IP node1.56879 > node1.34959: UDP, length 112
03:45:29.126614 IP node1.32848 > node1.59984: UDP, length 113
03:45:29.126747 IP node1.32848 > node1.36914: UDP, length 113
03:45:29.128060 IP node1.57400 > node1.36914: UDP, length 113
03:45:29.128472 IP node1.57400 > node1.59984: UDP, length 113
03:45:29.129427 IP node1.47025 > node1.59984: UDP, length 113
03:45:29.130338 IP node1.49865 > node1.59984: UDP, length 113
03:45:29.131188 IP node1.38553 > node1.59984: UDP, length 112
03:45:29.162721 IP node1.60033 > node1.55391: UDP, length 113
03:45:29.164125 IP node1.34176 > node1.55391: UDP, length 113
03:45:29.165880 IP node1.34433 > node1.55391: UDP, length 113
03:45:29.166963 IP node1.38553 > node1.55391: UDP, length 112
03:45:29.167199 IP node1.49009 > node1.55391: UDP, length 112
03:45:29.167336 IP node1.60161 > node1.55391: UDP, length 113
03:45:29.168102 IP node1.57062 > node1.55391: UDP, length 112
03:45:29.168321 IP node1.57925 > node1.55391: UDP, length 113
03:45:29.168436 IP node1.45761 > node1.55391: UDP, length 113
03:45:29.168461 IP node1.47760 > node1.55391: UDP, length 113
03:45:29.169189 IP node1.38638 > node1.55391: UDP, length 113
03:45:29.169679 IP node1.42579 > node1.55391: UDP, length 113
03:45:29.170339 IP node1.55391 > node1.54852: UDP, length 112
03:45:29.170496 IP node1.41557 > node1.55391: UDP, length 113
03:45:29.170635 IP node1.55391 > node1.41557: UDP, length 112
03:45:29.170798 IP node1.55391 > node1.57062: UDP, length 112
03:45:29.170857 IP node1.58616 > node1.55391: UDP, length 113
03:45:29.171009 IP node1.55391 > node1.57925: UDP, length 112
03:45:29.171902 IP node1.47025 > node1.55391: UDP, length 113
03:45:29.172122 IP node1.33607 > node1.55391: UDP, length 113
03:45:29.172190 IP node1.34959 > node1.38638: UDP, length 113
03:45:29.173207 IP node1.50532 > node1.55391: UDP, length 113
03:45:29.174197 IP node1.45429 > node1.55391: UDP, length 113
03:45:29.174339 IP node1.58838 > node1.55391: UDP, length 113
03:45:29.174599 IP node1.32848 > node1.55391: UDP, length 113
03:45:29.175129 IP node1.34959 > node1.56249: UDP, length 113
03:45:29.175308 IP node1.58604 > node1.55391: UDP, length 113
03:45:29.175348 IP node1.34959 > node1.56879: UDP, length 113
03:45:29.175567 IP node1.59003 > node1.55391: UDP, length 113
03:45:29.179667 IP node1.49865 > node1.55391: UDP, length 113
03:45:29.184713 IP node1.38430 > node1.55391: UDP, length 112
03:45:29.185746 IP node1.38655 > node1.55391: UDP, length 111
03:45:29.186076 IP node1.57400 > node1.55391: UDP, length 113
03:45:29.192623 IP node1.54852 > node1.55391: UDP, length 113
03:45:29.246867 IP node1.56249 > node1.54852: UDP, length 113
03:45:29.278996 IP node1.58604 > node1.37551: UDP, length 113
03:45:29.280788 IP node1.34176 > node1.37551: UDP, length 113
03:45:29.282998 IP node1.47760 > node1.37551: UDP, length 113
03:45:29.283192 IP node1.47025 > node1.37551: UDP, length 113
03:45:29.283689 IP node1.45761 > node1.37551: UDP, length 113
03:45:29.283902 IP node1.49009 > node1.37551: UDP, length 112
03:45:29.284054 IP node1.49865 > node1.37551: UDP, length 113
03:45:29.284317 IP node1.57400 > node1.37551: UDP, length 113
03:45:29.286199 IP node1.38638 > node1.37551: UDP, length 113
03:45:29.287306 IP node1.57062 > node1.37551: UDP, length 112
03:45:29.287570 IP node1.57925 > node1.37551: UDP, length 113
03:45:29.288041 IP node1.58616 > node1.37551: UDP, length 113
03:45:29.288256 IP node1.60161 > node1.37551: UDP, length 113
03:45:29.288309 IP node1.34433 > node1.37551: UDP, length 113
03:45:29.288543 IP node1.38553 > node1.37551: UDP, length 112
03:45:29.288826 IP node1.42579 > node1.37551: UDP, length 113
03:45:29.291456 IP node1.59003 > node1.37551: UDP, length 113
03:45:29.291716 IP node1.45429 > node1.37551: UDP, length 113
03:45:29.293346 IP node1.58838 > node1.37551: UDP, length 113
03:45:29.293643 IP node1.41557 > node1.37551: UDP, length 113
03:45:29.293805 IP node1.38655 > node1.37551: UDP, length 111
03:45:29.294042 IP node1.60033 > node1.37551: UDP, length 113
03:45:29.294142 IP node1.32848 > node1.37551: UDP, length 113
03:45:29.294692 IP node1.38430 > node1.37551: UDP, length 112
03:45:29.296059 IP node1.50532 > node1.37551: UDP, length 113
03:45:29.297411 IP node1.54852 > node1.37551: UDP, length 113
03:45:29.297642 IP node1.33607 > node1.37551: UDP, length 113
03:45:29.298795 IP node1.34959 > node1.36914: UDP, length 113
03:45:29.299101 IP node1.34959 > node1.59984: UDP, length 113
03:45:29.299930 IP node1.34959 > node1.55391: UDP, length 113
03:45:29.299994 IP node1.34959 > node1.37551: UDP, length 113
03:45:29.303114 IP node1.56249 > node1.38638: UDP, length 113
03:45:29.304108 IP node1.56249 > node1.56879: UDP, length 113
03:45:29.304422 IP node1.56249 > node1.36914: UDP, length 113
03:45:29.304900 IP node1.56249 > node1.59984: UDP, length 113
03:45:29.305196 IP node1.56249 > node1.55391: UDP, length 113
03:45:29.305396 IP node1.56249 > node1.37551: UDP, length 113
03:45:29.305638 IP node1.56249 > node1.34959: UDP, length 113
03:45:29.320934 IP node1.36914 > node1.38638: UDP, length 113
03:45:29.326778 IP node1.36914 > node1.56249: UDP, length 113
03:45:29.327929 IP node1.36914 > node1.56879: UDP, length 113
03:45:29.328185 IP node1.36914 > node1.34959: UDP, length 113
03:45:29.328420 IP node1.36914 > node1.59984: UDP, length 113
03:45:29.328605 IP node1.36914 > node1.55391: UDP, length 113
03:45:29.329016 IP node1.36914 > node1.37551: UDP, length 113
03:45:29.366749 IP node1.55391 > node1.38638: UDP, length 112
03:45:29.367184 IP node1.56879 > node1.36914: UDP, length 112
03:45:29.367537 IP node1.56879 > node1.59984: UDP, length 112
03:45:29.367868 IP node1.56879 > node1.55391: UDP, length 112
03:45:29.368135 IP node1.56879 > node1.37551: UDP, length 112
03:45:29.368342 IP node1.55391 > node1.56249: UDP, length 112
03:45:29.368633 IP node1.55391 > node1.56879: UDP, length 112
03:45:29.368870 IP node1.55391 > node1.34959: UDP, length 112
03:45:29.369064 IP node1.55391 > node1.36914: UDP, length 112
03:45:29.369292 IP node1.55391 > node1.59984: UDP, length 112
03:45:29.369507 IP node1.55391 > node1.37551: UDP, length 112
03:45:29.397668 IP node1.59984 > node1.41557: UDP, length 113
03:45:29.434019 IP node1.58604 > node1.53282: UDP, length 113
03:45:29.434113 IP node1.54852 > node1.53282: UDP, length 113
03:45:29.435504 IP node1.32848 > node1.53282: UDP, length 113
03:45:29.435823 IP node1.49865 > node1.53282: UDP, length 113
03:45:29.436784 IP node1.41557 > node1.53282: UDP, length 113
03:45:29.437144 IP node1.50532 > node1.53282: UDP, length 113
03:45:29.437942 IP node1.60161 > node1.53282: UDP, length 113
03:45:29.438111 IP node1.47760 > node1.53282: UDP, length 113
03:45:29.440441 IP node1.56249 > node1.53282: UDP, length 113
03:45:29.440619 IP node1.45429 > node1.53282: UDP, length 113
03:45:29.441723 IP node1.34176 > node1.53282: UDP, length 113
03:45:29.444404 IP node1.49009 > node1.53282: UDP, length 112
03:45:29.444568 IP node1.45761 > node1.53282: UDP, length 113
03:45:29.444912 IP node1.55391 > node1.53282: UDP, length 112
03:45:29.445384 IP node1.38638 > node1.53282: UDP, length 113
03:45:29.445630 IP node1.57062 > node1.53282: UDP, length 112
03:45:29.445867 IP node1.57925 > node1.53282: UDP, length 113
03:45:29.446532 IP node1.58616 > node1.53282: UDP, length 113
03:45:29.446757 IP node1.60033 > node1.53282: UDP, length 113
03:45:29.447732 IP node1.38655 > node1.53282: UDP, length 111
03:45:29.448570 IP node1.38430 > node1.53282: UDP, length 112
03:45:29.448792 IP node1.59003 > node1.53282: UDP, length 113
03:45:29.449993 IP node1.57400 > node1.53282: UDP, length 113
03:45:29.452772 IP node1.38553 > node1.53282: UDP, length 112
03:45:29.453083 IP node1.33607 > node1.53282: UDP, length 113
03:45:29.453274 IP node1.42579 > node1.53282: UDP, length 113
03:45:29.453691 IP node1.47025 > node1.53282: UDP, length 113
03:45:29.455363 IP node1.34433 > node1.53282: UDP, length 113
03:45:29.456826 IP node1.58838 > node1.53282: UDP, length 113
03:45:29.458176 IP node1.34959 > node1.53282: UDP, length 113
03:45:29.459645 IP node1.56879 > node1.53282: UDP, length 112
03:45:29.460758 IP node1.36914 > node1.53282: UDP, length 113
03:45:29.463823 IP node1.49009 > node1.41077: UDP, length 112
03:45:29.464183 IP node1.34959 > node1.41077: UDP, length 113
03:45:29.464853 IP node1.38638 > node1.41077: UDP, length 113
03:45:29.466522 IP node1.34433 > node1.41077: UDP, length 113
03:45:29.467006 IP node1.38553 > node1.41077: UDP, length 112
03:45:29.466774 IP node1.59003 > node1.41077: UDP, length 113
03:45:29.467387 IP node1.60161 > node1.41077: UDP, length 113
03:45:29.467613 IP node1.34176 > node1.41077: UDP, length 113
03:45:29.467693 IP node1.47760 > node1.41077: UDP, length 113
03:45:29.468221 IP node1.58604 > node1.41077: UDP, length 113
03:45:29.468729 IP node1.58616 > node1.41077: UDP, length 113
03:45:29.468907 IP node1.42579 > node1.41077: UDP, length 113
03:45:29.469047 IP node1.56249 > node1.41077: UDP, length 113
03:45:29.469049 IP node1.57925 > node1.41077: UDP, length 113
03:45:29.469538 IP node1.60033 > node1.41077: UDP, length 113
03:45:29.471446 IP node1.47025 > node1.41077: UDP, length 113
03:45:29.471832 IP node1.57062 > node1.41077: UDP, length 112
03:45:29.472003 IP node1.45761 > node1.41077: UDP, length 113
03:45:29.472074 IP node1.41557 > node1.41077: UDP, length 113
03:45:29.472493 IP node1.50532 > node1.41077: UDP, length 113
03:45:29.473872 IP node1.45429 > node1.41077: UDP, length 113
03:45:29.476225 IP node1.36914 > node1.41077: UDP, length 113
03:45:29.478287 IP node1.54852 > node1.41077: UDP, length 113
03:45:29.479196 IP node1.38430 > node1.41077: UDP, length 112
03:45:29.480768 IP node1.55391 > node1.41077: UDP, length 112
03:45:29.480840 IP node1.57400 > node1.41077: UDP, length 113
03:45:29.481144 IP node1.56879 > node1.41077: UDP, length 112
03:45:29.481335 IP node1.49865 > node1.41077: UDP, length 113
03:45:29.481359 IP node1.38655 > node1.41077: UDP, length 111
03:45:29.482223 IP node1.58838 > node1.41077: UDP, length 113
03:45:29.482979 IP node1.33607 > node1.41077: UDP, length 113
03:45:29.483356 IP node1.32848 > node1.41077: UDP, length 113
03:45:29.520062 IP node1.37551 > node1.54852: UDP, length 113
03:45:29.545647 IP node1.60161 > node1.38430: UDP, length 113
03:45:29.546040 IP node1.49009 > node1.38430: UDP, length 112
03:45:29.547701 IP node1.49865 > node1.38430: UDP, length 113
03:45:29.548015 IP node1.60033 > node1.38430: UDP, length 113
03:45:29.548757 IP node1.34433 > node1.38430: UDP, length 113
03:45:29.549339 IP node1.47760 > node1.38430: UDP, length 113
03:45:29.549350 IP node1.38553 > node1.38430: UDP, length 112
03:45:29.551279 IP node1.58616 > node1.38430: UDP, length 113
03:45:29.552020 IP node1.57062 > node1.38430: UDP, length 112
03:45:29.552656 IP node1.57925 > node1.38430: UDP, length 113
03:45:29.553587 IP node1.34959 > node1.38430: UDP, length 113
03:45:29.554001 IP node1.34176 > node1.38430: UDP, length 113
03:45:29.554214 IP node1.42579 > node1.38430: UDP, length 113
03:45:29.554459 IP node1.50532 > node1.38430: UDP, length 113
03:45:29.554741 IP node1.41557 > node1.38430: UDP, length 113
03:45:29.554959 IP node1.38638 > node1.38430: UDP, length 113
03:45:29.556143 IP node1.56249 > node1.38430: UDP, length 113
03:45:29.556989 IP node1.45429 > node1.38430: UDP, length 113
03:45:29.560559 IP node1.58604 > node1.38430: UDP, length 113
03:45:29.560561 IP node1.57400 > node1.38430: UDP, length 113
03:45:29.560590 IP node1.58838 > node1.38430: UDP, length 113
03:45:29.561133 IP node1.45761 > node1.38430: UDP, length 113
03:45:29.562007 IP node1.33607 > node1.38430: UDP, length 113
03:45:29.562866 IP node1.47025 > node1.38430: UDP, length 113
03:45:29.563727 IP node1.38655 > node1.38430: UDP, length 111
03:45:29.564983 IP node1.59003 > node1.38430: UDP, length 113
03:45:29.567298 IP node1.55391 > node1.38430: UDP, length 112
03:45:29.568908 IP node1.32848 > node1.38430: UDP, length 113
03:45:29.569114 IP node1.36914 > node1.38430: UDP, length 113
03:45:29.569988 IP node1.56879 > node1.38430: UDP, length 112
03:45:29.571388 IP node1.54852 > node1.38430: UDP, length 113
03:45:29.573295 IP node1.38638 > node1.60829: UDP, length 113
03:45:29.574085 IP node1.33607 > node1.60829: UDP, length 113
03:45:29.574891 IP node1.34176 > node1.60829: UDP, length 113
03:45:29.576337 IP node1.49865 > node1.60829: UDP, length 113
03:45:29.577046 IP node1.58604 > node1.60829: UDP, length 113
03:45:29.577091 IP node1.57400 > node1.60829: UDP, length 113
03:45:29.577798 IP node1.54852 > node1.60829: UDP, length 113
03:45:29.577907 IP node1.41557 > node1.60829: UDP, length 113
03:45:29.578074 IP node1.57062 > node1.60829: UDP, length 112
03:45:29.578154 IP node1.47760 > node1.60829: UDP, length 113
03:45:29.578779 IP node1.34959 > node1.60829: UDP, length 113
03:45:29.579662 IP node1.49009 > node1.60829: UDP, length 112
03:45:29.579924 IP node1.45761 > node1.60829: UDP, length 113
03:45:29.580930 IP node1.38430 > node1.60829: UDP, length 112
03:45:29.582251 IP node1.45429 > node1.60829: UDP, length 113
03:45:29.583201 IP node1.47025 > node1.60829: UDP, length 113
03:45:29.584361 IP node1.57925 > node1.60829: UDP, length 113
03:45:29.584657 IP node1.38655 > node1.60829: UDP, length 111
03:45:29.584848 IP node1.58616 > node1.60829: UDP, length 113
03:45:29.586167 IP node1.60033 > node1.60829: UDP, length 113
03:45:29.587675 IP node1.34433 > node1.60829: UDP, length 113
03:45:29.587960 IP node1.38553 > node1.60829: UDP, length 112
03:45:29.588211 IP node1.42579 > node1.60829: UDP, length 113
03:45:29.589667 IP node1.32848 > node1.60829: UDP, length 113
03:45:29.593276 IP node1.56249 > node1.60829: UDP, length 113
03:45:29.593569 IP node1.60161 > node1.60829: UDP, length 113
03:45:29.593592 IP node1.50532 > node1.60829: UDP, length 113
03:45:29.593780 IP node1.56879 > node1.60829: UDP, length 112
03:45:29.594848 IP node1.59003 > node1.60829: UDP, length 113
03:45:29.595211 IP node1.36914 > node1.60829: UDP, length 113
03:45:29.597612 IP node1.55391 > node1.60829: UDP, length 112
03:45:29.599526 IP node1.58838 > node1.60829: UDP, length 113
03:45:29.616901 IP node1.41077 > node1.41557: UDP, length 113
03:45:29.633252 IP node1.59984 > node1.57062: UDP, length 113
03:45:29.633652 IP node1.59984 > node1.54852: UDP, length 113
03:45:29.644026 IP node1.59984 > node1.38638: UDP, length 113
03:45:29.644102 IP node1.59984 > node1.56249: UDP, length 113
03:45:29.651413 IP node1.59984 > node1.34959: UDP, length 113
03:45:29.652327 IP node1.58604 > node1.45429: UDP, length 113
03:45:29.652443 IP node1.38638 > node1.45429: UDP, length 113
03:45:29.653895 IP node1.34959 > node1.45429: UDP, length 113
03:45:29.653974 IP node1.34176 > node1.45429: UDP, length 113
03:45:29.654634 IP node1.54852 > node1.45429: UDP, length 113
03:45:29.655141 IP node1.49865 > node1.45429: UDP, length 113
03:45:29.655431 IP node1.41557 > node1.45429: UDP, length 113
03:45:29.655699 IP node1.57062 > node1.45429: UDP, length 112
03:45:29.655852 IP node1.47760 > node1.45429: UDP, length 113
03:45:29.656757 IP node1.57400 > node1.45429: UDP, length 113
03:45:29.656881 IP node1.45761 > node1.45429: UDP, length 113
03:45:29.657191 IP node1.55391 > node1.45429: UDP, length 112
03:45:29.657373 IP node1.60161 > node1.45429: UDP, length 113
03:45:29.658238 IP node1.47025 > node1.45429: UDP, length 113
03:45:29.658624 IP node1.50532 > node1.45429: UDP, length 113
03:45:29.658878 IP node1.60033 > node1.45429: UDP, length 113
03:45:29.659154 IP node1.36914 > node1.45429: UDP, length 113
03:45:29.660437 IP node1.49009 > node1.45429: UDP, length 112
03:45:29.661096 IP node1.56249 > node1.45429: UDP, length 113
03:45:29.661418 IP node1.38553 > node1.45429: UDP, length 112
03:45:29.661660 IP node1.42579 > node1.45429: UDP, length 113
03:45:29.662128 IP node1.57925 > node1.45429: UDP, length 113
03:45:29.662387 IP node1.58616 > node1.45429: UDP, length 113
03:45:29.664296 IP node1.38430 > node1.45429: UDP, length 112
03:45:29.666064 IP node1.38655 > node1.45429: UDP, length 111
03:45:29.666697 IP node1.33607 > node1.45429: UDP, length 113
03:45:29.667500 IP node1.34433 > node1.45429: UDP, length 113
03:45:29.668270 IP node1.32848 > node1.45429: UDP, length 113
03:45:29.668929 IP node1.56879 > node1.45429: UDP, length 112
03:45:29.673407 IP node1.59003 > node1.45429: UDP, length 113
03:45:29.677886 IP node1.58838 > node1.45429: UDP, length 113
03:45:29.684578 IP node1.37145 > node1.54852: UDP, length 113
03:45:29.686004 IP node1.58604 > node1.37145: UDP, length 113
03:45:29.686580 IP node1.38430 > node1.37145: UDP, length 112
03:45:29.686963 IP node1.38655 > node1.37145: UDP, length 111
03:45:29.687674 IP node1.33607 > node1.37145: UDP, length 113
03:45:29.687674 IP node1.42579 > node1.37145: UDP, length 113
03:45:29.688715 IP node1.34176 > node1.37145: UDP, length 113
03:45:29.689212 IP node1.49865 > node1.37145: UDP, length 113
03:45:29.690060 IP node1.41557 > node1.37145: UDP, length 113
03:45:29.690479 IP node1.56879 > node1.37145: UDP, length 112
03:45:29.690942 IP node1.57400 > node1.37145: UDP, length 113
03:45:29.691357 IP node1.60033 > node1.37145: UDP, length 113
03:45:29.692723 IP node1.58616 > node1.37145: UDP, length 113
03:45:29.693008 IP node1.38553 > node1.37145: UDP, length 112
03:45:29.693033 IP node1.57062 > node1.37145: UDP, length 112
03:45:29.693655 IP node1.57925 > node1.37145: UDP, length 113
03:45:29.693934 IP node1.34433 > node1.37145: UDP, length 113
03:45:29.694178 IP node1.59003 > node1.37145: UDP, length 113
03:45:29.695976 IP node1.32848 > node1.37145: UDP, length 113
03:45:29.696353 IP node1.60161 > node1.37145: UDP, length 113
03:45:29.696886 IP node1.49009 > node1.37145: UDP, length 112
03:45:29.697031 IP node1.55391 > node1.37145: UDP, length 112
03:45:29.697834 IP node1.50532 > node1.37145: UDP, length 113
03:45:29.698695 IP node1.47760 > node1.37145: UDP, length 113
03:45:29.699410 IP node1.45761 > node1.37145: UDP, length 113
03:45:29.699685 IP node1.47025 > node1.37145: UDP, length 113
03:45:29.699835 IP node1.36914 > node1.37145: UDP, length 113
03:45:29.700086 IP node1.56249 > node1.37145: UDP, length 113
03:45:29.702033 IP node1.34959 > node1.37145: UDP, length 113
03:45:29.705044 IP node1.54852 > node1.37145: UDP, length 113
03:45:29.709384 IP node1.37145 > node1.38638: UDP, length 113
03:45:29.710981 IP node1.58838 > node1.37145: UDP, length 113
03:45:29.712947 IP node1.37145 > node1.56249: UDP, length 113
03:45:29.713121 IP node1.37145 > node1.56879: UDP, length 113
03:45:29.713420 IP node1.37145 > node1.36914: UDP, length 113
03:45:29.713799 IP node1.37145 > node1.59984: UDP, length 113
03:45:29.714348 IP node1.37145 > node1.55391: UDP, length 113
03:45:29.714542 IP node1.37145 > node1.34959: UDP, length 113
03:45:29.714974 IP node1.37145 > node1.53282: UDP, length 113
03:45:29.715269 IP node1.37145 > node1.41077: UDP, length 113
03:45:29.721129 IP node1.38638 > node1.37145: UDP, length 113
03:45:29.730304 IP node1.45429 > node1.37145: UDP, length 113
03:45:29.733880 IP node1.59984 > node1.36914: UDP, length 113
03:45:29.747868 IP node1.59984 > node1.45429: UDP, length 113
03:45:29.748899 IP node1.59984 > node1.37145: UDP, length 113
03:45:29.749051 IP node1.59984 > node1.41077: UDP, length 113
03:45:29.749128 IP node1.59984 > node1.56879: UDP, length 113
03:45:29.749224 IP node1.59984 > node1.53282: UDP, length 113
03:45:29.749289 IP node1.59984 > node1.38430: UDP, length 113
03:45:29.749350 IP node1.59984 > node1.60829: UDP, length 113
03:45:29.749660 IP node1.59984 > node1.37551: UDP, length 113
03:45:29.767555 IP node1.37551 > node1.38638: UDP, length 113
03:45:29.768198 IP node1.37551 > node1.56249: UDP, length 113
03:45:29.768907 IP node1.37551 > node1.56879: UDP, length 113
03:45:29.769961 IP node1.37551 > node1.36914: UDP, length 113
03:45:29.770086 IP node1.37551 > node1.34959: UDP, length 113
03:45:29.770211 IP node1.37551 > node1.59984: UDP, length 113
03:45:29.770310 IP node1.37551 > node1.55391: UDP, length 113
03:45:29.770419 IP node1.37551 > node1.53282: UDP, length 113
03:45:29.771999 IP node1.37551 > node1.45429: UDP, length 113
03:45:29.772302 IP node1.37551 > node1.37145: UDP, length 113
03:45:29.772398 IP node1.37551 > node1.41077: UDP, length 113
03:45:29.772508 IP node1.37551 > node1.38430: UDP, length 113
03:45:29.772655 IP node1.37551 > node1.60829: UDP, length 113
03:45:29.773779 IP node1.37145 > node1.45429: UDP, length 113
03:45:29.773977 IP node1.37145 > node1.60829: UDP, length 113
03:45:29.774044 IP node1.37145 > node1.37551: UDP, length 113
03:45:29.779704 IP node1.59984 > node1.55391: UDP, length 113
03:45:29.792675 IP node1.60829 > node1.54852: UDP, length 112
03:45:29.804836 IP node1.37145 > node1.38430: UDP, length 113
03:45:29.824498 IP node1.41077 > node1.57062: UDP, length 113
03:45:29.824814 IP node1.41077 > node1.54852: UDP, length 113
03:45:29.827394 IP node1.41077 > node1.38638: UDP, length 113
03:45:29.833316 IP node1.41077 > node1.56249: UDP, length 113
03:45:29.833543 IP node1.41077 > node1.56879: UDP, length 113
03:45:29.833994 IP node1.41077 > node1.34959: UDP, length 113
03:45:29.834205 IP node1.41077 > node1.36914: UDP, length 113
03:45:29.834434 IP node1.41077 > node1.59984: UDP, length 113
03:45:29.834997 IP node1.41077 > node1.55391: UDP, length 113
03:45:29.835417 IP node1.41077 > node1.37551: UDP, length 113
03:45:29.835918 IP node1.41077 > node1.53282: UDP, length 113
03:45:29.836624 IP node1.41077 > node1.38430: UDP, length 113
03:45:29.836858 IP node1.41077 > node1.60829: UDP, length 113
03:45:29.837408 IP node1.41077 > node1.45429: UDP, length 113
03:45:29.837694 IP node1.41077 > node1.37145: UDP, length 113
03:45:29.851954 IP node1.53282 > node1.38638: UDP, length 113
03:45:29.854836 IP node1.53282 > node1.56249: UDP, length 113
03:45:29.903340 IP node1.53282 > node1.36914: UDP, length 113
03:45:29.903407 IP node1.53282 > node1.56879: UDP, length 113
03:45:29.903461 IP node1.53282 > node1.34959: UDP, length 113
03:45:29.904652 IP node1.53282 > node1.55391: UDP, length 113
03:45:29.904953 IP node1.53282 > node1.37551: UDP, length 113
03:45:29.905233 IP node1.53282 > node1.41077: UDP, length 113
03:45:29.906050 IP node1.53282 > node1.38430: UDP, length 113
03:45:29.906484 IP node1.53282 > node1.60829: UDP, length 113
03:45:29.906741 IP node1.53282 > node1.45429: UDP, length 113
03:45:29.907039 IP node1.53282 > node1.37145: UDP, length 113
03:45:29.913430 IP node1.53282 > node1.59984: UDP, length 113
03:45:29.967623 IP node1.57925 > node1.49009: UDP, length 113
03:45:29.969289 IP node1.38553 > node1.49009: UDP, length 112
03:45:29.969331 IP node1.60161 > node1.49009: UDP, length 113
03:45:29.969444 IP node1.49865 > node1.49009: UDP, length 113
03:45:29.970217 IP node1.56249 > node1.49009: UDP, length 113
03:45:29.972584 IP node1.47760 > node1.49009: UDP, length 113
03:45:29.972854 IP node1.33607 > node1.49009: UDP, length 113
03:45:29.972891 IP node1.38430 > node1.49009: UDP, length 112
03:45:29.974741 IP node1.42579 > node1.49009: UDP, length 113
03:45:29.976362 IP node1.34433 > node1.49009: UDP, length 113
03:45:29.978575 IP node1.59003 > node1.49009: UDP, length 113
03:45:29.979867 IP node1.34176 > node1.49009: UDP, length 113
03:45:29.980890 IP node1.50532 > node1.49009: UDP, length 113
03:45:29.980968 IP node1.45761 > node1.49009: UDP, length 113
03:45:29.982106 IP node1.41077 > node1.49009: UDP, length 113
03:45:29.988151 IP node1.38655 > node1.49009: UDP, length 111
03:45:29.988421 IP node1.58838 > node1.49009: UDP, length 113
03:45:29.990822 IP node1.38638 > node1.49009: UDP, length 113
03:45:29.991387 IP node1.32848 > node1.49009: UDP, length 113
03:45:29.995634 IP node1.55391 > node1.49009: UDP, length 112
03:45:29.996764 IP node1.57400 > node1.49009: UDP, length 113
03:45:30.000126 IP node1.58604 > node1.49009: UDP, length 113
03:45:30.000535 IP node1.45429 > node1.49009: UDP, length 113
03:45:30.002534 IP node1.36914 > node1.49009: UDP, length 113
03:45:30.003217 IP node1.37551 > node1.49009: UDP, length 113
03:45:30.004757 IP node1.59984 > node1.49009: UDP, length 113
03:45:30.005765 IP node1.56879 > node1.49009: UDP, length 112
03:45:30.005929 IP node1.58616 > node1.49009: UDP, length 113
03:45:30.007763 IP node1.41557 > node1.49009: UDP, length 113
03:45:30.011569 IP node1.54852 > node1.49009: UDP, length 113
03:45:30.016474 IP node1.57062 > node1.49009: UDP, length 112
03:45:30.018001 IP node1.34959 > node1.49009: UDP, length 113
03:45:30.020920 IP node1.47025 > node1.49009: UDP, length 113
03:45:30.028872 IP node1.53282 > node1.49009: UDP, length 113
03:45:30.037671 IP node1.37145 > node1.49009: UDP, length 113
03:45:30.066653 IP node1.60033 > node1.49009: UDP, length 113
03:45:30.087871 IP node1.60829 > node1.59984: UDP, length 112
03:45:30.087967 IP node1.60829 > node1.45429: UDP, length 112
03:45:30.088064 IP node1.60829 > node1.49009: UDP, length 112
03:45:30.088213 IP node1.60829 > node1.36914: UDP, length 112
03:45:30.088319 IP node1.60829 > node1.37145: UDP, length 112
03:45:30.088465 IP node1.60829 > node1.38638: UDP, length 112
03:45:30.088605 IP node1.60829 > node1.56249: UDP, length 112
03:45:30.088721 IP node1.60829 > node1.55391: UDP, length 112
03:45:30.088848 IP node1.60829 > node1.41077: UDP, length 112
03:45:30.088929 IP node1.60829 > node1.56879: UDP, length 112
03:45:30.089001 IP node1.60829 > node1.53282: UDP, length 112
03:45:30.089061 IP node1.60829 > node1.38430: UDP, length 112
03:45:30.089132 IP node1.60829 > node1.34959: UDP, length 112
03:45:30.089197 IP node1.60829 > node1.37551: UDP, length 112
03:45:30.217831 IP node1.58604 > node1.50532: UDP, length 87
03:45:30.219123 IP node1.50532 > node1.58604: UDP, length 94
03:45:30.239410 IP node1.59984 > node1.60161: UDP, length 113
03:45:30.239750 IP node1.55391 > node1.60161: UDP, length 112
03:45:30.239959 IP node1.57925 > node1.60161: UDP, length 113
03:45:30.240201 IP node1.58838 > node1.60161: UDP, length 113
03:45:30.240321 IP node1.59003 > node1.60161: UDP, length 113
03:45:30.240739 IP node1.38655 > node1.60161: UDP, length 111
03:45:30.240861 IP node1.47025 > node1.60161: UDP, length 113
03:45:30.240907 IP node1.41077 > node1.60161: UDP, length 113
03:45:30.241247 IP node1.33607 > node1.60161: UDP, length 113
03:45:30.241259 IP node1.49009 > node1.60161: UDP, length 112
03:45:30.241501 IP node1.45761 > node1.60161: UDP, length 113
03:45:30.241720 IP node1.37551 > node1.60161: UDP, length 113
03:45:30.241956 IP node1.49865 > node1.60161: UDP, length 113
03:45:30.242211 IP node1.32848 > node1.60161: UDP, length 113
03:45:30.245896 IP node1.37145 > node1.60161: UDP, length 113
03:45:30.246120 IP node1.45429 > node1.60161: UDP, length 113
03:45:30.246196 IP node1.54852 > node1.60161: UDP, length 113
03:45:30.246856 IP node1.53282 > node1.60161: UDP, length 113
03:45:30.247014 IP node1.56879 > node1.60161: UDP, length 112
03:45:30.247049 IP node1.34959 > node1.60161: UDP, length 113
03:45:30.247232 IP node1.42579 > node1.60161: UDP, length 113
03:45:30.248219 IP node1.38430 > node1.60161: UDP, length 112
03:45:30.248825 IP node1.60033 > node1.60161: UDP, length 113
03:45:30.249068 IP node1.38553 > node1.60161: UDP, length 112
03:45:30.249069 IP node1.56249 > node1.60161: UDP, length 113
03:45:30.249546 IP node1.36914 > node1.60161: UDP, length 113
03:45:30.250021 IP node1.57400 > node1.60161: UDP, length 113
03:45:30.251081 IP node1.58604 > node1.60161: UDP, length 113
03:45:30.251083 IP node1.34176 > node1.60161: UDP, length 113
03:45:30.252135 IP node1.34433 > node1.60161: UDP, length 113
03:45:30.254835 IP node1.41557 > node1.60161: UDP, length 113
03:45:30.256803 IP node1.60829 > node1.60161: UDP, length 112
03:45:30.262237 IP node1.38638 > node1.60161: UDP, length 113
03:45:30.262758 IP node1.41557 > node1.57062: UDP, length 87
03:45:30.303340 IP node1.50532 > node1.60161: UDP, length 113
03:45:30.305960 IP node1.38638 > node1.47025: UDP, length 113
03:45:30.306041 IP node1.33607 > node1.47025: UDP, length 113
03:45:30.306759 IP node1.56879 > node1.47025: UDP, length 112
03:45:30.307495 IP node1.59984 > node1.47025: UDP, length 113
03:45:30.307537 IP node1.38430 > node1.47025: UDP, length 112
03:45:30.307656 IP node1.38655 > node1.47025: UDP, length 111
03:45:30.309401 IP node1.45429 > node1.47025: UDP, length 113
03:45:30.311694 IP node1.36914 > node1.47025: UDP, length 113
03:45:30.312157 IP node1.56249 > node1.47025: UDP, length 113
03:45:30.312405 IP node1.41077 > node1.47025: UDP, length 113
03:45:30.312824 IP node1.34959 > node1.47025: UDP, length 113
03:45:30.313140 IP node1.38553 > node1.47025: UDP, length 112
03:45:30.314609 IP node1.50532 > node1.47025: UDP, length 113
03:45:30.315207 IP node1.32848 > node1.47025: UDP, length 113
03:45:30.315786 IP node1.57062 > node1.41557: UDP, length 94
03:45:30.315949 IP node1.57062 > node1.47025: UDP, length 112
03:45:30.316001 IP node1.57062 > node1.60161: UDP, length 112
03:45:30.317585 IP node1.55391 > node1.47025: UDP, length 112
03:45:30.317903 IP node1.37145 > node1.47025: UDP, length 113
03:45:30.320094 IP node1.37551 > node1.47025: UDP, length 113
03:45:30.320739 IP node1.54852 > node1.47025: UDP, length 113
03:45:30.320897 IP node1.34176 > node1.47025: UDP, length 113
03:45:30.321424 IP node1.41557 > node1.47025: UDP, length 113
03:45:30.322926 IP node1.49009 > node1.47025: UDP, length 112
03:45:30.324213 IP node1.49865 > node1.47025: UDP, length 113
03:45:30.324390 IP node1.58604 > node1.47025: UDP, length 113
03:45:30.324847 IP node1.42579 > node1.47025: UDP, length 113
03:45:30.324921 IP node1.58838 > node1.47025: UDP, length 113
03:45:30.325472 IP node1.34433 > node1.47025: UDP, length 113
03:45:30.326692 IP node1.57400 > node1.47025: UDP, length 113
03:45:30.328008 IP node1.45761 > node1.47025: UDP, length 113
03:45:30.329543 IP node1.57925 > node1.47025: UDP, length 113
03:45:30.330674 IP node1.60829 > node1.47025: UDP, length 112
03:45:30.331049 IP node1.53282 > node1.47025: UDP, length 113
03:45:30.341175 IP node1.33607 > node1.54355: UDP, length 113
03:45:30.341195 IP node1.34176 > node1.54355: UDP, length 113
03:45:30.341229 IP node1.38638 > node1.54355: UDP, length 113
03:45:30.342405 IP node1.59984 > node1.54355: UDP, length 113
03:45:30.343019 IP node1.56249 > node1.54355: UDP, length 113
03:45:30.343745 IP node1.38655 > node1.54355: UDP, length 111
03:45:30.343762 IP node1.41557 > node1.54355: UDP, length 113
03:45:30.343823 IP node1.41077 > node1.54355: UDP, length 113
03:45:30.343825 IP node1.34959 > node1.54355: UDP, length 113
03:45:30.344850 IP node1.45429 > node1.54355: UDP, length 113
03:45:30.348034 IP node1.36914 > node1.54355: UDP, length 113
03:45:30.350403 IP node1.53282 > node1.54355: UDP, length 113
03:45:30.350581 IP node1.49009 > node1.54355: UDP, length 112
03:45:30.350878 IP node1.50532 > node1.54355: UDP, length 113
03:45:30.353632 IP node1.42579 > node1.54355: UDP, length 113
03:45:30.354950 IP node1.56879 > node1.54355: UDP, length 112
03:45:30.354953 IP node1.58838 > node1.54355: UDP, length 113
03:45:30.356615 IP node1.57400 > node1.54355: UDP, length 113
03:45:30.357529 IP node1.38430 > node1.54355: UDP, length 112
03:45:30.359078 IP node1.57925 > node1.54355: UDP, length 113
03:45:30.359248 IP node1.45761 > node1.54355: UDP, length 113
03:45:30.360053 IP node1.38553 > node1.54355: UDP, length 112
03:45:30.361462 IP node1.50532 > node1.60033: UDP, length 87
03:45:30.362443 IP node1.34433 > node1.54355: UDP, length 113
03:45:30.363228 IP node1.54852 > node1.54355: UDP, length 113
03:45:30.364896 IP node1.58604 > node1.54355: UDP, length 113
03:45:30.367619 IP node1.37145 > node1.54355: UDP, length 113
03:45:30.368359 IP node1.55391 > node1.54355: UDP, length 112
03:45:30.371225 IP node1.37551 > node1.54355: UDP, length 113
03:45:30.371602 IP node1.32848 > node1.54355: UDP, length 113
03:45:30.372185 IP node1.60829 > node1.54355: UDP, length 112
03:45:30.379190 IP node1.47025 > node1.54355: UDP, length 113
03:45:30.392531 IP node1.60033 > node1.47025: UDP, length 113
03:45:30.392603 IP node1.60033 > node1.50532: UDP, length 94
03:45:30.394504 IP node1.59003 > node1.47025: UDP, length 113
03:45:30.397398 IP node1.59003 > node1.54355: UDP, length 113
03:45:30.410655 IP node1.47760 > node1.47025: UDP, length 113
03:45:30.410739 IP node1.47760 > node1.54355: UDP, length 113
03:45:30.410780 IP node1.47760 > node1.60161: UDP, length 113
03:45:30.448420 IP node1.49865 > node1.54355: UDP, length 113
03:45:30.448940 IP node1.57062 > node1.54355: UDP, length 112
03:45:30.492932 IP node1.60033 > node1.54355: UDP, length 113
03:45:30.552376 IP node1.58616 > node1.47025: UDP, length 113
03:45:30.552455 IP node1.58616 > node1.54355: UDP, length 113
03:45:30.552503 IP node1.58616 > node1.60161: UDP, length 113
03:45:30.591181 IP node1.60161 > node1.47025: UDP, length 113
03:45:30.591494 IP node1.60161 > node1.54355: UDP, length 113
03:45:30.618334 IP node1.54355 > node1.53282: UDP, length 113
03:45:30.621093 IP node1.54355 > node1.41077: UDP, length 113
03:45:30.877552 IP node1.54355 > node1.38430: UDP, length 113
03:45:30.877739 IP node1.54355 > node1.60829: UDP, length 113
03:45:30.877899 IP node1.54355 > node1.45429: UDP, length 113
03:45:30.877999 IP node1.54355 > node1.49009: UDP, length 113
03:45:30.878154 IP node1.54355 > node1.37145: UDP, length 113
03:45:30.880197 IP node1.54355 > node1.60161: UDP, length 113
03:45:30.891523 IP node1.54355 > node1.47025: UDP, length 113
03:45:30.979548 IP node1.45761 > node1.49865: UDP, length 87
03:45:30.980832 IP node1.49865 > node1.45761: UDP, length 94
03:45:31.254388 IP node1.36914 > node1.34176: UDP, length 113
03:45:31.255640 IP node1.38553 > node1.34176: UDP, length 112
03:45:31.255925 IP node1.38430 > node1.34176: UDP, length 112
03:45:31.257766 IP node1.60161 > node1.34176: UDP, length 113
03:45:31.258094 IP node1.56879 > node1.34176: UDP, length 112
03:45:31.258589 IP node1.49009 > node1.34176: UDP, length 112
03:45:31.258790 IP node1.42579 > node1.34176: UDP, length 113
03:45:31.258904 IP node1.59984 > node1.34176: UDP, length 113
03:45:31.259088 IP node1.54852 > node1.34176: UDP, length 113
03:45:31.259645 IP node1.57062 > node1.34176: UDP, length 112
03:45:31.259657 IP node1.45761 > node1.34176: UDP, length 113
03:45:31.259924 IP node1.38655 > node1.34176: UDP, length 111
03:45:31.262069 IP node1.34433 > node1.34176: UDP, length 113
03:45:31.262636 IP node1.33607 > node1.34176: UDP, length 113
03:45:31.264366 IP node1.50532 > node1.34176: UDP, length 113
03:45:31.264669 IP node1.58604 > node1.34176: UDP, length 113
03:45:31.264990 IP node1.47760 > node1.34176: UDP, length 113
03:45:31.265404 IP node1.34959 > node1.34176: UDP, length 113
03:45:31.265669 IP node1.55391 > node1.34176: UDP, length 112
03:45:31.266696 IP node1.47025 > node1.34176: UDP, length 113
03:45:31.266822 IP node1.49865 > node1.34176: UDP, length 113
03:45:31.266970 IP node1.32848 > node1.34176: UDP, length 113
03:45:31.267410 IP node1.58616 > node1.34176: UDP, length 113
03:45:31.267878 IP node1.37551 > node1.34176: UDP, length 113
03:45:31.269484 IP node1.58838 > node1.34176: UDP, length 113
03:45:31.269540 IP node1.57400 > node1.34176: UDP, length 113
03:45:31.269835 IP node1.54355 > node1.34176: UDP, length 113
03:45:31.270280 IP node1.57925 > node1.34176: UDP, length 113
03:45:31.270663 IP node1.59003 > node1.34176: UDP, length 113
03:45:31.270972 IP node1.60829 > node1.34176: UDP, length 112
03:45:31.271487 IP node1.37145 > node1.34176: UDP, length 113
03:45:31.272889 IP node1.60033 > node1.34176: UDP, length 113
03:45:31.273314 IP node1.45429 > node1.34176: UDP, length 113
03:45:31.273869 IP node1.53282 > node1.34176: UDP, length 113
03:45:31.278607 IP node1.41077 > node1.34176: UDP, length 113
03:45:31.279914 IP node1.56249 > node1.34176: UDP, length 113
03:45:31.281105 IP node1.38638 > node1.34176: UDP, length 113
03:45:31.289516 IP node1.41557 > node1.34176: UDP, length 113
03:45:31.357651 IP node1.36914 > node1.57925: UDP, length 113
03:45:31.358094 IP node1.38430 > node1.57925: UDP, length 112
03:45:31.358271 IP node1.38553 > node1.57925: UDP, length 112
03:45:31.359983 IP node1.45761 > node1.57925: UDP, length 113
03:45:31.361051 IP node1.60161 > node1.57925: UDP, length 113
03:45:31.361551 IP node1.60033 > node1.57925: UDP, length 113
03:45:31.362664 IP node1.59984 > node1.57925: UDP, length 113
03:45:31.362994 IP node1.56879 > node1.57925: UDP, length 112
03:45:31.363507 IP node1.49009 > node1.57925: UDP, length 112
03:45:31.364031 IP node1.45429 > node1.57925: UDP, length 113
03:45:31.364146 IP node1.47025 > node1.57925: UDP, length 113
03:45:31.364497 IP node1.34433 > node1.57925: UDP, length 113
03:45:31.364749 IP node1.38655 > node1.57925: UDP, length 111
03:45:31.365727 IP node1.47760 > node1.57925: UDP, length 113
03:45:31.366130 IP node1.53282 > node1.57925: UDP, length 113
03:45:31.366332 IP node1.32848 > node1.57925: UDP, length 113
03:45:31.366419 IP node1.58838 > node1.57925: UDP, length 113
03:45:31.366842 IP node1.60829 > node1.57925: UDP, length 112
03:45:31.367316 IP node1.34959 > node1.57925: UDP, length 113
03:45:31.368077 IP node1.33607 > node1.57925: UDP, length 113
03:45:31.368358 IP node1.59003 > node1.57925: UDP, length 113
03:45:31.368954 IP node1.41077 > node1.57925: UDP, length 113
03:45:31.369061 IP node1.55391 > node1.57925: UDP, length 112
03:45:31.369295 IP node1.54852 > node1.57925: UDP, length 113
03:45:31.369945 IP node1.38638 > node1.57925: UDP, length 113
03:45:31.369964 IP node1.54355 > node1.57925: UDP, length 113
03:45:31.370393 IP node1.37145 > node1.57925: UDP, length 113
03:45:31.370777 IP node1.56249 > node1.57925: UDP, length 113
03:45:31.371411 IP node1.41557 > node1.57925: UDP, length 113
03:45:31.371796 IP node1.50532 > node1.57925: UDP, length 113
03:45:31.372018 IP node1.58604 > node1.57925: UDP, length 113
03:45:31.372423 IP node1.57400 > node1.57925: UDP, length 113
03:45:31.372644 IP node1.49865 > node1.57925: UDP, length 113
03:45:31.373333 IP node1.42579 > node1.57925: UDP, length 113
03:45:31.373874 IP node1.58616 > node1.57925: UDP, length 113
03:45:31.374270 IP node1.57062 > node1.57925: UDP, length 112
03:45:31.374689 IP node1.34176 > node1.57925: UDP, length 113
03:45:31.379105 IP node1.37551 > node1.57925: UDP, length 113
03:45:31.554502 IP node1.38655 > node1.54852: UDP, length 111
03:45:31.555254 IP node1.60161 > node1.54852: UDP, length 113
03:45:31.555443 IP node1.45761 > node1.54852: UDP, length 113
03:45:31.555488 IP node1.36914 > node1.54852: UDP, length 113
03:45:31.555557 IP node1.37551 > node1.54852: UDP, length 113
03:45:31.555626 IP node1.38430 > node1.54852: UDP, length 112
03:45:31.555843 IP node1.57925 > node1.54852: UDP, length 113
03:45:31.556021 IP node1.59984 > node1.54852: UDP, length 113
03:45:31.556415 IP node1.47025 > node1.54852: UDP, length 113
03:45:31.558249 IP node1.59003 > node1.54852: UDP, length 113
03:45:31.558579 IP node1.38553 > node1.54852: UDP, length 112
03:45:31.558763 IP node1.34433 > node1.54852: UDP, length 113
03:45:31.559120 IP node1.42579 > node1.54852: UDP, length 113
03:45:31.559514 IP node1.41557 > node1.54852: UDP, length 113
03:45:31.559527 IP node1.56879 > node1.54852: UDP, length 112
03:45:31.559540 IP node1.32848 > node1.54852: UDP, length 113
03:45:31.560811 IP node1.53282 > node1.54852: UDP, length 113
03:45:31.561004 IP node1.49865 > node1.54852: UDP, length 113
03:45:31.561129 IP node1.34959 > node1.54852: UDP, length 113
03:45:31.561194 IP node1.49009 > node1.54852: UDP, length 112
03:45:31.561491 IP node1.58838 > node1.54852: UDP, length 113
03:45:31.561603 IP node1.33607 > node1.54852: UDP, length 113
03:45:31.562162 IP node1.55391 > node1.54852: UDP, length 112
03:45:31.562475 IP node1.34176 > node1.54852: UDP, length 113
03:45:31.562509 IP node1.56249 > node1.54852: UDP, length 113
03:45:31.564252 IP node1.45429 > node1.54852: UDP, length 113
03:45:31.564466 IP node1.60829 > node1.54852: UDP, length 112
03:45:31.564971 IP node1.57062 > node1.54852: UDP, length 112
03:45:31.566338 IP node1.54355 > node1.54852: UDP, length 113
03:45:31.566577 IP node1.41077 > node1.54852: UDP, length 113
03:45:31.566733 IP node1.38638 > node1.54852: UDP, length 113
03:45:31.566777 IP node1.58604 > node1.54852: UDP, length 113
03:45:31.566948 IP node1.57400 > node1.54852: UDP, length 113
03:45:31.568653 IP node1.37145 > node1.54852: UDP, length 113
03:45:31.569489 IP node1.50532 > node1.54852: UDP, length 113
03:45:31.574363 IP node1.60033 > node1.54852: UDP, length 113
03:45:31.595174 IP node1.47760 > node1.54852: UDP, length 113
03:45:31.595727 IP node1.58616 > node1.54852: UDP, length 113
03:45:31.611390 IP node1.38638 > node1.34959: UDP, length 87
03:45:31.612355 IP node1.34959 > node1.38638: UDP, length 94
03:45:31.902900 IP node1.41557 > node1.47407: UDP, length 113
03:45:31.904144 IP node1.60033 > node1.47407: UDP, length 113
03:45:31.904420 IP node1.45761 > node1.47407: UDP, length 113
03:45:31.904625 IP node1.38553 > node1.47407: UDP, length 112
03:45:31.905302 IP node1.49009 > node1.47407: UDP, length 112
03:45:31.905886 IP node1.34433 > node1.47407: UDP, length 113
03:45:31.906015 IP node1.60161 > node1.47407: UDP, length 113
03:45:31.906117 IP node1.33607 > node1.47407: UDP, length 113
03:45:31.906660 IP node1.54852 > node1.47407: UDP, length 113
03:45:31.907148 IP node1.38638 > node1.47407: UDP, length 113
03:45:31.907856 IP node1.47025 > node1.47407: UDP, length 113
03:45:31.908032 IP node1.38655 > node1.47407: UDP, length 111
03:45:31.908106 IP node1.50532 > node1.47407: UDP, length 113
03:45:31.908630 IP node1.34176 > node1.47407: UDP, length 113
03:45:31.908847 IP node1.58604 > node1.47407: UDP, length 113
03:45:31.909289 IP node1.58616 > node1.47407: UDP, length 113
03:45:31.909324 IP node1.32848 > node1.47407: UDP, length 113
03:45:31.909553 IP node1.57400 > node1.47407: UDP, length 113
03:45:31.910541 IP node1.58838 > node1.47407: UDP, length 113
03:45:31.911169 IP node1.59003 > node1.47407: UDP, length 113
03:45:31.911295 IP node1.41077 > node1.47407: UDP, length 113
03:45:31.912715 IP node1.59984 > node1.47407: UDP, length 113
03:45:31.912745 IP node1.47760 > node1.47407: UDP, length 113
03:45:31.914152 IP node1.60829 > node1.47407: UDP, length 112
03:45:31.914646 IP node1.42579 > node1.47407: UDP, length 113
03:45:31.914682 IP node1.57062 > node1.47407: UDP, length 112
03:45:31.915890 IP node1.53282 > node1.47407: UDP, length 113
03:45:31.916346 IP node1.49865 > node1.47407: UDP, length 113
03:45:31.916758 IP node1.37551 > node1.47407: UDP, length 113
03:45:31.921048 IP node1.56249 > node1.47407: UDP, length 113
03:45:31.921972 IP node1.37145 > node1.47407: UDP, length 113
03:45:31.925924 IP node1.45429 > node1.47407: UDP, length 113
03:45:31.930604 IP node1.56879 > node1.47407: UDP, length 112
03:45:31.933579 IP node1.54355 > node1.47407: UDP, length 113
03:45:31.935731 IP node1.38430 > node1.47407: UDP, length 112
03:45:31.935912 IP node1.38430 > node1.37551: UDP, length 87
03:45:31.939923 IP node1.37551 > node1.38430: UDP, length 94
03:45:31.947176 IP node1.55391 > node1.47407: UDP, length 112
03:45:31.958971 IP node1.34959 > node1.47407: UDP, length 113
03:45:31.968200 IP node1.57925 > node1.47407: UDP, length 113
03:45:31.974897 IP node1.36914 > node1.47407: UDP, length 113
03:45:32.001579 IP node1.53282 > node1.60829: UDP, length 87
03:45:32.002678 IP node1.60829 > node1.53282: UDP, length 94
03:45:32.137058 IP node1.47407 > node1.34176: UDP, length 113
03:45:32.241705 IP node1.56879 > node1.55391: UDP, length 87
03:45:32.242940 IP node1.55391 > node1.56879: UDP, length 94
03:45:32.318481 IP node1.47407 > node1.57925: UDP, length 113
03:45:32.319298 IP node1.47407 > node1.54852: UDP, length 113
03:45:32.907880 IP node1.41077 > node1.59984: UDP, length 113
03:45:32.909253 IP node1.56249 > node1.59984: UDP, length 113
03:45:32.909687 IP node1.34959 > node1.59984: UDP, length 113
03:45:32.909893 IP node1.59003 > node1.59984: UDP, length 113
03:45:32.911883 IP node1.53282 > node1.59984: UDP, length 113
03:45:32.913161 IP node1.38553 > node1.59984: UDP, length 112
03:45:32.914287 IP node1.57400 > node1.59984: UDP, length 113
03:45:32.914729 IP node1.37551 > node1.59984: UDP, length 113
03:45:32.916531 IP node1.37145 > node1.59984: UDP, length 113
03:45:32.921857 IP node1.49865 > node1.59984: UDP, length 113
03:45:32.924129 IP node1.58616 > node1.59984: UDP, length 113
03:45:32.924682 IP node1.54355 > node1.59984: UDP, length 113
03:45:32.924942 IP node1.56879 > node1.59984: UDP, length 112
03:45:32.931275 IP node1.47760 > node1.59984: UDP, length 113
03:45:32.934583 IP node1.45429 > node1.59984: UDP, length 113
03:45:32.937577 IP node1.45761 > node1.59984: UDP, length 113
03:45:32.942795 IP node1.41557 > node1.59984: UDP, length 113
03:45:32.943220 IP node1.54852 > node1.59984: UDP, length 113
03:45:32.943461 IP node1.34176 > node1.59984: UDP, length 113
03:45:32.944427 IP node1.38430 > node1.59984: UDP, length 112
03:45:32.944869 IP node1.42579 > node1.59984: UDP, length 113
03:45:32.946747 IP node1.49009 > node1.59984: UDP, length 112
03:45:32.946787 IP node1.60829 > node1.59984: UDP, length 112
03:45:32.947458 IP node1.36914 > node1.59984: UDP, length 113
03:45:32.954162 IP node1.33607 > node1.59984: UDP, length 113
03:45:32.958591 IP node1.32848 > node1.59984: UDP, length 113
03:45:32.958799 IP node1.55391 > node1.59984: UDP, length 112
03:45:32.959201 IP node1.38638 > node1.59984: UDP, length 113
03:45:32.959651 IP node1.38655 > node1.59984: UDP, length 111
03:45:32.961128 IP node1.58604 > node1.59984: UDP, length 113
03:45:32.961517 IP node1.58838 > node1.59984: UDP, length 113
03:45:32.962040 IP node1.34433 > node1.59984: UDP, length 113
03:45:32.970627 IP node1.57062 > node1.59984: UDP, length 112
03:45:32.977499 IP node1.57925 > node1.59984: UDP, length 113
03:45:32.985634 IP node1.60033 > node1.59984: UDP, length 113
03:45:32.988444 IP node1.50532 > node1.59984: UDP, length 113
03:45:32.999772 IP node1.60161 > node1.59984: UDP, length 113
03:45:33.010795 IP node1.47025 > node1.59984: UDP, length 113
03:45:33.055033 IP node1.47407 > node1.59984: UDP, length 113
03:45:33.060118 IP node1.57925 > node1.54852: UDP, length 87
03:45:33.065091 IP node1.54852 > node1.57925: UDP, length 94
03:45:33.189175 IP node1.57062 > node1.37145: UDP, length 112
03:45:33.189540 IP node1.56249 > node1.37145: UDP, length 113
03:45:33.189738 IP node1.59003 > node1.37145: UDP, length 113
03:45:33.190053 IP node1.54852 > node1.37145: UDP, length 113
03:45:33.190575 IP node1.47407 > node1.37145: UDP, length 113
03:45:33.191041 IP node1.32848 > node1.37145: UDP, length 113
03:45:33.191796 IP node1.58838 > node1.37145: UDP, length 113
03:45:33.192397 IP node1.41077 > node1.37145: UDP, length 113
03:45:33.193145 IP node1.60033 > node1.37145: UDP, length 113
03:45:33.193324 IP node1.56879 > node1.37145: UDP, length 112
03:45:33.193467 IP node1.57925 > node1.37145: UDP, length 113
03:45:33.193500 IP node1.50532 > node1.37145: UDP, length 113
03:45:33.194224 IP node1.45761 > node1.37145: UDP, length 113
03:45:33.194686 IP node1.42579 > node1.37145: UDP, length 113
03:45:33.195918 IP node1.58616 > node1.37145: UDP, length 113
03:45:33.196271 IP node1.58604 > node1.37145: UDP, length 113
03:45:33.196977 IP node1.53282 > node1.37145: UDP, length 113
03:45:33.199558 IP node1.49865 > node1.37145: UDP, length 113
03:45:33.201341 IP node1.55391 > node1.37145: UDP, length 112
03:45:33.202246 IP node1.41557 > node1.37145: UDP, length 113
03:45:33.202626 IP node1.54355 > node1.37145: UDP, length 113
03:45:33.202898 IP node1.37551 > node1.37145: UDP, length 113
03:45:33.203139 IP node1.60829 > node1.37145: UDP, length 112
03:45:33.203146 IP node1.49009 > node1.37145: UDP, length 112
03:45:33.204528 IP node1.36914 > node1.37145: UDP, length 113
03:45:33.204793 IP node1.38638 > node1.37145: UDP, length 113
03:45:33.205650 IP node1.34959 > node1.37145: UDP, length 113
03:45:33.205953 IP node1.38553 > node1.37145: UDP, length 112
03:45:33.206700 IP node1.34176 > node1.37145: UDP, length 113
03:45:33.207037 IP node1.47025 > node1.37145: UDP, length 113
03:45:33.207411 IP node1.45429 > node1.37145: UDP, length 113
03:45:33.207711 IP node1.47760 > node1.37145: UDP, length 113
03:45:33.207976 IP node1.38430 > node1.37145: UDP, length 112
03:45:33.208310 IP node1.60161 > node1.37145: UDP, length 113
03:45:33.208497 IP node1.38655 > node1.37145: UDP, length 111
03:45:33.208992 IP node1.34433 > node1.37145: UDP, length 113
03:45:33.209834 IP node1.33607 > node1.37145: UDP, length 113
03:45:33.211077 IP node1.57400 > node1.37145: UDP, length 113
03:45:33.211708 IP node1.59984 > node1.37145: UDP, length 113
03:45:33.469102 IP node1.41077 > node1.49009: UDP, length 113
03:45:33.469681 IP node1.41557 > node1.49009: UDP, length 113
03:45:33.470492 IP node1.38430 > node1.49009: UDP, length 112
03:45:33.471383 IP node1.37551 > node1.49009: UDP, length 113
03:45:33.473007 IP node1.57062 > node1.49009: UDP, length 112
03:45:33.473344 IP node1.59984 > node1.49009: UDP, length 113
03:45:33.473718 IP node1.58604 > node1.49009: UDP, length 113
03:45:33.473985 IP node1.45761 > node1.49009: UDP, length 113
03:45:33.474409 IP node1.47025 > node1.49009: UDP, length 113
03:45:33.474637 IP node1.60161 > node1.49009: UDP, length 113
03:45:33.474844 IP node1.57925 > node1.49009: UDP, length 113
03:45:33.475157 IP node1.32848 > node1.49009: UDP, length 113
03:45:33.475429 IP node1.58838 > node1.49009: UDP, length 113
03:45:33.478217 IP node1.38655 > node1.49009: UDP, length 111
03:45:33.480658 IP node1.33607 > node1.49009: UDP, length 113
03:45:33.483891 IP node1.37145 > node1.49009: UDP, length 113
03:45:33.484183 IP node1.58616 > node1.49009: UDP, length 113
03:45:33.485751 IP node1.49865 > node1.49009: UDP, length 113
03:45:33.486079 IP node1.57400 > node1.49009: UDP, length 113
03:45:33.486545 IP node1.42579 > node1.49009: UDP, length 113
03:45:33.489109 IP node1.54355 > node1.49009: UDP, length 113
03:45:33.489132 IP node1.38553 > node1.49009: UDP, length 112
03:45:33.489419 IP node1.45429 > node1.49009: UDP, length 113
03:45:33.489654 IP node1.60829 > node1.49009: UDP, length 112
03:45:33.490159 IP node1.56249 > node1.49009: UDP, length 113
03:45:33.490234 IP node1.54852 > node1.49009: UDP, length 113
03:45:33.490503 IP node1.38638 > node1.49009: UDP, length 113
03:45:33.490785 IP node1.55391 > node1.49009: UDP, length 112
03:45:33.493916 IP node1.53282 > node1.49009: UDP, length 113
03:45:33.494420 IP node1.59003 > node1.49009: UDP, length 113
03:45:33.495437 IP node1.47407 > node1.49009: UDP, length 113
03:45:33.498856 IP node1.50532 > node1.49009: UDP, length 113
03:45:33.500146 IP node1.47760 > node1.49009: UDP, length 113
03:45:33.500630 IP node1.60033 > node1.49009: UDP, length 113
03:45:33.500965 IP node1.34176 > node1.49009: UDP, length 113
03:45:33.502521 IP node1.56879 > node1.49009: UDP, length 112
03:45:33.502837 IP node1.36914 > node1.49009: UDP, length 113
03:45:33.508947 IP node1.34959 > node1.49009: UDP, length 113
03:45:33.510819 IP node1.34433 > node1.49009: UDP, length 113
03:45:33.853703 IP node1.47407 > node1.59984: UDP, length 87
03:45:33.854695 IP node1.59984 > node1.47407: UDP, length 94
03:45:34.792798 IP node1.34433 > node1.34176: UDP, length 113
03:45:34.792864 IP node1.37551 > node1.34176: UDP, length 113
03:45:34.792985 IP node1.58604 > node1.34176: UDP, length 113
03:45:34.793085 IP node1.53282 > node1.34176: UDP, length 113
03:45:34.793149 IP node1.33607 > node1.34176: UDP, length 113
03:45:34.793548 IP node1.59003 > node1.34176: UDP, length 113
03:45:34.793576 IP node1.47760 > node1.34176: UDP, length 113
03:45:34.793606 IP node1.57925 > node1.34176: UDP, length 113
03:45:34.793776 IP node1.60033 > node1.34176: UDP, length 113
03:45:34.794197 IP node1.57062 > node1.34176: UDP, length 112
03:45:34.794518 IP node1.49865 > node1.34176: UDP, length 113
03:45:34.794809 IP node1.45761 > node1.34176: UDP, length 113
03:45:34.795406 IP node1.60161 > node1.34176: UDP, length 113
03:45:34.795660 IP node1.50532 > node1.34176: UDP, length 113
03:45:34.795953 IP node1.58838 > node1.34176: UDP, length 113
03:45:34.796441 IP node1.58616 > node1.34176: UDP, length 113
03:45:34.797217 IP node1.38655 > node1.34176: UDP, length 111
03:45:34.797542 IP node1.38553 > node1.34176: UDP, length 112
03:45:34.797689 IP node1.41557 > node1.34176: UDP, length 113
03:45:34.797694 IP node1.57400 > node1.34176: UDP, length 113
03:45:34.798180 IP node1.36914 > node1.34176: UDP, length 113
03:45:34.798416 IP node1.54355 > node1.34176: UDP, length 113
03:45:34.799454 IP node1.60829 > node1.34176: UDP, length 112
03:45:34.799713 IP node1.55391 > node1.34176: UDP, length 112
03:45:34.799859 IP node1.38638 > node1.34176: UDP, length 113
03:45:34.800482 IP node1.56879 > node1.34176: UDP, length 112
03:45:34.800714 IP node1.41077 > node1.34176: UDP, length 113
03:45:34.800859 IP node1.38430 > node1.34176: UDP, length 112
03:45:34.801252 IP node1.47407 > node1.34176: UDP, length 113
03:45:34.801614 IP node1.37145 > node1.34176: UDP, length 113
03:45:34.801775 IP node1.56249 > node1.34176: UDP, length 113
03:45:34.802255 IP node1.32848 > node1.34176: UDP, length 113
03:45:34.802904 IP node1.54852 > node1.34176: UDP, length 113
03:45:34.803021 IP node1.42579 > node1.34176: UDP, length 113
03:45:34.803712 IP node1.49009 > node1.34176: UDP, length 112
03:45:34.803712 IP node1.47025 > node1.34176: UDP, length 113
03:45:34.804319 IP node1.59984 > node1.34176: UDP, length 113
03:45:34.805586 IP node1.34959 > node1.34176: UDP, length 113
03:45:34.806927 IP node1.45429 > node1.34176: UDP, length 113
03:45:38.293880 IP node1.60829 > node1.34176: UDP, length 112
03:45:38.293957 IP node1.38430 > node1.34176: UDP, length 112
03:45:38.294044 IP node1.49009 > node1.34176: UDP, length 112
03:45:38.294088 IP node1.33607 > node1.34176: UDP, length 113
03:45:38.294158 IP node1.54355 > node1.34176: UDP, length 113
03:45:38.294384 IP node1.59003 > node1.34176: UDP, length 113
03:45:38.294506 IP node1.37145 > node1.34176: UDP, length 113
03:45:38.294637 IP node1.58616 > node1.34176: UDP, length 113
03:45:38.294823 IP node1.32848 > node1.34176: UDP, length 113
03:45:38.295116 IP node1.58838 > node1.34176: UDP, length 113
03:45:38.295542 IP node1.49865 > node1.34176: UDP, length 113
03:45:38.295714 IP node1.60161 > node1.34176: UDP, length 113
03:45:38.295919 IP node1.53282 > node1.34176: UDP, length 113
03:45:38.296122 IP node1.47407 > node1.34176: UDP, length 113
03:45:38.296517 IP node1.47760 > node1.34176: UDP, length 113
03:45:38.296570 IP node1.59984 > node1.34176: UDP, length 113
03:45:38.296914 IP node1.37551 > node1.34176: UDP, length 113
03:45:38.297085 IP node1.57062 > node1.34176: UDP, length 112
03:45:38.297237 IP node1.38655 > node1.34176: UDP, length 111
03:45:38.297491 IP node1.34433 > node1.34176: UDP, length 113
03:45:38.297675 IP node1.55391 > node1.34176: UDP, length 112
03:45:38.297692 IP node1.34959 > node1.34176: UDP, length 113
03:45:38.298342 IP node1.56249 > node1.34176: UDP, length 113
03:45:38.298451 IP node1.45429 > node1.34176: UDP, length 113
03:45:38.298462 IP node1.57400 > node1.34176: UDP, length 113
03:45:38.298512 IP node1.42579 > node1.34176: UDP, length 113
03:45:38.298792 IP node1.47025 > node1.34176: UDP, length 113
03:45:38.299025 IP node1.54852 > node1.34176: UDP, length 113
03:45:38.299058 IP node1.41077 > node1.34176: UDP, length 113
03:45:38.299750 IP node1.57925 > node1.34176: UDP, length 113
03:45:38.299767 IP node1.50532 > node1.34176: UDP, length 113
03:45:38.299949 IP node1.56879 > node1.34176: UDP, length 112
03:45:38.300956 IP node1.58604 > node1.34176: UDP, length 113
03:45:38.302266 IP node1.41557 > node1.34176: UDP, length 113
03:45:38.303611 IP node1.36914 > node1.34176: UDP, length 113
03:45:38.304421 IP node1.60033 > node1.34176: UDP, length 113
03:45:38.304570 IP node1.45761 > node1.34176: UDP, length 113
03:45:38.308369 IP node1.38553 > node1.34176: UDP, length 112
03:45:38.310377 IP node1.38638 > node1.34176: UDP, length 113
03:45:38.492048 IP node1.49009 > node1.34176: UDP, length 87
03:45:38.664420 IP node1.34176 > node1.49009: UDP, length 94

