03:45:15.022300 IP node3.45596 > node2.38644: UDP, length 113
03:45:15.122177 IP node3.45596 > node2.46240: UDP, length 113
03:45:15.152516 IP node3.45596 > node2.39590: UDP, length 113
03:45:15.152756 IP node3.45596 > node2.53302: UDP, length 113
03:45:15.152993 IP node3.45596 > node2.37029: UDP, length 113
03:45:15.153114 IP node3.45596 > node2.45176: UDP, length 113
03:45:15.153202 IP node3.45596 > node2.53706: UDP, length 113
03:45:15.153286 IP node3.45596 > node2.36822: UDP, length 113
03:45:15.153370 IP node3.45596 > node2.40292: UDP, length 113
03:45:15.153456 IP node3.45596 > node2.37998: UDP, length 113
03:45:15.153549 IP node3.45596 > node4.44488: UDP, length 113
03:45:15.153645 IP node3.45596 > node4.43535: UDP, length 113
03:45:15.153733 IP node3.45596 > node4.36649: UDP, length 113
03:45:15.153820 IP node3.45596 > node2.42544: UDP, length 113
03:45:15.180636 IP node3.45596 > node2.50420: UDP, length 113
03:45:15.180836 IP node3.45596 > node2.35476: UDP, length 113
03:45:15.180944 IP node3.45596 > node4.42817: UDP, length 113
03:45:15.181020 IP node3.45596 > node2.34103: UDP, length 113
03:45:15.197827 IP node3.45596 > node2.50822: UDP, length 113
03:45:15.198321 IP node3.45596 > node4.55298: UDP, length 113
03:45:15.198793 IP node3.45596 > node2.39954: UDP, length 113
03:45:15.257111 IP node3.33275 > node2.53302: UDP, length 113
03:45:15.266469 IP node3.33275 > node2.37998: UDP, length 113
03:45:15.266663 IP node3.33275 > node2.42544: UDP, length 113
03:45:15.286587 IP node3.33275 > node2.40292: UDP, length 113
03:45:15.300943 IP node3.33275 > node4.43535: UDP, length 113
03:45:15.301361 IP node3.33275 > node2.37029: UDP, length 113
03:45:15.301800 IP node3.33275 > node2.53706: UDP, length 113
03:45:15.302081 IP node3.33275 > node4.36649: UDP, length 113
03:45:15.302476 IP node3.33275 > node4.44488: UDP, length 113
03:45:15.302747 IP node3.33275 > node2.45176: UDP, length 113
03:45:15.303065 IP node3.33275 > node4.42817: UDP, length 113
03:45:15.345315 IP node3.33275 > node2.36822: UDP, length 113
03:45:15.346253 IP node3.33275 > node2.50420: UDP, length 113
03:45:15.346550 IP node3.33275 > node2.50822: UDP, length 113
03:45:15.347416 IP node3.33275 > node2.34103: UDP, length 113
03:45:15.349060 IP node3.33275 > node2.35476: UDP, length 113
03:45:15.349537 IP node3.33275 > node2.39954: UDP, length 113
03:45:15.356587 IP node3.33275 > node4.55298: UDP, length 113
03:45:15.385553 IP node3.45596 > node4.45910: UDP, length 113
03:45:15.387964 IP node3.33275 > node4.45910: UDP, length 113
03:45:15.467077 IP node3.33275 > node4.35032: UDP, length 113
03:45:15.468082 IP node3.45596 > node4.35032: UDP, length 113
03:45:15.493171 IP node3.45596 > node2.42304: UDP, length 113
03:45:15.493686 IP node3.33275 > node2.42304: UDP, length 113
03:45:15.518097 IP node3.45596 > node4.55446: UDP, length 113
03:45:15.518810 IP node3.33275 > node4.55446: UDP, length 113
03:45:15.574581 IP node3.45596 > node2.60168: UDP, length 113
03:45:15.575144 IP node3.33275 > node2.60168: UDP, length 113
03:45:15.591078 IP node3.45596 > node2.33273: UDP, length 113
03:45:15.591697 IP node3.33275 > node2.33273: UDP, length 113
03:45:15.602762 IP node3.45596 > node2.35425: UDP, length 113
03:45:15.602996 IP node3.33275 > node2.35425: UDP, length 113
03:45:15.646604 IP node3.58663 > node2.45176: UDP, length 113
03:45:15.647900 IP node3.45596 > node2.50082: UDP, length 113
03:45:15.649498 IP node3.33275 > node2.50082: UDP, length 113
03:45:15.654100 IP node3.58663 > node4.42817: UDP, length 113
03:45:15.657841 IP node3.58663 > node2.50420: UDP, length 113
03:45:15.658131 IP node3.58663 > node2.50822: UDP, length 113
03:45:15.659125 IP node3.58663 > node2.34103: UDP, length 113
03:45:15.668959 IP node3.45596 > node2.46051: UDP, length 113
03:45:15.669798 IP node3.33275 > node2.46051: UDP, length 113
03:45:15.670709 IP node3.58663 > node2.35476: UDP, length 113
03:45:15.671057 IP node3.58663 > node2.39954: UDP, length 113
03:45:15.671336 IP node3.58663 > node4.55298: UDP, length 113
03:45:15.671610 IP node3.58663 > node4.45910: UDP, length 113
03:45:15.671899 IP node3.58663 > node4.35032: UDP, length 113
03:45:15.672164 IP node3.58663 > node2.42304: UDP, length 113
03:45:15.672608 IP node3.58663 > node4.55446: UDP, length 113
03:45:15.674768 IP node3.58663 > node2.60168: UDP, length 113
03:45:15.675411 IP node3.58663 > node2.33273: UDP, length 113
03:45:15.688050 IP node3.58663 > node2.35425: UDP, length 113
03:45:15.700607 IP node3.45596 > node2.47183: UDP, length 113
03:45:15.701483 IP node3.33275 > node2.47183: UDP, length 113
03:45:15.712999 IP node3.58663 > node2.50082: UDP, length 113
03:45:15.814734 IP node3.33275 > node4.59050: UDP, length 113
03:45:15.819854 IP node3.45596 > node4.59050: UDP, length 113
03:45:15.869151 IP node3.58663 > node2.46051: UDP, length 113
03:45:15.917103 IP node3.39663 > node2.39954: UDP, length 113
03:45:15.917357 IP node3.39663 > node2.35476: UDP, length 113
03:45:15.917466 IP node3.39663 > node4.55298: UDP, length 113
03:45:15.917586 IP node3.39663 > node2.50822: UDP, length 113
03:45:15.917677 IP node3.39663 > node2.34103: UDP, length 113
03:45:15.918407 IP node3.39663 > node4.35032: UDP, length 113
03:45:15.918497 IP node3.39663 > node4.45910: UDP, length 113
03:45:15.918672 IP node3.39663 > node2.42304: UDP, length 113
03:45:15.918756 IP node3.39663 > node4.55446: UDP, length 113
03:45:15.918876 IP node3.39663 > node2.33273: UDP, length 113
03:45:15.918960 IP node3.39663 > node2.35425: UDP, length 113
03:45:15.919042 IP node3.39663 > node2.60168: UDP, length 113
03:45:15.919161 IP node3.39663 > node2.50082: UDP, length 113
03:45:15.919287 IP node3.39663 > node2.46051: UDP, length 113
03:45:15.930137 IP node3.45596 > node2.37614: UDP, length 113
03:45:15.930686 IP node3.33275 > node2.37614: UDP, length 113
03:45:15.938005 IP node3.42797 > node2.50822: UDP, length 113
03:45:15.938278 IP node3.42797 > node2.35476: UDP, length 113
03:45:15.938433 IP node3.42797 > node2.34103: UDP, length 113
03:45:15.940098 IP node3.42797 > node2.42304: UDP, length 113
03:45:15.940296 IP node3.42797 > node2.39954: UDP, length 113
03:45:15.940441 IP node3.42797 > node4.55298: UDP, length 113
03:45:15.940693 IP node3.42797 > node4.35032: UDP, length 113
03:45:15.940920 IP node3.42797 > node4.45910: UDP, length 113
03:45:15.941221 IP node3.42797 > node2.33273: UDP, length 113
03:45:15.941466 IP node3.42797 > node4.55446: UDP, length 113
03:45:15.941605 IP node3.42797 > node2.60168: UDP, length 113
03:45:15.947790 IP node3.45596 > node4.39087: UDP, length 113
03:45:15.948654 IP node3.33275 > node4.39087: UDP, length 113
03:45:15.957285 IP node3.42797 > node2.37614: UDP, length 113
03:45:15.957466 IP node3.42797 > node2.47183: UDP, length 113
03:45:15.957567 IP node3.42797 > node2.50082: UDP, length 113
03:45:15.957674 IP node3.42797 > node2.35425: UDP, length 113
03:45:15.957767 IP node3.42797 > node4.59050: UDP, length 113
03:45:15.957874 IP node3.42797 > node2.46051: UDP, length 113
03:45:15.961490 IP node3.42797 > node2.44278: UDP, length 94
03:45:16.033285 IP node3.45596 > node4.47308: UDP, length 113
03:45:16.036337 IP node3.33275 > node4.47308: UDP, length 113
03:45:16.046960 IP node3.42797 > node4.39087: UDP, length 113
03:45:16.048316 IP node3.42797 > node4.47308: UDP, length 113
03:45:16.050299 IP node3.39663 > node2.47183: UDP, length 113
03:45:16.050641 IP node3.39663 > node4.59050: UDP, length 113
03:45:16.050758 IP node3.39663 > node2.37614: UDP, length 113
03:45:16.050939 IP node3.39663 > node4.39087: UDP, length 113
03:45:16.071546 IP node3.33275 > node4.42409: UDP, length 113
03:45:16.072742 IP node3.45596 > node4.42409: UDP, length 113
03:45:16.087329 IP node3.42797 > node4.42409: UDP, length 113
03:45:16.125084 IP node3.55023 > node2.34103: UDP, length 112
03:45:16.125518 IP node3.55023 > node2.35476: UDP, length 112
03:45:16.125785 IP node3.55023 > node2.39954: UDP, length 112
03:45:16.126052 IP node3.55023 > node4.55298: UDP, length 112
03:45:16.126475 IP node3.55023 > node4.45910: UDP, length 112
03:45:16.126730 IP node3.55023 > node4.35032: UDP, length 112
03:45:16.126957 IP node3.55023 > node2.42304: UDP, length 112
03:45:16.145165 IP node3.39663 > node4.47308: UDP, length 113
03:45:16.145431 IP node3.39663 > node4.42409: UDP, length 113
03:45:16.150663 IP node3.39663 > node2.44278: UDP, length 94
03:45:16.157776 IP node3.48649 > node2.45176: UDP, length 113
03:45:16.157990 IP node3.48649 > node2.50420: UDP, length 113
03:45:16.158210 IP node3.48649 > node4.42817: UDP, length 113
03:45:16.160060 IP node3.48649 > node2.34103: UDP, length 113
03:45:16.160357 IP node3.48649 > node2.35476: UDP, length 113
03:45:16.161279 IP node3.45596 > node2.53863: UDP, length 113
03:45:16.162464 IP node3.45596 > node4.51453: UDP, length 113
03:45:16.162941 IP node3.33275 > node4.51453: UDP, length 113
03:45:16.163065 IP node3.33275 > node2.53863: UDP, length 113
03:45:16.165486 IP node3.39663 > node2.53863: UDP, length 113
03:45:16.165778 IP node3.39663 > node4.51453: UDP, length 113
03:45:16.166841 IP node3.39663 > node2.58597: UDP, length 113
03:45:16.167523 IP node3.45596 > node2.58597: UDP, length 113
03:45:16.168064 IP node3.33275 > node2.58597: UDP, length 113
03:45:16.169738 IP node3.42797 > node4.51453: UDP, length 113
03:45:16.169891 IP node3.42797 > node2.53863: UDP, length 113
03:45:16.170010 IP node3.42797 > node2.58597: UDP, length 113
03:45:16.196549 IP node3.39663 > node2.49754: UDP, length 113
03:45:16.197230 IP node3.33275 > node2.49754: UDP, length 113
03:45:16.197462 IP node3.45596 > node2.49754: UDP, length 113
03:45:16.198051 IP node3.42797 > node2.49754: UDP, length 113
03:45:16.238470 IP node3.33275 > node2.33869: UDP, length 113
03:45:16.239327 IP node3.42797 > node2.33869: UDP, length 113
03:45:16.240767 IP node3.39663 > node2.33869: UDP, length 113
03:45:16.240936 IP node3.45596 > node2.33869: UDP, length 113
03:45:16.245161 IP node3.33275 > node4.58434: UDP, length 113
03:45:16.246086 IP node3.45596 > node4.58434: UDP, length 113
03:45:16.247288 IP node3.42797 > node4.58434: UDP, length 113
03:45:16.248633 IP node3.39663 > node4.58434: UDP, length 113
03:45:16.252441 IP node3.58663 > node2.44278: UDP, length 94
03:45:16.254838 IP node3.58663 > node2.47183: UDP, length 113
03:45:16.255058 IP node3.58663 > node4.59050: UDP, length 113
03:45:16.257463 IP node3.33275 > node2.33901: UDP, length 113
03:45:16.258700 IP node3.45596 > node2.33901: UDP, length 113
03:45:16.261091 IP node3.42797 > node2.33901: UDP, length 113
03:45:16.261804 IP node3.39663 > node2.33901: UDP, length 113
03:45:16.266378 IP node3.58663 > node2.37614: UDP, length 113
03:45:16.267584 IP node3.58663 > node4.51453: UDP, length 113
03:45:16.267730 IP node3.58663 > node4.39087: UDP, length 113
03:45:16.267843 IP node3.58663 > node4.58434: UDP, length 113
03:45:16.268037 IP node3.58663 > node4.42409: UDP, length 113
03:45:16.268146 IP node3.58663 > node2.53863: UDP, length 113
03:45:16.268343 IP node3.58663 > node2.33869: UDP, length 113
03:45:16.268452 IP node3.58663 > node4.47308: UDP, length 113
03:45:16.268595 IP node3.58663 > node2.49754: UDP, length 113
03:45:16.270322 IP node3.58663 > node2.58597: UDP, length 113
03:45:16.278306 IP node3.58663 > node2.33901: UDP, length 113
03:45:16.316004 IP node3.33707 > node4.45910: UDP, length 113
03:45:16.316469 IP node3.33707 > node2.42304: UDP, length 113
03:45:16.316792 IP node3.33707 > node4.55446: UDP, length 113
03:45:16.317305 IP node3.33707 > node2.60168: UDP, length 113
03:45:16.317568 IP node3.33707 > node2.33273: UDP, length 113
03:45:16.317824 IP node3.33707 > node2.35425: UDP, length 113
03:45:16.318326 IP node3.33707 > node2.50082: UDP, length 113
03:45:16.318602 IP node3.33707 > node2.46051: UDP, length 113
03:45:16.319161 IP node3.33707 > node2.47183: UDP, length 113
03:45:16.321242 IP node3.33707 > node4.35032: UDP, length 113
03:45:16.321977 IP node3.48649 > node2.50822: UDP, length 113
03:45:16.324507 IP node3.33707 > node4.59050: UDP, length 113
03:45:16.325197 IP node3.33707 > node2.37614: UDP, length 113
03:45:16.325703 IP node3.33707 > node4.39087: UDP, length 113
03:45:16.328622 IP node3.48649 > node2.44278: UDP, length 94
03:45:16.329708 IP node3.48649 > node2.39954: UDP, length 113
03:45:16.329911 IP node3.48649 > node4.55298: UDP, length 113
03:45:16.330176 IP node3.48649 > node4.45910: UDP, length 113
03:45:16.330490 IP node3.48649 > node4.35032: UDP, length 113
03:45:16.330794 IP node3.48649 > node2.42304: UDP, length 113
03:45:16.331004 IP node3.48649 > node4.55446: UDP, length 113
03:45:16.332438 IP node3.48649 > node2.60168: UDP, length 113
03:45:16.332666 IP node3.48649 > node2.33273: UDP, length 113
03:45:16.332875 IP node3.48649 > node2.35425: UDP, length 113
03:45:16.333597 IP node3.48649 > node2.50082: UDP, length 113
03:45:16.333955 IP node3.48649 > node2.46051: UDP, length 113
03:45:16.335203 IP node3.48649 > node2.47183: UDP, length 113
03:45:16.335887 IP node3.48649 > node4.59050: UDP, length 113
03:45:16.336521 IP node3.48649 > node2.37614: UDP, length 113
03:45:16.336932 IP node3.48649 > node4.39087: UDP, length 113
03:45:16.337997 IP node3.48649 > node4.47308: UDP, length 113
03:45:16.338654 IP node3.48649 > node4.42409: UDP, length 113
03:45:16.339539 IP node3.48649 > node2.53863: UDP, length 113
03:45:16.348489 IP node3.48649 > node4.51453: UDP, length 113
03:45:16.348924 IP node3.48649 > node2.58597: UDP, length 113
03:45:16.349171 IP node3.48649 > node2.49754: UDP, length 113
03:45:16.357918 IP node3.48649 > node4.58434: UDP, length 113
03:45:16.359344 IP node3.48649 > node2.33869: UDP, length 113
03:45:16.365460 IP node3.55023 > node2.44278: UDP, length 94
03:45:16.365718 IP node3.55023 > node4.55446: UDP, length 112
03:45:16.365871 IP node3.55023 > node2.33273: UDP, length 112
03:45:16.365947 IP node3.55023 > node2.50082: UDP, length 112
03:45:16.366057 IP node3.55023 > node2.35425: UDP, length 112
03:45:16.366112 IP node3.55023 > node2.46051: UDP, length 112
03:45:16.366834 IP node3.58663 > node4.51545: UDP, length 113
03:45:16.367086 IP node3.48649 > node4.51545: UDP, length 113
03:45:16.367163 IP node3.42797 > node4.51545: UDP, length 113
03:45:16.367314 IP node3.48649 > node2.33901: UDP, length 113
03:45:16.367448 IP node3.45596 > node4.51545: UDP, length 113
03:45:16.367675 IP node3.55023 > node2.47183: UDP, length 112
03:45:16.367836 IP node3.33275 > node4.51545: UDP, length 113
03:45:16.367949 IP node3.55023 > node4.59050: UDP, length 112
03:45:16.368588 IP node3.55023 > node2.37614: UDP, length 112
03:45:16.369326 IP node3.39663 > node4.51545: UDP, length 113
03:45:16.372049 IP node3.55023 > node4.39087: UDP, length 112
03:45:16.372937 IP node3.55023 > node4.47308: UDP, length 112
03:45:16.373233 IP node3.55023 > node4.42409: UDP, length 112
03:45:16.373450 IP node3.55023 > node2.53863: UDP, length 112
03:45:16.373648 IP node3.55023 > node4.51453: UDP, length 112
03:45:16.373873 IP node3.55023 > node2.58597: UDP, length 112
03:45:16.374080 IP node3.55023 > node2.49754: UDP, length 112
03:45:16.375392 IP node3.55023 > node2.60168: UDP, length 112
03:45:16.375500 IP node3.55023 > node2.33869: UDP, length 112
03:45:16.375725 IP node3.55023 > node4.58434: UDP, length 112
03:45:16.375835 IP node3.55023 > node2.33901: UDP, length 112
03:45:16.380317 IP node3.55023 > node4.51545: UDP, length 112
03:45:16.476146 IP node3.33216 > node2.44278: UDP, length 94
03:45:16.476327 IP node3.33275 > node2.43732: UDP, length 113
03:45:16.477128 IP node3.45596 > node2.43732: UDP, length 113
03:45:16.477356 IP node3.42797 > node2.43732: UDP, length 113
03:45:16.477899 IP node3.39663 > node2.43732: UDP, length 113
03:45:16.478680 IP node3.58663 > node2.43732: UDP, length 113
03:45:16.480390 IP node3.55023 > node2.43732: UDP, length 112
03:45:16.480603 IP node3.33707 > node2.44278: UDP, length 94
03:45:16.480947 IP node3.48649 > node2.43732: UDP, length 113
03:45:16.510613 IP node3.33707 > node4.47308: UDP, length 113
03:45:16.513013 IP node3.33707 > node4.42409: UDP, length 113
03:45:16.514155 IP node3.33707 > node2.53863: UDP, length 113
03:45:16.514452 IP node3.33707 > node4.51453: UDP, length 113
03:45:16.514728 IP node3.33707 > node2.58597: UDP, length 113
03:45:16.515005 IP node3.33707 > node2.49754: UDP, length 113
03:45:16.517159 IP node3.33707 > node2.33869: UDP, length 113
03:45:16.517403 IP node3.33707 > node4.58434: UDP, length 113
03:45:16.518500 IP node3.33707 > node2.33901: UDP, length 113
03:45:16.519784 IP node3.42797 > node4.36744: UDP, length 113
03:45:16.519976 IP node3.58663 > node4.36744: UDP, length 113
03:45:16.520375 IP node3.33275 > node4.36744: UDP, length 113
03:45:16.521257 IP node3.45596 > node4.36744: UDP, length 113
03:45:16.521460 IP node3.39663 > node4.36744: UDP, length 113
03:45:16.522399 IP node3.48649 > node4.36744: UDP, length 113
03:45:16.523722 IP node3.55023 > node4.36744: UDP, length 112
03:45:16.525499 IP node3.33707 > node4.51545: UDP, length 113
03:45:16.527640 IP node3.33707 > node2.43732: UDP, length 113
03:45:16.530842 IP node3.33707 > node4.36744: UDP, length 113
03:45:16.556608 IP node3.33216 > node2.42304: UDP, length 113
03:45:16.556858 IP node3.33216 > node2.33273: UDP, length 113
03:45:16.556954 IP node3.33216 > node4.55446: UDP, length 113
03:45:16.557039 IP node3.33216 > node2.35425: UDP, length 113
03:45:16.557212 IP node3.33216 > node4.35032: UDP, length 113
03:45:16.557301 IP node3.33216 > node4.45910: UDP, length 113
03:45:16.557388 IP node3.33216 > node2.60168: UDP, length 113
03:45:16.557537 IP node3.33216 > node2.46051: UDP, length 113
03:45:16.559985 IP node3.33216 > node2.50082: UDP, length 113
03:45:16.560253 IP node3.33216 > node2.47183: UDP, length 113
03:45:16.562037 IP node3.33216 > node4.59050: UDP, length 113
03:45:16.562530 IP node3.33216 > node2.37614: UDP, length 113
03:45:16.563191 IP node3.33216 > node4.39087: UDP, length 113
03:45:16.563498 IP node3.33216 > node4.47308: UDP, length 113
03:45:16.563799 IP node3.33216 > node4.42409: UDP, length 113
03:45:16.564035 IP node3.33216 > node2.53863: UDP, length 113
03:45:16.564264 IP node3.33216 > node4.51453: UDP, length 113
03:45:16.564498 IP node3.33216 > node2.58597: UDP, length 113
03:45:16.564714 IP node3.33216 > node2.49754: UDP, length 113
03:45:16.568623 IP node3.33216 > node2.33869: UDP, length 113
03:45:16.568884 IP node3.33216 > node4.58434: UDP, length 113
03:45:16.569096 IP node3.33216 > node2.33901: UDP, length 113
03:45:16.570863 IP node3.33216 > node4.51545: UDP, length 113
03:45:16.571855 IP node3.33216 > node2.43732: UDP, length 113
03:45:16.572783 IP node3.33216 > node4.36744: UDP, length 113
03:45:16.624237 IP node3.42797 > node4.35588: UDP, length 113
03:45:16.624941 IP node3.45596 > node4.35588: UDP, length 113
03:45:16.625172 IP node3.58663 > node4.35588: UDP, length 113
03:45:16.625418 IP node3.33275 > node4.35588: UDP, length 113
03:45:16.626045 IP node3.39663 > node4.35588: UDP, length 113
03:45:16.627019 IP node3.48649 > node4.35588: UDP, length 113
03:45:16.627673 IP node3.33216 > node4.35588: UDP, length 113
03:45:16.630059 IP node3.55023 > node4.35588: UDP, length 112
03:45:16.631020 IP node3.33707 > node4.35588: UDP, length 113
03:45:16.682740 IP node3.42797 > node4.47204: UDP, length 113
03:45:16.683991 IP node3.48649 > node4.47204: UDP, length 113
03:45:16.684835 IP node3.45596 > node4.47204: UDP, length 113
03:45:16.684886 IP node3.33275 > node4.47204: UDP, length 113
03:45:16.685253 IP node3.39663 > node4.47204: UDP, length 113
03:45:16.685554 IP node3.58663 > node4.47204: UDP, length 113
03:45:16.686116 IP node3.33216 > node4.47204: UDP, length 113
03:45:16.688400 IP node3.55023 > node4.47204: UDP, length 112
03:45:16.690020 IP node3.33707 > node4.47204: UDP, length 113
03:45:16.695359 IP node3.45596 > node2.59900: UDP, length 113
03:45:16.695722 IP node3.39663 > node2.59900: UDP, length 113
03:45:16.695953 IP node3.58663 > node2.59900: UDP, length 113
03:45:16.696143 IP node3.33275 > node2.59900: UDP, length 113
03:45:16.697127 IP node3.42797 > node2.59900: UDP, length 113
03:45:16.697835 IP node3.55023 > node2.59900: UDP, length 112
03:45:16.698710 IP node3.48649 > node2.59900: UDP, length 113
03:45:16.700558 IP node3.33707 > node2.59900: UDP, length 113
03:45:16.701355 IP node3.33216 > node2.59900: UDP, length 113
03:45:16.704681 IP node3.55313 > node2.60168: UDP, length 113
03:45:16.715862 IP node3.45596 > node4.45660: UDP, length 113
03:45:16.716304 IP node3.39663 > node4.45660: UDP, length 113
03:45:16.716512 IP node3.58663 > node4.45660: UDP, length 113
03:45:16.716868 IP node3.42797 > node4.45660: UDP, length 113
03:45:16.718328 IP node3.33275 > node4.45660: UDP, length 113
03:45:16.721898 IP node3.55023 > node4.45660: UDP, length 112
03:45:16.722641 IP node3.48649 > node4.45660: UDP, length 113
03:45:16.725211 IP node3.58663 > node2.44881: UDP, length 113
03:45:16.728624 IP node3.39663 > node2.44881: UDP, length 113
03:45:16.729535 IP node3.42797 > node2.44881: UDP, length 113
03:45:16.729605 IP node3.45596 > node2.44881: UDP, length 113
03:45:16.733995 IP node3.33275 > node2.44881: UDP, length 113
03:45:16.736956 IP node3.45596 > node4.42261: UDP, length 113
03:45:16.737299 IP node3.42797 > node4.42261: UDP, length 113
03:45:16.737658 IP node3.39663 > node4.42261: UDP, length 113
03:45:16.738456 IP node3.33275 > node4.42261: UDP, length 113
03:45:16.742793 IP node3.55023 > node2.44881: UDP, length 112
03:45:16.744657 IP node3.55023 > node4.42261: UDP, length 112
03:45:16.746694 IP node3.48649 > node2.44881: UDP, length 113
03:45:16.747025 IP node3.48649 > node4.42261: UDP, length 113
03:45:16.750935 IP node3.33707 > node4.45660: UDP, length 113
03:45:16.751375 IP node3.33707 > node2.44881: UDP, length 113
03:45:16.752024 IP node3.33707 > node4.42261: UDP, length 113
03:45:16.755238 IP node3.33216 > node4.42261: UDP, length 113
03:45:16.755455 IP node3.33216 > node2.44881: UDP, length 113
03:45:16.755594 IP node3.33216 > node4.45660: UDP, length 113
03:45:16.765691 IP node3.45596 > node2.44832: UDP, length 113
03:45:16.766255 IP node3.42797 > node2.44832: UDP, length 113
03:45:16.766992 IP node3.33275 > node2.44832: UDP, length 113
03:45:16.767190 IP node3.39663 > node2.44832: UDP, length 113
03:45:16.768593 IP node3.55023 > node2.44832: UDP, length 112
03:45:16.769055 IP node3.48649 > node2.44832: UDP, length 113
03:45:16.770876 IP node3.33216 > node2.44832: UDP, length 113
03:45:16.771457 IP node3.33707 > node2.44832: UDP, length 113
03:45:16.782438 IP node3.33216 > node2.54620: UDP, length 113
03:45:16.785944 IP node3.45596 > node2.54620: UDP, length 113
03:45:16.786043 IP node3.45596 > node4.42345: UDP, length 113
03:45:16.786990 IP node3.33275 > node2.54620: UDP, length 113
03:45:16.787122 IP node3.33275 > node4.42345: UDP, length 113
03:45:16.787375 IP node3.42797 > node2.54620: UDP, length 113
03:45:16.787490 IP node3.42797 > node4.42345: UDP, length 113
03:45:16.787904 IP node3.39663 > node2.54620: UDP, length 113
03:45:16.788019 IP node3.39663 > node4.42345: UDP, length 113
03:45:16.788623 IP node3.48649 > node2.54620: UDP, length 113
03:45:16.788843 IP node3.48649 > node4.42345: UDP, length 113
03:45:16.796218 IP node3.55023 > node2.54620: UDP, length 112
03:45:16.796368 IP node3.55023 > node4.42345: UDP, length 112
03:45:16.798273 IP node3.33707 > node2.54620: UDP, length 113
03:45:16.798532 IP node3.33707 > node4.42345: UDP, length 113
03:45:16.799956 IP node3.33216 > node4.42345: UDP, length 113
03:45:16.807295 IP node3.58663 > node4.42261: UDP, length 113
03:45:16.808013 IP node3.58663 > node2.44832: UDP, length 113
03:45:16.810600 IP node3.58663 > node2.54620: UDP, length 113
03:45:16.810731 IP node3.58663 > node4.42345: UDP, length 113
03:45:16.868556 IP node3.53645 > node4.45910: UDP, length 113
03:45:16.872610 IP node3.42797 > node2.47183: UDP, length 94
03:45:16.876128 IP node3.33275 > node2.33434: UDP, length 113
03:45:16.876287 IP node3.45596 > node2.33434: UDP, length 113
03:45:16.876915 IP node3.58663 > node2.33434: UDP, length 113
03:45:16.877355 IP node3.39663 > node2.33434: UDP, length 113
03:45:16.877589 IP node3.42797 > node2.33434: UDP, length 113
03:45:16.879453 IP node3.48649 > node2.33434: UDP, length 113
03:45:16.880147 IP node3.55023 > node2.33434: UDP, length 112
03:45:16.880667 IP node3.33707 > node2.33434: UDP, length 113
03:45:16.881979 IP node3.47674 > node2.42304: UDP, length 112
03:45:16.882135 IP node3.47674 > node2.33273: UDP, length 112
03:45:16.882278 IP node3.47674 > node4.55446: UDP, length 112
03:45:16.882322 IP node3.47674 > node2.50082: UDP, length 112
03:45:16.882465 IP node3.47674 > node2.35425: UDP, length 112
03:45:16.882599 IP node3.47674 > node2.46051: UDP, length 112
03:45:16.882768 IP node3.47674 > node2.60168: UDP, length 112
03:45:16.888332 IP node3.47674 > node2.47183: UDP, length 112
03:45:16.893461 IP node3.33216 > node2.33434: UDP, length 113
03:45:16.898103 IP node3.53645 > node2.44278: UDP, length 94
03:45:16.900523 IP node3.53645 > node4.35032: UDP, length 113
03:45:16.900882 IP node3.53645 > node2.42304: UDP, length 113
03:45:16.901188 IP node3.53645 > node4.55446: UDP, length 113
03:45:16.902043 IP node3.47674 > node2.44278: UDP, length 94
03:45:16.902168 IP node3.53645 > node2.60168: UDP, length 113
03:45:16.902548 IP node3.53645 > node2.33273: UDP, length 113
03:45:16.902798 IP node3.53645 > node2.35425: UDP, length 113
03:45:16.906724 IP node3.33275 > node4.42011: UDP, length 113
03:45:16.906936 IP node3.47674 > node4.59050: UDP, length 112
03:45:16.907702 IP node3.45596 > node4.42011: UDP, length 113
03:45:16.907870 IP node3.39663 > node4.42011: UDP, length 113
03:45:16.907991 IP node3.47674 > node2.37614: UDP, length 112
03:45:16.908418 IP node3.47674 > node4.39087: UDP, length 112
03:45:16.908755 IP node3.48649 > node4.42011: UDP, length 113
03:45:16.909107 IP node3.47674 > node4.47308: UDP, length 112
03:45:16.909192 IP node3.58663 > node4.42011: UDP, length 113
03:45:16.909374 IP node3.47674 > node4.42409: UDP, length 112
03:45:16.909609 IP node3.47674 > node2.53863: UDP, length 112
03:45:16.909818 IP node3.47674 > node4.51453: UDP, length 112
03:45:16.910028 IP node3.47674 > node2.58597: UDP, length 112
03:45:16.910246 IP node3.47674 > node2.49754: UDP, length 112
03:45:16.910438 IP node3.47674 > node2.33869: UDP, length 112
03:45:16.910610 IP node3.55023 > node4.42011: UDP, length 112
03:45:16.910708 IP node3.47674 > node4.58434: UDP, length 112
03:45:16.910835 IP node3.47674 > node2.33901: UDP, length 112
03:45:16.912385 IP node3.33216 > node4.42011: UDP, length 113
03:45:16.913628 IP node3.47674 > node4.51545: UDP, length 112
03:45:16.914152 IP node3.47674 > node2.43732: UDP, length 112
03:45:16.914538 IP node3.47674 > node4.36744: UDP, length 112
03:45:16.914837 IP node3.47674 > node4.35588: UDP, length 112
03:45:16.915662 IP node3.53645 > node2.50082: UDP, length 113
03:45:16.915928 IP node3.53645 > node2.46051: UDP, length 113
03:45:16.916028 IP node3.47674 > node2.54620: UDP, length 112
03:45:16.916118 IP node3.47674 > node4.42011: UDP, length 112
03:45:16.916210 IP node3.47674 > node4.42261: UDP, length 112
03:45:16.916313 IP node3.47674 > node4.42345: UDP, length 112
03:45:16.916398 IP node3.47674 > node2.44881: UDP, length 112
03:45:16.916481 IP node3.47674 > node2.33434: UDP, length 112
03:45:16.916701 IP node3.47674 > node2.44832: UDP, length 112
03:45:16.916721 IP node3.47674 > node2.59900: UDP, length 112
03:45:16.916860 IP node3.47674 > node4.47204: UDP, length 112
03:45:16.916946 IP node3.47674 > node4.45660: UDP, length 112
03:45:16.917681 IP node3.33707 > node4.42011: UDP, length 113
03:45:16.934844 IP node3.55313 > node2.44278: UDP, length 94
03:45:16.938793 IP node3.45596 > node2.45941: UDP, length 113
03:45:16.938872 IP node3.58663 > node2.45941: UDP, length 113
03:45:16.940112 IP node3.42797 > node2.45941: UDP, length 113
03:45:16.940310 IP node3.33275 > node2.45941: UDP, length 113
03:45:16.940676 IP node3.39663 > node2.45941: UDP, length 113
03:45:16.941470 IP node3.48649 > node2.45941: UDP, length 113
03:45:16.941607 IP node3.47674 > node2.45941: UDP, length 112
03:45:16.942424 IP node3.55023 > node2.45941: UDP, length 112
03:45:16.942940 IP node3.33216 > node2.45941: UDP, length 113
03:45:16.943384 IP node3.55313 > node2.35425: UDP, length 113
03:45:16.943451 IP node3.33707 > node2.45941: UDP, length 113
03:45:16.945510 IP node3.55313 > node2.50082: UDP, length 113
03:45:16.945637 IP node3.55313 > node2.46051: UDP, length 113
03:45:16.946132 IP node3.55313 > node2.47183: UDP, length 113
03:45:16.946250 IP node3.55313 > node2.33273: UDP, length 113
03:45:16.946723 IP node3.55313 > node2.37614: UDP, length 113
03:45:16.950401 IP node3.53645 > node2.47183: UDP, length 113
03:45:16.951565 IP node3.53645 > node4.59050: UDP, length 113
03:45:16.999575 IP node3.55313 > node4.51453: UDP, length 113
03:45:16.999773 IP node3.55313 > node4.51545: UDP, length 113
03:45:16.999893 IP node3.55313 > node4.58434: UDP, length 113
03:45:16.999964 IP node3.55313 > node2.33901: UDP, length 113
03:45:17.000036 IP node3.55313 > node2.43732: UDP, length 113
03:45:17.000105 IP node3.55313 > node4.42409: UDP, length 113
03:45:17.000174 IP node3.55313 > node2.53863: UDP, length 113
03:45:17.000258 IP node3.55313 > node4.36744: UDP, length 113
03:45:17.000445 IP node3.55313 > node2.33869: UDP, length 113
03:45:17.000521 IP node3.55313 > node4.47308: UDP, length 113
03:45:17.000593 IP node3.55313 > node2.49754: UDP, length 113
03:45:17.000674 IP node3.55313 > node4.35588: UDP, length 113
03:45:17.000817 IP node3.55313 > node4.59050: UDP, length 113
03:45:17.000973 IP node3.55313 > node2.58597: UDP, length 113
03:45:17.001052 IP node3.55313 > node2.59900: UDP, length 113
03:45:17.001196 IP node3.55313 > node4.47204: UDP, length 113
03:45:17.003921 IP node3.55313 > node4.39087: UDP, length 113
03:45:17.004016 IP node3.55313 > node4.42261: UDP, length 113
03:45:17.004110 IP node3.55313 > node2.44881: UDP, length 113
03:45:17.004368 IP node3.55313 > node2.44832: UDP, length 113
03:45:17.005687 IP node3.55313 > node2.54620: UDP, length 113
03:45:17.005773 IP node3.55313 > node4.42345: UDP, length 113
03:45:17.006712 IP node3.55313 > node4.45660: UDP, length 113
03:45:17.007059 IP node3.55313 > node2.33434: UDP, length 113
03:45:17.009703 IP node3.55313 > node2.45941: UDP, length 113
03:45:17.009799 IP node3.55313 > node4.42011: UDP, length 113
03:45:17.009881 IP node3.55313 > node4.45176: UDP, length 113
03:45:17.010225 IP node3.58663 > node4.45176: UDP, length 113
03:45:17.011393 IP node3.33216 > node4.45176: UDP, length 113
03:45:17.012609 IP node3.47674 > node4.45176: UDP, length 112
03:45:17.012830 IP node3.45596 > node4.45176: UDP, length 113
03:45:17.012992 IP node3.42797 > node4.45176: UDP, length 113
03:45:17.013196 IP node3.33275 > node4.45176: UDP, length 113
03:45:17.013888 IP node3.39663 > node4.45176: UDP, length 113
03:45:17.014728 IP node3.48649 > node4.45176: UDP, length 113
03:45:17.044037 IP node3.55313 > node4.35245: UDP, length 113
03:45:17.044240 IP node3.47674 > node4.35245: UDP, length 112
03:45:17.045132 IP node3.33275 > node4.35245: UDP, length 113
03:45:17.046157 IP node3.48649 > node4.35245: UDP, length 113
03:45:17.046331 IP node3.45596 > node4.35245: UDP, length 113
03:45:17.046638 IP node3.39663 > node4.35245: UDP, length 113
03:45:17.047258 IP node3.33216 > node4.35245: UDP, length 113
03:45:17.048363 IP node3.33707 > node4.35245: UDP, length 113
03:45:17.065521 IP node3.53645 > node2.37614: UDP, length 113
03:45:17.066228 IP node3.53645 > node4.39087: UDP, length 113
03:45:17.066695 IP node3.53645 > node4.47308: UDP, length 113
03:45:17.067016 IP node3.53645 > node4.42409: UDP, length 113
03:45:17.067317 IP node3.53645 > node2.53863: UDP, length 113
03:45:17.067568 IP node3.53645 > node4.51453: UDP, length 113
03:45:17.067833 IP node3.53645 > node2.58597: UDP, length 113
03:45:17.071660 IP node3.39663 > node2.44278: UDP, length 71
03:45:17.074229 IP node3.53645 > node4.58434: UDP, length 113
03:45:17.074367 IP node3.53645 > node2.33869: UDP, length 113
03:45:17.074489 IP node3.53645 > node2.49754: UDP, length 113
03:45:17.075244 IP node3.53645 > node4.51545: UDP, length 113
03:45:17.076988 IP node3.53645 > node2.43732: UDP, length 113
03:45:17.077230 IP node3.53645 > node4.36744: UDP, length 113
03:45:17.078145 IP node3.53645 > node4.35588: UDP, length 113
03:45:17.078394 IP node3.53645 > node4.47204: UDP, length 113
03:45:17.078644 IP node3.53645 > node2.59900: UDP, length 113
03:45:17.079428 IP node3.53645 > node4.45660: UDP, length 113
03:45:17.080523 IP node3.53645 > node2.33901: UDP, length 113
03:45:17.080804 IP node3.53645 > node4.42261: UDP, length 113
03:45:17.080966 IP node3.53645 > node2.44881: UDP, length 113
03:45:17.084810 IP node3.53645 > node2.44832: UDP, length 113
03:45:17.085151 IP node3.53645 > node4.42345: UDP, length 113
03:45:17.085484 IP node3.53645 > node2.33434: UDP, length 113
03:45:17.085952 IP node3.53645 > node4.42011: UDP, length 113
03:45:17.089019 IP node3.53645 > node2.54620: UDP, length 113
03:45:17.089781 IP node3.53645 > node2.45941: UDP, length 113
03:45:17.089910 IP node3.53645 > node4.45176: UDP, length 113
03:45:17.090034 IP node3.53645 > node4.35245: UDP, length 113
03:45:17.101260 IP node3.33275 > node2.34901: UDP, length 113
03:45:17.101662 IP node3.45596 > node2.34901: UDP, length 113
03:45:17.102480 IP node3.47674 > node2.34901: UDP, length 112
03:45:17.102684 IP node3.39663 > node2.34901: UDP, length 113
03:45:17.102991 IP node3.48649 > node2.34901: UDP, length 113
03:45:17.103509 IP node3.53645 > node2.34901: UDP, length 113
03:45:17.105337 IP node3.55313 > node2.34901: UDP, length 113
03:45:17.108982 IP node3.42797 > node4.42011: UDP, length 113
03:45:17.123688 IP node3.58663 > node4.35245: UDP, length 113
03:45:17.130916 IP node3.55023 > node4.35245: UDP, length 112
03:45:17.167531 IP node3.47674 > node1.59003: UDP, length 112
03:45:17.167694 IP node3.33275 > node1.59003: UDP, length 113
03:45:17.168884 IP node3.48649 > node1.59003: UDP, length 113
03:45:17.169168 IP node3.55313 > node1.59003: UDP, length 113
03:45:17.169322 IP node3.45596 > node1.59003: UDP, length 113
03:45:17.169877 IP node3.53645 > node1.59003: UDP, length 113
03:45:17.176551 IP node3.48649 > node2.33629: UDP, length 113
03:45:17.177335 IP node3.47674 > node2.33629: UDP, length 112
03:45:17.177568 IP node3.45596 > node2.33629: UDP, length 113
03:45:17.177728 IP node3.33275 > node2.33629: UDP, length 113
03:45:17.178746 IP node3.55313 > node2.33629: UDP, length 113
03:45:17.179308 IP node3.58663 > node1.59003: UDP, length 113
03:45:17.185669 IP node3.53645 > node2.33629: UDP, length 113
03:45:17.218797 IP node3.39663 > node1.59003: UDP, length 113
03:45:17.219521 IP node3.39663 > node2.33629: UDP, length 113
03:45:17.226521 IP node3.42797 > node2.34901: UDP, length 113
03:45:17.226769 IP node3.42797 > node1.59003: UDP, length 113
03:45:17.232651 IP node3.33707 > node4.45176: UDP, length 113
03:45:17.233505 IP node3.33707 > node2.34901: UDP, length 113
03:45:17.233594 IP node3.33707 > node1.59003: UDP, length 113
03:45:17.234416 IP node3.33707 > node2.33629: UDP, length 113
03:45:17.238239 IP node3.48649 > node2.44278: UDP, length 71
03:45:17.240876 IP node3.33216 > node2.34901: UDP, length 113
03:45:17.247925 IP node3.33216 > node2.44278: UDP, length 71
03:45:17.252787 IP node3.33216 > node1.59003: UDP, length 113
03:45:17.252956 IP node3.33216 > node2.33629: UDP, length 113
03:45:17.272024 IP node3.39256 > node2.44278: UDP, length 94
03:45:17.279216 IP node3.33216 > node2.44278: UDP, length 71
03:45:17.279728 IP node3.39256 > node2.37614: UDP, length 113
03:45:17.281048 IP node3.39256 > node4.39087: UDP, length 113
03:45:17.282059 IP node3.39256 > node4.47308: UDP, length 113
03:45:17.282391 IP node3.39256 > node4.42409: UDP, length 113
03:45:17.282706 IP node3.39256 > node2.53863: UDP, length 113
03:45:17.282988 IP node3.39256 > node4.51453: UDP, length 113
03:45:17.283233 IP node3.39256 > node2.58597: UDP, length 113
03:45:17.283488 IP node3.39256 > node2.49754: UDP, length 113
03:45:17.284331 IP node3.39256 > node2.33869: UDP, length 113
03:45:17.284583 IP node3.39256 > node4.58434: UDP, length 113
03:45:17.284840 IP node3.39256 > node2.33901: UDP, length 113
03:45:17.290828 IP node3.39256 > node4.51545: UDP, length 113
03:45:17.291552 IP node3.39256 > node2.43732: UDP, length 113
03:45:17.294559 IP node3.39256 > node4.36744: UDP, length 113
03:45:17.295160 IP node3.39256 > node4.35588: UDP, length 113
03:45:17.295406 IP node3.39256 > node4.47204: UDP, length 113
03:45:17.295684 IP node3.39256 > node2.59900: UDP, length 113
03:45:17.296070 IP node3.39256 > node4.45660: UDP, length 113
03:45:17.296322 IP node3.39256 > node2.44881: UDP, length 113
03:45:17.296564 IP node3.39256 > node4.42261: UDP, length 113
03:45:17.296773 IP node3.39256 > node2.44832: UDP, length 113
03:45:17.297079 IP node3.39256 > node2.54620: UDP, length 113
03:45:17.297303 IP node3.39256 > node4.42345: UDP, length 113
03:45:17.297644 IP node3.39256 > node2.33434: UDP, length 113
03:45:17.297899 IP node3.39256 > node4.42011: UDP, length 113
03:45:17.298140 IP node3.39256 > node2.45941: UDP, length 113
03:45:17.298355 IP node3.39256 > node4.45176: UDP, length 113
03:45:17.307118 IP node3.58663 > node2.44278: UDP, length 71
03:45:17.331140 IP node3.42797 > node2.33629: UDP, length 113
03:45:17.332338 IP node3.42797 > node4.35245: UDP, length 113
03:45:17.332469 IP node3.42797 > node2.44278: UDP, length 71
03:45:17.361539 IP node3.55023 > node2.44278: UDP, length 71
03:45:17.362049 IP node3.55023 > node2.34901: UDP, length 112
03:45:17.362092 IP node3.55023 > node1.59003: UDP, length 112
03:45:17.362215 IP node3.55023 > node4.45176: UDP, length 112
03:45:17.363980 IP node3.55023 > node2.33629: UDP, length 112
03:45:17.364939 IP node3.55023 > node2.38644: UDP, length 112
03:45:17.365717 IP node3.33275 > node2.38644: UDP, length 113
03:45:17.365855 IP node3.42797 > node2.38644: UDP, length 113
03:45:17.366741 IP node3.55313 > node2.38644: UDP, length 113
03:45:17.366816 IP node3.47674 > node2.38644: UDP, length 112
03:45:17.367443 IP node3.45596 > node2.38644: UDP, length 113
03:45:17.371030 IP node3.39256 > node2.34901: UDP, length 113
03:45:17.371178 IP node3.53645 > node2.38644: UDP, length 113
03:45:17.371283 IP node3.39256 > node4.35245: UDP, length 113
03:45:17.372008 IP node3.39256 > node1.59003: UDP, length 113
03:45:17.372566 IP node3.47674 > node2.46240: UDP, length 112
03:45:17.372914 IP node3.33275 > node2.46240: UDP, length 113
03:45:17.373072 IP node3.53645 > node2.46240: UDP, length 113
03:45:17.373626 IP node3.55313 > node2.46240: UDP, length 113
03:45:17.374430 IP node3.45596 > node2.46240: UDP, length 113
03:45:17.374715 IP node3.55023 > node2.44278: UDP, length 71
03:45:17.384871 IP node3.55023 > node2.46240: UDP, length 112
03:45:17.385309 IP node3.39663 > node2.44278: UDP, length 740
03:45:17.385441 IP node3.39663 > node2.46240: UDP, length 113
03:45:17.385513 IP node3.39663 > node2.38644: UDP, length 113
03:45:17.396538 IP node3.55023 > node2.45020: UDP, length 112
03:45:17.397317 IP node3.33275 > node2.45020: UDP, length 113
03:45:17.398255 IP node3.47674 > node2.45020: UDP, length 112
03:45:17.398652 IP node3.45596 > node2.45020: UDP, length 113
03:45:17.399003 IP node3.55313 > node2.45020: UDP, length 113
03:45:17.401256 IP node3.39663 > node2.45020: UDP, length 113
03:45:17.411809 IP node3.53645 > node2.45020: UDP, length 113
03:45:17.433275 IP node3.39256 > node2.33629: UDP, length 113
03:45:17.433802 IP node3.39256 > node2.38644: UDP, length 113
03:45:17.434127 IP node3.39256 > node2.46240: UDP, length 113
03:45:17.434499 IP node3.39256 > node2.45020: UDP, length 113
03:45:17.465424 IP node3.50677 > node4.51453: UDP, length 113
03:45:17.465738 IP node3.50677 > node4.51545: UDP, length 113
03:45:17.465825 IP node3.50677 > node4.58434: UDP, length 113
