03:18:35.993065 IP node4.52656 > node4.42687: UDP, length 113
03:18:36.255469 IP node4.42687 > node4.42010: UDP, length 113
03:18:36.255672 IP node4.52656 > node4.42010: UDP, length 113
03:18:36.361178 IP node4.42010 > node4.42687: UDP, length 112
03:18:36.565366 IP node4.58818 > node4.42687: UDP, length 112
03:18:36.566847 IP node4.52656 > node4.58818: UDP, length 113
03:18:36.568449 IP node4.42687 > node4.58818: UDP, length 113
03:18:36.572648 IP node4.42010 > node4.58818: UDP, length 112
03:18:36.586703 IP node4.58818 > node4.42010: UDP, length 112
03:18:36.803058 IP node4.52656 > node4.43211: UDP, length 113
03:18:36.804389 IP node4.42010 > node4.43211: UDP, length 112
03:18:36.804699 IP node4.42687 > node4.43211: UDP, length 113
03:18:36.805460 IP node4.58818 > node4.43211: UDP, length 112
03:18:36.878076 IP node4.43211 > node4.58818: UDP, length 113
03:18:37.077606 IP node4.57668 > node4.58818: UDP, length 112
03:18:37.078817 IP node4.42687 > node4.57668: UDP, length 113
03:18:37.079100 IP node4.52656 > node4.57668: UDP, length 113
03:18:37.079445 IP node4.42010 > node4.57668: UDP, length 112
03:18:37.081860 IP node4.58818 > node4.57668: UDP, length 112
03:18:37.082833 IP node4.57668 > node4.43211: UDP, length 112
03:18:37.087569 IP node4.43211 > node4.57668: UDP, length 113
03:18:37.190355 IP node4.54313 > node4.43211: UDP, length 113
03:18:37.190685 IP node4.42010 > node4.54313: UDP, length 112
03:18:37.192040 IP node4.58818 > node4.54313: UDP, length 112
03:18:37.192040 IP node4.43211 > node4.54313: UDP, length 113
03:18:37.192415 IP node4.52656 > node4.54313: UDP, length 113
03:18:37.192528 IP node4.42687 > node4.54313: UDP, length 113
03:18:37.192647 IP node4.57668 > node4.54313: UDP, length 112
03:18:37.204184 IP node4.54313 > node4.57668: UDP, length 113
03:18:37.349930 IP node4.42010 > node4.38296: UDP, length 112
03:18:37.350120 IP node4.38296 > node4.43211: UDP, length 113
03:18:37.350819 IP node4.42010 > node4.35965: UDP, length 112
03:18:37.351649 IP node4.42010 > node4.40739: UDP, length 112
03:18:37.354857 IP node4.58818 > node4.40739: UDP, length 112
03:18:37.354864 IP node4.58818 > node4.38296: UDP, length 112
03:18:37.354901 IP node4.58818 > node4.35965: UDP, length 112
03:18:37.355479 IP node4.38296 > node4.57668: UDP, length 113
03:18:37.355770 IP node4.38296 > node4.54313: UDP, length 113
03:18:37.356734 IP node4.38296 > node4.35965: UDP, length 113
03:18:37.357072 IP node4.38296 > node4.40739: UDP, length 113
03:18:37.358012 IP node4.42687 > node4.40739: UDP, length 113
03:18:37.358061 IP node4.42687 > node4.38296: UDP, length 113
03:18:37.358102 IP node4.42687 > node4.35965: UDP, length 113
03:18:37.361478 IP node4.52656 > node4.40739: UDP, length 113
03:18:37.361525 IP node4.52656 > node4.38296: UDP, length 113
03:18:37.361564 IP node4.52656 > node4.35965: UDP, length 113
03:18:37.361743 IP node4.43211 > node4.40739: UDP, length 113
03:18:37.361785 IP node4.43211 > node4.35965: UDP, length 113
03:18:37.362899 IP node4.43211 > node4.38296: UDP, length 113
03:18:37.370308 IP node4.57668 > node4.40739: UDP, length 112
03:18:37.370361 IP node4.57668 > node4.38296: UDP, length 112
03:18:37.370608 IP node4.57668 > node4.35965: UDP, length 112
03:18:37.373838 IP node4.54313 > node4.40739: UDP, length 113
03:18:37.373897 IP node4.54313 > node4.35965: UDP, length 113
03:18:37.374677 IP node4.54313 > node4.38296: UDP, length 113
03:18:37.381629 IP node4.58818 > node4.44881: UDP, length 112
03:18:37.381756 IP node4.54313 > node4.44881: UDP, length 113
03:18:37.382130 IP node4.43211 > node4.44881: UDP, length 113
03:18:37.382273 IP node4.44881 > node4.43211: UDP, length 112
03:18:37.382803 IP node4.42687 > node4.44881: UDP, length 113
03:18:37.383125 IP node4.57668 > node4.44881: UDP, length 112
03:18:37.383662 IP node4.42010 > node4.44881: UDP, length 112
03:18:37.384043 IP node4.44881 > node4.57668: UDP, length 112
03:18:37.384265 IP node4.44881 > node4.54313: UDP, length 112
03:18:37.385227 IP node4.44881 > node4.38296: UDP, length 112
03:18:37.385652 IP node4.44881 > node4.35965: UDP, length 112
03:18:37.385933 IP node4.44881 > node4.40739: UDP, length 112
03:18:37.386783 IP node4.52656 > node4.44881: UDP, length 113
03:18:37.452969 IP node4.35965 > node4.57668: UDP, length 113
03:18:37.454422 IP node4.35965 > node4.54313: UDP, length 113
03:18:37.456928 IP node4.35965 > node4.38296: UDP, length 113
03:18:37.457256 IP node4.35965 > node4.40739: UDP, length 113
03:18:37.494528 IP node4.38296 > node4.44881: UDP, length 113
03:18:37.523790 IP node4.58818 > node4.41947: UDP, length 112
03:18:37.524369 IP node4.54313 > node4.41947: UDP, length 113
03:18:37.524745 IP node4.57668 > node4.41947: UDP, length 112
03:18:37.525113 IP node4.35965 > node4.44881: UDP, length 113
03:18:37.525166 IP node4.52656 > node4.41947: UDP, length 113
03:18:37.525415 IP node4.42687 > node4.41947: UDP, length 113
03:18:37.525517 IP node4.42010 > node4.41947: UDP, length 112
03:18:37.525603 IP node4.43211 > node4.41947: UDP, length 113
03:18:37.531217 IP node4.44881 > node4.41947: UDP, length 112
03:18:37.532264 IP node4.38296 > node4.41947: UDP, length 113
03:18:37.547399 IP node4.35965 > node4.41947: UDP, length 113
03:18:37.551603 IP node4.57668 > node4.58599: UDP, length 112
03:18:37.553279 IP node4.58818 > node4.58599: UDP, length 112
03:18:37.553610 IP node4.52656 > node4.58599: UDP, length 113
03:18:37.554496 IP node4.54313 > node4.58599: UDP, length 113
03:18:37.555499 IP node4.42010 > node4.58599: UDP, length 112
03:18:37.555828 IP node4.43211 > node4.58599: UDP, length 113
03:18:37.556256 IP node4.42687 > node4.58599: UDP, length 113
03:18:37.560092 IP node4.58599 > node4.40739: UDP, length 113
03:18:37.560151 IP node4.58599 > node4.38296: UDP, length 113
03:18:37.560359 IP node4.58599 > node4.54313: UDP, length 113
03:18:37.560422 IP node4.58599 > node4.41947: UDP, length 113
03:18:37.560571 IP node4.58599 > node4.35965: UDP, length 113
03:18:37.560634 IP node4.58599 > node4.44881: UDP, length 113
03:18:37.560957 IP node4.58599 > node4.57668: UDP, length 113
03:18:37.563261 IP node4.35965 > node4.58599: UDP, length 113
03:18:37.566444 IP node4.44881 > node4.58599: UDP, length 112
03:18:37.573121 IP node4.40739 > node4.57668: UDP, length 112
03:18:37.573246 IP node4.40739 > node4.38296: UDP, length 112
03:18:37.573453 IP node4.40739 > node4.54313: UDP, length 112
03:18:37.573594 IP node4.40739 > node4.35965: UDP, length 112
03:18:37.573703 IP node4.40739 > node4.44881: UDP, length 112
03:18:37.576573 IP node4.38296 > node4.58599: UDP, length 113
03:18:37.631418 IP node4.40739 > node4.41947: UDP, length 112
03:18:37.631473 IP node4.40739 > node4.58599: UDP, length 112
03:18:37.667414 IP node4.41947 > node4.54313: UDP, length 113
03:18:37.667996 IP node4.41947 > node4.38296: UDP, length 113
03:18:37.668476 IP node4.41947 > node4.35965: UDP, length 113
03:18:37.668627 IP node4.41947 > node4.40739: UDP, length 113
03:18:37.668730 IP node4.41947 > node4.44881: UDP, length 113
03:18:37.668784 IP node4.41947 > node4.58599: UDP, length 113
03:18:37.718208 IP node4.41947 > node4.57668: UDP, length 113
03:18:37.728329 IP node4.58818 > node4.56064: UDP, length 112
03:18:37.728729 IP node4.42010 > node4.56064: UDP, length 112
03:18:37.732490 IP node4.57668 > node4.56064: UDP, length 112
03:18:37.733911 IP node4.42687 > node4.56064: UDP, length 113
03:18:37.734227 IP node4.52656 > node4.56064: UDP, length 113
03:18:37.736604 IP node4.43211 > node4.56064: UDP, length 113
03:18:37.739494 IP node4.44881 > node4.56064: UDP, length 112
03:18:37.740342 IP node4.41947 > node4.56064: UDP, length 113
03:18:37.740686 IP node4.54313 > node4.56064: UDP, length 113
03:18:37.741288 IP node4.35965 > node4.56064: UDP, length 113
03:18:37.743490 IP node4.38296 > node4.56064: UDP, length 113
03:18:37.744842 IP node4.58599 > node4.56064: UDP, length 113
03:18:37.745520 IP node4.40739 > node4.56064: UDP, length 112
03:18:37.751006 IP node4.57668 > node4.50849: UDP, length 112
03:18:37.751697 IP node4.43211 > node4.50849: UDP, length 113
03:18:37.752415 IP node4.54313 > node4.50849: UDP, length 113
03:18:37.752999 IP node4.44881 > node4.50849: UDP, length 112
03:18:37.753454 IP node4.35965 > node4.50849: UDP, length 113
03:18:37.753741 IP node4.52656 > node4.50849: UDP, length 113
03:18:37.753942 IP node4.42010 > node4.50849: UDP, length 112
03:18:37.754161 IP node4.38296 > node4.50849: UDP, length 113
03:18:37.754353 IP node4.58818 > node4.50849: UDP, length 112
03:18:37.755245 IP node4.40739 > node4.50849: UDP, length 112
03:18:37.773238 IP node4.58599 > node4.50849: UDP, length 113
03:18:37.776254 IP node4.42687 > node4.50849: UDP, length 113
03:18:37.776825 IP node4.41947 > node4.50849: UDP, length 113
03:18:37.838631 IP node4.38585 > node4.38296: UDP, length 112
03:18:37.838998 IP node4.38585 > node4.35965: UDP, length 112
03:18:37.842394 IP node4.57668 > node4.38585: UDP, length 112
03:18:37.842642 IP node4.42687 > node4.38585: UDP, length 113
03:18:37.843326 IP node4.52656 > node4.38585: UDP, length 113
03:18:37.843434 IP node4.58818 > node4.38585: UDP, length 112
03:18:37.845069 IP node4.42010 > node4.38585: UDP, length 112
03:18:37.846359 IP node4.38296 > node4.38585: UDP, length 113
03:18:37.847266 IP node4.58599 > node4.38585: UDP, length 113
03:18:37.847872 IP node4.35965 > node4.38585: UDP, length 113
03:18:37.848376 IP node4.41947 > node4.38585: UDP, length 113
03:18:37.849866 IP node4.40739 > node4.38585: UDP, length 112
03:18:37.850277 IP node4.38585 > node4.54313: UDP, length 112
03:18:37.851082 IP node4.44881 > node4.38585: UDP, length 112
03:18:37.851291 IP node4.38585 > node4.44881: UDP, length 112
03:18:37.853753 IP node4.38585 > node4.41947: UDP, length 112
03:18:37.854194 IP node4.38585 > node4.58599: UDP, length 112
03:18:37.854986 IP node4.38585 > node4.56064: UDP, length 112
03:18:37.855174 IP node4.38585 > node4.50849: UDP, length 112
03:18:37.856632 IP node4.54313 > node4.38585: UDP, length 113
03:18:37.859219 IP node4.43211 > node4.38585: UDP, length 113
03:18:37.886917 IP node4.38585 > node4.40739: UDP, length 112
03:18:37.951827 IP node4.56064 > node4.54313: UDP, length 112
03:18:37.956455 IP node4.56064 > node4.38296: UDP, length 112
03:18:37.956587 IP node4.56064 > node4.35965: UDP, length 112
03:18:37.963132 IP node4.50849 > node4.57668: UDP, length 113
03:18:37.963678 IP node4.50849 > node4.54313: UDP, length 113
03:18:37.969125 IP node4.50849 > node4.38296: UDP, length 113
03:18:37.969324 IP node4.50849 > node4.35965: UDP, length 113
03:18:37.969564 IP node4.50849 > node4.40739: UDP, length 113
03:18:37.969864 IP node4.50849 > node4.44881: UDP, length 113
03:18:37.971265 IP node4.50849 > node4.41947: UDP, length 113
03:18:37.973200 IP node4.50849 > node4.58599: UDP, length 113
03:18:37.973826 IP node4.50849 > node4.56064: UDP, length 113
03:18:37.974882 IP node4.50849 > node4.38585: UDP, length 113
03:18:37.998252 IP node4.56064 > node4.40739: UDP, length 112
03:18:37.998648 IP node4.56064 > node4.44881: UDP, length 112
03:18:38.003398 IP node4.56064 > node4.41947: UDP, length 112
03:18:38.004205 IP node4.56064 > node4.58599: UDP, length 112
03:18:38.005243 IP node4.56064 > node4.50849: UDP, length 112
03:18:38.037042 IP node4.56064 > node4.38585: UDP, length 112
03:18:38.064472 IP node4.54313 > node4.42581: UDP, length 113
03:18:38.065035 IP node4.58599 > node4.42581: UDP, length 113
03:18:38.065228 IP node4.42010 > node4.42581: UDP, length 112
03:18:38.065354 IP node4.58818 > node4.42581: UDP, length 112
03:18:38.065856 IP node4.35965 > node4.42581: UDP, length 113
03:18:38.065901 IP node4.43211 > node4.42581: UDP, length 113
03:18:38.066409 IP node4.38585 > node4.42581: UDP, length 112
03:18:38.066681 IP node4.50849 > node4.42581: UDP, length 113
03:18:38.066943 IP node4.42581 > node4.44881: UDP, length 113
03:18:38.067672 IP node4.56064 > node4.42581: UDP, length 112
03:18:38.068752 IP node4.42687 > node4.42581: UDP, length 113
03:18:38.069485 IP node4.52656 > node4.42581: UDP, length 113
03:18:38.071010 IP node4.57668 > node4.42581: UDP, length 112
03:18:38.071815 IP node4.44881 > node4.42581: UDP, length 112
03:18:38.072740 IP node4.41947 > node4.42581: UDP, length 113
03:18:38.073064 IP node4.38296 > node4.42581: UDP, length 113
03:18:38.074499 IP node4.40739 > node4.42581: UDP, length 112
03:18:38.075135 IP node4.51437 > node4.40739: UDP, length 113
03:18:38.075236 IP node4.51437 > node4.38296: UDP, length 113
03:18:38.077166 IP node4.51437 > node4.35965: UDP, length 113
03:18:38.077224 IP node4.51437 > node4.44881: UDP, length 113
03:18:38.080043 IP node4.54313 > node4.51437: UDP, length 113
03:18:38.080111 IP node4.58818 > node4.51437: UDP, length 112
03:18:38.080206 IP node4.43211 > node4.51437: UDP, length 113
03:18:38.080329 IP node4.58599 > node4.51437: UDP, length 113
03:18:38.080605 IP node4.42010 > node4.51437: UDP, length 112
03:18:38.082439 IP node4.51437 > node4.41947: UDP, length 113
03:18:38.082779 IP node4.51437 > node4.58599: UDP, length 113
03:18:38.083516 IP node4.41947 > node4.51437: UDP, length 113
03:18:38.083566 IP node4.38585 > node4.51437: UDP, length 112
03:18:38.083867 IP node4.35965 > node4.51437: UDP, length 113
03:18:38.084328 IP node4.57668 > node4.51437: UDP, length 112
03:18:38.084786 IP node4.50849 > node4.51437: UDP, length 113
03:18:38.086193 IP node4.44881 > node4.51437: UDP, length 112
03:18:38.086596 IP node4.56064 > node4.51437: UDP, length 112
03:18:38.086596 IP node4.54313 > node4.50209: UDP, length 113
03:18:38.086648 IP node4.58599 > node4.50209: UDP, length 113
03:18:38.086730 IP node4.43211 > node4.50209: UDP, length 113
03:18:38.086856 IP node4.56064 > node4.50209: UDP, length 112
03:18:38.087591 IP node4.58818 > node4.50209: UDP, length 112
03:18:38.087794 IP node4.41947 > node4.50209: UDP, length 113
03:18:38.088147 IP node4.38585 > node4.50209: UDP, length 112
03:18:38.088347 IP node4.42010 > node4.50209: UDP, length 112
03:18:38.089958 IP node4.50849 > node4.50209: UDP, length 113
03:18:38.090533 IP node4.42687 > node4.51437: UDP, length 113
03:18:38.091406 IP node4.42687 > node4.50209: UDP, length 113
03:18:38.091514 IP node4.35965 > node4.50209: UDP, length 113
03:18:38.091781 IP node4.51437 > node4.50849: UDP, length 113
03:18:38.092222 IP node4.51437 > node4.56064: UDP, length 113
03:18:38.093325 IP node4.51437 > node4.38585: UDP, length 113
03:18:38.093362 IP node4.38296 > node4.50209: UDP, length 113
03:18:38.093378 IP node4.38296 > node4.51437: UDP, length 113
03:18:38.094656 IP node4.40739 > node4.50209: UDP, length 112
03:18:38.094752 IP node4.40739 > node4.51437: UDP, length 112
03:18:38.096700 IP node4.44881 > node4.50209: UDP, length 112
03:18:38.098235 IP node4.57668 > node4.50209: UDP, length 112
03:18:38.098477 IP node4.52656 > node4.51437: UDP, length 113
03:18:38.098558 IP node4.52656 > node4.50209: UDP, length 113
03:18:38.100856 IP node4.51437 > node4.42581: UDP, length 113
03:18:38.105488 IP node4.42581 > node4.41947: UDP, length 113
03:18:38.106280 IP node4.42581 > node4.58599: UDP, length 113
03:18:38.106812 IP node4.42581 > node4.56064: UDP, length 113
03:18:38.107081 IP node4.42581 > node4.50849: UDP, length 113
03:18:38.107838 IP node4.42581 > node4.38585: UDP, length 113
03:18:38.110803 IP node4.51437 > node4.50209: UDP, length 113
03:18:38.112905 IP node4.42581 > node4.51437: UDP, length 113
03:18:38.113093 IP node4.42581 > node4.50209: UDP, length 113
03:18:38.142316 IP node4.58599 > node4.54807: UDP, length 113
03:18:38.142514 IP node4.50849 > node4.54807: UDP, length 113
03:18:38.142638 IP node4.42010 > node4.54807: UDP, length 112
03:18:38.144479 IP node4.41947 > node4.54807: UDP, length 113
03:18:38.144484 IP node4.56064 > node4.54807: UDP, length 112
03:18:38.145256 IP node4.54313 > node4.54807: UDP, length 113
03:18:38.145392 IP node4.43211 > node4.54807: UDP, length 113
03:18:38.145460 IP node4.58818 > node4.54807: UDP, length 112
03:18:38.146311 IP node4.38585 > node4.54807: UDP, length 112
03:18:38.147734 IP node4.35965 > node4.54807: UDP, length 113
03:18:38.148683 IP node4.57668 > node4.54807: UDP, length 112
03:18:38.148835 IP node4.51437 > node4.54807: UDP, length 113
03:18:38.148971 IP node4.44881 > node4.54807: UDP, length 112
03:18:38.149105 IP node4.40739 > node4.54807: UDP, length 112
03:18:38.149884 IP node4.52656 > node4.54807: UDP, length 113
03:18:38.151083 IP node4.38296 > node4.54807: UDP, length 113
03:18:38.151110 IP node4.42687 > node4.54807: UDP, length 113
03:18:38.153774 IP node4.42581 > node4.54807: UDP, length 113
03:18:38.163713 IP node4.43211 > node4.42769: UDP, length 113
03:18:38.165173 IP node4.57668 > node4.42769: UDP, length 112
03:18:38.165488 IP node4.54313 > node4.42769: UDP, length 113
03:18:38.165552 IP node4.58599 > node4.42769: UDP, length 113
03:18:38.165638 IP node4.38296 > node4.42769: UDP, length 113
03:18:38.166209 IP node4.42010 > node4.42769: UDP, length 112
03:18:38.166300 IP node4.40739 > node4.42769: UDP, length 112
03:18:38.166489 IP node4.58818 > node4.42769: UDP, length 112
03:18:38.166909 IP node4.41947 > node4.42769: UDP, length 113
03:18:38.167321 IP node4.38585 > node4.42769: UDP, length 112
03:18:38.168329 IP node4.52656 > node4.42769: UDP, length 113
03:18:38.169299 IP node4.42581 > node4.42769: UDP, length 113
03:18:38.169547 IP node4.50849 > node4.42769: UDP, length 113
03:18:38.170543 IP node4.51437 > node4.42769: UDP, length 113
03:18:38.172115 IP node4.44881 > node4.42769: UDP, length 112
03:18:38.172808 IP node4.35965 > node4.42769: UDP, length 113
03:18:38.173174 IP node4.42687 > node4.42769: UDP, length 113
03:18:38.173811 IP node4.56064 > node4.42769: UDP, length 112
03:18:38.175883 IP node4.54807 > node4.41947: UDP, length 113
03:18:38.176199 IP node4.54807 > node4.58599: UDP, length 113
03:18:38.181044 IP node4.54807 > node4.56064: UDP, length 113
03:18:38.181372 IP node4.54807 > node4.50849: UDP, length 113
03:18:38.182459 IP node4.54807 > node4.38585: UDP, length 113
03:18:38.186717 IP node4.54313 > node4.38406: UDP, length 113
03:18:38.187255 IP node4.58599 > node4.38406: UDP, length 113
03:18:38.187386 IP node4.42010 > node4.38406: UDP, length 112
03:18:38.187975 IP node4.50849 > node4.38406: UDP, length 113
03:18:38.188471 IP node4.38296 > node4.38406: UDP, length 113
03:18:38.188732 IP node4.41947 > node4.38406: UDP, length 113
03:18:38.189030 IP node4.43211 > node4.38406: UDP, length 113
03:18:38.189210 IP node4.54807 > node4.42581: UDP, length 113
03:18:38.189516 IP node4.54807 > node4.51437: UDP, length 113
03:18:38.189732 IP node4.54807 > node4.50209: UDP, length 113
03:18:38.189938 IP node4.38585 > node4.38406: UDP, length 112
03:18:38.190593 IP node4.56064 > node4.38406: UDP, length 112
03:18:38.190772 IP node4.58818 > node4.38406: UDP, length 112
03:18:38.195013 IP node4.51437 > node4.38406: UDP, length 113
03:18:38.197719 IP node4.35965 > node4.38406: UDP, length 113
03:18:38.199265 IP node4.57668 > node4.38406: UDP, length 112
03:18:38.199700 IP node4.44881 > node4.38406: UDP, length 112
03:18:38.199927 IP node4.40739 > node4.38406: UDP, length 112
03:18:38.200539 IP node4.52656 > node4.38406: UDP, length 113
03:18:38.200804 IP node4.42687 > node4.38406: UDP, length 113
03:18:38.203138 IP node4.42581 > node4.38406: UDP, length 113
03:18:38.263011 IP node4.54807 > node4.42769: UDP, length 113
03:18:38.263328 IP node4.54807 > node4.38406: UDP, length 113
03:18:38.319854 IP node4.42769 > node4.56064: UDP, length 113
03:18:38.320644 IP node4.50209 > node4.41947: UDP, length 113
03:18:38.320847 IP node4.50209 > node4.58599: UDP, length 113
03:18:38.322321 IP node4.50209 > node4.56064: UDP, length 113
03:18:38.322820 IP node4.42769 > node4.50849: UDP, length 113
03:18:38.322884 IP node4.50209 > node4.50849: UDP, length 113
03:18:38.325492 IP node4.50209 > node4.38585: UDP, length 113
03:18:38.327358 IP node4.42769 > node4.38585: UDP, length 113
03:18:38.328931 IP node4.42769 > node4.42581: UDP, length 113
03:18:38.329111 IP node4.42769 > node4.51437: UDP, length 113
03:18:38.332262 IP node4.50209 > node4.42581: UDP, length 113
03:18:38.332659 IP node4.50209 > node4.51437: UDP, length 113
03:18:38.333093 IP node4.50209 > node4.54807: UDP, length 113
03:18:38.333492 IP node4.50209 > node4.42769: UDP, length 113
03:18:38.333856 IP node4.50209 > node4.38406: UDP, length 113
03:18:38.334444 IP node4.42581 > node4.33103: UDP, length 113
03:18:38.336160 IP node4.50849 > node4.33103: UDP, length 113
03:18:38.336600 IP node4.58599 > node4.33103: UDP, length 113
03:18:38.337502 IP node4.38296 > node4.33103: UDP, length 113
03:18:38.337702 IP node4.54313 > node4.33103: UDP, length 113
03:18:38.338477 IP node4.43211 > node4.33103: UDP, length 113
03:18:38.339551 IP node4.58818 > node4.33103: UDP, length 112
03:18:38.339902 IP node4.50209 > node4.33103: UDP, length 113
03:18:38.341699 IP node4.38406 > node4.38585: UDP, length 113
03:18:38.344168 IP node4.38406 > node4.33103: UDP, length 113
03:18:38.344457 IP node4.38406 > node4.50209: UDP, length 113
03:18:38.344708 IP node4.38406 > node4.54807: UDP, length 113
03:18:38.344919 IP node4.38406 > node4.42769: UDP, length 113
03:18:38.345370 IP node4.38406 > node4.51437: UDP, length 113
03:18:38.345422 IP node4.38406 > node4.42581: UDP, length 113
03:18:38.345681 IP node4.56064 > node4.33103: UDP, length 112
03:18:38.346119 IP node4.38585 > node4.33103: UDP, length 112
03:18:38.349455 IP node4.42010 > node4.33103: UDP, length 112
03:18:38.350800 IP node4.41947 > node4.33103: UDP, length 113
03:18:38.351223 IP node4.35965 > node4.33103: UDP, length 113
03:18:38.351549 IP node4.40739 > node4.33103: UDP, length 112
03:18:38.351557 IP node4.42769 > node4.50209: UDP, length 113
03:18:38.351778 IP node4.42769 > node4.54807: UDP, length 113
03:18:38.351906 IP node4.42769 > node4.38406: UDP, length 113
03:18:38.351906 IP node4.44881 > node4.33103: UDP, length 112
03:18:38.352140 IP node4.57668 > node4.33103: UDP, length 112
03:18:38.352374 IP node4.52656 > node4.33103: UDP, length 113
03:18:38.354461 IP node4.42769 > node4.33103: UDP, length 113
03:18:38.357954 IP node4.52495 > node4.50209: UDP, length 113
03:18:38.358515 IP node4.52495 > node4.54807: UDP, length 113
03:18:38.358754 IP node4.52495 > node4.42769: UDP, length 113
03:18:38.359130 IP node4.38406 > node4.52495: UDP, length 113
03:18:38.359718 IP node4.52495 > node4.51437: UDP, length 113
03:18:38.360025 IP node4.52495 > node4.38406: UDP, length 113
03:18:38.360139 IP node4.52495 > node4.42581: UDP, length 113
03:18:38.364257 IP node4.58599 > node4.52495: UDP, length 113
03:18:38.365092 IP node4.56064 > node4.52495: UDP, length 112
03:18:38.365291 IP node4.38296 > node4.52495: UDP, length 113
03:18:38.367490 IP node4.54313 > node4.52495: UDP, length 113
03:18:38.368653 IP node4.50849 > node4.52495: UDP, length 113
03:18:38.368984 IP node4.40739 > node4.52495: UDP, length 112
03:18:38.369590 IP node4.42769 > node4.52495: UDP, length 113
03:18:38.371000 IP node4.35965 > node4.52495: UDP, length 113
03:18:38.373410 IP node4.57668 > node4.52495: UDP, length 112
03:18:38.376333 IP node4.58818 > node4.52495: UDP, length 112
03:18:38.376618 IP node4.41947 > node4.52495: UDP, length 113
03:18:38.377656 IP node4.38585 > node4.52495: UDP, length 112
03:18:38.377863 IP node4.42687 > node4.33103: UDP, length 113
03:18:38.378095 IP node4.42687 > node4.52495: UDP, length 113
03:18:38.378844 IP node4.42010 > node4.52495: UDP, length 112
03:18:38.379528 IP node4.43211 > node4.52495: UDP, length 113
03:18:38.380883 IP node4.52656 > node4.52495: UDP, length 113
03:18:38.381371 IP node4.42581 > node4.52495: UDP, length 113
03:18:38.382408 IP node4.44881 > node4.52495: UDP, length 112
03:18:38.383417 IP node4.51437 > node4.33103: UDP, length 113
03:18:38.386602 IP node4.51437 > node4.52495: UDP, length 113
03:18:38.387969 IP node4.50209 > node4.52495: UDP, length 113
03:18:38.392248 IP node4.54807 > node4.33103: UDP, length 113
03:18:38.392642 IP node4.54807 > node4.52495: UDP, length 113
03:18:38.409262 IP node4.52495 > node4.33103: UDP, length 113
03:18:38.415353 IP node4.33103 > node4.42581: UDP, length 112
03:18:38.415506 IP node4.33103 > node4.51437: UDP, length 112
03:18:38.415686 IP node4.33103 > node4.50209: UDP, length 112
03:18:38.415828 IP node4.33103 > node4.54807: UDP, length 112
03:18:38.416158 IP node4.33103 > node4.42769: UDP, length 112
03:18:38.416299 IP node4.33103 > node4.38406: UDP, length 112
03:18:38.444072 IP node4.33103 > node4.52495: UDP, length 112
03:18:38.509502 IP node4.52495 > node4.33946: UDP, length 113
03:18:38.511186 IP node4.38585 > node4.33946: UDP, length 112
03:18:38.511215 IP node4.42010 > node4.33946: UDP, length 112
03:18:38.511382 IP node4.33103 > node4.33946: UDP, length 112
03:18:38.511442 IP node4.58599 > node4.33946: UDP, length 113
03:18:38.513164 IP node4.42769 > node4.33946: UDP, length 113
03:18:38.514238 IP node4.54313 > node4.33946: UDP, length 113
03:18:38.515554 IP node4.43211 > node4.33946: UDP, length 113
03:18:38.516376 IP node4.42687 > node4.33946: UDP, length 113
03:18:38.516504 IP node4.38406 > node4.33946: UDP, length 113
03:18:38.517283 IP node4.50209 > node4.33946: UDP, length 113
03:18:38.518989 IP node4.56064 > node4.33946: UDP, length 112
03:18:38.519260 IP node4.35965 > node4.33946: UDP, length 113
03:18:38.519503 IP node4.54807 > node4.33946: UDP, length 113
03:18:38.520539 IP node4.50849 > node4.33946: UDP, length 113
03:18:38.521681 IP node4.44881 > node4.33946: UDP, length 112
03:18:38.522558 IP node4.58818 > node4.33946: UDP, length 112
03:18:38.523137 IP node4.41947 > node4.33946: UDP, length 113
03:18:38.523477 IP node4.42581 > node4.33946: UDP, length 113
03:18:38.523875 IP node4.51437 > node4.33946: UDP, length 113
03:18:38.524149 IP node4.40739 > node4.33946: UDP, length 112
03:18:38.524385 IP node4.57668 > node4.33946: UDP, length 112
03:18:38.524582 IP node4.52656 > node4.33946: UDP, length 113
03:18:38.526279 IP node4.38296 > node4.33946: UDP, length 113
03:18:38.528326 IP node4.33946 > node4.42581: UDP, length 113
03:18:38.528430 IP node4.33946 > node4.51437: UDP, length 113
03:18:38.529348 IP node4.33946 > node4.54807: UDP, length 113
03:18:38.529377 IP node4.33946 > node4.42769: UDP, length 113
03:18:38.529633 IP node4.33946 > node4.38406: UDP, length 113
03:18:38.531100 IP node4.33946 > node4.50209: UDP, length 113
03:18:38.554628 IP node4.33946 > node4.33103: UDP, length 113
03:18:38.585126 IP node4.33946 > node4.52495: UDP, length 113
03:18:38.832040 IP node4.33103 > node4.52656: UDP, length 112
03:18:38.832485 IP node4.54313 > node4.52656: UDP, length 113
03:18:38.832672 IP node4.44881 > node4.52656: UDP, length 112
03:18:38.833161 IP node4.40739 > node4.52656: UDP, length 112
03:18:38.833186 IP node4.51437 > node4.52656: UDP, length 113
03:18:38.833757 IP node4.38585 > node4.52656: UDP, length 112
03:18:38.834026 IP node4.56064 > node4.52656: UDP, length 112
03:18:38.834254 IP node4.33946 > node4.52656: UDP, length 113
03:18:38.835253 IP node4.54807 > node4.52656: UDP, length 113
03:18:38.835670 IP node4.42581 > node4.52656: UDP, length 113
03:18:38.835921 IP node4.58599 > node4.52656: UDP, length 113
03:18:38.836207 IP node4.57668 > node4.52656: UDP, length 112
03:18:38.836458 IP node4.38406 > node4.52656: UDP, length 113
03:18:38.836479 IP node4.38296 > node4.52656: UDP, length 113
03:18:38.836721 IP node4.42769 > node4.52656: UDP, length 113
03:18:38.836900 IP node4.58818 > node4.52656: UDP, length 112
03:18:38.836924 IP node4.42687 > node4.52656: UDP, length 113
03:18:38.837347 IP node4.43211 > node4.52656: UDP, length 113
03:18:38.837648 IP node4.41947 > node4.52656: UDP, length 113
03:18:38.839517 IP node4.35965 > node4.52656: UDP, length 113
03:18:38.839752 IP node4.42010 > node4.52656: UDP, length 112
03:18:38.840512 IP node4.50209 > node4.52656: UDP, length 113
03:18:38.841042 IP node4.50849 > node4.52656: UDP, length 113
03:18:38.841371 IP node4.52495 > node4.52656: UDP, length 113
03:18:39.432639 IP node4.38585 > node4.42687: UDP, length 112
03:18:39.433093 IP node4.44881 > node4.42687: UDP, length 112
03:18:39.433481 IP node4.58599 > node4.42687: UDP, length 113
03:18:39.434024 IP node4.38296 > node4.42687: UDP, length 113
03:18:39.434035 IP node4.50849 > node4.42687: UDP, length 113
03:18:39.434509 IP node4.54807 > node4.42687: UDP, length 113
03:18:39.434732 IP node4.54313 > node4.42687: UDP, length 113
03:18:39.434856 IP node4.57668 > node4.42687: UDP, length 112
03:18:39.434876 IP node4.58818 > node4.42687: UDP, length 112
03:18:39.434988 IP node4.38406 > node4.42687: UDP, length 113
03:18:39.435165 IP node4.40739 > node4.42687: UDP, length 112
03:18:39.436584 IP node4.42581 > node4.42687: UDP, length 113
03:18:39.436596 IP node4.42769 > node4.42687: UDP, length 113
03:18:39.436756 IP node4.51437 > node4.42687: UDP, length 113
03:18:39.437278 IP node4.56064 > node4.42687: UDP, length 112
03:18:39.437649 IP node4.33946 > node4.42687: UDP, length 113
03:18:39.437842 IP node4.50209 > node4.42687: UDP, length 113
03:18:39.438100 IP node4.35965 > node4.42687: UDP, length 113
03:18:39.439295 IP node4.52495 > node4.42687: UDP, length 113
03:18:39.439371 IP node4.33103 > node4.42687: UDP, length 112
03:18:39.439628 IP node4.43211 > node4.42687: UDP, length 113
03:18:39.439875 IP node4.42010 > node4.42687: UDP, length 112
03:18:39.439894 IP node4.41947 > node4.42687: UDP, length 113
03:18:39.439903 IP node4.52656 > node4.42687: UDP, length 113
03:18:39.702335 IP node4.33946 > node4.42010: UDP, length 113
03:18:39.703522 IP node4.50849 > node4.42010: UDP, length 113
03:18:39.704141 IP node4.56064 > node4.42010: UDP, length 112
03:18:39.704497 IP node4.52495 > node4.42010: UDP, length 113
03:18:39.704705 IP node4.50209 > node4.42010: UDP, length 113
03:18:39.705314 IP node4.35965 > node4.42010: UDP, length 113
03:18:39.705595 IP node4.40739 > node4.42010: UDP, length 112
03:18:39.705764 IP node4.44881 > node4.42010: UDP, length 112
03:18:39.705829 IP node4.51437 > node4.42010: UDP, length 113
03:18:39.706106 IP node4.42581 > node4.42010: UDP, length 113
03:18:39.706374 IP node4.58599 > node4.42010: UDP, length 113
03:18:39.706411 IP node4.58818 > node4.42010: UDP, length 112
03:18:39.706722 IP node4.54807 > node4.42010: UDP, length 113
03:18:39.706799 IP node4.52656 > node4.42010: UDP, length 113
03:18:39.706934 IP node4.42687 > node4.42010: UDP, length 113
03:18:39.708599 IP node4.38585 > node4.42010: UDP, length 112
03:18:39.708629 IP node4.57668 > node4.42010: UDP, length 112
03:18:39.708836 IP node4.42769 > node4.42010: UDP, length 113
03:18:39.709116 IP node4.43211 > node4.42010: UDP, length 113
03:18:39.709497 IP node4.38296 > node4.42010: UDP, length 113
03:18:39.709533 IP node4.41947 > node4.42010: UDP, length 113
03:18:39.710598 IP node4.33103 > node4.42010: UDP, length 112
03:18:39.712577 IP node4.54313 > node4.42010: UDP, length 113
03:18:39.714219 IP node4.38406 > node4.42010: UDP, length 113
03:18:39.946680 IP node4.42581 > node4.58818: UDP, length 113
03:18:39.947772 IP node4.41947 > node4.58818: UDP, length 113
03:18:39.947978 IP node4.50849 > node4.58818: UDP, length 113
03:18:39.948168 IP node4.43211 > node4.58818: UDP, length 113
03:18:39.949034 IP node4.51437 > node4.58818: UDP, length 113
03:18:39.949196 IP node4.33103 > node4.58818: UDP, length 112
03:18:39.949542 IP node4.57668 > node4.58818: UDP, length 112
03:18:39.949879 IP node4.33946 > node4.58818: UDP, length 113
03:18:39.950047 IP node4.42687 > node4.58818: UDP, length 113
03:18:39.950142 IP node4.44881 > node4.58818: UDP, length 112
03:18:39.950143 IP node4.56064 > node4.58818: UDP, length 112
03:18:39.950286 IP node4.52656 > node4.58818: UDP, length 113
03:18:39.950372 IP node4.38296 > node4.58818: UDP, length 113
03:18:39.950551 IP node4.52495 > node4.58818: UDP, length 113
03:18:39.950719 IP node4.54313 > node4.58818: UDP, length 113
03:18:39.950879 IP node4.35965 > node4.58818: UDP, length 113
03:18:39.952686 IP node4.38406 > node4.58818: UDP, length 113
03:18:39.952772 IP node4.38585 > node4.58818: UDP, length 112
03:18:39.953055 IP node4.42010 > node4.58818: UDP, length 112
03:18:39.953595 IP node4.50209 > node4.58818: UDP, length 113
03:18:39.954193 IP node4.58599 > node4.58818: UDP, length 113
03:18:39.954401 IP node4.54807 > node4.58818: UDP, length 113
03:18:39.954665 IP node4.42769 > node4.58818: UDP, length 113
03:18:39.958117 IP node4.40739 > node4.58818: UDP, length 112
03:18:40.302577 IP node4.38406 > node4.43211: UDP, length 113
03:18:40.302802 IP node4.35965 > node4.43211: UDP, length 113
03:18:40.303296 IP node4.50849 > node4.43211: UDP, length 113
03:18:40.303368 IP node4.42581 > node4.43211: UDP, length 113
03:18:40.303640 IP node4.41947 > node4.43211: UDP, length 113
03:18:40.303972 IP node4.58599 > node4.43211: UDP, length 113
03:18:40.304236 IP node4.58818 > node4.43211: UDP, length 112
03:18:40.306082 IP node4.50209 > node4.43211: UDP, length 113
03:18:40.306323 IP node4.42687 > node4.43211: UDP, length 113
03:18:40.306993 IP node4.57668 > node4.43211: UDP, length 112
03:18:40.307171 IP node4.52656 > node4.43211: UDP, length 113
03:18:40.307279 IP node4.40739 > node4.43211: UDP, length 112
03:18:40.307496 IP node4.51437 > node4.43211: UDP, length 113
03:18:40.307894 IP node4.44881 > node4.43211: UDP, length 112
03:18:40.308849 IP node4.42010 > node4.43211: UDP, length 112
03:18:40.309319 IP node4.56064 > node4.43211: UDP, length 112
03:18:40.309902 IP node4.42769 > node4.43211: UDP, length 113
03:18:40.310086 IP node4.54807 > node4.43211: UDP, length 113
03:18:40.310813 IP node4.52495 > node4.43211: UDP, length 113
03:18:40.310846 IP node4.38296 > node4.43211: UDP, length 113
03:18:40.310942 IP node4.54313 > node4.43211: UDP, length 113
03:18:40.311253 IP node4.38585 > node4.43211: UDP, length 112
03:18:40.311806 IP node4.33946 > node4.43211: UDP, length 113
03:18:40.313139 IP node4.33103 > node4.43211: UDP, length 112
03:18:40.575332 IP node4.50209 > node4.54313: UDP, length 113
03:18:40.575395 IP node4.50209 > node4.57668: UDP, length 113
03:18:40.575642 IP node4.44881 > node4.54313: UDP, length 112
03:18:40.576204 IP node4.41947 > node4.54313: UDP, length 113
03:18:40.576269 IP node4.41947 > node4.57668: UDP, length 113
03:18:40.577483 IP node4.50849 > node4.54313: UDP, length 113
03:18:40.577585 IP node4.50849 > node4.57668: UDP, length 113
03:18:40.578319 IP node4.58818 > node4.54313: UDP, length 112
03:18:40.578361 IP node4.58818 > node4.57668: UDP, length 112
03:18:40.578655 IP node4.52656 > node4.54313: UDP, length 113
03:18:40.578722 IP node4.52656 > node4.57668: UDP, length 113
03:18:40.579586 IP node4.51437 > node4.54313: UDP, length 113
03:18:40.579881 IP node4.44881 > node4.57668: UDP, length 112
03:18:40.580497 IP node4.40739 > node4.54313: UDP, length 112
03:18:40.580586 IP node4.40739 > node4.57668: UDP, length 112
03:18:40.580587 IP node4.57668 > node4.54313: UDP, length 112
03:18:40.581051 IP node4.43211 > node4.54313: UDP, length 113
03:18:40.581258 IP node4.43211 > node4.57668: UDP, length 113
03:18:40.581741 IP node4.56064 > node4.54313: UDP, length 112
03:18:40.581777 IP node4.56064 > node4.57668: UDP, length 112
03:18:40.582353 IP node4.35965 > node4.54313: UDP, length 113
03:18:40.582512 IP node4.52495 > node4.57668: UDP, length 113
03:18:40.582582 IP node4.38296 > node4.54313: UDP, length 113
03:18:40.582615 IP node4.38296 > node4.57668: UDP, length 113
03:18:40.583638 IP node4.33946 > node4.54313: UDP, length 113
03:18:40.583676 IP node4.33946 > node4.57668: UDP, length 113
03:18:40.584534 IP node4.38406 > node4.54313: UDP, length 113
03:18:40.584646 IP node4.38406 > node4.57668: UDP, length 113
03:18:40.585354 IP node4.42581 > node4.54313: UDP, length 113
03:18:40.585386 IP node4.42581 > node4.57668: UDP, length 113
03:18:40.587243 IP node4.54807 > node4.54313: UDP, length 113
03:18:40.587283 IP node4.54807 > node4.57668: UDP, length 113
03:18:40.587562 IP node4.42769 > node4.54313: UDP, length 113
03:18:40.587594 IP node4.42769 > node4.57668: UDP, length 113
03:18:40.587603 IP node4.51437 > node4.57668: UDP, length 113
03:18:40.587777 IP node4.35965 > node4.57668: UDP, length 113
03:18:40.588994 IP node4.42010 > node4.54313: UDP, length 112
03:18:40.589079 IP node4.42010 > node4.57668: UDP, length 112
03:18:40.592075 IP node4.38585 > node4.54313: UDP, length 112
03:18:40.592583 IP node4.38585 > node4.57668: UDP, length 112
03:18:40.599415 IP node4.42687 > node4.54313: UDP, length 113
03:18:40.599452 IP node4.42687 > node4.57668: UDP, length 113
03:18:40.605373 IP node4.33103 > node4.54313: UDP, length 112
03:18:40.605454 IP node4.33103 > node4.57668: UDP, length 112
03:18:40.605747 IP node4.52495 > node4.54313: UDP, length 113
03:18:40.608360 IP node4.58599 > node4.54313: UDP, length 113
03:18:40.608500 IP node4.58599 > node4.57668: UDP, length 113
03:18:40.625916 IP node4.54313 > node4.57668: UDP, length 113
03:18:40.654309 IP node4.38585 > node4.44881: UDP, length 112
03:18:40.654853 IP node4.51437 > node4.44881: UDP, length 113
03:18:40.655339 IP node4.58599 > node4.44881: UDP, length 113
03:18:40.656278 IP node4.33946 > node4.44881: UDP, length 113
03:18:40.657900 IP node4.42769 > node4.44881: UDP, length 113
03:18:40.657945 IP node4.33103 > node4.44881: UDP, length 112
03:18:40.658080 IP node4.52495 > node4.44881: UDP, length 113
03:18:40.660238 IP node4.40739 > node4.44881: UDP, length 112
03:18:40.660295 IP node4.35965 > node4.44881: UDP, length 113
03:18:40.661675 IP node4.38296 > node4.44881: UDP, length 113
03:18:40.662735 IP node4.50849 > node4.44881: UDP, length 113
03:18:40.662997 IP node4.54313 > node4.44881: UDP, length 113
03:18:40.663320 IP node4.57668 > node4.44881: UDP, length 112
03:18:40.663332 IP node4.56064 > node4.44881: UDP, length 112
03:18:40.664901 IP node4.52656 > node4.44881: UDP, length 113
03:18:40.666045 IP node4.58818 > node4.44881: UDP, length 112
03:18:40.666065 IP node4.54807 > node4.44881: UDP, length 113
03:18:40.666301 IP node4.42010 > node4.44881: UDP, length 112
03:18:40.666543 IP node4.42687 > node4.44881: UDP, length 113
03:18:40.666700 IP node4.50209 > node4.44881: UDP, length 113
03:18:40.668570 IP node4.43211 > node4.44881: UDP, length 113
03:18:40.668583 IP node4.41947 > node4.44881: UDP, length 113
03:18:40.668968 IP node4.42581 > node4.44881: UDP, length 113
03:18:40.670612 IP node4.38406 > node4.44881: UDP, length 113
03:18:40.693678 IP node4.42010 > node4.38296: UDP, length 112
03:18:40.695294 IP node4.52656 > node4.38296: UDP, length 113
03:18:40.695839 IP node4.42687 > node4.38296: UDP, length 113
03:18:40.696505 IP node4.54313 > node4.38296: UDP, length 113
03:18:40.696653 IP node4.50849 > node4.38296: UDP, length 113
03:18:40.697005 IP node4.57668 > node4.38296: UDP, length 112
03:18:40.697702 IP node4.43211 > node4.38296: UDP, length 113
03:18:40.699856 IP node4.58818 > node4.38296: UDP, length 112
03:18:40.703583 IP node4.56064 > node4.38296: UDP, length 112
03:18:40.703728 IP node4.38585 > node4.38296: UDP, length 112
03:18:40.707807 IP node4.42581 > node4.38296: UDP, length 113
03:18:40.709665 IP node4.54807 > node4.38296: UDP, length 113
03:18:40.710378 IP node4.33103 > node4.38296: UDP, length 112
03:18:40.711057 IP node4.40739 > node4.38296: UDP, length 112
03:18:40.711248 IP node4.38406 > node4.38296: UDP, length 113
03:18:40.711475 IP node4.41947 > node4.38296: UDP, length 113
03:18:40.714299 IP node4.52495 > node4.38296: UDP, length 113
03:18:40.719746 IP node4.42769 > node4.38296: UDP, length 113
03:18:40.720967 IP node4.50209 > node4.38296: UDP, length 113
03:18:40.724169 IP node4.51437 > node4.38296: UDP, length 113
03:18:40.727617 IP node4.58599 > node4.38296: UDP, length 113
03:18:40.728286 IP node4.35965 > node4.38296: UDP, length 113
03:18:40.729860 IP node4.44881 > node4.38296: UDP, length 112
03:18:40.733054 IP node4.33946 > node4.38296: UDP, length 113
03:18:40.841090 IP node4.58599 > node4.35965: UDP, length 113
03:18:40.841088 IP node4.33946 > node4.35965: UDP, length 113
03:18:40.841290 IP node4.58818 > node4.35965: UDP, length 112
03:18:40.841785 IP node4.57668 > node4.35965: UDP, length 112
03:18:40.842114 IP node4.42010 > node4.35965: UDP, length 112
03:18:40.842213 IP node4.40739 > node4.35965: UDP, length 112
03:18:40.842285 IP node4.50849 > node4.35965: UDP, length 113
03:18:40.842358 IP node4.43211 > node4.35965: UDP, length 113
03:18:40.842378 IP node4.42581 > node4.35965: UDP, length 113
03:18:40.843552 IP node4.51437 > node4.35965: UDP, length 113
03:18:40.843742 IP node4.42687 > node4.35965: UDP, length 113
03:18:40.843820 IP node4.56064 > node4.35965: UDP, length 112
03:18:40.844385 IP node4.41947 > node4.35965: UDP, length 113
03:18:40.845024 IP node4.52656 > node4.35965: UDP, length 113
03:18:40.845110 IP node4.44881 > node4.35965: UDP, length 112
03:18:40.845830 IP node4.38296 > node4.35965: UDP, length 113
03:18:40.846155 IP node4.54313 > node4.35965: UDP, length 113
03:18:40.846452 IP node4.38585 > node4.35965: UDP, length 112
03:18:40.848697 IP node4.50209 > node4.35965: UDP, length 113
03:18:40.850152 IP node4.52495 > node4.35965: UDP, length 113
03:18:40.850399 IP node4.42769 > node4.35965: UDP, length 113
03:18:40.850706 IP node4.54807 > node4.35965: UDP, length 113
03:18:40.850866 IP node4.33103 > node4.35965: UDP, length 112
03:18:40.851672 IP node4.52656 > node4.40739: UDP, length 113
03:18:40.852070 IP node4.51437 > node4.40739: UDP, length 113
03:18:40.852099 IP node4.38406 > node4.40739: UDP, length 113
03:18:40.852139 IP node4.38406 > node4.35965: UDP, length 113
03:18:40.852281 IP node4.42010 > node4.40739: UDP, length 112
03:18:40.852972 IP node4.54313 > node4.40739: UDP, length 113
03:18:40.853174 IP node4.52495 > node4.40739: UDP, length 113
03:18:40.853304 IP node4.54807 > node4.40739: UDP, length 113
03:18:40.853310 IP node4.42769 > node4.40739: UDP, length 113
03:18:40.853509 IP node4.38585 > node4.40739: UDP, length 112
03:18:40.853533 IP node4.38296 > node4.40739: UDP, length 113
03:18:40.853589 IP node4.41947 > node4.40739: UDP, length 113
03:18:40.853842 IP node4.33946 > node4.40739: UDP, length 113
03:18:40.854268 IP node4.56064 > node4.40739: UDP, length 112
03:18:40.854519 IP node4.42687 > node4.40739: UDP, length 113
03:18:40.855008 IP node4.57668 > node4.40739: UDP, length 112
03:18:40.855350 IP node4.44881 > node4.40739: UDP, length 112
03:18:40.856015 IP node4.58599 > node4.40739: UDP, length 113
03:18:40.856147 IP node4.50849 > node4.40739: UDP, length 113
03:18:40.857256 IP node4.50209 > node4.40739: UDP, length 113
03:18:40.857679 IP node4.33103 > node4.40739: UDP, length 112
03:18:40.857687 IP node4.42581 > node4.40739: UDP, length 113
03:18:40.858398 IP node4.58818 > node4.40739: UDP, length 112
03:18:40.860955 IP node4.43211 > node4.40739: UDP, length 113
03:18:40.865925 IP node4.35965 > node4.40739: UDP, length 113
03:18:40.919800 IP node4.52495 > node4.58599: UDP, length 113
03:18:40.920060 IP node4.42769 > node4.58599: UDP, length 113
03:18:40.920568 IP node4.35965 > node4.58599: UDP, length 113
03:18:40.920683 IP node4.42581 > node4.58599: UDP, length 113
03:18:40.921906 IP node4.58818 > node4.58599: UDP, length 112
03:18:40.922312 IP node4.38406 > node4.58599: UDP, length 113
03:18:40.922620 IP node4.44881 > node4.58599: UDP, length 112
03:18:40.922838 IP node4.40739 > node4.58599: UDP, length 112
03:18:40.924021 IP node4.54807 > node4.58599: UDP, length 113
03:18:40.924967 IP node4.51437 > node4.58599: UDP, length 113
03:18:40.925716 IP node4.42010 > node4.58599: UDP, length 112
03:18:40.927321 IP node4.33103 > node4.58599: UDP, length 112
03:18:40.927493 IP node4.50209 > node4.58599: UDP, length 113
03:18:40.927789 IP node4.38585 > node4.58599: UDP, length 112
03:18:40.928142 IP node4.43211 > node4.58599: UDP, length 113
03:18:40.929073 IP node4.52656 > node4.58599: UDP, length 113
03:18:40.929722 IP node4.50849 > node4.58599: UDP, length 113
03:18:40.931291 IP node4.57668 > node4.58599: UDP, length 112
03:18:40.932514 IP node4.38296 > node4.58599: UDP, length 113
03:18:40.933775 IP node4.33946 > node4.58599: UDP, length 113
03:18:40.934046 IP node4.42687 > node4.58599: UDP, length 113
03:18:40.934708 IP node4.54313 > node4.58599: UDP, length 113
03:18:40.934922 IP node4.56064 > node4.58599: UDP, length 112
03:18:40.935118 IP node4.41947 > node4.58599: UDP, length 113
03:18:40.983090 IP node4.52656 > node4.41947: UDP, length 113
03:18:40.983223 IP node4.54313 > node4.41947: UDP, length 113
03:18:40.983364 IP node4.40739 > node4.41947: UDP, length 112
03:18:40.983810 IP node4.44881 > node4.41947: UDP, length 112
03:18:40.984215 IP node4.33946 > node4.41947: UDP, length 113
03:18:40.984279 IP node4.43211 > node4.41947: UDP, length 113
03:18:40.984359 IP node4.38585 > node4.41947: UDP, length 112
03:18:40.985119 IP node4.52495 > node4.41947: UDP, length 113
03:18:40.985193 IP node4.50849 > node4.41947: UDP, length 113
03:18:40.986095 IP node4.38296 > node4.41947: UDP, length 113
03:18:40.986455 IP node4.56064 > node4.41947: UDP, length 112
03:18:40.986855 IP node4.42581 > node4.41947: UDP, length 113
03:18:40.988119 IP node4.42010 > node4.41947: UDP, length 112
03:18:40.988447 IP node4.42687 > node4.41947: UDP, length 113
03:18:40.988928 IP node4.35965 > node4.41947: UDP, length 113
03:18:40.989336 IP node4.57668 > node4.41947: UDP, length 112
03:18:40.989546 IP node4.58599 > node4.41947: UDP, length 113
03:18:40.992047 IP node4.50209 > node4.41947: UDP, length 113
03:18:40.992276 IP node4.58818 > node4.41947: UDP, length 112
03:18:40.993077 IP node4.42769 > node4.41947: UDP, length 113
03:18:40.995882 IP node4.54807 > node4.41947: UDP, length 113
03:18:40.996668 IP node4.51437 > node4.41947: UDP, length 113
03:18:40.998213 IP node4.38406 > node4.41947: UDP, length 113
03:18:40.998233 IP node4.33103 > node4.41947: UDP, length 112
03:18:41.217135 IP node4.58599 > node4.50849: UDP, length 113
03:18:41.217296 IP node4.57668 > node4.50849: UDP, length 112
03:18:41.217327 IP node4.54313 > node4.50849: UDP, length 113
03:18:41.217592 IP node4.42581 > node4.50849: UDP, length 113
03:18:41.217592 IP node4.38296 > node4.50849: UDP, length 113
03:18:41.218353 IP node4.38406 > node4.50849: UDP, length 113
03:18:41.218524 IP node4.51437 > node4.50849: UDP, length 113
03:18:41.218768 IP node4.56064 > node4.50849: UDP, length 112
03:18:41.219647 IP node4.42687 > node4.50849: UDP, length 113
03:18:41.219959 IP node4.38585 > node4.50849: UDP, length 112
03:18:41.220159 IP node4.42010 > node4.50849: UDP, length 112
03:18:41.220404 IP node4.50209 > node4.50849: UDP, length 113
03:18:41.220559 IP node4.52656 > node4.50849: UDP, length 113
03:18:41.220642 IP node4.35965 > node4.50849: UDP, length 113
03:18:41.220829 IP node4.43211 > node4.50849: UDP, length 113
03:18:41.222210 IP node4.42769 > node4.50849: UDP, length 113
03:18:41.222859 IP node4.44881 > node4.50849: UDP, length 112
03:18:41.223796 IP node4.58818 > node4.50849: UDP, length 112
03:18:41.231974 IP node4.54313 > node4.56064: UDP, length 113
03:18:41.232597 IP node4.38296 > node4.56064: UDP, length 113
03:18:41.233287 IP node4.42581 > node4.56064: UDP, length 113
03:18:41.233569 IP node4.35965 > node4.56064: UDP, length 113
03:18:41.233940 IP node4.50209 > node4.56064: UDP, length 113
03:18:41.234071 IP node4.58599 > node4.56064: UDP, length 113
03:18:41.234236 IP node4.57668 > node4.56064: UDP, length 112
03:18:41.234593 IP node4.38585 > node4.56064: UDP, length 112
03:18:41.234700 IP node4.42010 > node4.56064: UDP, length 112
03:18:41.234881 IP node4.43211 > node4.56064: UDP, length 113
03:18:41.235452 IP node4.40739 > node4.50849: UDP, length 112
03:18:41.235733 IP node4.33946 > node4.56064: UDP, length 113
03:18:41.235764 IP node4.51437 > node4.56064: UDP, length 113
03:18:41.236520 IP node4.52656 > node4.56064: UDP, length 113
03:18:41.236803 IP node4.42687 > node4.56064: UDP, length 113
03:18:41.237141 IP node4.50849 > node4.56064: UDP, length 113
03:18:41.237814 IP node4.42769 > node4.56064: UDP, length 113
03:18:41.238980 IP node4.41947 > node4.50849: UDP, length 113
03:18:41.239010 IP node4.41947 > node4.56064: UDP, length 113
03:18:41.240233 IP node4.52495 > node4.50849: UDP, length 113
03:18:41.240264 IP node4.52495 > node4.56064: UDP, length 113
03:18:41.240731 IP node4.44881 > node4.56064: UDP, length 112
03:18:41.242878 IP node4.54807 > node4.50849: UDP, length 113
03:18:41.242936 IP node4.54807 > node4.56064: UDP, length 113
03:18:41.244904 IP node4.58818 > node4.56064: UDP, length 112
03:18:41.245344 IP node4.38406 > node4.56064: UDP, length 113
03:18:41.246214 IP node4.33946 > node4.50849: UDP, length 113
03:18:41.246958 IP node4.33103 > node4.50849: UDP, length 112
03:18:41.246990 IP node4.33103 > node4.56064: UDP, length 112
03:18:41.253033 IP node4.40739 > node4.56064: UDP, length 112
03:18:41.308214 IP node4.54313 > node4.38585: UDP, length 113
03:18:41.308782 IP node4.38296 > node4.38585: UDP, length 113
03:18:41.309704 IP node4.43211 > node4.38585: UDP, length 113
03:18:41.310284 IP node4.41947 > node4.38585: UDP, length 113
03:18:41.310524 IP node4.58599 > node4.38585: UDP, length 113
03:18:41.310526 IP node4.33946 > node4.38585: UDP, length 113
03:18:41.311875 IP node4.54807 > node4.38585: UDP, length 113
03:18:41.313267 IP node4.57668 > node4.38585: UDP, length 112
03:18:41.313455 IP node4.52656 > node4.38585: UDP, length 113
03:18:41.314099 IP node4.56064 > node4.38585: UDP, length 112
03:18:41.314332 IP node4.42581 > node4.38585: UDP, length 113
03:18:41.314590 IP node4.42010 > node4.38585: UDP, length 112
03:18:41.314812 IP node4.51437 > node4.38585: UDP, length 113
03:18:41.315791 IP node4.42687 > node4.38585: UDP, length 113
03:18:41.315791 IP node4.58818 > node4.38585: UDP, length 112
03:18:41.316324 IP node4.35965 > node4.38585: UDP, length 113
03:18:41.316607 IP node4.50209 > node4.38585: UDP, length 113
03:18:41.329986 IP node4.33103 > node4.38585: UDP, length 112
03:18:41.330157 IP node4.44881 > node4.38585: UDP, length 112
03:18:41.330894 IP node4.40739 > node4.38585: UDP, length 112
03:18:41.331857 IP node4.52495 > node4.38585: UDP, length 113
03:18:41.332519 IP node4.42769 > node4.38585: UDP, length 113
03:18:41.336284 IP node4.38406 > node4.38585: UDP, length 113
03:18:41.338694 IP node4.50849 > node4.38585: UDP, length 113
03:18:41.378184 IP node4.52656 > node4.42581: UDP, length 113
03:18:41.378329 IP node4.44881 > node4.42581: UDP, length 112
03:18:41.378454 IP node4.54313 > node4.42581: UDP, length 113
03:18:41.378792 IP node4.35965 > node4.42581: UDP, length 113
03:18:41.378939 IP node4.42687 > node4.42581: UDP, length 113
03:18:41.379634 IP node4.58599 > node4.42581: UDP, length 113
03:18:41.379811 IP node4.42010 > node4.42581: UDP, length 112
03:18:41.380640 IP node4.51437 > node4.42581: UDP, length 113
03:18:41.380998 IP node4.33946 > node4.42581: UDP, length 113
03:18:41.381245 IP node4.57668 > node4.42581: UDP, length 112
03:18:41.381349 IP node4.40739 > node4.42581: UDP, length 112
03:18:41.381695 IP node4.56064 > node4.42581: UDP, length 112
03:18:41.382259 IP node4.54807 > node4.42581: UDP, length 113
03:18:41.382301 IP node4.38406 > node4.42581: UDP, length 113
03:18:41.382735 IP node4.58818 > node4.42581: UDP, length 112
03:18:41.383565 IP node4.38296 > node4.42581: UDP, length 113
03:18:41.384134 IP node4.41947 > node4.42581: UDP, length 113
03:18:41.386220 IP node4.33103 > node4.42581: UDP, length 112
03:18:41.387408 IP node4.43211 > node4.42581: UDP, length 113
03:18:41.387806 IP node4.50209 > node4.42581: UDP, length 113
03:18:41.388396 IP node4.52495 > node4.42581: UDP, length 113
03:18:41.388981 IP node4.38585 > node4.42581: UDP, length 112
03:18:41.390103 IP node4.42769 > node4.42581: UDP, length 113
03:18:41.391586 IP node4.50849 > node4.42581: UDP, length 113
03:18:41.582691 IP node4.52656 > node4.50209: UDP, length 113
03:18:41.582909 IP node4.42769 > node4.50209: UDP, length 113
03:18:41.583469 IP node4.44881 > node4.50209: UDP, length 112
03:18:41.583769 IP node4.56064 > node4.50209: UDP, length 112
03:18:41.584561 IP node4.38296 > node4.50209: UDP, length 113
03:18:41.584690 IP node4.33103 > node4.50209: UDP, length 112
03:18:41.585626 IP node4.58818 > node4.50209: UDP, length 112
03:18:41.585793 IP node4.42010 > node4.50209: UDP, length 112
03:18:41.586596 IP node4.50849 > node4.50209: UDP, length 113
03:18:41.587200 IP node4.54313 > node4.50209: UDP, length 113
03:18:41.587404 IP node4.54807 > node4.50209: UDP, length 113
03:18:41.587465 IP node4.42687 > node4.50209: UDP, length 113
03:18:41.587867 IP node4.38585 > node4.50209: UDP, length 112
03:18:41.588140 IP node4.41947 > node4.50209: UDP, length 113
03:18:41.588625 IP node4.35965 > node4.50209: UDP, length 113
03:18:41.588867 IP node4.57668 > node4.50209: UDP, length 112
03:18:41.588994 IP node4.51437 > node4.50209: UDP, length 113
03:18:41.589100 IP node4.52495 > node4.50209: UDP, length 113
03:18:41.589845 IP node4.52656 > node4.51437: UDP, length 113
03:18:41.590864 IP node4.42769 > node4.51437: UDP, length 113
03:18:41.591041 IP node4.42010 > node4.51437: UDP, length 112
03:18:41.591854 IP node4.42581 > node4.50209: UDP, length 113
03:18:41.592172 IP node4.35965 > node4.51437: UDP, length 113
03:18:41.593590 IP node4.58818 > node4.51437: UDP, length 112
03:18:41.593903 IP node4.38406 > node4.50209: UDP, length 113
03:18:41.594574 IP node4.33946 > node4.50209: UDP, length 113
03:18:41.594617 IP node4.33946 > node4.51437: UDP, length 113
03:18:41.594673 IP node4.33103 > node4.51437: UDP, length 112
03:18:41.594842 IP node4.52495 > node4.51437: UDP, length 113
03:18:41.595047 IP node4.58599 > node4.50209: UDP, length 113
03:18:41.595161 IP node4.58599 > node4.51437: UDP, length 113
03:18:41.595590 IP node4.41947 > node4.51437: UDP, length 113
03:18:41.597288 IP node4.38296 > node4.51437: UDP, length 113
03:18:41.597458 IP node4.42581 > node4.51437: UDP, length 113
03:18:41.597600 IP node4.44881 > node4.51437: UDP, length 112
03:18:41.597810 IP node4.50849 > node4.51437: UDP, length 113
03:18:41.598162 IP node4.56064 > node4.51437: UDP, length 112
03:18:41.598366 IP node4.54807 > node4.51437: UDP, length 113
03:18:41.598505 IP node4.42687 > node4.51437: UDP, length 113
03:18:41.598803 IP node4.38406 > node4.51437: UDP, length 113
03:18:41.599253 IP node4.50209 > node4.51437: UDP, length 113
03:18:41.599539 IP node4.40739 > node4.50209: UDP, length 112
03:18:41.599580 IP node4.40739 > node4.51437: UDP, length 112
03:18:41.599809 IP node4.54313 > node4.51437: UDP, length 113
03:18:41.600019 IP node4.38585 > node4.51437: UDP, length 112
03:18:41.600218 IP node4.57668 > node4.51437: UDP, length 112
03:18:41.602371 IP node4.43211 > node4.50209: UDP, length 113
03:18:41.602676 IP node4.43211 > node4.51437: UDP, length 113
03:18:41.638579 IP node4.38406 > node4.54807: UDP, length 113
03:18:41.639912 IP node4.41947 > node4.54807: UDP, length 113
03:18:41.640036 IP node4.50209 > node4.54807: UDP, length 113
03:18:41.640099 IP node4.44881 > node4.54807: UDP, length 112
03:18:41.640367 IP node4.50849 > node4.54807: UDP, length 113
03:18:41.640904 IP node4.40739 > node4.54807: UDP, length 112
03:18:41.641149 IP node4.57668 > node4.54807: UDP, length 112
03:18:41.641303 IP node4.38296 > node4.54807: UDP, length 113
03:18:41.641438 IP node4.51437 > node4.54807: UDP, length 113
03:18:41.641461 IP node4.52656 > node4.54807: UDP, length 113
03:18:41.641632 IP node4.43211 > node4.54807: UDP, length 113
03:18:41.643326 IP node4.33103 > node4.54807: UDP, length 112
03:18:41.643498 IP node4.52495 > node4.54807: UDP, length 113
03:18:41.643997 IP node4.38585 > node4.54807: UDP, length 112
03:18:41.644452 IP node4.33946 > node4.54807: UDP, length 113
03:18:41.645165 IP node4.56064 > node4.54807: UDP, length 112
03:18:41.645379 IP node4.58599 > node4.54807: UDP, length 113
03:18:41.645803 IP node4.42687 > node4.54807: UDP, length 113
03:18:41.646550 IP node4.42769 > node4.54807: UDP, length 113
03:18:41.646961 IP node4.42010 > node4.54807: UDP, length 112
03:18:41.647225 IP node4.54313 > node4.54807: UDP, length 113
03:18:41.647449 IP node4.42581 > node4.54807: UDP, length 113
03:18:41.647607 IP node4.58818 > node4.54807: UDP, length 112
03:18:41.648458 IP node4.35965 > node4.54807: UDP, length 113
03:18:41.673506 IP node4.52656 > node4.38406: UDP, length 113
03:18:41.674639 IP node4.40739 > node4.38406: UDP, length 112
03:18:41.675198 IP node4.50849 > node4.38406: UDP, length 113
03:18:41.675217 IP node4.51437 > node4.38406: UDP, length 113
03:18:41.675386 IP node4.41947 > node4.38406: UDP, length 113
03:18:41.675436 IP node4.44881 > node4.38406: UDP, length 112
03:18:41.676047 IP node4.35965 > node4.42769: UDP, length 113
03:18:41.676097 IP node4.35965 > node4.38406: UDP, length 113
03:18:41.676802 IP node4.42581 > node4.42769: UDP, length 113
03:18:41.676837 IP node4.42581 > node4.38406: UDP, length 113
03:18:41.677059 IP node4.52656 > node4.42769: UDP, length 113
03:18:41.678025 IP node4.54807 > node4.42769: UDP, length 113
03:18:41.678060 IP node4.54807 > node4.38406: UDP, length 113
03:18:41.679074 IP node4.58599 > node4.42769: UDP, length 113
03:18:41.679150 IP node4.58599 > node4.38406: UDP, length 113
03:18:41.679179 IP node4.40739 > node4.42769: UDP, length 112
03:18:41.679536 IP node4.50849 > node4.42769: UDP, length 113
03:18:41.679672 IP node4.44881 > node4.42769: UDP, length 112
03:18:41.680019 IP node4.33946 > node4.42769: UDP, length 113
03:18:41.680050 IP node4.33946 > node4.38406: UDP, length 113
03:18:41.680971 IP node4.56064 > node4.42769: UDP, length 112
03:18:41.681008 IP node4.56064 > node4.38406: UDP, length 112
03:18:41.681368 IP node4.54313 > node4.42769: UDP, length 113
03:18:41.681571 IP node4.54313 > node4.38406: UDP, length 113
03:18:41.682034 IP node4.38406 > node4.42769: UDP, length 113
03:18:41.682505 IP node4.41947 > node4.42769: UDP, length 113
03:18:41.683063 IP node4.51437 > node4.42769: UDP, length 113
03:18:41.683240 IP node4.42769 > node4.38406: UDP, length 113
03:18:41.688787 IP node4.50209 > node4.38406: UDP, length 113
03:18:41.689896 IP node4.42010 > node4.42769: UDP, length 112
03:18:41.689935 IP node4.42010 > node4.38406: UDP, length 112
03:18:41.693991 IP node4.58818 > node4.42769: UDP, length 112
03:18:41.694060 IP node4.58818 > node4.38406: UDP, length 112
03:18:41.696476 IP node4.38585 > node4.42769: UDP, length 112
03:18:41.696518 IP node4.38585 > node4.38406: UDP, length 112
03:18:41.700114 IP node4.52495 > node4.42769: UDP, length 113
03:18:41.700151 IP node4.52495 > node4.38406: UDP, length 113
03:18:41.703957 IP node4.33103 > node4.42769: UDP, length 112
03:18:41.703989 IP node4.33103 > node4.38406: UDP, length 112
03:18:41.704174 IP node4.50209 > node4.42769: UDP, length 113
03:18:41.706073 IP node4.42687 > node4.42769: UDP, length 113
03:18:41.706115 IP node4.42687 > node4.38406: UDP, length 113
03:18:41.712246 IP node4.38296 > node4.42769: UDP, length 113
03:18:41.712326 IP node4.38296 > node4.38406: UDP, length 113
03:18:41.732550 IP node4.43211 > node4.42769: UDP, length 113
03:18:41.732654 IP node4.43211 > node4.38406: UDP, length 113
03:18:41.749801 IP node4.57668 > node4.42769: UDP, length 112
03:18:41.749996 IP node4.57668 > node4.38406: UDP, length 112
03:18:41.764052 IP node4.38585 > node4.33103: UDP, length 112
03:18:41.764588 IP node4.40739 > node4.33103: UDP, length 112
03:18:41.765332 IP node4.44881 > node4.33103: UDP, length 112
03:18:41.765767 IP node4.52656 > node4.33103: UDP, length 113
03:18:41.766087 IP node4.43211 > node4.33103: UDP, length 113
03:18:41.766869 IP node4.50209 > node4.33103: UDP, length 113
03:18:41.767087 IP node4.56064 > node4.33103: UDP, length 112
03:18:41.767433 IP node4.38406 > node4.33103: UDP, length 113
03:18:41.767640 IP node4.42687 > node4.33103: UDP, length 113
03:18:41.768116 IP node4.35965 > node4.33103: UDP, length 113
03:18:41.768808 IP node4.57668 > node4.33103: UDP, length 112
03:18:41.769103 IP node4.42769 > node4.33103: UDP, length 113
03:18:41.769274 IP node4.51437 > node4.33103: UDP, length 113
03:18:41.770623 IP node4.33946 > node4.33103: UDP, length 113
03:18:41.771506 IP node4.54807 > node4.33103: UDP, length 113
03:18:41.771913 IP node4.42581 > node4.33103: UDP, length 113
03:18:41.772432 IP node4.42010 > node4.33103: UDP, length 112
03:18:41.773918 IP node4.38296 > node4.33103: UDP, length 113
03:18:41.774054 IP node4.52495 > node4.33103: UDP, length 113
03:18:41.775061 IP node4.41947 > node4.33103: UDP, length 113
03:18:41.775518 IP node4.58818 > node4.33103: UDP, length 112
03:18:41.776674 IP node4.54313 > node4.33103: UDP, length 113
03:18:41.777572 IP node4.58599 > node4.33103: UDP, length 113
03:18:41.777728 IP node4.50849 > node4.33103: UDP, length 113
03:18:41.816015 IP node4.54313 > node4.52495: UDP, length 113
03:18:41.817652 IP node4.52656 > node4.52495: UDP, length 113
03:18:41.819740 IP node4.50849 > node4.52495: UDP, length 113
03:18:41.820678 IP node4.38585 > node4.52495: UDP, length 112
03:18:41.820986 IP node4.43211 > node4.52495: UDP, length 113
03:18:41.821309 IP node4.44881 > node4.52495: UDP, length 112
03:18:41.821934 IP node4.35965 > node4.52495: UDP, length 113
03:18:41.821957 IP node4.40739 > node4.52495: UDP, length 112
03:18:41.822513 IP node4.33946 > node4.52495: UDP, length 113
03:18:41.824829 IP node4.50209 > node4.52495: UDP, length 113
03:18:41.830044 IP node4.54807 > node4.52495: UDP, length 113
03:18:41.830387 IP node4.42769 > node4.52495: UDP, length 113
03:18:41.831109 IP node4.42010 > node4.52495: UDP, length 112
03:18:41.831543 IP node4.42687 > node4.52495: UDP, length 113
03:18:41.832377 IP node4.57668 > node4.52495: UDP, length 112
03:18:41.833395 IP node4.42581 > node4.52495: UDP, length 113
03:18:41.834559 IP node4.58818 > node4.52495: UDP, length 112
03:18:41.836646 IP node4.33103 > node4.52495: UDP, length 112
03:18:41.841900 IP node4.58599 > node4.52495: UDP, length 113
03:18:41.843414 IP node4.51437 > node4.52495: UDP, length 113
03:18:41.845827 IP node4.38296 > node4.52495: UDP, length 113
03:18:41.846283 IP node4.41947 > node4.52495: UDP, length 113
03:18:41.849765 IP node4.56064 > node4.52495: UDP, length 112
03:18:41.853635 IP node4.38406 > node4.52495: UDP, length 113
03:18:42.016633 IP node4.42010 > node4.33946: UDP, length 112
03:18:42.017615 IP node4.58818 > node4.33946: UDP, length 112
03:18:42.019096 IP node4.35965 > node4.33946: UDP, length 113
03:18:42.019225 IP node4.58599 > node4.33946: UDP, length 113
03:18:42.019326 IP node4.43211 > node4.33946: UDP, length 113
03:18:42.019357 IP node4.44881 > node4.33946: UDP, length 112
03:18:42.019568 IP node4.50209 > node4.33946: UDP, length 113
03:18:42.019724 IP node4.42687 > node4.33946: UDP, length 113
03:18:42.020340 IP node4.42581 > node4.33946: UDP, length 113
03:18:42.020824 IP node4.52656 > node4.33946: UDP, length 113
03:18:42.020875 IP node4.57668 > node4.33946: UDP, length 112
03:18:42.021413 IP node4.38406 > node4.33946: UDP, length 113
03:18:42.021693 IP node4.52495 > node4.33946: UDP, length 113
03:18:42.021861 IP node4.51437 > node4.33946: UDP, length 113
03:18:42.022011 IP node4.33103 > node4.33946: UDP, length 112
03:18:42.022178 IP node4.54807 > node4.33946: UDP, length 113
03:18:42.022977 IP node4.42769 > node4.33946: UDP, length 113
03:18:42.023132 IP node4.40739 > node4.33946: UDP, length 112
03:18:42.024388 IP node4.56064 > node4.33946: UDP, length 112
03:18:42.025327 IP node4.38296 > node4.33946: UDP, length 113
03:18:42.036694 IP node4.54313 > node4.33946: UDP, length 113
03:18:42.037171 IP node4.50849 > node4.33946: UDP, length 113
03:18:42.089024 IP node4.41947 > node4.33946: UDP, length 113
03:18:42.166242 IP node4.38585 > node4.33946: UDP, length 112

