03:18:37.610496 IP node3.35778 > node3.36712: UDP, length 113
03:18:37.620106 IP node3.59829 > node3.35778: UDP, length 113
03:18:37.620665 IP node3.59829 > node3.36712: UDP, length 113
03:18:37.670002 IP node3.35778 > node3.59829: UDP, length 113
03:18:37.715478 IP node3.36712 > node3.35778: UDP, length 113
03:18:37.715750 IP node3.36712 > node3.59829: UDP, length 113
03:18:37.882548 IP node3.59829 > node3.45962: UDP, length 113
03:18:37.883757 IP node3.35778 > node3.45962: UDP, length 113
03:18:37.884864 IP node3.36712 > node3.45962: UDP, length 113
03:18:38.061609 IP node3.45962 > node3.36712: UDP, length 113
03:18:38.062743 IP node3.45962 > node3.35778: UDP, length 113
03:18:38.070542 IP node3.36712 > node3.48961: UDP, length 113
03:18:38.070679 IP node3.59829 > node3.48961: UDP, length 113
03:18:38.071114 IP node3.35778 > node3.48961: UDP, length 113
03:18:38.092950 IP node3.45962 > node3.48961: UDP, length 113
03:18:38.099146 IP node3.45962 > node3.59829: UDP, length 113
03:18:38.152454 IP node3.36712 > node3.54133: UDP, length 113
03:18:38.153659 IP node3.35778 > node3.54133: UDP, length 113
03:18:38.154324 IP node3.59829 > node3.54133: UDP, length 113
03:18:38.156871 IP node3.45962 > node3.54133: UDP, length 113
03:18:38.227164 IP node3.48961 > node3.45962: UDP, length 113
03:18:38.229940 IP node3.48961 > node3.54133: UDP, length 113
03:18:38.256786 IP node3.54133 > node3.36712: UDP, length 113
03:18:38.340587 IP node3.54133 > node3.59829: UDP, length 113
03:18:38.345751 IP node3.54133 > node3.48961: UDP, length 113
03:18:38.346924 IP node3.54133 > node3.45962: UDP, length 113
03:18:38.410078 IP node3.36712 > node3.39872: UDP, length 113
03:18:38.411667 IP node3.45962 > node3.39872: UDP, length 113
03:18:38.411901 IP node3.59829 > node3.39872: UDP, length 113
03:18:38.412965 IP node3.35778 > node3.39872: UDP, length 113
03:18:38.414653 IP node3.48961 > node3.39872: UDP, length 113
03:18:38.423604 IP node3.54133 > node3.39872: UDP, length 113
03:18:38.434886 IP node3.39872 > node3.45962: UDP, length 113
03:18:38.435311 IP node3.39872 > node3.54133: UDP, length 113
03:18:38.435598 IP node3.39872 > node3.48961: UDP, length 113
03:18:38.452834 IP node3.36712 > node3.45327: UDP, length 113
03:18:38.453923 IP node3.59829 > node3.45327: UDP, length 113
03:18:38.454241 IP node3.35778 > node3.45327: UDP, length 113
03:18:38.455133 IP node3.45962 > node3.45327: UDP, length 113
03:18:38.457346 IP node3.48961 > node3.45327: UDP, length 113
03:18:38.459658 IP node3.54133 > node3.45327: UDP, length 113
03:18:38.496941 IP node3.45327 > node3.39872: UDP, length 113
03:18:38.497335 IP node3.45327 > node3.45962: UDP, length 113
03:18:38.497784 IP node3.45327 > node3.54133: UDP, length 113
03:18:38.498027 IP node3.45327 > node3.48961: UDP, length 113
03:18:38.521008 IP node3.39872 > node3.45327: UDP, length 113
03:18:38.559451 IP node3.48961 > node3.34875: UDP, length 113
03:18:38.559762 IP node3.35778 > node3.34875: UDP, length 113
03:18:38.561395 IP node3.59829 > node3.34875: UDP, length 113
03:18:38.566239 IP node3.45962 > node3.34875: UDP, length 113
03:18:38.569102 IP node3.36712 > node3.34875: UDP, length 113
03:18:38.576406 IP node3.54133 > node3.34875: UDP, length 113
03:18:38.578170 IP node3.39872 > node3.34875: UDP, length 113
03:18:38.586003 IP node3.45327 > node3.34875: UDP, length 113
03:18:38.621086 IP node3.39872 > node3.47016: UDP, length 113
03:18:38.625966 IP node3.45962 > node3.47016: UDP, length 113
03:18:38.627775 IP node3.59829 > node3.47016: UDP, length 113
03:18:38.627890 IP node3.48961 > node3.47016: UDP, length 113
03:18:38.628717 IP node3.36712 > node3.47016: UDP, length 113
03:18:38.629951 IP node3.35778 > node3.47016: UDP, length 113
03:18:38.632168 IP node3.54133 > node3.47016: UDP, length 113
03:18:38.645490 IP node3.47016 > node3.45962: UDP, length 113
03:18:38.650893 IP node3.47016 > node3.54133: UDP, length 113
03:18:38.651053 IP node3.47016 > node3.48961: UDP, length 113
03:18:38.655039 IP node3.47016 > node3.39872: UDP, length 113
03:18:38.656228 IP node3.47016 > node3.45327: UDP, length 113
03:18:38.661187 IP node3.45327 > node3.47016: UDP, length 113
03:18:38.662843 IP node3.47016 > node3.34875: UDP, length 113
03:18:38.719284 IP node3.34875 > node3.48961: UDP, length 113
03:18:38.719582 IP node3.34875 > node3.54133: UDP, length 113
03:18:38.720320 IP node3.34875 > node3.39872: UDP, length 113
03:18:38.720407 IP node3.34875 > node3.45327: UDP, length 113
03:18:38.753336 IP node3.34875 > node3.47016: UDP, length 113
03:18:38.904598 IP node3.45962 > node3.54995: UDP, length 113
03:18:38.906997 IP node3.45327 > node3.54995: UDP, length 113
03:18:38.907829 IP node3.48961 > node3.54995: UDP, length 113
03:18:38.909799 IP node3.47016 > node3.54995: UDP, length 113
03:18:38.910087 IP node3.34875 > node3.54995: UDP, length 113
03:18:38.910515 IP node3.59829 > node3.54995: UDP, length 113
03:18:38.910846 IP node3.36712 > node3.54995: UDP, length 113
03:18:38.911334 IP node3.54133 > node3.54995: UDP, length 113
03:18:38.914443 IP node3.45962 > node3.51519: UDP, length 113
03:18:38.918320 IP node3.59829 > node3.51519: UDP, length 113
03:18:38.919313 IP node3.45327 > node3.51519: UDP, length 113
03:18:38.921289 IP node3.48961 > node3.51519: UDP, length 113
03:18:38.922565 IP node3.35778 > node3.51519: UDP, length 113
03:18:38.924471 IP node3.39872 > node3.54995: UDP, length 113
03:18:38.925445 IP node3.47016 > node3.51519: UDP, length 113
03:18:38.926976 IP node3.54133 > node3.51519: UDP, length 113
03:18:38.927875 IP node3.35778 > node3.54995: UDP, length 113
03:18:38.929404 IP node3.36712 > node3.51519: UDP, length 113
03:18:38.930267 IP node3.34875 > node3.51519: UDP, length 113
03:18:38.930456 IP node3.39872 > node3.51519: UDP, length 113
03:18:38.974575 IP node3.52820 > node3.39872: UDP, length 113
03:18:38.974647 IP node3.52820 > node3.47016: UDP, length 113
03:18:38.975160 IP node3.52820 > node3.54995: UDP, length 113
03:18:38.975363 IP node3.35778 > node3.52820: UDP, length 113
03:18:38.975366 IP node3.52820 > node3.51519: UDP, length 113
03:18:38.975429 IP node3.52820 > node3.45327: UDP, length 113
03:18:38.975882 IP node3.52820 > node3.34875: UDP, length 113
03:18:38.979168 IP node3.39872 > node3.52820: UDP, length 113
03:18:38.979968 IP node3.45962 > node3.52820: UDP, length 113
03:18:38.981536 IP node3.36712 > node3.52820: UDP, length 113
03:18:38.982008 IP node3.47016 > node3.52820: UDP, length 113
03:18:38.983015 IP node3.48961 > node3.52820: UDP, length 113
03:18:38.983110 IP node3.34875 > node3.52820: UDP, length 113
03:18:38.983732 IP node3.59829 > node3.52820: UDP, length 113
03:18:38.984859 IP node3.54133 > node3.52820: UDP, length 113
03:18:38.985871 IP node3.45327 > node3.52820: UDP, length 113
03:18:38.986432 IP node3.54995 > node3.39872: UDP, length 113
03:18:38.988182 IP node3.54995 > node3.45327: UDP, length 113
03:18:38.993048 IP node3.54995 > node3.34875: UDP, length 113
03:18:38.993896 IP node3.54995 > node3.47016: UDP, length 113
03:18:38.997536 IP node3.33254 > node3.39872: UDP, length 113
03:18:38.999450 IP node3.33254 > node3.45327: UDP, length 113
03:18:39.004046 IP node3.47016 > node3.33254: UDP, length 113
03:18:39.005431 IP node3.39872 > node3.33254: UDP, length 113
03:18:39.006904 IP node3.48961 > node3.33254: UDP, length 113
03:18:39.007343 IP node3.45962 > node3.33254: UDP, length 113
03:18:39.008708 IP node3.36712 > node3.33254: UDP, length 113
03:18:39.009243 IP node3.33254 > node3.47016: UDP, length 113
03:18:39.009253 IP node3.34875 > node3.33254: UDP, length 113
03:18:39.009697 IP node3.33254 > node3.34875: UDP, length 113
03:18:39.012217 IP node3.35778 > node3.33254: UDP, length 113
03:18:39.013946 IP node3.59829 > node3.33254: UDP, length 113
03:18:39.016588 IP node3.33254 > node3.54995: UDP, length 113
03:18:39.017090 IP node3.33254 > node3.51519: UDP, length 113
03:18:39.017840 IP node3.33254 > node3.52820: UDP, length 113
03:18:39.018425 IP node3.54133 > node3.33254: UDP, length 113
03:18:39.019839 IP node3.45327 > node3.33254: UDP, length 113
03:18:39.117916 IP node3.52820 > node3.33254: UDP, length 113
03:18:39.127854 IP node3.51519 > node3.39872: UDP, length 113
03:18:39.128099 IP node3.51519 > node3.45327: UDP, length 113
03:18:39.128993 IP node3.51519 > node3.34875: UDP, length 113
03:18:39.129215 IP node3.51519 > node3.47016: UDP, length 113
03:18:39.135044 IP node3.51519 > node3.54995: UDP, length 113
03:18:39.136052 IP node3.51519 > node3.52820: UDP, length 113
03:18:39.137250 IP node3.51519 > node3.33254: UDP, length 113
03:18:39.177223 IP node3.51519 > node3.46934: UDP, length 113
03:18:39.177326 IP node3.35778 > node3.46934: UDP, length 113
03:18:39.179426 IP node3.45962 > node3.46934: UDP, length 113
03:18:39.180031 IP node3.39872 > node3.46934: UDP, length 113
03:18:39.180744 IP node3.59829 > node3.46934: UDP, length 113
03:18:39.181147 IP node3.48961 > node3.46934: UDP, length 113
03:18:39.181625 IP node3.47016 > node3.46934: UDP, length 113
03:18:39.181843 IP node3.54133 > node3.46934: UDP, length 113
03:18:39.181846 IP node3.45327 > node3.46934: UDP, length 113
03:18:39.182819 IP node3.34875 > node3.46934: UDP, length 113
03:18:39.182896 IP node3.36712 > node3.46934: UDP, length 113
03:18:39.185064 IP node3.54995 > node3.51519: UDP, length 113
03:18:39.188668 IP node3.54995 > node3.33254: UDP, length 113
03:18:39.190363 IP node3.54995 > node3.46934: UDP, length 113
03:18:39.213031 IP node3.33254 > node3.46934: UDP, length 113
03:18:39.216185 IP node3.54995 > node3.52820: UDP, length 113
03:18:39.218930 IP node3.52820 > node3.46934: UDP, length 113
03:18:39.230621 IP node3.47016 > node3.54317: UDP, length 113
03:18:39.231310 IP node3.48961 > node3.54317: UDP, length 113
03:18:39.231848 IP node3.45962 > node3.54317: UDP, length 113
03:18:39.233075 IP node3.45327 > node3.54317: UDP, length 113
03:18:39.233586 IP node3.51519 > node3.54317: UDP, length 113
03:18:39.234994 IP node3.39872 > node3.54317: UDP, length 113
03:18:39.236544 IP node3.54133 > node3.54317: UDP, length 113
03:18:39.236789 IP node3.36712 > node3.54317: UDP, length 113
03:18:39.237013 IP node3.35778 > node3.54317: UDP, length 113
03:18:39.237312 IP node3.59829 > node3.54317: UDP, length 113
03:18:39.237862 IP node3.34875 > node3.54317: UDP, length 113
03:18:39.240188 IP node3.54995 > node3.54317: UDP, length 113
03:18:39.240642 IP node3.33254 > node3.54317: UDP, length 113
03:18:39.269619 IP node3.45122 > node3.39872: UDP, length 113
03:18:39.270150 IP node3.45122 > node3.47016: UDP, length 113
03:18:39.270145 IP node3.52820 > node3.54317: UDP, length 113
03:18:39.270396 IP node3.45122 > node3.45327: UDP, length 113
03:18:39.270549 IP node3.45122 > node3.34875: UDP, length 113
03:18:39.270826 IP node3.52820 > node3.45122: UDP, length 113
03:18:39.271152 IP node3.45122 > node3.54995: UDP, length 113
03:18:39.271362 IP node3.45122 > node3.51519: UDP, length 113
03:18:39.271416 IP node3.45122 > node3.54317: UDP, length 113
03:18:39.271972 IP node3.45122 > node3.46934: UDP, length 113
03:18:39.272013 IP node3.45122 > node3.52820: UDP, length 113
03:18:39.272096 IP node3.35778 > node3.45122: UDP, length 113
03:18:39.274608 IP node3.48961 > node3.45122: UDP, length 113
03:18:39.274996 IP node3.34875 > node3.45122: UDP, length 113
03:18:39.275179 IP node3.45327 > node3.45122: UDP, length 113
03:18:39.275218 IP node3.39872 > node3.45122: UDP, length 113
03:18:39.275376 IP node3.45962 > node3.45122: UDP, length 113
03:18:39.275600 IP node3.51519 > node3.45122: UDP, length 113
03:18:39.276182 IP node3.45122 > node3.33254: UDP, length 113
03:18:39.278148 IP node3.47016 > node3.45122: UDP, length 113
03:18:39.278813 IP node3.33254 > node3.45122: UDP, length 113
03:18:39.279671 IP node3.54133 > node3.45122: UDP, length 113
03:18:39.279955 IP node3.36712 > node3.45122: UDP, length 113
03:18:39.280111 IP node3.59829 > node3.45122: UDP, length 113
03:18:39.284539 IP node3.54995 > node3.45122: UDP, length 113
03:18:39.306126 IP node3.46934 > node3.45327: UDP, length 113
03:18:39.306893 IP node3.46934 > node3.34875: UDP, length 113
03:18:39.307294 IP node3.46934 > node3.47016: UDP, length 113
03:18:39.312656 IP node3.46934 > node3.54995: UDP, length 113
03:18:39.313028 IP node3.46934 > node3.51519: UDP, length 113
03:18:39.313453 IP node3.46934 > node3.52820: UDP, length 113
03:18:39.314163 IP node3.46934 > node3.33254: UDP, length 113
03:18:39.354582 IP node3.46934 > node3.54317: UDP, length 113
03:18:39.379095 IP node3.46934 > node3.45122: UDP, length 113
03:18:39.386149 IP node3.54317 > node3.54995: UDP, length 113
03:18:39.386229 IP node3.54317 > node3.51519: UDP, length 113
03:18:39.400706 IP node3.54317 > node3.52820: UDP, length 113
03:18:39.400990 IP node3.54317 > node3.33254: UDP, length 113
03:18:39.401322 IP node3.54317 > node3.46934: UDP, length 113
03:18:39.401881 IP node3.54317 > node3.45122: UDP, length 113
03:18:39.414515 IP node3.47016 > node3.40893: UDP, length 113
03:18:39.415393 IP node3.34875 > node3.40893: UDP, length 113
03:18:39.415447 IP node3.45962 > node3.40893: UDP, length 113
03:18:39.416671 IP node3.54995 > node3.40893: UDP, length 113
03:18:39.417119 IP node3.33254 > node3.40893: UDP, length 113
03:18:39.417233 IP node3.45327 > node3.40893: UDP, length 113
03:18:39.417321 IP node3.36712 > node3.40893: UDP, length 113
03:18:39.417788 IP node3.39872 > node3.40893: UDP, length 113
03:18:39.418965 IP node3.35778 > node3.40893: UDP, length 113
03:18:39.419664 IP node3.59829 > node3.40893: UDP, length 113
03:18:39.420095 IP node3.52820 > node3.40893: UDP, length 113
03:18:39.421770 IP node3.54133 > node3.40893: UDP, length 113
03:18:39.423348 IP node3.51519 > node3.40893: UDP, length 113
03:18:39.424886 IP node3.48961 > node3.40893: UDP, length 113
03:18:39.430685 IP node3.45122 > node3.40893: UDP, length 113
03:18:39.431160 IP node3.54317 > node3.40893: UDP, length 113
03:18:39.437227 IP node3.46934 > node3.40893: UDP, length 113
03:18:39.645146 IP node3.40893 > node3.52820: UDP, length 113
03:18:39.645227 IP node3.40893 > node3.51519: UDP, length 113
03:18:39.645288 IP node3.40893 > node3.33254: UDP, length 113
03:18:39.646573 IP node3.40893 > node3.46934: UDP, length 113
03:18:39.707886 IP node3.40893 > node3.54317: UDP, length 113
03:18:39.708255 IP node3.40893 > node3.45122: UDP, length 113
03:18:39.735444 IP node3.34875 > node3.39110: UDP, length 113
03:18:39.740139 IP node3.59829 > node3.39110: UDP, length 113
03:18:39.740792 IP node3.46934 > node3.39110: UDP, length 113
03:18:39.741007 IP node3.54995 > node3.39110: UDP, length 113
03:18:39.741181 IP node3.48961 > node3.39110: UDP, length 113
03:18:39.741604 IP node3.36712 > node3.39110: UDP, length 113
03:18:39.743442 IP node3.35778 > node3.39110: UDP, length 113
03:18:39.743798 IP node3.45962 > node3.39110: UDP, length 113
03:18:39.744135 IP node3.45327 > node3.39110: UDP, length 113
03:18:39.744161 IP node3.54133 > node3.39110: UDP, length 113
03:18:39.744513 IP node3.47016 > node3.39110: UDP, length 113
03:18:39.744814 IP node3.52820 > node3.39110: UDP, length 113
03:18:39.747766 IP node3.54317 > node3.39110: UDP, length 113
03:18:39.748539 IP node3.45122 > node3.39110: UDP, length 113
03:18:39.748779 IP node3.33254 > node3.39110: UDP, length 113
03:18:39.751737 IP node3.51519 > node3.39110: UDP, length 113
03:18:39.752574 IP node3.39872 > node3.39110: UDP, length 113
03:18:39.771589 IP node3.56877 > node3.46934: UDP, length 113
03:18:39.774366 IP node3.56877 > node3.54317: UDP, length 113
03:18:39.775300 IP node3.56877 > node3.45122: UDP, length 113
03:18:39.781400 IP node3.54317 > node3.56877: UDP, length 113
03:18:39.784044 IP node3.54995 > node3.56877: UDP, length 113
03:18:39.786682 IP node3.52820 > node3.56877: UDP, length 113
03:18:39.786727 IP node3.48961 > node3.56877: UDP, length 113
03:18:39.786911 IP node3.54133 > node3.56877: UDP, length 113
03:18:39.788696 IP node3.56877 > node3.40893: UDP, length 113
03:18:39.789871 IP node3.36712 > node3.56877: UDP, length 113
03:18:39.791429 IP node3.35778 > node3.56877: UDP, length 113
03:18:39.791684 IP node3.56877 > node3.39110: UDP, length 113
03:18:39.793016 IP node3.51519 > node3.56877: UDP, length 113
03:18:39.795062 IP node3.59829 > node3.56877: UDP, length 113
03:18:39.795970 IP node3.51519 > node3.48650: UDP, length 113
03:18:39.796063 IP node3.54317 > node3.48650: UDP, length 113
03:18:39.797621 IP node3.48961 > node3.48650: UDP, length 113
03:18:39.797738 IP node3.52820 > node3.48650: UDP, length 113
03:18:39.797800 IP node3.36712 > node3.48650: UDP, length 113
03:18:39.798586 IP node3.54133 > node3.48650: UDP, length 113
03:18:39.801765 IP node3.35778 > node3.48650: UDP, length 113
03:18:39.801842 IP node3.34875 > node3.56877: UDP, length 113
03:18:39.801854 IP node3.54995 > node3.48650: UDP, length 113
03:18:39.803015 IP node3.59829 > node3.48650: UDP, length 113
03:18:39.803704 IP node3.34875 > node3.48650: UDP, length 113
03:18:39.805517 IP node3.47016 > node3.56877: UDP, length 113
03:18:39.805582 IP node3.47016 > node3.48650: UDP, length 113
03:18:39.808193 IP node3.46934 > node3.48650: UDP, length 113
03:18:39.817042 IP node3.45962 > node3.48650: UDP, length 113
03:18:39.821217 IP node3.45962 > node3.56877: UDP, length 113
03:18:39.825943 IP node3.48650 > node3.45122: UDP, length 113
03:18:39.826559 IP node3.48650 > node3.40893: UDP, length 113
03:18:39.829092 IP node3.39872 > node3.56877: UDP, length 113
03:18:39.829187 IP node3.39872 > node3.48650: UDP, length 113
03:18:39.829867 IP node3.33254 > node3.56877: UDP, length 113
03:18:39.829867 IP node3.33254 > node3.48650: UDP, length 113
03:18:39.830114 IP node3.45327 > node3.56877: UDP, length 113
03:18:39.830182 IP node3.45327 > node3.48650: UDP, length 113
03:18:39.835571 IP node3.46934 > node3.56877: UDP, length 113
03:18:39.837904 IP node3.45122 > node3.48650: UDP, length 113
03:18:39.840320 IP node3.45122 > node3.56877: UDP, length 113
03:18:39.855099 IP node3.40893 > node3.39110: UDP, length 113
03:18:39.880436 IP node3.56877 > node3.48650: UDP, length 113
03:18:39.909185 IP node3.48650 > node3.39110: UDP, length 113
03:18:39.911168 IP node3.48650 > node3.56877: UDP, length 113
03:18:39.914951 IP node3.33254 > node3.35360: UDP, length 113
03:18:39.916389 IP node3.46934 > node3.35360: UDP, length 113
03:18:39.916948 IP node3.54317 > node3.35360: UDP, length 113
03:18:39.917124 IP node3.45122 > node3.35360: UDP, length 113
03:18:39.917841 IP node3.34875 > node3.35360: UDP, length 113
03:18:39.918782 IP node3.48961 > node3.35360: UDP, length 113
03:18:39.918942 IP node3.56877 > node3.35360: UDP, length 113
03:18:39.919343 IP node3.45327 > node3.35360: UDP, length 113
03:18:39.920519 IP node3.39872 > node3.35360: UDP, length 113
03:18:39.924022 IP node3.51519 > node3.35360: UDP, length 113
03:18:39.924225 IP node3.47016 > node3.35360: UDP, length 113
03:18:39.924465 IP node3.45962 > node3.35360: UDP, length 113
03:18:39.925127 IP node3.36712 > node3.35360: UDP, length 113
03:18:39.925249 IP node3.35778 > node3.35360: UDP, length 113
03:18:39.928644 IP node3.54133 > node3.35360: UDP, length 113
03:18:39.928764 IP node3.59829 > node3.35360: UDP, length 113
03:18:39.929988 IP node3.52820 > node3.35360: UDP, length 113
03:18:39.930914 IP node3.40893 > node3.48650: UDP, length 113
03:18:39.932596 IP node3.54995 > node3.35360: UDP, length 113
03:18:39.933999 IP node3.40893 > node3.56877: UDP, length 113
03:18:39.938228 IP node3.40893 > node3.35360: UDP, length 113
03:18:39.945449 IP node3.48650 > node3.35360: UDP, length 113
03:18:39.952916 IP node3.45122 > node3.51686: UDP, length 113
03:18:39.953066 IP node3.48650 > node3.51686: UDP, length 113
03:18:39.953447 IP node3.33254 > node3.51686: UDP, length 113
03:18:39.953859 IP node3.56877 > node3.51686: UDP, length 113
03:18:39.954547 IP node3.54317 > node3.51686: UDP, length 113
03:18:39.954773 IP node3.46934 > node3.51686: UDP, length 113
03:18:39.955491 IP node3.54995 > node3.51686: UDP, length 113
03:18:39.957219 IP node3.34875 > node3.51686: UDP, length 113
03:18:39.957764 IP node3.45327 > node3.51686: UDP, length 113
03:18:39.960434 IP node3.59829 > node3.51686: UDP, length 113
03:18:39.961978 IP node3.39872 > node3.51686: UDP, length 113
03:18:39.962246 IP node3.48961 > node3.51686: UDP, length 113
03:18:39.963423 IP node3.51519 > node3.51686: UDP, length 113
03:18:39.963621 IP node3.47016 > node3.51686: UDP, length 113
03:18:39.963961 IP node3.35778 > node3.51686: UDP, length 113
03:18:39.964110 IP node3.36712 > node3.51686: UDP, length 113
03:18:39.964305 IP node3.45962 > node3.51686: UDP, length 113
03:18:39.966448 IP node3.52820 > node3.51686: UDP, length 113
03:18:39.967577 IP node3.54133 > node3.51686: UDP, length 113
03:18:39.986597 IP node3.39110 > node3.46934: UDP, length 112
03:18:39.986647 IP node3.39110 > node3.45122: UDP, length 112
03:18:39.986849 IP node3.39110 > node3.54317: UDP, length 112
03:18:39.997756 IP node3.39110 > node3.40893: UDP, length 112
03:18:40.005834 IP node3.39110 > node3.51686: UDP, length 112
03:18:40.006221 IP node3.39110 > node3.56877: UDP, length 112
03:18:40.006236 IP node3.39110 > node3.48650: UDP, length 112
03:18:40.006271 IP node3.39110 > node3.35360: UDP, length 112
03:18:40.010523 IP node3.51686 > node3.39110: UDP, length 112
03:18:40.011122 IP node3.40893 > node3.51686: UDP, length 113
03:18:40.028776 IP node3.35360 > node3.40893: UDP, length 113
03:18:40.049622 IP node3.35360 > node3.39110: UDP, length 113
03:18:40.051080 IP node3.35360 > node3.56877: UDP, length 113
03:18:40.051150 IP node3.35360 > node3.48650: UDP, length 113
03:18:40.052791 IP node3.35360 > node3.51686: UDP, length 113
03:18:40.062091 IP node3.51686 > node3.56877: UDP, length 112
03:18:40.062158 IP node3.51686 > node3.35360: UDP, length 112
03:18:40.062308 IP node3.51686 > node3.48650: UDP, length 112
03:18:40.100818 IP node3.42581 > node3.39110: UDP, length 113
03:18:40.101602 IP node3.42581 > node3.56877: UDP, length 113
03:18:40.101651 IP node3.42581 > node3.48650: UDP, length 113
03:18:40.101711 IP node3.42581 > node3.35360: UDP, length 113
03:18:40.101805 IP node3.42581 > node3.51686: UDP, length 113
03:18:40.102470 IP node3.45122 > node3.42581: UDP, length 113
03:18:40.103395 IP node3.46934 > node3.42581: UDP, length 113
03:18:40.103643 IP node3.54317 > node3.42581: UDP, length 113
03:18:40.104569 IP node3.48650 > node3.42581: UDP, length 113
03:18:40.104909 IP node3.39872 > node3.42581: UDP, length 113
03:18:40.105080 IP node3.48961 > node3.42581: UDP, length 113
03:18:40.105679 IP node3.35360 > node3.42581: UDP, length 113
03:18:40.106143 IP node3.34875 > node3.42581: UDP, length 113
03:18:40.106957 IP node3.45327 > node3.42581: UDP, length 113
03:18:40.107688 IP node3.40893 > node3.42581: UDP, length 113
03:18:40.108552 IP node3.39110 > node3.42581: UDP, length 112
03:18:40.108780 IP node3.56877 > node3.42581: UDP, length 113
03:18:40.110849 IP node3.33254 > node3.42581: UDP, length 113
03:18:40.113265 IP node3.51519 > node3.42581: UDP, length 113
03:18:40.113486 IP node3.52820 > node3.42581: UDP, length 113
03:18:40.113673 IP node3.47016 > node3.42581: UDP, length 113
03:18:40.113899 IP node3.36712 > node3.42581: UDP, length 113
03:18:40.114116 IP node3.45962 > node3.42581: UDP, length 113
03:18:40.114285 IP node3.35778 > node3.42581: UDP, length 113
03:18:40.116389 IP node3.59829 > node3.42581: UDP, length 113
03:18:40.116945 IP node3.54133 > node3.42581: UDP, length 113
03:18:40.118063 IP node3.54995 > node3.42581: UDP, length 113
03:18:40.138567 IP node3.51686 > node3.42581: UDP, length 112
03:18:40.266666 IP node3.48650 > node3.39110: UDP, length 87
03:18:40.267377 IP node3.39415 > node3.51686: UDP, length 113
03:18:40.267842 IP node3.39415 > node3.42581: UDP, length 113
03:18:40.267931 IP node3.39415 > node3.48650: UDP, length 113
03:18:40.268015 IP node3.39415 > node3.35360: UDP, length 113
03:18:40.268645 IP node3.48650 > node3.39415: UDP, length 113
03:18:40.270162 IP node3.33254 > node3.39415: UDP, length 113
03:18:40.270466 IP node3.40893 > node3.39415: UDP, length 113
03:18:40.270674 IP node3.45122 > node3.39415: UDP, length 113
03:18:40.271187 IP node3.46934 > node3.39415: UDP, length 113
03:18:40.271519 IP node3.54317 > node3.39415: UDP, length 113
03:18:40.271659 IP node3.54995 > node3.39415: UDP, length 113
03:18:40.273063 IP node3.34875 > node3.39415: UDP, length 113
03:18:40.273740 IP node3.52820 > node3.39415: UDP, length 113
03:18:40.274365 IP node3.51686 > node3.39415: UDP, length 112
03:18:40.274794 IP node3.39415 > node3.56877: UDP, length 113
03:18:40.275228 IP node3.35360 > node3.39415: UDP, length 113
03:18:40.277488 IP node3.59829 > node3.39415: UDP, length 113
03:18:40.277648 IP node3.45327 > node3.39415: UDP, length 113
03:18:40.277876 IP node3.48961 > node3.39415: UDP, length 113
03:18:40.278705 IP node3.42581 > node3.39415: UDP, length 113
03:18:40.279839 IP node3.51519 > node3.39415: UDP, length 113
03:18:40.280638 IP node3.39872 > node3.39415: UDP, length 113
03:18:40.280645 IP node3.36712 > node3.39415: UDP, length 113
03:18:40.280966 IP node3.35778 > node3.39415: UDP, length 113
03:18:40.283736 IP node3.54133 > node3.39415: UDP, length 113
03:18:40.284691 IP node3.45962 > node3.39415: UDP, length 113
03:18:40.285531 IP node3.47016 > node3.39415: UDP, length 113
03:18:40.298291 IP node3.39110 > node3.39415: UDP, length 112
03:18:40.298345 IP node3.39110 > node3.48650: UDP, length 94
03:18:40.355859 IP node3.56877 > node3.39415: UDP, length 113
03:18:41.016977 IP node3.48961 > node3.35778: UDP, length 113
03:18:41.017136 IP node3.34875 > node3.35778: UDP, length 113
03:18:41.017317 IP node3.33254 > node3.35778: UDP, length 113
03:18:41.017962 IP node3.39872 > node3.35778: UDP, length 113
03:18:41.017962 IP node3.52820 > node3.35778: UDP, length 113
03:18:41.020154 IP node3.56877 > node3.35778: UDP, length 113
03:18:41.020422 IP node3.48650 > node3.35778: UDP, length 113
03:18:41.020703 IP node3.51519 > node3.35778: UDP, length 113
03:18:41.020888 IP node3.59829 > node3.35778: UDP, length 113
03:18:41.021385 IP node3.36712 > node3.35778: UDP, length 113
03:18:41.021570 IP node3.39415 > node3.35778: UDP, length 113
03:18:41.023182 IP node3.51686 > node3.35778: UDP, length 112
03:18:41.023898 IP node3.42581 > node3.35778: UDP, length 113
03:18:41.024613 IP node3.46934 > node3.35778: UDP, length 113
03:18:41.025073 IP node3.54995 > node3.35778: UDP, length 113
03:18:41.025237 IP node3.40893 > node3.35778: UDP, length 113
03:18:41.025598 IP node3.54317 > node3.35778: UDP, length 113
03:18:41.026054 IP node3.45122 > node3.35778: UDP, length 113
03:18:41.026256 IP node3.45327 > node3.35778: UDP, length 113
03:18:41.026460 IP node3.47016 > node3.35778: UDP, length 113
03:18:41.026617 IP node3.35360 > node3.35778: UDP, length 113
03:18:41.027286 IP node3.39110 > node3.35778: UDP, length 112
03:18:41.027592 IP node3.54133 > node3.35778: UDP, length 113
03:18:41.027863 IP node3.45962 > node3.35778: UDP, length 113
03:18:41.126899 IP node3.39872 > node3.59829: UDP, length 113
03:18:41.127114 IP node3.33254 > node3.59829: UDP, length 113
03:18:41.127312 IP node3.36712 > node3.59829: UDP, length 113
03:18:41.128806 IP node3.52820 > node3.59829: UDP, length 113
03:18:41.128856 IP node3.56877 > node3.59829: UDP, length 113
03:18:41.129074 IP node3.34875 > node3.59829: UDP, length 113
03:18:41.130535 IP node3.48961 > node3.59829: UDP, length 113
03:18:41.131323 IP node3.35360 > node3.59829: UDP, length 113
03:18:41.131710 IP node3.54995 > node3.59829: UDP, length 113
03:18:41.131929 IP node3.40893 > node3.59829: UDP, length 113
03:18:41.132136 IP node3.46934 > node3.59829: UDP, length 113
03:18:41.132441 IP node3.42581 > node3.59829: UDP, length 113
03:18:41.132668 IP node3.45327 > node3.59829: UDP, length 113
03:18:41.132991 IP node3.47016 > node3.59829: UDP, length 113
03:18:41.134180 IP node3.54133 > node3.59829: UDP, length 113
03:18:41.134430 IP node3.54317 > node3.59829: UDP, length 113
03:18:41.134611 IP node3.48650 > node3.59829: UDP, length 113
03:18:41.135021 IP node3.39110 > node3.59829: UDP, length 112
03:18:41.135251 IP node3.45122 > node3.59829: UDP, length 113
03:18:41.135486 IP node3.45962 > node3.59829: UDP, length 113
03:18:41.136062 IP node3.51686 > node3.59829: UDP, length 112
03:18:41.136491 IP node3.51519 > node3.59829: UDP, length 113
03:18:41.137126 IP node3.39415 > node3.59829: UDP, length 113
03:18:41.137732 IP node3.35778 > node3.59829: UDP, length 113
03:18:41.229085 IP node3.48961 > node3.36712: UDP, length 113
03:18:41.229766 IP node3.52820 > node3.36712: UDP, length 113
03:18:41.230379 IP node3.51519 > node3.36712: UDP, length 113
03:18:41.230962 IP node3.33254 > node3.36712: UDP, length 113
03:18:41.231201 IP node3.54995 > node3.36712: UDP, length 113
03:18:41.231596 IP node3.48650 > node3.36712: UDP, length 113
03:18:41.232558 IP node3.34875 > node3.36712: UDP, length 113
03:18:41.232843 IP node3.45327 > node3.36712: UDP, length 113
03:18:41.232924 IP node3.47016 > node3.36712: UDP, length 113
03:18:41.233047 IP node3.46934 > node3.36712: UDP, length 113
03:18:41.233587 IP node3.54133 > node3.36712: UDP, length 113
03:18:41.233624 IP node3.39872 > node3.36712: UDP, length 113
03:18:41.234131 IP node3.56877 > node3.36712: UDP, length 113
03:18:41.235515 IP node3.35360 > node3.36712: UDP, length 113
03:18:41.236051 IP node3.45122 > node3.36712: UDP, length 113
03:18:41.236361 IP node3.45962 > node3.36712: UDP, length 113
03:18:41.239429 IP node3.54317 > node3.36712: UDP, length 113
03:18:41.241231 IP node3.51686 > node3.36712: UDP, length 112
03:18:41.241694 IP node3.35778 > node3.36712: UDP, length 113
03:18:41.242035 IP node3.40893 > node3.36712: UDP, length 113
03:18:41.246720 IP node3.42581 > node3.36712: UDP, length 113
03:18:41.249085 IP node3.59829 > node3.36712: UDP, length 113
03:18:41.259800 IP node3.39415 > node3.36712: UDP, length 113
03:18:41.265403 IP node3.39110 > node3.36712: UDP, length 112
03:18:41.495719 IP node3.54133 > node3.45962: UDP, length 113
03:18:41.496578 IP node3.42581 > node3.45962: UDP, length 113
03:18:41.496595 IP node3.39415 > node3.45962: UDP, length 113
03:18:41.496800 IP node3.52820 > node3.45962: UDP, length 113
03:18:41.496927 IP node3.34875 > node3.45962: UDP, length 113
03:18:41.497390 IP node3.54995 > node3.45962: UDP, length 113
03:18:41.497568 IP node3.36712 > node3.45962: UDP, length 113
03:18:41.497676 IP node3.46934 > node3.45962: UDP, length 113
03:18:41.497834 IP node3.33254 > node3.45962: UDP, length 113
03:18:41.498051 IP node3.51519 > node3.45962: UDP, length 113
03:18:41.498190 IP node3.45327 > node3.45962: UDP, length 113
03:18:41.498827 IP node3.45122 > node3.45962: UDP, length 113
03:18:41.498887 IP node3.47016 > node3.45962: UDP, length 113
03:18:41.499283 IP node3.48961 > node3.45962: UDP, length 113
03:18:41.500125 IP node3.59829 > node3.45962: UDP, length 113
03:18:41.501971 IP node3.39872 > node3.45962: UDP, length 113
03:18:41.505398 IP node3.35360 > node3.45962: UDP, length 113
03:18:41.505975 IP node3.39110 > node3.45962: UDP, length 112
03:18:41.506795 IP node3.48650 > node3.45962: UDP, length 113
03:18:41.507465 IP node3.56877 > node3.45962: UDP, length 113
03:18:41.507482 IP node3.51686 > node3.45962: UDP, length 112
03:18:41.507613 IP node3.40893 > node3.45962: UDP, length 113
03:18:41.507810 IP node3.35778 > node3.45962: UDP, length 113
03:18:41.508334 IP node3.54317 > node3.45962: UDP, length 113
03:18:41.552157 IP node3.35360 > node3.48961: UDP, length 113
03:18:41.552721 IP node3.42581 > node3.48961: UDP, length 113
03:18:41.553087 IP node3.39415 > node3.48961: UDP, length 113
03:18:41.553798 IP node3.36712 > node3.48961: UDP, length 113
03:18:41.553946 IP node3.52820 > node3.48961: UDP, length 113
03:18:41.554490 IP node3.47016 > node3.48961: UDP, length 113
03:18:41.554581 IP node3.34875 > node3.48961: UDP, length 113
03:18:41.554672 IP node3.56877 > node3.48961: UDP, length 113
03:18:41.555940 IP node3.54133 > node3.48961: UDP, length 113
03:18:41.556724 IP node3.48650 > node3.48961: UDP, length 113
03:18:41.558741 IP node3.35778 > node3.48961: UDP, length 113
03:18:41.560805 IP node3.33254 > node3.48961: UDP, length 113
03:18:41.561249 IP node3.54995 > node3.48961: UDP, length 113
03:18:41.561386 IP node3.51519 > node3.48961: UDP, length 113
03:18:41.561603 IP node3.45327 > node3.48961: UDP, length 113
03:18:41.561794 IP node3.46934 > node3.48961: UDP, length 113
03:18:41.562105 IP node3.51686 > node3.48961: UDP, length 112
03:18:41.562319 IP node3.39872 > node3.48961: UDP, length 113
03:18:41.562965 IP node3.59829 > node3.48961: UDP, length 113
03:18:41.563420 IP node3.54317 > node3.48961: UDP, length 113
03:18:41.563577 IP node3.45122 > node3.48961: UDP, length 113
03:18:41.563866 IP node3.39110 > node3.48961: UDP, length 112
03:18:41.564456 IP node3.40893 > node3.48961: UDP, length 113
03:18:41.567077 IP node3.45962 > node3.48961: UDP, length 113
03:18:41.602213 IP node3.45327 > node3.54133: UDP, length 113
03:18:41.602518 IP node3.54995 > node3.54133: UDP, length 113
03:18:41.602926 IP node3.39415 > node3.54133: UDP, length 113
03:18:41.603052 IP node3.51686 > node3.54133: UDP, length 112
03:18:41.603185 IP node3.34875 > node3.54133: UDP, length 113
03:18:41.603269 IP node3.48961 > node3.54133: UDP, length 113
03:18:41.603357 IP node3.52820 > node3.54133: UDP, length 113
03:18:41.604133 IP node3.54317 > node3.54133: UDP, length 113
03:18:41.605859 IP node3.33254 > node3.54133: UDP, length 113
03:18:41.607026 IP node3.56877 > node3.54133: UDP, length 113
03:18:41.607332 IP node3.51519 > node3.54133: UDP, length 113
03:18:41.607614 IP node3.42581 > node3.54133: UDP, length 113
03:18:41.607847 IP node3.40893 > node3.54133: UDP, length 113
03:18:41.608065 IP node3.39872 > node3.54133: UDP, length 113
03:18:41.608163 IP node3.35360 > node3.54133: UDP, length 113
03:18:41.608245 IP node3.45122 > node3.54133: UDP, length 113
03:18:41.608429 IP node3.46934 > node3.54133: UDP, length 113
03:18:41.608594 IP node3.47016 > node3.54133: UDP, length 113
03:18:41.608685 IP node3.39110 > node3.54133: UDP, length 112
03:18:41.609664 IP node3.35778 > node3.54133: UDP, length 113
03:18:41.609681 IP node3.36712 > node3.54133: UDP, length 113
03:18:41.615289 IP node3.45962 > node3.54133: UDP, length 113
03:18:41.618752 IP node3.59829 > node3.54133: UDP, length 113
03:18:41.623474 IP node3.48650 > node3.54133: UDP, length 113
03:18:41.758394 IP node3.40893 > node3.39872: UDP, length 113
03:18:41.758921 IP node3.35778 > node3.39872: UDP, length 113
03:18:41.759073 IP node3.54995 > node3.39872: UDP, length 113
03:18:41.759531 IP node3.39415 > node3.39872: UDP, length 113
03:18:41.759536 IP node3.51519 > node3.39872: UDP, length 113
03:18:41.759725 IP node3.34875 > node3.39872: UDP, length 113
03:18:41.760068 IP node3.47016 > node3.39872: UDP, length 113
03:18:41.760214 IP node3.59829 > node3.39872: UDP, length 113
03:18:41.760824 IP node3.51686 > node3.39872: UDP, length 112
03:18:41.761826 IP node3.42581 > node3.39872: UDP, length 113
03:18:41.763024 IP node3.45962 > node3.39872: UDP, length 113
03:18:41.763842 IP node3.52820 > node3.39872: UDP, length 113
03:18:41.763955 IP node3.54317 > node3.39872: UDP, length 113
03:18:41.764419 IP node3.33254 > node3.39872: UDP, length 113
03:18:41.764806 IP node3.54133 > node3.39872: UDP, length 113
03:18:41.764976 IP node3.48961 > node3.39872: UDP, length 113
03:18:41.765278 IP node3.46934 > node3.39872: UDP, length 113
03:18:41.765422 IP node3.36712 > node3.39872: UDP, length 113
03:18:41.766182 IP node3.56877 > node3.39872: UDP, length 113
03:18:41.766272 IP node3.48650 > node3.39872: UDP, length 113
03:18:41.766332 IP node3.35360 > node3.39872: UDP, length 113
03:18:41.766496 IP node3.45327 > node3.39872: UDP, length 113
03:18:41.769821 IP node3.39110 > node3.39872: UDP, length 112
03:18:41.774233 IP node3.45122 > node3.39872: UDP, length 113
03:18:41.954868 IP node3.34875 > node3.45327: UDP, length 113
03:18:41.956136 IP node3.51519 > node3.47016: UDP, length 113
03:18:41.956174 IP node3.51519 > node3.45327: UDP, length 113
03:18:41.956746 IP node3.45962 > node3.47016: UDP, length 113
03:18:41.956779 IP node3.45962 > node3.45327: UDP, length 113
03:18:41.960826 IP node3.54995 > node3.45327: UDP, length 113
03:18:41.960920 IP node3.48650 > node3.47016: UDP, length 113
03:18:41.960974 IP node3.48650 > node3.45327: UDP, length 113
03:18:41.961370 IP node3.48961 > node3.47016: UDP, length 113
03:18:41.961408 IP node3.48961 > node3.45327: UDP, length 113
03:18:41.962779 IP node3.35360 > node3.47016: UDP, length 113
03:18:41.963117 IP node3.35360 > node3.45327: UDP, length 113
03:18:41.964419 IP node3.46934 > node3.47016: UDP, length 113
03:18:41.964450 IP node3.46934 > node3.45327: UDP, length 113
03:18:41.965363 IP node3.54317 > node3.47016: UDP, length 113
03:18:41.965420 IP node3.54317 > node3.45327: UDP, length 113
03:18:41.965571 IP node3.59829 > node3.47016: UDP, length 113
03:18:41.965605 IP node3.59829 > node3.45327: UDP, length 113
03:18:41.966478 IP node3.39872 > node3.47016: UDP, length 113
03:18:41.966525 IP node3.39872 > node3.45327: UDP, length 113
03:18:41.967252 IP node3.36712 > node3.47016: UDP, length 113
03:18:41.967285 IP node3.36712 > node3.45327: UDP, length 113
03:18:41.969071 IP node3.39415 > node3.47016: UDP, length 113
03:18:41.969112 IP node3.39415 > node3.45327: UDP, length 113
03:18:41.969731 IP node3.33254 > node3.47016: UDP, length 113
03:18:41.969788 IP node3.33254 > node3.45327: UDP, length 113
03:18:41.970718 IP node3.52820 > node3.47016: UDP, length 113
03:18:41.970839 IP node3.45327 > node3.47016: UDP, length 113
03:18:41.970888 IP node3.45122 > node3.47016: UDP, length 113
03:18:41.970929 IP node3.45122 > node3.45327: UDP, length 113
03:18:41.970983 IP node3.52820 > node3.45327: UDP, length 113
03:18:41.971687 IP node3.51686 > node3.47016: UDP, length 112
03:18:41.971732 IP node3.51686 > node3.45327: UDP, length 112
03:18:41.972534 IP node3.40893 > node3.47016: UDP, length 113
03:18:41.972586 IP node3.40893 > node3.45327: UDP, length 113
03:18:41.972981 IP node3.56877 > node3.47016: UDP, length 113
03:18:41.973023 IP node3.56877 > node3.45327: UDP, length 113
03:18:41.973364 IP node3.39110 > node3.47016: UDP, length 112
03:18:41.973368 IP node3.34875 > node3.47016: UDP, length 113
03:18:41.973382 IP node3.47016 > node3.45327: UDP, length 113
03:18:41.973404 IP node3.39110 > node3.45327: UDP, length 112
03:18:41.973523 IP node3.35778 > node3.47016: UDP, length 113
03:18:41.973558 IP node3.35778 > node3.45327: UDP, length 113
03:18:41.973783 IP node3.54133 > node3.47016: UDP, length 113
03:18:41.973815 IP node3.54133 > node3.45327: UDP, length 113
03:18:41.974007 IP node3.54995 > node3.47016: UDP, length 113
03:18:41.976659 IP node3.42581 > node3.47016: UDP, length 113
03:18:41.976696 IP node3.42581 > node3.45327: UDP, length 113
03:18:42.207678 IP node3.51519 > node3.34875: UDP, length 113
03:18:42.209891 IP node3.48961 > node3.34875: UDP, length 113
03:18:42.210534 IP node3.39872 > node3.34875: UDP, length 113
03:18:42.210940 IP node3.45122 > node3.34875: UDP, length 113
03:18:42.212375 IP node3.33254 > node3.34875: UDP, length 113
03:18:42.212927 IP node3.45962 > node3.34875: UDP, length 113
03:18:42.213242 IP node3.36712 > node3.34875: UDP, length 113
03:18:42.213454 IP node3.47016 > node3.34875: UDP, length 113
03:18:42.216911 IP node3.42581 > node3.34875: UDP, length 113
03:18:42.217706 IP node3.40893 > node3.34875: UDP, length 113
03:18:42.218509 IP node3.56877 > node3.34875: UDP, length 113
03:18:42.218833 IP node3.59829 > node3.34875: UDP, length 113
03:18:42.219554 IP node3.54995 > node3.34875: UDP, length 113
03:18:42.219769 IP node3.45327 > node3.34875: UDP, length 113
03:18:42.220027 IP node3.52820 > node3.34875: UDP, length 113
03:18:42.221513 IP node3.54133 > node3.34875: UDP, length 113
03:18:42.223910 IP node3.35778 > node3.34875: UDP, length 113
03:18:42.226726 IP node3.51686 > node3.34875: UDP, length 112
03:18:42.226924 IP node3.39415 > node3.34875: UDP, length 113
03:18:42.227909 IP node3.39110 > node3.34875: UDP, length 112
03:18:42.228959 IP node3.46934 > node3.34875: UDP, length 113
03:18:42.229252 IP node3.35360 > node3.34875: UDP, length 113
03:18:42.232064 IP node3.54317 > node3.34875: UDP, length 113
03:18:42.242480 IP node3.48650 > node3.34875: UDP, length 113
03:18:42.347002 IP node3.35778 > node3.51519: UDP, length 113
03:18:42.349240 IP node3.59829 > node3.51519: UDP, length 113
03:18:42.351777 IP node3.54995 > node3.51519: UDP, length 113
03:18:42.352263 IP node3.35360 > node3.51519: UDP, length 113
03:18:42.354133 IP node3.46934 > node3.51519: UDP, length 113
03:18:42.354565 IP node3.48650 > node3.51519: UDP, length 113
03:18:42.355469 IP node3.39110 > node3.51519: UDP, length 112
03:18:42.356255 IP node3.34875 > node3.51519: UDP, length 113
03:18:42.356915 IP node3.40893 > node3.51519: UDP, length 113
03:18:42.357321 IP node3.54133 > node3.51519: UDP, length 113
03:18:42.357321 IP node3.47016 > node3.51519: UDP, length 113
03:18:42.357453 IP node3.52820 > node3.51519: UDP, length 113
03:18:42.357561 IP node3.51686 > node3.51519: UDP, length 112
03:18:42.357929 IP node3.45122 > node3.51519: UDP, length 113
03:18:42.357942 IP node3.42581 > node3.51519: UDP, length 113
03:18:42.358219 IP node3.36712 > node3.51519: UDP, length 113
03:18:42.359944 IP node3.39415 > node3.51519: UDP, length 113
03:18:42.361211 IP node3.54317 > node3.51519: UDP, length 113
03:18:42.361469 IP node3.45327 > node3.51519: UDP, length 113
03:18:42.361469 IP node3.56877 > node3.51519: UDP, length 113
03:18:42.362574 IP node3.33254 > node3.51519: UDP, length 113
03:18:42.385740 IP node3.48961 > node3.51519: UDP, length 113
03:18:42.387345 IP node3.39872 > node3.51519: UDP, length 113
03:18:42.388271 IP node3.45962 > node3.51519: UDP, length 113
03:18:42.422174 IP node3.47016 > node3.45327: UDP, length 87
03:18:42.423000 IP node3.45327 > node3.47016: UDP, length 94
03:18:42.473781 IP node3.48650 > node3.52820: UDP, length 113
03:18:42.473931 IP node3.54133 > node3.52820: UDP, length 113
03:18:42.473932 IP node3.45962 > node3.52820: UDP, length 113
03:18:42.474114 IP node3.59829 > node3.52820: UDP, length 113
03:18:42.475831 IP node3.39110 > node3.52820: UDP, length 112
03:18:42.476020 IP node3.39872 > node3.52820: UDP, length 113
03:18:42.476565 IP node3.35778 > node3.52820: UDP, length 113
03:18:42.477724 IP node3.35360 > node3.52820: UDP, length 113
03:18:42.478282 IP node3.45327 > node3.52820: UDP, length 113
03:18:42.478540 IP node3.46934 > node3.52820: UDP, length 113
03:18:42.479350 IP node3.54317 > node3.52820: UDP, length 113
03:18:42.480791 IP node3.56877 > node3.52820: UDP, length 113
03:18:42.481210 IP node3.48961 > node3.52820: UDP, length 113
03:18:42.482090 IP node3.33254 > node3.52820: UDP, length 113
03:18:42.483305 IP node3.39415 > node3.52820: UDP, length 113
03:18:42.483906 IP node3.42581 > node3.52820: UDP, length 113
03:18:42.483967 IP node3.51519 > node3.52820: UDP, length 113
03:18:42.484139 IP node3.36712 > node3.52820: UDP, length 113
03:18:42.484655 IP node3.54995 > node3.52820: UDP, length 113
03:18:42.484849 IP node3.40893 > node3.52820: UDP, length 113
03:18:42.485201 IP node3.45122 > node3.52820: UDP, length 113
03:18:42.486625 IP node3.34875 > node3.52820: UDP, length 113
03:18:42.487068 IP node3.51686 > node3.52820: UDP, length 112
03:18:42.493041 IP node3.45962 > node3.33254: UDP, length 113
03:18:42.493672 IP node3.54133 > node3.33254: UDP, length 113
03:18:42.496060 IP node3.39110 > node3.33254: UDP, length 112
03:18:42.496126 IP node3.59829 > node3.33254: UDP, length 113
03:18:42.498761 IP node3.48650 > node3.33254: UDP, length 113
03:18:42.500045 IP node3.35778 > node3.33254: UDP, length 113
03:18:42.500432 IP node3.36712 > node3.33254: UDP, length 113
03:18:42.501443 IP node3.48961 > node3.33254: UDP, length 113
03:18:42.502441 IP node3.35360 > node3.33254: UDP, length 113
03:18:42.503370 IP node3.56877 > node3.33254: UDP, length 113
03:18:42.503997 IP node3.39872 > node3.33254: UDP, length 113
03:18:42.507256 IP node3.54317 > node3.33254: UDP, length 113
03:18:42.507284 IP node3.42581 > node3.33254: UDP, length 113
03:18:42.508467 IP node3.45122 > node3.33254: UDP, length 113
03:18:42.508647 IP node3.54995 > node3.33254: UDP, length 113
03:18:42.508913 IP node3.39415 > node3.33254: UDP, length 113
03:18:42.509157 IP node3.40893 > node3.33254: UDP, length 113
03:18:42.509647 IP node3.46934 > node3.33254: UDP, length 113
03:18:42.510712 IP node3.45327 > node3.33254: UDP, length 113
03:18:42.511255 IP node3.51519 > node3.33254: UDP, length 113
03:18:42.511934 IP node3.52820 > node3.33254: UDP, length 113
03:18:42.514083 IP node3.51686 > node3.33254: UDP, length 112
03:18:42.515109 IP node3.34875 > node3.33254: UDP, length 113
03:18:42.537472 IP node3.45962 > node3.54995: UDP, length 113
03:18:42.537692 IP node3.39110 > node3.54995: UDP, length 112
03:18:42.537870 IP node3.36712 > node3.54995: UDP, length 113
03:18:42.538434 IP node3.35778 > node3.54995: UDP, length 113
03:18:42.538716 IP node3.59829 > node3.54995: UDP, length 113
03:18:42.540401 IP node3.45122 > node3.54995: UDP, length 113
03:18:42.540848 IP node3.39872 > node3.54995: UDP, length 113
03:18:42.540966 IP node3.54133 > node3.54995: UDP, length 113
03:18:42.541276 IP node3.40893 > node3.54995: UDP, length 113
03:18:42.543170 IP node3.42581 > node3.54995: UDP, length 113
03:18:42.543629 IP node3.51519 > node3.54995: UDP, length 113
03:18:42.543767 IP node3.54317 > node3.54995: UDP, length 113
03:18:42.544180 IP node3.56877 > node3.54995: UDP, length 113
03:18:42.544263 IP node3.35360 > node3.54995: UDP, length 113
03:18:42.545172 IP node3.52820 > node3.54995: UDP, length 113
03:18:42.545391 IP node3.45327 > node3.54995: UDP, length 113
03:18:42.545892 IP node3.46934 > node3.54995: UDP, length 113
03:18:42.546196 IP node3.33254 > node3.54995: UDP, length 113
03:18:42.546471 IP node3.48961 > node3.54995: UDP, length 113
03:18:42.549908 IP node3.51686 > node3.54995: UDP, length 112
03:18:42.550459 IP node3.39415 > node3.54995: UDP, length 113
03:18:42.550878 IP node3.34875 > node3.54995: UDP, length 113
03:18:42.556031 IP node3.48650 > node3.54995: UDP, length 113
03:18:42.581547 IP node3.47016 > node3.52820: UDP, length 113
03:18:42.581648 IP node3.47016 > node3.54995: UDP, length 113
03:18:42.581683 IP node3.47016 > node3.33254: UDP, length 113
03:18:42.671648 IP node3.54133 > node3.46934: UDP, length 113
03:18:42.672476 IP node3.54995 > node3.46934: UDP, length 113
03:18:42.673611 IP node3.56877 > node3.46934: UDP, length 113
03:18:42.673700 IP node3.45122 > node3.46934: UDP, length 113
03:18:42.673957 IP node3.39415 > node3.46934: UDP, length 113
03:18:42.674378 IP node3.52820 > node3.46934: UDP, length 113
03:18:42.674506 IP node3.39872 > node3.46934: UDP, length 113
03:18:42.674934 IP node3.59829 > node3.46934: UDP, length 113
03:18:42.675860 IP node3.47016 > node3.46934: UDP, length 113
03:18:42.676002 IP node3.48650 > node3.46934: UDP, length 113
03:18:42.676070 IP node3.45327 > node3.46934: UDP, length 113
03:18:42.676605 IP node3.48961 > node3.46934: UDP, length 113
03:18:42.676859 IP node3.51686 > node3.46934: UDP, length 112
03:18:42.676896 IP node3.40893 > node3.46934: UDP, length 113
03:18:42.676993 IP node3.42581 > node3.46934: UDP, length 113
03:18:42.677217 IP node3.54317 > node3.46934: UDP, length 113
03:18:42.677438 IP node3.33254 > node3.46934: UDP, length 113
03:18:42.677683 IP node3.39110 > node3.46934: UDP, length 112
03:18:42.680964 IP node3.34875 > node3.46934: UDP, length 113
03:18:42.681431 IP node3.51519 > node3.46934: UDP, length 113
03:18:42.681890 IP node3.35360 > node3.46934: UDP, length 113
03:18:42.682627 IP node3.36712 > node3.46934: UDP, length 113
03:18:42.684446 IP node3.45962 > node3.46934: UDP, length 113
03:18:42.690206 IP node3.35778 > node3.46934: UDP, length 113
03:18:42.728493 IP node3.59829 > node3.54317: UDP, length 113
03:18:42.729947 IP node3.56877 > node3.54317: UDP, length 113
03:18:42.730159 IP node3.51519 > node3.54317: UDP, length 113
03:18:42.730313 IP node3.42581 > node3.54317: UDP, length 113
03:18:42.730508 IP node3.51686 > node3.54317: UDP, length 112
03:18:42.731629 IP node3.54995 > node3.54317: UDP, length 113
03:18:42.732253 IP node3.39110 > node3.54317: UDP, length 112
03:18:42.732475 IP node3.45122 > node3.54317: UDP, length 113
03:18:42.732681 IP node3.52820 > node3.54317: UDP, length 113
03:18:42.733557 IP node3.47016 > node3.54317: UDP, length 113
03:18:42.733991 IP node3.39872 > node3.54317: UDP, length 113
03:18:42.735519 IP node3.48650 > node3.54317: UDP, length 113
03:18:42.735936 IP node3.35360 > node3.54317: UDP, length 113
03:18:42.736067 IP node3.46934 > node3.54317: UDP, length 113
03:18:42.736502 IP node3.40893 > node3.54317: UDP, length 113
03:18:42.740261 IP node3.39415 > node3.54317: UDP, length 113
03:18:42.741385 IP node3.54133 > node3.54317: UDP, length 113
03:18:42.742805 IP node3.45327 > node3.54317: UDP, length 113
03:18:42.748642 IP node3.45962 > node3.54317: UDP, length 113
03:18:42.752007 IP node3.39872 > node3.45122: UDP, length 113
03:18:42.752889 IP node3.39415 > node3.45122: UDP, length 113
03:18:42.753141 IP node3.40893 > node3.45122: UDP, length 113
03:18:42.753881 IP node3.36712 > node3.45122: UDP, length 113
03:18:42.753915 IP node3.36712 > node3.54317: UDP, length 113
03:18:42.754234 IP node3.59829 > node3.45122: UDP, length 113
03:18:42.754675 IP node3.33254 > node3.54317: UDP, length 113
03:18:42.754793 IP node3.45327 > node3.45122: UDP, length 113
03:18:42.755818 IP node3.33254 > node3.45122: UDP, length 113
03:18:42.756622 IP node3.52820 > node3.45122: UDP, length 113
03:18:42.757526 IP node3.46934 > node3.45122: UDP, length 113
03:18:42.757600 IP node3.51686 > node3.45122: UDP, length 112
03:18:42.757770 IP node3.42581 > node3.45122: UDP, length 113
03:18:42.757950 IP node3.51519 > node3.45122: UDP, length 113
03:18:42.758087 IP node3.48650 > node3.45122: UDP, length 113
03:18:42.759573 IP node3.56877 > node3.45122: UDP, length 113
03:18:42.759615 IP node3.47016 > node3.45122: UDP, length 113
03:18:42.760875 IP node3.35778 > node3.45122: UDP, length 113
03:18:42.760919 IP node3.35778 > node3.54317: UDP, length 113
03:18:42.762271 IP node3.54317 > node3.45122: UDP, length 113
03:18:42.762404 IP node3.34875 > node3.45122: UDP, length 113
03:18:42.762434 IP node3.34875 > node3.54317: UDP, length 113
03:18:42.763153 IP node3.35360 > node3.45122: UDP, length 113
03:18:42.764142 IP node3.45962 > node3.45122: UDP, length 113
03:18:42.764836 IP node3.39110 > node3.45122: UDP, length 112
03:18:42.765017 IP node3.54133 > node3.45122: UDP, length 113
03:18:42.765235 IP node3.54995 > node3.45122: UDP, length 113
03:18:42.777137 IP node3.48961 > node3.45122: UDP, length 113
03:18:42.777277 IP node3.48961 > node3.54317: UDP, length 113

