03:18:37.609524 IP node3.35778 > node4.58818: UDP, length 113
03:18:37.609723 IP node3.35778 > node4.43211: UDP, length 113
03:18:37.617002 IP node3.59829 > node4.58818: UDP, length 113
03:18:37.617832 IP node3.59829 > node4.43211: UDP, length 113
03:18:37.711662 IP node3.36712 > node4.58818: UDP, length 113
03:18:37.713283 IP node3.59829 > node4.57668: UDP, length 113
03:18:37.715977 IP node3.36712 > node4.57668: UDP, length 113
03:18:37.717608 IP node3.36712 > node4.43211: UDP, length 113
03:18:37.745577 IP node3.35778 > node4.57668: UDP, length 113
03:18:37.827281 IP node3.35778 > node4.54313: UDP, length 113
03:18:37.827768 IP node3.59829 > node4.54313: UDP, length 113
03:18:37.828963 IP node3.36712 > node4.54313: UDP, length 113
03:18:37.841649 IP node3.59829 > node2.44932: UDP, length 113
03:18:37.842702 IP node3.35778 > node2.44932: UDP, length 113
03:18:37.844699 IP node3.36712 > node2.44932: UDP, length 113
03:18:37.986119 IP node3.59829 > node4.38296: UDP, length 113
03:18:37.986555 IP node3.59829 > node4.35965: UDP, length 113
03:18:37.986785 IP node3.36712 > node4.38296: UDP, length 113
03:18:37.986964 IP node3.36712 > node4.35965: UDP, length 113
03:18:37.988341 IP node3.35778 > node4.38296: UDP, length 113
03:18:37.988456 IP node3.35778 > node4.35965: UDP, length 113
03:18:37.988940 IP node3.59829 > node4.40739: UDP, length 113
03:18:37.989444 IP node3.35778 > node4.40739: UDP, length 113
03:18:37.990425 IP node3.36712 > node4.40739: UDP, length 113
03:18:38.006440 IP node3.45962 > node4.43211: UDP, length 113
03:18:38.017334 IP node3.36712 > node4.44881: UDP, length 113
03:18:38.017740 IP node3.35778 > node4.44881: UDP, length 113
03:18:38.019035 IP node3.59829 > node4.44881: UDP, length 113
03:18:38.063011 IP node3.45962 > node4.57668: UDP, length 113
03:18:38.063420 IP node3.45962 > node4.54313: UDP, length 113
03:18:38.064136 IP node3.45962 > node2.44932: UDP, length 113
03:18:38.064445 IP node3.45962 > node4.38296: UDP, length 113
03:18:38.064732 IP node3.45962 > node4.35965: UDP, length 113
03:18:38.065110 IP node3.45962 > node4.40739: UDP, length 113
03:18:38.066246 IP node3.45962 > node4.44881: UDP, length 113
03:18:38.074628 IP node3.35778 > node2.50082: UDP, length 113
03:18:38.075766 IP node3.59829 > node2.50082: UDP, length 113
03:18:38.076107 IP node3.36712 > node2.50082: UDP, length 113
03:18:38.093262 IP node3.45962 > node2.50082: UDP, length 113
03:18:38.158935 IP node3.36712 > node4.41947: UDP, length 113
03:18:38.159183 IP node3.59829 > node4.41947: UDP, length 113
03:18:38.160926 IP node3.35778 > node4.41947: UDP, length 113
03:18:38.161799 IP node3.45962 > node4.41947: UDP, length 113
03:18:38.185625 IP node3.59829 > node4.58599: UDP, length 113
03:18:38.186875 IP node3.36712 > node4.58599: UDP, length 113
03:18:38.187038 IP node3.35778 > node4.58599: UDP, length 113
03:18:38.188144 IP node3.45962 > node4.58599: UDP, length 113
03:18:38.193318 IP node3.48961 > node4.57668: UDP, length 113
03:18:38.225433 IP node3.48961 > node4.54313: UDP, length 113
03:18:38.226778 IP node3.48961 > node2.44932: UDP, length 113
03:18:38.227784 IP node3.48961 > node4.38296: UDP, length 113
03:18:38.228553 IP node3.48961 > node4.35965: UDP, length 113
03:18:38.228832 IP node3.48961 > node4.40739: UDP, length 113
03:18:38.229098 IP node3.48961 > node4.44881: UDP, length 113
03:18:38.229655 IP node3.48961 > node2.50082: UDP, length 113
03:18:38.230128 IP node3.48961 > node4.41947: UDP, length 113
03:18:38.230400 IP node3.48961 > node4.58599: UDP, length 113
03:18:38.341765 IP node3.54133 > node4.57668: UDP, length 113
03:18:38.343523 IP node3.54133 > node4.54313: UDP, length 113
03:18:38.344318 IP node3.54133 > node2.44932: UDP, length 113
03:18:38.344869 IP node3.54133 > node4.38296: UDP, length 113
03:18:38.345114 IP node3.54133 > node4.35965: UDP, length 113
03:18:38.345324 IP node3.54133 > node4.40739: UDP, length 113
03:18:38.345536 IP node3.54133 > node4.44881: UDP, length 113
03:18:38.345934 IP node3.54133 > node2.50082: UDP, length 113
03:18:38.346254 IP node3.54133 > node4.41947: UDP, length 113
03:18:38.346484 IP node3.54133 > node4.58599: UDP, length 113
03:18:38.365518 IP node3.35778 > node2.38346: UDP, length 113
03:18:38.365860 IP node3.45962 > node4.56064: UDP, length 113
03:18:38.365958 IP node3.45962 > node2.38346: UDP, length 113
03:18:38.366181 IP node3.59829 > node4.56064: UDP, length 113
03:18:38.366265 IP node3.59829 > node2.38346: UDP, length 113
03:18:38.366961 IP node3.36712 > node4.56064: UDP, length 113
03:18:38.368729 IP node3.36712 > node2.38346: UDP, length 113
03:18:38.369324 IP node3.35778 > node4.56064: UDP, length 113
03:18:38.385544 IP node3.35778 > node4.50849: UDP, length 113
03:18:38.387190 IP node3.59829 > node4.50849: UDP, length 113
03:18:38.387274 IP node3.36712 > node4.50849: UDP, length 113
03:18:38.387500 IP node3.45962 > node4.50849: UDP, length 113
03:18:38.388852 IP node3.48961 > node2.38346: UDP, length 113
03:18:38.389160 IP node3.48961 > node4.56064: UDP, length 113
03:18:38.389423 IP node3.48961 > node4.50849: UDP, length 113
03:18:38.401391 IP node3.54133 > node2.38346: UDP, length 113
03:18:38.402442 IP node3.54133 > node4.50849: UDP, length 113
03:18:38.402714 IP node3.54133 > node4.56064: UDP, length 113
03:18:38.416972 IP node3.39872 > node4.57668: UDP, length 113
03:18:38.434041 IP node3.39872 > node4.40739: UDP, length 113
03:18:38.434252 IP node3.39872 > node4.38296: UDP, length 113
03:18:38.434369 IP node3.39872 > node2.44932: UDP, length 113
03:18:38.434483 IP node3.39872 > node4.54313: UDP, length 113
03:18:38.434603 IP node3.39872 > node4.41947: UDP, length 113
03:18:38.434752 IP node3.39872 > node4.50849: UDP, length 113
03:18:38.434945 IP node3.39872 > node4.35965: UDP, length 113
03:18:38.435058 IP node3.39872 > node4.44881: UDP, length 113
03:18:38.435170 IP node3.39872 > node4.58599: UDP, length 113
03:18:38.435362 IP node3.39872 > node2.50082: UDP, length 113
03:18:38.435478 IP node3.39872 > node4.56064: UDP, length 113
03:18:38.435647 IP node3.39872 > node2.38346: UDP, length 113
03:18:38.451303 IP node3.45327 > node4.57668: UDP, length 113
03:18:38.477574 IP node3.36712 > node4.38585: UDP, length 113
03:18:38.478889 IP node3.35778 > node4.38585: UDP, length 113
03:18:38.479257 IP node3.45962 > node4.38585: UDP, length 113
03:18:38.479537 IP node3.59829 > node4.38585: UDP, length 113
03:18:38.481448 IP node3.48961 > node4.38585: UDP, length 113
03:18:38.483744 IP node3.54133 > node4.38585: UDP, length 113
03:18:38.491371 IP node3.45327 > node2.44932: UDP, length 113
03:18:38.496680 IP node3.45327 > node4.40739: UDP, length 113
03:18:38.496807 IP node3.45327 > node4.38296: UDP, length 113
03:18:38.497017 IP node3.45327 > node4.54313: UDP, length 113
03:18:38.497118 IP node3.45327 > node4.41947: UDP, length 113
03:18:38.497226 IP node3.45327 > node4.50849: UDP, length 113
03:18:38.497394 IP node3.45327 > node4.35965: UDP, length 113
03:18:38.497491 IP node3.45327 > node4.44881: UDP, length 113
03:18:38.497590 IP node3.45327 > node4.38585: UDP, length 113
03:18:38.497694 IP node3.45327 > node4.58599: UDP, length 113
03:18:38.497842 IP node3.45327 > node2.50082: UDP, length 113
03:18:38.497934 IP node3.45327 > node4.56064: UDP, length 113
03:18:38.499279 IP node3.45327 > node2.38346: UDP, length 113
03:18:38.506553 IP node3.45962 > node2.43123: UDP, length 113
03:18:38.507138 IP node3.35778 > node2.43123: UDP, length 113
03:18:38.507381 IP node3.36712 > node2.43123: UDP, length 113
03:18:38.507483 IP node3.59829 > node2.43123: UDP, length 113
03:18:38.508700 IP node3.48961 > node2.43123: UDP, length 113
03:18:38.509299 IP node3.54133 > node2.43123: UDP, length 113
03:18:38.521231 IP node3.39872 > node2.43123: UDP, length 113
03:18:38.521554 IP node3.39872 > node4.38585: UDP, length 113
03:18:38.556142 IP node3.36712 > node2.38998: UDP, length 113
03:18:38.564660 IP node3.45327 > node2.43123: UDP, length 113
03:18:38.566014 IP node3.45962 > node2.38998: UDP, length 113
03:18:38.567844 IP node3.59829 > node2.38998: UDP, length 113
03:18:38.568779 IP node3.35778 > node2.38998: UDP, length 113
03:18:38.569512 IP node3.48961 > node2.38998: UDP, length 113
03:18:38.577307 IP node3.54133 > node2.38998: UDP, length 113
03:18:38.580005 IP node3.39872 > node2.38998: UDP, length 113
03:18:38.585761 IP node3.45327 > node2.38998: UDP, length 113
03:18:38.630008 IP node3.35778 > node2.41342: UDP, length 113
03:18:38.630757 IP node3.36712 > node2.41342: UDP, length 113
03:18:38.630873 IP node3.45962 > node2.41342: UDP, length 113
03:18:38.631439 IP node3.48961 > node2.41342: UDP, length 113
03:18:38.631892 IP node3.39872 > node2.41342: UDP, length 113
03:18:38.632180 IP node3.59829 > node2.41342: UDP, length 113
03:18:38.632693 IP node3.54133 > node2.41342: UDP, length 113
03:18:38.645082 IP node3.47016 > node4.54313: UDP, length 113
03:18:38.646879 IP node3.47016 > node4.38296: UDP, length 113
03:18:38.647210 IP node3.47016 > node4.35965: UDP, length 113
03:18:38.647492 IP node3.47016 > node4.40739: UDP, length 113
03:18:38.648044 IP node3.47016 > node4.44881: UDP, length 113
03:18:38.650613 IP node3.47016 > node2.44932: UDP, length 113
03:18:38.650775 IP node3.47016 > node4.41947: UDP, length 113
03:18:38.650939 IP node3.47016 > node2.50082: UDP, length 113
03:18:38.652293 IP node3.47016 > node2.38346: UDP, length 113
03:18:38.653073 IP node3.47016 > node4.58599: UDP, length 113
03:18:38.653352 IP node3.47016 > node4.50849: UDP, length 113
03:18:38.656858 IP node3.47016 > node4.38585: UDP, length 113
03:18:38.657522 IP node3.47016 > node2.43123: UDP, length 113
03:18:38.657843 IP node3.47016 > node2.38998: UDP, length 113
03:18:38.661264 IP node3.45327 > node2.41342: UDP, length 113
03:18:38.662012 IP node3.47016 > node4.56064: UDP, length 113
03:18:38.672630 IP node3.47016 > node2.41342: UDP, length 113
03:18:38.685044 IP node3.39872 > node2.45280: UDP, length 113
03:18:38.686822 IP node3.45962 > node2.45280: UDP, length 113
03:18:38.689414 IP node3.36712 > node2.45280: UDP, length 113
03:18:38.690469 IP node3.59829 > node2.45280: UDP, length 113
03:18:38.691546 IP node3.54133 > node2.45280: UDP, length 113
03:18:38.692362 IP node3.35778 > node2.45280: UDP, length 113
03:18:38.692830 IP node3.48961 > node2.45280: UDP, length 113
03:18:38.694992 IP node3.45327 > node2.45280: UDP, length 113
03:18:38.701221 IP node3.39872 > node4.42581: UDP, length 113
03:18:38.702874 IP node3.48961 > node4.42581: UDP, length 113
03:18:38.703109 IP node3.54133 > node4.42581: UDP, length 113
03:18:38.703306 IP node3.36712 > node4.42581: UDP, length 113
03:18:38.703526 IP node3.35778 > node4.42581: UDP, length 113
03:18:38.703725 IP node3.59829 > node4.42581: UDP, length 113
03:18:38.707150 IP node3.45962 > node4.42581: UDP, length 113
03:18:38.707571 IP node3.45327 > node4.42581: UDP, length 113
03:18:38.711302 IP node3.34875 > node4.38296: UDP, length 113
03:18:38.711422 IP node3.34875 > node4.35965: UDP, length 113
03:18:38.712996 IP node3.47016 > node2.45280: UDP, length 113
03:18:38.713441 IP node3.47016 > node4.42581: UDP, length 113
03:18:38.715505 IP node3.45962 > node4.51437: UDP, length 113
03:18:38.716072 IP node3.47016 > node4.51437: UDP, length 113
03:18:38.717990 IP node3.48961 > node4.51437: UDP, length 113
03:18:38.718462 IP node3.36712 > node4.51437: UDP, length 113
03:18:38.718882 IP node3.35778 > node4.51437: UDP, length 113
03:18:38.719116 IP node3.59829 > node4.51437: UDP, length 113
03:18:38.719199 IP node3.34875 > node4.40739: UDP, length 113
03:18:38.719423 IP node3.34875 > node2.50082: UDP, length 113
03:18:38.719672 IP node3.34875 > node4.41947: UDP, length 113
03:18:38.719803 IP node3.34875 > node4.58599: UDP, length 113
03:18:38.719943 IP node3.34875 > node2.38346: UDP, length 113
03:18:38.720067 IP node3.34875 > node4.56064: UDP, length 113
03:18:38.720182 IP node3.34875 > node4.50849: UDP, length 113
03:18:38.721185 IP node3.39872 > node4.51437: UDP, length 113
03:18:38.721578 IP node3.39872 > node4.50209: UDP, length 113
03:18:38.722974 IP node3.45962 > node4.50209: UDP, length 113
03:18:38.726600 IP node3.36712 > node4.50209: UDP, length 113
03:18:38.726912 IP node3.35778 > node4.50209: UDP, length 113
03:18:38.727120 IP node3.48961 > node4.50209: UDP, length 113
03:18:38.727711 IP node3.59829 > node4.50209: UDP, length 113
03:18:38.728449 IP node3.54133 > node4.50209: UDP, length 113
03:18:38.728591 IP node3.54133 > node4.51437: UDP, length 113
03:18:38.731288 IP node3.34875 > node4.44881: UDP, length 113
03:18:38.731438 IP node3.34875 > node2.43123: UDP, length 113
03:18:38.732075 IP node3.45327 > node4.50209: UDP, length 113
03:18:38.732207 IP node3.45327 > node4.51437: UDP, length 113
03:18:38.751558 IP node3.39872 > node2.57596: UDP, length 113
03:18:38.751795 IP node3.48961 > node2.57596: UDP, length 113
03:18:38.752408 IP node3.45962 > node2.57596: UDP, length 113
03:18:38.753040 IP node3.34875 > node2.38998: UDP, length 113
03:18:38.753558 IP node3.34875 > node2.41342: UDP, length 113
03:18:38.754151 IP node3.36712 > node2.57596: UDP, length 113
03:18:38.754449 IP node3.35778 > node2.57596: UDP, length 113
03:18:38.754996 IP node3.59829 > node2.57596: UDP, length 113
03:18:38.755553 IP node3.54133 > node2.57596: UDP, length 113
03:18:38.756369 IP node3.45327 > node2.57596: UDP, length 113
03:18:38.760993 IP node3.47016 > node2.57596: UDP, length 113
03:18:38.771502 IP node3.47016 > node4.50209: UDP, length 113
03:18:38.777055 IP node3.39872 > node4.54807: UDP, length 113
03:18:38.777567 IP node3.48961 > node4.54807: UDP, length 113
03:18:38.779899 IP node3.54133 > node4.54807: UDP, length 113
03:18:38.780268 IP node3.36712 > node4.54807: UDP, length 113
03:18:38.780519 IP node3.35778 > node4.54807: UDP, length 113
03:18:38.781274 IP node3.59829 > node4.54807: UDP, length 113
03:18:38.781548 IP node3.45962 > node4.54807: UDP, length 113
03:18:38.782244 IP node3.45327 > node4.54807: UDP, length 113
03:18:38.788825 IP node3.47016 > node4.54807: UDP, length 113
03:18:38.793297 IP node3.34875 > node2.45280: UDP, length 113
03:18:38.793640 IP node3.34875 > node4.42581: UDP, length 113
03:18:38.793936 IP node3.34875 > node4.38585: UDP, length 113
03:18:38.795754 IP node3.34875 > node4.51437: UDP, length 113
03:18:38.796149 IP node3.34875 > node2.57596: UDP, length 113
03:18:38.796424 IP node3.34875 > node4.54807: UDP, length 113
03:18:38.796997 IP node3.34875 > node4.50209: UDP, length 113
03:18:38.798997 IP node3.39872 > node4.42769: UDP, length 113
03:18:38.800262 IP node3.45962 > node4.42769: UDP, length 113
03:18:38.801630 IP node3.54133 > node4.42769: UDP, length 113
03:18:38.801937 IP node3.36712 > node4.42769: UDP, length 113
03:18:38.802194 IP node3.35778 > node4.42769: UDP, length 113
03:18:38.804232 IP node3.59829 > node4.42769: UDP, length 113
03:18:38.804690 IP node3.48961 > node4.42769: UDP, length 113
03:18:38.805363 IP node3.45327 > node4.42769: UDP, length 113
03:18:38.805685 IP node3.47016 > node4.42769: UDP, length 113
03:18:38.807213 IP node3.34875 > node4.42769: UDP, length 113
03:18:38.821957 IP node3.39872 > node4.38406: UDP, length 113
03:18:38.822684 IP node3.48961 > node4.38406: UDP, length 113
03:18:38.825655 IP node3.54133 > node4.38406: UDP, length 113
03:18:38.826187 IP node3.36712 > node4.38406: UDP, length 113
03:18:38.826467 IP node3.35778 > node4.38406: UDP, length 113
03:18:38.826759 IP node3.59829 > node4.38406: UDP, length 113
03:18:38.828092 IP node3.45962 > node4.38406: UDP, length 113
03:18:38.830377 IP node3.45327 > node4.38406: UDP, length 113
03:18:38.830735 IP node3.47016 > node4.38406: UDP, length 113
03:18:38.831343 IP node3.34875 > node4.38406: UDP, length 113
03:18:38.840579 IP node3.39872 > node2.51828: UDP, length 113
03:18:38.841619 IP node3.45962 > node2.51828: UDP, length 113
03:18:38.844602 IP node3.48961 > node2.51828: UDP, length 113
03:18:38.844990 IP node3.54133 > node2.51828: UDP, length 113
03:18:38.845855 IP node3.36712 > node2.51828: UDP, length 113
03:18:38.846152 IP node3.35778 > node2.51828: UDP, length 113
03:18:38.847970 IP node3.45327 > node2.51828: UDP, length 113
03:18:38.848624 IP node3.59829 > node2.51828: UDP, length 113
03:18:38.852394 IP node3.48961 > node1.38885: UDP, length 113
03:18:38.853329 IP node3.45962 > node1.38885: UDP, length 113
03:18:38.853587 IP node3.45327 > node1.38885: UDP, length 113
03:18:38.855027 IP node3.54133 > node1.38885: UDP, length 113
03:18:38.855355 IP node3.59829 > node1.38885: UDP, length 113
03:18:38.856168 IP node3.36712 > node1.38885: UDP, length 113
03:18:38.856931 IP node3.39872 > node1.38885: UDP, length 113
03:18:38.858744 IP node3.35778 > node1.38885: UDP, length 113
03:18:38.861658 IP node3.47016 > node2.51828: UDP, length 113
03:18:38.862166 IP node3.47016 > node1.38885: UDP, length 113
03:18:38.863907 IP node3.34875 > node1.38885: UDP, length 113
03:18:38.864041 IP node3.34875 > node2.51828: UDP, length 113
03:18:38.951039 IP node3.51519 > node2.38346: UDP, length 113
03:18:38.952180 IP node3.51519 > node4.56064: UDP, length 113
03:18:38.969669 IP node3.48961 > node4.33103: UDP, length 113
03:18:38.970746 IP node3.45962 > node4.33103: UDP, length 113
03:18:38.972501 IP node3.36712 > node4.33103: UDP, length 113
03:18:38.972752 IP node3.59829 > node4.33103: UDP, length 113
03:18:38.973837 IP node3.47016 > node4.33103: UDP, length 113
03:18:38.974355 IP node3.52820 > node2.57596: UDP, length 113
03:18:38.974460 IP node3.52820 > node4.50209: UDP, length 113
03:18:38.974723 IP node3.52820 > node1.38885: UDP, length 113
03:18:38.974816 IP node3.52820 > node4.50849: UDP, length 113
03:18:38.974911 IP node3.52820 > node2.38998: UDP, length 113
03:18:38.975053 IP node3.52820 > node4.54807: UDP, length 113
03:18:38.975211 IP node3.52820 > node4.42769: UDP, length 113
03:18:38.975251 IP node3.35778 > node4.33103: UDP, length 113
03:18:38.975484 IP node3.52820 > node4.38585: UDP, length 113
03:18:38.975582 IP node3.52820 > node4.58599: UDP, length 113
03:18:38.975686 IP node3.52820 > node2.51828: UDP, length 113
03:18:38.975781 IP node3.52820 > node2.41342: UDP, length 113
03:18:38.975947 IP node3.52820 > node2.45280: UDP, length 113
03:18:38.976053 IP node3.52820 > node4.51437: UDP, length 113
03:18:38.976149 IP node3.52820 > node4.56064: UDP, length 113
03:18:38.976266 IP node3.52820 > node4.38406: UDP, length 113
03:18:38.976561 IP node3.39872 > node4.33103: UDP, length 113
03:18:38.977729 IP node3.34875 > node4.33103: UDP, length 113
03:18:38.982266 IP node3.52820 > node2.38346: UDP, length 113
03:18:38.982433 IP node3.52820 > node2.43123: UDP, length 113
03:18:38.982535 IP node3.52820 > node4.42581: UDP, length 113
03:18:38.984545 IP node3.54133 > node4.33103: UDP, length 113
03:18:38.985163 IP node3.54995 > node4.50849: UDP, length 113
03:18:38.985763 IP node3.45327 > node4.33103: UDP, length 113
03:18:38.988628 IP node3.54995 > node4.38585: UDP, length 113
03:18:38.991821 IP node3.54995 > node2.43123: UDP, length 113
03:18:38.992484 IP node3.54995 > node2.38998: UDP, length 113
03:18:38.995953 IP node3.33254 > node2.38346: UDP, length 113
03:18:38.996723 IP node3.33254 > node4.50849: UDP, length 113
03:18:38.996771 IP node3.54995 > node2.41342: UDP, length 113
03:18:39.004111 IP node3.47016 > node1.34107: UDP, length 113
03:18:39.004696 IP node3.47016 > node4.52495: UDP, length 113
03:18:39.004798 IP node3.45962 > node4.52495: UDP, length 113
03:18:39.005116 IP node3.39872 > node4.52495: UDP, length 113
03:18:39.005476 IP node3.39872 > node1.34107: UDP, length 113
03:18:39.006948 IP node3.48961 > node4.52495: UDP, length 113
03:18:39.007047 IP node3.48961 > node1.34107: UDP, length 113
03:18:39.007379 IP node3.45962 > node1.34107: UDP, length 113
03:18:39.008751 IP node3.36712 > node4.52495: UDP, length 113
03:18:39.008895 IP node3.36712 > node1.34107: UDP, length 113
03:18:39.009287 IP node3.33254 > node2.38998: UDP, length 113
03:18:39.009349 IP node3.34875 > node4.52495: UDP, length 113
03:18:39.009412 IP node3.34875 > node1.34107: UDP, length 113
03:18:39.009537 IP node3.33254 > node4.38585: UDP, length 113
03:18:39.009621 IP node3.33254 > node2.41342: UDP, length 113
03:18:39.009733 IP node3.33254 > node2.45280: UDP, length 113
03:18:39.009914 IP node3.33254 > node2.43123: UDP, length 113
03:18:39.012265 IP node3.35778 > node4.52495: UDP, length 113
03:18:39.012391 IP node3.33254 > node4.51437: UDP, length 113
03:18:39.012506 IP node3.33254 > node4.42581: UDP, length 113
03:18:39.013985 IP node3.59829 > node1.34107: UDP, length 113
03:18:39.014176 IP node3.33254 > node4.50209: UDP, length 113
03:18:39.014445 IP node3.33254 > node2.57596: UDP, length 113
03:18:39.014688 IP node3.33254 > node4.54807: UDP, length 113
03:18:39.014900 IP node3.33254 > node4.42769: UDP, length 113
03:18:39.015485 IP node3.59829 > node4.52495: UDP, length 113
03:18:39.015790 IP node3.33254 > node4.38406: UDP, length 113
03:18:39.016071 IP node3.33254 > node2.51828: UDP, length 113
03:18:39.016121 IP node3.35778 > node1.34107: UDP, length 113
03:18:39.016368 IP node3.33254 > node1.38885: UDP, length 113
03:18:39.017619 IP node3.33254 > node4.33103: UDP, length 113
03:18:39.018217 IP node3.33254 > node4.52495: UDP, length 113
03:18:39.018466 IP node3.54133 > node4.52495: UDP, length 113
03:18:39.018604 IP node3.54133 > node1.34107: UDP, length 113
03:18:39.019126 IP node3.33254 > node1.34107: UDP, length 113
03:18:39.019442 IP node3.33254 > node4.56064: UDP, length 113
03:18:39.019926 IP node3.45327 > node1.34107: UDP, length 113
03:18:39.020618 IP node3.45327 > node4.52495: UDP, length 113
03:18:39.022656 IP node3.54995 > node2.45280: UDP, length 113
03:18:39.025182 IP node3.54995 > node4.42581: UDP, length 113
03:18:39.025568 IP node3.54995 > node4.51437: UDP, length 113
03:18:39.027711 IP node3.47016 > node2.59355: UDP, length 113
03:18:39.028215 IP node3.45962 > node2.59355: UDP, length 113
03:18:39.028746 IP node3.39872 > node2.59355: UDP, length 113
03:18:39.028936 IP node3.45327 > node2.59355: UDP, length 113
03:18:39.029599 IP node3.48961 > node2.59355: UDP, length 113
03:18:39.029650 IP node3.36712 > node2.59355: UDP, length 113
03:18:39.029892 IP node3.34875 > node2.59355: UDP, length 113
03:18:39.030837 IP node3.59829 > node2.59355: UDP, length 113
03:18:39.031274 IP node3.35778 > node2.59355: UDP, length 113
03:18:39.031563 IP node3.54133 > node2.59355: UDP, length 113
03:18:39.060604 IP node3.54995 > node2.57596: UDP, length 113
03:18:39.060818 IP node3.54995 > node4.50209: UDP, length 113
03:18:39.070544 IP node3.33254 > node2.59355: UDP, length 113
03:18:39.082070 IP node3.48961 > node2.55804: UDP, length 113
03:18:39.082358 IP node3.45962 > node2.55804: UDP, length 113
03:18:39.083727 IP node3.34875 > node2.55804: UDP, length 113
03:18:39.088758 IP node3.36712 > node2.55804: UDP, length 113
03:18:39.089358 IP node3.47016 > node2.55804: UDP, length 113
03:18:39.090139 IP node3.39872 > node2.55804: UDP, length 113
03:18:39.090988 IP node3.45327 > node2.55804: UDP, length 113
03:18:39.091771 IP node3.59829 > node2.55804: UDP, length 113
03:18:39.092981 IP node3.54133 > node2.55804: UDP, length 113
03:18:39.093384 IP node3.35778 > node2.55804: UDP, length 113
03:18:39.114243 IP node3.33254 > node2.55804: UDP, length 113
03:18:39.116447 IP node3.52820 > node4.33103: UDP, length 113
03:18:39.117638 IP node3.52820 > node4.52495: UDP, length 113
03:18:39.117777 IP node3.52820 > node1.34107: UDP, length 113
03:18:39.118005 IP node3.52820 > node2.59355: UDP, length 113
03:18:39.118253 IP node3.52820 > node2.55804: UDP, length 113
03:18:39.127412 IP node3.51519 > node4.50849: UDP, length 113
03:18:39.128314 IP node3.51519 > node4.38585: UDP, length 113
03:18:39.128545 IP node3.51519 > node2.43123: UDP, length 113
03:18:39.128764 IP node3.51519 > node2.38998: UDP, length 113
03:18:39.129411 IP node3.51519 > node2.41342: UDP, length 113
03:18:39.129643 IP node3.51519 > node2.45280: UDP, length 113
03:18:39.129887 IP node3.51519 > node4.42581: UDP, length 113
03:18:39.130154 IP node3.51519 > node4.51437: UDP, length 113
03:18:39.130813 IP node3.51519 > node4.50209: UDP, length 113
03:18:39.131043 IP node3.51519 > node2.57596: UDP, length 113
03:18:39.131272 IP node3.51519 > node4.54807: UDP, length 113
03:18:39.131510 IP node3.51519 > node4.42769: UDP, length 113
03:18:39.131802 IP node3.51519 > node4.38406: UDP, length 113
03:18:39.134536 IP node3.51519 > node2.51828: UDP, length 113
03:18:39.134807 IP node3.51519 > node1.38885: UDP, length 113
03:18:39.135765 IP node3.51519 > node4.33103: UDP, length 113
03:18:39.136236 IP node3.51519 > node4.52495: UDP, length 113
03:18:39.136962 IP node3.51519 > node1.34107: UDP, length 113
03:18:39.137622 IP node3.51519 > node2.59355: UDP, length 113
03:18:39.137871 IP node3.51519 > node2.55804: UDP, length 113
03:18:39.144800 IP node3.48961 > node4.33946: UDP, length 113
03:18:39.144987 IP node3.47016 > node4.33946: UDP, length 113
03:18:39.145423 IP node3.51519 > node4.33946: UDP, length 113
03:18:39.145602 IP node3.45962 > node4.33946: UDP, length 113
03:18:39.146478 IP node3.39872 > node4.33946: UDP, length 113
03:18:39.148071 IP node3.54133 > node4.33946: UDP, length 113
03:18:39.148465 IP node3.35778 > node4.33946: UDP, length 113
03:18:39.148681 IP node3.59829 > node4.33946: UDP, length 113
03:18:39.148957 IP node3.34875 > node4.33946: UDP, length 113
03:18:39.149120 IP node3.36712 > node4.33946: UDP, length 113
03:18:39.149996 IP node3.45327 > node4.33946: UDP, length 113
03:18:39.151315 IP node3.52820 > node4.33946: UDP, length 113
03:18:39.151606 IP node3.33254 > node4.33946: UDP, length 113
03:18:39.168037 IP node3.51519 > node2.51687: UDP, length 113
03:18:39.169033 IP node3.47016 > node2.51687: UDP, length 113
03:18:39.169543 IP node3.48961 > node2.51687: UDP, length 113
03:18:39.169703 IP node3.36712 > node2.51687: UDP, length 113
03:18:39.170161 IP node3.45962 > node2.51687: UDP, length 113
03:18:39.170599 IP node3.39872 > node2.51687: UDP, length 113
03:18:39.170737 IP node3.34875 > node2.51687: UDP, length 113
03:18:39.172781 IP node3.59829 > node2.51687: UDP, length 113
03:18:39.173669 IP node3.54133 > node2.51687: UDP, length 113
03:18:39.174475 IP node3.35778 > node2.51687: UDP, length 113
03:18:39.174551 IP node3.45327 > node2.51687: UDP, length 113
03:18:39.183576 IP node3.54995 > node4.54807: UDP, length 113
03:18:39.184068 IP node3.54995 > node4.42769: UDP, length 113
03:18:39.184271 IP node3.54995 > node4.38406: UDP, length 113
03:18:39.184616 IP node3.54995 > node2.51828: UDP, length 113
03:18:39.184829 IP node3.54995 > node1.38885: UDP, length 113
03:18:39.185669 IP node3.54995 > node4.33103: UDP, length 113
03:18:39.187907 IP node3.54995 > node4.52495: UDP, length 113
03:18:39.188424 IP node3.54995 > node1.34107: UDP, length 113
03:18:39.188891 IP node3.54995 > node2.59355: UDP, length 113
03:18:39.189629 IP node3.54995 > node2.55804: UDP, length 113
03:18:39.189890 IP node3.54995 > node4.33946: UDP, length 113
03:18:39.190150 IP node3.54995 > node2.51687: UDP, length 113
03:18:39.194028 IP node3.48961 > node2.42922: UDP, length 113
03:18:39.194698 IP node3.45962 > node2.42922: UDP, length 113
03:18:39.195940 IP node3.47016 > node2.42922: UDP, length 113
03:18:39.196453 IP node3.39872 > node2.42922: UDP, length 113
03:18:39.196530 IP node3.45327 > node2.42922: UDP, length 113
03:18:39.197313 IP node3.51519 > node2.42922: UDP, length 113
03:18:39.199883 IP node3.45962 > node2.59588: UDP, length 113
03:18:39.199950 IP node3.51519 > node2.59588: UDP, length 113
03:18:39.200127 IP node3.48961 > node2.59588: UDP, length 113
03:18:39.200477 IP node3.45327 > node2.59588: UDP, length 113
03:18:39.201117 IP node3.39872 > node2.59588: UDP, length 113
03:18:39.201741 IP node3.35778 > node2.59588: UDP, length 113
03:18:39.202925 IP node3.36712 > node2.42922: UDP, length 113
03:18:39.203942 IP node3.47016 > node2.59588: UDP, length 113
03:18:39.204576 IP node3.34875 > node2.42922: UDP, length 113
03:18:39.204688 IP node3.34875 > node2.59588: UDP, length 113
03:18:39.205504 IP node3.54133 > node2.42922: UDP, length 113
03:18:39.205610 IP node3.54133 > node2.59588: UDP, length 113
03:18:39.206086 IP node3.59829 > node2.59588: UDP, length 113
03:18:39.207662 IP node3.59829 > node2.42922: UDP, length 113
03:18:39.208466 IP node3.36712 > node2.59588: UDP, length 113
03:18:39.209341 IP node3.35778 > node2.42922: UDP, length 113
03:18:39.212533 IP node3.54995 > node2.42922: UDP, length 113
03:18:39.213085 IP node3.33254 > node2.51687: UDP, length 113
03:18:39.213544 IP node3.33254 > node2.42922: UDP, length 113
03:18:39.213663 IP node3.33254 > node2.59588: UDP, length 113
03:18:39.217609 IP node3.54995 > node2.59588: UDP, length 113
03:18:39.218284 IP node3.52820 > node2.51687: UDP, length 113
03:18:39.218431 IP node3.52820 > node2.42922: UDP, length 113
03:18:39.218524 IP node3.52820 > node2.59588: UDP, length 113
03:18:39.270211 IP node3.45122 > node2.38998: UDP, length 113
03:18:39.270301 IP node3.45122 > node4.38585: UDP, length 113
03:18:39.270453 IP node3.45122 > node2.41342: UDP, length 113
03:18:39.270976 IP node3.45122 > node2.57596: UDP, length 113
03:18:39.271069 IP node3.45122 > node4.54807: UDP, length 113
03:18:39.271201 IP node3.45122 > node2.42922: UDP, length 113
03:18:39.271281 IP node3.45122 > node4.42769: UDP, length 113
03:18:39.271470 IP node3.45122 > node2.59355: UDP, length 113
03:18:39.271557 IP node3.45122 > node4.42581: UDP, length 113
03:18:39.271637 IP node3.45122 > node2.51687: UDP, length 113
03:18:39.271715 IP node3.45122 > node2.43123: UDP, length 113
03:18:39.271798 IP node3.45122 > node1.34107: UDP, length 113
03:18:39.271882 IP node3.45122 > node4.33103: UDP, length 113
03:18:39.272076 IP node3.45122 > node4.50209: UDP, length 113
03:18:39.272160 IP node3.45122 > node1.38885: UDP, length 113
03:18:39.272243 IP node3.45122 > node4.33946: UDP, length 113
03:18:39.276236 IP node3.45122 > node4.52495: UDP, length 113
03:18:39.276400 IP node3.45122 > node2.51828: UDP, length 113
03:18:39.276533 IP node3.45122 > node2.55804: UDP, length 113
03:18:39.276639 IP node3.45122 > node2.45280: UDP, length 113
03:18:39.276728 IP node3.45122 > node4.51437: UDP, length 113
03:18:39.276827 IP node3.45122 > node4.38406: UDP, length 113
03:18:39.276914 IP node3.45122 > node2.59588: UDP, length 113
03:18:39.302418 IP node3.46934 > node4.38585: UDP, length 113
03:18:39.302838 IP node3.46934 > node2.43123: UDP, length 113
03:18:39.307603 IP node3.46934 > node2.41342: UDP, length 113
03:18:39.307942 IP node3.46934 > node2.45280: UDP, length 113
03:18:39.308191 IP node3.46934 > node4.42581: UDP, length 113
03:18:39.310067 IP node3.46934 > node4.51437: UDP, length 113
03:18:39.310305 IP node3.46934 > node4.50209: UDP, length 113
03:18:39.310542 IP node3.46934 > node2.57596: UDP, length 113
03:18:39.310767 IP node3.46934 > node4.54807: UDP, length 113
03:18:39.310968 IP node3.54317 > node2.45280: UDP, length 113
03:18:39.311119 IP node3.46934 > node4.42769: UDP, length 113
03:18:39.311775 IP node3.46934 > node4.38406: UDP, length 113
03:18:39.312096 IP node3.46934 > node2.51828: UDP, length 113
03:18:39.312425 IP node3.46934 > node1.38885: UDP, length 113
03:18:39.313227 IP node3.46934 > node4.33103: UDP, length 113
03:18:39.313646 IP node3.46934 > node4.52495: UDP, length 113
03:18:39.313901 IP node3.46934 > node1.34107: UDP, length 113
03:18:39.342507 IP node3.46934 > node2.38998: UDP, length 113
03:18:39.344811 IP node3.46934 > node2.55804: UDP, length 113
03:18:39.353028 IP node3.46934 > node2.59355: UDP, length 113
03:18:39.353291 IP node3.46934 > node2.51687: UDP, length 113
03:18:39.354160 IP node3.46934 > node4.33946: UDP, length 113
03:18:39.354360 IP node3.46934 > node2.59588: UDP, length 113
03:18:39.361935 IP node3.39872 > node2.46463: UDP, length 113
03:18:39.362117 IP node3.51519 > node2.46463: UDP, length 113
03:18:39.362457 IP node3.33254 > node2.46463: UDP, length 113
03:18:39.363787 IP node3.45962 > node2.46463: UDP, length 113
03:18:39.365016 IP node3.45327 > node2.46463: UDP, length 113
03:18:39.365268 IP node3.34875 > node2.46463: UDP, length 113
03:18:39.365691 IP node3.47016 > node2.46463: UDP, length 113
03:18:39.365981 IP node3.35778 > node2.46463: UDP, length 113
03:18:39.366260 IP node3.59829 > node2.46463: UDP, length 113
03:18:39.366437 IP node3.48961 > node2.46463: UDP, length 113
03:18:39.366950 IP node3.54133 > node2.46463: UDP, length 113
03:18:39.368887 IP node3.36712 > node2.46463: UDP, length 113
03:18:39.370219 IP node3.45122 > node2.46463: UDP, length 113
03:18:39.370676 IP node3.46934 > node2.42922: UDP, length 113
03:18:39.371498 IP node3.54995 > node2.46463: UDP, length 113
03:18:39.373977 IP node3.52820 > node2.46463: UDP, length 113
03:18:39.384703 IP node3.54317 > node2.57596: UDP, length 113
03:18:39.384942 IP node3.54317 > node4.50209: UDP, length 113
03:18:39.385346 IP node3.54317 > node4.54807: UDP, length 113
03:18:39.385469 IP node3.54317 > node4.42769: UDP, length 113
03:18:39.385590 IP node3.54317 > node2.51828: UDP, length 113
03:18:39.385731 IP node3.54317 > node4.51437: UDP, length 113
03:18:39.385838 IP node3.54317 > node4.42581: UDP, length 113
03:18:39.386013 IP node3.54317 > node1.38885: UDP, length 113
03:18:39.386291 IP node3.54317 > node4.38406: UDP, length 113
03:18:39.398777 IP node3.54317 > node4.33103: UDP, length 113
03:18:39.400762 IP node3.54317 > node1.34107: UDP, length 113
03:18:39.401051 IP node3.54317 > node2.55804: UDP, length 113
03:18:39.401171 IP node3.54317 > node2.59355: UDP, length 113
03:18:39.401376 IP node3.54317 > node4.33946: UDP, length 113
03:18:39.401476 IP node3.54317 > node2.51687: UDP, length 113
03:18:39.401622 IP node3.54317 > node2.42922: UDP, length 113
03:18:39.401727 IP node3.54317 > node2.59588: UDP, length 113
03:18:39.405800 IP node3.45962 > node2.44241: UDP, length 113
03:18:39.406671 IP node3.45962 > node2.33710: UDP, length 113
03:18:39.409397 IP node3.54995 > node2.44241: UDP, length 113
03:18:39.410100 IP node3.54995 > node2.33710: UDP, length 113
03:18:39.410979 IP node3.52820 > node2.44241: UDP, length 113
03:18:39.411096 IP node3.33254 > node2.44241: UDP, length 113
03:18:39.411203 IP node3.33254 > node2.33710: UDP, length 113
03:18:39.412316 IP node3.45327 > node2.44241: UDP, length 113
03:18:39.412442 IP node3.45327 > node2.33710: UDP, length 113
03:18:39.412482 IP node3.39872 > node2.44241: UDP, length 113
03:18:39.412536 IP node3.39872 > node2.33710: UDP, length 113
03:18:39.413129 IP node3.47016 > node2.44241: UDP, length 113
03:18:39.413207 IP node3.47016 > node2.33710: UDP, length 113
03:18:39.413575 IP node3.35778 > node2.44241: UDP, length 113
03:18:39.413816 IP node3.34875 > node2.44241: UDP, length 113
03:18:39.415427 IP node3.34875 > node2.33710: UDP, length 113
03:18:39.415932 IP node3.52820 > node2.33710: UDP, length 113
03:18:39.417376 IP node3.36712 > node2.44241: UDP, length 113
03:18:39.417572 IP node3.36712 > node2.33710: UDP, length 113
03:18:39.419683 IP node3.59829 > node2.44241: UDP, length 113
03:18:39.421813 IP node3.54133 > node2.44241: UDP, length 113
03:18:39.423401 IP node3.51519 > node2.44241: UDP, length 113
03:18:39.423562 IP node3.51519 > node2.33710: UDP, length 113
03:18:39.424930 IP node3.48961 > node2.44241: UDP, length 113
03:18:39.425205 IP node3.48961 > node2.33710: UDP, length 113
03:18:39.427219 IP node3.35778 > node2.33710: UDP, length 113
03:18:39.427894 IP node3.54133 > node2.33710: UDP, length 113
03:18:39.428728 IP node3.45122 > node2.44241: UDP, length 113
03:18:39.428856 IP node3.45122 > node2.33710: UDP, length 113
03:18:39.429076 IP node3.59829 > node2.33710: UDP, length 113
03:18:39.429369 IP node3.54317 > node4.52495: UDP, length 113
03:18:39.430906 IP node3.54317 > node2.46463: UDP, length 113
03:18:39.431021 IP node3.54317 > node2.44241: UDP, length 113
03:18:39.431209 IP node3.54317 > node2.33710: UDP, length 113
03:18:39.436441 IP node3.46934 > node2.46463: UDP, length 113
03:18:39.436779 IP node3.46934 > node2.44241: UDP, length 113
03:18:39.436991 IP node3.46934 > node2.33710: UDP, length 113
03:18:39.439485 IP node3.47016 > node2.35704: UDP, length 113
03:18:39.439673 IP node3.39872 > node2.35704: UDP, length 113
03:18:39.440721 IP node3.45327 > node2.35704: UDP, length 113
03:18:39.441299 IP node3.34875 > node2.35704: UDP, length 113
03:18:39.442687 IP node3.45962 > node2.35704: UDP, length 113
03:18:39.442975 IP node3.35778 > node2.35704: UDP, length 113
03:18:39.443987 IP node3.36712 > node2.35704: UDP, length 113
03:18:39.444222 IP node3.54995 > node2.35704: UDP, length 113
03:18:39.444361 IP node3.33254 > node2.35704: UDP, length 113
03:18:39.444579 IP node3.51519 > node2.35704: UDP, length 113
03:18:39.445137 IP node3.52820 > node2.35704: UDP, length 113
03:18:39.445243 IP node3.54133 > node2.35704: UDP, length 113
03:18:39.445464 IP node3.59829 > node2.35704: UDP, length 113
03:18:39.445864 IP node3.48961 > node2.35704: UDP, length 113
03:18:39.446636 IP node3.45122 > node2.35704: UDP, length 113
03:18:39.446855 IP node3.46934 > node2.35704: UDP, length 113
03:18:39.447622 IP node3.54317 > node2.35704: UDP, length 113
03:18:39.470181 IP node3.48961 > node4.52656: UDP, length 113
03:18:39.470489 IP node3.45962 > node4.52656: UDP, length 113
03:18:39.471446 IP node3.33254 > node4.52656: UDP, length 113
03:18:39.471665 IP node3.34875 > node4.52656: UDP, length 113
03:18:39.472758 IP node3.39872 > node4.52656: UDP, length 113
03:18:39.473193 IP node3.54995 > node4.52656: UDP, length 113
03:18:39.473570 IP node3.51519 > node4.52656: UDP, length 113
03:18:39.473866 IP node3.47016 > node4.52656: UDP, length 113
03:18:39.474111 IP node3.36712 > node4.52656: UDP, length 113
03:18:39.477378 IP node3.45327 > node4.52656: UDP, length 113
03:18:39.477726 IP node3.54133 > node4.52656: UDP, length 113
03:18:39.478260 IP node3.52820 > node4.52656: UDP, length 113
03:18:39.478843 IP node3.35778 > node4.52656: UDP, length 113
03:18:39.479011 IP node3.59829 > node4.52656: UDP, length 113
03:18:39.480797 IP node3.46934 > node4.52656: UDP, length 113
03:18:39.481073 IP node3.45122 > node4.52656: UDP, length 113
03:18:39.481990 IP node3.54317 > node4.52656: UDP, length 113
03:18:39.553290 IP node3.39872 > node2.55028: UDP, length 113
03:18:39.554152 IP node3.45327 > node2.55028: UDP, length 113
03:18:39.567152 IP node3.35778 > node2.55028: UDP, length 113
03:18:39.569129 IP node3.52820 > node2.55028: UDP, length 113
03:18:39.571693 IP node3.54995 > node2.55028: UDP, length 113
03:18:39.573228 IP node3.51519 > node2.55028: UDP, length 113
03:18:39.573616 IP node3.45962 > node2.55028: UDP, length 113
03:18:39.574848 IP node3.54133 > node2.55028: UDP, length 113
03:18:39.577790 IP node3.34875 > node2.55028: UDP, length 113
03:18:39.579662 IP node3.46934 > node2.55028: UDP, length 113
03:18:39.588571 IP node3.47016 > node2.55028: UDP, length 113
03:18:39.590090 IP node3.34875 > node2.40178: UDP, length 113
03:18:39.590247 IP node3.52820 > node2.40178: UDP, length 113
03:18:39.591323 IP node3.54995 > node2.40178: UDP, length 113
03:18:39.591637 IP node3.35778 > node2.40178: UDP, length 113
03:18:39.591939 IP node3.45962 > node2.40178: UDP, length 113
03:18:39.592125 IP node3.51519 > node2.40178: UDP, length 113
03:18:39.592905 IP node3.54133 > node2.40178: UDP, length 113
03:18:39.593932 IP node3.47016 > node2.40178: UDP, length 113
03:18:39.594017 IP node3.46934 > node2.40178: UDP, length 113
03:18:39.594384 IP node3.45327 > node2.40178: UDP, length 113
03:18:39.594938 IP node3.39872 > node2.40178: UDP, length 113
03:18:39.595469 IP node3.34875 > node2.60148: UDP, length 113
03:18:39.596295 IP node3.45962 > node2.60148: UDP, length 113
03:18:39.596780 IP node3.45327 > node2.60148: UDP, length 113
03:18:39.597025 IP node3.35778 > node2.60148: UDP, length 113
03:18:39.597913 IP node3.54995 > node2.60148: UDP, length 113
03:18:39.598454 IP node3.51519 > node2.60148: UDP, length 113
03:18:39.598937 IP node3.54133 > node2.60148: UDP, length 113
