03:18:35.460588 IP node4.52656 > node2.55028: UDP, length 113
03:18:35.460833 IP node4.52656 > node2.42922: UDP, length 113
03:18:35.460952 IP node4.52656 > node2.46463: UDP, length 113
03:18:35.461085 IP node4.52656 > node2.44241: UDP, length 113
03:18:35.461210 IP node4.52656 > node2.35704: UDP, length 113
03:18:35.461329 IP node4.52656 > node2.33710: UDP, length 113
03:18:35.461454 IP node4.52656 > node2.59588: UDP, length 113
03:18:35.461626 IP node4.52656 > node2.51687: UDP, length 113
03:18:35.469476 IP node4.52656 > node2.40178: UDP, length 113
03:18:35.475346 IP node4.52656 > node2.60148: UDP, length 113
03:18:35.490033 IP node4.52656 > node2.54999: UDP, length 113
03:18:35.559053 IP node4.52656 > node2.39546: UDP, length 113
03:18:35.718505 IP node4.52656 > node2.40763: UDP, length 113
03:18:35.743083 IP node4.52656 > node2.57500: UDP, length 113
03:18:36.022586 IP node4.42687 > node2.40178: UDP, length 113
03:18:36.026747 IP node4.42687 > node2.40763: UDP, length 113
03:18:36.026944 IP node4.42687 > node2.54999: UDP, length 113
03:18:36.027206 IP node4.42687 > node2.39546: UDP, length 113
03:18:36.027571 IP node4.42687 > node2.57500: UDP, length 113
03:18:36.038929 IP node4.42687 > node2.60148: UDP, length 113
03:18:36.295050 IP node4.42010 > node2.57500: UDP, length 112
03:18:36.900392 IP node4.42010 > node3.35778: UDP, length 112
03:18:36.904640 IP node4.58818 > node3.35778: UDP, length 112
03:18:36.905389 IP node4.42687 > node3.35778: UDP, length 113
03:18:36.905681 IP node4.52656 > node3.35778: UDP, length 113
03:18:36.931819 IP node4.43211 > node3.35778: UDP, length 113
03:18:36.942340 IP node4.52656 > node3.36712: UDP, length 113
03:18:36.943582 IP node4.58818 > node3.36712: UDP, length 112
03:18:36.943900 IP node4.42010 > node3.36712: UDP, length 112
03:18:36.944210 IP node4.42687 > node3.36712: UDP, length 113
03:18:36.944582 IP node4.43211 > node3.36712: UDP, length 113
03:18:36.983673 IP node4.42687 > node3.59829: UDP, length 113
03:18:36.983927 IP node4.52656 > node3.59829: UDP, length 113
03:18:36.984053 IP node4.42010 > node3.59829: UDP, length 112
03:18:36.985305 IP node4.43211 > node3.59829: UDP, length 113
03:18:36.986128 IP node4.58818 > node3.59829: UDP, length 112
03:18:37.084353 IP node4.57668 > node3.35778: UDP, length 112
03:18:37.084858 IP node4.57668 > node3.36712: UDP, length 112
03:18:37.085338 IP node4.57668 > node3.59829: UDP, length 112
03:18:37.203610 IP node4.54313 > node3.36712: UDP, length 113
03:18:37.203844 IP node4.54313 > node3.35778: UDP, length 113
03:18:37.203992 IP node4.54313 > node3.59829: UDP, length 113
03:18:37.207587 IP node4.58818 > node2.44932: UDP, length 112
03:18:37.207859 IP node4.42687 > node2.44932: UDP, length 113
03:18:37.207931 IP node4.52656 > node2.44932: UDP, length 113
03:18:37.208219 IP node4.42010 > node2.44932: UDP, length 112
03:18:37.208558 IP node4.57668 > node2.44932: UDP, length 112
03:18:37.208749 IP node4.43211 > node2.44932: UDP, length 113
03:18:37.237270 IP node4.54313 > node2.44932: UDP, length 113
03:18:37.249383 IP node4.43211 > node3.45962: UDP, length 113
03:18:37.250771 IP node4.52656 > node3.45962: UDP, length 113
03:18:37.251376 IP node4.42010 > node3.45962: UDP, length 112
03:18:37.251888 IP node4.58818 > node3.45962: UDP, length 112
03:18:37.252476 IP node4.42687 > node3.45962: UDP, length 113
03:18:37.254617 IP node4.57668 > node3.45962: UDP, length 112
03:18:37.270734 IP node4.54313 > node3.45962: UDP, length 113
03:18:37.350468 IP node4.38296 > node3.36712: UDP, length 113
03:18:37.354951 IP node4.38296 > node3.59829: UDP, length 113
03:18:37.355984 IP node4.38296 > node2.44932: UDP, length 113
03:18:37.356232 IP node4.38296 > node3.45962: UDP, length 113
03:18:37.360591 IP node4.38296 > node3.35778: UDP, length 113
03:18:37.383459 IP node4.44881 > node3.36712: UDP, length 112
03:18:37.383747 IP node4.44881 > node3.59829: UDP, length 112
03:18:37.384695 IP node4.44881 > node2.44932: UDP, length 112
03:18:37.384955 IP node4.44881 > node3.45962: UDP, length 112
03:18:37.414203 IP node4.44881 > node3.35778: UDP, length 112
03:18:37.439527 IP node4.58818 > node3.48961: UDP, length 112
03:18:37.439836 IP node4.52656 > node3.48961: UDP, length 113
03:18:37.439931 IP node4.42687 > node3.48961: UDP, length 113
03:18:37.439993 IP node4.42010 > node3.48961: UDP, length 112
03:18:37.441728 IP node4.43211 > node2.50082: UDP, length 113
03:18:37.442531 IP node4.43211 > node3.48961: UDP, length 113
03:18:37.443394 IP node4.52656 > node2.50082: UDP, length 113
03:18:37.443751 IP node4.57668 > node2.50082: UDP, length 112
03:18:37.443825 IP node4.57668 > node3.48961: UDP, length 112
03:18:37.444034 IP node4.54313 > node3.48961: UDP, length 113
03:18:37.444277 IP node4.54313 > node2.50082: UDP, length 113
03:18:37.445519 IP node4.42010 > node2.50082: UDP, length 112
03:18:37.445685 IP node4.42687 > node2.50082: UDP, length 113
03:18:37.447282 IP node4.35965 > node3.59829: UDP, length 113
03:18:37.448540 IP node4.58818 > node2.50082: UDP, length 112
03:18:37.453926 IP node4.44881 > node3.48961: UDP, length 112
03:18:37.454387 IP node4.44881 > node2.50082: UDP, length 112
03:18:37.455536 IP node4.35965 > node2.44932: UDP, length 113
03:18:37.456575 IP node4.35965 > node3.45962: UDP, length 113
03:18:37.494847 IP node4.38296 > node3.48961: UDP, length 113
03:18:37.495184 IP node4.38296 > node2.50082: UDP, length 113
03:18:37.518018 IP node4.58818 > node3.54133: UDP, length 112
03:18:37.519063 IP node4.43211 > node3.54133: UDP, length 113
03:18:37.519200 IP node4.42687 > node3.54133: UDP, length 113
03:18:37.519701 IP node4.42010 > node3.54133: UDP, length 112
03:18:37.521400 IP node4.52656 > node3.54133: UDP, length 113
03:18:37.522235 IP node4.57668 > node3.54133: UDP, length 112
03:18:37.529416 IP node4.54313 > node3.54133: UDP, length 113
03:18:37.531262 IP node4.44881 > node3.54133: UDP, length 112
03:18:37.531995 IP node4.38296 > node3.54133: UDP, length 113
03:18:37.546736 IP node4.35965 > node3.48961: UDP, length 113
03:18:37.547155 IP node4.35965 > node3.54133: UDP, length 113
03:18:37.547594 IP node4.35965 > node2.50082: UDP, length 113
03:18:37.549207 IP node4.58599 > node3.36712: UDP, length 113
03:18:37.560194 IP node4.58599 > node2.44932: UDP, length 113
03:18:37.560456 IP node4.58599 > node3.45962: UDP, length 113
03:18:37.560725 IP node4.58599 > node3.54133: UDP, length 113
03:18:37.560813 IP node4.58599 > node2.50082: UDP, length 113
03:18:37.560979 IP node4.58599 > node3.48961: UDP, length 113
03:18:37.572852 IP node4.40739 > node3.59829: UDP, length 112
03:18:37.573374 IP node4.40739 > node2.44932: UDP, length 112
03:18:37.573546 IP node4.40739 > node3.45962: UDP, length 112
03:18:37.573784 IP node4.40739 > node3.54133: UDP, length 112
03:18:37.573925 IP node4.40739 > node2.50082: UDP, length 112
03:18:37.573974 IP node4.40739 > node3.48961: UDP, length 112
03:18:37.581414 IP node4.58599 > node3.59829: UDP, length 113
03:18:37.631149 IP node4.40739 > node3.36712: UDP, length 112
03:18:37.668100 IP node4.41947 > node2.44932: UDP, length 113
03:18:37.668345 IP node4.41947 > node3.45962: UDP, length 113
03:18:37.668895 IP node4.41947 > node3.54133: UDP, length 113
03:18:37.669024 IP node4.41947 > node2.50082: UDP, length 113
03:18:37.669136 IP node4.41947 > node3.48961: UDP, length 113
03:18:37.728378 IP node4.58818 > node2.38346: UDP, length 112
03:18:37.728770 IP node4.42010 > node2.38346: UDP, length 112
03:18:37.731285 IP node4.38296 > node2.38346: UDP, length 113
03:18:37.731774 IP node4.54313 > node2.38346: UDP, length 113
03:18:37.732030 IP node4.44881 > node2.38346: UDP, length 112
03:18:37.732528 IP node4.57668 > node2.38346: UDP, length 112
03:18:37.733950 IP node4.42687 > node2.38346: UDP, length 113
03:18:37.734432 IP node4.52656 > node2.38346: UDP, length 113
03:18:37.739556 IP node4.41947 > node2.38346: UDP, length 113
03:18:37.741360 IP node4.35965 > node2.38346: UDP, length 113
03:18:37.743107 IP node4.43211 > node2.38346: UDP, length 113
03:18:37.744590 IP node4.58599 > node2.38346: UDP, length 113
03:18:37.745566 IP node4.40739 > node2.38346: UDP, length 112
03:18:37.775546 IP node4.58818 > node3.39872: UDP, length 112
03:18:37.775729 IP node4.54313 > node3.39872: UDP, length 113
03:18:37.776493 IP node4.43211 > node3.39872: UDP, length 113
03:18:37.776960 IP node4.42687 > node3.39872: UDP, length 113
03:18:37.777030 IP node4.44881 > node3.39872: UDP, length 112
03:18:37.778767 IP node4.57668 > node3.39872: UDP, length 112
03:18:37.779085 IP node4.42010 > node3.39872: UDP, length 112
03:18:37.779610 IP node4.35965 > node3.39872: UDP, length 113
03:18:37.779906 IP node4.52656 > node3.39872: UDP, length 113
03:18:37.780792 IP node4.38296 > node3.39872: UDP, length 113
03:18:37.780869 IP node4.40739 > node3.39872: UDP, length 112
03:18:37.781398 IP node4.58599 > node3.39872: UDP, length 113
03:18:37.783704 IP node4.41947 > node3.39872: UDP, length 113
03:18:37.819608 IP node4.54313 > node3.45327: UDP, length 113
03:18:37.822962 IP node4.43211 > node3.45327: UDP, length 113
03:18:37.823909 IP node4.38296 > node3.45327: UDP, length 113
03:18:37.825944 IP node4.57668 > node3.45327: UDP, length 112
03:18:37.826064 IP node4.58599 > node3.45327: UDP, length 113
03:18:37.826855 IP node4.52656 > node3.45327: UDP, length 113
03:18:37.831017 IP node4.58818 > node3.45327: UDP, length 112
03:18:37.831923 IP node4.42687 > node3.45327: UDP, length 113
03:18:37.832089 IP node4.35965 > node3.45327: UDP, length 113
03:18:37.833132 IP node4.42010 > node3.45327: UDP, length 112
03:18:37.834509 IP node4.44881 > node3.45327: UDP, length 112
03:18:37.836897 IP node4.41947 > node3.45327: UDP, length 113
03:18:37.837683 IP node4.40739 > node3.45327: UDP, length 112
03:18:37.838712 IP node4.38585 > node2.44932: UDP, length 112
03:18:37.838853 IP node4.38585 > node3.45962: UDP, length 112
03:18:37.852854 IP node4.38585 > node3.48961: UDP, length 112
03:18:37.853169 IP node4.38585 > node2.50082: UDP, length 112
03:18:37.853457 IP node4.38585 > node3.54133: UDP, length 112
03:18:37.854574 IP node4.38585 > node2.38346: UDP, length 112
03:18:37.855463 IP node4.38585 > node3.39872: UDP, length 112
03:18:37.871705 IP node4.58599 > node2.43123: UDP, length 113
03:18:37.871952 IP node4.43211 > node2.43123: UDP, length 113
03:18:37.873508 IP node4.42687 > node2.43123: UDP, length 113
03:18:37.873775 IP node4.35965 > node2.43123: UDP, length 113
03:18:37.873906 IP node4.54313 > node2.43123: UDP, length 113
03:18:37.874169 IP node4.38296 > node2.43123: UDP, length 113
03:18:37.874384 IP node4.57668 > node2.43123: UDP, length 112
03:18:37.875404 IP node4.52656 > node2.43123: UDP, length 113
03:18:37.875721 IP node4.44881 > node2.43123: UDP, length 112
03:18:37.881414 IP node4.40739 > node2.43123: UDP, length 112
03:18:37.882183 IP node4.58818 > node2.43123: UDP, length 112
03:18:37.882467 IP node4.42010 > node2.43123: UDP, length 112
03:18:37.882746 IP node4.41947 > node2.43123: UDP, length 113
03:18:37.887016 IP node4.38585 > node3.45327: UDP, length 112
03:18:37.916850 IP node4.58599 > node2.38998: UDP, length 113
03:18:37.919080 IP node4.54313 > node2.38998: UDP, length 113
03:18:37.919912 IP node4.43211 > node2.38998: UDP, length 113
03:18:37.921545 IP node4.57668 > node2.38998: UDP, length 112
03:18:37.922874 IP node4.38296 > node2.38998: UDP, length 113
03:18:37.923530 IP node4.41947 > node2.38998: UDP, length 113
03:18:37.923653 IP node4.35965 > node2.38998: UDP, length 113
03:18:37.924103 IP node4.58818 > node2.38998: UDP, length 112
03:18:37.924449 IP node4.43211 > node3.34875: UDP, length 113
03:18:37.924494 IP node4.42010 > node3.34875: UDP, length 112
03:18:37.925588 IP node4.52656 > node2.38998: UDP, length 113
03:18:37.925724 IP node4.54313 > node3.34875: UDP, length 113
03:18:37.926213 IP node4.58599 > node3.34875: UDP, length 113
03:18:37.927120 IP node4.42687 > node2.38998: UDP, length 113
03:18:37.927289 IP node4.41947 > node3.34875: UDP, length 113
03:18:37.927643 IP node4.42010 > node2.38998: UDP, length 112
03:18:37.928571 IP node4.58818 > node3.34875: UDP, length 112
03:18:37.928730 IP node4.42687 > node3.34875: UDP, length 113
03:18:37.928837 IP node4.57668 > node3.34875: UDP, length 112
03:18:37.929334 IP node4.52656 > node3.34875: UDP, length 113
03:18:37.929762 IP node4.38296 > node3.34875: UDP, length 113
03:18:37.930579 IP node4.40739 > node2.38998: UDP, length 112
03:18:37.930669 IP node4.35965 > node3.34875: UDP, length 113
03:18:37.930747 IP node4.40739 > node3.34875: UDP, length 112
03:18:37.934060 IP node4.44881 > node2.38998: UDP, length 112
03:18:37.934826 IP node4.44881 > node3.34875: UDP, length 112
03:18:37.954332 IP node4.56064 > node2.44932: UDP, length 112
03:18:37.954542 IP node4.56064 > node3.45962: UDP, length 112
03:18:37.957817 IP node4.50849 > node3.59829: UDP, length 113
03:18:37.960877 IP node4.38585 > node2.43123: UDP, length 112
03:18:37.962775 IP node4.38585 > node3.34875: UDP, length 112
03:18:37.964088 IP node4.50849 > node2.44932: UDP, length 113
03:18:37.966537 IP node4.38585 > node2.38998: UDP, length 112
03:18:37.967528 IP node4.50849 > node3.45962: UDP, length 113
03:18:37.970066 IP node4.50849 > node3.48961: UDP, length 113
03:18:37.970334 IP node4.50849 > node2.50082: UDP, length 113
03:18:37.970554 IP node4.50849 > node3.54133: UDP, length 113
03:18:37.973454 IP node4.50849 > node2.38346: UDP, length 113
03:18:37.973981 IP node4.50849 > node3.39872: UDP, length 113
03:18:37.974625 IP node4.50849 > node3.45327: UDP, length 113
03:18:37.975096 IP node4.50849 > node2.43123: UDP, length 113
03:18:37.975304 IP node4.50849 > node2.38998: UDP, length 113
03:18:37.975523 IP node4.50849 > node3.34875: UDP, length 113
03:18:37.985372 IP node4.43211 > node3.47016: UDP, length 113
03:18:37.986088 IP node4.58599 > node3.47016: UDP, length 113
03:18:37.986558 IP node4.54313 > node3.47016: UDP, length 113
03:18:37.987034 IP node4.42687 > node3.47016: UDP, length 113
03:18:37.988569 IP node4.40739 > node3.47016: UDP, length 112
03:18:37.989821 IP node4.58818 > node3.47016: UDP, length 112
03:18:37.990048 IP node4.38296 > node3.47016: UDP, length 113
03:18:37.990396 IP node4.41947 > node3.47016: UDP, length 113
03:18:37.990756 IP node4.35965 > node3.47016: UDP, length 113
03:18:37.990980 IP node4.57668 > node3.47016: UDP, length 112
03:18:37.991400 IP node4.50849 > node3.47016: UDP, length 113
03:18:37.991958 IP node4.42010 > node3.47016: UDP, length 112
03:18:37.992598 IP node4.52656 > node3.47016: UDP, length 113
03:18:37.993740 IP node4.58599 > node2.41342: UDP, length 113
03:18:37.993940 IP node4.44881 > node3.47016: UDP, length 112
03:18:37.994342 IP node4.54313 > node2.41342: UDP, length 113
03:18:37.995472 IP node4.43211 > node2.41342: UDP, length 113
03:18:37.996265 IP node4.57668 > node2.41342: UDP, length 112
03:18:37.996690 IP node4.58818 > node2.41342: UDP, length 112
03:18:37.997263 IP node4.42687 > node2.41342: UDP, length 113
03:18:37.998185 IP node4.42010 > node2.41342: UDP, length 112
03:18:37.998532 IP node4.41947 > node2.41342: UDP, length 113
03:18:37.999467 IP node4.52656 > node2.41342: UDP, length 113
03:18:37.999619 IP node4.44881 > node2.41342: UDP, length 112
03:18:37.999727 IP node4.56064 > node3.48961: UDP, length 112
03:18:38.000398 IP node4.40739 > node2.41342: UDP, length 112
03:18:38.000462 IP node4.38296 > node2.41342: UDP, length 113
03:18:38.000970 IP node4.56064 > node2.50082: UDP, length 112
03:18:38.001119 IP node4.50849 > node2.41342: UDP, length 113
03:18:38.001177 IP node4.35965 > node2.41342: UDP, length 113
03:18:38.003171 IP node4.56064 > node3.54133: UDP, length 112
03:18:38.004947 IP node4.56064 > node2.38346: UDP, length 112
03:18:38.005852 IP node4.56064 > node3.39872: UDP, length 112
03:18:38.006148 IP node4.56064 > node3.45327: UDP, length 112
03:18:38.009107 IP node4.38585 > node2.41342: UDP, length 112
03:18:38.009321 IP node4.38585 > node3.47016: UDP, length 112
03:18:38.037357 IP node4.56064 > node2.43123: UDP, length 112
03:18:38.037790 IP node4.56064 > node2.38998: UDP, length 112
03:18:38.047592 IP node4.56064 > node3.34875: UDP, length 112
03:18:38.048482 IP node4.58599 > node2.45280: UDP, length 113
03:18:38.048897 IP node4.50849 > node2.45280: UDP, length 113
03:18:38.050515 IP node4.42687 > node2.45280: UDP, length 113
03:18:38.051100 IP node4.38296 > node2.45280: UDP, length 113
03:18:38.051716 IP node4.43211 > node2.45280: UDP, length 113
03:18:38.052423 IP node4.54313 > node2.45280: UDP, length 113
03:18:38.052876 IP node4.41947 > node2.45280: UDP, length 113
03:18:38.053106 IP node4.35965 > node2.45280: UDP, length 113
03:18:38.054010 IP node4.56064 > node3.47016: UDP, length 112
03:18:38.054245 IP node4.44881 > node2.45280: UDP, length 112
03:18:38.054348 IP node4.56064 > node2.41342: UDP, length 112
03:18:38.054501 IP node4.57668 > node2.45280: UDP, length 112
03:18:38.055087 IP node4.56064 > node2.45280: UDP, length 112
03:18:38.055616 IP node4.42010 > node2.45280: UDP, length 112
03:18:38.057573 IP node4.40739 > node2.45280: UDP, length 112
03:18:38.057874 IP node4.52656 > node2.45280: UDP, length 113
03:18:38.058271 IP node4.58818 > node2.45280: UDP, length 112
03:18:38.061330 IP node4.38585 > node2.45280: UDP, length 112
03:18:38.081166 IP node4.51437 > node3.48961: UDP, length 113
03:18:38.081565 IP node4.51437 > node2.50082: UDP, length 113
03:18:38.081903 IP node4.51437 > node3.54133: UDP, length 113
03:18:38.085250 IP node4.51437 > node2.38346: UDP, length 113
03:18:38.092681 IP node4.51437 > node3.39872: UDP, length 113
03:18:38.093040 IP node4.51437 > node3.45327: UDP, length 113
03:18:38.097990 IP node4.51437 > node2.38998: UDP, length 113
03:18:38.099761 IP node4.51437 > node2.43123: UDP, length 113
03:18:38.100039 IP node4.51437 > node3.47016: UDP, length 113
03:18:38.100293 IP node4.51437 > node2.41342: UDP, length 113
03:18:38.100607 IP node4.51437 > node2.45280: UDP, length 113
03:18:38.101287 IP node4.42581 > node2.50082: UDP, length 113
03:18:38.104125 IP node4.51437 > node3.34875: UDP, length 113
03:18:38.105150 IP node4.42581 > node3.54133: UDP, length 113
03:18:38.106514 IP node4.42581 > node2.38346: UDP, length 113
03:18:38.107303 IP node4.42581 > node3.39872: UDP, length 113
03:18:38.107577 IP node4.42581 > node3.45327: UDP, length 113
03:18:38.108494 IP node4.42581 > node2.43123: UDP, length 113
03:18:38.108827 IP node4.42581 > node2.38998: UDP, length 113
03:18:38.110680 IP node4.42581 > node3.34875: UDP, length 113
03:18:38.110954 IP node4.42581 > node3.47016: UDP, length 113
03:18:38.111845 IP node4.42581 > node2.41342: UDP, length 113
03:18:38.112534 IP node4.42581 > node2.45280: UDP, length 113
03:18:38.117286 IP node4.43211 > node2.57596: UDP, length 113
03:18:38.117440 IP node4.35965 > node2.57596: UDP, length 113
03:18:38.117972 IP node4.58599 > node2.57596: UDP, length 113
03:18:38.118148 IP node4.54313 > node2.57596: UDP, length 113
03:18:38.118293 IP node4.41947 > node2.57596: UDP, length 113
03:18:38.118485 IP node4.58818 > node2.57596: UDP, length 112
03:18:38.118786 IP node4.42010 > node2.57596: UDP, length 112
03:18:38.119335 IP node4.57668 > node2.57596: UDP, length 112
03:18:38.119850 IP node4.38585 > node2.57596: UDP, length 112
03:18:38.119898 IP node4.40739 > node2.57596: UDP, length 112
03:18:38.120102 IP node4.50849 > node2.57596: UDP, length 113
03:18:38.120365 IP node4.38296 > node2.57596: UDP, length 113
03:18:38.120501 IP node4.56064 > node2.57596: UDP, length 112
03:18:38.120652 IP node4.52656 > node2.57596: UDP, length 113
03:18:38.121314 IP node4.42687 > node2.57596: UDP, length 113
03:18:38.122128 IP node4.44881 > node2.57596: UDP, length 112
03:18:38.127723 IP node4.42581 > node3.48961: UDP, length 113
03:18:38.128132 IP node4.51437 > node2.57596: UDP, length 113
03:18:38.135356 IP node4.42581 > node2.57596: UDP, length 113
03:18:38.180591 IP node4.54807 > node2.38346: UDP, length 113
03:18:38.181915 IP node4.54807 > node3.39872: UDP, length 113
03:18:38.182181 IP node4.54807 > node3.45327: UDP, length 113
03:18:38.182736 IP node4.54807 > node2.43123: UDP, length 113
03:18:38.183455 IP node4.54807 > node2.38998: UDP, length 113
03:18:38.183559 IP node4.54807 > node3.54133: UDP, length 113
03:18:38.184063 IP node4.54807 > node3.34875: UDP, length 113
03:18:38.184393 IP node4.54807 > node3.47016: UDP, length 113
03:18:38.184712 IP node4.54807 > node2.41342: UDP, length 113
03:18:38.185013 IP node4.54807 > node2.45280: UDP, length 113
03:18:38.189943 IP node4.54807 > node2.57596: UDP, length 113
03:18:38.205436 IP node4.54313 > node2.51828: UDP, length 113
03:18:38.206474 IP node4.42581 > node2.51828: UDP, length 113
03:18:38.206604 IP node4.58818 > node2.51828: UDP, length 112
03:18:38.208181 IP node4.42687 > node2.51828: UDP, length 113
03:18:38.208254 IP node4.38296 > node2.51828: UDP, length 113
03:18:38.208411 IP node4.50849 > node2.51828: UDP, length 113
03:18:38.208529 IP node4.43211 > node2.51828: UDP, length 113
03:18:38.208987 IP node4.58599 > node2.51828: UDP, length 113
03:18:38.209315 IP node4.38585 > node2.51828: UDP, length 112
03:18:38.209418 IP node4.42010 > node2.51828: UDP, length 112
03:18:38.209549 IP node4.35965 > node2.51828: UDP, length 113
03:18:38.209860 IP node4.40739 > node2.51828: UDP, length 112
03:18:38.210123 IP node4.44881 > node2.51828: UDP, length 112
03:18:38.210343 IP node4.57668 > node2.51828: UDP, length 112
03:18:38.210652 IP node4.41947 > node2.51828: UDP, length 113
03:18:38.212081 IP node4.52656 > node2.51828: UDP, length 113
03:18:38.213270 IP node4.56064 > node2.51828: UDP, length 112
03:18:38.213977 IP node4.51437 > node2.51828: UDP, length 113
03:18:38.215660 IP node4.38585 > node1.38885: UDP, length 112
03:18:38.216492 IP node4.54313 > node1.38885: UDP, length 113
03:18:38.217081 IP node4.42010 > node1.38885: UDP, length 112
03:18:38.217189 IP node4.38296 > node1.38885: UDP, length 113
03:18:38.217760 IP node4.52656 > node1.38885: UDP, length 113
03:18:38.217948 IP node4.58599 > node1.38885: UDP, length 113
03:18:38.218629 IP node4.43211 > node1.38885: UDP, length 113
03:18:38.218717 IP node4.57668 > node1.38885: UDP, length 112
03:18:38.218837 IP node4.50849 > node1.38885: UDP, length 113
03:18:38.219282 IP node4.56064 > node1.38885: UDP, length 112
03:18:38.219415 IP node4.40739 > node1.38885: UDP, length 112
03:18:38.219753 IP node4.41947 > node1.38885: UDP, length 113
03:18:38.219875 IP node4.51437 > node1.38885: UDP, length 113
03:18:38.220082 IP node4.44881 > node1.38885: UDP, length 112
03:18:38.220132 IP node4.42581 > node1.38885: UDP, length 113
03:18:38.221076 IP node4.35965 > node1.38885: UDP, length 113
03:18:38.221230 IP node4.42687 > node1.38885: UDP, length 113
03:18:38.222847 IP node4.58818 > node1.38885: UDP, length 112
03:18:38.263567 IP node4.54807 > node2.51828: UDP, length 113
03:18:38.263891 IP node4.54807 > node1.38885: UDP, length 113
03:18:38.264040 IP node4.38406 > node3.39872: UDP, length 113
03:18:38.266321 IP node4.50209 > node2.50082: UDP, length 113
03:18:38.266461 IP node4.42769 > node2.38346: UDP, length 113
03:18:38.268480 IP node4.42581 > node3.54995: UDP, length 113
03:18:38.270079 IP node4.50849 > node3.54995: UDP, length 113
03:18:38.270323 IP node4.58599 > node3.54995: UDP, length 113
03:18:38.271235 IP node4.38296 > node3.54995: UDP, length 113
03:18:38.271452 IP node4.54313 > node3.54995: UDP, length 113
03:18:38.272069 IP node4.58818 > node3.54995: UDP, length 112
03:18:38.272976 IP node4.43211 > node3.54995: UDP, length 113
03:18:38.273057 IP node4.42687 > node3.54995: UDP, length 113
03:18:38.273106 IP node4.38585 > node3.54995: UDP, length 112
03:18:38.275539 IP node4.42010 > node3.54995: UDP, length 112
03:18:38.275857 IP node4.41947 > node3.54995: UDP, length 113
03:18:38.276243 IP node4.35965 > node3.54995: UDP, length 113
03:18:38.276498 IP node4.40739 > node3.54995: UDP, length 112
03:18:38.277409 IP node4.44881 > node3.54995: UDP, length 112
03:18:38.278012 IP node4.57668 > node3.54995: UDP, length 112
03:18:38.278232 IP node4.52656 > node3.54995: UDP, length 113
03:18:38.284144 IP node4.42581 > node3.51519: UDP, length 113
03:18:38.284361 IP node4.58818 > node3.51519: UDP, length 112
03:18:38.284750 IP node4.42687 > node3.51519: UDP, length 113
03:18:38.284845 IP node4.50849 > node3.51519: UDP, length 113
03:18:38.287277 IP node4.40739 > node3.51519: UDP, length 112
03:18:38.287647 IP node4.41947 > node3.51519: UDP, length 113
03:18:38.289294 IP node4.52656 > node3.51519: UDP, length 113
03:18:38.289588 IP node4.35965 > node3.51519: UDP, length 113
03:18:38.290098 IP node4.54313 > node3.51519: UDP, length 113
03:18:38.290683 IP node4.44881 > node3.51519: UDP, length 112
03:18:38.290755 IP node4.42010 > node3.51519: UDP, length 112
03:18:38.291083 IP node4.38296 > node3.51519: UDP, length 113
03:18:38.291697 IP node4.43211 > node3.51519: UDP, length 113
03:18:38.291794 IP node4.58599 > node3.51519: UDP, length 113
03:18:38.292070 IP node4.57668 > node3.51519: UDP, length 112
03:18:38.292387 IP node4.38585 > node3.51519: UDP, length 112
03:18:38.293843 IP node4.56064 > node3.54995: UDP, length 112
03:18:38.294609 IP node4.56064 > node3.51519: UDP, length 112
03:18:38.294661 IP node4.51437 > node3.54995: UDP, length 113
03:18:38.294837 IP node4.51437 > node3.51519: UDP, length 113
03:18:38.295463 IP node4.54807 > node3.54995: UDP, length 113
03:18:38.295765 IP node4.54807 > node3.51519: UDP, length 113
03:18:38.305928 IP node4.50209 > node3.54133: UDP, length 113
03:18:38.311078 IP node4.50209 > node3.48961: UDP, length 113
03:18:38.321784 IP node4.42769 > node3.39872: UDP, length 113
03:18:38.322123 IP node4.42769 > node3.45327: UDP, length 113
03:18:38.322167 IP node4.50209 > node2.38346: UDP, length 113
03:18:38.323636 IP node4.50209 > node3.39872: UDP, length 113
03:18:38.324366 IP node4.50209 > node3.45327: UDP, length 113
03:18:38.324823 IP node4.42769 > node2.43123: UDP, length 113
03:18:38.325690 IP node4.50209 > node2.43123: UDP, length 113
03:18:38.327986 IP node4.42769 > node3.34875: UDP, length 113
03:18:38.328250 IP node4.42769 > node3.47016: UDP, length 113
03:18:38.328506 IP node4.42769 > node2.41342: UDP, length 113
03:18:38.328714 IP node4.42769 > node2.45280: UDP, length 113
03:18:38.330634 IP node4.50209 > node2.38998: UDP, length 113
03:18:38.330990 IP node4.50209 > node3.34875: UDP, length 113
03:18:38.331189 IP node4.50209 > node3.47016: UDP, length 113
03:18:38.331388 IP node4.50209 > node2.41342: UDP, length 113
03:18:38.332023 IP node4.50209 > node2.45280: UDP, length 113
03:18:38.332849 IP node4.50209 > node2.57596: UDP, length 113
03:18:38.334732 IP node4.50209 > node2.51828: UDP, length 113
03:18:38.335304 IP node4.50209 > node1.38885: UDP, length 113
03:18:38.336824 IP node4.50209 > node3.54995: UDP, length 113
03:18:38.337955 IP node4.50209 > node3.51519: UDP, length 113
03:18:38.341199 IP node4.38406 > node2.38998: UDP, length 113
03:18:38.341458 IP node4.38406 > node3.45327: UDP, length 113
03:18:38.341794 IP node4.38406 > node3.34875: UDP, length 113
03:18:38.341906 IP node4.38406 > node2.43123: UDP, length 113
03:18:38.344220 IP node4.38406 > node2.57596: UDP, length 113
03:18:38.344345 IP node4.38406 > node3.52820: UDP, length 113
03:18:38.344506 IP node4.38406 > node3.47016: UDP, length 113
03:18:38.344605 IP node4.38406 > node1.38885: UDP, length 113
03:18:38.344779 IP node4.38406 > node3.54995: UDP, length 113
03:18:38.344984 IP node4.38406 > node3.51519: UDP, length 113
03:18:38.345084 IP node4.38406 > node2.51828: UDP, length 113
03:18:38.345172 IP node4.38406 > node2.41342: UDP, length 113
03:18:38.345288 IP node4.38406 > node2.45280: UDP, length 113
03:18:38.349465 IP node4.42010 > node3.52820: UDP, length 112
03:18:38.351351 IP node4.42769 > node2.57596: UDP, length 113
03:18:38.351612 IP node4.42769 > node1.38885: UDP, length 113
03:18:38.351693 IP node4.42769 > node2.38998: UDP, length 113
03:18:38.351824 IP node4.42769 > node2.51828: UDP, length 113
03:18:38.352374 IP node4.52656 > node3.52820: UDP, length 113
03:18:38.353430 IP node4.42769 > node3.54995: UDP, length 113
03:18:38.353585 IP node4.42769 > node3.51519: UDP, length 113
03:18:38.357727 IP node4.52495 > node2.57596: UDP, length 113
03:18:38.358015 IP node4.52495 > node3.47016: UDP, length 113
03:18:38.358186 IP node4.52495 > node1.38885: UDP, length 113
03:18:38.358263 IP node4.52495 > node2.38998: UDP, length 113
03:18:38.358392 IP node4.38406 > node1.34107: UDP, length 113
03:18:38.358632 IP node4.52495 > node3.54995: UDP, length 113
03:18:38.358789 IP node4.52495 > node3.51519: UDP, length 113
03:18:38.358946 IP node4.52495 > node2.51828: UDP, length 113
03:18:38.359266 IP node4.52495 > node2.41342: UDP, length 113
03:18:38.359330 IP node4.52495 > node3.34875: UDP, length 113
03:18:38.359496 IP node4.52495 > node2.45280: UDP, length 113
03:18:38.362349 IP node4.50209 > node3.52820: UDP, length 113
03:18:38.362610 IP node4.54313 > node3.52820: UDP, length 113
03:18:38.362716 IP node4.38406 > node3.33254: UDP, length 113
03:18:38.362888 IP node4.54313 > node3.33254: UDP, length 113
03:18:38.362970 IP node4.54313 > node1.34107: UDP, length 113
03:18:38.364137 IP node4.58599 > node3.33254: UDP, length 113
03:18:38.364308 IP node4.58599 > node1.34107: UDP, length 113
03:18:38.364788 IP node4.56064 > node3.52820: UDP, length 112
03:18:38.364974 IP node4.56064 > node3.33254: UDP, length 112
03:18:38.365101 IP node4.38296 > node3.52820: UDP, length 113
03:18:38.365161 IP node4.56064 > node1.34107: UDP, length 112
03:18:38.365533 IP node4.58599 > node3.52820: UDP, length 113
03:18:38.367075 IP node4.38296 > node3.33254: UDP, length 113
03:18:38.367175 IP node4.38296 > node1.34107: UDP, length 113
03:18:38.368215 IP node4.50849 > node3.52820: UDP, length 113
03:18:38.368559 IP node4.50849 > node3.33254: UDP, length 113
03:18:38.368880 IP node4.40739 > node3.52820: UDP, length 112
03:18:38.369365 IP node4.42769 > node3.52820: UDP, length 113
03:18:38.369477 IP node4.42769 > node3.33254: UDP, length 113
03:18:38.369632 IP node4.42769 > node1.34107: UDP, length 113
03:18:38.369792 IP node4.50849 > node1.34107: UDP, length 113
03:18:38.370245 IP node4.44881 > node3.52820: UDP, length 112
03:18:38.370700 IP node4.35965 > node3.52820: UDP, length 113
03:18:38.370804 IP node4.35965 > node3.33254: UDP, length 113
03:18:38.371040 IP node4.35965 > node1.34107: UDP, length 113
03:18:38.373157 IP node4.57668 > node3.52820: UDP, length 112
03:18:38.376122 IP node4.41947 > node3.52820: UDP, length 113
03:18:38.376276 IP node4.58818 > node3.52820: UDP, length 112
03:18:38.376365 IP node4.58818 > node3.33254: UDP, length 112
03:18:38.376424 IP node4.58818 > node1.34107: UDP, length 112
03:18:38.376536 IP node4.41947 > node3.33254: UDP, length 113
03:18:38.376676 IP node4.41947 > node1.34107: UDP, length 113
03:18:38.376908 IP node4.38585 > node3.52820: UDP, length 112
03:18:38.377064 IP node4.38585 > node3.33254: UDP, length 112
03:18:38.377149 IP node4.38585 > node1.34107: UDP, length 112
03:18:38.377688 IP node4.40739 > node3.33254: UDP, length 112
03:18:38.377839 IP node4.40739 > node1.34107: UDP, length 112
03:18:38.377912 IP node4.42687 > node3.52820: UDP, length 113
03:18:38.378007 IP node4.42687 > node3.33254: UDP, length 113
03:18:38.378738 IP node4.42010 > node3.33254: UDP, length 112
03:18:38.378884 IP node4.42010 > node1.34107: UDP, length 112
03:18:38.379196 IP node4.57668 > node3.33254: UDP, length 112
03:18:38.379332 IP node4.43211 > node3.52820: UDP, length 113
03:18:38.379432 IP node4.43211 > node3.33254: UDP, length 113
03:18:38.379586 IP node4.43211 > node1.34107: UDP, length 113
03:18:38.379932 IP node4.42581 > node3.52820: UDP, length 113
03:18:38.379980 IP node4.57668 > node1.34107: UDP, length 112
03:18:38.381561 IP node4.52656 > node3.33254: UDP, length 113
03:18:38.382284 IP node4.44881 > node3.33254: UDP, length 112
03:18:38.382377 IP node4.42581 > node1.34107: UDP, length 113
03:18:38.382446 IP node4.52656 > node1.34107: UDP, length 113
03:18:38.382512 IP node4.44881 > node1.34107: UDP, length 112
03:18:38.383111 IP node4.42581 > node3.33254: UDP, length 113
03:18:38.384384 IP node4.42687 > node1.34107: UDP, length 113
03:18:38.385623 IP node4.51437 > node3.52820: UDP, length 113
03:18:38.386431 IP node4.51437 > node3.33254: UDP, length 113
03:18:38.386643 IP node4.51437 > node1.34107: UDP, length 113
03:18:38.388220 IP node4.50209 > node1.34107: UDP, length 113
03:18:38.388445 IP node4.50209 > node3.33254: UDP, length 113
03:18:38.392415 IP node4.54807 > node3.52820: UDP, length 113
03:18:38.392552 IP node4.54807 > node3.33254: UDP, length 113
03:18:38.392712 IP node4.54807 > node1.34107: UDP, length 113
03:18:38.393054 IP node4.50209 > node2.59355: UDP, length 113
03:18:38.393298 IP node4.38296 > node2.59355: UDP, length 113
03:18:38.393645 IP node4.58818 > node2.59355: UDP, length 112
03:18:38.394436 IP node4.50849 > node2.59355: UDP, length 113
03:18:38.394779 IP node4.42010 > node2.59355: UDP, length 112
03:18:38.394866 IP node4.54313 > node2.59355: UDP, length 113
03:18:38.395419 IP node4.38585 > node2.59355: UDP, length 112
03:18:38.395465 IP node4.56064 > node2.59355: UDP, length 112
03:18:38.395673 IP node4.38406 > node2.59355: UDP, length 113
03:18:38.396638 IP node4.58599 > node2.59355: UDP, length 113
03:18:38.397186 IP node4.52656 > node2.59355: UDP, length 113
03:18:38.397466 IP node4.54807 > node2.59355: UDP, length 113
03:18:38.403328 IP node4.41947 > node2.59355: UDP, length 113
03:18:38.404557 IP node4.44881 > node2.59355: UDP, length 112
03:18:38.404750 IP node4.42687 > node2.59355: UDP, length 113
03:18:38.405339 IP node4.42769 > node2.59355: UDP, length 113
03:18:38.405811 IP node4.35965 > node2.59355: UDP, length 113
03:18:38.406102 IP node4.40739 > node2.59355: UDP, length 112
03:18:38.406415 IP node4.57668 > node2.59355: UDP, length 112
03:18:38.406749 IP node4.42581 > node2.59355: UDP, length 113
03:18:38.407520 IP node4.43211 > node2.59355: UDP, length 113
03:18:38.408523 IP node4.51437 > node2.59355: UDP, length 113
03:18:38.409615 IP node4.52495 > node3.52820: UDP, length 113
03:18:38.410982 IP node4.52495 > node1.34107: UDP, length 113
03:18:38.411770 IP node4.52495 > node3.33254: UDP, length 113
03:18:38.414278 IP node4.33103 > node3.34875: UDP, length 112
03:18:38.414608 IP node4.33103 > node3.47016: UDP, length 112
03:18:38.414854 IP node4.33103 > node2.38998: UDP, length 112
03:18:38.415067 IP node4.33103 > node2.41342: UDP, length 112
03:18:38.415214 IP node4.33103 > node2.45280: UDP, length 112
03:18:38.416209 IP node4.33103 > node2.51828: UDP, length 112
03:18:38.416736 IP node4.33103 > node1.38885: UDP, length 112
03:18:38.416831 IP node4.33103 > node3.54995: UDP, length 112
03:18:38.417358 IP node4.33103 > node2.57596: UDP, length 112
03:18:38.417475 IP node4.33103 > node3.51519: UDP, length 112
03:18:38.427021 IP node4.52495 > node2.59355: UDP, length 113
03:18:38.443783 IP node4.33103 > node3.52820: UDP, length 112
03:18:38.443955 IP node4.33103 > node3.33254: UDP, length 112
03:18:38.444132 IP node4.33103 > node2.59355: UDP, length 112
03:18:38.444218 IP node4.33103 > node1.34107: UDP, length 112
03:18:38.449793 IP node4.38296 > node2.55804: UDP, length 113
03:18:38.449979 IP node4.58599 > node2.55804: UDP, length 113
03:18:38.450657 IP node4.44881 > node2.55804: UDP, length 112
03:18:38.451019 IP node4.43211 > node2.55804: UDP, length 113
03:18:38.451185 IP node4.54313 > node2.55804: UDP, length 113
03:18:38.451964 IP node4.42010 > node2.55804: UDP, length 112
03:18:38.452223 IP node4.42687 > node2.55804: UDP, length 113
03:18:38.453467 IP node4.50209 > node2.55804: UDP, length 113
03:18:38.453738 IP node4.56064 > node2.55804: UDP, length 112
03:18:38.454320 IP node4.38585 > node2.55804: UDP, length 112
03:18:38.455057 IP node4.40739 > node2.55804: UDP, length 112
03:18:38.455100 IP node4.50849 > node2.55804: UDP, length 113
03:18:38.455457 IP node4.57668 > node2.55804: UDP, length 112
03:18:38.455831 IP node4.58818 > node2.55804: UDP, length 112
03:18:38.456574 IP node4.51437 > node2.55804: UDP, length 113
03:18:38.457113 IP node4.41947 > node2.55804: UDP, length 113
03:18:38.460474 IP node4.52656 > node2.55804: UDP, length 113
03:18:38.461085 IP node4.42581 > node2.55804: UDP, length 113
03:18:38.463151 IP node4.52495 > node2.55804: UDP, length 113
03:18:38.464618 IP node4.33103 > node2.55804: UDP, length 112
03:18:38.464668 IP node4.54807 > node2.55804: UDP, length 113
03:18:38.464838 IP node4.35965 > node2.55804: UDP, length 113
03:18:38.465352 IP node4.38406 > node2.55804: UDP, length 113
03:18:38.467442 IP node4.42769 > node2.55804: UDP, length 113
03:18:38.508045 IP node4.33946 > node3.47016: UDP, length 113
03:18:38.508326 IP node4.33946 > node2.41342: UDP, length 113
03:18:38.508361 IP node4.33946 > node2.45280: UDP, length 113
03:18:38.529094 IP node4.33946 > node2.57596: UDP, length 113
03:18:38.529883 IP node4.33946 > node2.51828: UDP, length 113
03:18:38.530670 IP node4.33946 > node1.38885: UDP, length 113
03:18:38.530713 IP node4.33946 > node3.54995: UDP, length 113
03:18:38.530858 IP node4.33946 > node3.51519: UDP, length 113
03:18:38.534886 IP node4.35965 > node2.51687: UDP, length 113
03:18:38.535123 IP node4.43211 > node2.51687: UDP, length 113
03:18:38.535532 IP node4.33103 > node2.51687: UDP, length 112
03:18:38.535914 IP node4.54807 > node2.51687: UDP, length 113
03:18:38.536127 IP node4.38406 > node2.51687: UDP, length 113
03:18:38.536467 IP node4.56064 > node2.51687: UDP, length 112
03:18:38.536526 IP node4.42769 > node2.51687: UDP, length 113
03:18:38.537005 IP node4.42581 > node2.51687: UDP, length 113
03:18:38.537540 IP node4.52495 > node2.51687: UDP, length 113
03:18:38.538100 IP node4.38585 > node2.51687: UDP, length 112
03:18:38.538251 IP node4.57668 > node2.51687: UDP, length 112
03:18:38.538506 IP node4.51437 > node2.51687: UDP, length 113
03:18:38.538660 IP node4.58818 > node2.51687: UDP, length 112
03:18:38.539151 IP node4.42687 > node2.51687: UDP, length 113
03:18:38.539606 IP node4.52656 > node2.51687: UDP, length 113
03:18:38.540039 IP node4.54313 > node2.51687: UDP, length 113
03:18:38.540615 IP node4.38296 > node2.51687: UDP, length 113
03:18:38.540679 IP node4.50849 > node2.51687: UDP, length 113
03:18:38.540929 IP node4.44881 > node2.51687: UDP, length 112
03:18:38.542222 IP node4.42010 > node2.51687: UDP, length 112
03:18:38.542415 IP node4.40739 > node2.51687: UDP, length 112
03:18:38.543117 IP node4.42581 > node3.46934: UDP, length 113
03:18:38.543934 IP node4.38406 > node3.46934: UDP, length 113
03:18:38.544076 IP node4.42769 > node3.46934: UDP, length 113
03:18:38.544595 IP node4.54807 > node3.46934: UDP, length 113
03:18:38.544737 IP node4.54313 > node3.46934: UDP, length 113
03:18:38.544804 IP node4.41947 > node2.51687: UDP, length 113
03:18:38.545108 IP node4.58599 > node3.46934: UDP, length 113
03:18:38.545381 IP node4.43211 > node3.46934: UDP, length 113
03:18:38.546423 IP node4.56064 > node3.46934: UDP, length 112
03:18:38.546484 IP node4.50209 > node3.46934: UDP, length 113
03:18:38.547005 IP node4.35965 > node3.46934: UDP, length 113
03:18:38.547286 IP node4.33103 > node3.46934: UDP, length 112
03:18:38.548063 IP node4.50849 > node3.46934: UDP, length 113
03:18:38.548338 IP node4.57668 > node3.46934: UDP, length 112
03:18:38.548631 IP node4.58818 > node3.46934: UDP, length 112
03:18:38.548687 IP node4.52656 > node3.46934: UDP, length 113
03:18:38.549922 IP node4.51437 > node3.46934: UDP, length 113
03:18:38.550116 IP node4.42010 > node3.46934: UDP, length 112
03:18:38.551229 IP node4.38296 > node3.46934: UDP, length 113
03:18:38.551427 IP node4.50209 > node2.51687: UDP, length 113
03:18:38.551587 IP node4.42687 > node3.46934: UDP, length 113
03:18:38.552003 IP node4.58599 > node2.51687: UDP, length 113
03:18:38.552160 IP node4.40739 > node3.46934: UDP, length 112
03:18:38.552765 IP node4.52495 > node3.46934: UDP, length 113
03:18:38.552897 IP node4.38585 > node3.46934: UDP, length 112
