03:18:36.018838 IP node2.50082 > node4.52656: UDP, length 113
03:18:36.021115 IP node2.59588 > node4.52656: UDP, length 113
03:18:36.021288 IP node2.59355 > node4.52656: UDP, length 113
03:18:36.021816 IP node2.57596 > node4.52656: UDP, length 113
03:18:36.022174 IP node2.51828 > node4.52656: UDP, length 113
03:18:36.022380 IP node2.45280 > node4.52656: UDP, length 113
03:18:36.022610 IP node2.43123 > node4.52656: UDP, length 113
03:18:36.022859 IP node2.38998 > node4.52656: UDP, length 113
03:18:36.023279 IP node2.55804 > node4.52656: UDP, length 113
03:18:36.023625 IP node2.42922 > node4.52656: UDP, length 113
03:18:36.024247 IP node2.44932 > node4.52656: UDP, length 112
03:18:36.024873 IP node2.44241 > node4.52656: UDP, length 113
03:18:36.025953 IP node2.51687 > node4.52656: UDP, length 113
03:18:36.026519 IP node2.46463 > node4.52656: UDP, length 113
03:18:36.027359 IP node2.38346 > node4.52656: UDP, length 113
03:18:36.027737 IP node2.41342 > node4.52656: UDP, length 113
03:18:36.028728 IP node2.33710 > node4.52656: UDP, length 112
03:18:36.029364 IP node2.35704 > node4.52656: UDP, length 113
03:18:36.131427 IP node2.55028 > node4.52656: UDP, length 112
03:18:36.152367 IP node2.40178 > node4.52656: UDP, length 113
03:18:36.187060 IP node2.60148 > node4.52656: UDP, length 113
03:18:36.236416 IP node2.54999 > node4.52656: UDP, length 113
03:18:36.239643 IP node2.39546 > node4.52656: UDP, length 113
03:18:36.677278 IP node2.38998 > node4.42687: UDP, length 113
03:18:36.677450 IP node2.35704 > node4.42687: UDP, length 113
03:18:36.677837 IP node2.40178 > node4.42687: UDP, length 113
03:18:36.678116 IP node2.45280 > node4.42687: UDP, length 113
03:18:36.678270 IP node2.60148 > node4.42687: UDP, length 113
03:18:36.679164 IP node2.50082 > node4.42687: UDP, length 113
03:18:36.679419 IP node2.44241 > node4.42687: UDP, length 113
03:18:36.679538 IP node2.33710 > node4.42687: UDP, length 112
03:18:36.679762 IP node2.39546 > node4.42687: UDP, length 113
03:18:36.679913 IP node2.41342 > node4.42687: UDP, length 113
03:18:36.680095 IP node2.43123 > node4.42687: UDP, length 113
03:18:36.680215 IP node2.54999 > node4.42687: UDP, length 113
03:18:36.680294 IP node2.40763 > node4.42687: UDP, length 113
03:18:36.680375 IP node2.42922 > node4.42687: UDP, length 113
03:18:36.680537 IP node2.55028 > node4.42687: UDP, length 112
03:18:36.680600 IP node2.38346 > node4.42687: UDP, length 113
03:18:36.680811 IP node2.59355 > node4.42687: UDP, length 113
03:18:36.680964 IP node2.44932 > node4.42687: UDP, length 112
03:18:36.681484 IP node2.57500 > node4.42687: UDP, length 112
03:18:36.681627 IP node2.51687 > node4.42687: UDP, length 113
03:18:36.681887 IP node2.57596 > node4.42687: UDP, length 113
03:18:36.682008 IP node2.46463 > node4.42687: UDP, length 113
03:18:36.682160 IP node2.51828 > node4.42687: UDP, length 113
03:18:36.682218 IP node2.55804 > node4.42687: UDP, length 113
03:18:36.682414 IP node2.59588 > node4.42687: UDP, length 113
03:18:36.939585 IP node2.44241 > node4.42010: UDP, length 113
03:18:36.939786 IP node2.40178 > node4.42010: UDP, length 113
03:18:36.940714 IP node2.46463 > node4.42010: UDP, length 113
03:18:36.940977 IP node2.38998 > node4.42010: UDP, length 113
03:18:36.941717 IP node2.55028 > node4.42010: UDP, length 112
03:18:36.941970 IP node2.51828 > node4.42010: UDP, length 113
03:18:36.942069 IP node2.51687 > node4.42010: UDP, length 113
03:18:36.942218 IP node2.33710 > node4.42010: UDP, length 112
03:18:36.942257 IP node2.59355 > node4.42010: UDP, length 113
03:18:36.942448 IP node2.35704 > node4.42010: UDP, length 113
03:18:36.942576 IP node2.55804 > node4.42010: UDP, length 113
03:18:36.942803 IP node2.54999 > node4.42010: UDP, length 113
03:18:36.942909 IP node2.41342 > node4.42010: UDP, length 113
03:18:36.942966 IP node2.50082 > node4.42010: UDP, length 113
03:18:36.943081 IP node2.44932 > node4.42010: UDP, length 112
03:18:36.943199 IP node2.45280 > node4.42010: UDP, length 113
03:18:36.943288 IP node2.57500 > node4.42010: UDP, length 112
03:18:36.943374 IP node2.42922 > node4.42010: UDP, length 113
03:18:36.943457 IP node2.59588 > node4.42010: UDP, length 113
03:18:36.943580 IP node2.43123 > node4.42010: UDP, length 113
03:18:36.943902 IP node2.57596 > node4.42010: UDP, length 113
03:18:36.944010 IP node2.38346 > node4.42010: UDP, length 113
03:18:36.944656 IP node2.40763 > node4.42010: UDP, length 113
03:18:36.944911 IP node2.60148 > node4.42010: UDP, length 113
03:18:36.945513 IP node2.39546 > node4.42010: UDP, length 113
03:18:37.249148 IP node2.40178 > node4.58818: UDP, length 113
03:18:37.249676 IP node2.60148 > node4.58818: UDP, length 113
03:18:37.249972 IP node2.55804 > node4.58818: UDP, length 113
03:18:37.250042 IP node2.55028 > node4.58818: UDP, length 112
03:18:37.250611 IP node2.59588 > node4.58818: UDP, length 113
03:18:37.250795 IP node2.44932 > node4.58818: UDP, length 112
03:18:37.250879 IP node2.42922 > node4.58818: UDP, length 113
03:18:37.251226 IP node2.59355 > node4.58818: UDP, length 113
03:18:37.251298 IP node2.51687 > node4.58818: UDP, length 113
03:18:37.251376 IP node2.38346 > node4.58818: UDP, length 113
03:18:37.251688 IP node2.46463 > node4.58818: UDP, length 113
03:18:37.251870 IP node2.57596 > node4.58818: UDP, length 113
03:18:37.252085 IP node2.38998 > node4.58818: UDP, length 113
03:18:37.252504 IP node2.43123 > node4.58818: UDP, length 113
03:18:37.252758 IP node2.35704 > node4.58818: UDP, length 113
03:18:37.252859 IP node2.44241 > node4.58818: UDP, length 113
03:18:37.252982 IP node2.50082 > node4.58818: UDP, length 113
03:18:37.253070 IP node2.54999 > node4.58818: UDP, length 113
03:18:37.253131 IP node2.33710 > node4.58818: UDP, length 112
03:18:37.253192 IP node2.39546 > node4.58818: UDP, length 113
03:18:37.253267 IP node2.45280 > node4.58818: UDP, length 113
03:18:37.253738 IP node2.40763 > node4.58818: UDP, length 113
03:18:37.253792 IP node2.41342 > node4.58818: UDP, length 113
03:18:37.253881 IP node2.57500 > node4.58818: UDP, length 112
03:18:37.254029 IP node2.51828 > node4.58818: UDP, length 113
03:18:37.486419 IP node2.50082 > node4.43211: UDP, length 113
03:18:37.486546 IP node2.44932 > node4.43211: UDP, length 112
03:18:37.486645 IP node2.40178 > node4.43211: UDP, length 113
03:18:37.486712 IP node2.38346 > node4.43211: UDP, length 113
03:18:37.487208 IP node2.51828 > node4.43211: UDP, length 113
03:18:37.487408 IP node2.39546 > node4.43211: UDP, length 113
03:18:37.487840 IP node2.41342 > node4.43211: UDP, length 113
03:18:37.488164 IP node2.57596 > node4.43211: UDP, length 113
03:18:37.488527 IP node2.59588 > node4.43211: UDP, length 113
03:18:37.488813 IP node2.45280 > node4.43211: UDP, length 113
03:18:37.488875 IP node2.60148 > node4.43211: UDP, length 113
03:18:37.489806 IP node2.55804 > node4.43211: UDP, length 113
03:18:37.490017 IP node2.33710 > node4.43211: UDP, length 112
03:18:37.490167 IP node2.42922 > node4.43211: UDP, length 113
03:18:37.490293 IP node2.44241 > node4.43211: UDP, length 113
03:18:37.490536 IP node2.57500 > node4.43211: UDP, length 112
03:18:37.490597 IP node2.54999 > node4.43211: UDP, length 113
03:18:37.490861 IP node2.46463 > node4.43211: UDP, length 113
03:18:37.491622 IP node2.51687 > node4.43211: UDP, length 113
03:18:37.492467 IP node2.43123 > node4.43211: UDP, length 113
03:18:37.492581 IP node2.59355 > node4.43211: UDP, length 113
03:18:37.492673 IP node2.55028 > node4.43211: UDP, length 112
03:18:37.492796 IP node2.38998 > node4.43211: UDP, length 113
03:18:37.492865 IP node2.40763 > node4.43211: UDP, length 113
03:18:37.492984 IP node2.35704 > node4.43211: UDP, length 113
03:18:37.583109 IP node2.44241 > node3.35778: UDP, length 113
03:18:37.583576 IP node2.39546 > node3.35778: UDP, length 113
03:18:37.583740 IP node2.44932 > node3.35778: UDP, length 112
03:18:37.583915 IP node2.38998 > node3.35778: UDP, length 113
03:18:37.583978 IP node2.40178 > node3.35778: UDP, length 113
03:18:37.584234 IP node2.59588 > node3.35778: UDP, length 113
03:18:37.584527 IP node2.33710 > node3.35778: UDP, length 112
03:18:37.584622 IP node2.35704 > node3.35778: UDP, length 113
03:18:37.584840 IP node2.43123 > node3.35778: UDP, length 113
03:18:37.584922 IP node2.45280 > node3.35778: UDP, length 113
03:18:37.585008 IP node2.46463 > node3.35778: UDP, length 113
03:18:37.585234 IP node2.40763 > node3.35778: UDP, length 113
03:18:37.585477 IP node2.54999 > node3.35778: UDP, length 113
03:18:37.585737 IP node2.41342 > node3.35778: UDP, length 113
03:18:37.585947 IP node2.59355 > node3.35778: UDP, length 113
03:18:37.586047 IP node2.42922 > node3.35778: UDP, length 113
03:18:37.586120 IP node2.51828 > node3.35778: UDP, length 113
03:18:37.586194 IP node2.60148 > node3.35778: UDP, length 113
03:18:37.587613 IP node2.50082 > node3.35778: UDP, length 113
03:18:37.587723 IP node2.55028 > node3.35778: UDP, length 112
03:18:37.587840 IP node2.55804 > node3.35778: UDP, length 113
03:18:37.587896 IP node2.57596 > node3.35778: UDP, length 113
03:18:37.588461 IP node2.38346 > node3.35778: UDP, length 113
03:18:37.588546 IP node2.51687 > node3.35778: UDP, length 113
03:18:37.589047 IP node2.57500 > node3.35778: UDP, length 112
03:18:37.625092 IP node2.44932 > node3.36712: UDP, length 112
03:18:37.625171 IP node2.40178 > node3.36712: UDP, length 113
03:18:37.625747 IP node2.33710 > node3.36712: UDP, length 112
03:18:37.625871 IP node2.54999 > node3.36712: UDP, length 113
03:18:37.626048 IP node2.51828 > node3.36712: UDP, length 113
03:18:37.626807 IP node2.38998 > node3.36712: UDP, length 113
03:18:37.626945 IP node2.43123 > node3.36712: UDP, length 113
03:18:37.627125 IP node2.35704 > node3.36712: UDP, length 113
03:18:37.627701 IP node2.38346 > node3.36712: UDP, length 113
03:18:37.628167 IP node2.60148 > node3.36712: UDP, length 113
03:18:37.628269 IP node2.57500 > node3.36712: UDP, length 112
03:18:37.628523 IP node2.55804 > node3.36712: UDP, length 113
03:18:37.628662 IP node2.42922 > node3.36712: UDP, length 113
03:18:37.628755 IP node2.46463 > node3.36712: UDP, length 113
03:18:37.629136 IP node2.44241 > node3.36712: UDP, length 113
03:18:37.629427 IP node2.39546 > node3.36712: UDP, length 113
03:18:37.629548 IP node2.41342 > node3.36712: UDP, length 113
03:18:37.629644 IP node2.45280 > node3.36712: UDP, length 113
03:18:37.629725 IP node2.57596 > node3.36712: UDP, length 113
03:18:37.629801 IP node2.59588 > node3.36712: UDP, length 113
03:18:37.629878 IP node2.55028 > node3.36712: UDP, length 112
03:18:37.629953 IP node2.50082 > node3.36712: UDP, length 113
03:18:37.630001 IP node2.51687 > node3.36712: UDP, length 113
03:18:37.630079 IP node2.40763 > node3.36712: UDP, length 113
03:18:37.630119 IP node2.59355 > node3.36712: UDP, length 113
03:18:37.666259 IP node2.57500 > node3.59829: UDP, length 112
03:18:37.666964 IP node2.40178 > node3.59829: UDP, length 113
03:18:37.667202 IP node2.42922 > node3.59829: UDP, length 113
03:18:37.668175 IP node2.38998 > node3.59829: UDP, length 113
03:18:37.668392 IP node2.39546 > node3.59829: UDP, length 113
03:18:37.668497 IP node2.45280 > node3.59829: UDP, length 113
03:18:37.668869 IP node2.50082 > node3.59829: UDP, length 113
03:18:37.670053 IP node2.57596 > node3.59829: UDP, length 113
03:18:37.670692 IP node2.51687 > node3.59829: UDP, length 113
03:18:37.671176 IP node2.44241 > node3.59829: UDP, length 113
03:18:37.671730 IP node2.55028 > node3.59829: UDP, length 112
03:18:37.671908 IP node2.60148 > node3.59829: UDP, length 113
03:18:37.672034 IP node2.33710 > node3.59829: UDP, length 112
03:18:37.672100 IP node2.43123 > node3.59829: UDP, length 113
03:18:37.672165 IP node2.54999 > node3.59829: UDP, length 113
03:18:37.672221 IP node2.59355 > node3.59829: UDP, length 113
03:18:37.672647 IP node2.55804 > node3.59829: UDP, length 113
03:18:37.672739 IP node2.40763 > node3.59829: UDP, length 113
03:18:37.672867 IP node2.44932 > node3.59829: UDP, length 112
03:18:37.672935 IP node2.38346 > node3.59829: UDP, length 113
03:18:37.673001 IP node2.41342 > node3.59829: UDP, length 113
03:18:37.673239 IP node2.35704 > node3.59829: UDP, length 113
03:18:37.673305 IP node2.51828 > node3.59829: UDP, length 113
03:18:37.673498 IP node2.59588 > node3.59829: UDP, length 113
03:18:37.673789 IP node2.46463 > node3.59829: UDP, length 113
03:18:37.762133 IP node2.44932 > node4.57668: UDP, length 112
03:18:37.762411 IP node2.54999 > node4.57668: UDP, length 113
03:18:37.762551 IP node2.40763 > node4.57668: UDP, length 113
03:18:37.762892 IP node2.50082 > node4.57668: UDP, length 113
03:18:37.762938 IP node2.57500 > node4.57668: UDP, length 112
03:18:37.763268 IP node2.40178 > node4.57668: UDP, length 113
03:18:37.763331 IP node2.59355 > node4.57668: UDP, length 113
03:18:37.763578 IP node2.35704 > node4.57668: UDP, length 113
03:18:37.763708 IP node2.33710 > node4.57668: UDP, length 112
03:18:37.763907 IP node2.51828 > node4.57668: UDP, length 113
03:18:37.764002 IP node2.38998 > node4.57668: UDP, length 113
03:18:37.764601 IP node2.60148 > node4.57668: UDP, length 113
03:18:37.764797 IP node2.45280 > node4.57668: UDP, length 113
03:18:37.765152 IP node2.57596 > node4.57668: UDP, length 113
03:18:37.765391 IP node2.42922 > node4.57668: UDP, length 113
03:18:37.765503 IP node2.38346 > node4.57668: UDP, length 113
03:18:37.765603 IP node2.43123 > node4.57668: UDP, length 113
03:18:37.765775 IP node2.39546 > node4.57668: UDP, length 113
03:18:37.765910 IP node2.55028 > node4.57668: UDP, length 112
03:18:37.765985 IP node2.44241 > node4.57668: UDP, length 113
03:18:37.766074 IP node2.51687 > node4.57668: UDP, length 113
03:18:37.766320 IP node2.41342 > node4.57668: UDP, length 113
03:18:37.766438 IP node2.59588 > node4.57668: UDP, length 113
03:18:37.766542 IP node2.55804 > node4.57668: UDP, length 113
03:18:37.766980 IP node2.46463 > node4.57668: UDP, length 113
03:18:37.875163 IP node2.40763 > node4.54313: UDP, length 113
03:18:37.875667 IP node2.40178 > node4.54313: UDP, length 113
03:18:37.875934 IP node2.59355 > node4.54313: UDP, length 113
03:18:37.876076 IP node2.39546 > node4.54313: UDP, length 113
03:18:37.876372 IP node2.54999 > node4.54313: UDP, length 113
03:18:37.876765 IP node2.50082 > node4.54313: UDP, length 113
03:18:37.877118 IP node2.55804 > node4.54313: UDP, length 113
03:18:37.877170 IP node2.42922 > node4.54313: UDP, length 113
03:18:37.877209 IP node2.35704 > node4.54313: UDP, length 113
03:18:37.877487 IP node2.51828 > node4.54313: UDP, length 113
03:18:37.877559 IP node2.44241 > node4.54313: UDP, length 113
03:18:37.877637 IP node2.38998 > node4.54313: UDP, length 113
03:18:37.877849 IP node2.45280 > node4.54313: UDP, length 113
03:18:37.878295 IP node2.60148 > node4.54313: UDP, length 113
03:18:37.878370 IP node2.57596 > node4.54313: UDP, length 113
03:18:37.878541 IP node2.55028 > node4.54313: UDP, length 112
03:18:37.878779 IP node2.43123 > node4.54313: UDP, length 113
03:18:37.879194 IP node2.57500 > node4.54313: UDP, length 112
03:18:37.879404 IP node2.44932 > node4.54313: UDP, length 112
03:18:37.879542 IP node2.59588 > node4.54313: UDP, length 113
03:18:37.879744 IP node2.38346 > node4.54313: UDP, length 113
03:18:37.880055 IP node2.33710 > node4.54313: UDP, length 112
03:18:37.880452 IP node2.46463 > node4.54313: UDP, length 113
03:18:37.880810 IP node2.51687 > node4.54313: UDP, length 113
03:18:37.880891 IP node2.41342 > node4.54313: UDP, length 113
03:18:37.931897 IP node2.39546 > node3.45962: UDP, length 113
03:18:37.932657 IP node2.46463 > node3.45962: UDP, length 113
03:18:37.933516 IP node2.54999 > node3.45962: UDP, length 113
03:18:37.934552 IP node2.42922 > node3.45962: UDP, length 113
03:18:37.934751 IP node2.50082 > node3.45962: UDP, length 113
03:18:37.934840 IP node2.38346 > node3.45962: UDP, length 113
03:18:37.934946 IP node2.35704 > node3.45962: UDP, length 113
03:18:37.935853 IP node2.38998 > node3.45962: UDP, length 113
03:18:37.936024 IP node2.33710 > node3.45962: UDP, length 112
03:18:37.936127 IP node2.57500 > node3.45962: UDP, length 112
03:18:37.936327 IP node2.44932 > node3.45962: UDP, length 112
03:18:37.936439 IP node2.51687 > node3.45962: UDP, length 113
03:18:37.937095 IP node2.59355 > node3.45962: UDP, length 113
03:18:37.937264 IP node2.51828 > node3.45962: UDP, length 113
03:18:37.937357 IP node2.40178 > node3.45962: UDP, length 113
03:18:37.937550 IP node2.59588 > node3.45962: UDP, length 113
03:18:37.937687 IP node2.60148 > node3.45962: UDP, length 113
03:18:37.938007 IP node2.55028 > node3.45962: UDP, length 112
03:18:37.939111 IP node2.45280 > node3.45962: UDP, length 113
03:18:37.939418 IP node2.55804 > node3.45962: UDP, length 113
03:18:37.939550 IP node2.41342 > node3.45962: UDP, length 113
03:18:37.940023 IP node2.44241 > node3.45962: UDP, length 113
03:18:37.940295 IP node2.43123 > node3.45962: UDP, length 113
03:18:37.940379 IP node2.40763 > node3.45962: UDP, length 113
03:18:37.940469 IP node2.57596 > node3.45962: UDP, length 113
03:18:38.034837 IP node2.59588 > node4.38296: UDP, length 113
03:18:38.035067 IP node2.59588 > node4.35965: UDP, length 113
03:18:38.035186 IP node2.59588 > node4.40739: UDP, length 113
03:18:38.035966 IP node2.35704 > node4.38296: UDP, length 113
03:18:38.036342 IP node2.60148 > node4.38296: UDP, length 113
03:18:38.036895 IP node2.38346 > node4.40739: UDP, length 113
03:18:38.037015 IP node2.38346 > node4.38296: UDP, length 113
03:18:38.037117 IP node2.38346 > node4.35965: UDP, length 113
03:18:38.037456 IP node2.57596 > node4.40739: UDP, length 113
03:18:38.037601 IP node2.57596 > node4.38296: UDP, length 113
03:18:38.037729 IP node2.57596 > node4.35965: UDP, length 113
03:18:38.037878 IP node2.55804 > node4.40739: UDP, length 113
03:18:38.037999 IP node2.55804 > node4.38296: UDP, length 113
03:18:38.038095 IP node2.55804 > node4.35965: UDP, length 113
03:18:38.038719 IP node2.51828 > node4.40739: UDP, length 113
03:18:38.038833 IP node2.51828 > node4.38296: UDP, length 113
03:18:38.038963 IP node2.51828 > node4.35965: UDP, length 113
03:18:38.039123 IP node2.57500 > node4.38296: UDP, length 112
03:18:38.039228 IP node2.57500 > node4.35965: UDP, length 112
03:18:38.039272 IP node2.40178 > node4.38296: UDP, length 113
03:18:38.039313 IP node2.40178 > node4.35965: UDP, length 113
03:18:38.039723 IP node2.45280 > node4.38296: UDP, length 113
03:18:38.040337 IP node2.44241 > node4.40739: UDP, length 113
03:18:38.040446 IP node2.44241 > node4.38296: UDP, length 113
03:18:38.040534 IP node2.44241 > node4.35965: UDP, length 113
03:18:38.040655 IP node2.46463 > node4.40739: UDP, length 113
03:18:38.040748 IP node2.40763 > node4.40739: UDP, length 113
03:18:38.040789 IP node2.40763 > node4.38296: UDP, length 113
03:18:38.040827 IP node2.40763 > node4.35965: UDP, length 113
03:18:38.040864 IP node2.59355 > node4.40739: UDP, length 113
03:18:38.040901 IP node2.59355 > node4.38296: UDP, length 113
03:18:38.040939 IP node2.59355 > node4.35965: UDP, length 113
03:18:38.041031 IP node2.46463 > node4.38296: UDP, length 113
03:18:38.041121 IP node2.46463 > node4.35965: UDP, length 113
03:18:38.041344 IP node2.44932 > node4.40739: UDP, length 112
03:18:38.041413 IP node2.41342 > node4.40739: UDP, length 113
03:18:38.041479 IP node2.44932 > node4.38296: UDP, length 112
03:18:38.041517 IP node2.44932 > node4.35965: UDP, length 112
03:18:38.041631 IP node2.41342 > node4.38296: UDP, length 113
03:18:38.045175 IP node2.41342 > node4.35965: UDP, length 113
03:18:38.045266 IP node2.38998 > node4.38296: UDP, length 113
03:18:38.049446 IP node2.38998 > node4.35965: UDP, length 113
03:18:38.049566 IP node2.38998 > node4.40739: UDP, length 113
03:18:38.049668 IP node2.54999 > node4.40739: UDP, length 113
03:18:38.049769 IP node2.40178 > node4.40739: UDP, length 113
03:18:38.049820 IP node2.54999 > node4.38296: UDP, length 113
03:18:38.049865 IP node2.54999 > node4.35965: UDP, length 113
03:18:38.049919 IP node2.55028 > node4.40739: UDP, length 112
03:18:38.049977 IP node2.55028 > node4.38296: UDP, length 112
03:18:38.050033 IP node2.55028 > node4.35965: UDP, length 112
03:18:38.050090 IP node2.50082 > node4.40739: UDP, length 113
03:18:38.050146 IP node2.50082 > node4.38296: UDP, length 113
03:18:38.050202 IP node2.50082 > node4.35965: UDP, length 113
03:18:38.050258 IP node2.35704 > node4.40739: UDP, length 113
03:18:38.050314 IP node2.35704 > node4.35965: UDP, length 113
03:18:38.050370 IP node2.39546 > node4.40739: UDP, length 113
03:18:38.050427 IP node2.43123 > node4.38296: UDP, length 113
03:18:38.050483 IP node2.60148 > node4.40739: UDP, length 113
03:18:38.050539 IP node2.60148 > node4.35965: UDP, length 113
03:18:38.050595 IP node2.45280 > node4.40739: UDP, length 113
03:18:38.050651 IP node2.45280 > node4.35965: UDP, length 113
03:18:38.050706 IP node2.42922 > node4.40739: UDP, length 113
03:18:38.050762 IP node2.42922 > node4.38296: UDP, length 113
03:18:38.050818 IP node2.42922 > node4.35965: UDP, length 113
03:18:38.050874 IP node2.33710 > node4.40739: UDP, length 112
03:18:38.050929 IP node2.33710 > node4.38296: UDP, length 112
03:18:38.050986 IP node2.43123 > node4.40739: UDP, length 113
03:18:38.051042 IP node2.33710 > node4.35965: UDP, length 112
03:18:38.051097 IP node2.43123 > node4.35965: UDP, length 113
03:18:38.051152 IP node2.51687 > node4.40739: UDP, length 113
03:18:38.051208 IP node2.51687 > node4.38296: UDP, length 113
03:18:38.051264 IP node2.51687 > node4.35965: UDP, length 113
03:18:38.051319 IP node2.57500 > node4.40739: UDP, length 112
03:18:38.051442 IP node2.39546 > node4.38296: UDP, length 113
03:18:38.051565 IP node2.39546 > node4.35965: UDP, length 113
03:18:38.065113 IP node2.40178 > node4.44881: UDP, length 113
03:18:38.065240 IP node2.57500 > node4.44881: UDP, length 112
03:18:38.066040 IP node2.46463 > node4.44881: UDP, length 113
03:18:38.066148 IP node2.44241 > node4.44881: UDP, length 113
03:18:38.066356 IP node2.50082 > node4.44881: UDP, length 113
03:18:38.066539 IP node2.41342 > node4.44881: UDP, length 113
03:18:38.066923 IP node2.51687 > node4.44881: UDP, length 113
03:18:38.066997 IP node2.55804 > node4.44881: UDP, length 113
03:18:38.067092 IP node2.35704 > node4.44881: UDP, length 113
03:18:38.067295 IP node2.59588 > node4.44881: UDP, length 113
03:18:38.067396 IP node2.33710 > node4.44881: UDP, length 112
03:18:38.068052 IP node2.51828 > node4.44881: UDP, length 113
03:18:38.068104 IP node2.59355 > node4.44881: UDP, length 113
03:18:38.068271 IP node2.38346 > node4.44881: UDP, length 113
03:18:38.068715 IP node2.38998 > node4.44881: UDP, length 113
03:18:38.068781 IP node2.60148 > node4.44881: UDP, length 113
03:18:38.068857 IP node2.57596 > node4.44881: UDP, length 113
03:18:38.068998 IP node2.40763 > node4.44881: UDP, length 113
03:18:38.069278 IP node2.54999 > node4.44881: UDP, length 113
03:18:38.069432 IP node2.45280 > node4.44881: UDP, length 113
03:18:38.069643 IP node2.43123 > node4.44881: UDP, length 113
03:18:38.069832 IP node2.44932 > node4.44881: UDP, length 112
03:18:38.069902 IP node2.42922 > node4.44881: UDP, length 113
03:18:38.069974 IP node2.39546 > node4.44881: UDP, length 113
03:18:38.070044 IP node2.55028 > node4.44881: UDP, length 112
03:18:38.118754 IP node2.55804 > node3.48961: UDP, length 113
03:18:38.119010 IP node2.50082 > node3.48961: UDP, length 113
03:18:38.119639 IP node2.38346 > node3.48961: UDP, length 113
03:18:38.119713 IP node2.59588 > node3.48961: UDP, length 113
03:18:38.119971 IP node2.54999 > node3.48961: UDP, length 113
03:18:38.120298 IP node2.41342 > node3.48961: UDP, length 113
03:18:38.120361 IP node2.33710 > node3.48961: UDP, length 112
03:18:38.120401 IP node2.51687 > node3.48961: UDP, length 113
03:18:38.120589 IP node2.51828 > node3.48961: UDP, length 113
03:18:38.121524 IP node2.60148 > node3.48961: UDP, length 113
03:18:38.123919 IP node2.39546 > node3.48961: UDP, length 113
03:18:38.124005 IP node2.55028 > node3.48961: UDP, length 112
03:18:38.124597 IP node2.35704 > node3.48961: UDP, length 113
03:18:38.125824 IP node2.46463 > node3.48961: UDP, length 113
03:18:38.127253 IP node2.57500 > node3.48961: UDP, length 112
03:18:38.127541 IP node2.44932 > node3.48961: UDP, length 112
03:18:38.128134 IP node2.42922 > node3.48961: UDP, length 113
03:18:38.129803 IP node2.40763 > node3.48961: UDP, length 113
03:18:38.130118 IP node2.38998 > node3.48961: UDP, length 113
03:18:38.130219 IP node2.43123 > node3.48961: UDP, length 113
03:18:38.131713 IP node2.45280 > node3.48961: UDP, length 113
03:18:38.132136 IP node2.44241 > node3.48961: UDP, length 113
03:18:38.132466 IP node2.57596 > node3.48961: UDP, length 113
03:18:38.132601 IP node2.59355 > node3.48961: UDP, length 113
03:18:38.132912 IP node2.40178 > node3.48961: UDP, length 113
03:18:38.200265 IP node2.60148 > node3.54133: UDP, length 113
03:18:38.200746 IP node2.33710 > node3.54133: UDP, length 112
03:18:38.201177 IP node2.59355 > node3.54133: UDP, length 113
03:18:38.201576 IP node2.55028 > node3.54133: UDP, length 112
03:18:38.202028 IP node2.40178 > node3.54133: UDP, length 113
03:18:38.202314 IP node2.40763 > node3.54133: UDP, length 113
03:18:38.202663 IP node2.38346 > node3.54133: UDP, length 113
03:18:38.202728 IP node2.55804 > node3.54133: UDP, length 113
03:18:38.203003 IP node2.51687 > node3.54133: UDP, length 113
03:18:38.203078 IP node2.59588 > node3.54133: UDP, length 113
03:18:38.203212 IP node2.35704 > node3.54133: UDP, length 113
03:18:38.203612 IP node2.57596 > node3.54133: UDP, length 113
03:18:38.204275 IP node2.57500 > node3.54133: UDP, length 112
03:18:38.204542 IP node2.38998 > node3.54133: UDP, length 113
03:18:38.204836 IP node2.41342 > node3.54133: UDP, length 113
03:18:38.205652 IP node2.54999 > node3.54133: UDP, length 113
03:18:38.205721 IP node2.46463 > node3.54133: UDP, length 113
03:18:38.206059 IP node2.44241 > node3.54133: UDP, length 113
03:18:38.206835 IP node2.50082 > node3.54133: UDP, length 113
03:18:38.206909 IP node2.51828 > node3.54133: UDP, length 113
03:18:38.207170 IP node2.39546 > node3.54133: UDP, length 113
03:18:38.207234 IP node2.44932 > node3.54133: UDP, length 112
03:18:38.207673 IP node2.45280 > node3.54133: UDP, length 113
03:18:38.209076 IP node2.43123 > node4.41947: UDP, length 113
03:18:38.209166 IP node2.33710 > node4.41947: UDP, length 112
03:18:38.209242 IP node2.59355 > node4.41947: UDP, length 113
03:18:38.209929 IP node2.44932 > node4.41947: UDP, length 112
03:18:38.210308 IP node2.57596 > node4.41947: UDP, length 113
03:18:38.210541 IP node2.50082 > node4.41947: UDP, length 113
03:18:38.210861 IP node2.41342 > node4.41947: UDP, length 113
03:18:38.210929 IP node2.46463 > node4.41947: UDP, length 113
03:18:38.211052 IP node2.55804 > node4.41947: UDP, length 113
03:18:38.211126 IP node2.54999 > node4.41947: UDP, length 113
03:18:38.211201 IP node2.38346 > node4.41947: UDP, length 113
03:18:38.211389 IP node2.60148 > node4.41947: UDP, length 113
03:18:38.212167 IP node2.51828 > node4.41947: UDP, length 113
03:18:38.212583 IP node2.38998 > node4.41947: UDP, length 113
03:18:38.212748 IP node2.35704 > node4.41947: UDP, length 113
03:18:38.212966 IP node2.51687 > node4.41947: UDP, length 113
03:18:38.213218 IP node2.55028 > node4.41947: UDP, length 112
03:18:38.213296 IP node2.43123 > node3.54133: UDP, length 113
03:18:38.213828 IP node2.42922 > node4.41947: UDP, length 113
03:18:38.213924 IP node2.42922 > node3.54133: UDP, length 113
03:18:38.214232 IP node2.39546 > node4.41947: UDP, length 113
03:18:38.214557 IP node2.45280 > node4.41947: UDP, length 113
03:18:38.214612 IP node2.59588 > node4.41947: UDP, length 113
03:18:38.215103 IP node2.40763 > node4.41947: UDP, length 113
03:18:38.215174 IP node2.57500 > node4.41947: UDP, length 112
03:18:38.215570 IP node2.40178 > node4.41947: UDP, length 113
03:18:38.215921 IP node2.44241 > node4.41947: UDP, length 113
03:18:38.233421 IP node2.60148 > node4.58599: UDP, length 113
03:18:38.233665 IP node2.35704 > node4.58599: UDP, length 113
03:18:38.234174 IP node2.38346 > node4.58599: UDP, length 113
03:18:38.234862 IP node2.59355 > node4.58599: UDP, length 113
03:18:38.234941 IP node2.44932 > node4.58599: UDP, length 112
03:18:38.235053 IP node2.51687 > node4.58599: UDP, length 113
03:18:38.235162 IP node2.33710 > node4.58599: UDP, length 112
03:18:38.237501 IP node2.57500 > node4.58599: UDP, length 112
03:18:38.238032 IP node2.57596 > node4.58599: UDP, length 113
03:18:38.238251 IP node2.38998 > node4.58599: UDP, length 113
03:18:38.238805 IP node2.40763 > node4.58599: UDP, length 113
03:18:38.238904 IP node2.55804 > node4.58599: UDP, length 113
03:18:38.239549 IP node2.39546 > node4.58599: UDP, length 113
03:18:38.239723 IP node2.41342 > node4.58599: UDP, length 113
03:18:38.239795 IP node2.51828 > node4.58599: UDP, length 113
03:18:38.239861 IP node2.50082 > node4.58599: UDP, length 113
03:18:38.240127 IP node2.55028 > node4.58599: UDP, length 112
03:18:38.240911 IP node2.46463 > node4.58599: UDP, length 113
03:18:38.240977 IP node2.54999 > node4.58599: UDP, length 113
03:18:38.241249 IP node2.44241 > node4.58599: UDP, length 113
03:18:38.241365 IP node2.45280 > node4.58599: UDP, length 113
03:18:38.241445 IP node2.42922 > node4.58599: UDP, length 113
03:18:38.241641 IP node2.43123 > node4.58599: UDP, length 113
03:18:38.241708 IP node2.59588 > node4.58599: UDP, length 113
03:18:38.241778 IP node2.40178 > node4.58599: UDP, length 113
03:18:38.409224 IP node2.50082 > node4.56064: UDP, length 113
03:18:38.409539 IP node2.45280 > node4.56064: UDP, length 113
03:18:38.409754 IP node2.46463 > node4.56064: UDP, length 113
03:18:38.409822 IP node2.41342 > node4.56064: UDP, length 113
03:18:38.410018 IP node2.33710 > node4.56064: UDP, length 112
03:18:38.410215 IP node2.43123 > node4.56064: UDP, length 113
03:18:38.411551 IP node2.55804 > node4.56064: UDP, length 113
03:18:38.413034 IP node2.59355 > node4.56064: UDP, length 113
03:18:38.413168 IP node2.38346 > node4.56064: UDP, length 113
03:18:38.413576 IP node2.60148 > node4.56064: UDP, length 113
03:18:38.414249 IP node2.44932 > node4.56064: UDP, length 112
03:18:38.415353 IP node2.55028 > node4.56064: UDP, length 112
03:18:38.415888 IP node2.35704 > node4.56064: UDP, length 113
03:18:38.416386 IP node2.57500 > node4.56064: UDP, length 112
03:18:38.416980 IP node2.51828 > node4.56064: UDP, length 113
03:18:38.417482 IP node2.44241 > node4.56064: UDP, length 113
03:18:38.417626 IP node2.59588 > node4.56064: UDP, length 113
03:18:38.417742 IP node2.40763 > node4.56064: UDP, length 113
03:18:38.418351 IP node2.54999 > node4.56064: UDP, length 113
03:18:38.418480 IP node2.57596 > node4.56064: UDP, length 113
03:18:38.418649 IP node2.40178 > node4.56064: UDP, length 113
03:18:38.419394 IP node2.42922 > node4.56064: UDP, length 113
03:18:38.419841 IP node2.51687 > node4.56064: UDP, length 113
03:18:38.420343 IP node2.39546 > node4.56064: UDP, length 113
03:18:38.421640 IP node2.38998 > node4.56064: UDP, length 113
03:18:38.433918 IP node2.60148 > node4.50849: UDP, length 113
03:18:38.434063 IP node2.43123 > node4.50849: UDP, length 113
03:18:38.434591 IP node2.46463 > node4.50849: UDP, length 113
03:18:38.434848 IP node2.59588 > node4.50849: UDP, length 113
03:18:38.434958 IP node2.40178 > node4.50849: UDP, length 113
03:18:38.435209 IP node2.41342 > node4.50849: UDP, length 113
03:18:38.435352 IP node2.50082 > node4.50849: UDP, length 113
03:18:38.436264 IP node2.33710 > node4.50849: UDP, length 112
03:18:38.436559 IP node2.55028 > node4.50849: UDP, length 112
03:18:38.436650 IP node2.55804 > node4.50849: UDP, length 113
03:18:38.437523 IP node2.57596 > node4.50849: UDP, length 113
03:18:38.437795 IP node2.35704 > node4.50849: UDP, length 113
03:18:38.438123 IP node2.51828 > node4.50849: UDP, length 113
03:18:38.438200 IP node2.40763 > node4.50849: UDP, length 113
03:18:38.439156 IP node2.42922 > node4.50849: UDP, length 113
03:18:38.439240 IP node2.44932 > node4.50849: UDP, length 112
03:18:38.439568 IP node2.38346 > node4.50849: UDP, length 113
03:18:38.439832 IP node2.54999 > node4.50849: UDP, length 113
03:18:38.439941 IP node2.44241 > node4.50849: UDP, length 113
03:18:38.440504 IP node2.45280 > node4.50849: UDP, length 113
03:18:38.440909 IP node2.39546 > node4.50849: UDP, length 113
03:18:38.441235 IP node2.59355 > node4.50849: UDP, length 113
03:18:38.442044 IP node2.57500 > node4.50849: UDP, length 112
03:18:38.442241 IP node2.51687 > node4.50849: UDP, length 113
03:18:38.442415 IP node2.38998 > node4.50849: UDP, length 113
03:18:38.459107 IP node2.40178 > node3.39872: UDP, length 113
03:18:38.459375 IP node2.46463 > node3.39872: UDP, length 113
03:18:38.459753 IP node2.54999 > node3.39872: UDP, length 113
03:18:38.459987 IP node2.42922 > node3.39872: UDP, length 113
03:18:38.461108 IP node2.38346 > node3.39872: UDP, length 113
03:18:38.461638 IP node2.51687 > node3.39872: UDP, length 113
03:18:38.461865 IP node2.41342 > node3.39872: UDP, length 113
03:18:38.462108 IP node2.44932 > node3.39872: UDP, length 112
03:18:38.462724 IP node2.55028 > node3.39872: UDP, length 112
03:18:38.463274 IP node2.33710 > node3.39872: UDP, length 112
03:18:38.463577 IP node2.44241 > node3.39872: UDP, length 113
03:18:38.463843 IP node2.60148 > node3.39872: UDP, length 113
03:18:38.464243 IP node2.39546 > node3.39872: UDP, length 113
03:18:38.464809 IP node2.51828 > node3.39872: UDP, length 113
03:18:38.464907 IP node2.57500 > node3.39872: UDP, length 112
03:18:38.465017 IP node2.57596 > node3.39872: UDP, length 113
03:18:38.466098 IP node2.59588 > node3.39872: UDP, length 113
03:18:38.467790 IP node2.35704 > node3.39872: UDP, length 113
03:18:38.467851 IP node2.59355 > node3.39872: UDP, length 113
03:18:38.468128 IP node2.45280 > node3.39872: UDP, length 113
03:18:38.469047 IP node2.43123 > node3.39872: UDP, length 113
03:18:38.469116 IP node2.50082 > node3.39872: UDP, length 113
03:18:38.469406 IP node2.38998 > node3.39872: UDP, length 113
03:18:38.469694 IP node2.55804 > node3.39872: UDP, length 113
03:18:38.469764 IP node2.40763 > node3.39872: UDP, length 113
03:18:38.505350 IP node2.40178 > node3.45327: UDP, length 113
03:18:38.505631 IP node2.46463 > node3.45327: UDP, length 113
03:18:38.505895 IP node2.55804 > node3.45327: UDP, length 113
03:18:38.507756 IP node2.38998 > node3.45327: UDP, length 113
03:18:38.508081 IP node2.44241 > node3.45327: UDP, length 113
03:18:38.509058 IP node2.54999 > node3.45327: UDP, length 113
03:18:38.515816 IP node2.57596 > node3.45327: UDP, length 113
03:18:38.515912 IP node2.51828 > node3.45327: UDP, length 113
03:18:38.515957 IP node2.43123 > node3.45327: UDP, length 113
03:18:38.517428 IP node2.55028 > node3.45327: UDP, length 112
03:18:38.518181 IP node2.60148 > node3.45327: UDP, length 113
03:18:38.518676 IP node2.40763 > node3.45327: UDP, length 113
03:18:38.520015 IP node2.39546 > node3.45327: UDP, length 113
03:18:38.520424 IP node2.59588 > node3.45327: UDP, length 113
03:18:38.520684 IP node2.41342 > node3.45327: UDP, length 113
03:18:38.525006 IP node2.55804 > node4.38585: UDP, length 113
03:18:38.525180 IP node2.41342 > node4.38585: UDP, length 113
03:18:38.526296 IP node2.43123 > node4.38585: UDP, length 113
03:18:38.526813 IP node2.46463 > node4.38585: UDP, length 113
03:18:38.526988 IP node2.55028 > node4.38585: UDP, length 112
03:18:38.527310 IP node2.51687 > node3.45327: UDP, length 113
03:18:38.527619 IP node2.51828 > node4.38585: UDP, length 113
03:18:38.527872 IP node2.38346 > node3.45327: UDP, length 113
03:18:38.527972 IP node2.38346 > node4.38585: UDP, length 113
03:18:38.528042 IP node2.40178 > node4.38585: UDP, length 113
03:18:38.528333 IP node2.40763 > node4.38585: UDP, length 113
03:18:38.529586 IP node2.57500 > node4.38585: UDP, length 112
03:18:38.529748 IP node2.51687 > node4.38585: UDP, length 113
03:18:38.530894 IP node2.57500 > node3.45327: UDP, length 112
03:18:38.531110 IP node2.39546 > node4.38585: UDP, length 113
03:18:38.531228 IP node2.54999 > node4.38585: UDP, length 113
03:18:38.531330 IP node2.44932 > node4.38585: UDP, length 112
03:18:38.531666 IP node2.44932 > node3.45327: UDP, length 112
03:18:38.531724 IP node2.59588 > node4.38585: UDP, length 113
03:18:38.532577 IP node2.44241 > node4.38585: UDP, length 113
03:18:38.532803 IP node2.33710 > node3.45327: UDP, length 112
03:18:38.532930 IP node2.33710 > node4.38585: UDP, length 112
03:18:38.533255 IP node2.60148 > node4.38585: UDP, length 113
03:18:38.533548 IP node2.50082 > node3.45327: UDP, length 113
03:18:38.534057 IP node2.57596 > node4.38585: UDP, length 113
03:18:38.534180 IP node2.42922 > node3.45327: UDP, length 113
03:18:38.534378 IP node2.50082 > node4.38585: UDP, length 113
03:18:38.534550 IP node2.42922 > node4.38585: UDP, length 113
03:18:38.534787 IP node2.35704 > node3.45327: UDP, length 113
03:18:38.535011 IP node2.35704 > node4.38585: UDP, length 113
03:18:38.535184 IP node2.45280 > node4.38585: UDP, length 113
03:18:38.535307 IP node2.45280 > node3.45327: UDP, length 113
03:18:38.535363 IP node2.38998 > node4.38585: UDP, length 113
03:18:38.537445 IP node2.59355 > node4.38585: UDP, length 113
03:18:38.537555 IP node2.59355 > node3.45327: UDP, length 113
03:18:38.607782 IP node2.41342 > node3.34875: UDP, length 113
03:18:38.608141 IP node2.40178 > node3.34875: UDP, length 113
03:18:38.608750 IP node2.33710 > node3.34875: UDP, length 112
03:18:38.608881 IP node2.46463 > node3.34875: UDP, length 113
03:18:38.609473 IP node2.40763 > node3.34875: UDP, length 113
03:18:38.609686 IP node2.55804 > node3.34875: UDP, length 113
03:18:38.609762 IP node2.57500 > node3.34875: UDP, length 112
03:18:38.609826 IP node2.42922 > node3.34875: UDP, length 113
03:18:38.609926 IP node2.51828 > node3.34875: UDP, length 113
03:18:38.610128 IP node2.59355 > node3.34875: UDP, length 113
03:18:38.610571 IP node2.38346 > node3.34875: UDP, length 113
03:18:38.611431 IP node2.44932 > node3.34875: UDP, length 112
03:18:38.611823 IP node2.51687 > node3.34875: UDP, length 113
03:18:38.611913 IP node2.55028 > node3.34875: UDP, length 112
03:18:38.612581 IP node2.43123 > node3.34875: UDP, length 113
03:18:38.612705 IP node2.45280 > node3.34875: UDP, length 113
03:18:38.613150 IP node2.60148 > node3.34875: UDP, length 113
03:18:38.613742 IP node2.35704 > node3.34875: UDP, length 113
03:18:38.614140 IP node2.44241 > node3.34875: UDP, length 113
03:18:38.614463 IP node2.57596 > node3.34875: UDP, length 113
03:18:38.615123 IP node2.39546 > node3.34875: UDP, length 113
03:18:38.616232 IP node2.54999 > node3.34875: UDP, length 113
03:18:38.616631 IP node2.59588 > node3.34875: UDP, length 113
03:18:38.617727 IP node2.50082 > node3.34875: UDP, length 113
03:18:38.618990 IP node2.38998 > node3.34875: UDP, length 113
03:18:38.667347 IP node2.55028 > node3.47016: UDP, length 112
03:18:38.668650 IP node2.33710 > node3.47016: UDP, length 112
03:18:38.669016 IP node2.41342 > node3.47016: UDP, length 113
03:18:38.669245 IP node2.40178 > node3.47016: UDP, length 113
03:18:38.669332 IP node2.38998 > node3.47016: UDP, length 113
03:18:38.669408 IP node2.46463 > node3.47016: UDP, length 113
03:18:38.669482 IP node2.42922 > node3.47016: UDP, length 113
03:18:38.669981 IP node2.38346 > node3.47016: UDP, length 113
03:18:38.670424 IP node2.55804 > node3.47016: UDP, length 113
03:18:38.670555 IP node2.54999 > node3.47016: UDP, length 113
03:18:38.670704 IP node2.59588 > node3.47016: UDP, length 113
03:18:38.670910 IP node2.44932 > node3.47016: UDP, length 112
03:18:38.671133 IP node2.40763 > node3.47016: UDP, length 113
03:18:38.671580 IP node2.59355 > node3.47016: UDP, length 113
03:18:38.672131 IP node2.45280 > node3.47016: UDP, length 113
03:18:38.672374 IP node2.43123 > node3.47016: UDP, length 113
03:18:38.672657 IP node2.51687 > node3.47016: UDP, length 113
03:18:38.672753 IP node2.35704 > node3.47016: UDP, length 113
03:18:38.672947 IP node2.57500 > node3.47016: UDP, length 112
03:18:38.673605 IP node2.39546 > node3.47016: UDP, length 113
03:18:38.673707 IP node2.50082 > node3.47016: UDP, length 113
03:18:38.673959 IP node2.51828 > node3.47016: UDP, length 113
