03:18:34.672461 IP node2.50082 > node2.44932: UDP, length 113
03:18:34.722285 IP node2.44932 > node2.50082: UDP, length 112
03:18:34.921664 IP node2.50082 > node2.38346: UDP, length 113
03:18:34.922144 IP node2.44932 > node2.38346: UDP, length 112
03:18:35.022828 IP node2.38346 > node2.50082: UDP, length 113
03:18:35.054410 IP node2.50082 > node2.43123: UDP, length 113
03:18:35.055675 IP node2.44932 > node2.43123: UDP, length 112
03:18:35.057147 IP node2.38346 > node2.43123: UDP, length 113
03:18:35.105591 IP node2.44932 > node2.38998: UDP, length 112
03:18:35.105795 IP node2.50082 > node2.38998: UDP, length 113
03:18:35.108352 IP node2.38346 > node2.38998: UDP, length 113
03:18:35.121063 IP node2.43123 > node2.38346: UDP, length 113
03:18:35.122551 IP node2.43123 > node2.38998: UDP, length 113
03:18:35.157914 IP node2.38998 > node2.38346: UDP, length 113
03:18:35.158267 IP node2.38998 > node2.43123: UDP, length 113
03:18:35.170863 IP node2.38346 > node2.41342: UDP, length 113
03:18:35.171165 IP node2.50082 > node2.41342: UDP, length 113
03:18:35.171750 IP node2.44932 > node2.41342: UDP, length 112
03:18:35.172274 IP node2.43123 > node2.41342: UDP, length 113
03:18:35.182678 IP node2.38998 > node2.41342: UDP, length 113
03:18:35.218944 IP node2.41342 > node2.43123: UDP, length 113
03:18:35.219040 IP node2.41342 > node2.38998: UDP, length 113
03:18:35.225929 IP node2.41342 > node2.38346: UDP, length 113
03:18:35.237252 IP node2.44932 > node2.45280: UDP, length 112
03:18:35.237466 IP node2.38998 > node2.45280: UDP, length 113
03:18:35.237514 IP node2.50082 > node2.45280: UDP, length 113
03:18:35.237669 IP node2.38346 > node2.45280: UDP, length 113
03:18:35.240962 IP node2.41342 > node2.45280: UDP, length 113
03:18:35.245585 IP node2.43123 > node2.45280: UDP, length 113
03:18:35.354827 IP node2.43123 > node2.57596: UDP, length 113
03:18:35.354996 IP node2.44932 > node2.57596: UDP, length 112
03:18:35.355080 IP node2.50082 > node2.57596: UDP, length 113
03:18:35.355683 IP node2.38346 > node2.57596: UDP, length 113
03:18:35.355825 IP node2.41342 > node2.57596: UDP, length 113
03:18:35.355951 IP node2.38998 > node2.57596: UDP, length 113
03:18:35.394969 IP node2.57596 > node2.43123: UDP, length 113
03:18:35.395021 IP node2.57596 > node2.38998: UDP, length 113
03:18:35.396277 IP node2.57596 > node2.41342: UDP, length 113
03:18:35.405409 IP node2.38998 > node2.51828: UDP, length 113
03:18:35.405474 IP node2.50082 > node2.51828: UDP, length 113
03:18:35.405474 IP node2.43123 > node2.51828: UDP, length 113
03:18:35.405509 IP node2.44932 > node2.51828: UDP, length 112
03:18:35.405662 IP node2.41342 > node2.51828: UDP, length 113
03:18:35.405896 IP node2.38346 > node2.51828: UDP, length 113
03:18:35.411870 IP node2.57596 > node2.51828: UDP, length 113
03:18:35.432117 IP node2.45280 > node2.38346: UDP, length 113
03:18:35.432336 IP node2.57596 > node2.45280: UDP, length 113
03:18:35.473106 IP node2.45280 > node2.57596: UDP, length 113
03:18:35.473195 IP node2.45280 > node2.38998: UDP, length 113
03:18:35.473296 IP node2.45280 > node2.51828: UDP, length 113
03:18:35.477331 IP node2.51828 > node2.43123: UDP, length 113
03:18:35.479003 IP node2.45280 > node2.41342: UDP, length 113
03:18:35.493117 IP node2.45280 > node2.43123: UDP, length 113
03:18:35.494932 IP node2.51828 > node2.57596: UDP, length 113
03:18:35.495014 IP node2.51828 > node2.38998: UDP, length 113
03:18:35.495081 IP node2.51828 > node2.41342: UDP, length 113
03:18:35.495139 IP node2.51828 > node2.45280: UDP, length 113
03:18:35.564662 IP node2.59355 > node2.41342: UDP, length 113
03:18:35.565141 IP node2.43123 > node2.59355: UDP, length 113
03:18:35.565430 IP node2.50082 > node2.59355: UDP, length 113
03:18:35.566048 IP node2.44932 > node2.59355: UDP, length 112
03:18:35.566219 IP node2.45280 > node2.59355: UDP, length 113
03:18:35.568256 IP node2.38346 > node2.59355: UDP, length 113
03:18:35.569975 IP node2.38998 > node2.59355: UDP, length 113
03:18:35.572007 IP node2.41342 > node2.59355: UDP, length 113
03:18:35.572208 IP node2.59355 > node2.45280: UDP, length 113
03:18:35.572348 IP node2.51828 > node2.59355: UDP, length 113
03:18:35.575930 IP node2.59355 > node2.57596: UDP, length 113
03:18:35.576331 IP node2.59355 > node2.51828: UDP, length 113
03:18:35.589366 IP node2.57596 > node2.59355: UDP, length 113
03:18:35.612904 IP node2.55804 > node2.57596: UDP, length 113
03:18:35.613622 IP node2.55804 > node2.51828: UDP, length 113
03:18:35.613689 IP node2.55804 > node2.41342: UDP, length 113
03:18:35.613752 IP node2.55804 > node2.45280: UDP, length 113
03:18:35.613836 IP node2.55804 > node2.59355: UDP, length 113
03:18:35.614015 IP node2.41342 > node2.55804: UDP, length 113
03:18:35.614102 IP node2.44932 > node2.55804: UDP, length 112
03:18:35.615941 IP node2.45280 > node2.55804: UDP, length 113
03:18:35.616341 IP node2.50082 > node2.55804: UDP, length 113
03:18:35.618605 IP node2.51828 > node2.55804: UDP, length 113
03:18:35.618902 IP node2.57596 > node2.55804: UDP, length 113
03:18:35.621070 IP node2.43123 > node2.55804: UDP, length 113
03:18:35.621121 IP node2.38998 > node2.55804: UDP, length 113
03:18:35.621308 IP node2.38346 > node2.55804: UDP, length 113
03:18:35.625660 IP node2.59355 > node2.55804: UDP, length 113
03:18:35.729303 IP node2.42922 > node2.57596: UDP, length 113
03:18:35.730557 IP node2.42922 > node2.59355: UDP, length 113
03:18:35.731233 IP node2.50082 > node2.42922: UDP, length 113
03:18:35.731272 IP node2.44932 > node2.42922: UDP, length 112
03:18:35.731696 IP node2.41342 > node2.42922: UDP, length 113
03:18:35.733092 IP node2.45280 > node2.42922: UDP, length 113
03:18:35.733771 IP node2.55804 > node2.42922: UDP, length 113
03:18:35.733956 IP node2.43123 > node2.42922: UDP, length 113
03:18:35.734121 IP node2.57596 > node2.42922: UDP, length 113
03:18:35.734854 IP node2.42922 > node2.55804: UDP, length 113
03:18:35.735359 IP node2.38998 > node2.42922: UDP, length 113
03:18:35.735575 IP node2.38346 > node2.42922: UDP, length 113
03:18:35.735739 IP node2.51828 > node2.42922: UDP, length 113
03:18:35.735814 IP node2.59355 > node2.42922: UDP, length 113
03:18:35.740378 IP node2.42922 > node2.51828: UDP, length 113
03:18:35.740395 IP node2.59588 > node2.57596: UDP, length 113
03:18:35.741392 IP node2.41342 > node2.59588: UDP, length 113
03:18:35.741440 IP node2.50082 > node2.59588: UDP, length 113
03:18:35.741485 IP node2.44932 > node2.59588: UDP, length 112
03:18:35.742018 IP node2.59588 > node2.55804: UDP, length 113
03:18:35.742100 IP node2.59588 > node2.59355: UDP, length 113
03:18:35.742172 IP node2.43123 > node2.59588: UDP, length 113
03:18:35.742231 IP node2.38998 > node2.59588: UDP, length 113
03:18:35.743240 IP node2.57596 > node2.59588: UDP, length 113
03:18:35.743353 IP node2.45280 > node2.59588: UDP, length 113
03:18:35.743677 IP node2.51828 > node2.59588: UDP, length 113
03:18:35.744645 IP node2.55804 > node2.59588: UDP, length 113
03:18:35.745655 IP node2.38346 > node2.59588: UDP, length 113
03:18:35.745892 IP node2.59355 > node2.59588: UDP, length 113
03:18:35.758798 IP node2.59588 > node2.42922: UDP, length 113
03:18:35.760032 IP node2.59588 > node2.51828: UDP, length 113
03:18:35.777387 IP node2.42922 > node2.59588: UDP, length 113
03:18:35.800935 IP node2.51687 > node2.59355: UDP, length 113
03:18:35.801404 IP node2.50082 > node2.51687: UDP, length 113
03:18:35.801535 IP node2.41342 > node2.51687: UDP, length 113
03:18:35.801651 IP node2.44932 > node2.51687: UDP, length 112
03:18:35.801839 IP node2.57596 > node2.51687: UDP, length 113
03:18:35.802028 IP node2.43123 > node2.51687: UDP, length 113
03:18:35.802197 IP node2.55804 > node2.51687: UDP, length 113
03:18:35.802929 IP node2.45280 > node2.51687: UDP, length 113
03:18:35.803251 IP node2.38346 > node2.51687: UDP, length 113
03:18:35.803409 IP node2.59355 > node2.51687: UDP, length 113
03:18:35.803638 IP node2.38998 > node2.51687: UDP, length 113
03:18:35.803833 IP node2.59588 > node2.51687: UDP, length 113
03:18:35.803883 IP node2.51828 > node2.51687: UDP, length 113
03:18:35.808274 IP node2.42922 > node2.51687: UDP, length 113
03:18:35.822418 IP node2.51687 > node2.42922: UDP, length 113
03:18:35.822462 IP node2.51687 > node2.55804: UDP, length 113
03:18:35.822586 IP node2.51687 > node2.59588: UDP, length 113
03:18:35.898839 IP node2.46463 > node2.55804: UDP, length 113
03:18:35.898920 IP node2.46463 > node2.59355: UDP, length 113
03:18:35.899469 IP node2.41342 > node2.46463: UDP, length 113
03:18:35.900495 IP node2.44932 > node2.46463: UDP, length 112
03:18:35.900720 IP node2.59588 > node2.46463: UDP, length 113
03:18:35.901101 IP node2.42922 > node2.46463: UDP, length 113
03:18:35.901425 IP node2.51687 > node2.46463: UDP, length 113
03:18:35.902720 IP node2.59355 > node2.46463: UDP, length 113
03:18:35.903088 IP node2.45280 > node2.46463: UDP, length 113
03:18:35.903269 IP node2.55804 > node2.46463: UDP, length 113
03:18:35.903440 IP node2.50082 > node2.46463: UDP, length 113
03:18:35.904278 IP node2.46463 > node2.59588: UDP, length 113
03:18:35.904522 IP node2.46463 > node2.51687: UDP, length 113
03:18:35.904577 IP node2.57596 > node2.46463: UDP, length 113
03:18:35.904862 IP node2.43123 > node2.46463: UDP, length 113
03:18:35.905034 IP node2.38346 > node2.46463: UDP, length 113
03:18:35.906904 IP node2.38998 > node2.46463: UDP, length 113
03:18:35.908170 IP node2.51828 > node2.46463: UDP, length 113
03:18:35.923190 IP node2.46463 > node2.42922: UDP, length 113
03:18:35.982301 IP node2.35704 > node2.42922: UDP, length 113
03:18:35.982376 IP node2.35704 > node2.46463: UDP, length 113
03:18:35.982452 IP node2.35704 > node2.55804: UDP, length 113
03:18:35.982514 IP node2.35704 > node2.59355: UDP, length 113
03:18:35.982626 IP node2.35704 > node2.59588: UDP, length 113
03:18:35.982690 IP node2.35704 > node2.51687: UDP, length 113
03:18:35.982765 IP node2.41342 > node2.35704: UDP, length 113
03:18:35.983807 IP node2.45280 > node2.35704: UDP, length 113
03:18:35.983889 IP node2.38998 > node2.35704: UDP, length 113
03:18:35.984153 IP node2.59588 > node2.35704: UDP, length 113
03:18:35.984363 IP node2.44932 > node2.35704: UDP, length 112
03:18:35.984374 IP node2.51828 > node2.35704: UDP, length 113
03:18:35.984544 IP node2.50082 > node2.35704: UDP, length 113
03:18:35.984598 IP node2.51687 > node2.35704: UDP, length 113
03:18:35.984781 IP node2.59355 > node2.35704: UDP, length 113
03:18:35.986172 IP node2.55804 > node2.35704: UDP, length 113
03:18:35.986208 IP node2.42922 > node2.35704: UDP, length 113
03:18:35.987294 IP node2.38346 > node2.35704: UDP, length 113
03:18:35.988381 IP node2.46463 > node2.35704: UDP, length 113
03:18:35.988729 IP node2.57596 > node2.35704: UDP, length 113
03:18:35.988918 IP node2.33710 > node2.42922: UDP, length 112
03:18:35.989093 IP node2.43123 > node2.35704: UDP, length 113
03:18:35.989351 IP node2.50082 > node2.33710: UDP, length 113
03:18:35.989362 IP node2.41342 > node2.33710: UDP, length 113
03:18:35.989791 IP node2.38346 > node2.33710: UDP, length 113
03:18:35.990493 IP node2.57596 > node2.33710: UDP, length 113
03:18:35.991186 IP node2.55804 > node2.33710: UDP, length 113
03:18:35.991412 IP node2.59588 > node2.33710: UDP, length 113
03:18:35.991439 IP node2.43123 > node2.33710: UDP, length 113
03:18:35.991562 IP node2.38998 > node2.33710: UDP, length 113
03:18:35.991932 IP node2.59355 > node2.33710: UDP, length 113
03:18:35.992387 IP node2.42922 > node2.33710: UDP, length 113
03:18:35.993163 IP node2.45280 > node2.33710: UDP, length 113
03:18:35.993441 IP node2.46463 > node2.33710: UDP, length 113
03:18:35.993782 IP node2.51828 > node2.33710: UDP, length 113
03:18:35.994020 IP node2.51687 > node2.33710: UDP, length 113
03:18:35.994882 IP node2.44932 > node2.33710: UDP, length 112
03:18:35.996474 IP node2.33710 > node2.46463: UDP, length 112
03:18:35.996624 IP node2.33710 > node2.51687: UDP, length 112
03:18:36.002138 IP node2.44241 > node2.59355: UDP, length 113
03:18:36.002533 IP node2.44932 > node2.44241: UDP, length 112
03:18:36.002980 IP node2.38346 > node2.44241: UDP, length 113
03:18:36.003112 IP node2.33710 > node2.35704: UDP, length 112
03:18:36.003368 IP node2.41342 > node2.44241: UDP, length 113
03:18:36.003698 IP node2.43123 > node2.44241: UDP, length 113
03:18:36.004137 IP node2.55804 > node2.44241: UDP, length 113
03:18:36.004392 IP node2.50082 > node2.44241: UDP, length 113
03:18:36.004655 IP node2.38998 > node2.44241: UDP, length 113
03:18:36.005207 IP node2.57596 > node2.44241: UDP, length 113
03:18:36.006014 IP node2.33710 > node2.44241: UDP, length 112
03:18:36.006237 IP node2.42922 > node2.44241: UDP, length 113
03:18:36.007168 IP node2.59355 > node2.44241: UDP, length 113
03:18:36.007875 IP node2.59588 > node2.44241: UDP, length 113
03:18:36.007946 IP node2.51828 > node2.44241: UDP, length 113
03:18:36.008711 IP node2.45280 > node2.44241: UDP, length 113
03:18:36.009231 IP node2.46463 > node2.44241: UDP, length 113
03:18:36.010248 IP node2.51687 > node2.44241: UDP, length 113
03:18:36.014559 IP node2.44241 > node2.55804: UDP, length 113
03:18:36.014849 IP node2.44241 > node2.42922: UDP, length 113
03:18:36.015086 IP node2.44241 > node2.59588: UDP, length 113
03:18:36.016657 IP node2.44241 > node2.46463: UDP, length 113
03:18:36.016717 IP node2.44241 > node2.51687: UDP, length 113
03:18:36.017281 IP node2.35704 > node2.44241: UDP, length 113
03:18:36.017344 IP node2.35704 > node2.33710: UDP, length 113
03:18:36.024406 IP node2.44241 > node2.35704: UDP, length 113
03:18:36.024588 IP node2.44241 > node2.33710: UDP, length 113
03:18:36.029419 IP node2.33710 > node2.59588: UDP, length 112
03:18:36.074401 IP node2.35704 > node2.55028: UDP, length 113
03:18:36.074906 IP node2.44241 > node2.55028: UDP, length 113
03:18:36.075107 IP node2.38346 > node2.55028: UDP, length 113
03:18:36.075735 IP node2.50082 > node2.55028: UDP, length 113
03:18:36.076297 IP node2.57596 > node2.55028: UDP, length 113
03:18:36.077750 IP node2.43123 > node2.55028: UDP, length 113
03:18:36.078863 IP node2.38998 > node2.55028: UDP, length 113
03:18:36.081958 IP node2.55804 > node2.55028: UDP, length 113
03:18:36.082441 IP node2.33710 > node2.55028: UDP, length 112
03:18:36.082834 IP node2.59355 > node2.55028: UDP, length 113
03:18:36.083185 IP node2.46463 > node2.55028: UDP, length 113
03:18:36.083606 IP node2.51687 > node2.55028: UDP, length 113
03:18:36.083884 IP node2.51828 > node2.55028: UDP, length 113
03:18:36.084611 IP node2.44932 > node2.55028: UDP, length 112
03:18:36.087762 IP node2.45280 > node2.55028: UDP, length 113
03:18:36.088556 IP node2.59588 > node2.55028: UDP, length 113
03:18:36.088852 IP node2.41342 > node2.55028: UDP, length 113
03:18:36.089833 IP node2.42922 > node2.55028: UDP, length 113
03:18:36.126979 IP node2.55028 > node2.42922: UDP, length 112
03:18:36.127063 IP node2.55028 > node2.59588: UDP, length 112
03:18:36.131707 IP node2.55028 > node2.46463: UDP, length 112
03:18:36.131793 IP node2.55028 > node2.44241: UDP, length 112
03:18:36.131871 IP node2.55028 > node2.35704: UDP, length 112
03:18:36.131936 IP node2.55028 > node2.33710: UDP, length 112
03:18:36.137721 IP node2.55028 > node2.51687: UDP, length 112
03:18:36.152099 IP node2.40178 > node2.42922: UDP, length 113
03:18:36.152282 IP node2.50082 > node2.40178: UDP, length 113
03:18:36.152533 IP node2.40178 > node2.55028: UDP, length 113
03:18:36.152647 IP node2.40178 > node2.46463: UDP, length 113
03:18:36.152722 IP node2.40178 > node2.44241: UDP, length 113
03:18:36.152951 IP node2.40178 > node2.35704: UDP, length 113
03:18:36.154381 IP node2.33710 > node2.40178: UDP, length 112
03:18:36.154824 IP node2.35704 > node2.40178: UDP, length 113
03:18:36.155087 IP node2.44241 > node2.40178: UDP, length 113
03:18:36.155228 IP node2.51687 > node2.40178: UDP, length 113
03:18:36.155261 IP node2.46463 > node2.40178: UDP, length 113
03:18:36.155466 IP node2.42922 > node2.40178: UDP, length 113
03:18:36.155765 IP node2.59588 > node2.40178: UDP, length 113
03:18:36.156415 IP node2.59355 > node2.40178: UDP, length 113
03:18:36.156923 IP node2.55804 > node2.40178: UDP, length 113
03:18:36.157098 IP node2.57596 > node2.40178: UDP, length 113
03:18:36.157351 IP node2.51828 > node2.40178: UDP, length 113
03:18:36.157373 IP node2.41342 > node2.40178: UDP, length 113
03:18:36.158265 IP node2.38998 > node2.60148: UDP, length 113
03:18:36.158337 IP node2.38998 > node2.40178: UDP, length 113
03:18:36.158741 IP node2.45280 > node2.40178: UDP, length 113
03:18:36.159262 IP node2.43123 > node2.40178: UDP, length 113
03:18:36.159497 IP node2.38346 > node2.60148: UDP, length 113
03:18:36.159576 IP node2.38346 > node2.40178: UDP, length 113
03:18:36.160230 IP node2.44932 > node2.60148: UDP, length 112
03:18:36.160287 IP node2.44932 > node2.40178: UDP, length 112
03:18:36.161285 IP node2.35704 > node2.60148: UDP, length 113
03:18:36.162609 IP node2.55804 > node2.60148: UDP, length 113
03:18:36.163348 IP node2.46463 > node2.60148: UDP, length 113
03:18:36.163385 IP node2.57596 > node2.60148: UDP, length 113
03:18:36.163751 IP node2.51687 > node2.60148: UDP, length 113
03:18:36.163996 IP node2.33710 > node2.60148: UDP, length 112
03:18:36.164541 IP node2.51828 > node2.60148: UDP, length 113
03:18:36.164728 IP node2.59588 > node2.60148: UDP, length 113
03:18:36.165044 IP node2.44241 > node2.60148: UDP, length 113
03:18:36.165076 IP node2.59355 > node2.60148: UDP, length 113
03:18:36.165956 IP node2.50082 > node2.60148: UDP, length 113
03:18:36.166392 IP node2.43123 > node2.60148: UDP, length 113
03:18:36.166848 IP node2.40178 > node2.33710: UDP, length 113
03:18:36.166850 IP node2.41342 > node2.60148: UDP, length 113
03:18:36.167372 IP node2.40178 > node2.59588: UDP, length 113
03:18:36.167448 IP node2.45280 > node2.60148: UDP, length 113
03:18:36.167537 IP node2.60148 > node2.46463: UDP, length 113
03:18:36.167972 IP node2.40178 > node2.51687: UDP, length 113
03:18:36.168456 IP node2.42922 > node2.60148: UDP, length 113
03:18:36.169628 IP node2.55028 > node2.60148: UDP, length 112
03:18:36.169681 IP node2.55028 > node2.40178: UDP, length 112
03:18:36.171472 IP node2.40178 > node2.60148: UDP, length 113
03:18:36.172591 IP node2.46463 > node2.54999: UDP, length 113
03:18:36.172993 IP node2.59355 > node2.54999: UDP, length 113
03:18:36.173015 IP node2.38998 > node2.54999: UDP, length 113
03:18:36.173128 IP node2.50082 > node2.54999: UDP, length 113
03:18:36.173359 IP node2.51828 > node2.54999: UDP, length 113
03:18:36.173641 IP node2.41342 > node2.54999: UDP, length 113
03:18:36.173734 IP node2.35704 > node2.54999: UDP, length 113
03:18:36.174565 IP node2.55028 > node2.54999: UDP, length 112
03:18:36.174666 IP node2.59588 > node2.54999: UDP, length 113
03:18:36.174706 IP node2.43123 > node2.54999: UDP, length 113
03:18:36.175329 IP node2.44241 > node2.54999: UDP, length 113
03:18:36.175637 IP node2.44932 > node2.54999: UDP, length 112
03:18:36.175997 IP node2.40178 > node2.54999: UDP, length 113
03:18:36.176440 IP node2.38346 > node2.54999: UDP, length 113
03:18:36.177112 IP node2.55804 > node2.54999: UDP, length 113
03:18:36.178068 IP node2.57596 > node2.54999: UDP, length 113
03:18:36.178154 IP node2.51687 > node2.54999: UDP, length 113
03:18:36.178399 IP node2.33710 > node2.54999: UDP, length 112
03:18:36.178596 IP node2.45280 > node2.54999: UDP, length 113
03:18:36.178926 IP node2.42922 > node2.54999: UDP, length 113
03:18:36.187299 IP node2.60148 > node2.55028: UDP, length 113
03:18:36.187377 IP node2.60148 > node2.54999: UDP, length 113
03:18:36.187442 IP node2.60148 > node2.44241: UDP, length 113
03:18:36.187501 IP node2.60148 > node2.35704: UDP, length 113
03:18:36.187594 IP node2.60148 > node2.33710: UDP, length 113
03:18:36.187650 IP node2.60148 > node2.40178: UDP, length 113
03:18:36.236667 IP node2.54999 > node2.55028: UDP, length 113
03:18:36.236939 IP node2.54999 > node2.60148: UDP, length 113
03:18:36.237047 IP node2.39546 > node2.35704: UDP, length 113
03:18:36.237052 IP node2.54999 > node2.40178: UDP, length 113
03:18:36.239943 IP node2.39546 > node2.55028: UDP, length 113
03:18:36.240024 IP node2.39546 > node2.54999: UDP, length 113
03:18:36.240080 IP node2.39546 > node2.60148: UDP, length 113
03:18:36.242728 IP node2.44932 > node2.39546: UDP, length 112
03:18:36.244022 IP node2.39546 > node2.44241: UDP, length 113
03:18:36.244098 IP node2.39546 > node2.40178: UDP, length 113
03:18:36.244964 IP node2.51828 > node2.39546: UDP, length 113
03:18:36.247570 IP node2.59588 > node2.39546: UDP, length 113
03:18:36.248654 IP node2.50082 > node2.39546: UDP, length 113
03:18:36.249456 IP node2.46463 > node2.39546: UDP, length 113
03:18:36.249665 IP node2.39546 > node2.33710: UDP, length 113
03:18:36.252744 IP node2.38998 > node2.39546: UDP, length 113
03:18:36.255196 IP node2.54999 > node2.39546: UDP, length 113
03:18:36.255264 IP node2.55028 > node2.39546: UDP, length 112
03:18:36.260287 IP node2.51687 > node2.39546: UDP, length 113
03:18:36.263049 IP node2.40178 > node2.39546: UDP, length 113
03:18:36.264098 IP node2.33710 > node2.39546: UDP, length 112
03:18:36.264336 IP node2.44241 > node2.39546: UDP, length 113
03:18:36.265110 IP node2.59355 > node2.39546: UDP, length 113
03:18:36.268635 IP node2.38346 > node2.39546: UDP, length 113
03:18:36.270072 IP node2.43123 > node2.39546: UDP, length 113
03:18:36.271014 IP node2.57596 > node2.39546: UDP, length 113
03:18:36.272021 IP node2.41342 > node2.39546: UDP, length 113
03:18:36.276001 IP node2.35704 > node2.39546: UDP, length 113
03:18:36.277858 IP node2.55804 > node2.39546: UDP, length 113
03:18:36.281445 IP node2.45280 > node2.39546: UDP, length 113
03:18:36.282550 IP node2.60148 > node2.39546: UDP, length 113
03:18:36.285833 IP node2.42922 > node2.39546: UDP, length 113
03:18:36.401643 IP node2.38998 > node2.40763: UDP, length 113
03:18:36.402185 IP node2.50082 > node2.40763: UDP, length 113
03:18:36.402488 IP node2.40178 > node2.40763: UDP, length 113
03:18:36.402703 IP node2.35704 > node2.40763: UDP, length 113
03:18:36.403257 IP node2.45280 > node2.40763: UDP, length 113
03:18:36.403430 IP node2.46463 > node2.40763: UDP, length 113
03:18:36.404237 IP node2.55028 > node2.40763: UDP, length 112
03:18:36.404530 IP node2.44241 > node2.40763: UDP, length 113
03:18:36.404670 IP node2.54999 > node2.40763: UDP, length 113
03:18:36.404906 IP node2.51687 > node2.40763: UDP, length 113
03:18:36.404931 IP node2.39546 > node2.40763: UDP, length 113
03:18:36.404950 IP node2.38346 > node2.40763: UDP, length 113
03:18:36.405086 IP node2.51828 > node2.40763: UDP, length 113
03:18:36.405122 IP node2.41342 > node2.40763: UDP, length 113
03:18:36.405150 IP node2.43123 > node2.40763: UDP, length 113
03:18:36.405326 IP node2.57596 > node2.40763: UDP, length 113
03:18:36.406271 IP node2.60148 > node2.40763: UDP, length 113
03:18:36.406565 IP node2.33710 > node2.40763: UDP, length 112
03:18:36.406565 IP node2.59355 > node2.40763: UDP, length 113
03:18:36.406683 IP node2.55804 > node2.40763: UDP, length 113
03:18:36.406928 IP node2.42922 > node2.40763: UDP, length 113
03:18:36.407410 IP node2.44932 > node2.40763: UDP, length 112
03:18:36.407611 IP node2.59588 > node2.40763: UDP, length 113
03:18:36.426191 IP node2.44241 > node2.57500: UDP, length 113
03:18:36.426550 IP node2.40178 > node2.57500: UDP, length 113
03:18:36.427104 IP node2.38998 > node2.57500: UDP, length 113
03:18:36.427307 IP node2.59355 > node2.57500: UDP, length 113
03:18:36.427951 IP node2.35704 > node2.57500: UDP, length 113
03:18:36.428328 IP node2.51687 > node2.57500: UDP, length 113
03:18:36.428502 IP node2.45280 > node2.57500: UDP, length 113
03:18:36.428774 IP node2.33710 > node2.57500: UDP, length 112
03:18:36.429050 IP node2.43123 > node2.57500: UDP, length 113
03:18:36.429098 IP node2.46463 > node2.57500: UDP, length 113
03:18:36.429120 IP node2.60148 > node2.57500: UDP, length 113
03:18:36.429360 IP node2.51828 > node2.57500: UDP, length 113
03:18:36.429375 IP node2.39546 > node2.57500: UDP, length 113
03:18:36.429817 IP node2.42922 > node2.57500: UDP, length 113
03:18:36.429817 IP node2.55804 > node2.57500: UDP, length 113
03:18:36.429852 IP node2.50082 > node2.57500: UDP, length 113
03:18:36.430096 IP node2.57596 > node2.57500: UDP, length 113
03:18:36.430122 IP node2.54999 > node2.57500: UDP, length 113
03:18:36.430217 IP node2.38346 > node2.57500: UDP, length 113
03:18:36.430396 IP node2.41342 > node2.57500: UDP, length 113
03:18:36.430621 IP node2.59588 > node2.57500: UDP, length 113
03:18:36.430914 IP node2.44932 > node2.57500: UDP, length 112
03:18:36.431284 IP node2.40763 > node2.57500: UDP, length 113
03:18:36.431609 IP node2.55028 > node2.57500: UDP, length 112
03:18:36.439303 IP node2.57500 > node2.40763: UDP, length 112
03:18:37.889096 IP node2.44241 > node2.44932: UDP, length 113
03:18:37.889478 IP node2.35704 > node2.44932: UDP, length 113
03:18:37.889927 IP node2.42922 > node2.44932: UDP, length 113
03:18:37.890071 IP node2.57596 > node2.44932: UDP, length 113
03:18:37.890305 IP node2.39546 > node2.44932: UDP, length 113
03:18:37.891366 IP node2.57500 > node2.44932: UDP, length 112
03:18:37.891632 IP node2.41342 > node2.44932: UDP, length 113
03:18:37.891973 IP node2.51828 > node2.44932: UDP, length 113
03:18:37.892912 IP node2.43123 > node2.44932: UDP, length 113
03:18:37.893288 IP node2.38346 > node2.44932: UDP, length 113
03:18:37.893405 IP node2.54999 > node2.44932: UDP, length 113
03:18:37.893608 IP node2.51687 > node2.44932: UDP, length 113
03:18:37.893930 IP node2.40763 > node2.44932: UDP, length 113
03:18:37.893931 IP node2.38998 > node2.44932: UDP, length 113
03:18:37.894031 IP node2.45280 > node2.44932: UDP, length 113
03:18:37.894032 IP node2.55028 > node2.44932: UDP, length 112
03:18:37.894190 IP node2.46463 > node2.44932: UDP, length 113
03:18:37.894229 IP node2.59355 > node2.44932: UDP, length 113
03:18:37.894414 IP node2.50082 > node2.44932: UDP, length 113
03:18:37.894640 IP node2.59588 > node2.44932: UDP, length 113
03:18:37.896084 IP node2.55804 > node2.44932: UDP, length 113
03:18:37.896276 IP node2.40178 > node2.44932: UDP, length 113
03:18:37.896496 IP node2.60148 > node2.44932: UDP, length 113
03:18:37.896803 IP node2.33710 > node2.44932: UDP, length 112
03:18:38.121801 IP node2.55804 > node2.50082: UDP, length 113
03:18:38.122038 IP node2.38346 > node2.50082: UDP, length 113
03:18:38.123127 IP node2.51687 > node2.50082: UDP, length 113
03:18:38.123351 IP node2.41342 > node2.50082: UDP, length 113
03:18:38.123538 IP node2.54999 > node2.50082: UDP, length 113
03:18:38.123800 IP node2.39546 > node2.50082: UDP, length 113
03:18:38.123858 IP node2.55028 > node2.50082: UDP, length 112
03:18:38.124515 IP node2.33710 > node2.50082: UDP, length 112
03:18:38.125556 IP node2.60148 > node2.50082: UDP, length 113
03:18:38.125755 IP node2.46463 > node2.50082: UDP, length 113
03:18:38.126503 IP node2.35704 > node2.50082: UDP, length 113
03:18:38.127170 IP node2.57500 > node2.50082: UDP, length 112
03:18:38.127246 IP node2.44932 > node2.50082: UDP, length 112
03:18:38.128073 IP node2.42922 > node2.50082: UDP, length 113
03:18:38.129114 IP node2.59588 > node2.50082: UDP, length 113
03:18:38.129302 IP node2.51828 > node2.50082: UDP, length 113
03:18:38.130229 IP node2.43123 > node2.50082: UDP, length 113
03:18:38.130366 IP node2.38998 > node2.50082: UDP, length 113
03:18:38.131642 IP node2.45280 > node2.50082: UDP, length 113
03:18:38.132071 IP node2.44241 > node2.50082: UDP, length 113
03:18:38.132404 IP node2.57596 > node2.50082: UDP, length 113
03:18:38.132860 IP node2.40178 > node2.50082: UDP, length 113
03:18:38.132981 IP node2.59355 > node2.50082: UDP, length 113
03:18:38.133358 IP node2.40763 > node2.50082: UDP, length 113
03:18:38.406477 IP node2.55804 > node2.38346: UDP, length 113
03:18:38.406481 IP node2.43123 > node2.38346: UDP, length 113
03:18:38.407187 IP node2.50082 > node2.38346: UDP, length 113
03:18:38.407790 IP node2.46463 > node2.38346: UDP, length 113
03:18:38.407934 IP node2.59355 > node2.38346: UDP, length 113
03:18:38.408011 IP node2.45280 > node2.38346: UDP, length 113
03:18:38.408357 IP node2.33710 > node2.38346: UDP, length 112
03:18:38.409746 IP node2.41342 > node2.38346: UDP, length 113
03:18:38.413742 IP node2.60148 > node2.38346: UDP, length 113
03:18:38.414592 IP node2.44932 > node2.38346: UDP, length 112
03:18:38.415186 IP node2.55028 > node2.38346: UDP, length 112
03:18:38.416028 IP node2.35704 > node2.38346: UDP, length 113
03:18:38.416090 IP node2.57500 > node2.38346: UDP, length 112
03:18:38.416797 IP node2.51828 > node2.38346: UDP, length 113
03:18:38.417397 IP node2.44241 > node2.38346: UDP, length 113
03:18:38.417759 IP node2.59588 > node2.38346: UDP, length 113
03:18:38.418495 IP node2.57596 > node2.38346: UDP, length 113
03:18:38.418625 IP node2.54999 > node2.38346: UDP, length 113
03:18:38.418788 IP node2.40178 > node2.38346: UDP, length 113
03:18:38.419509 IP node2.42922 > node2.38346: UDP, length 113
03:18:38.419630 IP node2.51687 > node2.38346: UDP, length 113
03:18:38.420399 IP node2.40763 > node2.38346: UDP, length 113
03:18:38.420506 IP node2.39546 > node2.38346: UDP, length 113
03:18:38.421755 IP node2.38998 > node2.38346: UDP, length 113
03:18:38.553298 IP node2.59355 > node2.43123: UDP, length 113
03:18:38.553921 IP node2.46463 > node2.43123: UDP, length 113
03:18:38.554131 IP node2.40763 > node2.43123: UDP, length 113
03:18:38.554368 IP node2.41342 > node2.43123: UDP, length 113
03:18:38.554691 IP node2.33710 > node2.43123: UDP, length 112
03:18:38.554835 IP node2.55028 > node2.43123: UDP, length 112
03:18:38.554872 IP node2.40178 > node2.43123: UDP, length 113
03:18:38.554925 IP node2.59588 > node2.43123: UDP, length 113
03:18:38.555090 IP node2.55804 > node2.43123: UDP, length 113
03:18:38.555255 IP node2.54999 > node2.43123: UDP, length 113
03:18:38.556025 IP node2.38346 > node2.43123: UDP, length 113
03:18:38.556850 IP node2.38998 > node2.43123: UDP, length 113
03:18:38.557158 IP node2.57500 > node2.43123: UDP, length 112
03:18:38.557178 IP node2.42922 > node2.43123: UDP, length 113
03:18:38.557791 IP node2.44241 > node2.43123: UDP, length 113
03:18:38.558468 IP node2.44932 > node2.43123: UDP, length 112
03:18:38.558769 IP node2.51687 > node2.43123: UDP, length 113
03:18:38.558993 IP node2.60148 > node2.43123: UDP, length 113
03:18:38.559268 IP node2.57596 > node2.43123: UDP, length 113
03:18:38.559406 IP node2.51828 > node2.43123: UDP, length 113
03:18:38.559810 IP node2.50082 > node2.43123: UDP, length 113
03:18:38.560398 IP node2.39546 > node2.43123: UDP, length 113
03:18:38.560838 IP node2.45280 > node2.43123: UDP, length 113
03:18:38.560965 IP node2.35704 > node2.43123: UDP, length 113
03:18:38.599286 IP node2.38346 > node2.38998: UDP, length 113
03:18:38.600432 IP node2.50082 > node2.38998: UDP, length 113
03:18:38.600549 IP node2.55804 > node2.38998: UDP, length 113
03:18:38.600583 IP node2.41342 > node2.38998: UDP, length 113
03:18:38.601103 IP node2.46463 > node2.38998: UDP, length 113
03:18:38.601467 IP node2.54999 > node2.38998: UDP, length 113
03:18:38.601844 IP node2.57500 > node2.38998: UDP, length 112
03:18:38.603442 IP node2.51687 > node2.38998: UDP, length 113
03:18:38.603579 IP node2.59355 > node2.38998: UDP, length 113
03:18:38.603720 IP node2.39546 > node2.38998: UDP, length 113
03:18:38.603863 IP node2.40763 > node2.38998: UDP, length 113
03:18:38.604118 IP node2.43123 > node2.38998: UDP, length 113
03:18:38.604503 IP node2.44932 > node2.38998: UDP, length 112
03:18:38.604780 IP node2.51828 > node2.38998: UDP, length 113
03:18:38.605327 IP node2.33710 > node2.38998: UDP, length 112
03:18:38.605729 IP node2.44241 > node2.38998: UDP, length 113
03:18:38.605822 IP node2.40178 > node2.38998: UDP, length 113
03:18:38.606373 IP node2.45280 > node2.38998: UDP, length 113
03:18:38.608386 IP node2.55028 > node2.38998: UDP, length 112
03:18:38.613689 IP node2.35704 > node2.38998: UDP, length 113
03:18:38.614022 IP node2.60148 > node2.38998: UDP, length 113
03:18:38.614413 IP node2.57596 > node2.38998: UDP, length 113
03:18:38.615909 IP node2.42922 > node2.38998: UDP, length 113
03:18:38.616588 IP node2.59588 > node2.38998: UDP, length 113
03:18:38.677022 IP node2.55028 > node2.41342: UDP, length 112
03:18:38.677421 IP node2.40763 > node2.41342: UDP, length 113
03:18:38.677820 IP node2.40178 > node2.41342: UDP, length 113
03:18:38.678187 IP node2.38346 > node2.41342: UDP, length 113
03:18:38.678334 IP node2.50082 > node2.41342: UDP, length 113
03:18:38.678921 IP node2.55804 > node2.41342: UDP, length 113
03:18:38.679202 IP node2.33710 > node2.41342: UDP, length 112
03:18:38.679208 IP node2.46463 > node2.41342: UDP, length 113
03:18:38.679450 IP node2.59588 > node2.41342: UDP, length 113
03:18:38.679829 IP node2.57500 > node2.41342: UDP, length 112
03:18:38.680064 IP node2.44932 > node2.41342: UDP, length 112
03:18:38.680574 IP node2.51828 > node2.41342: UDP, length 113
03:18:38.680637 IP node2.59355 > node2.41342: UDP, length 113
03:18:38.681100 IP node2.51687 > node2.41342: UDP, length 113
03:18:38.681512 IP node2.35704 > node2.41342: UDP, length 113
03:18:38.681735 IP node2.60148 > node2.41342: UDP, length 113
03:18:38.681854 IP node2.43123 > node2.41342: UDP, length 113
03:18:38.681865 IP node2.42922 > node2.41342: UDP, length 113
03:18:38.682003 IP node2.54999 > node2.41342: UDP, length 113
03:18:38.682093 IP node2.39546 > node2.41342: UDP, length 113
03:18:38.682308 IP node2.44241 > node2.41342: UDP, length 113
03:18:38.683328 IP node2.45280 > node2.41342: UDP, length 113
03:18:38.684198 IP node2.38998 > node2.41342: UDP, length 113
03:18:38.684941 IP node2.57596 > node2.41342: UDP, length 113
03:18:38.731104 IP node2.40763 > node2.45280: UDP, length 113
03:18:38.731104 IP node2.55028 > node2.45280: UDP, length 112
03:18:38.731890 IP node2.46463 > node2.45280: UDP, length 113
03:18:38.732051 IP node2.38346 > node2.45280: UDP, length 113
03:18:38.732579 IP node2.50082 > node2.45280: UDP, length 113
03:18:38.732928 IP node2.59588 > node2.45280: UDP, length 113
03:18:38.733176 IP node2.44932 > node2.45280: UDP, length 112
03:18:38.733414 IP node2.51828 > node2.45280: UDP, length 113
03:18:38.733528 IP node2.41342 > node2.45280: UDP, length 113
03:18:38.733637 IP node2.60148 > node2.45280: UDP, length 113
03:18:38.733724 IP node2.42922 > node2.45280: UDP, length 113
03:18:38.733782 IP node2.59355 > node2.45280: UDP, length 113
03:18:38.734132 IP node2.38998 > node2.45280: UDP, length 113
03:18:38.734617 IP node2.51687 > node2.45280: UDP, length 113
03:18:38.735241 IP node2.57596 > node2.45280: UDP, length 113
03:18:38.735779 IP node2.55804 > node2.45280: UDP, length 113
03:18:38.736064 IP node2.33710 > node2.45280: UDP, length 112
03:18:38.736939 IP node2.57500 > node2.45280: UDP, length 112
03:18:38.737791 IP node2.43123 > node2.45280: UDP, length 113
03:18:38.737794 IP node2.54999 > node2.45280: UDP, length 113
03:18:38.739180 IP node2.39546 > node2.45280: UDP, length 113
03:18:38.740715 IP node2.35704 > node2.45280: UDP, length 113
03:18:38.742609 IP node2.40178 > node2.45280: UDP, length 113
03:18:38.743607 IP node2.44241 > node2.45280: UDP, length 113
03:18:38.799024 IP node2.55028 > node2.57596: UDP, length 112
03:18:38.799316 IP node2.42922 > node2.57596: UDP, length 113
03:18:38.799373 IP node2.57500 > node2.57596: UDP, length 112
03:18:38.800106 IP node2.35704 > node2.57596: UDP, length 113
03:18:38.800242 IP node2.38998 > node2.57596: UDP, length 113
03:18:38.800571 IP node2.51828 > node2.57596: UDP, length 113
03:18:38.800734 IP node2.50082 > node2.57596: UDP, length 113
03:18:38.800764 IP node2.40763 > node2.57596: UDP, length 113
03:18:38.800809 IP node2.46463 > node2.57596: UDP, length 113
03:18:38.800934 IP node2.54999 > node2.57596: UDP, length 113
03:18:38.800940 IP node2.44932 > node2.57596: UDP, length 112
03:18:38.801127 IP node2.59588 > node2.57596: UDP, length 113
03:18:38.801239 IP node2.60148 > node2.57596: UDP, length 113
03:18:38.801259 IP node2.38346 > node2.57596: UDP, length 113
03:18:38.802591 IP node2.59355 > node2.57596: UDP, length 113
03:18:38.803711 IP node2.41342 > node2.57596: UDP, length 113
03:18:38.803879 IP node2.51687 > node2.57596: UDP, length 113
03:18:38.804535 IP node2.43123 > node2.57596: UDP, length 113
03:18:38.804902 IP node2.55804 > node2.57596: UDP, length 113
03:18:38.804991 IP node2.33710 > node2.57596: UDP, length 112
03:18:38.805823 IP node2.45280 > node2.57596: UDP, length 113
03:18:38.806027 IP node2.40178 > node2.57596: UDP, length 113
03:18:38.806156 IP node2.44241 > node2.57596: UDP, length 113
03:18:38.807083 IP node2.39546 > node2.57596: UDP, length 113
03:18:38.887847 IP node2.55028 > node2.51828: UDP, length 112
03:18:38.888035 IP node2.57596 > node2.51828: UDP, length 113
03:18:38.888530 IP node2.38346 > node2.51828: UDP, length 113
03:18:38.888850 IP node2.35704 > node2.51828: UDP, length 113
03:18:38.889001 IP node2.41342 > node2.51828: UDP, length 113
03:18:38.889717 IP node2.46463 > node2.51828: UDP, length 113
03:18:38.889752 IP node2.60148 > node2.51828: UDP, length 113
03:18:38.890325 IP node2.43123 > node2.51828: UDP, length 113
03:18:38.890696 IP node2.44932 > node2.51828: UDP, length 112
03:18:38.890840 IP node2.55804 > node2.51828: UDP, length 113
03:18:38.890956 IP node2.54999 > node2.51828: UDP, length 113
03:18:38.891143 IP node2.57500 > node2.51828: UDP, length 112
03:18:38.891367 IP node2.33710 > node2.51828: UDP, length 112
03:18:38.891501 IP node2.50082 > node2.51828: UDP, length 113
03:18:38.891679 IP node2.38998 > node2.51828: UDP, length 113
03:18:38.891702 IP node2.59588 > node2.51828: UDP, length 113
03:18:38.892870 IP node2.40763 > node2.51828: UDP, length 113
03:18:38.892926 IP node2.42922 > node2.51828: UDP, length 113
03:18:38.893196 IP node2.51687 > node2.51828: UDP, length 113
03:18:38.893718 IP node2.39546 > node2.51828: UDP, length 113
03:18:38.893727 IP node2.45280 > node2.51828: UDP, length 113
03:18:38.893855 IP node2.44241 > node2.51828: UDP, length 113
03:18:38.896789 IP node2.40178 > node2.51828: UDP, length 113
03:18:38.904041 IP node2.59355 > node2.51828: UDP, length 113
03:18:39.074987 IP node2.41342 > node2.59355: UDP, length 113
03:18:39.075142 IP node2.35704 > node2.59355: UDP, length 113
03:18:39.075313 IP node2.57596 > node2.59355: UDP, length 113
03:18:39.075909 IP node2.59588 > node2.59355: UDP, length 113
03:18:39.076139 IP node2.44241 > node2.59355: UDP, length 113
03:18:39.076264 IP node2.38998 > node2.59355: UDP, length 113
03:18:39.076534 IP node2.50082 > node2.59355: UDP, length 113
03:18:39.076697 IP node2.33710 > node2.59355: UDP, length 112
03:18:39.076822 IP node2.40178 > node2.59355: UDP, length 113
03:18:39.077345 IP node2.46463 > node2.59355: UDP, length 113
03:18:39.077947 IP node2.44932 > node2.59355: UDP, length 112
03:18:39.077973 IP node2.54999 > node2.59355: UDP, length 113
03:18:39.079315 IP node2.51687 > node2.59355: UDP, length 113
03:18:39.079391 IP node2.55028 > node2.59355: UDP, length 112
03:18:39.080412 IP node2.51828 > node2.59355: UDP, length 113
03:18:39.080535 IP node2.38346 > node2.59355: UDP, length 113
03:18:39.080881 IP node2.55804 > node2.59355: UDP, length 113
03:18:39.081175 IP node2.42922 > node2.59355: UDP, length 113
03:18:39.081473 IP node2.40763 > node2.59355: UDP, length 113
03:18:39.081484 IP node2.57500 > node2.59355: UDP, length 112
03:18:39.081709 IP node2.60148 > node2.59355: UDP, length 113
03:18:39.081760 IP node2.45280 > node2.59355: UDP, length 113
03:18:39.082092 IP node2.39546 > node2.59355: UDP, length 113
03:18:39.083733 IP node2.43123 > node2.59355: UDP, length 113
03:18:39.128298 IP node2.41342 > node2.55804: UDP, length 113
03:18:39.128326 IP node2.38998 > node2.55804: UDP, length 113
03:18:39.128694 IP node2.40178 > node2.55804: UDP, length 113
03:18:39.129658 IP node2.39546 > node2.55804: UDP, length 113
03:18:39.129806 IP node2.38346 > node2.55804: UDP, length 113
03:18:39.130174 IP node2.45280 > node2.55804: UDP, length 113
