03:18:42.475835 IP node1.38885 > node1.34107: UDP, length 113
03:18:42.725234 IP node1.34107 > node1.38885: UDP, length 112
03:18:43.679386 IP node1.38885 > node1.42688: UDP, length 113
03:18:43.686516 IP node1.34107 > node1.42688: UDP, length 112
03:18:44.000650 IP node1.34107 > node1.39490: UDP, length 112
03:18:44.001067 IP node1.38885 > node1.39490: UDP, length 113
03:18:44.003871 IP node1.42688 > node1.39490: UDP, length 113
03:18:44.178833 IP node1.39490 > node1.42688: UDP, length 112
03:18:44.286742 IP node1.38885 > node1.58351: UDP, length 113
03:18:44.286972 IP node1.34107 > node1.58351: UDP, length 112
03:18:44.297317 IP node1.39490 > node1.58351: UDP, length 112
03:18:44.303109 IP node1.42688 > node1.58351: UDP, length 113
03:18:44.562645 IP node1.58351 > node1.39490: UDP, length 112
03:18:44.806260 IP node1.42688 > node1.52277: UDP, length 113
03:18:44.809177 IP node1.38885 > node1.52277: UDP, length 113
03:18:44.819484 IP node1.34107 > node1.52277: UDP, length 112
03:18:44.840822 IP node1.39490 > node1.52277: UDP, length 112
03:18:44.917099 IP node1.39490 > node1.57918: UDP, length 112
03:18:44.919967 IP node1.38885 > node1.57918: UDP, length 113
03:18:44.923303 IP node1.42688 > node1.57918: UDP, length 113
03:18:44.923639 IP node1.34107 > node1.57918: UDP, length 112
03:18:44.936904 IP node1.57918 > node1.58351: UDP, length 113
03:18:44.942388 IP node1.57918 > node1.52277: UDP, length 113
03:18:45.062374 IP node1.52277 > node1.39490: UDP, length 113
03:18:45.074867 IP node1.58351 > node1.52277: UDP, length 112
03:18:45.075473 IP node1.58351 > node1.57918: UDP, length 112
03:18:45.094165 IP node1.38885 > node1.42550: UDP, length 113
03:18:45.094352 IP node1.42688 > node1.42550: UDP, length 113
03:18:45.094841 IP node1.34107 > node1.42550: UDP, length 112
03:18:45.103672 IP node1.52277 > node1.57918: UDP, length 113
03:18:45.104133 IP node1.52277 > node1.58351: UDP, length 113
03:18:45.108497 IP node1.52277 > node1.42550: UDP, length 113
03:18:45.133895 IP node1.39490 > node1.42550: UDP, length 112
03:18:45.145118 IP node1.58351 > node1.42550: UDP, length 112
03:18:45.177359 IP node1.57918 > node1.42550: UDP, length 113
03:18:45.270466 IP node1.42550 > node1.52277: UDP, length 113
03:18:45.272542 IP node1.42550 > node1.57918: UDP, length 113
03:18:45.434318 IP node1.58351 > node1.34101: UDP, length 112
03:18:45.435042 IP node1.38885 > node1.34101: UDP, length 113
03:18:45.435648 IP node1.39490 > node1.34101: UDP, length 112
03:18:45.437576 IP node1.52277 > node1.34101: UDP, length 113
03:18:45.438076 IP node1.57918 > node1.34101: UDP, length 113
03:18:45.440399 IP node1.42550 > node1.34101: UDP, length 113
03:18:45.441768 IP node1.42688 > node1.34101: UDP, length 113
03:18:45.442376 IP node1.34107 > node1.34101: UDP, length 112
03:18:45.491455 IP node1.42550 > node1.35968: UDP, length 113
03:18:45.496547 IP node1.38885 > node1.35968: UDP, length 113
03:18:45.502670 IP node1.57918 > node1.35968: UDP, length 113
03:18:45.503046 IP node1.52277 > node1.35968: UDP, length 113
03:18:45.505442 IP node1.58351 > node1.35968: UDP, length 112
03:18:45.510009 IP node1.34107 > node1.35968: UDP, length 112
03:18:45.510845 IP node1.42688 > node1.35968: UDP, length 113
03:18:45.512820 IP node1.39490 > node1.35968: UDP, length 112
03:18:45.553359 IP node1.52277 > node1.56164: UDP, length 113
03:18:45.553886 IP node1.42550 > node1.56164: UDP, length 113
03:18:45.554701 IP node1.38885 > node1.56164: UDP, length 113
03:18:45.556439 IP node1.39490 > node1.56164: UDP, length 112
03:18:45.559405 IP node1.57918 > node1.56164: UDP, length 113
03:18:45.560380 IP node1.42688 > node1.56164: UDP, length 113
03:18:45.560634 IP node1.34107 > node1.56164: UDP, length 112
03:18:45.561316 IP node1.58351 > node1.56164: UDP, length 112
03:18:45.600977 IP node1.35968 > node1.42550: UDP, length 113
03:18:45.602775 IP node1.35968 > node1.57918: UDP, length 113
03:18:45.647851 IP node1.35968 > node1.34101: UDP, length 113
03:18:45.750895 IP node1.56164 > node1.42550: UDP, length 113
03:18:45.775896 IP node1.38885 > node1.59529: UDP, length 113
03:18:45.778595 IP node1.58351 > node1.59529: UDP, length 112
03:18:45.785402 IP node1.42688 > node1.59529: UDP, length 113
03:18:45.785747 IP node1.57918 > node1.59529: UDP, length 113
03:18:45.786252 IP node1.52277 > node1.59529: UDP, length 113
03:18:45.788603 IP node1.34107 > node1.59529: UDP, length 112
03:18:45.794270 IP node1.39490 > node1.59529: UDP, length 112
03:18:45.805290 IP node1.34101 > node1.52277: UDP, length 113
03:18:45.806865 IP node1.56164 > node1.34101: UDP, length 113
03:18:45.808089 IP node1.56164 > node1.35968: UDP, length 113
03:18:45.814116 IP node1.42550 > node1.59529: UDP, length 113
03:18:45.830088 IP node1.34101 > node1.57918: UDP, length 113
03:18:45.832939 IP node1.42688 > node1.38885: UDP, length 113
03:18:45.833023 IP node1.39490 > node1.38885: UDP, length 112
03:18:45.842583 IP node1.58351 > node1.38885: UDP, length 112
03:18:45.846283 IP node1.35968 > node1.56164: UDP, length 113
03:18:45.851080 IP node1.35968 > node1.59529: UDP, length 113
03:18:45.851715 IP node1.34101 > node1.42550: UDP, length 113
03:18:45.852823 IP node1.35968 > node1.38885: UDP, length 113
03:18:45.853976 IP node1.34101 > node1.35968: UDP, length 113
03:18:45.857510 IP node1.42550 > node1.38885: UDP, length 113
03:18:45.858290 IP node1.34101 > node1.38885: UDP, length 113
03:18:45.858419 IP node1.34101 > node1.59529: UDP, length 113
03:18:45.858603 IP node1.34101 > node1.56164: UDP, length 113
03:18:45.866961 IP node1.34107 > node1.38885: UDP, length 112
03:18:45.875482 IP node1.52277 > node1.38885: UDP, length 113
03:18:45.921939 IP node1.56164 > node1.59529: UDP, length 113
03:18:45.924521 IP node1.56164 > node1.38885: UDP, length 113
03:18:45.946808 IP node1.56164 > node1.34107: UDP, length 113
03:18:45.953760 IP node1.34101 > node1.34107: UDP, length 113
03:18:45.960058 IP node1.38885 > node1.34107: UDP, length 113
03:18:45.960658 IP node1.42688 > node1.34107: UDP, length 113
03:18:45.967280 IP node1.35968 > node1.34107: UDP, length 113
03:18:45.968005 IP node1.39490 > node1.34107: UDP, length 112
03:18:45.972437 IP node1.58351 > node1.34107: UDP, length 112
03:18:45.973446 IP node1.57918 > node1.38885: UDP, length 113
03:18:45.973718 IP node1.57918 > node1.34107: UDP, length 113
03:18:45.988634 IP node1.52277 > node1.34107: UDP, length 113
03:18:46.123238 IP node1.42550 > node1.34107: UDP, length 113
03:18:46.142341 IP node1.56164 > node1.52695: UDP, length 113
03:18:46.144185 IP node1.38885 > node1.52695: UDP, length 113
03:18:46.146285 IP node1.42688 > node1.52695: UDP, length 113
03:18:46.146336 IP node1.59529 > node1.42550: UDP, length 112
03:18:46.148953 IP node1.52695 > node1.35968: UDP, length 113
03:18:46.149846 IP node1.59529 > node1.34101: UDP, length 112
03:18:46.150008 IP node1.52695 > node1.56164: UDP, length 113
03:18:46.151812 IP node1.34107 > node1.52695: UDP, length 112
03:18:46.156010 IP node1.34101 > node1.52695: UDP, length 113
03:18:46.156261 IP node1.39490 > node1.52695: UDP, length 112
03:18:46.170085 IP node1.52695 > node1.34101: UDP, length 113
03:18:46.170239 IP node1.52695 > node1.42550: UDP, length 113
03:18:46.170242 IP node1.35968 > node1.52695: UDP, length 113
03:18:46.171238 IP node1.58351 > node1.52695: UDP, length 112
03:18:46.174542 IP node1.34101 > node1.56606: UDP, length 113
03:18:46.175499 IP node1.38885 > node1.56606: UDP, length 113
03:18:46.176983 IP node1.57918 > node1.56606: UDP, length 113
03:18:46.178481 IP node1.56164 > node1.56606: UDP, length 113
03:18:46.180080 IP node1.39490 > node1.56606: UDP, length 112
03:18:46.181052 IP node1.34107 > node1.56606: UDP, length 112
03:18:46.183061 IP node1.42688 > node1.56606: UDP, length 113
03:18:46.185620 IP node1.58351 > node1.56606: UDP, length 112
03:18:46.215453 IP node1.56164 > node1.33032: UDP, length 113
03:18:46.217072 IP node1.34101 > node1.33032: UDP, length 113
03:18:46.217123 IP node1.33032 > node1.56164: UDP, length 113
03:18:46.217624 IP node1.33032 > node1.34101: UDP, length 113
03:18:46.222044 IP node1.34107 > node1.33032: UDP, length 112
03:18:46.224105 IP node1.39490 > node1.33032: UDP, length 112
03:18:46.226342 IP node1.59529 > node1.35968: UDP, length 112
03:18:46.229677 IP node1.35968 > node1.56606: UDP, length 113
03:18:46.229896 IP node1.59529 > node1.56164: UDP, length 112
03:18:46.230152 IP node1.35968 > node1.33032: UDP, length 113
03:18:46.242330 IP node1.38885 > node1.33032: UDP, length 113
03:18:46.246410 IP node1.59529 > node1.38885: UDP, length 112
03:18:46.247257 IP node1.42688 > node1.33032: UDP, length 113
03:18:46.247451 IP node1.59529 > node1.34107: UDP, length 112
03:18:46.254306 IP node1.59529 > node1.52695: UDP, length 112
03:18:46.258065 IP node1.52277 > node1.56606: UDP, length 113
03:18:46.258375 IP node1.52277 > node1.52695: UDP, length 113
03:18:46.259125 IP node1.52277 > node1.33032: UDP, length 113
03:18:46.264121 IP node1.56606 > node1.34101: UDP, length 113
03:18:46.264460 IP node1.56606 > node1.35968: UDP, length 113
03:18:46.265671 IP node1.42550 > node1.56606: UDP, length 113
03:18:46.265931 IP node1.56606 > node1.56164: UDP, length 113
03:18:46.266130 IP node1.42550 > node1.52695: UDP, length 113
03:18:46.266232 IP node1.42550 > node1.33032: UDP, length 113
03:18:46.268029 IP node1.33032 > node1.59529: UDP, length 113
03:18:46.270035 IP node1.58351 > node1.33032: UDP, length 112
03:18:46.271632 IP node1.33032 > node1.38885: UDP, length 113
03:18:46.287128 IP node1.59529 > node1.56606: UDP, length 112
03:18:46.305597 IP node1.52695 > node1.38885: UDP, length 113
03:18:46.306084 IP node1.52695 > node1.59529: UDP, length 113
03:18:46.310207 IP node1.59529 > node1.33032: UDP, length 112
03:18:46.316463 IP node1.57918 > node1.52695: UDP, length 113
03:18:46.322585 IP node1.57918 > node1.33032: UDP, length 113
03:18:46.323210 IP node1.33032 > node1.35968: UDP, length 113
03:18:46.327238 IP node1.52695 > node1.34107: UDP, length 113
03:18:46.328227 IP node1.52695 > node1.56606: UDP, length 113
03:18:46.329075 IP node1.52695 > node1.33032: UDP, length 113
03:18:46.338188 IP node1.33032 > node1.34107: UDP, length 113
03:18:46.384828 IP node1.33032 > node1.52695: UDP, length 113
03:18:46.386115 IP node1.33032 > node1.56606: UDP, length 113
03:18:46.409463 IP node1.56606 > node1.59529: UDP, length 113
03:18:46.410025 IP node1.56606 > node1.38885: UDP, length 113
03:18:46.412929 IP node1.56606 > node1.34107: UDP, length 113
03:18:46.414668 IP node1.56606 > node1.52695: UDP, length 113
03:18:46.418720 IP node1.56606 > node1.33032: UDP, length 113
03:18:46.748500 IP node1.52695 > node1.34879: UDP, length 113
03:18:46.749787 IP node1.35968 > node1.34879: UDP, length 113
03:18:46.750083 IP node1.34101 > node1.34879: UDP, length 113
03:18:46.750254 IP node1.38885 > node1.34879: UDP, length 113
03:18:46.755622 IP node1.39490 > node1.34879: UDP, length 112
03:18:46.759757 IP node1.57918 > node1.34879: UDP, length 113
03:18:46.760114 IP node1.52277 > node1.34879: UDP, length 113
03:18:46.760764 IP node1.42550 > node1.34879: UDP, length 113
03:18:46.760766 IP node1.34107 > node1.34879: UDP, length 112
03:18:46.762180 IP node1.59529 > node1.34879: UDP, length 112
03:18:46.763152 IP node1.42688 > node1.34879: UDP, length 113
03:18:46.763478 IP node1.58351 > node1.34879: UDP, length 112
03:18:46.768674 IP node1.56606 > node1.34879: UDP, length 113
03:18:46.769060 IP node1.56164 > node1.34879: UDP, length 113
03:18:46.770915 IP node1.33032 > node1.34879: UDP, length 113
03:18:46.988808 IP node1.35968 > node1.34306: UDP, length 113
03:18:46.989044 IP node1.52695 > node1.34306: UDP, length 113
03:18:46.989281 IP node1.57918 > node1.34306: UDP, length 113
03:18:46.989373 IP node1.38885 > node1.34306: UDP, length 113
03:18:46.990977 IP node1.39490 > node1.34306: UDP, length 112
03:18:46.991878 IP node1.58351 > node1.34306: UDP, length 112
03:18:46.995612 IP node1.42550 > node1.34306: UDP, length 113
03:18:47.000624 IP node1.52277 > node1.34306: UDP, length 113
03:18:47.004087 IP node1.56164 > node1.34306: UDP, length 113
03:18:47.010617 IP node1.34107 > node1.34306: UDP, length 112
03:18:47.013163 IP node1.56606 > node1.34306: UDP, length 113
03:18:47.022381 IP node1.49395 > node1.33032: UDP, length 113
03:18:47.022605 IP node1.49395 > node1.34879: UDP, length 113
03:18:47.022628 IP node1.35968 > node1.49395: UDP, length 113
03:18:47.022774 IP node1.49395 > node1.34306: UDP, length 113
03:18:47.023442 IP node1.38885 > node1.49395: UDP, length 113
03:18:47.028753 IP node1.52695 > node1.49395: UDP, length 113
03:18:47.031605 IP node1.59529 > node1.34306: UDP, length 112
03:18:47.032529 IP node1.59529 > node1.49395: UDP, length 112
03:18:47.033774 IP node1.39490 > node1.49395: UDP, length 112
03:18:47.035220 IP node1.57918 > node1.49395: UDP, length 113
03:18:47.036378 IP node1.56606 > node1.49395: UDP, length 113
03:18:47.038654 IP node1.42550 > node1.49395: UDP, length 113
03:18:47.041719 IP node1.58351 > node1.49395: UDP, length 112
03:18:47.045433 IP node1.52277 > node1.49395: UDP, length 113
03:18:47.046585 IP node1.42688 > node1.34306: UDP, length 113
03:18:47.048029 IP node1.42688 > node1.49395: UDP, length 113
03:18:47.057027 IP node1.33032 > node1.49395: UDP, length 113
03:18:47.057178 IP node1.33032 > node1.34306: UDP, length 113
03:18:47.058154 IP node1.34107 > node1.49395: UDP, length 112
03:18:47.059071 IP node1.56164 > node1.49395: UDP, length 113
03:18:47.061327 IP node1.34101 > node1.34306: UDP, length 113
03:18:47.062966 IP node1.34101 > node1.49395: UDP, length 113
03:18:47.118582 IP node1.34879 > node1.52695: UDP, length 112
03:18:47.119860 IP node1.34879 > node1.56606: UDP, length 112
03:18:47.121392 IP node1.34879 > node1.33032: UDP, length 112
03:18:47.168078 IP node1.34879 > node1.34306: UDP, length 112
03:18:47.169142 IP node1.34879 > node1.49395: UDP, length 112
03:18:47.182168 IP node1.34306 > node1.34879: UDP, length 113
03:18:47.183337 IP node1.34306 > node1.49395: UDP, length 113
03:18:47.349022 IP node1.35968 > node1.44614: UDP, length 113
03:18:47.350849 IP node1.33032 > node1.44614: UDP, length 113
03:18:47.352325 IP node1.52277 > node1.44614: UDP, length 113
03:18:47.352377 IP node1.34101 > node1.44614: UDP, length 113
03:18:47.352966 IP node1.57918 > node1.44614: UDP, length 113
03:18:47.356376 IP node1.58351 > node1.44614: UDP, length 112
03:18:47.356839 IP node1.34306 > node1.44614: UDP, length 113
03:18:47.361075 IP node1.39490 > node1.44614: UDP, length 112
03:18:47.361368 IP node1.34879 > node1.44614: UDP, length 112
03:18:47.362033 IP node1.42550 > node1.44614: UDP, length 113
03:18:47.362032 IP node1.42688 > node1.44614: UDP, length 113
03:18:47.362078 IP node1.49395 > node1.44614: UDP, length 113
03:18:47.362720 IP node1.56164 > node1.44614: UDP, length 113
03:18:47.371857 IP node1.59529 > node1.44614: UDP, length 112
03:18:47.381242 IP node1.52695 > node1.44614: UDP, length 113
03:18:47.389070 IP node1.44614 > node1.34879: UDP, length 113
03:18:47.391023 IP node1.44614 > node1.34306: UDP, length 113
03:18:47.431346 IP node1.38885 > node1.44614: UDP, length 113
03:18:47.431607 IP node1.34107 > node1.44614: UDP, length 112
03:18:47.447452 IP node1.56606 > node1.44614: UDP, length 113
03:18:47.481784 IP node1.44614 > node1.49395: UDP, length 113
03:18:47.519822 IP node1.59529 > node1.59844: UDP, length 112
03:18:47.520477 IP node1.44614 > node1.59844: UDP, length 113
03:18:47.521988 IP node1.42550 > node1.59844: UDP, length 113
03:18:47.522016 IP node1.34101 > node1.59844: UDP, length 113
03:18:47.524515 IP node1.34879 > node1.59844: UDP, length 112
03:18:47.524528 IP node1.33032 > node1.59844: UDP, length 113
03:18:47.524662 IP node1.49395 > node1.59844: UDP, length 113
03:18:47.524692 IP node1.58351 > node1.59844: UDP, length 112
03:18:47.524974 IP node1.34306 > node1.59844: UDP, length 113
03:18:47.528412 IP node1.35968 > node1.59844: UDP, length 113
03:18:47.532932 IP node1.52277 > node1.59844: UDP, length 113
03:18:47.534344 IP node1.56606 > node1.59844: UDP, length 113
03:18:47.534899 IP node1.39490 > node1.59844: UDP, length 112
03:18:47.535322 IP node1.42688 > node1.59844: UDP, length 113
03:18:47.536122 IP node1.56164 > node1.59844: UDP, length 113
03:18:47.537594 IP node1.57918 > node1.59844: UDP, length 113
03:18:47.538107 IP node1.59844 > node1.49395: UDP, length 113
03:18:47.538204 IP node1.59844 > node1.34306: UDP, length 113
03:18:47.581732 IP node1.52695 > node1.59844: UDP, length 113
03:18:47.599650 IP node1.38885 > node1.59844: UDP, length 113
03:18:47.616965 IP node1.34107 > node1.59844: UDP, length 112
03:18:47.617302 IP node1.59844 > node1.44614: UDP, length 113
03:18:47.927345 IP node1.34879 > node1.55751: UDP, length 112
03:18:47.927564 IP node1.34306 > node1.55751: UDP, length 113
03:18:47.927705 IP node1.59529 > node1.55751: UDP, length 112
03:18:47.930212 IP node1.58351 > node1.55751: UDP, length 112
03:18:47.930386 IP node1.33032 > node1.55751: UDP, length 113
03:18:47.931623 IP node1.34101 > node1.55751: UDP, length 113
03:18:47.932821 IP node1.59844 > node1.55751: UDP, length 113
03:18:47.934079 IP node1.44614 > node1.55751: UDP, length 113
03:18:47.936993 IP node1.49395 > node1.55751: UDP, length 113
03:18:47.943803 IP node1.56164 > node1.55751: UDP, length 113
03:18:47.945407 IP node1.35968 > node1.55751: UDP, length 113
03:18:47.947111 IP node1.52277 > node1.55751: UDP, length 113
03:18:47.949768 IP node1.56606 > node1.55751: UDP, length 113
03:18:47.950131 IP node1.52695 > node1.55751: UDP, length 113
03:18:47.953512 IP node1.57918 > node1.55751: UDP, length 113
03:18:47.954427 IP node1.39490 > node1.55751: UDP, length 112
03:18:47.954698 IP node1.42688 > node1.55751: UDP, length 113
03:18:47.954902 IP node1.34107 > node1.55751: UDP, length 112
03:18:47.960817 IP node1.42550 > node1.55751: UDP, length 113
03:18:47.989376 IP node1.56606 > node1.49395: UDP, length 87
03:18:48.020512 IP node1.38885 > node1.55751: UDP, length 113
03:18:48.212334 IP node1.55751 > node1.59844: UDP, length 113
03:18:48.309475 IP node1.34879 > node1.45921: UDP, length 112
03:18:48.310680 IP node1.34306 > node1.45921: UDP, length 113
03:18:48.314842 IP node1.44614 > node1.45921: UDP, length 113
03:18:48.315111 IP node1.56164 > node1.45921: UDP, length 113
03:18:48.316059 IP node1.59844 > node1.45921: UDP, length 113
03:18:48.317663 IP node1.59529 > node1.45921: UDP, length 112
03:18:48.321311 IP node1.58351 > node1.45921: UDP, length 112
03:18:48.321848 IP node1.52277 > node1.45921: UDP, length 113
03:18:48.322956 IP node1.57918 > node1.45921: UDP, length 113
03:18:48.322961 IP node1.42550 > node1.45921: UDP, length 113
03:18:48.323777 IP node1.34101 > node1.45921: UDP, length 113
03:18:48.325385 IP node1.56606 > node1.45921: UDP, length 113
03:18:48.325909 IP node1.33032 > node1.45921: UDP, length 113
03:18:48.328700 IP node1.55751 > node1.45921: UDP, length 113
03:18:48.328979 IP node1.39490 > node1.45921: UDP, length 112
03:18:48.329264 IP node1.38885 > node1.45921: UDP, length 113
03:18:48.330100 IP node1.34107 > node1.45921: UDP, length 112
03:18:48.330391 IP node1.42688 > node1.45921: UDP, length 113
03:18:48.334597 IP node1.35968 > node1.45921: UDP, length 113
03:18:48.335891 IP node1.52695 > node1.45921: UDP, length 113
03:18:48.361928 IP node1.45921 > node1.55751: UDP, length 113
03:18:48.445683 IP node1.49395 > node1.45921: UDP, length 113
03:18:48.530318 IP node1.56606 > node1.49395: UDP, length 113
03:18:48.550354 IP node1.49395 > node1.56606: UDP, length 94
03:18:48.559773 IP node1.57492 > node1.55751: UDP, length 113
03:18:48.560002 IP node1.57492 > node1.45921: UDP, length 113
03:18:48.561575 IP node1.34879 > node1.57492: UDP, length 112
03:18:48.562549 IP node1.56164 > node1.57492: UDP, length 113
03:18:48.563649 IP node1.59844 > node1.57492: UDP, length 113
03:18:48.564065 IP node1.59529 > node1.57492: UDP, length 112
03:18:48.564511 IP node1.39490 > node1.57492: UDP, length 112
03:18:48.566786 IP node1.45921 > node1.57492: UDP, length 113
03:18:48.566963 IP node1.49395 > node1.57492: UDP, length 113
03:18:48.568178 IP node1.34107 > node1.57492: UDP, length 112
03:18:48.570436 IP node1.55751 > node1.57492: UDP, length 113
03:18:48.570702 IP node1.34306 > node1.57492: UDP, length 113
03:18:48.572573 IP node1.56606 > node1.57492: UDP, length 113
03:18:48.573068 IP node1.42688 > node1.57492: UDP, length 113
03:18:48.573185 IP node1.33032 > node1.57492: UDP, length 113
03:18:48.573634 IP node1.34101 > node1.57492: UDP, length 113
03:18:48.574214 IP node1.52695 > node1.57492: UDP, length 113
03:18:48.574548 IP node1.58351 > node1.57492: UDP, length 112
03:18:48.576373 IP node1.57918 > node1.57492: UDP, length 113
03:18:48.576893 IP node1.42550 > node1.57492: UDP, length 113
03:18:48.576931 IP node1.52277 > node1.57492: UDP, length 113
03:18:48.577909 IP node1.38885 > node1.57492: UDP, length 113
03:18:48.579306 IP node1.35968 > node1.57492: UDP, length 113
03:18:48.610679 IP node1.44614 > node1.57492: UDP, length 113
03:18:48.789932 IP node1.59844 > node1.45921: UDP, length 87
03:18:48.884763 IP node1.57492 > node1.57013: UDP, length 113
03:18:48.885121 IP node1.49395 > node1.57013: UDP, length 113
03:18:48.885571 IP node1.39490 > node1.57013: UDP, length 112
03:18:48.885946 IP node1.42688 > node1.57013: UDP, length 113
03:18:48.885980 IP node1.44614 > node1.57013: UDP, length 113
03:18:48.887834 IP node1.42550 > node1.57013: UDP, length 113
03:18:48.888664 IP node1.34879 > node1.57013: UDP, length 112
03:18:48.889004 IP node1.34107 > node1.57013: UDP, length 112
03:18:48.891235 IP node1.35968 > node1.57013: UDP, length 113
03:18:48.891301 IP node1.34101 > node1.57013: UDP, length 113
03:18:48.891839 IP node1.58351 > node1.57013: UDP, length 112
03:18:48.892259 IP node1.33032 > node1.57013: UDP, length 113
03:18:48.892521 IP node1.59844 > node1.57013: UDP, length 113
03:18:48.892751 IP node1.56606 > node1.57013: UDP, length 113
03:18:48.895005 IP node1.52277 > node1.57013: UDP, length 113
03:18:48.896089 IP node1.57918 > node1.57013: UDP, length 113
03:18:48.896238 IP node1.59529 > node1.57013: UDP, length 112
03:18:48.897014 IP node1.56164 > node1.57013: UDP, length 113
03:18:48.897616 IP node1.38885 > node1.57013: UDP, length 113
03:18:48.899997 IP node1.34306 > node1.57013: UDP, length 113
03:18:48.900798 IP node1.55751 > node1.57013: UDP, length 113
03:18:48.900995 IP node1.52695 > node1.57013: UDP, length 113
03:18:48.953208 IP node1.45921 > node1.57013: UDP, length 113
03:18:48.968842 IP node1.59844 > node1.45921: UDP, length 113
03:18:49.025999 IP node1.57013 > node1.57492: UDP, length 112
03:18:49.146193 IP node1.57013 > node1.33274: UDP, length 112
03:18:49.147633 IP node1.35968 > node1.33274: UDP, length 113
03:18:49.147936 IP node1.57918 > node1.33274: UDP, length 113
03:18:49.148665 IP node1.52277 > node1.33274: UDP, length 113
03:18:49.148900 IP node1.56164 > node1.33274: UDP, length 113
03:18:49.148947 IP node1.42688 > node1.33274: UDP, length 113
03:18:49.148987 IP node1.49395 > node1.33274: UDP, length 113
03:18:49.149200 IP node1.34107 > node1.33274: UDP, length 112
03:18:49.149217 IP node1.59844 > node1.33274: UDP, length 113
03:18:49.149255 IP node1.34879 > node1.33274: UDP, length 112
03:18:49.149342 IP node1.42550 > node1.33274: UDP, length 113
03:18:49.149449 IP node1.59529 > node1.33274: UDP, length 112
03:18:49.149811 IP node1.58351 > node1.33274: UDP, length 112
03:18:49.150015 IP node1.39490 > node1.33274: UDP, length 112
03:18:49.150137 IP node1.44614 > node1.33274: UDP, length 113
03:18:49.150504 IP node1.34101 > node1.33274: UDP, length 113
03:18:49.150794 IP node1.52695 > node1.33274: UDP, length 113
03:18:49.151180 IP node1.55751 > node1.33274: UDP, length 113
03:18:49.151756 IP node1.33032 > node1.33274: UDP, length 113
03:18:49.151888 IP node1.56606 > node1.33274: UDP, length 113
03:18:49.153804 IP node1.34306 > node1.33274: UDP, length 113
03:18:49.154597 IP node1.38885 > node1.33274: UDP, length 113
03:18:49.154857 IP node1.45921 > node1.33274: UDP, length 113
03:18:49.156223 IP node1.57492 > node1.33274: UDP, length 113
03:18:49.169547 IP node1.33274 > node1.57013: UDP, length 113
03:18:49.357528 IP node1.57492 > node1.57013: UDP, length 87
03:18:49.359237 IP node1.57013 > node1.57492: UDP, length 94
03:18:49.660484 IP node1.57013 > node1.33274: UDP, length 87
03:18:49.672944 IP node1.33274 > node1.57013: UDP, length 94
03:18:50.225086 IP node1.34107 > node1.34879: UDP, length 112
03:18:50.225770 IP node1.52695 > node1.34879: UDP, length 113
03:18:50.226334 IP node1.35968 > node1.34879: UDP, length 113
03:18:50.226553 IP node1.49395 > node1.34879: UDP, length 113
03:18:50.226630 IP node1.55751 > node1.34879: UDP, length 113
03:18:50.226840 IP node1.56606 > node1.34879: UDP, length 113
03:18:50.227412 IP node1.45921 > node1.34879: UDP, length 113
03:18:50.227439 IP node1.34101 > node1.34879: UDP, length 113
03:18:50.227764 IP node1.44614 > node1.34879: UDP, length 113
03:18:50.227800 IP node1.57492 > node1.34879: UDP, length 113
03:18:50.229835 IP node1.33032 > node1.34879: UDP, length 113
03:18:50.230802 IP node1.59529 > node1.34879: UDP, length 112
03:18:50.231226 IP node1.42688 > node1.34879: UDP, length 113
03:18:50.231861 IP node1.56164 > node1.34879: UDP, length 113
03:18:50.232297 IP node1.58351 > node1.34879: UDP, length 112
03:18:50.232876 IP node1.57013 > node1.34879: UDP, length 112
03:18:50.234476 IP node1.42550 > node1.34879: UDP, length 113
03:18:50.234618 IP node1.39490 > node1.34879: UDP, length 112
03:18:50.234880 IP node1.33274 > node1.34879: UDP, length 113
03:18:50.235639 IP node1.52277 > node1.34879: UDP, length 113
03:18:50.236037 IP node1.57918 > node1.34879: UDP, length 113
03:18:50.236252 IP node1.38885 > node1.34879: UDP, length 113
03:18:50.238198 IP node1.34306 > node1.34879: UDP, length 113
03:18:50.238998 IP node1.59844 > node1.34879: UDP, length 113
03:18:50.483737 IP node1.55751 > node1.34306: UDP, length 113
03:18:50.483897 IP node1.35968 > node1.34306: UDP, length 113
03:18:50.484050 IP node1.34107 > node1.34306: UDP, length 112
03:18:50.484471 IP node1.33032 > node1.34306: UDP, length 113
03:18:50.484476 IP node1.52695 > node1.34306: UDP, length 113
03:18:50.485085 IP node1.49395 > node1.34306: UDP, length 113
03:18:50.486278 IP node1.45921 > node1.34306: UDP, length 113
03:18:50.486411 IP node1.44614 > node1.34306: UDP, length 113
03:18:50.486435 IP node1.59844 > node1.34306: UDP, length 113
03:18:50.486514 IP node1.33274 > node1.34306: UDP, length 113
03:18:50.486544 IP node1.57013 > node1.34306: UDP, length 112
03:18:50.486618 IP node1.57492 > node1.34306: UDP, length 113
03:18:50.487683 IP node1.56606 > node1.34306: UDP, length 113
03:18:50.488464 IP node1.42550 > node1.34306: UDP, length 113
03:18:50.490124 IP node1.59529 > node1.34306: UDP, length 112
03:18:50.493141 IP node1.38885 > node1.34306: UDP, length 113
03:18:50.493294 IP node1.52277 > node1.34306: UDP, length 113
03:18:50.493449 IP node1.57918 > node1.34306: UDP, length 113
03:18:50.496663 IP node1.34879 > node1.34306: UDP, length 112
03:18:50.496791 IP node1.34101 > node1.34306: UDP, length 113
03:18:50.497068 IP node1.42688 > node1.34306: UDP, length 113
03:18:50.497212 IP node1.56164 > node1.34306: UDP, length 113
03:18:50.500800 IP node1.39490 > node1.34306: UDP, length 112
03:18:50.500865 IP node1.58351 > node1.34306: UDP, length 112
03:18:50.626194 IP node1.33274 > node1.34306: UDP, length 87
03:18:50.628461 IP node1.34306 > node1.33274: UDP, length 94
03:18:51.412831 IP node1.49395 > node1.55751: UDP, length 113
03:18:51.412935 IP node1.58351 > node1.55751: UDP, length 112
03:18:51.412953 IP node1.45921 > node1.55751: UDP, length 113
03:18:51.412953 IP node1.38885 > node1.55751: UDP, length 113
03:18:51.413184 IP node1.39490 > node1.55751: UDP, length 112
03:18:51.413509 IP node1.57492 > node1.55751: UDP, length 113
03:18:51.413554 IP node1.42688 > node1.55751: UDP, length 113
03:18:51.413595 IP node1.56606 > node1.55751: UDP, length 113
03:18:51.414130 IP node1.34101 > node1.55751: UDP, length 113
03:18:51.414137 IP node1.33032 > node1.55751: UDP, length 113
03:18:51.414296 IP node1.59844 > node1.55751: UDP, length 113
03:18:51.414652 IP node1.57013 > node1.55751: UDP, length 112
03:18:51.414836 IP node1.52277 > node1.55751: UDP, length 113
03:18:51.415780 IP node1.44614 > node1.55751: UDP, length 113
03:18:51.416014 IP node1.56164 > node1.55751: UDP, length 113
03:18:51.416326 IP node1.34879 > node1.55751: UDP, length 112
03:18:51.416402 IP node1.35968 > node1.55751: UDP, length 113
03:18:51.416417 IP node1.34107 > node1.55751: UDP, length 112
03:18:51.416592 IP node1.52695 > node1.55751: UDP, length 113
03:18:51.417247 IP node1.42550 > node1.55751: UDP, length 113
03:18:51.417256 IP node1.59529 > node1.55751: UDP, length 112
03:18:51.417418 IP node1.33274 > node1.55751: UDP, length 113
03:18:51.419662 IP node1.57918 > node1.55751: UDP, length 113
03:18:51.420509 IP node1.34306 > node1.55751: UDP, length 113
03:18:51.512843 IP node1.34306 > node1.55751: UDP, length 87
03:18:51.515189 IP node1.55751 > node1.34306: UDP, length 94
03:18:53.726609 IP node1.33032 > node1.34879: UDP, length 113
03:18:53.726773 IP node1.52277 > node1.34879: UDP, length 113
03:18:53.727074 IP node1.59529 > node1.34879: UDP, length 112
03:18:53.727169 IP node1.57013 > node1.34879: UDP, length 112
03:18:53.727711 IP node1.57492 > node1.34879: UDP, length 113
03:18:53.727869 IP node1.55751 > node1.34879: UDP, length 113
03:18:53.728085 IP node1.34101 > node1.34879: UDP, length 113
03:18:53.728324 IP node1.56606 > node1.34879: UDP, length 113
03:18:53.728495 IP node1.57918 > node1.34879: UDP, length 113
03:18:53.728735 IP node1.58351 > node1.34879: UDP, length 112
03:18:53.729106 IP node1.52695 > node1.34879: UDP, length 113
03:18:53.729332 IP node1.49395 > node1.34879: UDP, length 113
03:18:53.729651 IP node1.42550 > node1.34879: UDP, length 113
03:18:53.729894 IP node1.34107 > node1.34879: UDP, length 112
03:18:53.729969 IP node1.44614 > node1.34879: UDP, length 113
03:18:53.730045 IP node1.38885 > node1.34879: UDP, length 113
03:18:53.730189 IP node1.34306 > node1.34879: UDP, length 113
03:18:53.730201 IP node1.35968 > node1.34879: UDP, length 113
03:18:53.730244 IP node1.45921 > node1.34879: UDP, length 113
03:18:53.730398 IP node1.33274 > node1.34879: UDP, length 113
03:18:53.730500 IP node1.56164 > node1.34879: UDP, length 113
03:18:53.730557 IP node1.39490 > node1.34879: UDP, length 112
03:18:53.730787 IP node1.59844 > node1.34879: UDP, length 113
03:18:53.731452 IP node1.42688 > node1.34879: UDP, length 113
03:18:53.873226 IP node1.55751 > node1.34879: UDP, length 87
03:18:53.874548 IP node1.34879 > node1.55751: UDP, length 94

