03:11:30.082639 IP node3.43587 > node3.34474: UDP, length 113
03:11:30.104421 IP node3.34474 > node3.43587: UDP, length 113
03:11:30.360365 IP node3.43587 > node3.33617: UDP, length 113
03:11:30.361237 IP node3.34474 > node3.33617: UDP, length 113
03:11:30.375500 IP node3.52099 > node3.33617: UDP, length 113
03:11:30.378006 IP node3.34474 > node3.52099: UDP, length 113
03:11:30.378006 IP node3.43587 > node3.52099: UDP, length 113
03:11:30.379307 IP node3.33617 > node3.52099: UDP, length 113
03:11:30.426779 IP node3.43587 > node3.56938: UDP, length 113
03:11:30.437450 IP node3.33617 > node3.56938: UDP, length 113
03:11:30.437713 IP node3.34474 > node3.56938: UDP, length 113
03:11:30.442915 IP node3.52099 > node3.56938: UDP, length 113
03:11:30.528101 IP node3.56938 > node3.33617: UDP, length 113
03:11:30.528263 IP node3.56938 > node3.52099: UDP, length 113
03:11:30.604948 IP node3.34474 > node3.56677: UDP, length 113
03:11:30.604948 IP node3.52099 > node3.56677: UDP, length 113
03:11:30.605063 IP node3.43587 > node3.56677: UDP, length 113
03:11:30.607441 IP node3.56677 > node3.33617: UDP, length 113
03:11:30.608442 IP node3.56938 > node3.56677: UDP, length 113
03:11:30.609081 IP node3.33617 > node3.56677: UDP, length 113
03:11:30.610218 IP node3.56677 > node3.56938: UDP, length 113
03:11:30.614306 IP node3.56677 > node3.52099: UDP, length 113
03:11:30.716143 IP node3.42227 > node3.56938: UDP, length 112
03:11:30.716237 IP node3.42227 > node3.56677: UDP, length 112
03:11:30.716818 IP node3.43587 > node3.42227: UDP, length 113
03:11:30.717661 IP node3.56677 > node3.42227: UDP, length 113
03:11:30.718340 IP node3.56938 > node3.42227: UDP, length 113
03:11:30.718779 IP node3.34474 > node3.42227: UDP, length 113
03:11:30.719531 IP node3.33617 > node3.42227: UDP, length 113
03:11:30.719660 IP node3.52099 > node3.42227: UDP, length 113
03:11:30.742234 IP node3.43587 > node3.57155: UDP, length 113
03:11:30.744838 IP node3.56938 > node3.57155: UDP, length 113
03:11:30.750549 IP node3.42227 > node3.57155: UDP, length 112
03:11:30.750985 IP node3.57155 > node3.42227: UDP, length 113
03:11:30.750985 IP node3.57155 > node3.56677: UDP, length 113
03:11:30.751997 IP node3.56677 > node3.57155: UDP, length 113
03:11:30.753485 IP node3.34474 > node3.57155: UDP, length 113
03:11:30.760544 IP node3.33617 > node3.57155: UDP, length 113
03:11:30.763167 IP node3.52099 > node3.57155: UDP, length 113
03:11:30.775018 IP node3.35550 > node3.42227: UDP, length 113
03:11:30.775327 IP node3.35550 > node3.52099: UDP, length 113
03:11:30.775397 IP node3.35550 > node3.57155: UDP, length 113
03:11:30.775478 IP node3.35550 > node3.56677: UDP, length 113
03:11:30.775917 IP node3.34474 > node3.35550: UDP, length 113
03:11:30.778221 IP node3.56938 > node3.35550: UDP, length 113
03:11:30.778390 IP node3.33617 > node3.35550: UDP, length 113
03:11:30.778650 IP node3.52099 > node3.35550: UDP, length 113
03:11:30.778734 IP node3.43587 > node3.35550: UDP, length 113
03:11:30.778877 IP node3.42227 > node3.35550: UDP, length 112
03:11:30.779688 IP node3.57155 > node3.35550: UDP, length 113
03:11:30.779982 IP node3.56677 > node3.35550: UDP, length 113
03:11:30.780711 IP node3.35550 > node3.56938: UDP, length 113
03:11:31.053057 IP node3.42227 > node3.52635: UDP, length 112
03:11:31.055266 IP node3.43587 > node3.52635: UDP, length 113
03:11:31.055417 IP node3.52099 > node3.52635: UDP, length 113
03:11:31.056103 IP node3.35550 > node3.52635: UDP, length 113
03:11:31.056185 IP node3.33617 > node3.52635: UDP, length 113
03:11:31.056921 IP node3.56938 > node3.52635: UDP, length 113
03:11:31.057351 IP node3.57155 > node3.52635: UDP, length 113
03:11:31.057831 IP node3.56677 > node3.52635: UDP, length 113
03:11:31.058240 IP node3.34474 > node3.52635: UDP, length 113
03:11:31.112083 IP node3.52635 > node3.48193: UDP, length 113
03:11:31.113849 IP node3.43587 > node3.48193: UDP, length 113
03:11:31.114492 IP node3.35550 > node3.48193: UDP, length 113
03:11:31.115607 IP node3.33617 > node3.48193: UDP, length 113
03:11:31.115770 IP node3.56938 > node3.48193: UDP, length 113
03:11:31.115814 IP node3.57155 > node3.48193: UDP, length 113
03:11:31.116847 IP node3.34474 > node3.48193: UDP, length 113
03:11:31.117880 IP node3.56677 > node3.48193: UDP, length 113
03:11:31.118347 IP node3.42227 > node3.48193: UDP, length 112
03:11:31.119594 IP node3.52099 > node3.48193: UDP, length 113
03:11:31.145237 IP node3.56938 > node3.60133: UDP, length 113
03:11:31.145388 IP node3.35550 > node3.60133: UDP, length 113
03:11:31.145987 IP node3.52635 > node3.60133: UDP, length 113
03:11:31.146717 IP node3.43587 > node3.60133: UDP, length 113
03:11:31.146852 IP node3.34474 > node3.60133: UDP, length 113
03:11:31.146982 IP node3.56677 > node3.60133: UDP, length 113
03:11:31.147554 IP node3.42227 > node3.60133: UDP, length 112
03:11:31.148085 IP node3.33617 > node3.60133: UDP, length 113
03:11:31.148254 IP node3.57155 > node3.60133: UDP, length 113
03:11:31.148798 IP node3.52099 > node3.60133: UDP, length 113
03:11:31.185907 IP node3.48193 > node3.60133: UDP, length 112
03:11:31.185973 IP node3.48193 > node3.52635: UDP, length 112
03:11:31.202461 IP node3.57155 > node3.35498: UDP, length 113
03:11:31.202626 IP node3.33617 > node3.35498: UDP, length 113
03:11:31.203888 IP node3.42227 > node3.35498: UDP, length 112
03:11:31.206019 IP node3.52635 > node3.35498: UDP, length 113
03:11:31.206116 IP node3.56677 > node3.35498: UDP, length 113
03:11:31.206315 IP node3.43587 > node3.35498: UDP, length 113
03:11:31.207444 IP node3.35550 > node3.35498: UDP, length 113
03:11:31.207480 IP node3.52099 > node3.35498: UDP, length 113
03:11:31.207615 IP node3.34474 > node3.35498: UDP, length 113
03:11:31.207827 IP node3.56938 > node3.35498: UDP, length 113
03:11:31.213629 IP node3.48193 > node3.35498: UDP, length 112
03:11:31.221252 IP node3.60133 > node3.52635: UDP, length 113
03:11:31.229735 IP node3.60133 > node3.35498: UDP, length 113
03:11:31.229788 IP node3.60133 > node3.48193: UDP, length 113
03:11:31.243470 IP node3.35498 > node3.60133: UDP, length 112
03:11:31.255054 IP node3.35498 > node3.48193: UDP, length 112
03:11:31.308273 IP node3.49285 > node3.48193: UDP, length 113
03:11:31.308702 IP node3.43587 > node3.49285: UDP, length 113
03:11:31.310647 IP node3.52635 > node3.49285: UDP, length 113
03:11:31.311028 IP node3.56938 > node3.49285: UDP, length 113
03:11:31.311894 IP node3.56677 > node3.49285: UDP, length 113
03:11:31.312200 IP node3.57155 > node3.49285: UDP, length 113
03:11:31.312340 IP node3.34474 > node3.49285: UDP, length 113
03:11:31.312868 IP node3.33617 > node3.49285: UDP, length 113
03:11:31.312917 IP node3.60133 > node3.49285: UDP, length 113
03:11:31.312932 IP node3.42227 > node3.49285: UDP, length 112
03:11:31.313066 IP node3.35550 > node3.49285: UDP, length 113
03:11:31.313519 IP node3.49285 > node3.35498: UDP, length 113
03:11:31.313656 IP node3.35498 > node3.49285: UDP, length 112
03:11:31.313930 IP node3.52099 > node3.49285: UDP, length 113
03:11:31.315305 IP node3.48193 > node3.49285: UDP, length 112
03:11:31.317890 IP node3.49285 > node3.60133: UDP, length 113
03:11:31.346127 IP node3.60850 > node3.60133: UDP, length 112
03:11:31.348634 IP node3.35498 > node3.60850: UDP, length 112
03:11:31.348928 IP node3.42227 > node3.60850: UDP, length 112
03:11:31.348961 IP node3.48193 > node3.60850: UDP, length 112
03:11:31.349073 IP node3.57155 > node3.60850: UDP, length 113
03:11:31.349400 IP node3.52635 > node3.60850: UDP, length 113
03:11:31.349887 IP node3.43587 > node3.60850: UDP, length 113
03:11:31.349933 IP node3.49285 > node3.60850: UDP, length 113
03:11:31.350205 IP node3.33617 > node3.60850: UDP, length 113
03:11:31.350951 IP node3.60850 > node3.35498: UDP, length 112
03:11:31.351226 IP node3.60850 > node3.49285: UDP, length 112
03:11:31.351511 IP node3.56938 > node3.60850: UDP, length 113
03:11:31.351988 IP node3.60133 > node3.60850: UDP, length 113
03:11:31.352315 IP node3.56677 > node3.60850: UDP, length 113
03:11:31.354063 IP node3.34474 > node3.60850: UDP, length 113
03:11:31.355789 IP node3.52099 > node3.60850: UDP, length 113
03:11:31.356172 IP node3.35550 > node3.60850: UDP, length 113
03:11:33.458558 IP node3.35550 > node3.43587: UDP, length 113
03:11:33.458971 IP node3.49285 > node3.43587: UDP, length 113
03:11:33.459384 IP node3.60133 > node3.43587: UDP, length 113
03:11:33.459981 IP node3.60850 > node3.43587: UDP, length 112
03:11:33.460755 IP node3.33617 > node3.43587: UDP, length 113
03:11:33.462135 IP node3.34474 > node3.43587: UDP, length 113
03:11:33.462345 IP node3.56938 > node3.43587: UDP, length 113
03:11:33.463370 IP node3.48193 > node3.43587: UDP, length 112
03:11:33.463522 IP node3.57155 > node3.43587: UDP, length 113
03:11:33.463643 IP node3.42227 > node3.43587: UDP, length 112
03:11:33.464168 IP node3.56677 > node3.43587: UDP, length 113
03:11:33.464170 IP node3.52099 > node3.43587: UDP, length 113
03:11:33.466223 IP node3.52635 > node3.43587: UDP, length 113
03:11:33.466752 IP node3.35498 > node3.43587: UDP, length 112
03:11:33.520680 IP node3.35550 > node3.34474: UDP, length 113
03:11:33.521505 IP node3.49285 > node3.34474: UDP, length 113
03:11:33.522837 IP node3.60850 > node3.34474: UDP, length 112
03:11:33.523677 IP node3.52635 > node3.34474: UDP, length 113
03:11:33.523960 IP node3.52099 > node3.34474: UDP, length 113
03:11:33.524283 IP node3.56938 > node3.34474: UDP, length 113
03:11:33.524504 IP node3.60133 > node3.34474: UDP, length 113
03:11:33.524527 IP node3.33617 > node3.34474: UDP, length 113
03:11:33.524718 IP node3.42227 > node3.34474: UDP, length 112
03:11:33.524943 IP node3.57155 > node3.34474: UDP, length 113
03:11:33.525594 IP node3.56677 > node3.34474: UDP, length 113
03:11:33.525613 IP node3.43587 > node3.34474: UDP, length 113
03:11:33.525781 IP node3.35498 > node3.34474: UDP, length 112
03:11:33.525816 IP node3.48193 > node3.34474: UDP, length 112
03:11:33.743817 IP node3.43587 > node3.34474: UDP, length 87
03:11:33.744513 IP node3.34474 > node3.43587: UDP, length 94
03:11:33.855491 IP node3.48193 > node3.52099: UDP, length 112
03:11:33.855642 IP node3.49285 > node3.52099: UDP, length 113
03:11:33.855814 IP node3.35498 > node3.52099: UDP, length 112
03:11:33.856088 IP node3.56938 > node3.52099: UDP, length 113
03:11:33.856214 IP node3.35550 > node3.52099: UDP, length 113
03:11:33.856646 IP node3.33617 > node3.52099: UDP, length 113
03:11:33.857394 IP node3.60850 > node3.52099: UDP, length 112
03:11:33.858775 IP node3.35550 > node3.33617: UDP, length 113
03:11:33.858797 IP node3.52099 > node3.33617: UDP, length 113
03:11:33.858874 IP node3.56938 > node3.33617: UDP, length 113
03:11:33.860784 IP node3.52635 > node3.52099: UDP, length 113
03:11:33.860784 IP node3.48193 > node3.33617: UDP, length 112
03:11:33.860803 IP node3.35498 > node3.33617: UDP, length 112
03:11:33.861185 IP node3.49285 > node3.33617: UDP, length 113
03:11:33.861658 IP node3.60850 > node3.33617: UDP, length 112
03:11:33.862829 IP node3.34474 > node3.52099: UDP, length 113
03:11:33.862875 IP node3.34474 > node3.33617: UDP, length 113
03:11:33.862948 IP node3.57155 > node3.52099: UDP, length 113
03:11:33.862992 IP node3.57155 > node3.33617: UDP, length 113
03:11:33.863534 IP node3.43587 > node3.52099: UDP, length 113
03:11:33.863603 IP node3.43587 > node3.33617: UDP, length 113
03:11:33.867465 IP node3.60133 > node3.52099: UDP, length 113
03:11:33.867513 IP node3.60133 > node3.33617: UDP, length 113
03:11:33.869870 IP node3.52635 > node3.33617: UDP, length 113
03:11:33.870525 IP node3.56677 > node3.52099: UDP, length 113
03:11:33.870649 IP node3.56677 > node3.33617: UDP, length 113
03:11:33.870829 IP node3.42227 > node3.52099: UDP, length 112
03:11:33.870875 IP node3.42227 > node3.33617: UDP, length 112
03:11:33.929862 IP node3.57155 > node3.56938: UDP, length 113
03:11:33.930418 IP node3.52635 > node3.56938: UDP, length 113
03:11:33.930706 IP node3.52099 > node3.56938: UDP, length 113
03:11:33.931483 IP node3.43587 > node3.56938: UDP, length 113
03:11:33.931754 IP node3.34474 > node3.56938: UDP, length 113
03:11:33.932128 IP node3.49285 > node3.56938: UDP, length 113
03:11:33.932278 IP node3.42227 > node3.56938: UDP, length 112
03:11:33.932470 IP node3.60850 > node3.56938: UDP, length 112
03:11:33.932804 IP node3.33617 > node3.56938: UDP, length 113
03:11:33.933140 IP node3.35550 > node3.56938: UDP, length 113
03:11:33.933490 IP node3.56677 > node3.56938: UDP, length 113
03:11:33.933838 IP node3.35498 > node3.56938: UDP, length 112
03:11:33.934196 IP node3.60133 > node3.56938: UDP, length 113
03:11:33.936621 IP node3.48193 > node3.56938: UDP, length 112
03:11:34.026829 IP node3.33617 > node3.56938: UDP, length 87
03:11:34.027377 IP node3.56938 > node3.33617: UDP, length 94
03:11:34.049703 IP node3.57155 > node3.56677: UDP, length 113
03:11:34.050174 IP node3.60850 > node3.56677: UDP, length 112
03:11:34.050376 IP node3.35498 > node3.56677: UDP, length 112
03:11:34.051907 IP node3.49285 > node3.56677: UDP, length 113
03:11:34.052174 IP node3.35550 > node3.56677: UDP, length 113
03:11:34.052739 IP node3.52635 > node3.56677: UDP, length 113
03:11:34.052985 IP node3.34474 > node3.56677: UDP, length 113
03:11:34.053203 IP node3.42227 > node3.56677: UDP, length 112
03:11:34.054512 IP node3.43587 > node3.56677: UDP, length 113
03:11:34.055355 IP node3.48193 > node3.56677: UDP, length 112
03:11:34.055421 IP node3.60133 > node3.56677: UDP, length 113
03:11:34.057405 IP node3.56938 > node3.56677: UDP, length 113
03:11:34.059526 IP node3.33617 > node3.56677: UDP, length 113
03:11:34.061367 IP node3.52099 > node3.56677: UDP, length 113
03:11:34.133249 IP node3.35498 > node3.42227: UDP, length 112
03:11:34.134379 IP node3.35550 > node3.42227: UDP, length 113
03:11:34.135596 IP node3.60850 > node3.42227: UDP, length 112
03:11:34.136407 IP node3.33617 > node3.42227: UDP, length 113
03:11:34.136606 IP node3.52099 > node3.42227: UDP, length 113
03:11:34.136753 IP node3.49285 > node3.42227: UDP, length 113
03:11:34.136903 IP node3.34474 > node3.42227: UDP, length 113
03:11:34.137902 IP node3.60133 > node3.42227: UDP, length 113
03:11:34.138298 IP node3.48193 > node3.42227: UDP, length 112
03:11:34.139414 IP node3.52635 > node3.42227: UDP, length 113
03:11:34.139805 IP node3.56677 > node3.42227: UDP, length 113
03:11:34.139960 IP node3.43587 > node3.42227: UDP, length 113
03:11:34.140161 IP node3.57155 > node3.42227: UDP, length 113
03:11:34.148675 IP node3.56938 > node3.42227: UDP, length 113
03:11:34.167696 IP node3.35498 > node3.57155: UDP, length 112
03:11:34.167839 IP node3.60133 > node3.57155: UDP, length 113
03:11:34.168590 IP node3.52099 > node3.57155: UDP, length 113
03:11:34.168717 IP node3.35550 > node3.57155: UDP, length 113
03:11:34.169331 IP node3.34474 > node3.57155: UDP, length 113
03:11:34.169681 IP node3.56938 > node3.57155: UDP, length 113
03:11:34.171298 IP node3.33617 > node3.57155: UDP, length 113
03:11:34.172469 IP node3.56677 > node3.57155: UDP, length 113
03:11:34.172684 IP node3.42227 > node3.57155: UDP, length 112
03:11:34.173207 IP node3.60850 > node3.57155: UDP, length 112
03:11:34.174673 IP node3.43587 > node3.57155: UDP, length 113
03:11:34.175384 IP node3.48193 > node3.57155: UDP, length 112
03:11:34.176350 IP node3.49285 > node3.57155: UDP, length 113
03:11:34.176431 IP node3.52635 > node3.57155: UDP, length 113
03:11:34.214892 IP node3.56938 > node3.56677: UDP, length 87
03:11:34.215477 IP node3.56677 > node3.56938: UDP, length 94
03:11:34.271252 IP node3.42227 > node3.57155: UDP, length 87
03:11:34.277092 IP node3.57155 > node3.42227: UDP, length 94
03:11:34.278100 IP node3.34474 > node3.35550: UDP, length 113
03:11:34.279092 IP node3.57155 > node3.35550: UDP, length 113
03:11:34.280378 IP node3.56938 > node3.35550: UDP, length 113
03:11:34.280548 IP node3.52635 > node3.35550: UDP, length 113
03:11:34.283115 IP node3.49285 > node3.35550: UDP, length 113
03:11:34.283243 IP node3.35498 > node3.35550: UDP, length 112
03:11:34.284408 IP node3.42227 > node3.35550: UDP, length 112
03:11:34.285179 IP node3.60133 > node3.35550: UDP, length 113
03:11:34.285302 IP node3.60850 > node3.35550: UDP, length 112
03:11:34.285861 IP node3.43587 > node3.35550: UDP, length 113
03:11:34.286923 IP node3.48193 > node3.35550: UDP, length 112
03:11:34.287238 IP node3.33617 > node3.35550: UDP, length 113
03:11:34.292489 IP node3.56677 > node3.35550: UDP, length 113
03:11:34.292961 IP node3.52099 > node3.35550: UDP, length 113
03:11:34.468546 IP node3.57155 > node3.35550: UDP, length 87
03:11:34.469184 IP node3.35550 > node3.57155: UDP, length 94
03:11:34.524956 IP node3.35550 > node3.52635: UDP, length 113
03:11:34.525490 IP node3.43587 > node3.52635: UDP, length 113
03:11:34.526063 IP node3.34474 > node3.52635: UDP, length 113
03:11:34.532609 IP node3.52099 > node3.52635: UDP, length 113
03:11:34.533270 IP node3.56938 > node3.52635: UDP, length 113
03:11:34.533497 IP node3.42227 > node3.52635: UDP, length 112
03:11:34.533705 IP node3.33617 > node3.52635: UDP, length 113
03:11:34.534196 IP node3.56677 > node3.52635: UDP, length 113
03:11:34.534734 IP node3.60133 > node3.52635: UDP, length 113
03:11:34.535340 IP node3.60850 > node3.52635: UDP, length 112
03:11:34.535823 IP node3.57155 > node3.52635: UDP, length 113
03:11:34.535922 IP node3.49285 > node3.52635: UDP, length 113
03:11:34.536094 IP node3.35498 > node3.52635: UDP, length 112
03:11:34.536538 IP node3.48193 > node3.52635: UDP, length 112
03:11:34.604521 IP node3.43587 > node3.48193: UDP, length 113
03:11:34.606964 IP node3.35498 > node3.48193: UDP, length 112
03:11:34.607114 IP node3.52099 > node3.48193: UDP, length 113
03:11:34.607263 IP node3.34474 > node3.48193: UDP, length 113
03:11:34.607479 IP node3.49285 > node3.48193: UDP, length 113
03:11:34.608031 IP node3.52635 > node3.48193: UDP, length 113
03:11:34.608570 IP node3.56938 > node3.48193: UDP, length 113
03:11:34.608601 IP node3.60133 > node3.48193: UDP, length 113
03:11:34.608864 IP node3.42227 > node3.48193: UDP, length 112
03:11:34.609019 IP node3.60850 > node3.48193: UDP, length 112
03:11:34.609253 IP node3.35550 > node3.48193: UDP, length 113
03:11:34.609429 IP node3.33617 > node3.48193: UDP, length 113
03:11:34.611296 IP node3.57155 > node3.48193: UDP, length 113
03:11:34.611541 IP node3.56677 > node3.48193: UDP, length 113
03:11:34.646533 IP node3.43587 > node3.60133: UDP, length 113
03:11:34.646991 IP node3.57155 > node3.60133: UDP, length 113
03:11:34.647036 IP node3.48193 > node3.60133: UDP, length 112
03:11:34.647884 IP node3.35550 > node3.60133: UDP, length 113
03:11:34.647979 IP node3.56677 > node3.60133: UDP, length 113
03:11:34.649248 IP node3.42227 > node3.60133: UDP, length 112
03:11:34.650218 IP node3.56938 > node3.60133: UDP, length 113
03:11:34.650414 IP node3.52099 > node3.60133: UDP, length 113
03:11:34.650561 IP node3.33617 > node3.60133: UDP, length 113
03:11:34.651262 IP node3.52635 > node3.60133: UDP, length 113
03:11:34.655873 IP node3.34474 > node3.60133: UDP, length 113
03:11:34.656625 IP node3.60850 > node3.60133: UDP, length 112
03:11:34.656837 IP node3.49285 > node3.60133: UDP, length 113
03:11:34.659358 IP node3.35498 > node3.60133: UDP, length 112
03:11:34.681390 IP node3.49285 > node3.35498: UDP, length 113
03:11:34.681504 IP node3.34474 > node3.35498: UDP, length 113
03:11:34.682072 IP node3.42227 > node3.35498: UDP, length 112
03:11:34.682927 IP node3.52099 > node3.35498: UDP, length 113
03:11:34.683087 IP node3.48193 > node3.35498: UDP, length 112
03:11:34.683310 IP node3.57155 > node3.35498: UDP, length 113
03:11:34.683532 IP node3.35550 > node3.35498: UDP, length 113
03:11:34.683705 IP node3.43587 > node3.35498: UDP, length 113
03:11:34.683798 IP node3.56677 > node3.35498: UDP, length 113
03:11:34.683965 IP node3.60850 > node3.35498: UDP, length 112
03:11:34.684843 IP node3.52635 > node3.35498: UDP, length 113
03:11:34.685375 IP node3.60133 > node3.35498: UDP, length 113
03:11:34.687261 IP node3.56938 > node3.35498: UDP, length 113
03:11:34.687803 IP node3.33617 > node3.35498: UDP, length 113
03:11:34.784925 IP node3.52635 > node3.49285: UDP, length 113
03:11:34.785196 IP node3.35550 > node3.49285: UDP, length 113
03:11:34.785207 IP node3.56677 > node3.49285: UDP, length 113
03:11:34.785486 IP node3.35498 > node3.49285: UDP, length 112
03:11:34.786294 IP node3.60133 > node3.49285: UDP, length 113
03:11:34.787979 IP node3.60850 > node3.49285: UDP, length 112
03:11:34.788192 IP node3.42227 > node3.49285: UDP, length 112
03:11:34.788359 IP node3.52099 > node3.49285: UDP, length 113
03:11:34.788436 IP node3.56938 > node3.49285: UDP, length 113
03:11:34.788537 IP node3.34474 > node3.49285: UDP, length 113
03:11:34.788587 IP node3.33617 > node3.49285: UDP, length 113
03:11:34.788901 IP node3.57155 > node3.49285: UDP, length 113
03:11:34.789048 IP node3.48193 > node3.49285: UDP, length 112
03:11:34.789813 IP node3.43587 > node3.49285: UDP, length 113
03:11:34.815801 IP node3.52635 > node3.48193: UDP, length 87
03:11:34.819701 IP node3.48193 > node3.52635: UDP, length 94
03:11:34.849618 IP node3.34474 > node3.60850: UDP, length 113
03:11:34.850528 IP node3.49285 > node3.60850: UDP, length 113
03:11:34.851141 IP node3.60133 > node3.60850: UDP, length 113
03:11:34.851598 IP node3.52099 > node3.60850: UDP, length 113
03:11:34.852077 IP node3.56938 > node3.60850: UDP, length 113
03:11:34.854164 IP node3.33617 > node3.60850: UDP, length 113
03:11:34.855043 IP node3.35550 > node3.60850: UDP, length 113
03:11:34.855236 IP node3.57155 > node3.60850: UDP, length 113
03:11:34.855318 IP node3.42227 > node3.60850: UDP, length 112
03:11:34.856552 IP node3.52635 > node3.60850: UDP, length 113
03:11:34.857746 IP node3.35498 > node3.60850: UDP, length 112
03:11:34.859054 IP node3.56677 > node3.60850: UDP, length 113
03:11:34.859707 IP node3.43587 > node3.60850: UDP, length 113
03:11:34.870744 IP node3.48193 > node3.60850: UDP, length 112

