03:11:30.065678 IP node2.38768 > node3.43587: UDP, length 113
03:11:30.065838 IP node2.58256 > node3.43587: UDP, length 113
03:11:30.065960 IP node2.40433 > node3.43587: UDP, length 112
03:11:30.066273 IP node2.35844 > node3.43587: UDP, length 113
03:11:30.066434 IP node2.58185 > node3.34474: UDP, length 113
03:11:30.066607 IP node2.58185 > node3.43587: UDP, length 113
03:11:30.067141 IP node2.35844 > node3.34474: UDP, length 113
03:11:30.068029 IP node2.47170 > node3.43587: UDP, length 112
03:11:30.068381 IP node2.33739 > node3.34474: UDP, length 113
03:11:30.068437 IP node2.33739 > node3.43587: UDP, length 113
03:11:30.070131 IP node2.52006 > node3.34474: UDP, length 113
03:11:30.070230 IP node2.52006 > node3.43587: UDP, length 113
03:11:30.071612 IP node2.36166 > node3.34474: UDP, length 113
03:11:30.071749 IP node2.36166 > node3.43587: UDP, length 113
03:11:30.072106 IP node2.50518 > node3.34474: UDP, length 111
03:11:30.072190 IP node2.50518 > node3.43587: UDP, length 111
03:11:30.072516 IP node2.58256 > node3.34474: UDP, length 113
03:11:30.076505 IP node2.38768 > node3.34474: UDP, length 113
03:11:30.077162 IP node2.40433 > node3.34474: UDP, length 112
03:11:30.079338 IP node2.47170 > node3.34474: UDP, length 112
03:11:30.160388 IP node2.44193 > node3.43587: UDP, length 113
03:11:30.166390 IP node2.44193 > node3.34474: UDP, length 113
03:11:30.187470 IP node2.52599 > node3.34474: UDP, length 112
03:11:30.190069 IP node2.52599 > node3.43587: UDP, length 112
03:11:30.196575 IP node2.38620 > node3.43587: UDP, length 113
03:11:30.198446 IP node2.38620 > node3.34474: UDP, length 113
03:11:30.408509 IP node2.58185 > node3.33617: UDP, length 113
03:11:30.409103 IP node2.35844 > node3.33617: UDP, length 113
03:11:30.409252 IP node2.38768 > node3.33617: UDP, length 113
03:11:30.409570 IP node2.40433 > node3.33617: UDP, length 112
03:11:30.409666 IP node2.33739 > node3.33617: UDP, length 113
03:11:30.409739 IP node2.36166 > node3.33617: UDP, length 113
03:11:30.409945 IP node2.38620 > node3.33617: UDP, length 113
03:11:30.410041 IP node2.52599 > node3.33617: UDP, length 112
03:11:30.410209 IP node2.47170 > node3.33617: UDP, length 112
03:11:30.410898 IP node2.44193 > node3.33617: UDP, length 113
03:11:30.411307 IP node2.50518 > node3.33617: UDP, length 111
03:11:30.411491 IP node2.58256 > node3.33617: UDP, length 113
03:11:30.411783 IP node2.52006 > node3.33617: UDP, length 113
03:11:30.412298 IP node2.47792 > node3.33617: UDP, length 112
03:11:30.412476 IP node2.40826 > node3.33617: UDP, length 113
03:11:30.424619 IP node2.58256 > node3.52099: UDP, length 113
03:11:30.424923 IP node2.47170 > node3.52099: UDP, length 112
03:11:30.424949 IP node2.33739 > node3.52099: UDP, length 113
03:11:30.425107 IP node2.38768 > node3.52099: UDP, length 113
03:11:30.425257 IP node2.36166 > node3.52099: UDP, length 113
03:11:30.425876 IP node2.52599 > node3.52099: UDP, length 112
03:11:30.425900 IP node2.50518 > node3.52099: UDP, length 111
03:11:30.425957 IP node2.38620 > node3.52099: UDP, length 113
03:11:30.426096 IP node2.52006 > node3.52099: UDP, length 113
03:11:30.426526 IP node2.40433 > node3.52099: UDP, length 112
03:11:30.426625 IP node2.47792 > node3.52099: UDP, length 112
03:11:30.426703 IP node2.44193 > node3.52099: UDP, length 113
03:11:30.426825 IP node2.40826 > node3.52099: UDP, length 113
03:11:30.426878 IP node2.58185 > node3.52099: UDP, length 113
03:11:30.427076 IP node2.35844 > node3.52099: UDP, length 113
03:11:30.474638 IP node2.38768 > node3.56938: UDP, length 113
03:11:30.474948 IP node2.58185 > node3.56938: UDP, length 113
03:11:30.475128 IP node2.33739 > node3.56938: UDP, length 113
03:11:30.475311 IP node2.47170 > node3.56938: UDP, length 112
03:11:30.475449 IP node2.35844 > node3.56938: UDP, length 113
03:11:30.475836 IP node2.36166 > node3.56938: UDP, length 113
03:11:30.476044 IP node2.44193 > node3.56938: UDP, length 113
03:11:30.476248 IP node2.58256 > node3.56938: UDP, length 113
03:11:30.476417 IP node2.52006 > node3.56938: UDP, length 113
03:11:30.476541 IP node2.50518 > node3.56938: UDP, length 111
03:11:30.476666 IP node2.52599 > node3.56938: UDP, length 112
03:11:30.476898 IP node2.40433 > node3.56938: UDP, length 112
03:11:30.477194 IP node2.47792 > node3.56938: UDP, length 112
03:11:30.477281 IP node2.40826 > node3.56938: UDP, length 113
03:11:30.478104 IP node2.38620 > node3.56938: UDP, length 113
03:11:30.648300 IP node2.47792 > node1.33333: UDP, length 112
03:11:30.648437 IP node2.52599 > node1.33333: UDP, length 112
03:11:30.648525 IP node2.33739 > node1.33333: UDP, length 113
03:11:30.648602 IP node2.40433 > node1.33333: UDP, length 112
03:11:30.648680 IP node2.58256 > node1.33333: UDP, length 113
03:11:30.648768 IP node2.38768 > node1.33333: UDP, length 113
03:11:30.648954 IP node2.58185 > node1.33333: UDP, length 113
03:11:30.649211 IP node2.50518 > node1.33333: UDP, length 111
03:11:30.649321 IP node2.44193 > node1.33333: UDP, length 113
03:11:30.649379 IP node2.40826 > node1.33333: UDP, length 113
03:11:30.649466 IP node2.38620 > node1.33333: UDP, length 113
03:11:30.649599 IP node2.35844 > node1.33333: UDP, length 113
03:11:30.649871 IP node2.36166 > node1.33333: UDP, length 113
03:11:30.650152 IP node2.52006 > node1.33333: UDP, length 113
03:11:30.650398 IP node2.47170 > node1.33333: UDP, length 112
03:11:30.652892 IP node2.38768 > node3.56677: UDP, length 113
03:11:30.653397 IP node2.40433 > node3.56677: UDP, length 112
03:11:30.653849 IP node2.35844 > node3.56677: UDP, length 113
03:11:30.653959 IP node2.33739 > node3.56677: UDP, length 113
03:11:30.654037 IP node2.52599 > node3.56677: UDP, length 112
03:11:30.654153 IP node2.47792 > node3.56677: UDP, length 112
03:11:30.654440 IP node2.58256 > node3.56677: UDP, length 113
03:11:30.654713 IP node2.50518 > node3.56677: UDP, length 111
03:11:30.654784 IP node2.47170 > node3.56677: UDP, length 112
03:11:30.655201 IP node2.44193 > node3.56677: UDP, length 113
03:11:30.659678 IP node2.52006 > node3.56677: UDP, length 113
03:11:30.659862 IP node2.58185 > node3.56677: UDP, length 113
03:11:30.660229 IP node2.40826 > node3.56677: UDP, length 113
03:11:30.660775 IP node2.38620 > node3.56677: UDP, length 113
03:11:30.661147 IP node2.36166 > node3.56677: UDP, length 113
03:11:30.764388 IP node2.36166 > node3.42227: UDP, length 113
03:11:30.764943 IP node2.50518 > node3.42227: UDP, length 111
03:11:30.765091 IP node2.58256 > node3.42227: UDP, length 113
03:11:30.765180 IP node2.58185 > node3.42227: UDP, length 113
03:11:30.765261 IP node2.35844 > node3.42227: UDP, length 113
03:11:30.765370 IP node2.40433 > node3.42227: UDP, length 112
03:11:30.766595 IP node2.47170 > node3.42227: UDP, length 112
03:11:30.766668 IP node2.52006 > node3.42227: UDP, length 113
03:11:30.766749 IP node2.33739 > node3.42227: UDP, length 113
03:11:30.767019 IP node2.52599 > node3.42227: UDP, length 112
03:11:30.770649 IP node2.38620 > node3.42227: UDP, length 113
03:11:30.770931 IP node2.47792 > node3.42227: UDP, length 112
03:11:30.771029 IP node2.38768 > node3.42227: UDP, length 113
03:11:30.771078 IP node2.40826 > node3.42227: UDP, length 113
03:11:30.771157 IP node2.44193 > node3.42227: UDP, length 113
03:11:30.789460 IP node2.40433 > node3.57155: UDP, length 112
03:11:30.789567 IP node2.38768 > node3.57155: UDP, length 113
03:11:30.789739 IP node2.58256 > node3.57155: UDP, length 113
03:11:30.789911 IP node2.40826 > node3.57155: UDP, length 113
03:11:30.790025 IP node2.58185 > node3.57155: UDP, length 113
03:11:30.790278 IP node2.33739 > node3.57155: UDP, length 113
03:11:30.790384 IP node2.47792 > node3.57155: UDP, length 112
03:11:30.790615 IP node2.52599 > node3.57155: UDP, length 112
03:11:30.791040 IP node2.35844 > node3.57155: UDP, length 113
03:11:30.791147 IP node2.47170 > node3.57155: UDP, length 112
03:11:30.791198 IP node2.50518 > node3.57155: UDP, length 111
03:11:30.791341 IP node2.38620 > node3.57155: UDP, length 113
03:11:30.791631 IP node2.52006 > node3.57155: UDP, length 113
03:11:30.791698 IP node2.44193 > node3.57155: UDP, length 113
03:11:30.792206 IP node2.36166 > node3.57155: UDP, length 113
03:11:30.824026 IP node2.36166 > node3.35550: UDP, length 113
03:11:30.824335 IP node2.58185 > node3.35550: UDP, length 113
03:11:30.824536 IP node2.33739 > node3.35550: UDP, length 113
03:11:30.824644 IP node2.58256 > node3.35550: UDP, length 113
03:11:30.824724 IP node2.38768 > node3.35550: UDP, length 113
03:11:30.824803 IP node2.47792 > node3.35550: UDP, length 112
03:11:30.824934 IP node2.35844 > node3.35550: UDP, length 113
03:11:30.825112 IP node2.44193 > node3.35550: UDP, length 113
03:11:30.825260 IP node2.50518 > node3.35550: UDP, length 111
03:11:30.825418 IP node2.38620 > node3.35550: UDP, length 113
03:11:30.825561 IP node2.40433 > node3.35550: UDP, length 112
03:11:30.825750 IP node2.52599 > node3.35550: UDP, length 112
03:11:30.825840 IP node2.40826 > node3.35550: UDP, length 113
03:11:30.825941 IP node2.47170 > node3.35550: UDP, length 112
03:11:30.826270 IP node2.52006 > node3.35550: UDP, length 113
03:11:30.922833 IP node2.52599 > node1.40064: UDP, length 112
03:11:30.923054 IP node2.40826 > node1.40064: UDP, length 113
03:11:30.923222 IP node2.58185 > node1.40064: UDP, length 113
03:11:30.923423 IP node2.38768 > node1.40064: UDP, length 113
03:11:30.923559 IP node2.35844 > node1.40064: UDP, length 113
03:11:30.923713 IP node2.47170 > node1.40064: UDP, length 112
03:11:30.923849 IP node2.47792 > node1.40064: UDP, length 112
03:11:30.924001 IP node2.38620 > node1.40064: UDP, length 113
03:11:30.924957 IP node2.33739 > node1.40064: UDP, length 113
03:11:30.925138 IP node2.40433 > node1.40064: UDP, length 112
03:11:30.925225 IP node2.52006 > node1.40064: UDP, length 113
03:11:30.925304 IP node2.44193 > node1.40064: UDP, length 113
03:11:30.925380 IP node2.36166 > node1.40064: UDP, length 113
03:11:30.925454 IP node2.50518 > node1.40064: UDP, length 111
03:11:30.925543 IP node2.58256 > node1.40064: UDP, length 113
03:11:30.960834 IP node2.52599 > node4.36486: UDP, length 112
03:11:30.961050 IP node2.40826 > node4.36486: UDP, length 113
03:11:30.961146 IP node2.58185 > node4.36486: UDP, length 113
03:11:30.961216 IP node2.47170 > node4.36486: UDP, length 112
03:11:30.961301 IP node2.38768 > node4.36486: UDP, length 113
03:11:30.961371 IP node2.40433 > node4.36486: UDP, length 112
03:11:30.961447 IP node2.38620 > node4.36486: UDP, length 113
03:11:30.961523 IP node2.35844 > node4.36486: UDP, length 113
03:11:30.961681 IP node2.47792 > node4.36486: UDP, length 112
03:11:30.961833 IP node2.52006 > node4.36486: UDP, length 113
03:11:30.962351 IP node2.33739 > node4.36486: UDP, length 113
03:11:30.962437 IP node2.36166 > node4.36486: UDP, length 113
03:11:30.962728 IP node2.58256 > node4.36486: UDP, length 113
03:11:30.962862 IP node2.44193 > node4.36486: UDP, length 113
03:11:30.963206 IP node2.50518 > node4.36486: UDP, length 111
03:11:31.001036 IP node2.33739 > node4.48590: UDP, length 113
03:11:31.001160 IP node2.40826 > node4.48590: UDP, length 113
03:11:31.001243 IP node2.40433 > node4.48590: UDP, length 112
03:11:31.001318 IP node2.35844 > node4.48590: UDP, length 113
03:11:31.001396 IP node2.38620 > node4.48590: UDP, length 113
03:11:31.001482 IP node2.52599 > node4.48590: UDP, length 112
03:11:31.001552 IP node2.47170 > node4.48590: UDP, length 112
03:11:31.001631 IP node2.50518 > node4.48590: UDP, length 111
03:11:31.001709 IP node2.47792 > node4.48590: UDP, length 112
03:11:31.001787 IP node2.52006 > node4.48590: UDP, length 113
03:11:31.002224 IP node2.58256 > node4.48590: UDP, length 113
03:11:31.002586 IP node2.38768 > node4.48590: UDP, length 113
03:11:31.002759 IP node2.58185 > node4.48590: UDP, length 113
03:11:31.002837 IP node2.36166 > node4.48590: UDP, length 113
03:11:31.002879 IP node2.44193 > node4.48590: UDP, length 113
03:11:31.098423 IP node2.38768 > node3.52635: UDP, length 113
03:11:31.098673 IP node2.35844 > node3.52635: UDP, length 113
03:11:31.098933 IP node2.33739 > node3.52635: UDP, length 113
03:11:31.099087 IP node2.36166 > node3.52635: UDP, length 113
03:11:31.099165 IP node2.58256 > node3.52635: UDP, length 113
03:11:31.099240 IP node2.40433 > node3.52635: UDP, length 112
03:11:31.099312 IP node2.44193 > node3.52635: UDP, length 113
03:11:31.099382 IP node2.47792 > node3.52635: UDP, length 112
03:11:31.099450 IP node2.38620 > node3.52635: UDP, length 113
03:11:31.099658 IP node2.50518 > node3.52635: UDP, length 111
03:11:31.100276 IP node2.40826 > node3.52635: UDP, length 113
03:11:31.100559 IP node2.58185 > node3.52635: UDP, length 113
03:11:31.100721 IP node2.52599 > node3.52635: UDP, length 112
03:11:31.100797 IP node2.47170 > node3.52635: UDP, length 112
03:11:31.100870 IP node2.52006 > node3.52635: UDP, length 113
03:11:31.160058 IP node2.58185 > node3.48193: UDP, length 113
03:11:31.160176 IP node2.40433 > node3.48193: UDP, length 112
03:11:31.160263 IP node2.40826 > node3.48193: UDP, length 113
03:11:31.160354 IP node2.52599 > node3.48193: UDP, length 112
03:11:31.160462 IP node2.44193 > node3.48193: UDP, length 113
03:11:31.160539 IP node2.47170 > node3.48193: UDP, length 112
03:11:31.160629 IP node2.38620 > node3.48193: UDP, length 113
03:11:31.160921 IP node2.58256 > node3.48193: UDP, length 113
03:11:31.161079 IP node2.35844 > node3.48193: UDP, length 113
03:11:31.161161 IP node2.33739 > node3.48193: UDP, length 113
03:11:31.161223 IP node2.50518 > node3.48193: UDP, length 111
03:11:31.161294 IP node2.52006 > node3.48193: UDP, length 113
03:11:31.161365 IP node2.38768 > node3.48193: UDP, length 113
03:11:31.161450 IP node2.47792 > node3.48193: UDP, length 112
03:11:31.161609 IP node2.36166 > node3.48193: UDP, length 113
03:11:31.178226 IP node2.52006 > node4.44113: UDP, length 113
03:11:31.178403 IP node2.47792 > node4.44113: UDP, length 112
03:11:31.178515 IP node2.44193 > node4.44113: UDP, length 113
03:11:31.178649 IP node2.40826 > node4.44113: UDP, length 113
03:11:31.178885 IP node2.38768 > node4.44113: UDP, length 113
03:11:31.178979 IP node2.35844 > node4.44113: UDP, length 113
03:11:31.179055 IP node2.36166 > node4.44113: UDP, length 113
03:11:31.179132 IP node2.58256 > node4.44113: UDP, length 113
03:11:31.179209 IP node2.40433 > node4.44113: UDP, length 112
03:11:31.179330 IP node2.52599 > node4.44113: UDP, length 112
03:11:31.179394 IP node2.38620 > node4.44113: UDP, length 113
03:11:31.179471 IP node2.33739 > node4.44113: UDP, length 113
03:11:31.179600 IP node2.50518 > node4.44113: UDP, length 111
03:11:31.179926 IP node2.47170 > node4.44113: UDP, length 112
03:11:31.180162 IP node2.58185 > node4.44113: UDP, length 113
03:11:31.192579 IP node2.40433 > node3.60133: UDP, length 112
03:11:31.192927 IP node2.52599 > node3.60133: UDP, length 112
03:11:31.193105 IP node2.33739 > node3.60133: UDP, length 113
03:11:31.193273 IP node2.38620 > node3.60133: UDP, length 113
03:11:31.193345 IP node2.52006 > node3.60133: UDP, length 113
03:11:31.193422 IP node2.35844 > node3.60133: UDP, length 113
03:11:31.193496 IP node2.40826 > node3.60133: UDP, length 113
03:11:31.193568 IP node2.47170 > node3.60133: UDP, length 112
03:11:31.193642 IP node2.38768 > node3.60133: UDP, length 113
03:11:31.193715 IP node2.58256 > node3.60133: UDP, length 113
03:11:31.193820 IP node2.47792 > node3.60133: UDP, length 112
03:11:31.193960 IP node2.50518 > node3.60133: UDP, length 111
03:11:31.194122 IP node2.44193 > node3.60133: UDP, length 113
03:11:31.194313 IP node2.36166 > node3.60133: UDP, length 113
03:11:31.194629 IP node2.58185 > node3.60133: UDP, length 113
03:11:31.212914 IP node2.40826 > node4.36499: UDP, length 113
03:11:31.213160 IP node2.52006 > node4.36499: UDP, length 113
03:11:31.213224 IP node2.50518 > node4.36499: UDP, length 111
03:11:31.213398 IP node2.35844 > node4.36499: UDP, length 113
03:11:31.213470 IP node2.40433 > node4.36499: UDP, length 112
03:11:31.213548 IP node2.58256 > node4.36499: UDP, length 113
03:11:31.213638 IP node2.33739 > node4.36499: UDP, length 113
03:11:31.213840 IP node2.38768 > node4.36499: UDP, length 113
03:11:31.213949 IP node2.52599 > node4.36499: UDP, length 112
03:11:31.214044 IP node2.36166 > node4.36499: UDP, length 113
03:11:31.214152 IP node2.58185 > node4.36499: UDP, length 113
03:11:31.214217 IP node2.38620 > node4.36499: UDP, length 113
03:11:31.214418 IP node2.44193 > node4.36499: UDP, length 113
03:11:31.214645 IP node2.47170 > node4.36499: UDP, length 112
03:11:31.214860 IP node2.47792 > node4.36499: UDP, length 112
03:11:31.245727 IP node2.40433 > node3.35498: UDP, length 112
03:11:31.245843 IP node2.52599 > node3.35498: UDP, length 112
03:11:31.246178 IP node2.33739 > node3.35498: UDP, length 113
03:11:31.246276 IP node2.35844 > node3.35498: UDP, length 113
03:11:31.246461 IP node2.44193 > node3.35498: UDP, length 113
03:11:31.246528 IP node2.38620 > node3.35498: UDP, length 113
03:11:31.246602 IP node2.47170 > node3.35498: UDP, length 112
03:11:31.246653 IP node2.40826 > node3.35498: UDP, length 113
03:11:31.246762 IP node2.52006 > node3.35498: UDP, length 113
03:11:31.246882 IP node2.38768 > node3.35498: UDP, length 113
03:11:31.247093 IP node2.47792 > node3.35498: UDP, length 112
03:11:31.247366 IP node2.58185 > node3.35498: UDP, length 113
03:11:31.247821 IP node2.50518 > node3.35498: UDP, length 111
03:11:31.247973 IP node2.58256 > node3.35498: UDP, length 113
03:11:31.248150 IP node2.36166 > node3.35498: UDP, length 113
03:11:31.335768 IP node2.52006 > node4.58460: UDP, length 113
03:11:31.335874 IP node2.38620 > node4.58460: UDP, length 113
03:11:31.336032 IP node2.38768 > node4.58460: UDP, length 113
03:11:31.336695 IP node2.58185 > node4.58460: UDP, length 113
03:11:31.336807 IP node2.58256 > node4.58460: UDP, length 113
03:11:31.336970 IP node2.35844 > node4.58460: UDP, length 113
03:11:31.337051 IP node2.40433 > node4.58460: UDP, length 112
03:11:31.337272 IP node2.47170 > node4.58460: UDP, length 112
03:11:31.337685 IP node2.50518 > node4.58460: UDP, length 111
03:11:31.337912 IP node2.40826 > node4.58460: UDP, length 113
03:11:31.337992 IP node2.33739 > node4.58460: UDP, length 113
03:11:31.338242 IP node2.47792 > node4.58460: UDP, length 112
03:11:31.338451 IP node2.36166 > node4.58460: UDP, length 113
03:11:31.338555 IP node2.52599 > node4.58460: UDP, length 112
03:11:31.338638 IP node2.44193 > node4.58460: UDP, length 113
03:11:31.356459 IP node2.47170 > node3.49285: UDP, length 112
03:11:31.356677 IP node2.44193 > node3.49285: UDP, length 113
03:11:31.356786 IP node2.38768 > node3.49285: UDP, length 113
03:11:31.356912 IP node2.33739 > node3.49285: UDP, length 113
03:11:31.357067 IP node2.52006 > node3.49285: UDP, length 113
03:11:31.357427 IP node2.52599 > node3.49285: UDP, length 112
03:11:31.357964 IP node2.40826 > node3.49285: UDP, length 113
03:11:31.358543 IP node2.38620 > node3.49285: UDP, length 113
03:11:31.358941 IP node2.35844 > node3.49285: UDP, length 113
03:11:31.359363 IP node2.40433 > node3.49285: UDP, length 112
03:11:31.359435 IP node2.47792 > node3.49285: UDP, length 112
03:11:31.359763 IP node2.36166 > node3.49285: UDP, length 113
03:11:31.360038 IP node2.50518 > node3.49285: UDP, length 111
03:11:31.360089 IP node2.58185 > node3.49285: UDP, length 113
03:11:31.360507 IP node2.58256 > node3.49285: UDP, length 113
03:11:31.397615 IP node2.38620 > node3.60850: UDP, length 113
03:11:31.399266 IP node2.58256 > node3.60850: UDP, length 113
03:11:31.399858 IP node2.33739 > node3.60850: UDP, length 113
03:11:31.400390 IP node2.38768 > node3.60850: UDP, length 113
03:11:31.400692 IP node2.44193 > node3.60850: UDP, length 113
03:11:31.400806 IP node2.52006 > node3.60850: UDP, length 113
03:11:31.400998 IP node2.35844 > node3.60850: UDP, length 113
03:11:31.401078 IP node2.58185 > node3.60850: UDP, length 113
03:11:31.401158 IP node2.40826 > node3.60850: UDP, length 113
03:11:31.401230 IP node2.40433 > node3.60850: UDP, length 112
03:11:31.401299 IP node2.52599 > node3.60850: UDP, length 112
03:11:31.401375 IP node2.36166 > node3.60850: UDP, length 113
03:11:31.401447 IP node2.50518 > node3.60850: UDP, length 111
03:11:31.401800 IP node2.47170 > node3.60850: UDP, length 112
03:11:31.403054 IP node2.47792 > node3.60850: UDP, length 112
03:11:31.506056 IP node2.40826 > node4.36451: UDP, length 113
03:11:31.506223 IP node2.36166 > node4.36451: UDP, length 113
03:11:31.506512 IP node2.47170 > node4.36451: UDP, length 112
03:11:31.506654 IP node2.58256 > node4.36451: UDP, length 113
03:11:31.506960 IP node2.50518 > node4.36451: UDP, length 111
03:11:31.507092 IP node2.38768 > node4.36451: UDP, length 113
03:11:31.507188 IP node2.44193 > node4.36451: UDP, length 113
03:11:31.507274 IP node2.40433 > node4.36451: UDP, length 112
03:11:31.507431 IP node2.52599 > node4.36451: UDP, length 112
03:11:31.507552 IP node2.47792 > node4.36451: UDP, length 112
03:11:31.507631 IP node2.33739 > node4.36451: UDP, length 113
03:11:31.507814 IP node2.52006 > node4.36451: UDP, length 113
03:11:31.507948 IP node2.58185 > node4.36451: UDP, length 113
03:11:31.508549 IP node2.35844 > node4.36451: UDP, length 113
03:11:31.508743 IP node2.38620 > node4.36451: UDP, length 113
03:11:31.669767 IP node2.44193 > node4.59422: UDP, length 113
03:11:31.670439 IP node2.35844 > node4.59422: UDP, length 113
03:11:31.670500 IP node2.36166 > node4.59422: UDP, length 113
03:11:31.670682 IP node2.40826 > node4.59422: UDP, length 113
03:11:31.670800 IP node2.33739 > node4.59422: UDP, length 113
03:11:31.670877 IP node2.47170 > node4.59422: UDP, length 112
03:11:31.671020 IP node2.47792 > node4.59422: UDP, length 112
03:11:31.671167 IP node2.38768 > node4.59422: UDP, length 113
03:11:31.671242 IP node2.52006 > node4.59422: UDP, length 113
03:11:31.671409 IP node2.58185 > node4.59422: UDP, length 113
03:11:31.671624 IP node2.40433 > node4.59422: UDP, length 112
03:11:31.671816 IP node2.50518 > node4.59422: UDP, length 111
03:11:31.672163 IP node2.52599 > node4.59422: UDP, length 112
03:11:31.672411 IP node2.58256 > node4.59422: UDP, length 113
03:11:31.672489 IP node2.38620 > node4.59422: UDP, length 113
03:11:31.712228 IP node2.52599 > node4.51500: UDP, length 112
03:11:31.712667 IP node2.50518 > node4.51500: UDP, length 111
03:11:31.712865 IP node2.40826 > node4.51500: UDP, length 113
03:11:31.713132 IP node2.52006 > node4.51500: UDP, length 113
03:11:31.713196 IP node2.44193 > node4.51500: UDP, length 113
03:11:31.713273 IP node2.38620 > node4.51500: UDP, length 113
03:11:31.713352 IP node2.35844 > node4.51500: UDP, length 113
03:11:31.713432 IP node2.36166 > node4.51500: UDP, length 113
03:11:31.713558 IP node2.33739 > node4.51500: UDP, length 113
03:11:31.713754 IP node2.58185 > node4.51500: UDP, length 113
03:11:31.713947 IP node2.47170 > node4.51500: UDP, length 112
03:11:31.714189 IP node2.38768 > node4.51500: UDP, length 113
03:11:31.714323 IP node2.40433 > node4.51500: UDP, length 112
03:11:31.714695 IP node2.58256 > node4.51500: UDP, length 113
03:11:31.715152 IP node2.47792 > node4.51500: UDP, length 112
03:11:31.737334 IP node2.40826 > node1.44966: UDP, length 113
03:11:31.737827 IP node2.52006 > node1.44966: UDP, length 113
03:11:31.737903 IP node2.40433 > node1.44966: UDP, length 112
03:11:31.737985 IP node2.38620 > node1.44966: UDP, length 113
03:11:31.738059 IP node2.33739 > node1.44966: UDP, length 113
03:11:31.738110 IP node2.47170 > node1.44966: UDP, length 112
03:11:31.739693 IP node2.58185 > node1.44966: UDP, length 113
03:11:31.739773 IP node2.36166 > node1.44966: UDP, length 113
03:11:31.739857 IP node2.44193 > node1.44966: UDP, length 113
03:11:31.739915 IP node2.35844 > node1.44966: UDP, length 113
03:11:31.739987 IP node2.52599 > node1.44966: UDP, length 112
03:11:31.740063 IP node2.47792 > node1.44966: UDP, length 112
03:11:31.740131 IP node2.38768 > node1.44966: UDP, length 113
03:11:31.740202 IP node2.58256 > node1.44966: UDP, length 113
03:11:31.740272 IP node2.50518 > node1.44966: UDP, length 111
03:11:31.795332 IP node2.36166 > node4.58465: UDP, length 113
03:11:31.795539 IP node2.38620 > node4.58465: UDP, length 113
03:11:31.795654 IP node2.40826 > node4.58465: UDP, length 113
03:11:31.795805 IP node2.52599 > node4.58465: UDP, length 112
03:11:31.796189 IP node2.58185 > node4.58465: UDP, length 113
03:11:31.796258 IP node2.52006 > node4.58465: UDP, length 113
03:11:31.796336 IP node2.38768 > node4.58465: UDP, length 113
03:11:31.796410 IP node2.47170 > node4.58465: UDP, length 112
03:11:31.796556 IP node2.58256 > node4.58465: UDP, length 113
03:11:31.796622 IP node2.44193 > node4.58465: UDP, length 113
03:11:31.796693 IP node2.35844 > node4.58465: UDP, length 113
03:11:31.796772 IP node2.33739 > node4.58465: UDP, length 113
03:11:31.797136 IP node2.47792 > node4.58465: UDP, length 112
03:11:31.797268 IP node2.40433 > node4.58465: UDP, length 112
03:11:31.797612 IP node2.50518 > node4.58465: UDP, length 111
03:11:31.804602 IP node2.40433 > node1.36361: UDP, length 112
03:11:31.804679 IP node2.35844 > node1.36361: UDP, length 113
03:11:31.804889 IP node2.52006 > node1.36361: UDP, length 113
03:11:31.804943 IP node2.36166 > node1.36361: UDP, length 113
03:11:31.805123 IP node2.58256 > node1.36361: UDP, length 113
03:11:31.805253 IP node2.50518 > node1.36361: UDP, length 111
03:11:31.805322 IP node2.44193 > node1.36361: UDP, length 113
03:11:31.805516 IP node2.52599 > node1.36361: UDP, length 112
03:11:31.805635 IP node2.40826 > node1.36361: UDP, length 113
03:11:31.805731 IP node2.38768 > node1.36361: UDP, length 113
03:11:31.805826 IP node2.47170 > node1.36361: UDP, length 112
03:11:31.805917 IP node2.58185 > node1.36361: UDP, length 113
03:11:31.806005 IP node2.33739 > node1.36361: UDP, length 113
03:11:31.806090 IP node2.38620 > node1.36361: UDP, length 113
03:11:31.806281 IP node2.47792 > node1.36361: UDP, length 112
03:11:31.827225 IP node2.36166 > node4.49214: UDP, length 113
03:11:31.827328 IP node2.47170 > node4.49214: UDP, length 112
03:11:31.827607 IP node2.52599 > node4.49214: UDP, length 112
03:11:31.827798 IP node2.58256 > node4.49214: UDP, length 113
03:11:31.828016 IP node2.40433 > node4.49214: UDP, length 112
03:11:31.828140 IP node2.40826 > node4.49214: UDP, length 113
03:11:31.828328 IP node2.58185 > node4.49214: UDP, length 113
03:11:31.828416 IP node2.52006 > node4.49214: UDP, length 113
03:11:31.828498 IP node2.44193 > node4.49214: UDP, length 113
03:11:31.828629 IP node2.50518 > node4.49214: UDP, length 111
03:11:31.828767 IP node2.38620 > node4.49214: UDP, length 113
03:11:31.828839 IP node2.38768 > node4.49214: UDP, length 113
03:11:31.828944 IP node2.33739 > node4.49214: UDP, length 113
03:11:31.829023 IP node2.35844 > node4.49214: UDP, length 113
03:11:31.829389 IP node2.47792 > node4.49214: UDP, length 112
03:11:31.836691 IP node2.35844 > node1.43787: UDP, length 113
03:11:31.836819 IP node2.52006 > node1.43787: UDP, length 113
03:11:31.837015 IP node2.44193 > node1.43787: UDP, length 113
03:11:31.837120 IP node2.58256 > node1.43787: UDP, length 113
03:11:31.837381 IP node2.40826 > node1.43787: UDP, length 113
03:11:31.837451 IP node2.47170 > node1.43787: UDP, length 112
03:11:31.837668 IP node2.38768 > node1.43787: UDP, length 113
03:11:31.837731 IP node2.58185 > node1.43787: UDP, length 113
03:11:31.837818 IP node2.36166 > node1.43787: UDP, length 113
03:11:31.837881 IP node2.40433 > node1.43787: UDP, length 112
03:11:31.838259 IP node2.33739 > node1.43787: UDP, length 113
03:11:31.838590 IP node2.38620 > node1.43787: UDP, length 113
03:11:31.838777 IP node2.47792 > node1.43787: UDP, length 112
03:11:31.838915 IP node2.52599 > node1.43787: UDP, length 112
03:11:31.839144 IP node2.50518 > node1.43787: UDP, length 111
03:11:31.840347 IP node2.38768 > node4.38789: UDP, length 113
03:11:31.840583 IP node2.36166 > node4.38789: UDP, length 113
03:11:31.840780 IP node2.35844 > node4.38789: UDP, length 113
03:11:31.840912 IP node2.38620 > node4.38789: UDP, length 113
03:11:31.841008 IP node2.47170 > node4.38789: UDP, length 112
03:11:31.841121 IP node2.58256 > node4.38789: UDP, length 113
03:11:31.841183 IP node2.40826 > node4.38789: UDP, length 113
03:11:31.841338 IP node2.44193 > node4.38789: UDP, length 113
03:11:31.841407 IP node2.40433 > node4.38789: UDP, length 112
03:11:31.841459 IP node2.52599 > node4.38789: UDP, length 112
03:11:31.841533 IP node2.58185 > node4.38789: UDP, length 113
03:11:31.841609 IP node2.50518 > node4.38789: UDP, length 111
03:11:31.841804 IP node2.52006 > node4.38789: UDP, length 113
03:11:31.841898 IP node2.47792 > node4.38789: UDP, length 112
03:11:31.841983 IP node2.33739 > node4.38789: UDP, length 113
03:11:31.879224 IP node2.35844 > node4.44091: UDP, length 113
03:11:31.879298 IP node2.44193 > node4.44091: UDP, length 113
03:11:31.879671 IP node2.40826 > node4.44091: UDP, length 113
03:11:31.879872 IP node2.38768 > node4.44091: UDP, length 113
03:11:31.879961 IP node2.33739 > node4.44091: UDP, length 113
03:11:31.880039 IP node2.58256 > node4.44091: UDP, length 113
03:11:31.880204 IP node2.52006 > node4.44091: UDP, length 113
03:11:31.880462 IP node2.38620 > node4.44091: UDP, length 113
03:11:31.880601 IP node2.40433 > node4.44091: UDP, length 112
03:11:31.880784 IP node2.58185 > node4.44091: UDP, length 113
03:11:31.880851 IP node2.52599 > node4.44091: UDP, length 112
03:11:31.882093 IP node2.47170 > node4.44091: UDP, length 112
03:11:31.882156 IP node2.36166 > node4.44091: UDP, length 113
03:11:31.882445 IP node2.50518 > node4.44091: UDP, length 111
03:11:31.882555 IP node2.47792 > node4.44091: UDP, length 112
03:11:31.913333 IP node2.38620 > node4.40772: UDP, length 113
03:11:31.913488 IP node2.38768 > node4.40772: UDP, length 113
03:11:31.913979 IP node2.52006 > node4.40772: UDP, length 113
03:11:31.914264 IP node2.58256 > node4.40772: UDP, length 113
03:11:31.914503 IP node2.40433 > node4.40772: UDP, length 112
03:11:31.914864 IP node2.58185 > node4.40772: UDP, length 113
03:11:31.915767 IP node2.40826 > node4.40772: UDP, length 113
03:11:31.916173 IP node2.36166 > node4.40772: UDP, length 113
03:11:31.916919 IP node2.50518 > node4.40772: UDP, length 111
03:11:31.917205 IP node2.33739 > node4.40772: UDP, length 113
03:11:31.917287 IP node2.35844 > node4.40772: UDP, length 113
03:11:31.917440 IP node2.52599 > node4.40772: UDP, length 112
03:11:31.917519 IP node2.47792 > node4.40772: UDP, length 112
03:11:31.917651 IP node2.47170 > node4.40772: UDP, length 112
03:11:31.919451 IP node2.44193 > node4.40772: UDP, length 113
03:11:31.953045 IP node2.35844 > node1.33674: UDP, length 113
03:11:31.953752 IP node2.40826 > node1.33674: UDP, length 113
03:11:31.953866 IP node2.38620 > node1.33674: UDP, length 113
03:11:31.954197 IP node2.38768 > node1.33674: UDP, length 113
03:11:31.954266 IP node2.40433 > node1.33674: UDP, length 112
03:11:31.954515 IP node2.47170 > node1.33674: UDP, length 112
03:11:31.955341 IP node2.47792 > node1.33674: UDP, length 112
03:11:31.955625 IP node2.33739 > node1.33674: UDP, length 113
03:11:31.955759 IP node2.52599 > node1.33674: UDP, length 112
03:11:31.956011 IP node2.36166 > node1.33674: UDP, length 113
03:11:31.956302 IP node2.50518 > node1.33674: UDP, length 111
03:11:31.959888 IP node2.52006 > node1.33674: UDP, length 113
03:11:31.960263 IP node2.44193 > node1.33674: UDP, length 113
03:11:31.960523 IP node2.58185 > node1.33674: UDP, length 113
03:11:31.960598 IP node2.58256 > node1.33674: UDP, length 113
03:11:32.044907 IP node2.38768 > node4.38845: UDP, length 113
03:11:32.045441 IP node2.47792 > node4.38845: UDP, length 112
03:11:32.045669 IP node2.35844 > node4.38845: UDP, length 113
03:11:32.045731 IP node2.50518 > node4.38845: UDP, length 111
03:11:32.046144 IP node2.58256 > node4.38845: UDP, length 113
03:11:32.046322 IP node2.38620 > node4.38845: UDP, length 113
03:11:32.046574 IP node2.40826 > node4.38845: UDP, length 113
03:11:32.046703 IP node2.52599 > node4.38845: UDP, length 112
03:11:32.046924 IP node2.36166 > node4.38845: UDP, length 113
03:11:32.047055 IP node2.40433 > node4.38845: UDP, length 112
03:11:32.047298 IP node2.58185 > node4.38845: UDP, length 113
03:11:32.047604 IP node2.33739 > node4.38845: UDP, length 113
03:11:32.047756 IP node2.47170 > node4.38845: UDP, length 112
03:11:32.047878 IP node2.52006 > node4.38845: UDP, length 113
03:11:32.048230 IP node2.44193 > node4.38845: UDP, length 113
03:11:32.130184 IP node2.44193 > node4.36825: UDP, length 113
03:11:32.130324 IP node2.35844 > node4.36825: UDP, length 113
03:11:32.130789 IP node2.33739 > node4.36825: UDP, length 113
03:11:32.130977 IP node2.47792 > node4.36825: UDP, length 112
03:11:32.131837 IP node2.47170 > node4.36825: UDP, length 112
03:11:32.132533 IP node2.40433 > node4.36825: UDP, length 112
03:11:32.132620 IP node2.58256 > node4.36825: UDP, length 113
03:11:32.132940 IP node2.36166 > node4.36825: UDP, length 113
03:11:32.134405 IP node2.50518 > node4.36825: UDP, length 111
03:11:32.134475 IP node2.38620 > node4.36825: UDP, length 113
03:11:32.134875 IP node2.58185 > node4.36825: UDP, length 113
03:11:32.134928 IP node2.52006 > node4.36825: UDP, length 113
03:11:32.135963 IP node2.40826 > node4.36825: UDP, length 113
03:11:32.137378 IP node2.38768 > node4.36825: UDP, length 113
03:11:32.138468 IP node2.52599 > node4.36825: UDP, length 112
03:11:32.473662 IP node2.44193 > node1.55726: UDP, length 113
03:11:32.474243 IP node2.33739 > node1.55726: UDP, length 113
03:11:32.474491 IP node2.47792 > node1.55726: UDP, length 112
03:11:32.474967 IP node2.40433 > node1.55726: UDP, length 112
03:11:32.475164 IP node2.38768 > node1.55726: UDP, length 113
03:11:32.476293 IP node2.52599 > node1.55726: UDP, length 112
03:11:32.476599 IP node2.47170 > node1.55726: UDP, length 112
03:11:32.476696 IP node2.38620 > node1.55726: UDP, length 113
03:11:32.477058 IP node2.35844 > node1.55726: UDP, length 113
03:11:32.477171 IP node2.40826 > node1.55726: UDP, length 113
03:11:32.477245 IP node2.58185 > node1.55726: UDP, length 113
03:11:32.477443 IP node2.50518 > node1.55726: UDP, length 111
03:11:32.477804 IP node2.58256 > node1.55726: UDP, length 113
03:11:32.477876 IP node2.52006 > node1.55726: UDP, length 113
03:11:32.477967 IP node2.36166 > node1.55726: UDP, length 113
03:11:32.490973 IP node2.35844 > node1.56111: UDP, length 113
03:11:32.491334 IP node2.58256 > node1.56111: UDP, length 113
03:11:32.491379 IP node2.38620 > node1.56111: UDP, length 113
03:11:32.491858 IP node2.52006 > node1.56111: UDP, length 113
03:11:32.492178 IP node2.33739 > node1.56111: UDP, length 113
03:11:32.492310 IP node2.38768 > node1.56111: UDP, length 113
03:11:32.492667 IP node2.40433 > node1.56111: UDP, length 112
03:11:32.493553 IP node2.50518 > node1.56111: UDP, length 111
03:11:32.493691 IP node2.44193 > node1.56111: UDP, length 113
03:11:32.493949 IP node2.58185 > node1.56111: UDP, length 113
03:11:32.494559 IP node2.47170 > node1.56111: UDP, length 112
03:11:32.495898 IP node2.47792 > node1.56111: UDP, length 112
03:11:32.496018 IP node2.40826 > node1.56111: UDP, length 113
03:11:32.496220 IP node2.52599 > node1.56111: UDP, length 112
03:11:32.496455 IP node2.36166 > node1.56111: UDP, length 113
03:11:32.688337 IP node2.47792 > node1.42485: UDP, length 112
03:11:32.688770 IP node2.50518 > node1.42485: UDP, length 111
03:11:32.689712 IP node2.58185 > node1.42485: UDP, length 113
03:11:32.689937 IP node2.52599 > node1.42485: UDP, length 112
03:11:32.690468 IP node2.47170 > node1.42485: UDP, length 112
03:11:32.690626 IP node2.40826 > node1.42485: UDP, length 113
03:11:32.690943 IP node2.33739 > node1.42485: UDP, length 113
03:11:32.691023 IP node2.36166 > node1.42485: UDP, length 113
03:11:32.691327 IP node2.38768 > node1.42485: UDP, length 113
03:11:32.691709 IP node2.44193 > node1.42485: UDP, length 113
03:11:32.691869 IP node2.38620 > node1.42485: UDP, length 113
03:11:32.691983 IP node2.58256 > node1.42485: UDP, length 113
03:11:32.692821 IP node2.40433 > node1.42485: UDP, length 112
03:11:32.692892 IP node2.35844 > node1.42485: UDP, length 113
03:11:32.696622 IP node2.52006 > node1.42485: UDP, length 113
03:11:33.010498 IP node2.40826 > node1.32830: UDP, length 113
03:11:33.010682 IP node2.38768 > node1.32830: UDP, length 113
03:11:33.010770 IP node2.38620 > node1.32830: UDP, length 113
03:11:33.010970 IP node2.47792 > node1.32830: UDP, length 112
03:11:33.011144 IP node2.36166 > node1.32830: UDP, length 113
03:11:33.011423 IP node2.58256 > node1.32830: UDP, length 113
03:11:33.011618 IP node2.52599 > node1.32830: UDP, length 112
03:11:33.011683 IP node2.52006 > node1.32830: UDP, length 113
03:11:33.011938 IP node2.50518 > node1.32830: UDP, length 111
03:11:33.011986 IP node2.44193 > node1.32830: UDP, length 113
03:11:33.012554 IP node2.47170 > node1.32830: UDP, length 112
03:11:33.013444 IP node2.35844 > node1.32830: UDP, length 113
03:11:33.013693 IP node2.58185 > node1.32830: UDP, length 113
03:11:33.014432 IP node2.40433 > node1.32830: UDP, length 112
03:11:33.014769 IP node2.33739 > node1.32830: UDP, length 113
03:11:33.108653 IP node2.38620 > node1.53733: UDP, length 113
03:11:33.109035 IP node2.52006 > node1.53733: UDP, length 113
03:11:33.109191 IP node2.38768 > node1.53733: UDP, length 113
03:11:33.109369 IP node2.52599 > node1.53733: UDP, length 112
03:11:33.109604 IP node2.50518 > node1.53733: UDP, length 111
03:11:33.109686 IP node2.58185 > node1.53733: UDP, length 113
03:11:33.109764 IP node2.58256 > node1.53733: UDP, length 113
03:11:33.109843 IP node2.40826 > node1.53733: UDP, length 113
03:11:33.110534 IP node2.40433 > node1.53733: UDP, length 112
03:11:33.111094 IP node2.35844 > node1.53733: UDP, length 113
03:11:33.111372 IP node2.47170 > node1.53733: UDP, length 112
03:11:33.111885 IP node2.47792 > node1.53733: UDP, length 112
03:11:33.112322 IP node2.33739 > node1.53733: UDP, length 113
03:11:33.113355 IP node2.44193 > node1.53733: UDP, length 113
03:11:33.116160 IP node2.36166 > node1.53733: UDP, length 113
03:11:33.208970 IP node2.36166 > node1.34167: UDP, length 113
03:11:33.209742 IP node2.47792 > node1.34167: UDP, length 112
03:11:33.209914 IP node2.38620 > node1.34167: UDP, length 113
03:11:33.210389 IP node2.58185 > node1.34167: UDP, length 113
03:11:33.211058 IP node2.33739 > node1.34167: UDP, length 113
03:11:33.211434 IP node2.40826 > node1.34167: UDP, length 113
03:11:33.211681 IP node2.58256 > node1.34167: UDP, length 113
03:11:33.211827 IP node2.38768 > node1.34167: UDP, length 113
03:11:33.212113 IP node2.47170 > node1.34167: UDP, length 112
03:11:33.212396 IP node2.50518 > node1.34167: UDP, length 111
03:11:33.212659 IP node2.52006 > node1.34167: UDP, length 113
03:11:33.212730 IP node2.40433 > node1.34167: UDP, length 112
03:11:33.213332 IP node2.44193 > node1.34167: UDP, length 113
03:11:33.213657 IP node2.52599 > node1.34167: UDP, length 112
03:11:33.213874 IP node2.35844 > node1.34167: UDP, length 113
03:11:33.278614 IP node2.36166 > node1.35563: UDP, length 113
03:11:33.279066 IP node2.52006 > node1.35563: UDP, length 113
03:11:33.279302 IP node2.40826 > node1.35563: UDP, length 113
03:11:33.279379 IP node2.47792 > node1.35563: UDP, length 112
03:11:33.279859 IP node2.33739 > node1.35563: UDP, length 113
03:11:33.279948 IP node2.38620 > node1.35563: UDP, length 113
03:11:33.280355 IP node2.44193 > node1.35563: UDP, length 113
03:11:33.280443 IP node2.38768 > node1.35563: UDP, length 113
03:11:33.280567 IP node2.47170 > node1.35563: UDP, length 112
03:11:33.280856 IP node2.58256 > node1.35563: UDP, length 113
03:11:33.280914 IP node2.35844 > node1.35563: UDP, length 113
03:11:33.281159 IP node2.52599 > node1.35563: UDP, length 112
03:11:33.281419 IP node2.58185 > node1.35563: UDP, length 113
03:11:33.281606 IP node2.50518 > node1.35563: UDP, length 111
03:11:33.282030 IP node2.40433 > node1.35563: UDP, length 112
03:11:33.303232 IP node2.36166 > node1.34167: UDP, length 235
03:11:33.303432 IP node2.36166 > node1.53733: UDP, length 235
03:11:33.353801 IP node2.40433 > node1.53733: UDP, length 87
03:11:33.362908 IP node2.36166 > node1.53733: UDP, length 71
