03:11:34.059420 IP node1.33333 > node3.33617: UDP, length 113
03:11:34.091089 IP node1.33333 > node3.56938: UDP, length 113
03:11:34.091336 IP node1.33333 > node3.52099: UDP, length 113
03:11:34.091490 IP node1.33333 > node3.56677: UDP, length 113
03:11:34.178539 IP node1.33333 > node3.42227: UDP, length 113
03:11:34.203691 IP node1.33333 > node3.57155: UDP, length 113
03:11:34.237886 IP node1.33333 > node3.35550: UDP, length 113
03:11:34.375738 IP node1.33333 > node4.36486: UDP, length 113
03:11:34.396510 IP node1.40064 > node3.56677: UDP, length 113
03:11:34.396909 IP node1.40064 > node3.42227: UDP, length 113
03:11:34.410918 IP node1.33333 > node4.48590: UDP, length 113
03:11:34.413814 IP node1.40064 > node3.57155: UDP, length 113
03:11:34.414062 IP node1.40064 > node3.35550: UDP, length 113
03:11:34.438473 IP node1.40064 > node4.48590: UDP, length 113
03:11:34.438732 IP node1.40064 > node4.36486: UDP, length 113
03:11:34.509628 IP node1.33333 > node3.52635: UDP, length 113
03:11:34.509787 IP node1.40064 > node3.52635: UDP, length 113
03:11:34.574437 IP node1.40064 > node3.48193: UDP, length 113
03:11:34.576391 IP node1.33333 > node3.48193: UDP, length 113
03:11:34.592009 IP node1.33333 > node4.44113: UDP, length 113
03:11:34.592655 IP node1.40064 > node4.44113: UDP, length 113
03:11:34.602753 IP node1.40064 > node3.60133: UDP, length 113
03:11:34.603304 IP node1.33333 > node3.60133: UDP, length 113
03:11:34.625420 IP node1.33333 > node4.36499: UDP, length 113
03:11:34.625678 IP node1.40064 > node4.36499: UDP, length 113
03:11:34.657196 IP node1.40064 > node3.35498: UDP, length 113
03:11:34.657351 IP node1.33333 > node3.35498: UDP, length 113
03:11:34.747150 IP node1.40064 > node4.58460: UDP, length 113
03:11:34.747345 IP node1.33333 > node4.58460: UDP, length 113
03:11:34.767502 IP node1.33333 > node3.49285: UDP, length 113
03:11:34.768898 IP node1.40064 > node3.49285: UDP, length 113
03:11:34.806639 IP node1.40064 > node3.60850: UDP, length 113
03:11:34.806758 IP node1.33333 > node3.60850: UDP, length 113
03:11:34.916183 IP node1.33333 > node4.36451: UDP, length 113
03:11:34.916652 IP node1.40064 > node4.36451: UDP, length 113
03:11:35.080450 IP node1.40064 > node4.59422: UDP, length 113
03:11:35.080643 IP node1.33333 > node4.59422: UDP, length 113
03:11:35.123217 IP node1.40064 > node4.51500: UDP, length 113
03:11:35.123557 IP node1.33333 > node4.51500: UDP, length 113
03:11:35.209246 IP node1.40064 > node4.58465: UDP, length 113
03:11:35.209688 IP node1.33333 > node4.58465: UDP, length 113
03:11:35.239388 IP node1.40064 > node4.49214: UDP, length 113
03:11:35.239814 IP node1.33333 > node4.49214: UDP, length 113
03:11:35.243246 IP node1.36361 > node4.36451: UDP, length 112
03:11:35.244465 IP node1.36361 > node4.59422: UDP, length 112
03:11:35.247608 IP node1.36361 > node3.60850: UDP, length 112
03:11:35.249390 IP node1.36361 > node4.58465: UDP, length 112
03:11:35.252440 IP node1.40064 > node4.38789: UDP, length 113
03:11:35.252668 IP node1.33333 > node4.38789: UDP, length 113
03:11:35.259723 IP node1.44966 > node4.59422: UDP, length 113
03:11:35.259883 IP node1.44966 > node4.36451: UDP, length 113
03:11:35.260048 IP node1.44966 > node4.58465: UDP, length 113
03:11:35.263414 IP node1.44966 > node4.51500: UDP, length 113
03:11:35.275535 IP node1.44966 > node4.49214: UDP, length 113
03:11:35.275653 IP node1.44966 > node4.38789: UDP, length 113
03:11:35.276558 IP node1.36361 > node4.51500: UDP, length 112
03:11:35.290476 IP node1.43787 > node4.59422: UDP, length 113
03:11:35.291359 IP node1.40064 > node4.44091: UDP, length 113
03:11:35.291768 IP node1.33333 > node4.44091: UDP, length 113
03:11:35.293136 IP node1.44966 > node4.44091: UDP, length 113
03:11:35.308582 IP node1.43787 > node4.51500: UDP, length 113
03:11:35.311172 IP node1.36361 > node4.44091: UDP, length 112
03:11:35.311352 IP node1.36361 > node4.49214: UDP, length 112
03:11:35.311458 IP node1.36361 > node4.38789: UDP, length 112
03:11:35.314486 IP node1.43787 > node4.58465: UDP, length 113
03:11:35.315630 IP node1.43787 > node4.49214: UDP, length 113
03:11:35.316751 IP node1.43787 > node4.38789: UDP, length 113
03:11:35.320735 IP node1.43787 > node4.44091: UDP, length 113
03:11:35.328277 IP node1.44966 > node4.40772: UDP, length 113
03:11:35.328963 IP node1.33333 > node4.40772: UDP, length 113
03:11:35.329861 IP node1.43787 > node4.40772: UDP, length 113
03:11:35.330950 IP node1.40064 > node4.40772: UDP, length 113
03:11:35.337619 IP node1.36361 > node4.40772: UDP, length 112
03:11:35.402900 IP node1.33674 > node4.44091: UDP, length 112
03:11:35.403211 IP node1.33674 > node4.49214: UDP, length 112
03:11:35.403309 IP node1.33674 > node4.58465: UDP, length 112
03:11:35.403397 IP node1.33674 > node4.38789: UDP, length 112
03:11:35.403484 IP node1.33674 > node4.40772: UDP, length 112
03:11:35.454845 IP node1.43787 > node4.38845: UDP, length 113
03:11:35.455224 IP node1.33674 > node4.38845: UDP, length 112
03:11:35.458561 IP node1.44966 > node4.38845: UDP, length 113
03:11:35.461555 IP node1.36361 > node4.38845: UDP, length 112
03:11:35.462324 IP node1.33333 > node4.38845: UDP, length 113
03:11:35.462779 IP node1.40064 > node4.38845: UDP, length 113
03:11:35.541414 IP node1.33674 > node4.36825: UDP, length 112
03:11:35.544120 IP node1.36361 > node4.36825: UDP, length 112
03:11:35.545820 IP node1.43787 > node4.36825: UDP, length 113
03:11:35.546085 IP node1.44966 > node4.36825: UDP, length 113
03:11:35.546434 IP node1.40064 > node4.36825: UDP, length 113
03:11:35.546919 IP node1.33333 > node4.36825: UDP, length 113
03:11:35.910968 IP node1.56111 > node4.38845: UDP, length 113
03:11:35.911381 IP node1.56111 > node4.36825: UDP, length 113
03:11:36.107767 IP node1.43787 > node2.52006: UDP, length 113
03:11:36.108379 IP node1.44966 > node2.52006: UDP, length 113
03:11:36.111234 IP node1.40064 > node2.52006: UDP, length 113
03:11:36.111559 IP node1.55726 > node2.52006: UDP, length 113
03:11:36.111720 IP node1.33333 > node2.52006: UDP, length 113
03:11:36.112044 IP node1.33674 > node2.52006: UDP, length 112
03:11:36.113512 IP node1.56111 > node2.52006: UDP, length 113
03:11:36.115220 IP node1.36361 > node2.52006: UDP, length 112
03:11:36.153993 IP node1.42485 > node4.36825: UDP, length 113
03:11:36.214610 IP node1.42485 > node2.52006: UDP, length 113
03:11:36.366171 IP node1.42485 > node2.33739: UDP, length 113
03:11:36.367611 IP node1.44966 > node2.33739: UDP, length 113
03:11:36.367902 IP node1.43787 > node2.33739: UDP, length 113
03:11:36.368117 IP node1.33674 > node2.33739: UDP, length 112
03:11:36.369219 IP node1.55726 > node2.33739: UDP, length 113
03:11:36.369453 IP node1.56111 > node2.33739: UDP, length 113
03:11:36.369647 IP node1.36361 > node2.33739: UDP, length 112
03:11:36.369833 IP node1.40064 > node2.33739: UDP, length 113
03:11:36.370045 IP node1.33333 > node2.33739: UDP, length 113
03:11:36.384799 IP node1.42485 > node2.47170: UDP, length 113
03:11:36.385123 IP node1.55726 > node2.47170: UDP, length 113
03:11:36.385726 IP node1.43787 > node2.47170: UDP, length 113
03:11:36.387186 IP node1.44966 > node2.47170: UDP, length 113
03:11:36.396127 IP node1.40064 > node2.47170: UDP, length 113
03:11:36.396298 IP node1.36361 > node2.47170: UDP, length 112
03:11:36.396985 IP node1.33674 > node2.47170: UDP, length 112
03:11:36.397120 IP node1.56111 > node2.47170: UDP, length 113
03:11:36.397829 IP node1.33333 > node2.47170: UDP, length 113
03:11:36.419246 IP node1.32830 > node2.33739: UDP, length 113
03:11:36.419460 IP node1.32830 > node2.47170: UDP, length 113
03:11:36.429284 IP node1.32830 > node2.52006: UDP, length 113
03:11:36.449937 IP node1.42485 > node2.38768: UDP, length 113
03:11:36.450277 IP node1.43787 > node2.38768: UDP, length 113
03:11:36.450798 IP node1.36361 > node2.38768: UDP, length 112
03:11:36.451153 IP node1.44966 > node2.38768: UDP, length 113
03:11:36.451603 IP node1.55726 > node2.38768: UDP, length 113
03:11:36.453137 IP node1.33674 > node2.38768: UDP, length 112
03:11:36.453982 IP node1.56111 > node2.38768: UDP, length 113
03:11:36.456142 IP node1.33333 > node2.38768: UDP, length 113
03:11:36.456366 IP node1.33333 > node2.50518: UDP, length 113
03:11:36.456661 IP node1.40064 > node2.38768: UDP, length 113
03:11:36.456938 IP node1.43787 > node2.50518: UDP, length 113
03:11:36.457575 IP node1.44966 > node2.50518: UDP, length 113
03:11:36.458526 IP node1.33674 > node2.50518: UDP, length 112
03:11:36.459311 IP node1.40064 > node2.50518: UDP, length 113
03:11:36.461042 IP node1.42485 > node2.50518: UDP, length 113
03:11:36.461823 IP node1.55726 > node2.50518: UDP, length 113
03:11:36.463378 IP node1.56111 > node2.50518: UDP, length 113
03:11:36.463592 IP node1.36361 > node2.50518: UDP, length 112
03:11:36.493369 IP node1.32830 > node2.38768: UDP, length 113
03:11:36.493578 IP node1.32830 > node2.50518: UDP, length 113
03:11:36.546732 IP node1.43787 > node2.58185: UDP, length 113
03:11:36.551116 IP node1.42485 > node2.58185: UDP, length 113
03:11:36.559884 IP node1.36361 > node2.58185: UDP, length 112
03:11:36.560414 IP node1.32830 > node2.58185: UDP, length 113
03:11:36.566729 IP node1.44966 > node2.58185: UDP, length 113
03:11:36.567014 IP node1.55726 > node2.58185: UDP, length 113
03:11:36.569093 IP node1.53733 > node2.47170: UDP, length 112
03:11:36.569313 IP node1.53733 > node2.33739: UDP, length 112
03:11:36.574072 IP node1.40064 > node2.58185: UDP, length 113
03:11:36.574246 IP node1.33674 > node2.58185: UDP, length 112
03:11:36.579699 IP node1.33333 > node2.58185: UDP, length 113
03:11:36.592247 IP node1.53733 > node2.38768: UDP, length 112
03:11:36.592518 IP node1.53733 > node2.50518: UDP, length 112
03:11:36.598351 IP node1.33674 > node2.40433: UDP, length 112
03:11:36.599511 IP node1.43787 > node2.40433: UDP, length 113
03:11:36.599808 IP node1.44966 > node2.40433: UDP, length 113
03:11:36.605021 IP node1.36361 > node2.40433: UDP, length 112
03:11:36.605390 IP node1.33333 > node2.40433: UDP, length 113
03:11:36.607065 IP node1.32830 > node2.40433: UDP, length 113
03:11:36.608135 IP node1.42485 > node2.40433: UDP, length 113
03:11:36.610915 IP node1.40064 > node2.40433: UDP, length 113
03:11:36.614341 IP node1.56111 > node2.40433: UDP, length 113
03:11:36.624404 IP node1.55726 > node2.40433: UDP, length 113
03:11:36.625516 IP node1.56111 > node2.58185: UDP, length 113
03:11:36.635282 IP node1.53733 > node2.58185: UDP, length 112
03:11:36.635670 IP node1.53733 > node2.36166: UDP, length 94
03:11:36.635874 IP node1.53733 > node2.40433: UDP, length 112
03:11:36.643489 IP node1.34167 > node2.38768: UDP, length 113
03:11:36.643766 IP node1.34167 > node2.47170: UDP, length 113
03:11:36.644130 IP node1.34167 > node2.33739: UDP, length 113
03:11:36.644358 IP node1.34167 > node2.50518: UDP, length 113
03:11:36.666223 IP node1.34167 > node2.58185: UDP, length 113
03:11:36.666443 IP node1.34167 > node2.40433: UDP, length 113
03:11:36.672383 IP node1.34167 > node2.36166: UDP, length 94
03:11:36.686145 IP node1.35563 > node2.38768: UDP, length 113
03:11:36.686929 IP node1.35563 > node2.47170: UDP, length 113
03:11:36.687037 IP node1.35563 > node2.50518: UDP, length 113
03:11:36.687324 IP node1.35563 > node2.33739: UDP, length 113
03:11:36.736472 IP node1.42485 > node2.35844: UDP, length 113
03:11:36.736569 IP node1.33333 > node2.35844: UDP, length 113
03:11:36.737498 IP node1.32830 > node2.35844: UDP, length 113
03:11:36.738384 IP node1.33674 > node2.35844: UDP, length 112
03:11:36.738664 IP node1.34167 > node2.35844: UDP, length 113
03:11:36.739055 IP node1.55726 > node2.35844: UDP, length 113
03:11:36.740515 IP node1.44966 > node2.35844: UDP, length 113
03:11:36.740572 IP node1.43787 > node2.35844: UDP, length 113
03:11:36.745122 IP node1.56111 > node2.35844: UDP, length 113
03:11:36.755514 IP node1.35563 > node2.36166: UDP, length 94
03:11:36.767157 IP node1.53733 > node2.40433: UDP, length 94
03:11:36.767865 IP node1.35563 > node2.58185: UDP, length 113
03:11:36.769322 IP node1.35563 > node2.40433: UDP, length 113
03:11:36.769439 IP node1.35563 > node2.35844: UDP, length 113
03:11:36.771814 IP node1.40064 > node2.35844: UDP, length 113
03:11:36.774437 IP node1.53733 > node2.35844: UDP, length 112
03:11:36.778982 IP node1.36361 > node2.35844: UDP, length 112
03:11:36.802823 IP node1.53733 > node2.36166: UDP, length 71
03:11:36.810122 IP node1.34167 > node2.36166: UDP, length 71
03:11:36.811851 IP node1.34167 > node2.36166: UDP, length 71
03:11:36.845014 IP node1.32830 > node2.58256: UDP, length 113
03:11:36.845610 IP node1.35563 > node2.58256: UDP, length 113
03:11:36.847326 IP node1.33674 > node2.58256: UDP, length 112
03:11:36.848280 IP node1.36361 > node2.58256: UDP, length 112
03:11:36.848614 IP node1.43787 > node2.58256: UDP, length 113
03:11:36.848713 IP node1.34167 > node2.58256: UDP, length 113
03:11:36.848763 IP node1.40064 > node2.58256: UDP, length 113
03:11:36.849129 IP node1.44966 > node2.58256: UDP, length 113
03:11:36.850035 IP node1.56111 > node2.58256: UDP, length 113
03:11:36.857686 IP node1.53733 > node2.58256: UDP, length 112
03:11:36.859263 IP node1.33333 > node2.58256: UDP, length 113
03:11:36.860251 IP node1.42485 > node2.58256: UDP, length 113
03:11:36.860663 IP node1.55726 > node2.58256: UDP, length 113
03:11:36.872081 IP node1.50324 > node2.35844: UDP, length 113
03:11:36.872349 IP node1.50324 > node2.58256: UDP, length 113
03:11:36.883071 IP node1.53733 > node2.36166: UDP, length 78
03:11:36.900788 IP node1.50324 > node2.36166: UDP, length 94
03:11:36.901263 IP node1.34167 > node2.36166: UDP, length 78
03:11:36.918237 IP node1.32830 > node3.43587: UDP, length 113
03:11:36.919938 IP node1.33674 > node3.43587: UDP, length 112
03:11:36.922257 IP node1.56111 > node3.43587: UDP, length 113
03:11:36.922642 IP node1.33333 > node3.43587: UDP, length 113
03:11:36.922807 IP node1.35563 > node3.43587: UDP, length 113
03:11:36.922857 IP node1.44966 > node3.43587: UDP, length 113
03:11:36.923307 IP node1.36361 > node3.43587: UDP, length 112
03:11:36.924708 IP node1.43787 > node3.43587: UDP, length 113
03:11:36.925228 IP node1.42485 > node3.43587: UDP, length 113
03:11:36.925525 IP node1.40064 > node3.43587: UDP, length 113
03:11:36.925732 IP node1.53733 > node3.43587: UDP, length 112
03:11:36.926090 IP node1.34167 > node3.43587: UDP, length 113
03:11:36.927201 IP node1.50324 > node3.43587: UDP, length 113
03:11:36.928553 IP node1.55726 > node3.43587: UDP, length 113
03:11:36.974024 IP node1.53733 > node2.36166: UDP, length 78
03:11:36.979713 IP node1.32830 > node3.34474: UDP, length 113
03:11:36.980037 IP node1.56111 > node3.34474: UDP, length 113
03:11:36.981092 IP node1.34167 > node3.34474: UDP, length 113
03:11:36.981173 IP node1.43787 > node3.34474: UDP, length 113
03:11:36.981235 IP node1.40064 > node3.34474: UDP, length 113
03:11:36.981492 IP node1.35563 > node3.34474: UDP, length 113
03:11:36.981824 IP node1.42485 > node3.34474: UDP, length 113
03:11:36.981987 IP node1.44966 > node3.34474: UDP, length 113
03:11:36.983085 IP node1.36361 > node3.34474: UDP, length 112
03:11:36.985011 IP node1.55726 > node3.34474: UDP, length 113
03:11:36.985659 IP node1.50324 > node3.34474: UDP, length 113
03:11:36.986573 IP node1.53733 > node3.34474: UDP, length 112
03:11:36.989084 IP node1.33674 > node3.34474: UDP, length 112
03:11:36.989269 IP node1.33333 > node3.34474: UDP, length 113
03:11:37.004258 IP node1.34167 > node2.36166: UDP, length 78
03:11:37.004917 IP node1.50406 > node2.58256: UDP, length 113
03:11:37.005724 IP node1.50406 > node3.43587: UDP, length 113
03:11:37.025542 IP node1.50406 > node3.34474: UDP, length 113
03:11:37.029061 IP node1.50324 > node2.58256: UDP, length 94
03:11:37.041449 IP node1.35563 > node2.36166: UDP, length 71
03:11:37.049729 IP node1.50406 > node2.36166: UDP, length 94
03:11:37.073482 IP node1.43787 > node2.44193: UDP, length 113
03:11:37.073922 IP node1.44966 > node2.44193: UDP, length 113
03:11:37.074595 IP node1.42485 > node2.44193: UDP, length 113
03:11:37.075120 IP node1.56111 > node2.44193: UDP, length 113
03:11:37.075163 IP node1.40064 > node2.44193: UDP, length 113
03:11:37.075245 IP node1.55726 > node2.44193: UDP, length 113
03:11:37.076143 IP node1.33674 > node2.44193: UDP, length 112
03:11:37.076792 IP node1.34167 > node2.44193: UDP, length 113
03:11:37.076927 IP node1.53733 > node2.44193: UDP, length 112
03:11:37.076971 IP node1.33333 > node2.44193: UDP, length 113
03:11:37.077242 IP node1.32830 > node2.44193: UDP, length 113
03:11:37.077549 IP node1.50406 > node2.44193: UDP, length 113
03:11:37.079356 IP node1.36361 > node2.44193: UDP, length 112
03:11:37.079712 IP node1.35563 > node2.44193: UDP, length 113
03:11:37.085325 IP node1.50324 > node2.36166: UDP, length 71
03:11:37.087638 IP node1.44966 > node2.52599: UDP, length 113
03:11:37.087848 IP node1.43787 > node2.52599: UDP, length 113
03:11:37.088443 IP node1.53733 > node2.52599: UDP, length 112
03:11:37.088711 IP node1.34167 > node2.52599: UDP, length 113
03:11:37.088851 IP node1.56111 > node2.52599: UDP, length 113
03:11:37.089004 IP node1.50406 > node2.52599: UDP, length 113
03:11:37.089098 IP node1.32830 > node2.52599: UDP, length 113
03:11:37.090466 IP node1.33333 > node2.52599: UDP, length 113
03:11:37.091701 IP node1.55726 > node2.52599: UDP, length 113
03:11:37.091810 IP node1.42485 > node2.52599: UDP, length 113
03:11:37.092386 IP node1.33674 > node2.52599: UDP, length 112
03:11:37.092880 IP node1.40064 > node2.52599: UDP, length 113
03:11:37.093126 IP node1.35563 > node2.52599: UDP, length 113
03:11:37.093211 IP node1.36361 > node2.52599: UDP, length 112
03:11:37.097274 IP node1.50324 > node2.52599: UDP, length 113
03:11:37.099278 IP node1.50324 > node2.36166: UDP, length 71
03:11:37.100984 IP node1.50324 > node2.44193: UDP, length 113
03:11:37.105747 IP node1.33674 > node2.38620: UDP, length 112
03:11:37.105948 IP node1.43787 > node2.38620: UDP, length 113
03:11:37.106618 IP node1.42485 > node2.38620: UDP, length 113
03:11:37.107546 IP node1.53733 > node2.38620: UDP, length 112
03:11:37.108152 IP node1.55726 > node2.38620: UDP, length 113
03:11:37.108422 IP node1.32830 > node2.38620: UDP, length 113
03:11:37.108591 IP node1.35563 > node2.38620: UDP, length 113
03:11:37.108901 IP node1.44966 > node2.38620: UDP, length 113
03:11:37.108969 IP node1.56111 > node2.38620: UDP, length 113
03:11:37.109186 IP node1.50406 > node2.38620: UDP, length 113
03:11:37.109382 IP node1.40064 > node2.38620: UDP, length 113
03:11:37.109429 IP node1.36361 > node2.38620: UDP, length 112
03:11:37.109788 IP node1.34167 > node2.38620: UDP, length 113
03:11:37.110496 IP node1.33333 > node2.38620: UDP, length 113
03:11:37.111147 IP node1.50324 > node2.38620: UDP, length 113
03:11:37.129615 IP node1.35563 > node2.36166: UDP, length 78
03:11:37.138285 IP node1.50324 > node2.36166: UDP, length 78
03:11:37.153642 IP node1.50406 > node2.40826: UDP, length 113
03:11:37.154707 IP node1.42485 > node2.40826: UDP, length 113
03:11:37.154914 IP node1.56111 > node2.40826: UDP, length 113
03:11:37.155004 IP node1.32830 > node2.40826: UDP, length 113
03:11:37.155184 IP node1.34167 > node2.40826: UDP, length 113
03:11:37.155255 IP node1.43787 > node2.40826: UDP, length 113
03:11:37.155311 IP node1.53733 > node2.40826: UDP, length 112
03:11:37.155560 IP node1.44966 > node2.40826: UDP, length 113
03:11:37.155622 IP node1.55726 > node2.40826: UDP, length 113
03:11:37.155697 IP node1.33674 > node2.40826: UDP, length 112
03:11:37.155961 IP node1.35563 > node2.40826: UDP, length 113
03:11:37.156142 IP node1.33333 > node2.40826: UDP, length 113
03:11:37.156364 IP node1.40064 > node2.40826: UDP, length 113
03:11:37.156537 IP node1.36361 > node2.40826: UDP, length 112
03:11:37.156750 IP node1.50324 > node2.40826: UDP, length 113
03:11:37.176125 IP node1.53733 > node2.36166: UDP, length 71
03:11:37.183021 IP node1.43787 > node2.47792: UDP, length 113
03:11:37.183126 IP node1.53733 > node2.47792: UDP, length 112
03:11:37.183795 IP node1.50406 > node2.47792: UDP, length 113
03:11:37.183908 IP node1.40064 > node2.47792: UDP, length 113
03:11:37.184056 IP node1.44966 > node2.47792: UDP, length 113
03:11:37.184626 IP node1.42485 > node2.47792: UDP, length 113
03:11:37.185215 IP node1.33333 > node2.47792: UDP, length 113
03:11:37.185297 IP node1.32830 > node2.47792: UDP, length 113
03:11:37.185440 IP node1.56111 > node2.47792: UDP, length 113
03:11:37.185569 IP node1.36361 > node2.47792: UDP, length 112
03:11:37.185733 IP node1.33674 > node2.47792: UDP, length 112
03:11:37.185917 IP node1.55726 > node2.47792: UDP, length 113
03:11:37.186039 IP node1.35563 > node2.47792: UDP, length 113
03:11:37.186948 IP node1.34167 > node2.47792: UDP, length 113
03:11:37.187125 IP node1.50324 > node2.47792: UDP, length 113
03:11:37.204370 IP node1.34167 > node2.36166: UDP, length 78
03:11:37.207483 IP node1.53733 > node2.36166: UDP, length 78
03:11:37.216256 IP node1.35563 > node2.36166: UDP, length 78
03:11:37.239874 IP node1.50324 > node2.36166: UDP, length 78
03:11:37.258718 IP node1.50406 > node2.36166: UDP, length 71
03:11:37.279706 IP node1.50406 > node2.36166: UDP, length 71
03:11:37.314010 IP node1.43787 > node3.52099: UDP, length 113
03:11:37.314219 IP node1.55726 > node3.52099: UDP, length 113
03:11:37.314277 IP node1.33333 > node3.52099: UDP, length 113
03:11:37.314840 IP node1.35563 > node3.52099: UDP, length 113
03:11:37.315673 IP node1.36361 > node3.52099: UDP, length 112
03:11:37.317334 IP node1.40064 > node3.52099: UDP, length 113
03:11:37.317408 IP node1.50324 > node3.52099: UDP, length 113
03:11:37.317709 IP node1.33674 > node3.52099: UDP, length 112
03:11:37.317766 IP node1.42485 > node3.52099: UDP, length 113
03:11:37.318001 IP node1.33333 > node3.33617: UDP, length 113
03:11:37.318194 IP node1.43787 > node3.33617: UDP, length 113
03:11:37.318774 IP node1.50406 > node3.33617: UDP, length 113
03:11:37.318898 IP node1.42485 > node3.33617: UDP, length 113
03:11:37.319232 IP node1.56111 > node3.33617: UDP, length 113
03:11:37.319624 IP node1.34167 > node3.52099: UDP, length 113
03:11:37.319690 IP node1.44966 > node3.52099: UDP, length 113
03:11:37.319748 IP node1.53733 > node3.52099: UDP, length 112
03:11:37.319805 IP node1.53733 > node3.33617: UDP, length 112
03:11:37.320334 IP node1.34167 > node3.33617: UDP, length 113
03:11:37.321047 IP node1.44966 > node3.33617: UDP, length 113
03:11:37.321170 IP node1.36361 > node3.33617: UDP, length 112
03:11:37.321691 IP node1.40064 > node3.33617: UDP, length 113
03:11:37.321778 IP node1.56111 > node3.52099: UDP, length 113
03:11:37.322669 IP node1.35563 > node3.33617: UDP, length 113
03:11:37.323225 IP node1.50406 > node3.52099: UDP, length 113
03:11:37.323771 IP node1.32830 > node3.52099: UDP, length 113
03:11:37.323873 IP node1.32830 > node3.33617: UDP, length 113
03:11:37.324362 IP node1.33674 > node3.33617: UDP, length 112
03:11:37.326421 IP node1.50324 > node3.33617: UDP, length 113
03:11:37.329605 IP node1.55726 > node3.33617: UDP, length 113
03:11:37.332933 IP node1.50406 > node2.36166: UDP, length 78
03:11:37.388764 IP node1.33333 > node3.56938: UDP, length 113
03:11:37.389071 IP node1.34167 > node3.56938: UDP, length 113
03:11:37.389188 IP node1.50324 > node3.56938: UDP, length 113
03:11:37.389355 IP node1.32830 > node3.56938: UDP, length 113
03:11:37.389472 IP node1.55726 > node3.56938: UDP, length 113
03:11:37.389656 IP node1.44966 > node3.56938: UDP, length 113
03:11:37.389701 IP node1.33674 > node3.56938: UDP, length 112
03:11:37.389847 IP node1.56111 > node3.56938: UDP, length 113
03:11:37.390035 IP node1.53733 > node3.56938: UDP, length 112
03:11:37.390761 IP node1.50406 > node3.56938: UDP, length 113
03:11:37.390919 IP node1.43787 > node3.56938: UDP, length 113
03:11:37.391135 IP node1.36361 > node3.56938: UDP, length 112
03:11:37.391275 IP node1.42485 > node3.56938: UDP, length 113
03:11:37.391618 IP node1.40064 > node3.56938: UDP, length 113
03:11:37.391867 IP node1.35563 > node3.56938: UDP, length 113
03:11:37.404966 IP node1.35563 > node2.36166: UDP, length 71
03:11:37.436454 IP node1.34167 > node2.36166: UDP, length 78
03:11:37.437697 IP node1.50324 > node2.36166: UDP, length 78
03:11:37.442994 IP node1.53733 > node2.36166: UDP, length 78
03:11:37.444052 IP node1.35563 > node2.36166: UDP, length 78
03:11:37.447750 IP node1.50406 > node2.36166: UDP, length 78
03:11:37.508061 IP node1.50324 > node3.56677: UDP, length 113
03:11:37.508405 IP node1.42485 > node3.56677: UDP, length 113
03:11:37.508537 IP node1.34167 > node3.56677: UDP, length 113
03:11:37.508916 IP node1.33333 > node3.56677: UDP, length 113
03:11:37.509033 IP node1.56111 > node3.56677: UDP, length 113
03:11:37.509205 IP node1.43787 > node3.56677: UDP, length 113
03:11:37.509264 IP node1.50406 > node3.56677: UDP, length 113
03:11:37.509319 IP node1.55726 > node3.56677: UDP, length 113
03:11:37.509525 IP node1.40064 > node3.56677: UDP, length 113
03:11:37.509580 IP node1.36361 > node3.56677: UDP, length 112
03:11:37.509639 IP node1.32830 > node3.56677: UDP, length 113
03:11:37.509868 IP node1.35563 > node3.56677: UDP, length 113
03:11:37.510080 IP node1.53733 > node3.56677: UDP, length 112
03:11:37.510236 IP node1.44966 > node3.56677: UDP, length 113
03:11:37.510570 IP node1.33674 > node3.56677: UDP, length 112
03:11:37.553629 IP node1.33333 > node2.36166: UDP, length 94
03:11:37.591345 IP node1.50406 > node3.42227: UDP, length 113
03:11:37.591641 IP node1.50324 > node3.42227: UDP, length 113
03:11:37.591923 IP node1.53733 > node3.42227: UDP, length 112
03:11:37.592116 IP node1.34167 > node3.42227: UDP, length 113
03:11:37.592266 IP node1.32830 > node3.42227: UDP, length 113
03:11:37.592327 IP node1.56111 > node3.42227: UDP, length 113
03:11:37.592385 IP node1.36361 > node3.42227: UDP, length 112
03:11:37.592558 IP node1.42485 > node3.42227: UDP, length 113
03:11:37.592631 IP node1.35563 > node3.42227: UDP, length 113
03:11:37.592694 IP node1.43787 > node3.42227: UDP, length 113
03:11:37.593332 IP node1.40064 > node3.42227: UDP, length 113
03:11:37.593503 IP node1.33333 > node3.42227: UDP, length 113
03:11:37.593567 IP node1.33674 > node3.42227: UDP, length 112
03:11:37.593631 IP node1.44966 > node3.42227: UDP, length 113
03:11:37.594855 IP node1.55726 > node3.42227: UDP, length 113
03:11:37.626247 IP node1.50406 > node3.57155: UDP, length 113
03:11:37.626380 IP node1.34167 > node3.57155: UDP, length 113
03:11:37.626523 IP node1.44966 > node3.57155: UDP, length 113
03:11:37.626770 IP node1.43787 > node3.57155: UDP, length 113
03:11:37.627001 IP node1.33674 > node3.57155: UDP, length 112
03:11:37.627048 IP node1.36361 > node3.57155: UDP, length 112
03:11:37.627320 IP node1.42485 > node3.57155: UDP, length 113
03:11:37.627370 IP node1.55726 > node3.57155: UDP, length 113
03:11:37.627441 IP node1.35563 > node3.57155: UDP, length 113
03:11:37.627579 IP node1.53733 > node3.57155: UDP, length 112
03:11:37.627644 IP node1.32830 > node3.57155: UDP, length 113
03:11:37.627834 IP node1.50324 > node3.57155: UDP, length 113
03:11:37.628200 IP node1.40064 > node3.57155: UDP, length 113
03:11:37.628316 IP node1.33333 > node3.57155: UDP, length 113
03:11:37.628425 IP node1.56111 > node3.57155: UDP, length 113
03:11:37.666338 IP node1.53733 > node2.36166: UDP, length 78
03:11:37.670147 IP node1.50406 > node2.36166: UDP, length 78
03:11:37.672816 IP node1.35563 > node2.36166: UDP, length 78
03:11:37.677847 IP node1.34167 > node2.36166: UDP, length 78
03:11:37.687397 IP node1.50324 > node2.36166: UDP, length 78
03:11:37.716044 IP node1.33333 > node2.36166: UDP, length 71
03:11:37.736805 IP node1.44966 > node3.35550: UDP, length 113
03:11:37.737883 IP node1.40064 > node3.35550: UDP, length 113
03:11:37.738392 IP node1.36361 > node3.35550: UDP, length 112
03:11:37.739561 IP node1.43787 > node3.35550: UDP, length 113
03:11:37.739620 IP node1.32830 > node3.35550: UDP, length 113
03:11:37.740136 IP node1.33674 > node3.35550: UDP, length 112
03:11:37.743833 IP node1.56111 > node3.35550: UDP, length 113
03:11:37.744219 IP node1.42485 > node3.35550: UDP, length 113
03:11:37.744816 IP node1.53733 > node3.35550: UDP, length 112
03:11:37.745267 IP node1.50406 > node3.35550: UDP, length 113
03:11:37.745647 IP node1.55726 > node3.35550: UDP, length 113
03:11:37.746143 IP node1.50324 > node3.35550: UDP, length 113
03:11:37.746742 IP node1.34167 > node3.35550: UDP, length 113
03:11:37.752392 IP node1.35563 > node3.35550: UDP, length 113
03:11:37.757021 IP node1.33333 > node3.35550: UDP, length 113
03:11:37.768820 IP node1.33333 > node2.36166: UDP, length 78
03:11:37.789336 IP node1.33333 > node2.36166: UDP, length 71
03:11:37.825059 IP node1.40064 > node2.36166: UDP, length 94
03:11:37.865080 IP node1.50324 > node4.36486: UDP, length 113
03:11:37.865765 IP node1.33333 > node4.36486: UDP, length 113
03:11:37.866125 IP node1.42485 > node4.36486: UDP, length 113
03:11:37.866340 IP node1.35563 > node4.36486: UDP, length 113
03:11:37.866392 IP node1.53733 > node4.36486: UDP, length 112
03:11:37.867109 IP node1.50406 > node4.36486: UDP, length 113
03:11:37.867325 IP node1.34167 > node4.36486: UDP, length 113
03:11:37.867523 IP node1.43787 > node4.36486: UDP, length 113
03:11:37.867608 IP node1.55726 > node4.36486: UDP, length 113
03:11:37.867654 IP node1.44966 > node4.36486: UDP, length 113
03:11:37.868748 IP node1.56111 > node4.36486: UDP, length 113
03:11:37.869583 IP node1.40064 > node4.36486: UDP, length 113
03:11:37.870303 IP node1.33674 > node4.36486: UDP, length 112
03:11:37.870387 IP node1.32830 > node4.36486: UDP, length 113
03:11:37.870525 IP node1.36361 > node4.36486: UDP, length 112
03:11:37.902692 IP node1.33333 > node2.36166: UDP, length 78
03:11:37.902957 IP node1.50324 > node2.36166: UDP, length 78
03:11:37.906782 IP node1.53733 > node2.36166: UDP, length 78
03:11:37.910001 IP node1.56111 > node4.48590: UDP, length 113
03:11:37.910887 IP node1.55726 > node4.48590: UDP, length 113
03:11:37.911095 IP node1.34167 > node4.48590: UDP, length 113
03:11:37.911198 IP node1.33333 > node4.48590: UDP, length 113
03:11:37.911558 IP node1.32830 > node4.48590: UDP, length 113
03:11:37.912118 IP node1.40064 > node4.48590: UDP, length 113
03:11:37.912218 IP node1.35563 > node4.48590: UDP, length 113
03:11:37.912342 IP node1.35563 > node2.36166: UDP, length 78
03:11:37.912394 IP node1.44966 > node4.48590: UDP, length 113
03:11:37.912520 IP node1.50324 > node4.48590: UDP, length 113
03:11:37.912679 IP node1.43787 > node4.48590: UDP, length 113
03:11:37.912845 IP node1.33674 > node4.48590: UDP, length 112
03:11:37.913009 IP node1.50406 > node4.48590: UDP, length 113
03:11:37.914087 IP node1.42485 > node4.48590: UDP, length 113
03:11:37.914142 IP node1.53733 > node4.48590: UDP, length 112
03:11:37.915319 IP node1.34167 > node2.36166: UDP, length 78
03:11:37.915388 IP node1.36361 > node4.48590: UDP, length 112
03:11:37.923397 IP node1.50406 > node2.36166: UDP, length 78
03:11:37.970401 IP node1.40064 > node2.36166: UDP, length 71
03:11:37.984705 IP node1.36361 > node3.52635: UDP, length 112
03:11:37.984784 IP node1.44966 > node3.52635: UDP, length 113
03:11:37.984998 IP node1.33333 > node3.52635: UDP, length 113
03:11:37.985150 IP node1.35563 > node3.52635: UDP, length 113
03:11:37.985472 IP node1.50406 > node3.52635: UDP, length 113
03:11:37.985774 IP node1.40064 > node3.52635: UDP, length 113
03:11:37.985950 IP node1.53733 > node3.52635: UDP, length 112
03:11:37.986509 IP node1.33674 > node3.52635: UDP, length 112
03:11:37.987042 IP node1.55726 > node3.52635: UDP, length 113
03:11:37.987230 IP node1.42485 > node3.52635: UDP, length 113
03:11:37.988052 IP node1.34167 > node3.52635: UDP, length 113
03:11:37.989498 IP node1.43787 > node3.52635: UDP, length 113
03:11:37.989717 IP node1.32830 > node3.52635: UDP, length 113
03:11:37.990328 IP node1.50324 > node3.52635: UDP, length 113
03:11:37.991113 IP node1.56111 > node3.52635: UDP, length 113
03:11:38.000763 IP node1.40064 > node2.36166: UDP, length 78
03:11:38.062773 IP node1.50406 > node3.48193: UDP, length 113
03:11:38.067266 IP node1.34167 > node3.48193: UDP, length 113
03:11:38.068797 IP node1.50324 > node3.48193: UDP, length 113
03:11:38.069655 IP node1.32830 > node3.48193: UDP, length 113
03:11:38.070204 IP node1.36361 > node3.48193: UDP, length 112
03:11:38.070450 IP node1.55726 > node3.48193: UDP, length 113
03:11:38.070817 IP node1.56111 > node3.48193: UDP, length 113
03:11:38.070904 IP node1.42485 > node3.48193: UDP, length 113
03:11:38.070950 IP node1.35563 > node3.48193: UDP, length 113
03:11:38.071188 IP node1.33674 > node3.48193: UDP, length 112
03:11:38.071247 IP node1.53733 > node3.48193: UDP, length 112
03:11:38.071498 IP node1.44966 > node3.48193: UDP, length 113
03:11:38.073292 IP node1.50406 > node2.36166: UDP, length 78
03:11:38.075873 IP node1.33333 > node3.48193: UDP, length 113
03:11:38.077270 IP node1.40064 > node3.48193: UDP, length 113
03:11:38.079207 IP node1.53733 > node2.36166: UDP, length 78
03:11:38.082376 IP node1.34167 > node2.36166: UDP, length 78
03:11:38.083205 IP node1.50324 > node2.36166: UDP, length 78
03:11:38.085838 IP node1.35563 > node2.36166: UDP, length 78
03:11:38.088421 IP node1.43787 > node3.48193: UDP, length 113
03:11:38.090984 IP node1.33333 > node2.36166: UDP, length 78
03:11:38.095418 IP node1.40064 > node2.36166: UDP, length 78
03:11:38.105397 IP node1.50406 > node3.60133: UDP, length 113
03:11:38.105626 IP node1.56111 > node3.60133: UDP, length 113
03:11:38.105878 IP node1.42485 > node3.60133: UDP, length 113
03:11:38.107255 IP node1.32830 > node3.60133: UDP, length 113
03:11:38.107314 IP node1.44966 > node3.60133: UDP, length 113
03:11:38.107714 IP node1.36361 > node3.60133: UDP, length 112
03:11:38.108139 IP node1.33674 > node3.60133: UDP, length 112
03:11:38.108594 IP node1.34167 > node3.60133: UDP, length 113
03:11:38.108638 IP node1.55726 > node3.60133: UDP, length 113
03:11:38.108694 IP node1.50324 > node3.60133: UDP, length 113
03:11:38.108746 IP node1.33333 > node3.60133: UDP, length 113
03:11:38.110590 IP node1.40064 > node3.60133: UDP, length 113
03:11:38.112739 IP node1.53733 > node3.60133: UDP, length 112
03:11:38.114635 IP node1.43787 > node3.60133: UDP, length 113
03:11:38.116836 IP node1.35563 > node3.60133: UDP, length 113
03:11:38.124103 IP node1.33674 > node4.36499: UDP, length 112
03:11:38.124419 IP node1.42485 > node4.36499: UDP, length 113
03:11:38.124745 IP node1.56111 > node4.36499: UDP, length 113
03:11:38.125071 IP node1.44966 > node4.36499: UDP, length 113
03:11:38.125341 IP node1.50324 > node4.36499: UDP, length 113
03:11:38.125395 IP node1.32830 > node4.36499: UDP, length 113
03:11:38.125454 IP node1.50406 > node4.36499: UDP, length 113
03:11:38.125576 IP node1.34167 > node4.36499: UDP, length 113
03:11:38.125717 IP node1.35563 > node4.36499: UDP, length 113
03:11:38.125943 IP node1.36361 > node4.36499: UDP, length 112
03:11:38.126965 IP node1.55726 > node4.36499: UDP, length 113
03:11:38.127518 IP node1.53733 > node4.36499: UDP, length 112
03:11:38.127896 IP node1.43787 > node4.36499: UDP, length 113
03:11:38.128248 IP node1.40064 > node4.36499: UDP, length 113
03:11:38.130211 IP node1.33333 > node4.36499: UDP, length 113
03:11:38.139954 IP node1.42485 > node3.35498: UDP, length 113
03:11:38.140673 IP node1.50406 > node3.35498: UDP, length 113
03:11:38.140855 IP node1.56111 > node3.35498: UDP, length 113
03:11:38.141910 IP node1.50324 > node3.35498: UDP, length 113
03:11:38.143139 IP node1.44966 > node3.35498: UDP, length 113
03:11:38.143491 IP node1.35563 > node3.35498: UDP, length 113
03:11:38.144069 IP node1.55726 > node3.35498: UDP, length 113
03:11:38.145299 IP node1.53733 > node3.35498: UDP, length 112
03:11:38.145400 IP node1.34167 > node3.35498: UDP, length 113
03:11:38.145512 IP node1.33333 > node3.35498: UDP, length 113
03:11:38.145774 IP node1.33674 > node3.35498: UDP, length 112
03:11:38.145864 IP node1.40064 > node3.35498: UDP, length 113
03:11:38.146217 IP node1.32830 > node3.35498: UDP, length 113
03:11:38.146741 IP node1.43787 > node3.35498: UDP, length 113
03:11:38.147235 IP node1.36361 > node3.35498: UDP, length 112
03:11:38.162785 IP node1.33674 > node4.44113: UDP, length 112
03:11:38.162908 IP node1.50406 > node4.44113: UDP, length 113
03:11:38.162985 IP node1.35563 > node4.44113: UDP, length 113
03:11:38.163673 IP node1.50324 > node4.44113: UDP, length 113
03:11:38.163836 IP node1.44966 > node4.44113: UDP, length 113
03:11:38.164071 IP node1.43787 > node4.44113: UDP, length 113
03:11:38.164208 IP node1.36361 > node4.44113: UDP, length 112
03:11:38.164414 IP node1.40064 > node4.44113: UDP, length 113
03:11:38.164459 IP node1.33333 > node4.44113: UDP, length 113
03:11:38.164719 IP node1.32830 > node4.44113: UDP, length 113
03:11:38.164857 IP node1.53733 > node4.44113: UDP, length 112
03:11:38.165140 IP node1.56111 > node4.44113: UDP, length 113
03:11:38.165198 IP node1.34167 > node4.44113: UDP, length 113
03:11:38.165398 IP node1.55726 > node4.44113: UDP, length 113
03:11:38.165498 IP node1.42485 > node4.44113: UDP, length 113
03:11:38.243512 IP node1.33674 > node3.49285: UDP, length 112
03:11:38.243610 IP node1.32830 > node3.49285: UDP, length 113
03:11:38.243677 IP node1.53733 > node3.49285: UDP, length 112
03:11:38.244001 IP node1.43787 > node3.49285: UDP, length 113
03:11:38.244076 IP node1.44966 > node3.49285: UDP, length 113
03:11:38.244206 IP node1.35563 > node3.49285: UDP, length 113
03:11:38.244282 IP node1.42485 > node3.49285: UDP, length 113
03:11:38.244486 IP node1.40064 > node3.49285: UDP, length 113
03:11:38.244904 IP node1.33333 > node3.49285: UDP, length 113
03:11:38.245091 IP node1.36361 > node3.49285: UDP, length 112
03:11:38.245179 IP node1.56111 > node3.49285: UDP, length 113
03:11:38.245278 IP node1.34167 > node3.49285: UDP, length 113
03:11:38.245446 IP node1.55726 > node3.49285: UDP, length 113
03:11:38.245531 IP node1.50324 > node3.49285: UDP, length 113
03:11:38.245589 IP node1.50406 > node3.49285: UDP, length 113
03:11:38.249471 IP node1.42485 > node4.58460: UDP, length 113
03:11:38.249959 IP node1.53733 > node4.58460: UDP, length 112
03:11:38.250318 IP node1.33333 > node4.58460: UDP, length 113
03:11:38.250566 IP node1.32830 > node4.58460: UDP, length 113
03:11:38.251151 IP node1.36361 > node4.58460: UDP, length 112
03:11:38.251977 IP node1.40064 > node4.58460: UDP, length 113
03:11:38.253108 IP node1.35563 > node4.58460: UDP, length 113
03:11:38.253461 IP node1.33333 > node2.36166: UDP, length 78
03:11:38.253810 IP node1.34167 > node2.36166: UDP, length 78
03:11:38.254730 IP node1.50324 > node4.58460: UDP, length 113
03:11:38.254842 IP node1.50324 > node2.36166: UDP, length 78
03:11:38.255526 IP node1.53733 > node2.36166: UDP, length 78
03:11:38.255905 IP node1.34167 > node4.58460: UDP, length 113
03:11:38.256957 IP node1.44966 > node4.58460: UDP, length 113
03:11:38.257133 IP node1.50406 > node2.36166: UDP, length 78
03:11:38.257319 IP node1.50406 > node4.58460: UDP, length 113
03:11:38.258152 IP node1.43787 > node4.58460: UDP, length 113
03:11:38.259519 IP node1.35563 > node2.36166: UDP, length 78
03:11:38.260040 IP node1.56111 > node4.58460: UDP, length 113
03:11:38.260338 IP node1.33674 > node4.58460: UDP, length 112
03:11:38.260802 IP node1.55726 > node4.58460: UDP, length 113
03:11:38.261427 IP node1.40064 > node2.36166: UDP, length 78
03:11:38.309109 IP node1.42485 > node3.60850: UDP, length 113
03:11:38.309455 IP node1.40064 > node3.60850: UDP, length 113
03:11:38.309698 IP node1.33333 > node3.60850: UDP, length 113
03:11:38.309848 IP node1.34167 > node3.60850: UDP, length 113
03:11:38.309980 IP node1.44966 > node3.60850: UDP, length 113
03:11:38.310112 IP node1.53733 > node3.60850: UDP, length 112
03:11:38.310338 IP node1.50406 > node3.60850: UDP, length 113
03:11:38.310781 IP node1.33674 > node3.60850: UDP, length 112
03:11:38.311081 IP node1.55726 > node3.60850: UDP, length 113
03:11:38.311856 IP node1.43787 > node3.60850: UDP, length 113
03:11:38.312811 IP node1.36361 > node3.60850: UDP, length 112
03:11:38.313104 IP node1.50324 > node3.60850: UDP, length 113
03:11:38.313919 IP node1.56111 > node3.60850: UDP, length 113
03:11:38.314398 IP node1.35563 > node3.60850: UDP, length 113
03:11:38.314511 IP node1.32830 > node3.60850: UDP, length 113
03:11:38.384025 IP node1.44966 > node4.36451: UDP, length 113
03:11:38.384290 IP node1.34167 > node4.36451: UDP, length 113
03:11:38.384373 IP node1.43787 > node4.36451: UDP, length 113
03:11:38.384534 IP node1.42485 > node4.36451: UDP, length 113
03:11:38.384585 IP node1.36361 > node4.36451: UDP, length 112
03:11:38.384739 IP node1.53733 > node4.36451: UDP, length 112
03:11:38.384993 IP node1.55726 > node4.36451: UDP, length 113
03:11:38.385098 IP node1.50406 > node4.36451: UDP, length 113
03:11:38.385714 IP node1.56111 > node4.36451: UDP, length 113
03:11:38.385822 IP node1.33333 > node4.36451: UDP, length 113
03:11:38.385922 IP node1.50324 > node4.36451: UDP, length 113
03:11:38.386848 IP node1.35563 > node4.36451: UDP, length 113
03:11:38.387511 IP node1.40064 > node4.36451: UDP, length 113
03:11:38.388217 IP node1.33674 > node4.36451: UDP, length 112
03:11:38.388426 IP node1.32830 > node4.36451: UDP, length 113
03:11:38.418670 IP node1.40064 > node2.36166: UDP, length 71
03:11:38.506047 IP node1.34167 > node2.36166: UDP, length 78
03:11:38.507595 IP node1.35563 > node2.36166: UDP, length 78
03:11:38.508194 IP node1.50324 > node2.36166: UDP, length 78
03:11:38.510132 IP node1.33333 > node2.36166: UDP, length 78
03:11:38.513994 IP node1.50406 > node2.36166: UDP, length 78
03:11:38.515942 IP node1.40064 > node2.36166: UDP, length 78
03:11:38.520463 IP node1.53733 > node2.36166: UDP, length 78
03:11:38.576605 IP node1.53733 > node4.59422: UDP, length 112
03:11:38.576788 IP node1.42485 > node4.59422: UDP, length 113
03:11:38.576900 IP node1.34167 > node4.59422: UDP, length 113
03:11:38.577080 IP node1.56111 > node4.59422: UDP, length 113
03:11:38.577132 IP node1.35563 > node4.59422: UDP, length 113
03:11:38.577191 IP node1.33674 > node4.59422: UDP, length 112
03:11:38.577262 IP node1.40064 > node4.59422: UDP, length 113
03:11:38.577340 IP node1.50406 > node4.59422: UDP, length 113
03:11:38.577520 IP node1.50324 > node4.59422: UDP, length 113
03:11:38.577684 IP node1.44966 > node4.59422: UDP, length 113
03:11:38.577735 IP node1.33333 > node4.59422: UDP, length 113
03:11:38.577837 IP node1.32830 > node4.59422: UDP, length 113
03:11:38.578237 IP node1.55726 > node4.59422: UDP, length 113
03:11:38.578438 IP node1.43787 > node4.59422: UDP, length 113
03:11:38.578897 IP node1.36361 > node4.59422: UDP, length 112
03:11:38.622351 IP node1.44966 > node4.51500: UDP, length 113
03:11:38.622486 IP node1.50406 > node4.51500: UDP, length 113
03:11:38.622622 IP node1.36361 > node4.51500: UDP, length 112
03:11:38.622679 IP node1.35563 > node4.51500: UDP, length 113
03:11:38.622781 IP node1.34167 > node4.51500: UDP, length 113
03:11:38.622941 IP node1.43787 > node4.51500: UDP, length 113
03:11:38.623114 IP node1.50324 > node4.51500: UDP, length 113
03:11:38.623177 IP node1.33674 > node4.51500: UDP, length 112
03:11:38.623497 IP node1.53733 > node4.51500: UDP, length 112
03:11:38.624027 IP node1.42485 > node4.51500: UDP, length 113
03:11:38.624499 IP node1.56111 > node4.51500: UDP, length 113
03:11:38.624666 IP node1.40064 > node4.51500: UDP, length 113
03:11:38.625552 IP node1.32830 > node4.51500: UDP, length 113
03:11:38.625627 IP node1.55726 > node4.51500: UDP, length 113
03:11:38.625737 IP node1.33333 > node4.51500: UDP, length 113
03:11:38.656956 IP node1.44966 > node2.36166: UDP, length 94
03:11:38.694514 IP node1.34167 > node4.58465: UDP, length 113
03:11:38.695136 IP node1.43787 > node4.58465: UDP, length 113
03:11:38.695291 IP node1.53733 > node4.58465: UDP, length 112
03:11:38.695361 IP node1.50324 > node4.58465: UDP, length 113
03:11:38.695962 IP node1.42485 > node4.58465: UDP, length 113
03:11:38.696378 IP node1.35563 > node4.58465: UDP, length 113
03:11:38.696515 IP node1.36361 > node4.58465: UDP, length 112
03:11:38.696729 IP node1.40064 > node4.58465: UDP, length 113
03:11:38.696907 IP node1.33333 > node4.58465: UDP, length 113
03:11:38.696963 IP node1.55726 > node4.58465: UDP, length 113
03:11:38.696998 IP node1.33674 > node4.58465: UDP, length 112
03:11:38.697694 IP node1.56111 > node4.58465: UDP, length 113
03:11:38.697767 IP node1.50406 > node4.58465: UDP, length 113
03:11:38.697821 IP node1.32830 > node4.58465: UDP, length 113
03:11:38.698361 IP node1.44966 > node4.58465: UDP, length 113
03:11:38.705540 IP node1.36361 > node2.36166: UDP, length 94
03:11:38.710512 IP node1.44966 > node4.49214: UDP, length 113
03:11:38.710580 IP node1.55726 > node4.49214: UDP, length 113
03:11:38.710762 IP node1.50406 > node4.49214: UDP, length 113
03:11:38.710883 IP node1.32830 > node4.49214: UDP, length 113
03:11:38.710927 IP node1.42485 > node4.49214: UDP, length 113
03:11:38.711594 IP node1.33333 > node4.49214: UDP, length 113
03:11:38.711998 IP node1.40064 > node4.49214: UDP, length 113
03:11:38.712353 IP node1.43787 > node4.49214: UDP, length 113
03:11:38.712498 IP node1.53733 > node4.49214: UDP, length 112
03:11:38.712551 IP node1.33674 > node4.49214: UDP, length 112
03:11:38.712966 IP node1.35563 > node4.49214: UDP, length 113
03:11:38.713302 IP node1.34167 > node4.49214: UDP, length 113
03:11:38.713692 IP node1.50324 > node4.49214: UDP, length 113
03:11:38.713769 IP node1.56111 > node4.49214: UDP, length 113
03:11:38.713849 IP node1.36361 > node4.49214: UDP, length 112
03:11:38.754008 IP node1.43787 > node4.38789: UDP, length 113
03:11:38.754124 IP node1.55726 > node4.38789: UDP, length 113
03:11:38.754223 IP node1.36361 > node4.38789: UDP, length 112
03:11:38.754381 IP node1.42485 > node4.38789: UDP, length 113
03:11:38.754429 IP node1.32830 > node4.38789: UDP, length 113
03:11:38.754645 IP node1.56111 > node4.38789: UDP, length 113
03:11:38.754813 IP node1.40064 > node4.38789: UDP, length 113
03:11:38.754915 IP node1.50406 > node4.38789: UDP, length 113
03:11:38.754974 IP node1.34167 > node4.38789: UDP, length 113
03:11:38.755032 IP node1.50324 > node4.38789: UDP, length 113
03:11:38.755083 IP node1.35563 > node4.38789: UDP, length 113
03:11:38.755160 IP node1.53733 > node4.38789: UDP, length 112
03:11:38.756124 IP node1.33333 > node4.38789: UDP, length 113
03:11:38.756370 IP node1.44966 > node4.38789: UDP, length 113
03:11:38.756624 IP node1.33674 > node4.38789: UDP, length 112
03:11:38.767396 IP node1.43787 > node2.36166: UDP, length 94
03:11:38.784580 IP node1.33333 > node2.36166: UDP, length 78
03:11:38.784789 IP node1.50406 > node2.36166: UDP, length 78
03:11:38.787826 IP node1.53733 > node2.36166: UDP, length 78
03:11:38.790039 IP node1.40064 > node2.36166: UDP, length 78
03:11:38.798978 IP node1.32830 > node4.44091: UDP, length 113
03:11:38.800054 IP node1.44966 > node4.44091: UDP, length 113
03:11:38.800357 IP node1.35563 > node2.36166: UDP, length 78
03:11:38.801214 IP node1.40064 > node4.44091: UDP, length 113
03:11:38.801404 IP node1.56111 > node4.44091: UDP, length 113
03:11:38.802242 IP node1.50324 > node2.36166: UDP, length 78
03:11:38.802300 IP node1.34167 > node2.36166: UDP, length 78
03:11:38.802415 IP node1.50324 > node4.44091: UDP, length 113
03:11:38.802523 IP node1.34167 > node4.44091: UDP, length 113
03:11:38.802947 IP node1.55726 > node4.44091: UDP, length 113
03:11:38.804520 IP node1.43787 > node4.44091: UDP, length 113
03:11:38.804573 IP node1.33674 > node4.44091: UDP, length 112
03:11:38.805270 IP node1.42485 > node4.44091: UDP, length 113
03:11:38.805441 IP node1.50406 > node4.44091: UDP, length 113
03:11:38.807515 IP node1.33333 > node4.44091: UDP, length 113
03:11:38.808438 IP node1.36361 > node4.44091: UDP, length 112
03:11:38.808923 IP node1.35563 > node4.44091: UDP, length 113
03:11:38.809757 IP node1.53733 > node4.44091: UDP, length 112
03:11:38.823555 IP node1.50406 > node4.40772: UDP, length 113
03:11:38.824315 IP node1.50324 > node4.40772: UDP, length 113
03:11:38.824819 IP node1.35563 > node4.40772: UDP, length 113
03:11:38.825319 IP node1.53733 > node4.40772: UDP, length 112
03:11:38.826303 IP node1.55726 > node4.40772: UDP, length 113
03:11:38.826758 IP node1.56111 > node4.40772: UDP, length 113
03:11:38.826925 IP node1.43787 > node4.40772: UDP, length 113
03:11:38.827013 IP node1.42485 > node4.40772: UDP, length 113
03:11:38.827701 IP node1.33674 > node4.40772: UDP, length 112
03:11:38.828141 IP node1.44966 > node4.40772: UDP, length 113
03:11:38.828366 IP node1.36361 > node4.40772: UDP, length 112
03:11:38.828455 IP node1.34167 > node4.40772: UDP, length 113
03:11:38.828521 IP node1.40064 > node4.40772: UDP, length 113
03:11:38.829557 IP node1.33333 > node4.40772: UDP, length 113
03:11:38.829988 IP node1.32830 > node4.40772: UDP, length 113
03:11:38.881917 IP node1.33674 > node2.36166: UDP, length 94
03:11:38.883490 IP node1.36361 > node2.36166: UDP, length 71
03:11:38.889004 IP node1.36361 > node4.58465: UDP, length 87
03:11:38.915676 IP node1.43787 > node4.38789: UDP, length 94
03:11:38.943765 IP node1.43787 > node2.36166: UDP, length 71
03:11:38.953768 IP node1.44966 > node4.51500: UDP, length 94
03:11:38.955079 IP node1.34167 > node4.38845: UDP, length 113
03:11:38.955357 IP node1.50324 > node4.38845: UDP, length 113
03:11:38.955840 IP node1.50406 > node4.38845: UDP, length 113
03:11:38.955907 IP node1.55726 > node4.38845: UDP, length 113
03:11:38.956273 IP node1.56111 > node4.38845: UDP, length 113
03:11:38.956945 IP node1.33333 > node4.38845: UDP, length 113
03:11:38.957337 IP node1.36361 > node4.38845: UDP, length 112
03:11:38.957818 IP node1.33674 > node4.38845: UDP, length 112
03:11:38.958118 IP node1.40064 > node4.38845: UDP, length 113
03:11:38.959105 IP node1.44966 > node4.38845: UDP, length 113
03:11:38.959191 IP node1.44966 > node2.36166: UDP, length 71
03:11:38.959401 IP node1.44966 > node2.36166: UDP, length 71
03:11:38.959544 IP node1.35563 > node4.38845: UDP, length 113
03:11:38.960804 IP node1.53733 > node4.38845: UDP, length 112
03:11:38.961035 IP node1.32830 > node4.38845: UDP, length 113
03:11:38.962129 IP node1.42485 > node4.38845: UDP, length 113
03:11:38.962602 IP node1.36361 > node2.36166: UDP, length 78
03:11:38.962931 IP node1.43787 > node4.38845: UDP, length 113
03:11:39.005926 IP node1.44966 > node2.36166: UDP, length 78
03:11:39.027505 IP node1.43787 > node2.36166: UDP, length 78
03:11:39.033557 IP node1.43787 > node2.36166: UDP, length 71
03:11:39.052451 IP node1.35563 > node4.36825: UDP, length 113
03:11:39.052514 IP node1.56111 > node4.36825: UDP, length 113
03:11:39.052761 IP node1.55726 > node4.36825: UDP, length 113
03:11:39.053500 IP node1.50406 > node4.36825: UDP, length 113
03:11:39.054238 IP node1.32830 > node4.36825: UDP, length 113
03:11:39.054293 IP node1.34167 > node4.36825: UDP, length 113
03:11:39.054481 IP node1.43787 > node4.36825: UDP, length 113
03:11:39.054961 IP node1.40064 > node4.36825: UDP, length 113
03:11:39.055268 IP node1.33674 > node4.36825: UDP, length 112
03:11:39.055391 IP node1.44966 > node4.36825: UDP, length 113
03:11:39.055596 IP node1.53733 > node4.36825: UDP, length 112
03:11:39.055777 IP node1.36361 > node4.36825: UDP, length 112
03:11:39.055832 IP node1.33333 > node4.36825: UDP, length 113
03:11:39.057425 IP node1.42485 > node4.36825: UDP, length 113
03:11:39.057525 IP node1.50324 > node4.36825: UDP, length 113
03:11:39.104187 IP node1.50406 > node2.36166: UDP, length 78
03:11:39.105586 IP node1.53733 > node2.36166: UDP, length 78
03:11:39.105729 IP node1.33333 > node2.36166: UDP, length 78
03:11:39.110752 IP node1.44966 > node2.36166: UDP, length 78
03:11:39.112558 IP node1.35563 > node2.36166: UDP, length 78
03:11:39.117278 IP node1.34167 > node2.36166: UDP, length 78
03:11:39.121336 IP node1.50324 > node2.36166: UDP, length 78
03:11:39.132985 IP node1.40064 > node2.36166: UDP, length 78
03:11:39.142056 IP node1.36361 > node2.36166: UDP, length 78
03:11:39.154596 IP node1.43787 > node2.36166: UDP, length 78
03:11:39.155097 IP node1.43787 > node4.44091: UDP, length 87
03:11:39.192693 IP node1.33674 > node2.36166: UDP, length 71
03:11:39.199097 IP node1.33674 > node4.38845: UDP, length 87
03:11:39.249942 IP node1.33674 > node2.36166: UDP, length 78
03:11:39.309000 IP node1.36361 > node2.36166: UDP, length 71
03:11:39.312368 IP node1.44966 > node2.36166: UDP, length 1048
03:11:39.398509 IP node1.55726 > node2.36166: UDP, length 94
03:11:39.411274 IP node1.35563 > node2.36166: UDP, length 78
03:11:39.413483 IP node1.34167 > node2.36166: UDP, length 78
03:11:39.418704 IP node1.40064 > node2.36166: UDP, length 78
03:11:39.424696 IP node1.53733 > node2.36166: UDP, length 78
03:11:39.425554 IP node1.44966 > node2.36166: UDP, length 78
03:11:39.428219 IP node1.50324 > node2.36166: UDP, length 78
03:11:39.432975 IP node1.50406 > node2.36166: UDP, length 78
03:11:39.437039 IP node1.33333 > node2.36166: UDP, length 1066
03:11:39.440219 IP node1.56111 > node2.36166: UDP, length 94
03:11:39.442931 IP node1.33674 > node2.36166: UDP, length 78
03:11:39.455311 IP node1.36361 > node2.36166: UDP, length 78
03:11:39.455729 IP node1.33333 > node2.36166: UDP, length 78
03:11:39.456482 IP node1.43787 > node2.36166: UDP, length 78
03:11:39.469785 IP node1.55726 > node4.36825: UDP, length 94
03:11:39.527036 IP node1.55726 > node2.36166: UDP, length 71
03:11:39.568387 IP node1.33674 > node2.36166: UDP, length 71
03:11:39.568547 IP node1.55726 > node2.36166: UDP, length 78
03:11:39.613156 IP node1.44966 > node2.52006: UDP, length 113
03:11:39.613879 IP node1.43787 > node2.52006: UDP, length 113
03:11:39.614092 IP node1.40064 > node2.52006: UDP, length 113
03:11:39.614162 IP node1.33333 > node2.52006: UDP, length 113
03:11:39.614298 IP node1.32830 > node2.52006: UDP, length 113
03:11:39.614369 IP node1.33674 > node2.52006: UDP, length 112
03:11:39.615210 IP node1.35563 > node2.52006: UDP, length 113
03:11:39.615930 IP node1.36361 > node2.52006: UDP, length 112
03:11:39.616128 IP node1.55726 > node2.52006: UDP, length 113
03:11:39.616245 IP node1.53733 > node2.52006: UDP, length 112
03:11:39.617228 IP node1.50406 > node2.52006: UDP, length 113
03:11:39.617675 IP node1.34167 > node2.52006: UDP, length 113
03:11:39.618068 IP node1.56111 > node2.52006: UDP, length 113
03:11:39.618422 IP node1.50324 > node2.52006: UDP, length 113
03:11:39.621496 IP node1.42485 > node2.36166: UDP, length 94
03:11:39.621605 IP node1.42485 > node2.52006: UDP, length 113
03:11:39.631424 IP node1.40064 > node2.36166: UDP, length 78
03:11:39.633308 IP node1.43787 > node2.36166: UDP, length 78
03:11:39.635756 IP node1.33333 > node2.36166: UDP, length 78
03:11:39.636084 IP node1.50406 > node2.36166: UDP, length 78
03:11:39.641311 IP node1.34167 > node2.36166: UDP, length 78
03:11:39.643745 IP node1.53733 > node2.36166: UDP, length 78
03:11:39.644265 IP node1.35563 > node2.36166: UDP, length 78
03:11:39.645720 IP node1.44966 > node2.36166: UDP, length 78
03:11:39.656991 IP node1.50324 > node2.36166: UDP, length 78
03:11:39.660355 IP node1.55726 > node2.36166: UDP, length 71
03:11:39.660803 IP node1.36361 > node2.36166: UDP, length 78
03:11:39.670668 IP node1.55726 > node2.36166: UDP, length 78
03:11:39.672570 IP node1.33674 > node2.36166: UDP, length 78
03:11:39.676078 IP node1.50324 > node2.36166: UDP, length 1084
03:11:39.687252 IP node1.56111 > node2.36166: UDP, length 71
03:11:39.712848 IP node1.56111 > node2.36166: UDP, length 71
03:11:39.793120 IP node1.56111 > node2.36166: UDP, length 78
03:11:39.864968 IP node1.50406 > node2.36166: UDP, length 78
03:11:39.874043 IP node1.32830 > node2.33739: UDP, length 113
03:11:39.874210 IP node1.53733 > node2.33739: UDP, length 112
03:11:39.876129 IP node1.50324 > node2.33739: UDP, length 113
03:11:39.876294 IP node1.44966 > node2.36166: UDP, length 78
03:11:39.876654 IP node1.33333 > node2.36166: UDP, length 78
03:11:39.876950 IP node1.33333 > node2.33739: UDP, length 113
03:11:39.877045 IP node1.36361 > node2.33739: UDP, length 112
03:11:39.880690 IP node1.44966 > node2.33739: UDP, length 113
03:11:39.881844 IP node1.35563 > node2.36166: UDP, length 78
03:11:39.883285 IP node1.34167 > node2.33739: UDP, length 113
03:11:39.885184 IP node1.35563 > node2.33739: UDP, length 113
03:11:39.885264 IP node1.40064 > node2.36166: UDP, length 78
03:11:39.885524 IP node1.40064 > node2.33739: UDP, length 113
03:11:39.886762 IP node1.34167 > node2.47170: UDP, length 113
03:11:39.887281 IP node1.32830 > node2.47170: UDP, length 113
03:11:39.889005 IP node1.33674 > node2.47170: UDP, length 112
03:11:39.889201 IP node1.33674 > node2.33739: UDP, length 112
03:11:39.889506 IP node1.50324 > node2.47170: UDP, length 113
03:11:39.890555 IP node1.44966 > node2.47170: UDP, length 113
03:11:39.890623 IP node1.34167 > node2.36166: UDP, length 78
03:11:39.892471 IP node1.53733 > node2.47170: UDP, length 112
03:11:39.892755 IP node1.42485 > node2.47170: UDP, length 113
03:11:39.892905 IP node1.42485 > node2.33739: UDP, length 113
03:11:39.893355 IP node1.33674 > node2.36166: UDP, length 78
03:11:39.895100 IP node1.35563 > node2.47170: UDP, length 113
03:11:39.897217 IP node1.40064 > node2.47170: UDP, length 113
03:11:39.899539 IP node1.55726 > node2.47170: UDP, length 113
03:11:39.899669 IP node1.55726 > node2.33739: UDP, length 113
03:11:39.900740 IP node1.43787 > node2.33739: UDP, length 113
03:11:39.900831 IP node1.43787 > node2.47170: UDP, length 113
03:11:39.901158 IP node1.33333 > node2.47170: UDP, length 113
03:11:39.903168 IP node1.50324 > node2.36166: UDP, length 78
03:11:39.903446 IP node1.43787 > node2.36166: UDP, length 78
03:11:39.909185 IP node1.50406 > node2.47170: UDP, length 113
03:11:39.909456 IP node1.50406 > node2.33739: UDP, length 113
03:11:39.911653 IP node1.36361 > node2.36166: UDP, length 78
03:11:39.913035 IP node1.56111 > node2.47170: UDP, length 113
03:11:39.913135 IP node1.56111 > node2.33739: UDP, length 113
03:11:39.913192 IP node1.36361 > node2.47170: UDP, length 112
03:11:39.916037 IP node1.53733 > node2.36166: UDP, length 78
03:11:39.916775 IP node1.56111 > node2.52006: UDP, length 87
03:11:39.922129 IP node1.32830 > node2.36166: UDP, length 94
03:11:39.923521 IP node1.56111 > node2.36166: UDP, length 78
03:11:39.926294 IP node1.55726 > node2.36166: UDP, length 78
03:11:39.961603 IP node1.42485 > node2.36166: UDP, length 71
03:11:40.039929 IP node1.42485 > node2.36166: UDP, length 78
03:11:40.042043 IP node1.42485 > node2.36166: UDP, length 71
03:11:40.097019 IP node1.50324 > node2.36166: UDP, length 78
03:11:40.105022 IP node1.50406 > node2.36166: UDP, length 78
03:11:40.106180 IP node1.53733 > node2.36166: UDP, length 78
03:11:40.113073 IP node1.33674 > node2.36166: UDP, length 78
03:11:40.113238 IP node1.40064 > node2.36166: UDP, length 78
03:11:40.113471 IP node1.43787 > node2.36166: UDP, length 78
03:11:40.120763 IP node1.36361 > node2.36166: UDP, length 78
03:11:40.120906 IP node1.33333 > node2.36166: UDP, length 78
03:11:40.121871 IP node1.35563 > node2.36166: UDP, length 78
03:11:40.122597 IP node1.34167 > node2.36166: UDP, length 78
03:11:40.126917 IP node1.44966 > node2.36166: UDP, length 78
03:11:40.179467 IP node1.55726 > node2.36166: UDP, length 78
03:11:40.181278 IP node1.56111 > node2.36166: UDP, length 78
03:11:40.182427 IP node1.42485 > node2.47170: UDP, length 87
03:11:40.203857 IP node1.42485 > node2.36166: UDP, length 78
03:11:40.236088 IP node1.32830 > node2.33739: UDP, length 94
03:11:40.245451 IP node1.32830 > node2.36166: UDP, length 71
03:11:40.287029 IP node1.32830 > node2.36166: UDP, length 78
03:11:40.506219 IP node1.32830 > node2.36166: UDP, length 71
03:11:40.634494 IP node1.53733 > node2.36166: UDP, length 1174
03:11:44.680081 IP node1.55726 > node2.36166: UDP, length 1174
03:11:45.052887 IP node1.55726 > node2.36166: UDP, length 1174
03:11:46.864411 IP node1.43787 > node2.36166: UDP, length 1174
03:11:47.359014 IP node1.33333 > node2.36166: UDP, length 1174
03:11:48.656744 IP node1.43787 > node2.36166: UDP, length 1174
03:11:53.347805 IP node1.32830 > node2.36166: UDP, length 1174
03:11:53.552831 IP node1.36361 > node2.36166: UDP, length 1174
03:11:55.227322 IP node1.33333 > node2.36166: UDP, length 1174
03:11:55.271046 IP node1.36361 > node2.36166: UDP, length 1174
03:11:55.340338 IP node1.53733 > node2.36166: UDP, length 1174
03:11:58.732608 IP node1.40064 > node2.36166: UDP, length 1174
03:12:01.341064 IP node1.33333 > node2.36166: UDP, length 1174
03:12:03.006522 IP node1.33674 > node2.36166: UDP, length 1174
03:12:03.758198 IP node1.44966 > node2.36166: UDP, length 1174
03:12:05.195026 IP node1.42485 > node2.36166: UDP, length 1174
03:12:07.917696 IP node1.50406 > node2.36166: UDP, length 1174
03:12:08.047738 IP node1.55726 > node2.36166: UDP, length 1174
03:12:08.735172 IP node1.33674 > node2.36166: UDP, length 1174
03:12:09.030299 IP node1.56111 > node2.36166: UDP, length 1174
03:12:09.271450 IP node1.34167 > node2.36166: UDP, length 1174
03:12:09.316153 IP node1.53733 > node2.36166: UDP, length 1174
03:12:12.970838 IP node1.35563 > node2.36166: UDP, length 1174
03:12:13.618506 IP node1.43787 > node2.36166: UDP, length 1174
03:12:17.209590 IP node1.50324 > node2.36166: UDP, length 1174
03:12:19.246698 IP node1.35563 > node2.36166: UDP, length 1174
03:12:21.104506 IP node1.42485 > node2.36166: UDP, length 1174
03:12:21.725165 IP node1.34167 > node2.36166: UDP, length 1174
03:12:22.269654 IP node1.32830 > node2.36166: UDP, length 1174
03:12:24.362519 IP node1.40064 > node2.36166: UDP, length 1174
03:12:26.650616 IP node1.50406 > node2.36166: UDP, length 1174
03:12:27.133605 IP node1.33333 > node2.36166: UDP, length 1174
03:12:29.416792 IP node1.36361 > node2.36166: UDP, length 1174
03:12:29.772951 IP node1.44966 > node2.36166: UDP, length 1174
03:12:30.394271 IP node1.43787 > node2.36166: UDP, length 1174
03:12:30.433358 IP node1.42485 > node2.36166: UDP, length 1174
03:12:30.741272 IP node1.50324 > node2.36166: UDP, length 1174
03:12:33.495001 IP node1.33674 > node2.36166: UDP, length 1174
03:12:34.234225 IP node1.42485 > node2.36166: UDP, length 1174
03:12:35.536735 IP node1.33674 > node2.36166: UDP, length 1174
03:12:35.614175 IP node1.32830 > node2.36166: UDP, length 1174
03:12:38.622554 IP node1.55726 > node2.36166: UDP, length 1174
03:12:40.162808 IP node1.56111 > node2.36166: UDP, length 1174
03:12:40.343999 IP node1.34167 > node2.36166: UDP, length 1174
03:12:42.118904 IP node1.53733 > node2.36166: UDP, length 1174
03:12:44.648566 IP node1.56111 > node2.36166: UDP, length 1174
03:12:44.982084 IP node1.43787 > node2.36166: UDP, length 1174
03:12:46.567180 IP node1.35563 > node2.36166: UDP, length 1174
03:12:50.427047 IP node1.50324 > node2.36166: UDP, length 1174
03:12:50.680211 IP node1.40064 > node2.36166: UDP, length 1174
03:12:54.813819 IP node1.50406 > node2.36166: UDP, length 1174
03:12:54.826515 IP node1.33674 > node2.36166: UDP, length 1174
03:12:55.527324 IP node1.40064 > node2.36166: UDP, length 1174
03:12:56.122505 IP node1.50406 > node2.36166: UDP, length 1174
03:12:56.924409 IP node1.33674 > node2.36166: UDP, length 1174
03:12:57.544398 IP node1.42485 > node2.36166: UDP, length 1174
03:12:59.113717 IP node1.50324 > node2.36166: UDP, length 1174
03:12:59.290609 IP node1.43787 > node2.36166: UDP, length 1174
03:13:00.052855 IP node1.32830 > node2.36166: UDP, length 1174
03:13:00.261692 IP node1.53733 > node2.36166: UDP, length 1174
03:13:01.400649 IP node1.55726 > node2.36166: UDP, length 1174
03:13:02.426956 IP node1.33674 > node2.36166: UDP, length 1174
03:13:03.125191 IP node1.43787 > node2.36166: UDP, length 1174
03:13:03.755902 IP node1.36361 > node2.36166: UDP, length 1174
03:13:04.155273 IP node1.50324 > node2.36166: UDP, length 1174
03:13:05.650407 IP node1.33333 > node2.36166: UDP, length 1174
03:13:05.668911 IP node1.44966 > node2.36166: UDP, length 1174
03:13:07.093816 IP node1.43787 > node2.36166: UDP, length 1174
03:13:07.987596 IP node1.34167 > node2.36166: UDP, length 1174
03:13:08.519053 IP node1.50324 > node2.36166: UDP, length 1174
03:13:13.278912 IP node1.35563 > node2.36166: UDP, length 1174
03:13:15.370220 IP node1.55726 > node2.36166: UDP, length 1174
03:13:15.454734 IP node1.32830 > node2.36166: UDP, length 1174
03:13:15.844481 IP node1.42485 > node2.36166: UDP, length 1174
03:13:16.040482 IP node1.34167 > node2.36166: UDP, length 1174
03:13:17.242259 IP node1.43787 > node2.36166: UDP, length 1174
03:13:17.942236 IP node1.34167 > node2.36166: UDP, length 1174
03:13:22.368590 IP node1.40064 > node2.36166: UDP, length 1174
03:13:23.881350 IP node1.56111 > node2.36166: UDP, length 1174
03:13:23.921708 IP node1.50406 > node2.36166: UDP, length 1174
03:13:27.714652 IP node1.50324 > node2.36166: UDP, length 1174
03:13:28.030322 IP node1.50406 > node2.36166: UDP, length 1174
03:13:28.776200 IP node1.32830 > node2.36166: UDP, length 1174
03:13:29.416872 IP node1.50406 > node2.36166: UDP, length 1174
03:13:33.575195 IP node1.44966 > node2.36166: UDP, length 1174
03:13:37.044971 IP node1.33333 > node2.36166: UDP, length 1174
03:13:38.422372 IP node1.53733 > node2.36166: UDP, length 1174
03:13:40.303291 IP node1.36361 > node2.36166: UDP, length 1174
03:13:40.999877 IP node1.43787 > node2.36166: UDP, length 1174
03:13:41.316361 IP node1.35563 > node2.36166: UDP, length 1174
03:13:41.321741 IP node1.55726 > node2.36166: UDP, length 1174
03:13:41.688613 IP node1.33674 > node2.36166: UDP, length 1174
03:13:45.257864 IP node1.55726 > node2.36166: UDP, length 1174
03:13:45.877310 IP node1.33674 > node2.36166: UDP, length 1174
03:13:45.980061 IP node1.40064 > node2.36166: UDP, length 1174
03:13:46.268329 IP node1.42485 > node2.36166: UDP, length 1174
03:13:48.167084 IP node1.44966 > node2.36166: UDP, length 1174
03:13:49.849946 IP node1.33333 > node2.36166: UDP, length 67
03:13:49.864339 IP node1.36361 > node2.36166: UDP, length 67
03:13:49.963674 IP node1.35563 > node2.36166: UDP, length 67
03:13:49.980975 IP node1.40064 > node2.36166: UDP, length 67
03:13:50.092457 IP node1.40064 > node2.36166: UDP, length 1174
03:13:50.108950 IP node1.42485 > node2.36166: UDP, length 67
03:13:50.110504 IP node1.43787 > node2.36166: UDP, length 67
03:13:50.117897 IP node1.33674 > node2.36166: UDP, length 67
03:13:50.140640 IP node1.50324 > node2.36166: UDP, length 67
03:13:50.219739 IP node1.55726 > node2.36166: UDP, length 67
03:13:50.248373 IP node1.53733 > node2.36166: UDP, length 67
03:13:50.254649 IP node1.56111 > node2.36166: UDP, length 67
03:13:50.341468 IP node1.50406 > node2.36166: UDP, length 67
03:13:50.387195 IP node1.34167 > node2.36166: UDP, length 67
03:13:50.514653 IP node1.44966 > node2.36166: UDP, length 67
03:13:50.566215 IP node1.32830 > node2.36166: UDP, length 67
03:13:51.012007 IP node1.34167 > node2.36166: UDP, length 1174
03:13:52.860273 IP node1.50324 > node2.36166: UDP, length 1174
03:13:53.653556 IP node1.34167 > node2.36166: UDP, length 1174
03:13:59.369809 IP node1.56111 > node2.36166: UDP, length 1174
03:14:04.163768 IP node1.50324 > node2.36166: UDP, length 1174
03:14:04.864790 IP node1.32830 > node2.36166: UDP, length 1174
03:14:06.273755 IP node1.42485 > node2.36166: UDP, length 1174
03:14:07.977363 IP node1.50406 > node2.36166: UDP, length 1174
03:14:07.988688 IP node1.33333 > node2.36166: UDP, length 1174
03:14:08.709141 IP node1.40064 > node2.36166: UDP, length 1174
03:14:11.542424 IP node1.43787 > node2.36166: UDP, length 1174
03:14:11.594012 IP node1.53733 > node2.36166: UDP, length 1174
03:14:12.415505 IP node1.42485 > node2.36166: UDP, length 1174
03:14:13.057240 IP node1.50324 > node2.36166: UDP, length 1174
03:14:14.468969 IP node1.55726 > node2.36166: UDP, length 1174
03:14:17.597094 IP node1.36361 > node2.36166: UDP, length 1174
03:14:19.114845 IP node1.53733 > node2.36166: UDP, length 1174
03:14:19.273751 IP node1.40064 > node2.36166: UDP, length 1174
03:14:19.907007 IP node1.43787 > node2.36166: UDP, length 1174
03:14:20.340306 IP node1.35563 > node2.36166: UDP, length 1174
03:14:21.994071 IP node1.44966 > node2.36166: UDP, length 1174
03:14:22.229451 IP node1.32830 > node2.36166: UDP, length 1174
03:14:23.080976 IP node1.32830 > node2.36166: UDP, length 1174
03:14:23.809778 IP node1.33674 > node2.36166: UDP, length 1174
03:14:24.625258 IP node1.33333 > node2.36166: UDP, length 1174
03:14:29.449932 IP node1.50406 > node2.36166: UDP, length 1174
03:14:29.732924 IP node1.42485 > node2.36166: UDP, length 1174
03:14:31.273269 IP node1.56111 > node2.36166: UDP, length 1174
03:14:31.359028 IP node1.34167 > node2.36166: UDP, length 1174
03:14:32.761382 IP node1.40064 > node2.36166: UDP, length 1174
03:14:32.898360 IP node1.33674 > node2.36166: UDP, length 1174
03:14:33.004591 IP node1.33674 > node2.36166: UDP, length 1174
03:14:34.242344 IP node1.55726 > node2.36166: UDP, length 1174
03:14:35.474750 IP node1.32830 > node2.36166: UDP, length 1174
03:14:35.967352 IP node1.42485 > node2.36166: UDP, length 1174
03:14:36.220072 IP node1.33674 > node2.36166: UDP, length 1174
03:14:36.887307 IP node1.53733 > node2.36166: UDP, length 154
03:14:36.903110 IP node1.34167 > node2.36166: UDP, length 154
03:14:37.136825 IP node1.35563 > node2.36166: UDP, length 154
03:14:37.145304 IP node1.50324 > node2.36166: UDP, length 154
03:14:37.337088 IP node1.50406 > node2.36166: UDP, length 154
03:14:37.682781 IP node1.44966 > node2.36166: UDP, length 1174
03:14:37.770015 IP node1.33333 > node2.36166: UDP, length 154
03:14:37.896974 IP node1.53733 > node2.36166: UDP, length 154
03:14:37.916436 IP node1.34167 > node2.36166: UDP, length 154
03:14:38.004955 IP node1.40064 > node2.36166: UDP, length 154
03:14:38.146487 IP node1.35563 > node2.36166: UDP, length 154
03:14:38.153104 IP node1.50324 > node2.36166: UDP, length 154
03:14:38.344495 IP node1.50406 > node2.36166: UDP, length 154
03:14:38.790303 IP node1.33333 > node2.36166: UDP, length 154
03:14:38.904509 IP node1.53733 > node2.36166: UDP, length 154
03:14:38.927859 IP node1.34167 > node2.36166: UDP, length 154
03:14:38.964963 IP node1.36361 > node2.36166: UDP, length 154
03:14:39.009756 IP node1.40064 > node2.36166: UDP, length 154
03:14:39.013598 IP node1.44966 > node2.36166: UDP, length 154
03:14:39.031034 IP node1.43787 > node2.36166: UDP, length 154
03:14:39.152552 IP node1.35563 > node2.36166: UDP, length 154
03:14:39.163780 IP node1.50324 > node2.36166: UDP, length 154
03:14:39.253849 IP node1.33674 > node2.36166: UDP, length 154
03:14:39.353578 IP node1.50406 > node2.36166: UDP, length 154
03:14:39.571452 IP node1.55726 > node2.36166: UDP, length 154
03:14:39.797119 IP node1.56111 > node2.36166: UDP, length 154
03:14:39.802059 IP node1.33333 > node2.36166: UDP, length 154
03:14:39.913441 IP node1.53733 > node2.36166: UDP, length 154
03:14:39.938304 IP node1.34167 > node2.36166: UDP, length 154
03:14:39.974858 IP node1.36361 > node2.36166: UDP, length 154
03:14:40.014759 IP node1.40064 > node2.36166: UDP, length 154
03:14:40.036732 IP node1.44966 > node2.36166: UDP, length 154
03:14:40.037418 IP node1.43787 > node2.36166: UDP, length 154
03:14:40.069851 IP node1.42485 > node2.36166: UDP, length 154
03:14:40.160387 IP node1.35563 > node2.36166: UDP, length 154
03:14:40.171274 IP node1.50324 > node2.36166: UDP, length 154
03:14:40.260031 IP node1.33674 > node2.36166: UDP, length 154
03:14:40.291270 IP node1.32830 > node2.36166: UDP, length 154
03:14:40.361409 IP node1.50406 > node2.36166: UDP, length 154
03:14:40.578490 IP node1.55726 > node2.36166: UDP, length 154
03:14:40.809747 IP node1.33333 > node2.36166: UDP, length 154
03:14:40.816603 IP node1.56111 > node2.36166: UDP, length 154
03:14:40.922505 IP node1.53733 > node2.36166: UDP, length 154
03:14:40.949230 IP node1.34167 > node2.36166: UDP, length 154
03:14:40.979393 IP node1.36361 > node2.36166: UDP, length 154
03:14:41.019694 IP node1.40064 > node2.36166: UDP, length 154
03:14:41.058052 IP node1.44966 > node2.36166: UDP, length 154
03:14:41.067941 IP node1.43787 > node2.36166: UDP, length 154
03:14:41.079052 IP node1.42485 > node2.36166: UDP, length 154
03:14:41.168889 IP node1.35563 > node2.36166: UDP, length 154
03:14:41.180025 IP node1.50324 > node2.36166: UDP, length 154
03:14:41.267857 IP node1.33674 > node2.36166: UDP, length 154
03:14:41.297025 IP node1.32830 > node2.36166: UDP, length 154
03:14:41.310517 IP node1.53733 > node2.36166: UDP, length 1174
03:14:41.371804 IP node1.50406 > node2.36166: UDP, length 154
03:14:41.586613 IP node1.55726 > node2.36166: UDP, length 154
03:14:41.819203 IP node1.33333 > node2.36166: UDP, length 154
03:14:41.829701 IP node1.56111 > node2.36166: UDP, length 154
03:14:41.928612 IP node1.53733 > node2.36166: UDP, length 154
03:14:41.956119 IP node1.34167 > node2.36166: UDP, length 154
03:14:41.987149 IP node1.36361 > node2.36166: UDP, length 154
03:14:42.027527 IP node1.40064 > node2.36166: UDP, length 154
03:14:42.070876 IP node1.44966 > node2.36166: UDP, length 154
03:14:42.084772 IP node1.43787 > node2.36166: UDP, length 154
03:14:42.089070 IP node1.42485 > node2.36166: UDP, length 154
03:14:42.180925 IP node1.35563 > node2.36166: UDP, length 154
03:14:42.187005 IP node1.50324 > node2.36166: UDP, length 154
03:14:42.278648 IP node1.33674 > node2.36166: UDP, length 154
03:14:42.303544 IP node1.32830 > node2.36166: UDP, length 154
03:14:42.383719 IP node1.50406 > node2.36166: UDP, length 154
03:14:42.600979 IP node1.55726 > node2.36166: UDP, length 154
03:14:42.850965 IP node1.33333 > node2.36166: UDP, length 154
03:14:42.852761 IP node1.56111 > node2.36166: UDP, length 154
03:14:42.940921 IP node1.53733 > node2.36166: UDP, length 154
03:14:42.961344 IP node1.34167 > node2.36166: UDP, length 154
03:14:42.992736 IP node1.36361 > node2.36166: UDP, length 154
03:14:43.036080 IP node1.40064 > node2.36166: UDP, length 154
03:14:43.080597 IP node1.44966 > node2.36166: UDP, length 154
03:14:43.098366 IP node1.43787 > node2.36166: UDP, length 154
03:14:43.098593 IP node1.42485 > node2.36166: UDP, length 154
03:14:43.186188 IP node1.35563 > node2.36166: UDP, length 154
03:14:43.191123 IP node1.50324 > node2.36166: UDP, length 154
03:14:43.287073 IP node1.33674 > node2.36166: UDP, length 154
03:14:43.329053 IP node1.32830 > node2.36166: UDP, length 154
03:14:43.386183 IP node1.50324 > node2.36166: UDP, length 1175
03:14:43.394911 IP node1.50406 > node2.36166: UDP, length 154
03:14:43.607111 IP node1.55726 > node2.36166: UDP, length 154
03:14:43.856309 IP node1.33333 > node2.36166: UDP, length 154
03:14:43.867417 IP node1.56111 > node2.36166: UDP, length 154
03:14:43.951009 IP node1.53733 > node2.36166: UDP, length 154
03:14:43.965541 IP node1.34167 > node2.36166: UDP, length 154
03:14:43.999761 IP node1.36361 > node2.36166: UDP, length 154
03:14:44.045917 IP node1.40064 > node2.36166: UDP, length 154
03:14:44.089813 IP node1.44966 > node2.36166: UDP, length 154
03:14:44.105280 IP node1.43787 > node2.36166: UDP, length 154
03:14:44.116995 IP node1.42485 > node2.36166: UDP, length 154
03:14:44.191196 IP node1.35563 > node2.36166: UDP, length 154
03:14:44.202316 IP node1.50324 > node2.36166: UDP, length 154
03:14:44.292005 IP node1.33674 > node2.36166: UDP, length 154
03:14:44.335377 IP node1.32830 > node2.36166: UDP, length 154
03:14:44.402646 IP node1.50406 > node2.36166: UDP, length 154
03:14:44.614541 IP node1.55726 > node2.36166: UDP, length 154
03:14:44.871422 IP node1.33333 > node2.36166: UDP, length 154
03:14:44.887476 IP node1.56111 > node2.36166: UDP, length 154
03:14:44.961389 IP node1.53733 > node2.36166: UDP, length 154
03:14:44.975629 IP node1.34167 > node2.36166: UDP, length 154
03:14:45.010870 IP node1.36361 > node2.36166: UDP, length 154
03:14:45.056584 IP node1.40064 > node2.36166: UDP, length 154
03:14:45.104268 IP node1.44966 > node2.36166: UDP, length 154
03:14:45.119745 IP node1.43787 > node2.36166: UDP, length 154
03:14:45.132253 IP node1.42485 > node2.36166: UDP, length 154
03:14:45.206679 IP node1.35563 > node2.36166: UDP, length 154
03:14:45.214262 IP node1.50324 > node2.36166: UDP, length 154
03:14:45.299744 IP node1.33674 > node2.36166: UDP, length 154
03:14:45.339212 IP node1.32830 > node2.36166: UDP, length 154
03:14:45.400348 IP node1.56111 > node2.36166: UDP, length 1175
03:14:45.409942 IP node1.50406 > node2.36166: UDP, length 154
03:14:45.624473 IP node1.55726 > node2.36166: UDP, length 154
03:14:45.878609 IP node1.33333 > node2.36166: UDP, length 154
03:14:45.893747 IP node1.56111 > node2.36166: UDP, length 154
03:14:45.973893 IP node1.53733 > node2.36166: UDP, length 154
03:14:45.981554 IP node1.34167 > node2.36166: UDP, length 154
03:14:46.016830 IP node1.36361 > node2.36166: UDP, length 154
03:14:46.066485 IP node1.40064 > node2.36166: UDP, length 154
03:14:46.118006 IP node1.44966 > node2.36166: UDP, length 154
03:14:46.133601 IP node1.43787 > node2.36166: UDP, length 154
03:14:46.139941 IP node1.42485 > node2.36166: UDP, length 154
03:14:46.217731 IP node1.35563 > node2.36166: UDP, length 154
03:14:46.225930 IP node1.50324 > node2.36166: UDP, length 154
03:14:46.310170 IP node1.33674 > node2.36166: UDP, length 154
03:14:46.343336 IP node1.32830 > node2.36166: UDP, length 154
03:14:46.413603 IP node1.50406 > node2.36166: UDP, length 154
03:14:46.638485 IP node1.55726 > node2.36166: UDP, length 154
03:14:46.889500 IP node1.33333 > node2.36166: UDP, length 154
03:14:46.900554 IP node1.56111 > node2.36166: UDP, length 154
03:14:46.985495 IP node1.53733 > node2.36166: UDP, length 154
03:14:46.989501 IP node1.34167 > node2.36166: UDP, length 154
03:14:47.026442 IP node1.36361 > node2.36166: UDP, length 154
03:14:47.076555 IP node1.40064 > node2.36166: UDP, length 154
03:14:47.128812 IP node1.44966 > node2.36166: UDP, length 154
03:14:47.142616 IP node1.43787 > node2.36166: UDP, length 154
03:14:47.146077 IP node1.42485 > node2.36166: UDP, length 154
03:14:47.229212 IP node1.35563 > node2.36166: UDP, length 154
03:14:47.235173 IP node1.50324 > node2.36166: UDP, length 154
03:14:47.283802 IP node1.36361 > node2.36166: UDP, length 1175
03:14:47.315692 IP node1.33674 > node2.36166: UDP, length 154
03:14:47.351241 IP node1.32830 > node2.36166: UDP, length 154
03:14:47.419589 IP node1.50406 > node2.36166: UDP, length 154
03:14:47.651655 IP node1.55726 > node2.36166: UDP, length 154
03:14:47.905004 IP node1.56111 > node2.36166: UDP, length 154
03:14:47.906245 IP node1.33333 > node2.36166: UDP, length 154
03:14:47.986293 IP node1.53733 > node2.36166: UDP, length 154
03:14:47.990249 IP node1.34167 > node2.36166: UDP, length 154
03:14:48.032506 IP node1.36361 > node2.36166: UDP, length 154
03:14:48.082867 IP node1.40064 > node2.36166: UDP, length 154
03:14:48.136895 IP node1.44966 > node2.36166: UDP, length 154
03:14:48.149099 IP node1.43787 > node2.36166: UDP, length 154
03:14:48.153788 IP node1.42485 > node2.36166: UDP, length 154
03:14:48.230475 IP node1.35563 > node2.36166: UDP, length 154
03:14:48.236236 IP node1.50324 > node2.36166: UDP, length 154
03:14:48.324013 IP node1.33674 > node2.36166: UDP, length 154
03:14:48.362532 IP node1.32830 > node2.36166: UDP, length 154
03:14:48.419217 IP node1.50406 > node2.36166: UDP, length 154
03:14:48.665409 IP node1.55726 > node2.36166: UDP, length 154
03:14:48.906791 IP node1.33333 > node2.36166: UDP, length 154
03:14:48.910097 IP node1.56111 > node2.36166: UDP, length 154
03:14:49.040826 IP node1.36361 > node2.36166: UDP, length 154
03:14:49.084354 IP node1.40064 > node2.36166: UDP, length 154
03:14:49.146193 IP node1.44966 > node2.36166: UDP, length 154
03:14:49.153926 IP node1.43787 > node2.36166: UDP, length 154
03:14:49.160052 IP node1.42485 > node2.36166: UDP, length 154
03:14:49.331087 IP node1.33674 > node2.36166: UDP, length 154
03:14:49.368242 IP node1.32830 > node2.36166: UDP, length 154
03:14:49.672083 IP node1.55726 > node2.36166: UDP, length 154
03:14:49.915348 IP node1.56111 > node2.36166: UDP, length 154
03:14:50.042386 IP node1.36361 > node2.36166: UDP, length 154
03:14:50.147258 IP node1.44966 > node2.36166: UDP, length 154
03:14:50.155182 IP node1.43787 > node2.36166: UDP, length 154
03:14:50.165569 IP node1.42485 > node2.36166: UDP, length 154
03:14:50.327054 IP node1.35563 > node2.36166: UDP, length 1175
03:14:50.335199 IP node1.33674 > node2.36166: UDP, length 154
03:14:50.375594 IP node1.32830 > node2.36166: UDP, length 154
03:14:50.670958 IP node1.55726 > node2.36166: UDP, length 154
03:14:50.916210 IP node1.56111 > node2.36166: UDP, length 154
03:14:51.166440 IP node1.42485 > node2.36166: UDP, length 154
03:14:51.376792 IP node1.32830 > node2.36166: UDP, length 154
03:14:51.598119 IP node1.33333 > node2.36166: UDP, length 1175
03:14:52.433899 IP node1.43787 > node2.36166: UDP, length 1175
03:14:53.406941 IP node1.43787 > node2.36166: UDP, length 1175
03:14:53.474629 IP node1.50406 > node2.36166: UDP, length 1175
03:14:54.380599 IP node1.32830 > node2.36166: UDP, length 1175
03:14:55.028806 IP node1.36361 > node2.36166: UDP, length 1175
03:14:55.115525 IP node1.43787 > node2.36166: UDP, length 1175
03:14:57.748859 IP node1.44966 > node2.36166: UDP, length 1175
03:14:58.890927 IP node1.35563 > node2.36166: UDP, length 1175
03:14:59.308359 IP node1.56111 > node2.36166: UDP, length 1175
03:14:59.403447 IP node1.43787 > node2.36166: UDP, length 1175
03:14:59.732441 IP node1.50406 > node2.36166: UDP, length 1175
03:15:01.152504 IP node1.43787 > node2.36166: UDP, length 1175
03:15:03.401097 IP node1.33333 > node2.36166: UDP, length 1175
03:15:05.767768 IP node1.42485 > node2.36166: UDP, length 1175
03:15:06.373257 IP node1.33674 > node2.36166: UDP, length 1175
03:15:06.562005 IP node1.44966 > node2.36166: UDP, length 1175
03:15:08.671347 IP node1.34167 > node2.36166: UDP, length 1175
03:15:10.140924 IP node1.36361 > node2.36166: UDP, length 1175
03:15:10.310662 IP node1.53733 > node2.36166: UDP, length 1175
03:15:11.030587 IP node1.40064 > node2.36166: UDP, length 1175
03:15:12.884074 IP node1.35563 > node2.36166: UDP, length 1175
03:15:13.252214 IP node1.55726 > node2.36166: UDP, length 1175
03:15:14.302699 IP node1.56111 > node2.36166: UDP, length 1175
03:15:19.968354 IP node1.50324 > node2.36166: UDP, length 1175
03:15:20.705048 IP node1.36361 > node2.36166: UDP, length 1175
03:15:22.220575 IP node1.32830 > node2.36166: UDP, length 1175
03:15:24.019176 IP node1.33674 > node2.36166: UDP, length 1175
03:15:24.715207 IP node1.50406 > node2.36166: UDP, length 1175
03:15:25.047811 IP node1.36361 > node2.36166: UDP, length 1175
03:15:26.509354 IP node1.34167 > node2.36166: UDP, length 1175
03:15:27.903442 IP node1.43787 > node2.36166: UDP, length 1175
03:15:28.413238 IP node1.42485 > node2.36166: UDP, length 1175
03:15:29.145256 IP node1.56111 > node2.36166: UDP, length 1175
03:15:31.491799 IP node1.33333 > node2.36166: UDP, length 1175
03:15:31.703443 IP node1.44966 > node2.36166: UDP, length 1175
03:15:34.610402 IP node1.32830 > node2.36166: UDP, length 1175
03:15:37.230411 IP node1.53733 > node2.36166: UDP, length 1175
03:15:38.790820 IP node1.55726 > node2.36166: UDP, length 1175
03:15:40.246521 IP node1.40064 > node2.36166: UDP, length 1175
03:15:40.795520 IP node1.43787 > node2.36166: UDP, length 1175
03:15:41.130981 IP node1.35563 > node2.36166: UDP, length 1175
03:15:41.446499 IP node1.34167 > node2.36166: UDP, length 1175
03:15:41.806227 IP node1.44966 > node2.36166: UDP, length 1175
03:15:42.556484 IP node1.43787 > node2.36166: UDP, length 1175
03:15:43.266943 IP node1.56111 > node2.36166: UDP, length 1175
03:15:45.960679 IP node1.33333 > node2.36166: UDP, length 1175
03:15:50.518760 IP node1.34167 > node2.36166: UDP, length 1175
03:15:50.817412 IP node1.56111 > node2.36166: UDP, length 1175
03:15:51.093570 IP node1.36361 > node2.36166: UDP, length 1175
03:15:52.134194 IP node1.55726 > node2.36166: UDP, length 1175
03:15:52.265618 IP node1.50406 > node2.36166: UDP, length 1175
03:15:53.561697 IP node1.44966 > node2.36166: UDP, length 1175
03:15:54.529877 IP node1.56111 > node2.36166: UDP, length 1175
03:15:59.294942 IP node1.50324 > node2.36166: UDP, length 1175
03:15:59.510688 IP node1.33674 > node2.36166: UDP, length 1175
03:15:59.593627 IP node1.42485 > node2.36166: UDP, length 1175
03:16:01.813114 IP node1.53733 > node2.36166: UDP, length 1175
03:16:02.676312 IP node1.33674 > node2.36166: UDP, length 1175
03:16:05.022782 IP node1.32830 > node2.36166: UDP, length 1175

