03:11:34.332853 IP node1.33333 > node1.40064: UDP, length 113
03:11:34.391622 IP node1.40064 > node1.33333: UDP, length 113
03:11:35.152735 IP node1.40064 > node1.44966: UDP, length 113
03:11:35.152908 IP node1.33333 > node1.44966: UDP, length 113
03:11:35.216896 IP node1.33333 > node1.36361: UDP, length 113
03:11:35.217155 IP node1.40064 > node1.36361: UDP, length 113
03:11:35.246183 IP node1.33333 > node1.43787: UDP, length 113
03:11:35.246290 IP node1.40064 > node1.43787: UDP, length 113
03:11:35.248148 IP node1.36361 > node1.44966: UDP, length 112
03:11:35.275488 IP node1.44966 > node1.43787: UDP, length 113
03:11:35.283456 IP node1.44966 > node1.36361: UDP, length 113
03:11:35.311101 IP node1.36361 > node1.43787: UDP, length 112
03:11:35.313443 IP node1.43787 > node1.44966: UDP, length 113
03:11:35.315300 IP node1.43787 > node1.36361: UDP, length 113
03:11:35.362480 IP node1.43787 > node1.33674: UDP, length 113
03:11:35.365770 IP node1.33674 > node1.44966: UDP, length 112
03:11:35.365872 IP node1.44966 > node1.33674: UDP, length 113
03:11:35.367665 IP node1.33333 > node1.33674: UDP, length 113
03:11:35.368641 IP node1.36361 > node1.33674: UDP, length 112
03:11:35.371046 IP node1.40064 > node1.33674: UDP, length 113
03:11:35.402783 IP node1.33674 > node1.43787: UDP, length 112
03:11:35.403138 IP node1.33674 > node1.36361: UDP, length 112
03:11:35.887406 IP node1.33674 > node1.55726: UDP, length 112
03:11:35.887655 IP node1.43787 > node1.55726: UDP, length 113
03:11:35.887690 IP node1.36361 > node1.55726: UDP, length 112
03:11:35.888705 IP node1.44966 > node1.55726: UDP, length 113
03:11:35.892364 IP node1.40064 > node1.55726: UDP, length 113
03:11:35.892848 IP node1.33333 > node1.55726: UDP, length 113
03:11:35.903419 IP node1.44966 > node1.56111: UDP, length 113
03:11:35.904277 IP node1.33674 > node1.56111: UDP, length 112
03:11:35.905165 IP node1.43787 > node1.56111: UDP, length 113
03:11:35.905783 IP node1.36361 > node1.56111: UDP, length 112
03:11:35.908552 IP node1.40064 > node1.56111: UDP, length 113
03:11:35.908982 IP node1.56111 > node1.33674: UDP, length 113
03:11:35.909400 IP node1.33333 > node1.56111: UDP, length 113
03:11:35.911780 IP node1.56111 > node1.55726: UDP, length 113
03:11:35.974898 IP node1.55726 > node1.56111: UDP, length 113
03:11:36.097781 IP node1.56111 > node1.42485: UDP, length 113
03:11:36.098124 IP node1.43787 > node1.42485: UDP, length 113
03:11:36.098829 IP node1.55726 > node1.42485: UDP, length 113
03:11:36.099478 IP node1.33674 > node1.42485: UDP, length 112
03:11:36.099675 IP node1.44966 > node1.42485: UDP, length 113
03:11:36.099848 IP node1.36361 > node1.42485: UDP, length 112
03:11:36.101347 IP node1.40064 > node1.42485: UDP, length 113
03:11:36.102440 IP node1.33333 > node1.42485: UDP, length 113
03:11:36.211532 IP node1.42485 > node1.56111: UDP, length 113
03:11:36.211649 IP node1.42485 > node1.55726: UDP, length 113
03:11:36.419128 IP node1.32830 > node1.42485: UDP, length 113
03:11:36.420057 IP node1.42485 > node1.32830: UDP, length 113
03:11:36.420671 IP node1.43787 > node1.32830: UDP, length 113
03:11:36.422023 IP node1.40064 > node1.32830: UDP, length 113
03:11:36.422205 IP node1.33333 > node1.32830: UDP, length 113
03:11:36.422390 IP node1.55726 > node1.32830: UDP, length 113
03:11:36.422785 IP node1.33674 > node1.32830: UDP, length 112
03:11:36.422954 IP node1.56111 > node1.32830: UDP, length 113
03:11:36.423190 IP node1.44966 > node1.32830: UDP, length 113
03:11:36.423449 IP node1.36361 > node1.32830: UDP, length 112
03:11:36.519991 IP node1.32830 > node1.53733: UDP, length 113
03:11:36.520351 IP node1.42485 > node1.53733: UDP, length 113
03:11:36.520563 IP node1.36361 > node1.53733: UDP, length 112
03:11:36.521260 IP node1.44966 > node1.53733: UDP, length 113
03:11:36.521635 IP node1.56111 > node1.53733: UDP, length 113
03:11:36.522972 IP node1.43787 > node1.53733: UDP, length 113
03:11:36.525595 IP node1.55726 > node1.53733: UDP, length 113
03:11:36.528431 IP node1.33674 > node1.53733: UDP, length 112
03:11:36.544683 IP node1.40064 > node1.53733: UDP, length 113
03:11:36.553348 IP node1.33333 > node1.53733: UDP, length 113
03:11:36.612947 IP node1.53733 > node1.32830: UDP, length 112
03:11:36.619680 IP node1.33674 > node1.34167: UDP, length 112
03:11:36.621542 IP node1.44966 > node1.34167: UDP, length 113
03:11:36.622548 IP node1.43787 > node1.34167: UDP, length 113
03:11:36.623691 IP node1.36361 > node1.34167: UDP, length 112
03:11:36.625431 IP node1.42485 > node1.34167: UDP, length 113
03:11:36.625579 IP node1.32830 > node1.34167: UDP, length 113
03:11:36.626155 IP node1.33333 > node1.34167: UDP, length 113
03:11:36.626180 IP node1.40064 > node1.34167: UDP, length 113
03:11:36.626288 IP node1.56111 > node1.34167: UDP, length 113
03:11:36.627597 IP node1.55726 > node1.34167: UDP, length 113
03:11:36.635809 IP node1.53733 > node1.34167: UDP, length 112
03:11:36.643959 IP node1.34167 > node1.32830: UDP, length 113
03:11:36.644541 IP node1.34167 > node1.53733: UDP, length 113
03:11:36.687196 IP node1.35563 > node1.53733: UDP, length 113
03:11:36.687265 IP node1.35563 > node1.32830: UDP, length 113
03:11:36.687947 IP node1.40064 > node1.35563: UDP, length 113
03:11:36.688071 IP node1.34167 > node1.35563: UDP, length 113
03:11:36.688237 IP node1.33674 > node1.35563: UDP, length 112
03:11:36.688522 IP node1.42485 > node1.35563: UDP, length 113
03:11:36.691144 IP node1.32830 > node1.35563: UDP, length 113
03:11:36.691730 IP node1.36361 > node1.35563: UDP, length 112
03:11:36.692664 IP node1.43787 > node1.35563: UDP, length 113
03:11:36.693817 IP node1.56111 > node1.35563: UDP, length 113
03:11:36.694173 IP node1.33333 > node1.35563: UDP, length 113
03:11:36.695517 IP node1.44966 > node1.35563: UDP, length 113
03:11:36.696935 IP node1.53733 > node1.35563: UDP, length 112
03:11:36.698918 IP node1.55726 > node1.35563: UDP, length 113
03:11:36.768134 IP node1.35563 > node1.34167: UDP, length 113
03:11:36.871988 IP node1.50324 > node1.35563: UDP, length 113
03:11:36.876695 IP node1.33674 > node1.50324: UDP, length 112
03:11:36.877394 IP node1.35563 > node1.50324: UDP, length 113
03:11:36.879156 IP node1.32830 > node1.50324: UDP, length 113
03:11:36.879484 IP node1.42485 > node1.50324: UDP, length 113
03:11:36.880604 IP node1.43787 > node1.50324: UDP, length 113
03:11:36.881033 IP node1.36361 > node1.50324: UDP, length 112
03:11:36.881145 IP node1.55726 > node1.50324: UDP, length 113
03:11:36.881335 IP node1.44966 > node1.50324: UDP, length 113
03:11:36.881553 IP node1.33333 > node1.50324: UDP, length 113
03:11:36.882071 IP node1.53733 > node1.50324: UDP, length 112
03:11:36.882172 IP node1.56111 > node1.50324: UDP, length 113
03:11:36.883528 IP node1.34167 > node1.50324: UDP, length 113
03:11:36.888142 IP node1.40064 > node1.50324: UDP, length 113
03:11:36.974109 IP node1.34167 > node1.35563: UDP, length 87
03:11:36.975356 IP node1.35563 > node1.34167: UDP, length 94
03:11:36.992682 IP node1.43787 > node1.50406: UDP, length 113
03:11:36.993667 IP node1.44966 > node1.50406: UDP, length 113
03:11:36.994836 IP node1.55726 > node1.50406: UDP, length 113
03:11:36.995113 IP node1.33333 > node1.50406: UDP, length 113
03:11:36.995888 IP node1.34167 > node1.50406: UDP, length 113
03:11:36.995936 IP node1.33674 > node1.50406: UDP, length 112
03:11:36.996366 IP node1.32830 > node1.50406: UDP, length 113
03:11:36.996488 IP node1.50324 > node1.50406: UDP, length 113
03:11:36.997018 IP node1.35563 > node1.50406: UDP, length 113
03:11:36.997228 IP node1.40064 > node1.50406: UDP, length 113
03:11:36.997779 IP node1.36361 > node1.50406: UDP, length 112
03:11:36.997970 IP node1.42485 > node1.50406: UDP, length 113
03:11:36.998505 IP node1.53733 > node1.50406: UDP, length 112
03:11:36.999288 IP node1.56111 > node1.50406: UDP, length 113
03:11:37.005441 IP node1.50406 > node1.50324: UDP, length 113
03:11:37.539918 IP node1.50324 > node1.33333: UDP, length 113
03:11:37.540503 IP node1.42485 > node1.33333: UDP, length 113
03:11:37.540719 IP node1.35563 > node1.33333: UDP, length 113
03:11:37.540859 IP node1.32830 > node1.33333: UDP, length 113
03:11:37.541421 IP node1.43787 > node1.33333: UDP, length 113
03:11:37.541558 IP node1.40064 > node1.33333: UDP, length 113
03:11:37.541564 IP node1.33674 > node1.33333: UDP, length 112
03:11:37.542713 IP node1.56111 > node1.33333: UDP, length 113
03:11:37.542905 IP node1.53733 > node1.33333: UDP, length 112
03:11:37.543124 IP node1.44966 > node1.33333: UDP, length 113
03:11:37.543451 IP node1.34167 > node1.33333: UDP, length 113
03:11:37.544391 IP node1.50406 > node1.33333: UDP, length 113
03:11:37.544508 IP node1.55726 > node1.33333: UDP, length 113
03:11:37.548919 IP node1.36361 > node1.33333: UDP, length 112
03:11:37.812062 IP node1.50324 > node1.40064: UDP, length 113
03:11:37.813941 IP node1.50406 > node1.40064: UDP, length 113
03:11:37.814095 IP node1.42485 > node1.40064: UDP, length 113
03:11:37.814794 IP node1.35563 > node1.40064: UDP, length 113
03:11:37.815580 IP node1.55726 > node1.40064: UDP, length 113
03:11:37.816500 IP node1.32830 > node1.40064: UDP, length 113
03:11:37.816656 IP node1.56111 > node1.40064: UDP, length 113
03:11:37.816722 IP node1.34167 > node1.40064: UDP, length 113
03:11:37.816813 IP node1.44966 > node1.40064: UDP, length 113
03:11:37.817060 IP node1.43787 > node1.40064: UDP, length 113
03:11:37.817829 IP node1.33674 > node1.40064: UDP, length 112
03:11:37.817999 IP node1.36361 > node1.40064: UDP, length 112
03:11:37.818092 IP node1.33333 > node1.40064: UDP, length 113
03:11:37.819319 IP node1.53733 > node1.40064: UDP, length 112
03:11:38.649103 IP node1.53733 > node1.44966: UDP, length 112
03:11:38.649386 IP node1.35563 > node1.44966: UDP, length 113
03:11:38.649872 IP node1.36361 > node1.44966: UDP, length 112
03:11:38.650213 IP node1.33333 > node1.44966: UDP, length 113
03:11:38.650231 IP node1.33674 > node1.44966: UDP, length 112
03:11:38.650326 IP node1.43787 > node1.44966: UDP, length 113
03:11:38.650344 IP node1.50324 > node1.44966: UDP, length 113
03:11:38.650472 IP node1.50406 > node1.44966: UDP, length 113
03:11:38.650618 IP node1.34167 > node1.44966: UDP, length 113
03:11:38.650885 IP node1.40064 > node1.44966: UDP, length 113
03:11:38.651508 IP node1.42485 > node1.44966: UDP, length 113
03:11:38.651681 IP node1.32830 > node1.44966: UDP, length 113
03:11:38.652646 IP node1.55726 > node1.44966: UDP, length 113
03:11:38.653806 IP node1.56111 > node1.44966: UDP, length 113
03:11:38.698079 IP node1.40064 > node1.36361: UDP, length 113
03:11:38.698186 IP node1.32830 > node1.36361: UDP, length 113
03:11:38.698366 IP node1.55726 > node1.36361: UDP, length 113
03:11:38.698625 IP node1.33674 > node1.36361: UDP, length 112
03:11:38.699178 IP node1.33333 > node1.36361: UDP, length 113
03:11:38.699187 IP node1.44966 > node1.36361: UDP, length 113
03:11:38.699976 IP node1.35563 > node1.36361: UDP, length 113
03:11:38.699984 IP node1.53733 > node1.36361: UDP, length 112
03:11:38.700258 IP node1.56111 > node1.36361: UDP, length 113
03:11:38.700443 IP node1.34167 > node1.36361: UDP, length 113
03:11:38.701747 IP node1.43787 > node1.36361: UDP, length 113
03:11:38.701960 IP node1.50406 > node1.36361: UDP, length 113
03:11:38.702036 IP node1.50324 > node1.36361: UDP, length 113
03:11:38.702913 IP node1.42485 > node1.36361: UDP, length 113
03:11:38.759846 IP node1.35563 > node1.43787: UDP, length 113
03:11:38.760683 IP node1.50324 > node1.43787: UDP, length 113
03:11:38.761301 IP node1.40064 > node1.43787: UDP, length 113
03:11:38.761687 IP node1.32830 > node1.43787: UDP, length 113
03:11:38.761795 IP node1.42485 > node1.43787: UDP, length 113
03:11:38.762665 IP node1.33333 > node1.43787: UDP, length 113
03:11:38.762968 IP node1.44966 > node1.43787: UDP, length 113
03:11:38.763272 IP node1.50406 > node1.43787: UDP, length 113
03:11:38.763758 IP node1.33674 > node1.43787: UDP, length 112
03:11:38.763960 IP node1.55726 > node1.43787: UDP, length 113
03:11:38.764677 IP node1.36361 > node1.43787: UDP, length 112
03:11:38.764830 IP node1.56111 > node1.43787: UDP, length 113
03:11:38.765183 IP node1.53733 > node1.43787: UDP, length 112
03:11:38.765353 IP node1.34167 > node1.43787: UDP, length 113
03:11:38.861276 IP node1.50406 > node1.33674: UDP, length 113
03:11:38.861994 IP node1.50324 > node1.33674: UDP, length 113
03:11:38.862208 IP node1.34167 > node1.33674: UDP, length 113
03:11:38.862429 IP node1.43787 > node1.33674: UDP, length 113
03:11:38.864363 IP node1.56111 > node1.33674: UDP, length 113
03:11:38.865193 IP node1.55726 > node1.33674: UDP, length 113
03:11:38.865250 IP node1.35563 > node1.33674: UDP, length 113
03:11:38.865325 IP node1.40064 > node1.33674: UDP, length 113
03:11:38.865434 IP node1.32830 > node1.33674: UDP, length 113
03:11:38.865539 IP node1.42485 > node1.33674: UDP, length 113
03:11:38.865633 IP node1.33333 > node1.33674: UDP, length 113
03:11:38.865671 IP node1.53733 > node1.33674: UDP, length 112
03:11:38.865857 IP node1.44966 > node1.33674: UDP, length 113
03:11:38.866393 IP node1.36361 > node1.33674: UDP, length 112
03:11:39.384073 IP node1.44966 > node1.55726: UDP, length 113
03:11:39.384132 IP node1.40064 > node1.55726: UDP, length 113
03:11:39.384232 IP node1.33333 > node1.55726: UDP, length 113
03:11:39.384344 IP node1.42485 > node1.55726: UDP, length 113
03:11:39.384694 IP node1.50324 > node1.55726: UDP, length 113
03:11:39.384827 IP node1.33674 > node1.55726: UDP, length 112
03:11:39.385078 IP node1.43787 > node1.55726: UDP, length 113
03:11:39.385137 IP node1.50406 > node1.55726: UDP, length 113
03:11:39.385484 IP node1.34167 > node1.55726: UDP, length 113
03:11:39.385911 IP node1.56111 > node1.55726: UDP, length 113
03:11:39.385952 IP node1.32830 > node1.55726: UDP, length 113
03:11:39.386725 IP node1.53733 > node1.55726: UDP, length 112
03:11:39.387904 IP node1.36361 > node1.55726: UDP, length 112
03:11:39.388309 IP node1.35563 > node1.55726: UDP, length 113
03:11:39.402438 IP node1.33333 > node1.56111: UDP, length 113
03:11:39.402581 IP node1.44966 > node1.56111: UDP, length 113
03:11:39.403847 IP node1.55726 > node1.56111: UDP, length 113
03:11:39.403886 IP node1.32830 > node1.56111: UDP, length 113
03:11:39.404987 IP node1.33674 > node1.56111: UDP, length 112
03:11:39.406061 IP node1.50406 > node1.56111: UDP, length 113
03:11:39.406131 IP node1.53733 > node1.56111: UDP, length 112
03:11:39.406680 IP node1.35563 > node1.56111: UDP, length 113
03:11:39.427114 IP node1.43787 > node1.56111: UDP, length 113
03:11:39.428030 IP node1.50324 > node1.56111: UDP, length 113
03:11:39.428820 IP node1.34167 > node1.56111: UDP, length 113
03:11:39.429338 IP node1.42485 > node1.56111: UDP, length 113
03:11:39.434535 IP node1.36361 > node1.56111: UDP, length 112
03:11:39.435050 IP node1.40064 > node1.56111: UDP, length 113
03:11:39.600138 IP node1.44966 > node1.42485: UDP, length 113
03:11:39.600230 IP node1.33674 > node1.42485: UDP, length 112
03:11:39.600397 IP node1.33333 > node1.42485: UDP, length 113
03:11:39.600681 IP node1.32830 > node1.42485: UDP, length 113
03:11:39.601634 IP node1.40064 > node1.42485: UDP, length 113
03:11:39.601880 IP node1.43787 > node1.42485: UDP, length 113
03:11:39.601948 IP node1.50324 > node1.42485: UDP, length 113
03:11:39.602017 IP node1.53733 > node1.42485: UDP, length 112
03:11:39.602348 IP node1.35563 > node1.42485: UDP, length 113
03:11:39.602820 IP node1.36361 > node1.42485: UDP, length 112
03:11:39.603259 IP node1.56111 > node1.42485: UDP, length 113
03:11:39.605442 IP node1.55726 > node1.42485: UDP, length 113
03:11:39.607247 IP node1.50406 > node1.42485: UDP, length 113
03:11:39.609730 IP node1.34167 > node1.42485: UDP, length 113
03:11:39.662701 IP node1.55726 > node1.56111: UDP, length 87
03:11:39.663408 IP node1.56111 > node1.55726: UDP, length 94
03:11:39.866675 IP node1.55726 > node1.32830: UDP, length 113
03:11:39.867280 IP node1.53733 > node1.32830: UDP, length 112
03:11:39.876052 IP node1.50324 > node1.32830: UDP, length 113
03:11:39.876804 IP node1.36361 > node1.32830: UDP, length 112
03:11:39.876893 IP node1.33333 > node1.32830: UDP, length 113
03:11:39.877005 IP node1.56111 > node1.32830: UDP, length 113
03:11:39.880635 IP node1.44966 > node1.32830: UDP, length 113
03:11:39.881881 IP node1.42485 > node1.32830: UDP, length 113
03:11:39.883235 IP node1.34167 > node1.32830: UDP, length 113
03:11:39.885067 IP node1.35563 > node1.32830: UDP, length 113
03:11:39.885433 IP node1.40064 > node1.32830: UDP, length 113
03:11:39.889158 IP node1.33674 > node1.32830: UDP, length 112
03:11:39.900683 IP node1.43787 > node1.32830: UDP, length 113
03:11:39.909371 IP node1.50406 > node1.32830: UDP, length 113

