03:11:30.386946 IP node4.36486 > node4.48590: UDP, length 112
03:11:30.422950 IP node4.48590 > node4.36486: UDP, length 113
03:11:30.495628 IP node4.36486 > node4.44113: UDP, length 112
03:11:30.528700 IP node4.36499 > node4.44113: UDP, length 113
03:11:30.528782 IP node4.36499 > node4.48590: UDP, length 113
03:11:30.532606 IP node4.36486 > node4.36499: UDP, length 112
03:11:30.535709 IP node4.36499 > node4.36486: UDP, length 113
03:11:30.537895 IP node4.48590 > node4.36499: UDP, length 113
03:11:30.538021 IP node4.48590 > node4.44113: UDP, length 113
03:11:30.574934 IP node4.44113 > node4.36486: UDP, length 113
03:11:30.575972 IP node4.44113 > node4.48590: UDP, length 113
03:11:30.578323 IP node4.44113 > node4.36499: UDP, length 113
03:11:30.656333 IP node4.48590 > node4.58460: UDP, length 113
03:11:30.656678 IP node4.36486 > node4.58460: UDP, length 112
03:11:30.656857 IP node4.44113 > node4.58460: UDP, length 113
03:11:30.657833 IP node4.36499 > node4.58460: UDP, length 113
03:11:30.681187 IP node4.58460 > node4.48590: UDP, length 113
03:11:30.688746 IP node4.58460 > node4.44113: UDP, length 113
03:11:30.689090 IP node4.58460 > node4.36499: UDP, length 113
03:11:30.821115 IP node4.36451 > node4.44113: UDP, length 113
03:11:30.822219 IP node4.36451 > node4.36499: UDP, length 113
03:11:30.822422 IP node4.36451 > node4.58460: UDP, length 113
03:11:30.828500 IP node4.36499 > node4.36451: UDP, length 113
03:11:30.829215 IP node4.48590 > node4.36451: UDP, length 113
03:11:30.831158 IP node4.44113 > node4.36451: UDP, length 113
03:11:30.832545 IP node4.36486 > node4.36451: UDP, length 112
03:11:30.837066 IP node4.58460 > node4.36451: UDP, length 113
03:11:30.990236 IP node4.58460 > node4.59422: UDP, length 113
03:11:30.990276 IP node4.36451 > node4.59422: UDP, length 113
03:11:30.991647 IP node4.36499 > node4.59422: UDP, length 113
03:11:30.992323 IP node4.36486 > node4.59422: UDP, length 112
03:11:30.992362 IP node4.48590 > node4.59422: UDP, length 113
03:11:30.992482 IP node4.44113 > node4.59422: UDP, length 113
03:11:31.031204 IP node4.58460 > node4.51500: UDP, length 113
03:11:31.031279 IP node4.36451 > node4.51500: UDP, length 113
03:11:31.032773 IP node4.48590 > node4.51500: UDP, length 113
03:11:31.033119 IP node4.36499 > node4.51500: UDP, length 113
03:11:31.034802 IP node4.36486 > node4.51500: UDP, length 112
03:11:31.036013 IP node4.59422 > node4.51500: UDP, length 113
03:11:31.036492 IP node4.59422 > node4.36451: UDP, length 113
03:11:31.037788 IP node4.44113 > node4.51500: UDP, length 113
03:11:31.113009 IP node4.58460 > node4.58465: UDP, length 113
03:11:31.113572 IP node4.36486 > node4.58465: UDP, length 112
03:11:31.115357 IP node4.36451 > node4.58465: UDP, length 113
03:11:31.115956 IP node4.48590 > node4.58465: UDP, length 113
03:11:31.116462 IP node4.44113 > node4.58465: UDP, length 113
03:11:31.117025 IP node4.36499 > node4.58465: UDP, length 113
03:11:31.117342 IP node4.59422 > node4.58465: UDP, length 113
03:11:31.132484 IP node4.51500 > node4.59422: UDP, length 113
03:11:31.134641 IP node4.51500 > node4.58465: UDP, length 113
03:11:31.142729 IP node4.49214 > node4.59422: UDP, length 113
03:11:31.142945 IP node4.49214 > node4.51500: UDP, length 113
03:11:31.143679 IP node4.49214 > node4.58465: UDP, length 113
03:11:31.147249 IP node4.58460 > node4.49214: UDP, length 113
03:11:31.148665 IP node4.59422 > node4.49214: UDP, length 113
03:11:31.148894 IP node4.36451 > node4.49214: UDP, length 113
03:11:31.153505 IP node4.36499 > node4.49214: UDP, length 113
03:11:31.153841 IP node4.44113 > node4.49214: UDP, length 113
03:11:31.154036 IP node4.48590 > node4.49214: UDP, length 113
03:11:31.155296 IP node4.36486 > node4.49214: UDP, length 112
03:11:31.156410 IP node4.38789 > node4.59422: UDP, length 113
03:11:31.157266 IP node4.36451 > node4.38789: UDP, length 113
03:11:31.157532 IP node4.59422 > node4.38789: UDP, length 113
03:11:31.158799 IP node4.38789 > node4.51500: UDP, length 113
03:11:31.159196 IP node4.51500 > node4.49214: UDP, length 113
03:11:31.159250 IP node4.51500 > node4.38789: UDP, length 113
03:11:31.159459 IP node4.38789 > node4.58465: UDP, length 113
03:11:31.159939 IP node4.38789 > node4.49214: UDP, length 113
03:11:31.160657 IP node4.36486 > node4.38789: UDP, length 112
03:11:31.162226 IP node4.38789 > node4.36451: UDP, length 113
03:11:31.166157 IP node4.48590 > node4.38789: UDP, length 113
03:11:31.166529 IP node4.36499 > node4.38789: UDP, length 113
03:11:31.168310 IP node4.44113 > node4.38789: UDP, length 113
03:11:31.172510 IP node4.58460 > node4.38789: UDP, length 113
03:11:31.179804 IP node4.49214 > node4.38789: UDP, length 113
03:11:31.197341 IP node4.36499 > node4.44091: UDP, length 113
03:11:31.198090 IP node4.59422 > node4.44091: UDP, length 113
03:11:31.199334 IP node4.58460 > node4.44091: UDP, length 113
03:11:31.203173 IP node4.48590 > node4.44091: UDP, length 113
03:11:31.203850 IP node4.44113 > node4.44091: UDP, length 113
03:11:31.205082 IP node4.36486 > node4.44091: UDP, length 112
03:11:31.205386 IP node4.36451 > node4.44091: UDP, length 113
03:11:31.206023 IP node4.49214 > node4.44091: UDP, length 113
03:11:31.206817 IP node4.51500 > node4.44091: UDP, length 113
03:11:31.208641 IP node4.38789 > node4.44091: UDP, length 113
03:11:31.216536 IP node4.44091 > node4.59422: UDP, length 113
03:11:31.216607 IP node4.44091 > node4.51500: UDP, length 113
03:11:31.216867 IP node4.58465 > node4.51500: UDP, length 113
03:11:31.216867 IP node4.44091 > node4.58465: UDP, length 113
03:11:31.216978 IP node4.58465 > node4.59422: UDP, length 113
03:11:31.217446 IP node4.58465 > node4.49214: UDP, length 113
03:11:31.217569 IP node4.58465 > node4.38789: UDP, length 113
03:11:31.227082 IP node4.44091 > node4.49214: UDP, length 113
03:11:31.227163 IP node4.44091 > node4.38789: UDP, length 113
03:11:31.227658 IP node4.58465 > node4.44091: UDP, length 113
03:11:31.231693 IP node4.36499 > node4.40772: UDP, length 113
03:11:31.231854 IP node4.51500 > node4.40772: UDP, length 113
03:11:31.232787 IP node4.59422 > node4.40772: UDP, length 113
03:11:31.235189 IP node4.38789 > node4.40772: UDP, length 113
03:11:31.235440 IP node4.48590 > node4.40772: UDP, length 113
03:11:31.239117 IP node4.49214 > node4.40772: UDP, length 113
03:11:31.240620 IP node4.36486 > node4.40772: UDP, length 112
03:11:31.241159 IP node4.36451 > node4.40772: UDP, length 113
03:11:31.246000 IP node4.58460 > node4.40772: UDP, length 113
03:11:31.247598 IP node4.44113 > node4.40772: UDP, length 113
03:11:31.252417 IP node4.44091 > node4.40772: UDP, length 113
03:11:31.269107 IP node4.58465 > node4.40772: UDP, length 113
03:11:31.282363 IP node4.40772 > node4.59422: UDP, length 113
03:11:31.282445 IP node4.40772 > node4.51500: UDP, length 113
03:11:31.283015 IP node4.40772 > node4.44091: UDP, length 113
03:11:31.283194 IP node4.40772 > node4.49214: UDP, length 113
03:11:31.283270 IP node4.40772 > node4.58465: UDP, length 113
03:11:31.283338 IP node4.40772 > node4.38789: UDP, length 113
03:11:31.362234 IP node4.49214 > node4.38845: UDP, length 113
03:11:31.363103 IP node4.36486 > node4.38845: UDP, length 112
03:11:31.363561 IP node4.58460 > node4.38845: UDP, length 113
03:11:31.363697 IP node4.58465 > node4.38845: UDP, length 113
03:11:31.363764 IP node4.40772 > node4.38845: UDP, length 113
03:11:31.363886 IP node4.44091 > node4.38845: UDP, length 113
03:11:31.363886 IP node4.36451 > node4.38845: UDP, length 113
03:11:31.364770 IP node4.36499 > node4.38845: UDP, length 113
03:11:31.364905 IP node4.48590 > node4.38845: UDP, length 113
03:11:31.364905 IP node4.44113 > node4.38845: UDP, length 113
03:11:31.367071 IP node4.51500 > node4.38845: UDP, length 113
03:11:31.367826 IP node4.38789 > node4.38845: UDP, length 113
03:11:31.369165 IP node4.59422 > node4.38845: UDP, length 113
03:11:31.393016 IP node4.38845 > node4.44091: UDP, length 113
03:11:31.393095 IP node4.38845 > node4.40772: UDP, length 113
03:11:31.446110 IP node4.38789 > node4.36825: UDP, length 113
03:11:31.447145 IP node4.59422 > node4.36825: UDP, length 113
03:11:31.447559 IP node4.51500 > node4.36825: UDP, length 113
03:11:31.448100 IP node4.40772 > node4.36825: UDP, length 113
03:11:31.448389 IP node4.38845 > node4.36825: UDP, length 113
03:11:31.448607 IP node4.58465 > node4.36825: UDP, length 113
03:11:31.448643 IP node4.44091 > node4.36825: UDP, length 113
03:11:31.449347 IP node4.36451 > node4.36825: UDP, length 113
03:11:31.449362 IP node4.36486 > node4.36825: UDP, length 112
03:11:31.451576 IP node4.58460 > node4.36825: UDP, length 113
03:11:31.451710 IP node4.36499 > node4.36825: UDP, length 113
03:11:31.452092 IP node4.48590 > node4.36825: UDP, length 113
03:11:31.452584 IP node4.49214 > node4.36825: UDP, length 113
03:11:31.452908 IP node4.44113 > node4.36825: UDP, length 113
03:11:33.770974 IP node4.51500 > node4.36486: UDP, length 113
03:11:33.771013 IP node4.48590 > node4.36486: UDP, length 113
03:11:33.771875 IP node4.36825 > node4.36486: UDP, length 112
03:11:33.771875 IP node4.44113 > node4.36486: UDP, length 113
03:11:33.771923 IP node4.38789 > node4.36486: UDP, length 113
03:11:33.772510 IP node4.44091 > node4.36486: UDP, length 113
03:11:33.772531 IP node4.49214 > node4.36486: UDP, length 113
03:11:33.772882 IP node4.59422 > node4.36486: UDP, length 113
03:11:33.773238 IP node4.40772 > node4.36486: UDP, length 113
03:11:33.773928 IP node4.38845 > node4.36486: UDP, length 113
03:11:33.774035 IP node4.36451 > node4.36486: UDP, length 113
03:11:33.774631 IP node4.58460 > node4.36486: UDP, length 113
03:11:33.774740 IP node4.36499 > node4.36486: UDP, length 113
03:11:33.775030 IP node4.58465 > node4.36486: UDP, length 113
03:11:33.813621 IP node4.44091 > node4.48590: UDP, length 113
03:11:33.813738 IP node4.36451 > node4.48590: UDP, length 113
03:11:33.814044 IP node4.51500 > node4.48590: UDP, length 113
03:11:33.814710 IP node4.44113 > node4.48590: UDP, length 113
03:11:33.814718 IP node4.38789 > node4.48590: UDP, length 113
03:11:33.814988 IP node4.38845 > node4.48590: UDP, length 113
03:11:33.815288 IP node4.36499 > node4.48590: UDP, length 113
03:11:33.815926 IP node4.49214 > node4.48590: UDP, length 113
03:11:33.816076 IP node4.36825 > node4.48590: UDP, length 112
03:11:33.816379 IP node4.40772 > node4.48590: UDP, length 113
03:11:33.816882 IP node4.58460 > node4.48590: UDP, length 113
03:11:33.817117 IP node4.36486 > node4.48590: UDP, length 112
03:11:33.817937 IP node4.58465 > node4.48590: UDP, length 113
03:11:33.819176 IP node4.59422 > node4.48590: UDP, length 113
03:11:33.985670 IP node4.36486 > node4.48590: UDP, length 87
03:11:33.986570 IP node4.48590 > node4.36486: UDP, length 94
03:11:34.030386 IP node4.58460 > node4.36499: UDP, length 113
03:11:34.030445 IP node4.58465 > node4.36499: UDP, length 113
03:11:34.030577 IP node4.48590 > node4.36499: UDP, length 113
03:11:34.030854 IP node4.36486 > node4.36499: UDP, length 112
03:11:34.031001 IP node4.36451 > node4.36499: UDP, length 113
03:11:34.031040 IP node4.38789 > node4.36499: UDP, length 113
03:11:34.031123 IP node4.44113 > node4.36499: UDP, length 113
03:11:34.035400 IP node4.59422 > node4.36499: UDP, length 113
03:11:34.035418 IP node4.40772 > node4.36499: UDP, length 113
03:11:34.035962 IP node4.36825 > node4.36499: UDP, length 112
03:11:34.037760 IP node4.51500 > node4.36499: UDP, length 113
03:11:34.038364 IP node4.49214 > node4.36499: UDP, length 113
03:11:34.038939 IP node4.44091 > node4.36499: UDP, length 113
03:11:34.039366 IP node4.38845 > node4.36499: UDP, length 113
03:11:34.069096 IP node4.36486 > node4.44113: UDP, length 112
03:11:34.069447 IP node4.48590 > node4.44113: UDP, length 113
03:11:34.069984 IP node4.49214 > node4.44113: UDP, length 113
03:11:34.070235 IP node4.36499 > node4.44113: UDP, length 113
03:11:34.070733 IP node4.38789 > node4.44113: UDP, length 113
03:11:34.071020 IP node4.36825 > node4.44113: UDP, length 112
03:11:34.071131 IP node4.40772 > node4.44113: UDP, length 113
03:11:34.071916 IP node4.36451 > node4.44113: UDP, length 113
03:11:34.072546 IP node4.58460 > node4.44113: UDP, length 113
03:11:34.073131 IP node4.51500 > node4.44113: UDP, length 113
03:11:34.073518 IP node4.44091 > node4.44113: UDP, length 113
03:11:34.073606 IP node4.38845 > node4.44113: UDP, length 113
03:11:34.074524 IP node4.59422 > node4.44113: UDP, length 113
03:11:34.075625 IP node4.58465 > node4.44113: UDP, length 113
03:11:34.155676 IP node4.44113 > node4.58460: UDP, length 113
03:11:34.155687 IP node4.36499 > node4.58460: UDP, length 113
03:11:34.155848 IP node4.58465 > node4.58460: UDP, length 113
03:11:34.158128 IP node4.49214 > node4.58460: UDP, length 113
03:11:34.158571 IP node4.38789 > node4.58460: UDP, length 113
03:11:34.159623 IP node4.59422 > node4.58460: UDP, length 113
03:11:34.161895 IP node4.36486 > node4.58460: UDP, length 112
03:11:34.162674 IP node4.51500 > node4.58460: UDP, length 113
03:11:34.162863 IP node4.36451 > node4.58460: UDP, length 113
03:11:34.163343 IP node4.40772 > node4.58460: UDP, length 113
03:11:34.163477 IP node4.38845 > node4.58460: UDP, length 113
03:11:34.163527 IP node4.36825 > node4.58460: UDP, length 112
03:11:34.163606 IP node4.44091 > node4.58460: UDP, length 113
03:11:34.166397 IP node4.48590 > node4.58460: UDP, length 113
03:11:34.290533 IP node4.58465 > node4.36451: UDP, length 113
03:11:34.291270 IP node4.51500 > node4.36451: UDP, length 113
03:11:34.291315 IP node4.44091 > node4.36451: UDP, length 113
03:11:34.291498 IP node4.36486 > node4.36451: UDP, length 112
03:11:34.292591 IP node4.49214 > node4.36451: UDP, length 113
03:11:34.292828 IP node4.38845 > node4.36451: UDP, length 113
03:11:34.293546 IP node4.36825 > node4.36451: UDP, length 112
03:11:34.293799 IP node4.36499 > node4.36451: UDP, length 113
03:11:34.294024 IP node4.38789 > node4.36451: UDP, length 113
03:11:34.294308 IP node4.44113 > node4.36451: UDP, length 113
03:11:34.295204 IP node4.40772 > node4.36451: UDP, length 113
03:11:34.295793 IP node4.48590 > node4.36451: UDP, length 113
03:11:34.296030 IP node4.58460 > node4.36451: UDP, length 113
03:11:34.297963 IP node4.59422 > node4.36451: UDP, length 113
03:11:34.418853 IP node4.44113 > node4.58460: UDP, length 87
03:11:34.419830 IP node4.58460 > node4.44113: UDP, length 94
03:11:34.483087 IP node4.36451 > node4.59422: UDP, length 113
03:11:34.484830 IP node4.58465 > node4.59422: UDP, length 113
03:11:34.484966 IP node4.58460 > node4.59422: UDP, length 113
03:11:34.485214 IP node4.36486 > node4.59422: UDP, length 112
03:11:34.485489 IP node4.49214 > node4.59422: UDP, length 113
03:11:34.486059 IP node4.44113 > node4.59422: UDP, length 113
03:11:34.487234 IP node4.38789 > node4.59422: UDP, length 113
03:11:34.487497 IP node4.36499 > node4.59422: UDP, length 113
03:11:34.487521 IP node4.51500 > node4.59422: UDP, length 113
03:11:34.487673 IP node4.38845 > node4.59422: UDP, length 113
03:11:34.489498 IP node4.44091 > node4.59422: UDP, length 113
03:11:34.492709 IP node4.40772 > node4.59422: UDP, length 113
03:11:34.492950 IP node4.36825 > node4.59422: UDP, length 112
03:11:34.494612 IP node4.48590 > node4.59422: UDP, length 113
03:11:34.529767 IP node4.36499 > node4.51500: UDP, length 113
03:11:34.529942 IP node4.58460 > node4.51500: UDP, length 113
03:11:34.531162 IP node4.38845 > node4.51500: UDP, length 113
03:11:34.531288 IP node4.40772 > node4.51500: UDP, length 113
03:11:34.531525 IP node4.38789 > node4.51500: UDP, length 113
03:11:34.531556 IP node4.59422 > node4.51500: UDP, length 113
03:11:34.531775 IP node4.44113 > node4.51500: UDP, length 113
03:11:34.531987 IP node4.36451 > node4.51500: UDP, length 113
03:11:34.533473 IP node4.36486 > node4.51500: UDP, length 112
03:11:34.535564 IP node4.48590 > node4.51500: UDP, length 113
03:11:34.538733 IP node4.58465 > node4.51500: UDP, length 113
03:11:34.539959 IP node4.44091 > node4.51500: UDP, length 113
03:11:34.540960 IP node4.36825 > node4.51500: UDP, length 112
03:11:34.541204 IP node4.49214 > node4.51500: UDP, length 113
03:11:34.601149 IP node4.36486 > node4.58465: UDP, length 112
03:11:34.601534 IP node4.36499 > node4.58465: UDP, length 113
03:11:34.601550 IP node4.40772 > node4.58465: UDP, length 113
03:11:34.602511 IP node4.38789 > node4.58465: UDP, length 113
03:11:34.602594 IP node4.38845 > node4.58465: UDP, length 113
03:11:34.602797 IP node4.44113 > node4.58465: UDP, length 113
03:11:34.603372 IP node4.59422 > node4.58465: UDP, length 113
03:11:34.603557 IP node4.48590 > node4.58465: UDP, length 113
03:11:34.603913 IP node4.44091 > node4.58465: UDP, length 113
03:11:34.605176 IP node4.36451 > node4.58465: UDP, length 113
03:11:34.606337 IP node4.58460 > node4.58465: UDP, length 113
03:11:34.606865 IP node4.49214 > node4.58465: UDP, length 113
03:11:34.613032 IP node4.51500 > node4.58465: UDP, length 113
03:11:34.615616 IP node4.36825 > node4.58465: UDP, length 112
03:11:34.617583 IP node4.51500 > node4.49214: UDP, length 113
03:11:34.619172 IP node4.48590 > node4.49214: UDP, length 113
03:11:34.619213 IP node4.36499 > node4.49214: UDP, length 113
03:11:34.619333 IP node4.36486 > node4.49214: UDP, length 112
03:11:34.619490 IP node4.38845 > node4.49214: UDP, length 113
03:11:34.619991 IP node4.38789 > node4.49214: UDP, length 113
03:11:34.620720 IP node4.58460 > node4.49214: UDP, length 113
03:11:34.620957 IP node4.36451 > node4.49214: UDP, length 113
03:11:34.621110 IP node4.59422 > node4.49214: UDP, length 113
03:11:34.621230 IP node4.36825 > node4.49214: UDP, length 112
03:11:34.621851 IP node4.40772 > node4.49214: UDP, length 113
03:11:34.622436 IP node4.44091 > node4.49214: UDP, length 113
03:11:34.622938 IP node4.58465 > node4.49214: UDP, length 113
03:11:34.624377 IP node4.44113 > node4.49214: UDP, length 113
03:11:34.661141 IP node4.58465 > node4.38789: UDP, length 113
03:11:34.661198 IP node4.36499 > node4.38789: UDP, length 113
03:11:34.661848 IP node4.44113 > node4.38789: UDP, length 113
03:11:34.662061 IP node4.59422 > node4.38789: UDP, length 113
03:11:34.662053 IP node4.48590 > node4.38789: UDP, length 113
03:11:34.662141 IP node4.58460 > node4.38789: UDP, length 113
03:11:34.662238 IP node4.40772 > node4.38789: UDP, length 113
03:11:34.662279 IP node4.36486 > node4.38789: UDP, length 112
03:11:34.662294 IP node4.38845 > node4.38789: UDP, length 113
03:11:34.662568 IP node4.44091 > node4.38789: UDP, length 113
03:11:34.663079 IP node4.36451 > node4.38789: UDP, length 113
03:11:34.663292 IP node4.49214 > node4.38789: UDP, length 113
03:11:34.663298 IP node4.51500 > node4.38789: UDP, length 113
03:11:34.665330 IP node4.36825 > node4.38789: UDP, length 112
03:11:34.704996 IP node4.49214 > node4.44091: UDP, length 113
03:11:34.705586 IP node4.38845 > node4.44091: UDP, length 113
03:11:34.705666 IP node4.44113 > node4.44091: UDP, length 113
03:11:34.706241 IP node4.36486 > node4.44091: UDP, length 112
03:11:34.706494 IP node4.58465 > node4.44091: UDP, length 113
03:11:34.706680 IP node4.48590 > node4.44091: UDP, length 113
03:11:34.706767 IP node4.51500 > node4.44091: UDP, length 113
03:11:34.707084 IP node4.58460 > node4.44091: UDP, length 113
03:11:34.707551 IP node4.38789 > node4.44091: UDP, length 113
03:11:34.710281 IP node4.59422 > node4.44091: UDP, length 113
03:11:34.710459 IP node4.40772 > node4.44091: UDP, length 113
03:11:34.711903 IP node4.36499 > node4.44091: UDP, length 113
03:11:34.712324 IP node4.36825 > node4.44091: UDP, length 112
03:11:34.719376 IP node4.36451 > node4.44091: UDP, length 113
03:11:34.725205 IP node4.36451 > node4.59422: UDP, length 87
03:11:34.726173 IP node4.59422 > node4.36451: UDP, length 94
03:11:34.730597 IP node4.58460 > node4.40772: UDP, length 113
03:11:34.730879 IP node4.36499 > node4.40772: UDP, length 113
03:11:34.731035 IP node4.58465 > node4.40772: UDP, length 113
03:11:34.731172 IP node4.49214 > node4.40772: UDP, length 113
03:11:34.731378 IP node4.38845 > node4.40772: UDP, length 113
03:11:34.731973 IP node4.44091 > node4.40772: UDP, length 113
03:11:34.733059 IP node4.44113 > node4.40772: UDP, length 113
03:11:34.733176 IP node4.36451 > node4.40772: UDP, length 113
03:11:34.734257 IP node4.36486 > node4.40772: UDP, length 112
03:11:34.734495 IP node4.59422 > node4.40772: UDP, length 113
03:11:34.734712 IP node4.38789 > node4.40772: UDP, length 113
03:11:34.734937 IP node4.48590 > node4.40772: UDP, length 113
03:11:34.735899 IP node4.51500 > node4.40772: UDP, length 113
03:11:34.736600 IP node4.36825 > node4.40772: UDP, length 112
03:11:34.863413 IP node4.59422 > node4.38845: UDP, length 113
03:11:34.863528 IP node4.36486 > node4.38845: UDP, length 112
03:11:34.864379 IP node4.38789 > node4.38845: UDP, length 113
03:11:34.865035 IP node4.58460 > node4.38845: UDP, length 113
03:11:34.865548 IP node4.36451 > node4.38845: UDP, length 113
03:11:34.866664 IP node4.48590 > node4.38845: UDP, length 113
03:11:34.867009 IP node4.49214 > node4.38845: UDP, length 113
03:11:34.868895 IP node4.51500 > node4.38845: UDP, length 113
03:11:34.869928 IP node4.44113 > node4.38845: UDP, length 113
03:11:34.870063 IP node4.44091 > node4.38845: UDP, length 113
03:11:34.872691 IP node4.36499 > node4.38845: UDP, length 113
03:11:34.874072 IP node4.58465 > node4.38845: UDP, length 113
03:11:34.874198 IP node4.36825 > node4.38845: UDP, length 112
03:11:34.874618 IP node4.40772 > node4.38845: UDP, length 113
03:11:34.959402 IP node4.40772 > node4.36825: UDP, length 113
03:11:34.959561 IP node4.38789 > node4.36825: UDP, length 113
03:11:34.960332 IP node4.48590 > node4.36825: UDP, length 113
03:11:34.960368 IP node4.44091 > node4.36825: UDP, length 113
03:11:34.960712 IP node4.58465 > node4.36825: UDP, length 113
03:11:34.960745 IP node4.44113 > node4.36825: UDP, length 113
03:11:34.961229 IP node4.38845 > node4.36825: UDP, length 113
03:11:34.961240 IP node4.36499 > node4.36825: UDP, length 113
03:11:34.961940 IP node4.36451 > node4.36825: UDP, length 113
03:11:34.962246 IP node4.59422 > node4.36825: UDP, length 113
03:11:34.962333 IP node4.36486 > node4.36825: UDP, length 112
03:11:34.962351 IP node4.51500 > node4.36825: UDP, length 113
03:11:34.962542 IP node4.58460 > node4.36825: UDP, length 113
03:11:34.964855 IP node4.49214 > node4.36825: UDP, length 113

