03:11:30.383902 IP node4.36486 > node3.56677: UDP, length 112
03:11:30.384632 IP node4.36486 > node3.42227: UDP, length 112
03:11:30.386342 IP node4.36486 > node3.57155: UDP, length 112
03:11:30.386574 IP node4.36486 > node3.35550: UDP, length 112
03:11:30.386731 IP node4.36486 > node1.40064: UDP, length 112
03:11:30.393155 IP node4.36486 > node1.33333: UDP, length 112
03:11:30.395328 IP node4.48590 > node1.33333: UDP, length 113
03:11:30.416800 IP node4.36486 > node3.52635: UDP, length 112
03:11:30.422200 IP node4.48590 > node3.56677: UDP, length 113
03:11:30.422462 IP node4.48590 > node3.42227: UDP, length 113
03:11:30.422586 IP node4.48590 > node3.57155: UDP, length 113
03:11:30.422712 IP node4.48590 > node3.35550: UDP, length 113
03:11:30.422866 IP node4.48590 > node1.40064: UDP, length 113
03:11:30.423048 IP node4.48590 > node3.52635: UDP, length 113
03:11:30.479626 IP node4.36486 > node3.48193: UDP, length 112
03:11:30.510848 IP node4.36486 > node3.60133: UDP, length 112
03:11:30.528896 IP node4.36499 > node3.60133: UDP, length 113
03:11:30.529208 IP node4.36499 > node3.52635: UDP, length 113
03:11:30.529541 IP node4.36499 > node1.40064: UDP, length 113
03:11:30.529780 IP node4.36499 > node3.48193: UDP, length 113
03:11:30.537502 IP node4.48590 > node3.60133: UDP, length 113
03:11:30.537773 IP node4.48590 > node3.48193: UDP, length 113
03:11:30.549911 IP node4.44113 > node3.35550: UDP, length 113
03:11:30.563722 IP node4.36486 > node3.35498: UDP, length 112
03:11:30.564749 IP node4.48590 > node3.35498: UDP, length 113
03:11:30.577306 IP node4.44113 > node3.52635: UDP, length 113
03:11:30.577723 IP node4.44113 > node3.48193: UDP, length 113
03:11:30.578036 IP node4.44113 > node3.60133: UDP, length 113
03:11:30.578753 IP node4.44113 > node3.35498: UDP, length 113
03:11:30.585250 IP node4.44113 > node1.40064: UDP, length 113
03:11:30.591276 IP node4.36499 > node3.35498: UDP, length 113
03:11:30.674443 IP node4.36499 > node3.49285: UDP, length 113
03:11:30.675041 IP node4.36486 > node3.49285: UDP, length 112
03:11:30.676579 IP node4.44113 > node3.49285: UDP, length 113
03:11:30.677850 IP node4.48590 > node3.49285: UDP, length 113
03:11:30.681289 IP node4.58460 > node3.52635: UDP, length 113
03:11:30.681504 IP node4.58460 > node3.48193: UDP, length 113
03:11:30.688786 IP node4.58460 > node3.35498: UDP, length 113
03:11:30.688939 IP node4.58460 > node3.60133: UDP, length 113
03:11:30.689036 IP node4.58460 > node3.49285: UDP, length 113
03:11:30.713341 IP node4.48590 > node3.60850: UDP, length 113
03:11:30.713866 IP node4.36486 > node3.60850: UDP, length 112
03:11:30.715495 IP node4.36499 > node3.60850: UDP, length 113
03:11:30.715706 IP node4.44113 > node3.60850: UDP, length 113
03:11:30.763788 IP node4.58460 > node3.60850: UDP, length 113
03:11:30.821305 IP node4.36451 > node3.35498: UDP, length 113
03:11:30.821423 IP node4.36451 > node3.60133: UDP, length 113
03:11:30.821699 IP node4.36451 > node3.52635: UDP, length 113
03:11:30.822008 IP node4.36451 > node3.49285: UDP, length 113
03:11:30.822524 IP node4.36451 > node3.48193: UDP, length 113
03:11:30.822574 IP node4.36451 > node3.60850: UDP, length 113
03:11:31.036327 IP node4.59422 > node3.49285: UDP, length 113
03:11:31.036572 IP node4.59422 > node3.60850: UDP, length 113
03:11:31.055606 IP node4.36451 > node1.44966: UDP, length 113
03:11:31.055771 IP node4.58460 > node1.44966: UDP, length 113
03:11:31.056604 IP node4.36499 > node1.44966: UDP, length 113
03:11:31.056966 IP node4.36486 > node1.44966: UDP, length 112
03:11:31.057380 IP node4.44113 > node1.44966: UDP, length 113
03:11:31.057380 IP node4.48590 > node1.44966: UDP, length 113
03:11:31.066251 IP node4.59422 > node1.44966: UDP, length 113
03:11:31.121972 IP node4.44113 > node1.36361: UDP, length 113
03:11:31.122110 IP node4.58460 > node1.36361: UDP, length 113
03:11:31.122278 IP node4.36499 > node1.36361: UDP, length 113
03:11:31.122470 IP node4.48590 > node1.36361: UDP, length 113
03:11:31.122740 IP node4.36486 > node1.36361: UDP, length 112
03:11:31.122979 IP node4.36451 > node1.36361: UDP, length 113
03:11:31.123238 IP node4.59422 > node1.36361: UDP, length 113
03:11:31.134157 IP node4.51500 > node1.44966: UDP, length 113
03:11:31.136443 IP node4.51500 > node1.36361: UDP, length 113
03:11:31.143061 IP node4.49214 > node1.44966: UDP, length 113
03:11:31.143480 IP node4.49214 > node1.36361: UDP, length 113
03:11:31.156287 IP node4.36499 > node1.43787: UDP, length 113
03:11:31.156794 IP node4.38789 > node3.60850: UDP, length 113
03:11:31.156957 IP node4.36451 > node1.43787: UDP, length 113
03:11:31.157411 IP node4.59422 > node1.43787: UDP, length 113
03:11:31.158997 IP node4.38789 > node1.44966: UDP, length 113
03:11:31.159132 IP node4.51500 > node1.43787: UDP, length 113
03:11:31.159679 IP node4.38789 > node1.36361: UDP, length 113
03:11:31.160529 IP node4.36486 > node1.43787: UDP, length 112
03:11:31.166038 IP node4.48590 > node1.43787: UDP, length 113
03:11:31.167989 IP node4.44113 > node1.43787: UDP, length 113
03:11:31.172253 IP node4.58460 > node1.43787: UDP, length 113
03:11:31.179547 IP node4.49214 > node1.43787: UDP, length 113
03:11:31.192102 IP node4.38789 > node1.43787: UDP, length 113
03:11:31.216669 IP node4.44091 > node1.44966: UDP, length 113
03:11:31.217071 IP node4.58465 > node1.36361: UDP, length 113
03:11:31.217313 IP node4.58465 > node1.43787: UDP, length 113
03:11:31.224914 IP node4.58465 > node1.44966: UDP, length 113
03:11:31.226793 IP node4.44091 > node1.36361: UDP, length 113
03:11:31.227006 IP node4.44091 > node1.43787: UDP, length 113
03:11:31.270170 IP node4.36486 > node1.33674: UDP, length 112
03:11:31.270356 IP node4.36499 > node1.33674: UDP, length 113
03:11:31.270492 IP node4.59422 > node1.33674: UDP, length 113
03:11:31.270663 IP node4.58460 > node1.33674: UDP, length 113
03:11:31.271249 IP node4.44113 > node1.33674: UDP, length 113
03:11:31.272001 IP node4.38789 > node1.33674: UDP, length 113
03:11:31.272565 IP node4.49214 > node1.33674: UDP, length 113
03:11:31.273411 IP node4.51500 > node1.33674: UDP, length 113
03:11:31.273600 IP node4.36451 > node1.33674: UDP, length 113
03:11:31.273792 IP node4.48590 > node1.33674: UDP, length 113
03:11:31.274493 IP node4.58465 > node1.33674: UDP, length 113
03:11:31.275342 IP node4.44091 > node1.33674: UDP, length 113
03:11:31.282717 IP node4.40772 > node1.44966: UDP, length 113
03:11:31.282904 IP node4.40772 > node1.43787: UDP, length 113
03:11:31.283086 IP node4.40772 > node1.36361: UDP, length 113
03:11:31.302166 IP node4.40772 > node1.33674: UDP, length 113
03:11:31.393236 IP node4.38845 > node1.33674: UDP, length 113
03:11:31.791101 IP node4.36486 > node1.55726: UDP, length 112
03:11:31.791914 IP node4.49214 > node1.55726: UDP, length 113
03:11:31.792762 IP node4.40772 > node1.55726: UDP, length 113
03:11:31.793134 IP node4.58465 > node1.55726: UDP, length 113
03:11:31.793335 IP node4.38789 > node1.55726: UDP, length 113
03:11:31.793396 IP node4.36499 > node1.55726: UDP, length 113
03:11:31.793665 IP node4.48590 > node1.55726: UDP, length 113
03:11:31.793924 IP node4.51500 > node1.55726: UDP, length 113
03:11:31.794132 IP node4.36451 > node1.55726: UDP, length 113
03:11:31.794419 IP node4.36825 > node1.55726: UDP, length 112
03:11:31.794491 IP node4.44113 > node1.55726: UDP, length 113
03:11:31.794580 IP node4.38845 > node1.55726: UDP, length 113
03:11:31.794716 IP node4.58460 > node1.55726: UDP, length 113
03:11:31.795258 IP node4.44091 > node1.55726: UDP, length 113
03:11:31.795336 IP node4.59422 > node1.55726: UDP, length 113
03:11:31.807867 IP node4.38789 > node1.56111: UDP, length 113
03:11:31.807923 IP node4.51500 > node1.56111: UDP, length 113
03:11:31.808869 IP node4.59422 > node1.56111: UDP, length 113
03:11:31.809426 IP node4.38845 > node1.56111: UDP, length 113
03:11:31.809800 IP node4.58465 > node1.56111: UDP, length 113
03:11:31.810064 IP node4.44091 > node1.56111: UDP, length 113
03:11:31.810343 IP node4.36451 > node1.56111: UDP, length 113
03:11:31.810764 IP node4.44113 > node1.56111: UDP, length 113
03:11:31.810923 IP node4.49214 > node1.56111: UDP, length 113
03:11:31.810992 IP node4.40772 > node1.56111: UDP, length 113
03:11:31.811075 IP node4.36499 > node1.56111: UDP, length 113
03:11:31.811457 IP node4.36486 > node1.56111: UDP, length 112
03:11:31.811716 IP node4.36825 > node1.56111: UDP, length 112
03:11:31.812247 IP node4.48590 > node1.56111: UDP, length 113
03:11:31.812491 IP node4.58460 > node1.56111: UDP, length 113
03:11:32.004009 IP node4.51500 > node1.42485: UDP, length 113
03:11:32.005072 IP node4.38845 > node1.42485: UDP, length 113
03:11:32.005302 IP node4.36499 > node1.42485: UDP, length 113
03:11:32.006215 IP node4.38789 > node1.42485: UDP, length 113
03:11:32.006640 IP node4.58465 > node1.42485: UDP, length 113
03:11:32.006868 IP node4.40772 > node1.42485: UDP, length 113
03:11:32.006937 IP node4.44113 > node1.42485: UDP, length 113
03:11:32.007019 IP node4.44091 > node1.42485: UDP, length 113
03:11:32.007333 IP node4.58460 > node1.42485: UDP, length 113
03:11:32.007465 IP node4.36451 > node1.42485: UDP, length 113
03:11:32.007577 IP node4.48590 > node1.42485: UDP, length 113
03:11:32.007652 IP node4.36825 > node1.42485: UDP, length 112
03:11:32.007776 IP node4.36486 > node1.42485: UDP, length 112
03:11:32.007838 IP node4.49214 > node1.42485: UDP, length 113
03:11:32.008272 IP node4.59422 > node1.42485: UDP, length 113
03:11:32.015242 IP node4.36499 > node2.52006: UDP, length 113
03:11:32.016463 IP node4.44091 > node2.52006: UDP, length 113
03:11:32.016977 IP node4.36451 > node2.52006: UDP, length 113
03:11:32.017033 IP node4.51500 > node2.52006: UDP, length 113
03:11:32.017196 IP node4.38845 > node2.52006: UDP, length 113
03:11:32.017425 IP node4.59422 > node2.52006: UDP, length 113
03:11:32.017542 IP node4.40772 > node2.52006: UDP, length 113
03:11:32.017672 IP node4.36486 > node2.52006: UDP, length 112
03:11:32.018044 IP node4.38789 > node2.52006: UDP, length 113
03:11:32.018172 IP node4.44113 > node2.52006: UDP, length 113
03:11:32.018467 IP node4.48590 > node2.52006: UDP, length 113
03:11:32.018632 IP node4.49214 > node2.52006: UDP, length 113
03:11:32.019115 IP node4.36825 > node2.52006: UDP, length 112
03:11:32.019378 IP node4.58460 > node2.52006: UDP, length 113
03:11:32.019540 IP node4.58465 > node2.52006: UDP, length 113
03:11:32.272437 IP node4.44113 > node2.33739: UDP, length 113
03:11:32.272791 IP node4.49214 > node2.33739: UDP, length 113
03:11:32.273182 IP node4.36499 > node2.33739: UDP, length 113
03:11:32.273248 IP node4.44091 > node2.33739: UDP, length 113
03:11:32.273401 IP node4.36451 > node2.33739: UDP, length 113
03:11:32.273555 IP node4.58465 > node2.33739: UDP, length 113
03:11:32.273622 IP node4.48590 > node2.33739: UDP, length 113
03:11:32.273937 IP node4.40772 > node2.33739: UDP, length 113
03:11:32.274803 IP node4.59422 > node2.33739: UDP, length 113
03:11:32.275216 IP node4.38789 > node2.33739: UDP, length 113
03:11:32.275494 IP node4.58460 > node2.33739: UDP, length 113
03:11:32.275759 IP node4.36486 > node2.33739: UDP, length 112
03:11:32.276092 IP node4.38845 > node2.33739: UDP, length 113
03:11:32.276507 IP node4.36825 > node2.33739: UDP, length 112
03:11:32.276720 IP node4.51500 > node2.33739: UDP, length 113
03:11:32.291753 IP node4.58465 > node2.47170: UDP, length 113
03:11:32.291984 IP node4.44091 > node2.47170: UDP, length 113
03:11:32.293241 IP node4.51500 > node2.47170: UDP, length 113
03:11:32.293314 IP node4.36499 > node2.47170: UDP, length 113
03:11:32.293671 IP node4.40772 > node2.47170: UDP, length 113
03:11:32.295578 IP node4.59422 > node2.47170: UDP, length 113
03:11:32.297147 IP node4.58460 > node2.47170: UDP, length 113
03:11:32.297384 IP node4.38789 > node2.47170: UDP, length 113
03:11:32.297633 IP node4.36451 > node2.47170: UDP, length 113
03:11:32.297692 IP node4.38845 > node2.47170: UDP, length 113
03:11:32.298435 IP node4.36486 > node2.47170: UDP, length 112
03:11:32.298959 IP node4.36825 > node2.47170: UDP, length 112
03:11:32.299118 IP node4.48590 > node2.47170: UDP, length 113
03:11:32.299451 IP node4.49214 > node2.47170: UDP, length 113
03:11:32.299944 IP node4.44113 > node2.47170: UDP, length 113
03:11:32.327200 IP node4.40772 > node1.32830: UDP, length 113
03:11:32.327388 IP node4.44091 > node1.32830: UDP, length 113
03:11:32.328634 IP node4.36499 > node1.32830: UDP, length 113
03:11:32.328765 IP node4.58460 > node1.32830: UDP, length 113
03:11:32.328885 IP node4.48590 > node1.32830: UDP, length 113
03:11:32.329455 IP node4.38845 > node1.32830: UDP, length 113
03:11:32.330009 IP node4.59422 > node1.32830: UDP, length 113
03:11:32.330168 IP node4.36451 > node1.32830: UDP, length 113
03:11:32.330424 IP node4.38789 > node1.32830: UDP, length 113
03:11:32.330437 IP node4.44113 > node1.32830: UDP, length 113
03:11:32.331685 IP node4.58465 > node1.32830: UDP, length 113
03:11:32.331813 IP node4.51500 > node1.32830: UDP, length 113
03:11:32.332197 IP node4.36486 > node1.32830: UDP, length 112
03:11:32.332527 IP node4.49214 > node1.32830: UDP, length 113
03:11:32.332766 IP node4.36825 > node1.32830: UDP, length 112
03:11:32.356654 IP node4.51500 > node2.38768: UDP, length 113
03:11:32.358116 IP node4.49214 > node2.38768: UDP, length 113
03:11:32.358121 IP node4.44113 > node2.38768: UDP, length 113
03:11:32.358946 IP node4.58460 > node2.38768: UDP, length 113
03:11:32.359355 IP node4.36486 > node2.38768: UDP, length 112
03:11:32.359745 IP node4.36451 > node2.38768: UDP, length 113
03:11:32.360450 IP node4.58465 > node2.38768: UDP, length 113
03:11:32.360580 IP node4.38845 > node2.38768: UDP, length 113
03:11:32.360696 IP node4.59422 > node2.38768: UDP, length 113
03:11:32.361117 IP node4.44091 > node2.38768: UDP, length 113
03:11:32.361457 IP node4.38789 > node2.38768: UDP, length 113
03:11:32.361515 IP node4.36499 > node2.38768: UDP, length 113
03:11:32.363110 IP node4.36825 > node2.38768: UDP, length 112
03:11:32.363412 IP node4.40772 > node2.38768: UDP, length 113
03:11:32.363650 IP node4.48590 > node2.38768: UDP, length 113
03:11:32.363893 IP node4.51500 > node2.50518: UDP, length 113
03:11:32.363994 IP node4.48590 > node2.50518: UDP, length 113
03:11:32.364284 IP node4.58460 > node2.50518: UDP, length 113
03:11:32.365107 IP node4.44113 > node2.50518: UDP, length 113
03:11:32.365167 IP node4.38845 > node2.50518: UDP, length 113
03:11:32.365310 IP node4.36486 > node2.50518: UDP, length 112
03:11:32.365681 IP node4.38789 > node2.50518: UDP, length 113
03:11:32.366085 IP node4.58465 > node2.50518: UDP, length 113
03:11:32.366545 IP node4.49214 > node2.50518: UDP, length 113
03:11:32.366669 IP node4.40772 > node2.50518: UDP, length 113
03:11:32.367127 IP node4.36451 > node2.50518: UDP, length 113
03:11:32.367315 IP node4.36499 > node2.50518: UDP, length 113
03:11:32.368121 IP node4.44091 > node2.50518: UDP, length 113
03:11:32.368203 IP node4.36825 > node2.50518: UDP, length 112
03:11:32.368269 IP node4.59422 > node2.50518: UDP, length 113
03:11:32.425930 IP node4.59422 > node1.53733: UDP, length 113
03:11:32.426886 IP node4.51500 > node1.53733: UDP, length 113
03:11:32.428140 IP node4.44113 > node1.53733: UDP, length 113
03:11:32.428597 IP node4.40772 > node1.53733: UDP, length 113
03:11:32.428653 IP node4.58465 > node1.53733: UDP, length 113
03:11:32.429103 IP node4.58460 > node1.53733: UDP, length 113
03:11:32.429732 IP node4.38789 > node1.53733: UDP, length 113
03:11:32.430277 IP node4.36499 > node1.53733: UDP, length 113
03:11:32.430531 IP node4.48590 > node1.53733: UDP, length 113
03:11:32.430848 IP node4.44091 > node1.53733: UDP, length 113
03:11:32.431041 IP node4.36486 > node1.53733: UDP, length 112
03:11:32.431407 IP node4.49214 > node1.53733: UDP, length 113
03:11:32.431547 IP node4.36825 > node1.53733: UDP, length 112
03:11:32.432323 IP node4.36451 > node1.53733: UDP, length 113
03:11:32.432595 IP node4.38845 > node1.53733: UDP, length 113
03:11:32.453417 IP node4.38789 > node2.58185: UDP, length 113
03:11:32.453758 IP node4.38845 > node2.58185: UDP, length 113
03:11:32.453822 IP node4.58465 > node2.58185: UDP, length 113
03:11:32.453987 IP node4.36499 > node2.58185: UDP, length 113
03:11:32.454194 IP node4.58460 > node2.58185: UDP, length 113
03:11:32.454356 IP node4.36486 > node2.58185: UDP, length 112
03:11:32.454474 IP node4.40772 > node2.58185: UDP, length 113
03:11:32.454632 IP node4.36451 > node2.58185: UDP, length 113
03:11:32.454841 IP node4.59422 > node2.58185: UDP, length 113
03:11:32.455020 IP node4.48590 > node2.58185: UDP, length 113
03:11:32.455185 IP node4.44113 > node2.58185: UDP, length 113
03:11:32.455781 IP node4.51500 > node2.58185: UDP, length 113
03:11:32.457002 IP node4.49214 > node2.58185: UDP, length 113
03:11:32.457540 IP node4.36825 > node2.58185: UDP, length 112
03:11:32.458470 IP node4.44091 > node2.58185: UDP, length 113
03:11:32.504006 IP node4.48590 > node2.40433: UDP, length 113
03:11:32.504689 IP node4.36499 > node2.40433: UDP, length 113
03:11:32.504930 IP node4.40772 > node2.40433: UDP, length 113
03:11:32.505469 IP node4.38845 > node2.40433: UDP, length 113
03:11:32.506411 IP node4.44113 > node2.40433: UDP, length 113
03:11:32.506562 IP node4.49214 > node2.40433: UDP, length 113
03:11:32.506860 IP node4.44091 > node2.40433: UDP, length 113
03:11:32.506949 IP node4.36451 > node2.40433: UDP, length 113
03:11:32.508280 IP node4.36825 > node2.40433: UDP, length 112
03:11:32.508471 IP node4.58465 > node2.40433: UDP, length 113
03:11:32.509342 IP node4.58460 > node2.40433: UDP, length 113
03:11:32.509413 IP node4.38789 > node2.40433: UDP, length 113
03:11:32.509701 IP node4.51500 > node2.40433: UDP, length 113
03:11:32.510515 IP node4.36486 > node2.40433: UDP, length 112
03:11:32.510607 IP node4.59422 > node2.40433: UDP, length 113
03:11:32.526419 IP node4.44113 > node1.34167: UDP, length 113
03:11:32.526693 IP node4.36499 > node1.34167: UDP, length 113
03:11:32.526733 IP node4.36486 > node1.34167: UDP, length 112
03:11:32.526864 IP node4.58465 > node1.34167: UDP, length 113
03:11:32.526965 IP node4.38845 > node1.34167: UDP, length 113
03:11:32.527175 IP node4.58460 > node1.34167: UDP, length 113
03:11:32.527367 IP node4.36451 > node1.34167: UDP, length 113
03:11:32.527524 IP node4.48590 > node1.34167: UDP, length 113
03:11:32.528673 IP node4.44091 > node1.34167: UDP, length 113
03:11:32.528732 IP node4.49214 > node1.34167: UDP, length 113
03:11:32.528935 IP node4.59422 > node1.34167: UDP, length 113
03:11:32.529238 IP node4.36825 > node1.34167: UDP, length 112
03:11:32.529374 IP node4.51500 > node1.34167: UDP, length 113
03:11:32.530271 IP node4.40772 > node1.34167: UDP, length 113
03:11:32.530396 IP node4.38789 > node1.34167: UDP, length 113
03:11:32.595166 IP node4.36499 > node1.35563: UDP, length 113
03:11:32.595455 IP node4.48590 > node1.35563: UDP, length 113
03:11:32.595511 IP node4.58460 > node1.35563: UDP, length 113
03:11:32.595745 IP node4.49214 > node1.35563: UDP, length 113
03:11:32.595889 IP node4.38845 > node1.35563: UDP, length 113
03:11:32.596917 IP node4.44113 > node1.35563: UDP, length 113
03:11:32.597163 IP node4.40772 > node1.35563: UDP, length 113
03:11:32.597901 IP node4.58465 > node1.35563: UDP, length 113
03:11:32.598125 IP node4.36451 > node1.35563: UDP, length 113
03:11:32.598181 IP node4.36486 > node1.35563: UDP, length 112
03:11:32.598653 IP node4.59422 > node1.35563: UDP, length 113
03:11:32.598744 IP node4.44091 > node1.35563: UDP, length 113
03:11:32.599275 IP node4.51500 > node1.35563: UDP, length 113
03:11:32.599371 IP node4.38789 > node1.35563: UDP, length 113
03:11:32.599524 IP node4.36825 > node1.35563: UDP, length 112
03:11:32.641535 IP node4.36825 > node2.35844: UDP, length 112
03:11:32.641900 IP node4.40772 > node2.35844: UDP, length 113
03:11:32.642076 IP node4.48590 > node2.35844: UDP, length 113
03:11:32.642222 IP node4.36499 > node2.35844: UDP, length 113
03:11:32.642412 IP node4.38845 > node2.35844: UDP, length 113
03:11:32.642915 IP node4.44091 > node2.35844: UDP, length 113
03:11:32.643154 IP node4.49214 > node2.35844: UDP, length 113
03:11:32.643576 IP node4.36486 > node2.35844: UDP, length 112
03:11:32.643751 IP node4.58465 > node2.35844: UDP, length 113
03:11:32.644007 IP node4.58460 > node2.35844: UDP, length 113
03:11:32.644126 IP node4.51500 > node2.35844: UDP, length 113
03:11:32.644227 IP node4.36451 > node2.35844: UDP, length 113
03:11:32.644612 IP node4.59422 > node2.35844: UDP, length 113
03:11:32.644686 IP node4.38789 > node2.35844: UDP, length 113
03:11:32.644947 IP node4.44113 > node2.35844: UDP, length 113
03:11:32.749916 IP node4.38845 > node2.58256: UDP, length 113
03:11:32.750129 IP node4.38789 > node2.58256: UDP, length 113
03:11:32.750230 IP node4.58460 > node2.58256: UDP, length 113
03:11:32.750357 IP node4.44091 > node2.58256: UDP, length 113
03:11:32.750512 IP node4.44113 > node2.58256: UDP, length 113
03:11:32.750734 IP node4.59422 > node2.58256: UDP, length 113
03:11:32.751104 IP node4.36499 > node2.58256: UDP, length 113
03:11:32.751179 IP node4.48590 > node2.58256: UDP, length 113
03:11:32.751631 IP node4.36825 > node2.58256: UDP, length 112
03:11:32.752064 IP node4.49214 > node2.58256: UDP, length 113
03:11:32.752471 IP node4.40772 > node2.58256: UDP, length 113
03:11:32.752807 IP node4.36486 > node2.58256: UDP, length 112
03:11:32.752862 IP node4.58465 > node2.58256: UDP, length 113
03:11:32.753376 IP node4.36451 > node2.58256: UDP, length 113
03:11:32.753457 IP node4.51500 > node2.58256: UDP, length 113
03:11:32.779562 IP node4.38845 > node1.50324: UDP, length 113
03:11:32.779645 IP node4.58465 > node1.50324: UDP, length 113
03:11:32.780178 IP node4.49214 > node1.50324: UDP, length 113
03:11:32.780283 IP node4.48590 > node1.50324: UDP, length 113
03:11:32.780608 IP node4.36499 > node1.50324: UDP, length 113
03:11:32.781025 IP node4.59422 > node1.50324: UDP, length 113
03:11:32.781288 IP node4.58460 > node1.50324: UDP, length 113
03:11:32.781375 IP node4.36486 > node1.50324: UDP, length 112
03:11:32.781858 IP node4.51500 > node1.50324: UDP, length 113
03:11:32.782021 IP node4.40772 > node1.50324: UDP, length 113
03:11:32.782624 IP node4.38789 > node1.50324: UDP, length 113
03:11:32.782736 IP node4.36451 > node1.50324: UDP, length 113
03:11:32.783602 IP node4.44091 > node1.50324: UDP, length 113
03:11:32.783847 IP node4.36825 > node1.50324: UDP, length 112
03:11:32.784025 IP node4.44113 > node1.50324: UDP, length 113
03:11:32.823917 IP node4.58460 > node3.43587: UDP, length 113
03:11:32.824021 IP node4.44113 > node3.43587: UDP, length 113
03:11:32.824100 IP node4.48590 > node3.43587: UDP, length 113
03:11:32.824481 IP node4.36499 > node3.43587: UDP, length 113
03:11:32.824590 IP node4.44091 > node3.43587: UDP, length 113
03:11:32.824663 IP node4.49214 > node3.43587: UDP, length 113
03:11:32.825882 IP node4.38845 > node3.43587: UDP, length 113
03:11:32.826338 IP node4.58465 > node3.43587: UDP, length 113
03:11:32.826589 IP node4.51500 > node3.43587: UDP, length 113
03:11:32.826680 IP node4.38789 > node3.43587: UDP, length 113
03:11:32.826885 IP node4.36825 > node3.43587: UDP, length 112
03:11:32.827056 IP node4.36486 > node3.43587: UDP, length 112
03:11:32.827729 IP node4.59422 > node3.43587: UDP, length 113
03:11:32.827849 IP node4.40772 > node3.43587: UDP, length 113
03:11:32.828444 IP node4.36451 > node3.43587: UDP, length 113
03:11:32.885892 IP node4.58465 > node3.34474: UDP, length 113
03:11:32.886018 IP node4.59422 > node3.34474: UDP, length 113
03:11:32.886094 IP node4.51500 > node3.34474: UDP, length 113
03:11:32.887305 IP node4.38789 > node3.34474: UDP, length 113
03:11:32.887583 IP node4.44091 > node3.34474: UDP, length 113
03:11:32.888564 IP node4.40772 > node3.34474: UDP, length 113
03:11:32.888991 IP node4.36499 > node3.34474: UDP, length 113
03:11:32.889198 IP node4.48590 > node3.34474: UDP, length 113
03:11:32.889355 IP node4.36486 > node3.34474: UDP, length 112
03:11:32.889593 IP node4.49214 > node3.34474: UDP, length 113
03:11:32.889889 IP node4.38845 > node3.34474: UDP, length 113
03:11:32.889978 IP node4.36825 > node3.34474: UDP, length 112
03:11:32.890308 IP node4.58460 > node3.34474: UDP, length 113
03:11:32.890711 IP node4.44113 > node3.34474: UDP, length 113
03:11:32.891386 IP node4.36451 > node3.34474: UDP, length 113
03:11:32.899858 IP node4.44113 > node1.50406: UDP, length 113
03:11:32.900459 IP node4.36451 > node1.50406: UDP, length 113
03:11:32.900587 IP node4.59422 > node1.50406: UDP, length 113
03:11:32.900987 IP node4.58460 > node1.50406: UDP, length 113
03:11:32.901117 IP node4.38845 > node1.50406: UDP, length 113
03:11:32.901226 IP node4.38789 > node1.50406: UDP, length 113
03:11:32.901288 IP node4.49214 > node1.50406: UDP, length 113
03:11:32.901353 IP node4.58465 > node1.50406: UDP, length 113
03:11:32.901936 IP node4.36499 > node1.50406: UDP, length 113
03:11:32.901988 IP node4.36825 > node1.50406: UDP, length 112
03:11:32.902580 IP node4.51500 > node1.50406: UDP, length 113
03:11:32.902951 IP node4.40772 > node1.50406: UDP, length 113
03:11:32.903125 IP node4.48590 > node1.50406: UDP, length 113
03:11:32.903401 IP node4.44091 > node1.50406: UDP, length 113
03:11:32.903947 IP node4.36486 > node1.50406: UDP, length 112
03:11:32.980576 IP node4.58465 > node2.44193: UDP, length 113
03:11:32.981363 IP node4.44113 > node2.44193: UDP, length 113
03:11:32.982262 IP node4.38845 > node2.44193: UDP, length 113
03:11:32.982714 IP node4.59422 > node2.44193: UDP, length 113
03:11:32.983613 IP node4.49214 > node2.44193: UDP, length 113
03:11:32.983720 IP node4.40772 > node2.44193: UDP, length 113
03:11:32.984033 IP node4.51500 > node2.44193: UDP, length 113
03:11:32.984596 IP node4.48590 > node2.44193: UDP, length 113
03:11:32.984805 IP node4.36499 > node2.44193: UDP, length 113
03:11:32.985231 IP node4.36825 > node2.44193: UDP, length 112
03:11:32.985342 IP node4.36486 > node2.44193: UDP, length 112
03:11:32.985487 IP node4.58460 > node2.44193: UDP, length 113
03:11:32.985573 IP node4.44091 > node2.44193: UDP, length 113
03:11:32.985740 IP node4.38789 > node2.44193: UDP, length 113
03:11:32.986264 IP node4.36451 > node2.44193: UDP, length 113
03:11:32.994066 IP node4.51500 > node2.52599: UDP, length 113
03:11:32.994227 IP node4.58465 > node2.52599: UDP, length 113
03:11:32.994447 IP node4.44113 > node2.52599: UDP, length 113
03:11:32.994540 IP node4.58460 > node2.52599: UDP, length 113
03:11:32.994891 IP node4.38789 > node2.52599: UDP, length 113
03:11:32.995006 IP node4.36825 > node2.52599: UDP, length 112
03:11:32.995220 IP node4.36451 > node2.52599: UDP, length 113
03:11:32.995268 IP node4.36499 > node2.52599: UDP, length 113
03:11:32.995387 IP node4.38845 > node2.52599: UDP, length 113
03:11:32.995898 IP node4.49214 > node2.52599: UDP, length 113
03:11:32.996224 IP node4.59422 > node2.52599: UDP, length 113
03:11:32.996671 IP node4.44091 > node2.52599: UDP, length 113
03:11:32.996854 IP node4.48590 > node2.52599: UDP, length 113
03:11:32.997705 IP node4.40772 > node2.52599: UDP, length 113
03:11:32.998084 IP node4.36486 > node2.52599: UDP, length 112
03:11:33.011636 IP node4.38789 > node2.38620: UDP, length 113
03:11:33.011850 IP node4.58460 > node2.38620: UDP, length 113
03:11:33.011893 IP node4.44091 > node2.38620: UDP, length 113
03:11:33.012518 IP node4.36825 > node2.38620: UDP, length 112
03:11:33.012600 IP node4.59422 > node2.38620: UDP, length 113
03:11:33.012780 IP node4.44113 > node2.38620: UDP, length 113
03:11:33.013240 IP node4.48590 > node2.38620: UDP, length 113
03:11:33.013888 IP node4.40772 > node2.38620: UDP, length 113
03:11:33.013992 IP node4.36499 > node2.38620: UDP, length 113
03:11:33.014706 IP node4.58465 > node2.38620: UDP, length 113
03:11:33.014766 IP node4.38845 > node2.38620: UDP, length 113
03:11:33.014843 IP node4.51500 > node2.38620: UDP, length 113
03:11:33.015077 IP node4.49214 > node2.38620: UDP, length 113
03:11:33.015236 IP node4.36486 > node2.38620: UDP, length 112
03:11:33.016155 IP node4.36451 > node2.38620: UDP, length 113
03:11:33.060441 IP node4.51500 > node2.40826: UDP, length 113
03:11:33.060666 IP node4.58465 > node2.40826: UDP, length 113
03:11:33.060846 IP node4.36499 > node2.40826: UDP, length 113
03:11:33.061094 IP node4.44113 > node2.40826: UDP, length 113
03:11:33.061920 IP node4.38789 > node2.40826: UDP, length 113
03:11:33.062005 IP node4.36825 > node2.40826: UDP, length 112
03:11:33.062134 IP node4.59422 > node2.40826: UDP, length 113
03:11:33.062418 IP node4.48590 > node2.40826: UDP, length 113
03:11:33.062492 IP node4.38845 > node2.40826: UDP, length 113
03:11:33.062678 IP node4.49214 > node2.40826: UDP, length 113
03:11:33.062821 IP node4.44091 > node2.40826: UDP, length 113
03:11:33.062969 IP node4.58460 > node2.40826: UDP, length 113
03:11:33.063112 IP node4.40772 > node2.40826: UDP, length 113
03:11:33.063372 IP node4.36486 > node2.40826: UDP, length 112
03:11:33.063429 IP node4.36451 > node2.40826: UDP, length 113
03:11:33.089055 IP node4.44091 > node2.47792: UDP, length 113
03:11:33.089736 IP node4.58465 > node2.47792: UDP, length 113
03:11:33.089960 IP node4.49214 > node2.47792: UDP, length 113
03:11:33.090160 IP node4.58460 > node2.47792: UDP, length 113
03:11:33.090291 IP node4.44113 > node2.47792: UDP, length 113
03:11:33.090617 IP node4.38789 > node2.47792: UDP, length 113
03:11:33.090947 IP node4.48590 > node2.47792: UDP, length 113
03:11:33.091322 IP node4.59422 > node2.47792: UDP, length 113
03:11:33.091393 IP node4.38845 > node2.47792: UDP, length 113
03:11:33.091578 IP node4.36486 > node2.47792: UDP, length 112
03:11:33.092049 IP node4.36499 > node2.47792: UDP, length 113
03:11:33.092381 IP node4.51500 > node2.47792: UDP, length 113
03:11:33.092464 IP node4.36451 > node2.47792: UDP, length 113
03:11:33.092677 IP node4.40772 > node2.47792: UDP, length 113
03:11:33.092732 IP node4.36825 > node2.47792: UDP, length 112
03:11:33.220819 IP node4.44091 > node3.52099: UDP, length 113
03:11:33.220999 IP node4.49214 > node3.52099: UDP, length 113
03:11:33.221579 IP node4.48590 > node3.52099: UDP, length 113
03:11:33.221747 IP node4.36825 > node3.52099: UDP, length 112
03:11:33.221818 IP node4.44113 > node3.52099: UDP, length 113
03:11:33.221899 IP node4.58460 > node3.52099: UDP, length 113
03:11:33.222083 IP node4.59422 > node3.52099: UDP, length 113
03:11:33.222365 IP node4.38845 > node3.52099: UDP, length 113
03:11:33.222483 IP node4.36499 > node3.52099: UDP, length 113
03:11:33.222686 IP node4.36486 > node3.52099: UDP, length 112
03:11:33.222932 IP node4.51500 > node3.52099: UDP, length 113
03:11:33.223528 IP node4.38789 > node3.52099: UDP, length 113
03:11:33.223592 IP node4.58465 > node3.52099: UDP, length 113
03:11:33.224116 IP node4.44091 > node3.33617: UDP, length 113
03:11:33.224341 IP node4.58460 > node3.33617: UDP, length 113
03:11:33.224507 IP node4.38789 > node3.33617: UDP, length 113
03:11:33.224749 IP node4.51500 > node3.33617: UDP, length 113
03:11:33.225374 IP node4.44113 > node3.33617: UDP, length 113
03:11:33.225756 IP node4.49214 > node3.33617: UDP, length 113
03:11:33.226046 IP node4.40772 > node3.52099: UDP, length 113
03:11:33.226131 IP node4.40772 > node3.33617: UDP, length 113
03:11:33.226526 IP node4.36451 > node3.52099: UDP, length 113
03:11:33.226612 IP node4.36451 > node3.33617: UDP, length 113
03:11:33.226829 IP node4.36825 > node3.33617: UDP, length 112
03:11:33.226891 IP node4.48590 > node3.33617: UDP, length 113
03:11:33.227372 IP node4.58465 > node3.33617: UDP, length 113
03:11:33.227683 IP node4.38845 > node3.33617: UDP, length 113
03:11:33.227948 IP node4.36499 > node3.33617: UDP, length 113
03:11:33.228248 IP node4.59422 > node3.33617: UDP, length 113
03:11:33.229184 IP node4.36486 > node3.33617: UDP, length 112
03:11:33.295914 IP node4.58465 > node3.56938: UDP, length 113
03:11:33.296434 IP node4.40772 > node3.56938: UDP, length 113
03:11:33.296540 IP node4.44091 > node3.56938: UDP, length 113
03:11:33.296659 IP node4.51500 > node3.56938: UDP, length 113
03:11:33.297121 IP node4.48590 > node3.56938: UDP, length 113
03:11:33.297255 IP node4.36825 > node3.56938: UDP, length 112
03:11:33.297325 IP node4.59422 > node3.56938: UDP, length 113
03:11:33.297384 IP node4.36486 > node3.56938: UDP, length 112
03:11:33.297706 IP node4.58460 > node3.56938: UDP, length 113
03:11:33.297756 IP node4.36499 > node3.56938: UDP, length 113
03:11:33.298136 IP node4.36451 > node3.56938: UDP, length 113
03:11:33.298339 IP node4.38845 > node3.56938: UDP, length 113
03:11:33.298606 IP node4.49214 > node3.56938: UDP, length 113
03:11:33.298732 IP node4.44113 > node3.56938: UDP, length 113
03:11:33.299695 IP node4.38789 > node3.56938: UDP, length 113
03:11:33.416247 IP node4.36825 > node3.56677: UDP, length 112
03:11:33.417878 IP node4.49214 > node3.56677: UDP, length 113
03:11:33.418066 IP node4.40772 > node3.56677: UDP, length 113
03:11:33.418287 IP node4.38845 > node3.56677: UDP, length 113
03:11:33.421652 IP node4.44091 > node3.56677: UDP, length 113
03:11:33.422193 IP node4.36451 > node3.56677: UDP, length 113
03:11:33.422426 IP node4.51500 > node3.56677: UDP, length 113
03:11:33.426270 IP node4.58465 > node3.56677: UDP, length 113
03:11:33.426350 IP node4.36499 > node3.56677: UDP, length 113
03:11:33.426844 IP node4.44113 > node3.56677: UDP, length 113
03:11:33.427036 IP node4.58460 > node3.56677: UDP, length 113
03:11:33.427145 IP node4.59422 > node3.56677: UDP, length 113
03:11:33.427567 IP node4.38789 > node3.56677: UDP, length 113
03:11:33.427756 IP node4.36486 > node3.56677: UDP, length 112
03:11:33.428147 IP node4.48590 > node3.56677: UDP, length 113
03:11:33.447705 IP node4.49214 > node1.33333: UDP, length 113
03:11:33.448332 IP node4.40772 > node1.33333: UDP, length 113
03:11:33.448689 IP node4.38789 > node1.33333: UDP, length 113
03:11:33.448873 IP node4.51500 > node1.33333: UDP, length 113
03:11:33.449376 IP node4.36451 > node1.33333: UDP, length 113
03:11:33.449703 IP node4.44091 > node1.33333: UDP, length 113
03:11:33.449971 IP node4.44113 > node1.33333: UDP, length 113
03:11:33.450476 IP node4.58460 > node1.33333: UDP, length 113
03:11:33.451124 IP node4.38845 > node1.33333: UDP, length 113
03:11:33.451593 IP node4.36825 > node1.33333: UDP, length 112
03:11:33.451873 IP node4.36499 > node1.33333: UDP, length 113
03:11:33.452472 IP node4.59422 > node1.33333: UDP, length 113
03:11:33.453055 IP node4.58465 > node1.33333: UDP, length 113
03:11:33.453959 IP node4.48590 > node1.33333: UDP, length 113
03:11:33.454020 IP node4.36486 > node1.33333: UDP, length 112
03:11:33.498769 IP node4.49214 > node3.42227: UDP, length 113
03:11:33.498873 IP node4.36451 > node3.42227: UDP, length 113
03:11:33.499174 IP node4.38789 > node3.42227: UDP, length 113
03:11:33.499477 IP node4.40772 > node3.42227: UDP, length 113
03:11:33.499643 IP node4.38845 > node3.42227: UDP, length 113
03:11:33.499842 IP node4.51500 > node3.42227: UDP, length 113
03:11:33.500033 IP node4.44113 > node3.42227: UDP, length 113
03:11:33.500476 IP node4.48590 > node3.42227: UDP, length 113
03:11:33.500605 IP node4.44091 > node3.42227: UDP, length 113
03:11:33.500709 IP node4.36825 > node3.42227: UDP, length 112
03:11:33.500760 IP node4.58465 > node3.42227: UDP, length 113
03:11:33.501302 IP node4.36499 > node3.42227: UDP, length 113
03:11:33.501428 IP node4.58460 > node3.42227: UDP, length 113
03:11:33.501982 IP node4.59422 > node3.42227: UDP, length 113
03:11:33.502914 IP node4.36486 > node3.42227: UDP, length 112
03:11:33.533346 IP node4.36451 > node3.57155: UDP, length 113
03:11:33.533869 IP node4.40772 > node3.57155: UDP, length 113
03:11:33.534015 IP node4.51500 > node3.57155: UDP, length 113
03:11:33.534279 IP node4.49214 > node3.57155: UDP, length 113
03:11:33.534440 IP node4.44113 > node3.57155: UDP, length 113
03:11:33.534823 IP node4.38845 > node3.57155: UDP, length 113
03:11:33.534914 IP node4.48590 > node3.57155: UDP, length 113
03:11:33.535059 IP node4.36825 > node3.57155: UDP, length 112
03:11:33.535240 IP node4.36499 > node3.57155: UDP, length 113
03:11:33.535651 IP node4.58465 > node3.57155: UDP, length 113
03:11:33.535750 IP node4.44091 > node3.57155: UDP, length 113
03:11:33.536292 IP node4.59422 > node3.57155: UDP, length 113
03:11:33.536490 IP node4.36486 > node3.57155: UDP, length 112
03:11:33.536675 IP node4.38789 > node3.57155: UDP, length 113
03:11:33.538262 IP node4.58460 > node3.57155: UDP, length 113
03:11:33.643064 IP node4.36825 > node3.35550: UDP, length 112
03:11:33.643239 IP node4.51500 > node3.35550: UDP, length 113
03:11:33.643751 IP node4.40772 > node3.35550: UDP, length 113
03:11:33.643960 IP node4.38845 > node3.35550: UDP, length 113
03:11:33.644119 IP node4.38789 > node3.35550: UDP, length 113
03:11:33.644512 IP node4.49214 > node3.35550: UDP, length 113
03:11:33.644628 IP node4.58465 > node3.35550: UDP, length 113
03:11:33.645004 IP node4.48590 > node3.35550: UDP, length 113
03:11:33.645944 IP node4.59422 > node3.35550: UDP, length 113
03:11:33.647079 IP node4.44113 > node3.35550: UDP, length 113
03:11:33.647432 IP node4.36451 > node3.35550: UDP, length 113
03:11:33.647568 IP node4.36486 > node3.35550: UDP, length 112
03:11:33.647726 IP node4.44091 > node3.35550: UDP, length 113
03:11:33.648793 IP node4.58460 > node3.35550: UDP, length 113
03:11:33.649776 IP node4.36499 > node3.35550: UDP, length 113
03:11:33.719468 IP node4.38845 > node1.40064: UDP, length 113
03:11:33.719592 IP node4.40772 > node1.40064: UDP, length 113
03:11:33.719667 IP node4.49214 > node1.40064: UDP, length 113
03:11:33.720373 IP node4.36499 > node1.40064: UDP, length 113
03:11:33.720524 IP node4.51500 > node1.40064: UDP, length 113
03:11:33.720895 IP node4.59422 > node1.40064: UDP, length 113
03:11:33.721305 IP node4.36451 > node1.40064: UDP, length 113
03:11:33.721869 IP node4.58460 > node1.40064: UDP, length 113
03:11:33.721922 IP node4.36825 > node1.40064: UDP, length 112
03:11:33.722120 IP node4.38789 > node1.40064: UDP, length 113
03:11:33.722455 IP node4.44091 > node1.40064: UDP, length 113
03:11:33.722884 IP node4.58465 > node1.40064: UDP, length 113
03:11:33.723064 IP node4.44113 > node1.40064: UDP, length 113
03:11:33.723410 IP node4.48590 > node1.40064: UDP, length 113
03:11:33.723974 IP node4.36486 > node1.40064: UDP, length 112
03:11:33.781861 IP node4.36486 > node2.36166: UDP, length 94
03:11:33.820815 IP node4.48590 > node2.36166: UDP, length 94
03:11:33.855050 IP node4.36486 > node2.36166: UDP, length 71
03:11:33.882337 IP node4.36486 > node2.36166: UDP, length 78
03:11:33.890060 IP node4.48590 > node3.52635: UDP, length 113
03:11:33.890437 IP node4.36486 > node3.52635: UDP, length 112
03:11:33.890696 IP node4.38789 > node3.52635: UDP, length 113
03:11:33.891216 IP node4.51500 > node3.52635: UDP, length 113
03:11:33.891801 IP node4.58465 > node3.52635: UDP, length 113
03:11:33.892803 IP node4.49214 > node3.52635: UDP, length 113
03:11:33.892986 IP node4.36499 > node3.52635: UDP, length 113
03:11:33.893467 IP node4.38845 > node3.52635: UDP, length 113
03:11:33.895316 IP node4.40772 > node3.52635: UDP, length 113
03:11:33.895794 IP node4.44113 > node3.52635: UDP, length 113
03:11:33.897301 IP node4.36825 > node3.52635: UDP, length 112
03:11:33.898038 IP node4.44091 > node3.52635: UDP, length 113
03:11:33.898496 IP node4.58460 > node3.52635: UDP, length 113
03:11:33.899264 IP node4.59422 > node3.52635: UDP, length 113
03:11:33.899319 IP node4.36451 > node3.52635: UDP, length 113
03:11:33.971264 IP node4.59422 > node3.48193: UDP, length 113
03:11:33.971939 IP node4.58460 > node3.48193: UDP, length 113
03:11:33.971995 IP node4.36486 > node3.48193: UDP, length 112
03:11:33.972642 IP node4.44091 > node3.48193: UDP, length 113
03:11:33.973732 IP node4.36825 > node3.48193: UDP, length 112
03:11:33.973822 IP node4.44113 > node3.48193: UDP, length 113
03:11:33.974085 IP node4.58465 > node3.48193: UDP, length 113
03:11:33.974371 IP node4.49214 > node3.48193: UDP, length 113
03:11:33.974470 IP node4.48590 > node3.48193: UDP, length 113
03:11:33.974555 IP node4.36499 > node3.48193: UDP, length 113
03:11:33.975891 IP node4.36451 > node3.48193: UDP, length 113
03:11:33.976483 IP node4.51500 > node3.48193: UDP, length 113
03:11:33.976806 IP node4.38845 > node3.48193: UDP, length 113
03:11:33.978061 IP node4.40772 > node3.48193: UDP, length 113
03:11:33.978951 IP node4.38789 > node3.48193: UDP, length 113
03:11:33.986980 IP node4.36486 > node2.36166: UDP, length 78
03:11:34.011297 IP node4.36486 > node3.60133: UDP, length 112
03:11:34.011510 IP node4.48590 > node3.60133: UDP, length 113
03:11:34.011970 IP node4.36825 > node3.60133: UDP, length 112
03:11:34.012476 IP node4.40772 > node3.60133: UDP, length 113
03:11:34.012927 IP node4.48590 > node2.36166: UDP, length 71
03:11:34.013324 IP node4.49214 > node3.60133: UDP, length 113
03:11:34.014013 IP node4.44091 > node3.60133: UDP, length 113
03:11:34.014322 IP node4.51500 > node3.60133: UDP, length 113
03:11:34.014614 IP node4.38789 > node3.60133: UDP, length 113
03:11:34.014697 IP node4.38845 > node3.60133: UDP, length 113
03:11:34.015739 IP node4.36499 > node3.60133: UDP, length 113
03:11:34.015800 IP node4.44113 > node3.60133: UDP, length 113
03:11:34.016689 IP node4.36451 > node3.60133: UDP, length 113
03:11:34.016793 IP node4.58465 > node3.60133: UDP, length 113
03:11:34.017544 IP node4.58460 > node3.60133: UDP, length 113
03:11:34.017807 IP node4.59422 > node3.60133: UDP, length 113
03:11:34.018589 IP node4.48590 > node3.52635: UDP, length 87
03:11:34.044940 IP node4.36499 > node2.36166: UDP, length 94
03:11:34.046037 IP node4.38845 > node3.35498: UDP, length 113
03:11:34.046255 IP node4.40772 > node3.35498: UDP, length 113
03:11:34.046522 IP node4.49214 > node3.35498: UDP, length 113
03:11:34.047010 IP node4.44091 > node3.35498: UDP, length 113
03:11:34.047262 IP node4.51500 > node3.35498: UDP, length 113
03:11:34.047732 IP node4.36451 > node3.35498: UDP, length 113
03:11:34.048630 IP node4.48590 > node3.35498: UDP, length 113
03:11:34.049072 IP node4.58460 > node3.35498: UDP, length 113
03:11:34.049123 IP node4.58465 > node3.35498: UDP, length 113
03:11:34.049469 IP node4.44113 > node3.35498: UDP, length 113
03:11:34.050215 IP node4.38789 > node3.35498: UDP, length 113
03:11:34.050466 IP node4.36486 > node3.35498: UDP, length 112
03:11:34.050781 IP node4.36499 > node3.35498: UDP, length 113
03:11:34.051073 IP node4.36825 > node3.35498: UDP, length 112
03:11:34.051329 IP node4.59422 > node3.35498: UDP, length 113
03:11:34.059927 IP node4.48590 > node2.36166: UDP, length 78
03:11:34.078660 IP node4.44113 > node2.36166: UDP, length 94
03:11:34.150519 IP node4.44091 > node3.49285: UDP, length 113
03:11:34.150982 IP node4.58460 > node3.49285: UDP, length 113
03:11:34.151294 IP node4.36499 > node3.49285: UDP, length 113
03:11:34.151459 IP node4.36825 > node3.49285: UDP, length 112
03:11:34.151547 IP node4.40772 > node3.49285: UDP, length 113
03:11:34.151944 IP node4.36486 > node3.49285: UDP, length 112
03:11:34.152484 IP node4.36451 > node3.49285: UDP, length 113
03:11:34.152753 IP node4.38845 > node3.49285: UDP, length 113
03:11:34.152812 IP node4.51500 > node3.49285: UDP, length 113
03:11:34.153713 IP node4.38789 > node3.49285: UDP, length 113
03:11:34.154160 IP node4.49214 > node3.49285: UDP, length 113
03:11:34.154294 IP node4.58465 > node3.49285: UDP, length 113
03:11:34.154369 IP node4.48590 > node3.49285: UDP, length 113
03:11:34.155028 IP node4.44113 > node3.49285: UDP, length 113
03:11:34.155261 IP node4.59422 > node3.49285: UDP, length 113
03:11:34.161743 IP node4.36486 > node2.36166: UDP, length 78
03:11:34.166246 IP node4.48590 > node2.36166: UDP, length 78
03:11:34.171474 IP node4.58460 > node2.36166: UDP, length 94
03:11:34.205210 IP node4.44113 > node2.36166: UDP, length 71
03:11:34.209086 IP node4.36499 > node2.36166: UDP, length 71
03:11:34.212736 IP node4.36499 > node3.35498: UDP, length 87
03:11:34.217136 IP node4.40772 > node3.60850: UDP, length 113
03:11:34.219182 IP node4.36499 > node3.60850: UDP, length 113
03:11:34.219904 IP node4.36451 > node3.60850: UDP, length 113
03:11:34.220161 IP node4.58460 > node3.60850: UDP, length 113
03:11:34.221561 IP node4.38845 > node3.60850: UDP, length 113
03:11:34.222100 IP node4.44113 > node3.60850: UDP, length 113
03:11:34.224073 IP node4.51500 > node3.60850: UDP, length 113
03:11:34.224895 IP node4.59422 > node3.60850: UDP, length 113
03:11:34.225235 IP node4.48590 > node3.60850: UDP, length 113
03:11:34.226083 IP node4.44091 > node3.60850: UDP, length 113
03:11:34.226146 IP node4.49214 > node3.60850: UDP, length 113
03:11:34.226228 IP node4.58465 > node3.60850: UDP, length 113
03:11:34.226507 IP node4.36486 > node3.60850: UDP, length 112
03:11:34.227154 IP node4.38789 > node3.60850: UDP, length 113
03:11:34.227584 IP node4.36825 > node3.60850: UDP, length 112
03:11:34.258012 IP node4.36499 > node2.36166: UDP, length 78
03:11:34.266974 IP node4.44113 > node2.36166: UDP, length 78
03:11:34.298832 IP node4.36451 > node2.36166: UDP, length 94
03:11:34.345768 IP node4.36486 > node2.36166: UDP, length 71
03:11:34.379769 IP node4.48590 > node2.36166: UDP, length 71
03:11:34.414457 IP node4.36499 > node2.36166: UDP, length 78
03:11:34.415559 IP node4.36486 > node2.36166: UDP, length 78
03:11:34.417971 IP node4.48590 > node2.36166: UDP, length 78
03:11:34.426003 IP node4.44113 > node2.36166: UDP, length 78
03:11:34.462348 IP node4.58460 > node2.36166: UDP, length 71
03:11:34.470708 IP node4.36451 > node2.36166: UDP, length 71
03:11:34.473873 IP node4.58460 > node3.49285: UDP, length 87
03:11:34.496897 IP node4.59422 > node2.36166: UDP, length 94
03:11:34.518357 IP node4.36451 > node2.36166: UDP, length 78
03:11:34.539347 IP node4.58460 > node2.36166: UDP, length 78
03:11:34.545209 IP node4.51500 > node2.36166: UDP, length 94
03:11:34.556547 IP node4.44091 > node1.44966: UDP, length 113
03:11:34.557111 IP node4.51500 > node1.44966: UDP, length 113
03:11:34.557352 IP node4.36499 > node1.44966: UDP, length 113
03:11:34.558846 IP node4.59422 > node1.44966: UDP, length 113
03:11:34.559126 IP node4.58465 > node1.44966: UDP, length 113
03:11:34.559449 IP node4.36825 > node1.44966: UDP, length 112
03:11:34.560454 IP node4.38845 > node1.44966: UDP, length 113
03:11:34.560568 IP node4.58460 > node1.44966: UDP, length 113
03:11:34.560920 IP node4.36451 > node1.44966: UDP, length 113
03:11:34.561287 IP node4.38789 > node1.44966: UDP, length 113
03:11:34.561543 IP node4.36486 > node1.44966: UDP, length 112
03:11:34.561841 IP node4.48590 > node1.44966: UDP, length 113
03:11:34.562160 IP node4.44113 > node1.44966: UDP, length 113
03:11:34.562489 IP node4.40772 > node1.44966: UDP, length 113
03:11:34.562693 IP node4.49214 > node1.44966: UDP, length 113
03:11:34.574709 IP node4.36499 > node2.36166: UDP, length 71
03:11:34.588822 IP node4.44113 > node2.36166: UDP, length 71
03:11:34.605349 IP node4.36499 > node1.36361: UDP, length 113
03:11:34.606256 IP node4.38789 > node1.36361: UDP, length 113
03:11:34.606335 IP node4.58460 > node1.36361: UDP, length 113
03:11:34.606895 IP node4.36486 > node1.36361: UDP, length 112
03:11:34.607424 IP node4.48590 > node1.36361: UDP, length 113
03:11:34.607466 IP node4.49214 > node1.36361: UDP, length 113
03:11:34.607699 IP node4.44113 > node1.36361: UDP, length 113
03:11:34.608776 IP node4.36451 > node1.36361: UDP, length 113
03:11:34.610106 IP node4.36825 > node1.36361: UDP, length 112
03:11:34.610427 IP node4.44091 > node1.36361: UDP, length 113
03:11:34.612527 IP node4.40772 > node1.36361: UDP, length 113
03:11:34.612898 IP node4.51500 > node1.36361: UDP, length 113
03:11:34.613668 IP node4.38845 > node1.36361: UDP, length 113
03:11:34.613934 IP node4.59422 > node1.36361: UDP, length 113
03:11:34.617909 IP node4.58465 > node1.36361: UDP, length 113
03:11:34.618078 IP node4.58465 > node2.36166: UDP, length 94
03:11:34.627788 IP node4.49214 > node2.36166: UDP, length 94
03:11:34.666833 IP node4.40772 > node1.43787: UDP, length 113
03:11:34.667443 IP node4.36486 > node1.43787: UDP, length 112
03:11:34.667650 IP node4.38845 > node1.43787: UDP, length 113
03:11:34.667842 IP node4.44091 > node1.43787: UDP, length 113
03:11:34.668093 IP node4.51500 > node1.43787: UDP, length 113
03:11:34.669623 IP node4.59422 > node1.43787: UDP, length 113
03:11:34.670208 IP node4.49214 > node1.43787: UDP, length 113
03:11:34.670422 IP node4.44113 > node1.43787: UDP, length 113
03:11:34.670903 IP node4.36825 > node1.43787: UDP, length 112
03:11:34.671056 IP node4.48590 > node1.43787: UDP, length 113
03:11:34.671461 IP node4.36499 > node1.43787: UDP, length 113
03:11:34.671636 IP node4.58460 > node1.43787: UDP, length 113
03:11:34.671708 IP node4.38789 > node1.43787: UDP, length 113
03:11:34.671826 IP node4.36451 > node1.43787: UDP, length 113
03:11:34.672151 IP node4.58465 > node1.43787: UDP, length 113
03:11:34.672224 IP node4.38789 > node2.36166: UDP, length 94
03:11:34.693127 IP node4.48590 > node2.36166: UDP, length 78
03:11:34.696596 IP node4.36486 > node2.36166: UDP, length 78
03:11:34.696837 IP node4.44113 > node2.36166: UDP, length 78
03:11:34.701866 IP node4.36499 > node2.36166: UDP, length 78
03:11:34.702464 IP node4.58460 > node2.36166: UDP, length 78
03:11:34.720118 IP node4.44091 > node2.36166: UDP, length 94
03:11:34.725288 IP node4.36451 > node2.36166: UDP, length 78
03:11:34.765840 IP node4.36486 > node1.33674: UDP, length 112
03:11:34.767263 IP node4.38789 > node1.33674: UDP, length 113
03:11:34.768058 IP node4.44091 > node1.33674: UDP, length 113
03:11:34.768277 IP node4.44113 > node1.33674: UDP, length 113
03:11:34.768579 IP node4.48590 > node1.33674: UDP, length 113
03:11:34.768838 IP node4.36499 > node1.33674: UDP, length 113
03:11:34.769303 IP node4.59422 > node1.33674: UDP, length 113
03:11:34.769507 IP node4.58460 > node1.33674: UDP, length 113
03:11:34.769749 IP node4.36451 > node1.33674: UDP, length 113
03:11:34.770044 IP node4.51500 > node1.33674: UDP, length 113
03:11:34.770357 IP node4.36825 > node1.33674: UDP, length 112
03:11:34.770654 IP node4.38845 > node1.33674: UDP, length 113
03:11:34.770859 IP node4.58465 > node1.33674: UDP, length 113
03:11:34.772151 IP node4.40772 > node2.36166: UDP, length 94
03:11:34.772682 IP node4.49214 > node1.33674: UDP, length 113
03:11:34.778595 IP node4.40772 > node1.33674: UDP, length 113
03:11:34.792288 IP node4.59422 > node2.36166: UDP, length 71
03:11:34.792984 IP node4.38789 > node2.36166: UDP, length 71
03:11:34.797357 IP node4.58465 > node1.36361: UDP, length 94
03:11:34.799960 IP node4.51500 > node2.36166: UDP, length 71
03:11:34.805455 IP node4.49214 > node2.36166: UDP, length 71
03:11:34.807235 IP node4.58460 > node2.36166: UDP, length 71
03:11:34.813634 IP node4.58465 > node2.36166: UDP, length 71
03:11:34.820218 IP node4.38789 > node1.43787: UDP, length 87
03:11:34.840103 IP node4.51500 > node2.36166: UDP, length 71
03:11:34.859500 IP node4.51500 > node1.44966: UDP, length 87
03:11:34.862088 IP node4.36451 > node2.36166: UDP, length 71
03:11:34.882976 IP node4.38845 > node2.36166: UDP, length 94
03:11:34.895395 IP node4.58465 > node2.36166: UDP, length 71
03:11:34.899742 IP node4.59422 > node2.36166: UDP, length 78
03:11:34.912465 IP node4.49214 > node2.36166: UDP, length 78
03:11:34.924488 IP node4.49214 > node2.36166: UDP, length 71
03:11:34.929054 IP node4.51500 > node2.36166: UDP, length 78
03:11:34.941153 IP node4.38789 > node2.36166: UDP, length 78
03:11:34.944911 IP node4.58465 > node2.36166: UDP, length 78
03:11:34.967278 IP node4.36825 > node2.36166: UDP, length 94
03:11:35.010756 IP node4.36486 > node2.36166: UDP, length 78
03:11:35.015010 IP node4.44113 > node2.36166: UDP, length 78
03:11:35.015558 IP node4.48590 > node2.36166: UDP, length 78
03:11:35.020540 IP node4.36499 > node2.36166: UDP, length 78
03:11:35.021854 IP node4.38789 > node2.36166: UDP, length 78
03:11:35.022775 IP node4.51500 > node2.36166: UDP, length 78
03:11:35.022943 IP node4.36451 > node2.36166: UDP, length 78
03:11:35.025698 IP node4.58460 > node2.36166: UDP, length 78
03:11:35.027509 IP node4.58465 > node2.36166: UDP, length 78
03:11:35.034759 IP node4.59422 > node2.36166: UDP, length 78
03:11:35.037048 IP node4.49214 > node2.36166: UDP, length 78
03:11:35.063537 IP node4.44091 > node1.43787: UDP, length 94
03:11:35.100117 IP node4.40772 > node2.36166: UDP, length 71
03:11:35.105589 IP node4.36825 > node2.36166: UDP, length 71
03:11:35.107841 IP node4.38845 > node1.33674: UDP, length 94
03:11:35.130036 IP node4.38845 > node2.36166: UDP, length 71
03:11:35.135468 IP node4.44091 > node2.36166: UDP, length 71
03:11:35.150598 IP node4.38789 > node2.36166: UDP, length 71
03:11:35.167904 IP node4.59422 > node2.36166: UDP, length 71
03:11:35.184699 IP node4.40772 > node2.36166: UDP, length 78
03:11:35.212608 IP node4.38845 > node2.36166: UDP, length 78
03:11:35.218469 IP node4.44091 > node2.36166: UDP, length 78
03:11:35.242882 IP node4.36825 > node2.36166: UDP, length 78
03:11:35.292520 IP node4.59422 > node1.55726: UDP, length 113
03:11:35.292849 IP node4.38789 > node1.55726: UDP, length 113
03:11:35.293115 IP node4.36499 > node1.55726: UDP, length 113
03:11:35.293212 IP node4.58460 > node1.55726: UDP, length 113
03:11:35.293394 IP node4.44113 > node1.55726: UDP, length 113
03:11:35.294125 IP node4.36825 > node1.55726: UDP, length 112
03:11:35.294391 IP node4.38845 > node2.36166: UDP, length 71
03:11:35.294478 IP node4.38845 > node1.55726: UDP, length 113
03:11:35.294682 IP node4.51500 > node1.55726: UDP, length 113
03:11:35.294870 IP node4.49214 > node1.55726: UDP, length 113
03:11:35.295152 IP node4.36486 > node1.55726: UDP, length 112
03:11:35.295875 IP node4.44091 > node1.55726: UDP, length 113
03:11:35.296162 IP node4.40772 > node1.55726: UDP, length 113
03:11:35.296544 IP node4.36451 > node1.55726: UDP, length 113
03:11:35.296845 IP node4.58465 > node1.55726: UDP, length 113
03:11:35.299917 IP node4.48590 > node1.55726: UDP, length 113
03:11:35.311120 IP node4.36451 > node1.56111: UDP, length 113
03:11:35.311359 IP node4.59422 > node1.56111: UDP, length 113
03:11:35.313821 IP node4.36825 > node1.56111: UDP, length 112
03:11:35.314024 IP node4.38789 > node1.56111: UDP, length 113
03:11:35.314134 IP node4.58465 > node1.56111: UDP, length 113
03:11:35.314194 IP node4.36486 > node1.56111: UDP, length 112
03:11:35.317584 IP node4.44113 > node1.56111: UDP, length 113
03:11:35.317982 IP node4.44091 > node1.56111: UDP, length 113
03:11:35.320060 IP node4.58460 > node1.56111: UDP, length 113
03:11:35.320591 IP node4.38845 > node1.56111: UDP, length 113
03:11:35.324500 IP node4.36499 > node1.56111: UDP, length 113
03:11:35.325558 IP node4.40772 > node1.56111: UDP, length 113
03:11:35.327047 IP node4.36825 > node2.36166: UDP, length 71
03:11:35.330064 IP node4.48590 > node2.36166: UDP, length 78
03:11:35.330234 IP node4.48590 > node1.56111: UDP, length 113
03:11:35.331693 IP node4.36499 > node2.36166: UDP, length 78
03:11:35.334166 IP node4.38845 > node2.36166: UDP, length 78
03:11:35.335591 IP node4.49214 > node1.56111: UDP, length 113
03:11:35.335878 IP node4.51500 > node1.56111: UDP, length 113
03:11:35.342593 IP node4.51500 > node2.36166: UDP, length 78
03:11:35.343104 IP node4.58460 > node2.36166: UDP, length 78
03:11:35.351185 IP node4.44113 > node2.36166: UDP, length 78
03:11:35.357727 IP node4.59422 > node2.36166: UDP, length 78
03:11:35.362046 IP node4.36451 > node2.36166: UDP, length 78
03:11:35.362335 IP node4.49214 > node2.36166: UDP, length 78
03:11:35.366755 IP node4.44091 > node2.36166: UDP, length 78
03:11:35.366897 IP node4.58465 > node2.36166: UDP, length 78
03:11:35.367529 IP node4.38789 > node2.36166: UDP, length 78
03:11:35.367863 IP node4.36825 > node1.55726: UDP, length 87
03:11:35.370262 IP node4.40772 > node2.36166: UDP, length 78
03:11:35.376812 IP node4.36486 > node2.36166: UDP, length 78
03:11:35.379685 IP node4.36825 > node2.36166: UDP, length 78
03:11:35.473128 IP node4.44091 > node2.36166: UDP, length 71
03:11:35.474604 IP node4.40772 > node2.36166: UDP, length 71
03:11:35.509719 IP node4.36451 > node1.42485: UDP, length 113
03:11:35.509885 IP node4.58460 > node1.42485: UDP, length 113
03:11:35.510259 IP node4.44113 > node1.42485: UDP, length 113
03:11:35.510945 IP node4.36825 > node1.42485: UDP, length 112
03:11:35.511300 IP node4.38845 > node1.42485: UDP, length 113
03:11:35.515635 IP node4.36499 > node1.42485: UDP, length 113
03:11:35.515970 IP node4.59422 > node1.42485: UDP, length 113
03:11:35.516219 IP node4.38789 > node1.42485: UDP, length 113
03:11:35.516475 IP node4.51500 > node1.42485: UDP, length 113
03:11:35.516718 IP node4.44091 > node1.42485: UDP, length 113
03:11:35.516994 IP node4.58465 > node1.42485: UDP, length 113
03:11:35.517244 IP node4.49214 > node1.42485: UDP, length 113
03:11:35.517619 IP node4.48590 > node1.42485: UDP, length 113
03:11:35.517993 IP node4.36486 > node1.42485: UDP, length 112
03:11:35.522518 IP node4.40772 > node2.52006: UDP, length 113
03:11:35.522624 IP node4.40772 > node1.42485: UDP, length 113
03:11:35.523773 IP node4.49214 > node2.52006: UDP, length 113
03:11:35.524258 IP node4.38789 > node2.52006: UDP, length 113
03:11:35.524622 IP node4.36825 > node2.52006: UDP, length 112
03:11:35.524670 IP node4.44091 > node2.52006: UDP, length 113
03:11:35.524953 IP node4.36451 > node2.52006: UDP, length 113
03:11:35.525440 IP node4.58460 > node2.52006: UDP, length 113
03:11:35.527471 IP node4.38845 > node2.52006: UDP, length 113
03:11:35.528073 IP node4.59422 > node2.52006: UDP, length 113
03:11:35.528351 IP node4.58465 > node2.52006: UDP, length 113
03:11:35.528441 IP node4.36486 > node2.52006: UDP, length 112
03:11:35.528883 IP node4.51500 > node2.52006: UDP, length 113
03:11:35.529905 IP node4.44113 > node2.52006: UDP, length 113
03:11:35.532742 IP node4.48590 > node2.52006: UDP, length 113
03:11:35.533099 IP node4.36499 > node2.52006: UDP, length 113
03:11:35.543087 IP node4.36825 > node2.36166: UDP, length 78
03:11:35.544500 IP node4.58465 > node2.36166: UDP, length 78
03:11:35.544560 IP node4.38789 > node2.36166: UDP, length 78
03:11:35.544687 IP node4.44091 > node2.36166: UDP, length 78
03:11:35.561693 IP node4.59422 > node2.36166: UDP, length 78
03:11:35.562027 IP node4.51500 > node2.36166: UDP, length 78
03:11:35.564663 IP node4.48590 > node2.36166: UDP, length 78
03:11:35.564721 IP node4.44113 > node2.36166: UDP, length 78
03:11:35.564932 IP node4.40772 > node2.36166: UDP, length 78
03:11:35.568604 IP node4.36486 > node2.36166: UDP, length 78
03:11:35.569253 IP node4.38845 > node2.36166: UDP, length 78
03:11:35.569762 IP node4.49214 > node2.36166: UDP, length 78
03:11:35.570116 IP node4.36451 > node2.36166: UDP, length 78
03:11:35.573678 IP node4.58460 > node2.36166: UDP, length 78
03:11:35.578048 IP node4.36499 > node2.36166: UDP, length 78
03:11:35.590453 IP node4.51500 > node2.36166: UDP, length 1084
03:11:35.776914 IP node4.38845 > node2.36166: UDP, length 78
03:11:35.779135 IP node4.36499 > node2.36166: UDP, length 78
03:11:35.780562 IP node4.49214 > node2.36166: UDP, length 78
03:11:35.780905 IP node4.58465 > node2.36166: UDP, length 78
03:11:35.781056 IP node4.44091 > node1.32830: UDP, length 113
03:11:35.781086 IP node4.44091 > node2.33739: UDP, length 113
03:11:35.781148 IP node4.58465 > node1.32830: UDP, length 113
03:11:35.781804 IP node4.36451 > node1.32830: UDP, length 113
03:11:35.781927 IP node4.36451 > node2.36166: UDP, length 78
03:11:35.782500 IP node4.36486 > node2.36166: UDP, length 78
03:11:35.782866 IP node4.44113 > node2.36166: UDP, length 78
03:11:35.783236 IP node4.38789 > node2.36166: UDP, length 78
03:11:35.783315 IP node4.38789 > node1.32830: UDP, length 113
03:11:35.783588 IP node4.40772 > node2.36166: UDP, length 78
03:11:35.783971 IP node4.51500 > node2.36166: UDP, length 78
03:11:35.784348 IP node4.48590 > node2.36166: UDP, length 78
03:11:35.789224 IP node4.38845 > node1.32830: UDP, length 113
03:11:35.789347 IP node4.38845 > node2.33739: UDP, length 113
03:11:35.790386 IP node4.49214 > node1.32830: UDP, length 113
03:11:35.790529 IP node4.58460 > node1.32830: UDP, length 113
03:11:35.790592 IP node4.59422 > node2.36166: UDP, length 78
03:11:35.790655 IP node4.59422 > node1.32830: UDP, length 113
03:11:35.790719 IP node4.59422 > node2.33739: UDP, length 113
03:11:35.790819 IP node4.49214 > node2.33739: UDP, length 113
03:11:35.792619 IP node4.36451 > node2.33739: UDP, length 113
03:11:35.793824 IP node4.58460 > node2.47170: UDP, length 113
03:11:35.793926 IP node4.58460 > node2.33739: UDP, length 113
03:11:35.797257 IP node4.36825 > node1.32830: UDP, length 112
03:11:35.797343 IP node4.36825 > node2.33739: UDP, length 112
03:11:35.797464 IP node4.36825 > node2.47170: UDP, length 112
03:11:35.798163 IP node4.38845 > node2.47170: UDP, length 113
03:11:35.801564 IP node4.49214 > node2.47170: UDP, length 113
03:11:35.802380 IP node4.38789 > node2.47170: UDP, length 113
03:11:35.802495 IP node4.38789 > node2.33739: UDP, length 113
03:11:35.803214 IP node4.44091 > node2.47170: UDP, length 113
03:11:35.804488 IP node4.36825 > node2.36166: UDP, length 78
03:11:35.807302 IP node4.36451 > node2.47170: UDP, length 113
03:11:35.807707 IP node4.40772 > node2.47170: UDP, length 113
03:11:35.807783 IP node4.40772 > node1.32830: UDP, length 113
03:11:35.807852 IP node4.40772 > node2.33739: UDP, length 113
03:11:35.808109 IP node4.58460 > node2.36166: UDP, length 78
03:11:35.809893 IP node4.51500 > node2.47170: UDP, length 113
03:11:35.809979 IP node4.51500 > node1.32830: UDP, length 113
03:11:35.810052 IP node4.51500 > node2.33739: UDP, length 113
03:11:35.810257 IP node4.58465 > node2.47170: UDP, length 113
03:11:35.810364 IP node4.58465 > node2.33739: UDP, length 113
03:11:35.812093 IP node4.44091 > node2.36166: UDP, length 78
03:11:35.813229 IP node4.48590 > node2.47170: UDP, length 113
03:11:35.813327 IP node4.48590 > node1.32830: UDP, length 113
03:11:35.813438 IP node4.48590 > node2.33739: UDP, length 113
03:11:35.814213 IP node4.59422 > node2.47170: UDP, length 113
03:11:35.815042 IP node4.44113 > node2.47170: UDP, length 113
03:11:35.815119 IP node4.44113 > node1.32830: UDP, length 113
03:11:35.815188 IP node4.44113 > node2.33739: UDP, length 113
03:11:35.815401 IP node4.36499 > node2.47170: UDP, length 113
03:11:35.815476 IP node4.36499 > node1.32830: UDP, length 113
03:11:35.815540 IP node4.36499 > node2.33739: UDP, length 113
03:11:35.815811 IP node4.36486 > node2.47170: UDP, length 112
03:11:35.815879 IP node4.36486 > node1.32830: UDP, length 112
03:11:35.815941 IP node4.36486 > node2.33739: UDP, length 112
03:11:35.929245 IP node4.40772 > node2.36166: UDP, length 1120
03:11:36.006759 IP node4.44113 > node2.36166: UDP, length 78
03:11:36.012052 IP node4.48590 > node2.36166: UDP, length 78
03:11:36.015793 IP node4.36486 > node2.36166: UDP, length 78
03:11:36.017246 IP node4.51500 > node2.36166: UDP, length 78
03:11:36.017872 IP node4.38789 > node2.36166: UDP, length 78
03:11:36.018621 IP node4.36825 > node2.36166: UDP, length 78
03:11:36.019918 IP node4.38845 > node2.36166: UDP, length 78
03:11:36.020637 IP node4.59422 > node2.36166: UDP, length 78
03:11:36.020875 IP node4.36499 > node2.36166: UDP, length 78
03:11:36.024656 IP node4.49214 > node2.36166: UDP, length 78
03:11:36.029123 IP node4.44091 > node2.36166: UDP, length 78
03:11:36.029536 IP node4.58465 > node2.36166: UDP, length 78
03:11:36.030870 IP node4.58460 > node2.36166: UDP, length 78
03:11:36.035121 IP node4.40772 > node2.36166: UDP, length 78
03:11:36.037797 IP node4.36451 > node2.36166: UDP, length 78
03:11:36.243581 IP node4.36486 > node2.36166: UDP, length 1174
03:11:41.966740 IP node4.58465 > node2.36166: UDP, length 1174
03:11:43.294489 IP node4.36825 > node2.36166: UDP, length 1174
03:11:44.002003 IP node4.48590 > node2.36166: UDP, length 1174
03:11:44.232705 IP node4.49214 > node2.36166: UDP, length 1174
03:11:44.409917 IP node4.44091 > node2.36166: UDP, length 1174
03:11:45.358711 IP node4.36499 > node2.36166: UDP, length 1174
03:11:46.298401 IP node4.58460 > node2.36166: UDP, length 1174
03:11:46.661364 IP node4.59422 > node2.36166: UDP, length 1174
03:11:53.266811 IP node4.44113 > node2.36166: UDP, length 1174
03:11:53.634415 IP node4.36825 > node2.36166: UDP, length 1174
03:11:54.645281 IP node4.48590 > node2.36166: UDP, length 1174
03:11:54.775378 IP node4.38789 > node2.36166: UDP, length 1174
03:11:55.940171 IP node4.36825 > node2.36166: UDP, length 1174
03:11:56.497681 IP node4.38845 > node2.36166: UDP, length 1174
03:12:01.939199 IP node4.36486 > node2.36166: UDP, length 1174
03:12:02.900163 IP node4.58460 > node2.36166: UDP, length 1174
03:12:02.948980 IP node4.48590 > node2.36166: UDP, length 1174
03:12:04.583545 IP node4.49214 > node2.36166: UDP, length 1174
03:12:04.727471 IP node4.36451 > node2.36166: UDP, length 1174
03:12:06.711891 IP node4.36486 > node2.36166: UDP, length 1174
03:12:08.214174 IP node4.59422 > node2.36166: UDP, length 1174
03:12:08.265712 IP node4.44091 > node2.36166: UDP, length 1174
03:12:09.473001 IP node4.51500 > node2.36166: UDP, length 1174
03:12:09.930073 IP node4.38789 > node2.36166: UDP, length 1174
03:12:12.038068 IP node4.36825 > node2.36166: UDP, length 1174
03:12:14.080043 IP node4.40772 > node2.36166: UDP, length 1174
03:12:14.303053 IP node4.59422 > node2.36166: UDP, length 1174
03:12:14.939324 IP node4.36499 > node2.36166: UDP, length 1174
03:12:15.470053 IP node4.58460 > node2.36166: UDP, length 1174
03:12:18.923641 IP node4.36486 > node2.36166: UDP, length 1174
03:12:21.647478 IP node4.58465 > node2.36166: UDP, length 1174
03:12:21.855197 IP node4.38845 > node2.36166: UDP, length 1174
03:12:22.264954 IP node4.59422 > node2.36166: UDP, length 1174
03:12:23.163634 IP node4.38789 > node2.36166: UDP, length 1174
03:12:25.239881 IP node4.49214 > node2.36166: UDP, length 1174
03:12:25.552768 IP node4.44113 > node2.36166: UDP, length 1174
03:12:31.462729 IP node4.51500 > node2.36166: UDP, length 1174
03:12:33.334297 IP node4.36499 > node2.36166: UDP, length 1174
03:12:33.374508 IP node4.44091 > node2.36166: UDP, length 1174
03:12:35.038351 IP node4.36486 > node2.36166: UDP, length 1174
03:12:36.552682 IP node4.48590 > node2.36166: UDP, length 1174
03:12:37.415374 IP node4.38789 > node2.36166: UDP, length 1174
03:12:40.007074 IP node4.36451 > node2.36166: UDP, length 1174
03:12:40.063167 IP node4.49214 > node2.36166: UDP, length 1174
03:12:41.002828 IP node4.58460 > node2.36166: UDP, length 1174
03:12:44.102890 IP node4.59422 > node2.36166: UDP, length 1174
03:12:44.858504 IP node4.58460 > node2.36166: UDP, length 1174
03:12:45.333781 IP node4.36825 > node2.36166: UDP, length 1174
03:12:46.974177 IP node4.36499 > node2.36166: UDP, length 1174
03:12:50.077006 IP node4.40772 > node2.36166: UDP, length 1174
03:12:51.354015 IP node4.38845 > node2.36166: UDP, length 1174
03:12:56.523706 IP node4.59422 > node2.36166: UDP, length 1174
03:12:58.683133 IP node4.58460 > node2.36166: UDP, length 1174
03:12:59.497261 IP node4.58465 > node2.36166: UDP, length 1174
03:13:00.429534 IP node4.51500 > node2.36166: UDP, length 1174
03:13:02.342842 IP node4.49214 > node2.36166: UDP, length 1174
03:13:02.963371 IP node4.36825 > node2.36166: UDP, length 1174
03:13:03.464259 IP node4.44113 > node2.36166: UDP, length 1174
03:13:05.173080 IP node4.51500 > node2.36166: UDP, length 1174
03:13:06.054913 IP node4.51500 > node2.36166: UDP, length 1174
03:13:06.630445 IP node4.48590 > node2.36166: UDP, length 1174
03:13:08.402240 IP node4.44091 > node2.36166: UDP, length 1174
03:13:11.209673 IP node4.40772 > node2.36166: UDP, length 1174
03:13:11.555809 IP node4.36825 > node2.36166: UDP, length 1174
03:13:11.558953 IP node4.36486 > node2.36166: UDP, length 1174
03:13:13.043693 IP node4.38789 > node2.36166: UDP, length 1174
03:13:17.236022 IP node4.36451 > node2.36166: UDP, length 1174
03:13:20.446902 IP node4.58460 > node2.36166: UDP, length 1174
03:13:23.331809 IP node4.36499 > node2.36166: UDP, length 1174
03:13:27.151557 IP node4.38845 > node2.36166: UDP, length 1174
03:13:28.090027 IP node4.44091 > node2.36166: UDP, length 1174
03:13:28.701627 IP node4.59422 > node2.36166: UDP, length 1174
03:13:31.528932 IP node4.44113 > node2.36166: UDP, length 1174
03:13:35.114658 IP node4.36451 > node2.36166: UDP, length 1174
03:13:36.111817 IP node4.44113 > node2.36166: UDP, length 1174
03:13:36.391815 IP node4.58465 > node2.36166: UDP, length 1174
03:13:37.133642 IP node4.51500 > node2.36166: UDP, length 1174
03:13:38.168108 IP node4.48590 > node2.36166: UDP, length 1174
03:13:39.330683 IP node4.36486 > node2.36166: UDP, length 1174
03:13:40.328898 IP node4.49214 > node2.36166: UDP, length 1174
03:13:40.746392 IP node4.36499 > node2.36166: UDP, length 1174
03:13:40.756332 IP node4.40772 > node2.36166: UDP, length 1174
03:13:41.201616 IP node4.58460 > node2.36166: UDP, length 1174
03:13:42.641675 IP node4.38789 > node2.36166: UDP, length 1174
03:13:44.102493 IP node4.38789 > node2.36166: UDP, length 1174
03:13:45.603694 IP node4.36825 > node2.36166: UDP, length 1174
03:13:45.711201 IP node4.38789 > node2.36166: UDP, length 67
03:13:45.731168 IP node4.59422 > node2.36166: UDP, length 67
03:13:45.849348 IP node4.38845 > node2.36166: UDP, length 67
03:13:45.905505 IP node4.51500 > node2.36166: UDP, length 67
03:13:45.913812 IP node4.36486 > node2.36166: UDP, length 67
03:13:45.941250 IP node4.48590 > node2.36166: UDP, length 67
03:13:45.956225 IP node4.58465 > node2.36166: UDP, length 67
03:13:45.998220 IP node4.49214 > node2.36166: UDP, length 67
03:13:46.035947 IP node4.44091 > node2.36166: UDP, length 67
03:13:46.036456 IP node4.40772 > node2.36166: UDP, length 67
03:13:46.061226 IP node4.58460 > node2.36166: UDP, length 1174
03:13:46.145020 IP node4.36499 > node2.36166: UDP, length 67
03:13:46.158375 IP node4.44113 > node2.36166: UDP, length 67
03:13:46.369305 IP node4.58460 > node2.36166: UDP, length 67
03:13:46.401226 IP node4.36825 > node2.36166: UDP, length 67
03:13:46.432084 IP node4.36451 > node2.36166: UDP, length 67
03:13:48.014103 IP node4.40772 > node2.36166: UDP, length 1174
03:13:50.627785 IP node4.59422 > node2.36166: UDP, length 1174
03:13:50.935288 IP node4.36451 > node2.36166: UDP, length 1174
03:13:51.745801 IP node4.44091 > node2.36166: UDP, length 1174
03:13:55.004239 IP node4.36486 > node2.36166: UDP, length 1174
03:13:56.110134 IP node4.36499 > node2.36166: UDP, length 1174
03:13:56.161208 IP node4.44113 > node2.36166: UDP, length 1174
03:13:57.336351 IP node4.38845 > node2.36166: UDP, length 1174
03:13:58.575428 IP node4.59422 > node2.36166: UDP, length 1174
03:14:02.320485 IP node4.49214 > node2.36166: UDP, length 1174
03:14:03.013009 IP node4.36486 > node2.36166: UDP, length 1174
03:14:03.047977 IP node4.36451 > node2.36166: UDP, length 1174
03:14:04.316237 IP node4.44091 > node2.36166: UDP, length 1174
03:14:04.939104 IP node4.38845 > node2.36166: UDP, length 1174
03:14:06.510738 IP node4.40772 > node2.36166: UDP, length 1174
03:14:07.830034 IP node4.51500 > node2.36166: UDP, length 1174
03:14:08.676545 IP node4.58465 > node2.36166: UDP, length 1174
03:14:09.768270 IP node4.40772 > node2.36166: UDP, length 1174
03:14:10.914015 IP node4.38845 > node2.36166: UDP, length 1174
03:14:11.421771 IP node4.48590 > node2.36166: UDP, length 1174
03:14:11.970101 IP node4.38789 > node2.36166: UDP, length 1174
03:14:12.436255 IP node4.36825 > node2.36166: UDP, length 1174
03:14:14.382374 IP node4.48590 > node2.36166: UDP, length 1174
03:14:15.857893 IP node4.36825 > node2.36166: UDP, length 1174
03:14:15.900344 IP node4.36825 > node2.36166: UDP, length 1174
03:14:17.887707 IP node4.58460 > node2.36166: UDP, length 1174
03:14:18.386039 IP node4.48590 > node2.36166: UDP, length 1174
03:14:19.102575 IP node4.48590 > node2.36166: UDP, length 1174
03:14:20.618569 IP node4.38789 > node2.36166: UDP, length 1174
03:14:20.765909 IP node4.44113 > node2.36166: UDP, length 1174
03:14:20.782013 IP node4.59422 > node2.36166: UDP, length 1174
03:14:21.435520 IP node4.59422 > node2.36166: UDP, length 1174
03:14:22.000704 IP node4.51500 > node2.36166: UDP, length 1174
03:14:22.091273 IP node4.38789 > node2.36166: UDP, length 1174
03:14:23.137012 IP node4.58465 > node2.36166: UDP, length 1174
03:14:23.494755 IP node4.38789 > node2.36166: UDP, length 1174
03:14:24.141783 IP node4.36499 > node2.36166: UDP, length 1174
03:14:28.219726 IP node4.44091 > node2.36166: UDP, length 1174
03:14:30.178215 IP node4.49214 > node2.36166: UDP, length 1174
03:14:31.909510 IP node4.36486 > node2.36166: UDP, length 1174
03:14:31.998946 IP node4.59422 > node2.36166: UDP, length 1174
03:14:33.716497 IP node4.44091 > node2.36166: UDP, length 1174
03:14:33.884977 IP node4.36486 > node2.36166: UDP, length 154
03:14:33.939849 IP node4.38845 > node2.36166: UDP, length 1174
03:14:34.062215 IP node4.48590 > node2.36166: UDP, length 154
03:14:34.260546 IP node4.36499 > node2.36166: UDP, length 154
03:14:34.269948 IP node4.44113 > node2.36166: UDP, length 154
03:14:34.520966 IP node4.36451 > node2.36166: UDP, length 154
03:14:34.535258 IP node4.58460 > node2.36166: UDP, length 154
03:14:34.895809 IP node4.36486 > node2.36166: UDP, length 154
03:14:34.903394 IP node4.59422 > node2.36166: UDP, length 154
03:14:34.914496 IP node4.49214 > node2.36166: UDP, length 154
03:14:34.933865 IP node4.51500 > node2.36166: UDP, length 154
03:14:34.944572 IP node4.38789 > node2.36166: UDP, length 154
03:14:34.948233 IP node4.58465 > node2.36166: UDP, length 154
03:14:35.076805 IP node4.48590 > node2.36166: UDP, length 154
03:14:35.187579 IP node4.40772 > node2.36166: UDP, length 154
03:14:35.215381 IP node4.38845 > node2.36166: UDP, length 154
03:14:35.219323 IP node4.44091 > node2.36166: UDP, length 154
03:14:35.245406 IP node4.36825 > node2.36166: UDP, length 154
03:14:35.270954 IP node4.36499 > node2.36166: UDP, length 154
03:14:35.291957 IP node4.44113 > node2.36166: UDP, length 154
03:14:35.530942 IP node4.36451 > node2.36166: UDP, length 154
03:14:35.541528 IP node4.58460 > node2.36166: UDP, length 154
03:14:35.904404 IP node4.36486 > node2.36166: UDP, length 154
03:14:35.916655 IP node4.59422 > node2.36166: UDP, length 154
03:14:35.923245 IP node4.49214 > node2.36166: UDP, length 154
03:14:35.943591 IP node4.51500 > node2.36166: UDP, length 154
03:14:35.957189 IP node4.58465 > node2.36166: UDP, length 154
03:14:35.957338 IP node4.38789 > node2.36166: UDP, length 154
03:14:36.081213 IP node4.48590 > node2.36166: UDP, length 154
03:14:36.193864 IP node4.40772 > node2.36166: UDP, length 154
03:14:36.222426 IP node4.38845 > node2.36166: UDP, length 154
03:14:36.227190 IP node4.44091 > node2.36166: UDP, length 154
03:14:36.251255 IP node4.36825 > node2.36166: UDP, length 154
03:14:36.280206 IP node4.36499 > node2.36166: UDP, length 154
03:14:36.302713 IP node4.44113 > node2.36166: UDP, length 154
03:14:36.538541 IP node4.36451 > node2.36166: UDP, length 154
03:14:36.550992 IP node4.58460 > node2.36166: UDP, length 154
03:14:36.908656 IP node4.36486 > node2.36166: UDP, length 154
03:14:36.929832 IP node4.49214 > node2.36166: UDP, length 154
03:14:36.931486 IP node4.59422 > node2.36166: UDP, length 154
03:14:36.949535 IP node4.51500 > node2.36166: UDP, length 154
03:14:36.961751 IP node4.58465 > node2.36166: UDP, length 154
03:14:36.964672 IP node4.38789 > node2.36166: UDP, length 154
03:14:37.087189 IP node4.48590 > node2.36166: UDP, length 154
03:14:37.200657 IP node4.40772 > node2.36166: UDP, length 154
03:14:37.227059 IP node4.38845 > node2.36166: UDP, length 154
03:14:37.231389 IP node4.44091 > node2.36166: UDP, length 154
03:14:37.266296 IP node4.36825 > node2.36166: UDP, length 154
03:14:37.283838 IP node4.36499 > node2.36166: UDP, length 154
03:14:37.332658 IP node4.44113 > node2.36166: UDP, length 154
03:14:37.545264 IP node4.36451 > node2.36166: UDP, length 154
03:14:37.557662 IP node4.58460 > node2.36166: UDP, length 154
03:14:37.916280 IP node4.36486 > node2.36166: UDP, length 154
03:14:37.935933 IP node4.59422 > node2.36166: UDP, length 154
03:14:37.936143 IP node4.49214 > node2.36166: UDP, length 154
03:14:37.956673 IP node4.51500 > node2.36166: UDP, length 154
03:14:37.972557 IP node4.58465 > node2.36166: UDP, length 154
03:14:37.978356 IP node4.38789 > node2.36166: UDP, length 154
03:14:38.096083 IP node4.48590 > node2.36166: UDP, length 154
03:14:38.207788 IP node4.40772 > node2.36166: UDP, length 154
03:14:38.233096 IP node4.38845 > node2.36166: UDP, length 154
03:14:38.240406 IP node4.44091 > node2.36166: UDP, length 154
03:14:38.275041 IP node4.36825 > node2.36166: UDP, length 154
03:14:38.300944 IP node4.36499 > node2.36166: UDP, length 154
03:14:38.316092 IP node4.36451 > node2.36166: UDP, length 1175
03:14:38.354863 IP node4.44113 > node2.36166: UDP, length 154
03:14:38.554405 IP node4.36451 > node2.36166: UDP, length 154
03:14:38.567706 IP node4.58460 > node2.36166: UDP, length 154
03:14:38.653989 IP node4.40772 > node2.36166: UDP, length 1175
03:14:38.930425 IP node4.36486 > node2.36166: UDP, length 154
03:14:38.944406 IP node4.49214 > node2.36166: UDP, length 154
03:14:38.945565 IP node4.59422 > node2.36166: UDP, length 154
03:14:38.966402 IP node4.51500 > node2.36166: UDP, length 154
03:14:38.982104 IP node4.58465 > node2.36166: UDP, length 154
03:14:38.988008 IP node4.38789 > node2.36166: UDP, length 154
03:14:39.112870 IP node4.48590 > node2.36166: UDP, length 154
03:14:39.218658 IP node4.40772 > node2.36166: UDP, length 154
03:14:39.239096 IP node4.38845 > node2.36166: UDP, length 154
03:14:39.248646 IP node4.44091 > node2.36166: UDP, length 154
03:14:39.281095 IP node4.36825 > node2.36166: UDP, length 154
03:14:39.304866 IP node4.36499 > node2.36166: UDP, length 154
03:14:39.369745 IP node4.44113 > node2.36166: UDP, length 154
03:14:39.562320 IP node4.36451 > node2.36166: UDP, length 154
03:14:39.571862 IP node4.58460 > node2.36166: UDP, length 154
03:14:39.943702 IP node4.36486 > node2.36166: UDP, length 154
03:14:39.955550 IP node4.49214 > node2.36166: UDP, length 154
03:14:39.955833 IP node4.59422 > node2.36166: UDP, length 154
03:14:39.971406 IP node4.51500 > node2.36166: UDP, length 154
03:14:39.990025 IP node4.58465 > node2.36166: UDP, length 154
03:14:39.993975 IP node4.38789 > node2.36166: UDP, length 154
03:14:40.120384 IP node4.48590 > node2.36166: UDP, length 154
03:14:40.223851 IP node4.40772 > node2.36166: UDP, length 154
03:14:40.243943 IP node4.38845 > node2.36166: UDP, length 154
03:14:40.257677 IP node4.44091 > node2.36166: UDP, length 154
03:14:40.288437 IP node4.36825 > node2.36166: UDP, length 154
03:14:40.310361 IP node4.36499 > node2.36166: UDP, length 154
03:14:40.374468 IP node4.44113 > node2.36166: UDP, length 154
03:14:40.569237 IP node4.36451 > node2.36166: UDP, length 154
03:14:40.579084 IP node4.58460 > node2.36166: UDP, length 154
03:14:40.958483 IP node4.36486 > node2.36166: UDP, length 154
03:14:40.969060 IP node4.49214 > node2.36166: UDP, length 154
03:14:40.971085 IP node4.59422 > node2.36166: UDP, length 154
03:14:40.979070 IP node4.51500 > node2.36166: UDP, length 154
03:14:41.001894 IP node4.58465 > node2.36166: UDP, length 154
03:14:41.006068 IP node4.38789 > node2.36166: UDP, length 154
03:14:41.128494 IP node4.48590 > node2.36166: UDP, length 154
03:14:41.227496 IP node4.40772 > node2.36166: UDP, length 154
03:14:41.249187 IP node4.38845 > node2.36166: UDP, length 154
03:14:41.269848 IP node4.44091 > node2.36166: UDP, length 154
03:14:41.293934 IP node4.36825 > node2.36166: UDP, length 154
03:14:41.314836 IP node4.36499 > node2.36166: UDP, length 154
03:14:41.380087 IP node4.44113 > node2.36166: UDP, length 154
03:14:41.577749 IP node4.36451 > node2.36166: UDP, length 154
03:14:41.584350 IP node4.58460 > node2.36166: UDP, length 154
03:14:41.954938 IP node4.44113 > node2.36166: UDP, length 1175
03:14:41.962801 IP node4.36486 > node2.36166: UDP, length 154
03:14:41.974849 IP node4.49214 > node2.36166: UDP, length 154
03:14:41.977756 IP node4.59422 > node2.36166: UDP, length 154
03:14:41.993218 IP node4.51500 > node2.36166: UDP, length 154
03:14:42.014484 IP node4.58465 > node2.36166: UDP, length 154
03:14:42.017838 IP node4.38789 > node2.36166: UDP, length 154
03:14:42.132136 IP node4.48590 > node2.36166: UDP, length 154
03:14:42.232326 IP node4.40772 > node2.36166: UDP, length 154
03:14:42.256579 IP node4.38845 > node2.36166: UDP, length 154
03:14:42.276839 IP node4.44091 > node2.36166: UDP, length 154
03:14:42.297917 IP node4.36825 > node2.36166: UDP, length 154
03:14:42.319109 IP node4.36499 > node2.36166: UDP, length 154
03:14:42.383932 IP node4.44113 > node2.36166: UDP, length 154
03:14:42.582554 IP node4.36451 > node2.36166: UDP, length 154
03:14:42.588750 IP node4.58460 > node2.36166: UDP, length 154
03:14:42.764443 IP node4.40772 > node2.36166: UDP, length 1175
03:14:42.969916 IP node4.36486 > node2.36166: UDP, length 154
03:14:42.984146 IP node4.59422 > node2.36166: UDP, length 154
03:14:42.986251 IP node4.49214 > node2.36166: UDP, length 154
03:14:43.002300 IP node4.51500 > node2.36166: UDP, length 154
03:14:43.022368 IP node4.58465 > node2.36166: UDP, length 154
03:14:43.026579 IP node4.38789 > node2.36166: UDP, length 154
03:14:43.135548 IP node4.48590 > node2.36166: UDP, length 154
03:14:43.239900 IP node4.40772 > node2.36166: UDP, length 154
03:14:43.259410 IP node4.44113 > node2.36166: UDP, length 1175
03:14:43.262110 IP node4.38845 > node2.36166: UDP, length 154
03:14:43.282866 IP node4.44091 > node2.36166: UDP, length 154
03:14:43.300366 IP node4.36825 > node2.36166: UDP, length 154
03:14:43.324307 IP node4.36499 > node2.36166: UDP, length 154
03:14:43.390074 IP node4.44113 > node2.36166: UDP, length 154
03:14:43.476994 IP node4.44113 > node2.36166: UDP, length 1175
03:14:43.589205 IP node4.36451 > node2.36166: UDP, length 154
03:14:43.592287 IP node4.58460 > node2.36166: UDP, length 154
03:14:43.648807 IP node4.59422 > node2.36166: UDP, length 1175
03:14:43.975630 IP node4.36486 > node2.36166: UDP, length 154
03:14:43.989640 IP node4.49214 > node2.36166: UDP, length 154
03:14:43.991898 IP node4.59422 > node2.36166: UDP, length 154
03:14:44.007537 IP node4.51500 > node2.36166: UDP, length 154
03:14:44.026463 IP node4.58465 > node2.36166: UDP, length 154
03:14:44.035549 IP node4.38789 > node2.36166: UDP, length 154
03:14:44.139307 IP node4.48590 > node2.36166: UDP, length 154
03:14:44.248642 IP node4.40772 > node2.36166: UDP, length 154
03:14:44.265072 IP node4.38845 > node2.36166: UDP, length 154
03:14:44.288550 IP node4.44091 > node2.36166: UDP, length 154
03:14:44.306789 IP node4.36825 > node2.36166: UDP, length 154
03:14:44.332967 IP node4.36499 > node2.36166: UDP, length 154
03:14:44.395154 IP node4.44113 > node2.36166: UDP, length 154
03:14:44.596034 IP node4.36451 > node2.36166: UDP, length 154
03:14:44.598993 IP node4.58460 > node2.36166: UDP, length 154
03:14:44.621562 IP node4.44091 > node2.36166: UDP, length 1175
03:14:44.976388 IP node4.36486 > node2.36166: UDP, length 154
03:14:44.993370 IP node4.49214 > node2.36166: UDP, length 154
03:14:45.001010 IP node4.59422 > node2.36166: UDP, length 154
03:14:45.012040 IP node4.51500 > node2.36166: UDP, length 154
03:14:45.032696 IP node4.58465 > node2.36166: UDP, length 154
03:14:45.040187 IP node4.38789 > node2.36166: UDP, length 154
03:14:45.140441 IP node4.48590 > node2.36166: UDP, length 154
03:14:45.252615 IP node4.40772 > node2.36166: UDP, length 154
03:14:45.271013 IP node4.38845 > node2.36166: UDP, length 154
03:14:45.293857 IP node4.44091 > node2.36166: UDP, length 154
03:14:45.313682 IP node4.36825 > node2.36166: UDP, length 154
03:14:45.332951 IP node4.36499 > node2.36166: UDP, length 154
03:14:45.396078 IP node4.44113 > node2.36166: UDP, length 154
03:14:45.599557 IP node4.58460 > node2.36166: UDP, length 154
03:14:45.599850 IP node4.36451 > node2.36166: UDP, length 154
03:14:45.995044 IP node4.49214 > node2.36166: UDP, length 154
03:14:46.002009 IP node4.59422 > node2.36166: UDP, length 154
03:14:46.013172 IP node4.51500 > node2.36166: UDP, length 154
03:14:46.033911 IP node4.58465 > node2.36166: UDP, length 154
03:14:46.041095 IP node4.38789 > node2.36166: UDP, length 154
03:14:46.253364 IP node4.40772 > node2.36166: UDP, length 154
03:14:46.271738 IP node4.38845 > node2.36166: UDP, length 154
03:14:46.294693 IP node4.44091 > node2.36166: UDP, length 154
03:14:46.314052 IP node4.36825 > node2.36166: UDP, length 154
03:14:47.160129 IP node4.36486 > node2.36166: UDP, length 1175
03:14:47.741367 IP node4.58460 > node2.36166: UDP, length 1175
03:14:48.932310 IP node4.48590 > node2.36166: UDP, length 1175
03:14:49.459133 IP node4.40772 > node2.36166: UDP, length 1175
03:14:50.258063 IP node4.59422 > node2.36166: UDP, length 1175
03:14:51.070458 IP node4.38845 > node2.36166: UDP, length 1175
03:14:51.613787 IP node4.36486 > node2.36166: UDP, length 1175
03:14:52.314020 IP node4.36825 > node2.36166: UDP, length 1175
03:14:55.162668 IP node4.58465 > node2.36166: UDP, length 1175
03:14:57.330419 IP node4.38789 > node2.36166: UDP, length 1175
03:14:59.982052 IP node4.51500 > node2.36166: UDP, length 1175
03:15:03.125394 IP node4.36499 > node2.36166: UDP, length 1175
03:15:03.145561 IP node4.36825 > node2.36166: UDP, length 1175
03:15:05.112109 IP node4.49214 > node2.36166: UDP, length 1175
03:15:05.325300 IP node4.44091 > node2.36166: UDP, length 1175
03:15:06.064493 IP node4.36451 > node2.36166: UDP, length 1175
03:15:06.552776 IP node4.36451 > node2.36166: UDP, length 1175
03:15:13.563545 IP node4.49214 > node2.36166: UDP, length 1175
03:15:15.238786 IP node4.44091 > node2.36166: UDP, length 1175
03:15:16.234581 IP node4.36486 > node2.36166: UDP, length 1175
03:15:17.881970 IP node4.38845 > node2.36166: UDP, length 1175
03:15:19.348828 IP node4.58460 > node2.36166: UDP, length 1175
03:15:19.968926 IP node4.58465 > node2.36166: UDP, length 1175
03:15:20.009621 IP node4.51500 > node2.36166: UDP, length 1175
03:15:21.133929 IP node4.38789 > node2.36166: UDP, length 1175
03:15:21.300702 IP node4.44091 > node2.36166: UDP, length 1175
03:15:21.609311 IP node4.59422 > node2.36166: UDP, length 1175
03:15:22.958544 IP node4.58460 > node2.36166: UDP, length 1175
03:15:23.005237 IP node4.36825 > node2.36166: UDP, length 1175
03:15:23.392868 IP node4.44113 > node2.36166: UDP, length 1175
03:15:23.995876 IP node4.40772 > node2.36166: UDP, length 1175
03:15:24.129408 IP node4.36451 > node2.36166: UDP, length 1175
03:15:24.537191 IP node4.48590 > node2.36166: UDP, length 1175
03:15:24.620070 IP node4.36451 > node2.36166: UDP, length 1175
03:15:24.919290 IP node4.48590 > node2.36166: UDP, length 1175
03:15:26.398142 IP node4.36499 > node2.36166: UDP, length 1175
03:15:30.542555 IP node4.36451 > node2.36166: UDP, length 1175
03:15:31.769529 IP node4.38845 > node2.36166: UDP, length 1175
03:15:37.399941 IP node4.36825 > node2.36166: UDP, length 1175
03:15:38.333764 IP node4.36499 > node2.36166: UDP, length 1175
03:15:39.037000 IP node4.49214 > node2.36166: UDP, length 1175
03:15:39.923234 IP node4.36486 > node2.36166: UDP, length 1175
03:15:40.032431 IP node4.49214 > node2.36166: UDP, length 1175
03:15:40.467643 IP node4.36486 > node2.36166: UDP, length 1175
03:15:41.332993 IP node4.51500 > node2.36166: UDP, length 1175
03:15:42.773809 IP node4.59422 > node2.36166: UDP, length 1175
03:15:43.230775 IP node4.59422 > node2.36166: UDP, length 1175
03:15:45.110477 IP node4.36825 > node2.36166: UDP, length 1175
03:15:47.634944 IP node4.58460 > node2.36166: UDP, length 1175
03:15:47.686985 IP node4.36825 > node2.36166: UDP, length 1175
03:15:52.511275 IP node4.58465 > node2.36166: UDP, length 1175
03:15:52.662289 IP node4.40772 > node2.36166: UDP, length 1175
03:15:53.332079 IP node4.44091 > node2.36166: UDP, length 1175
03:15:53.379740 IP node4.58465 > node2.36166: UDP, length 1175
03:15:54.055176 IP node4.36486 > node2.36166: UDP, length 1175
03:15:54.615345 IP node4.58460 > node2.36166: UDP, length 1175
03:15:55.523022 IP node4.44113 > node2.36166: UDP, length 1175
03:15:57.210196 IP node4.36499 > node2.36166: UDP, length 1175
03:15:58.096638 IP node4.38789 > node2.36166: UDP, length 1175

