03:11:30.054615 IP node3.34474 > node2.58256: UDP, length 113
03:11:30.082055 IP node3.43587 > node2.36166: UDP, length 113
03:11:30.082286 IP node3.43587 > node2.35844: UDP, length 113
03:11:30.082458 IP node3.43587 > node2.58256: UDP, length 113
03:11:30.115391 IP node3.34474 > node2.36166: UDP, length 113
03:11:30.117268 IP node3.34474 > node2.44193: UDP, length 113
03:11:30.128651 IP node3.34474 > node2.52599: UDP, length 113
03:11:30.144397 IP node3.34474 > node2.38620: UDP, length 113
03:11:30.191247 IP node3.43587 > node2.38620: UDP, length 113
03:11:30.191473 IP node3.43587 > node2.44193: UDP, length 113
03:11:30.191585 IP node3.43587 > node2.52599: UDP, length 113
03:11:30.194439 IP node3.34474 > node2.40826: UDP, length 113
03:11:30.195755 IP node3.43587 > node2.40826: UDP, length 113
03:11:30.227535 IP node3.43587 > node2.47792: UDP, length 113
03:11:30.227926 IP node3.34474 > node2.47792: UDP, length 113
03:11:30.358438 IP node3.33617 > node2.38620: UDP, length 113
03:11:30.358690 IP node3.33617 > node2.47792: UDP, length 113
03:11:30.359025 IP node3.33617 > node2.44193: UDP, length 113
03:11:30.359116 IP node3.33617 > node2.40826: UDP, length 113
03:11:30.359320 IP node3.33617 > node2.52599: UDP, length 113
03:11:30.374790 IP node3.52099 > node2.38620: UDP, length 113
03:11:30.375025 IP node3.52099 > node2.47792: UDP, length 113
03:11:30.375510 IP node3.52099 > node2.44193: UDP, length 113
03:11:30.375588 IP node3.52099 > node2.40826: UDP, length 113
03:11:30.376006 IP node3.52099 > node2.52599: UDP, length 113
03:11:30.600312 IP node3.43587 > node1.33333: UDP, length 113
03:11:30.600312 IP node3.33617 > node1.33333: UDP, length 113
03:11:30.600581 IP node3.56938 > node1.33333: UDP, length 113
03:11:30.601161 IP node3.52099 > node1.33333: UDP, length 113
03:11:30.603274 IP node3.34474 > node1.33333: UDP, length 113
03:11:30.616911 IP node3.56677 > node1.33333: UDP, length 113
03:11:30.721856 IP node3.42227 > node1.33333: UDP, length 112
03:11:30.750543 IP node3.57155 > node1.33333: UDP, length 113
03:11:30.774754 IP node3.35550 > node1.33333: UDP, length 113
03:11:30.874823 IP node3.57155 > node1.40064: UDP, length 113
03:11:30.875196 IP node3.34474 > node1.40064: UDP, length 113
03:11:30.875283 IP node3.56938 > node1.40064: UDP, length 113
03:11:30.876510 IP node3.42227 > node1.40064: UDP, length 112
03:11:30.877075 IP node3.33617 > node1.40064: UDP, length 113
03:11:30.877402 IP node3.56677 > node1.40064: UDP, length 113
03:11:30.877907 IP node3.52099 > node1.40064: UDP, length 113
03:11:30.878284 IP node3.35550 > node1.40064: UDP, length 113
03:11:30.878673 IP node3.43587 > node1.40064: UDP, length 113
03:11:30.914520 IP node3.52099 > node4.36486: UDP, length 113
03:11:30.914520 IP node3.34474 > node4.36486: UDP, length 113
03:11:30.914962 IP node3.35550 > node4.36486: UDP, length 113
03:11:30.915432 IP node3.56938 > node4.36486: UDP, length 113
03:11:30.915522 IP node3.57155 > node4.36486: UDP, length 113
03:11:30.916772 IP node3.33617 > node4.36486: UDP, length 113
03:11:30.917689 IP node3.42227 > node4.36486: UDP, length 112
03:11:30.918000 IP node3.56677 > node4.36486: UDP, length 113
03:11:30.925089 IP node3.43587 > node4.36486: UDP, length 113
03:11:30.954347 IP node3.57155 > node4.48590: UDP, length 113
03:11:30.955096 IP node3.42227 > node4.48590: UDP, length 112
03:11:30.955326 IP node3.56938 > node4.48590: UDP, length 113
03:11:30.955503 IP node3.43587 > node4.48590: UDP, length 113
03:11:30.956093 IP node3.33617 > node4.48590: UDP, length 113
03:11:30.956924 IP node3.52099 > node4.48590: UDP, length 113
03:11:30.957759 IP node3.35550 > node4.48590: UDP, length 113
03:11:30.958217 IP node3.56677 > node4.48590: UDP, length 113
03:11:30.958772 IP node3.34474 > node4.48590: UDP, length 113
03:11:31.050066 IP node3.52635 > node4.36486: UDP, length 113
03:11:31.050980 IP node3.52635 > node4.48590: UDP, length 113
03:11:31.130857 IP node3.52635 > node4.44113: UDP, length 113
03:11:31.134175 IP node3.52099 > node4.44113: UDP, length 113
03:11:31.135397 IP node3.35550 > node4.44113: UDP, length 113
03:11:31.135715 IP node3.43587 > node4.44113: UDP, length 113
03:11:31.136029 IP node3.56938 > node4.44113: UDP, length 113
03:11:31.136325 IP node3.42227 > node4.44113: UDP, length 112
03:11:31.136699 IP node3.56677 > node4.44113: UDP, length 113
03:11:31.136862 IP node3.33617 > node4.44113: UDP, length 113
03:11:31.139528 IP node3.34474 > node4.44113: UDP, length 113
03:11:31.140032 IP node3.57155 > node4.44113: UDP, length 113
03:11:31.162649 IP node3.48193 > node1.40064: UDP, length 112
03:11:31.166184 IP node3.42227 > node4.36499: UDP, length 112
03:11:31.166480 IP node3.57155 > node4.36499: UDP, length 113
03:11:31.166664 IP node3.33617 > node4.36499: UDP, length 113
03:11:31.167382 IP node3.43587 > node4.36499: UDP, length 113
03:11:31.168061 IP node3.52099 > node4.36499: UDP, length 113
03:11:31.168370 IP node3.56677 > node4.36499: UDP, length 113
03:11:31.168552 IP node3.52635 > node4.36499: UDP, length 113
03:11:31.168813 IP node3.35550 > node4.36499: UDP, length 113
03:11:31.168984 IP node3.56938 > node4.36499: UDP, length 113
03:11:31.169170 IP node3.60133 > node4.36486: UDP, length 113
03:11:31.169170 IP node3.34474 > node4.36499: UDP, length 113
03:11:31.185314 IP node3.48193 > node4.48590: UDP, length 112
03:11:31.185541 IP node3.48193 > node4.36486: UDP, length 112
03:11:31.185779 IP node3.48193 > node4.44113: UDP, length 112
03:11:31.186032 IP node3.48193 > node4.36499: UDP, length 112
03:11:31.221365 IP node3.60133 > node4.48590: UDP, length 113
03:11:31.221631 IP node3.60133 > node4.44113: UDP, length 113
03:11:31.221727 IP node3.60133 > node4.36499: UDP, length 113
03:11:31.236347 IP node3.35498 > node4.44113: UDP, length 112
03:11:31.257479 IP node3.35498 > node4.36499: UDP, length 112
03:11:31.288877 IP node3.35498 > node4.58460: UDP, length 112
03:11:31.290126 IP node3.35550 > node4.58460: UDP, length 113
03:11:31.290425 IP node3.43587 > node4.58460: UDP, length 113
03:11:31.290578 IP node3.60133 > node4.58460: UDP, length 113
03:11:31.290802 IP node3.52635 > node4.58460: UDP, length 113
03:11:31.290875 IP node3.56677 > node4.58460: UDP, length 113
03:11:31.290958 IP node3.34474 > node4.58460: UDP, length 113
03:11:31.291163 IP node3.48193 > node4.58460: UDP, length 112
03:11:31.291725 IP node3.52099 > node4.58460: UDP, length 113
03:11:31.292056 IP node3.56938 > node4.58460: UDP, length 113
03:11:31.292332 IP node3.42227 > node4.58460: UDP, length 112
03:11:31.292379 IP node3.57155 > node4.58460: UDP, length 113
03:11:31.292819 IP node3.33617 > node4.58460: UDP, length 113
03:11:31.308078 IP node3.49285 > node4.44113: UDP, length 113
03:11:31.313595 IP node3.49285 > node4.36499: UDP, length 113
03:11:31.313848 IP node3.49285 > node4.58460: UDP, length 113
03:11:31.350632 IP node3.60850 > node4.36499: UDP, length 112
03:11:31.351038 IP node3.60850 > node4.58460: UDP, length 112
03:11:31.458299 IP node3.33617 > node4.36451: UDP, length 113
03:11:31.458679 IP node3.35498 > node4.36451: UDP, length 112
03:11:31.458738 IP node3.42227 > node4.36451: UDP, length 112
03:11:31.459154 IP node3.60133 > node4.36451: UDP, length 113
03:11:31.459228 IP node3.57155 > node4.36451: UDP, length 113
03:11:31.459415 IP node3.56938 > node4.36451: UDP, length 113
03:11:31.459495 IP node3.48193 > node4.36451: UDP, length 112
03:11:31.459576 IP node3.56677 > node4.36451: UDP, length 113
03:11:31.459732 IP node3.52635 > node4.36451: UDP, length 113
03:11:31.460040 IP node3.43587 > node4.36451: UDP, length 113
03:11:31.460822 IP node3.52099 > node4.36451: UDP, length 113
03:11:31.460956 IP node3.35550 > node4.36451: UDP, length 113
03:11:31.461043 IP node3.49285 > node4.36451: UDP, length 113
03:11:31.461983 IP node3.60850 > node4.36451: UDP, length 112
03:11:31.462605 IP node3.34474 > node4.36451: UDP, length 113
03:11:31.622166 IP node3.42227 > node4.59422: UDP, length 112
03:11:31.622713 IP node3.49285 > node4.59422: UDP, length 113
03:11:31.622849 IP node3.35498 > node4.59422: UDP, length 112
03:11:31.622940 IP node3.33617 > node4.59422: UDP, length 113
03:11:31.623434 IP node3.56677 > node4.59422: UDP, length 113
03:11:31.623680 IP node3.35550 > node4.59422: UDP, length 113
03:11:31.623765 IP node3.52635 > node4.59422: UDP, length 113
03:11:31.623901 IP node3.57155 > node4.59422: UDP, length 113
03:11:31.623993 IP node3.60133 > node4.59422: UDP, length 113
03:11:31.624189 IP node3.43587 > node4.59422: UDP, length 113
03:11:31.624252 IP node3.48193 > node4.59422: UDP, length 112
03:11:31.625100 IP node3.56938 > node4.59422: UDP, length 113
03:11:31.625260 IP node3.34474 > node4.59422: UDP, length 113
03:11:31.625761 IP node3.52099 > node4.59422: UDP, length 113
03:11:31.625832 IP node3.60850 > node4.59422: UDP, length 112
03:11:31.664424 IP node3.35498 > node4.51500: UDP, length 112
03:11:31.665896 IP node3.52635 > node4.51500: UDP, length 113
03:11:31.665988 IP node3.43587 > node4.51500: UDP, length 113
03:11:31.666300 IP node3.60133 > node4.51500: UDP, length 113
03:11:31.666852 IP node3.56938 > node4.51500: UDP, length 113
03:11:31.667083 IP node3.60850 > node4.51500: UDP, length 112
03:11:31.667142 IP node3.34474 > node4.51500: UDP, length 113
03:11:31.667338 IP node3.49285 > node4.51500: UDP, length 113
03:11:31.667402 IP node3.33617 > node4.51500: UDP, length 113
03:11:31.668033 IP node3.48193 > node4.51500: UDP, length 112
03:11:31.668789 IP node3.52099 > node4.51500: UDP, length 113
03:11:31.668993 IP node3.57155 > node4.51500: UDP, length 113
03:11:31.669051 IP node3.42227 > node4.51500: UDP, length 112
03:11:31.669211 IP node3.35550 > node4.51500: UDP, length 113
03:11:31.669304 IP node3.56677 > node4.51500: UDP, length 113
03:11:31.689957 IP node3.42227 > node1.44966: UDP, length 112
03:11:31.690297 IP node3.35550 > node1.44966: UDP, length 113
03:11:31.690528 IP node3.60133 > node1.44966: UDP, length 113
03:11:31.690604 IP node3.34474 > node1.44966: UDP, length 113
03:11:31.690750 IP node3.48193 > node1.44966: UDP, length 112
03:11:31.690896 IP node3.49285 > node1.44966: UDP, length 113
03:11:31.691013 IP node3.56677 > node1.44966: UDP, length 113
03:11:31.691488 IP node3.52635 > node1.44966: UDP, length 113
03:11:31.692453 IP node3.43587 > node1.44966: UDP, length 113
03:11:31.692725 IP node3.60850 > node1.44966: UDP, length 112
03:11:31.692788 IP node3.35498 > node1.44966: UDP, length 112
03:11:31.692962 IP node3.56938 > node1.44966: UDP, length 113
03:11:31.693502 IP node3.52099 > node1.44966: UDP, length 113
03:11:31.694411 IP node3.33617 > node1.44966: UDP, length 113
03:11:31.695504 IP node3.57155 > node1.44966: UDP, length 113
03:11:31.748422 IP node3.35498 > node4.58465: UDP, length 112
03:11:31.748727 IP node3.52635 > node4.58465: UDP, length 113
03:11:31.749092 IP node3.35550 > node4.58465: UDP, length 113
03:11:31.749313 IP node3.60133 > node4.58465: UDP, length 113
03:11:31.749571 IP node3.34474 > node4.58465: UDP, length 113
03:11:31.749804 IP node3.48193 > node4.58465: UDP, length 112
03:11:31.749867 IP node3.42227 > node4.58465: UDP, length 112
03:11:31.750015 IP node3.56677 > node4.58465: UDP, length 113
03:11:31.750154 IP node3.60850 > node4.58465: UDP, length 112
03:11:31.751335 IP node3.33617 > node4.58465: UDP, length 113
03:11:31.751415 IP node3.43587 > node4.58465: UDP, length 113
03:11:31.751553 IP node3.56938 > node4.58465: UDP, length 113
03:11:31.751645 IP node3.49285 > node4.58465: UDP, length 113
03:11:31.752229 IP node3.57155 > node4.58465: UDP, length 113
03:11:31.752515 IP node3.52099 > node4.58465: UDP, length 113
03:11:31.756513 IP node3.52099 > node1.36361: UDP, length 113
03:11:31.757380 IP node3.57155 > node1.36361: UDP, length 113
03:11:31.758007 IP node3.35550 > node1.36361: UDP, length 113
03:11:31.758355 IP node3.49285 > node1.36361: UDP, length 113
03:11:31.759289 IP node3.33617 > node1.36361: UDP, length 113
03:11:31.759562 IP node3.43587 > node1.36361: UDP, length 113
03:11:31.759867 IP node3.34474 > node1.36361: UDP, length 113
03:11:31.760107 IP node3.52635 > node1.36361: UDP, length 113
03:11:31.760412 IP node3.42227 > node1.36361: UDP, length 112
03:11:31.760526 IP node3.56938 > node1.36361: UDP, length 113
03:11:31.760791 IP node3.56677 > node1.36361: UDP, length 113
03:11:31.761066 IP node3.35498 > node1.36361: UDP, length 112
03:11:31.762936 IP node3.60133 > node1.36361: UDP, length 113
03:11:31.763033 IP node3.48193 > node1.36361: UDP, length 112
03:11:31.763278 IP node3.60850 > node1.36361: UDP, length 112
03:11:31.779305 IP node3.35498 > node4.49214: UDP, length 112
03:11:31.780704 IP node3.56938 > node4.49214: UDP, length 113
03:11:31.781209 IP node3.35550 > node4.49214: UDP, length 113
03:11:31.781491 IP node3.60133 > node4.49214: UDP, length 113
03:11:31.781666 IP node3.49285 > node4.49214: UDP, length 113
03:11:31.782104 IP node3.60850 > node4.49214: UDP, length 112
03:11:31.782381 IP node3.57155 > node4.49214: UDP, length 113
03:11:31.783739 IP node3.34474 > node4.49214: UDP, length 113
03:11:31.783982 IP node3.43587 > node4.49214: UDP, length 113
03:11:31.784064 IP node3.52099 > node4.49214: UDP, length 113
03:11:31.784233 IP node3.42227 > node4.49214: UDP, length 112
03:11:31.785295 IP node3.33617 > node4.49214: UDP, length 113
03:11:31.785605 IP node3.56677 > node4.49214: UDP, length 113
03:11:31.785735 IP node3.48193 > node4.49214: UDP, length 112
03:11:31.785808 IP node3.52635 > node4.49214: UDP, length 113
03:11:31.788499 IP node3.35498 > node1.43787: UDP, length 112
03:11:31.789029 IP node3.42227 > node1.43787: UDP, length 112
03:11:31.789262 IP node3.56677 > node1.43787: UDP, length 113
03:11:31.789573 IP node3.56938 > node1.43787: UDP, length 113
03:11:31.789927 IP node3.34474 > node1.43787: UDP, length 113
03:11:31.790157 IP node3.52099 > node1.43787: UDP, length 113
03:11:31.790614 IP node3.35550 > node1.43787: UDP, length 113
03:11:31.791363 IP node3.60850 > node1.43787: UDP, length 112
03:11:31.791463 IP node3.60133 > node1.43787: UDP, length 113
03:11:31.791702 IP node3.48193 > node1.43787: UDP, length 112
03:11:31.791789 IP node3.49285 > node1.43787: UDP, length 113
03:11:31.792828 IP node3.34474 > node4.38789: UDP, length 113
03:11:31.794198 IP node3.35550 > node4.38789: UDP, length 113
03:11:31.794489 IP node3.48193 > node4.38789: UDP, length 112
03:11:31.794686 IP node3.49285 > node4.38789: UDP, length 113
03:11:31.795133 IP node3.43587 > node1.43787: UDP, length 113
03:11:31.795290 IP node3.57155 > node1.43787: UDP, length 113
03:11:31.795335 IP node3.52099 > node4.38789: UDP, length 113
03:11:31.796642 IP node3.52635 > node1.43787: UDP, length 113
03:11:31.796705 IP node3.57155 > node4.38789: UDP, length 113
03:11:31.796783 IP node3.52635 > node4.38789: UDP, length 113
03:11:31.797154 IP node3.35498 > node4.38789: UDP, length 112
03:11:31.797426 IP node3.56677 > node4.38789: UDP, length 113
03:11:31.797595 IP node3.43587 > node4.38789: UDP, length 113
03:11:31.797779 IP node3.42227 > node4.38789: UDP, length 112
03:11:31.798131 IP node3.56938 > node4.38789: UDP, length 113
03:11:31.798178 IP node3.60850 > node4.38789: UDP, length 112
03:11:31.798869 IP node3.33617 > node1.43787: UDP, length 113
03:11:31.798967 IP node3.33617 > node4.38789: UDP, length 113
03:11:31.799298 IP node3.60133 > node4.38789: UDP, length 113
03:11:31.832439 IP node3.34474 > node4.44091: UDP, length 113
03:11:31.832563 IP node3.56938 > node4.44091: UDP, length 113
03:11:31.832689 IP node3.52635 > node4.44091: UDP, length 113
03:11:31.834252 IP node3.52099 > node4.44091: UDP, length 113
03:11:31.835046 IP node3.57155 > node4.44091: UDP, length 113
03:11:31.867343 IP node3.34474 > node4.40772: UDP, length 113
03:11:31.870331 IP node3.60133 > node4.44091: UDP, length 113
03:11:31.872137 IP node3.56938 > node4.40772: UDP, length 113
03:11:31.881330 IP node3.42227 > node4.44091: UDP, length 112
03:11:31.883096 IP node3.52099 > node4.40772: UDP, length 113
03:11:31.884245 IP node3.42227 > node4.40772: UDP, length 112
03:11:31.890774 IP node3.60133 > node4.40772: UDP, length 113
03:11:31.891097 IP node3.52635 > node4.40772: UDP, length 113
03:11:31.892908 IP node3.35498 > node4.44091: UDP, length 112
03:11:31.893254 IP node3.48193 > node4.44091: UDP, length 112
03:11:31.893346 IP node3.48193 > node4.40772: UDP, length 112
03:11:31.893593 IP node3.35550 > node4.44091: UDP, length 113
03:11:31.893656 IP node3.49285 > node4.44091: UDP, length 113
03:11:31.894363 IP node3.35550 > node4.40772: UDP, length 113
03:11:31.895451 IP node3.56677 > node4.44091: UDP, length 113
03:11:31.895546 IP node3.56677 > node4.40772: UDP, length 113
03:11:31.896685 IP node3.57155 > node4.40772: UDP, length 113
03:11:31.896892 IP node3.60850 > node4.44091: UDP, length 112
03:11:31.897049 IP node3.33617 > node4.44091: UDP, length 113
03:11:31.897127 IP node3.33617 > node4.40772: UDP, length 113
03:11:31.898680 IP node3.49285 > node4.40772: UDP, length 113
03:11:31.899560 IP node3.60850 > node4.40772: UDP, length 112
03:11:31.899897 IP node3.43587 > node4.44091: UDP, length 113
03:11:31.902669 IP node3.43587 > node4.40772: UDP, length 113
03:11:31.904401 IP node3.35498 > node4.40772: UDP, length 112
03:11:31.904864 IP node3.57155 > node1.33674: UDP, length 113
03:11:31.905262 IP node3.49285 > node1.33674: UDP, length 113
03:11:31.905462 IP node3.56938 > node1.33674: UDP, length 113
03:11:31.906017 IP node3.56677 > node1.33674: UDP, length 113
03:11:31.906125 IP node3.52099 > node1.33674: UDP, length 113
03:11:31.906581 IP node3.42227 > node1.33674: UDP, length 112
03:11:31.908015 IP node3.43587 > node1.33674: UDP, length 113
03:11:31.909555 IP node3.35550 > node1.33674: UDP, length 113
03:11:31.910705 IP node3.34474 > node1.33674: UDP, length 113
03:11:31.911412 IP node3.33617 > node1.33674: UDP, length 113
03:11:31.911623 IP node3.52635 > node1.33674: UDP, length 113
03:11:31.912473 IP node3.60133 > node1.33674: UDP, length 113
03:11:31.912675 IP node3.60850 > node1.33674: UDP, length 112
03:11:31.912920 IP node3.48193 > node1.33674: UDP, length 112
03:11:31.913146 IP node3.35498 > node1.33674: UDP, length 112
03:11:31.997791 IP node3.57155 > node4.38845: UDP, length 113
03:11:31.998087 IP node3.56677 > node4.38845: UDP, length 113
03:11:31.998197 IP node3.52099 > node4.38845: UDP, length 113
03:11:31.998352 IP node3.35550 > node4.38845: UDP, length 113
03:11:31.998423 IP node3.48193 > node4.38845: UDP, length 112
03:11:31.998499 IP node3.34474 > node4.38845: UDP, length 113
03:11:31.999015 IP node3.42227 > node4.38845: UDP, length 112
03:11:31.999691 IP node3.56938 > node4.38845: UDP, length 113
03:11:31.999995 IP node3.52635 > node4.38845: UDP, length 113
03:11:32.000228 IP node3.60133 > node4.38845: UDP, length 113
03:11:32.000510 IP node3.60850 > node4.38845: UDP, length 112
03:11:32.001510 IP node3.33617 > node4.38845: UDP, length 113
03:11:32.002104 IP node3.43587 > node4.38845: UDP, length 113
03:11:32.002401 IP node3.49285 > node4.38845: UDP, length 113
03:11:32.002459 IP node3.35498 > node4.38845: UDP, length 112
03:11:32.083653 IP node3.56677 > node4.36825: UDP, length 113
03:11:32.089674 IP node3.52099 > node4.36825: UDP, length 113
03:11:32.090405 IP node3.57155 > node4.36825: UDP, length 113
03:11:32.092330 IP node3.42227 > node4.36825: UDP, length 112
03:11:32.092715 IP node3.35498 > node4.36825: UDP, length 112
03:11:32.094265 IP node3.33617 > node4.36825: UDP, length 113
03:11:32.095292 IP node3.60133 > node4.36825: UDP, length 113
03:11:32.097188 IP node3.60850 > node4.36825: UDP, length 112
03:11:32.098909 IP node3.43587 > node4.36825: UDP, length 113
03:11:32.106508 IP node3.49285 > node4.36825: UDP, length 113
03:11:32.106789 IP node3.56938 > node4.36825: UDP, length 113
03:11:32.106833 IP node3.52635 > node4.36825: UDP, length 113
03:11:32.110303 IP node3.34474 > node4.36825: UDP, length 113
03:11:32.111301 IP node3.48193 > node4.36825: UDP, length 112
03:11:32.112095 IP node3.35550 > node4.36825: UDP, length 113
03:11:32.426103 IP node3.49285 > node1.55726: UDP, length 113
03:11:32.426279 IP node3.60133 > node1.55726: UDP, length 113
03:11:32.426349 IP node3.52635 > node1.55726: UDP, length 113
03:11:32.427037 IP node3.42227 > node1.55726: UDP, length 112
03:11:32.427256 IP node3.56938 > node1.55726: UDP, length 113
03:11:32.427498 IP node3.43587 > node1.55726: UDP, length 113
03:11:32.427596 IP node3.33617 > node1.55726: UDP, length 113
03:11:32.427667 IP node3.35550 > node1.55726: UDP, length 113
03:11:32.427778 IP node3.52099 > node1.55726: UDP, length 113
03:11:32.428076 IP node3.56677 > node1.55726: UDP, length 113
03:11:32.429723 IP node3.35498 > node1.55726: UDP, length 112
03:11:32.429996 IP node3.48193 > node1.55726: UDP, length 112
03:11:32.430690 IP node3.60850 > node1.55726: UDP, length 112
03:11:32.430919 IP node3.57155 > node1.55726: UDP, length 113
03:11:32.432118 IP node3.34474 > node1.55726: UDP, length 113
03:11:32.444338 IP node3.56677 > node1.56111: UDP, length 113
03:11:32.446690 IP node3.33617 > node1.56111: UDP, length 113
03:11:32.447010 IP node3.57155 > node1.56111: UDP, length 113
03:11:32.447197 IP node3.52635 > node1.56111: UDP, length 113
03:11:32.447437 IP node3.56938 > node1.56111: UDP, length 113
03:11:32.447952 IP node3.60133 > node1.56111: UDP, length 113
03:11:32.448018 IP node3.52099 > node1.56111: UDP, length 113
03:11:32.448096 IP node3.42227 > node1.56111: UDP, length 112
03:11:32.448291 IP node3.49285 > node1.56111: UDP, length 113
03:11:32.448565 IP node3.35550 > node1.56111: UDP, length 113
03:11:32.448624 IP node3.43587 > node1.56111: UDP, length 113
03:11:32.449472 IP node3.35498 > node1.56111: UDP, length 112
03:11:32.449532 IP node3.60850 > node1.56111: UDP, length 112
03:11:32.449657 IP node3.34474 > node1.56111: UDP, length 113
03:11:32.450195 IP node3.48193 > node1.56111: UDP, length 112
03:11:32.639127 IP node3.60850 > node1.42485: UDP, length 112
03:11:32.639415 IP node3.43587 > node1.42485: UDP, length 113
03:11:32.640245 IP node3.34474 > node1.42485: UDP, length 113
03:11:32.640324 IP node3.56938 > node1.42485: UDP, length 113
03:11:32.640519 IP node3.35498 > node1.42485: UDP, length 112
03:11:32.640809 IP node3.49285 > node1.42485: UDP, length 113
03:11:32.641052 IP node3.52635 > node1.42485: UDP, length 113
03:11:32.641169 IP node3.56677 > node1.42485: UDP, length 113
03:11:32.641670 IP node3.52099 > node1.42485: UDP, length 113
03:11:32.641730 IP node3.35550 > node1.42485: UDP, length 113
03:11:32.641917 IP node3.57155 > node1.42485: UDP, length 113
03:11:32.642340 IP node3.42227 > node1.42485: UDP, length 112
03:11:32.642441 IP node3.48193 > node1.42485: UDP, length 112
03:11:32.642942 IP node3.33617 > node1.42485: UDP, length 113
03:11:32.643233 IP node3.60133 > node1.42485: UDP, length 113
03:11:32.649070 IP node3.60850 > node2.52006: UDP, length 112
03:11:32.649261 IP node3.34474 > node2.52006: UDP, length 113
03:11:32.649616 IP node3.52099 > node2.52006: UDP, length 113
03:11:32.649683 IP node3.33617 > node2.52006: UDP, length 113
03:11:32.650005 IP node3.52635 > node2.52006: UDP, length 113
03:11:32.650172 IP node3.56677 > node2.52006: UDP, length 113
03:11:32.651530 IP node3.42227 > node2.52006: UDP, length 112
03:11:32.651696 IP node3.56938 > node2.52006: UDP, length 113
03:11:32.652515 IP node3.35550 > node2.52006: UDP, length 113
03:11:32.652578 IP node3.57155 > node2.52006: UDP, length 113
03:11:32.652811 IP node3.49285 > node2.52006: UDP, length 113
03:11:32.653110 IP node3.60133 > node2.52006: UDP, length 113
03:11:32.654102 IP node3.48193 > node2.52006: UDP, length 112
03:11:32.654434 IP node3.35498 > node2.52006: UDP, length 112
03:11:32.654664 IP node3.43587 > node2.52006: UDP, length 113
03:11:32.907864 IP node3.42227 > node2.33739: UDP, length 112
03:11:32.907994 IP node3.33617 > node2.33739: UDP, length 113
03:11:32.908091 IP node3.34474 > node2.33739: UDP, length 113
03:11:32.908238 IP node3.52635 > node2.33739: UDP, length 113
03:11:32.908763 IP node3.56938 > node2.33739: UDP, length 113
03:11:32.909362 IP node3.35498 > node2.33739: UDP, length 112
03:11:32.910179 IP node3.60850 > node2.33739: UDP, length 112
03:11:32.910411 IP node3.57155 > node2.33739: UDP, length 113
03:11:32.932739 IP node3.56677 > node2.33739: UDP, length 113
03:11:32.935396 IP node3.60850 > node2.47170: UDP, length 112
03:11:32.937864 IP node3.49285 > node2.33739: UDP, length 113
03:11:32.939259 IP node3.49285 > node2.47170: UDP, length 113
03:11:32.942386 IP node3.52099 > node2.47170: UDP, length 113
03:11:32.942517 IP node3.52099 > node2.33739: UDP, length 113
03:11:32.943185 IP node3.48193 > node2.47170: UDP, length 112
03:11:32.943304 IP node3.48193 > node2.33739: UDP, length 112
03:11:32.943552 IP node3.60133 > node2.47170: UDP, length 113
03:11:32.943661 IP node3.60133 > node2.33739: UDP, length 113
03:11:32.943894 IP node3.43587 > node2.47170: UDP, length 113
03:11:32.943995 IP node3.43587 > node2.33739: UDP, length 113
03:11:32.944483 IP node3.57155 > node2.47170: UDP, length 113
03:11:32.944789 IP node3.35498 > node2.47170: UDP, length 112
03:11:32.946389 IP node3.33617 > node2.47170: UDP, length 113
03:11:32.946720 IP node3.56938 > node2.47170: UDP, length 113
03:11:32.947128 IP node3.56677 > node2.47170: UDP, length 113
03:11:32.948844 IP node3.34474 > node2.47170: UDP, length 113
03:11:32.948931 IP node3.42227 > node2.47170: UDP, length 112
03:11:32.949987 IP node3.35550 > node2.47170: UDP, length 113
03:11:32.950171 IP node3.35550 > node2.33739: UDP, length 113
03:11:32.952250 IP node3.52635 > node2.47170: UDP, length 113
03:11:32.963221 IP node3.56677 > node1.32830: UDP, length 113
03:11:32.963531 IP node3.42227 > node1.32830: UDP, length 112
03:11:32.964554 IP node3.35498 > node1.32830: UDP, length 112
03:11:32.964813 IP node3.34474 > node1.32830: UDP, length 113
03:11:32.964863 IP node3.56938 > node1.32830: UDP, length 113
03:11:32.965036 IP node3.57155 > node1.32830: UDP, length 113
03:11:32.965641 IP node3.60850 > node1.32830: UDP, length 112
03:11:32.965914 IP node3.33617 > node1.32830: UDP, length 113
03:11:32.966719 IP node3.43587 > node1.32830: UDP, length 113
03:11:32.967502 IP node3.35550 > node1.32830: UDP, length 113
03:11:32.968016 IP node3.52635 > node1.32830: UDP, length 113
03:11:32.968333 IP node3.52099 > node1.32830: UDP, length 113
03:11:32.968609 IP node3.60133 > node1.32830: UDP, length 113
03:11:32.968898 IP node3.48193 > node1.32830: UDP, length 112
03:11:32.969216 IP node3.49285 > node1.32830: UDP, length 113
03:11:32.991842 IP node3.60850 > node2.38768: UDP, length 112
03:11:32.992103 IP node3.33617 > node2.38768: UDP, length 113
03:11:32.994004 IP node3.34474 > node2.38768: UDP, length 113
03:11:32.994463 IP node3.42227 > node2.38768: UDP, length 112
03:11:32.995664 IP node3.43587 > node2.38768: UDP, length 113
03:11:32.995818 IP node3.57155 > node2.38768: UDP, length 113
03:11:32.996511 IP node3.35550 > node2.38768: UDP, length 113
03:11:32.997345 IP node3.60133 > node2.38768: UDP, length 113
03:11:32.997615 IP node3.52635 > node2.38768: UDP, length 113
03:11:32.997736 IP node3.35498 > node2.38768: UDP, length 112
03:11:32.998074 IP node3.56677 > node2.50518: UDP, length 113
03:11:32.999248 IP node3.49285 > node2.38768: UDP, length 113
03:11:32.999346 IP node3.56938 > node2.50518: UDP, length 113
03:11:32.999438 IP node3.33617 > node2.50518: UDP, length 113
03:11:32.999595 IP node3.48193 > node2.38768: UDP, length 112
03:11:33.000159 IP node3.56677 > node2.38768: UDP, length 113
03:11:33.000478 IP node3.57155 > node2.50518: UDP, length 113
03:11:33.001964 IP node3.52635 > node2.50518: UDP, length 113
03:11:33.002425 IP node3.52099 > node2.50518: UDP, length 113
03:11:33.002588 IP node3.52099 > node2.38768: UDP, length 113
03:11:33.002669 IP node3.56938 > node2.38768: UDP, length 113
03:11:33.002799 IP node3.42227 > node2.50518: UDP, length 112
03:11:33.003155 IP node3.48193 > node2.50518: UDP, length 112
03:11:33.003434 IP node3.35550 > node2.50518: UDP, length 113
03:11:33.003756 IP node3.60133 > node2.50518: UDP, length 113
03:11:33.004135 IP node3.49285 > node2.50518: UDP, length 113
03:11:33.004211 IP node3.35498 > node2.50518: UDP, length 112
03:11:33.004455 IP node3.43587 > node2.50518: UDP, length 113
03:11:33.006288 IP node3.34474 > node2.50518: UDP, length 113
03:11:33.006375 IP node3.60850 > node2.50518: UDP, length 112
03:11:33.060120 IP node3.33617 > node1.53733: UDP, length 113
03:11:33.060414 IP node3.35498 > node1.53733: UDP, length 112
03:11:33.060467 IP node3.57155 > node1.53733: UDP, length 113
03:11:33.060906 IP node3.56677 > node1.53733: UDP, length 113
03:11:33.061659 IP node3.35550 > node1.53733: UDP, length 113
03:11:33.062246 IP node3.34474 > node1.53733: UDP, length 113
03:11:33.062720 IP node3.48193 > node1.53733: UDP, length 112
03:11:33.063516 IP node3.52099 > node1.53733: UDP, length 113
03:11:33.063963 IP node3.49285 > node1.53733: UDP, length 113
03:11:33.064188 IP node3.56938 > node1.53733: UDP, length 113
03:11:33.064279 IP node3.43587 > node1.53733: UDP, length 113
03:11:33.064387 IP node3.42227 > node1.53733: UDP, length 112
03:11:33.064691 IP node3.60850 > node1.53733: UDP, length 112
03:11:33.065743 IP node3.52635 > node1.53733: UDP, length 113
03:11:33.066186 IP node3.60133 > node1.53733: UDP, length 113
03:11:33.087639 IP node3.43587 > node2.58185: UDP, length 113
03:11:33.087912 IP node3.35550 > node2.58185: UDP, length 113
03:11:33.087994 IP node3.33617 > node2.58185: UDP, length 113
03:11:33.088177 IP node3.42227 > node2.58185: UDP, length 112
03:11:33.088567 IP node3.34474 > node2.58185: UDP, length 113
03:11:33.088639 IP node3.57155 > node2.58185: UDP, length 113
03:11:33.088706 IP node3.48193 > node2.58185: UDP, length 112
03:11:33.089341 IP node3.35498 > node2.58185: UDP, length 112
03:11:33.089401 IP node3.56938 > node2.58185: UDP, length 113
03:11:33.089644 IP node3.60133 > node2.58185: UDP, length 113
03:11:33.090074 IP node3.49285 > node2.58185: UDP, length 113
03:11:33.090573 IP node3.56677 > node2.58185: UDP, length 113
03:11:33.092992 IP node3.52099 > node2.58185: UDP, length 113
03:11:33.094629 IP node3.52635 > node2.58185: UDP, length 113
03:11:33.098044 IP node3.60850 > node2.58185: UDP, length 112
03:11:33.139558 IP node3.35498 > node2.40433: UDP, length 112
03:11:33.140003 IP node3.56938 > node2.40433: UDP, length 113
03:11:33.140658 IP node3.34474 > node2.40433: UDP, length 113
03:11:33.141214 IP node3.33617 > node2.40433: UDP, length 113
03:11:33.142223 IP node3.35550 > node2.40433: UDP, length 113
03:11:33.142363 IP node3.60133 > node2.40433: UDP, length 113
03:11:33.142876 IP node3.57155 > node2.40433: UDP, length 113
03:11:33.142976 IP node3.56677 > node2.40433: UDP, length 113
03:11:33.143150 IP node3.48193 > node2.40433: UDP, length 112
03:11:33.143403 IP node3.43587 > node2.40433: UDP, length 113
03:11:33.144024 IP node3.42227 > node2.40433: UDP, length 112
03:11:33.144959 IP node3.52099 > node2.40433: UDP, length 113
03:11:33.146886 IP node3.49285 > node2.40433: UDP, length 113
03:11:33.147484 IP node3.52635 > node2.40433: UDP, length 113
03:11:33.147774 IP node3.60850 > node2.40433: UDP, length 112
03:11:33.160977 IP node3.56938 > node1.34167: UDP, length 113
03:11:33.161765 IP node3.33617 > node1.34167: UDP, length 113
03:11:33.161897 IP node3.56677 > node1.34167: UDP, length 113
03:11:33.162817 IP node3.42227 > node1.34167: UDP, length 112
03:11:33.164639 IP node3.35550 > node1.34167: UDP, length 113
03:11:33.164775 IP node3.52635 > node1.34167: UDP, length 113
03:11:33.165280 IP node3.48193 > node1.34167: UDP, length 112
03:11:33.165392 IP node3.57155 > node1.34167: UDP, length 113
03:11:33.165477 IP node3.34474 > node1.34167: UDP, length 113
03:11:33.165567 IP node3.60133 > node1.34167: UDP, length 113
03:11:33.165651 IP node3.35498 > node1.34167: UDP, length 112
03:11:33.165735 IP node3.43587 > node1.34167: UDP, length 113
03:11:33.166614 IP node3.52099 > node1.34167: UDP, length 113
03:11:33.167825 IP node3.49285 > node1.34167: UDP, length 113
03:11:33.168103 IP node3.60850 > node1.34167: UDP, length 112
03:11:33.230298 IP node3.48193 > node1.35563: UDP, length 112
03:11:33.230783 IP node3.42227 > node1.35563: UDP, length 112
03:11:33.230884 IP node3.35498 > node1.35563: UDP, length 112
03:11:33.231409 IP node3.52099 > node1.35563: UDP, length 113
03:11:33.231975 IP node3.33617 > node1.35563: UDP, length 113
03:11:33.232074 IP node3.34474 > node1.35563: UDP, length 113
03:11:33.232343 IP node3.35550 > node1.35563: UDP, length 113
03:11:33.232604 IP node3.56938 > node1.35563: UDP, length 113
03:11:33.232922 IP node3.60850 > node1.35563: UDP, length 112
03:11:33.234645 IP node3.56677 > node1.35563: UDP, length 113
03:11:33.235406 IP node3.60133 > node1.35563: UDP, length 113
03:11:33.235554 IP node3.43587 > node1.35563: UDP, length 113
03:11:33.235789 IP node3.49285 > node1.35563: UDP, length 113
03:11:33.235941 IP node3.52635 > node1.35563: UDP, length 113
03:11:33.236866 IP node3.57155 > node1.35563: UDP, length 113
03:11:33.276872 IP node3.35498 > node2.35844: UDP, length 112
03:11:33.278283 IP node3.49285 > node2.35844: UDP, length 113
03:11:33.278636 IP node3.35550 > node2.35844: UDP, length 113
03:11:33.278836 IP node3.33617 > node2.35844: UDP, length 113
03:11:33.279149 IP node3.34474 > node2.35844: UDP, length 113
03:11:33.279212 IP node3.43587 > node2.35844: UDP, length 113
03:11:33.279508 IP node3.56938 > node2.35844: UDP, length 113
03:11:33.279962 IP node3.60133 > node2.35844: UDP, length 113
03:11:33.280215 IP node3.48193 > node2.35844: UDP, length 112
03:11:33.280347 IP node3.56677 > node2.35844: UDP, length 113
03:11:33.280936 IP node3.57155 > node2.35844: UDP, length 113
03:11:33.281024 IP node3.42227 > node2.35844: UDP, length 112
03:11:33.281574 IP node3.52635 > node2.35844: UDP, length 113
03:11:33.281867 IP node3.60850 > node2.35844: UDP, length 112
03:11:33.282504 IP node3.52099 > node2.35844: UDP, length 113
03:11:33.384877 IP node3.60133 > node2.58256: UDP, length 113
03:11:33.385040 IP node3.43587 > node2.58256: UDP, length 113
03:11:33.385174 IP node3.35550 > node2.58256: UDP, length 113
03:11:33.385822 IP node3.42227 > node2.58256: UDP, length 112
03:11:33.385902 IP node3.56677 > node2.58256: UDP, length 113
03:11:33.386559 IP node3.57155 > node2.58256: UDP, length 113
03:11:33.386665 IP node3.34474 > node2.58256: UDP, length 113
03:11:33.386900 IP node3.48193 > node2.58256: UDP, length 112
03:11:33.387116 IP node3.33617 > node2.58256: UDP, length 113
03:11:33.387882 IP node3.56938 > node2.58256: UDP, length 113
03:11:33.388558 IP node3.52635 > node2.58256: UDP, length 113
03:11:33.388613 IP node3.49285 > node2.58256: UDP, length 113
03:11:33.389211 IP node3.60850 > node2.58256: UDP, length 112
03:11:33.389437 IP node3.35498 > node2.58256: UDP, length 112
03:11:33.389619 IP node3.52099 > node2.58256: UDP, length 113
03:11:33.415065 IP node3.43587 > node1.50324: UDP, length 113
03:11:33.415241 IP node3.35550 > node1.50324: UDP, length 113
03:11:33.415673 IP node3.56938 > node1.50324: UDP, length 113
03:11:33.415736 IP node3.34474 > node1.50324: UDP, length 113
03:11:33.415811 IP node3.60133 > node1.50324: UDP, length 113
03:11:33.416354 IP node3.49285 > node1.50324: UDP, length 113
03:11:33.416728 IP node3.33617 > node1.50324: UDP, length 113
03:11:33.417561 IP node3.56677 > node1.50324: UDP, length 113
03:11:33.417895 IP node3.60850 > node1.50324: UDP, length 112
03:11:33.418525 IP node3.35498 > node1.50324: UDP, length 112
03:11:33.418669 IP node3.52099 > node1.50324: UDP, length 113
03:11:33.419198 IP node3.52635 > node1.50324: UDP, length 113
03:11:33.419382 IP node3.48193 > node1.50324: UDP, length 112
03:11:33.419646 IP node3.57155 > node1.50324: UDP, length 113
03:11:33.419757 IP node3.42227 > node1.50324: UDP, length 112
03:11:33.477152 IP node3.43587 > node2.36166: UDP, length 94
03:11:33.534684 IP node3.56677 > node1.50406: UDP, length 113
03:11:33.534771 IP node3.56938 > node1.50406: UDP, length 113
03:11:33.534961 IP node3.43587 > node1.50406: UDP, length 113
03:11:33.535316 IP node3.49285 > node1.50406: UDP, length 113
03:11:33.535749 IP node3.35550 > node1.50406: UDP, length 113
03:11:33.536029 IP node3.60133 > node1.50406: UDP, length 113
03:11:33.536402 IP node3.48193 > node1.50406: UDP, length 112
03:11:33.536599 IP node3.42227 > node1.50406: UDP, length 112
03:11:33.537012 IP node3.60850 > node1.50406: UDP, length 112
03:11:33.537067 IP node3.52635 > node1.50406: UDP, length 113
03:11:33.537124 IP node3.33617 > node1.50406: UDP, length 113
03:11:33.537810 IP node3.35498 > node1.50406: UDP, length 112
03:11:33.538139 IP node3.52099 > node1.50406: UDP, length 113
03:11:33.538345 IP node3.57155 > node1.50406: UDP, length 113
03:11:33.539399 IP node3.34474 > node2.36166: UDP, length 94
03:11:33.539516 IP node3.34474 > node1.50406: UDP, length 113
03:11:33.554944 IP node3.43587 > node2.36166: UDP, length 71
03:11:33.601704 IP node3.43587 > node2.36166: UDP, length 78
03:11:33.615697 IP node3.35498 > node2.44193: UDP, length 112
03:11:33.615795 IP node3.57155 > node2.44193: UDP, length 113
03:11:33.616924 IP node3.60133 > node2.44193: UDP, length 113
03:11:33.617254 IP node3.52635 > node2.44193: UDP, length 113
03:11:33.617781 IP node3.56938 > node2.44193: UDP, length 113
03:11:33.617925 IP node3.42227 > node2.44193: UDP, length 112
03:11:33.617973 IP node3.56677 > node2.44193: UDP, length 113
03:11:33.619073 IP node3.33617 > node2.44193: UDP, length 113
03:11:33.619134 IP node3.60850 > node2.44193: UDP, length 112
03:11:33.619358 IP node3.52099 > node2.44193: UDP, length 113
03:11:33.619787 IP node3.43587 > node2.44193: UDP, length 113
03:11:33.619840 IP node3.35550 > node2.44193: UDP, length 113
03:11:33.619913 IP node3.49285 > node2.44193: UDP, length 113
03:11:33.620252 IP node3.48193 > node2.44193: UDP, length 112
03:11:33.621235 IP node3.34474 > node2.44193: UDP, length 113
03:11:33.629484 IP node3.48193 > node2.52599: UDP, length 112
03:11:33.629719 IP node3.52635 > node2.52599: UDP, length 113
03:11:33.629868 IP node3.57155 > node2.52599: UDP, length 113
03:11:33.630671 IP node3.60850 > node2.52599: UDP, length 112
03:11:33.630856 IP node3.60133 > node2.52599: UDP, length 113
03:11:33.631477 IP node3.42227 > node2.52599: UDP, length 112
03:11:33.631674 IP node3.49285 > node2.52599: UDP, length 113
03:11:33.632055 IP node3.34474 > node2.52599: UDP, length 113
03:11:33.633032 IP node3.33617 > node2.52599: UDP, length 113
03:11:33.633326 IP node3.56938 > node2.52599: UDP, length 113
03:11:33.633399 IP node3.52099 > node2.52599: UDP, length 113
03:11:33.633482 IP node3.35498 > node2.52599: UDP, length 112
03:11:33.633933 IP node3.35550 > node2.52599: UDP, length 113
03:11:33.634254 IP node3.56677 > node2.52599: UDP, length 113
03:11:33.634826 IP node3.43587 > node2.52599: UDP, length 113
03:11:33.646624 IP node3.60850 > node2.38620: UDP, length 112
03:11:33.647087 IP node3.33617 > node2.38620: UDP, length 113
03:11:33.647698 IP node3.43587 > node2.38620: UDP, length 113
03:11:33.648019 IP node3.57155 > node2.38620: UDP, length 113
03:11:33.648166 IP node3.34474 > node2.38620: UDP, length 113
03:11:33.648469 IP node3.60133 > node2.38620: UDP, length 113
03:11:33.648631 IP node3.52099 > node2.38620: UDP, length 113
03:11:33.648918 IP node3.56677 > node2.38620: UDP, length 113
03:11:33.649213 IP node3.42227 > node2.38620: UDP, length 112
03:11:33.649516 IP node3.56938 > node2.38620: UDP, length 113
03:11:33.649789 IP node3.35550 > node2.38620: UDP, length 113
03:11:33.649861 IP node3.35498 > node2.38620: UDP, length 112
03:11:33.650060 IP node3.52635 > node2.38620: UDP, length 113
03:11:33.650568 IP node3.49285 > node2.38620: UDP, length 113
03:11:33.650824 IP node3.48193 > node2.38620: UDP, length 112
03:11:33.695299 IP node3.60850 > node2.40826: UDP, length 112
03:11:33.699898 IP node3.48193 > node2.40826: UDP, length 112
03:11:33.700817 IP node3.35550 > node2.40826: UDP, length 113
03:11:33.701069 IP node3.52635 > node2.40826: UDP, length 113
