03:11:29.487973 IP node2.52006 > node2.33739: UDP, length 113
03:11:29.491096 IP node2.47170 > node2.33739: UDP, length 112
03:11:29.497432 IP node2.33739 > node2.47170: UDP, length 113
03:11:29.512167 IP node2.52006 > node2.47170: UDP, length 113
03:11:29.538710 IP node2.52006 > node2.38768: UDP, length 113
03:11:29.538820 IP node2.47170 > node2.38768: UDP, length 112
03:11:29.543120 IP node2.33739 > node2.38768: UDP, length 113
03:11:29.543200 IP node2.33739 > node2.50518: UDP, length 113
03:11:29.544343 IP node2.52006 > node2.50518: UDP, length 113
03:11:29.547630 IP node2.47170 > node2.50518: UDP, length 112
03:11:29.587201 IP node2.38768 > node2.47170: UDP, length 113
03:11:29.587303 IP node2.38768 > node2.33739: UDP, length 113
03:11:29.596043 IP node2.38768 > node2.50518: UDP, length 113
03:11:29.619193 IP node2.50518 > node2.38768: UDP, length 111
03:11:29.619280 IP node2.50518 > node2.47170: UDP, length 111
03:11:29.620526 IP node2.50518 > node2.33739: UDP, length 111
03:11:29.631531 IP node2.33739 > node2.58185: UDP, length 113
03:11:29.631584 IP node2.58185 > node2.33739: UDP, length 113
03:11:29.631773 IP node2.52006 > node2.58185: UDP, length 113
03:11:29.632407 IP node2.50518 > node2.58185: UDP, length 111
03:11:29.632461 IP node2.47170 > node2.58185: UDP, length 112
03:11:29.632975 IP node2.38768 > node2.58185: UDP, length 113
03:11:29.641446 IP node2.58185 > node2.38768: UDP, length 113
03:11:29.641527 IP node2.58185 > node2.50518: UDP, length 113
03:11:29.651914 IP node2.58185 > node2.47170: UDP, length 113
03:11:29.680444 IP node2.52006 > node2.40433: UDP, length 113
03:11:29.680620 IP node2.38768 > node2.40433: UDP, length 113
03:11:29.680960 IP node2.47170 > node2.40433: UDP, length 112
03:11:29.681369 IP node2.58185 > node2.40433: UDP, length 113
03:11:29.681642 IP node2.33739 > node2.40433: UDP, length 113
03:11:29.681940 IP node2.40433 > node2.47170: UDP, length 112
03:11:29.682687 IP node2.50518 > node2.40433: UDP, length 111
03:11:29.686014 IP node2.40433 > node2.50518: UDP, length 112
03:11:29.687845 IP node2.40433 > node2.58185: UDP, length 112
03:11:29.689659 IP node2.40433 > node2.38768: UDP, length 112
03:11:29.820797 IP node2.35844 > node2.58185: UDP, length 113
03:11:29.822130 IP node2.33739 > node2.35844: UDP, length 113
03:11:29.822229 IP node2.40433 > node2.35844: UDP, length 112
03:11:29.824008 IP node2.47170 > node2.35844: UDP, length 112
03:11:29.824299 IP node2.38768 > node2.35844: UDP, length 113
03:11:29.825461 IP node2.50518 > node2.35844: UDP, length 111
03:11:29.826121 IP node2.58185 > node2.35844: UDP, length 113
03:11:29.826370 IP node2.52006 > node2.35844: UDP, length 113
03:11:29.830426 IP node2.35844 > node2.40433: UDP, length 113
03:11:29.931810 IP node2.50518 > node2.58256: UDP, length 111
03:11:29.932195 IP node2.33739 > node2.58256: UDP, length 113
03:11:29.933583 IP node2.47170 > node2.58256: UDP, length 112
03:11:29.933583 IP node2.52006 > node2.58256: UDP, length 113
03:11:29.933998 IP node2.35844 > node2.58256: UDP, length 113
03:11:29.934981 IP node2.40433 > node2.58256: UDP, length 112
03:11:29.935047 IP node2.58185 > node2.58256: UDP, length 113
03:11:29.935246 IP node2.38768 > node2.58256: UDP, length 113
03:11:29.949248 IP node2.58256 > node2.35844: UDP, length 113
03:11:30.024010 IP node2.58185 > node2.36166: UDP, length 113
03:11:30.026791 IP node2.35844 > node2.36166: UDP, length 113
03:11:30.027222 IP node2.40433 > node2.36166: UDP, length 112
03:11:30.027640 IP node2.38768 > node2.36166: UDP, length 113
03:11:30.028975 IP node2.52006 > node2.36166: UDP, length 113
03:11:30.028983 IP node2.58256 > node2.36166: UDP, length 113
03:11:30.029273 IP node2.50518 > node2.36166: UDP, length 111
03:11:30.029574 IP node2.47170 > node2.36166: UDP, length 112
03:11:30.029772 IP node2.33739 > node2.36166: UDP, length 113
03:11:30.033381 IP node2.36166 > node2.58256: UDP, length 113
03:11:30.162041 IP node2.58185 > node2.44193: UDP, length 113
03:11:30.162174 IP node2.38768 > node2.44193: UDP, length 113
03:11:30.162359 IP node2.40433 > node2.44193: UDP, length 112
03:11:30.163480 IP node2.35844 > node2.44193: UDP, length 113
03:11:30.163562 IP node2.58256 > node2.44193: UDP, length 113
03:11:30.163916 IP node2.50518 > node2.44193: UDP, length 111
03:11:30.164460 IP node2.36166 > node2.44193: UDP, length 113
03:11:30.164993 IP node2.47170 > node2.44193: UDP, length 112
03:11:30.165371 IP node2.33739 > node2.44193: UDP, length 113
03:11:30.166657 IP node2.52006 > node2.44193: UDP, length 113
03:11:30.174891 IP node2.33739 > node2.52599: UDP, length 113
03:11:30.174975 IP node2.58185 > node2.52599: UDP, length 113
03:11:30.175424 IP node2.52006 > node2.52599: UDP, length 113
03:11:30.177598 IP node2.35844 > node2.52599: UDP, length 113
03:11:30.177990 IP node2.36166 > node2.52599: UDP, length 113
03:11:30.177990 IP node2.47170 > node2.52599: UDP, length 112
03:11:30.178197 IP node2.38768 > node2.52599: UDP, length 113
03:11:30.178473 IP node2.40433 > node2.52599: UDP, length 112
03:11:30.179040 IP node2.58256 > node2.52599: UDP, length 113
03:11:30.179653 IP node2.50518 > node2.52599: UDP, length 111
03:11:30.179690 IP node2.44193 > node2.52599: UDP, length 113
03:11:30.187725 IP node2.52599 > node2.44193: UDP, length 112
03:11:30.191854 IP node2.58185 > node2.38620: UDP, length 113
03:11:30.193503 IP node2.58256 > node2.38620: UDP, length 113
03:11:30.193955 IP node2.52006 > node2.38620: UDP, length 113
03:11:30.193980 IP node2.33739 > node2.38620: UDP, length 113
03:11:30.194568 IP node2.50518 > node2.38620: UDP, length 111
03:11:30.194610 IP node2.44193 > node2.38620: UDP, length 113
03:11:30.194895 IP node2.38620 > node2.36166: UDP, length 113
03:11:30.195113 IP node2.36166 > node2.38620: UDP, length 113
03:11:30.196205 IP node2.47170 > node2.38620: UDP, length 112
03:11:30.196483 IP node2.38768 > node2.38620: UDP, length 113
03:11:30.196791 IP node2.52599 > node2.38620: UDP, length 112
03:11:30.197093 IP node2.40433 > node2.38620: UDP, length 112
03:11:30.197274 IP node2.35844 > node2.38620: UDP, length 113
03:11:30.198613 IP node2.38620 > node2.44193: UDP, length 113
03:11:30.200025 IP node2.38620 > node2.52599: UDP, length 113
03:11:30.242562 IP node2.58185 > node2.40826: UDP, length 113
03:11:30.242708 IP node2.33739 > node2.40826: UDP, length 113
03:11:30.242852 IP node2.50518 > node2.40826: UDP, length 111
03:11:30.243018 IP node2.44193 > node2.40826: UDP, length 113
03:11:30.243930 IP node2.58256 > node2.40826: UDP, length 113
03:11:30.244425 IP node2.36166 > node2.40826: UDP, length 113
03:11:30.244430 IP node2.52006 > node2.40826: UDP, length 113
03:11:30.244611 IP node2.38620 > node2.40826: UDP, length 113
03:11:30.244626 IP node2.40826 > node2.44193: UDP, length 113
03:11:30.245188 IP node2.35844 > node2.40826: UDP, length 113
03:11:30.245560 IP node2.47170 > node2.40826: UDP, length 112
03:11:30.245852 IP node2.52599 > node2.40826: UDP, length 112
03:11:30.246188 IP node2.40433 > node2.40826: UDP, length 112
03:11:30.246435 IP node2.40826 > node2.52599: UDP, length 113
03:11:30.246455 IP node2.38768 > node2.40826: UDP, length 113
03:11:30.247223 IP node2.40826 > node2.38620: UDP, length 113
03:11:30.274471 IP node2.47792 > node2.52599: UDP, length 112
03:11:30.275998 IP node2.40826 > node2.47792: UDP, length 113
03:11:30.276363 IP node2.33739 > node2.47792: UDP, length 113
03:11:30.276456 IP node2.38620 > node2.47792: UDP, length 113
03:11:30.276829 IP node2.40433 > node2.47792: UDP, length 112
03:11:30.277049 IP node2.58185 > node2.47792: UDP, length 113
03:11:30.277118 IP node2.38768 > node2.47792: UDP, length 113
03:11:30.277259 IP node2.36166 > node2.47792: UDP, length 113
03:11:30.277357 IP node2.35844 > node2.47792: UDP, length 113
03:11:30.277357 IP node2.52006 > node2.47792: UDP, length 113
03:11:30.277604 IP node2.47170 > node2.47792: UDP, length 112
03:11:30.277695 IP node2.44193 > node2.47792: UDP, length 113
03:11:30.277819 IP node2.52599 > node2.47792: UDP, length 112
03:11:30.278662 IP node2.50518 > node2.47792: UDP, length 111
03:11:30.279128 IP node2.58256 > node2.47792: UDP, length 113
03:11:30.279152 IP node2.47792 > node2.40826: UDP, length 112
03:11:30.280793 IP node2.47792 > node2.38620: UDP, length 112
03:11:32.693836 IP node2.38620 > node2.52006: UDP, length 113
03:11:32.696743 IP node2.40826 > node2.52006: UDP, length 113
03:11:32.696956 IP node2.47792 > node2.52006: UDP, length 112
03:11:32.697041 IP node2.52599 > node2.52006: UDP, length 112
03:11:32.697133 IP node2.44193 > node2.52006: UDP, length 113
03:11:32.697851 IP node2.36166 > node2.52006: UDP, length 113
03:11:32.698515 IP node2.47170 > node2.52006: UDP, length 112
03:11:32.699071 IP node2.35844 > node2.52006: UDP, length 113
03:11:32.699253 IP node2.58185 > node2.52006: UDP, length 113
03:11:32.699429 IP node2.50518 > node2.52006: UDP, length 111
03:11:32.699706 IP node2.38768 > node2.52006: UDP, length 113
03:11:32.699811 IP node2.58256 > node2.52006: UDP, length 113
03:11:32.699816 IP node2.40433 > node2.52006: UDP, length 112
03:11:32.701067 IP node2.33739 > node2.52006: UDP, length 113
03:11:32.953116 IP node2.40433 > node2.33739: UDP, length 112
03:11:32.953404 IP node2.50518 > node2.33739: UDP, length 111
03:11:32.953420 IP node2.35844 > node2.33739: UDP, length 113
03:11:32.953951 IP node2.58185 > node2.33739: UDP, length 113
03:11:32.954057 IP node2.47170 > node2.33739: UDP, length 112
03:11:32.955696 IP node2.40826 > node2.33739: UDP, length 113
03:11:32.955816 IP node2.52599 > node2.33739: UDP, length 112
03:11:32.955894 IP node2.58256 > node2.33739: UDP, length 113
03:11:32.956188 IP node2.38620 > node2.33739: UDP, length 113
03:11:32.963819 IP node2.36166 > node2.33739: UDP, length 113
03:11:32.964371 IP node2.38768 > node2.33739: UDP, length 113
03:11:32.964657 IP node2.44193 > node2.33739: UDP, length 113
03:11:32.964928 IP node2.47792 > node2.33739: UDP, length 112
03:11:32.967930 IP node2.52006 > node2.33739: UDP, length 113
03:11:32.974801 IP node2.44193 > node2.47170: UDP, length 113
03:11:32.975209 IP node2.35844 > node2.47170: UDP, length 113
03:11:32.975302 IP node2.40826 > node2.47170: UDP, length 113
03:11:32.975783 IP node2.47792 > node2.47170: UDP, length 112
03:11:32.976412 IP node2.36166 > node2.47170: UDP, length 113
03:11:32.976619 IP node2.50518 > node2.47170: UDP, length 111
03:11:32.976885 IP node2.52006 > node2.47170: UDP, length 113
03:11:32.977408 IP node2.52599 > node2.47170: UDP, length 112
03:11:32.977796 IP node2.38768 > node2.47170: UDP, length 113
03:11:32.978133 IP node2.40433 > node2.47170: UDP, length 112
03:11:32.978752 IP node2.33739 > node2.47170: UDP, length 113
03:11:32.979812 IP node2.58185 > node2.47170: UDP, length 113
03:11:32.980128 IP node2.38620 > node2.47170: UDP, length 113
03:11:32.981590 IP node2.58256 > node2.47170: UDP, length 113
03:11:33.038833 IP node2.35844 > node2.38768: UDP, length 113
03:11:33.040189 IP node2.38620 > node2.38768: UDP, length 113
03:11:33.040230 IP node2.44193 > node2.38768: UDP, length 113
03:11:33.040440 IP node2.50518 > node2.38768: UDP, length 111
03:11:33.040772 IP node2.40826 > node2.38768: UDP, length 113
03:11:33.040798 IP node2.36166 > node2.38768: UDP, length 113
03:11:33.040947 IP node2.40433 > node2.38768: UDP, length 112
03:11:33.041389 IP node2.58256 > node2.38768: UDP, length 113
03:11:33.041449 IP node2.47792 > node2.38768: UDP, length 112
03:11:33.041589 IP node2.33739 > node2.38768: UDP, length 113
03:11:33.041605 IP node2.52599 > node2.38768: UDP, length 112
03:11:33.041808 IP node2.52006 > node2.38768: UDP, length 113
03:11:33.043078 IP node2.47170 > node2.38768: UDP, length 112
03:11:33.044602 IP node2.58185 > node2.38768: UDP, length 113
03:11:33.045416 IP node2.52006 > node2.50518: UDP, length 113
03:11:33.045716 IP node2.38620 > node2.50518: UDP, length 113
03:11:33.045716 IP node2.38768 > node2.50518: UDP, length 113
03:11:33.046203 IP node2.58185 > node2.50518: UDP, length 113
03:11:33.048217 IP node2.40433 > node2.50518: UDP, length 112
03:11:33.048619 IP node2.47170 > node2.50518: UDP, length 112
03:11:33.048819 IP node2.33739 > node2.50518: UDP, length 113
03:11:33.049620 IP node2.44193 > node2.50518: UDP, length 113
03:11:33.050360 IP node2.47792 > node2.50518: UDP, length 112
03:11:33.051319 IP node2.52599 > node2.50518: UDP, length 112
03:11:33.051751 IP node2.36166 > node2.50518: UDP, length 113
03:11:33.051762 IP node2.40826 > node2.50518: UDP, length 113
03:11:33.054251 IP node2.38768 > node2.36166: UDP, length 94
03:11:33.055930 IP node2.58256 > node2.50518: UDP, length 113
03:11:33.057963 IP node2.35844 > node2.50518: UDP, length 113
03:11:33.063454 IP node2.50518 > node2.36166: UDP, length 94
03:11:33.117037 IP node2.36166 > node2.38768: UDP, length 87
03:11:33.121737 IP node2.38768 > node2.36166: UDP, length 94
03:11:33.130743 IP node2.36166 > node2.38768: UDP, length 161
03:11:33.130836 IP node2.36166 > node2.50518: UDP, length 161
03:11:33.134684 IP node2.47170 > node2.58185: UDP, length 112
03:11:33.135300 IP node2.33739 > node2.58185: UDP, length 113
03:11:33.136038 IP node2.38768 > node2.58185: UDP, length 113
03:11:33.136508 IP node2.47792 > node2.58185: UDP, length 112
03:11:33.136516 IP node2.36166 > node2.58185: UDP, length 113
03:11:33.136998 IP node2.58256 > node2.58185: UDP, length 113
03:11:33.138363 IP node2.35844 > node2.58185: UDP, length 113
03:11:33.139103 IP node2.40433 > node2.58185: UDP, length 112
03:11:33.139261 IP node2.52006 > node2.58185: UDP, length 113
03:11:33.141240 IP node2.50518 > node2.58185: UDP, length 111
03:11:33.142438 IP node2.52599 > node2.58185: UDP, length 112
03:11:33.143089 IP node2.44193 > node2.58185: UDP, length 113
03:11:33.143183 IP node2.40826 > node2.58185: UDP, length 113
03:11:33.145131 IP node2.38620 > node2.58185: UDP, length 113
03:11:33.150612 IP node2.38768 > node2.36166: UDP, length 71
03:11:33.152638 IP node2.36166 > node2.38768: UDP, length 129
03:11:33.156084 IP node2.38768 > node2.50518: UDP, length 87
03:11:33.156758 IP node2.58185 > node2.36166: UDP, length 94
03:11:33.159362 IP node2.50518 > node2.38768: UDP, length 94
03:11:33.162958 IP node2.50518 > node2.36166: UDP, length 71
03:11:33.164470 IP node2.36166 > node2.50518: UDP, length 154
03:11:33.178742 IP node2.50518 > node2.36166: UDP, length 71
03:11:33.186502 IP node2.38768 > node2.40433: UDP, length 113
03:11:33.186752 IP node2.58185 > node2.40433: UDP, length 113
03:11:33.186910 IP node2.36166 > node2.40433: UDP, length 113
03:11:33.186983 IP node2.33739 > node2.40433: UDP, length 113
03:11:33.187948 IP node2.40826 > node2.40433: UDP, length 113
03:11:33.189356 IP node2.52006 > node2.40433: UDP, length 113
03:11:33.190131 IP node2.52599 > node2.40433: UDP, length 112
03:11:33.190527 IP node2.50518 > node2.40433: UDP, length 111
03:11:33.190830 IP node2.47170 > node2.40433: UDP, length 112
03:11:33.191069 IP node2.58256 > node2.40433: UDP, length 113
03:11:33.191213 IP node2.44193 > node2.40433: UDP, length 113
03:11:33.191453 IP node2.47792 > node2.40433: UDP, length 112
03:11:33.191767 IP node2.35844 > node2.40433: UDP, length 113
03:11:33.193879 IP node2.38620 > node2.40433: UDP, length 113
03:11:33.202382 IP node2.40433 > node2.36166: UDP, length 94
03:11:33.217621 IP node2.38768 > node2.36166: UDP, length 78
03:11:33.223043 IP node2.50518 > node2.36166: UDP, length 78
03:11:33.273891 IP node2.38768 > node2.36166: UDP, length 71
03:11:33.297638 IP node2.38768 > node2.36166: UDP, length 78
03:11:33.299344 IP node2.50518 > node2.58185: UDP, length 87
03:11:33.300350 IP node2.58185 > node2.50518: UDP, length 94
03:11:33.301895 IP node2.50518 > node2.36166: UDP, length 78
03:11:33.303151 IP node2.36166 > node2.58185: UDP, length 235
03:11:33.303615 IP node2.36166 > node2.40433: UDP, length 235
03:11:33.322570 IP node2.58185 > node2.36166: UDP, length 71
03:11:33.324028 IP node2.44193 > node2.35844: UDP, length 113
03:11:33.324440 IP node2.38620 > node2.35844: UDP, length 113
03:11:33.324561 IP node2.50518 > node2.35844: UDP, length 111
03:11:33.325225 IP node2.52599 > node2.35844: UDP, length 112
03:11:33.325279 IP node2.52006 > node2.35844: UDP, length 113
03:11:33.325770 IP node2.38768 > node2.35844: UDP, length 113
03:11:33.325811 IP node2.40433 > node2.35844: UDP, length 112
03:11:33.325961 IP node2.40826 > node2.35844: UDP, length 113
03:11:33.326134 IP node2.36166 > node2.58185: UDP, length 179
03:11:33.326402 IP node2.58256 > node2.35844: UDP, length 113
03:11:33.327234 IP node2.47170 > node2.35844: UDP, length 112
03:11:33.328696 IP node2.47792 > node2.35844: UDP, length 112
03:11:33.328901 IP node2.58185 > node2.35844: UDP, length 113
03:11:33.329494 IP node2.33739 > node2.35844: UDP, length 113
03:11:33.329504 IP node2.36166 > node2.35844: UDP, length 113
03:11:33.332198 IP node2.58185 > node2.40433: UDP, length 87
03:11:33.333300 IP node2.40433 > node2.58185: UDP, length 94
03:11:33.333881 IP node2.58185 > node2.36166: UDP, length 71
03:11:33.342235 IP node2.40433 > node2.36166: UDP, length 71
03:11:33.343124 IP node2.36166 > node2.40433: UDP, length 204
03:11:33.345708 IP node2.58185 > node2.36166: UDP, length 78
03:11:33.358739 IP node2.35844 > node2.36166: UDP, length 94
03:11:33.362857 IP node2.36166 > node2.50518: UDP, length 71
03:11:33.363166 IP node2.36166 > node2.35844: UDP, length 71
03:11:33.363198 IP node2.36166 > node2.40433: UDP, length 71
03:11:33.363279 IP node2.36166 > node2.58185: UDP, length 71
03:11:33.363393 IP node2.36166 > node2.38768: UDP, length 71
03:11:33.371209 IP node2.40433 > node2.36166: UDP, length 78
03:11:33.432273 IP node2.44193 > node2.58256: UDP, length 113
03:11:33.432481 IP node2.38620 > node2.58256: UDP, length 113
03:11:33.432708 IP node2.33739 > node2.58256: UDP, length 113
03:11:33.432814 IP node2.36166 > node2.58256: UDP, length 113
03:11:33.433107 IP node2.58185 > node2.58256: UDP, length 113
03:11:33.433173 IP node2.38768 > node2.58256: UDP, length 113
03:11:33.433272 IP node2.47170 > node2.58256: UDP, length 112
03:11:33.433734 IP node2.50518 > node2.58256: UDP, length 111
03:11:33.435110 IP node2.52006 > node2.58256: UDP, length 113
03:11:33.435331 IP node2.35844 > node2.58256: UDP, length 113
03:11:33.435362 IP node2.40826 > node2.58256: UDP, length 113
03:11:33.435770 IP node2.52599 > node2.58256: UDP, length 112
03:11:33.436314 IP node2.40433 > node2.58256: UDP, length 112
03:11:33.436848 IP node2.47792 > node2.58256: UDP, length 112
03:11:33.437817 IP node2.58256 > node2.36166: UDP, length 94
03:11:33.452597 IP node2.40433 > node2.36166: UDP, length 71
03:11:33.549744 IP node2.58185 > node2.36166: UDP, length 78
03:11:33.551639 IP node2.40433 > node2.36166: UDP, length 78
03:11:33.554916 IP node2.50518 > node2.36166: UDP, length 78
03:11:33.564545 IP node2.38768 > node2.36166: UDP, length 78
03:11:33.595746 IP node2.36166 > node2.35844: UDP, length 325
03:11:33.595798 IP node2.36166 > node2.58256: UDP, length 325
03:11:33.602598 IP node2.35844 > node2.36166: UDP, length 71
03:11:33.608119 IP node2.36166 > node2.35844: UDP, length 304
03:11:33.609416 IP node2.58256 > node2.36166: UDP, length 71
03:11:33.612008 IP node2.36166 > node2.58256: UDP, length 304
03:11:33.635108 IP node2.58256 > node2.36166: UDP, length 78
03:11:33.655296 IP node2.35844 > node2.36166: UDP, length 78
03:11:33.664405 IP node2.40826 > node2.44193: UDP, length 113
03:11:33.664569 IP node2.52599 > node2.44193: UDP, length 112
03:11:33.665230 IP node2.47170 > node2.44193: UDP, length 112
03:11:33.665481 IP node2.47792 > node2.44193: UDP, length 112
03:11:33.665638 IP node2.52006 > node2.44193: UDP, length 113
03:11:33.665696 IP node2.36166 > node2.44193: UDP, length 113
03:11:33.665942 IP node2.38768 > node2.44193: UDP, length 113
03:11:33.665998 IP node2.50518 > node2.44193: UDP, length 111
03:11:33.666631 IP node2.33739 > node2.44193: UDP, length 113
03:11:33.666663 IP node2.35844 > node2.44193: UDP, length 113
03:11:33.666735 IP node2.58185 > node2.44193: UDP, length 113
03:11:33.667662 IP node2.40433 > node2.44193: UDP, length 112
03:11:33.668621 IP node2.58256 > node2.44193: UDP, length 113
03:11:33.669353 IP node2.38620 > node2.44193: UDP, length 113
03:11:33.676569 IP node2.44193 > node2.36166: UDP, length 94
03:11:33.676677 IP node2.38620 > node2.52599: UDP, length 113
03:11:33.677054 IP node2.40433 > node2.52599: UDP, length 112
03:11:33.677654 IP node2.47792 > node2.52599: UDP, length 112
03:11:33.677848 IP node2.38768 > node2.52599: UDP, length 113
03:11:33.678096 IP node2.47170 > node2.52599: UDP, length 112
03:11:33.678348 IP node2.58256 > node2.52599: UDP, length 113
03:11:33.678436 IP node2.40826 > node2.52599: UDP, length 113
03:11:33.678980 IP node2.50518 > node2.52599: UDP, length 111
03:11:33.679202 IP node2.36166 > node2.52599: UDP, length 113
03:11:33.679631 IP node2.35844 > node2.52599: UDP, length 113
03:11:33.681867 IP node2.33739 > node2.52599: UDP, length 113
03:11:33.682435 IP node2.52006 > node2.52599: UDP, length 113
03:11:33.683834 IP node2.44193 > node2.52599: UDP, length 113
03:11:33.685711 IP node2.58185 > node2.52599: UDP, length 113
03:11:33.691086 IP node2.52599 > node2.36166: UDP, length 94
03:11:33.693581 IP node2.58185 > node2.38620: UDP, length 113
03:11:33.693901 IP node2.35844 > node2.38620: UDP, length 113
03:11:33.694284 IP node2.52599 > node2.38620: UDP, length 112
03:11:33.694715 IP node2.33739 > node2.38620: UDP, length 113
03:11:33.695270 IP node2.52006 > node2.38620: UDP, length 113
03:11:33.695421 IP node2.47792 > node2.38620: UDP, length 112
03:11:33.695793 IP node2.40826 > node2.38620: UDP, length 113
03:11:33.695842 IP node2.38768 > node2.38620: UDP, length 113
03:11:33.696055 IP node2.40433 > node2.38620: UDP, length 112
03:11:33.696201 IP node2.47170 > node2.38620: UDP, length 112
03:11:33.696925 IP node2.44193 > node2.38620: UDP, length 113
03:11:33.697288 IP node2.50518 > node2.38620: UDP, length 111
03:11:33.697344 IP node2.58256 > node2.36166: UDP, length 71
03:11:33.698197 IP node2.36166 > node2.38620: UDP, length 113
03:11:33.700246 IP node2.58256 > node2.38620: UDP, length 113
03:11:33.706828 IP node2.38620 > node2.36166: UDP, length 94
03:11:33.743016 IP node2.40433 > node2.40826: UDP, length 112
03:11:33.743095 IP node2.52599 > node2.40826: UDP, length 112
03:11:33.743285 IP node2.58185 > node2.40826: UDP, length 113
03:11:33.744060 IP node2.47792 > node2.40826: UDP, length 112
03:11:33.744454 IP node2.33739 > node2.40826: UDP, length 113
03:11:33.744468 IP node2.38768 > node2.40826: UDP, length 113
03:11:33.744778 IP node2.47170 > node2.40826: UDP, length 112
03:11:33.744819 IP node2.52006 > node2.40826: UDP, length 113
03:11:33.744911 IP node2.44193 > node2.40826: UDP, length 113
03:11:33.745036 IP node2.35844 > node2.40826: UDP, length 113
03:11:33.745577 IP node2.36166 > node2.40826: UDP, length 113
03:11:33.745634 IP node2.38620 > node2.40826: UDP, length 113
03:11:33.745635 IP node2.58256 > node2.40826: UDP, length 113
03:11:33.745991 IP node2.50518 > node2.40826: UDP, length 111
03:11:33.754536 IP node2.40826 > node2.36166: UDP, length 94
03:11:33.772332 IP node2.35844 > node2.47792: UDP, length 113
03:11:33.772704 IP node2.36166 > node2.47792: UDP, length 113
03:11:33.772933 IP node2.40433 > node2.47792: UDP, length 112
03:11:33.773140 IP node2.50518 > node2.47792: UDP, length 111
03:11:33.773243 IP node2.38620 > node2.47792: UDP, length 113
03:11:33.773958 IP node2.33739 > node2.47792: UDP, length 113
03:11:33.774536 IP node2.58256 > node2.47792: UDP, length 113
03:11:33.774850 IP node2.58185 > node2.47792: UDP, length 113
03:11:33.776073 IP node2.47170 > node2.47792: UDP, length 112
03:11:33.776241 IP node2.44193 > node2.47792: UDP, length 113
03:11:33.776627 IP node2.52006 > node2.47792: UDP, length 113
03:11:33.776820 IP node2.40826 > node2.47792: UDP, length 113
03:11:33.776964 IP node2.52599 > node2.47792: UDP, length 112
03:11:33.777150 IP node2.38768 > node2.47792: UDP, length 113
03:11:33.793545 IP node2.40433 > node2.36166: UDP, length 78
03:11:33.793670 IP node2.35844 > node2.36166: UDP, length 78
03:11:33.794306 IP node2.38768 > node2.36166: UDP, length 78
03:11:33.795800 IP node2.50518 > node2.36166: UDP, length 78
03:11:33.797613 IP node2.58256 > node2.36166: UDP, length 78
03:11:33.802181 IP node2.58185 > node2.36166: UDP, length 78
03:11:33.809839 IP node2.47792 > node2.36166: UDP, length 94
03:11:33.832050 IP node2.36166 > node2.44193: UDP, length 433
03:11:33.832116 IP node2.36166 > node2.52599: UDP, length 433
03:11:33.832390 IP node2.36166 > node2.38620: UDP, length 433
03:11:33.832452 IP node2.36166 > node2.40826: UDP, length 433
03:11:33.848255 IP node2.44193 > node2.36166: UDP, length 71
03:11:33.850199 IP node2.36166 > node2.44193: UDP, length 404
03:11:33.862004 IP node2.44193 > node2.52599: UDP, length 87
03:11:33.867096 IP node2.36166 > node2.58185: UDP, length 71
03:11:33.867355 IP node2.36166 > node2.38768: UDP, length 71
03:11:33.867412 IP node2.36166 > node2.47792: UDP, length 71
03:11:33.867550 IP node2.36166 > node2.38620: UDP, length 71
03:11:33.867753 IP node2.36166 > node2.50518: UDP, length 71
03:11:33.867867 IP node2.36166 > node2.44193: UDP, length 71
03:11:33.868011 IP node2.36166 > node2.40826: UDP, length 71
03:11:33.868239 IP node2.36166 > node2.35844: UDP, length 71
03:11:33.868291 IP node2.36166 > node2.52599: UDP, length 71
03:11:33.868344 IP node2.36166 > node2.40433: UDP, length 71
03:11:33.868385 IP node2.36166 > node2.58256: UDP, length 71
03:11:33.871914 IP node2.52599 > node2.36166: UDP, length 71
03:11:33.872034 IP node2.52599 > node2.44193: UDP, length 94
03:11:33.880738 IP node2.36166 > node2.52599: UDP, length 504
03:11:33.891209 IP node2.40826 > node2.36166: UDP, length 71
03:11:33.896838 IP node2.36166 > node2.40826: UDP, length 529
03:11:33.937669 IP node2.38620 > node2.36166: UDP, length 71
03:11:33.938604 IP node2.36166 > node2.38620: UDP, length 529
03:11:33.939779 IP node2.40826 > node2.36166: UDP, length 78
03:11:33.948503 IP node2.44193 > node2.36166: UDP, length 78
03:11:33.953452 IP node2.38620 > node2.36166: UDP, length 71
03:11:33.957712 IP node2.52599 > node2.36166: UDP, length 78
03:11:33.961515 IP node2.38620 > node2.36166: UDP, length 78
03:11:34.027678 IP node2.44193 > node2.36166: UDP, length 71
03:11:34.032923 IP node2.52599 > node2.36166: UDP, length 78
03:11:34.035349 IP node2.38768 > node2.36166: UDP, length 78
03:11:34.038933 IP node2.44193 > node2.36166: UDP, length 78
03:11:34.039964 IP node2.35844 > node2.36166: UDP, length 78
03:11:34.040318 IP node2.50518 > node2.36166: UDP, length 78
03:11:34.042939 IP node2.40826 > node2.47792: UDP, length 87
03:11:34.044087 IP node2.58185 > node2.36166: UDP, length 78
03:11:34.045346 IP node2.47792 > node2.40826: UDP, length 94
03:11:34.046999 IP node2.40826 > node2.36166: UDP, length 78
03:11:34.047830 IP node2.38620 > node2.36166: UDP, length 78
03:11:34.049204 IP node2.35844 > node2.36166: UDP, length 71
03:11:34.051840 IP node2.52599 > node2.36166: UDP, length 71
03:11:34.057251 IP node2.58256 > node2.36166: UDP, length 78
03:11:34.057826 IP node2.40433 > node2.36166: UDP, length 78
03:11:34.059441 IP node2.36166 > node2.47792: UDP, length 505
03:11:34.090344 IP node2.40826 > node2.36166: UDP, length 71
03:11:34.092749 IP node2.47792 > node2.36166: UDP, length 71
03:11:34.093596 IP node2.36166 > node2.47792: UDP, length 604
03:11:34.131440 IP node2.47792 > node2.36166: UDP, length 71
03:11:34.153159 IP node2.47792 > node2.36166: UDP, length 78
03:11:34.253918 IP node2.58256 > node2.36166: UDP, length 78
03:11:34.262121 IP node2.58185 > node2.36166: UDP, length 78
03:11:34.265526 IP node2.38768 > node2.36166: UDP, length 78
03:11:34.267011 IP node2.40433 > node2.36166: UDP, length 78
03:11:34.269813 IP node2.40826 > node2.36166: UDP, length 78
03:11:34.275795 IP node2.35844 > node2.36166: UDP, length 78
03:11:34.279178 IP node2.50518 > node2.36166: UDP, length 78
03:11:34.280722 IP node2.44193 > node2.36166: UDP, length 78
03:11:34.281848 IP node2.38620 > node2.36166: UDP, length 78
03:11:34.287796 IP node2.47792 > node2.36166: UDP, length 78
03:11:34.290505 IP node2.52599 > node2.36166: UDP, length 78
03:11:34.364952 IP node2.36166 > node2.47792: UDP, length 71
03:11:34.365076 IP node2.36166 > node2.38620: UDP, length 71
03:11:34.365566 IP node2.36166 > node2.44193: UDP, length 71
03:11:34.366560 IP node2.36166 > node2.58185: UDP, length 71
03:11:34.366623 IP node2.36166 > node2.38768: UDP, length 71
03:11:34.366805 IP node2.36166 > node2.50518: UDP, length 71
03:11:34.367027 IP node2.36166 > node2.40826: UDP, length 71
03:11:34.367290 IP node2.36166 > node2.35844: UDP, length 71
03:11:34.367328 IP node2.36166 > node2.52599: UDP, length 71
03:11:34.367365 IP node2.36166 > node2.40433: UDP, length 71
03:11:34.367451 IP node2.36166 > node2.58256: UDP, length 71
03:11:34.488534 IP node2.58256 > node2.36166: UDP, length 78
03:11:34.488860 IP node2.40433 > node2.36166: UDP, length 78
03:11:34.489242 IP node2.40826 > node2.36166: UDP, length 78
03:11:34.491853 IP node2.58185 > node2.36166: UDP, length 78
03:11:34.492857 IP node2.50518 > node2.36166: UDP, length 78
03:11:34.494445 IP node2.35844 > node2.36166: UDP, length 78
03:11:34.497513 IP node2.38768 > node2.36166: UDP, length 78
03:11:34.506525 IP node2.52599 > node2.36166: UDP, length 78
03:11:34.507917 IP node2.44193 > node2.36166: UDP, length 78
03:11:34.514732 IP node2.38620 > node2.36166: UDP, length 78
03:11:34.522810 IP node2.47792 > node2.36166: UDP, length 78
03:11:34.660919 IP node2.58256 > node2.36166: UDP, length 78
03:11:34.664286 IP node2.40826 > node2.36166: UDP, length 78
03:11:34.665476 IP node2.38620 > node2.36166: UDP, length 78
03:11:34.665739 IP node2.47792 > node2.36166: UDP, length 78
03:11:34.666085 IP node2.58185 > node2.36166: UDP, length 78
03:11:34.668724 IP node2.44193 > node2.36166: UDP, length 78
03:11:34.669313 IP node2.40433 > node2.36166: UDP, length 78
03:11:34.670156 IP node2.38768 > node2.36166: UDP, length 78
03:11:34.671956 IP node2.50518 > node2.36166: UDP, length 78
03:11:34.675308 IP node2.35844 > node2.36166: UDP, length 78
03:11:34.680889 IP node2.52599 > node2.36166: UDP, length 78
03:11:34.842717 IP node2.58256 > node2.36166: UDP, length 78
03:11:34.844509 IP node2.44193 > node2.36166: UDP, length 78
03:11:34.844879 IP node2.35844 > node2.36166: UDP, length 78
03:11:34.848091 IP node2.40433 > node2.36166: UDP, length 78
03:11:34.850039 IP node2.38768 > node2.36166: UDP, length 78
03:11:34.851650 IP node2.50518 > node2.36166: UDP, length 78
03:11:34.852653 IP node2.52599 > node2.36166: UDP, length 78
03:11:34.854771 IP node2.58185 > node2.36166: UDP, length 78
03:11:34.858437 IP node2.38620 > node2.36166: UDP, length 78
03:11:34.860856 IP node2.40826 > node2.36166: UDP, length 78
03:11:34.862642 IP node2.47792 > node2.36166: UDP, length 78
03:11:34.865911 IP node2.36166 > node2.47792: UDP, length 71
03:11:34.865971 IP node2.36166 > node2.38620: UDP, length 71
03:11:34.867191 IP node2.36166 > node2.44193: UDP, length 71
03:11:34.867235 IP node2.36166 > node2.40826: UDP, length 71
03:11:34.867493 IP node2.36166 > node2.52599: UDP, length 71
03:11:34.867557 IP node2.36166 > node2.40433: UDP, length 71
03:11:34.867756 IP node2.36166 > node2.58185: UDP, length 71
03:11:34.867940 IP node2.36166 > node2.38768: UDP, length 71
03:11:34.868184 IP node2.36166 > node2.50518: UDP, length 71
03:11:34.868366 IP node2.36166 > node2.35844: UDP, length 71
03:11:34.868409 IP node2.36166 > node2.58256: UDP, length 71
03:11:35.094328 IP node2.40433 > node2.36166: UDP, length 78
03:11:35.096132 IP node2.58185 > node2.36166: UDP, length 78
03:11:35.096343 IP node2.38620 > node2.36166: UDP, length 78
03:11:35.098658 IP node2.40826 > node2.36166: UDP, length 78
03:11:35.102762 IP node2.52599 > node2.36166: UDP, length 78
03:11:35.103905 IP node2.58256 > node2.36166: UDP, length 78
03:11:35.105056 IP node2.47792 > node2.36166: UDP, length 78
03:11:35.108313 IP node2.35844 > node2.36166: UDP, length 78
03:11:35.109689 IP node2.44193 > node2.36166: UDP, length 78
03:11:35.110061 IP node2.38768 > node2.36166: UDP, length 78
03:11:35.115909 IP node2.50518 > node2.36166: UDP, length 78
03:11:35.368885 IP node2.36166 > node2.47792: UDP, length 71
03:11:35.368973 IP node2.36166 > node2.38620: UDP, length 71
03:11:35.373077 IP node2.38768 > node2.36166: UDP, length 78
03:11:35.374903 IP node2.58256 > node2.36166: UDP, length 78
03:11:35.375549 IP node2.50518 > node2.36166: UDP, length 78
03:11:35.377782 IP node2.40826 > node2.36166: UDP, length 78
03:11:35.377956 IP node2.36166 > node2.44193: UDP, length 71
03:11:35.378443 IP node2.36166 > node2.40826: UDP, length 71
03:11:35.378580 IP node2.52599 > node2.36166: UDP, length 78
03:11:35.378745 IP node2.36166 > node2.52599: UDP, length 71
03:11:35.378791 IP node2.36166 > node2.40433: UDP, length 71
03:11:35.379179 IP node2.36166 > node2.58185: UDP, length 71
03:11:35.379382 IP node2.36166 > node2.38768: UDP, length 71
03:11:35.380074 IP node2.36166 > node2.50518: UDP, length 71
03:11:35.380386 IP node2.36166 > node2.35844: UDP, length 71
03:11:35.380514 IP node2.36166 > node2.58256: UDP, length 71
03:11:35.380959 IP node2.58185 > node2.36166: UDP, length 78
03:11:35.383912 IP node2.38620 > node2.36166: UDP, length 78
03:11:35.384684 IP node2.44193 > node2.36166: UDP, length 78
03:11:35.387276 IP node2.35844 > node2.36166: UDP, length 78
03:11:35.397367 IP node2.40433 > node2.36166: UDP, length 78
03:11:35.399647 IP node2.47792 > node2.36166: UDP, length 78
03:11:35.690577 IP node2.50518 > node2.36166: UDP, length 78
03:11:35.691418 IP node2.58256 > node2.36166: UDP, length 78
03:11:35.691853 IP node2.38768 > node2.36166: UDP, length 78
03:11:35.697607 IP node2.38620 > node2.36166: UDP, length 78
03:11:35.706737 IP node2.52599 > node2.36166: UDP, length 78
03:11:35.707691 IP node2.35844 > node2.36166: UDP, length 78
03:11:35.711194 IP node2.40826 > node2.36166: UDP, length 78
03:11:35.713907 IP node2.58185 > node2.36166: UDP, length 78
03:11:35.715792 IP node2.44193 > node2.36166: UDP, length 78
03:11:35.718411 IP node2.40433 > node2.36166: UDP, length 78
03:11:35.722966 IP node2.47792 > node2.36166: UDP, length 78
03:11:35.869246 IP node2.36166 > node2.47792: UDP, length 71
03:11:35.869824 IP node2.36166 > node2.40433: UDP, length 71
03:11:35.869897 IP node2.36166 > node2.58185: UDP, length 71
03:11:35.870145 IP node2.36166 > node2.38620: UDP, length 71
03:11:35.870252 IP node2.36166 > node2.44193: UDP, length 71
03:11:35.870284 IP node2.36166 > node2.40826: UDP, length 71
03:11:35.870356 IP node2.36166 > node2.52599: UDP, length 71
03:11:35.870481 IP node2.36166 > node2.38768: UDP, length 71
03:11:35.870557 IP node2.36166 > node2.50518: UDP, length 71
03:11:35.870603 IP node2.36166 > node2.35844: UDP, length 71
03:11:35.870943 IP node2.36166 > node2.58256: UDP, length 71
03:11:36.001637 IP node2.47792 > node2.36166: UDP, length 78
03:11:36.001935 IP node2.44193 > node2.36166: UDP, length 78
03:11:36.002013 IP node2.38768 > node2.36166: UDP, length 78
03:11:36.002050 IP node2.58256 > node2.36166: UDP, length 78
03:11:36.005773 IP node2.52599 > node2.36166: UDP, length 78
03:11:36.007162 IP node2.50518 > node2.36166: UDP, length 78
03:11:36.007703 IP node2.40433 > node2.36166: UDP, length 78
03:11:36.011260 IP node2.40826 > node2.36166: UDP, length 78
03:11:36.011840 IP node2.38620 > node2.36166: UDP, length 78
03:11:36.014139 IP node2.58185 > node2.36166: UDP, length 78
03:11:36.020106 IP node2.35844 > node2.36166: UDP, length 78
03:11:36.202165 IP node2.38768 > node2.52006: UDP, length 113
03:11:36.202285 IP node2.47170 > node2.52006: UDP, length 112
03:11:36.202558 IP node2.44193 > node2.52006: UDP, length 113
03:11:36.202661 IP node2.40433 > node2.52006: UDP, length 112
03:11:36.202775 IP node2.38620 > node2.52006: UDP, length 113
03:11:36.203001 IP node2.50518 > node2.52006: UDP, length 111
03:11:36.203165 IP node2.33739 > node2.52006: UDP, length 113
03:11:36.203248 IP node2.47792 > node2.52006: UDP, length 112
03:11:36.203263 IP node2.40826 > node2.52006: UDP, length 113
03:11:36.203675 IP node2.58256 > node2.52006: UDP, length 113
03:11:36.204218 IP node2.36166 > node2.52006: UDP, length 113
03:11:36.204681 IP node2.35844 > node2.52006: UDP, length 113
03:11:36.204822 IP node2.52599 > node2.52006: UDP, length 112
03:11:36.207600 IP node2.58185 > node2.52006: UDP, length 113
03:11:36.209519 IP node2.52006 > node2.36166: UDP, length 94
03:11:36.217946 IP node2.35844 > node2.36166: UDP, length 78
03:11:36.220189 IP node2.40433 > node2.36166: UDP, length 78
03:11:36.220606 IP node2.58256 > node2.36166: UDP, length 78
03:11:36.222526 IP node2.40826 > node2.36166: UDP, length 78
03:11:36.222613 IP node2.47792 > node2.36166: UDP, length 78
03:11:36.223820 IP node2.38620 > node2.36166: UDP, length 78
03:11:36.224070 IP node2.50518 > node2.36166: UDP, length 78
03:11:36.234840 IP node2.44193 > node2.36166: UDP, length 78
03:11:36.237297 IP node2.38768 > node2.36166: UDP, length 78
03:11:36.240974 IP node2.58185 > node2.36166: UDP, length 78
03:11:36.243810 IP node2.52599 > node2.36166: UDP, length 78
03:11:36.372327 IP node2.36166 > node2.47792: UDP, length 71
03:11:36.372458 IP node2.36166 > node2.38620: UDP, length 71
03:11:36.373082 IP node2.36166 > node2.44193: UDP, length 71
03:11:36.374875 IP node2.36166 > node2.40826: UDP, length 71
03:11:36.376137 IP node2.36166 > node2.52599: UDP, length 71
03:11:36.376373 IP node2.36166 > node2.58185: UDP, length 71
03:11:36.378146 IP node2.36166 > node2.40433: UDP, length 71
03:11:36.378444 IP node2.36166 > node2.38768: UDP, length 71
03:11:36.378766 IP node2.36166 > node2.50518: UDP, length 71
03:11:36.378975 IP node2.36166 > node2.35844: UDP, length 71
03:11:36.384287 IP node2.36166 > node2.58256: UDP, length 71
03:11:36.384390 IP node2.36166 > node2.52006: UDP, length 71
03:11:36.446272 IP node2.38620 > node2.36166: UDP, length 78
03:11:36.448950 IP node2.50518 > node2.36166: UDP, length 78
03:11:36.453245 IP node2.47792 > node2.36166: UDP, length 78
03:11:36.455224 IP node2.35844 > node2.36166: UDP, length 78
03:11:36.456369 IP node2.58185 > node2.36166: UDP, length 78
03:11:36.457843 IP node2.38768 > node2.36166: UDP, length 78
03:11:36.458073 IP node2.44193 > node2.36166: UDP, length 78
03:11:36.458259 IP node2.40433 > node2.36166: UDP, length 78
03:11:36.461241 IP node2.44193 > node2.33739: UDP, length 113
03:11:36.461766 IP node2.40826 > node2.33739: UDP, length 113
03:11:36.463258 IP node2.47170 > node2.33739: UDP, length 112
03:11:36.464729 IP node2.58256 > node2.36166: UDP, length 78
03:11:36.464904 IP node2.38620 > node2.33739: UDP, length 113
03:11:36.465050 IP node2.58256 > node2.33739: UDP, length 113
03:11:36.465627 IP node2.52599 > node2.36166: UDP, length 78
03:11:36.465753 IP node2.52599 > node2.33739: UDP, length 112
03:11:36.465777 IP node2.58185 > node2.33739: UDP, length 113
03:11:36.466926 IP node2.52006 > node2.33739: UDP, length 113
03:11:36.467238 IP node2.50518 > node2.33739: UDP, length 111
03:11:36.468933 IP node2.40433 > node2.33739: UDP, length 112
03:11:36.471811 IP node2.38768 > node2.33739: UDP, length 113
03:11:36.475870 IP node2.52006 > node2.47170: UDP, length 113
03:11:36.476320 IP node2.58185 > node2.47170: UDP, length 113
03:11:36.476397 IP node2.35844 > node2.33739: UDP, length 113
03:11:36.477356 IP node2.44193 > node2.47170: UDP, length 113
03:11:36.477729 IP node2.40433 > node2.47170: UDP, length 112
03:11:36.477986 IP node2.33739 > node2.47170: UDP, length 113
03:11:36.478041 IP node2.38620 > node2.47170: UDP, length 113
03:11:36.478607 IP node2.38768 > node2.47170: UDP, length 113
03:11:36.479368 IP node2.40826 > node2.47170: UDP, length 113
03:11:36.479708 IP node2.58256 > node2.47170: UDP, length 113
03:11:36.479887 IP node2.50518 > node2.47170: UDP, length 111
03:11:36.480875 IP node2.52599 > node2.47170: UDP, length 112
03:11:36.480874 IP node2.35844 > node2.47170: UDP, length 113
03:11:36.482140 IP node2.36166 > node2.47170: UDP, length 113
03:11:36.482212 IP node2.36166 > node2.33739: UDP, length 113
03:11:36.493148 IP node2.47170 > node2.36166: UDP, length 94
03:11:36.498079 IP node2.33739 > node2.36166: UDP, length 94
03:11:36.504548 IP node2.40826 > node2.36166: UDP, length 78
03:11:36.519929 IP node2.36166 > node2.52006: UDP, length 1135
03:11:36.531069 IP node2.47792 > node2.47170: UDP, length 112
03:11:36.531164 IP node2.47792 > node2.33739: UDP, length 112
03:11:36.546317 IP node2.52006 > node2.36166: UDP, length 71
03:11:36.548480 IP node2.36166 > node2.52006: UDP, length 1479
03:11:36.578038 IP node2.52006 > node2.36166: UDP, length 78
03:11:36.690293 IP node2.38768 > node2.36166: UDP, length 78
03:11:36.692016 IP node2.52006 > node2.36166: UDP, length 78
03:11:36.695205 IP node2.58256 > node2.36166: UDP, length 78
03:11:36.695318 IP node2.38620 > node2.36166: UDP, length 78
03:11:36.695372 IP node2.35844 > node2.36166: UDP, length 78
03:11:36.695414 IP node2.44193 > node2.36166: UDP, length 78
03:11:36.695481 IP node2.58185 > node2.36166: UDP, length 78
03:11:36.698474 IP node2.40433 > node2.36166: UDP, length 78
03:11:36.699992 IP node2.47792 > node2.36166: UDP, length 78
03:11:36.700507 IP node2.40826 > node2.36166: UDP, length 78
03:11:36.705732 IP node2.52599 > node2.36166: UDP, length 78
03:11:36.716230 IP node2.50518 > node2.36166: UDP, length 78
03:11:36.752145 IP node2.40433 > node2.36166: UDP, length 1174
03:11:36.794709 IP node2.36166 > node2.47170: UDP, length 1189
03:11:36.794969 IP node2.36166 > node2.33739: UDP, length 1189
03:11:36.809479 IP node2.47170 > node2.36166: UDP, length 71
03:11:36.810121 IP node2.36166 > node2.47170: UDP, length 1529
03:11:36.812858 IP node2.33739 > node2.36166: UDP, length 71
03:11:36.816745 IP node2.36166 > node2.33739: UDP, length 1554
03:11:36.849612 IP node2.33739 > node2.36166: UDP, length 78
03:11:36.853073 IP node2.38768 > node2.36166: UDP, length 1174
03:11:36.859677 IP node2.47170 > node2.36166: UDP, length 78
03:11:36.872161 IP node2.36166 > node2.47170: UDP, length 71
03:11:36.873313 IP node2.36166 > node2.47792: UDP, length 72
03:11:36.873353 IP node2.36166 > node2.38620: UDP, length 72
03:11:36.874008 IP node2.36166 > node2.44193: UDP, length 72
03:11:36.874043 IP node2.36166 > node2.40826: UDP, length 72
03:11:36.874244 IP node2.36166 > node2.52599: UDP, length 72
03:11:36.874433 IP node2.36166 > node2.58185: UDP, length 72
03:11:36.877080 IP node2.36166 > node2.40433: UDP, length 72
03:11:36.877394 IP node2.36166 > node2.38768: UDP, length 72
03:11:36.877692 IP node2.36166 > node2.50518: UDP, length 72
03:11:36.877820 IP node2.36166 > node2.35844: UDP, length 72
03:11:36.877865 IP node2.36166 > node2.58256: UDP, length 72
03:11:36.877912 IP node2.36166 > node2.52006: UDP, length 72
03:11:36.878031 IP node2.36166 > node2.33739: UDP, length 72
03:11:36.980403 IP node2.52006 > node2.36166: UDP, length 71
03:11:37.212022 IP node2.33739 > node2.36166: UDP, length 71
03:11:37.226418 IP node2.47170 > node2.36166: UDP, length 71
03:11:37.515501 IP node2.40433 > node2.36166: UDP, length 1174
03:11:38.638221 IP node2.40826 > node2.36166: UDP, length 1174
03:11:39.583019 IP node2.40826 > node2.36166: UDP, length 1174
03:11:42.079860 IP node2.44193 > node2.36166: UDP, length 1174
03:11:42.950463 IP node2.52006 > node2.36166: UDP, length 1174
03:11:44.386486 IP node2.52006 > node2.36166: UDP, length 1174
03:11:46.792787 IP node2.52599 > node2.36166: UDP, length 1174
03:11:47.728270 IP node2.44193 > node2.36166: UDP, length 1174
03:11:52.517178 IP node2.38620 > node2.36166: UDP, length 1174
03:11:54.542699 IP node2.35844 > node2.36166: UDP, length 1174
03:11:56.390702 IP node2.38768 > node2.36166: UDP, length 1174
03:12:01.998051 IP node2.50518 > node2.36166: UDP, length 1174
03:12:03.277215 IP node2.58256 > node2.36166: UDP, length 1174
03:12:03.417614 IP node2.33739 > node2.36166: UDP, length 1174
03:12:05.434289 IP node2.40433 > node2.36166: UDP, length 1174
03:12:06.471913 IP node2.58185 > node2.36166: UDP, length 1174
03:12:08.259762 IP node2.47792 > node2.36166: UDP, length 1174
03:12:08.273656 IP node2.47170 > node2.36166: UDP, length 1174
03:12:08.628855 IP node2.38620 > node2.36166: UDP, length 1174
03:12:09.415292 IP node2.58185 > node2.36166: UDP, length 1174
03:12:09.923184 IP node2.47792 > node2.36166: UDP, length 1174
03:12:10.204225 IP node2.52006 > node2.36166: UDP, length 1174
03:12:10.811484 IP node2.47170 > node2.36166: UDP, length 1174
03:12:11.479954 IP node2.58185 > node2.36166: UDP, length 1174
03:12:13.139853 IP node2.40826 > node2.36166: UDP, length 1174
03:12:16.233261 IP node2.35844 > node2.36166: UDP, length 1174
03:12:16.699040 IP node2.44193 > node2.36166: UDP, length 1174
03:12:19.315409 IP node2.52599 > node2.36166: UDP, length 1174
03:12:19.681398 IP node2.38768 > node2.36166: UDP, length 1174
03:12:21.645815 IP node2.44193 > node2.36166: UDP, length 1174
03:12:22.691238 IP node2.33739 > node2.36166: UDP, length 1174
03:12:22.848475 IP node2.40826 > node2.36166: UDP, length 1174
03:12:24.022296 IP node2.47170 > node2.36166: UDP, length 1174
03:12:24.746501 IP node2.50518 > node2.36166: UDP, length 1174
03:12:25.120119 IP node2.40433 > node2.36166: UDP, length 1174
03:12:29.041669 IP node2.38620 > node2.36166: UDP, length 1174
03:12:29.762026 IP node2.35844 > node2.36166: UDP, length 1174
03:12:30.961981 IP node2.40433 > node2.36166: UDP, length 1174
03:12:31.977182 IP node2.40433 > node2.36166: UDP, length 1174
03:12:32.805802 IP node2.44193 > node2.36166: UDP, length 1174
03:12:32.987537 IP node2.58256 > node2.36166: UDP, length 1174
03:12:34.640204 IP node2.47792 > node2.36166: UDP, length 1174
03:12:37.548606 IP node2.58185 > node2.36166: UDP, length 1174
03:12:38.102450 IP node2.38620 > node2.36166: UDP, length 1174
03:12:38.212001 IP node2.52006 > node2.36166: UDP, length 1174
03:12:47.216234 IP node2.52599 > node2.36166: UDP, length 1174
03:12:49.871133 IP node2.38620 > node2.36166: UDP, length 1174
03:12:50.799848 IP node2.47792 > node2.36166: UDP, length 1174
03:12:51.136994 IP node2.38768 > node2.36166: UDP, length 1174
03:12:52.707025 IP node2.47170 > node2.36166: UDP, length 1174
03:12:54.036949 IP node2.33739 > node2.36166: UDP, length 1174
03:12:57.085266 IP node2.40826 > node2.36166: UDP, length 1174
03:12:59.032499 IP node2.58185 > node2.36166: UDP, length 1174
03:13:01.444222 IP node2.44193 > node2.36166: UDP, length 1174
03:13:02.947918 IP node2.38768 > node2.36166: UDP, length 1174
03:13:03.192904 IP node2.40826 > node2.36166: UDP, length 1174
03:13:03.636713 IP node2.35844 > node2.36166: UDP, length 1174
03:13:04.040347 IP node2.50518 > node2.36166: UDP, length 1174
03:13:06.907169 IP node2.58185 > node2.36166: UDP, length 1174
03:13:07.832469 IP node2.58256 > node2.36166: UDP, length 1174
03:13:07.907382 IP node2.40433 > node2.36166: UDP, length 1174
03:13:08.581887 IP node2.40433 > node2.36166: UDP, length 1174
03:13:09.695869 IP node2.35844 > node2.36166: UDP, length 1174
03:13:10.071860 IP node2.47170 > node2.36166: UDP, length 1174
03:13:11.130065 IP node2.58256 > node2.36166: UDP, length 1174
03:13:12.454989 IP node2.38620 > node2.36166: UDP, length 1174
03:13:13.339956 IP node2.52006 > node2.36166: UDP, length 1174
03:13:13.618169 IP node2.35844 > node2.36166: UDP, length 1174
03:13:19.111812 IP node2.47792 > node2.36166: UDP, length 1174
03:13:20.055957 IP node2.35844 > node2.36166: UDP, length 1174
03:13:20.848967 IP node2.47170 > node2.36166: UDP, length 1174
03:13:22.538834 IP node2.58256 > node2.36166: UDP, length 1174
03:13:24.981238 IP node2.58256 > node2.36166: UDP, length 1174
03:13:26.565140 IP node2.33739 > node2.36166: UDP, length 1174
03:13:27.091719 IP node2.52599 > node2.36166: UDP, length 1174
03:13:27.682632 IP node2.38768 > node2.36166: UDP, length 1174
03:13:29.851641 IP node2.40826 > node2.36166: UDP, length 1174
03:13:33.655593 IP node2.35844 > node2.36166: UDP, length 1174
03:13:34.010997 IP node2.50518 > node2.36166: UDP, length 1174
03:13:34.705781 IP node2.52599 > node2.36166: UDP, length 1174
03:13:35.146464 IP node2.58256 > node2.36166: UDP, length 1174
03:13:36.955906 IP node2.33739 > node2.36166: UDP, length 1174
03:13:38.743202 IP node2.47170 > node2.36166: UDP, length 1174
03:13:38.811185 IP node2.47792 > node2.36166: UDP, length 1174
03:13:39.350848 IP node2.44193 > node2.36166: UDP, length 1174
03:13:41.936778 IP node2.58185 > node2.36166: UDP, length 1174
03:13:42.036986 IP node2.33739 > node2.36166: UDP, length 1174
03:13:42.773233 IP node2.38768 > node2.36166: UDP, length 1174
03:13:43.467507 IP node2.36166 > node2.58185: UDP, length 67
03:13:43.467926 IP node2.36166 > node2.40433: UDP, length 67
03:13:43.467974 IP node2.36166 > node2.38768: UDP, length 67
03:13:43.468017 IP node2.36166 > node2.50518: UDP, length 67
03:13:43.968038 IP node2.36166 > node2.38620: UDP, length 67
03:13:43.968180 IP node2.36166 > node2.44193: UDP, length 67
03:13:43.968218 IP node2.36166 > node2.40826: UDP, length 67
03:13:43.968249 IP node2.36166 > node2.52599: UDP, length 67
03:13:43.968523 IP node2.36166 > node2.35844: UDP, length 67
03:13:43.968563 IP node2.36166 > node2.58256: UDP, length 67
03:13:44.307672 IP node2.58185 > node2.36166: UDP, length 1174
03:13:44.468300 IP node2.36166 > node2.47792: UDP, length 67
03:13:45.598839 IP node2.47170 > node2.36166: UDP, length 1174
03:13:46.123871 IP node2.50518 > node2.36166: UDP, length 1174
03:13:46.352638 IP node2.40433 > node2.36166: UDP, length 1174
03:13:46.527856 IP node2.38620 > node2.36166: UDP, length 67
03:13:46.542467 IP node2.52006 > node2.36166: UDP, length 67
03:13:46.590570 IP node2.44193 > node2.36166: UDP, length 67
03:13:46.630223 IP node2.35844 > node2.36166: UDP, length 67
03:13:46.632116 IP node2.52599 > node2.36166: UDP, length 67
03:13:46.658569 IP node2.40826 > node2.36166: UDP, length 67
03:13:46.697458 IP node2.47792 > node2.36166: UDP, length 67
03:13:46.752336 IP node2.50518 > node2.36166: UDP, length 67
03:13:46.776097 IP node2.58256 > node2.36166: UDP, length 67
03:13:46.784161 IP node2.33739 > node2.36166: UDP, length 67
03:13:46.792893 IP node2.47170 > node2.36166: UDP, length 67
03:13:46.861868 IP node2.38768 > node2.36166: UDP, length 67
03:13:46.914615 IP node2.58185 > node2.36166: UDP, length 67
03:13:46.967571 IP node2.38620 > node2.36166: UDP, length 1174
03:13:46.970696 IP node2.36166 > node2.47170: UDP, length 67
03:13:46.970743 IP node2.36166 > node2.52006: UDP, length 67
03:13:46.970773 IP node2.36166 > node2.33739: UDP, length 67
03:13:47.038508 IP node2.40433 > node2.36166: UDP, length 67
03:13:51.878501 IP node2.52006 > node2.36166: UDP, length 1174
03:13:56.332228 IP node2.40826 > node2.36166: UDP, length 1174
03:14:02.116018 IP node2.35844 > node2.36166: UDP, length 1174
03:14:02.387229 IP node2.38620 > node2.36166: UDP, length 1174
03:14:02.598174 IP node2.40826 > node2.36166: UDP, length 1174
03:14:04.419877 IP node2.47792 > node2.36166: UDP, length 1174
03:14:06.109404 IP node2.52599 > node2.36166: UDP, length 1174
03:14:07.487268 IP node2.50518 > node2.36166: UDP, length 1174
03:14:12.870916 IP node2.40826 > node2.36166: UDP, length 1174
03:14:14.010507 IP node2.58256 > node2.36166: UDP, length 1174
03:14:16.265612 IP node2.35844 > node2.36166: UDP, length 1174
03:14:17.077869 IP node2.38768 > node2.36166: UDP, length 1174
03:14:17.549577 IP node2.44193 > node2.36166: UDP, length 1174
03:14:18.178058 IP node2.58185 > node2.36166: UDP, length 1174
03:14:18.652544 IP node2.47792 > node2.36166: UDP, length 1174
03:14:19.891207 IP node2.40433 > node2.36166: UDP, length 1174
03:14:20.122437 IP node2.47170 > node2.36166: UDP, length 1174
03:14:20.344434 IP node2.40826 > node2.36166: UDP, length 1174
03:14:21.115732 IP node2.33739 > node2.36166: UDP, length 1174
03:14:21.959088 IP node2.35844 > node2.36166: UDP, length 1174
03:14:25.353461 IP node2.38768 > node2.36166: UDP, length 1174
03:14:29.019194 IP node2.52006 > node2.36166: UDP, length 1174
03:14:29.279038 IP node2.52599 > node2.36166: UDP, length 1174
03:14:30.205182 IP node2.50518 > node2.36166: UDP, length 1174
03:14:33.222648 IP node2.38768 > node2.36166: UDP, length 154
03:14:33.236584 IP node2.50518 > node2.36166: UDP, length 154
03:14:33.350360 IP node2.58185 > node2.36166: UDP, length 154
03:14:33.374163 IP node2.40433 > node2.36166: UDP, length 154
03:14:33.494012 IP node2.36166 > node2.58185: UDP, length 72
03:14:33.494326 IP node2.36166 > node2.40433: UDP, length 72
03:14:33.494412 IP node2.36166 > node2.38768: UDP, length 72
03:14:33.494446 IP node2.36166 > node2.50518: UDP, length 72
03:14:33.632285 IP node2.47170 > node2.36166: UDP, length 1174
03:14:33.636697 IP node2.58256 > node2.36166: UDP, length 154
03:14:33.658724 IP node2.35844 > node2.36166: UDP, length 154
03:14:33.943208 IP node2.40826 > node2.36166: UDP, length 154
03:14:33.952530 IP node2.44193 > node2.36166: UDP, length 154
03:14:33.963251 IP node2.52599 > node2.36166: UDP, length 154
03:14:33.966806 IP node2.38620 > node2.36166: UDP, length 154
03:14:33.994544 IP node2.36166 > node2.38620: UDP, length 72
03:14:33.994797 IP node2.36166 > node2.44193: UDP, length 72
03:14:33.994836 IP node2.36166 > node2.40826: UDP, length 72
03:14:33.994876 IP node2.36166 > node2.52599: UDP, length 72
03:14:33.995133 IP node2.36166 > node2.35844: UDP, length 72
03:14:33.995173 IP node2.36166 > node2.58256: UDP, length 72
03:14:34.158827 IP node2.47792 > node2.36166: UDP, length 154
03:14:34.237074 IP node2.38768 > node2.36166: UDP, length 154
03:14:34.242808 IP node2.50518 > node2.36166: UDP, length 154
03:14:34.357967 IP node2.58185 > node2.36166: UDP, length 154
03:14:34.363342 IP node2.38768 > node2.36166: UDP, length 1174
03:14:34.381515 IP node2.40433 > node2.36166: UDP, length 154
03:14:34.494859 IP node2.36166 > node2.47792: UDP, length 72
03:14:34.495203 IP node2.36166 > node2.58185: UDP, length 72
03:14:34.495347 IP node2.36166 > node2.40433: UDP, length 72
03:14:34.495423 IP node2.36166 > node2.38768: UDP, length 72
03:14:34.495545 IP node2.36166 > node2.50518: UDP, length 72
03:14:34.644798 IP node2.58256 > node2.36166: UDP, length 154
03:14:34.668896 IP node2.35844 > node2.36166: UDP, length 154
03:14:34.949279 IP node2.40826 > node2.36166: UDP, length 154
03:14:34.959270 IP node2.44193 > node2.36166: UDP, length 154
03:14:34.972670 IP node2.52599 > node2.36166: UDP, length 154
03:14:34.978180 IP node2.38620 > node2.36166: UDP, length 154
03:14:34.995577 IP node2.36166 > node2.38620: UDP, length 72
03:14:34.996076 IP node2.36166 > node2.44193: UDP, length 72
03:14:34.996112 IP node2.36166 > node2.40826: UDP, length 72
03:14:34.996211 IP node2.36166 > node2.52599: UDP, length 72
03:14:34.996684 IP node2.36166 > node2.35844: UDP, length 72
03:14:34.996713 IP node2.36166 > node2.58256: UDP, length 72
03:14:35.164657 IP node2.47792 > node2.36166: UDP, length 154
03:14:35.255584 IP node2.38768 > node2.36166: UDP, length 154
03:14:35.255781 IP node2.50518 > node2.36166: UDP, length 154
03:14:35.367741 IP node2.58185 > node2.36166: UDP, length 154
03:14:35.398086 IP node2.40433 > node2.36166: UDP, length 154
03:14:35.495977 IP node2.36166 > node2.47792: UDP, length 72
03:14:35.496530 IP node2.36166 > node2.58185: UDP, length 72
03:14:35.496996 IP node2.36166 > node2.40433: UDP, length 72
03:14:35.497077 IP node2.36166 > node2.38768: UDP, length 72
03:14:35.497223 IP node2.36166 > node2.50518: UDP, length 72
03:14:35.653140 IP node2.58256 > node2.36166: UDP, length 154
03:14:35.698236 IP node2.35844 > node2.36166: UDP, length 154
03:14:35.957569 IP node2.40826 > node2.36166: UDP, length 154
03:14:35.970404 IP node2.44193 > node2.36166: UDP, length 154
03:14:35.983650 IP node2.52599 > node2.36166: UDP, length 154
03:14:35.990282 IP node2.38620 > node2.36166: UDP, length 154
03:14:35.996771 IP node2.36166 > node2.38620: UDP, length 72
03:14:35.997066 IP node2.36166 > node2.44193: UDP, length 72
03:14:35.997093 IP node2.36166 > node2.40826: UDP, length 72
03:14:35.997180 IP node2.36166 > node2.52599: UDP, length 72
03:14:35.998169 IP node2.36166 > node2.35844: UDP, length 72
03:14:35.998193 IP node2.36166 > node2.58256: UDP, length 72
03:14:36.170164 IP node2.47792 > node2.36166: UDP, length 154
03:14:36.269212 IP node2.50518 > node2.36166: UDP, length 154
03:14:36.273269 IP node2.38768 > node2.36166: UDP, length 154
03:14:36.376448 IP node2.58185 > node2.36166: UDP, length 154
03:14:36.406994 IP node2.40433 > node2.36166: UDP, length 154
03:14:36.500191 IP node2.36166 > node2.47792: UDP, length 72
03:14:36.500685 IP node2.36166 > node2.58185: UDP, length 72
03:14:36.501242 IP node2.36166 > node2.40433: UDP, length 72
03:14:36.501342 IP node2.36166 > node2.38768: UDP, length 72
03:14:36.501498 IP node2.36166 > node2.50518: UDP, length 72
03:14:36.581364 IP node2.52006 > node2.36166: UDP, length 154
03:14:36.657410 IP node2.58256 > node2.36166: UDP, length 154
03:14:36.705704 IP node2.35844 > node2.36166: UDP, length 154
03:14:36.852305 IP node2.33739 > node2.36166: UDP, length 154
03:14:36.862359 IP node2.47170 > node2.36166: UDP, length 154
03:14:36.961296 IP node2.40826 > node2.36166: UDP, length 154
03:14:36.974513 IP node2.44193 > node2.36166: UDP, length 154
03:14:36.987036 IP node2.52599 > node2.36166: UDP, length 154
03:14:36.994170 IP node2.38620 > node2.36166: UDP, length 154
03:14:37.000957 IP node2.36166 > node2.38620: UDP, length 72
03:14:37.001350 IP node2.36166 > node2.44193: UDP, length 72
03:14:37.001443 IP node2.36166 > node2.40826: UDP, length 72
03:14:37.001548 IP node2.36166 > node2.52599: UDP, length 72
03:14:37.002475 IP node2.36166 > node2.47170: UDP, length 72
03:14:37.003003 IP node2.36166 > node2.35844: UDP, length 72
03:14:37.003049 IP node2.36166 > node2.58256: UDP, length 72
03:14:37.003087 IP node2.36166 > node2.52006: UDP, length 72
03:14:37.004457 IP node2.36166 > node2.33739: UDP, length 72
03:14:37.137199 IP node2.47170 > node2.36166: UDP, length 1174
03:14:37.181575 IP node2.47792 > node2.36166: UDP, length 154
03:14:37.285006 IP node2.50518 > node2.36166: UDP, length 154
03:14:37.285784 IP node2.38768 > node2.36166: UDP, length 154
03:14:37.382429 IP node2.58185 > node2.36166: UDP, length 154
03:14:37.413746 IP node2.40433 > node2.36166: UDP, length 154
03:14:37.501310 IP node2.36166 > node2.47792: UDP, length 72
03:14:37.501807 IP node2.36166 > node2.58185: UDP, length 72
03:14:37.502340 IP node2.36166 > node2.40433: UDP, length 72
03:14:37.502511 IP node2.36166 > node2.38768: UDP, length 72
03:14:37.502652 IP node2.36166 > node2.50518: UDP, length 72
03:14:37.587789 IP node2.52006 > node2.36166: UDP, length 154
03:14:37.661352 IP node2.58256 > node2.36166: UDP, length 154
03:14:37.709423 IP node2.35844 > node2.36166: UDP, length 154
03:14:37.855747 IP node2.33739 > node2.36166: UDP, length 154
03:14:37.867552 IP node2.47170 > node2.36166: UDP, length 154
03:14:37.965633 IP node2.40826 > node2.36166: UDP, length 154
03:14:37.980143 IP node2.44193 > node2.36166: UDP, length 154
03:14:37.988090 IP node2.40826 > node2.36166: UDP, length 1174
03:14:38.002572 IP node2.36166 > node2.44193: UDP, length 72
03:14:38.002615 IP node2.36166 > node2.40826: UDP, length 72
03:14:38.003361 IP node2.36166 > node2.47170: UDP, length 72
03:14:38.004027 IP node2.36166 > node2.35844: UDP, length 72
03:14:38.004058 IP node2.36166 > node2.58256: UDP, length 72
03:14:38.004084 IP node2.36166 > node2.52006: UDP, length 72
03:14:38.004155 IP node2.36166 > node2.33739: UDP, length 72
03:14:38.006947 IP node2.38620 > node2.36166: UDP, length 154
03:14:38.010100 IP node2.52599 > node2.36166: UDP, length 154
03:14:38.127733 IP node2.38620 > node2.36166: UDP, length 1174
03:14:38.190707 IP node2.47792 > node2.36166: UDP, length 154
03:14:38.291733 IP node2.50518 > node2.36166: UDP, length 154
03:14:38.302126 IP node2.38768 > node2.36166: UDP, length 154
03:14:38.393199 IP node2.58185 > node2.36166: UDP, length 154
03:14:38.419594 IP node2.40433 > node2.36166: UDP, length 154
03:14:38.502178 IP node2.36166 > node2.47792: UDP, length 72
03:14:38.502229 IP node2.36166 > node2.38620: UDP, length 72
03:14:38.502560 IP node2.36166 > node2.52599: UDP, length 72
03:14:38.502705 IP node2.36166 > node2.58185: UDP, length 72
03:14:38.503170 IP node2.36166 > node2.40433: UDP, length 72
03:14:38.503260 IP node2.36166 > node2.38768: UDP, length 72
03:14:38.503419 IP node2.36166 > node2.50518: UDP, length 72
03:14:38.592890 IP node2.52006 > node2.36166: UDP, length 154
03:14:38.666911 IP node2.58256 > node2.36166: UDP, length 154
03:14:38.715525 IP node2.35844 > node2.36166: UDP, length 154
03:14:38.858512 IP node2.33739 > node2.36166: UDP, length 154
03:14:38.872865 IP node2.47170 > node2.36166: UDP, length 154
03:14:38.988324 IP node2.44193 > node2.36166: UDP, length 154
03:14:38.989125 IP node2.40826 > node2.36166: UDP, length 154
03:14:39.004433 IP node2.36166 > node2.44193: UDP, length 72
03:14:39.004469 IP node2.36166 > node2.40826: UDP, length 72
03:14:39.005349 IP node2.36166 > node2.47170: UDP, length 72
03:14:39.005840 IP node2.36166 > node2.35844: UDP, length 72
03:14:39.005860 IP node2.36166 > node2.58256: UDP, length 72
03:14:39.005893 IP node2.36166 > node2.52006: UDP, length 72
03:14:39.005971 IP node2.36166 > node2.33739: UDP, length 72
03:14:39.018924 IP node2.38620 > node2.36166: UDP, length 154
03:14:39.027206 IP node2.52599 > node2.36166: UDP, length 154
03:14:39.193534 IP node2.47792 > node2.36166: UDP, length 154
03:14:39.302294 IP node2.50518 > node2.36166: UDP, length 154
03:14:39.311662 IP node2.38768 > node2.36166: UDP, length 154
03:14:39.404558 IP node2.58185 > node2.36166: UDP, length 154
03:14:39.433632 IP node2.40433 > node2.36166: UDP, length 154
03:14:39.504186 IP node2.36166 > node2.47792: UDP, length 72
03:14:39.504232 IP node2.36166 > node2.38620: UDP, length 72
03:14:39.504564 IP node2.36166 > node2.52599: UDP, length 72
03:14:39.504735 IP node2.36166 > node2.58185: UDP, length 72
03:14:39.505116 IP node2.36166 > node2.40433: UDP, length 72
03:14:39.505217 IP node2.36166 > node2.38768: UDP, length 72
03:14:39.505408 IP node2.36166 > node2.50518: UDP, length 72
03:14:39.598137 IP node2.52006 > node2.36166: UDP, length 154
03:14:39.674863 IP node2.58256 > node2.36166: UDP, length 154
03:14:39.718510 IP node2.35844 > node2.36166: UDP, length 154
03:14:39.865798 IP node2.33739 > node2.36166: UDP, length 154
03:14:39.878324 IP node2.47170 > node2.36166: UDP, length 154
03:14:39.994233 IP node2.40826 > node2.36166: UDP, length 154
03:14:39.999771 IP node2.44193 > node2.36166: UDP, length 154
03:14:40.005401 IP node2.36166 > node2.44193: UDP, length 72
03:14:40.005434 IP node2.36166 > node2.40826: UDP, length 72
03:14:40.006139 IP node2.36166 > node2.47170: UDP, length 72
03:14:40.006678 IP node2.36166 > node2.35844: UDP, length 72
03:14:40.006702 IP node2.36166 > node2.58256: UDP, length 72
03:14:40.006724 IP node2.36166 > node2.52006: UDP, length 72
03:14:40.006801 IP node2.36166 > node2.33739: UDP, length 72
03:14:40.026196 IP node2.38620 > node2.36166: UDP, length 154
03:14:40.034293 IP node2.52599 > node2.36166: UDP, length 154
03:14:40.203860 IP node2.47792 > node2.36166: UDP, length 154
03:14:40.309681 IP node2.50518 > node2.36166: UDP, length 154
03:14:40.323082 IP node2.38768 > node2.36166: UDP, length 154
03:14:40.421791 IP node2.58185 > node2.36166: UDP, length 154
03:14:40.457186 IP node2.40433 > node2.36166: UDP, length 154
03:14:40.505258 IP node2.36166 > node2.47792: UDP, length 72
03:14:40.505423 IP node2.36166 > node2.38620: UDP, length 72
03:14:40.505694 IP node2.36166 > node2.52599: UDP, length 72
03:14:40.505963 IP node2.36166 > node2.58185: UDP, length 72
03:14:40.506365 IP node2.36166 > node2.40433: UDP, length 72
03:14:40.506675 IP node2.36166 > node2.38768: UDP, length 72
03:14:40.506842 IP node2.36166 > node2.50518: UDP, length 72
03:14:40.602437 IP node2.52006 > node2.36166: UDP, length 154
03:14:40.680904 IP node2.58256 > node2.36166: UDP, length 154
03:14:40.723006 IP node2.35844 > node2.36166: UDP, length 154
03:14:40.872589 IP node2.33739 > node2.36166: UDP, length 154
03:14:40.885572 IP node2.47170 > node2.36166: UDP, length 154
03:14:41.002457 IP node2.40826 > node2.36166: UDP, length 154
03:14:41.006527 IP node2.36166 > node2.40826: UDP, length 72
03:14:41.007110 IP node2.44193 > node2.36166: UDP, length 154
03:14:41.007232 IP node2.36166 > node2.47170: UDP, length 72
03:14:41.009036 IP node2.36166 > node2.35844: UDP, length 72
03:14:41.009064 IP node2.36166 > node2.58256: UDP, length 72
03:14:41.009102 IP node2.36166 > node2.52006: UDP, length 72
03:14:41.009200 IP node2.36166 > node2.33739: UDP, length 72
03:14:41.028601 IP node2.38620 > node2.36166: UDP, length 154
03:14:41.036777 IP node2.52599 > node2.36166: UDP, length 154
03:14:41.213822 IP node2.47792 > node2.36166: UDP, length 154
03:14:41.318266 IP node2.50518 > node2.36166: UDP, length 154
03:14:41.328942 IP node2.38768 > node2.36166: UDP, length 154
03:14:41.429180 IP node2.58185 > node2.36166: UDP, length 154
03:14:41.478085 IP node2.40433 > node2.36166: UDP, length 154
03:14:41.506296 IP node2.36166 > node2.47792: UDP, length 72
03:14:41.506403 IP node2.36166 > node2.38620: UDP, length 72
03:14:41.506745 IP node2.36166 > node2.44193: UDP, length 72
03:14:41.506806 IP node2.36166 > node2.52599: UDP, length 72
03:14:41.506960 IP node2.36166 > node2.58185: UDP, length 72
03:14:41.507402 IP node2.36166 > node2.40433: UDP, length 72
03:14:41.507536 IP node2.36166 > node2.38768: UDP, length 72
03:14:41.515019 IP node2.36166 > node2.50518: UDP, length 72
03:14:41.606749 IP node2.52006 > node2.36166: UDP, length 154
03:14:41.696592 IP node2.58256 > node2.36166: UDP, length 154
03:14:41.731706 IP node2.35844 > node2.36166: UDP, length 154
03:14:41.884760 IP node2.33739 > node2.36166: UDP, length 154
03:14:41.897341 IP node2.47170 > node2.36166: UDP, length 154
03:14:42.008490 IP node2.36166 > node2.47170: UDP, length 72
03:14:42.008993 IP node2.36166 > node2.35844: UDP, length 72
03:14:42.009034 IP node2.36166 > node2.58256: UDP, length 72
03:14:42.009078 IP node2.36166 > node2.52006: UDP, length 72
03:14:42.009159 IP node2.36166 > node2.33739: UDP, length 72
03:14:42.011596 IP node2.44193 > node2.36166: UDP, length 154
03:14:42.014930 IP node2.40826 > node2.36166: UDP, length 154
03:14:42.032335 IP node2.38620 > node2.36166: UDP, length 154
03:14:42.041382 IP node2.52599 > node2.36166: UDP, length 154
03:14:42.221820 IP node2.47792 > node2.36166: UDP, length 154
03:14:42.322737 IP node2.50518 > node2.36166: UDP, length 154
03:14:42.340455 IP node2.38768 > node2.36166: UDP, length 154
03:14:42.432915 IP node2.58185 > node2.36166: UDP, length 154
03:14:42.485286 IP node2.40433 > node2.36166: UDP, length 154
03:14:42.507426 IP node2.36166 > node2.47792: UDP, length 72
03:14:42.507472 IP node2.36166 > node2.38620: UDP, length 72
03:14:42.507795 IP node2.36166 > node2.44193: UDP, length 72
03:14:42.507828 IP node2.36166 > node2.40826: UDP, length 72
03:14:42.507928 IP node2.36166 > node2.52599: UDP, length 72
03:14:42.508080 IP node2.36166 > node2.58185: UDP, length 72
03:14:42.508547 IP node2.36166 > node2.40433: UDP, length 72
03:14:42.508632 IP node2.36166 > node2.38768: UDP, length 72
03:14:42.508769 IP node2.36166 > node2.50518: UDP, length 72
03:14:42.613024 IP node2.52006 > node2.36166: UDP, length 154
03:14:42.702282 IP node2.58256 > node2.36166: UDP, length 154
03:14:42.735622 IP node2.35844 > node2.36166: UDP, length 154
03:14:42.888267 IP node2.33739 > node2.36166: UDP, length 154
03:14:42.901248 IP node2.47170 > node2.36166: UDP, length 154
03:14:43.008941 IP node2.36166 > node2.47170: UDP, length 72
03:14:43.009401 IP node2.36166 > node2.35844: UDP, length 72
03:14:43.009432 IP node2.36166 > node2.58256: UDP, length 72
03:14:43.009464 IP node2.36166 > node2.52006: UDP, length 72
03:14:43.009548 IP node2.36166 > node2.33739: UDP, length 72
03:14:43.014846 IP node2.44193 > node2.36166: UDP, length 154
03:14:43.016965 IP node2.40826 > node2.36166: UDP, length 154
03:14:43.040255 IP node2.38620 > node2.36166: UDP, length 154
03:14:43.044703 IP node2.52599 > node2.36166: UDP, length 154
03:14:43.225388 IP node2.47792 > node2.36166: UDP, length 154
03:14:43.329101 IP node2.50518 > node2.36166: UDP, length 154
03:14:43.344745 IP node2.38768 > node2.36166: UDP, length 154
03:14:43.438136 IP node2.58185 > node2.36166: UDP, length 154
03:14:43.488988 IP node2.40433 > node2.36166: UDP, length 154
03:14:43.508394 IP node2.36166 > node2.47792: UDP, length 72
03:14:43.508436 IP node2.36166 > node2.38620: UDP, length 72
03:14:43.508689 IP node2.36166 > node2.44193: UDP, length 72
03:14:43.508728 IP node2.36166 > node2.40826: UDP, length 72
03:14:43.508837 IP node2.36166 > node2.52599: UDP, length 72
03:14:43.508982 IP node2.36166 > node2.58185: UDP, length 72
03:14:43.509431 IP node2.36166 > node2.40433: UDP, length 72
03:14:43.509513 IP node2.36166 > node2.38768: UDP, length 72
03:14:43.509656 IP node2.36166 > node2.50518: UDP, length 72
03:14:43.617016 IP node2.52006 > node2.36166: UDP, length 154
03:14:43.706166 IP node2.58256 > node2.36166: UDP, length 154
03:14:43.740708 IP node2.35844 > node2.36166: UDP, length 154
03:14:43.892812 IP node2.33739 > node2.36166: UDP, length 154
03:14:43.904185 IP node2.47170 > node2.36166: UDP, length 154
03:14:44.011947 IP node2.36166 > node2.47170: UDP, length 72
03:14:44.012437 IP node2.36166 > node2.35844: UDP, length 72
03:14:44.012482 IP node2.36166 > node2.58256: UDP, length 72
03:14:44.012519 IP node2.36166 > node2.52006: UDP, length 72
03:14:44.012601 IP node2.36166 > node2.33739: UDP, length 72
03:14:44.020185 IP node2.44193 > node2.36166: UDP, length 154
03:14:44.020842 IP node2.40826 > node2.36166: UDP, length 154
03:14:44.043031 IP node2.38620 > node2.36166: UDP, length 154
03:14:44.049671 IP node2.52599 > node2.36166: UDP, length 154
03:14:44.181880 IP node2.50518 > node2.36166: UDP, length 1175
03:14:44.227692 IP node2.47792 > node2.36166: UDP, length 154
03:14:44.329654 IP node2.50518 > node2.36166: UDP, length 154
03:14:44.345430 IP node2.38768 > node2.36166: UDP, length 154
03:14:44.407991 IP node2.52006 > node2.36166: UDP, length 1175
03:14:44.438863 IP node2.58185 > node2.36166: UDP, length 154
03:14:44.489998 IP node2.40433 > node2.36166: UDP, length 154
03:14:44.511247 IP node2.36166 > node2.47792: UDP, length 72
03:14:44.511308 IP node2.36166 > node2.38620: UDP, length 72
03:14:44.511700 IP node2.36166 > node2.44193: UDP, length 72
03:14:44.511739 IP node2.36166 > node2.40826: UDP, length 72
03:14:44.511859 IP node2.36166 > node2.52599: UDP, length 72
03:14:44.512065 IP node2.36166 > node2.58185: UDP, length 72
03:14:44.512645 IP node2.36166 > node2.40433: UDP, length 72
03:14:44.512757 IP node2.36166 > node2.38768: UDP, length 72
03:14:44.512974 IP node2.36166 > node2.50518: UDP, length 72
03:14:44.621242 IP node2.52006 > node2.36166: UDP, length 154
03:14:44.706925 IP node2.58256 > node2.36166: UDP, length 154
03:14:44.741542 IP node2.35844 > node2.36166: UDP, length 154
03:14:44.898079 IP node2.33739 > node2.36166: UDP, length 154
03:14:44.911016 IP node2.47170 > node2.36166: UDP, length 154
03:14:45.013278 IP node2.36166 > node2.47170: UDP, length 72
03:14:45.013989 IP node2.36166 > node2.35844: UDP, length 72
03:14:45.014020 IP node2.36166 > node2.58256: UDP, length 72
03:14:45.014039 IP node2.36166 > node2.52006: UDP, length 72
03:14:45.014152 IP node2.36166 > node2.33739: UDP, length 72
03:14:45.021023 IP node2.44193 > node2.36166: UDP, length 154
03:14:45.021585 IP node2.40826 > node2.36166: UDP, length 154
03:14:45.043851 IP node2.38620 > node2.36166: UDP, length 154
03:14:45.053045 IP node2.52599 > node2.36166: UDP, length 154
03:14:45.228463 IP node2.47792 > node2.36166: UDP, length 154
03:14:45.512124 IP node2.36166 > node2.47792: UDP, length 72
03:14:45.512176 IP node2.36166 > node2.38620: UDP, length 72
03:14:45.512540 IP node2.36166 > node2.44193: UDP, length 72
03:14:45.512571 IP node2.36166 > node2.40826: UDP, length 72
03:14:45.512654 IP node2.36166 > node2.52599: UDP, length 72
03:14:45.629514 IP node2.52006 > node2.36166: UDP, length 154
03:14:45.902686 IP node2.33739 > node2.36166: UDP, length 154
03:14:45.914672 IP node2.47170 > node2.36166: UDP, length 154
03:14:46.013558 IP node2.36166 > node2.47170: UDP, length 72
03:14:46.013896 IP node2.36166 > node2.52006: UDP, length 72
03:14:46.013975 IP node2.36166 > node2.33739: UDP, length 72
03:14:46.634416 IP node2.52006 > node2.36166: UDP, length 154
03:14:46.911058 IP node2.33739 > node2.36166: UDP, length 154
03:14:46.921262 IP node2.47170 > node2.36166: UDP, length 154
03:14:47.014230 IP node2.36166 > node2.47170: UDP, length 72
03:14:47.014596 IP node2.36166 > node2.52006: UDP, length 72
03:14:47.014628 IP node2.36166 > node2.33739: UDP, length 72
03:14:47.560704 IP node2.58185 > node2.36166: UDP, length 1175
03:14:47.635036 IP node2.52006 > node2.36166: UDP, length 154
03:14:47.912152 IP node2.33739 > node2.36166: UDP, length 154
03:14:47.922002 IP node2.47170 > node2.36166: UDP, length 154
03:14:48.014465 IP node2.36166 > node2.47170: UDP, length 72
03:14:48.014504 IP node2.36166 > node2.52006: UDP, length 72
03:14:48.014530 IP node2.36166 > node2.33739: UDP, length 72
03:14:49.249340 IP node2.44193 > node2.36166: UDP, length 1175
03:14:49.876576 IP node2.58256 > node2.36166: UDP, length 1175
03:14:51.204736 IP node2.38620 > node2.36166: UDP, length 1175
03:14:51.317711 IP node2.40826 > node2.36166: UDP, length 1175
03:14:51.371538 IP node2.50518 > node2.36166: UDP, length 1175
03:14:53.960246 IP node2.38768 > node2.36166: UDP, length 1175
03:14:54.587106 IP node2.44193 > node2.36166: UDP, length 1175
03:14:54.891800 IP node2.33739 > node2.36166: UDP, length 1175
03:14:56.142144 IP node2.52599 > node2.36166: UDP, length 1175
03:14:57.228541 IP node2.47792 > node2.36166: UDP, length 1175
03:14:58.020006 IP node2.38768 > node2.36166: UDP, length 1175
03:14:59.220902 IP node2.40433 > node2.36166: UDP, length 1175
03:14:59.912959 IP node2.35844 > node2.36166: UDP, length 1175
03:15:02.960450 IP node2.38620 > node2.36166: UDP, length 1175
03:15:03.131395 IP node2.40826 > node2.36166: UDP, length 1175
03:15:06.007179 IP node2.52006 > node2.36166: UDP, length 1175
03:15:06.989092 IP node2.50518 > node2.36166: UDP, length 1175
03:15:07.422900 IP node2.44193 > node2.36166: UDP, length 1175
03:15:11.833989 IP node2.47170 > node2.36166: UDP, length 1175
03:15:13.079521 IP node2.47792 > node2.36166: UDP, length 1175
03:15:13.132960 IP node2.33739 > node2.36166: UDP, length 1175
03:15:14.806598 IP node2.44193 > node2.36166: UDP, length 1175
03:15:14.965682 IP node2.40433 > node2.36166: UDP, length 1175
03:15:20.756218 IP node2.47170 > node2.36166: UDP, length 1175
03:15:20.968874 IP node2.38768 > node2.36166: UDP, length 1175
03:15:22.956532 IP node2.58185 > node2.36166: UDP, length 1175
03:15:23.818208 IP node2.58256 > node2.36166: UDP, length 1175
03:15:24.965822 IP node2.58256 > node2.36166: UDP, length 1175
03:15:26.501828 IP node2.50518 > node2.36166: UDP, length 1175
03:15:27.526980 IP node2.38620 > node2.36166: UDP, length 1175
03:15:28.786205 IP node2.40826 > node2.36166: UDP, length 1175
03:15:30.155647 IP node2.35844 > node2.36166: UDP, length 1175
03:15:30.235329 IP node2.35844 > node2.36166: UDP, length 1175
03:15:33.930998 IP node2.35844 > node2.36166: UDP, length 1175
03:15:34.036606 IP node2.50518 > node2.36166: UDP, length 1175
03:15:34.161650 IP node2.52006 > node2.36166: UDP, length 1175
03:15:35.170866 IP node2.52599 > node2.36166: UDP, length 1175
03:15:35.847645 IP node2.40826 > node2.36166: UDP, length 1175
03:15:36.380388 IP node2.35844 > node2.36166: UDP, length 1175
03:15:39.892193 IP node2.58256 > node2.36166: UDP, length 1175
03:15:40.541718 IP node2.58256 > node2.36166: UDP, length 1175
03:15:40.887150 IP node2.58256 > node2.36166: UDP, length 1175
03:15:40.901091 IP node2.40433 > node2.36166: UDP, length 1175
03:15:42.933764 IP node2.47792 > node2.36166: UDP, length 1175
03:15:43.432615 IP node2.40433 > node2.36166: UDP, length 1175
03:15:45.568404 IP node2.33739 > node2.36166: UDP, length 1175
03:15:46.521046 IP node2.38620 > node2.36166: UDP, length 1175
03:15:46.853602 IP node2.47170 > node2.36166: UDP, length 1175
03:15:49.222033 IP node2.44193 > node2.36166: UDP, length 1175
03:15:50.030708 IP node2.58256 > node2.36166: UDP, length 1175
03:15:52.100357 IP node2.47792 > node2.36166: UDP, length 1175
03:15:52.714456 IP node2.38768 > node2.36166: UDP, length 1175
03:15:54.339144 IP node2.40826 > node2.36166: UDP, length 1175
03:15:54.988164 IP node2.40433 > node2.36166: UDP, length 1175
03:15:55.520663 IP node2.40433 > node2.36166: UDP, length 1175
03:15:56.031325 IP node2.40433 > node2.36166: UDP, length 1175
03:15:56.588110 IP node2.50518 > node2.36166: UDP, length 1175
03:15:58.104105 IP node2.58185 > node2.36166: UDP, length 1175

